Invoice,StockCode,Description,Quantity,Price,Customer ID,Country,InvoiceDate
501893,84990,60 GOLD AND SILVER FAIRY CAKE CASES,1,0.55,15005.0,United Kingdom,2025-09-20
501893,21212,PACK OF 72 RETRO SPOT CAKE CASES,1,0.55,15005.0,United Kingdom,2025-09-20
501893,22241,GARLAND WOODEN HAPPY EASTER,1,1.25,15005.0,United Kingdom,2025-09-20
501893,84459B,YELLOW METAL CHICKEN HEART ,4,1.49,15005.0,United Kingdom,2025-09-20
501893,21212,PACK OF 72 RETRO SPOT CAKE CASES,1,0.55,15005.0,United Kingdom,2025-09-20
501893,84992,72 SWEETHEART FAIRY CAKE CASES,1,0.55,15005.0,United Kingdom,2025-09-20
501893,84992,72 SWEETHEART FAIRY CAKE CASES,2,0.55,15005.0,United Kingdom,2025-09-20
501893,22508,DOORSTOP RETROSPOT HEART,2,3.75,15005.0,United Kingdom,2025-09-20
501893,22513,DOORSTOP FOOTBALL DESIGN,1,3.75,15005.0,United Kingdom,2025-09-20
501893,20992,JAZZ HEARTS PURSE NOTEBOOK,6,0.85,15005.0,United Kingdom,2025-09-20
501893,20754,RETRO RED SPOTTY WASHING UP GLOVES,2,2.1,15005.0,United Kingdom,2025-09-20
501893,84990,60 GOLD AND SILVER FAIRY CAKE CASES,5,0.55,15005.0,United Kingdom,2025-09-20
501893,22294,HEART FILIGREE DOVE  SMALL,6,1.25,15005.0,United Kingdom,2025-09-20
501893,85206A,CREAM FELT EASTER EGG BASKET,2,1.65,15005.0,United Kingdom,2025-09-20
501893,84459A,PINK METAL CHICKEN HEART ,2,1.49,15005.0,United Kingdom,2025-09-20
501893,21212,PACK OF 72 RETRO SPOT CAKE CASES,4,0.55,15005.0,United Kingdom,2025-09-20
501893,85189,HANGING BUTTERFLY  EGG,4,0.85,15005.0,United Kingdom,2025-09-20
501893,85188A,GREEN METAL SWINGING BUNNY,3,0.85,15005.0,United Kingdom,2025-09-20
501893,20671,BLUE TEATIME PRINT BOWL ,6,1.25,15005.0,United Kingdom,2025-09-20
501894,82552,WASHROOM METAL SIGN,12,1.25,16858.0,United Kingdom,2025-09-20
501894,22139,RETRO SPOT TEA SET CERAMIC 11 PC ,6,4.95,16858.0,United Kingdom,2025-09-20
501894,21749,LARGE RED SPOT WINDMILL,6,2.1,16858.0,United Kingdom,2025-09-20
501894,21166,COOK WITH WINE METAL SIGN ,12,1.95,16858.0,United Kingdom,2025-09-20
501894,21868,POTTING SHED TEA MUG,12,1.25,16858.0,United Kingdom,2025-09-20
501894,21529,RETRO SPOT CERAMIC TOASTRACK,6,3.45,16858.0,United Kingdom,2025-09-20
501894,21844,RETRO SPOT MUG,12,2.95,16858.0,United Kingdom,2025-09-20
501894,22073,RETRO SPOT STORAGE JAR,4,3.75,16858.0,United Kingdom,2025-09-20
501894,21746,SMALL RED SPOT  WINDMILL,12,1.25,16858.0,United Kingdom,2025-09-20
501895,21916,SET 12 RETRO WHITE CHALK STICKS,24,0.42,16039.0,United Kingdom,2025-09-20
501895,22457,NATURAL SLATE HEART CHALKBOARD ,6,2.95,16039.0,United Kingdom,2025-09-20
501895,22356,"CHARLOTTE BAG , PINK/WHITE SPOTS",10,0.85,16039.0,United Kingdom,2025-09-20
501895,20719,WOODLAND CHARLOTTE BAG,10,0.85,16039.0,United Kingdom,2025-09-20
501895,22212,FOUR HOOK  WHITE LOVEBIRDS,6,2.1,16039.0,United Kingdom,2025-09-20
501895,20724,RED SPOTTY CHARLOTTE BAG,10,0.85,16039.0,United Kingdom,2025-09-20
501895,22188,BLACK HEART CARD HOLDER,4,3.95,16039.0,United Kingdom,2025-09-20
501895,79323W,WHITE CHERRY LIGHTS,4,6.75,16039.0,United Kingdom,2025-09-20
501895,21499,BLUE SPOTS  WRAP,25,0.42,16039.0,United Kingdom,2025-09-20
501895,22355,"CHARLOTTE BAG , SUKI DESIGN",10,0.85,16039.0,United Kingdom,2025-09-20
501895,22189,CREAM HEART CARD HOLDER,4,3.95,16039.0,United Kingdom,2025-09-20
501896,85061W,WHITE JEWELLED HEART DECORATION,24,0.85,15623.0,United Kingdom,2025-09-20
501896,21157,RED SPOTTY WASHBAG,6,2.1,15623.0,United Kingdom,2025-09-20
501896,22318,FIVE HEART HANGING DECORATION,6,2.95,15623.0,United Kingdom,2025-09-20
501896,84469,ROSE DES PADDED FLOOR CUSHION,2,6.95,15623.0,United Kingdom,2025-09-20
501896,22078,RIBBON REEL LACE DESIGN ,10,2.1,15623.0,United Kingdom,2025-09-20
501896,20702,PINK PADDED MOBILE,3,4.25,15623.0,United Kingdom,2025-09-20
501896,20703,BLUE PADDED SOFT MOBILE,3,4.25,15623.0,United Kingdom,2025-09-20
501896,22457,NATURAL SLATE HEART CHALKBOARD ,6,2.95,15623.0,United Kingdom,2025-09-20
501896,22342,HOME GARLAND PAINTED ZINC ,12,1.65,15623.0,United Kingdom,2025-09-20
501896,79323W,WHITE CHERRY LIGHTS,8,6.75,15623.0,United Kingdom,2025-09-20
501896,47566B,TEA TIME PARTY BUNTING,5,4.65,15623.0,United Kingdom,2025-09-20
501896,47566,PARTY BUNTING,5,4.65,15623.0,United Kingdom,2025-09-20
501896,21524,DOOR MAT SPOTTY HOME SWEET HOME,4,7.49,15623.0,United Kingdom,2025-09-20
501896,48194,DOOR MAT HEARTS,4,7.49,15623.0,United Kingdom,2025-09-20
501896,48187,DOOR MAT NEW ENGLAND,4,7.49,15623.0,United Kingdom,2025-09-20
501896,79323P,PINK CHERRY LIGHTS,8,6.75,15623.0,United Kingdom,2025-09-20
501896,79323LP,LIGHT PINK CHERRY LIGHTS,8,6.75,15623.0,United Kingdom,2025-09-20
501896,22381,TOY TIDY PINK RETROSPOT  ,5,2.1,15623.0,United Kingdom,2025-09-20
501896,22341,LOVE GARLAND PAINTED ZINC ,12,1.65,15623.0,United Kingdom,2025-09-20
501897,22281,EASTER TREE YELLOW BIRDS,2,5.95,17539.0,United Kingdom,2025-09-20
501897,22509,SEWING BOX RETROSPOT DESIGN ,1,16.95,17539.0,United Kingdom,2025-09-20
501897,22245,"HOOK, 1 HANGER ,MAGIC GARDEN",2,0.85,17539.0,United Kingdom,2025-09-20
501897,22292,"SPRING DEC , HANGING CHICK  YELLOW",24,1.45,17539.0,United Kingdom,2025-09-20
501897,85186A,EASTER BUNNY GARLAND OF FLOWERS,24,0.42,17539.0,United Kingdom,2025-09-20
501897,85186C,BUNNY EGG GARLAND,24,0.42,17539.0,United Kingdom,2025-09-20
501897,22293,"SPRING DEC , HANGING CHICK  GREEN",24,1.45,17539.0,United Kingdom,2025-09-20
501897,85194S,HANGING SPRING FLOWER EGG SMALL,10,0.65,17539.0,United Kingdom,2025-09-20
501897,85186A,EASTER BUNNY GARLAND OF FLOWERS,24,0.42,17539.0,United Kingdom,2025-09-20
501897,22284,HEN HOUSE DECORATION,12,1.65,17539.0,United Kingdom,2025-09-20
501897,84978,HANGING HEART JAR T-LIGHT HOLDER,6,1.25,17539.0,United Kingdom,2025-09-20
501897,22248,DECORATION  PINK CHICK MAGIC GARDEN,10,0.85,17539.0,United Kingdom,2025-09-20
501897,22228,BUNNY WOODEN PAINTED WITH BIRD ,10,0.85,17539.0,United Kingdom,2025-09-20
501897,22230,JIGSAW TREE WITH WATERING CAN,10,0.85,17539.0,United Kingdom,2025-09-20
501897,22485,SET OF 2 WOODEN MARKET CRATES,1,12.75,17539.0,United Kingdom,2025-09-20
501897,22290,STANDING METAL RABBIT WITH EGG,6,2.1,17539.0,United Kingdom,2025-09-20
501897,22249,DECORATION WHITE CHICK MAGIC GARDEN,9,0.85,17539.0,United Kingdom,2025-09-20
501897,22230,JIGSAW TREE WITH WATERING CAN,4,0.85,17539.0,United Kingdom,2025-09-20
501897,22231,JIGSAW TREE WITH BIRDHOUSE,4,1.45,17539.0,United Kingdom,2025-09-20
501897,84454,WOBBLING METAL CHICKEN EASTER,10,0.85,17539.0,United Kingdom,2025-09-20
501897,22236,CAKE STAND 3 TIER MAGIC GARDEN,2,12.75,17539.0,United Kingdom,2025-09-20
501897,22243,"HOOK, 5 HANGER ,MAGIC TOADSTOOL RED",4,1.65,17539.0,United Kingdom,2025-09-20
501897,21892,TRADITIONAL WOODEN CATCH CUP GAME ,1,1.25,17539.0,United Kingdom,2025-09-20
501897,22449,SILK PURSE RUSSIAN DOLL PINK,1,3.35,17539.0,United Kingdom,2025-09-20
501897,22452,MEASURING TAPE RUSSIAN DOLL PINK,1,2.95,17539.0,United Kingdom,2025-09-20
501897,85188A,GREEN METAL SWINGING BUNNY,24,0.85,17539.0,United Kingdom,2025-09-20
501897,22487,WHITE WOOD GARDEN PLANT LADDER,2,9.95,17539.0,United Kingdom,2025-09-20
501897,22423,REGENCY CAKESTAND 3 TIER,2,12.75,17539.0,United Kingdom,2025-09-20
501897,22472,TV DINNER TRAY DOLLY GIRL,1,4.95,17539.0,United Kingdom,2025-09-20
501897,22283,6 EGG HOUSE PAINTED WOOD,2,7.95,17539.0,United Kingdom,2025-09-20
501897,22505,MEMO BOARD COTTAGE DESIGN,2,4.95,17539.0,United Kingdom,2025-09-20
501897,22507,MEMO BOARD RETROSPOT  DESIGN,1,4.95,17539.0,United Kingdom,2025-09-20
501897,22282,12 EGG HOUSE PAINTED WOOD,1,12.75,17539.0,United Kingdom,2025-09-20
501897,21384,IVORY HANGING DECORATION  BUTTERFLY,2,0.85,17539.0,United Kingdom,2025-09-20
501897,22281,EASTER TREE YELLOW BIRDS,2,5.95,17539.0,United Kingdom,2025-09-20
501897,22229,BUNNY WOODEN PAINTED WITH FLOWER ,10,0.85,17539.0,United Kingdom,2025-09-20
501897,22454,MEASURING TAPE RUSSIAN DOLL RED,1,2.95,17539.0,United Kingdom,2025-09-20
501897,22287,"DECORATION , WOBBLY CHICKEN, METAL ",12,1.65,17539.0,United Kingdom,2025-09-20
501897,22263,FELT EGG COSY LADYBIRD ,2,0.85,17539.0,United Kingdom,2025-09-20
501897,22458,CAST IRON HOOK GARDEN FORK,1,2.55,17539.0,United Kingdom,2025-09-20
501897,22459,CAST IRON HOOK GARDEN TROWEL,1,2.55,17539.0,United Kingdom,2025-09-20
501897,22087,PAPER BUNTING WHITE LACE,1,2.95,17539.0,United Kingdom,2025-09-20
501897,22233,JIGSAW RABBIT AND BIRDHOUSE,2,1.65,17539.0,United Kingdom,2025-09-20
501897,21658,GLASS  BEURRE DISH,12,3.95,17539.0,United Kingdom,2025-09-20
501897,21114,LAVENDER SCENTED FABRIC HEART,5,1.25,17539.0,United Kingdom,2025-09-20
501897,22411,JUMBO SHOPPER VINTAGE RED PAISLEY,1,1.95,17539.0,United Kingdom,2025-09-20
501897,22265,EASTER DECORATION NATURAL CHICK,10,0.65,17539.0,United Kingdom,2025-09-20
501897,21454,PAINTED PINK RABBIT ,10,0.85,17539.0,United Kingdom,2025-09-20
501897,22259,FELT FARM ANIMAL HEN,10,1.25,17539.0,United Kingdom,2025-09-20
501897,22268,EASTER DECORATION SITTING BUNNY,10,0.85,17539.0,United Kingdom,2025-09-20
501897,22256,FELT FARM ANIMAL CHICKEN,10,1.25,17539.0,United Kingdom,2025-09-20
501897,22251,BIRDHOUSE DECORATION MAGIC GARDEN,10,1.25,17539.0,United Kingdom,2025-09-20
501897,85186B,BUNNY BUNCH OF FLOWERS,10,0.42,17539.0,United Kingdom,2025-09-20
501897,22364,GLASS JAR DIGESTIVE BISCUITS,2,2.95,17539.0,United Kingdom,2025-09-20
501897,22262,FELT EGG COSY CHICKEN,2,0.85,17539.0,United Kingdom,2025-09-20
501897,22360,GLASS JAR ENGLISH CONFECTIONERY,2,2.95,17539.0,United Kingdom,2025-09-20
501897,22264,FELT FARM ANIMAL WHITE BUNNY ,2,0.85,17539.0,United Kingdom,2025-09-20
501897,85187,S/12 MINI RABBIT EASTER,10,1.65,17539.0,United Kingdom,2025-09-20
501897,35915B,BLUE KNITTED HEN ,6,1.65,17539.0,United Kingdom,2025-09-20
501897,35915C,PEACH KNITTED HEN ,6,1.65,17539.0,United Kingdom,2025-09-20
501897,85196,EASTER BUNNIES ON A STICK,12,0.55,17539.0,United Kingdom,2025-09-20
501897,22288,"DECORATION , HANGING METAL RABBIT",10,1.25,17539.0,United Kingdom,2025-09-20
501897,22286,"DECORATION , WOBBLY RABBIT , METAL ",12,1.65,17539.0,United Kingdom,2025-09-20
501897,22261,FELT EGG COSY WHITE RABBIT ,2,0.85,17539.0,United Kingdom,2025-09-20
501897,85189,HANGING BUTTERFLY  EGG,24,0.85,17539.0,United Kingdom,2025-09-20
501897,22289,"DECORATION , HANGING METAL CHICKEN",10,1.25,17539.0,United Kingdom,2025-09-20
501897,22290,STANDING METAL RABBIT WITH EGG,6,2.1,17539.0,United Kingdom,2025-09-20
501897,22266,EASTER DECORATION HANGING BUNNY,10,0.65,17539.0,United Kingdom,2025-09-20
501897,85188B,PINK METAL SWINGING BUNNY,10,0.85,17539.0,United Kingdom,2025-09-20
501897,85186C,BUNNY EGG GARLAND,10,0.42,17539.0,United Kingdom,2025-09-20
501897,22244,"HOOK, 3 HANGER ,MAGIC GARDEN",1,1.95,17539.0,United Kingdom,2025-09-20
501897,22087,PAPER BUNTING WHITE LACE,2,2.95,17539.0,United Kingdom,2025-09-20
501897,22290,STANDING METAL RABBIT WITH EGG,6,2.1,17539.0,United Kingdom,2025-09-20
501897,21386,IVORY HANGING DECORATION  EGG,10,0.85,17539.0,United Kingdom,2025-09-20
501898,22384,LUNCH BAG PINK RETROSPOT,10,1.65,18177.0,United Kingdom,2025-09-20
501898,21930,JUMBO STORAGE BAG SKULLS,10,1.95,18177.0,United Kingdom,2025-09-20
501898,22383,LUNCH BAG SUKI  DESIGN ,10,1.65,18177.0,United Kingdom,2025-09-20
501898,20719,WOODLAND CHARLOTTE BAG,10,0.85,18177.0,United Kingdom,2025-09-20
501898,22381,TOY TIDY PINK RETROSPOT  ,10,2.1,18177.0,United Kingdom,2025-09-20
501898,22385,JUMBO BAG SPACEBOY DESIGN,10,1.95,18177.0,United Kingdom,2025-09-20
501898,22386,JUMBO BAG PINK WITH WHITE SPOTS,20,1.95,18177.0,United Kingdom,2025-09-20
501898,22411,JUMBO SHOPPER VINTAGE RED PAISLEY,30,1.95,18177.0,United Kingdom,2025-09-20
501898,22380,TOY TIDY SPACEBOY  ,10,2.1,18177.0,United Kingdom,2025-09-20
501899,21231,SWEETHEART CERAMIC TRINKET BOX,72,1.06,13798.0,United Kingdom,2025-09-20
501899,21937,STRAWBERRY   PICNIC BAG,50,2.55,13798.0,United Kingdom,2025-09-20
501899,37449,CERAMIC CAKE STAND + HANGING CAKES,8,8.5,13798.0,United Kingdom,2025-09-20
501899,20676,RED SPOTTY BOWL,72,1.06,13798.0,United Kingdom,2025-09-20
501899,20725,LUNCH BAG RED SPOTTY,100,1.45,13798.0,United Kingdom,2025-09-20
501899,21843,RETRO SPOT CAKE STAND,24,9.95,13798.0,United Kingdom,2025-09-20
501899,85123A,WHITE HANGING HEART T-LIGHT HOLDER,32,2.55,13798.0,United Kingdom,2025-09-20
501899,84596I,WRAP SWEETS LIGHT PINK SMALL BOWL,56,1.06,13798.0,United Kingdom,2025-09-20
501899,20972,PINK CREAM FELT CRAFT TRINKET BOX ,24,1.25,13798.0,United Kingdom,2025-09-20
501899,21035,SET/2 RED SPOTTY TEA TOWELS ,12,2.95,13798.0,United Kingdom,2025-09-20
501899,21154,RED SPOTTY OVEN GLOVE ,24,1.25,13798.0,United Kingdom,2025-09-20
501899,82583,HOT BATHS METAL SIGN,72,1.69,13798.0,United Kingdom,2025-09-20
501900,21897,POTTING SHED CANDLE CITRONELLA,1,2.95,16397.0,United Kingdom,2025-09-20
501900,17021,NAMASTE SWAGAT INCENSE,6,0.3,16397.0,United Kingdom,2025-09-20
501900,17021,NAMASTE SWAGAT INCENSE,6,0.3,16397.0,United Kingdom,2025-09-20
501900,22193,RED DINER WALL CLOCK,6,8.5,16397.0,United Kingdom,2025-09-20
501900,71459,HANGING JAM JAR T-LIGHT HOLDER,12,0.85,16397.0,United Kingdom,2025-09-20
501900,21924,BLUE/CREAM STRIPE FRINGE HAMMOCK,2,7.95,16397.0,United Kingdom,2025-09-20
501900,21923,RED/CREAM STRIPE FRINGE HAMMOCK,2,7.95,16397.0,United Kingdom,2025-09-20
501900,47503K,ASSORTED FLORAL SECATEURS,1,1.95,16397.0,United Kingdom,2025-09-20
501900,21737,SET 3 WICKER LOG BASKETS,1,19.95,16397.0,United Kingdom,2025-09-20
501900,21980,PACK OF 12 RED SPOTTY TISSUES ,12,0.29,16397.0,United Kingdom,2025-09-20
501900,21897,POTTING SHED CANDLE CITRONELLA,1,2.95,16397.0,United Kingdom,2025-09-20
C501901,21843,RETRO SPOT CAKE STAND,-8,9.95,13798.0,United Kingdom,2025-09-20
C501901,35924,HANGING FAIRY CAKE DECORATION,-2,1.69,13798.0,United Kingdom,2025-09-20
C501901,20676,RED SPOTTY BOWL,-2,1.06,13798.0,United Kingdom,2025-09-20
C501901,37447,CERAMIC CAKE DESIGN SPOTTED PLATE,-1,1.25,13798.0,United Kingdom,2025-09-20
C501901,82599,FANNY'S REST STOPMETAL SIGN,-1,1.69,13798.0,United Kingdom,2025-09-20
C501901,21231,SWEETHEART CERAMIC TRINKET BOX,-5,1.06,13798.0,United Kingdom,2025-09-20
C501901,20914,SET/5 RED SPOTTY LID GLASS BOWLS,-1,2.55,13798.0,United Kingdom,2025-09-20
C501901,22064,PINK DOUGHNUT TRINKET POT ,-2,1.45,13798.0,United Kingdom,2025-09-20
C501901,M,Manual,-1,2.95,13798.0,United Kingdom,2025-09-20
C501901,37450,CERAMIC CAKE BOWL + HANGING CAKES,-4,2.55,13798.0,United Kingdom,2025-09-20
501902,POST,POSTAGE,2,15.0,12796.0,Netherlands,2025-09-20
501902,85099F,JUMBO BAG STRAWBERRY,30,1.95,12796.0,Netherlands,2025-09-20
501902,22386,JUMBO BAG PINK WITH WHITE SPOTS,30,1.95,12796.0,Netherlands,2025-09-20
501902,85099B,JUMBO BAG RED WHITE SPOTTY ,30,1.95,12796.0,Netherlands,2025-09-20
501902,21929,JUMBO BAG PINK VINTAGE PAISLEY,30,1.95,12796.0,Netherlands,2025-09-20
501902,20711,JUMBO BAG TOYS ,30,1.95,12796.0,Netherlands,2025-09-20
501902,22385,JUMBO BAG SPACEBOY DESIGN,30,1.95,12796.0,Netherlands,2025-09-20
501903,22270,HAPPY EASTER HANGING DECORATION,1,3.75,18078.0,United Kingdom,2025-09-20
501903,85203,HANGING WOOD AND FELT BUTTERFLY ,1,0.42,18078.0,United Kingdom,2025-09-20
501903,21204,DAISIES  HONEYCOMB GARLAND ,2,1.65,18078.0,United Kingdom,2025-09-20
501903,21203,BUTTERFLIES  HONEYCOMB GARLAND,1,1.65,18078.0,United Kingdom,2025-09-20
501903,21201,TROPICAL  HONEYCOMB PAPER GARLAND ,1,2.55,18078.0,United Kingdom,2025-09-20
501903,84458,S/3 RABBIT FLOWER/EGG/CARROT ROPE,1,0.85,18078.0,United Kingdom,2025-09-20
501903,20717,STRAWBERRY SHOPPER BAG,1,1.25,18078.0,United Kingdom,2025-09-20
501903,84802A,WHITE ANEMONE ARTIFICIAL FLOWER,24,1.69,18078.0,United Kingdom,2025-09-20
501903,84804B,BLUE DELPHINIUM ARTIFICIAL FLOWER,12,2.95,18078.0,United Kingdom,2025-09-20
501903,84803A,PINK ALLIUM  ARTIFICIAL FLOWER,12,1.69,18078.0,United Kingdom,2025-09-20
501903,84809B,PINK CHRYSANTHEMUMS ART FLOWER,18,2.1,18078.0,United Kingdom,2025-09-20
501903,84804B,BLUE DELPHINIUM ARTIFICIAL FLOWER,12,2.95,18078.0,United Kingdom,2025-09-20
501903,84802B,PURPLE ANEMONE ARTIFICIAL FLOWER,24,1.69,18078.0,United Kingdom,2025-09-20
501903,47504G,ENGLISH ROSE TAPE MEASURE,1,1.25,18078.0,United Kingdom,2025-09-20
501903,84465,15 PINK FLUFFY CHICKS IN BOX,1,2.95,18078.0,United Kingdom,2025-09-20
501903,84802B,PURPLE ANEMONE ARTIFICIAL FLOWER,24,1.69,18078.0,United Kingdom,2025-09-20
501903,22095,LADS ONLY TISSUE BOX,1,1.25,18078.0,United Kingdom,2025-09-20
501903,17021,NAMASTE SWAGAT INCENSE,6,0.3,18078.0,United Kingdom,2025-09-20
501903,84456,SET OF 3 RABBIT EGG EASTER,1,0.85,18078.0,United Kingdom,2025-09-20
501903,22088,PAPER BUNTING COLOURED LACE,2,2.95,18078.0,United Kingdom,2025-09-20
501903,79000,MOROCCAN TEA GLASS,12,0.85,18078.0,United Kingdom,2025-09-20
501903,84802A,WHITE ANEMONE ARTIFICIAL FLOWER,24,1.69,18078.0,United Kingdom,2025-09-20
501903,84806A,PINK CANDYSTUFT ARTIFICIAL FLOWER,24,1.45,18078.0,United Kingdom,2025-09-20
501903,22087,PAPER BUNTING WHITE LACE,3,2.95,18078.0,United Kingdom,2025-09-20
501904,22348,TEA BAG PLATE RED SPOTTY ,36,0.85,12368.0,Cyprus,2025-09-20
501904,51014C,"FEATHER PEN,COAL BLACK",24,0.85,12368.0,Cyprus,2025-09-20
501904,22299,PIG KEYRING WITH LIGHT & SOUND ,24,1.25,12368.0,Cyprus,2025-09-20
501904,37450,CERAMIC CAKE BOWL + HANGING CAKES,18,2.55,12368.0,Cyprus,2025-09-20
501904,20914,SET/5 RED SPOTTY LID GLASS BOWLS,6,2.95,12368.0,Cyprus,2025-09-20
501904,22094,RED POLKA DOT TISSUE BOX,12,1.25,12368.0,Cyprus,2025-09-20
501904,21246,RED SPOTTY BIG BOWL,6,4.95,12368.0,Cyprus,2025-09-20
501904,22198,"POPCORN HOLDER , LARGE",50,1.45,12368.0,Cyprus,2025-09-20
501904,22100,SKULLS SQUARE TISSUE BOX,12,1.25,12368.0,Cyprus,2025-09-20
501904,37503,TEA TIME CAKE STAND IN GIFT BOX,12,9.95,12368.0,Cyprus,2025-09-20
501904,37446,MINI CAKE STAND WITH HANGING CAKES,32,1.25,12368.0,Cyprus,2025-09-20
501904,22055,MINI CAKE STAND  HANGING STRAWBERY,32,1.45,12368.0,Cyprus,2025-09-20
501904,22061,LARGE CAKE STAND  HANGING STRAWBERY,8,9.95,12368.0,Cyprus,2025-09-20
501904,37449,CERAMIC CAKE STAND + HANGING CAKES,8,8.5,12368.0,Cyprus,2025-09-20
501904,21667,GLASS CAKE COVER AND PLATE,6,14.95,12368.0,Cyprus,2025-09-20
501904,48188,DOOR MAT WELCOME PUPPIES,10,6.35,12368.0,Cyprus,2025-09-20
501904,48187,DOOR MAT NEW ENGLAND,10,6.35,12368.0,Cyprus,2025-09-20
501904,47556B,TEA TIME TEA TOWELS ,24,2.95,12368.0,Cyprus,2025-09-20
C501905,37495,FAIRY CAKE BIRTHDAY CANDLE SET,-3,3.75,13451.0,United Kingdom,2025-09-20
501906,21457,2 PICTURE BOOK EGGS EASTER DUCKS,12,1.25,17340.0,United Kingdom,2025-09-20
501906,21458,2 PICTURE BOOK EGGS EASTER BUNNY,12,1.25,17340.0,United Kingdom,2025-09-20
501906,21908,CHOCOLATE THIS WAY METAL SIGN,12,2.1,17340.0,United Kingdom,2025-09-20
501906,22423,REGENCY CAKESTAND 3 TIER,3,12.75,17340.0,United Kingdom,2025-09-20
501906,84836,ZINC METAL HEART DECORATION,12,1.25,17340.0,United Kingdom,2025-09-20
501906,84836,ZINC METAL HEART DECORATION,12,1.25,17340.0,United Kingdom,2025-09-20
501906,85206A,CREAM FELT EASTER EGG BASKET,1,1.65,17340.0,United Kingdom,2025-09-20
501906,21691,SILVER VANILLA FLOWER CANDLE POT,2,3.75,17340.0,United Kingdom,2025-09-20
501906,82486,WOOD S/3 CABINET ANT WHITE FINISH,12,6.95,17340.0,United Kingdom,2025-09-20
501906,21691,SILVER VANILLA FLOWER CANDLE POT,3,3.75,17340.0,United Kingdom,2025-09-20
501906,21690,SILVER  CANDLEPOT JARDIN ,8,3.75,17340.0,United Kingdom,2025-09-20
501906,22413,METAL SIGN TAKE IT OR LEAVE IT ,12,2.95,17340.0,United Kingdom,2025-09-20
501906,21687,SILVER PLATE CANDLE BOWL LARGE,6,3.75,17340.0,United Kingdom,2025-09-20
501906,21693,SMALL HAMMERED SILVER CANDLEPOT ,6,2.95,17340.0,United Kingdom,2025-09-20
501906,21696,SMALL SILVER TRELLIS CANDLEPOT,6,2.95,17340.0,United Kingdom,2025-09-20
501906,22242,"HOOK, 5 HANGER , MAGIC TOADSTOOL",12,1.65,17340.0,United Kingdom,2025-09-20
501906,21874,GIN AND TONIC MUG,6,1.25,17340.0,United Kingdom,2025-09-20
501906,21181,PLEASE ONE PERSON METAL SIGN,12,2.1,17340.0,United Kingdom,2025-09-20
501906,21874,GIN AND TONIC MUG,6,1.25,17340.0,United Kingdom,2025-09-20
501906,85197,SET OF 12 MINI BUNNIES IN A BUCKET,1,2.1,17340.0,United Kingdom,2025-09-20
501906,84832,ZINC WILLIE WINKIE  CANDLE STICK,28,0.85,17340.0,United Kingdom,2025-09-20
501906,84792,ENCHANTED BIRD COATHANGER 5 HOOK,6,4.65,17340.0,United Kingdom,2025-09-20
501906,84077,WORLD WAR 2 GLIDERS ASSTD DESIGNS,48,0.21,17340.0,United Kingdom,2025-09-20
501906,84949,SILVER HANGING T-LIGHT HOLDER,24,1.65,17340.0,United Kingdom,2025-09-20
501906,84946,ANTIQUE SILVER TEA GLASS ETCHED,12,1.25,17340.0,United Kingdom,2025-09-20
501906,85230A,OPIUM SCENTED VOTIVE CANDLE,24,0.29,17340.0,United Kingdom,2025-09-20
501906,16156L,"WRAP, CAROUSEL",25,0.42,17340.0,United Kingdom,2025-09-20
501906,22300,COFFEE MUG DOG + BALL DESIGN,1,2.55,17340.0,United Kingdom,2025-09-20
501906,16235,RECYCLED PENCIL WITH RABBIT ERASER,25,0.21,17340.0,United Kingdom,2025-09-20
501906,22203,MILK PAN RED RETROSPOT,1,3.75,17340.0,United Kingdom,2025-09-20
501906,21467,CHERRY CROCHET FOOD COVER,1,3.75,17340.0,United Kingdom,2025-09-20
501906,21472,LADYBIRD + BEE RAFFIA FOOD COVER,2,3.75,17340.0,United Kingdom,2025-09-20
501906,47566,PARTY BUNTING,1,4.65,17340.0,United Kingdom,2025-09-20
501906,84997B,RED 3 PIECE MINI DOTS CUTLERY SET,2,3.75,17340.0,United Kingdom,2025-09-20
501906,21717,EASTER TIN BUCKET,8,2.55,17340.0,United Kingdom,2025-09-20
501906,21870,I CAN ONLY PLEASE ONE PERSON MUG,6,1.25,17340.0,United Kingdom,2025-09-20
501906,21870,I CAN ONLY PLEASE ONE PERSON MUG,12,1.25,17340.0,United Kingdom,2025-09-20
501906,85150,LADIES & GENTLEMEN METAL SIGN,12,2.55,17340.0,United Kingdom,2025-09-20
501906,21704,BAG 250g SWIRLY MARBLES,8,0.85,17340.0,United Kingdom,2025-09-20
501906,21166,COOK WITH WINE METAL SIGN ,12,1.95,17340.0,United Kingdom,2025-09-20
501906,21918,SET 12 KIDS COLOUR  CHALK STICKS,5,0.42,17340.0,United Kingdom,2025-09-20
501906,85205A,IVORY FELT EASTER RABBIT GARLAND,1,2.55,17340.0,United Kingdom,2025-09-20
501906,85188A,GREEN METAL SWINGING BUNNY,7,0.85,17340.0,United Kingdom,2025-09-20
501906,85188B,PINK METAL SWINGING BUNNY,9,0.85,17340.0,United Kingdom,2025-09-20
501906,85186A,EASTER BUNNY GARLAND OF FLOWERS,7,0.42,17340.0,United Kingdom,2025-09-20
501906,22232,JIGSAW TOADSTOOLS 3 PIECE,1,1.65,17340.0,United Kingdom,2025-09-20
501906,22258,FELT FARM ANIMAL RABBIT,6,1.25,17340.0,United Kingdom,2025-09-20
501906,84218,BOX/12 CHICK & EGG IN BASKET,3,1.95,17340.0,United Kingdom,2025-09-20
501906,22281,EASTER TREE YELLOW BIRDS,1,5.95,17340.0,United Kingdom,2025-09-20
501906,20749,ASSORTED COLOUR MINI CASES,2,7.95,17340.0,United Kingdom,2025-09-20
501906,84050,PINK HEART SHAPE EGG FRYING PAN,15,1.65,17340.0,United Kingdom,2025-09-20
501906,22263,FELT EGG COSY LADYBIRD ,3,0.85,17340.0,United Kingdom,2025-09-20
501906,22246,"GARLAND, MAGIC GARDEN 1.8M",3,1.95,17340.0,United Kingdom,2025-09-20
501906,47566,PARTY BUNTING,16,4.65,17340.0,United Kingdom,2025-09-20
501906,21471,STRAWBERRY RAFFIA FOOD COVER,1,3.75,17340.0,United Kingdom,2025-09-20
501906,84879,ASSORTED COLOUR BIRD ORNAMENT,8,1.69,17340.0,United Kingdom,2025-09-20
501906,21917,SET 12 KIDS  WHITE CHALK STICKS,5,0.42,17340.0,United Kingdom,2025-09-20
501906,21455,PAINTED YELLOW WOODEN DAISY,12,0.85,17340.0,United Kingdom,2025-09-20
501906,22264,FELT FARM ANIMAL WHITE BUNNY ,4,0.85,17340.0,United Kingdom,2025-09-20
501906,21469,POLKA DOT RAFFIA FOOD COVER,1,3.75,17340.0,United Kingdom,2025-09-20
501906,22261,FELT EGG COSY WHITE RABBIT ,6,0.85,17340.0,United Kingdom,2025-09-20
501906,82600,NO SINGING METAL SIGN,12,2.1,17340.0,United Kingdom,2025-09-20
501906,22262,FELT EGG COSY CHICKEN,3,0.85,17340.0,United Kingdom,2025-09-20
501906,21696,SMALL SILVER TRELLIS CANDLEPOT,6,2.95,17340.0,United Kingdom,2025-09-20
501906,84558A,3D DOG PICTURE PLAYING CARDS,5,2.95,17340.0,United Kingdom,2025-09-20
501906,21790,VINTAGE SNAP CARDS,5,0.85,17340.0,United Kingdom,2025-09-20
501906,84879,ASSORTED COLOUR BIRD ORNAMENT,24,1.69,17340.0,United Kingdom,2025-09-20
501906,47566,PARTY BUNTING,1,4.65,17340.0,United Kingdom,2025-09-20
501906,21165,BEWARE OF THE CAT METAL SIGN ,6,1.69,17340.0,United Kingdom,2025-09-20
501906,21693,SMALL HAMMERED SILVER CANDLEPOT ,6,2.95,17340.0,United Kingdom,2025-09-20
501906,22231,JIGSAW TREE WITH BIRDHOUSE,5,1.45,17340.0,United Kingdom,2025-09-20
501906,22230,JIGSAW TREE WITH WATERING CAN,7,0.85,17340.0,United Kingdom,2025-09-20
501906,22228,BUNNY WOODEN PAINTED WITH BIRD ,2,0.85,17340.0,United Kingdom,2025-09-20
501906,22229,BUNNY WOODEN PAINTED WITH FLOWER ,2,0.85,17340.0,United Kingdom,2025-09-20
501906,22241,GARLAND WOODEN HAPPY EASTER,4,1.25,17340.0,United Kingdom,2025-09-20
501906,22262,FELT EGG COSY CHICKEN,3,0.85,17340.0,United Kingdom,2025-09-20
501906,22263,FELT EGG COSY LADYBIRD ,3,0.85,17340.0,United Kingdom,2025-09-20
501906,84627,CANDY STRIPE ROSE C/COVER ,2,5.95,17340.0,United Kingdom,2025-09-20
501906,22268,EASTER DECORATION SITTING BUNNY,6,0.85,17340.0,United Kingdom,2025-09-20
501907,20982,12 PENCILS TALL TUBE SKULLS,3,0.85,13451.0,United Kingdom,2025-09-20
501907,20983,12 PENCILS TALL TUBE RED SPOTTY,3,0.85,13451.0,United Kingdom,2025-09-20
501907,35973,GERANIUM FOLKART HEART DECORATION,2,1.25,13451.0,United Kingdom,2025-09-20
501907,84692,BOX OF 24 COCKTAIL PARASOLS,3,0.42,13451.0,United Kingdom,2025-09-20
501907,84450B,PINK/YELLOW RABBIT SAT EASTER,3,0.42,13451.0,United Kingdom,2025-09-20
501907,35972,DAISY FOLKART HEART DECORATION,2,1.25,13451.0,United Kingdom,2025-09-20
501907,21455,PAINTED YELLOW WOODEN DAISY,5,0.85,13451.0,United Kingdom,2025-09-20
501907,35971,ROSE FOLKART HEART DECORATIONS,4,1.25,13451.0,United Kingdom,2025-09-20
501907,20977,36 PENCILS TUBE WOODLAND,3,1.25,13451.0,United Kingdom,2025-09-20
501907,85049G,CHOCOLATE BOX RIBBONS ,1,1.25,13451.0,United Kingdom,2025-09-20
501907,85049C,ROMANTIC PINKS RIBBONS ,1,1.25,13451.0,United Kingdom,2025-09-20
501907,22246,"GARLAND, MAGIC GARDEN 1.8M",4,1.95,13451.0,United Kingdom,2025-09-20
501907,22078,RIBBON REEL LACE DESIGN ,2,2.1,13451.0,United Kingdom,2025-09-20
