Invoice,StockCode,Description,Quantity,Price,Customer ID,Country,InvoiceDate
501879,85194L,HANGING SPRING FLOWER EGG LARGE,3,0.85,17472.0,United Kingdom,2025-09-20
501879,85150,LADIES & GENTLEMEN METAL SIGN,3,2.55,17472.0,United Kingdom,2025-09-20
501879,22115,METAL SIGN EMPIRE TEA,2,2.95,17472.0,United Kingdom,2025-09-20
501879,22195,LARGE HEART MEASURING SPOONS,1,1.65,17472.0,United Kingdom,2025-09-20
501879,22136,LOVE HEART SOCK HANGER,1,1.65,17472.0,United Kingdom,2025-09-20
501879,21899,"KEY FOB , GARAGE DESIGN",2,0.65,17472.0,United Kingdom,2025-09-20
501879,21900,"KEY FOB , SHED",3,0.65,17472.0,United Kingdom,2025-09-20
501879,21911,GARDEN METAL SIGN ,2,1.65,17472.0,United Kingdom,2025-09-20
501879,84459A,PINK METAL CHICKEN HEART ,2,1.49,17472.0,United Kingdom,2025-09-20
501879,47503K,ASSORTED FLORAL SECATEURS,1,1.95,17472.0,United Kingdom,2025-09-20
501879,20685,DOOR MAT RED SPOT,1,7.49,17472.0,United Kingdom,2025-09-20
501879,21524,DOOR MAT SPOTTY HOME SWEET HOME,1,7.49,17472.0,United Kingdom,2025-09-20
501879,48111,DOOR MAT 3 SMILEY CATS,1,7.49,17472.0,United Kingdom,2025-09-20
501879,48188,DOOR MAT WELCOME PUPPIES,1,7.49,17472.0,United Kingdom,2025-09-20
501879,21907,I'M ON HOLIDAY METAL SIGN,2,2.1,17472.0,United Kingdom,2025-09-20
501880,21539,RETRO SPOTS BUTTER DISH,2,4.95,17285.0,United Kingdom,2025-09-20
501880,22055,MINI CAKE STAND  HANGING STRAWBERY,1,1.65,17285.0,United Kingdom,2025-09-20
501880,M,Manual,2,3.75,17285.0,United Kingdom,2025-09-20
501880,21843,RETRO SPOT CAKE STAND,2,10.95,17285.0,United Kingdom,2025-09-20
501880,37449,CERAMIC CAKE STAND + HANGING CAKES,1,9.95,17285.0,United Kingdom,2025-09-20
501880,84596G,SMALL CHOCOLATES PINK BOWL,8,1.25,17285.0,United Kingdom,2025-09-20
501880,21844,RETRO SPOT MUG,1,2.95,17285.0,United Kingdom,2025-09-20
501880,21041,RED SPOTTY OVEN GLOVE DOUBLE,2,2.95,17285.0,United Kingdom,2025-09-20
501880,84596B,SMALL DOLLY MIX DESIGN ORANGE BOWL,8,1.25,17285.0,United Kingdom,2025-09-20
501880,22063,CERAMIC BOWL WITH STRAWBERRY DESIGN,2,2.95,17285.0,United Kingdom,2025-09-20
501880,22055,MINI CAKE STAND  HANGING STRAWBERY,2,1.65,17285.0,United Kingdom,2025-09-20
501880,22073,RETRO SPOT STORAGE JAR,1,3.75,17285.0,United Kingdom,2025-09-20
501880,22061,LARGE CAKE STAND  HANGING STRAWBERY,1,9.95,17285.0,United Kingdom,2025-09-20
501880,22055,MINI CAKE STAND  HANGING STRAWBERY,2,1.65,17285.0,United Kingdom,2025-09-20
501880,84596E,SMALL LICORICE DES PINK BOWL,8,1.25,17285.0,United Kingdom,2025-09-20
501880,22073,RETRO SPOT STORAGE JAR,1,3.75,17285.0,United Kingdom,2025-09-20
501880,21529,RETRO SPOT CERAMIC TOASTRACK,2,3.45,17285.0,United Kingdom,2025-09-20
501880,22423,REGENCY CAKESTAND 3 TIER,2,12.75,17285.0,United Kingdom,2025-09-20
501880,84596K,JELLY BABIES YELLOW SMALL BOWL,8,1.25,17285.0,United Kingdom,2025-09-20
501880,84596J,MIXED NUTS LIGHT GREEN BOWL,8,1.25,17285.0,United Kingdom,2025-09-20
501880,21109,"LARGE CAKE TOWEL, CHOCOLATE SPOTS",1,6.75,17285.0,United Kingdom,2025-09-20
501880,22059,CERAMIC STRWBERRY DESIGN MUG,1,1.49,17285.0,United Kingdom,2025-09-20
501880,22055,MINI CAKE STAND  HANGING STRAWBERY,1,1.65,17285.0,United Kingdom,2025-09-20
501880,84596F,SMALL MARSHMALLOWS PINK BOWL,8,1.25,17285.0,United Kingdom,2025-09-20
501880,20671,BLUE TEATIME PRINT BOWL ,8,1.25,17285.0,United Kingdom,2025-09-20
501880,22073,RETRO SPOT STORAGE JAR,1,3.75,17285.0,United Kingdom,2025-09-20
501880,37450,CERAMIC CAKE BOWL + HANGING CAKES,1,2.95,17285.0,United Kingdom,2025-09-20
501880,21110,LARGE CAKE TOWEL PINK SPOTS,1,6.75,17285.0,United Kingdom,2025-09-20
501882,84218,BOX/12 CHICK & EGG IN BASKET,1,1.95,17372.0,United Kingdom,2025-09-20
501881,21843,RETRO SPOT CAKE STAND,12,10.95,15482.0,United Kingdom,2025-09-20
501881,85123A,WHITE HANGING HEART T-LIGHT HOLDER,64,2.55,15482.0,United Kingdom,2025-09-20
501882,21454,PAINTED PINK RABBIT ,4,0.85,17372.0,United Kingdom,2025-09-20
501882,84467,ENGLISH ROSE DESIGN QUILTED THROW,6,12.75,17372.0,United Kingdom,2025-09-20
501882,22229,BUNNY WOODEN PAINTED WITH FLOWER ,4,0.85,17372.0,United Kingdom,2025-09-20
501882,84231,EASTER BUNNY WITH BASKET ON BACK,4,0.65,17372.0,United Kingdom,2025-09-20
501882,21500,PINK SPOTS  WRAP ,25,0.42,17372.0,United Kingdom,2025-09-20
501882,22228,BUNNY WOODEN PAINTED WITH BIRD ,4,0.85,17372.0,United Kingdom,2025-09-20
501883,21717,EASTER TIN BUCKET,8,2.55,13466.0,United Kingdom,2025-09-20
501883,21977,PACK OF 60 PINK PAISLEY CAKE CASES,24,0.55,13466.0,United Kingdom,2025-09-20
501883,22467,GUMBALL COAT RACK,6,2.55,13466.0,United Kingdom,2025-09-20
501883,15044C,PURPLE PAPER PARASOL,6,2.95,13466.0,United Kingdom,2025-09-20
501883,15044B,BLUE PAPER PARASOL ,6,2.95,13466.0,United Kingdom,2025-09-20
501883,22423,REGENCY CAKESTAND 3 TIER,3,12.75,13466.0,United Kingdom,2025-09-20
501883,21786,RAIN HAT WITH RED SPOTS,24,0.42,13466.0,United Kingdom,2025-09-20
501883,22147,FELTCRAFT BUTTERFLY HEARTS,12,1.45,13466.0,United Kingdom,2025-09-20
501883,22189,CREAM HEART CARD HOLDER,4,3.95,13466.0,United Kingdom,2025-09-20
501883,22348,TEA BAG PLATE RED SPOTTY ,12,0.85,13466.0,United Kingdom,2025-09-20
501883,85123A,WHITE HANGING HEART T-LIGHT HOLDER,6,2.95,13466.0,United Kingdom,2025-09-20
501883,22151,PLACE SETTING WHITE HEART,24,0.42,13466.0,United Kingdom,2025-09-20
501883,85061W,WHITE JEWELLED HEART DECORATION,24,0.85,13466.0,United Kingdom,2025-09-20
501883,20914,SET/5 RED SPOTTY LID GLASS BOWLS,6,2.95,13466.0,United Kingdom,2025-09-20
501883,22345,PARTY PIZZA DISH BLUE WHITE SPOT ,12,0.85,13466.0,United Kingdom,2025-09-20
501883,22343,PARTY PIZZA DISH RED WHITE SPOT ,12,0.85,13466.0,United Kingdom,2025-09-20
501884,90027D,GLASS BEAD HOOP EARRINGS AMETHYST,2,2.95,17611.0,United Kingdom,2025-09-20
501884,90025E,BAROQUE BUTTERFLY EARRINGS MONTANA,1,3.75,17611.0,United Kingdom,2025-09-20
501884,90198B,VINTAGE ROSE BEAD BRACELET BLACK,1,4.25,17611.0,United Kingdom,2025-09-20
501884,90011E,AMBER CRYSTAL DROP EARRINGS,1,2.95,17611.0,United Kingdom,2025-09-20
501884,90187A,BLUE DROP EARRINGS W BEAD CLUSTER,2,3.35,17611.0,United Kingdom,2025-09-20
501884,90187B,GREEN DROP EARRINGS W BEAD CLUSTER,2,3.35,17611.0,United Kingdom,2025-09-20
501884,90071,RUBY GLASS CLUSTER EARRINGS,1,1.25,17611.0,United Kingdom,2025-09-20
501884,90175D,TIGRIS EYE CHUNKY CHARM BRACELET,1,8.95,17611.0,United Kingdom,2025-09-20
501884,90024B,NEW BAROQUE B'FLY NECKLACE RED,1,8.5,17611.0,United Kingdom,2025-09-20
501884,90139,FLOWER BROOCH 4 ASSORTED COLOURS,2,4.95,17611.0,United Kingdom,2025-09-20
501884,90161A,ANT COPPER RED BOUDICCA BRACELET,1,4.95,17611.0,United Kingdom,2025-09-20
501884,90070,RUBY GLASS CLUSTER BRACELET,1,5.95,17611.0,United Kingdom,2025-09-20
501884,90160B,RED BOUDICCA LARGE BRACELET,1,6.95,17611.0,United Kingdom,2025-09-20
501884,90027B,GLASS BEAD HOOP EARRINGS MONTANA,1,2.95,17611.0,United Kingdom,2025-09-20
501884,90161D,ANT COPPER PINK BOUDICCA BRACELET,1,4.95,17611.0,United Kingdom,2025-09-20
501884,90160D,PINK BOUDICCA LARGE BRACELET,1,6.95,17611.0,United Kingdom,2025-09-20
501884,90160C,TURQ+RED BOUDICCA LARGE BRACELET,1,6.95,17611.0,United Kingdom,2025-09-20
501884,90161B,ANT COPPER TURQ BOUDICCA BRACELET,1,4.95,17611.0,United Kingdom,2025-09-20
501884,90027A,GLASS BEAD HOOP EARRINGS BLACK,1,2.95,17611.0,United Kingdom,2025-09-20
501884,90161C,ANT COPPER LIME BOUDICCA BRACELET,1,4.95,17611.0,United Kingdom,2025-09-20
501885,20702,PINK PADDED MOBILE,3,4.25,13092.0,United Kingdom,2025-09-20
501885,47566,PARTY BUNTING,10,4.65,13092.0,United Kingdom,2025-09-20
501885,84529C,YELLOW KNITTED KIDS RUCKSACK,4,6.75,13092.0,United Kingdom,2025-09-20
501886,21833,CAMOUFLAGE LED TORCH,12,1.45,17448.0,United Kingdom,2025-09-20
501886,21610,SET 12 PEAR BOTANICAL T-LIGHTS,6,2.55,17448.0,United Kingdom,2025-09-20
501886,85221,ASSORTED COLOUR SILK COIN PURSE,12,1.06,17448.0,United Kingdom,2025-09-20
501886,21058,PARTY INVITES WOODLAND,12,0.72,17448.0,United Kingdom,2025-09-20
501886,21518,BANK ACCOUNT  GREETING  CARD ,12,0.36,17448.0,United Kingdom,2025-09-20
501886,21060,PARTY INVITES BALLOON GIRL,12,0.72,17448.0,United Kingdom,2025-09-20
501886,21063,PARTY INVITES JAZZ HEARTS,12,0.72,17448.0,United Kingdom,2025-09-20
501886,21613,S/12 VANILLA  BOTANICAL T-LIGHTS,6,2.55,17448.0,United Kingdom,2025-09-20
501886,17003,BROCADE RING PURSE ,36,0.16,17448.0,United Kingdom,2025-09-20
501886,22030,SWALLOWS GREETING CARD,12,0.36,17448.0,United Kingdom,2025-09-20
501886,22107,PIZZA PLATE IN BOX,4,3.39,17448.0,United Kingdom,2025-09-20
501886,21059,PARTY INVITES DINOSAURS,12,0.72,17448.0,United Kingdom,2025-09-20
501886,22036,DINOSAUR BIRTHDAY CARD,12,0.36,17448.0,United Kingdom,2025-09-20
501886,85089,CANDY SPOT BUNNY,6,2.55,17448.0,United Kingdom,2025-09-20
501886,22109,FULL ENGLISH BREAKFAST PLATE,4,3.39,17448.0,United Kingdom,2025-09-20
501886,22033,BOTANICAL ROSE GREETING CARD,12,0.36,17448.0,United Kingdom,2025-09-20
501886,21061,PARTY INVITES FOOTBALL,12,0.72,17448.0,United Kingdom,2025-09-20
501886,85189,HANGING BUTTERFLY  EGG,24,0.72,17448.0,United Kingdom,2025-09-20
501886,17033,"BROCADE PURSE,SMALL ARCH BUTTON",36,0.21,17448.0,United Kingdom,2025-09-20
501887,85117,NIGHTINGALE COATHOOK WHITE,1,1.65,17587.0,United Kingdom,2025-09-20
501887,21078,SET/20 STRAWBERRY PAPER NAPKINS ,1,0.85,17587.0,United Kingdom,2025-09-20
501887,21272,SALLE DE BAIN HOOK,3,1.25,17587.0,United Kingdom,2025-09-20
501887,85183B,CHARLIE & LOLA WASTEPAPER BIN FLORA,1,3.75,17587.0,United Kingdom,2025-09-20
501887,72799D,BLUE PILLAR CANDLE SILVER FLOCK,1,2.95,17587.0,United Kingdom,2025-09-20
501887,21260,FIRST AID TIN,1,3.25,17587.0,United Kingdom,2025-09-20
501887,90098,NECKLACE+BRACELET PINK BUTTERFLY,1,2.55,17587.0,United Kingdom,2025-09-20
501887,22077,6 RIBBONS RUSTIC CHARM,1,1.65,17587.0,United Kingdom,2025-09-20
501887,84926D,LA PALMIERA TILE COASTER,2,1.25,17587.0,United Kingdom,2025-09-20
501887,84879,ASSORTED COLOUR BIRD ORNAMENT,8,1.69,17587.0,United Kingdom,2025-09-20
501887,84926B,SCOTTS ROSES TILE COASTER,2,1.25,17587.0,United Kingdom,2025-09-20
501887,84926A,WAKE UP COCKEREL TILE COASTER,2,1.25,17587.0,United Kingdom,2025-09-20
501887,15058A,BLUE WHITE SPOTS GARDEN PARASOL,1,7.95,17587.0,United Kingdom,2025-09-20
501887,85035C,ROSE 3 WICK MORRIS BOX CANDLE,1,4.25,17587.0,United Kingdom,2025-09-20
501887,72803A,ROSE SCENT CANDLE JEWELLED DRAWER,1,4.25,17587.0,United Kingdom,2025-09-20
501887,72741,GRAND CHOCOLATECANDLE,9,1.45,17587.0,United Kingdom,2025-09-20
501887,21407,BROWN CHECK CAT DOORSTOP ,1,4.25,17587.0,United Kingdom,2025-09-20
501887,84837,WHITE SWEETHEARTS CABINET 4 DRAWERS,1,12.75,17587.0,United Kingdom,2025-09-20
501887,21077,SET/20 WOODLAND PAPER NAPKINS ,1,0.85,17587.0,United Kingdom,2025-09-20
501887,84926E,FLOWERS TILE COASTER,2,1.25,17587.0,United Kingdom,2025-09-20
501887,84520B,PACK 20 ENGLISH ROSE PAPER NAPKINS,1,0.85,17587.0,United Kingdom,2025-09-20
501887,21115,ROSE CARAVAN DOORSTOP,1,6.75,17587.0,United Kingdom,2025-09-20
501887,22055,MINI CAKE STAND  HANGING STRAWBERY,1,1.65,17587.0,United Kingdom,2025-09-20
501887,20712,JUMBO BAG WOODLAND ANIMALS,1,1.95,17587.0,United Kingdom,2025-09-20
501887,21524,DOOR MAT SPOTTY HOME SWEET HOME,1,7.49,17587.0,United Kingdom,2025-09-20
501887,22139,RETRO SPOT TEA SET CERAMIC 11 PC ,1,4.95,17587.0,United Kingdom,2025-09-20
501887,M,Manual,1,2.95,17587.0,United Kingdom,2025-09-20
501887,35971,ROSE FOLKART HEART DECORATIONS,2,1.25,17587.0,United Kingdom,2025-09-20
501887,21765,HANGING METAL BIRD BATH,1,7.95,17587.0,United Kingdom,2025-09-20
501887,22423,REGENCY CAKESTAND 3 TIER,1,12.75,17587.0,United Kingdom,2025-09-20
501887,21548,CERAMIC BIRDHOUSE FINCH BLUE ROOF,1,2.95,17587.0,United Kingdom,2025-09-20
501887,21363,HOME SMALL WOOD LETTERS,1,4.95,17587.0,United Kingdom,2025-09-20
501887,21906,PHARMACIE FIRST AID TIN,1,6.75,17587.0,United Kingdom,2025-09-20
501887,22454,MEASURING TAPE RUSSIAN DOLL RED,1,2.95,17587.0,United Kingdom,2025-09-20
501887,85049E,SCANDINAVIAN REDS RIBBONS,1,1.25,17587.0,United Kingdom,2025-09-20
501887,72802C,VANILLA SCENT CANDLE JEWELLED BOX,1,4.25,17587.0,United Kingdom,2025-09-20
501887,21384,IVORY HANGING DECORATION  BUTTERFLY,3,0.85,17587.0,United Kingdom,2025-09-20
501887,22294,HEART FILIGREE DOVE  SMALL,1,1.25,17587.0,United Kingdom,2025-09-20
501887,22295,HEART FILIGREE DOVE LARGE,2,1.65,17587.0,United Kingdom,2025-09-20
501887,84836,ZINC METAL HEART DECORATION,1,1.25,17587.0,United Kingdom,2025-09-20
501887,22253,6 CROCHET STRAWBERRIES,1,1.25,17587.0,United Kingdom,2025-09-20
501887,22453,MEASURING TAPE RUSSIAN DOLL BLUE,1,2.95,17587.0,United Kingdom,2025-09-20
501887,22139,RETRO SPOT TEA SET CERAMIC 11 PC ,1,4.95,17587.0,United Kingdom,2025-09-20
501888,22073,RETRO SPOT STORAGE JAR,16,3.39,15633.0,United Kingdom,2025-09-20
501888,22381,TOY TIDY PINK RETROSPOT  ,50,1.85,15633.0,United Kingdom,2025-09-20
501888,20727,LUNCH BAG  BLACK SKULL.,10,1.65,15633.0,United Kingdom,2025-09-20
501888,21212,PACK OF 72 RETRO SPOT CAKE CASES,24,0.55,15633.0,United Kingdom,2025-09-20
501888,22457,NATURAL SLATE HEART CHALKBOARD ,6,2.95,15633.0,United Kingdom,2025-09-20
501888,21535,RETRO SPOT SMALL MILK JUG,6,2.55,15633.0,United Kingdom,2025-09-20
501888,47556B,TEA TIME TEA TOWELS ,6,2.95,15633.0,United Kingdom,2025-09-20
501888,21716,BOYS VINTAGE TIN SEASIDE BUCKET,8,2.55,15633.0,United Kingdom,2025-09-20
501888,21035,SET/2 RED SPOTTY TEA TOWELS ,6,2.95,15633.0,United Kingdom,2025-09-20
501888,21531,RETRO SPOT SUGAR JAM BOWL,6,2.55,15633.0,United Kingdom,2025-09-20
501888,21843,RETRO SPOT CAKE STAND,1,10.95,15633.0,United Kingdom,2025-09-20
501888,21539,RETRO SPOTS BUTTER DISH,3,4.95,15633.0,United Kingdom,2025-09-20
501888,21718,RED METAL BEACH SPADE ,12,1.25,15633.0,United Kingdom,2025-09-20
501889,22199,FRYING PAN RED POLKADOT ,4,4.25,13093.0,United Kingdom,2025-09-20
501889,48138,DOOR MAT UNION FLAG,10,6.35,13093.0,United Kingdom,2025-09-20
501889,48116,DOOR MAT MULTICOLOUR STRIPE,10,6.35,13093.0,United Kingdom,2025-09-20
501889,21524,DOOR MAT SPOTTY HOME SWEET HOME,10,6.35,13093.0,United Kingdom,2025-09-20
501889,22382,LUNCH BAG SPACEBOY DESIGN ,20,1.65,13093.0,United Kingdom,2025-09-20
501889,22383,LUNCH BAG SUKI  DESIGN ,20,1.65,13093.0,United Kingdom,2025-09-20
501889,21155,RED SPOTTY PEG BAG,6,2.1,13093.0,United Kingdom,2025-09-20
501889,20914,SET/5 RED SPOTTY LID GLASS BOWLS,32,2.55,13093.0,United Kingdom,2025-09-20
501889,22030,SWALLOWS GREETING CARD,12,0.42,13093.0,United Kingdom,2025-09-20
501889,21498,RED SPOTS  WRAP ,25,0.42,13093.0,United Kingdom,2025-09-20
501889,22027,TEA PARTY BIRTHDAY CARD,36,0.42,13093.0,United Kingdom,2025-09-20
501889,22474,SPACEBOY TV DINNER TRAY,3,4.95,13093.0,United Kingdom,2025-09-20
501889,22473,TV DINNER TRAY VINTAGE PAISLEY,3,4.95,13093.0,United Kingdom,2025-09-20
501889,22381,TOY TIDY PINK RETROSPOT  ,15,2.1,13093.0,United Kingdom,2025-09-20
501889,22380,TOY TIDY SPACEBOY  ,15,2.1,13093.0,United Kingdom,2025-09-20
501889,21506,"FANCY FONT BIRTHDAY CARD, ",12,0.42,13093.0,United Kingdom,2025-09-20
501889,21508,VINTAGE KID DOLLY CARD ,24,0.42,13093.0,United Kingdom,2025-09-20
501889,22029,SPACEBOY BIRTHDAY CARD,36,0.42,13093.0,United Kingdom,2025-09-20
501889,22379,RECYCLING BAG RETROSPOT ,10,2.1,13093.0,United Kingdom,2025-09-20
501889,21507,"ELEPHANT, BIRTHDAY CARD, ",24,0.42,13093.0,United Kingdom,2025-09-20
501890,21459,YELLOW EASTER EGG HUNT START POST,1,1.95,14606.0,United Kingdom,2025-09-20
501890,84596K,JELLY BABIES YELLOW SMALL BOWL,1,1.25,14606.0,United Kingdom,2025-09-20
501890,84971S,SMALL HEART FLOWERS HOOK ,2,0.85,14606.0,United Kingdom,2025-09-20
501890,21212,PACK OF 72 RETRO SPOT CAKE CASES,1,0.55,14606.0,United Kingdom,2025-09-20
501890,21851,LILAC DIAMANTE PEN IN GIFT BOX,2,4.95,14606.0,United Kingdom,2025-09-20
501890,22161,HEART DECORATION RUSTIC HANGING ,3,0.65,14606.0,United Kingdom,2025-09-20
501890,84970L,SINGLE HEART ZINC T-LIGHT HOLDER,2,0.95,14606.0,United Kingdom,2025-09-20
501890,22178,VICTORIAN GLASS HANGING T-LIGHT,32,1.25,14606.0,United Kingdom,2025-09-20
501890,22198,LARGE POPCORN HOLDER ,1,1.65,14606.0,United Kingdom,2025-09-20
501890,22381,TOY TIDY PINK RETROSPOT  ,1,2.1,14606.0,United Kingdom,2025-09-20
501890,21934,SKULL SHOULDER BAG,1,1.65,14606.0,United Kingdom,2025-09-20
501890,20731,POSY CANDY BAG,1,1.25,14606.0,United Kingdom,2025-09-20
501890,21432,SET OF 3 CASES WOODLAND DESIGN,1,5.95,14606.0,United Kingdom,2025-09-20
501890,22073,RETRO SPOT STORAGE JAR,1,3.75,14606.0,United Kingdom,2025-09-20
501890,22138,BAKING SET 9 PIECE RETROSPOT ,1,4.95,14606.0,United Kingdom,2025-09-20
501890,21550,CERAMIC BIRDHOUSE CRESTED TIT LARGE,1,5.95,14606.0,United Kingdom,2025-09-20
501890,21231,SWEETHEART CERAMIC TRINKET BOX,2,1.25,14606.0,United Kingdom,2025-09-20
501890,18098C,PORCELAIN BUTTERFLY OIL BURNER,1,2.95,14606.0,United Kingdom,2025-09-20
501890,22197,SMALL POPCORN HOLDER,2,0.85,14606.0,United Kingdom,2025-09-20
501890,21948,SET OF 6 CAKE CHOPSTICKS,1,1.25,14606.0,United Kingdom,2025-09-20
501890,22326,ROUND SNACK BOXES SET OF4 WOODLAND ,1,2.95,14606.0,United Kingdom,2025-09-20
501890,22483,RED GINGHAM TEDDY BEAR ,1,2.95,14606.0,United Kingdom,2025-09-20
501890,22432,WATERING CAN PINK BUNNY,1,1.95,14606.0,United Kingdom,2025-09-20
501890,84596F,SMALL MARSHMALLOWS PINK BOWL,1,1.25,14606.0,United Kingdom,2025-09-20
501890,21232,STRAWBERRY CERAMIC TRINKET BOX,2,1.25,14606.0,United Kingdom,2025-09-20
501890,20671,BLUE TEATIME PRINT BOWL ,1,1.25,14606.0,United Kingdom,2025-09-20
501890,22260,FELT EGG COSY BLUE RABBIT ,1,0.85,14606.0,United Kingdom,2025-09-20
501890,22261,FELT EGG COSY WHITE RABBIT ,4,0.85,14606.0,United Kingdom,2025-09-20
501890,22262,FELT EGG COSY CHICKEN,2,0.85,14606.0,United Kingdom,2025-09-20
501890,21837,CROSS STITCH ALPHABET CUSHION COVER,2,5.95,14606.0,United Kingdom,2025-09-20
501890,20828,GLITTER BUTTERFLY CLIPS,1,2.55,14606.0,United Kingdom,2025-09-20
501890,85114C,RED ENCHANTED FOREST PLACEMAT,11,1.65,14606.0,United Kingdom,2025-09-20
501890,85114B,IVORY ENCHANTED FOREST PLACEMAT,1,1.65,14606.0,United Kingdom,2025-09-20
501890,22241,GARLAND WOODEN HAPPY EASTER,1,1.25,14606.0,United Kingdom,2025-09-20
501890,20734,SILVER MINI TAPE MEASURE ,2,0.85,14606.0,United Kingdom,2025-09-20
501890,20735,BLACK MINI TAPE MEASURE ,1,0.85,14606.0,United Kingdom,2025-09-20
501890,90214K,"LETTER ""K"" BLING KEY RING",1,1.25,14606.0,United Kingdom,2025-09-20
501890,20733,GOLD MINI TAPE MEASURE ,2,0.85,14606.0,United Kingdom,2025-09-20
501890,20738,GREEN MINI TAPE MEASURE ,1,0.85,14606.0,United Kingdom,2025-09-20
501890,72741,GRAND CHOCOLATECANDLE,9,1.45,14606.0,United Kingdom,2025-09-20
501890,20886,BOX OF 9 PEBBLE CANDLES,1,1.95,14606.0,United Kingdom,2025-09-20
501890,21755,LOVE BUILDING BLOCK WORD,1,5.95,14606.0,United Kingdom,2025-09-20
501890,22261,FELT EGG COSY WHITE RABBIT ,1,0.85,14606.0,United Kingdom,2025-09-20
501890,22467,GUMBALL COAT RACK,4,2.55,14606.0,United Kingdom,2025-09-20
501890,22260,FELT EGG COSY BLUE RABBIT ,1,0.85,14606.0,United Kingdom,2025-09-20
501890,22262,FELT EGG COSY CHICKEN,3,0.85,14606.0,United Kingdom,2025-09-20
501890,22286,"DECORATION , WOBBLY RABBIT , METAL ",1,1.65,14606.0,United Kingdom,2025-09-20
501890,22451,SILK PURSE RUSSIAN DOLL RED,1,3.35,14606.0,United Kingdom,2025-09-20
501890,84596B,SMALL DOLLY MIX DESIGN ORANGE BOWL,1,1.25,14606.0,United Kingdom,2025-09-20
501890,22262,FELT EGG COSY CHICKEN,2,0.85,14606.0,United Kingdom,2025-09-20
501891,21323,HANGING MEDINA LANTERN LARGE,5,4.25,17969.0,United Kingdom,2025-09-20
501891,84795E,RIO PINK STRIPE HAMMOCK,1,7.95,17969.0,United Kingdom,2025-09-20
501891,21035,SET/2 RED SPOTTY TEA TOWELS ,1,2.95,17969.0,United Kingdom,2025-09-20
501891,84946,ANTIQUE SILVER TEA GLASS ETCHED,42,1.25,17969.0,United Kingdom,2025-09-20
501891,84795A,PASTEL STRIPE HAMMOCK ,1,7.95,17969.0,United Kingdom,2025-09-20
501891,79323S,SILVER CHERRY LIGHTS,1,6.75,17969.0,United Kingdom,2025-09-20
501891,72793,BLACK BOX MIRROR LANTERN,1,5.95,17969.0,United Kingdom,2025-09-20
501891,21923,RED/CREAM STRIPE FRINGE HAMMOCK,1,7.95,17969.0,United Kingdom,2025-09-20
501892,21381,MINI WOODEN HAPPY BIRTHDAY GARLAND,1,1.69,17051.0,United Kingdom,2025-09-20
501892,47589,CONGRATULATIONS BUNTING,3,5.45,17051.0,United Kingdom,2025-09-20
501892,20914,SET/5 RED SPOTTY LID GLASS BOWLS,2,2.95,17051.0,United Kingdom,2025-09-20
501892,22457,NATURAL SLATE HEART CHALKBOARD ,1,2.95,17051.0,United Kingdom,2025-09-20
501892,22230,JIGSAW TREE WITH WATERING CAN,2,0.85,17051.0,United Kingdom,2025-09-20
501892,85197,SET OF 12 MINI BUNNIES IN A BUCKET,1,2.1,17051.0,United Kingdom,2025-09-20
501892,22269,EGG CUP NATURAL CHICKEN,2,1.25,17051.0,United Kingdom,2025-09-20
501892,85186A,EASTER BUNNY GARLAND OF FLOWERS,3,0.42,17051.0,United Kingdom,2025-09-20
501892,20971,PINK BLUE FELT CRAFT TRINKET BOX,2,1.25,17051.0,United Kingdom,2025-09-20
501892,22217,T-LIGHT HOLDER HANGING LACE,2,1.25,17051.0,United Kingdom,2025-09-20
501892,22228,BUNNY WOODEN PAINTED WITH BIRD ,2,0.85,17051.0,United Kingdom,2025-09-20
501892,20717,STRAWBERRY SHOPPER BAG,2,1.25,17051.0,United Kingdom,2025-09-20
501892,22196,SMALL HEART MEASURING SPOONS,2,0.85,17051.0,United Kingdom,2025-09-20
501892,22196,SMALL HEART MEASURING SPOONS,1,0.85,17051.0,United Kingdom,2025-09-20
501892,20846,ZINC HEART LATTICE T-LIGHT HOLDER,2,1.25,17051.0,United Kingdom,2025-09-20
501892,85186C,BUNNY EGG GARLAND,3,0.42,17051.0,United Kingdom,2025-09-20
501892,21437,24 HANGING EASTER EGGS FLORAL TUB,1,3.75,17051.0,United Kingdom,2025-09-20
501892,20886,BOX OF 9 PEBBLE CANDLES,6,1.95,17051.0,United Kingdom,2025-09-20
501892,85099B,JUMBO BAG RED WHITE SPOTTY ,10,1.95,17051.0,United Kingdom,2025-09-20
501892,79191C,RETRO PLASTIC ELEPHANT TRAY,1,0.85,17051.0,United Kingdom,2025-09-20
501892,84970S,HANGING HEART ZINC T-LIGHT HOLDER,2,0.85,17051.0,United Kingdom,2025-09-20
501892,22231,JIGSAW TREE WITH BIRDHOUSE,2,1.45,17051.0,United Kingdom,2025-09-20
501892,84535B,FAIRY CAKES NOTEBOOK A6 SIZE,2,0.65,17051.0,United Kingdom,2025-09-20
501892,84536B,FAIRY CAKES NOTEBOOK A7 SIZE,2,0.42,17051.0,United Kingdom,2025-09-20
501892,20724,RED SPOTTY CHARLOTTE BAG,2,0.85,17051.0,United Kingdom,2025-09-20
501892,47599B,BLUE PARTY BAGS ,6,2.1,17051.0,United Kingdom,2025-09-20
501892,15060B,FAIRY CAKE DESIGN UMBRELLA,1,3.75,17051.0,United Kingdom,2025-09-20
501892,21232,STRAWBERRY CERAMIC TRINKET BOX,2,1.25,17051.0,United Kingdom,2025-09-20
501892,21559,STRAWBERRY LUNCHBOX WITH CUTLERY,1,2.55,17051.0,United Kingdom,2025-09-20
501892,22353,LUNCHBOX WITH CUTLERY FAIRY CAKES ,1,2.55,17051.0,United Kingdom,2025-09-20
501892,21111,"SWISS ROLL TOWEL, CHOCOLATE  SPOTS",6,2.95,17051.0,United Kingdom,2025-09-20
501892,18097C,WHITE TALL PORCELAIN T-LIGHT HOLDER,2,2.55,17051.0,United Kingdom,2025-09-20
501892,37502,TEA TIME MUG IN GIFT BOX,3,2.95,17051.0,United Kingdom,2025-09-20
501892,22188,BLACK HEART CARD HOLDER,1,3.95,17051.0,United Kingdom,2025-09-20
501892,37501,TEA TIME TEA SET IN GIFT BOX,2,6.95,17051.0,United Kingdom,2025-09-20
501893,20618,QUEEN OF THE SKIES PASSPORT COVER ,2,2.1,15005.0,United Kingdom,2025-09-20
501893,22356,"CHARLOTTE BAG , PINK/WHITE SPOTS",6,0.85,15005.0,United Kingdom,2025-09-20
501893,21231,SWEETHEART CERAMIC TRINKET BOX,4,1.25,15005.0,United Kingdom,2025-09-20
501893,35961,FOLKART ZINC HEART CHRISTMAS DEC,6,0.85,15005.0,United Kingdom,2025-09-20
501893,37447,CERAMIC CAKE DESIGN SPOTTED PLATE,4,1.49,15005.0,United Kingdom,2025-09-20
501893,22055,MINI CAKE STAND  HANGING STRAWBERY,1,1.65,15005.0,United Kingdom,2025-09-20
501893,22059,CERAMIC STRWBERRY DESIGN MUG,1,1.49,15005.0,United Kingdom,2025-09-20
501893,37502,TEA TIME MUG IN GIFT BOX,2,2.95,15005.0,United Kingdom,2025-09-20
501893,37446,MINI CAKE STAND WITH HANGING CAKES,2,1.45,15005.0,United Kingdom,2025-09-20
501893,21232,STRAWBERRY CERAMIC TRINKET BOX,4,1.25,15005.0,United Kingdom,2025-09-20
501893,37461,FUNKY MONKEY MUG,6,1.25,15005.0,United Kingdom,2025-09-20
501893,20723,STRAWBERRY CHARLOTTE BAG,6,0.85,15005.0,United Kingdom,2025-09-20
501893,22386,JUMBO BAG PINK WITH WHITE SPOTS,1,1.95,15005.0,United Kingdom,2025-09-20
501893,84466,TOP SECRET PEN SET,4,1.25,15005.0,United Kingdom,2025-09-20
501893,82486,WOOD S/3 CABINET ANT WHITE FINISH,1,7.95,15005.0,United Kingdom,2025-09-20
501893,20914,SET/5 RED SPOTTY LID GLASS BOWLS,3,2.95,15005.0,United Kingdom,2025-09-20
501893,21791,VINTAGE HEADS AND TAILS CARD GAME ,2,1.25,15005.0,United Kingdom,2025-09-20
501893,20724,RED SPOTTY CHARLOTTE BAG,6,0.85,15005.0,United Kingdom,2025-09-20
501893,22385,JUMBO BAG SPACEBOY DESIGN,1,1.95,15005.0,United Kingdom,2025-09-20
501893,20711,JUMBO BAG TOYS ,2,1.95,15005.0,United Kingdom,2025-09-20
501893,22411,JUMBO SHOPPER VINTAGE RED PAISLEY,1,1.95,15005.0,United Kingdom,2025-09-20
501893,20681,PINK SPOTTY CHILDS UMBRELLA,2,3.25,15005.0,United Kingdom,2025-09-20
501893,22227,"DECORATION, HANGING HEART+MIRROR ",10,0.65,15005.0,United Kingdom,2025-09-20
501893,84270,ASSTD DESIGN BUBBLE GUM RING,30,0.21,15005.0,United Kingdom,2025-09-20
501893,21733,RED HANGING HEART T-LIGHT HOLDER,2,2.95,15005.0,United Kingdom,2025-09-20
501893,20719,WOODLAND CHARLOTTE BAG,6,0.85,15005.0,United Kingdom,2025-09-20
501893,85123A,WHITE HANGING HEART T-LIGHT HOLDER,4,2.95,15005.0,United Kingdom,2025-09-20
501893,22175,PINK OWL SOFT TOY,2,2.95,15005.0,United Kingdom,2025-09-20
501893,37502,TEA TIME MUG IN GIFT BOX,2,2.95,15005.0,United Kingdom,2025-09-20
501893,21791,VINTAGE HEADS AND TAILS CARD GAME ,2,1.25,15005.0,United Kingdom,2025-09-20
501893,21715,GIRLS VINTAGE TIN SEASIDE BUCKET,2,2.55,15005.0,United Kingdom,2025-09-20
501893,84596E,SMALL LICORICE DES PINK BOWL,6,1.25,15005.0,United Kingdom,2025-09-20
501893,21500,PINK SPOTS  WRAP ,25,0.42,15005.0,United Kingdom,2025-09-20
501893,90058A,CRYSTAL STUD EARRINGS CLEAR DISPLAY,36,0.38,15005.0,United Kingdom,2025-09-20
501893,85203,HANGING WOOD AND FELT BUTTERFLY ,6,0.42,15005.0,United Kingdom,2025-09-20
501893,85206A,CREAM FELT EASTER EGG BASKET,1,1.65,15005.0,United Kingdom,2025-09-20
