Invoice,StockCode,Description,Quantity,Price,Customer ID,Country,InvoiceDate
498642,22380,TOY TIDY SPACEBOY  ,5,2.1,16057.0,United Kingdom,2025-08-28
498642,22329,ROUND CONTAINER SET OF 5 RETROSPOT,12,1.65,16057.0,United Kingdom,2025-08-28
498642,21527,RETRO SPOT TRADITIONAL TEAPOT ,2,7.95,16057.0,United Kingdom,2025-08-28
498642,22073,RETRO SPOT STORAGE JAR,4,3.75,16057.0,United Kingdom,2025-08-28
498642,22352,LUNCHBOX WITH CUTLERY RETROSPOT ,6,2.55,16057.0,United Kingdom,2025-08-28
498648,21421,PORCELAIN ROSE LARGE ,180,1.06,17955.0,United Kingdom,2025-08-28
498648,21422,PORCELAIN ROSE SMALL,208,0.85,17955.0,United Kingdom,2025-08-28
498688,84616,,-2,0.0,,United Kingdom,2025-08-28
498692,84472,,-3,0.0,,United Kingdom,2025-08-28
498693,84653,,-3,0.0,,United Kingdom,2025-08-28
498689,84909A,,-4,0.0,,United Kingdom,2025-08-28
498694,22322,BIRD DECORATION GREEN  SPOT,12,0.85,13787.0,United Kingdom,2025-08-28
498694,21385,IVORY HANGING DECORATION  HEART,24,0.85,13787.0,United Kingdom,2025-08-28
498694,85170A,SET/6 IVORY BIRD T-LIGHT CANDLES,6,2.1,13787.0,United Kingdom,2025-08-28
498694,85231L,LAVENDER SCENTED SET/9 T-LIGHTS,12,0.85,13787.0,United Kingdom,2025-08-28
498694,85231G,ORANGE SCENTED SET/9 T-LIGHTS,12,0.85,13787.0,United Kingdom,2025-08-28
498694,85231E,STRAWBERRY SCENTED SET/9 T-LIGHTS,12,0.85,13787.0,United Kingdom,2025-08-28
498694,22257,FELT FARM ANIMAL SHEEP,12,1.25,13787.0,United Kingdom,2025-08-28
498694,85186C,BUNNY EGG GARLAND,24,0.42,13787.0,United Kingdom,2025-08-28
498694,85230F,JASMINE VOTIVE CANDLE,24,0.29,13787.0,United Kingdom,2025-08-28
498694,22258,FELT FARM ANIMAL RABBIT,12,1.25,13787.0,United Kingdom,2025-08-28
498694,85170C,SET/6 EAU DE NIL BIRD T-LIGHTS,6,2.1,13787.0,United Kingdom,2025-08-28
498694,85196,EASTER BUNNIES ON A STICK,12,0.55,13787.0,United Kingdom,2025-08-28
498694,22253,6 CROCHET STRAWBERRIES,12,1.25,13787.0,United Kingdom,2025-08-28
498694,37495,FAIRY CAKE BIRTHDAY CANDLE SET,4,3.75,13787.0,United Kingdom,2025-08-28
498694,84839,SWEETHEART KEY CABINET,2,6.75,13787.0,United Kingdom,2025-08-28
498694,22415,WHITE TISSUE REAM,1,7.95,13787.0,United Kingdom,2025-08-28
498694,22288,"DECORATION , HANGING METAL RABBIT",24,1.25,13787.0,United Kingdom,2025-08-28
498694,21383,PACK OF 12 STICKY BUNNIES,24,0.65,13787.0,United Kingdom,2025-08-28
498695,82482,,-53,0.0,,United Kingdom,2025-08-28
498696,21795,SET OF 3 BLUE STRIPE BASKET,2,12.75,16619.0,United Kingdom,2025-08-28
498696,21593,SWALLOW CIGAR BOX MATCHES ,24,1.25,16619.0,United Kingdom,2025-08-28
498696,21411,GINGHAM HEART  DOORSTOP RED,3,4.25,16619.0,United Kingdom,2025-08-28
498696,21980,PACK OF 12 RED SPOTTY TISSUES ,48,0.29,16619.0,United Kingdom,2025-08-28
498696,22185,SLATE TILE NATURAL HANGING,24,1.65,16619.0,United Kingdom,2025-08-28
498696,21923,RED/CREAM STRIPE FRINGE HAMMOCK,2,7.95,16619.0,United Kingdom,2025-08-28
498696,21896,POTTING SHED TWINE,6,2.1,16619.0,United Kingdom,2025-08-28
498696,47503K,ASSORTED FLORAL SECATEURS,12,1.95,16619.0,United Kingdom,2025-08-28
498696,47503G,ASS FLORAL PRINT TAPE MEASURE,12,1.25,16619.0,United Kingdom,2025-08-28
498696,21796,SET OF 3 RED STRIPE BASKETS,2,12.75,16619.0,United Kingdom,2025-08-28
498696,84795D,SEASIDE STRIPE HAMMOCK,2,7.95,16619.0,United Kingdom,2025-08-28
498696,21448,12 DAISY PEGS IN WOOD BOX,12,1.65,16619.0,United Kingdom,2025-08-28
498696,22127,PARTY CONES CARNIVAL ASSORTED,12,1.25,16619.0,United Kingdom,2025-08-28
498696,22125,UNION JACK HOT WATER BOTTLE ,3,5.95,16619.0,United Kingdom,2025-08-28
498696,20750, RED/WHITE DOT MINI CASES,2,7.95,16619.0,United Kingdom,2025-08-28
498696,20682,RED SPOTTY CHILDS UMBRELLA,6,3.25,16619.0,United Kingdom,2025-08-28
498696,21488,RED WHITE SCARF  HOT WATER BOTTLE,4,3.95,16619.0,United Kingdom,2025-08-28
498696,21498,RED SPOTS  WRAP ,25,0.42,16619.0,United Kingdom,2025-08-28
498696,21733,RED HANGING HEART T-LIGHT HOLDER,6,2.95,16619.0,United Kingdom,2025-08-28
498696,84970L,SINGLE HEART ZINC T-LIGHT HOLDER,12,0.95,16619.0,United Kingdom,2025-08-28
498696,84970S,HANGING HEART ZINC T-LIGHT HOLDER,12,0.85,16619.0,United Kingdom,2025-08-28
498696,85123A,WHITE HANGING HEART T-LIGHT HOLDER,6,2.95,16619.0,United Kingdom,2025-08-28
498696,84690,S/2 BEACH HUT STOOLS,2,7.95,16619.0,United Kingdom,2025-08-28
498696,22177,5 HOOK BLACKBOARD ORGANISER ,2,9.95,16619.0,United Kingdom,2025-08-28
498696,84762A,WHITE PICNIC BARBECUE BUCKET,1,10.75,16619.0,United Kingdom,2025-08-28
498696,84762B,PINK PICNIC BARBECUE BUCKET,1,10.75,16619.0,United Kingdom,2025-08-28
498696,21584,RETRO SPOT SMALL TUBE MATCHES,20,1.65,16619.0,United Kingdom,2025-08-28
498696,22128,PARTY CONES CANDY ASSORTED,12,1.25,16619.0,United Kingdom,2025-08-28
498696,21495,SKULLS WRAP,25,0.42,16619.0,United Kingdom,2025-08-28
498696,48138,DOOR MAT UNION FLAG,2,7.49,16619.0,United Kingdom,2025-08-28
498696,47503E,ASS FLORAL PRINT SCISSORS,12,1.25,16619.0,United Kingdom,2025-08-28
498696,22082,RIBBON REEL STRIPES DESIGN ,10,1.65,16619.0,United Kingdom,2025-08-28
498696,21916,SET 12 RETRO WHITE CHALK STICKS,24,0.42,16619.0,United Kingdom,2025-08-28
498696,21718,RED METAL BEACH SPADE ,12,1.25,16619.0,United Kingdom,2025-08-28
498696,84599,CANDY STRIPE ROSE FLOOR CUSHION,2,7.95,16619.0,United Kingdom,2025-08-28
498696,84621,BLUE GINGHAM ROSE FLOOR CUSHION ,2,7.95,16619.0,United Kingdom,2025-08-28
498696,84623,PINK GINGHAM ROSE FLOOR CUSHION,2,7.95,16619.0,United Kingdom,2025-08-28
498696,21737,SET 3 WICKER LOG BASKETS,2,19.95,16619.0,United Kingdom,2025-08-28
498696,22052,VINTAGE CARAVAN GIFT WRAP,25,0.42,16619.0,United Kingdom,2025-08-28
498696,22191,EAU DE NIL DINER WALL CLOCK,2,8.5,16619.0,United Kingdom,2025-08-28
498696,79029,GLASS HONEYPOT WASP CATCHER,6,1.95,16619.0,United Kingdom,2025-08-28
498696,20685,DOOR MAT RED SPOT,2,7.49,16619.0,United Kingdom,2025-08-28
498696,22149,FELTCRAFT 6 FLOWER FRIENDS,6,2.1,16619.0,United Kingdom,2025-08-28
498696,22150, 3 STRIPEY MICE FELTCRAFT,6,1.95,16619.0,United Kingdom,2025-08-28
498696,85232B,SET/3 RUSSIAN DOLL STACKING TINS,3,4.95,16619.0,United Kingdom,2025-08-28
498696,22192,BLUE DINER WALL CLOCK,2,8.5,16619.0,United Kingdom,2025-08-28
498696,22079,RIBBON REEL HEARTS DESIGN ,10,1.65,16619.0,United Kingdom,2025-08-28
498696,10134,COLOURING PENCILS BROWN TUBE,10,1.25,16619.0,United Kingdom,2025-08-28
498696,20978,36 PENCILS TUBE SKULLS,16,1.25,16619.0,United Kingdom,2025-08-28
498696,20766,GARDEN PATH SKETCHBOOK,4,3.75,16619.0,United Kingdom,2025-08-28
498696,22189,CREAM HEART CARD HOLDER,4,3.95,16619.0,United Kingdom,2025-08-28
498696,21114,LAVENDER SCENTED FABRIC HEART,10,1.25,16619.0,United Kingdom,2025-08-28
498696,21381,MINI WOODEN HAPPY BIRTHDAY GARLAND,12,1.69,16619.0,United Kingdom,2025-08-28
498696,84971L,LARGE HEART FLOWERS HOOK   ,12,1.25,16619.0,United Kingdom,2025-08-28
498696,22083,PAPER CHAIN KIT RETRO SPOT,6,2.95,16619.0,United Kingdom,2025-08-28
498696,22318,FIVE HEART HANGING DECORATION,6,2.95,16619.0,United Kingdom,2025-08-28
498696,21668,RED STRIPE CERAMIC DRAWER KNOB,12,1.25,16619.0,United Kingdom,2025-08-28
498696,22193,RED DINER WALL CLOCK,2,8.5,16619.0,United Kingdom,2025-08-28
498696,21136,PAINTED METAL PEARS ASSORTED,8,1.69,16619.0,United Kingdom,2025-08-28
498697,84270,ASSTD DESIGN BUBBLE GUM RING,60,0.21,14997.0,United Kingdom,2025-08-28
498697,20832,RED FLOCK LOVE HEART PHOTO FRAME,24,0.85,14997.0,United Kingdom,2025-08-28
498697,71101E,STANDING FAIRY POLE SUPPORT ,12,0.85,14997.0,United Kingdom,2025-08-28
498697,51020B,STRIPY DESIGN SHOWER CAP,12,1.25,14997.0,United Kingdom,2025-08-28
498697,37340,MULTICOLOUR SPRING FLOWER MUG,36,0.85,14997.0,United Kingdom,2025-08-28
498697,85129C,BEADED CRYSTAL HEART BLUE SMALL,12,1.25,14997.0,United Kingdom,2025-08-28
498697,90085,CRYSTAL STILETTO PHONE CHARM,24,0.85,14997.0,United Kingdom,2025-08-28
498697,22227,"DECORATION, HANGING HEART+MIRROR ",24,0.65,14997.0,United Kingdom,2025-08-28
498697,21354,TOAST ITS - BEST MUM,24,1.25,14997.0,United Kingdom,2025-08-28
498697,90087,CRYSTAL SEA HORSE PHONE CHARM,12,0.85,14997.0,United Kingdom,2025-08-28
498697,90090,PINK CRYSTAL HEART PHONE CHARM,24,0.85,14997.0,United Kingdom,2025-08-28
498697,85129D,BEADED CRYSTAL HEART PINK SMALL,24,1.25,14997.0,United Kingdom,2025-08-28
498698,DCGS0053,,-2,0.0,,United Kingdom,2025-08-28
498699,DCGS0004,,-2,0.0,,United Kingdom,2025-08-28
498700,DCGS0062,,-1,0.0,,United Kingdom,2025-08-28
498701,DCGS0037,,-1,0.0,,United Kingdom,2025-08-28
498702,20954,,-2,0.0,,United Kingdom,2025-08-28
C498703,37448,CERAMIC CAKE DESIGN SPOTTED MUG,-2,1.49,14680.0,United Kingdom,2025-08-28
C498703,22384,LUNCH BAG PINK RETROSPOT,-1,1.65,14680.0,United Kingdom,2025-08-28
C498703,21556,CERAMIC STRAWBERRY MONEY BOX,-1,2.55,14680.0,United Kingdom,2025-08-28
C498703,22352,LUNCHBOX WITH CUTLERY RETROSPOT ,-1,2.55,14680.0,United Kingdom,2025-08-28
C498703,85123A,WHITE HANGING HEART T-LIGHT HOLDER,-5,2.55,14680.0,United Kingdom,2025-08-28
C498703,85152,HAND OVER THE CHOCOLATE   SIGN ,-1,2.1,14680.0,United Kingdom,2025-08-28
C498703,21733,RED HANGING HEART T-LIGHT HOLDER,-1,2.55,14680.0,United Kingdom,2025-08-28
C498703,20726,LUNCH BAG WOODLAND,-3,1.65,14680.0,United Kingdom,2025-08-28
498704,21611,SET OF 12 LILY BOTANICAL T-LIGHTS,1,2.95,17841.0,United Kingdom,2025-08-28
498705,21864,UNION JACK FLAG PASSPORT COVER ,1,2.1,14680.0,United Kingdom,2025-08-28
498705,20618,QUEEN OF THE SKIES PASSPORT COVER ,1,2.1,14680.0,United Kingdom,2025-08-28
498705,20618,QUEEN OF THE SKIES PASSPORT COVER ,1,2.1,14680.0,United Kingdom,2025-08-28
498705,21843,RETRO SPOT CAKE STAND,4,10.95,14680.0,United Kingdom,2025-08-28
498705,20914,SET/5 RED SPOTTY LID GLASS BOWLS,5,2.95,14680.0,United Kingdom,2025-08-28
498705,84997C,BLUE 3 PIECE MINI DOTS CUTLERY SET,10,3.75,14680.0,United Kingdom,2025-08-28
498704,22221,CAKE STAND LOVEBIRD 2 TIER PINK,6,9.95,17841.0,United Kingdom,2025-08-28
498704,21121,SET/10 RED SPOTTY PARTY CANDLES,1,1.25,17841.0,United Kingdom,2025-08-28
498704,22114,HOT WATER BOTTLE TEA AND SYMPATHY,4,3.95,17841.0,United Kingdom,2025-08-28
498704,21669,BLUE STRIPE CERAMIC DRAWER KNOB,7,1.25,17841.0,United Kingdom,2025-08-28
498704,44230,SQUARE MIRROR CURTAIN,1,7.95,17841.0,United Kingdom,2025-08-28
498705,21865,PINK UNION JACK  PASSPORT COVER ,1,2.1,14680.0,United Kingdom,2025-08-28
498704,21218,RED SPOTTY BISCUIT TIN,1,3.75,17841.0,United Kingdom,2025-08-28
498704,84997B,RED 3 PIECE MINI DOTS CUTLERY SET,2,3.75,17841.0,United Kingdom,2025-08-28
498704,84997D,PINK 3 PIECE MINI DOTS CUTLERY SET,1,3.75,17841.0,United Kingdom,2025-08-28
498704,21242,RED SPOTTY PLATE ,3,1.69,17841.0,United Kingdom,2025-08-28
498704,84849B,FAIRY SOAP SOAP HOLDER,1,1.69,17841.0,United Kingdom,2025-08-28
498704,21041,RED SPOTTY OVEN GLOVE DOUBLE,6,2.95,17841.0,United Kingdom,2025-08-28
498705,21535,RETRO SPOT SMALL MILK JUG,2,2.55,14680.0,United Kingdom,2025-08-28
498704,22329,ROUND CONTAINER SET OF 5 RETROSPOT,2,1.65,17841.0,United Kingdom,2025-08-28
498705,21532,DAIRY MAID SUGAR JAM BOWL,4,2.1,14680.0,United Kingdom,2025-08-28
498705,84991,60 TEATIME FAIRY CAKE CASES,24,0.55,14680.0,United Kingdom,2025-08-28
498705,21975,PACK OF 60 DINOSAUR CAKE CASES,24,0.55,14680.0,United Kingdom,2025-08-28
498705,21212,PACK OF 72 RETRO SPOT CAKE CASES,120,0.42,14680.0,United Kingdom,2025-08-28
498705,37501,TEA TIME TEA SET IN GIFT BOX,2,6.95,14680.0,United Kingdom,2025-08-28
498705,37500,TEA TIME TEAPOT IN GIFT BOX,2,9.95,14680.0,United Kingdom,2025-08-28
498705,21844,RETRO SPOT MUG,10,2.95,14680.0,United Kingdom,2025-08-28
498705,21845,DAIRY MAID STRIPE MUG,6,2.95,14680.0,United Kingdom,2025-08-28
498704,47021G,SET/6 BEAD COASTERS GAUZE BAG GOLD,1,1.25,17841.0,United Kingdom,2025-08-28
498705,21536,DAIRY MAID  SMALL  MILK JUG,5,2.1,14680.0,United Kingdom,2025-08-28
498704,22309,TEA COSY RED  STRIPE,1,2.55,17841.0,United Kingdom,2025-08-28
498704,21578,WOODLAND DESIGN  COTTON TOTE BAG,1,2.25,17841.0,United Kingdom,2025-08-28
498704,21577,SAVE THE PLANET COTTON TOTE BAG,1,2.25,17841.0,United Kingdom,2025-08-28
498704,21625,VINTAGE UNION JACK APRON,1,6.95,17841.0,United Kingdom,2025-08-28
498704,20676,RED SPOTTY BOWL,1,1.25,17841.0,United Kingdom,2025-08-28
498704,21286,RETRO SPOT CANDLE  LARGE,2,2.55,17841.0,United Kingdom,2025-08-28
498704,21284,RETRO SPOT CANDLE  SMALL,1,1.69,17841.0,United Kingdom,2025-08-28
498704,21201,TROPICAL  HONEYCOMB PAPER GARLAND ,1,2.55,17841.0,United Kingdom,2025-08-28
498705,21531,RETRO SPOT SUGAR JAM BOWL,8,2.55,14680.0,United Kingdom,2025-08-28
498704,84912A,PINK ROSE WASHBAG,1,3.75,17841.0,United Kingdom,2025-08-28
498704,20990,SPRING FLOWER CHOPSTICKS SET/5,1,1.95,17841.0,United Kingdom,2025-08-28
498704,22125,UNION JACK HOT WATER BOTTLE ,4,5.95,17841.0,United Kingdom,2025-08-28
498704,82583,HOT BATHS METAL SIGN,1,2.1,17841.0,United Kingdom,2025-08-28
498705,22352,LUNCHBOX WITH CUTLERY RETROSPOT ,7,2.55,14680.0,United Kingdom,2025-08-28
498705,22073,RETRO SPOT STORAGE JAR,9,3.75,14680.0,United Kingdom,2025-08-28
498705,37502,TEA TIME MUG IN GIFT BOX,1,2.95,14680.0,United Kingdom,2025-08-28
498705,20676,RED SPOTTY BOWL,8,1.25,14680.0,United Kingdom,2025-08-28
498705,21488,RED WHITE SCARF  HOT WATER BOTTLE,5,3.95,14680.0,United Kingdom,2025-08-28
498705,21538,DAIRY MAID  PUDDING BOWL,3,3.75,14680.0,United Kingdom,2025-08-28
498705,20728,LUNCH BAG CARS BLUE,10,1.65,14680.0,United Kingdom,2025-08-28
498705,20727,LUNCH BAG  BLACK SKULL.,10,1.65,14680.0,United Kingdom,2025-08-28
498705,84997B,RED 3 PIECE MINI DOTS CUTLERY SET,7,3.75,14680.0,United Kingdom,2025-08-28
498705,20725,LUNCH BAG RED SPOTTY,10,1.65,14680.0,United Kingdom,2025-08-28
498705,47591C,BLUE FAIRY CAKE CHILD'S APRON,2,1.95,14680.0,United Kingdom,2025-08-28
498705,21156,RED SPOTTY CHILDS APRON,2,1.95,14680.0,United Kingdom,2025-08-28
498704,84520B,PACK 20 ENGLISH ROSE PAPER NAPKINS,4,0.85,17841.0,United Kingdom,2025-08-28
498705,85099B,JUMBO BAG RED WHITE SPOTTY ,25,1.95,14680.0,United Kingdom,2025-08-28
498705,84519A,TOMATO CHARLIE+LOLA COASTER SET,8,2.95,14680.0,United Kingdom,2025-08-28
498705,84519B,CARROT CHARLIE+LOLA COASTER SET,10,2.95,14680.0,United Kingdom,2025-08-28
498705,20718,RED SPOTTY SHOPPER BAG,2,1.25,14680.0,United Kingdom,2025-08-28
498705,21533,RETRO SPOT LARGE MILK JUG,1,4.95,14680.0,United Kingdom,2025-08-28
498705,20726,LUNCH BAG WOODLAND,20,1.65,14680.0,United Kingdom,2025-08-28
498705,84997D,PINK 3 PIECE MINI DOTS CUTLERY SET,9,3.75,14680.0,United Kingdom,2025-08-28
498705,85123A,WHITE HANGING HEART T-LIGHT HOLDER,32,2.55,14680.0,United Kingdom,2025-08-28
498704,84313B,BLUE TV TRAY TABLE ,1,4.25,17841.0,United Kingdom,2025-08-28
498704,21171,BATHROOM METAL SIGN ,1,1.45,17841.0,United Kingdom,2025-08-28
498704,21174,POTTERING IN THE SHED METAL SIGN,1,1.95,17841.0,United Kingdom,2025-08-28
498704,84985B,SET OF 72 BLACK PAPER DOILIES ,1,1.45,17841.0,United Kingdom,2025-08-28
498704,84985A,SET OF 72 GREEN PAPER DOILIES,3,1.45,17841.0,United Kingdom,2025-08-28
498704,21974,SET OF 36 PAISLEY FLOWER DOILIES,1,1.45,17841.0,United Kingdom,2025-08-28
498704,22200,FRYING PAN PINK POLKADOT ,2,4.25,17841.0,United Kingdom,2025-08-28
498704,22199,FRYING PAN RED POLKADOT ,1,4.25,17841.0,United Kingdom,2025-08-28
498704,79160,HEART SHAPE WIRELESS DOORBELL,1,2.1,17841.0,United Kingdom,2025-08-28
498704,21216,"SET 3 RED SPOT TIN TEA,COFFEE,SUGAR",2,4.95,17841.0,United Kingdom,2025-08-28
498704,20728,LUNCH BAG CARS BLUE,2,1.65,17841.0,United Kingdom,2025-08-28
498704,85114B,IVORY ENCHANTED FOREST PLACEMAT,6,1.65,17841.0,United Kingdom,2025-08-28
498704,22380,TOY TIDY SPACEBOY  ,2,2.1,17841.0,United Kingdom,2025-08-28
498704,21931,JUMBO STORAGE BAG SUKI,1,1.95,17841.0,United Kingdom,2025-08-28
498704,22384,LUNCH BAG PINK RETROSPOT,1,1.65,17841.0,United Kingdom,2025-08-28
498704,22378,WALL TIDY RETROSPOT ,1,2.1,17841.0,United Kingdom,2025-08-28
498704,22379,RECYCLING BAG RETROSPOT ,4,2.1,17841.0,United Kingdom,2025-08-28
498704,22366,DOOR MAT AIRMAIL ,1,7.49,17841.0,United Kingdom,2025-08-28
498704,47590A,BLUE HAPPY BIRTHDAY BUNTING,2,5.45,17841.0,United Kingdom,2025-08-28
498704,17129F,DEEP BLUE GLASS GEMS IN BAG,1,0.85,17841.0,United Kingdom,2025-08-28
498706,20888,SET 3 JARDIN DE FEMME SCENT CANDLES,24,1.25,17439.0,United Kingdom,2025-08-28
498706,21313,GLASS HEART T-LIGHT HOLDER ,96,0.64,17439.0,United Kingdom,2025-08-28
498706,20871,OPULENT VELVET SET/3 CANDLES,24,1.25,17439.0,United Kingdom,2025-08-28
498706,84970S,HANGING HEART ZINC T-LIGHT HOLDER,12,0.85,17439.0,United Kingdom,2025-08-28
498706,47566,PARTY BUNTING,10,4.65,17439.0,United Kingdom,2025-08-28
498706,21621,VINTAGE UNION JACK BUNTING,12,8.5,17439.0,United Kingdom,2025-08-28
498706,85109,PINK BOUDOIR T-LIGHT HOLDER,144,0.19,17439.0,United Kingdom,2025-08-28
498707,21119,,-1,0.0,,United Kingdom,2025-08-28
498708,22122,SET OF 2 FANCY FONT TEA TOWELS,24,2.95,13199.0,United Kingdom,2025-08-28
498708,85232B,SET/3 RUSSIAN DOLL STACKING TINS,24,4.25,13199.0,United Kingdom,2025-08-28
498708,84947,ANTIQUE SILVER TEA GLASS ENGRAVED,72,1.06,13199.0,United Kingdom,2025-08-28
498706,85118,HEART T-LIGHT HOLDER,48,0.38,17439.0,United Kingdom,2025-08-28
498709,15039,SANDALWOOD FAN,250,0.53,13217.0,United Kingdom,2025-08-28
498710,21858,,-3,0.0,,United Kingdom,2025-08-28
498711,21857,,-1,0.0,,United Kingdom,2025-08-28
498712,21919,,-1,0.0,,United Kingdom,2025-08-28
498713,22334,DINOSAUR PARTY BAG + STICKER SET,8,1.65,17195.0,United Kingdom,2025-08-28
498713,22332,SKULLS PARTY BAG + STICKER SET,8,1.65,17195.0,United Kingdom,2025-08-28
498713,20970,PINK FLORAL FELTCRAFT SHOULDER BAG,4,3.75,17195.0,United Kingdom,2025-08-28
498713,20967,GREY FLORAL FELTCRAFT SHOULDER BAG,4,3.75,17195.0,United Kingdom,2025-08-28
498713,22211,WOOD STAMP SET FLOWERS,12,1.65,17195.0,United Kingdom,2025-08-28
498713,21890,S/6 WOODEN SKITTLES IN COTTON BAG,6,2.95,17195.0,United Kingdom,2025-08-28
498713,21718,RED METAL BEACH SPADE ,12,1.25,17195.0,United Kingdom,2025-08-28
498713,21704,BAG 250g SWIRLY MARBLES,12,0.85,17195.0,United Kingdom,2025-08-28
498713,21716,BOYS VINTAGE TIN SEASIDE BUCKET,8,2.55,17195.0,United Kingdom,2025-08-28
498713,21715,GIRLS VINTAGE TIN SEASIDE BUCKET,8,2.55,17195.0,United Kingdom,2025-08-28
498713,21791,VINTAGE HEADS AND TAILS CARD GAME ,12,1.25,17195.0,United Kingdom,2025-08-28
498713,22198,"POPCORN HOLDER , LARGE",12,1.65,17195.0,United Kingdom,2025-08-28
498713,22333,RETRO SPORT PARTY BAG + STICKER SET,8,1.65,17195.0,United Kingdom,2025-08-28
498713,21912,VINTAGE SNAKES & LADDERS,4,3.75,17195.0,United Kingdom,2025-08-28
498713,22331,WOODLAND PARTY BAG + STICKER SET,8,1.65,17195.0,United Kingdom,2025-08-28
498713,85206A,CREAM FELT EASTER EGG BASKET,6,1.65,17195.0,United Kingdom,2025-08-28
498713,20985,HEART CALCULATOR,24,1.25,17195.0,United Kingdom,2025-08-28
498713,22021,BLUE FELT EASTER EGG BASKET,6,1.65,17195.0,United Kingdom,2025-08-28
498713,21827,EIGHT PIECE CREEPY CRAWLIE SET,36,1.25,17195.0,United Kingdom,2025-08-28
498713,21828,EIGHT PIECE SNAKE  SET,36,1.25,17195.0,United Kingdom,2025-08-28
498713,21826,EIGHT PIECE DINOSAUR SET,36,1.25,17195.0,United Kingdom,2025-08-28
498713,85206B,PINK FELT EASTER EGG BASKET,6,1.65,17195.0,United Kingdom,2025-08-28
498713,21509,COWBOYS AND INDIANS BIRTHDAY CARD ,12,0.42,17195.0,United Kingdom,2025-08-28
498713,21542,WOODLAND WATER TRANSFER TATTOOS ,24,0.85,17195.0,United Kingdom,2025-08-28
498713,22030,SWALLOWS GREETING CARD,12,0.42,17195.0,United Kingdom,2025-08-28
498713,21561,DINOSAUR LUNCHBOX WITH CUTLERY,6,2.55,17195.0,United Kingdom,2025-08-28
498713,21541,DINOSAURS WATER TRANSFER TATTOOS ,60,0.85,17195.0,United Kingdom,2025-08-28
498713,21830,ASSORTED CREEPY CRAWLIES,24,0.42,17195.0,United Kingdom,2025-08-28
498713,84077,WORLD WAR 2 GLIDERS ASSTD DESIGNS,48,0.21,17195.0,United Kingdom,2025-08-28
498713,84247L,FAWN AND MUSHROOM GREETING CARD,12,0.42,17195.0,United Kingdom,2025-08-28
498713,21544,SKULLS  WATER TRANSFER TATTOOS ,12,0.85,17195.0,United Kingdom,2025-08-28
498714,22311,OFFICE MUG WARMER BLACK+SILVER ,2,4.95,,United Kingdom,2025-08-28
498714,22114,HOT WATER BOTTLE TEA AND SYMPATHY,1,3.95,,United Kingdom,2025-08-28
498715,21269,ANTIQUE CREAM CUTLERY SHELF ,1,8.5,17081.0,United Kingdom,2025-08-28
498715,85098B,BLUE FLYING SINGING CANARY,1,3.75,17081.0,United Kingdom,2025-08-28
498715,22091,EMPIRE TISSUE BOX,1,1.25,17081.0,United Kingdom,2025-08-28
498715,22114,HOT WATER BOTTLE TEA AND SYMPATHY,1,3.95,17081.0,United Kingdom,2025-08-28
498715,22112,CHOCOLATE HOT WATER BOTTLE,1,4.95,17081.0,United Kingdom,2025-08-28
498715,22191,EAU DE NIL DINER WALL CLOCK,1,8.5,17081.0,United Kingdom,2025-08-28
498715,85164B,BLACK BAROQUE CUCKOO CLOCK,1,12.75,17081.0,United Kingdom,2025-08-28
498715,21034,REX CASH+CARRY JUMBO SHOPPER,1,0.95,17081.0,United Kingdom,2025-08-28
498715,84629,WHITE 3 FRAME BIRDS AND TREE ,1,21.95,17081.0,United Kingdom,2025-08-28
498715,21071,VINTAGE BILLBOARD DRINK ME MUG,6,1.25,17081.0,United Kingdom,2025-08-28
498715,21076,SET/20 COLLAGE PAPER NAPKIN ,4,0.85,17081.0,United Kingdom,2025-08-28
498715,22093,MOTORING TISSUE BOX,2,1.25,17081.0,United Kingdom,2025-08-28
498715,22314,OFFICE MUG WARMER CHOC+BLUE,2,4.95,17081.0,United Kingdom,2025-08-28
498715,22097,SWALLOW SQUARE TISSUE BOX,1,1.25,17081.0,United Kingdom,2025-08-28
498715,21519,GIN & TONIC DIET GREETING CARD ,12,0.42,17081.0,United Kingdom,2025-08-28
498715,22030,SWALLOWS GREETING CARD,12,0.42,17081.0,United Kingdom,2025-08-28
498715,79320, FLAMINGO LIGHTS,1,4.95,17081.0,United Kingdom,2025-08-28
498715,22183,CAKE STAND VICTORIAN FILIGREE MED,1,6.75,17081.0,United Kingdom,2025-08-28
498716,22365,DOOR MAT RESPECTABLE HOUSE,2,7.49,15754.0,United Kingdom,2025-08-28
498716,21869,POTTING SHED COFFEE MUG,12,1.25,15754.0,United Kingdom,2025-08-28
498716,21868,POTTING SHED TEA MUG,12,1.25,15754.0,United Kingdom,2025-08-28
498716,21876,POTTERING MUG,12,1.25,15754.0,United Kingdom,2025-08-28
498716,71459,HANGING JAM JAR T-LIGHT HOLDER,24,0.85,15754.0,United Kingdom,2025-08-28
498716,22300,COFFEE MUG DOG + BALL DESIGN,6,2.55,15754.0,United Kingdom,2025-08-28
498716,22302,COFFEE MUG PEARS  DESIGN,6,2.55,15754.0,United Kingdom,2025-08-28
498716,22303,COFFEE MUG APPLES DESIGN,6,2.55,15754.0,United Kingdom,2025-08-28
498716,22301,COFFEE MUG CAT + BIRD DESIGN,6,2.55,15754.0,United Kingdom,2025-08-28
498716,22358,KINGS CHOICE TEA CADDY ,6,2.95,15754.0,United Kingdom,2025-08-28
498716,22338,STAR DECORATION PAINTED ZINC ,24,0.65,15754.0,United Kingdom,2025-08-28
498716,84755,COLOUR GLASS T-LIGHT HOLDER HANGING,16,0.65,15754.0,United Kingdom,2025-08-28
498716,22335,HEART DECORATION PAINTED ZINC ,24,0.65,15754.0,United Kingdom,2025-08-28
498716,20846,ZINC HEART LATTICE T-LIGHT HOLDER,24,1.25,15754.0,United Kingdom,2025-08-28
498716,22499,WOODEN UNION JACK BUNTING,3,5.95,15754.0,United Kingdom,2025-08-28
498716,21465,PINK FLOWER CROCHET FOOD COVER,24,3.75,15754.0,United Kingdom,2025-08-28
498716,21469,POLKA DOT RAFFIA FOOD COVER,24,3.75,15754.0,United Kingdom,2025-08-28
498716,21466,RED FLOWER CROCHET FOOD COVER,24,3.75,15754.0,United Kingdom,2025-08-28
498716,21468,BUTTERFLY CROCHET FOOD COVER,24,3.75,15754.0,United Kingdom,2025-08-28
498716,84970L,SINGLE HEART ZINC T-LIGHT HOLDER,12,0.95,15754.0,United Kingdom,2025-08-28
498716,84978,HANGING HEART JAR T-LIGHT HOLDER,12,1.25,15754.0,United Kingdom,2025-08-28
498716,84970S,HANGING HEART ZINC T-LIGHT HOLDER,12,0.85,15754.0,United Kingdom,2025-08-28
498716,21899,"KEY FOB , GARAGE DESIGN",24,0.65,15754.0,United Kingdom,2025-08-28
498716,21900,"KEY FOB , SHED",24,0.65,15754.0,United Kingdom,2025-08-28
498716,21901,"KEY FOB , BACK DOOR ",24,0.65,15754.0,United Kingdom,2025-08-28
498716,21902,"KEY FOB , FRONT  DOOR ",24,0.65,15754.0,United Kingdom,2025-08-28
498716,22357,KINGS CHOICE BISCUIT TIN,4,4.25,15754.0,United Kingdom,2025-08-28
498716,22339,CHRISTMAS TREE PAINTED ZINC ,24,0.65,15754.0,United Kingdom,2025-08-28
498716,22084,PAPER CHAIN KIT EMPIRE,12,2.95,15754.0,United Kingdom,2025-08-28
498716,21213,PACK OF 72 SKULL CAKE CASES,36,0.55,15754.0,United Kingdom,2025-08-28
498716,21212,PACK OF 72 RETRO SPOT CAKE CASES,36,0.55,15754.0,United Kingdom,2025-08-28
498716,48138,DOOR MAT UNION FLAG,2,7.49,15754.0,United Kingdom,2025-08-28
498716,20685,DOOR MAT RED SPOT,2,7.49,15754.0,United Kingdom,2025-08-28
498716,21916,SET 12 RETRO WHITE CHALK STICKS,36,0.42,15754.0,United Kingdom,2025-08-28
498716,22340,NOEL GARLAND PAINTED ZINC ,12,1.65,15754.0,United Kingdom,2025-08-28
498716,22151,PLACE SETTING WHITE HEART,24,0.42,15754.0,United Kingdom,2025-08-28
498716,21661,VINTAGE GLASS TEA CADDY,3,5.95,15754.0,United Kingdom,2025-08-28
498716,21663,VINTAGE GLASS SUGAR CADDY,3,5.95,15754.0,United Kingdom,2025-08-28
498716,21662,VINTAGE GLASS COFFEE CADDY,3,5.95,15754.0,United Kingdom,2025-08-28
498716,85123A,WHITE HANGING HEART T-LIGHT HOLDER,12,2.95,15754.0,United Kingdom,2025-08-28
498716,21214,SET OF 72 IVORY PAPER DOILIES,12,1.45,15754.0,United Kingdom,2025-08-28
498716,21777,RECIPE BOX WITH METAL HEART,2,7.95,15754.0,United Kingdom,2025-08-28
498716,21781,MA CAMPAGNE CUTLERY BOX,2,14.95,15754.0,United Kingdom,2025-08-28
498716,21122,SET/10 PINK SPOTTY PARTY CANDLES,24,1.25,15754.0,United Kingdom,2025-08-28
498716,22153,ANGEL DECORATION STARS ON DRESS,48,0.42,15754.0,United Kingdom,2025-08-28
498716,21121,SET/10 RED SPOTTY PARTY CANDLES,24,1.25,15754.0,United Kingdom,2025-08-28
498716,21124,SET/10 BLUE SPOTTY PARTY CANDLES,24,1.25,15754.0,United Kingdom,2025-08-28
498716,22413,METAL SIGN TAKE IT OR LEAVE IT ,6,2.95,15754.0,United Kingdom,2025-08-28
498716,21166,COOK WITH WINE METAL SIGN ,12,1.95,15754.0,United Kingdom,2025-08-28
498716,22117,METAL SIGN HER DINNER IS SERVED ,6,2.95,15754.0,United Kingdom,2025-08-28
498716,22115,METAL SIGN EMPIRE TEA,6,2.95,15754.0,United Kingdom,2025-08-28
498716,21977,PACK OF 60 PINK PAISLEY CAKE CASES,36,0.55,15754.0,United Kingdom,2025-08-28
498716,82600,NO SINGING METAL SIGN,12,2.1,15754.0,United Kingdom,2025-08-28
498716,21907,I'M ON HOLIDAY METAL SIGN,6,2.1,15754.0,United Kingdom,2025-08-28
