Invoice,StockCode,Description,Quantity,Price,Customer ID,Country,InvoiceDate
516147,22622,BOX OF VINTAGE ALPHABET BLOCKS,3,9.95,17243.0,United Kingdom,2025-12-26
516147,22470,HEART OF WICKER LARGE,4,2.95,17243.0,United Kingdom,2025-12-26
516147,82486,WOOD S/3 CABINET ANT WHITE FINISH,2,7.95,17243.0,United Kingdom,2025-12-26
516147,75013B,"STRING OF 8 BUTTERFLIES,PINK",4,1.65,17243.0,United Kingdom,2025-12-26
516147,22423,REGENCY CAKESTAND 3 TIER,3,12.75,17243.0,United Kingdom,2025-12-26
516147,84802A,WHITE ANEMONE ARTIFICIAL FLOWER,2,1.69,17243.0,United Kingdom,2025-12-26
516147,84802B,PURPLE ANEMONE ARTIFICIAL FLOWER,2,1.69,17243.0,United Kingdom,2025-12-26
516147,22427,ENAMEL FLOWER JUG CREAM,2,5.95,17243.0,United Kingdom,2025-12-26
C516149,35924,HANGING FAIRY CAKE DECORATION,-3,2.1,13798.0,United Kingdom,2025-12-26
C516149,21080,SET/20 RED SPOTTY PAPER NAPKINS ,-1,0.85,13798.0,United Kingdom,2025-12-26
516148,22026,BANQUET BIRTHDAY  CARD  ,12,0.42,18021.0,United Kingdom,2025-12-26
516148,37370,RETRO COFFEE MUGS ASSORTED,6,1.25,18021.0,United Kingdom,2025-12-26
516148,22613,PACK OF 20 SPACEBOY NAPKINS,2,0.85,18021.0,United Kingdom,2025-12-26
516148,21989,PACK OF 20 SKULL PAPER NAPKINS,2,0.85,18021.0,United Kingdom,2025-12-26
516148,21082,SET/20 FRUIT SALAD PAPER NAPKINS ,2,0.85,18021.0,United Kingdom,2025-12-26
516148,21080,SET/20 RED SPOTTY PAPER NAPKINS ,2,0.85,18021.0,United Kingdom,2025-12-26
516148,21121,SET/10 RED SPOTTY PARTY CANDLES,24,1.25,18021.0,United Kingdom,2025-12-26
516148,47589,CONGRATULATIONS BUNTING,2,5.45,18021.0,United Kingdom,2025-12-26
516148,21503,TOYBOX  WRAP ,25,0.42,18021.0,United Kingdom,2025-12-26
516148,21497,FANCY FONTS BIRTHDAY WRAP,25,0.42,18021.0,United Kingdom,2025-12-26
516148,84803A,PINK ALLIUM  ARTIFICIAL FLOWER,3,1.69,18021.0,United Kingdom,2025-12-26
516148,47591B,SCOTTIES CHILDRENS APRON,3,1.65,18021.0,United Kingdom,2025-12-26
516148,21156,RETROSPOT CHILDRENS APRON,3,1.95,18021.0,United Kingdom,2025-12-26
516148,21955,DOORMAT UNION JACK GUNS AND ROSES,1,7.49,18021.0,United Kingdom,2025-12-26
C516149,21928,JUMBO BAG SCANDINAVIAN PAISLEY,-1,1.95,13798.0,United Kingdom,2025-12-26
516148,21077,SET/20 WOODLAND PAPER NAPKINS ,2,0.85,18021.0,United Kingdom,2025-12-26
C516149,20727,LUNCH BAG  BLACK SKULL.,-4,1.65,13798.0,United Kingdom,2025-12-26
516148,84803B,WHITE ALLIUM  ARTIFICIAL FLOWER,3,1.69,18021.0,United Kingdom,2025-12-26
C516149,85123A,WHITE HANGING HEART T-LIGHT HOLDER,-1,2.95,13798.0,United Kingdom,2025-12-26
C516149,37449,CERAMIC CAKE STAND + HANGING CAKES,-4,9.95,13798.0,United Kingdom,2025-12-26
C516149,22064,PINK DOUGHNUT TRINKET POT ,-8,1.65,13798.0,United Kingdom,2025-12-26
C516149,20724,RED SPOTTY CHARLOTTE BAG,-3,0.85,13798.0,United Kingdom,2025-12-26
C516149,21936,RED RETROSPOT PICNIC BAG,-1,2.95,13798.0,United Kingdom,2025-12-26
C516149,20723,STRAWBERRY CHARLOTTE BAG,-1,0.85,13798.0,United Kingdom,2025-12-26
C516149,21927,BLUE/CREAM STRIPE CUSHION COVER ,-1,1.25,13798.0,United Kingdom,2025-12-26
C516149,85099F,JUMBO BAG STRAWBERRY,-4,1.95,13798.0,United Kingdom,2025-12-26
C516149,21232,STRAWBERRY CERAMIC TRINKET BOX,-3,1.25,13798.0,United Kingdom,2025-12-26
C516149,20725,LUNCH BAG RED SPOTTY,-5,1.65,13798.0,United Kingdom,2025-12-26
516148,84249D,FAIRY CAKE GREETINGS CARD,12,0.42,18021.0,United Kingdom,2025-12-26
C516149,21843,RED RETROSPOT CAKE STAND,-5,10.95,13798.0,United Kingdom,2025-12-26
C516149,37446,MINI CAKE STAND WITH HANGING CAKES,-4,1.45,13798.0,United Kingdom,2025-12-26
C516149,37450,CERAMIC CAKE BOWL + HANGING CAKES,-4,2.95,13798.0,United Kingdom,2025-12-26
C516149,21166,COOK WITH WINE METAL SIGN ,-1,1.95,13798.0,United Kingdom,2025-12-26
C516149,20903,VINTAGE KEEPSAKE BOX TRAVELOGUE,-1,6.35,13798.0,United Kingdom,2025-12-26
C516149,82578,KITCHEN METAL SIGN,-1,0.55,13798.0,United Kingdom,2025-12-26
C516149,21169,YOU'RE CONFUSING ME METAL SIGN ,-1,1.69,13798.0,United Kingdom,2025-12-26
C516149,21231,SWEETHEART CERAMIC TRINKET BOX,-8,1.25,13798.0,United Kingdom,2025-12-26
516150,21519,GIN & TONIC DIET GREETING CARD ,12,0.42,13542.0,United Kingdom,2025-12-26
516150,22059,CERAMIC STRWBERRY DESIGN MUG,1,1.49,13542.0,United Kingdom,2025-12-26
516150,22059,CERAMIC STRWBERRY DESIGN MUG,1,1.49,13542.0,United Kingdom,2025-12-26
516150,22063,CERAMIC BOWL WITH STRAWBERRY DESIGN,1,2.95,13542.0,United Kingdom,2025-12-26
516150,22055,MINI CAKE STAND  HANGING STRAWBERY,2,1.65,13542.0,United Kingdom,2025-12-26
516150,85099B,JUMBO BAG RED RETROSPOT,2,1.95,13542.0,United Kingdom,2025-12-26
516150,22384,LUNCH BAG PINK RETROSPOT,4,1.65,13542.0,United Kingdom,2025-12-26
516150,22386,JUMBO BAG PINK WITH WHITE SPOTS,2,1.95,13542.0,United Kingdom,2025-12-26
516150,85099C,JUMBO  BAG BAROQUE BLACK WHITE,2,1.95,13542.0,United Kingdom,2025-12-26
516150,21518,BANK ACCOUNT  GREETING  CARD ,12,0.42,13542.0,United Kingdom,2025-12-26
516150,22064,PINK DOUGHNUT TRINKET POT ,2,1.65,13542.0,United Kingdom,2025-12-26
516150,48129,DOORMAT TOPIARY,2,7.49,13542.0,United Kingdom,2025-12-26
516150,48184,DOORMAT ENGLISH ROSE ,2,7.49,13542.0,United Kingdom,2025-12-26
516150,21524,DOORMAT SPOTTY HOME SWEET HOME,4,7.49,13542.0,United Kingdom,2025-12-26
516150,22690,DOORMAT HOME SWEET HOME BLUE ,1,7.49,13542.0,United Kingdom,2025-12-26
516150,48194,DOORMAT HEARTS,1,7.49,13542.0,United Kingdom,2025-12-26
516150,21523,DOORMAT FANCY FONT HOME SWEET HOME,1,7.49,13542.0,United Kingdom,2025-12-26
516150,48173C,DOORMAT BLACK FLOCK ,2,7.49,13542.0,United Kingdom,2025-12-26
516150,21955,DOORMAT UNION JACK GUNS AND ROSES,1,7.49,13542.0,United Kingdom,2025-12-26
516150,48185,DOORMAT FAIRY CAKE,3,7.49,13542.0,United Kingdom,2025-12-26
516150,22691,DOORMAT WELCOME SUNRISE,1,7.49,13542.0,United Kingdom,2025-12-26
516150,22660,DOORMAT I LOVE LONDON,1,7.49,13542.0,United Kingdom,2025-12-26
516150,48116,DOORMAT MULTICOLOUR STRIPE,2,7.49,13542.0,United Kingdom,2025-12-26
516150,48187,DOORMAT NEW ENGLAND,2,7.49,13542.0,United Kingdom,2025-12-26
516150,48111,DOORMAT 3 SMILEY CATS,3,7.49,13542.0,United Kingdom,2025-12-26
516151,22469,HEART OF WICKER SMALL,12,1.65,15938.0,United Kingdom,2025-12-26
516151,21135,VICTORIAN  METAL POSTCARD SPRING,8,1.69,15938.0,United Kingdom,2025-12-26
516151,22668,PINK BABY BUNTING,5,2.95,15938.0,United Kingdom,2025-12-26
516151,71053,WHITE METAL LANTERN,4,3.75,15938.0,United Kingdom,2025-12-26
516151,82482,WOODEN PICTURE FRAME WHITE FINISH,6,2.55,15938.0,United Kingdom,2025-12-26
516151,84970S,HANGING HEART ZINC T-LIGHT HOLDER,12,0.85,15938.0,United Kingdom,2025-12-26
516152,22080,RIBBON REEL SPOTS DESIGN ,10,1.65,16344.0,United Kingdom,2025-12-26
516152,22156,HEART DECORATION WITH PEARLS ,24,0.85,16344.0,United Kingdom,2025-12-26
516152,22130,PARTY CONE CHRISTMAS DECORATION ,24,0.85,16344.0,United Kingdom,2025-12-26
516152,22082,RIBBON REEL STRIPES DESIGN ,10,1.65,16344.0,United Kingdom,2025-12-26
516152,21819,GLITTER CHRISTMAS STAR ,12,0.85,16344.0,United Kingdom,2025-12-26
516152,22151,PLACE SETTING WHITE HEART,24,0.42,16344.0,United Kingdom,2025-12-26
516152,21820,GLITTER HEART GARLAND WITH BELLS ,6,3.75,16344.0,United Kingdom,2025-12-26
516152,21821,GLITTER STAR GARLAND WITH BELLS ,6,3.75,16344.0,United Kingdom,2025-12-26
516152,22574,HEART WOODEN CHRISTMAS DECORATION,12,0.85,16344.0,United Kingdom,2025-12-26
516152,22576,SWALLOW WOODEN CHRISTMAS DECORATION,12,0.85,16344.0,United Kingdom,2025-12-26
516152,21818,GLITTER CHRISTMAS HEART ,12,0.85,16344.0,United Kingdom,2025-12-26
516152,22152,PLACE SETTING WHITE STAR,24,0.42,16344.0,United Kingdom,2025-12-26
516152,35958,FOLKART ZINC STAR CHRISTMAS DEC,12,0.85,16344.0,United Kingdom,2025-12-26
516152,22594,CHRISTMAS GINGHAM TREE,24,0.85,16344.0,United Kingdom,2025-12-26
516152,22573,STAR WOODEN CHRISTMAS DECORATION,12,0.85,16344.0,United Kingdom,2025-12-26
516152,22581,WOOD STOCKING CHRISTMAS SCANDISPOT,24,0.85,16344.0,United Kingdom,2025-12-26
516152,22579,WOODEN TREE CHRISTMAS SCANDINAVIAN,24,0.85,16344.0,United Kingdom,2025-12-26
516152,22578,WOODEN STAR CHRISTMAS SCANDINAVIAN,24,0.85,16344.0,United Kingdom,2025-12-26
516152,22577,WOODEN HEART CHRISTMAS SCANDINAVIAN,24,0.85,16344.0,United Kingdom,2025-12-26
516152,22593,CHRISTMAS GINGHAM STAR,24,0.85,16344.0,United Kingdom,2025-12-26
516152,22602,CHRISTMAS RETROSPOT HEART WOOD,24,0.85,16344.0,United Kingdom,2025-12-26
516152,22601,CHRISTMAS RETROSPOT ANGEL WOOD,24,0.85,16344.0,United Kingdom,2025-12-26
516152,22600,CHRISTMAS RETROSPOT STAR WOOD,24,0.85,16344.0,United Kingdom,2025-12-26
516152,22595,CHRISTMAS GINGHAM HEART,24,0.85,16344.0,United Kingdom,2025-12-26
516152,22603,CHRISTMAS RETROSPOT TREE WOOD,24,0.85,16344.0,United Kingdom,2025-12-26
516153,20914,SET/5 RED SPOTTY LID GLASS BOWLS,32,2.55,13798.0,United Kingdom,2025-12-26
516153,72598,SET/12 TAPER CANDLES,1,0.85,13798.0,United Kingdom,2025-12-26
516153,22473,TV DINNER TRAY VINTAGE PAISLEY,1,4.95,13798.0,United Kingdom,2025-12-26
516153,37450,CERAMIC CAKE BOWL + HANGING CAKES,36,2.55,13798.0,United Kingdom,2025-12-26
516153,22064,PINK DOUGHNUT TRINKET POT ,48,1.45,13798.0,United Kingdom,2025-12-26
516153,21232,STRAWBERRY CERAMIC TRINKET BOX,144,1.06,13798.0,United Kingdom,2025-12-26
516153,21231,SWEETHEART CERAMIC TRINKET BOX,144,1.06,13798.0,United Kingdom,2025-12-26
516153,20671,BLUE TEATIME PRINT BOWL ,72,1.06,13798.0,United Kingdom,2025-12-26
516153,35924,HANGING FAIRY CAKE DECORATION,120,1.69,13798.0,United Kingdom,2025-12-26
516153,37449,CERAMIC CAKE STAND + HANGING CAKES,12,8.5,13798.0,United Kingdom,2025-12-26
516153,21035,SET/2 RED SPOTTY TEA TOWELS ,200,2.55,13798.0,United Kingdom,2025-12-26
516153,47559B,TEA TIME OVEN GLOVE,50,1.06,13798.0,United Kingdom,2025-12-26
516153,20685,DOORMAT RED SPOT,20,6.35,13798.0,United Kingdom,2025-12-26
516153,21080,SET/20 RED SPOTTY PAPER NAPKINS ,96,0.64,13798.0,United Kingdom,2025-12-26
516153,84380,SET OF 3 BUTTERFLY COOKIE CUTTERS,144,1.06,13798.0,United Kingdom,2025-12-26
516153,82599,FANNY'S REST STOPMETAL SIGN,48,1.69,13798.0,United Kingdom,2025-12-26
516153,82581,TOILET METAL SIGN,250,0.42,13798.0,United Kingdom,2025-12-26
516153,21936,RED RETROSPOT PICNIC BAG,50,2.55,13798.0,United Kingdom,2025-12-26
516153,82551,LAUNDRY 15C METAL SIGN,96,1.06,13798.0,United Kingdom,2025-12-26
516153,85099B,JUMBO BAG RED RETROSPOT,100,1.65,13798.0,United Kingdom,2025-12-26
516153,20725,LUNCH BAG RED SPOTTY,100,1.45,13798.0,United Kingdom,2025-12-26
516153,48185,DOORMAT FAIRY CAKE,20,6.35,13798.0,United Kingdom,2025-12-26
516153,21937,STRAWBERRY   PICNIC BAG,50,2.55,13798.0,United Kingdom,2025-12-26
516154,21584,RETRO SPOT SMALL TUBE MATCHES,1,1.65,17541.0,United Kingdom,2025-12-26
516154,22628,PICNIC BOXES SET OF 3 RETROSPOT ,1,4.95,17541.0,United Kingdom,2025-12-26
516154,21115,ROSE CARAVAN DOORSTOP,1,6.75,17541.0,United Kingdom,2025-12-26
516154,22528,GARDENERS KNEELING PAD,1,1.25,17541.0,United Kingdom,2025-12-26
516154,21888,BINGO SET,1,3.75,17541.0,United Kingdom,2025-12-26
516154,84673B,BLUE FLY SWAT,1,0.65,17541.0,United Kingdom,2025-12-26
516154,22384,LUNCH BAG PINK RETROSPOT,1,1.65,17541.0,United Kingdom,2025-12-26
516154,84997C,BLUE 3 PIECE MINI DOTS CUTLERY SET,1,3.75,17541.0,United Kingdom,2025-12-26
516154,22318,FIVE HEART HANGING DECORATION,1,2.95,17541.0,United Kingdom,2025-12-26
516154,22501,PICNIC BASKET WICKER LARGE,1,9.95,17541.0,United Kingdom,2025-12-26
516154,21121,SET/10 RED SPOTTY PARTY CANDLES,1,1.25,17541.0,United Kingdom,2025-12-26
516154,22629,SPACEBOY LUNCH BOX ,1,1.95,17541.0,United Kingdom,2025-12-26
516154,22328,ROUND SNACK BOXES SET OF 4 FRUITS ,1,2.95,17541.0,United Kingdom,2025-12-26
516154,90124B,BLUE MURANO TWIST NECKLACE,2,9.95,17541.0,United Kingdom,2025-12-26
516154,22464,HANGING METAL HEART LANTERN,1,1.65,17541.0,United Kingdom,2025-12-26
516154,90124C,GREEN MURANO TWIST NECKLACE,1,9.95,17541.0,United Kingdom,2025-12-26
516154,22328,ROUND SNACK BOXES SET OF 4 FRUITS ,1,2.95,17541.0,United Kingdom,2025-12-26
516154,22349,DOG BOWL CHASING BALL DESIGN,1,3.75,17541.0,United Kingdom,2025-12-26
516154,22502,PICNIC BASKET WICKER SMALL,1,4.25,17541.0,United Kingdom,2025-12-26
516154,22386,JUMBO BAG PINK WITH WHITE SPOTS,2,1.95,17541.0,United Kingdom,2025-12-26
516154,21210,SET OF 72 RETRO SPOT PAPER  DOILIES,1,1.45,17541.0,United Kingdom,2025-12-26
516154,84987,SET OF 36 TEATIME PAPER DOILIES,1,1.45,17541.0,United Kingdom,2025-12-26
516154,21590,KINGS CHOICE CIGAR BOX MATCHES ,1,1.25,17541.0,United Kingdom,2025-12-26
516154,84991,60 TEATIME FAIRY CAKE CASES,1,0.55,17541.0,United Kingdom,2025-12-26
516154,48188,DOORMAT WELCOME PUPPIES,1,7.49,17541.0,United Kingdom,2025-12-26
516154,22557,PLASTERS IN TIN VINTAGE PAISLEY ,1,1.65,17541.0,United Kingdom,2025-12-26
516154,84789,ENCHANTED BIRD PLANT CAGE,1,3.75,17541.0,United Kingdom,2025-12-26
516154,21584,RETRO SPOT SMALL TUBE MATCHES,1,1.65,17541.0,United Kingdom,2025-12-26
516154,21124,SET/10 BLUE SPOTTY PARTY CANDLES,1,1.25,17541.0,United Kingdom,2025-12-26
516154,21122,SET/10 PINK SPOTTY PARTY CANDLES,1,1.25,17541.0,United Kingdom,2025-12-26
516154,22630,DOLLY GIRL LUNCH BOX,1,1.95,17541.0,United Kingdom,2025-12-26
516154,22616,PACK OF 12 LONDON TISSUES ,12,0.29,17541.0,United Kingdom,2025-12-26
516154,48194,DOORMAT HEARTS,1,7.49,17541.0,United Kingdom,2025-12-26
516155,37503,TEA TIME CAKE STAND IN GIFT BOX,1,10.75,12748.0,United Kingdom,2025-12-26
516155,72760B,VINTAGE CREAM 3 BASKET CAKE STAND,1,9.95,12748.0,United Kingdom,2025-12-26
516155,22275,WEEKEND BAG VINTAGE ROSE PAISLEY,1,8.5,12748.0,United Kingdom,2025-12-26
516155,85065,CREAM SWEETHEART TRAYS,1,12.75,12748.0,United Kingdom,2025-12-26
516155,22276,WASH BAG VINTAGE ROSE PAISLEY,2,2.55,12748.0,United Kingdom,2025-12-26
516155,21931,JUMBO STORAGE BAG SUKI,2,1.95,12748.0,United Kingdom,2025-12-26
516155,22198,LARGE POPCORN HOLDER ,1,1.65,12748.0,United Kingdom,2025-12-26
516155,21929,JUMBO BAG PINK VINTAGE PAISLEY,1,1.95,12748.0,United Kingdom,2025-12-26
516156,21086,SET/6 RED SPOTTY PAPER CUPS,12,0.65,14205.0,United Kingdom,2025-12-26
516156,22090,PAPER BUNTING RETRO SPOTS,6,2.95,14205.0,United Kingdom,2025-12-26
516156,22089,PAPER BUNTING VINTAGE PAISLEY,6,2.95,14205.0,United Kingdom,2025-12-26
516156,47590B,PINK HAPPY BIRTHDAY BUNTING,3,5.45,14205.0,United Kingdom,2025-12-26
516156,22668,PINK BABY BUNTING,5,2.95,14205.0,United Kingdom,2025-12-26
516155,22386,JUMBO BAG PINK WITH WHITE SPOTS,1,1.95,12748.0,United Kingdom,2025-12-26
516155,22457,NATURAL SLATE HEART CHALKBOARD ,2,2.95,12748.0,United Kingdom,2025-12-26
516155,84993A,75 GREEN PETIT FOUR CASES,3,0.42,12748.0,United Kingdom,2025-12-26
516155,84989A,75 GREEN FAIRY CAKE CASES,2,0.55,12748.0,United Kingdom,2025-12-26
516155,47591D,PINK FAIRY CAKE CHILDRENS APRON,6,1.95,12748.0,United Kingdom,2025-12-26
516156,22423,REGENCY CAKESTAND 3 TIER,16,10.95,14205.0,United Kingdom,2025-12-26
516156,21528,DAIRY MAID TRADITIONAL TEAPOT ,2,6.95,14205.0,United Kingdom,2025-12-26
516156,21527,RED RETROSPOT TRADITIONAL TEAPOT ,2,7.95,14205.0,United Kingdom,2025-12-26
516156,37500,TEA TIME TEAPOT IN GIFT BOX,2,9.95,14205.0,United Kingdom,2025-12-26
516156,21094,SET/6 RED SPOTTY PAPER PLATES,12,0.85,14205.0,United Kingdom,2025-12-26
516155,22411,JUMBO SHOPPER VINTAGE RED PAISLEY,2,1.95,12748.0,United Kingdom,2025-12-26
516155,22223,CAKE PLATE LOVEBIRD PINK,2,4.95,12748.0,United Kingdom,2025-12-26
516155,84985A,SET OF 72 GREEN PAPER DOILIES,1,1.45,12748.0,United Kingdom,2025-12-26
516155,22222,CAKE PLATE LOVEBIRD WHITE,2,4.95,12748.0,United Kingdom,2025-12-26
516155,21124,SET/10 BLUE SPOTTY PARTY CANDLES,5,1.25,12748.0,United Kingdom,2025-12-26
516155,22456,NATURAL SLATE CHALKBOARD LARGE ,1,4.95,12748.0,United Kingdom,2025-12-26
516155,21122,SET/10 PINK SPOTTY PARTY CANDLES,5,1.25,12748.0,United Kingdom,2025-12-26
516155,22215,CAKE STAND WHITE TWO TIER LACE,1,8.5,12748.0,United Kingdom,2025-12-26
516157,21871,SAVE THE PLANET MUG,2,1.25,17261.0,United Kingdom,2025-12-26
516157,21877,HOME SWEET HOME MUG,2,1.25,17261.0,United Kingdom,2025-12-26
516157,85132A,CHARLIE + LOLA BISCUITS TINS,1,9.95,17261.0,United Kingdom,2025-12-26
516157,85123A,WHITE HANGING HEART T-LIGHT HOLDER,3,2.95,17261.0,United Kingdom,2025-12-26
516157,21733,RED HANGING HEART T-LIGHT HOLDER,2,2.95,17261.0,United Kingdom,2025-12-26
516157,22382,LUNCH BAG SPACEBOY DESIGN ,2,1.65,17261.0,United Kingdom,2025-12-26
516157,20914,SET/5 RED SPOTTY LID GLASS BOWLS,1,2.95,17261.0,United Kingdom,2025-12-26
516157,21949,SET OF 6 STRAWBERRY CHOPSTICKS,3,1.25,17261.0,United Kingdom,2025-12-26
516157,84519A,TOMATO CHARLIE+LOLA COASTER SET,2,2.95,17261.0,United Kingdom,2025-12-26
516157,22562,MONSTERS STENCIL CRAFT,3,1.25,17261.0,United Kingdom,2025-12-26
516157,21327,SKULLS WRITING SET ,3,1.65,17261.0,United Kingdom,2025-12-26
516157,21069,VINTAGE BILLBOARD TEA MUG,1,1.25,17261.0,United Kingdom,2025-12-26
516157,85132B,CHARLIE AND LOLA TABLE TINS,1,9.95,17261.0,United Kingdom,2025-12-26
516157,21067,VINTAGE RED TEATIME MUG,1,1.25,17261.0,United Kingdom,2025-12-26
516158,21009,ETCHED GLASS STAR TREE DECORATION,36,1.25,16950.0,United Kingdom,2025-12-26
516158,22508,DOORSTOP RETROSPOT HEART,4,3.75,16950.0,United Kingdom,2025-12-26
516158,21825,PAINTED METAL TREE WITH HOLLY BELLS,24,1.45,16950.0,United Kingdom,2025-12-26
516158,84836,ZINC METAL HEART DECORATION,12,1.25,16950.0,United Kingdom,2025-12-26
516158,21823,PAINTED METAL HEART WITH HOLLY BELL,24,1.45,16950.0,United Kingdom,2025-12-26
516158,21824,PAINTED METAL STAR WITH HOLLY BELLS,24,1.45,16950.0,United Kingdom,2025-12-26
516157,21330,WOODLAND ANIMAL  WRITING SET ,3,1.65,17261.0,United Kingdom,2025-12-26
516158,84949,SILVER HANGING T-LIGHT HOLDER,12,1.65,16950.0,United Kingdom,2025-12-26
516158,21143,ANTIQUE GLASS HEART DECORATION ,12,1.95,16950.0,United Kingdom,2025-12-26
516158,21143,ANTIQUE GLASS HEART DECORATION ,12,1.95,16950.0,United Kingdom,2025-12-26
516158,84754,S/15 SILVER GLASS BAUBLES IN BAG,48,1.25,16950.0,United Kingdom,2025-12-26
516158,22585,PACK OF 6 BIRDY GIFT TAGS,6,1.25,16950.0,United Kingdom,2025-12-26
516158,22595,CHRISTMAS GINGHAM HEART,48,0.85,16950.0,United Kingdom,2025-12-26
516158,M,Manual,8,1.0,16950.0,United Kingdom,2025-12-26
516158,35981C,WHITE SNOW SCANDINAVIAN STOCKING ,60,0.38,16950.0,United Kingdom,2025-12-26
516157,21328,BALLOONS  WRITING SET ,3,1.65,17261.0,United Kingdom,2025-12-26
516157,22272,FELTCRAFT DOLL MARIA,1,2.95,17261.0,United Kingdom,2025-12-26
516157,22273,FELTCRAFT DOLL MOLLY,1,2.95,17261.0,United Kingdom,2025-12-26
516157,21071,VINTAGE BILLBOARD DRINK ME MUG,1,1.25,17261.0,United Kingdom,2025-12-26
516157,37461,FUNKY MONKEY MUG,3,1.25,17261.0,United Kingdom,2025-12-26
516157,84997C,BLUE 3 PIECE MINI DOTS CUTLERY SET,16,3.75,17261.0,United Kingdom,2025-12-26
516157,22195,LARGE HEART MEASURING SPOONS,2,1.65,17261.0,United Kingdom,2025-12-26
516157,48173C,DOORMAT BLACK FLOCK ,1,7.49,17261.0,United Kingdom,2025-12-26
516157,22352,LUNCH BOX WITH CUTLERY RETROSPOT ,1,2.55,17261.0,United Kingdom,2025-12-26
516157,21561,DINOSAUR LUNCH BOX WITH CUTLERY,1,2.55,17261.0,United Kingdom,2025-12-26
516157,22629,SPACEBOY LUNCH BOX ,2,1.95,17261.0,United Kingdom,2025-12-26
516157,20970,PINK FLORAL FELTCRAFT SHOULDER BAG,1,3.75,17261.0,United Kingdom,2025-12-26
516157,82482,WOODEN PICTURE FRAME WHITE FINISH,2,2.55,17261.0,United Kingdom,2025-12-26
516157,84985A,SET OF 72 GREEN PAPER DOILIES,1,1.45,17261.0,United Kingdom,2025-12-26
516157,21210,SET OF 72 RETRO SPOT PAPER  DOILIES,1,1.45,17261.0,United Kingdom,2025-12-26
516157,22528,GARDENERS KNEELING PAD,2,1.25,17261.0,United Kingdom,2025-12-26
516157,85227,SET OF 6 3D KIT CARDS FOR KIDS,3,0.85,17261.0,United Kingdom,2025-12-26
516157,21972,SET OF 36 DINOSAUR PAPER DOILIES,1,1.45,17261.0,United Kingdom,2025-12-26
516157,22454,MEASURING TAPE RUSSIAN DOLL RED,3,2.95,17261.0,United Kingdom,2025-12-26
516157,22429,ENAMEL MEASURING JUG CREAM,1,4.25,17261.0,United Kingdom,2025-12-26
516157,22352,LUNCH BOX WITH CUTLERY RETROSPOT ,1,2.55,17261.0,United Kingdom,2025-12-26
516157,22570,FELTCRAFT CUSHION RABBIT,1,3.75,17261.0,United Kingdom,2025-12-26
516157,20971,PINK BLUE FELT CRAFT TRINKET BOX,2,1.25,17261.0,United Kingdom,2025-12-26
516157,22561,WOODEN SCHOOL COLOURING SET,4,1.65,17261.0,United Kingdom,2025-12-26
516157,22565,FELTCRAFT HAIRBANDS PINK AND WHITE ,4,0.85,17261.0,United Kingdom,2025-12-26
516157,84992,72 SWEETHEART FAIRY CAKE CASES,1,0.55,17261.0,United Kingdom,2025-12-26
516157,21213,PACK OF 72 SKULL CAKE CASES,1,0.55,17261.0,United Kingdom,2025-12-26
516157,21390,FILIGRIS HEART WITH BUTTERFLY,4,1.25,17261.0,United Kingdom,2025-12-26
516157,20970,PINK FLORAL FELTCRAFT SHOULDER BAG,1,3.75,17261.0,United Kingdom,2025-12-26
516157,21561,DINOSAUR LUNCH BOX WITH CUTLERY,1,2.55,17261.0,United Kingdom,2025-12-26
516157,84989A,75 GREEN FAIRY CAKE CASES,1,0.55,17261.0,United Kingdom,2025-12-26
C516159,M,Manual,-8,1.0,16950.0,United Kingdom,2025-12-26
516160,84520B,PACK 20 ENGLISH ROSE PAPER NAPKINS,12,0.85,,EIRE,2025-12-26
516160,22178,VICTORIAN GLASS HANGING T-LIGHT,24,1.25,,EIRE,2025-12-26
516160,79000,MOROCCAN TEA GLASS,12,0.85,,EIRE,2025-12-26
516160,22172,METAL SHELF WITH RAIL ,2,8.5,,EIRE,2025-12-26
516160,72760B,VINTAGE CREAM 3 BASKET CAKE STAND,2,9.95,,EIRE,2025-12-26
516160,22424,ENAMEL BREAD BIN CREAM,2,12.75,,EIRE,2025-12-26
516160,22082,RIBBON REEL STRIPES DESIGN ,120,1.45,,EIRE,2025-12-26
516160,21465,PINK FLOWER CROCHET FOOD COVER,6,3.75,,EIRE,2025-12-26
516160,84840,SWEETHEART CARRY-ALL BASKET,2,8.5,,EIRE,2025-12-26
516160,21470,FLOWER VINE RAFFIA FOOD COVER,6,3.75,,EIRE,2025-12-26
516160,21078,SET/20 STRAWBERRY PAPER NAPKINS ,12,0.85,,EIRE,2025-12-26
516160,21974,SET OF 36 PAISLEY FLOWER DOILIES,12,1.45,,EIRE,2025-12-26
516160,22423,REGENCY CAKESTAND 3 TIER,4,12.75,,EIRE,2025-12-26
516160,85232B,SET/3 RUSSIAN DOLL STACKING TINS,3,4.95,,EIRE,2025-12-26
516160,21977,PACK OF 60 PINK PAISLEY CAKE CASES,24,0.55,,EIRE,2025-12-26
516160,15056N,EDWARDIAN PARASOL NATURAL,3,5.95,,EIRE,2025-12-26
516160,22149,FELTCRAFT 6 FLOWER FRIENDS,6,2.1,,EIRE,2025-12-26
516160,47591D,PINK FAIRY CAKE CHILD'S APRON,8,1.95,,EIRE,2025-12-26
516160,47590B,PINK HAPPY BIRTHDAY BUNTING,3,5.45,,EIRE,2025-12-26
516160,C2,CARRIAGE,1,50.0,,EIRE,2025-12-26
516161,21781,MA CAMPAGNE CUTLERY BOX,2,14.95,14563.0,United Kingdom,2025-12-26
516161,21781,MA CAMPAGNE CUTLERY BOX,1,14.95,14563.0,United Kingdom,2025-12-26
516161,22483,RED GINGHAM TEDDY BEAR ,2,2.95,14563.0,United Kingdom,2025-12-26
516161,21747,SMALL SKULL WINDMILL,1,1.25,14563.0,United Kingdom,2025-12-26
516161,22507,MEMO BOARD RETROSPOT  DESIGN,1,4.95,14563.0,United Kingdom,2025-12-26
516161,22667,RECIPE BOX RETRO SPOT DESIGN,1,2.95,14563.0,United Kingdom,2025-12-26
516161,22666,RECIPE BOX PANTRY YELLOW DESIGN,1,2.95,14563.0,United Kingdom,2025-12-26
516161,20749,ASSORTED COLOUR MINI CASES,1,7.95,14563.0,United Kingdom,2025-12-26
516161,22040,BOTANICAL ROSE GIFT WRAP,25,0.42,14563.0,United Kingdom,2025-12-26
516161,21746,SMALL RED RETROSPOT WINDMILL,1,1.25,14563.0,United Kingdom,2025-12-26
516161,21218,RED SPOTTY BISCUIT TIN,1,3.75,14563.0,United Kingdom,2025-12-26
516161,21746,SMALL RED RETROSPOT WINDMILL,1,1.25,14563.0,United Kingdom,2025-12-26
516161,21747,SMALL SKULL WINDMILL,1,1.25,14563.0,United Kingdom,2025-12-26
516161,21054,NURSE'S BAG SOFT TOY,1,8.95,14563.0,United Kingdom,2025-12-26
516161,22627,MINT KITCHEN SCALES,1,8.5,14563.0,United Kingdom,2025-12-26
516161,22700,BLACK AND WHITE DOG BOWL,1,2.95,14563.0,United Kingdom,2025-12-26
516161,22701,PINK DOG BOWL,1,2.95,14563.0,United Kingdom,2025-12-26
516161,22702,BLACK AND WHITE CAT BOWL,2,2.1,14563.0,United Kingdom,2025-12-26
516161,22625,RED KITCHEN SCALES,1,8.5,14563.0,United Kingdom,2025-12-26
516161,22138,BAKING SET 9 PIECE RETROSPOT ,1,4.95,14563.0,United Kingdom,2025-12-26
516161,21056,DOCTOR'S BAG SOFT TOY,1,8.95,14563.0,United Kingdom,2025-12-26
516161,21432,SET OF 3 CASES WOODLAND DESIGN,1,5.95,14563.0,United Kingdom,2025-12-26
516161,22505,MEMO BOARD COTTAGE DESIGN,1,4.95,14563.0,United Kingdom,2025-12-26
516162,21390,FILIGRIS HEART WITH BUTTERFLY,1,1.25,14553.0,United Kingdom,2025-12-26
516162,22195,LARGE HEART MEASURING SPOONS,2,1.65,14553.0,United Kingdom,2025-12-26
516162,22196,SMALL HEART MEASURING SPOONS,3,0.85,14553.0,United Kingdom,2025-12-26
516162,22613,PACK OF 20 SPACEBOY NAPKINS,2,0.85,14553.0,United Kingdom,2025-12-26
516162,21080,SET/20 RED SPOTTY PAPER NAPKINS ,2,0.85,14553.0,United Kingdom,2025-12-26
516162,22294,HEART FILIGREE DOVE  SMALL,2,1.25,14553.0,United Kingdom,2025-12-26
516162,22297,HEART IVORY TRELLIS SMALL,2,1.25,14553.0,United Kingdom,2025-12-26
516162,22329,ROUND CONTAINER SET OF 5 RETROSPOT,1,1.65,14553.0,United Kingdom,2025-12-26
516162,22144,CHRISTMAS CRAFT LITTLE FRIENDS,1,2.1,14553.0,United Kingdom,2025-12-26
516162,22143,CHRISTMAS CRAFT HEART DECORATIONS,6,2.1,14553.0,United Kingdom,2025-12-26
516162,20658,RED SPOTTY LUGGAGE TAG,1,1.25,14553.0,United Kingdom,2025-12-26
516162,21866,UNION JACK FLAG LUGGAGE TAG,2,1.25,14553.0,United Kingdom,2025-12-26
516162,21098,CHRISTMAS TOILET ROLL,1,1.25,14553.0,United Kingdom,2025-12-26
516162,22085,PAPER CHAIN KIT SKULLS ,1,2.95,14553.0,United Kingdom,2025-12-26
516162,22582,PACK OF 6 SWEETIE GIFT BOXES,3,2.55,14553.0,United Kingdom,2025-12-26
516162,22584,PACK OF 6 PANNETONE GIFT BOXES,3,2.55,14553.0,United Kingdom,2025-12-26
516162,84459B,YELLOW METAL CHICKEN HEART ,1,1.49,14553.0,United Kingdom,2025-12-26
516162,84459A,PINK METAL CHICKEN HEART ,1,1.49,14553.0,United Kingdom,2025-12-26
516162,22327,ROUND SNACK BOXES SET OF 4 SKULLS,1,2.95,14553.0,United Kingdom,2025-12-26
516162,20669,RED HEART LUGGAGE TAG,1,1.25,14553.0,United Kingdom,2025-12-26
516162,22550,HOLIDAY FUN LUDO,2,3.75,14553.0,United Kingdom,2025-12-26
516162,21892,TRADITIONAL WOODEN CATCH CUP GAME ,2,1.25,14553.0,United Kingdom,2025-12-26
516162,85150,LADIES & GENTLEMEN METAL SIGN,3,2.55,14553.0,United Kingdom,2025-12-26
516162,21452,TOADSTOOL MONEY BOX,1,2.95,14553.0,United Kingdom,2025-12-26
