Invoice,StockCode,Description,Quantity,Price,Customer ID,Country,InvoiceDate
494814,20762,GREEN FERN SKETCHBOOK ,3,3.36,,United Kingdom,2025-07-30
494814,21946,PARTY TIME DESIGN FLANNEL,4,0.85,,United Kingdom,2025-07-30
494814,21680,WOODLAND  STICKERS,8,0.81,,United Kingdom,2025-07-30
494814,22315,200 RED + WHITE BENDY STRAWS,1,2.51,,United Kingdom,2025-07-30
494814,20764,ABSTRACT CIRCLES SKETCHBOOK ,1,3.36,,United Kingdom,2025-07-30
494814,20763,DAISY SKETCHBOOK ,2,3.36,,United Kingdom,2025-07-30
494814,22115,METAL SIGN EMPIRE TEA,1,5.91,,United Kingdom,2025-07-30
494814,20761,BLUE PAISLEY SKETCHBOOK,3,3.36,,United Kingdom,2025-07-30
494814,21628,TRIANGULAR POUFFE VINTAGE ,5,29.79,,United Kingdom,2025-07-30
494814,20759,CHRYSANTHEMUM POCKET BOOK ,2,0.64,,United Kingdom,2025-07-30
494814,21678,PAISLEY PATTERN  STICKERS,5,0.81,,United Kingdom,2025-07-30
494814,21675,BUTTERFLIES STICKERS,3,0.81,,United Kingdom,2025-07-30
494814,21648,ASSORTED TUTTI FRUTTI SMALL PURSE,1,2.51,,United Kingdom,2025-07-30
494814,21629,SQUARE FLOOR CUSHION VINTAGE RED,1,16.13,,United Kingdom,2025-07-30
494814,21627,ELEPHANT CARNIVAL POUFFE,1,29.79,,United Kingdom,2025-07-30
494814,35001W,HAND OPEN SHAPE DECO.WHITE,1,4.21,,United Kingdom,2025-07-30
494814,21626,VINTAGE UNION JACK PENNANT,1,4.21,,United Kingdom,2025-07-30
494814,20760,GARDEN PATH POCKET BOOK,3,0.64,,United Kingdom,2025-07-30
494814,37494A,FAIRY CAKE CERAMIC BUTTER DISH,1,5.91,,United Kingdom,2025-07-30
494814,90198A,VINTAGE ROSE BEAD BRACELET RASPBERR,1,4.24,,United Kingdom,2025-07-30
494814,79160,HEART SHAPE WIRELESS DOORBELL,1,3.36,,United Kingdom,2025-07-30
494814,90205C,LARGE CRYSTAL DIAMANTE HAIRSLIDE,1,1.69,,United Kingdom,2025-07-30
494814,90205A,LARGE MINT DIAMANTE HAIRSLIDE,1,1.69,,United Kingdom,2025-07-30
494814,90201D,GREEN ENAMEL FLOWER RING,1,2.96,,United Kingdom,2025-07-30
494814,90200D,PINK SWEETHEART BRACELET,2,4.24,,United Kingdom,2025-07-30
494814,21580,RABBIT  DESIGN  COTTON TOTE BAG,1,2.51,,United Kingdom,2025-07-30
494814,85174,S/4 CACTI CANDLES,1,11.02,,United Kingdom,2025-07-30
494814,70006,LOVE HEART POCKET WARMER,9,1.66,,United Kingdom,2025-07-30
494814,62094B,TURQ ICE CREAM BUM BAG ,1,5.06,,United Kingdom,2025-07-30
494814,47566B,TEA TIME PARTY BUNTING,1,8.47,,United Kingdom,2025-07-30
494814,48185,DOOR MAT FAIRY CAKE,1,13.57,,United Kingdom,2025-07-30
494814,85116,BLACK CANDELABRA T-LIGHT HOLDER,3,1.66,,United Kingdom,2025-07-30
494814,85054,FRENCH ENAMEL POT W LID,6,5.91,,United Kingdom,2025-07-30
494814,84992,72 SWEETHEART FAIRY CAKE CASES,2,1.28,,United Kingdom,2025-07-30
494814,84968C,S/16 VINTAGE PISTACHIO CUTLERY,2,11.02,,United Kingdom,2025-07-30
494814,84832,ZINC WILLIE WINKIE  CANDLE STICK,1,1.66,,United Kingdom,2025-07-30
494814,84596K,JELLY BABIES YELLOW SMALL BOWL,1,1.66,,United Kingdom,2025-07-30
494814,84469,ROSE DES PADDED FLOOR CUSHION,2,14.43,,United Kingdom,2025-07-30
494814,84031A,CHARLIE+LOLA RED HOT WATER BOTTLE ,1,4.21,,United Kingdom,2025-07-30
494814,48138,DOOR MAT UNION FLAG,1,13.57,,United Kingdom,2025-07-30
494814,21579,LOLITA  DESIGN  COTTON TOTE BAG,2,2.51,,United Kingdom,2025-07-30
494814,46776D,WOVEN SUNSET CUSHION COVER ,2,4.21,,United Kingdom,2025-07-30
494814,21578,WOODLAND DESIGN  COTTON TOTE BAG,6,2.51,,United Kingdom,2025-07-30
494814,20752,RETRO BLUE SPOTTY WASHING UP GLOVES,3,2.51,,United Kingdom,2025-07-30
494814,20748,KENSINGTON COFFEE SET,3,8.47,,United Kingdom,2025-07-30
494814,20730,STRAWBERRY CANDY BAG,41,0.85,,United Kingdom,2025-07-30
494814,20729,RED SPOTTY CANDY BAG,81,0.85,,United Kingdom,2025-07-30
494814,20728,LUNCH BAG CARS BLUE,1,4.21,,United Kingdom,2025-07-30
494814,20727,LUNCH BAG  BLACK SKULL.,1,4.21,,United Kingdom,2025-07-30
494814,20725,LUNCH BAG RED SPOTTY,3,4.21,,United Kingdom,2025-07-30
494814,20724,RED SPOTTY CHARLOTTE BAG,4,1.66,,United Kingdom,2025-07-30
494814,20723,STRAWBERRY CHARLOTTE BAG,1,1.66,,United Kingdom,2025-07-30
494814,21945,STRAWBERRIES  DESIGN FLANNEL ,6,0.85,,United Kingdom,2025-07-30
494814,21944,KITTENS DESIGN FLANNEL,8,0.85,,United Kingdom,2025-07-30
494814,21943,CAKES AND RABBITS DESIGN FLANNEL ,4,0.85,,United Kingdom,2025-07-30
494814,21942,SKULLS DESIGN FLANNEL,5,0.85,,United Kingdom,2025-07-30
494814,21936,RED/WHITE SPOT PICNIC BAG,1,5.91,,United Kingdom,2025-07-30
494814,22114,HOT WATER BOTTLE TEA AND SYMPATHY,1,8.47,,United Kingdom,2025-07-30
494814,22110,BIRD HOUSE HOT WATER BOTTLE,10,3.36,,United Kingdom,2025-07-30
494814,90209B,GREEN ENAMEL+GLASS HAIR COMB,1,2.11,,United Kingdom,2025-07-30
494814,20756,GREEN FERN POCKET BOOK,2,0.64,,United Kingdom,2025-07-30
494814,20757,RED DAISY POCKET BOOK ,3,0.64,,United Kingdom,2025-07-30
494814,20758,ABSTRACT CIRCLES POCKET BOOK,2,0.64,,United Kingdom,2025-07-30
494814,21100,CHARLIE AND LOLA CHARLOTTE BAG,11,1.66,,United Kingdom,2025-07-30
494814,21577,SAVE THE PLANET COTTON TOTE BAG,3,2.51,,United Kingdom,2025-07-30
494814,21576,LETS GO SHOPPING COTTON TOTE BAG,3,2.51,,United Kingdom,2025-07-30
494814,84828,JUNGLE POPSICLES ICE LOLLY HOLDERS,1,2.51,,United Kingdom,2025-07-30
494814,84813,SET OF 4 DIAMOND NAPKIN RINGS,4,11.02,,United Kingdom,2025-07-30
494814,84754,S/15 SILVER GLASS BAUBLES IN BAG,2,2.51,,United Kingdom,2025-07-30
494814,84753A,PINK EAU DE COLOGNE BOTTLE,2,1.66,,United Kingdom,2025-07-30
494814,84691,PACK 20 DOLLY PEGS,1,1.66,,United Kingdom,2025-07-30
494814,84661B,BLACK SQUARE TABLE CLOCK,1,5.06,,United Kingdom,2025-07-30
494814,21080,SET/20 RED SPOTTY PAPER NAPKINS ,1,1.66,,United Kingdom,2025-07-30
494814,84596E,SMALL LICORICE DES PINK BOWL,3,1.66,,United Kingdom,2025-07-30
494814,22109,FULL ENGLISH BREAKFAST PLATE,2,7.62,,United Kingdom,2025-07-30
494814,82585,SWEET VALENCIA CANDLE+CUP,2,2.51,,United Kingdom,2025-07-30
494814,79000,MOROCCAN TEA GLASS,1,5.06,,United Kingdom,2025-07-30
494814,35647,VINTAGE BEAD PINK SHADE ,2,2.51,,United Kingdom,2025-07-30
494814,22352,LUNCHBOX WITH CUTLERY RETROSPOT ,3,5.06,,United Kingdom,2025-07-30
494814,22138,BAKING SET 9 PIECE RETROSPOT ,1,11.02,,United Kingdom,2025-07-30
494814,21992,VINTAGE PAISLEY STATIONERY SET,12,2.51,,United Kingdom,2025-07-30
494814,21774,DECORATIVE CATS BATHROOM BOTTLE,2,2.51,,United Kingdom,2025-07-30
494814,84050,PINK HEART SHAPE EGG FRYING PAN,1,4.21,,United Kingdom,2025-07-30
494814,90209C,PINK ENAMEL+GLASS HAIR COMB,1,2.11,,United Kingdom,2025-07-30
494814,20770,ABSTRACT CIRCLE JOURNAL ,2,2.51,,United Kingdom,2025-07-30
494814,90211B,JET BLACK LAS VEGAS NECKLACE 45CM,1,5.94,,United Kingdom,2025-07-30
494814,20804,GLASS CHICKEN BUTTER DISH,1,3.36,,United Kingdom,2025-07-30
494814,20781,GOLD EAR MUFF HEADPHONES,1,4.21,,United Kingdom,2025-07-30
494814,20777,CHRYSANTHEMUM NOTEBOOK,5,1.66,,United Kingdom,2025-07-30
494814,20776,ABSTRACT CIRCLES NOTEBOOK,4,1.66,,United Kingdom,2025-07-30
494814,20774,GREEN FERN NOTEBOOK,3,1.66,,United Kingdom,2025-07-30
494814,20773,BLUE PAISLEY NOTEBOOK,4,1.66,,United Kingdom,2025-07-30
494814,20772,GARDEN PATH JOURNAL,1,2.51,,United Kingdom,2025-07-30
494814,20768,GREEN FERN JOURNAL ,1,2.51,,United Kingdom,2025-07-30
494814,22134,LADLE LOVE HEART RED ,1,0.85,,United Kingdom,2025-07-30
494814,22349,"DOG BOWL , CHASING BALL DESIGN",1,7.62,,United Kingdom,2025-07-30
494814,22348,TEA BAG PLATE RED SPOTTY ,1,1.66,,United Kingdom,2025-07-30
494814,22329,ROUND CONTAINER SET OF 5 RETROSPOT,4,3.36,,United Kingdom,2025-07-30
494814,22328,ROUND SNACK BOXES SET OF 4 FRUITS ,4,5.91,,United Kingdom,2025-07-30
494814,35471D,SET OF 3 BIRD LIGHT PINK FEATHER ,1,2.51,,United Kingdom,2025-07-30
494814,46776B,WOVEN BERRIES CUSHION COVER ,1,4.21,,United Kingdom,2025-07-30
494814,46776A,WOVEN BUBBLE GUM CUSHION COVER,2,4.21,,United Kingdom,2025-07-30
494814,72586,"S/6 HALLOWEEN GHOST T LIGHTS, 5CM H",2,0.81,,United Kingdom,2025-07-30
494814,20866,BLUE ROSE FABRIC MIRROR,6,0.85,,United Kingdom,2025-07-30
494814,20867,PINK ROSE FABRIC MIRROR,6,0.85,,United Kingdom,2025-07-30
494814,20868,SILVER FABRIC MIRROR,3,0.85,,United Kingdom,2025-07-30
494814,20869,GOLD FABRIC MIRROR,2,0.85,,United Kingdom,2025-07-30
494814,22094,RED POLKA DOT TISSUE BOX,2,2.51,,United Kingdom,2025-07-30
494814,21077,SET/20 WOODLAND PAPER NAPKINS ,2,1.66,,United Kingdom,2025-07-30
494814,21065,BOOM BOX SPEAKER GIRLS,1,4.21,,United Kingdom,2025-07-30
494814,21064,BOOM BOX SPEAKER BOYS,1,4.21,,United Kingdom,2025-07-30
494814,21058,PARTY INVITES WOODLAND,1,1.66,,United Kingdom,2025-07-30
494814,21043,APRON MODERN VINTAGE COTTON,1,5.91,,United Kingdom,2025-07-30
494814,21040,MODERN VINTAGE COTTON SHOPPING BAG,5,2.51,,United Kingdom,2025-07-30
494814,21035,SET/2 RED SPOTTY TEA TOWELS ,1,5.91,,United Kingdom,2025-07-30
494814,85184C,S/4 VALENTINE DECOUPAGE HEART BOX,1,5.91,,United Kingdom,2025-07-30
494814,21033,JUMBO BAG CHARLIE AND LOLA TOYS,3,3.36,,United Kingdom,2025-07-30
494814,20991,JAZZ HEARTS MAGNETIC MEMO PAD,2,1.28,,United Kingdom,2025-07-30
494814,20977,36 PENCILS TUBE WOODLAND,1,2.51,,United Kingdom,2025-07-30
494814,21773,DECORATIVE ROSE BATHROOM BOTTLE,1,2.51,,United Kingdom,2025-07-30
494814,21756,BATH BUILDING BLOCK WORD,1,11.87,,United Kingdom,2025-07-30
494814,21754,HOME BUILDING BLOCK WORD,1,11.87,,United Kingdom,2025-07-30
494814,20969,RED FLORAL FELTCRAFT SHOULDER BAG,1,7.62,,United Kingdom,2025-07-30
494814,21990,MODERN FLORAL STATIONERY SET,8,2.51,,United Kingdom,2025-07-30
494814,20902,VINTAGE KEEPSAKE BOX PARIS DAYS,1,12.72,,United Kingdom,2025-07-30
494814,21009,ETCHED GLASS STAR TREE DECORATION,2,2.51,,United Kingdom,2025-07-30
494814,85123A,WHITE HANGING HEART T-LIGHT HOLDER,5,5.91,,United Kingdom,2025-07-30
494814,82581,TOILET METAL SIGN,1,1.28,,United Kingdom,2025-07-30
494814,82580,BATHROOM METAL SIGN,2,1.28,,United Kingdom,2025-07-30
494814,21718,RED METAL BEACH SPADE ,2,2.51,,United Kingdom,2025-07-30
494814,21716,BOYS VINTAGE TIN SEASIDE BUCKET,2,5.06,,United Kingdom,2025-07-30
494814,21706,"FOLDING UMBRELLA , RED/WHITE SPOT",2,10.17,,United Kingdom,2025-07-30
494814,21704,BAG 250g SWIRLY MARBLES,1,1.66,,United Kingdom,2025-07-30
494814,21977,PACK OF 60 PINK PAISLEY CAKE CASES,3,1.28,,United Kingdom,2025-07-30
494814,21976,PACK OF 60 MUSHROOM CAKE CASES,2,1.28,,United Kingdom,2025-07-30
494814,22116,METAL SIGN HIS DINNER IS SERVED,1,2.51,,United Kingdom,2025-07-30
494814,22326,ROUND SNACK BOXES SET OF4 WOODLAND ,10,5.91,,United Kingdom,2025-07-30
494814,20766,GARDEN PATH SKETCHBOOK,2,3.36,,United Kingdom,2025-07-30
494814,22325,MOBILE VINTAGE HEARTS ,7,3.36,,United Kingdom,2025-07-30
494814,20765,CHRYSANTHEMUM SKETCHBOOK ,5,3.36,,United Kingdom,2025-07-30
494814,46775D,SUNSET COLOUR CHUNKY KNITTED THROW,1,11.02,,United Kingdom,2025-07-30
494814,46775A,BUBBLE GUM CHUNKY KNITTED THROW ,5,11.02,,United Kingdom,2025-07-30
494814,40046A,RED DAISY PAPER LAMPSHADE,1,2.51,,United Kingdom,2025-07-30
494814,37502,TEA TIME MUG IN GIFT BOX,1,5.91,,United Kingdom,2025-07-30
494814,DOT,DOTCOM POSTAGE,1,451.02,,United Kingdom,2025-07-30
494814,DCGS0058,MISO PRETTY  GUM,1,0.81,,United Kingdom,2025-07-30
494814,90212B,JET BLACK LAS VEGAS BRACELET ROUND,1,3.81,,United Kingdom,2025-07-30
494814,35004C,SET OF 3 COLOURED  FLYING DUCKS,1,12.72,,United Kingdom,2025-07-30
494814,90210D,PURPLE ACRYLIC FACETED BANGLE,1,2.96,,United Kingdom,2025-07-30
494814,20767,BLUE PAISLEY JOURNAL ,1,2.51,,United Kingdom,2025-07-30
494814,21980,PACK OF 12 RED SPOTTY TISSUES ,2,0.81,,United Kingdom,2025-07-30
494814,82567,"AIRLINE LOUNGE,METAL SIGN",3,1.66,,United Kingdom,2025-07-30
494814,82553,POP'S GREASY SPOON METAL SIGN,1,3.36,,United Kingdom,2025-07-30
494814,82552,WASHROOM METAL SIGN,2,2.51,,United Kingdom,2025-07-30
494814,84032B,CHARLIE + LOLA RED HOT WATER BOTTLE,6,2.51,,United Kingdom,2025-07-30
494814,84032A,CHARLIE+LOLA PINK HOT WATER BOTTLE,11,2.51,,United Kingdom,2025-07-30
494814,85098B,BLUE FLYING SINGING CANARY,1,7.62,,United Kingdom,2025-07-30
494814,84993A,75 GREEN PETIT FOUR CASES,1,0.84,,United Kingdom,2025-07-30
494814,84968D,S/16 VINTAGE RED CUTLERY,3,11.02,,United Kingdom,2025-07-30
494814,21739,COSY SLIPPER SHOES SMALL GREEN,1,5.91,,United Kingdom,2025-07-30
494814,84951B,S/4 BLACK LOVEBIRD COASTERS,8,1.66,,United Kingdom,2025-07-30
494814,84596B,SMALL DOLLY MIX DESIGN ORANGE BOWL,7,1.66,,United Kingdom,2025-07-30
494814,84031B,CHARLIE LOLA BLUE HOT WATER BOTTLE ,1,4.21,,United Kingdom,2025-07-30
494814,82494L,WOODEN FRAME ANTIQUE WHITE ,2,7.62,,United Kingdom,2025-07-30
494814,70007,HI TEC ALPINE HAND WARMER,2,1.66,,United Kingdom,2025-07-30
494814,46775E,CANDY POP CHUNKY KNITTED THROW ,5,11.02,,United Kingdom,2025-07-30
494814,35096A,BLUE VICTORIAN FABRIC HEART BOX,1,0.84,,United Kingdom,2025-07-30
494814,22327,ROUND SNACK BOXES SET OF 4 SKULLS,4,5.91,,United Kingdom,2025-07-30
494814,22132,RED LOVE HEART SHAPE CUP,18,1.66,,United Kingdom,2025-07-30
494814,84596L,BISCUITS SMALL BOWL LIGHT BLUE,1,1.66,,United Kingdom,2025-07-30
494814,21556,CERAMIC STRAWBERRY MONEY BOX,1,5.06,,United Kingdom,2025-07-30
494814,21329,DINOSAURS  WRITING SET ,1,3.36,,United Kingdom,2025-07-30
494814,22313,OFFICE MUG WARMER PINK,1,8.47,,United Kingdom,2025-07-30
494814,84270,ASSTD DESIGN BUBBLE GUM RING,10,0.43,,United Kingdom,2025-07-30
494814,84596J,MIXED NUTS LIGHT GREEN BOWL,1,1.66,,United Kingdom,2025-07-30
494814,84990,60 GOLD AND SILVER FAIRY CAKE CASES,2,1.28,,United Kingdom,2025-07-30
494814,84988,SET OF 72 PINK HEART PAPER DOILIES,2,2.98,,United Kingdom,2025-07-30
494814,84968E,S/16 VINTAGE BLACK CUTLERY,1,11.02,,United Kingdom,2025-07-30
494814,84952A,CLEAR LOVE BIRD T-LIGHT HOLDER,3,2.51,,United Kingdom,2025-07-30
494814,84968B,S/16 VINTAGE IVORY CUTLERY,3,11.02,,United Kingdom,2025-07-30
494814,85184D,S/4 BLUE ROUND DECOUPAGE BOXES,1,5.91,,United Kingdom,2025-07-30
494814,85132A,CHARLIE + LOLA BISCUITS TINS,1,8.47,,United Kingdom,2025-07-30
494814,85099B,JUMBO BAG RED WHITE SPOTTY ,1,4.21,,United Kingdom,2025-07-30
494814,85015,SET OF 12  VINTAGE POSTCARD SET,1,2.51,,United Kingdom,2025-07-30
494814,90197B,BLACK GLASS BRACELET W HEART CHARMS,1,5.09,,United Kingdom,2025-07-30
494814,90183A,AMBER DROP EARRINGS W LONG BEADS,1,2.96,,United Kingdom,2025-07-30
494814,90171,DAISY RING,2,1.26,,United Kingdom,2025-07-30
494814,90170,DAISY HAIR BAND,2,1.69,,United Kingdom,2025-07-30
494814,90169,DAISY HAIR COMB,1,2.54,,United Kingdom,2025-07-30
494814,90161A,ANT COPPER RED BOUDICCA BRACELET,1,5.09,,United Kingdom,2025-07-30
494814,84396,6 HOOK JEWELLERY STAND BLACK DRESS,1,8.47,,United Kingdom,2025-07-30
494814,22024,RAINY LADIES BIRTHDAY CARD,1,0.84,,United Kingdom,2025-07-30
494814,22027,TEA PARTY BIRTHDAY CARD,3,0.84,,United Kingdom,2025-07-30
494814,22028,PENNY FARTHING BIRTHDAY CARD,1,0.84,,United Kingdom,2025-07-30
494814,82613D,METAL SIGN CUPCAKE SINGLE HOOK,1,2.51,,United Kingdom,2025-07-30
494814,21847,GREEN  DIAMANTE PEN IN GIFT BOX,3,2.51,,United Kingdom,2025-07-30
494814,21846,PINK DIAMANTE PEN IN GIFT BOX,5,2.51,,United Kingdom,2025-07-30
494814,21837,CROSS STITCH ALPHABET CUSHION COVER,1,14.43,,United Kingdom,2025-07-30
494814,21806,WHITE CHRISTMAS HEART DECORATION,1,0.85,,United Kingdom,2025-07-30
494814,21791,VINTAGE HEADS AND TAILS CARD GAME ,2,2.51,,United Kingdom,2025-07-30
494814,21790,VINTAGE SNAP CARDS,3,1.66,,United Kingdom,2025-07-30
494814,21777,RECIPE BOX WITH METAL HEART,1,16.98,,United Kingdom,2025-07-30
494814,90132,LIGHT TOPAZ TEAL/AQUA COL NECKLACE,1,5.09,,United Kingdom,2025-07-30
494814,21163,DO NOT TOUCH MY STUFF DOOR HANGER ,1,1.66,,United Kingdom,2025-07-30
494814,21158,MOODY GIRL DOOR HANGER ,1,1.66,,United Kingdom,2025-07-30
494814,21112,"SWISS ROLL TOWEL, PINK  SPOTS",1,5.91,,United Kingdom,2025-07-30
494814,21109,"LARGE CAKE TOWEL, CHOCOLATE SPOTS",1,13.57,,United Kingdom,2025-07-30
494814,22076,6 RIBBONS EMPIRE  ,1,3.36,,United Kingdom,2025-07-30
494814,22072,TEA CUP AND SAUCER RETRO SPOT,4,7.62,,United Kingdom,2025-07-30
494814,22054,MINI CAKE STAND HANGING HEARTS,1,3.36,,United Kingdom,2025-07-30
494814,22035,VINTAGE CARAVAN GREETING CARD ,1,0.84,,United Kingdom,2025-07-30
494814,22029,SPACEBOY BIRTHDAY CARD,3,0.84,,United Kingdom,2025-07-30
494814,21161,KEEP OUT BOYS DOOR HANGER ,3,1.66,,United Kingdom,2025-07-30
494814,22173,METAL 4 HOOK HANGER FRENCH CHATEAU,3,5.91,,United Kingdom,2025-07-30
494814,90129F,RED GLASS TASSLE BAG CHARM,1,1.66,,United Kingdom,2025-07-30
494814,90129D,AMBER GLASS TASSLE BAG CHARM,1,1.66,,United Kingdom,2025-07-30
494814,85099F,JUMBO BAG STRAWBERRY,1,4.21,,United Kingdom,2025-07-30
494814,85016,SET OF 6 VINTAGE NOTELETS KIT,1,2.51,,United Kingdom,2025-07-30
494814,84968F,S/16 VINTAGE SKY BLUE CUTLERY,1,11.02,,United Kingdom,2025-07-30
494814,84952B,BLACK LOVE BIRD T-LIGHT HOLDER,3,2.51,,United Kingdom,2025-07-30
494814,84688,BEACH HUT DESIGN BLACKBOARD,1,8.47,,United Kingdom,2025-07-30
494814,84596F,SMALL MARSHMALLOWS PINK BOWL,3,1.66,,United Kingdom,2025-07-30
494814,84251J,"GREETING CARD, THE BLACK CAT",1,0.84,,United Kingdom,2025-07-30
494814,82587,TEXRIO TOMATOES CANDLE+CUP,1,2.51,,United Kingdom,2025-07-30
494814,79029,GLASS HONEYPOT WASP CATCHER,1,4.21,,United Kingdom,2025-07-30
494814,46776E,WOVEN CANDY CUSHION COVER ,1,4.21,,United Kingdom,2025-07-30
494814,35911A,MULTICOLOUR RABBIT EGG WARMER,1,4.21,,United Kingdom,2025-07-30
494814,22353,LUNCHBOX WITH CUTLERY FAIRY CAKES ,2,5.06,,United Kingdom,2025-07-30
494814,22172,METAL SHELF WITH RAIL ,2,16.98,,United Kingdom,2025-07-30
494814,21993,FLORAL FOLK STATIONERY SET,4,2.51,,United Kingdom,2025-07-30
494814,21775,DECORATIVE FLORE BATHROOM BOTTLE,1,2.51,,United Kingdom,2025-07-30
494814,21108,FAIRY CAKE FLANNEL ASSORTED COLOUR,1,5.06,,United Kingdom,2025-07-30
494814,20719,WOODLAND CHARLOTTE BAG,1,1.66,,United Kingdom,2025-07-30
494814,85199S,SMALL HANGING IVORY/RED WOOD BIRD,1,0.81,,United Kingdom,2025-07-30
494814,85217,ASSORTED ICE CREAM FRIDGE MAGNETS,1,7.62,,United Kingdom,2025-07-30
494814,85232B,SET/3 RUSSIAN DOLL STACKING TINS,1,10.17,,United Kingdom,2025-07-30
494814,90005A,JADE GREEN ENAMEL HAIR COMB,1,2.11,,United Kingdom,2025-07-30
494814,90129C,GREEN GLASS TASSLE BAG CHARM,7,1.66,,United Kingdom,2025-07-30
494814,90129B,TURQUOISE GLASS TASSLE BAG CHARM ,8,1.66,,United Kingdom,2025-07-30
494814,90129A,PINK GLASS TASSLE BAG CHARM ,11,1.66,,United Kingdom,2025-07-30
494814,90124B,BLUE MURANO TWIST NECKLACE,1,10.17,,United Kingdom,2025-07-30
494814,90098,NECKLACE+BRACELET PINK BUTTERFLY,1,1.66,,United Kingdom,2025-07-30
494814,85132C,CHARLIE AND LOLA FIGURES TINS,1,8.47,,United Kingdom,2025-07-30
494814,85048,15CM CHRISTMAS GLASS BALL 20 LIGHTS,1,16.98,,United Kingdom,2025-07-30
494814,85038,6 CHOCOLATE LOVE HEART T-LIGHTS,1,2.51,,United Kingdom,2025-07-30
494814,90129E,PURPLE GLASS TASSLE BAG CHARM,7,1.66,,United Kingdom,2025-07-30
494814,85017A,ENVELOPE 50 ROMANTIC IMAGES,2,0.81,,United Kingdom,2025-07-30
494814,90065B,BLACK VINT ART DEC CRYSTAL BRACELET,1,7.22,,United Kingdom,2025-07-30
494814,90059E,DIAMANTE HAIR GRIP PACK/2 RUBY,1,1.69,,United Kingdom,2025-07-30
494814,90059D,DIAMANTE HAIR GRIP PACK/2 PERIDOT,1,1.69,,United Kingdom,2025-07-30
494814,90059B,DIAMANTE HAIR GRIP PACK/2 BLACK DIA,1,1.69,,United Kingdom,2025-07-30
494814,90059A,DIAMANTE HAIR GRIP PACK/2 CRYSTAL,2,1.69,,United Kingdom,2025-07-30
494814,90036E,"FLOWER GLASS GARLD NECKL36""AMETHYST",1,8.07,,United Kingdom,2025-07-30
494814,90028,NEW BAROQUE LARGE NECKLACE BLK/WHIT,1,8.49,,United Kingdom,2025-07-30
494814,90013B,BLACK VINTAGE EARRINGS,1,4.24,,United Kingdom,2025-07-30
494814,90073,VINTAGE ENAMEL & CRYSTAL EARRINGS,1,5.09,,United Kingdom,2025-07-30
494814,22175,PINK OWL SOFT TOY,1,5.91,,United Kingdom,2025-07-30
494814,84952C,MIRROR LOVE BIRD T-LIGHT HOLDER,3,2.51,,United Kingdom,2025-07-30
494814,22189,CREAM HEART CARD HOLDER,1,8.47,,United Kingdom,2025-07-30
494814,20616,CHERRY BLOSSOM PASSPORT COVER,2,1.66,,United Kingdom,2025-07-30
494814,21935,SUKI  SHOULDER BAG,2,3.36,,United Kingdom,2025-07-30
494814,21486,PINK HEART DOTS HOT WATER BOTTLE,3,4.21,,United Kingdom,2025-07-30
494814,20615,BLUE SPOTTY PASSPORT COVER,3,1.66,,United Kingdom,2025-07-30
494814,37423,WHITE WITH BLACK CATS PLATE,1,1.66,,United Kingdom,2025-07-30
494814,21931,JUMBO STORAGE BAG SUKI,2,4.21,,United Kingdom,2025-07-30
494814,21929,JUMBO BAG PINK VINTAGE PAISLEY,2,4.21,,United Kingdom,2025-07-30
494814,21904,HOUSE WRECKING METAL SIGN ,3,1.66,,United Kingdom,2025-07-30
494814,20620,RED SPOTTY PASSPORT COVER,1,4.21,,United Kingdom,2025-07-30
494814,21900,"KEY FOB , SHED",2,1.66,,United Kingdom,2025-07-30
494814,21891,TRADITIONAL WOODEN SKIPPING ROPE,2,2.51,,United Kingdom,2025-07-30
494814,21880,RED AND WHITE SPOT TAPE,4,1.66,,United Kingdom,2025-07-30
494814,21871,SAVE THE PLANET MUG,1,3.36,,United Kingdom,2025-07-30
494814,21868,POTTING SHED TEA MUG,1,3.36,,United Kingdom,2025-07-30
494814,21851,LILAC DIAMANTE PEN IN GIFT BOX,6,2.51,,United Kingdom,2025-07-30
494814,21850,BLUE  DIAMANTE PEN IN GIFT BOX,3,2.51,,United Kingdom,2025-07-30
494814,21383,PACK OF 12 STICKY BUNNIES,1,1.66,,United Kingdom,2025-07-30
494814,21356,TOAST ITS - FAIRY FLOWER,1,2.51,,United Kingdom,2025-07-30
494814,21892,TRADITIONAL WOODEN CATCH CUP GAME ,1,2.51,,United Kingdom,2025-07-30
494814,21330,WOODLAND ANIMAL  WRITING SET ,2,3.36,,United Kingdom,2025-07-30
494814,20652,BLUE SPOTTY LUGGAGE TAG ,3,0.85,,United Kingdom,2025-07-30
494814,20657,TROPICAL LUGGAGE TAG,3,0.85,,United Kingdom,2025-07-30
494814,35001G,HAND OPEN SHAPE GOLD,3,4.21,,United Kingdom,2025-07-30
494814,22414,DOORMAT NEIGHBOURHOOD WITCH ,2,13.57,,United Kingdom,2025-07-30
494814,22356,"CHARLOTTE BAG , PINK/WHITE SPOTS",2,1.66,,United Kingdom,2025-07-30
494814,22355,"CHARLOTTE BAG , SUKI DESIGN",2,1.66,,United Kingdom,2025-07-30
494814,21542,WOODLAND WATER TRANSFER TATTOOS ,1,1.66,,United Kingdom,2025-07-30
494814,21541,DINOSAURS WATER TRANSFER TATTOOS ,1,1.66,,United Kingdom,2025-07-30
494814,21535,RETRO SPOT SMALL MILK JUG,2,5.06,,United Kingdom,2025-07-30
494814,21531,RETRO SPOT SUGAR JAM BOWL,2,5.06,,United Kingdom,2025-07-30
494814,20653,CHERRY BLOSSOM LUGGAGE TAG,1,0.85,,United Kingdom,2025-07-30
494814,21529,RETRO SPOT CERAMIC TOASTRACK,1,5.91,,United Kingdom,2025-07-30
494814,22186,RED STAR CARD HOLDER,1,5.91,,United Kingdom,2025-07-30
494814,21519,GIN & TONIC DIET GREETING CARD ,1,0.84,,United Kingdom,2025-07-30
494814,21494,ROTATING LEAVES T-LIGHT HOLDER,10,1.66,,United Kingdom,2025-07-30
494814,20711,JUMBO BAG TOYS ,1,4.21,,United Kingdom,2025-07-30
494814,20700,GREEN CAT FLORAL CUSHION COVER ,4,4.21,,United Kingdom,2025-07-30
494814,20694,FLORAL PINK MONSTER,2,2.51,,United Kingdom,2025-07-30
494814,20682,RED SPOTTY CHILDS UMBRELLA,1,6.77,,United Kingdom,2025-07-30
494814,20658,RED SPOTTY LUGGAGE TAG,1,2.51,,United Kingdom,2025-07-30
494814,21527,RETRO SPOT TRADITIONAL TEAPOT ,1,16.98,,United Kingdom,2025-07-30
494814,21324,HANGING MEDINA LANTERN SMALL,2,5.91,,United Kingdom,2025-07-30
494814,21523,FANCY FONT HOME SWEET HOME DOORMAT,1,13.57,,United Kingdom,2025-07-30
494814,21293,MIRRORED DOVE WALL DECORATION,1,3.36,,United Kingdom,2025-07-30
494814,15036,ASSORTED COLOURS SILK FAN,3,1.28,,United Kingdom,2025-07-30
494814,21186,WHITE DOVE HONEYCOMB PAPER GARLAND,1,3.36,,United Kingdom,2025-07-30
494814,21179,NO JUNK MAIL METAL SIGN,2,1.66,,United Kingdom,2025-07-30
494814,21174,POTTERING IN THE SHED METAL SIGN,1,4.21,,United Kingdom,2025-07-30
494814,21165,BEWARE OF THE CAT METAL SIGN ,1,4.21,,United Kingdom,2025-07-30
494814,21164,HOME SWEET HOME METAL SIGN ,1,5.91,,United Kingdom,2025-07-30
494814,79067,CORONA MEXICAN TRAY,1,8.47,,United Kingdom,2025-07-30
494814,22294,HEART FILIGREE DOVE  SMALL,1,2.51,,United Kingdom,2025-07-30
494814,22264,FELT FARM ANIMAL WHITE BUNNY ,1,1.66,,United Kingdom,2025-07-30
494814,22262,FELT EGG COSY CHICKEN,1,1.66,,United Kingdom,2025-07-30
494814,22245,"HOOK, 1 HANGER ,MAGIC GARDEN",2,1.66,,United Kingdom,2025-07-30
494814,22227,"DECORATION, HANGING HEART+MIRROR ",8,1.28,,United Kingdom,2025-07-30
494814,22219,LOVEBIRD HANGING DECORATION WHITE ,2,1.66,,United Kingdom,2025-07-30
494814,22204,MILK PAN BLUE RETROSPOT,1,7.62,,United Kingdom,2025-07-30
494814,22202,MILK PAN PINK RETROSPOT,1,7.62,,United Kingdom,2025-07-30
494814,22199,FRYING PAN RED POLKADOT ,1,8.47,,United Kingdom,2025-07-30
494814,21314,SMALL GLASS HEART TRINKET POT,2,4.21,,United Kingdom,2025-07-30
494814,16046,TEATIME PEN CASE & PENS,1,1.66,,United Kingdom,2025-07-30
494814,16225,RATTLE SNAKE EGGS,1,1.28,,United Kingdom,2025-07-30
494814,15044C,PURPLE PAPER PARASOL,1,5.91,,United Kingdom,2025-07-30
494814,16238,PARTY TIME PENCIL ERASERS,1,0.43,,United Kingdom,2025-07-30
494814,21285,RETRO SPOT CANDLE  MEDIUM,2,4.21,,United Kingdom,2025-07-30
494814,21248,DOOR HANGER  MUM + DADS ROOM,2,1.66,,United Kingdom,2025-07-30
494814,21246,RED SPOTTY BIG BOWL,1,11.02,,United Kingdom,2025-07-30
494814,21238,RED SPOTTY CUP,2,1.66,,United Kingdom,2025-07-30
494814,21218,RED SPOTTY BISCUIT TIN,1,8.47,,United Kingdom,2025-07-30
494814,21217,RED SPOTTY ROUND CAKE TINS,1,21.23,,United Kingdom,2025-07-30
494814,21213,PACK OF 72 SKULL CAKE CASES,1,1.28,,United Kingdom,2025-07-30
494814,16237,SLEEPING CAT ERASERS,2,0.43,,United Kingdom,2025-07-30
494814,47566,PARTY BUNTING,2,8.47,,United Kingdom,2025-07-30
494814,21212,PACK OF 72 RETRO SPOT CAKE CASES,7,1.28,,United Kingdom,2025-07-30
494814,46776F,WOVEN ROSE GARDEN CUSHION COVER ,1,4.21,,United Kingdom,2025-07-30
494814,22299,PIG KEYRING WITH LIGHT & SOUND ,1,2.51,,United Kingdom,2025-07-30
494814,22087,PAPER BUNTING WHITE LACE,5,5.91,,United Kingdom,2025-07-30
494814,21849,SILVER DIAMANTE PEN IN GIFT BOX,2,2.51,,United Kingdom,2025-07-30
494814,18098C,PORCELAIN BUTTERFLY OIL BURNER,2,2.51,,United Kingdom,2025-07-30
494814,18097C,WHITE TALL PORCELAIN T-LIGHT HOLDER,5,2.51,,United Kingdom,2025-07-30
494814,17084N,FAIRY DREAMS INCENSE ,1,0.43,,United Kingdom,2025-07-30
494814,16254,TRANSPARENT ACRYLIC TAPE DISPENSER,5,1.66,,United Kingdom,2025-07-30
494814,22193,RED DINER WALL CLOCK,1,16.98,,United Kingdom,2025-07-30
