Invoice,StockCode,Description,Quantity,Price,Customer ID,Country,InvoiceDate
C512785,22605,WOODEN CROQUET GARDEN SET,-1,12.75,14505.0,United Kingdom,2025-12-01
C512785,85061W,WHITE JEWELLED HEART DECORATION,-17,0.85,14505.0,United Kingdom,2025-12-01
512786,20726,LUNCH BAG WOODLAND,1,1.65,13277.0,United Kingdom,2025-12-01
512786,20960,WATERMELON BATH SPONGE,1,1.25,13277.0,United Kingdom,2025-12-01
512786,20725,LUNCH BAG RED SPOTTY,1,1.65,13277.0,United Kingdom,2025-12-01
512786,21976,PACK OF 60 MUSHROOM CAKE CASES,1,0.55,13277.0,United Kingdom,2025-12-01
512786,21212,PACK OF 72 RETRO SPOT CAKE CASES,1,0.55,13277.0,United Kingdom,2025-12-01
512786,20963,APPLE BATH SPONGE,1,1.25,13277.0,United Kingdom,2025-12-01
512787,22499,WOODEN UNION JACK BUNTING,3,5.95,14492.0,United Kingdom,2025-12-01
512787,71053,WHITE METAL LANTERN,4,3.75,14492.0,United Kingdom,2025-12-01
512787,85123A,WHITE HANGING HEART T-LIGHT HOLDER,32,2.55,14492.0,United Kingdom,2025-12-01
512787,85152,HAND OVER THE CHOCOLATE   SIGN ,12,2.1,14492.0,United Kingdom,2025-12-01
512787,48138,DOOR MAT UNION FLAG,4,7.49,14492.0,United Kingdom,2025-12-01
512787,21755,LOVE BUILDING BLOCK WORD,6,5.95,14492.0,United Kingdom,2025-12-01
512787,22486,PLASMATRONIC LAMP,4,12.75,14492.0,United Kingdom,2025-12-01
512787,85172,HYACINTH BULB T-LIGHT CANDLES,32,0.42,14492.0,United Kingdom,2025-12-01
512787,21612,SET 12 WILDFLOWER BOTANICAL T-LIGHT,6,2.95,14492.0,United Kingdom,2025-12-01
512787,22500,SET OF 2 TINS JARDIN DE PROVENCE,4,4.95,14492.0,United Kingdom,2025-12-01
512788,21381,MINI WOODEN HAPPY BIRTHDAY GARLAND,12,1.69,13427.0,United Kingdom,2025-12-01
512788,22178,VICTORIAN GLASS HANGING T-LIGHT,12,1.25,13427.0,United Kingdom,2025-12-01
512788,84755,COLOUR GLASS T-LIGHT HOLDER HANGING,16,0.65,13427.0,United Kingdom,2025-12-01
512788,84978,HANGING HEART JAR T-LIGHT HOLDER,12,1.25,13427.0,United Kingdom,2025-12-01
512788,84970S,HANGING HEART ZINC T-LIGHT HOLDER,12,0.85,13427.0,United Kingdom,2025-12-01
512788,22469,HEART OF WICKER SMALL,12,1.65,13427.0,United Kingdom,2025-12-01
512788,22487,WHITE WOOD GARDEN PLANT LADDER,1,9.95,13427.0,United Kingdom,2025-12-01
512788,22080,RIBBON REEL SPOTS DESIGN ,10,1.65,13427.0,United Kingdom,2025-12-01
512788,22441,GROW YOUR OWN BASIL IN ENAMEL MUG,8,2.1,13427.0,United Kingdom,2025-12-01
512788,21614,SET OF 12 ROSE BOTANICAL T-LIGHTS,6,2.95,13427.0,United Kingdom,2025-12-01
C512790,22606,WOODEN SKITTLES GARDEN SET,-1,15.95,13297.0,United Kingdom,2025-12-01
C512792,85175,CACTI T-LIGHT CANDLES,-3,0.42,15141.0,United Kingdom,2025-12-01
C512792,21643,ASSORTED TUTTI FRUTTI MIRROR,-1,1.25,15141.0,United Kingdom,2025-12-01
512791,21785,RAIN PONCHO ,2,0.85,,United Kingdom,2025-12-01
512791,21787,RAIN PONCHO WITH RED SPOTS,2,0.85,,United Kingdom,2025-12-01
C512793,22636,CHILDS BREAKFAST SET CIRCUS PARADE,-1,8.5,17017.0,United Kingdom,2025-12-01
C512793,71459,HANGING JAM JAR T-LIGHT HOLDER,-14,0.72,17017.0,United Kingdom,2025-12-01
C512794,21922,UNION STRIPE WITH FRINGE  HAMMOCK,-1,7.95,15447.0,United Kingdom,2025-12-01
512795,20685,DOOR MAT RED SPOT,2,7.49,17612.0,United Kingdom,2025-12-01
512795,20886,BOX OF 9 PEBBLE CANDLES,6,1.95,17612.0,United Kingdom,2025-12-01
512795,48138,DOOR MAT UNION FLAG,2,7.49,17612.0,United Kingdom,2025-12-01
512795,21523,DOOR MAT FANCY FONT HOME SWEET HOME,2,7.49,17612.0,United Kingdom,2025-12-01
512795,21524,DOOR MAT SPOTTY HOME SWEET HOME,2,7.49,17612.0,United Kingdom,2025-12-01
512795,22366,DOOR MAT AIRMAIL ,2,7.49,17612.0,United Kingdom,2025-12-01
512795,84971S,SMALL HEART FLOWERS HOOK ,24,0.85,17612.0,United Kingdom,2025-12-01
512795,20702,PINK PADDED MOBILE,3,4.25,17612.0,United Kingdom,2025-12-01
512795,20971,PINK BLUE FELT CRAFT TRINKET BOX,12,1.25,17612.0,United Kingdom,2025-12-01
512795,20972,PINK CREAM FELT CRAFT TRINKET BOX ,12,1.25,17612.0,United Kingdom,2025-12-01
512795,21888,BINGO SET,4,3.75,17612.0,United Kingdom,2025-12-01
512795,22167,"WALL MIRROR , DIAMANTE OVAL SHAPE",2,9.95,17612.0,United Kingdom,2025-12-01
512795,84970S,HANGING HEART ZINC T-LIGHT HOLDER,12,0.85,17612.0,United Kingdom,2025-12-01
512795,22165,"DIAMANTE HEART SHAPED WALL MIRROR, ",1,12.75,17612.0,United Kingdom,2025-12-01
512795,21668,RED STRIPE CERAMIC DRAWER KNOB,12,1.25,17612.0,United Kingdom,2025-12-01
512795,21671,RED SPOT CERAMIC DRAWER KNOB,12,1.25,17612.0,United Kingdom,2025-12-01
512795,21672,WHITE SPOT RED CERAMIC DRAWER KNOB,12,1.25,17612.0,United Kingdom,2025-12-01
512795,20750,RED/WHITE DOT MINI CASES,2,7.95,17612.0,United Kingdom,2025-12-01
512795,85099B,JUMBO BAG RED RETROSPOT,10,1.95,17612.0,United Kingdom,2025-12-01
512795,21621,VINTAGE UNION JACK BUNTING,2,8.5,17612.0,United Kingdom,2025-12-01
512795,21670,BLUE SPOT CERAMIC DRAWER KNOB,12,1.25,17612.0,United Kingdom,2025-12-01
C512796,85014B,RED/WHITE DOTS RUFFLED UMBRELLA,-1,5.95,16797.0,United Kingdom,2025-12-01
C512796,22215,CAKE STAND WHITE TWO TIER LACE,-1,8.5,16797.0,United Kingdom,2025-12-01
C512796,82494L,WOODEN FRAME ANTIQUE WHITE ,-1,2.95,16797.0,United Kingdom,2025-12-01
512797,84792,ENCHANTED BIRD COATHANGER 5 HOOK,8,4.65,14895.0,United Kingdom,2025-12-01
512797,22169,FAMILY ALBUM WHITE PICTURE FRAME,8,7.65,14895.0,United Kingdom,2025-12-01
512797,22170,PICTURE FRAME WOOD TRIPLE PORTRAIT,8,6.75,14895.0,United Kingdom,2025-12-01
512797,82486,WOOD S/3 CABINET ANT WHITE FINISH,4,7.95,14895.0,United Kingdom,2025-12-01
512797,82494L,WOODEN FRAME ANTIQUE WHITE ,24,2.55,14895.0,United Kingdom,2025-12-01
512797,22430,ENAMEL WATERING CAN CREAM,4,4.95,14895.0,United Kingdom,2025-12-01
512797,21217,RED SPOTTY ROUND CAKE TINS,2,9.95,14895.0,United Kingdom,2025-12-01
512797,22429,ENAMEL MEASURING JUG CREAM,4,4.25,14895.0,United Kingdom,2025-12-01
512797,22425,ENAMEL COLANDER CREAM,3,4.95,14895.0,United Kingdom,2025-12-01
512797,22424,ENAMEL BREAD BIN CREAM,3,12.75,14895.0,United Kingdom,2025-12-01
512797,21314,SMALL GLASS HEART TRINKET POT,16,2.1,14895.0,United Kingdom,2025-12-01
512797,22423,REGENCY CAKESTAND 3 TIER,6,12.75,14895.0,United Kingdom,2025-12-01
512797,22172,METAL SHELF WITH RAIL ,2,8.5,14895.0,United Kingdom,2025-12-01
512797,22427,ENAMEL FLOWER JUG CREAM,3,5.95,14895.0,United Kingdom,2025-12-01
512797,84970L,SINGLE HEART ZINC T-LIGHT HOLDER,12,0.95,14895.0,United Kingdom,2025-12-01
512797,22077,6 RIBBONS RUSTIC CHARM,12,1.65,14895.0,United Kingdom,2025-12-01
512797,84978,HANGING HEART JAR T-LIGHT HOLDER,24,1.25,14895.0,United Kingdom,2025-12-01
512797,22504,CABIN BAG VINTAGE RETROSPOT,4,29.95,14895.0,United Kingdom,2025-12-01
512797,22501,PICNIC BASKET WICKER LARGE,2,9.95,14895.0,United Kingdom,2025-12-01
512797,84970S,HANGING HEART ZINC T-LIGHT HOLDER,12,0.85,14895.0,United Kingdom,2025-12-01
512797,20972,PINK CREAM FELT CRAFT TRINKET BOX ,24,1.25,14895.0,United Kingdom,2025-12-01
512797,22089,PAPER BUNTING VINTAGE PAISLEY,12,2.95,14895.0,United Kingdom,2025-12-01
512797,21313,GLASS HEART T-LIGHT HOLDER ,12,0.85,14895.0,United Kingdom,2025-12-01
512797,20971,PINK BLUE FELT CRAFT TRINKET BOX,24,1.25,14895.0,United Kingdom,2025-12-01
512797,22348,TEA BAG PLATE RED SPOTTY ,12,0.85,14895.0,United Kingdom,2025-12-01
512797,22073,RED RETROSPOT STORAGE JAR,8,3.75,14895.0,United Kingdom,2025-12-01
512797,22377,BOTTLE BAG RETROSPOT ,5,2.1,14895.0,United Kingdom,2025-12-01
512797,21662,VINTAGE GLASS COFFEE CADDY,3,5.95,14895.0,United Kingdom,2025-12-01
512797,21661,VINTAGE GLASS TEA CADDY,3,5.95,14895.0,United Kingdom,2025-12-01
512797,21153,RED SPOTTY TABLECLOTH ,2,10.65,14895.0,United Kingdom,2025-12-01
512798,84970S,HANGING HEART ZINC T-LIGHT HOLDER,48,0.85,17389.0,United Kingdom,2025-12-01
512798,84970L,SINGLE HEART ZINC T-LIGHT HOLDER,24,0.95,17389.0,United Kingdom,2025-12-01
512798,22607,WOODEN ROUNDERS GARDEN SET ,30,7.65,17389.0,United Kingdom,2025-12-01
512798,21617,4 LILY  BOTANICAL DINNER CANDLES,12,3.75,17389.0,United Kingdom,2025-12-01
512798,21635,MADRAS NOTEBOOK LARGE ,12,3.75,17389.0,United Kingdom,2025-12-01
512798,21735,TWO DOOR CURIO CABINET,60,10.95,17389.0,United Kingdom,2025-12-01
512799,47590B,PINK HAPPY BIRTHDAY BUNTING,6,5.45,16126.0,United Kingdom,2025-12-01
512799,22150,3 STRIPEY MICE FELTCRAFT,12,1.95,16126.0,United Kingdom,2025-12-01
512799,22274,FELTCRAFT DOLL EMILY,12,2.95,16126.0,United Kingdom,2025-12-01
512799,21621,VINTAGE UNION JACK BUNTING,10,8.5,16126.0,United Kingdom,2025-12-01
512799,20969,RED FLORAL FELTCRAFT SHOULDER BAG,8,3.75,16126.0,United Kingdom,2025-12-01
512799,22147,FELTCRAFT BUTTERFLY HEARTS,6,1.45,16126.0,United Kingdom,2025-12-01
512799,22149,FELTCRAFT 6 FLOWER FRIENDS,6,2.1,16126.0,United Kingdom,2025-12-01
512799,20970,PINK FLORAL FELTCRAFT SHOULDER BAG,8,3.75,16126.0,United Kingdom,2025-12-01
512799,22452,MEASURING TAPE RUSSIAN DOLL PINK,6,2.95,16126.0,United Kingdom,2025-12-01
512799,22505,MEMO BOARD COTTAGE DESIGN,4,4.95,16126.0,United Kingdom,2025-12-01
512799,21259,VICTORIAN SEWING BOX SMALL ,6,5.95,16126.0,United Kingdom,2025-12-01
512799,20971,PINK BLUE FELT CRAFT TRINKET BOX,36,1.25,16126.0,United Kingdom,2025-12-01
512799,20972,PINK CREAM FELT CRAFT TRINKET BOX ,36,1.25,16126.0,United Kingdom,2025-12-01
512799,22621,TRADITIONAL KNITTING NANCY,12,1.45,16126.0,United Kingdom,2025-12-01
512799,22454,MEASURING TAPE RUSSIAN DOLL RED,6,2.95,16126.0,United Kingdom,2025-12-01
512799,22446,PIN CUSHION RUSSIAN DOLL PINK,6,3.35,16126.0,United Kingdom,2025-12-01
512799,85176,SEWING SUSAN 21 NEEDLE SET,24,0.85,16126.0,United Kingdom,2025-12-01
512799,85178,VICTORIAN SEWING KIT,24,1.25,16126.0,United Kingdom,2025-12-01
512799,22448,PIN CUSHION RUSSIAN DOLL RED,6,3.35,16126.0,United Kingdom,2025-12-01
512800,22118,JOY WOODEN BLOCK LETTERS,2,4.95,15402.0,United Kingdom,2025-12-01
512800,35160,BUDDHA INCENSE HOLDER ASSORTED,12,0.85,15402.0,United Kingdom,2025-12-01
512800,17084N,FAIRY DREAMS INCENSE ,25,0.21,15402.0,United Kingdom,2025-12-01
512800,17084R,ASSORTED INCENSE PACK,144,0.21,15402.0,United Kingdom,2025-12-01
512800,71053,WHITE METAL LANTERN,3,3.75,15402.0,United Kingdom,2025-12-01
512800,21621,VINTAGE UNION JACK BUNTING,3,8.5,15402.0,United Kingdom,2025-12-01
512800,21630,FLOOR CUSHION ELEPHANT CARNIVAL,5,8.95,15402.0,United Kingdom,2025-12-01
512800,46000M,POLYESTER FILLER PAD 45x45cm,5,1.55,15402.0,United Kingdom,2025-12-01
512800,21755,LOVE BUILDING BLOCK WORD,2,5.95,15402.0,United Kingdom,2025-12-01
512800,21754,HOME BUILDING BLOCK WORD,2,5.95,15402.0,United Kingdom,2025-12-01
512800,21323,HANGING MEDINA LANTERN LARGE,4,4.25,15402.0,United Kingdom,2025-12-01
512800,35004C,SET OF 3 COLOURED  FLYING DUCKS,1,5.45,15402.0,United Kingdom,2025-12-01
512800,71053,WHITE METAL LANTERN,1,3.75,15402.0,United Kingdom,2025-12-01
512800,22101,MIRROR MOSAIC VOTIVE HOLDER,6,2.1,15402.0,United Kingdom,2025-12-01
512800,22168,ORGANISER WOOD ANTIQUE WHITE ,1,8.5,15402.0,United Kingdom,2025-12-01
512800,79532,MOSAIC GLASS BALL CANDLEHOLDER,6,1.25,15402.0,United Kingdom,2025-12-01
512800,17096,ASSORTED LAQUERED INCENSE HOLDERS,24,0.21,15402.0,United Kingdom,2025-12-01
512800,21651,HANGING GLASS ETCHED TEALIGHT,2,1.65,15402.0,United Kingdom,2025-12-01
512800,21324,HANGING MEDINA LANTERN SMALL,6,2.95,15402.0,United Kingdom,2025-12-01
512801,21330,?,-207,0.0,,United Kingdom,2025-12-01
512802,21429,RED GINGHAM ROSE JEWELLERY BOX,1,1.65,15483.0,United Kingdom,2025-12-01
512802,21431,GREEN GINGHAM FLOWER JEWELLERY BOX,1,1.65,15483.0,United Kingdom,2025-12-01
512802,84033,FLAG OF ST GEORGE ,1,1.65,15483.0,United Kingdom,2025-12-01
512802,22553,PLASTERS IN TIN SKULLS,2,1.65,15483.0,United Kingdom,2025-12-01
512802,22150,3 STRIPEY MICE FELTCRAFT,1,1.95,15483.0,United Kingdom,2025-12-01
512802,21213,PACK OF 72 SKULL CAKE CASES,1,0.55,15483.0,United Kingdom,2025-12-01
512802,20986,BLUE CALCULATOR RULER,1,1.25,15483.0,United Kingdom,2025-12-01
512802,22367,CHILDS APRON SPACEBOY DESIGN,2,1.95,15483.0,United Kingdom,2025-12-01
512802,22557,PLASTERS IN TIN VINTAGE PAISLEY ,2,1.65,15483.0,United Kingdom,2025-12-01
512802,22586,FELTCRAFT HAIRBAND PINK AND BLUE,2,0.85,15483.0,United Kingdom,2025-12-01
512802,22613,PACK OF 20 SPACEBOY NAPKINS,1,0.85,15483.0,United Kingdom,2025-12-01
512802,84033,FLAG OF ST GEORGE ,1,1.65,15483.0,United Kingdom,2025-12-01
512802,16238,PARTY TIME PENCIL ERASERS,3,0.21,15483.0,United Kingdom,2025-12-01
512802,21156,RED SPOTTY CHILDS APRON,2,1.95,15483.0,United Kingdom,2025-12-01
512802,85142,JARDIN ETCHED GLASS GINGER JAR,1,7.95,15483.0,United Kingdom,2025-12-01
512802,22439,6 ROCKET BALLOONS ,1,0.65,15483.0,United Kingdom,2025-12-01
512802,22431,WATERING CAN BLUE ELEPHANT,1,1.95,15483.0,United Kingdom,2025-12-01
512802,22433,WATERING CAN GREEN DINOSAUR,1,1.95,15483.0,United Kingdom,2025-12-01
512802,37441,ASSORTED WHITE EMBOSSED CHINA MUGS,12,2.1,15483.0,United Kingdom,2025-12-01
512802,16237,SLEEPING CAT ERASERS,2,0.21,15483.0,United Kingdom,2025-12-01
512802,16216,LETTER SHAPE PENCIL SHARPENER,10,0.16,15483.0,United Kingdom,2025-12-01
512802,16020C,CLEAR STATIONERY BOX SET ,2,0.85,15483.0,United Kingdom,2025-12-01
512803,79190D,RETRO PLASTIC DAISY TRAY,1,0.42,15483.0,United Kingdom,2025-12-01
512803,20671,BLUE TEATIME PRINT BOWL ,1,1.25,15483.0,United Kingdom,2025-12-01
512803,22196,SMALL HEART MEASURING SPOONS,1,0.85,15483.0,United Kingdom,2025-12-01
512803,10125,MINI FUNKY DESIGN TAPES,1,0.85,15483.0,United Kingdom,2025-12-01
512803,22367,CHILDS APRON SPACEBOY DESIGN,1,1.95,15483.0,United Kingdom,2025-12-01
512803,22092,BLUE PAISLEY TISSUE BOX,1,1.25,15483.0,United Kingdom,2025-12-01
512803,21431,GREEN GINGHAM FLOWER JEWELLERY BOX,1,1.65,15483.0,United Kingdom,2025-12-01
512803,22093,MOTORING TISSUE BOX,1,1.25,15483.0,United Kingdom,2025-12-01
512803,20752,RETRO BLUE SPOTTY WASHING UP GLOVES,1,2.1,15483.0,United Kingdom,2025-12-01
512803,21166,COOK WITH WINE METAL SIGN ,1,1.95,15483.0,United Kingdom,2025-12-01
512803,22195,LARGE HEART MEASURING SPOONS,1,1.65,15483.0,United Kingdom,2025-12-01
512803,21579,LOLITA  DESIGN  COTTON TOTE BAG,1,2.25,15483.0,United Kingdom,2025-12-01
512803,37475,SET/4 COLOURFUL MIXING BOWLS,1,9.95,15483.0,United Kingdom,2025-12-01
512804,M,Manual,1,241.38,16943.0,United Kingdom,2025-12-01
C512805,M,Manual,-1,241.38,,United Kingdom,2025-12-01
512807,20665,RED SPOTTY PURSE ,2,2.95,14646.0,Netherlands,2025-12-01
512807,85123A,WHITE HANGING HEART T-LIGHT HOLDER,2,2.95,14646.0,Netherlands,2025-12-01
512807,21733,RED HANGING HEART T-LIGHT HOLDER,2,2.95,14646.0,Netherlands,2025-12-01
512807,21114,LAVENDER SCENTED FABRIC HEART,2,1.25,14646.0,Netherlands,2025-12-01
512807,22378,WALL TIDY RETROSPOT ,2,2.1,14646.0,Netherlands,2025-12-01
512807,22086,PAPER CHAIN KIT 50'S CHRISTMAS ,2,2.95,14646.0,Netherlands,2025-12-01
512807,22585,PACK OF 6 BIRDY GIFT TAGS,2,1.25,14646.0,Netherlands,2025-12-01
512807,22584,PACK OF 6 PANNETONE GIFT BOXES,2,2.55,14646.0,Netherlands,2025-12-01
512807,22583,PACK OF 6 HANDBAG GIFT BOXES,2,2.55,14646.0,Netherlands,2025-12-01
512807,22582,PACK OF 6 SWEETIE GIFT BOXES,2,2.55,14646.0,Netherlands,2025-12-01
512807,20658,RED SPOTTY LUGGAGE TAG,2,1.25,14646.0,Netherlands,2025-12-01
512807,22028,PENNY FARTHING BIRTHDAY CARD,12,0.42,14646.0,Netherlands,2025-12-01
512806,16237,SLEEPING CAT ERASERS,3,0.21,15483.0,United Kingdom,2025-12-01
512806,35015,JACOBS LADDER SMALL,6,0.06,15483.0,United Kingdom,2025-12-01
512806,20755,BLUE PAISLEY POCKET BOOK,1,0.85,15483.0,United Kingdom,2025-12-01
512806,20756,GREEN FERN POCKET BOOK,1,0.85,15483.0,United Kingdom,2025-12-01
512806,20757,RED DAISY POCKET BOOK ,1,0.85,15483.0,United Kingdom,2025-12-01
512806,17003,BROCADE RING PURSE ,36,0.21,15483.0,United Kingdom,2025-12-01
512806,17164B,ASS COL SMALL SAND GECKO P'WEIGHT,5,0.42,15483.0,United Kingdom,2025-12-01
512806,21703,BAG 125g SWIRLY MARBLES,10,0.42,15483.0,United Kingdom,2025-12-01
512806,84270,ASSTD DESIGN BUBBLE GUM RING,30,0.21,15483.0,United Kingdom,2025-12-01
512806,84670,JAPANESE CROCHETED ANIMAL,12,0.42,15483.0,United Kingdom,2025-12-01
512807,22714,CARD BIRTHDAY COWBOY,12,0.42,14646.0,Netherlands,2025-12-01
512807,21157,RED SPOTTY WASHBAG,2,2.1,14646.0,Netherlands,2025-12-01
512807,21669,BLUE STRIPE CERAMIC DRAWER KNOB,192,1.06,14646.0,Netherlands,2025-12-01
512807,20712,JUMBO BAG WOODLAND ANIMALS,200,1.65,14646.0,Netherlands,2025-12-01
512807,22384,LUNCH BAG PINK RETROSPOT,2,1.65,14646.0,Netherlands,2025-12-01
512806,M,Manual,34,0.21,15483.0,United Kingdom,2025-12-01
512806,16236,KITTY PENCIL ERASERS,3,0.21,15483.0,United Kingdom,2025-12-01
512806,16238,PARTY TIME PENCIL ERASERS,6,0.21,15483.0,United Kingdom,2025-12-01
512807,22443,GROW YOUR OWN HERBS SET OF 3,20,6.75,14646.0,Netherlands,2025-12-01
512807,22242,"HOOK, 5 HANGER , MAGIC TOADSTOOL",96,1.45,14646.0,Netherlands,2025-12-01
512807,21668,RED STRIPE CERAMIC DRAWER KNOB,192,1.06,14646.0,Netherlands,2025-12-01
512807,21671,RED SPOT CERAMIC DRAWER KNOB,192,1.06,14646.0,Netherlands,2025-12-01
512807,21672,WHITE SPOT RED CERAMIC DRAWER KNOB,192,1.06,14646.0,Netherlands,2025-12-01
512807,21673,WHITE SPOT BLUE CERAMIC DRAWER KNOB,384,1.06,14646.0,Netherlands,2025-12-01
512807,21670,BLUE SPOT CERAMIC DRAWER KNOB,192,1.06,14646.0,Netherlands,2025-12-01
512807,21218,RED SPOTTY BISCUIT TIN,24,3.25,14646.0,Netherlands,2025-12-01
512807,21330,WOODLAND ANIMAL  WRITING SET ,100,1.45,14646.0,Netherlands,2025-12-01
512807,22326,ROUND SNACK BOXES SET OF4 WOODLAND ,48,2.55,14646.0,Netherlands,2025-12-01
512807,21432,SET OF 3 CASES WOODLAND DESIGN,48,5.45,14646.0,Netherlands,2025-12-01
512807,20692,FLORAL ELEPHANT SOFT TOY,96,3.75,14646.0,Netherlands,2025-12-01
512807,85099B,JUMBO BAG RED RETROSPOT,200,1.65,14646.0,Netherlands,2025-12-01
512807,20725,LUNCH BAG RED SPOTTY,100,1.45,14646.0,Netherlands,2025-12-01
512807,21929,JUMBO BAG PINK VINTAGE PAISLEY,100,1.65,14646.0,Netherlands,2025-12-01
512807,85232D,SET/3 DECOUPAGE STACKING TINS,24,4.25,14646.0,Netherlands,2025-12-01
512807,85232B,SET/3 RUSSIAN DOLL STACKING TINS,48,4.25,14646.0,Netherlands,2025-12-01
512807,22386,JUMBO BAG PINK WITH WHITE SPOTS,100,1.65,14646.0,Netherlands,2025-12-01
512808,21155,RED SPOTTY PEG BAG,6,2.1,16155.0,United Kingdom,2025-12-01
512808,22094,RED POLKA DOT TISSUE BOX,12,1.25,16155.0,United Kingdom,2025-12-01
512808,37476,CONDIMENT TRAY 4 BOWLS AND 4 SPOONS,1,9.95,16155.0,United Kingdom,2025-12-01
512808,22197,SMALL POPCORN HOLDER,12,0.85,16155.0,United Kingdom,2025-12-01
512808,22557,PLASTERS IN TIN VINTAGE PAISLEY ,12,1.65,16155.0,United Kingdom,2025-12-01
512808,22553,PLASTERS IN TIN SKULLS,12,1.65,16155.0,United Kingdom,2025-12-01
512808,21901,"KEY FOB , BACK DOOR ",24,0.65,16155.0,United Kingdom,2025-12-01
512808,20718,RED SPOTTY SHOPPER BAG,10,1.25,16155.0,United Kingdom,2025-12-01
512808,22333,RETRO SPORT PARTY BAG + STICKER SET,8,1.65,16155.0,United Kingdom,2025-12-01
512808,20717,STRAWBERRY SHOPPER BAG,10,1.25,16155.0,United Kingdom,2025-12-01
512808,22504,CABIN BAG VINTAGE RETROSPOT,1,29.95,16155.0,United Kingdom,2025-12-01
512808,22564,ALPHABET STENCIL CRAFT,12,1.25,16155.0,United Kingdom,2025-12-01
512808,22562,MONSTERS STENCIL CRAFT,12,1.25,16155.0,United Kingdom,2025-12-01
512808,22558,CLOTHES PEGS RETROSPOT PACK 24 ,12,1.25,16155.0,United Kingdom,2025-12-01
512808,21027,NINJA RABBIT PINK,10,1.25,16155.0,United Kingdom,2025-12-01
512818,22379,RECYCLING BAG RETROSPOT ,5,2.1,13293.0,United Kingdom,2025-12-01
512818,22084,PAPER CHAIN KIT EMPIRE,6,2.95,13293.0,United Kingdom,2025-12-01
512818,48138,DOOR MAT UNION FLAG,2,7.49,13293.0,United Kingdom,2025-12-01
512818,22636,CHILDS BREAKFAST SET CIRCUS PARADE,2,8.5,13293.0,United Kingdom,2025-12-01
512818,22441,GROW YOUR OWN BASIL IN ENAMEL MUG,8,2.1,13293.0,United Kingdom,2025-12-01
512818,20685,DOOR MAT RED SPOT,2,7.49,13293.0,United Kingdom,2025-12-01
512818,85099B,JUMBO BAG RED RETROSPOT,10,1.95,13293.0,United Kingdom,2025-12-01
512827,22563,HAPPY STENCIL CRAFT,12,1.25,15981.0,United Kingdom,2025-12-01
512827,22149,FELTCRAFT 6 FLOWER FRIENDS,6,2.1,15981.0,United Kingdom,2025-12-01
512827,22150,3 STRIPEY MICE FELTCRAFT,6,1.95,15981.0,United Kingdom,2025-12-01
512827,22356,CHARLOTTE BAG PINK WITH WHITE SPOTS,20,0.85,15981.0,United Kingdom,2025-12-01
512827,22382,LUNCH BAG SPACEBOY DESIGN ,20,1.65,15981.0,United Kingdom,2025-12-01
512827,22384,LUNCH BAG PINK RETROSPOT,20,1.65,15981.0,United Kingdom,2025-12-01
512827,22385,JUMBO BAG SPACEBOY DESIGN,20,1.95,15981.0,United Kingdom,2025-12-01
512827,22386,JUMBO BAG PINK WITH WHITE SPOTS,20,1.95,15981.0,United Kingdom,2025-12-01
512827,22411,JUMBO SHOPPER VINTAGE RED PAISLEY,20,1.95,15981.0,United Kingdom,2025-12-01
512827,22560,TRADITIONAL MODELLING CLAY,24,1.25,15981.0,United Kingdom,2025-12-01
512827,22585,PACK OF 6 BIRDY GIFT TAGS,12,1.25,15981.0,United Kingdom,2025-12-01
512827,22087,PAPER BUNTING WHITE LACE,6,2.95,15981.0,United Kingdom,2025-12-01
512827,84380,SET OF 3 BUTTERFLY COOKIE CUTTERS,12,1.25,15981.0,United Kingdom,2025-12-01
512827,22088,PAPER BUNTING COLOURED LACE,6,2.95,15981.0,United Kingdom,2025-12-01
512827,21974,SET OF 36 PAISLEY FLOWER DOILIES,12,1.45,15981.0,United Kingdom,2025-12-01
512827,21395,BLUE SPOTTY BEAKER ,10,1.95,15981.0,United Kingdom,2025-12-01
512827,21931,JUMBO STORAGE BAG SUKI,20,1.95,15981.0,United Kingdom,2025-12-01
512827,84378,SET OF 3 HEART COOKIE CUTTERS,12,1.25,15981.0,United Kingdom,2025-12-01
512827,21259,VICTORIAN SEWING BOX SMALL ,2,5.95,15981.0,United Kingdom,2025-12-01
512827,20719,WOODLAND CHARLOTTE BAG,20,0.85,15981.0,United Kingdom,2025-12-01
512827,84988,SET OF 72 PINK HEART PAPER DOILIES,12,1.45,15981.0,United Kingdom,2025-12-01
512827,21912,VINTAGE SNAKES & LADDERS,4,3.75,15981.0,United Kingdom,2025-12-01
512847,82482,WOODEN PICTURE FRAME WHITE FINISH,12,2.55,18170.0,United Kingdom,2025-12-01
C512845,C2,CARRIAGE,-1,50.0,13338.0,United Kingdom,2025-12-01
512847,21795,SET OF 3 BLUE STRIPE BASKET,2,12.75,18170.0,United Kingdom,2025-12-01
512847,21754,HOME BUILDING BLOCK WORD,6,5.95,18170.0,United Kingdom,2025-12-01
512847,84837,WHITE SWEETHEARTS CABINET 4 DRAWERS,1,12.75,18170.0,United Kingdom,2025-12-01
512847,21985,PACK OF 12 HEARTS DESIGN TISSUES ,24,0.29,18170.0,United Kingdom,2025-12-01
512847,82494L,WOODEN FRAME ANTIQUE WHITE ,6,2.95,18170.0,United Kingdom,2025-12-01
512847,82483,WOOD 2 DRAWER CABINET WHITE FINISH,4,5.95,18170.0,United Kingdom,2025-12-01
512847,21755,LOVE BUILDING BLOCK WORD,7,5.95,18170.0,United Kingdom,2025-12-01
512847,21908,CHOCOLATE THIS WAY METAL SIGN,4,2.1,18170.0,United Kingdom,2025-12-01
512847,85152,HAND OVER THE CHOCOLATE   SIGN ,4,2.1,18170.0,United Kingdom,2025-12-01
512847,71053,WHITE METAL LANTERN,4,3.75,18170.0,United Kingdom,2025-12-01
512847,22470,HEART OF WICKER LARGE,5,2.95,18170.0,United Kingdom,2025-12-01
512847,22469,HEART OF WICKER SMALL,10,1.65,18170.0,United Kingdom,2025-12-01
512847,85066,CREAM SWEETHEART MINI CHEST,2,12.75,18170.0,United Kingdom,2025-12-01
512847,48138,DOOR MAT UNION FLAG,2,7.49,18170.0,United Kingdom,2025-12-01
512847,21796,SET OF 3 RED STRIPE BASKETS,2,12.75,18170.0,United Kingdom,2025-12-01
512883,22534,,-190,0.0,,United Kingdom,2025-12-01
512885,85165,,-6,0.0,,United Kingdom,2025-12-01
512884,85060,damaged,-88,0.0,,United Kingdom,2025-12-01
512888,22380,TOY TIDY SPACEBOY  ,2,2.1,17068.0,United Kingdom,2025-12-01
512888,47568,ENGLISH ROSE DESIGN PEG BAG,2,2.1,17068.0,United Kingdom,2025-12-01
512888,47570B,TEA TIME TABLE CLOTH,1,10.65,17068.0,United Kingdom,2025-12-01
512888,22379,RECYCLING BAG RETROSPOT ,3,2.1,17068.0,United Kingdom,2025-12-01
512888,22090,PAPER BUNTING RETRO SPOTS,2,2.95,17068.0,United Kingdom,2025-12-01
512888,22367,CHILDS APRON SPACEBOY DESIGN,3,1.95,17068.0,United Kingdom,2025-12-01
512888,20717,STRAWBERRY SHOPPER BAG,5,1.25,17068.0,United Kingdom,2025-12-01
512888,20718,RED SPOTTY SHOPPER BAG,5,1.25,17068.0,United Kingdom,2025-12-01
512888,21559,STRAWBERRY LUNCH BOX WITH CUTLERY,2,2.55,17068.0,United Kingdom,2025-12-01
512888,21936,RED RETROSPOT PICNIC BAG,3,2.95,17068.0,United Kingdom,2025-12-01
512888,40046A,RED DAISY PAPER LAMPSHADE,3,1.25,17068.0,United Kingdom,2025-12-01
512888,21034,REX CASH+CARRY JUMBO SHOPPER,2,0.95,17068.0,United Kingdom,2025-12-01
512888,22384,LUNCH BAG PINK RETROSPOT,5,1.65,17068.0,United Kingdom,2025-12-01
512888,21558,SKULL LUNCH BOX WITH CUTLERY ,1,2.55,17068.0,United Kingdom,2025-12-01
512888,20727,LUNCH BAG  BLACK SKULL.,2,1.65,17068.0,United Kingdom,2025-12-01
512888,20726,LUNCH BAG WOODLAND,5,1.65,17068.0,United Kingdom,2025-12-01
512888,22381,TOY TIDY PINK RETROSPOT  ,3,2.1,17068.0,United Kingdom,2025-12-01
512888,21937,STRAWBERRY   PICNIC BAG,3,2.95,17068.0,United Kingdom,2025-12-01
512888,22382,LUNCH BAG SPACEBOY DESIGN ,2,1.65,17068.0,United Kingdom,2025-12-01
512888,20725,LUNCH BAG RED SPOTTY,5,1.65,17068.0,United Kingdom,2025-12-01
512888,47590B,PINK HAPPY BIRTHDAY BUNTING,3,5.45,17068.0,United Kingdom,2025-12-01
512888,22383,LUNCH BAG SUKI  DESIGN ,5,1.65,17068.0,United Kingdom,2025-12-01
512886,82551,LAUNDRY 15C METAL SIGN,12,1.25,15641.0,United Kingdom,2025-12-01
512886,82580,BATHROOM METAL SIGN,12,0.55,15641.0,United Kingdom,2025-12-01
512886,82581,TOILET METAL SIGN,12,0.55,15641.0,United Kingdom,2025-12-01
512886,20724,RED SPOTTY CHARLOTTE BAG,10,0.85,15641.0,United Kingdom,2025-12-01
512886,22356,CHARLOTTE BAG PINK WITH WHITE SPOTS,10,0.85,15641.0,United Kingdom,2025-12-01
512886,21929,JUMBO BAG PINK VINTAGE PAISLEY,10,1.95,15641.0,United Kingdom,2025-12-01
512886,20723,STRAWBERRY CHARLOTTE BAG,10,0.85,15641.0,United Kingdom,2025-12-01
512886,85099F,JUMBO BAG STRAWBERRY,10,1.95,15641.0,United Kingdom,2025-12-01
512886,15060B,FAIRY CAKE DESIGN UMBRELLA,4,3.75,15641.0,United Kingdom,2025-12-01
512886,20713,JUMBO BAG OWLS,10,1.95,15641.0,United Kingdom,2025-12-01
512886,82552,WASHROOM METAL SIGN,12,1.25,15641.0,United Kingdom,2025-12-01
512887,22285,,-17,0.0,,United Kingdom,2025-12-01
512888,72760B,VINTAGE CREAM 3 BASKET CAKE STAND,1,9.95,17068.0,United Kingdom,2025-12-01
512888,22328,ROUND SNACK BOXES SET OF 4 FRUITS ,2,2.95,17068.0,United Kingdom,2025-12-01
