Invoice,StockCode,Description,Quantity,Price,Customer ID,Country,InvoiceDate
496628,21188,3D HEARTS  HONEYCOMB PAPER GARLAND,12,2.95,16755.0,United Kingdom,2025-08-12
496628,21677,HEARTS  STICKERS,12,0.85,16755.0,United Kingdom,2025-08-12
496628,21381,MINI WOODEN HAPPY BIRTHDAY GARLAND,12,1.69,16755.0,United Kingdom,2025-08-12
496628,84078A,SET/4 WHITE RETRO STORAGE CUBES ,1,39.95,16755.0,United Kingdom,2025-08-12
496628,85123A,WHITE HANGING HEART T-LIGHT HOLDER,12,2.95,16755.0,United Kingdom,2025-08-12
496628,21288,STRIPEY CHOCOLATE NESTING BOXES,6,2.95,16755.0,United Kingdom,2025-08-12
496628,22133,PINK LOVE HEART SHAPE CUP,12,0.85,16755.0,United Kingdom,2025-08-12
496628,22131,FOOD CONTAINER SET 3 LOVE HEART ,6,1.95,16755.0,United Kingdom,2025-08-12
496628,21733,RED HANGING HEART T-LIGHT HOLDER,6,2.95,16755.0,United Kingdom,2025-08-12
496628,21985,PACK OF 12 HEARTS DESIGN TISSUES ,12,0.29,16755.0,United Kingdom,2025-08-12
496628,22147,FELTCRAFT BUTTERFLY HEARTS,12,1.45,16755.0,United Kingdom,2025-08-12
496629,22344,PARTY PIZZA DISH PINK WHITE SPOT ,12,0.85,12647.0,Germany,2025-08-12
496629,22343,PARTY PIZZA DISH RED WHITE SPOT ,12,0.85,12647.0,Germany,2025-08-12
C496630,22244,"HOOK, 3 HANGER ,MAGIC GARDEN",-12,1.95,12647.0,Germany,2025-08-12
C496630,22243,"HOOK, 5 HANGER ,MAGIC TOADSTOOL RED",-12,1.65,12647.0,Germany,2025-08-12
496631,48197,DOOR MAT BIRD ON THE WIRE,2,6.75,14146.0,United Kingdom,2025-08-12
496631,22111,SCOTTIE DOG HOT WATER BOTTLE,3,4.95,14146.0,United Kingdom,2025-08-12
496631,21485,RED SPOT HEART HOT WATER BOTTLE,3,4.95,14146.0,United Kingdom,2025-08-12
496631,22317,FIVE CATS HANGING DECORATION,6,2.95,14146.0,United Kingdom,2025-08-12
496631,20703,BLUE PADDED SOFT MOBILE,3,4.25,14146.0,United Kingdom,2025-08-12
496631,21329,DINOSAURS  WRITING SET ,12,1.65,14146.0,United Kingdom,2025-08-12
496631,21330,WOODLAND ANIMAL  WRITING SET ,12,1.65,14146.0,United Kingdom,2025-08-12
496631,21328,BALLOONS  WRITING SET ,12,1.65,14146.0,United Kingdom,2025-08-12
496631,22215,CAKE STAND WHITE TWO TIER LACE,2,8.5,14146.0,United Kingdom,2025-08-12
496631,84029E,RED WOOLLY HOTTIE WHITE HEART.,4,3.75,14146.0,United Kingdom,2025-08-12
496631,21498,RED SPOTS  WRAP ,25,0.42,14146.0,United Kingdom,2025-08-12
496631,21527,RETRO SPOT TRADITIONAL TEAPOT ,2,7.95,14146.0,United Kingdom,2025-08-12
496631,85118,HEART T-LIGHT HOLDER,12,1.25,14146.0,United Kingdom,2025-08-12
496631,85123A,WHITE HANGING HEART T-LIGHT HOLDER,6,2.95,14146.0,United Kingdom,2025-08-12
496631,48194,DOOR MAT HEARTS,2,6.75,14146.0,United Kingdom,2025-08-12
496631,22196,SMALL HEART MEASURING SPOONS,12,0.85,14146.0,United Kingdom,2025-08-12
496631,84378,SET OF 3 HEART COOKIE CUTTERS,12,1.25,14146.0,United Kingdom,2025-08-12
496631,84813,SET OF 4 DIAMOND NAPKIN RINGS,2,12.75,14146.0,United Kingdom,2025-08-12
496631,72741,GRAND CHOCOLATECANDLE,18,1.45,14146.0,United Kingdom,2025-08-12
496631,21317,GLASS SPHERE CANDLE STAND MEDIUM,2,5.45,14146.0,United Kingdom,2025-08-12
496631,22320,BIRDS MOBILE VINTAGE DESIGN,3,5.95,14146.0,United Kingdom,2025-08-12
496631,21524,DOOR MAT SPOTTY HOME SWEET HOME,2,6.75,14146.0,United Kingdom,2025-08-12
496631,48195,DOOR MAT GREEN PAISLEY ,2,6.75,14146.0,United Kingdom,2025-08-12
496631,84978,HANGING HEART JAR T-LIGHT HOLDER,12,1.25,14146.0,United Kingdom,2025-08-12
496632,16207A,,10,0.0,,United Kingdom,2025-08-12
496633,84925A,,15,0.0,,United Kingdom,2025-08-12
496635,21967,,2,0.0,,United Kingdom,2025-08-12
496634,20736,,7,0.0,,United Kingdom,2025-08-12
496637,72785B,,1,0.0,,United Kingdom,2025-08-12
496636,90121B,,1,0.0,,United Kingdom,2025-08-12
496638,51012C,,12,0.0,,United Kingdom,2025-08-12
496639,85193S,,-80,0.0,,United Kingdom,2025-08-12
496640,85018C,,3,0.0,,United Kingdom,2025-08-12
496641,22381,TOY TIDY PINK RETROSPOT  ,5,2.1,15091.0,United Kingdom,2025-08-12
496641,22380,TOY TIDY SPACEBOY  ,5,2.1,15091.0,United Kingdom,2025-08-12
496641,21259,VICTORIAN SEWING BOX SMALL ,2,5.95,15091.0,United Kingdom,2025-08-12
496641,22275,WEEKEND BAG VINTAGE ROSE PAISLEY,2,8.5,15091.0,United Kingdom,2025-08-12
496641,22378,WALL TIDY RETROSPOT ,5,2.1,15091.0,United Kingdom,2025-08-12
496641,22379,RECYCLING BAG RETROSPOT ,5,2.1,15091.0,United Kingdom,2025-08-12
496641,21527,RETRO SPOT TRADITIONAL TEAPOT ,12,6.95,15091.0,United Kingdom,2025-08-12
496641,22367,CHILDS APRON SPACEBOY DESIGN,8,1.95,15091.0,United Kingdom,2025-08-12
496641,22357,KINGS CHOICE BISCUIT TIN,4,4.25,15091.0,United Kingdom,2025-08-12
496641,22091,EMPIRE TISSUE BOX,12,1.25,15091.0,United Kingdom,2025-08-12
496641,48138,DOOR MAT UNION FLAG,2,6.75,15091.0,United Kingdom,2025-08-12
496641,21524,SPOTTY  HOME SWEET HOME DOORMAT,10,5.95,15091.0,United Kingdom,2025-08-12
496641,22175,PINK OWL SOFT TOY,6,2.95,15091.0,United Kingdom,2025-08-12
496641,22176,BLUE OWL SOFT TOY,6,2.95,15091.0,United Kingdom,2025-08-12
496641,20914,SET/5 RED SPOTTY LID GLASS BOWLS,6,2.95,15091.0,United Kingdom,2025-08-12
496642,21232,STRAWBERRY CERAMIC TRINKET BOX,12,1.25,15091.0,United Kingdom,2025-08-12
496642,71053,WHITE METAL LANTERN,4,3.75,15091.0,United Kingdom,2025-08-12
496642,22095,LADS ONLY TISSUE BOX,12,1.25,15091.0,United Kingdom,2025-08-12
496642,16169N,WRAP BLUE RUSSIAN FOLKART,25,0.42,15091.0,United Kingdom,2025-08-12
496642,16161U,"WRAP,SUKI AND FRIENDS",25,0.42,15091.0,United Kingdom,2025-08-12
496642,22107,PIZZA PLATE IN BOX,4,3.75,15091.0,United Kingdom,2025-08-12
496642,22190,LOCAL CAFE MUG,6,2.1,15091.0,United Kingdom,2025-08-12
496642,21164,HOME SWEET HOME METAL SIGN ,6,2.95,15091.0,United Kingdom,2025-08-12
496642,85123A,WHITE HANGING HEART T-LIGHT HOLDER,32,2.55,15091.0,United Kingdom,2025-08-12
496642,20970,PINK FLORAL FELTCRAFT SHOULDER BAG,4,3.75,15091.0,United Kingdom,2025-08-12
496642,20971,PINK BLUE FELT CRAFT TRINKET BOX,12,1.25,15091.0,United Kingdom,2025-08-12
496642,22109,FULL ENGLISH BREAKFAST PLATE,4,3.75,15091.0,United Kingdom,2025-08-12
496644,85231B,CINAMMON SET OF 9 T-LIGHTS,1,0.85,15003.0,United Kingdom,2025-08-12
496644,85231E,STRAWBERRY SCENTED SET/9 T-LIGHTS,1,0.85,15003.0,United Kingdom,2025-08-12
496644,72023F,RED ORGANIC CANDLE IN GLASS,2,1.25,15003.0,United Kingdom,2025-08-12
496644,84997B,RED 3 PIECE MINI DOTS CUTLERY SET,1,3.75,15003.0,United Kingdom,2025-08-12
496644,84997C,BLUE 3 PIECE MINI DOTS CUTLERY SET,1,3.75,15003.0,United Kingdom,2025-08-12
496644,84378,SET OF 3 HEART COOKIE CUTTERS,2,1.25,15003.0,United Kingdom,2025-08-12
496644,84459B,YELLOW METAL CHICKEN HEART ,2,1.49,15003.0,United Kingdom,2025-08-12
496644,35918B,BLUE FLORIBUNDA EGG WARMER,1,1.25,15003.0,United Kingdom,2025-08-12
496644,21383,PACK OF 12 STICKY BUNNIES,2,0.65,15003.0,United Kingdom,2025-08-12
496644,84437A,S/6 PINK EASTER DECS IN BOX,2,0.85,15003.0,United Kingdom,2025-08-12
496644,21892,TRADITIONAL WOODEN CATCH CUP GAME ,4,1.25,15003.0,United Kingdom,2025-08-12
496644,37370,RETRO COFFEE MUGS ASSORTED,1,1.25,15003.0,United Kingdom,2025-08-12
496644,21871,SAVE THE PLANET MUG,1,1.25,15003.0,United Kingdom,2025-08-12
496644,35914,PINK CHICK EGG WARMER + EGG CUP,1,2.1,15003.0,United Kingdom,2025-08-12
496644,21457,2 PICTURE BOOK EGGS EASTER DUCKS,1,1.25,15003.0,United Kingdom,2025-08-12
496644,22353,LUNCHBOX WITH CUTLERY FAIRY CAKES ,1,2.55,15003.0,United Kingdom,2025-08-12
496644,84880,WHITE WIRE EGG HOLDER,1,5.95,15003.0,United Kingdom,2025-08-12
496644,21869,POTTING SHED COFFEE MUG,1,1.25,15003.0,United Kingdom,2025-08-12
496644,90214J,"LETTER ""J"" BLING KEY RING",1,1.25,15003.0,United Kingdom,2025-08-12
496644,20993,JAZZ HEARTS MEMO PAD,2,0.85,15003.0,United Kingdom,2025-08-12
496644,84519A,TOMATO CHARLIE+LOLA COASTER SET,1,2.95,15003.0,United Kingdom,2025-08-12
496644,84519B,CARROT CHARLIE+LOLA COASTER SET,1,2.95,15003.0,United Kingdom,2025-08-12
496644,84675,FROG KING WATERING CAN,1,2.95,15003.0,United Kingdom,2025-08-12
496644,21458,2 PICTURE BOOK EGGS EASTER BUNNY,1,1.25,15003.0,United Kingdom,2025-08-12
496644,84674,FLYING PIG WATERING CAN,1,2.95,15003.0,United Kingdom,2025-08-12
496644,85232D,SET/3 DECOUPAGE STACKING TINS,1,4.95,15003.0,United Kingdom,2025-08-12
496644,22383,LUNCH BAG SUKI  DESIGN ,1,1.65,15003.0,United Kingdom,2025-08-12
496644,20728,LUNCH BAG CARS BLUE,1,1.65,15003.0,United Kingdom,2025-08-12
496644,90214V,"LETTER ""V"" BLING KEY RING",1,1.25,15003.0,United Kingdom,2025-08-12
496644,21561,DINOSAUR LUNCHBOX WITH CUTLERY,1,2.55,15003.0,United Kingdom,2025-08-12
496644,22352,LUNCHBOX WITH CUTLERY RETROSPOT ,1,2.55,15003.0,United Kingdom,2025-08-12
496644,85008,SET OF 3 CONEY ISLAND OVAL BOXES,1,4.95,15003.0,United Kingdom,2025-08-12
496644,37370,RETRO COFFEE MUGS ASSORTED,1,1.25,15003.0,United Kingdom,2025-08-12
496643,22087,PAPER BUNTING WHITE LACE,40,2.55,13408.0,United Kingdom,2025-08-12
496644,21942,SKULLS DESIGN FLANNEL,1,0.85,15003.0,United Kingdom,2025-08-12
496644,21106,CREAM SLICE FLANNEL CHOCOLATE SPOT ,1,2.95,15003.0,United Kingdom,2025-08-12
496644,21107,CREAM SLICE FLANNEL PINK SPOT ,1,2.95,15003.0,United Kingdom,2025-08-12
496644,21733,RED HANGING HEART T-LIGHT HOLDER,2,2.95,15003.0,United Kingdom,2025-08-12
496644,85123A,WHITE HANGING HEART T-LIGHT HOLDER,3,2.95,15003.0,United Kingdom,2025-08-12
496644,21642,ASSORTED TUTTI FRUTTI PEN,3,0.85,15003.0,United Kingdom,2025-08-12
496644,10125,MINI FUNKY DESIGN TAPES,2,0.85,15003.0,United Kingdom,2025-08-12
496644,85049E,SCANDINAVIAN REDS RIBBONS,1,1.25,15003.0,United Kingdom,2025-08-12
496643,22148,EASTER CRAFT 4 CHICKS ,40,1.65,13408.0,United Kingdom,2025-08-12
496643,22291,"SPRING DEC , HANGING CHICK CREAM",48,1.45,13408.0,United Kingdom,2025-08-12
496643,21985,PACK OF 12 HEARTS DESIGN TISSUES ,48,0.29,13408.0,United Kingdom,2025-08-12
496643,22189,CREAM HEART CARD HOLDER,36,3.39,13408.0,United Kingdom,2025-08-12
496643,22079,RIBBON REEL HEARTS DESIGN ,30,1.65,13408.0,United Kingdom,2025-08-12
496643,21621,VINTAGE UNION JACK BUNTING,12,8.5,13408.0,United Kingdom,2025-08-12
496643,21622,VINTAGE UNION JACK CUSHION COVER,4,4.95,13408.0,United Kingdom,2025-08-12
496643,22083,PAPER CHAIN KIT RETRO SPOT,40,2.55,13408.0,United Kingdom,2025-08-12
496644,21875,KINGS CHOICE MUG,1,1.25,15003.0,United Kingdom,2025-08-12
496643,20972,PINK CREAM FELT CRAFT TRINKET BOX ,48,1.25,13408.0,United Kingdom,2025-08-12
496643,22381,TOY TIDY PINK RETROSPOT  ,10,2.1,13408.0,United Kingdom,2025-08-12
496643,22380,TOY TIDY SPACEBOY  ,10,2.1,13408.0,United Kingdom,2025-08-12
496643,22241,GARLAND WOODEN HAPPY EASTER,36,1.25,13408.0,United Kingdom,2025-08-12
496643,84406B,CREAM CUPID HEARTS COAT HANGER,32,2.75,13408.0,United Kingdom,2025-08-12
496643,PADS,PADS TO MATCH ALL CUSHIONS,1,0.001,13408.0,United Kingdom,2025-08-12
496643,70006,LOVE HEART POCKET WARMER,90,1.25,13408.0,United Kingdom,2025-08-12
496643,21190,PINK HEARTS PAPER GARLAND,48,1.45,13408.0,United Kingdom,2025-08-12
496643,72008,FROSTED BOX 9 WHITE T-LIGHT CANDLES,48,0.42,13408.0,United Kingdom,2025-08-12
496643,46000M,POLYESTER FILLER PAD 45x45cm,4,1.55,13408.0,United Kingdom,2025-08-12
496644,85049F,BABY BOOM RIBBONS ,1,1.25,15003.0,United Kingdom,2025-08-12
496644,21945,STRAWBERRIES  DESIGN FLANNEL ,1,0.85,15003.0,United Kingdom,2025-08-12
496644,21944,KITTENS DESIGN FLANNEL,1,0.85,15003.0,United Kingdom,2025-08-12
496644,21943,CAKES AND RABBITS DESIGN FLANNEL ,1,0.85,15003.0,United Kingdom,2025-08-12
496643,22274,FELTCRAFT DOLL EMILY,18,2.95,13408.0,United Kingdom,2025-08-12
496645,21855,,-1,0.0,,United Kingdom,2025-08-12
496646,16131,,-1,0.0,,United Kingdom,2025-08-12
496648,20720,,-1,0.0,,United Kingdom,2025-08-12
496647,18094A,,-1,0.0,,United Kingdom,2025-08-12
496649,20879,,-1,0.0,,United Kingdom,2025-08-12
496650,21345,,-1,0.0,,United Kingdom,2025-08-12
496651,84450A,PINK RABBIT SITTING EASTER,4,0.42,13553.0,United Kingdom,2025-08-12
496651,21158,MOODY GIRL DOOR HANGER ,1,1.45,13553.0,United Kingdom,2025-08-12
496651,21163,DO NOT TOUCH MY STUFF DOOR HANGER ,1,1.45,13553.0,United Kingdom,2025-08-12
496651,47504K,ENGLISH ROSE GARDEN SECATEURS,2,1.95,13553.0,United Kingdom,2025-08-12
496651,21162,TOXIC AREA  DOOR HANGER ,1,1.45,13553.0,United Kingdom,2025-08-12
496651,20703,BLUE PADDED SOFT MOBILE,1,4.25,13553.0,United Kingdom,2025-08-12
496651,51014C,"FEATHER PEN,COAL BLACK",12,0.85,13553.0,United Kingdom,2025-08-12
496651,51014A,"FEATHER PEN,HOT PINK",12,0.85,13553.0,United Kingdom,2025-08-12
496651,47566B,TEA TIME PARTY BUNTING,1,4.65,13553.0,United Kingdom,2025-08-12
496651,15060B,FAIRY CAKE DESIGN UMBRELLA,2,3.75,13553.0,United Kingdom,2025-08-12
496651,21754,HOME BUILDING BLOCK WORD,1,5.95,13553.0,United Kingdom,2025-08-12
496651,20681,PINK SPOTTY CHILDS UMBRELLA,2,3.25,13553.0,United Kingdom,2025-08-12
496651,47591C,BLUE FAIRY CAKE CHILD'S APRON,2,1.95,13553.0,United Kingdom,2025-08-12
496651,20702,PINK PADDED MOBILE,2,4.25,13553.0,United Kingdom,2025-08-12
496651,47566B,TEA TIME PARTY BUNTING,1,4.65,13553.0,United Kingdom,2025-08-12
496651,47504G,ENGLISH ROSE TAPE MEASURE,2,1.25,13553.0,United Kingdom,2025-08-12
496651,51012C,"FEATHER DUSTER, COAL BLACK",3,1.25,13553.0,United Kingdom,2025-08-12
496651,21755,LOVE BUILDING BLOCK WORD,1,5.95,13553.0,United Kingdom,2025-08-12
496651,20621,ECONOMY PASSPORT COVER ,2,2.1,13553.0,United Kingdom,2025-08-12
496651,47567B,TEA TIME KITCHEN APRON,2,5.95,13553.0,United Kingdom,2025-08-12
496651,21902,"KEY FOB , FRONT  DOOR ",2,0.65,13553.0,United Kingdom,2025-08-12
496651,20617,FIRST CLASS PASSPORT COVER ,2,2.1,13553.0,United Kingdom,2025-08-12
496651,47568,ENGLISH ROSE DESIGN PEG BAG,1,2.1,13553.0,United Kingdom,2025-08-12
496651,21864,UNION JACK FLAG PASSPORT COVER ,2,2.1,13553.0,United Kingdom,2025-08-12
496651,21174,POTTERING IN THE SHED METAL SIGN,1,1.95,13553.0,United Kingdom,2025-08-12
496651,22197,"POPCORN HOLDER , SMALL ",7,0.85,13553.0,United Kingdom,2025-08-12
496651,21042,RED SPOTTY APRON ,1,5.95,13553.0,United Kingdom,2025-08-12
496651,22021,BLUE FELT EASTER EGG BASKET,3,1.65,13553.0,United Kingdom,2025-08-12
496651,85206B,PINK FELT EASTER EGG BASKET,3,1.65,13553.0,United Kingdom,2025-08-12
496651,85206A,CREAM FELT EASTER EGG BASKET,3,1.65,13553.0,United Kingdom,2025-08-12
496651,22220,CAKE STAND LOVEBIRD 2 TIER WHITE,1,9.95,13553.0,United Kingdom,2025-08-12
496651,37348,SET OF 4 PASTEL STACKING MUGS,1,2.55,13553.0,United Kingdom,2025-08-12
496651,47567B,TEA TIME KITCHEN APRON,1,5.95,13553.0,United Kingdom,2025-08-12
496651,84509G,FAIRY CAKE PLACEMATS ,1,3.75,13553.0,United Kingdom,2025-08-12
496651,21155,RED SPOTTY PEG BAG,1,2.1,13553.0,United Kingdom,2025-08-12
496651,21154,RED SPOTTY OVEN GLOVE ,1,1.25,13553.0,United Kingdom,2025-08-12
496651,47559B,TEA TIME OVEN GLOVE,2,1.25,13553.0,United Kingdom,2025-08-12
496651,20749,ASSORTED COLOUR MINI CASES,1,7.95,13553.0,United Kingdom,2025-08-12
496651,47567B,TEA TIME KITCHEN APRON,1,5.95,13553.0,United Kingdom,2025-08-12
496651,47568,ENGLISH ROSE DESIGN PEG BAG,1,2.1,13553.0,United Kingdom,2025-08-12
496651,21591,COSY HOUR CIGAR BOX MATCHES ,2,1.25,13553.0,United Kingdom,2025-08-12
496651,21592,RETRO SPOT  CIGAR BOX MATCHES ,1,1.25,13553.0,United Kingdom,2025-08-12
496651,21593,SWALLOW CIGAR BOX MATCHES ,1,1.25,13553.0,United Kingdom,2025-08-12
496651,21218,RED SPOTTY BISCUIT TIN,1,3.75,13553.0,United Kingdom,2025-08-12
496651,84231,EASTER BUNNY WITH BASKET ON BACK,4,0.65,13553.0,United Kingdom,2025-08-12
496651,22221,CAKE STAND LOVEBIRD 2 TIER PINK,1,9.95,13553.0,United Kingdom,2025-08-12
496651,47559B,TEA TIME OVEN GLOVE,3,1.25,13553.0,United Kingdom,2025-08-12
496651,21523,DOOR MAT FANCY FONT HOME SWEET HOME,1,6.75,13553.0,United Kingdom,2025-08-12
496651,21745,GAOLERS KEYS DECORATIVE GARDEN ,1,3.75,13553.0,United Kingdom,2025-08-12
496651,82600,NO SINGING METAL SIGN,1,2.1,13553.0,United Kingdom,2025-08-12
496651,20750, RED/WHITE DOT MINI CASES,2,7.95,13553.0,United Kingdom,2025-08-12
496651,21770,OPEN CLOSED METAL SIGN,1,4.95,13553.0,United Kingdom,2025-08-12
496651,20829,GLITTER HANGING BUTTERFLY STRING,3,2.1,13553.0,United Kingdom,2025-08-12
496651,85205A,IVORY FELT EASTER RABBIT GARLAND,5,2.55,13553.0,United Kingdom,2025-08-12
496651,85205B,PINK FELT EASTER RABBIT GARLAND,5,2.55,13553.0,United Kingdom,2025-08-12
496651,85232B,SET/3 RUSSIAN DOLL STACKING TINS,1,4.95,13553.0,United Kingdom,2025-08-12
496651,22195,LARGE HEART MEASURING SPOONS,1,1.65,13553.0,United Kingdom,2025-08-12
496651,85198,ASSORTED FARMYARD ANIMALS IN BUCKET,12,0.85,13553.0,United Kingdom,2025-08-12
496651,82553,POP'S GREASY SPOON METAL SIGN,1,1.65,13553.0,United Kingdom,2025-08-12
496651,85198,ASSORTED FARMYARD ANIMALS IN BUCKET,4,0.85,13553.0,United Kingdom,2025-08-12
496651,21159,MOODY BOY  DOOR HANGER ,1,1.45,13553.0,United Kingdom,2025-08-12
496651,22241,GARLAND WOODEN HAPPY EASTER,1,1.25,13553.0,United Kingdom,2025-08-12
496651,22196,SMALL HEART MEASURING SPOONS,1,0.85,13553.0,United Kingdom,2025-08-12
496651,21899,"KEY FOB , GARAGE DESIGN",2,0.65,13553.0,United Kingdom,2025-08-12
496651,21901,"KEY FOB , BACK DOOR ",1,0.65,13553.0,United Kingdom,2025-08-12
496651,21900,"KEY FOB , SHED",2,0.65,13553.0,United Kingdom,2025-08-12
496651,22242,"HOOK, 5 HANGER , MAGIC TOADSTOOL",2,1.65,13553.0,United Kingdom,2025-08-12
496651,21179,NO JUNK MAIL METAL SIGN,1,1.25,13553.0,United Kingdom,2025-08-12
496651,21865,PINK UNION JACK  PASSPORT COVER ,2,2.1,13553.0,United Kingdom,2025-08-12
496651,47504H,ENGLISH ROSE SPIRIT LEVEL ,2,1.95,13553.0,United Kingdom,2025-08-12
496651,21179,NO JUNK MAIL METAL SIGN,1,1.25,13553.0,United Kingdom,2025-08-12
496651,85152,HAND OVER THE CHOCOLATE   SIGN ,1,2.1,13553.0,United Kingdom,2025-08-12
496651,21185, HOME SWEET HOME  BLACKBOARD,1,6.35,13553.0,United Kingdom,2025-08-12
496651,22365,DOOR MAT RESPECTABLE HOUSE,1,6.75,13553.0,United Kingdom,2025-08-12
496651,48185,DOOR MAT FAIRY CAKE,1,6.75,13553.0,United Kingdom,2025-08-12
496651,22414,DOOR MAT NEIGHBOURHOOD WITCH ,1,6.75,13553.0,United Kingdom,2025-08-12
496651,21524,DOOR MAT SPOTTY HOME SWEET HOME,1,6.75,13553.0,United Kingdom,2025-08-12
496651,84824,DANISH ROSE UMBRELLA STAND,1,15.95,13553.0,United Kingdom,2025-08-12
496651,84857A,SILVER MONTE CARLO HANDBAG,1,8.5,13553.0,United Kingdom,2025-08-12
496651,21165,BEWARE OF THE CAT METAL SIGN ,1,1.69,13553.0,United Kingdom,2025-08-12
496651,84555A,YELLOW VW BEETLE CERAMIC MONEY BOX,2,2.95,13553.0,United Kingdom,2025-08-12
496651,35001G,HAND OPEN SHAPE GOLD,4,4.25,13553.0,United Kingdom,2025-08-12
496651,84533B,FAIRY CAKES ROUND NESTING BOXES,1,5.95,13553.0,United Kingdom,2025-08-12
496651,47566B,TEA TIME PARTY BUNTING,6,4.65,13553.0,United Kingdom,2025-08-12
496651,20703,BLUE PADDED SOFT MOBILE,1,4.25,13553.0,United Kingdom,2025-08-12
496651,21986,PACK OF 12 PINK SPOT TISSUES ,12,0.29,13553.0,United Kingdom,2025-08-12
496651,20828,GLITTER BUTTERFLY CLIPS,4,2.55,13553.0,United Kingdom,2025-08-12
496651,47581B,FAIRY CAKE WICKER PICNIC BASKET ,1,12.75,13553.0,United Kingdom,2025-08-12
496651,82486,WOOD S/3 CABINET ANT WHITE FINISH,2,7.95,13553.0,United Kingdom,2025-08-12
496651,84509B,FAIRY CAKE PLACEMATS,1,3.75,13553.0,United Kingdom,2025-08-12
496651,85121B,RETRO LAUNDRY TUB PINK,1,8.5,13553.0,United Kingdom,2025-08-12
496651,84688,BEACH HUT DESIGN BLACKBOARD,1,4.25,13553.0,United Kingdom,2025-08-12
496651,20689,RETRO SISTERS EXPRESSO CUPS,1,5.95,13553.0,United Kingdom,2025-08-12
496651,84425A,WHITE GLASS TV TRIPLE FRAME,2,4.25,13553.0,United Kingdom,2025-08-12
496652,21769,VINTAGE POST OFFICE CABINET,1,79.95,16928.0,United Kingdom,2025-08-12
496652,46776F,WOVEN ROSE GARDEN CUSHION COVER ,5,4.95,16928.0,United Kingdom,2025-08-12
496652,22354,RETRO SPOT PADDED SEAT CUSHION,2,3.75,16928.0,United Kingdom,2025-08-12
496653,21475,,-1,0.0,,United Kingdom,2025-08-12
496660,21047,,-1,0.0,,United Kingdom,2025-08-12
496662,22185,SLATE TILE NATURAL HANGING,6,1.65,13757.0,United Kingdom,2025-08-12
496662,21659,GLASS CAKE STAND,12,12.75,13757.0,United Kingdom,2025-08-12
496662,22316,200 BENDY SKULL STRAWS,1,1.25,13757.0,United Kingdom,2025-08-12
496662,79302M,"ART LIGHTS,FUNK MONKEY",1,2.95,13757.0,United Kingdom,2025-08-12
496662,21679,SKULLS  STICKERS,6,0.85,13757.0,United Kingdom,2025-08-12
496662,21250,SET OF SKULL WALL STICKERS,1,2.95,13757.0,United Kingdom,2025-08-12
496662,79321,CHILLI LIGHTS,2,4.95,13757.0,United Kingdom,2025-08-12
496662,21495,SKULLS WRAP,25,0.42,13757.0,United Kingdom,2025-08-12
496665,22352,LUNCHBOX WITH CUTLERY RETROSPOT ,6,2.55,17311.0,United Kingdom,2025-08-12
496665,22379,RECYCLING BAG RETROSPOT ,5,2.1,17311.0,United Kingdom,2025-08-12
496665,21791,VINTAGE HEADS AND TAILS CARD GAME ,12,1.25,17311.0,United Kingdom,2025-08-12
496665,22028,PENNY FARTHING BIRTHDAY CARD,12,0.42,17311.0,United Kingdom,2025-08-12
496665,22029,SPACE BOY BIRTHDAY CARD,12,0.42,17311.0,United Kingdom,2025-08-12
496665,21509,COWBOYS AND INDIANS BIRTHDAY CARD ,12,0.42,17311.0,United Kingdom,2025-08-12
496665,21507,"ELEPHANT, BIRTHDAY CARD, ",12,0.42,17311.0,United Kingdom,2025-08-12
496665,21508,VINTAGE KID DOLLY CARD ,12,0.42,17311.0,United Kingdom,2025-08-12
496665,22027,TEA PARTY BIRTHDAY CARD,12,0.42,17311.0,United Kingdom,2025-08-12
496665,21985,PACK OF 12 HEARTS DESIGN TISSUES ,48,0.29,17311.0,United Kingdom,2025-08-12
496665,21790,VINTAGE SNAP CARDS,12,0.85,17311.0,United Kingdom,2025-08-12
496665,20960,WATERMELON BATH SPONGE,20,1.25,17311.0,United Kingdom,2025-08-12
496665,22198,"POPCORN HOLDER , LARGE",36,1.65,17311.0,United Kingdom,2025-08-12
496665,22127,PARTY CONES CARNIVAL ASSORTED,36,1.25,17311.0,United Kingdom,2025-08-12
496665,51014A,"FEATHER PEN,HOT PINK",36,0.85,17311.0,United Kingdom,2025-08-12
496665,22319,HAIRCLIPS FORTIES FABRIC ASSORTED,36,0.65,17311.0,United Kingdom,2025-08-12
496665,22149,FELTCRAFT 6 FLOWER FRIENDS,40,1.85,17311.0,United Kingdom,2025-08-12
496665,22146,EASTER CRAFT IVY WREATH WITH CHICK,40,1.65,17311.0,United Kingdom,2025-08-12
496665,22148,EASTER CRAFT 4 CHICKS ,40,1.65,17311.0,United Kingdom,2025-08-12
496665,85196,EASTER BUNNIES ON A STICK,24,0.55,17311.0,United Kingdom,2025-08-12
496665,22131,FOOD CONTAINER SET 3 LOVE HEART ,6,1.95,17311.0,United Kingdom,2025-08-12
496675,21621,VINTAGE UNION JACK BUNTING,2,8.5,16840.0,United Kingdom,2025-08-12
496675,84987,SET OF 36 TEATIME PAPER DOILIES,12,1.45,16840.0,United Kingdom,2025-08-12
496675,84989A,75 GREEN FAIRY CAKE CASES,24,0.55,16840.0,United Kingdom,2025-08-12
496675,21210,SET OF 72 RETRO SPOT PAPER  DOILIES,12,1.45,16840.0,United Kingdom,2025-08-12
496675,21212,PACK OF 72 RETRO SPOT CAKE CASES,24,0.55,16840.0,United Kingdom,2025-08-12
496675,47590A,BLUE HAPPY BIRTHDAY BUNTING,3,5.45,16840.0,United Kingdom,2025-08-12
496675,84992,72 SWEETHEART FAIRY CAKE CASES,24,0.55,16840.0,United Kingdom,2025-08-12
496677,72741,GRAND CHOCOLATECANDLE,9,1.45,16081.0,United Kingdom,2025-08-12
496677,21125,SET 6 FOOTBALL CELEBRATION CANDLES,1,1.25,16081.0,United Kingdom,2025-08-12
496677,84219,BOX/12 MOTHER & CHICK IN BASKET/BOW,1,2.55,16081.0,United Kingdom,2025-08-12
496677,22064,PINK DOUGHNUT TRINKET POT ,4,1.65,16081.0,United Kingdom,2025-08-12
496677,22059,CERAMIC STRWBERRY DESIGN MUG,1,1.49,16081.0,United Kingdom,2025-08-12
496677,22139,RETRO SPOT TEA SET CERAMIC 11 PC ,1,4.95,16081.0,United Kingdom,2025-08-12
496677,22063,CERAMIC BOWL WITH STRAWBERRY DESIGN,2,2.95,16081.0,United Kingdom,2025-08-12
496677,21232,STRAWBERRY CERAMIC TRINKET BOX,2,1.25,16081.0,United Kingdom,2025-08-12
496677,37502,TEA TIME MUG IN GIFT BOX,1,2.95,16081.0,United Kingdom,2025-08-12
496677,47556B,TEA TIME TEA TOWELS ,3,2.95,16081.0,United Kingdom,2025-08-12
496677,84988,SET OF 72 PINK HEART PAPER DOILIES,2,1.45,16081.0,United Kingdom,2025-08-12
496677,84987,SET OF 36 TEATIME PAPER DOILIES,2,1.45,16081.0,United Kingdom,2025-08-12
496677,37495,FAIRY CAKE BIRTHDAY CANDLE SET,1,3.75,16081.0,United Kingdom,2025-08-12
496677,22054,MINI CAKE STAND HANGING HEARTS,1,1.65,16081.0,United Kingdom,2025-08-12
496677,84997D,PINK 3 PIECE MINI DOTS CUTLERY SET,1,3.75,16081.0,United Kingdom,2025-08-12
496677,22059,CERAMIC STRWBERRY DESIGN MUG,1,1.49,16081.0,United Kingdom,2025-08-12
496677,22057,CERAMIC PLATE STRAWBERRY DESIGN,2,1.49,16081.0,United Kingdom,2025-08-12
496677,37447,CERAMIC CAKE DESIGN SPOTTED PLATE,3,1.49,16081.0,United Kingdom,2025-08-12
496677,37502,TEA TIME MUG IN GIFT BOX,1,2.95,16081.0,United Kingdom,2025-08-12
496677,48185,DOOR MAT FAIRY CAKE,1,6.75,16081.0,United Kingdom,2025-08-12
496677,22054,MINI CAKE STAND HANGING HEARTS,1,1.65,16081.0,United Kingdom,2025-08-12
496677,84997C,BLUE 3 PIECE MINI DOTS CUTLERY SET,1,3.75,16081.0,United Kingdom,2025-08-12
496677,20854,BLUE PATCH PURSE PINK HEART,1,1.65,16081.0,United Kingdom,2025-08-12
496677,20855,PINK PATCH PURSE BLUE HEART,2,1.65,16081.0,United Kingdom,2025-08-12
496677,37503,TEA TIME CAKE STAND IN GIFT BOX,1,10.75,16081.0,United Kingdom,2025-08-12
496677,47598,NEW ENGLAND EGG WARMER,2,0.55,16081.0,United Kingdom,2025-08-12
496678,21052,,-1,0.0,,United Kingdom,2025-08-12
496679,21564,PINK  HEART SHAPE LOVE BUCKET ,2,2.95,,United Kingdom,2025-08-12
496680,84450A,,4,0.0,,United Kingdom,2025-08-12
496681,22494,EMERGENCY FIRST AID TIN ,1,1.25,,United Kingdom,2025-08-12
496681,22497,SET OF 2 TINS VINTAGE BATHROOM ,1,4.25,,United Kingdom,2025-08-12
496682,22139,,1,0.0,,United Kingdom,2025-08-12
C496687,21733,RED HANGING HEART T-LIGHT HOLDER,-1,2.55,14399.0,United Kingdom,2025-08-12
C496687,85123A,WHITE HANGING HEART T-LIGHT HOLDER,-1,2.55,14399.0,United Kingdom,2025-08-12
C496687,22342,HOME GARLAND PAINTED ZINC ,-6,1.65,14399.0,United Kingdom,2025-08-12
496690,22209,WOOD STAMP SET HAPPY BIRTHDAY,2,1.65,14399.0,United Kingdom,2025-08-12
496690,22208,WOOD STAMP SET THANK YOU,2,1.65,14399.0,United Kingdom,2025-08-12
496690,22211,WOOD STAMP SET FLOWERS,2,1.65,14399.0,United Kingdom,2025-08-12
496690,22210,WOOD STAMP SET BEST WISHES,2,1.65,14399.0,United Kingdom,2025-08-12
496690,20971,PINK BLUE FELT CRAFT TRINKET BOX,2,1.25,14399.0,United Kingdom,2025-08-12
496690,85049D,BRIGHT BLUES RIBBONS ,2,1.25,14399.0,United Kingdom,2025-08-12
496690,85049E,SCANDINAVIAN REDS RIBBONS,2,1.25,14399.0,United Kingdom,2025-08-12
