Invoice,StockCode,Description,Quantity,Price,Customer ID,Country,InvoiceDate
498736,21589,SWALLOW GIANT TUBE MATCHES,1,2.55,12748.0,United Kingdom,2025-08-28
498736,22111,SCOTTIE DOG HOT WATER BOTTLE,2,4.95,12748.0,United Kingdom,2025-08-28
498736,84270,ASSTD DESIGN BUBBLE GUM RING,30,0.21,12748.0,United Kingdom,2025-08-28
498736,21481,FAWN BLUE HOT WATER BOTTLE,3,2.95,12748.0,United Kingdom,2025-08-28
498736,21327,SKULLS WRITING SET ,6,1.65,12748.0,United Kingdom,2025-08-28
498736,15044C,PURPLE PAPER PARASOL,2,2.95,12748.0,United Kingdom,2025-08-28
498736,22023,EMPIRE BIRTHDAY CARD,12,0.42,12748.0,United Kingdom,2025-08-28
498736,21871,SAVE THE PLANET MUG,6,1.25,12748.0,United Kingdom,2025-08-28
498736,79323GR,GREEN CHERRY LIGHTS,6,6.75,12748.0,United Kingdom,2025-08-28
498736,15044B,BLUE PAPER PARASOL ,2,2.95,12748.0,United Kingdom,2025-08-28
498736,79323W, WHITE CHERRY LIGHTS,6,6.75,12748.0,United Kingdom,2025-08-28
498736,21495,SKULLS WRAP,25,0.42,12748.0,United Kingdom,2025-08-28
498736,85206A,CREAM FELT EASTER EGG BASKET,3,1.65,12748.0,United Kingdom,2025-08-28
498736,22021,BLUE FELT EASTER EGG BASKET,3,1.65,12748.0,United Kingdom,2025-08-28
498736,22059,CERAMIC STRWBERRY DESIGN MUG,4,1.49,12748.0,United Kingdom,2025-08-28
498736,84218,BOX/12 CHICK & EGG IN BASKET,2,1.95,12748.0,United Kingdom,2025-08-28
498736,79323P,PINK CHERRY LIGHTS,6,6.75,12748.0,United Kingdom,2025-08-28
498736,21790,VINTAGE SNAP CARDS,5,0.85,12748.0,United Kingdom,2025-08-28
498736,20977,36 PENCILS TUBE WOODLAND,6,1.25,12748.0,United Kingdom,2025-08-28
498736,20978,36 PENCILS TUBE SKULLS,5,1.25,12748.0,United Kingdom,2025-08-28
498736,20978,36 PENCILS TUBE SKULLS,16,1.25,12748.0,United Kingdom,2025-08-28
498736,21869,POTTING SHED COFFEE MUG,3,1.25,12748.0,United Kingdom,2025-08-28
498736,21868,POTTING SHED TEA MUG,3,1.25,12748.0,United Kingdom,2025-08-28
498736,22061,LARGE CAKE STAND  HANGING STRAWBERY,1,9.95,12748.0,United Kingdom,2025-08-28
C498737,21174,POTTERING IN THE SHED METAL SIGN,-1,1.95,14783.0,United Kingdom,2025-08-28
498746,22367,CHILDS APRON SPACEBOY DESIGN,8,1.95,13513.0,United Kingdom,2025-08-28
498746,90167,BEADED LOVE HEART JEWELLERY SET,12,0.85,13513.0,United Kingdom,2025-08-28
498746,22147,FELTCRAFT BUTTERFLY HEARTS,12,1.45,13513.0,United Kingdom,2025-08-28
498746,22274,FELTCRAFT DOLL EMILY,6,2.95,13513.0,United Kingdom,2025-08-28
498746,20969,RED FLORAL FELTCRAFT SHOULDER BAG,8,3.75,13513.0,United Kingdom,2025-08-28
498746,20970,PINK FLORAL FELTCRAFT SHOULDER BAG,8,3.75,13513.0,United Kingdom,2025-08-28
498746,84949,SILVER HANGING T-LIGHT HOLDER,6,1.65,13513.0,United Kingdom,2025-08-28
498746,84970L,SINGLE HEART ZINC T-LIGHT HOLDER,12,0.95,13513.0,United Kingdom,2025-08-28
498746,85123A,WHITE HANGING HEART T-LIGHT HOLDER,6,2.95,13513.0,United Kingdom,2025-08-28
498746,21693,SMALL HAMMERED SILVER CANDLEPOT ,6,2.95,13513.0,United Kingdom,2025-08-28
498746,84836,ZINC METAL HEART DECORATION,12,1.25,13513.0,United Kingdom,2025-08-28
498746,72807C,SET/3 VANILLA SCENTED CANDLE IN BOX,24,3.81,13513.0,United Kingdom,2025-08-28
498746,21156,RED SPOTTY CHILDS APRON,8,1.95,13513.0,United Kingdom,2025-08-28
498747,16044,,96,0.0,,United Kingdom,2025-08-28
498749,84288B,,22,0.0,,United Kingdom,2025-08-28
498748,21984,,23,0.0,,United Kingdom,2025-08-28
498750,90002A,,7,0.0,,United Kingdom,2025-08-28
498751,35001B,,7,0.0,,United Kingdom,2025-08-28
498752,21309,,1,0.0,,United Kingdom,2025-08-28
498753,84464,,3,0.0,,United Kingdom,2025-08-28
498754,21256,,2,0.0,,United Kingdom,2025-08-28
498755,20672,,1,0.0,,United Kingdom,2025-08-28
498756,35004C,SET OF 3 COLOURED  FLYING DUCKS,36,4.65,12980.0,United Kingdom,2025-08-28
498756,21137,BLACK RECORD COVER FRAME,72,3.39,12980.0,United Kingdom,2025-08-28
498756,84078A,SET/4 WHITE RETRO STORAGE CUBES ,20,34.95,12980.0,United Kingdom,2025-08-28
498757,21545,CERAMIC BIRDHOUSE BUTTERFLY SMALL,3,2.95,14030.0,United Kingdom,2025-08-28
498757,22189,CREAM HEART CARD HOLDER,2,3.95,14030.0,United Kingdom,2025-08-28
498757,21255,"FRENCH BOTTLE , LAVENDER",12,1.65,14030.0,United Kingdom,2025-08-28
498757,22168,ORGANISER WOOD ANTIQUE WHITE ,1,8.5,14030.0,United Kingdom,2025-08-28
498757,21154,RED SPOTTY OVEN GLOVE ,6,1.25,14030.0,United Kingdom,2025-08-28
498757,21440,12 MINI TOADSTOOL PEGS,24,1.25,14030.0,United Kingdom,2025-08-28
498757,21550,CERAMIC BIRDHOUSE CRESTED TIT LARGE,1,5.95,14030.0,United Kingdom,2025-08-28
498757,84951A,SET OF 4 PISTACHIO LOVEBIRD COASTER,1,2.55,14030.0,United Kingdom,2025-08-28
498757,85036A,GARDENIA 1 WICK MORRIS BOXED CANDLE,18,3.81,14030.0,United Kingdom,2025-08-28
498757,21314,SMALL GLASS HEART TRINKET POT,4,2.1,14030.0,United Kingdom,2025-08-28
498757,22374,AIRLINE BAG VINTAGE JET SET RED,1,6.35,14030.0,United Kingdom,2025-08-28
498757,22372,AIRLINE BAG VINTAGE WORLD CHAMPION ,1,6.35,14030.0,United Kingdom,2025-08-28
498757,21547,CERAMIC BIRDHOUSE CRESTED TIT SMALL,3,2.95,14030.0,United Kingdom,2025-08-28
498757,22357,KINGS CHOICE BISCUIT TIN,1,4.25,14030.0,United Kingdom,2025-08-28
498757,22431,WATERING CAN BLUE ELEPHANT,2,1.95,14030.0,United Kingdom,2025-08-28
498757,22343,PARTY PIZZA DISH RED WHITE SPOT ,6,0.85,14030.0,United Kingdom,2025-08-28
498757,84950,ASSORTED COLOUR T-LIGHT HOLDER,12,0.85,14030.0,United Kingdom,2025-08-28
498757,21906,PHARMACIE FIRST AID TIN,2,6.75,14030.0,United Kingdom,2025-08-28
498757,22371,AIRLINE BAG VINTAGE TOKYO 78,1,6.35,14030.0,United Kingdom,2025-08-28
498757,21548,CERAMIC BIRDHOUSE FINCH BLUE ROOF,1,2.95,14030.0,United Kingdom,2025-08-28
498757,21549,CERAMIC BIRDHOUSE RED ROOF SMALL,3,2.95,14030.0,United Kingdom,2025-08-28
498757,21042,RED SPOTTY APRON ,1,5.95,14030.0,United Kingdom,2025-08-28
498757,20752,RETRO BLUE SPOTTY WASHING UP GLOVES,2,2.1,14030.0,United Kingdom,2025-08-28
498757,20751,FUNKY WASHING UP GLOVES ASSORTED,2,2.1,14030.0,United Kingdom,2025-08-28
498757,20754,RETRO RED SPOTTY WASHING UP GLOVES,2,2.1,14030.0,United Kingdom,2025-08-28
498757,72349B,SET/6 PURPLE BUTTERFLY T-LIGHTS,2,2.1,14030.0,United Kingdom,2025-08-28
498757,21411,GINGHAM HEART  DOORSTOP RED,1,4.25,14030.0,United Kingdom,2025-08-28
498757,85214,TUB 24 PINK FLOWER PEGS,12,1.65,14030.0,United Kingdom,2025-08-28
498757,22138,BAKING SET 9 PIECE RETROSPOT ,1,4.95,14030.0,United Kingdom,2025-08-28
498757,21116,OWL DOORSTOP,1,4.95,14030.0,United Kingdom,2025-08-28
498757,21218,RED SPOTTY BISCUIT TIN,1,3.75,14030.0,United Kingdom,2025-08-28
498757,21837,CROSS STITCH ALPHABET CUSHION COVER,2,5.95,14030.0,United Kingdom,2025-08-28
498757,84818,DANISH ROSE PHOTO FRAME,6,2.55,14030.0,United Kingdom,2025-08-28
498757,72802C,VANILLA SCENT CANDLE JEWELLED BOX,18,3.81,14030.0,United Kingdom,2025-08-28
498757,47559B,TEA TIME OVEN GLOVE,8,1.25,14030.0,United Kingdom,2025-08-28
498757,22432,WATERING CAN PINK BUNNY,3,1.95,14030.0,United Kingdom,2025-08-28
498757,22328,ROUND SNACK BOXES SET OF 4 FRUITS ,2,2.95,14030.0,United Kingdom,2025-08-28
498757,47505,MINATURE COLOURED GARDENING SET,1,4.95,14030.0,United Kingdom,2025-08-28
498758,16161E,WRAP BOUDOIR ,25,0.1,12748.0,United Kingdom,2025-08-28
498759,22214,CANDLE PLATE LACE WHITE,12,2.55,14156.0,EIRE,2025-08-28
498759,15056BL,EDWARDIAN PARASOL BLACK,12,5.95,14156.0,EIRE,2025-08-28
498759,22216,T-LIGHT HOLDER WHITE LACE,96,0.72,14156.0,EIRE,2025-08-28
498759,21843,RETRO SPOT CAKE STAND,6,10.95,14156.0,EIRE,2025-08-28
498759,15056N,EDWARDIAN PARASOL NATURAL,12,5.95,14156.0,EIRE,2025-08-28
498759,22198,"POPCORN HOLDER , LARGE",50,1.45,14156.0,EIRE,2025-08-28
498759,37503,TEA TIME CAKE STAND IN GIFT BOX,12,9.95,14156.0,EIRE,2025-08-28
498759,22061,LARGE CAKE STAND  HANGING STRAWBERY,12,8.5,14156.0,EIRE,2025-08-28
498759,37449,CERAMIC CAKE STAND + HANGING CAKES,16,8.5,14156.0,EIRE,2025-08-28
498759,22197,"POPCORN HOLDER , SMALL ",100,0.72,14156.0,EIRE,2025-08-28
498759,20679,EDWARDIAN PARASOL RED,12,5.95,14156.0,EIRE,2025-08-28
C498760,22097,SWALLOW SQUARE TISSUE BOX,-4,1.25,12490.0,France,2025-08-28
C498761,84279P, CHERRY BLOSSOM  DECORATIVE FLASK,-2,3.75,13813.0,Germany,2025-08-28
498762,21380,WOODEN HAPPY BIRTHDAY GARLAND,2,2.95,14081.0,United Kingdom,2025-08-28
498762,21986,PACK OF 12 PINK SPOT TISSUES ,12,0.29,14081.0,United Kingdom,2025-08-28
498762,21154,RED SPOTTY OVEN GLOVE ,1,1.25,14081.0,United Kingdom,2025-08-28
498762,72728,ROSE SCENT CANDLES IN GLASS,9,0.85,14081.0,United Kingdom,2025-08-28
498762,47559B,TEA TIME OVEN GLOVE,2,1.25,14081.0,United Kingdom,2025-08-28
498762,21154,RED SPOTTY OVEN GLOVE ,2,1.25,14081.0,United Kingdom,2025-08-28
498762,21042,RED SPOTTY APRON ,2,5.95,14081.0,United Kingdom,2025-08-28
498762,21155,RED SPOTTY PEG BAG,2,2.1,14081.0,United Kingdom,2025-08-28
498762,21154,RED SPOTTY OVEN GLOVE ,1,1.25,14081.0,United Kingdom,2025-08-28
498762,21485,RED SPOT HEART HOT WATER BOTTLE,1,4.95,14081.0,United Kingdom,2025-08-28
498762,21484,CHICK GREY HOT WATER BOTTLE,1,3.45,14081.0,United Kingdom,2025-08-28
498762,21478,SILVER SKULL HOT WATER BOTTLE ,1,3.75,14081.0,United Kingdom,2025-08-28
498762,21482,MUSHROOM BLUE HOT WATER BOTTLE,1,2.95,14081.0,United Kingdom,2025-08-28
498762,22110,BIRD HOUSE HOT WATER BOTTLE,1,3.45,14081.0,United Kingdom,2025-08-28
498762,22114,HOT WATER BOTTLE TEA AND SYMPATHY,3,3.95,14081.0,United Kingdom,2025-08-28
498762,22112,CHOCOLATE HOT WATER BOTTLE,2,4.95,14081.0,United Kingdom,2025-08-28
498762,84029G,KNITTED UNION FLAG HOT WATER BOTTLE,2,3.75,14081.0,United Kingdom,2025-08-28
498762,21034,REX CASH+CARRY JUMBO SHOPPER,1,0.95,14081.0,United Kingdom,2025-08-28
498762,21034,REX CASH+CARRY JUMBO SHOPPER,1,0.95,14081.0,United Kingdom,2025-08-28
498762,21837,CROSS STITCH ALPHABET CUSHION COVER,2,5.95,14081.0,United Kingdom,2025-08-28
498762,21622,VINTAGE UNION JACK CUSHION COVER,3,4.95,14081.0,United Kingdom,2025-08-28
498762,16161E,WRAP BOUDOIR ,50,0.1,14081.0,United Kingdom,2025-08-28
498762,21498,RED SPOTS  WRAP ,25,0.42,14081.0,United Kingdom,2025-08-28
498762,22040,BOTANICAL ROSE GIFT WRAP,25,0.42,14081.0,United Kingdom,2025-08-28
498762,22050,PINK PAISLEY ROSE GIFT WRAP,25,0.42,14081.0,United Kingdom,2025-08-28
498762,21499,BLUE SPOTS  WRAP,25,0.42,14081.0,United Kingdom,2025-08-28
498762,16161P,WRAP ENGLISH ROSE ,25,0.42,14081.0,United Kingdom,2025-08-28
498762,22309,TEA COSY RED  STRIPE,1,2.55,14081.0,United Kingdom,2025-08-28
498762,20754,RETRO RED SPOTTY WASHING UP GLOVES,1,2.1,14081.0,United Kingdom,2025-08-28
498762,21114,LAVENDER SCENTED FABRIC HEART,5,1.25,14081.0,United Kingdom,2025-08-28
498762,84375,SET OF 20 KIDS COOKIE CUTTERS,1,1.95,14081.0,United Kingdom,2025-08-28
498762,22066,LOVE HEART TRINKET POT,2,1.45,14081.0,United Kingdom,2025-08-28
498762,21529,RETRO SPOT CERAMIC TOASTRACK,1,3.45,14081.0,United Kingdom,2025-08-28
498762,21540,DAIRY MAID CERAMIC BUTTER DISH,1,4.25,14081.0,United Kingdom,2025-08-28
498762,21535,RETRO SPOT SMALL MILK JUG,5,2.55,14081.0,United Kingdom,2025-08-28
498762,21531,RETRO SPOT SUGAR JAM BOWL,2,2.55,14081.0,United Kingdom,2025-08-28
498762,21539,RETRO SPOTS BUTTER DISH,2,4.95,14081.0,United Kingdom,2025-08-28
498762,21527,RETRO SPOT TRADITIONAL TEAPOT ,5,7.95,14081.0,United Kingdom,2025-08-28
498762,21354,TOAST ITS - BEST MUM,4,1.25,14081.0,United Kingdom,2025-08-28
498762,22028,PENNY FARTHING BIRTHDAY CARD,12,0.42,14081.0,United Kingdom,2025-08-28
498762,22131,FOOD CONTAINER SET 3 LOVE HEART ,1,1.95,14081.0,United Kingdom,2025-08-28
498762,47580,TEA TIME DES TEA COSY,1,2.55,14081.0,United Kingdom,2025-08-28
498762,85184C,S/4 VALENTINE DECOUPAGE HEART BOX,1,2.95,14081.0,United Kingdom,2025-08-28
498762,21874,GIN AND TONIC MUG,3,1.25,14081.0,United Kingdom,2025-08-28
498762,21076,SET/20 COLLAGE PAPER NAPKIN ,1,0.85,14081.0,United Kingdom,2025-08-28
498762,22150, 3 STRIPEY MICE FELTCRAFT,1,1.95,14081.0,United Kingdom,2025-08-28
498762,84950,ASSORTED COLOUR T-LIGHT HOLDER,12,0.85,14081.0,United Kingdom,2025-08-28
498762,21590,KINGS CHOICE CIGAR BOX MATCHES ,4,1.25,14081.0,United Kingdom,2025-08-28
498762,22084,PAPER CHAIN KIT EMPIRE,1,2.95,14081.0,United Kingdom,2025-08-28
498762,72349B,SET/6 PURPLE BUTTERFLY T-LIGHTS,1,2.1,14081.0,United Kingdom,2025-08-28
498762,72779,SET/6 BLACK ROSE T-LIGHT CANDLES,2,1.69,14081.0,United Kingdom,2025-08-28
498762,72351B,SET/6 PINK  BUTTERFLY T-LIGHTS,1,2.1,14081.0,United Kingdom,2025-08-28
498762,72351A,SET/6 TURQUOISE BUTTERFLY T-LIGHTS,1,2.1,14081.0,United Kingdom,2025-08-28
498762,21121,SET/10 RED SPOTTY PARTY CANDLES,1,1.25,14081.0,United Kingdom,2025-08-28
498762,85170D,SET/6 PINK BIRD T-LIGHT CANDLES,1,2.1,14081.0,United Kingdom,2025-08-28
498762,85170C,SET/6 EAU DE NIL BIRD T-LIGHTS,2,2.1,14081.0,United Kingdom,2025-08-28
498762,85008,SET OF 3 CONEY ISLAND OVAL BOXES,1,4.95,14081.0,United Kingdom,2025-08-28
498762,22149,FELTCRAFT 6 FLOWER FRIENDS,2,2.1,14081.0,United Kingdom,2025-08-28
498762,21533,RETRO SPOT LARGE MILK JUG,2,4.95,14081.0,United Kingdom,2025-08-28
498763,21408,SPOTTY PINK DUCK DOORSTOP,1,4.25,14030.0,United Kingdom,2025-08-28
498763,37485,ENGLISH ROSE TEA SET IN GIFT BOX,3,4.65,14030.0,United Kingdom,2025-08-28
498763,21407,BROWN CHECK CAT DOORSTOP ,1,4.25,14030.0,United Kingdom,2025-08-28
498763,21115,ROSE CARAVAN DOORSTOP,1,6.75,14030.0,United Kingdom,2025-08-28
498763,21218,RED SPOTTY BISCUIT TIN,1,3.75,14030.0,United Kingdom,2025-08-28
498763,85232D,SET/3 DECOUPAGE STACKING TINS,1,4.95,14030.0,United Kingdom,2025-08-28
498764,22417,PACK OF 60 SPACEBOY CAKE CASES,3,0.55,14081.0,United Kingdom,2025-08-28
498764,84990,60 GOLD AND SILVER FAIRY CAKE CASES,3,0.55,14081.0,United Kingdom,2025-08-28
498764,22138,BAKING SET 9 PIECE RETROSPOT ,1,4.95,14081.0,United Kingdom,2025-08-28
498764,21756,BATH BUILDING BLOCK WORD,2,5.95,14081.0,United Kingdom,2025-08-28
498764,84792,ENCHANTED BIRD COATHANGER 5 HOOK,3,4.65,14081.0,United Kingdom,2025-08-28
498764,21777,RECIPE BOX WITH METAL HEART,1,7.95,14081.0,United Kingdom,2025-08-28
498764,21765,HANGING METAL BIRD BATH,1,7.95,14081.0,United Kingdom,2025-08-28
498764,84837,WHITE SWEETHEARTS CABINET 4 DRAWERS,1,12.75,14081.0,United Kingdom,2025-08-28
498764,21259,VICTORIAN SEWING BOX SMALL ,2,5.95,14081.0,United Kingdom,2025-08-28
498764,21770,OPEN CLOSED METAL SIGN,1,4.95,14081.0,United Kingdom,2025-08-28
498764,85017C,ENVELOPE 50 CURIOUS IMAGES,1,0.85,14081.0,United Kingdom,2025-08-28
498764,21875,KINGS CHOICE MUG,6,1.25,14081.0,United Kingdom,2025-08-28
498764,85017C,ENVELOPE 50 CURIOUS IMAGES,9,0.85,14081.0,United Kingdom,2025-08-28
498764,20914,SET/5 RED SPOTTY LID GLASS BOWLS,1,2.95,14081.0,United Kingdom,2025-08-28
498764,82585,SWEET VALENCIA CANDLE+CUP,5,1.25,14081.0,United Kingdom,2025-08-28
498764,21212,PACK OF 72 RETRO SPOT CAKE CASES,6,0.55,14081.0,United Kingdom,2025-08-28
498764,84993A,75 GREEN PETIT FOUR CASES,5,0.42,14081.0,United Kingdom,2025-08-28
498764,21843,RETRO SPOT CAKE STAND,1,10.95,14081.0,United Kingdom,2025-08-28
498764,84990,60 GOLD AND SILVER FAIRY CAKE CASES,1,0.55,14081.0,United Kingdom,2025-08-28
498764,84993B,75 BLACK PETIT FOUR CASES,5,0.42,14081.0,United Kingdom,2025-08-28
498764,21672,WHITE SPOT RED CERAMIC DRAWER KNOB,6,1.25,14081.0,United Kingdom,2025-08-28
498764,21671,RED SPOT CERAMIC DRAWER KNOB,6,1.25,14081.0,United Kingdom,2025-08-28
498764,85232B,SET/3 RUSSIAN DOLL STACKING TINS,1,4.95,14081.0,United Kingdom,2025-08-28
498764,85232D,SET/3 DECOUPAGE STACKING TINS,1,4.95,14081.0,United Kingdom,2025-08-28
498764,85035C,ROSE 3 WICK MORRIS BOX CANDLE,1,4.25,14081.0,United Kingdom,2025-08-28
498764,85035A,GARDENIA 3 WICK MORRIS BOXED CANDLE,1,4.25,14081.0,United Kingdom,2025-08-28
498764,22071,SMALL RETRO SPOT MUG IN BOX  WHITE,1,3.75,14081.0,United Kingdom,2025-08-28
498764,21690,SILVER  CANDLEPOT JARDIN ,1,3.75,14081.0,United Kingdom,2025-08-28
498764,21955,DOOR MAT UNION JACK GUNS AND ROSES,1,7.49,14081.0,United Kingdom,2025-08-28
498764,48189,DOOR MAT FRIENDSHIP ,1,7.49,14081.0,United Kingdom,2025-08-28
498764,85014C,BLUE/BROWN DOTS RUFFLED UMBRELLA,1,5.95,14081.0,United Kingdom,2025-08-28
498764,85014B,RED/WHITE DOTS RUFFLED UMBRELLA,1,5.95,14081.0,United Kingdom,2025-08-28
498764,85014D,PINK/BROWN DOTS RUFFLED UMBRELLA,1,5.95,14081.0,United Kingdom,2025-08-28
498764,84992,72 SWEETHEART FAIRY CAKE CASES,3,0.55,14081.0,United Kingdom,2025-08-28
498764,22070,SMALL RETRO SPOT MUG IN BOX  RED,1,3.75,14081.0,United Kingdom,2025-08-28
498764,21977,PACK OF 60 PINK PAISLEY CAKE CASES,3,0.55,14081.0,United Kingdom,2025-08-28
