Invoice,StockCode,Description,Quantity,Price,Customer ID,Country,InvoiceDate
495239,20675,BLUE SPOTTY BOWL,1,2.51,,United Kingdom,2025-08-02
495239,20674,GREEN SPOTTY BOWL,1,2.51,,United Kingdom,2025-08-02
495239,20672,PINK TEATIME PRINT BOWL,1,2.51,,United Kingdom,2025-08-02
495239,84031A,CHARLIE+LOLA RED HOT WATER BOTTLE ,1,4.21,,United Kingdom,2025-08-02
495239,82605,OLD DOC RUSSEL METAL SIGN,1,1.66,,United Kingdom,2025-08-02
495239,82580,BATHROOM METAL SIGN,1,1.28,,United Kingdom,2025-08-02
495239,70007,HI TEC ALPINE HAND WARMER,2,1.66,,United Kingdom,2025-08-02
495239,47592A,CAROUSEL DES CHILD'S OVERALL,1,4.21,,United Kingdom,2025-08-02
495239,46775E,CANDY POP CHUNKY KNITTED THROW ,4,11.02,,United Kingdom,2025-08-02
495239,22326,ROUND SNACK BOXES SET OF4 WOODLAND ,2,5.91,,United Kingdom,2025-08-02
495239,22327,ROUND SNACK BOXES SET OF 4 SKULLS,4,5.91,,United Kingdom,2025-08-02
495239,22262,FELT EGG COSY CHICKEN,1,1.66,,United Kingdom,2025-08-02
495239,22181,SNOWSTORM PHOTO FRAME FRIDGE MAGNET,1,1.66,,United Kingdom,2025-08-02
495239,81950B,FLOWER BLUE CLOCK W/SUCKER,1,1.66,,United Kingdom,2025-08-02
495239,20764,ABSTRACT CIRCLES SKETCHBOOK ,4,3.36,,United Kingdom,2025-08-02
495239,21908,CHOCOLATE THIS WAY METAL SIGN,1,4.21,,United Kingdom,2025-08-02
495239,20762,GREEN FERN SKETCHBOOK ,2,3.36,,United Kingdom,2025-08-02
495239,20761,BLUE PAISLEY SKETCHBOOK,4,3.36,,United Kingdom,2025-08-02
495239,20760,GARDEN PATH POCKET BOOK,12,0.64,,United Kingdom,2025-08-02
495239,20757,RED DAISY POCKET BOOK ,4,0.64,,United Kingdom,2025-08-02
495239,20756,GREEN FERN POCKET BOOK,7,0.64,,United Kingdom,2025-08-02
495239,37461,FUNKY MONKEY MUG,1,2.51,,United Kingdom,2025-08-02
495239,20755,BLUE PAISLEY POCKET BOOK,4,0.64,,United Kingdom,2025-08-02
495239,20748,KENSINGTON COFFEE SET,185,8.47,,United Kingdom,2025-08-02
495239,20730,STRAWBERRY CANDY BAG,24,0.85,,United Kingdom,2025-08-02
495239,20729,RED SPOTTY CANDY BAG,23,0.85,,United Kingdom,2025-08-02
495239,20727,LUNCH BAG  BLACK SKULL.,1,4.21,,United Kingdom,2025-08-02
495239,20725,LUNCH BAG RED SPOTTY,1,4.21,,United Kingdom,2025-08-02
495239,20705,MRS ROBOT SOFT TOY,1,5.91,,United Kingdom,2025-08-02
495239,22227,"DECORATION, HANGING HEART+MIRROR ",1,1.28,,United Kingdom,2025-08-02
495239,22219,LOVEBIRD HANGING DECORATION WHITE ,1,1.66,,United Kingdom,2025-08-02
495239,21891,TRADITIONAL WOODEN SKIPPING ROPE,2,2.51,,United Kingdom,2025-08-02
495239,84968C,S/16 VINTAGE PISTACHIO CUTLERY,4,11.02,,United Kingdom,2025-08-02
495239,35965,FOLKART HEART NAPKIN RINGS,2,5.91,,United Kingdom,2025-08-02
495239,22317,FIVE CATS HANGING DECORATION,1,5.91,,United Kingdom,2025-08-02
495239,85116,BLACK CANDELABRA T-LIGHT HOLDER,3,1.66,,United Kingdom,2025-08-02
495239,85099C,JUMBO  BAG BAROQUE BLACK WHITE,2,4.21,,United Kingdom,2025-08-02
495239,85086A,CANDY SPOT HEART DECORATION,1,1.66,,United Kingdom,2025-08-02
495239,85061W,WHITE JEWELLED HEART DECORATION,2,1.66,,United Kingdom,2025-08-02
495239,85059,FRENCH ENAMEL WATER BASIN,1,7.62,,United Kingdom,2025-08-02
495239,85038,6 CHOCOLATE LOVE HEART T-LIGHTS,5,2.51,,United Kingdom,2025-08-02
495239,85017B,ENVELOPE 50 BLOSSOM IMAGES,1,0.81,,United Kingdom,2025-08-02
495239,85015,SET OF 12  VINTAGE POSTCARD SET,1,2.51,,United Kingdom,2025-08-02
495239,84997D,PINK 3 PIECE MINI DOTS CUTLERY SET,2,7.62,,United Kingdom,2025-08-02
495239,84992,72 SWEETHEART FAIRY CAKE CASES,1,1.28,,United Kingdom,2025-08-02
495239,84991,60 TEATIME FAIRY CAKE CASES,4,1.28,,United Kingdom,2025-08-02
495239,84988,SET OF 72 PINK HEART PAPER DOILIES,2,2.98,,United Kingdom,2025-08-02
495239,84985A,SET OF 72 GREEN PAPER DOILIES,1,2.98,,United Kingdom,2025-08-02
495239,84971S,SMALL HEART FLOWERS HOOK ,1,1.66,,United Kingdom,2025-08-02
495239,84970S,HANGING HEART ZINC T-LIGHT HOLDER,1,2.13,,United Kingdom,2025-08-02
495239,84968F,S/16 VINTAGE SKY BLUE CUTLERY,2,11.02,,United Kingdom,2025-08-02
495239,84968E,S/16 VINTAGE BLACK CUTLERY,3,11.02,,United Kingdom,2025-08-02
495239,85123A,WHITE HANGING HEART T-LIGHT HOLDER,3,5.91,,United Kingdom,2025-08-02
495239,85130A,BEADED PEARL HEART WHITE LARGE,1,3.36,,United Kingdom,2025-08-02
495239,85130C,BEADED CRYSTAL HEART BLUE  LARGE,2,3.36,,United Kingdom,2025-08-02
495239,85132A,CHARLIE + LOLA BISCUITS TINS,3,8.47,,United Kingdom,2025-08-02
495239,22260,FELT EGG COSY BLUE RABBIT ,1,1.66,,United Kingdom,2025-08-02
495239,22135,LADLE LOVE HEART PINK,1,0.85,,United Kingdom,2025-08-02
495239,21888,BINGO SET,1,7.62,,United Kingdom,2025-08-02
495239,20671,BLUE TEATIME PRINT BOWL ,1,2.51,,United Kingdom,2025-08-02
495239,90025F,BAROQUE BUTTERFLY EARRINGS CRYSTAL,1,3.81,,United Kingdom,2025-08-02
495239,90013A,MIDNIGHT BLUE VINTAGE EARRINGS,1,3.81,,United Kingdom,2025-08-02
495239,85232D,SET/3 DECOUPAGE STACKING TINS,1,10.17,,United Kingdom,2025-08-02
495239,85232B,SET/3 RUSSIAN DOLL STACKING TINS,1,10.17,,United Kingdom,2025-08-02
495239,35096A,BLUE VICTORIAN FABRIC HEART BOX,1,0.84,,United Kingdom,2025-08-02
495239,85227,SET/6 3D KIT CARDS FOR KIDS,1,1.66,,United Kingdom,2025-08-02
495239,85224,ASSORTED COLOUR SILK GLASSES CASE,1,4.21,,United Kingdom,2025-08-02
495239,85216,ASSORTED CAKES FRIDGE MAGNETS,1,7.62,,United Kingdom,2025-08-02
495239,85194S,HANGING SPRING FLOWER EGG SMALL,1,1.66,,United Kingdom,2025-08-02
495239,85194L,HANGING SPRING FLOWER EGG LARGE,1,1.66,,United Kingdom,2025-08-02
495239,85189,HANGING BUTTERFLY  EGG,1,1.66,,United Kingdom,2025-08-02
495239,85174,S/4 CACTI CANDLES,1,11.02,,United Kingdom,2025-08-02
495239,85170D,SET/6 PINK BIRD T-LIGHT CANDLES,1,4.21,,United Kingdom,2025-08-02
495239,85132C,CHARLIE AND LOLA FIGURES TINS,1,8.47,,United Kingdom,2025-08-02
495239,85226C,BLUE PULL BACK RACING CAR,1,1.66,,United Kingdom,2025-08-02
495239,75049L,LARGE CIRCULAR MIRROR MOBILE,1,2.51,,United Kingdom,2025-08-02
495239,72807A,SET/3 ROSE CANDLE IN JEWELLED BOX,1,8.47,,United Kingdom,2025-08-02
495239,84378,SET OF 3 HEART COOKIE CUTTERS,3,2.51,,United Kingdom,2025-08-02
495239,22242,"HOOK, 5 HANGER , MAGIC TOADSTOOL",2,3.36,,United Kingdom,2025-08-02
495239,21212,PACK OF 72 RETRO SPOT CAKE CASES,2,1.28,,United Kingdom,2025-08-02
495239,21955,  DOORMAT UNION JACK GUNS AND ROSES,1,13.57,,United Kingdom,2025-08-02
495239,21946,PARTY TIME DESIGN FLANNEL,3,0.85,,United Kingdom,2025-08-02
495239,21945,STRAWBERRIES  DESIGN FLANNEL ,7,0.85,,United Kingdom,2025-08-02
495239,21944,KITTENS DESIGN FLANNEL,7,0.85,,United Kingdom,2025-08-02
495239,21943,CAKES AND RABBITS DESIGN FLANNEL ,2,0.85,,United Kingdom,2025-08-02
495239,21942,SKULLS DESIGN FLANNEL,34,0.85,,United Kingdom,2025-08-02
495239,21935,SUKI  SHOULDER BAG,1,3.36,,United Kingdom,2025-08-02
495239,22268,EASTER DECORATION SITTING BUNNY,1,1.66,,United Kingdom,2025-08-02
495239,90201C,RED ENAMEL FLOWER RING,2,2.96,,United Kingdom,2025-08-02
495239,90201A,PURPLE ENAMEL FLOWER RING,1,2.96,,United Kingdom,2025-08-02
495239,90200D,PINK SWEETHEART BRACELET,2,4.24,,United Kingdom,2025-08-02
495239,90200B,BLACK SWEETHEART BRACELET,1,4.24,,United Kingdom,2025-08-02
495239,90200A,PURPLE SWEETHEART BRACELET,1,4.24,,United Kingdom,2025-08-02
495239,90197B,BLACK GLASS BRACELET W HEART CHARMS,1,5.09,,United Kingdom,2025-08-02
495239,21210,SET OF 72 RETRO SPOT PAPER  DOILIES,1,2.98,,United Kingdom,2025-08-02
495239,DOT,DOTCOM POSTAGE,1,649.83,,United Kingdom,2025-08-02
495239,21195,PINK  HONEYCOMB PAPER BALL ,1,4.21,,United Kingdom,2025-08-02
495239,21213,PACK OF 72 SKULL CAKE CASES,3,1.28,,United Kingdom,2025-08-02
495239,21232,STRAWBERRY CERAMIC TRINKET BOX,3,2.51,,United Kingdom,2025-08-02
495239,84536B,FAIRY CAKES NOTEBOOK A7 SIZE,1,0.81,,United Kingdom,2025-08-02
495239,84536A,ENGLISH ROSE NOTEBOOK A7 SIZE,1,0.81,,United Kingdom,2025-08-02
495239,84520D,PACK OF 20 FAIRY CAKE PAPER NAPKINS,2,1.66,,United Kingdom,2025-08-02
495239,84510B,SET OF 4 FAIRY CAKES COASTERS ,1,2.51,,United Kingdom,2025-08-02
495239,84450B,YELLOW RABBIT SAT EASTER,1,0.81,,United Kingdom,2025-08-02
495239,84380,SET OF 3 BUTTERFLY COOKIE CUTTERS,2,2.51,,United Kingdom,2025-08-02
495239,21993,FLORAL FOLK STATIONERY SET,13,2.51,,United Kingdom,2025-08-02
495239,21992,VINTAGE PAISLEY STATIONERY SET,15,2.51,,United Kingdom,2025-08-02
495239,21991,BOHEMIAN COLLAGE STATIONERY SET,2,2.51,,United Kingdom,2025-08-02
495239,21990,MODERN FLORAL STATIONERY SET,5,2.51,,United Kingdom,2025-08-02
495239,21976,PACK OF 60 MUSHROOM CAKE CASES,1,1.28,,United Kingdom,2025-08-02
495239,21975,PACK OF 60 DINOSAUR CAKE CASES,1,1.28,,United Kingdom,2025-08-02
495239,21260,FIRST AID TIN,2,6.77,,United Kingdom,2025-08-02
495239,21241,GREEN SPOTTY CUP,1,1.66,,United Kingdom,2025-08-02
495239,21240,BLUE  SPOTTY CUP,1,1.66,,United Kingdom,2025-08-02
495239,21239,PINK  SPOTTY CUP,2,1.66,,United Kingdom,2025-08-02
495239,21238,RED SPOTTY CUP,1,1.66,,United Kingdom,2025-08-02
495239,21216,"SET 3 RED SPOT TIN TEA,COFFEE,SUGAR",1,11.02,,United Kingdom,2025-08-02
495239,21194,PINK  HONEYCOMB PAPER FAN,1,4.21,,United Kingdom,2025-08-02
495239,21181,PLEASE ONE PERSON  METAL SIGN,1,4.21,,United Kingdom,2025-08-02
495239,21166,COOK WITH WINE METAL SIGN ,1,4.21,,United Kingdom,2025-08-02
495239,37494A,FAIRY CAKE CERAMIC BUTTER DISH,2,5.91,,United Kingdom,2025-08-02
495239,35971,ROSE FOLKART HEART DECORATIONS,2,2.51,,United Kingdom,2025-08-02
495239,20829,GLITTER HANGING BUTTERFLY STRING,1,4.21,,United Kingdom,2025-08-02
495239,35809B,ENAMEL BLUE RIM TEA CONTAINER,1,4.21,,United Kingdom,2025-08-02
495239,22328,ROUND SNACK BOXES SET OF 4 FRUITS ,1,5.91,,United Kingdom,2025-08-02
495239,22266,EASTER DECORATION HANGING BUNNY,1,1.28,,United Kingdom,2025-08-02
495239,22241,GARLAND WOODEN HAPPY EASTER,1,2.51,,United Kingdom,2025-08-02
495239,20777,CHRYSANTHEMUM NOTEBOOK,2,1.66,,United Kingdom,2025-08-02
495239,20776,ABSTRACT CIRCLES NOTEBOOK,1,1.66,,United Kingdom,2025-08-02
495239,20775,DAISY NOTEBOOK ,1,1.66,,United Kingdom,2025-08-02
495239,20774,GREEN FERN NOTEBOOK,2,1.66,,United Kingdom,2025-08-02
495239,20773,BLUE PAISLEY NOTEBOOK,3,1.66,,United Kingdom,2025-08-02
495239,20772,GARDEN PATH JOURNAL,1,2.51,,United Kingdom,2025-08-02
495239,20769,DAISY JOURNAL ,1,2.51,,United Kingdom,2025-08-02
495239,20768,GREEN FERN JOURNAL ,1,2.51,,United Kingdom,2025-08-02
495239,20766,GARDEN PATH SKETCHBOOK,1,3.36,,United Kingdom,2025-08-02
495239,20765,CHRYSANTHEMUM SKETCHBOOK ,1,3.36,,United Kingdom,2025-08-02
495239,46776A,WOVEN BUBBLE GUM CUSHION COVER,5,4.21,,United Kingdom,2025-08-02
495239,47599A,PINK PARTY BAGS,1,4.21,,United Kingdom,2025-08-02
495239,72351B,SET/6 PINK  BUTTERFLY T-LIGHTS,1,4.21,,United Kingdom,2025-08-02
495239,82582,AREA PATROLLED METAL SIGN,1,4.21,,United Kingdom,2025-08-02
495239,21160,KEEP OUT GIRLS DOOR HANGER ,15,1.66,,United Kingdom,2025-08-02
495239,21154,RED SPOTTY OVEN GLOVE ,1,2.51,,United Kingdom,2025-08-02
495239,21100,CHARLIE AND LOLA CHARLOTTE BAG,3,1.66,,United Kingdom,2025-08-02
495239,21071,VINTAGE BILLBOARD DRINK ME MUG,1,2.51,,United Kingdom,2025-08-02
495239,21063,PARTY INVITES JAZZ HEARTS,2,1.66,,United Kingdom,2025-08-02
495239,22355,"CHARLOTTE BAG , SUKI DESIGN",1,1.66,,United Kingdom,2025-08-02
495239,22348,TEA BAG PLATE RED SPOTTY ,1,1.66,,United Kingdom,2025-08-02
495239,21043,APRON MODERN VINTAGE COTTON,4,5.91,,United Kingdom,2025-08-02
495239,84562B,BLUE/WHITE RIBBED MELAMINE JUG,2,16.98,,United Kingdom,2025-08-02
495239,21041,RED SPOTTY OVEN GLOVE DOUBLE,1,5.91,,United Kingdom,2025-08-02
495239,21035,SET/2 RED SPOTTY TEA TOWELS ,1,5.91,,United Kingdom,2025-08-02
495239,21033,JUMBO BAG CHARLIE AND LOLA TOYS,1,3.36,,United Kingdom,2025-08-02
495239,20996,JAZZ HEARTS ADDRESS BOOK,1,0.84,,United Kingdom,2025-08-02
495239,20961,STRAWBERRY BATH SPONGE ,1,2.51,,United Kingdom,2025-08-02
495239,20935,ROUND CACTUS CANDLE,1,5.91,,United Kingdom,2025-08-02
495239,35810B,ENAMEL BLUE RIM COFFEE CONTAINER,1,4.21,,United Kingdom,2025-08-02
495239,84032A,CHARLIE+LOLA PINK HOT WATER BOTTLE,6,2.51,,United Kingdom,2025-08-02
495239,82616B,FRAPPUCINO SCARF KNITTING KIT,1,2.51,,United Kingdom,2025-08-02
495239,21040,MODERN VINTAGE COTTON SHOPPING BAG,1,2.51,,United Kingdom,2025-08-02
495239,84568,GIRLS ALPHABET IRON ON PATCHES ,9,0.43,,United Kingdom,2025-08-02
495239,20980,36 PENCILS TUBE POSY,1,2.51,,United Kingdom,2025-08-02
495239,84596B,SMALL DOLLY MIX DESIGN ORANGE BOWL,4,1.66,,United Kingdom,2025-08-02
495239,46776D,WOVEN SUNSET CUSHION COVER ,3,4.21,,United Kingdom,2025-08-02
495239,46775A,BUBBLE GUM CHUNKY KNITTED THROW ,1,11.02,,United Kingdom,2025-08-02
495239,21533,RETRO SPOT LARGE MILK JUG,1,10.17,,United Kingdom,2025-08-02
495239,20658,RED SPOTTY LUGGAGE TAG,2,2.51,,United Kingdom,2025-08-02
495239,20657,TROPICAL LUGGAGE TAG,4,0.85,,United Kingdom,2025-08-02
495239,20653,CHERRY BLOSSOM LUGGAGE TAG,1,0.85,,United Kingdom,2025-08-02
495239,20652,BLUE SPOTTY LUGGAGE TAG ,8,0.85,,United Kingdom,2025-08-02
495239,20619,TROPICAL PASSPORT COVER ,2,1.66,,United Kingdom,2025-08-02
495239,20618,QUEEN OF THE SKIES PASSPORT COVER ,1,4.21,,United Kingdom,2025-08-02
495239,20616,CHERRY BLOSSOM PASSPORT COVER,1,1.66,,United Kingdom,2025-08-02
495239,20615,BLUE SPOTTY PASSPORT COVER,3,1.66,,United Kingdom,2025-08-02
495239,18097C,WHITE TALL PORCELAIN T-LIGHT HOLDER,3,2.51,,United Kingdom,2025-08-02
495239,16244B,MAXWELL 2 TONE BLUE 60 PAGE PHOTO A,1,4.21,,United Kingdom,2025-08-02
495239,16244A,MAXWELL 2 TONE PINK 60 PAGE PHOTO A,2,4.21,,United Kingdom,2025-08-02
495239,16237,SLEEPING CAT ERASERS,1,0.43,,United Kingdom,2025-08-02
495239,16235,RECYCLED PENCIL WITH RABBIT ERASER,2,0.43,,United Kingdom,2025-08-02
495239,16225,RATTLE SNAKE EGGS,1,1.28,,United Kingdom,2025-08-02
495239,48138,DOOR MAT UNION FLAG,1,13.57,,United Kingdom,2025-08-02
495239,72586,"S/6 HALLOWEEN GHOST T LIGHTS, 5CM H",3,0.81,,United Kingdom,2025-08-02
495239,20752,RETRO BLUE SPOTTY WASHING UP GLOVES,9,2.51,,United Kingdom,2025-08-02
495239,22027,TEA PARTY BIRTHDAY CARD,2,0.84,,United Kingdom,2025-08-02
495239,84569C,PACK 4 FLOWER/BUTTERFLY PATCHES,2,2.51,,United Kingdom,2025-08-02
495239,84313B,BLUE TV TRAY TABLE ,1,16.98,,United Kingdom,2025-08-02
495239,84050,PINK HEART SHAPE EGG FRYING PAN,1,4.21,,United Kingdom,2025-08-02
495239,84032B,CHARLIE + LOLA RED HOT WATER BOTTLE,3,2.51,,United Kingdom,2025-08-02
495239,84029G,KNITTED UNION FLAG HOT WATER BOTTLE,1,7.62,,United Kingdom,2025-08-02
495239,84029E,RED WOOLLY HOTTIE WHITE HEART.,1,7.62,,United Kingdom,2025-08-02
495239,82585,SWEET VALENCIA CANDLE+CUP,1,2.51,,United Kingdom,2025-08-02
495239,82583,HOT BATHS METAL SIGN,1,4.21,,United Kingdom,2025-08-02
495239,16168M,FUNKY MONKEY GIFT BAG MEDIUM,1,0.81,,United Kingdom,2025-08-02
495239,72484,ROSES IN WHITE HEART CANDLE ,1,2.51,,United Kingdom,2025-08-02
495239,46776B,WOVEN BERRIES CUSHION COVER ,4,4.21,,United Kingdom,2025-08-02
495239,37495,FAIRY CAKE BIRTHDAY CANDLE SET,1,7.62,,United Kingdom,2025-08-02
495239,37343,SPOTS DESIGN MUG W PINK INSIDE,9,3.36,,United Kingdom,2025-08-02
495239,35914,PINK CHICK EGG WARMER + EGG CUP,1,4.21,,United Kingdom,2025-08-02
495239,22365,DOORMAT RESPECTABLE HOUSE,2,13.57,,United Kingdom,2025-08-02
495239,22297,HEART IVORY TRELLIS SMALL,1,2.51,,United Kingdom,2025-08-02
495239,22243,"HOOK, 5 HANGER ,MAGIC TOADSTOOL RED",1,3.36,,United Kingdom,2025-08-02
495239,22110,BIRD HOUSE HOT WATER BOTTLE,3,3.36,,United Kingdom,2025-08-02
495239,47599B,BLUE PARTY BAGS ,3,4.21,,United Kingdom,2025-08-02
495239,15044B,BLUE PAPER PARASOL ,1,5.91,,United Kingdom,2025-08-02
495239,18098C,PORCELAIN BUTTERFLY OIL BURNER,4,2.51,,United Kingdom,2025-08-02
495239,22107,PIZZA PLATE IN BOX,4,7.62,,United Kingdom,2025-08-02
495239,21393,BLUE  SPOTTY PUDDING BOWL,2,4.21,,United Kingdom,2025-08-02
495239,21392,RED SPOTTY PUDDING BOWL,2,4.21,,United Kingdom,2025-08-02
495239,21381,MINI WOODEN HAPPY BIRTHDAY GARLAND,1,3.36,,United Kingdom,2025-08-02
495239,21371,MIRRORED WALL ART POPPIES,4,5.06,,United Kingdom,2025-08-02
495239,21356,TOAST ITS - FAIRY FLOWER,1,2.51,,United Kingdom,2025-08-02
495239,15036,ASSORTED COLOURS SILK FAN,3,1.28,,United Kingdom,2025-08-02
495239,21293,MIRRORED DOVE WALL DECORATION,7,3.36,,United Kingdom,2025-08-02
495239,21284,RETRO SPOT CANDLE  SMALL,1,3.36,,United Kingdom,2025-08-02
495239,21396,RED SPOTTY EGG CUP ,2,3.36,,United Kingdom,2025-08-02
495239,21274,EMBOSSED HEART 3 DRAWER SHELF,1,25.49,,United Kingdom,2025-08-02
495239,84660C,PINK STITCHED WALL CLOCK,1,7.62,,United Kingdom,2025-08-02
495239,84609,TALL ROCOCO CANDLE HOLDER,2,16.98,,United Kingdom,2025-08-02
495239,84598,BOYS ALPHABET IRON ON PATCHES,5,0.43,,United Kingdom,2025-08-02
495239,84596L,BISCUITS SMALL BOWL LIGHT BLUE,4,1.66,,United Kingdom,2025-08-02
495239,84596K,JELLY BABIES YELLOW SMALL BOWL,5,1.66,,United Kingdom,2025-08-02
495239,84596G,SMALL CHOCOLATES PINK BOWL,2,1.66,,United Kingdom,2025-08-02
495239,84596F,SMALL MARSHMALLOWS PINK BOWL,5,1.66,,United Kingdom,2025-08-02
495239,84596E,SMALL LICORICE DES PINK BOWL,2,1.66,,United Kingdom,2025-08-02
495239,21272,SALLE DE BAIN HOOK,1,2.51,,United Kingdom,2025-08-02
495239,21397,BLUE  SPOTTY EGG CUP ,2,3.36,,United Kingdom,2025-08-02
495239,21294,ETCHED GLASS COASTER,1,2.51,,United Kingdom,2025-08-02
495239,22028,PENNY FARTHING BIRTHDAY CARD,1,0.84,,United Kingdom,2025-08-02
495239,22067,CHOC TRUFFLE GOLD TRINKET POT ,1,3.36,,United Kingdom,2025-08-02
495239,21486,PINK HEART DOTS HOT WATER BOTTLE,2,4.21,,United Kingdom,2025-08-02
495239,22059,CERAMIC STRWBERRY DESIGN MUG,2,3.36,,United Kingdom,2025-08-02
495239,22058,CERAMIC LOVE HEARTS DESIGN MUG,2,3.36,,United Kingdom,2025-08-02
495239,22057,CERAMIC PLATE STRAWBERRY DESIGN,1,3.36,,United Kingdom,2025-08-02
495239,22029,SPACEBOY BIRTHDAY CARD,2,0.84,,United Kingdom,2025-08-02
495239,37370,RETRO COFFEE MUGS ASSORTED,1,16.13,,United Kingdom,2025-08-02
495239,35924,HANGING FAIRY CAKE DECORATION,1,4.21,,United Kingdom,2025-08-02
495239,22366,DOORMAT AIRMAIL ,1,13.57,,United Kingdom,2025-08-02
495239,22064,PINK DOUGHNUT TRINKET POT ,1,3.36,,United Kingdom,2025-08-02
495239,21527,RETRO SPOT TRADITIONAL TEAPOT ,1,16.98,,United Kingdom,2025-08-02
495239,21523,FANCY FONT HOME SWEET HOME DOORMAT,1,13.57,,United Kingdom,2025-08-02
495239,22244,"HOOK, 3 HANGER ,MAGIC GARDEN",3,4.21,,United Kingdom,2025-08-02
495239,21519,GIN & TONIC DIET GREETING CARD ,2,0.84,,United Kingdom,2025-08-02
495239,21509,COWBOYS AND INDIANS BIRTHDAY CARD ,2,0.84,,United Kingdom,2025-08-02
495239,21508,VINTAGE KID DOLLY CARD ,3,0.84,,United Kingdom,2025-08-02
495239,21494,ROTATING LEAVES T-LIGHT HOLDER,2,1.66,,United Kingdom,2025-08-02
495239,22309,TEA COSY RED  STRIPE,1,5.06,,United Kingdom,2025-08-02
495240,21314,SMALL GLASS HEART TRINKET POT,300,1.85,17949.0,United Kingdom,2025-08-02
495241,21871,SAVE THE PLANET MUG,12,1.25,13078.0,United Kingdom,2025-08-02
495241,21181,PLEASE ONE PERSON  METAL SIGN,48,1.85,13078.0,United Kingdom,2025-08-02
495241,46000M,POLYESTER FILLER PAD 45x45cm,8,1.55,13078.0,United Kingdom,2025-08-02
495241,21622,VINTAGE UNION JACK CUSHION COVER,8,4.95,13078.0,United Kingdom,2025-08-02
495241,22365,DOORMAT RESPECTABLE HOUSE,10,5.95,13078.0,United Kingdom,2025-08-02
495241,48138,DOOR MAT UNION FLAG,10,5.95,13078.0,United Kingdom,2025-08-02
495241,22111,SCOTTIE DOG HOT WATER BOTTLE,24,4.25,13078.0,United Kingdom,2025-08-02
495241,21523,FANCY FONT HOME SWEET HOME DOORMAT,10,5.95,13078.0,United Kingdom,2025-08-02
495242,48138,DOOR MAT UNION FLAG,2,6.75,17794.0,United Kingdom,2025-08-02
495243,35241,ENAMEL BLUE RIM BISCUIT BIN,3,4.95,14209.0,United Kingdom,2025-08-02
495243,21260,FIRST AID TIN,6,3.25,14209.0,United Kingdom,2025-08-02
495243,21737,SET 3 WICKER LOG BASKETS,1,19.95,14209.0,United Kingdom,2025-08-02
495243,85063,CREAM SWEETHEART MAGAZINE RACK,1,16.95,14209.0,United Kingdom,2025-08-02
495243,84880,WHITE WIRE EGG HOLDER,3,5.95,14209.0,United Kingdom,2025-08-02
495243,71053,WHITE METAL LANTERN,4,3.75,14209.0,United Kingdom,2025-08-02
495243,84970S,HANGING HEART ZINC T-LIGHT HOLDER,12,0.85,14209.0,United Kingdom,2025-08-02
495243,85123A,WHITE HANGING HEART T-LIGHT HOLDER,12,2.95,14209.0,United Kingdom,2025-08-02
495243,84029E,RED WOOLLY HOTTIE WHITE HEART.,4,3.75,14209.0,United Kingdom,2025-08-02
495243,84971L,LARGE HEART FLOWERS HOOK   ,12,1.25,14209.0,United Kingdom,2025-08-02
495243,84970L,SINGLE HEART ZINC T-LIGHT HOLDER,12,0.95,14209.0,United Kingdom,2025-08-02
495243,71459,HANGING JAM JAR T-LIGHT HOLDER,12,0.85,14209.0,United Kingdom,2025-08-02
495243,85065,CREAM SWEETHEART TRAYS,1,12.75,14209.0,United Kingdom,2025-08-02
495243,35810B,ENAMEL BLUE RIM COFFEE CONTAINER,6,2.1,14209.0,United Kingdom,2025-08-02
495243,35809B,ENAMEL BLUE RIM TEA CONTAINER,6,2.1,14209.0,United Kingdom,2025-08-02
495243,85006,SET 4 NURSERY DES ROUND BOXES,6,2.95,14209.0,United Kingdom,2025-08-02
495244,22079,RIBBON REEL HEARTS DESIGN ,10,1.65,15179.0,United Kingdom,2025-08-02
495244,84792,ENCHANTED BIRD COATHANGER 5 HOOK,4,4.65,15179.0,United Kingdom,2025-08-02
495244,21256,"FRENCH BOTTLE, BRASSERIE DES ARTIST",12,1.65,15179.0,United Kingdom,2025-08-02
495244,84378,SET OF 3 HEART COOKIE CUTTERS,12,1.25,15179.0,United Kingdom,2025-08-02
495244,21212,PACK OF 72 RETRO SPOT CAKE CASES,24,0.55,15179.0,United Kingdom,2025-08-02
495244,84978,HANGING HEART JAR T-LIGHT HOLDER,12,1.25,15179.0,United Kingdom,2025-08-02
495244,84380,SET OF 3 BUTTERFLY COOKIE CUTTERS,12,1.25,15179.0,United Kingdom,2025-08-02
495244,85099B,JUMBO BAG RED WHITE SPOTTY ,20,1.95,15179.0,United Kingdom,2025-08-02
495244,22328,ROUND SNACK BOXES SET OF 4 FRUITS ,6,2.95,15179.0,United Kingdom,2025-08-02
495244,21541,DINOSAURS WATER TRANSFER TATTOOS ,12,0.85,15179.0,United Kingdom,2025-08-02
495244,21204,DAISIES  HONEYCOMB GARLAND ,12,1.65,15179.0,United Kingdom,2025-08-02
495244,85184C,S/4 VALENTINE DECOUPAGE HEART BOX,6,2.95,15179.0,United Kingdom,2025-08-02
495244,22270,HAPPY EASTER HANGING DECORATION,4,3.75,15179.0,United Kingdom,2025-08-02
495244,37503,TEA TIME CAKE STAND IN GIFT BOX,4,10.75,15179.0,United Kingdom,2025-08-02
495244,21203,BUTTERFLIES  HONEYCOMB GARLAND,12,1.65,15179.0,United Kingdom,2025-08-02
495244,21088,SET/6 FRUIT SALAD PAPER CUPS,12,0.65,15179.0,United Kingdom,2025-08-02
495244,21096,SET/6 FRUIT SALAD  PAPER PLATES,12,0.85,15179.0,United Kingdom,2025-08-02
495244,21082,SET/20 FRUIT SALAD PAPER NAPKINS ,12,0.85,15179.0,United Kingdom,2025-08-02
495244,47599B,BLUE PARTY BAGS ,6,2.1,15179.0,United Kingdom,2025-08-02
495244,20711,JUMBO BAG TOYS ,10,1.95,15179.0,United Kingdom,2025-08-02
495244,22027,TEA PARTY BIRTHDAY CARD,12,0.42,15179.0,United Kingdom,2025-08-02
495244,84077,WORLD WAR 2 GLIDERS ASSTD DESIGNS,48,0.21,15179.0,United Kingdom,2025-08-02
495244,20747,PICCADILLY TEA SET,4,14.95,15179.0,United Kingdom,2025-08-02
495244,21202,DOLLY HONEYCOMB GARLAND,12,1.65,15179.0,United Kingdom,2025-08-02
495244,22319,HAIRCLIPS FORTIES FABRIC ASSORTED,24,0.65,15179.0,United Kingdom,2025-08-02
495244,22046,TEA PARTY  WRAPPING PAPER ,25,0.42,15179.0,United Kingdom,2025-08-02
495244,21506,"FANCY FONT BIRTHDAY CARD, ",12,0.42,15179.0,United Kingdom,2025-08-02
495244,22026,BANQUET BIRTHDAY  CARD  ,12,0.42,15179.0,United Kingdom,2025-08-02
495244,22048,BIRTHDAY BANQUET GIFT WRAP,25,0.42,15179.0,United Kingdom,2025-08-02
495244,22060,LARGE CAKE STAND HANGING HEARTS,2,9.95,15179.0,United Kingdom,2025-08-02
495244,22303,COFFEE MUG APPLES DESIGN,6,2.55,15179.0,United Kingdom,2025-08-02
495244,20983,12 PENCILS TALL TUBE RED SPOTTY,24,0.85,15179.0,United Kingdom,2025-08-02
495244,21977,PACK OF 60 PINK PAISLEY CAKE CASES,24,0.55,15179.0,United Kingdom,2025-08-02
495244,21563,RED HEART SHAPE LOVE BUCKET ,6,2.95,15179.0,United Kingdom,2025-08-02
495244,84970S,HANGING HEART ZINC T-LIGHT HOLDER,12,0.85,15179.0,United Kingdom,2025-08-02
495244,84970L,SINGLE HEART ZINC T-LIGHT HOLDER,12,0.95,15179.0,United Kingdom,2025-08-02
495244,22302,COFFEE MUG PEARS  DESIGN,6,2.55,15179.0,United Kingdom,2025-08-02
495244,85065,CREAM SWEETHEART TRAYS,2,12.75,15179.0,United Kingdom,2025-08-02
495244,21629,SQUARE FLOOR CUSHION VINTAGE RED,2,7.95,15179.0,United Kingdom,2025-08-02
495244,85014B,RED/WHITE DOTS RUFFLED UMBRELLA,6,5.95,15179.0,United Kingdom,2025-08-02
495244,21058,PARTY INVITES WOODLAND,12,0.85,15179.0,United Kingdom,2025-08-02
495244,21333,CLASSIC WHITE FRAME,12,2.95,15179.0,United Kingdom,2025-08-02
495244,85014D,PINK/BROWN DOTS RUFFLED UMBRELLA,6,5.95,15179.0,United Kingdom,2025-08-02
495244,47590A,BLUE HAPPY BIRTHDAY BUNTING,6,5.45,15179.0,United Kingdom,2025-08-02
495244,47590B,PINK HAPPY BIRTHDAY BUNTING,6,5.45,15179.0,United Kingdom,2025-08-02
495244,21755,LOVE BUILDING BLOCK WORD,3,5.95,15179.0,United Kingdom,2025-08-02
495244,85063,CREAM SWEETHEART MAGAZINE RACK,2,16.95,15179.0,United Kingdom,2025-08-02
495244,21114,LAVENDER SCENTED FABRIC HEART,20,1.25,15179.0,United Kingdom,2025-08-02
495276,20785,FUSCHIA RETRO BAR STOOL,12,35.95,14063.0,United Kingdom,2025-08-02
495276,20786,BLACK RETRO BAR STOOL,12,35.95,14063.0,United Kingdom,2025-08-02
495276,46126A,ELVIS WALLHANGING / CURTAIN,80,1.25,14063.0,United Kingdom,2025-08-02
495276,22200,FRYING PAN PINK POLKADOT ,24,3.75,14063.0,United Kingdom,2025-08-02
495276,82093,HEART SHAPE BUTTON FRAME ,18,1.25,14063.0,United Kingdom,2025-08-02
495277,84580,MOUSE TOY WITH PINK T-SHIRT,4,3.75,14911.0,EIRE,2025-08-02
495277,C2,CARRIAGE,1,50.0,14911.0,EIRE,2025-08-02
495277,85014D,PINK/BROWN DOTS RUFFLED UMBRELLA,3,5.95,14911.0,EIRE,2025-08-02
495277,20681,PINK SPOTTY CHILDS UMBRELLA,6,3.25,14911.0,EIRE,2025-08-02
495277,20901,VINTAGE KEEPSAKE BOX PINK FLOWER,2,6.35,14911.0,EIRE,2025-08-02
495277,85123A,WHITE HANGING HEART T-LIGHT HOLDER,6,2.95,14911.0,EIRE,2025-08-02
495277,21614,SET OF 12 ROSE BOTANICAL T-LIGHTS,6,2.95,14911.0,EIRE,2025-08-02
495277,22178,VICTORIAN GLASS HANGING T-LIGHT,12,1.25,14911.0,EIRE,2025-08-02
495277,21408,SPOTTY PINK DUCK DOORSTOP,3,4.25,14911.0,EIRE,2025-08-02
495277,21116,OWL DOORSTOP,3,4.95,14911.0,EIRE,2025-08-02
495277,21428,SET3 BOOK BOX GREEN GINGHAM FLOWER ,4,4.25,14911.0,EIRE,2025-08-02
