Invoice,StockCode,Description,Quantity,Price,Customer ID,Country,InvoiceDate
503430,48111,DOOR MAT 3 SMILEY CATS,10,6.35,13361.0,United Kingdom,2025-09-30
503430,62096A,PINK/YELLOW FLOWERS HANDBAG,6,1.95,13361.0,United Kingdom,2025-09-30
503430,62096B,PURPLE/TURQ FLOWERS HANDBAG,6,1.95,13361.0,United Kingdom,2025-09-30
503430,84932B,SMALL PINK PEONY FOLDING STOOL,8,1.95,13361.0,United Kingdom,2025-09-30
503430,84932A,SMALL GREEN PEONY FOLDING STOOL,8,1.95,13361.0,United Kingdom,2025-09-30
503430,84706D,CHERRY BLOSSOM TABLE CLOCK ,24,1.95,13361.0,United Kingdom,2025-09-30
503430,84664,CHERRY BLOSSOM BATHROOM CABINET,4,4.95,13361.0,United Kingdom,2025-09-30
503430,21580,RABBIT  DESIGN  COTTON TOTE BAG,6,2.25,13361.0,United Kingdom,2025-09-30
503430,21577,SAVE THE PLANET COTTON TOTE BAG,6,2.25,13361.0,United Kingdom,2025-09-30
503430,21576,LETS GO SHOPPING COTTON TOTE BAG,6,2.25,13361.0,United Kingdom,2025-09-30
503430,48188,DOOR MAT WELCOME PUPPIES,10,6.35,13361.0,United Kingdom,2025-09-30
503430,20703,BLUE PADDED SOFT MOBILE,3,4.25,13361.0,United Kingdom,2025-09-30
503430,22112,CHOCOLATE HOT WATER BOTTLE,3,4.95,13361.0,United Kingdom,2025-09-30
503430,22114,HOT WATER BOTTLE TEA AND SYMPATHY,4,3.95,13361.0,United Kingdom,2025-09-30
503430,84508C,BLUE CIRCLES DESIGN TEDDY,6,2.55,13361.0,United Kingdom,2025-09-30
503430,84327A,PINK JUMPER LARRY THE LAMB,6,2.1,13361.0,United Kingdom,2025-09-30
503430,48197,DOOR MAT BIRD ON THE WIRE,10,6.35,13361.0,United Kingdom,2025-09-30
503430,48194,DOOR MAT HEARTS,10,6.35,13361.0,United Kingdom,2025-09-30
503430,48187,DOOR MAT NEW ENGLAND,10,6.35,13361.0,United Kingdom,2025-09-30
503430,48129,DOOR MAT TOPIARY,10,6.35,13361.0,United Kingdom,2025-09-30
503430,48116,DOOR MAT MULTICOLOUR STRIPE,10,6.35,13361.0,United Kingdom,2025-09-30
503430,21524,DOOR MAT SPOTTY HOME SWEET HOME,10,6.35,13361.0,United Kingdom,2025-09-30
503430,21523,DOOR MAT FANCY FONT HOME SWEET HOME,10,6.35,13361.0,United Kingdom,2025-09-30
503430,20702,PINK PADDED MOBILE,3,4.25,13361.0,United Kingdom,2025-09-30
503431,84816,DANISH ROSE BEDSIDE CABINET,4,34.95,14643.0,United Kingdom,2025-09-30
503431,84932B,SMALL PINK PEONY FOLDING STOOL,8,1.95,14643.0,United Kingdom,2025-09-30
503431,84664,CHERRY BLOSSOM BATHROOM CABINET,4,4.95,14643.0,United Kingdom,2025-09-30
503431,82578,KITCHEN METAL SIGN,12,0.55,14643.0,United Kingdom,2025-09-30
503431,84615,PINK ROUND BUTTERFLY MIRROR ,8,1.95,14643.0,United Kingdom,2025-09-30
503431,21272,SALLE DE BAIN HOOK,12,1.25,14643.0,United Kingdom,2025-09-30
503431,78124,MAGAZINE RACK GEBRA ASSORTED ,24,1.25,14643.0,United Kingdom,2025-09-30
503431,22467,GUMBALL COAT RACK,36,2.1,14643.0,United Kingdom,2025-09-30
503431,82581,TOILET METAL SIGN,12,0.55,14643.0,United Kingdom,2025-09-30
503432,79321,CHILLI LIGHTS,8,4.95,17739.0,United Kingdom,2025-09-30
503432,85152,HAND OVER THE CHOCOLATE   SIGN ,12,2.1,17739.0,United Kingdom,2025-09-30
503432,21166,COOK WITH WINE METAL SIGN ,12,1.95,17739.0,United Kingdom,2025-09-30
503432,21155,RED SPOTTY PEG BAG,12,2.1,17739.0,United Kingdom,2025-09-30
503432,20727,LUNCH BAG  BLACK SKULL.,20,1.65,17739.0,United Kingdom,2025-09-30
503432,22382,LUNCH BAG SPACEBOY DESIGN ,10,1.65,17739.0,United Kingdom,2025-09-30
503432,48116,DOOR MAT MULTICOLOUR STRIPE,10,6.35,17739.0,United Kingdom,2025-09-30
503432,21777,RECIPE BOX WITH METAL HEART,12,6.95,17739.0,United Kingdom,2025-09-30
503432,22468,BABUSHKA LIGHTS STRING OF 10,6,6.75,17739.0,United Kingdom,2025-09-30
503432,21361,LOVE LARGE WOOD LETTERS ,6,12.75,17739.0,United Kingdom,2025-09-30
503432,21363,HOME SMALL WOOD LETTERS,6,4.95,17739.0,United Kingdom,2025-09-30
503432,22467,GUMBALL COAT RACK,6,2.55,17739.0,United Kingdom,2025-09-30
503432,84978,HANGING HEART JAR T-LIGHT HOLDER,12,1.25,17739.0,United Kingdom,2025-09-30
503433,POST,POSTAGE,2,18.0,12609.0,Germany,2025-09-30
503433,22367,CHILDS APRON SPACEBOY DESIGN,8,1.95,12609.0,Germany,2025-09-30
503433,21223,SET/4 BADGES WOODLAND ANIMAL,10,1.25,12609.0,Germany,2025-09-30
503433,22497,SET OF 2 TINS VINTAGE BATHROOM ,4,4.25,12609.0,Germany,2025-09-30
503433,22236,CAKE STAND 3 TIER MAGIC GARDEN,2,12.75,12609.0,Germany,2025-09-30
503433,21976,PACK OF 60 MUSHROOM CAKE CASES,24,0.55,12609.0,Germany,2025-09-30
503433,22382,LUNCH BAG SPACEBOY DESIGN ,10,1.65,12609.0,Germany,2025-09-30
503433,22303,COFFEE MUG APPLES DESIGN,6,2.55,12609.0,Germany,2025-09-30
503433,85232B,SET/3 RUSSIAN DOLL STACKING TINS,9,4.95,12609.0,Germany,2025-09-30
503433,21673,WHITE SPOT BLUE CERAMIC DRAWER KNOB,12,1.25,12609.0,Germany,2025-09-30
503433,21670,BLUE SPOT CERAMIC DRAWER KNOB,12,1.25,12609.0,Germany,2025-09-30
503433,21668,RED STRIPE CERAMIC DRAWER KNOB,12,1.25,12609.0,Germany,2025-09-30
503433,22326,ROUND SNACK BOXES SET OF4 WOODLAND ,6,2.95,12609.0,Germany,2025-09-30
503433,22301,COFFEE MUG CAT + BIRD DESIGN,6,2.55,12609.0,Germany,2025-09-30
503433,22300,COFFEE MUG DOG + BALL DESIGN,6,2.55,12609.0,Germany,2025-09-30
503433,22349,"DOG BOWL , CHASING BALL DESIGN",6,3.75,12609.0,Germany,2025-09-30
503433,22423,REGENCY CAKESTAND 3 TIER,2,12.75,12609.0,Germany,2025-09-30
503433,22505,MEMO BOARD COTTAGE DESIGN,4,4.95,12609.0,Germany,2025-09-30
503433,21452,TOADSTOOL MONEY BOX,6,2.95,12609.0,Germany,2025-09-30
503433,21672,WHITE SPOT RED CERAMIC DRAWER KNOB,12,1.25,12609.0,Germany,2025-09-30
503434,22518,CHILDS GARDEN BRUSH BLUE,36,1.85,15251.0,United Kingdom,2025-09-30
503434,22517,CHILDS GARDEN RAKE PINK,36,1.85,15251.0,United Kingdom,2025-09-30
503434,22516,CHILDS GARDEN RAKE BLUE,36,1.85,15251.0,United Kingdom,2025-09-30
503434,22519,CHILDS GARDEN BRUSH PINK,36,1.85,15251.0,United Kingdom,2025-09-30
503434,22528,GARDENERS KNEELING PAD,48,1.06,15251.0,United Kingdom,2025-09-30
503434,22515,CHILDS GARDEN SPADE PINK,36,1.85,15251.0,United Kingdom,2025-09-30
503434,22526,WHEELBARROW FOR CHILDREN ,12,10.95,15251.0,United Kingdom,2025-09-30
503434,22561,WOODEN SCHOOL COLOURING SET,48,1.45,15251.0,United Kingdom,2025-09-30
503434,22514,CHILDS GARDEN SPADE BLUE,36,1.85,15251.0,United Kingdom,2025-09-30
503435,82600,NO SINGING METAL SIGN,12,2.1,14893.0,United Kingdom,2025-09-30
503435,22275,WEEKEND BAG VINTAGE ROSE PAISLEY,4,8.5,14893.0,United Kingdom,2025-09-30
503435,22277,COSMETIC BAG VINTAGE ROSE PAISLEY,6,2.1,14893.0,United Kingdom,2025-09-30
503435,21116,OWL DOORSTOP,3,4.95,14893.0,United Kingdom,2025-09-30
503435,21407,BROWN CHECK CAT DOORSTOP ,3,4.25,14893.0,United Kingdom,2025-09-30
503435,21411,GINGHAM HEART  DOORSTOP RED,3,4.25,14893.0,United Kingdom,2025-09-30
503435,20960,WATERMELON BATH SPONGE,10,1.25,14893.0,United Kingdom,2025-09-30
503435,21175,GIN + TONIC DIET METAL SIGN,6,2.1,14893.0,United Kingdom,2025-09-30
503435,20961,STRAWBERRY BATH SPONGE ,10,1.25,14893.0,United Kingdom,2025-09-30
503435,15060B,FAIRY CAKE DESIGN UMBRELLA,4,3.75,14893.0,United Kingdom,2025-09-30
503435,21278,VINTAGE KITCHEN PRINT PUDDINGS,6,2.55,14893.0,United Kingdom,2025-09-30
503435,21279,VINTAGE KITCHEN PRINT FRUITS,6,2.55,14893.0,United Kingdom,2025-09-30
503435,21280,VINTAGE KITCHEN PRINT VEGETABLES,6,2.55,14893.0,United Kingdom,2025-09-30
503435,21928,JUMBO BAG SCANDINAVIAN PAISLEY,10,1.95,14893.0,United Kingdom,2025-09-30
503435,21758,VINTAGE SHELLS PRINT,4,6.45,14893.0,United Kingdom,2025-09-30
503435,22413,METAL SIGN TAKE IT OR LEAVE IT ,6,2.95,14893.0,United Kingdom,2025-09-30
503435,21624,VINTAGE UNION JACK DOORSTOP,3,5.95,14893.0,United Kingdom,2025-09-30
503435,85152,HAND OVER THE CHOCOLATE   SIGN ,6,2.1,14893.0,United Kingdom,2025-09-30
503435,21903,MAN FLU METAL SIGN,6,2.1,14893.0,United Kingdom,2025-09-30
503435,21906,PHARMACIE FIRST AID TIN,2,6.75,14893.0,United Kingdom,2025-09-30
503435,21260,FIRST AID TIN,6,3.25,14893.0,United Kingdom,2025-09-30
503435,22494,EMERGENCY FIRST AID TIN ,12,1.25,14893.0,United Kingdom,2025-09-30
503435,82486,WOOD S/3 CABINET ANT WHITE FINISH,2,7.95,14893.0,United Kingdom,2025-09-30
503435,21136,PAINTED METAL PEARS ASSORTED,8,1.69,14893.0,United Kingdom,2025-09-30
503435,84836,ZINC METAL HEART DECORATION,12,1.25,14893.0,United Kingdom,2025-09-30
503435,84879,ASSORTED COLOUR BIRD ORNAMENT,16,1.69,14893.0,United Kingdom,2025-09-30
503435,22294,HEART FILIGREE DOVE  SMALL,24,1.25,14893.0,United Kingdom,2025-09-30
503435,85099B,JUMBO BAG RED WHITE SPOTTY ,10,1.95,14893.0,United Kingdom,2025-09-30
503435,21164,HOME SWEET HOME METAL SIGN ,6,2.95,14893.0,United Kingdom,2025-09-30
503435,21181,PLEASE ONE PERSON  METAL SIGN,6,2.1,14893.0,United Kingdom,2025-09-30
503435,21166,COOK WITH WINE METAL SIGN ,12,1.95,14893.0,United Kingdom,2025-09-30
503435,21908,CHOCOLATE THIS WAY METAL SIGN,6,2.1,14893.0,United Kingdom,2025-09-30
503435,22295,HEART FILIGREE DOVE LARGE,12,1.65,14893.0,United Kingdom,2025-09-30
503436,22320,BIRDS MOBILE VINTAGE DESIGN,3,5.95,12662.0,Germany,2025-09-30
503436,21244,BLUE  SPOTTY PLATE ,8,1.69,12662.0,Germany,2025-09-30
503436,21245,GREEN  SPOTTY PLATE ,8,1.69,12662.0,Germany,2025-09-30
503436,22352,LUNCHBOX WITH CUTLERY RETROSPOT ,6,2.55,12662.0,Germany,2025-09-30
503436,20703,BLUE PADDED SOFT MOBILE,3,4.25,12662.0,Germany,2025-09-30
503436,22244,"HOOK, 3 HANGER ,MAGIC GARDEN",12,1.95,12662.0,Germany,2025-09-30
503436,21242,RED SPOTTY PLATE ,8,1.69,12662.0,Germany,2025-09-30
503436,22505,MEMO BOARD COTTAGE DESIGN,4,4.95,12662.0,Germany,2025-09-30
503436,22328,ROUND SNACK BOXES SET OF 4 FRUITS ,6,2.95,12662.0,Germany,2025-09-30
503436,20685,DOOR MAT RED SPOT,2,7.49,12662.0,Germany,2025-09-30
503436,22242,"HOOK, 5 HANGER , MAGIC TOADSTOOL",12,1.65,12662.0,Germany,2025-09-30
503436,85175,CACTI T-LIGHT CANDLES,16,0.42,12662.0,Germany,2025-09-30
503436,POST,POSTAGE,2,18.0,12662.0,Germany,2025-09-30
503436,22090,PAPER BUNTING RETRO SPOTS,6,2.95,12662.0,Germany,2025-09-30
503436,21238,RED SPOTTY CUP,8,0.85,12662.0,Germany,2025-09-30
503436,21124,SET/10 BLUE SPOTTY PARTY CANDLES,24,1.25,12662.0,Germany,2025-09-30
503436,21240,BLUE  SPOTTY CUP,8,0.85,12662.0,Germany,2025-09-30
503436,22326,ROUND SNACK BOXES SET OF4 WOODLAND ,6,2.95,12662.0,Germany,2025-09-30
503436,21680,WOODLAND  STICKERS,12,0.85,12662.0,Germany,2025-09-30
503436,20712,JUMBO BAG WOODLAND ANIMALS,10,1.95,12662.0,Germany,2025-09-30
503436,20726,LUNCH BAG WOODLAND,10,1.65,12662.0,Germany,2025-09-30
503436,20665,RED SPOTTY PURSE ,6,2.95,12662.0,Germany,2025-09-30
503436,20661,BLUE SPOTTY PURSE ,6,2.95,12662.0,Germany,2025-09-30
503436,20719,WOODLAND CHARLOTTE BAG,10,0.85,12662.0,Germany,2025-09-30
503436,20676,RED SPOTTY BOWL,8,1.25,12662.0,Germany,2025-09-30
503436,20675,BLUE SPOTTY BOWL,8,1.25,12662.0,Germany,2025-09-30
503436,21121,SET/10 RED SPOTTY PARTY CANDLES,24,1.25,12662.0,Germany,2025-09-30
503436,21241,GREEN SPOTTY CUP,8,0.85,12662.0,Germany,2025-09-30
503436,21156,RED SPOTTY CHILDS APRON,8,1.95,12662.0,Germany,2025-09-30
503436,20674,GREEN SPOTTY BOWL,8,1.25,12662.0,Germany,2025-09-30
503437,22115,METAL SIGN EMPIRE TEA,6,2.95,15689.0,United Kingdom,2025-09-30
503437,22487,WHITE WOOD GARDEN PLANT LADDER,1,9.95,15689.0,United Kingdom,2025-09-30
503437,22476,EMPIRE UNION JACK TV DINNER TRAY,3,4.95,15689.0,United Kingdom,2025-09-30
503437,22499,WOODEN UNION JACK BUNTING,3,5.95,15689.0,United Kingdom,2025-09-30
503437,22507,MEMO BOARD RETROSPOT  DESIGN,4,4.95,15689.0,United Kingdom,2025-09-30
503437,22467,GUMBALL COAT RACK,6,2.55,15689.0,United Kingdom,2025-09-30
503437,21165,BEWARE OF THE CAT METAL SIGN ,12,1.69,15689.0,United Kingdom,2025-09-30
503437,22485,SET OF 2 WOODEN MARKET CRATES,4,12.75,15689.0,United Kingdom,2025-09-30
503437,82581,TOILET METAL SIGN,12,0.55,15689.0,United Kingdom,2025-09-30
503437,82580,BATHROOM METAL SIGN,12,0.55,15689.0,United Kingdom,2025-09-30
503437,82552,WASHROOM METAL SIGN,12,1.25,15689.0,United Kingdom,2025-09-30
503437,21868,POTTING SHED TEA MUG,12,1.25,15689.0,United Kingdom,2025-09-30
503437,21911,GARDEN METAL SIGN ,12,1.65,15689.0,United Kingdom,2025-09-30
503437,21910,WAY OUT METAL SIGN ,12,1.65,15689.0,United Kingdom,2025-09-30
503437,21171,BATHROOM METAL SIGN ,12,1.45,15689.0,United Kingdom,2025-09-30
503438,22472,TV DINNER TRAY DOLLY GIRL,3,4.95,12417.0,Belgium,2025-09-30
503438,POST,POSTAGE,1,15.0,12417.0,Belgium,2025-09-30
503438,22509,SEWING BOX RETROSPOT DESIGN ,1,16.95,12417.0,Belgium,2025-09-30
503438,84937,KASHMIR FOLKART TUMBLERS,6,2.1,12417.0,Belgium,2025-09-30
503438,22077,6 RIBBONS RUSTIC CHARM,12,1.65,12417.0,Belgium,2025-09-30
503438,84997B,RED 3 PIECE MINI DOTS CUTLERY SET,6,3.75,12417.0,Belgium,2025-09-30
503438,22399,MAGNETS PACK OF 4 CHILDHOOD MEMORY,12,1.25,12417.0,Belgium,2025-09-30
503438,21715,GIRLS VINTAGE TIN SEASIDE BUCKET,8,2.55,12417.0,Belgium,2025-09-30
503438,21130,COLOURFUL STANDING GNOME,6,3.45,12417.0,Belgium,2025-09-30
503438,22559,SEASIDE FRISBEE ,12,1.25,12417.0,Belgium,2025-09-30
503438,22530,MAGIC DRAWING SLATE DOLLY GIRL ,48,0.42,12417.0,Belgium,2025-09-30
503438,85098B,BLUE FLYING SINGING CANARY,4,3.75,12417.0,Belgium,2025-09-30
503438,22449,SILK PURSE RUSSIAN DOLL PINK,6,3.35,12417.0,Belgium,2025-09-30
503438,21249,WOODLAND  HEIGHT CHART STICKERS ,6,2.95,12417.0,Belgium,2025-09-30
503439,POST,POSTAGE,7,18.0,12647.0,Germany,2025-09-30
503439,22245,"HOOK, 1 HANGER ,MAGIC GARDEN",12,0.85,12647.0,Germany,2025-09-30
503439,22242,"HOOK, 5 HANGER , MAGIC TOADSTOOL",12,1.65,12647.0,Germany,2025-09-30
503439,20685,DOOR MAT RED SPOT,10,6.35,12647.0,Germany,2025-09-30
503439,85049H,URBAN BLACK RIBBONS ,12,1.25,12647.0,Germany,2025-09-30
503439,85049G,CHOCOLATE BOX RIBBONS ,24,1.25,12647.0,Germany,2025-09-30
503439,85049C,ROMANTIC PINKS RIBBONS ,24,1.25,12647.0,Germany,2025-09-30
503439,85049B,LUSH GREENS RIBBONS,24,1.25,12647.0,Germany,2025-09-30
503439,22378,WALL TIDY RETROSPOT ,10,2.1,12647.0,Germany,2025-09-30
503439,22212,FOUR HOOK  WHITE LOVEBIRDS,12,2.1,12647.0,Germany,2025-09-30
503439,85162C,WHITE RETRODISC LAMPSHADE,24,1.95,12647.0,Germany,2025-09-30
503439,22386,JUMBO BAG PINK WITH WHITE SPOTS,10,1.95,12647.0,Germany,2025-09-30
503439,84691,PACK 20 DOLLY PEGS,12,0.85,12647.0,Germany,2025-09-30
503439,22077,6 RIBBONS RUSTIC CHARM,24,1.65,12647.0,Germany,2025-09-30
503439,22507,MEMO BOARD RETROSPOT  DESIGN,8,4.95,12647.0,Germany,2025-09-30
503439,22505,MEMO BOARD COTTAGE DESIGN,8,4.95,12647.0,Germany,2025-09-30
503439,22568,FELTCRAFT CUSHION OWL,4,3.75,12647.0,Germany,2025-09-30
503439,85162A,SILVER RETRODISC LAMPSHADE,24,1.95,12647.0,Germany,2025-09-30
C503440,M,Manual,-1,376.17,14481.0,United Kingdom,2025-09-30
503441,79321,CHILLI LIGHTS,24,4.25,15606.0,United Kingdom,2025-09-30
503441,16202E,BLACK PHOTO ALBUM ,12,1.95,15606.0,United Kingdom,2025-09-30
503441,84660B,BLACK STITCHED WALL CLOCK,4,3.75,15606.0,United Kingdom,2025-09-30
503441,22194,BLACK DINER WALL CLOCK,2,8.5,15606.0,United Kingdom,2025-09-30
503441,21216,"SET 3 RED SPOT TIN TEA,COFFEE,SUGAR",4,4.95,15606.0,United Kingdom,2025-09-30
503441,22513,DOORSTOP FOOTBALL DESIGN,4,3.75,15606.0,United Kingdom,2025-09-30
503441,22475,SKULL DESIGN TV DINNER TRAY,3,4.95,15606.0,United Kingdom,2025-09-30
503441,22468,BABUSHKA LIGHTS STRING OF 10,2,6.75,15606.0,United Kingdom,2025-09-30
503441,79323P,PINK CHERRY LIGHTS,4,6.75,15606.0,United Kingdom,2025-09-30
503441,22236,CAKE STAND 3 TIER MAGIC GARDEN,2,12.75,15606.0,United Kingdom,2025-09-30
503441,79323B,BLACK CHERRY LIGHTS,4,6.75,15606.0,United Kingdom,2025-09-30
503442,22584,PACK OF 6 PANNETONE GIFT BOXES,1,2.55,18009.0,United Kingdom,2025-09-30
503442,22148,EASTER CRAFT 4 CHICKS ,2,1.95,18009.0,United Kingdom,2025-09-30
503442,22146,EASTER CRAFT IVY WREATH WITH CHICK,2,1.95,18009.0,United Kingdom,2025-09-30
503442,21380,WOODEN HAPPY BIRTHDAY GARLAND,4,2.95,18009.0,United Kingdom,2025-09-30
503442,85123A,WHITE HANGING HEART T-LIGHT HOLDER,8,2.95,18009.0,United Kingdom,2025-09-30
503442,90160D,PINK BOUDICCA LARGE BRACELET,3,6.95,18009.0,United Kingdom,2025-09-30
503442,90160B,RED BOUDICCA LARGE BRACELET,3,6.95,18009.0,United Kingdom,2025-09-30
503442,90199B,5 STRAND GLASS NECKLACE AMETHYST,3,6.35,18009.0,United Kingdom,2025-09-30
503442,90014B,GOLD M PEARL  ORBIT NECKLACE,3,9.95,18009.0,United Kingdom,2025-09-30
503442,90149,SILVER FLOWR PINK SHELL NECKLACE,3,7.5,18009.0,United Kingdom,2025-09-30
503442,90152C,BLUE/NAT SHELL NECKLACE W PENDANT,3,5.95,18009.0,United Kingdom,2025-09-30
503442,90151,SILVER/NATURAL SHELL NECKLACE,3,8.5,18009.0,United Kingdom,2025-09-30
503443,21272,SALLE DE BAIN HOOK,12,1.25,15754.0,United Kingdom,2025-09-30
503443,22275,WEEKEND BAG VINTAGE ROSE PAISLEY,2,8.5,15754.0,United Kingdom,2025-09-30
503443,22276,WASH BAG VINTAGE ROSE PAISLEY,6,2.55,15754.0,United Kingdom,2025-09-30
503443,47568,ENGLISH ROSE DESIGN PEG BAG,6,2.1,15754.0,United Kingdom,2025-09-30
503443,85150,LADIES & GENTLEMEN METAL SIGN,6,2.55,15754.0,United Kingdom,2025-09-30
503443,82552,WASHROOM METAL SIGN,12,1.25,15754.0,United Kingdom,2025-09-30
503443,22423,REGENCY CAKESTAND 3 TIER,2,12.75,15754.0,United Kingdom,2025-09-30
503443,22277,COSMETIC BAG VINTAGE ROSE PAISLEY,6,2.1,15754.0,United Kingdom,2025-09-30
503443,22139,RETRO SPOT TEA SET CERAMIC 11 PC ,24,4.25,15754.0,United Kingdom,2025-09-30
503443,22096,PINK PAISLEY SQUARE TISSUE BOX ,12,1.25,15754.0,United Kingdom,2025-09-30
503443,21984,PACK OF 12 PINK PAISLEY TISSUES ,48,0.29,15754.0,United Kingdom,2025-09-30
503443,22278,OVERNIGHT BAG VINTAGE ROSE PAISLEY,3,4.95,15754.0,United Kingdom,2025-09-30
503443,22557,PLASTERS IN TIN VINTAGE PAISLEY ,12,1.65,15754.0,United Kingdom,2025-09-30
503443,84682,CLASSICAL ROSE DISH,24,1.25,15754.0,United Kingdom,2025-09-30
503444,15036,ASSORTED COLOURS SILK FAN,600,0.65,16377.0,United Kingdom,2025-09-30
503444,16016,LARGE CHINESE STYLE SCISSOR,60,0.85,16377.0,United Kingdom,2025-09-30
503444,16014,SMALL CHINESE STYLE SCISSOR,60,0.42,16377.0,United Kingdom,2025-09-30
503444,16015,MEDIUM CHINESE STYLE SCISSOR,60,0.5,16377.0,United Kingdom,2025-09-30
503444,17033,"BROCADE PURSE,SMALL ARCH BUTTON",648,0.21,16377.0,United Kingdom,2025-09-30
503445,85099B,JUMBO BAG RED WHITE SPOTTY ,30,1.95,13327.0,United Kingdom,2025-09-30
503445,85099F,JUMBO BAG STRAWBERRY,10,1.95,13327.0,United Kingdom,2025-09-30
503445,82580,BATHROOM METAL SIGN,12,0.55,13327.0,United Kingdom,2025-09-30
503445,85150,LADIES & GENTLEMEN METAL SIGN,12,2.55,13327.0,United Kingdom,2025-09-30
503445,22411,JUMBO SHOPPER VINTAGE RED PAISLEY,20,1.95,13327.0,United Kingdom,2025-09-30
503445,82578,KITCHEN METAL SIGN,12,0.55,13327.0,United Kingdom,2025-09-30
503445,85217,ASSORTED ICE CREAM FRIDGE MAGNETS,12,0.65,13327.0,United Kingdom,2025-09-30
503445,22279,POCKET BAG BLUE PAISLEY RED SPOT,6,2.1,13327.0,United Kingdom,2025-09-30
503445,21175,GIN + TONIC DIET METAL SIGN,12,2.1,13327.0,United Kingdom,2025-09-30
503445,22379,RECYCLING BAG RETROSPOT ,20,2.1,13327.0,United Kingdom,2025-09-30
503445,22367,CHILDS APRON SPACEBOY DESIGN,8,1.95,13327.0,United Kingdom,2025-09-30
503445,22197,SMALL POPCORN HOLDER,12,0.85,13327.0,United Kingdom,2025-09-30
503445,22198,LARGE POPCORN HOLDER ,24,1.65,13327.0,United Kingdom,2025-09-30
503445,48188,DOOR MAT WELCOME PUPPIES,10,6.35,13327.0,United Kingdom,2025-09-30
503445,79321,CHILLI LIGHTS,8,4.95,13327.0,United Kingdom,2025-09-30
503445,21381,MINI WOODEN HAPPY BIRTHDAY GARLAND,12,1.69,13327.0,United Kingdom,2025-09-30
503445,85222,ASSORTED COLOUR SILK COSMETIC PURSE,12,2.1,13327.0,United Kingdom,2025-09-30
503445,22449,SILK PURSE RUSSIAN DOLL PINK,6,3.35,13327.0,United Kingdom,2025-09-30
503445,21156,RED SPOTTY CHILDS APRON,8,1.95,13327.0,United Kingdom,2025-09-30
503445,22381,TOY TIDY PINK RETROSPOT  ,20,2.1,13327.0,United Kingdom,2025-09-30
C503446,35001P,HAND OPEN SHAPE PINK,-1,3.49,14796.0,United Kingdom,2025-09-30
C503446,22374,AIRLINE BAG VINTAGE JET SET RED,-1,6.35,14796.0,United Kingdom,2025-09-30
C503446,85152,HAND OVER THE CHOCOLATE   SIGN ,-1,2.1,14796.0,United Kingdom,2025-09-30
503447,22507,MEMO BOARD RETROSPOT  DESIGN,4,4.95,14916.0,United Kingdom,2025-09-30
503447,22029,SPACEBOY BIRTHDAY CARD,12,0.42,14916.0,United Kingdom,2025-09-30
503447,22027,TEA PARTY BIRTHDAY CARD,12,0.42,14916.0,United Kingdom,2025-09-30
503447,22030,SWALLOWS GREETING CARD,12,0.42,14916.0,United Kingdom,2025-09-30
503447,21787,RAIN PONCHO WITH RED SPOTS,24,0.85,14916.0,United Kingdom,2025-09-30
503447,21786,RAIN HAT WITH RED SPOTS,24,0.42,14916.0,United Kingdom,2025-09-30
503447,22488,NATURAL SLATE RECTANGLE CHALKBOARD,12,1.65,14916.0,United Kingdom,2025-09-30
503447,21918,SET 12 KIDS COLOUR  CHALK STICKS,24,0.42,14916.0,United Kingdom,2025-09-30
503447,21902,"KEY FOB , FRONT  DOOR ",24,0.65,14916.0,United Kingdom,2025-09-30
503447,21901,"KEY FOB , BACK DOOR ",24,0.65,14916.0,United Kingdom,2025-09-30
503447,21900,"KEY FOB , SHED",24,0.65,14916.0,United Kingdom,2025-09-30
503447,21889,WOODEN BOX OF DOMINOES,12,1.25,14916.0,United Kingdom,2025-09-30
503447,21899,"KEY FOB , GARAGE DESIGN",24,0.65,14916.0,United Kingdom,2025-09-30
503447,21980,PACK OF 12 RED SPOTTY TISSUES ,48,0.29,14916.0,United Kingdom,2025-09-30
503447,22024,RAINY LADIES BIRTHDAY CARD,12,0.42,14916.0,United Kingdom,2025-09-30
503447,21745,GAOLERS KEYS DECORATIVE GARDEN ,4,3.75,14916.0,United Kingdom,2025-09-30
503447,22026,BANQUET BIRTHDAY  CARD  ,12,0.42,14916.0,United Kingdom,2025-09-30
503447,20712,JUMBO BAG WOODLAND ANIMALS,10,1.95,14916.0,United Kingdom,2025-09-30
503447,22540,MINI JIGSAW CIRCUS PARADE ,48,0.42,14916.0,United Kingdom,2025-09-30
503447,20724,RED SPOTTY CHARLOTTE BAG,100,0.72,14916.0,United Kingdom,2025-09-30
503447,20723,STRAWBERRY CHARLOTTE BAG,10,0.85,14916.0,United Kingdom,2025-09-30
503447,22356,"CHARLOTTE BAG , PINK/WHITE SPOTS",10,0.85,14916.0,United Kingdom,2025-09-30
503447,20719,WOODLAND CHARLOTTE BAG,10,0.85,14916.0,United Kingdom,2025-09-30
503447,85099F,JUMBO BAG STRAWBERRY,100,1.65,14916.0,United Kingdom,2025-09-30
503447,20713,JUMBO BAG OWLS,10,1.95,14916.0,United Kingdom,2025-09-30
503447,20711,JUMBO BAG TOYS ,10,1.95,14916.0,United Kingdom,2025-09-30
503447,22423,REGENCY CAKESTAND 3 TIER,1,12.75,14916.0,United Kingdom,2025-09-30
503447,22385,JUMBO BAG SPACEBOY DESIGN,10,1.95,14916.0,United Kingdom,2025-09-30
503447,22367,CHILDS APRON SPACEBOY DESIGN,8,1.95,14916.0,United Kingdom,2025-09-30
503447,22530,MAGIC DRAWING SLATE DOLLY GIRL ,48,0.42,14916.0,United Kingdom,2025-09-30
503447,22537,MAGIC DRAWING SLATE DINOSAUR,48,0.42,14916.0,United Kingdom,2025-09-30
503447,22561,WOODEN SCHOOL COLOURING SET,12,1.65,14916.0,United Kingdom,2025-09-30
503447,22544,MINI JIGSAW SPACEBOY,48,0.42,14916.0,United Kingdom,2025-09-30
503447,22411,JUMBO SHOPPER VINTAGE RED PAISLEY,10,1.95,14916.0,United Kingdom,2025-09-30
503448,21039,RED SPOTTY SHOPPING BAG,6,2.55,16779.0,United Kingdom,2025-09-30
503448,20711,JUMBO BAG TOYS ,20,1.95,16779.0,United Kingdom,2025-09-30
503448,84499,BLACK FLOWER CANDLE PLATE,12,0.85,16779.0,United Kingdom,2025-09-30
503448,72780,BLACK SILOUETTE CANDLE PLATE,24,0.85,16779.0,United Kingdom,2025-09-30
503448,21035,SET/2 RED SPOTTY TEA TOWELS ,6,2.95,16779.0,United Kingdom,2025-09-30
503448,37508,NEW ENGLAND CERAMIC CAKE SERVER,3,2.55,16779.0,United Kingdom,2025-09-30
503448,20726,LUNCH BAG WOODLAND,100,1.45,16779.0,United Kingdom,2025-09-30
503448,17001,HEAVENS SCENT FRAGRANCE OILS ASSTD,36,0.29,16779.0,United Kingdom,2025-09-30
503448,21906,PHARMACIE FIRST AID TIN,16,5.95,16779.0,United Kingdom,2025-09-30
503448,85123A,WHITE HANGING HEART T-LIGHT HOLDER,32,2.55,16779.0,United Kingdom,2025-09-30
503448,21218,RED SPOTTY BISCUIT TIN,24,3.25,16779.0,United Kingdom,2025-09-30
503448,21086,SET/6 RED SPOTTY PAPER CUPS,6,0.65,16779.0,United Kingdom,2025-09-30
503449,82600,NO SINGING METAL SIGN,2,2.1,14796.0,United Kingdom,2025-09-30
503449,21166,COOK WITH WINE METAL SIGN ,6,1.95,14796.0,United Kingdom,2025-09-30
503449,21903,MAN FLU METAL SIGN,2,2.1,14796.0,United Kingdom,2025-09-30
503449,21905,MORE BUTTER METAL SIGN ,1,2.1,14796.0,United Kingdom,2025-09-30
503449,21907,I'M ON HOLIDAY METAL SIGN,2,2.1,14796.0,United Kingdom,2025-09-30
503449,85150,LADIES & GENTLEMEN METAL SIGN,4,2.55,14796.0,United Kingdom,2025-09-30
503449,21181,PLEASE ONE PERSON METAL SIGN,3,2.1,14796.0,United Kingdom,2025-09-30
503449,21175,GIN + TONIC DIET METAL SIGN,5,2.1,14796.0,United Kingdom,2025-09-30
503449,82597,BOMBS AWAY METAL SIGN,2,2.1,14796.0,United Kingdom,2025-09-30
503449,21165,BEWARE OF THE CAT METAL SIGN ,5,1.69,14796.0,United Kingdom,2025-09-30
503449,22582,PACK OF 6 SWEETIE GIFT BOXES,1,2.55,14796.0,United Kingdom,2025-09-30
503449,85152,HAND OVER THE CHOCOLATE   SIGN ,1,2.1,14796.0,United Kingdom,2025-09-30
503449,82582,AREA PATROLLED METAL SIGN,3,2.1,14796.0,United Kingdom,2025-09-30
503449,15056BL,EDWARDIAN PARASOL BLACK,2,5.95,14796.0,United Kingdom,2025-09-30
503449,85014A,BLACK/BLUE DOTS RUFFLED UMBRELLA,1,5.95,14796.0,United Kingdom,2025-09-30
503449,22583,PACK OF 6 HANDBAG GIFT BOXES,1,2.55,14796.0,United Kingdom,2025-09-30
503449,20679,EDWARDIAN PARASOL RED,1,5.95,14796.0,United Kingdom,2025-09-30
503449,22584,PACK OF 6 PANNETONE GIFT BOXES,1,2.55,14796.0,United Kingdom,2025-09-30
503449,85123A,WHITE HANGING HEART T-LIGHT HOLDER,2,2.95,14796.0,United Kingdom,2025-09-30
503449,22412,METAL SIGN NEIGHBOURHOOD WITCH ,4,2.1,14796.0,United Kingdom,2025-09-30
503449,82567,"AIRLINE LOUNGE,METAL SIGN",3,2.1,14796.0,United Kingdom,2025-09-30
503450,79315W,FLYING SAUCER TABLE LIGHT IN WHITE,16,2.95,13582.0,United Kingdom,2025-09-30
503450,84597C,RETRO PINK BALL ASHTRAY ,12,1.25,13582.0,United Kingdom,2025-09-30
503450,22467,GUMBALL COAT RACK,6,2.55,13582.0,United Kingdom,2025-09-30
503452,21785,RAIN PONCHO ,72,0.65,16347.0,United Kingdom,2025-09-30
503452,79029,GLASS HONEYPOT WASP CATCHER,6,1.95,16347.0,United Kingdom,2025-09-30
503452,22567,20 DOLLY PEGS RETROSPOT,10,1.25,16347.0,United Kingdom,2025-09-30
503455,21041,RED SPOTTY OVEN GLOVE DOUBLE,85,2.55,15311.0,United Kingdom,2025-09-30
503452,84755,COLOUR GLASS T-LIGHT HOLDER HANGING,8,0.65,16347.0,United Kingdom,2025-09-30
503452,84077,WORLD WAR 2 GLIDERS ASSTD DESIGNS,48,0.21,16347.0,United Kingdom,2025-09-30
