Invoice,StockCode,Description,Quantity,Price,Customer ID,Country,InvoiceDate
512455,21791,VINTAGE HEADS AND TAILS CARD GAME ,12,1.25,12957.0,United Kingdom,2025-11-29
512455,21891,TRADITIONAL WOODEN SKIPPING ROPE,12,1.25,12957.0,United Kingdom,2025-11-29
512455,21656,RIDGED GLASS POSY VASE ,6,1.45,12957.0,United Kingdom,2025-11-29
512455,84997D,PINK 3 PIECE MINI DOTS CUTLERY SET,6,3.75,12957.0,United Kingdom,2025-11-29
512455,20674,GREEN SPOTTY BOWL,8,1.25,12957.0,United Kingdom,2025-11-29
512455,20675,BLUE SPOTTY BOWL,8,1.25,12957.0,United Kingdom,2025-11-29
512455,20671,BLUE TEATIME PRINT BOWL ,8,1.25,12957.0,United Kingdom,2025-11-29
512455,85160A,WHITE BIRD GARDEN DESIGN MUG,6,1.25,12957.0,United Kingdom,2025-11-29
512455,21876,POTTERING MUG,12,1.25,12957.0,United Kingdom,2025-11-29
512455,22508,DOORSTOP RETROSPOT HEART,4,3.75,12957.0,United Kingdom,2025-11-29
512455,21391,FRENCH EMROIDR LAVENDER SCENT HEART,6,2.1,12957.0,United Kingdom,2025-11-29
512455,22167,"WALL MIRROR , DIAMANTE OVAL SHAPE",2,9.95,12957.0,United Kingdom,2025-11-29
512455,75131,METAL TUBE CHIME ON BAMBOO,6,1.69,12957.0,United Kingdom,2025-11-29
512455,21888,BINGO SET,4,3.75,12957.0,United Kingdom,2025-11-29
512455,37340,MULTICOLOUR SPRING FLOWER MUG,12,0.85,12957.0,United Kingdom,2025-11-29
512455,21839,MUMMY MOUSE RED GINGHAM RIBBON,3,5.45,12957.0,United Kingdom,2025-11-29
512455,84659A,WHITE TRAVEL ALARM CLOCK,6,2.55,12957.0,United Kingdom,2025-11-29
512455,21055,TOOL BOX SOFT TOY ,1,8.95,12957.0,United Kingdom,2025-11-29
512455,22540,MINI JIGSAW CIRCUS PARADE ,48,0.42,12957.0,United Kingdom,2025-11-29
512455,22627,MINT KITCHEN SCALES,2,8.5,12957.0,United Kingdom,2025-11-29
512455,22620,4 TRADITIONAL SPINNING TOPS,12,1.25,12957.0,United Kingdom,2025-11-29
512455,22491,PACK OF 12 COLOURED PENCILS,12,0.85,12957.0,United Kingdom,2025-11-29
512455,22489,PACK OF 12 TRADITIONAL CRAYONS,24,0.42,12957.0,United Kingdom,2025-11-29
512455,21380,WOODEN HAPPY BIRTHDAY GARLAND,6,2.95,12957.0,United Kingdom,2025-11-29
512455,22169,FAMILY ALBUM WHITE PICTURE FRAME,2,8.5,12957.0,United Kingdom,2025-11-29
512455,21407,BROWN CHECK CAT DOORSTOP ,3,4.25,12957.0,United Kingdom,2025-11-29
512455,21115,ROSE CARAVAN DOORSTOP,2,6.75,12957.0,United Kingdom,2025-11-29
512455,21410,COUNTRY COTTAGE  DOORSTOP GREEN,3,4.25,12957.0,United Kingdom,2025-11-29
512455,21641,ASSORTED TUTTI FRUTTI KEYRING BALL,24,0.85,12957.0,United Kingdom,2025-11-29
512455,21868,POTTING SHED TEA MUG,12,1.25,12957.0,United Kingdom,2025-11-29
512455,37492B,BLUE YELLOW FLOWER PIGGY BANK,4,4.65,12957.0,United Kingdom,2025-11-29
512455,84920,PINK FLOWER FABRIC PONY,4,3.75,12957.0,United Kingdom,2025-11-29
512455,21054,NURSE'S BAG SOFT TOY,1,8.95,12957.0,United Kingdom,2025-11-29
512455,84508B,STRIPES DESIGN TEDDY,6,2.55,12957.0,United Kingdom,2025-11-29
512455,85226A,WHITE/BLUE PULL BACK RACING CAR,12,0.55,12957.0,United Kingdom,2025-11-29
512455,21892,TRADITIONAL WOODEN CATCH CUP GAME ,12,1.25,12957.0,United Kingdom,2025-11-29
512455,22436,12 COLOURED PARTY BALLOONS,20,0.65,12957.0,United Kingdom,2025-11-29
512455,48188,DOOR MAT WELCOME PUPPIES,2,7.49,12957.0,United Kingdom,2025-11-29
512455,48194,DOOR MAT HEARTS,2,7.49,12957.0,United Kingdom,2025-11-29
512455,22528,GARDENERS KNEELING PAD,12,1.25,12957.0,United Kingdom,2025-11-29
512455,79029,GLASS HONEYPOT WASP CATCHER,12,1.95,12957.0,United Kingdom,2025-11-29
512455,84795C,OCEAN STRIPE HAMMOCK ,2,7.95,12957.0,United Kingdom,2025-11-29
512455,21923,RED/CREAM STRIPE FRINGE HAMMOCK,2,7.95,12957.0,United Kingdom,2025-11-29
512455,48187,DOOR MAT NEW ENGLAND,4,7.49,12957.0,United Kingdom,2025-11-29
512455,84795A,PASTEL STRIPE HAMMOCK ,2,7.95,12957.0,United Kingdom,2025-11-29
512455,85049D,BRIGHT BLUES RIBBONS ,12,1.25,12957.0,United Kingdom,2025-11-29
512455,85049F,BABY BOOM RIBBONS ,12,1.25,12957.0,United Kingdom,2025-11-29
512455,85049C,ROMANTIC PINKS RIBBONS ,12,1.25,12957.0,United Kingdom,2025-11-29
512455,22077,6 RIBBONS RUSTIC CHARM,12,1.65,12957.0,United Kingdom,2025-11-29
512455,22273,FELTCRAFT DOLL MOLLY,6,2.95,12957.0,United Kingdom,2025-11-29
512455,22090,PAPER BUNTING RETRO SPOTS,6,2.95,12957.0,United Kingdom,2025-11-29
512455,22080,RIBBON REEL SPOTS DESIGN ,10,1.65,12957.0,United Kingdom,2025-11-29
512455,22365,DOOR MAT RESPECTABLE HOUSE,4,7.49,12957.0,United Kingdom,2025-11-29
512455,48129,DOOR MAT TOPIARY,2,7.49,12957.0,United Kingdom,2025-11-29
512455,20749,ASSORTED COLOUR MINI CASES,2,7.95,12957.0,United Kingdom,2025-11-29
512455,22429,ENAMEL MEASURING JUG CREAM,4,4.25,12957.0,United Kingdom,2025-11-29
512455,85123A,WHITE HANGING HEART T-LIGHT HOLDER,12,2.95,12957.0,United Kingdom,2025-11-29
512455,84970S,HANGING HEART ZINC T-LIGHT HOLDER,24,0.85,12957.0,United Kingdom,2025-11-29
512455,21524,DOOR MAT SPOTTY HOME SWEET HOME,4,7.49,12957.0,United Kingdom,2025-11-29
512455,22083,PAPER CHAIN KIT RETRO SPOT,12,2.95,12957.0,United Kingdom,2025-11-29
512455,22139,RETRO SPOT TEA SET CERAMIC 11 PC ,3,4.95,12957.0,United Kingdom,2025-11-29
512455,21355,TOAST ITS - I LOVE YOU ,12,1.25,12957.0,United Kingdom,2025-11-29
512455,22584,PACK OF 6 PANNETONE GIFT BOXES,6,2.55,12957.0,United Kingdom,2025-11-29
512455,62096A,PINK/YELLOW FLOWERS HANDBAG,6,1.25,12957.0,United Kingdom,2025-11-29
512455,84857C,PINK MONTE CARLO HANDBAG,2,8.5,12957.0,United Kingdom,2025-11-29
512455,22374,AIRLINE BAG VINTAGE JET SET RED,2,6.35,12957.0,United Kingdom,2025-11-29
512455,84858C,PINK RIVIERA HANDBAG,2,5.95,12957.0,United Kingdom,2025-11-29
512455,20970,PINK FLORAL FELTCRAFT SHOULDER BAG,4,3.75,12957.0,United Kingdom,2025-11-29
512455,22452,MEASURING TAPE RUSSIAN DOLL PINK,6,2.95,12957.0,United Kingdom,2025-11-29
512455,84856L,LARGE TAHITI BEACH BAG,3,5.95,12957.0,United Kingdom,2025-11-29
512455,22434,BALLOON PUMP WITH 10 BALLOONS,8,1.95,12957.0,United Kingdom,2025-11-29
512456,20685,DOOR MAT RED SPOT,2,7.49,12957.0,United Kingdom,2025-11-29
512456,22502,PICNIC BASKET WICKER SMALL,4,4.25,12957.0,United Kingdom,2025-11-29
512456,22425,ENAMEL COLLANDER CREAM,3,4.95,12957.0,United Kingdom,2025-11-29
512456,22429,ENAMEL MEASURING JUG CREAM,4,4.25,12957.0,United Kingdom,2025-11-29
512456,22180,RETRO SPOT LAMP,3,9.95,12957.0,United Kingdom,2025-11-29
512456,22491,PACK OF 12 COLOURED PENCILS,12,0.85,12957.0,United Kingdom,2025-11-29
512456,22558,CLOTHES PEGS RETROSPOT PACK 24 ,12,1.25,12957.0,United Kingdom,2025-11-29
512457,22055,MINI CAKE STAND  HANGING STRAWBERY,64,1.45,14045.0,United Kingdom,2025-11-29
512457,22061,LARGE CAKE STAND  HANGING STRAWBERY,32,8.5,14045.0,United Kingdom,2025-11-29
512457,20914,SET/5 RED SPOTTY LID GLASS BOWLS,64,2.55,14045.0,United Kingdom,2025-11-29
512458,22529,MAGIC DRAWING SLATE GO TO THE FAIR ,48,0.42,14634.0,United Kingdom,2025-11-29
512458,22536,MAGIC DRAWING SLATE FIDO,48,0.42,14634.0,United Kingdom,2025-11-29
512458,22534,MAGIC DRAWING SLATE SPACEBOY ,48,0.42,14634.0,United Kingdom,2025-11-29
512458,22561,WOODEN SCHOOL COLOURING SET,12,1.65,14634.0,United Kingdom,2025-11-29
512458,20974,12 PENCILS SMALL TUBE SKULL,24,0.65,14634.0,United Kingdom,2025-11-29
512458,84270,ASSTD DESIGN BUBBLE GUM RING,60,0.21,14634.0,United Kingdom,2025-11-29
512458,10002,INFLATABLE POLITICAL GLOBE ,12,0.85,14634.0,United Kingdom,2025-11-29
512458,84077,WORLD WAR 2 GLIDERS ASSTD DESIGNS,48,0.21,14634.0,United Kingdom,2025-11-29
512458,22533,MAGIC DRAWING SLATE BAKE A CAKE ,48,0.42,14634.0,United Kingdom,2025-11-29
512458,21988,PACK OF 6 SKULL PAPER PLATES,12,0.85,14634.0,United Kingdom,2025-11-29
512458,85049H,URBAN BLACK RIBBONS ,12,1.25,14634.0,United Kingdom,2025-11-29
512458,85049C,ROMANTIC PINKS RIBBONS ,12,1.25,14634.0,United Kingdom,2025-11-29
512458,21747,SMALL SKULL WINDMILL,12,1.25,14634.0,United Kingdom,2025-11-29
512458,22332,SKULLS PARTY BAG + STICKER SET,8,1.65,14634.0,United Kingdom,2025-11-29
512458,22085,PAPER CHAIN KIT SKULLS ,6,2.95,14634.0,United Kingdom,2025-11-29
512458,22327,ROUND SNACK BOXES SET OF 4 SKULLS,6,2.95,14634.0,United Kingdom,2025-11-29
512458,21211,SET OF 72 SKULL PAPER  DOILIES,12,1.45,14634.0,United Kingdom,2025-11-29
512458,21213,PACK OF 72 SKULL CAKE CASES,24,0.55,14634.0,United Kingdom,2025-11-29
512458,85049D,BRIGHT BLUES RIBBONS ,12,1.25,14634.0,United Kingdom,2025-11-29
512458,22299,PIG KEYRING WITH LIGHT & SOUND ,24,1.25,14634.0,United Kingdom,2025-11-29
512458,22537,MAGIC DRAWING SLATE DINOSAUR,48,0.42,14634.0,United Kingdom,2025-11-29
512458,22617,BAKING SET SPACEBOY DESIGN,3,4.95,14634.0,United Kingdom,2025-11-29
512458,22041,"RECORD FRAME 7"" SINGLE SIZE ",6,2.55,14634.0,United Kingdom,2025-11-29
512458,21137,BLACK RECORD COVER FRAME,4,3.75,14634.0,United Kingdom,2025-11-29
512458,22197,"POPCORN HOLDER , SMALL ",12,0.85,14634.0,United Kingdom,2025-11-29
512458,22151,PLACE SETTING WHITE HEART,24,0.42,14634.0,United Kingdom,2025-11-29
512458,22198,"POPCORN HOLDER , LARGE",12,1.65,14634.0,United Kingdom,2025-11-29
512458,21212,PACK OF 72 RETRO SPOT CAKE CASES,24,0.55,14634.0,United Kingdom,2025-11-29
512458,82581,TOILET METAL SIGN,12,0.55,14634.0,United Kingdom,2025-11-29
512458,22083,PAPER CHAIN KIT RETRO SPOT,6,2.95,14634.0,United Kingdom,2025-11-29
512458,22084,PAPER CHAIN KIT EMPIRE,6,2.95,14634.0,United Kingdom,2025-11-29
512458,22090,PAPER BUNTING RETRO SPOTS,6,2.95,14634.0,United Kingdom,2025-11-29
512458,21122,SET/10 PINK SPOTTY PARTY CANDLES,24,1.25,14634.0,United Kingdom,2025-11-29
512458,21121,SET/10 RED SPOTTY PARTY CANDLES,24,1.25,14634.0,United Kingdom,2025-11-29
512458,21967,PACK OF 12 SKULL TISSUES,48,0.29,14634.0,United Kingdom,2025-11-29
512458,22614,PACK OF 12 SPACEBOY TISSUES,48,0.29,14634.0,United Kingdom,2025-11-29
512458,22492,MINI PAINT SET VINTAGE  BOY+ GIRL,36,0.65,14634.0,United Kingdom,2025-11-29
512458,22551,PLASTERS IN TIN SPACEBOY,12,1.65,14634.0,United Kingdom,2025-11-29
512458,22416,36 DOILIES SPACEBOY DESIGN ,12,1.45,14634.0,United Kingdom,2025-11-29
512458,22418,10 COLOUR SPACEBOY PEN,24,0.85,14634.0,United Kingdom,2025-11-29
512458,21124,SET/10 BLUE SPOTTY PARTY CANDLES,24,1.25,14634.0,United Kingdom,2025-11-29
512458,21987,PACK OF 6 SKULL PAPER CUPS,12,0.65,14634.0,United Kingdom,2025-11-29
512458,22434,BALLOON PUMP WITH 10 BALLOONS,8,1.95,14634.0,United Kingdom,2025-11-29
512458,22553,PLASTERS IN TIN SKULLS,12,1.65,14634.0,United Kingdom,2025-11-29
512458,21790,VINTAGE SNAP CARDS,12,0.85,14634.0,United Kingdom,2025-11-29
512458,22491,PACK OF 12 COLOURED PENCILS,12,0.85,14634.0,United Kingdom,2025-11-29
512458,22560,TRADITIONAL MODELLING CLAY,24,1.25,14634.0,United Kingdom,2025-11-29
512458,22493, PAINT YOUR OWN CANVAS SET,12,1.65,14634.0,United Kingdom,2025-11-29
512458,21746,SMALL RED SPOT  WINDMILL,12,1.25,14634.0,United Kingdom,2025-11-29
512458,22128,PARTY CONES CANDY ASSORTED,120,1.06,14634.0,United Kingdom,2025-11-29
512458,20982,12 PENCILS TALL TUBE SKULLS,12,0.85,14634.0,United Kingdom,2025-11-29
512458,20978,36 PENCILS TUBE SKULLS,16,1.25,14634.0,United Kingdom,2025-11-29
512458,22606,WOODEN SKITTLES GARDEN SET,2,15.95,14634.0,United Kingdom,2025-11-29
512458,21878,PACK OF 6 SANDCASTLE FLAGS ASSORTED,12,0.85,14634.0,United Kingdom,2025-11-29
512458,22526,WHEELBARROW FOR CHILDREN ,4,12.75,14634.0,United Kingdom,2025-11-29
512458,22559,SEASIDE FRISBEE ,12,1.25,14634.0,United Kingdom,2025-11-29
512458,21716,BOYS VINTAGE TIN SEASIDE BUCKET,8,2.55,14634.0,United Kingdom,2025-11-29
512458,21926,RED/CREAM STRIPE CUSHION COVER ,12,1.25,14634.0,United Kingdom,2025-11-29
512458,21925,UNION STRIPE CUSHION COVER ,12,1.25,14634.0,United Kingdom,2025-11-29
512458,21927,BLUE/CREAM STRIPE CUSHION COVER ,12,1.25,14634.0,United Kingdom,2025-11-29
512458,22499,WOODEN UNION JACK BUNTING,3,5.95,14634.0,United Kingdom,2025-11-29
512458,21918,SET 12 KIDS COLOUR  CHALK STICKS,24,0.42,14634.0,United Kingdom,2025-11-29
512458,22439,6 ROCKET BALLOONS ,24,0.65,14634.0,United Kingdom,2025-11-29
512458,22607,WOODEN ROUNDERS GARDEN SET ,4,8.5,14634.0,United Kingdom,2025-11-29
512458,21703,BAG 125g SWIRLY MARBLES,24,0.42,14634.0,United Kingdom,2025-11-29
512458,22437,SET OF 9 BLACK SKULL BALLOONS,20,0.85,14634.0,United Kingdom,2025-11-29
512458,22475,SKULL DESIGN TV DINNER TRAY,2,4.95,14634.0,United Kingdom,2025-11-29
512458,21586,KINGS CHOICE GIANT TUBE MATCHES,12,2.55,14634.0,United Kingdom,2025-11-29
512458,21590,KINGS CHOICE CIGAR BOX MATCHES ,24,1.25,14634.0,United Kingdom,2025-11-29
512458,21592,RETRO SPOT  CIGAR BOX MATCHES ,24,1.25,14634.0,United Kingdom,2025-11-29
512458,21588,RETRO SPOT GIANT  TUBE MATCHES,12,2.55,14634.0,United Kingdom,2025-11-29
512458,21282,NATURAL BARK CANDLE LARGE,6,4.25,14634.0,United Kingdom,2025-11-29
512458,21283,NATURAL BARK CANDLE SMALL,6,3.25,14634.0,United Kingdom,2025-11-29
512458,71459,HANGING JAM JAR T-LIGHT HOLDER,24,0.85,14634.0,United Kingdom,2025-11-29
512458,21584,RETRO SPOT SMALL TUBE MATCHES,20,1.65,14634.0,United Kingdom,2025-11-29
512458,22443,GROW YOUR OWN HERBS SET OF 3,4,7.95,14634.0,United Kingdom,2025-11-29
512458,79321,CHILLI LIGHTS,4,4.95,14634.0,United Kingdom,2025-11-29
512458,46000S,POLYESTER FILLER PAD 40x40cm,36,1.45,14634.0,United Kingdom,2025-11-29
512458,48138,DOOR MAT UNION FLAG,2,7.49,14634.0,United Kingdom,2025-11-29
512458,22422,TOOTHPASTE TUBE PEN,12,0.65,14634.0,United Kingdom,2025-11-29
512458,22312,OFFICE MUG WARMER POLKADOT,2,4.95,14634.0,United Kingdom,2025-11-29
512458,21791,VINTAGE HEADS AND TAILS CARD GAME ,12,1.25,14634.0,United Kingdom,2025-11-29
512458,21915,RED  HARMONICA IN BOX ,12,1.25,14634.0,United Kingdom,2025-11-29
512458,21889,WOODEN BOX OF DOMINOES,12,1.25,14634.0,United Kingdom,2025-11-29
512459,37441,ASSORTED WHITE EMBOSSED CHINA MUGS,6,2.1,15329.0,United Kingdom,2025-11-29
512459,21471,STRAWBERRY RAFFIA FOOD COVER,6,3.75,15329.0,United Kingdom,2025-11-29
512459,21231,SWEETHEART CERAMIC TRINKET BOX,12,1.25,15329.0,United Kingdom,2025-11-29
512459,22184,CAKE STAND VICTORIAN FILIGREE LARGE,2,8.5,15329.0,United Kingdom,2025-11-29
512460,22470,HEART OF WICKER LARGE,12,2.95,13089.0,United Kingdom,2025-11-29
512459,37503,TEA TIME CAKE STAND IN GIFT BOX,6,10.75,15329.0,United Kingdom,2025-11-29
512460,22528,GARDENERS KNEELING PAD,12,1.25,13089.0,United Kingdom,2025-11-29
512459,22139,RETRO SPOT TEA SET CERAMIC 11 PC ,3,4.95,15329.0,United Kingdom,2025-11-29
512459,22423,REGENCY CAKESTAND 3 TIER,4,12.75,15329.0,United Kingdom,2025-11-29
512459,22197,SMALL POPCORN HOLDER,24,0.85,15329.0,United Kingdom,2025-11-29
512460,22413,METAL SIGN TAKE IT OR LEAVE IT ,6,2.95,13089.0,United Kingdom,2025-11-29
512459,22612,TEA COSY VINTAGE UNION JACK,4,3.75,15329.0,United Kingdom,2025-11-29
512459,21524,DOOR MAT SPOTTY HOME SWEET HOME,2,7.49,15329.0,United Kingdom,2025-11-29
512459,21955,DOOR MAT UNION JACK GUNS AND ROSES,2,7.49,15329.0,United Kingdom,2025-11-29
512459,21787,RAIN PONCHO WITH RED SPOTS,24,0.85,15329.0,United Kingdom,2025-11-29
512459,22435,SET OF 9 HEART SHAPED BALLOONS,12,1.25,15329.0,United Kingdom,2025-11-29
512459,47480,HANGING PHOTO CLIP ROPE LADDER,12,1.65,15329.0,United Kingdom,2025-11-29
512459,22303,COFFEE MUG APPLES DESIGN,6,2.55,15329.0,United Kingdom,2025-11-29
512460,22440,BALLOON WATER BOMB PACK OF 35,20,0.42,13089.0,United Kingdom,2025-11-29
512460,22348,TEA BAG PLATE RED SPOTTY ,12,0.85,13089.0,United Kingdom,2025-11-29
512460,22558,CLOTHES PEGS RETROSPOT PACK 24 ,12,1.25,13089.0,United Kingdom,2025-11-29
512459,22198,LARGE POPCORN HOLDER ,12,1.65,15329.0,United Kingdom,2025-11-29
512460,79000,MOROCCAN TEA GLASS,12,0.85,13089.0,United Kingdom,2025-11-29
512460,21467,CHERRY CROCHET FOOD COVER,6,3.75,13089.0,United Kingdom,2025-11-29
512460,21472,LADYBIRD + BEE RAFFIA FOOD COVER,6,3.75,13089.0,United Kingdom,2025-11-29
512460,82552,WASHROOM METAL SIGN,12,1.25,13089.0,United Kingdom,2025-11-29
512460,22342,HOME GARLAND PAINTED ZINC ,12,1.65,13089.0,United Kingdom,2025-11-29
512460,22227,"DECORATION, HANGING HEART+MIRROR ",24,0.65,13089.0,United Kingdom,2025-11-29
512460,22037,ROBOT BIRTHDAY CARD,12,0.42,13089.0,United Kingdom,2025-11-29
512460,21984,PACK OF 12 PINK PAISLEY TISSUES ,48,0.29,13089.0,United Kingdom,2025-11-29
512460,21765,HANGING METAL BIRD BATH,4,7.95,13089.0,United Kingdom,2025-11-29
512460,21672,WHITE SPOT RED CERAMIC DRAWER KNOB,12,1.25,13089.0,United Kingdom,2025-11-29
512460,21671,RED SPOT CERAMIC DRAWER KNOB,12,1.25,13089.0,United Kingdom,2025-11-29
512460,21670,BLUE SPOT CERAMIC DRAWER KNOB,12,1.25,13089.0,United Kingdom,2025-11-29
512460,21561,DINOSAUR LUNCH BOX WITH CUTLERY,6,2.55,13089.0,United Kingdom,2025-11-29
512460,21874,GIN AND TONIC MUG,12,1.25,13089.0,United Kingdom,2025-11-29
512460,21447,12 IVORY ROSE PEG PLACE SETTINGS,12,1.25,13089.0,United Kingdom,2025-11-29
512460,21213,PACK OF 72 SKULL CAKE CASES,24,0.55,13089.0,United Kingdom,2025-11-29
512460,21212,PACK OF 72 RETRO SPOT CAKE CASES,24,0.55,13089.0,United Kingdom,2025-11-29
512460,21135,VICTORIAN  METAL POSTCARD SPRING,24,1.69,13089.0,United Kingdom,2025-11-29
512460,20727,LUNCH BAG  BLACK SKULL.,12,1.65,13089.0,United Kingdom,2025-11-29
512460,21471,STRAWBERRY RAFFIA FOOD COVER,6,3.75,13089.0,United Kingdom,2025-11-29
512460,82607A,GLASS BONBON JAR PARFUME AUX FLEURE,12,1.25,13089.0,United Kingdom,2025-11-29
512460,22090,PAPER BUNTING RETRO SPOTS,6,2.95,13089.0,United Kingdom,2025-11-29
512460,21519,GIN & TONIC DIET GREETING CARD ,12,0.42,13089.0,United Kingdom,2025-11-29
512460,21186,WHITE DOVE HONEYCOMB PAPER GARLAND,12,1.65,13089.0,United Kingdom,2025-11-29
512461,21533,RETRO SPOT LARGE MILK JUG,3,4.95,13338.0,United Kingdom,2025-11-29
512461,C2,CARRIAGE,1,50.0,13338.0,United Kingdom,2025-11-29
512461,46000U,POLYESTER FILLER PAD 30CMx30CM,8,1.25,13338.0,United Kingdom,2025-11-29
512461,20997,ROSE DU SUD CUSHION COVER ,3,4.95,13338.0,United Kingdom,2025-11-29
512461,85063,CREAM SWEETHEART MAGAZINE RACK,1,16.95,13338.0,United Kingdom,2025-11-29
512461,22345,PARTY PIZZA DISH BLUE RETROSPOT,12,0.85,13338.0,United Kingdom,2025-11-29
512461,84509F,SET OF 4 NEW ENGLAND PLACEMATS,4,3.75,13338.0,United Kingdom,2025-11-29
512461,84509B,SET OF 4 FAIRY CAKE PLACEMATS,4,3.75,13338.0,United Kingdom,2025-11-29
512461,22344,PARTY PIZZA DISH PINK RETROSPOT,12,0.85,13338.0,United Kingdom,2025-11-29
512461,22131,FOOD CONTAINER SET 3 LOVE HEART ,6,1.95,13338.0,United Kingdom,2025-11-29
512461,21555,CERAMIC STRAWBERRY TRINKET TRAY,6,2.55,13338.0,United Kingdom,2025-11-29
512461,20914,SET/5 RED SPOTTY LID GLASS BOWLS,6,2.95,13338.0,United Kingdom,2025-11-29
512461,21661,VINTAGE GLASS TEA CADDY,3,5.95,13338.0,United Kingdom,2025-11-29
512461,21214,SET OF 72 IVORY PAPER DOILIES,12,1.45,13338.0,United Kingdom,2025-11-29
512461,85142,JARDIN ETCHED GLASS GINGER JAR,2,7.95,13338.0,United Kingdom,2025-11-29
512461,84782A,PINK 3 TIER GLASS PLATE STAND,1,12.75,13338.0,United Kingdom,2025-11-29
512461,37503,TEA TIME CAKE STAND IN GIFT BOX,2,10.75,13338.0,United Kingdom,2025-11-29
512461,22182,CAKE STAND VICTORIAN FILIGREE SMALL,4,4.95,13338.0,United Kingdom,2025-11-29
512461,21662,VINTAGE GLASS COFFEE CADDY,3,5.95,13338.0,United Kingdom,2025-11-29
512461,21210,SET OF 72 RETRO SPOT PAPER  DOILIES,12,1.45,13338.0,United Kingdom,2025-11-29
512461,21667,GLASS CAKE COVER AND PLATE,1,16.95,13338.0,United Kingdom,2025-11-29
512461,84968F,S/16 VINTAGE SKY BLUE CUTLERY,1,12.75,13338.0,United Kingdom,2025-11-29
512461,84968B,S/16 VINTAGE IVORY CUTLERY,1,12.75,13338.0,United Kingdom,2025-11-29
512461,21393,BLUE  SPOTTY PUDDING BOWL,6,2.1,13338.0,United Kingdom,2025-11-29
512461,21392,RED SPOTTY PUDDING BOWL,6,2.1,13338.0,United Kingdom,2025-11-29
512461,85144,JARDIN ETCHED GLASS BUTTER DISH,2,7.25,13338.0,United Kingdom,2025-11-29
512461,84969,ASSORTED COLOUR SET 6 TEASPOONS,6,4.25,13338.0,United Kingdom,2025-11-29
512462,22556,PLASTERS IN TIN CIRCUS PARADE ,24,1.65,17017.0,United Kingdom,2025-11-29
512462,22636,CHILDS BREAKFAST SET CIRCUS PARADE,6,8.5,17017.0,United Kingdom,2025-11-29
512462,22555,PLASTERS IN TIN STRONGMAN,12,1.65,17017.0,United Kingdom,2025-11-29
512462,22551,PLASTERS IN TIN SPACEBOY,24,1.65,17017.0,United Kingdom,2025-11-29
512462,21498,RED SPOTS  WRAP ,25,0.42,17017.0,United Kingdom,2025-11-29
512462,20685,DOOR MAT RED SPOT,10,6.35,17017.0,United Kingdom,2025-11-29
512462,71459,HANGING JAM JAR T-LIGHT HOLDER,96,0.72,17017.0,United Kingdom,2025-11-29
512462,22328,ROUND SNACK BOXES SET OF 4 FRUITS ,36,2.95,17017.0,United Kingdom,2025-11-29
512462,21499,BLUE SPOTS  WRAP,25,0.42,17017.0,United Kingdom,2025-11-29
C512463,22168,ORGANISER WOOD ANTIQUE WHITE ,-2,8.5,16101.0,United Kingdom,2025-11-29
512464,84795C,OCEAN STRIPE HAMMOCK ,6,7.95,17438.0,United Kingdom,2025-11-29
C512465,85123A,WHITE HANGING HEART T-LIGHT HOLDER,-1,2.95,16625.0,United Kingdom,2025-11-29
512468,47367B,PAIR PADDED HANGERS PINK CHECK,6,3.75,18042.0,United Kingdom,2025-11-29
512468,21889,WOODEN BOX OF DOMINOES,3,1.25,18042.0,United Kingdom,2025-11-29
512468,22558,CLOTHES PEGS RETROSPOT PACK 24 ,6,1.25,18042.0,United Kingdom,2025-11-29
512468,22623,BOX OF VINTAGE JIGSAW BLOCKS ,3,4.95,18042.0,United Kingdom,2025-11-29
512468,21034,REX CASH+CARRY JUMBO SHOPPER,1,0.95,18042.0,United Kingdom,2025-11-29
512468,22561,WOODEN SCHOOL COLOURING SET,6,1.65,18042.0,United Kingdom,2025-11-29
512468,21733,RED HANGING HEART T-LIGHT HOLDER,4,2.95,18042.0,United Kingdom,2025-11-29
512468,21732,RED HANGING METAL STAR TLIGHT HLDR,4,3.75,18042.0,United Kingdom,2025-11-29
512468,22622,BOX OF VINTAGE ALPHABET BLOCKS,3,9.95,18042.0,United Kingdom,2025-11-29
512494,21499,BLUE SPOTS  WRAP,200,0.34,15061.0,United Kingdom,2025-11-29
512494,21506,"FANCY FONT BIRTHDAY CARD, ",72,0.36,15061.0,United Kingdom,2025-11-29
512494,21509,COWBOYS AND INDIANS BIRTHDAY CARD ,72,0.36,15061.0,United Kingdom,2025-11-29
512494,21507,"ELEPHANT, BIRTHDAY CARD, ",120,0.36,15061.0,United Kingdom,2025-11-29
512494,22024,RAINY LADIES BIRTHDAY CARD,96,0.36,15061.0,United Kingdom,2025-11-29
512494,22423,REGENCY CAKESTAND 3 TIER,96,10.95,15061.0,United Kingdom,2025-11-29
512494,16156S,WRAP PINK FAIRY CAKES ,200,0.34,15061.0,United Kingdom,2025-11-29
512494,22023,EMPIRE BIRTHDAY CARD,72,0.36,15061.0,United Kingdom,2025-11-29
512499,85041,SET/4 PINK ORCHID CANDLES IN BOWL,96,1.45,15061.0,United Kingdom,2025-11-29
512499,85040B,SET/4 BLUE FLOWER CANDLES IN BOWL,96,1.45,15061.0,United Kingdom,2025-11-29
512499,48184,DOOR MAT ENGLISH ROSE ,30,6.35,15061.0,United Kingdom,2025-11-29
512499,48116,DOOR MAT MULTICOLOUR STRIPE,10,6.35,15061.0,United Kingdom,2025-11-29
512499,21500,PINK SPOTS  WRAP ,100,0.34,15061.0,United Kingdom,2025-11-29
512499,20685,DOOR MAT RED SPOT,10,6.35,15061.0,United Kingdom,2025-11-29
512504,84692,BOX OF 24 COCKTAIL PARASOLS,100,0.42,15061.0,United Kingdom,2025-11-29
512504,22585,PACK OF 6 BIRDY GIFT TAGS,96,1.25,15061.0,United Kingdom,2025-11-29
512507,21498,RED SPOTS  WRAP ,200,0.34,15061.0,United Kingdom,2025-11-29
512507,22423,REGENCY CAKESTAND 3 TIER,32,10.95,15061.0,United Kingdom,2025-11-29
512510,22423,REGENCY CAKESTAND 3 TIER,48,10.95,15061.0,United Kingdom,2025-11-29
512511,22028,PENNY FARTHING BIRTHDAY CARD,84,0.36,15061.0,United Kingdom,2025-11-29
512512,21671,RED SPOT CERAMIC DRAWER KNOB,96,1.06,15061.0,United Kingdom,2025-11-29
512512,21669,BLUE STRIPE CERAMIC DRAWER KNOB,192,1.06,15061.0,United Kingdom,2025-11-29
512513,21671,RED SPOT CERAMIC DRAWER KNOB,96,1.06,15061.0,United Kingdom,2025-11-29
512514,22321,BIRD DECORATION RED SPOT,3,0.85,14606.0,United Kingdom,2025-11-29
512514,21931,JUMBO STORAGE BAG SUKI,2,1.95,14606.0,United Kingdom,2025-11-29
512514,21944,KITTENS DESIGN FLANNEL,12,0.85,14606.0,United Kingdom,2025-11-29
512514,22315,200 RED + WHITE BENDY STRAWS,1,1.25,14606.0,United Kingdom,2025-11-29
512514,84970S,HANGING HEART ZINC T-LIGHT HOLDER,8,0.85,14606.0,United Kingdom,2025-11-29
512514,22427,ENAMEL FLOWER JUG CREAM,1,5.95,14606.0,United Kingdom,2025-11-29
512514,21204,DAISIES  HONEYCOMB GARLAND ,1,1.65,14606.0,United Kingdom,2025-11-29
512514,21206,STRAWBERRY HONEYCOMB  GARLAND ,2,1.65,14606.0,United Kingdom,2025-11-29
512514,22067,CHOC TRUFFLE GOLD TRINKET POT ,1,1.65,14606.0,United Kingdom,2025-11-29
512514,21467,CHERRY CROCHET FOOD COVER,1,3.75,14606.0,United Kingdom,2025-11-29
512514,21472,LADYBIRD + BEE RAFFIA FOOD COVER,1,3.75,14606.0,United Kingdom,2025-11-29
512514,21471,STRAWBERRY RAFFIA FOOD COVER,1,3.75,14606.0,United Kingdom,2025-11-29
512514,22350,CAT BOWL ,2,2.55,14606.0,United Kingdom,2025-11-29
512514,22092,BLUE PAISLEY TISSUE BOX,1,1.25,14606.0,United Kingdom,2025-11-29
512514,82583,HOT BATHS METAL SIGN,1,2.1,14606.0,United Kingdom,2025-11-29
512514,84993B,75 BLACK PETIT FOUR CASES,24,0.42,14606.0,United Kingdom,2025-11-29
512514,82600,NO SINGING METAL SIGN,1,2.1,14606.0,United Kingdom,2025-11-29
512514,21700,BIG DOUGHNUT FRIDGE MAGNETS,12,0.85,14606.0,United Kingdom,2025-11-29
512514,90214B,"LETTER ""B"" BLING KEY RING",1,1.25,14606.0,United Kingdom,2025-11-29
512514,90214M,"LETTER ""M"" BLING KEY RING",1,1.25,14606.0,United Kingdom,2025-11-29
512514,90214H,"LETTER ""H"" BLING KEY RING",1,1.25,14606.0,United Kingdom,2025-11-29
512514,20735,BLACK MINI TAPE MEASURE ,2,0.85,14606.0,United Kingdom,2025-11-29
512514,20738,GREEN MINI TAPE MEASURE ,2,0.85,14606.0,United Kingdom,2025-11-29
512514,20734,SILVER MINI TAPE MEASURE ,3,0.85,14606.0,United Kingdom,2025-11-29
512514,20733,GOLD MINI TAPE MEASURE ,2,0.85,14606.0,United Kingdom,2025-11-29
512514,21790,VINTAGE SNAP CARDS,1,0.85,14606.0,United Kingdom,2025-11-29
512514,21929,JUMBO BAG PINK VINTAGE PAISLEY,2,1.95,14606.0,United Kingdom,2025-11-29
512514,37447,CERAMIC CAKE DESIGN SPOTTED PLATE,4,1.49,14606.0,United Kingdom,2025-11-29
512514,22195,LARGE HEART MEASURING SPOONS,1,1.65,14606.0,United Kingdom,2025-11-29
512514,20768,GREEN FERN JOURNAL ,1,2.55,14606.0,United Kingdom,2025-11-29
512514,21324,HANGING MEDINA LANTERN SMALL,1,2.95,14606.0,United Kingdom,2025-11-29
512514,21935,SUKI  SHOULDER BAG,3,1.65,14606.0,United Kingdom,2025-11-29
512514,20729,RED SPOTTY CANDY BAG,8,1.25,14606.0,United Kingdom,2025-11-29
