Invoice,StockCode,Description,Quantity,Price,Customer ID,Country,InvoiceDate
516337,22585,PACK OF 6 BIRDY GIFT TAGS,12,1.25,14626.0,United Kingdom,2025-12-28
516337,22423,REGENCY CAKESTAND 3 TIER,2,12.75,14626.0,United Kingdom,2025-12-28
516337,22294,HEART FILIGREE DOVE  SMALL,24,1.25,14626.0,United Kingdom,2025-12-28
516337,22498,WOODEN REGATTA BUNTING,3,5.95,14626.0,United Kingdom,2025-12-28
516337,22149,FELTCRAFT 6 FLOWER FRIENDS,12,2.1,14626.0,United Kingdom,2025-12-28
516337,85123A,WHITE HANGING HEART T-LIGHT HOLDER,32,2.55,14626.0,United Kingdom,2025-12-28
516337,20685,DOORMAT RED SPOT,2,7.49,14626.0,United Kingdom,2025-12-28
516337,48111,DOORMAT 3 SMILEY CATS,2,7.49,14626.0,United Kingdom,2025-12-28
516337,48184,DOORMAT ENGLISH ROSE ,2,7.49,14626.0,United Kingdom,2025-12-28
516337,85099F,JUMBO BAG STRAWBERRY,20,1.95,14626.0,United Kingdom,2025-12-28
516337,85099C,JUMBO  BAG BAROQUE BLACK WHITE,20,1.95,14626.0,United Kingdom,2025-12-28
516337,48173C,DOORMAT BLACK FLOCK ,2,7.49,14626.0,United Kingdom,2025-12-28
516338,22027,TEA PARTY BIRTHDAY CARD,24,0.42,13418.0,United Kingdom,2025-12-28
516338,22492,MINI PAINT SET VINTAGE ,36,0.65,13418.0,United Kingdom,2025-12-28
516338,22631,CIRCUS PARADE LUNCH BOX ,12,1.95,13418.0,United Kingdom,2025-12-28
516338,22659,LUNCH BOX I LOVE LONDON,12,1.95,13418.0,United Kingdom,2025-12-28
516338,22630,DOLLY GIRL LUNCH BOX,12,1.95,13418.0,United Kingdom,2025-12-28
516338,22037,ROBOT BIRTHDAY CARD,24,0.42,13418.0,United Kingdom,2025-12-28
516338,21507,"ELEPHANT, BIRTHDAY CARD, ",24,0.42,13418.0,United Kingdom,2025-12-28
516338,21508,VINTAGE KID DOLLY CARD ,24,0.42,13418.0,United Kingdom,2025-12-28
516338,22029,SPACEBOY BIRTHDAY CARD,24,0.42,13418.0,United Kingdom,2025-12-28
516338,22629,SPACEBOY LUNCH BOX ,12,1.95,13418.0,United Kingdom,2025-12-28
516338,21506,"FANCY FONT BIRTHDAY CARD, ",24,0.42,13418.0,United Kingdom,2025-12-28
516338,22035,VINTAGE CARAVAN GREETING CARD ,24,0.42,13418.0,United Kingdom,2025-12-28
516338,22028,PENNY FARTHING BIRTHDAY CARD,24,0.42,13418.0,United Kingdom,2025-12-28
516338,22048,BIRTHDAY BANQUET GIFT WRAP,25,0.42,13418.0,United Kingdom,2025-12-28
516338,22045,SPACEBOY GIFT WRAP,25,0.42,13418.0,United Kingdom,2025-12-28
516338,22046,TEA PARTY  WRAPPING PAPER ,25,0.42,13418.0,United Kingdom,2025-12-28
516338,22109,FULL ENGLISH BREAKFAST PLATE,8,3.75,13418.0,United Kingdom,2025-12-28
516338,22561,WOODEN SCHOOL COLOURING SET,12,1.65,13418.0,United Kingdom,2025-12-28
516338,21497,FANCY FONTS BIRTHDAY WRAP,25,0.42,13418.0,United Kingdom,2025-12-28
516338,22026,BANQUET BIRTHDAY  CARD  ,24,0.42,13418.0,United Kingdom,2025-12-28
516339,15056N,EDWARDIAN PARASOL NATURAL,12,5.95,14110.0,United Kingdom,2025-12-28
516339,21930,JUMBO STORAGE BAG SKULLS,10,1.95,14110.0,United Kingdom,2025-12-28
516339,22383,LUNCH BAG SUKI  DESIGN ,10,1.65,14110.0,United Kingdom,2025-12-28
516339,22355,CHARLOTTE BAG SUKI DESIGN,10,0.85,14110.0,United Kingdom,2025-12-28
516339,48194,DOORMAT HEARTS,10,6.35,14110.0,United Kingdom,2025-12-28
516339,22061,LARGE CAKE STAND  HANGING STRAWBERY,4,9.95,14110.0,United Kingdom,2025-12-28
516339,22090,PAPER BUNTING RETRO SPOTS,12,2.95,14110.0,United Kingdom,2025-12-28
516339,21931,JUMBO STORAGE BAG SUKI,10,1.95,14110.0,United Kingdom,2025-12-28
516340,21207,SKULL AND CROSSBONES  GARLAND ,12,1.65,14825.0,United Kingdom,2025-12-28
516340,21203,BUTTERFLIES  HONEYCOMB GARLAND,12,1.65,14825.0,United Kingdom,2025-12-28
516340,21380,WOODEN HAPPY BIRTHDAY GARLAND,12,2.95,14825.0,United Kingdom,2025-12-28
516340,21381,MINI WOODEN HAPPY BIRTHDAY GARLAND,12,1.69,14825.0,United Kingdom,2025-12-28
516340,22367,CHILDRENS APRON SPACEBOY DESIGN,8,1.95,14825.0,United Kingdom,2025-12-28
516340,21901,"KEY FOB , BACK DOOR ",24,0.65,14825.0,United Kingdom,2025-12-28
516340,21900,"KEY FOB , SHED",24,0.65,14825.0,United Kingdom,2025-12-28
516340,21186,WHITE DOVE HONEYCOMB PAPER GARLAND,12,1.65,14825.0,United Kingdom,2025-12-28
516340,22380,TOY TIDY SPACEBOY  ,5,2.1,14825.0,United Kingdom,2025-12-28
516340,22383,LUNCH BAG SUKI  DESIGN ,10,1.65,14825.0,United Kingdom,2025-12-28
516340,22382,LUNCH BAG SPACEBOY DESIGN ,10,1.65,14825.0,United Kingdom,2025-12-28
516340,21936,RED RETROSPOT PICNIC BAG,5,2.95,14825.0,United Kingdom,2025-12-28
516340,21933,PINK VINTAGE PAISLEY PICNIC BAG,5,2.95,14825.0,United Kingdom,2025-12-28
516340,22669,RED BABY BUNTING ,10,2.95,14825.0,United Kingdom,2025-12-28
516340,22668,PINK BABY BUNTING,10,2.95,14825.0,United Kingdom,2025-12-28
516340,21899,"KEY FOB , GARAGE DESIGN",24,0.65,14825.0,United Kingdom,2025-12-28
516341,85014A,BLACK/BLUE DOTS RUFFLED UMBRELLA,6,5.95,15854.0,United Kingdom,2025-12-28
516341,85014B,RED/WHITE DOTS RUFFLED UMBRELLA,6,5.95,15854.0,United Kingdom,2025-12-28
516341,15056BL,EDWARDIAN PARASOL BLACK,12,5.95,15854.0,United Kingdom,2025-12-28
516341,71477,COLOUR GLASS. STAR T-LIGHT HOLDER,24,2.75,15854.0,United Kingdom,2025-12-28
516341,21622,VINTAGE UNION JACK CUSHION COVER,12,4.95,15854.0,United Kingdom,2025-12-28
516341,15056N,EDWARDIAN PARASOL NATURAL,6,5.95,15854.0,United Kingdom,2025-12-28
516342,22383,LUNCH BAG SUKI  DESIGN ,2,1.65,17994.0,United Kingdom,2025-12-28
516342,21561,DINOSAUR LUNCH BOX WITH CUTLERY,6,2.55,17994.0,United Kingdom,2025-12-28
516342,21559,STRAWBERRY LUNCH BOX WITH CUTLERY,6,2.55,17994.0,United Kingdom,2025-12-28
516342,22659,LUNCH BOX I LOVE LONDON,2,1.95,17994.0,United Kingdom,2025-12-28
516342,84803A,PINK ALLIUM  ARTIFICIAL FLOWER,2,1.69,17994.0,United Kingdom,2025-12-28
516342,22353,LUNCH BOX WITH CUTLERY FAIRY CAKES ,2,2.55,17994.0,United Kingdom,2025-12-28
516342,84803B,WHITE ALLIUM  ARTIFICIAL FLOWER,1,1.69,17994.0,United Kingdom,2025-12-28
516342,22716,CARD CIRCUS PARADE,12,0.42,17994.0,United Kingdom,2025-12-28
516342,20728,LUNCH BAG CARS BLUE,2,1.65,17994.0,United Kingdom,2025-12-28
516342,22271,FELTCRAFT DOLL ROSIE,2,2.95,17994.0,United Kingdom,2025-12-28
516342,22384,LUNCH BAG PINK RETROSPOT,2,1.65,17994.0,United Kingdom,2025-12-28
516342,22274,FELTCRAFT DOLL EMILY,2,2.95,17994.0,United Kingdom,2025-12-28
516342,22272,FELTCRAFT DOLL MARIA,2,2.95,17994.0,United Kingdom,2025-12-28
516342,22273,FELTCRAFT DOLL MOLLY,2,2.95,17994.0,United Kingdom,2025-12-28
516342,21792,CLASSIC FRENCH STYLE BASKET GREEN ,2,6.75,17994.0,United Kingdom,2025-12-28
516342,M,Manual,2,1.0,17994.0,United Kingdom,2025-12-28
516342,22493,PAINT YOUR OWN CANVAS SET,1,1.65,17994.0,United Kingdom,2025-12-28
516342,20970,PINK FLORAL FELTCRAFT SHOULDER BAG,1,3.75,17994.0,United Kingdom,2025-12-28
516342,20684,STRAWBERRY DREAM CHILDS UMBRELLA,1,3.25,17994.0,United Kingdom,2025-12-28
516343,22424,ENAMEL BREAD BIN CREAM,1,12.75,14922.0,United Kingdom,2025-12-28
516343,22427,ENAMEL FLOWER JUG CREAM,3,5.95,14922.0,United Kingdom,2025-12-28
516343,85042,ANTIQUE LILY FAIRY LIGHTS,4,4.95,14922.0,United Kingdom,2025-12-28
516343,85047,WHITE BEADED GARLAND STRING 20LIGHT,3,6.35,14922.0,United Kingdom,2025-12-28
516343,22444,GROW YOUR OWN PLANT IN A CAN ,24,1.25,14922.0,United Kingdom,2025-12-28
516343,22138,BAKING SET 9 PIECE RETROSPOT ,3,4.95,14922.0,United Kingdom,2025-12-28
516343,22617,BAKING SET SPACEBOY DESIGN,3,4.95,14922.0,United Kingdom,2025-12-28
516343,21890,S/6 WOODEN SKITTLES IN COTTON BAG,6,2.95,14922.0,United Kingdom,2025-12-28
516343,21892,TRADITIONAL WOODEN CATCH CUP GAME ,12,1.25,14922.0,United Kingdom,2025-12-28
516343,21891,TRADITIONAL WOODEN SKIPPING ROPE,12,1.25,14922.0,United Kingdom,2025-12-28
516343,20971,PINK BLUE FELT CRAFT TRINKET BOX,12,1.25,14922.0,United Kingdom,2025-12-28
516343,20972,PINK CREAM FELT CRAFT TRINKET BOX ,12,1.25,14922.0,United Kingdom,2025-12-28
516343,22570,FELTCRAFT CUSHION RABBIT,4,3.75,14922.0,United Kingdom,2025-12-28
516343,22507,MEMO BOARD RETROSPOT  DESIGN,4,4.95,14922.0,United Kingdom,2025-12-28
516343,22605,WOODEN CROQUET GARDEN SET,1,12.75,14922.0,United Kingdom,2025-12-28
516343,21755,LOVE BUILDING BLOCK WORD,3,5.95,14922.0,United Kingdom,2025-12-28
516343,22430,ENAMEL WATERING CAN CREAM,4,4.95,14922.0,United Kingdom,2025-12-28
516343,22073,RED RETROSPOT STORAGE JAR,4,3.75,14922.0,United Kingdom,2025-12-28
516343,22423,REGENCY CAKESTAND 3 TIER,2,12.75,14922.0,United Kingdom,2025-12-28
516343,22568,FELTCRAFT CUSHION OWL,4,3.75,14922.0,United Kingdom,2025-12-28
516343,21499,BLUE SPOTS  WRAP,25,0.42,14922.0,United Kingdom,2025-12-28
516343,22350,ILLUSTRATED CAT BOWL ,6,2.55,14922.0,United Kingdom,2025-12-28
516343,22349,DOG BOWL CHASING BALL DESIGN,6,3.75,14922.0,United Kingdom,2025-12-28
516343,22636,CHILDS BREAKFAST SET CIRCUS PARADE,2,8.5,14922.0,United Kingdom,2025-12-28
516343,22178,VICTORIAN GLASS HANGING T-LIGHT,12,1.25,14922.0,United Kingdom,2025-12-28
516343,21497,FANCY FONTS BIRTHDAY WRAP,25,0.42,14922.0,United Kingdom,2025-12-28
516343,84949,SILVER HANGING T-LIGHT HOLDER,6,1.65,14922.0,United Kingdom,2025-12-28
516343,22460,EMBOSSED GLASS TEALIGHT HOLDER,12,1.25,14922.0,United Kingdom,2025-12-28
516343,18097C,WHITE TALL PORCELAIN T-LIGHT HOLDER,6,2.55,14922.0,United Kingdom,2025-12-28
516343,84879,ASSORTED COLOUR BIRD ORNAMENT,8,1.69,14922.0,United Kingdom,2025-12-28
516343,84840,SWEETHEART CARRY-ALL BASKET,2,8.5,14922.0,United Kingdom,2025-12-28
516343,21136,PAINTED METAL PEARS ASSORTED,8,1.69,14922.0,United Kingdom,2025-12-28
516343,85123A,WHITE HANGING HEART T-LIGHT HOLDER,6,2.95,14922.0,United Kingdom,2025-12-28
516344,85123A,WHITE HANGING HEART T-LIGHT HOLDER,32,2.55,13874.0,United Kingdom,2025-12-28
516344,47568,ENGLISH ROSE DESIGN PEG BAG,12,2.1,13874.0,United Kingdom,2025-12-28
516344,15036,ASSORTED COLOURS SILK FAN,12,0.75,13874.0,United Kingdom,2025-12-28
516344,84406B,CREAM CUPID HEARTS COAT HANGER,8,3.25,13874.0,United Kingdom,2025-12-28
516344,84970S,HANGING HEART ZINC T-LIGHT HOLDER,12,0.85,13874.0,United Kingdom,2025-12-28
516344,21935,SUKI  SHOULDER BAG,10,1.65,13874.0,United Kingdom,2025-12-28
516345,72741,GRAND CHOCOLATECANDLE,18,1.45,16631.0,United Kingdom,2025-12-28
516345,85132A,CHARLIE + LOLA BISCUITS TINS,2,9.95,16631.0,United Kingdom,2025-12-28
516345,84997C,BLUE 3 PIECE MINI DOTS CUTLERY SET,6,3.75,16631.0,United Kingdom,2025-12-28
516345,22138,BAKING SET 9 PIECE RETROSPOT ,6,4.95,16631.0,United Kingdom,2025-12-28
516345,48187,DOORMAT NEW ENGLAND,10,6.35,16631.0,United Kingdom,2025-12-28
516345,47591D,PINK FAIRY CAKE CHILDRENS APRON,8,1.95,16631.0,United Kingdom,2025-12-28
516345,85175,CACTI T-LIGHT CANDLES,32,0.42,16631.0,United Kingdom,2025-12-28
516345,85123A,WHITE HANGING HEART T-LIGHT HOLDER,12,2.95,16631.0,United Kingdom,2025-12-28
516345,21115,ROSE CARAVAN DOORSTOP,6,6.75,16631.0,United Kingdom,2025-12-28
516345,84997B,RED 3 PIECE MINI DOTS CUTLERY SET,6,3.75,16631.0,United Kingdom,2025-12-28
516345,72351A,SET/6 TURQUOISE BUTTERFLY T-LIGHTS,12,2.1,16631.0,United Kingdom,2025-12-28
516346,85152,HAND OVER THE CHOCOLATE   SIGN ,12,2.1,13769.0,United Kingdom,2025-12-28
516346,85123A,WHITE HANGING HEART T-LIGHT HOLDER,6,2.95,13769.0,United Kingdom,2025-12-28
516346,84879,ASSORTED COLOUR BIRD ORNAMENT,8,1.69,13769.0,United Kingdom,2025-12-28
516346,21790,VINTAGE SNAP CARDS,12,0.85,13769.0,United Kingdom,2025-12-28
516346,22457,NATURAL SLATE HEART CHALKBOARD ,6,2.95,13769.0,United Kingdom,2025-12-28
516346,22499,WOODEN UNION JACK BUNTING,3,5.95,13769.0,United Kingdom,2025-12-28
516346,22114,HOT WATER BOTTLE TEA AND SYMPATHY,4,3.95,13769.0,United Kingdom,2025-12-28
516346,71477,COLOUR GLASS. STAR T-LIGHT HOLDER,48,2.75,13769.0,United Kingdom,2025-12-28
516346,84949,SILVER HANGING T-LIGHT HOLDER,6,1.65,13769.0,United Kingdom,2025-12-28
516346,22112,CHOCOLATE HOT WATER BOTTLE,3,4.95,13769.0,United Kingdom,2025-12-28
516346,22444,GROW YOUR OWN PLANT IN A CAN ,24,1.25,13769.0,United Kingdom,2025-12-28
516346,82494L,WOODEN FRAME ANTIQUE WHITE ,6,2.95,13769.0,United Kingdom,2025-12-28
516347,POST,POSTAGE,1,4.5,12843.0,United Kingdom,2025-12-28
516347,21621,VINTAGE UNION JACK BUNTING,12,8.5,12843.0,United Kingdom,2025-12-28
516348,84836,ZINC METAL HEART DECORATION,12,1.25,12975.0,United Kingdom,2025-12-28
516348,22296,HEART IVORY TRELLIS LARGE,12,1.65,12975.0,United Kingdom,2025-12-28
516348,22188,BLACK HEART CARD HOLDER,4,3.95,12975.0,United Kingdom,2025-12-28
516348,48111,DOORMAT 3 SMILEY CATS,4,7.49,12975.0,United Kingdom,2025-12-28
516348,48138,DOORMAT UNION FLAG,4,7.49,12975.0,United Kingdom,2025-12-28
516348,48194,DOORMAT HEARTS,4,7.49,12975.0,United Kingdom,2025-12-28
516348,20685,DOORMAT RED SPOT,4,7.49,12975.0,United Kingdom,2025-12-28
516348,48129,DOORMAT TOPIARY,4,7.49,12975.0,United Kingdom,2025-12-28
516348,20829,GLITTER HANGING BUTTERFLY STRING,16,2.1,12975.0,United Kingdom,2025-12-28
516348,85123A,WHITE HANGING HEART T-LIGHT HOLDER,6,2.95,12975.0,United Kingdom,2025-12-28
516348,84879,ASSORTED COLOUR BIRD ORNAMENT,8,1.69,12975.0,United Kingdom,2025-12-28
516348,22366,DOORMAT AIRMAIL ,4,7.49,12975.0,United Kingdom,2025-12-28
516349,20726,LUNCH BAG WOODLAND,10,1.65,13995.0,United Kingdom,2025-12-28
516349,22030,SWALLOWS GREETING CARD,12,0.42,13995.0,United Kingdom,2025-12-28
516349,22383,LUNCH BAG SUKI  DESIGN ,10,1.65,13995.0,United Kingdom,2025-12-28
516349,20725,LUNCH BAG RED SPOTTY,10,1.65,13995.0,United Kingdom,2025-12-28
516349,22026,BANQUET BIRTHDAY  CARD  ,12,0.42,13995.0,United Kingdom,2025-12-28
516349,22037,ROBOT BIRTHDAY CARD,12,0.42,13995.0,United Kingdom,2025-12-28
516349,21519,GIN & TONIC DIET GREETING CARD ,12,0.42,13995.0,United Kingdom,2025-12-28
516349,22629,SPACEBOY LUNCH BOX ,12,1.95,13995.0,United Kingdom,2025-12-28
516349,20728,LUNCH BAG CARS BLUE,10,1.65,13995.0,United Kingdom,2025-12-28
516349,22469,HEART OF WICKER SMALL,12,1.65,13995.0,United Kingdom,2025-12-28
516349,22083,PAPER CHAIN KIT RETRO SPOT,6,2.95,13995.0,United Kingdom,2025-12-28
516349,22470,HEART OF WICKER LARGE,12,2.95,13995.0,United Kingdom,2025-12-28
516349,22090,PAPER BUNTING RETRO SPOTS,6,2.95,13995.0,United Kingdom,2025-12-28
516349,22457,NATURAL SLATE HEART CHALKBOARD ,12,2.95,13995.0,United Kingdom,2025-12-28
516349,22172,METAL SHELF WITH RAIL ,2,8.5,13995.0,United Kingdom,2025-12-28
516349,22379,RECYCLING BAG RETROSPOT ,5,2.1,13995.0,United Kingdom,2025-12-28
516349,21931,JUMBO STORAGE BAG SUKI,10,1.95,13995.0,United Kingdom,2025-12-28
516349,22084,PAPER CHAIN KIT EMPIRE,6,2.95,13995.0,United Kingdom,2025-12-28
516350,21231,SWEETHEART CERAMIC TRINKET BOX,12,1.25,14493.0,United Kingdom,2025-12-28
516350,21232,STRAWBERRY CERAMIC TRINKET BOX,12,1.25,14493.0,United Kingdom,2025-12-28
516350,84879,ASSORTED COLOUR BIRD ORNAMENT,8,1.69,14493.0,United Kingdom,2025-12-28
516350,21136,PAINTED METAL PEARS ASSORTED,8,1.69,14493.0,United Kingdom,2025-12-28
516350,21126,SET OF 6 GIRLS CELEBRATION CANDLES,12,1.25,14493.0,United Kingdom,2025-12-28
516350,21125,SET 6 FOOTBALL CELEBRATION CANDLES,12,1.25,14493.0,United Kingdom,2025-12-28
516350,21645,ASSORTED TUTTI FRUTTI ROUND BOX,12,1.65,14493.0,United Kingdom,2025-12-28
516350,22065,CHRISTMAS PUDDING TRINKET POT ,24,1.45,14493.0,United Kingdom,2025-12-28
516350,84945,MULTI COLOUR SILVER T-LIGHT HOLDER,24,0.85,14493.0,United Kingdom,2025-12-28
516350,20898,VINTAGE NOTEBOOK TRAVELOGUE,6,2.95,14493.0,United Kingdom,2025-12-28
516350,21769,VINTAGE POST OFFICE CABINET,1,79.95,14493.0,United Kingdom,2025-12-28
516351,82600,NO SINGING METAL SIGN,12,2.1,15394.0,United Kingdom,2025-12-28
516351,21324,HANGING MEDINA LANTERN SMALL,6,2.95,15394.0,United Kingdom,2025-12-28
516351,72760B,VINTAGE CREAM 3 BASKET CAKE STAND,2,9.95,15394.0,United Kingdom,2025-12-28
516351,85099F,JUMBO BAG STRAWBERRY,20,1.95,15394.0,United Kingdom,2025-12-28
516351,85099C,JUMBO  BAG BAROQUE BLACK WHITE,20,1.95,15394.0,United Kingdom,2025-12-28
516351,85099B,JUMBO BAG RED RETROSPOT,30,1.95,15394.0,United Kingdom,2025-12-28
516351,22386,JUMBO BAG PINK WITH WHITE SPOTS,20,1.95,15394.0,United Kingdom,2025-12-28
516351,21931,JUMBO STORAGE BAG SUKI,20,1.95,15394.0,United Kingdom,2025-12-28
516351,21930,JUMBO STORAGE BAG SKULLS,20,1.95,15394.0,United Kingdom,2025-12-28
516351,21755,LOVE BUILDING BLOCK WORD,3,5.95,15394.0,United Kingdom,2025-12-28
516351,21928,JUMBO BAG SCANDINAVIAN PAISLEY,20,1.95,15394.0,United Kingdom,2025-12-28
516351,21770,OPEN CLOSED METAL SIGN,2,4.95,15394.0,United Kingdom,2025-12-28
516351,21673,WHITE SPOT BLUE CERAMIC DRAWER KNOB,12,1.25,15394.0,United Kingdom,2025-12-28
516351,21670,BLUE SPOT CERAMIC DRAWER KNOB,12,1.25,15394.0,United Kingdom,2025-12-28
516351,22423,REGENCY CAKESTAND 3 TIER,2,12.75,15394.0,United Kingdom,2025-12-28
516351,21929,JUMBO BAG PINK VINTAGE PAISLEY,20,1.95,15394.0,United Kingdom,2025-12-28
516351,21700,BIG DOUGHNUT FRIDGE MAGNETS,12,0.85,15394.0,United Kingdom,2025-12-28
516351,20828,GLITTER BUTTERFLY CLIPS,12,2.55,15394.0,United Kingdom,2025-12-28
516351,22616,PACK OF 12 LONDON TISSUES ,48,0.29,15394.0,United Kingdom,2025-12-28
516351,85217,ASSORTED ICE CREAM FRIDGE MAGNETS,12,0.65,15394.0,United Kingdom,2025-12-28
516367,22384,LUNCH BAG PINK RETROSPOT,30,1.65,12921.0,United Kingdom,2025-12-28
516367,84970L,SINGLE HEART ZINC T-LIGHT HOLDER,12,0.95,12921.0,United Kingdom,2025-12-28
516367,84755,COLOUR GLASS T-LIGHT HOLDER HANGING,32,0.65,12921.0,United Kingdom,2025-12-28
516367,71459,HANGING JAM JAR T-LIGHT HOLDER,96,0.72,12921.0,United Kingdom,2025-12-28
516367,21928,JUMBO BAG SCANDINAVIAN PAISLEY,20,1.95,12921.0,United Kingdom,2025-12-28
516367,21929,JUMBO BAG PINK VINTAGE PAISLEY,10,1.95,12921.0,United Kingdom,2025-12-28
516367,22386,JUMBO BAG PINK WITH WHITE SPOTS,10,1.95,12921.0,United Kingdom,2025-12-28
516367,85099B,JUMBO BAG RED RETROSPOT,20,1.95,12921.0,United Kingdom,2025-12-28
516367,20718,RED SPOTTY SHOPPER BAG,10,1.25,12921.0,United Kingdom,2025-12-28
516367,22423,REGENCY CAKESTAND 3 TIER,8,12.75,12921.0,United Kingdom,2025-12-28
516369,85123A,WHITE HANGING HEART T-LIGHT HOLDER,96,2.55,13831.0,United Kingdom,2025-12-28
516369,84839,SWEETHEART KEY CABINET,12,5.55,13831.0,United Kingdom,2025-12-28
516371,22384,LUNCH BAG PINK RETROSPOT,10,1.65,15002.0,United Kingdom,2025-12-28
516371,22197,SMALL POPCORN HOLDER,15,0.85,15002.0,United Kingdom,2025-12-28
516371,22470,HEART OF WICKER LARGE,6,2.95,15002.0,United Kingdom,2025-12-28
516371,22469,HEART OF WICKER SMALL,12,1.65,15002.0,United Kingdom,2025-12-28
516371,84270,ASSTD DESIGN BUBBLE GUM RING,60,0.21,15002.0,United Kingdom,2025-12-28
516371,21469,POLKA DOT RAFFIA FOOD COVER,6,3.75,15002.0,United Kingdom,2025-12-28
516371,72789,BASKET/8 SCENTED LOVE TOKEN CANDLES,2,3.75,15002.0,United Kingdom,2025-12-28
516371,21974,SET OF 36 PAISLEY FLOWER DOILIES,7,1.45,15002.0,United Kingdom,2025-12-28
516371,85040B,SET/4 BLUE FLOWER CANDLES IN BOWL,3,1.65,15002.0,United Kingdom,2025-12-28
516371,85039B,S/4 IVORY MINI ROSE CANDLE IN BOWL,3,1.65,15002.0,United Kingdom,2025-12-28
516371,85040A,S/4 PINK FLOWER CANDLES IN BOWL,3,1.65,15002.0,United Kingdom,2025-12-28
516371,22088,PAPER BUNTING COLOURED LACE,2,2.95,15002.0,United Kingdom,2025-12-28
516371,22090,PAPER BUNTING RETRO SPOTS,2,2.95,15002.0,United Kingdom,2025-12-28
516371,72351A,SET/6 TURQUOISE BUTTERFLY T-LIGHTS,6,2.1,15002.0,United Kingdom,2025-12-28
516371,72351B,SET/6 PINK  BUTTERFLY T-LIGHTS,6,2.1,15002.0,United Kingdom,2025-12-28
516371,21556,CERAMIC STRAWBERRY MONEY BOX,1,2.55,15002.0,United Kingdom,2025-12-28
516371,18097C,WHITE TALL PORCELAIN T-LIGHT HOLDER,3,2.55,15002.0,United Kingdom,2025-12-28
516371,22440,BALLOON WATER BOMB PACK OF 35,10,0.42,15002.0,United Kingdom,2025-12-28
516371,21231,SWEETHEART CERAMIC TRINKET BOX,3,1.25,15002.0,United Kingdom,2025-12-28
516371,21232,STRAWBERRY CERAMIC TRINKET BOX,4,1.25,15002.0,United Kingdom,2025-12-28
516371,22628,PICNIC BOXES SET OF 3 RETROSPOT ,5,4.95,15002.0,United Kingdom,2025-12-28
516371,22296,HEART IVORY TRELLIS LARGE,12,1.65,15002.0,United Kingdom,2025-12-28
516371,21733,RED HANGING HEART T-LIGHT HOLDER,5,2.95,15002.0,United Kingdom,2025-12-28
516371,22273,FELTCRAFT DOLL MOLLY,1,2.95,15002.0,United Kingdom,2025-12-28
516371,22274,FELTCRAFT DOLL EMILY,1,2.95,15002.0,United Kingdom,2025-12-28
516371,22271,FELTCRAFT DOLL ROSIE,1,2.95,15002.0,United Kingdom,2025-12-28
516371,20727,LUNCH BAG  BLACK SKULL.,10,1.65,15002.0,United Kingdom,2025-12-28
516371,22383,LUNCH BAG SUKI  DESIGN ,10,1.65,15002.0,United Kingdom,2025-12-28
516371,22382,LUNCH BAG SPACEBOY DESIGN ,10,1.65,15002.0,United Kingdom,2025-12-28
516371,21556,CERAMIC STRAWBERRY MONEY BOX,3,2.55,15002.0,United Kingdom,2025-12-28
516371,20725,LUNCH BAG RED SPOTTY,10,1.65,15002.0,United Kingdom,2025-12-28
516371,85066,CREAM SWEETHEART MINI CHEST,2,12.75,15002.0,United Kingdom,2025-12-28
516371,21754,HOME BUILDING BLOCK WORD,6,5.95,15002.0,United Kingdom,2025-12-28
516371,21755,LOVE BUILDING BLOCK WORD,3,5.95,15002.0,United Kingdom,2025-12-28
516371,21990,MODERN FLORAL STATIONERY SET,2,2.95,15002.0,United Kingdom,2025-12-28
516371,21992,VINTAGE PAISLEY STATIONERY SET,2,2.95,15002.0,United Kingdom,2025-12-28
516371,21993,FLORAL FOLK STATIONERY SET,2,2.95,15002.0,United Kingdom,2025-12-28
516371,22588,CARD HOLDER GINGHAM HEART,5,2.55,15002.0,United Kingdom,2025-12-28
516371,84840,SWEETHEART CARRY-ALL BASKET,2,8.5,15002.0,United Kingdom,2025-12-28
516371,85123A,WHITE HANGING HEART T-LIGHT HOLDER,8,2.95,15002.0,United Kingdom,2025-12-28
516378,21929,JUMBO BAG PINK VINTAGE PAISLEY,100,1.65,14855.0,United Kingdom,2025-12-28
516378,21928,JUMBO BAG SCANDINAVIAN PAISLEY,100,1.65,14855.0,United Kingdom,2025-12-28
516378,21936,RED RETROSPOT PICNIC BAG,25,2.95,14855.0,United Kingdom,2025-12-28
516378,22383,LUNCH BAG SUKI  DESIGN ,100,1.45,14855.0,United Kingdom,2025-12-28
516378,22386,JUMBO BAG PINK WITH WHITE SPOTS,100,1.65,14855.0,United Kingdom,2025-12-28
516378,21931,JUMBO STORAGE BAG SUKI,100,1.65,14855.0,United Kingdom,2025-12-28
516378,22381,TOY TIDY PINK RETROSPOT  ,25,2.1,14855.0,United Kingdom,2025-12-28
516378,21930,JUMBO STORAGE BAG SKULLS,20,1.95,14855.0,United Kingdom,2025-12-28
516378,22507,MEMO BOARD RETROSPOT  DESIGN,4,4.95,14855.0,United Kingdom,2025-12-28
516378,85099F,JUMBO BAG STRAWBERRY,100,1.65,14855.0,United Kingdom,2025-12-28
516378,22384,LUNCH BAG PINK RETROSPOT,100,1.45,14855.0,United Kingdom,2025-12-28
516378,22508,DOORSTOP RETROSPOT HEART,4,3.75,14855.0,United Kingdom,2025-12-28
516378,21481,FAWN BLUE HOT WATER BOTTLE,6,2.95,14855.0,United Kingdom,2025-12-28
516378,20725,LUNCH BAG RED SPOTTY,100,1.45,14855.0,United Kingdom,2025-12-28
516378,20718,RED SPOTTY SHOPPER BAG,100,1.06,14855.0,United Kingdom,2025-12-28
516378,85099B,JUMBO BAG RED RETROSPOT,100,1.65,14855.0,United Kingdom,2025-12-28
516378,22382,LUNCH BAG SPACEBOY DESIGN ,20,1.65,14855.0,United Kingdom,2025-12-28
516378,22385,JUMBO BAG SPACEBOY DESIGN,30,1.95,14855.0,United Kingdom,2025-12-28
516378,20723,STRAWBERRY CHARLOTTE BAG,20,0.85,14855.0,United Kingdom,2025-12-28
516378,22411,JUMBO SHOPPER VINTAGE RED PAISLEY,100,1.65,14855.0,United Kingdom,2025-12-28
516378,21484,CHICK GREY HOT WATER BOTTLE,6,3.45,14855.0,United Kingdom,2025-12-28
516378,22386,JUMBO BAG PINK WITH WHITE SPOTS,10,1.95,14855.0,United Kingdom,2025-12-28
516378,21485,RED SPOT HEART HOT WATER BOTTLE,6,4.95,14855.0,United Kingdom,2025-12-28
516378,22586,FELTCRAFT HAIRBAND PINK AND BLUE,12,0.85,14855.0,United Kingdom,2025-12-28
516378,21937,STRAWBERRY   PICNIC BAG,24,2.95,14855.0,United Kingdom,2025-12-28
516378,22379,RECYCLING BAG RETROSPOT ,10,2.1,14855.0,United Kingdom,2025-12-28
516378,22077,6 RIBBONS RUSTIC CHARM,12,1.65,14855.0,United Kingdom,2025-12-28
516378,21932,SCANDINAVIAN PAISLEY PICNIC BAG,25,2.95,14855.0,United Kingdom,2025-12-28
516378,21899,"KEY FOB , GARAGE DESIGN",24,0.65,14855.0,United Kingdom,2025-12-28
516378,84791,GINGHAM HEART DECORATION,1,2.95,14855.0,United Kingdom,2025-12-28
516378,22149,FELTCRAFT 6 FLOWER FRIENDS,6,2.1,14855.0,United Kingdom,2025-12-28
516378,22111,SCOTTIE DOG HOT WATER BOTTLE,6,4.95,14855.0,United Kingdom,2025-12-28
516378,21621,VINTAGE UNION JACK BUNTING,4,8.5,14855.0,United Kingdom,2025-12-28
516378,21623,VINTAGE UNION JACK MEMOBOARD,4,9.95,14855.0,United Kingdom,2025-12-28
516378,21626,VINTAGE UNION JACK PENNANT,12,1.95,14855.0,United Kingdom,2025-12-28
516378,22621,TRADITIONAL KNITTING NANCY,12,1.45,14855.0,United Kingdom,2025-12-28
516378,22029,SPACEBOY BIRTHDAY CARD,12,0.42,14855.0,United Kingdom,2025-12-28
516378,22045,SPACEBOY GIFT WRAP,25,0.42,14855.0,United Kingdom,2025-12-28
516378,21504,SKULLS GREETING CARD,12,0.42,14855.0,United Kingdom,2025-12-28
516378,21495,SKULLS AND CROSSBONES WRAP,25,0.42,14855.0,United Kingdom,2025-12-28
516378,21497,FANCY FONTS BIRTHDAY WRAP,25,0.42,14855.0,United Kingdom,2025-12-28
516378,22035,VINTAGE CARAVAN GREETING CARD ,12,0.42,14855.0,United Kingdom,2025-12-28
516378,21446,12 RED ROSE PEG PLACE SETTINGS,24,1.25,14855.0,United Kingdom,2025-12-28
516378,21843,RED RETROSPOT CAKE STAND,6,10.95,14855.0,United Kingdom,2025-12-28
516378,22030,SWALLOWS GREETING CARD,12,0.42,14855.0,United Kingdom,2025-12-28
516378,48189,DOORMAT FRIENDSHIP ,10,6.35,14855.0,United Kingdom,2025-12-28
516378,48187,DOORMAT NEW ENGLAND,10,6.35,14855.0,United Kingdom,2025-12-28
516378,21524,DOORMAT SPOTTY HOME SWEET HOME,10,6.35,14855.0,United Kingdom,2025-12-28
516378,21115,ROSE CARAVAN DOORSTOP,2,6.75,14855.0,United Kingdom,2025-12-28
516378,21212,PACK OF 72 RETRO SPOT CAKE CASES,24,0.55,14855.0,United Kingdom,2025-12-28
516378,21900,"KEY FOB , SHED",24,0.65,14855.0,United Kingdom,2025-12-28
516378,21658,GLASS  BEURRE DISH,4,3.95,14855.0,United Kingdom,2025-12-28
516378,21356,TOAST ITS - FAIRY FLOWER,12,1.25,14855.0,United Kingdom,2025-12-28
516378,21355,TOAST ITS - I LOVE YOU ,12,1.25,14855.0,United Kingdom,2025-12-28
516378,21528,DAIRY MAID TRADITIONAL TEAPOT ,2,6.95,14855.0,United Kingdom,2025-12-28
516378,22423,REGENCY CAKESTAND 3 TIER,16,10.95,14855.0,United Kingdom,2025-12-28
516379,21385,IVORY HANGING DECORATION  HEART,24,0.85,14855.0,United Kingdom,2025-12-28
516379,22558,CLOTHES PEGS RETROSPOT PACK 24 ,12,1.25,14855.0,United Kingdom,2025-12-28
516430,22622,BOX OF VINTAGE ALPHABET BLOCKS,2,9.95,17511.0,United Kingdom,2025-12-28
