Invoice,StockCode,Description,Quantity,Price,Customer ID,Country,InvoiceDate
508999,22138,BAKING SET 9 PIECE RETROSPOT ,2,4.95,17897.0,United Kingdom,2025-11-06
508999,22377,BOTTLE BAG RETROSPOT ,1,2.1,17897.0,United Kingdom,2025-11-06
508999,22070,SMALL RED RETROSPOT MUG IN BOX ,1,3.75,17897.0,United Kingdom,2025-11-06
508999,21625,VINTAGE UNION JACK APRON,1,6.95,17897.0,United Kingdom,2025-11-06
508999,21930,JUMBO STORAGE BAG SKULLS,1,1.95,17897.0,United Kingdom,2025-11-06
508999,22569,FELTCRAFT CUSHION BUTTERFLY,1,3.75,17897.0,United Kingdom,2025-11-06
508999,51014A,"FEATHER PEN,HOT PINK",24,0.85,17897.0,United Kingdom,2025-11-06
508999,21161,KEEP OUT BOYS DOOR HANGER ,1,1.45,17897.0,United Kingdom,2025-11-06
508999,84558A,3D DOG PICTURE PLAYING CARDS,2,2.95,17897.0,United Kingdom,2025-11-06
508999,21506,"FANCY FONT BIRTHDAY CARD, ",12,0.42,17897.0,United Kingdom,2025-11-06
508999,21577,SAVE THE PLANET COTTON TOTE BAG,2,2.25,17897.0,United Kingdom,2025-11-06
508999,85169A,IVORY LOVE BIRD CANDLE,2,1.25,17897.0,United Kingdom,2025-11-06
508999,16258A,SWIRLY CIRCULAR RUBBERS IN BAG,12,0.42,17897.0,United Kingdom,2025-11-06
508999,22071,SMALL WHITE RETROSPOT MUG IN BOX ,1,3.75,17897.0,United Kingdom,2025-11-06
508999,84270,ASSTD DESIGN BUBBLE GUM RING,30,0.21,17897.0,United Kingdom,2025-11-06
508999,10120,DOGGY RUBBER,4,0.21,17897.0,United Kingdom,2025-11-06
508999,21934,SKULL SHOULDER BAG,1,1.65,17897.0,United Kingdom,2025-11-06
508999,22088,PAPER BUNTING COLOURED LACE,5,2.95,17897.0,United Kingdom,2025-11-06
508999,22082,RIBBON REEL STRIPES DESIGN ,5,1.65,17897.0,United Kingdom,2025-11-06
509000,82552,WASHROOM METAL SIGN,12,1.25,14210.0,United Kingdom,2025-11-06
509000,22115,METAL SIGN EMPIRE TEA,6,2.95,14210.0,United Kingdom,2025-11-06
509000,85152,HAND OVER THE CHOCOLATE   SIGN ,12,2.1,14210.0,United Kingdom,2025-11-06
509000,21175,GIN + TONIC DIET METAL SIGN,12,2.1,14210.0,United Kingdom,2025-11-06
509000,47566,PARTY BUNTING,10,4.65,14210.0,United Kingdom,2025-11-06
509000,82583,HOT BATHS METAL SIGN,12,2.1,14210.0,United Kingdom,2025-11-06
509000,21875,KINGS CHOICE MUG,12,1.25,14210.0,United Kingdom,2025-11-06
509000,22178,VICTORIAN GLASS HANGING T-LIGHT,12,1.25,14210.0,United Kingdom,2025-11-06
509000,82599,FANNY'S REST STOPMETAL SIGN,12,2.1,14210.0,United Kingdom,2025-11-06
509000,85123A,WHITE HANGING HEART T-LIGHT HOLDER,6,2.95,14210.0,United Kingdom,2025-11-06
509000,21733,RED HANGING HEART T-LIGHT HOLDER,6,2.95,14210.0,United Kingdom,2025-11-06
509000,21535,RED RETROSPOT SMALL MILK JUG,6,2.55,14210.0,United Kingdom,2025-11-06
509000,82482,WOODEN PICTURE FRAME WHITE FINISH,6,2.55,14210.0,United Kingdom,2025-11-06
509000,82494L,WOODEN FRAME ANTIQUE WHITE ,6,2.95,14210.0,United Kingdom,2025-11-06
509000,21157,RED SPOTTY WASHBAG,6,2.1,14210.0,United Kingdom,2025-11-06
509000,22073,RED RETROSPOT STORAGE JAR,4,3.75,14210.0,United Kingdom,2025-11-06
509000,21155,RED SPOTTY PEG BAG,6,2.1,14210.0,United Kingdom,2025-11-06
509000,21217,RED SPOTTY ROUND CAKE TINS,2,9.95,14210.0,United Kingdom,2025-11-06
509000,21539,RED RETROSPOT BUTTER DISH,3,4.95,14210.0,United Kingdom,2025-11-06
509000,21531,RED RETROSPOT SUGAR JAM BOWL,6,2.55,14210.0,United Kingdom,2025-11-06
509000,82484,WOOD BLACK BOARD ANT WHITE FINISH,3,6.45,14210.0,United Kingdom,2025-11-06
509001,84755,COLOUR GLASS T-LIGHT HOLDER HANGING,16,0.65,15581.0,United Kingdom,2025-11-06
509001,22528,GARDENERS KNEELING PAD,4,1.25,15581.0,United Kingdom,2025-11-06
509001,22149,FELTCRAFT 6 FLOWER FRIENDS,4,2.1,15581.0,United Kingdom,2025-11-06
509001,84016,FLAG OF ST GEORGE CAR FLAG,12,0.42,15581.0,United Kingdom,2025-11-06
509001,22560,TRADITIONAL MODELLING CLAY,6,1.25,15581.0,United Kingdom,2025-11-06
509001,21918,SET 12 KIDS COLOUR  CHALK STICKS,3,0.42,15581.0,United Kingdom,2025-11-06
509001,22649,STRAWBERRY FAIRY CAKE TEAPOT,1,4.95,15581.0,United Kingdom,2025-11-06
509001,21790,VINTAGE SNAP CARDS,3,0.85,15581.0,United Kingdom,2025-11-06
509001,22437,SET OF 9 BLACK SKULL BALLOONS,6,0.85,15581.0,United Kingdom,2025-11-06
509001,22233,JIGSAW RABBIT AND BIRDHOUSE,1,1.65,15581.0,United Kingdom,2025-11-06
509001,22209,WOOD STAMP SET HAPPY BIRTHDAY,4,1.65,15581.0,United Kingdom,2025-11-06
509001,85211,S/4 GROOVY CAT MAGNETS,2,1.65,15581.0,United Kingdom,2025-11-06
509001,21726,MULTI HEARTS  STICKERS,2,0.85,15581.0,United Kingdom,2025-11-06
509001,22436,12 COLOURED PARTY BALLOONS,6,0.65,15581.0,United Kingdom,2025-11-06
509001,22332,SKULLS PARTY BAG + STICKER SET,2,1.65,15581.0,United Kingdom,2025-11-06
509001,16011,ANIMAL STICKERS,24,0.21,15581.0,United Kingdom,2025-11-06
509001,21721,CANDY SHOP  STICKER SHEET,2,0.85,15581.0,United Kingdom,2025-11-06
509001,21917,SET 12 KIDS  WHITE CHALK STICKS,3,0.42,15581.0,United Kingdom,2025-11-06
509001,21725,SWEETIES  STICKERS,2,0.85,15581.0,United Kingdom,2025-11-06
509001,21724,PANDA AND BUNNIES STICKER SHEET,2,0.85,15581.0,United Kingdom,2025-11-06
509001,21891,TRADITIONAL WOODEN SKIPPING ROPE,3,1.25,15581.0,United Kingdom,2025-11-06
509001,21937,STRAWBERRY   PICNIC BAG,3,2.95,15581.0,United Kingdom,2025-11-06
509001,21544,SKULLS  WATER TRANSFER TATTOOS ,2,0.85,15581.0,United Kingdom,2025-11-06
509001,21542,WOODLAND WATER TRANSFER TATTOOS ,2,0.85,15581.0,United Kingdom,2025-11-06
509001,22559,SEASIDE FLYING DISC,4,1.25,15581.0,United Kingdom,2025-11-06
509001,21722,SWEET PUDDING STICKER SHEET,2,0.85,15581.0,United Kingdom,2025-11-06
509001,22619,SET OF 6 SOLDIER SKITTLES,2,3.75,15581.0,United Kingdom,2025-11-06
509001,22231,JIGSAW TREE WITH BIRDHOUSE,1,1.45,15581.0,United Kingdom,2025-11-06
509001,22489,PACK OF 12 TRADITIONAL CRAYONS,6,0.42,15581.0,United Kingdom,2025-11-06
509001,79029,GLASS HONEYPOT WASP CATCHER,3,1.95,15581.0,United Kingdom,2025-11-06
509001,22620,4 TRADITIONAL SPINNING TOPS,2,1.25,15581.0,United Kingdom,2025-11-06
509001,20728,LUNCH BAG CARS BLUE,1,1.65,15581.0,United Kingdom,2025-11-06
509001,22383,LUNCH BAG SUKI  DESIGN ,1,1.65,15581.0,United Kingdom,2025-11-06
509001,22356,CHARLOTTE BAG PINK WITH WHITE SPOTS,4,0.85,15581.0,United Kingdom,2025-11-06
509001,20723,STRAWBERRY CHARLOTTE BAG,6,0.85,15581.0,United Kingdom,2025-11-06
509001,20724,RED SPOTTY CHARLOTTE BAG,9,0.85,15581.0,United Kingdom,2025-11-06
509001,85099B,JUMBO BAG RED RETROSPOT,3,1.95,15581.0,United Kingdom,2025-11-06
509001,21936,RED RETROSPOT PICNIC BAG,3,2.95,15581.0,United Kingdom,2025-11-06
509001,21541,DINOSAURS WATER TRANSFER TATTOOS ,2,0.85,15581.0,United Kingdom,2025-11-06
509001,20727,LUNCH BAG  BLACK SKULL.,1,1.65,15581.0,United Kingdom,2025-11-06
509002,82583,HOT BATHS METAL SIGN,12,2.1,14220.0,United Kingdom,2025-11-06
509002,82551,LAUNDRY 15C METAL SIGN,12,1.25,14220.0,United Kingdom,2025-11-06
509002,82552,WASHROOM METAL SIGN,24,1.25,14220.0,United Kingdom,2025-11-06
509002,22496,SET OF 2 ROUND TINS DUTCH CHEESE,6,2.95,14220.0,United Kingdom,2025-11-06
509002,22424,ENAMEL BREAD BIN CREAM,8,10.95,14220.0,United Kingdom,2025-11-06
509002,22426,ENAMEL WASH BOWL CREAM,16,2.95,14220.0,United Kingdom,2025-11-06
509002,22427,ENAMEL FLOWER JUG CREAM,12,5.45,14220.0,United Kingdom,2025-11-06
509002,22500,SET OF 2 TINS JARDIN DE PROVENCE,4,4.95,14220.0,United Kingdom,2025-11-06
509003,84292B,,4,0.0,,United Kingdom,2025-11-06
509004,21837,,2,0.0,,United Kingdom,2025-11-06
509008,84625D,WHITE NEWBAROQUE CANDLESTICK CANDLE,24,0.85,15157.0,United Kingdom,2025-11-06
509008,21621,VINTAGE UNION JACK BUNTING,2,8.5,15157.0,United Kingdom,2025-11-06
509008,72038P,PRICE'S CANDLE PEACH,200,0.08,15157.0,United Kingdom,2025-11-06
509008,21441,BLUE BIRDHOUSE DECORATION,24,0.38,15157.0,United Kingdom,2025-11-06
509008,35160,BUDDHA INCENSE HOLDER ASSORTED,24,0.85,15157.0,United Kingdom,2025-11-06
509008,21442,GREEN BIRDHOUSE DECORATION,24,0.38,15157.0,United Kingdom,2025-11-06
509008,84689,S/2 BEACH HUT TREASURE CHESTS,12,1.65,15157.0,United Kingdom,2025-11-06
509008,84688,BEACH HUT DESIGN BLACKBOARD,24,1.65,15157.0,United Kingdom,2025-11-06
509008,84687,BEACH HUT SHELF W 3 DRAWERS,16,1.95,15157.0,United Kingdom,2025-11-06
509008,84686,BEACH HUT MIRROR,16,1.65,15157.0,United Kingdom,2025-11-06
509008,84685,BEACH HUT KEY CABINET,16,1.25,15157.0,United Kingdom,2025-11-06
509008,84684,BEACH HUT PHOTO FRAME,48,0.85,15157.0,United Kingdom,2025-11-06
509006,37492C,,1,0.0,,United Kingdom,2025-11-06
509007,72800A,,1,0.0,,United Kingdom,2025-11-06
509005,21928,,2,0.0,,United Kingdom,2025-11-06
509009,84990,,1,0.0,,United Kingdom,2025-11-06
509010,47587A,,1,0.0,,United Kingdom,2025-11-06
509012,85152,HAND OVER THE CHOCOLATE   SIGN ,3,2.1,17623.0,United Kingdom,2025-11-06
509011,84963A,PINK PAINTED KASHMIRI CHAIR,1,49.95,16915.0,United Kingdom,2025-11-06
509011,84963B,BLUE PAINTED KASHMIRI CHAIR,1,49.95,16915.0,United Kingdom,2025-11-06
509011,84967B,BLUE KASHMIRI OCCASIONAL TABLE,1,79.95,16915.0,United Kingdom,2025-11-06
509011,84967C,GREEN KASHMIRI OCCASIONAL TABLE,1,79.95,16915.0,United Kingdom,2025-11-06
509012,22469,HEART OF WICKER SMALL,2,1.65,17623.0,United Kingdom,2025-11-06
509012,22470,HEART OF WICKER LARGE,2,2.95,17623.0,United Kingdom,2025-11-06
509012,21843,RED RETROSPOT CAKE STAND,1,10.95,17623.0,United Kingdom,2025-11-06
509012,21166,COOK WITH WINE METAL SIGN ,1,1.95,17623.0,United Kingdom,2025-11-06
509012,84972L,GIANT PINK HEART MEMO HOLDER,2,3.95,17623.0,United Kingdom,2025-11-06
509012,21904,HOUSE WRECKING METAL SIGN ,1,2.1,17623.0,United Kingdom,2025-11-06
509012,22413,METAL SIGN TAKE IT OR LEAVE IT ,1,2.95,17623.0,United Kingdom,2025-11-06
509012,21164,HOME SWEET HOME METAL SIGN ,1,2.95,17623.0,United Kingdom,2025-11-06
509011,21686,MEDINA STAMPED METAL STOOL,1,39.95,16915.0,United Kingdom,2025-11-06
509012,22189,CREAM HEART CARD HOLDER,2,3.95,17623.0,United Kingdom,2025-11-06
509012,20718,RED SPOTTY SHOPPER BAG,5,1.25,17623.0,United Kingdom,2025-11-06
509012,21034,REX CASH+CARRY JUMBO SHOPPER,2,0.95,17623.0,United Kingdom,2025-11-06
509012,22427,ENAMEL FLOWER JUG CREAM,1,5.95,17623.0,United Kingdom,2025-11-06
509012,85062,PEARL CRYSTAL PUMPKIN T-LIGHT HLDR,6,1.65,17623.0,United Kingdom,2025-11-06
509012,21903,MAN FLU METAL SIGN,1,2.1,17623.0,United Kingdom,2025-11-06
509012,22622,BOX OF VINTAGE ALPHABET BLOCKS,1,9.95,17623.0,United Kingdom,2025-11-06
509012,21166,COOK WITH WINE METAL SIGN ,1,1.95,17623.0,United Kingdom,2025-11-06
509012,22607,WOODEN ROUNDERS GARDEN SET ,3,8.5,17623.0,United Kingdom,2025-11-06
509012,21528,DAIRY MAID TRADITIONAL TEAPOT ,1,6.95,17623.0,United Kingdom,2025-11-06
509012,82582,AREA PATROLLED METAL SIGN,2,2.1,17623.0,United Kingdom,2025-11-06
509012,85150,LADIES & GENTLEMEN METAL SIGN,1,2.55,17623.0,United Kingdom,2025-11-06
509012,82597,BOMBS AWAY METAL SIGN,1,2.1,17623.0,United Kingdom,2025-11-06
509012,20754,RETRO RED SPOTTY WASHING UP GLOVES,1,2.1,17623.0,United Kingdom,2025-11-06
509012,22624,IVORY KITCHEN SCALES,1,8.5,17623.0,United Kingdom,2025-11-06
509012,22627,MINT KITCHEN SCALES,1,8.5,17623.0,United Kingdom,2025-11-06
509012,22606,WOODEN SKITTLES GARDEN SET,1,15.95,17623.0,United Kingdom,2025-11-06
509012,22073,RED RETROSPOT STORAGE JAR,1,3.75,17623.0,United Kingdom,2025-11-06
509012,21533,RETRO SPOT LARGE MILK JUG,1,4.95,17623.0,United Kingdom,2025-11-06
509012,20751,FUNKY WASHING UP GLOVES ASSORTED,1,2.1,17623.0,United Kingdom,2025-11-06
509012,22442,GROW YOUR OWN FLOWERS SET OF 3,1,7.95,17623.0,United Kingdom,2025-11-06
509012,22622,BOX OF VINTAGE ALPHABET BLOCKS,2,9.95,17623.0,United Kingdom,2025-11-06
509012,84978,HANGING HEART JAR T-LIGHT HOLDER,6,1.25,17623.0,United Kingdom,2025-11-06
509012,21623,VINTAGE UNION JACK MEMOBOARD,1,9.95,17623.0,United Kingdom,2025-11-06
509012,84898F,YELLOW FLOWERS FELT HANDBAG KIT,2,2.1,17623.0,United Kingdom,2025-11-06
509012,20972,PINK CREAM FELT CRAFT TRINKET BOX ,3,1.25,17623.0,United Kingdom,2025-11-06
509012,22443,GROW YOUR OWN HERBS SET OF 3,1,7.95,17623.0,United Kingdom,2025-11-06
509012,22441,GROW YOUR OWN BASIL IN ENAMEL MUG,1,2.1,17623.0,United Kingdom,2025-11-06
509012,22606,WOODEN SKITTLES GARDEN SET,1,15.95,17623.0,United Kingdom,2025-11-06
509012,21534,DAIRY MAID LARGE MILK JUG,1,4.95,17623.0,United Kingdom,2025-11-06
509013,72038B,damaged,-244,0.0,,United Kingdom,2025-11-06
C509015,22649,STRAWBERRY FAIRY CAKE TEAPOT,-1,4.95,14598.0,United Kingdom,2025-11-06
C509015,21541,DINOSAURS WATER TRANSFER TATTOOS ,-2,0.85,14598.0,United Kingdom,2025-11-06
C509015,22560,TRADITIONAL MODELLING CLAY,-6,1.25,14598.0,United Kingdom,2025-11-06
C509015,22528,GARDENERS KNEELING PAD,-4,1.25,14598.0,United Kingdom,2025-11-06
C509015,22149,FELTCRAFT 6 FLOWER FRIENDS,-4,2.1,14598.0,United Kingdom,2025-11-06
C509015,84016,FLAG OF ST GEORGE CAR FLAG,-12,0.42,14598.0,United Kingdom,2025-11-06
C509015,21722,SWEET PUDDING STICKER SHEET,-2,0.85,14598.0,United Kingdom,2025-11-06
C509015,21725,SWEETIES  STICKERS,-2,0.85,14598.0,United Kingdom,2025-11-06
C509015,21724,PANDA AND BUNNIES STICKER SHEET,-2,0.85,14598.0,United Kingdom,2025-11-06
C509015,21721,CANDY SHOP  STICKER SHEET,-2,0.85,14598.0,United Kingdom,2025-11-06
509014,15044D,RED PAPER PARASOL,6,2.95,15570.0,United Kingdom,2025-11-06
C509015,21726,MULTI HEARTS  STICKERS,-2,0.85,14598.0,United Kingdom,2025-11-06
509014,15044B,BLUE PAPER PARASOL ,6,2.95,15570.0,United Kingdom,2025-11-06
C509015,22332,SKULLS PARTY BAG + STICKER SET,-2,1.65,14598.0,United Kingdom,2025-11-06
509014,15044C,PURPLE PAPER PARASOL,6,2.95,15570.0,United Kingdom,2025-11-06
C509015,84755,COLOUR GLASS T-LIGHT HOLDER HANGING,-16,0.65,14598.0,United Kingdom,2025-11-06
C509015,21918,SET 12 KIDS COLOUR  CHALK STICKS,-3,0.42,14598.0,United Kingdom,2025-11-06
C509015,21790,VINTAGE SNAP CARDS,-3,0.85,14598.0,United Kingdom,2025-11-06
C509015,21917,SET 12 KIDS  WHITE CHALK STICKS,-3,0.42,14598.0,United Kingdom,2025-11-06
C509015,22233,JIGSAW RABBIT AND BIRDHOUSE,-1,1.65,14598.0,United Kingdom,2025-11-06
C509015,22209,WOOD STAMP SET HAPPY BIRTHDAY,-4,1.65,14598.0,United Kingdom,2025-11-06
C509015,85211,S/4 GROOVY CAT MAGNETS,-2,1.65,14598.0,United Kingdom,2025-11-06
C509015,22437,SET OF 9 BLACK SKULL BALLOONS,-6,0.85,14598.0,United Kingdom,2025-11-06
C509015,22436,12 COLOURED PARTY BALLOONS,-6,0.65,14598.0,United Kingdom,2025-11-06
C509015,16011,ANIMAL STICKERS,-24,0.21,14598.0,United Kingdom,2025-11-06
C509015,21891,TRADITIONAL WOODEN SKIPPING ROPE,-3,1.25,14598.0,United Kingdom,2025-11-06
C509015,21542,WOODLAND WATER TRANSFER TATTOOS ,-2,0.85,14598.0,United Kingdom,2025-11-06
509014,15044A,PINK PAPER PARASOL ,6,2.95,15570.0,United Kingdom,2025-11-06
C509015,21544,SKULLS  WATER TRANSFER TATTOOS ,-2,0.85,14598.0,United Kingdom,2025-11-06
509014,22224,WHITE LOVEBIRD LANTERN,6,2.95,15570.0,United Kingdom,2025-11-06
C509015,21936,RED RETROSPOT PICNIC BAG,-3,2.95,14598.0,United Kingdom,2025-11-06
509014,47566,PARTY BUNTING,10,4.65,15570.0,United Kingdom,2025-11-06
509014,85119,WATERING CAN SINGLE HOOK PISTACHIO,8,1.69,15570.0,United Kingdom,2025-11-06
509014,21164,HOME SWEET HOME METAL SIGN ,6,2.95,15570.0,United Kingdom,2025-11-06
509014,21174,POTTERING IN THE SHED METAL SIGN,12,1.95,15570.0,United Kingdom,2025-11-06
C509015,21937,STRAWBERRY   PICNIC BAG,-3,2.95,14598.0,United Kingdom,2025-11-06
509014,85123A,WHITE HANGING HEART T-LIGHT HOLDER,12,2.95,15570.0,United Kingdom,2025-11-06
509014,21732,RED HANGING METAL STAR TLIGHT HLDR,4,3.75,15570.0,United Kingdom,2025-11-06
509014,71459,HANGING JAM JAR T-LIGHT HOLDER,24,0.85,15570.0,United Kingdom,2025-11-06
509014,71477,COLOUR GLASS. STAR T-LIGHT HOLDER,4,3.25,15570.0,United Kingdom,2025-11-06
509014,84950,ASSORTED COLOUR T-LIGHT HOLDER,12,0.85,15570.0,United Kingdom,2025-11-06
509014,84945,MULTI COLOUR SILVER T-LIGHT HOLDER,12,0.85,15570.0,United Kingdom,2025-11-06
509014,84839,SWEETHEART KEY CABINET,2,6.75,15570.0,United Kingdom,2025-11-06
509014,22430,ENAMEL WATERING CAN CREAM,4,4.95,15570.0,United Kingdom,2025-11-06
509014,21179,NO JUNK MAIL METAL SIGN,12,1.25,15570.0,United Kingdom,2025-11-06
C509015,22620,4 TRADITIONAL SPINNING TOPS,-2,1.25,14598.0,United Kingdom,2025-11-06
C509015,22559,SEASIDE FLYING DISC,-4,1.25,14598.0,United Kingdom,2025-11-06
C509015,22619,SET OF 6 SOLDIER SKITTLES,-2,3.75,14598.0,United Kingdom,2025-11-06
C509015,22231,JIGSAW TREE WITH BIRDHOUSE,-1,1.45,14598.0,United Kingdom,2025-11-06
C509015,22489,PACK OF 12 TRADITIONAL CRAYONS,-6,0.42,14598.0,United Kingdom,2025-11-06
C509015,79029,GLASS HONEYPOT WASP CATCHER,-3,1.95,14598.0,United Kingdom,2025-11-06
C509015,20727,LUNCH BAG  BLACK SKULL.,-1,1.65,14598.0,United Kingdom,2025-11-06
C509015,20728,LUNCH BAG CARS BLUE,-1,1.65,14598.0,United Kingdom,2025-11-06
C509015,22383,LUNCH BAG SUKI  DESIGN ,-1,1.65,14598.0,United Kingdom,2025-11-06
C509015,22356,CHARLOTTE BAG PINK WITH WHITE SPOTS,-4,0.85,14598.0,United Kingdom,2025-11-06
C509015,20723,STRAWBERRY CHARLOTTE BAG,-6,0.85,14598.0,United Kingdom,2025-11-06
C509015,20724,RED SPOTTY CHARLOTTE BAG,-9,0.85,14598.0,United Kingdom,2025-11-06
C509015,85099B,JUMBO BAG RED RETROSPOT,-3,1.95,14598.0,United Kingdom,2025-11-06
509016,84625B,Damaged,-47,0.0,,United Kingdom,2025-11-06
509017,84685,BEACH HUT KEY CABINET,32,1.25,13164.0,United Kingdom,2025-11-06
509017,84684,BEACH HUT PHOTO FRAME,48,0.85,13164.0,United Kingdom,2025-11-06
509017,84687,BEACH HUT SHELF W 3 DRAWERS,8,1.95,13164.0,United Kingdom,2025-11-06
509018,84692,BOX OF 24 COCKTAIL PARASOLS,10,0.42,12748.0,United Kingdom,2025-11-06
509019,22085,PAPER CHAIN KIT SKULLS ,1,2.95,13610.0,United Kingdom,2025-11-06
509019,20828,GLITTER BUTTERFLY CLIPS,1,2.55,13610.0,United Kingdom,2025-11-06
509019,20829,GLITTER HANGING BUTTERFLY STRING,1,2.1,13610.0,United Kingdom,2025-11-06
509019,22189,CREAM HEART CARD HOLDER,1,3.95,13610.0,United Kingdom,2025-11-06
509019,84884A,ANT WHITE WIRE HEART SPIRAL,1,3.95,13610.0,United Kingdom,2025-11-06
509019,22467,GUMBALL COAT RACK,2,2.55,13610.0,United Kingdom,2025-11-06
509019,22482,BLUE TEA TOWEL CLASSIC DESIGN,2,1.25,13610.0,United Kingdom,2025-11-06
509019,22481,BLACK TEA TOWEL CLASSIC DESIGN,2,1.25,13610.0,United Kingdom,2025-11-06
509019,84406B,CREAM CUPID HEARTS COAT HANGER,2,3.25,13610.0,United Kingdom,2025-11-06
509019,20886,BOX OF 9 PEBBLE CANDLES,2,1.95,13610.0,United Kingdom,2025-11-06
509019,22171,3 HOOK PHOTO SHELF ANTIQUE WHITE,1,8.5,13610.0,United Kingdom,2025-11-06
509019,84192,ASSORTED COLOUR METAL CAT ,3,1.25,13610.0,United Kingdom,2025-11-06
509019,79029,GLASS HONEYPOT WASP CATCHER,2,1.95,13610.0,United Kingdom,2025-11-06
509019,22480,RED TEA TOWEL CLASSIC DESIGN,2,1.25,13610.0,United Kingdom,2025-11-06
509019,22083,PAPER CHAIN KIT RETRO SPOT,1,2.95,13610.0,United Kingdom,2025-11-06
509019,84795C,OCEAN STRIPE HAMMOCK ,1,7.95,13610.0,United Kingdom,2025-11-06
509019,21472,LADYBIRD + BEE RAFFIA FOOD COVER,1,3.75,13610.0,United Kingdom,2025-11-06
509019,84795D,SEASIDE STRIPE HAMMOCK,1,7.95,13610.0,United Kingdom,2025-11-06
509019,21742,LARGE ROUND WICKER PLATTER ,1,5.95,13610.0,United Kingdom,2025-11-06
509019,21673,WHITE SPOT BLUE CERAMIC DRAWER KNOB,6,1.25,13610.0,United Kingdom,2025-11-06
509019,21621,VINTAGE UNION JACK BUNTING,2,8.5,13610.0,United Kingdom,2025-11-06
509019,21907,I'M ON HOLIDAY METAL SIGN,1,2.1,13610.0,United Kingdom,2025-11-06
509019,21908,CHOCOLATE THIS WAY METAL SIGN,1,2.1,13610.0,United Kingdom,2025-11-06
509019,22122,SET OF 2 FANCY FONT TEA TOWELS,2,2.95,13610.0,United Kingdom,2025-11-06
509019,21171,BATHROOM METAL SIGN ,1,1.45,13610.0,United Kingdom,2025-11-06
509019,21179,NO JUNK MAIL METAL SIGN,1,1.25,13610.0,United Kingdom,2025-11-06
509019,21164,HOME SWEET HOME METAL SIGN ,1,2.95,13610.0,United Kingdom,2025-11-06
509019,85152,HAND OVER THE CHOCOLATE   SIGN ,1,2.1,13610.0,United Kingdom,2025-11-06
509019,82582,AREA PATROLLED METAL SIGN,1,2.1,13610.0,United Kingdom,2025-11-06
509019,21174,POTTERING IN THE SHED METAL SIGN,1,1.95,13610.0,United Kingdom,2025-11-06
509019,21469,POLKA DOT RAFFIA FOOD COVER,1,3.75,13610.0,United Kingdom,2025-11-06
509020,21258,VICTORIAN SEWING BOX LARGE,1,12.75,16827.0,United Kingdom,2025-11-06
509020,21922,UNION STRIPE WITH FRINGE  HAMMOCK,2,7.95,16827.0,United Kingdom,2025-11-06
509020,22606,WOODEN SKITTLES GARDEN SET,2,15.95,16827.0,United Kingdom,2025-11-06
509021,21737,SET 3 WICKER LOG BASKETS,2,19.95,14442.0,Channel Islands,2025-11-06
509021,22470,HEART OF WICKER LARGE,12,2.95,14442.0,Channel Islands,2025-11-06
509021,22170,PICTURE FRAME WOOD TRIPLE PORTRAIT,6,6.75,14442.0,Channel Islands,2025-11-06
509021,22169,FAMILY ALBUM WHITE PICTURE FRAME,6,8.5,14442.0,Channel Islands,2025-11-06
509021,82483,WOOD 2 DRAWER CABINET WHITE FINISH,4,5.95,14442.0,Channel Islands,2025-11-06
509021,82494L,WOODEN FRAME ANTIQUE WHITE ,6,2.95,14442.0,Channel Islands,2025-11-06
509021,85063,CREAM SWEETHEART MAGAZINE RACK,2,16.95,14442.0,Channel Islands,2025-11-06
509021,85066,CREAM SWEETHEART MINI CHEST,4,12.75,14442.0,Channel Islands,2025-11-06
509021,85065,CREAM SWEETHEART TRAYS,2,12.75,14442.0,Channel Islands,2025-11-06
509021,85067,CREAM SWEETHEART WALL CABINET,2,18.95,14442.0,Channel Islands,2025-11-06
509021,22180,RETRO SPOT LAMP,2,9.95,14442.0,Channel Islands,2025-11-06
509021,85064,CREAM SWEETHEART LETTER RACK,4,5.45,14442.0,Channel Islands,2025-11-06
509021,84837,WHITE SWEETHEARTS CABINET 4 DRAWERS,2,12.75,14442.0,Channel Islands,2025-11-06
509021,22423,REGENCY CAKESTAND 3 TIER,2,12.75,14442.0,Channel Islands,2025-11-06
509021,20828,GLITTER BUTTERFLY CLIPS,6,2.55,14442.0,Channel Islands,2025-11-06
509021,22624,IVORY KITCHEN SCALES,2,8.5,14442.0,Channel Islands,2025-11-06
509021,22509,SEWING BOX RETROSPOT DESIGN ,2,16.95,14442.0,Channel Islands,2025-11-06
509021,22626,BLACK KITCHEN SCALES,2,8.5,14442.0,Channel Islands,2025-11-06
509021,22469,HEART OF WICKER SMALL,12,1.65,14442.0,Channel Islands,2025-11-06
509021,22487,WHITE WOOD GARDEN PLANT LADDER,2,9.95,14442.0,Channel Islands,2025-11-06
509021,20749,ASSORTED COLOUR MINI CASES,3,7.95,14442.0,Channel Islands,2025-11-06
509021,21363,HOME SMALL WOOD LETTERS,6,4.95,14442.0,Channel Islands,2025-11-06
509021,22485,SET OF 2 WOODEN MARKET CRATES,2,12.75,14442.0,Channel Islands,2025-11-06
509021,21638,ASSORTED TUTTI FRUTTI NOTEBOOK,12,2.1,14442.0,Channel Islands,2025-11-06
509021,20750,RED/WHITE DOT MINI CASES,3,7.95,14442.0,Channel Islands,2025-11-06
509021,84991,60 TEATIME FAIRY CAKE CASES,24,0.55,14442.0,Channel Islands,2025-11-06
509021,85068,CREAM SWEETHEART SHELF + HOOKS,4,7.95,14442.0,Channel Islands,2025-11-06
509021,22507,MEMO BOARD RETROSPOT  DESIGN,4,4.95,14442.0,Channel Islands,2025-11-06
509021,37502,TEA TIME MUG IN GIFT BOX,6,2.95,14442.0,Channel Islands,2025-11-06
509022,22426,ENAMEL WASH BOWL CREAM,4,3.75,13405.0,United Kingdom,2025-11-06
509022,22427,ENAMEL FLOWER JUG CREAM,12,5.45,13405.0,United Kingdom,2025-11-06
509022,21897,POTTING SHED CANDLE CITRONELLA,6,2.95,13405.0,United Kingdom,2025-11-06
509022,21713,CITRONELLA CANDLE FLOWERPOT,8,2.1,13405.0,United Kingdom,2025-11-06
509022,21923,RED/CREAM STRIPE FRINGE HAMMOCK,12,6.95,13405.0,United Kingdom,2025-11-06
509022,21924,BLUE/CREAM STRIPE FRINGE HAMMOCK,12,6.95,13405.0,United Kingdom,2025-11-06
509022,22424,ENAMEL BREAD BIN CREAM,8,10.95,13405.0,United Kingdom,2025-11-06
509022,22624,IVORY KITCHEN SCALES,2,8.5,13405.0,United Kingdom,2025-11-06
509023,21557,SET OF 6 FUNKY BEAKERS,6,2.95,17184.0,United Kingdom,2025-11-06
509023,22278,OVERNIGHT BAG VINTAGE ROSE PAISLEY,3,4.95,17184.0,United Kingdom,2025-11-06
509023,22475,SKULL DESIGN TV DINNER TRAY,3,4.95,17184.0,United Kingdom,2025-11-06
509023,21506,"FANCY FONT BIRTHDAY CARD, ",12,0.42,17184.0,United Kingdom,2025-11-06
509023,22357,KINGS CHOICE BISCUIT TIN,4,4.25,17184.0,United Kingdom,2025-11-06
509023,84247G,"DECOUPAGE,GREETING CARD,",12,0.42,17184.0,United Kingdom,2025-11-06
509023,22470,HEART OF WICKER LARGE,6,2.95,17184.0,United Kingdom,2025-11-06
509023,21333,CLASSIC WHITE FRAME,4,2.95,17184.0,United Kingdom,2025-11-06
509023,22497,SET OF 2 TINS VINTAGE BATHROOM ,4,4.25,17184.0,United Kingdom,2025-11-06
509023,21463,MIRRORED DISCO BALL ,2,5.95,17184.0,United Kingdom,2025-11-06
509023,48189,DOOR MAT FRIENDSHIP ,2,7.49,17184.0,United Kingdom,2025-11-06
509024,21114,LAVENDER SCENTED FABRIC HEART,10,1.25,16564.0,United Kingdom,2025-11-06
509024,85130B,BEADED CRYSTAL HEART GREEN LARGE,12,1.65,16564.0,United Kingdom,2025-11-06
509024,85130D,BEADED CRYSTAL HEART PINK LARGE,12,1.65,16564.0,United Kingdom,2025-11-06
509024,21755,LOVE BUILDING BLOCK WORD,3,5.95,16564.0,United Kingdom,2025-11-06
509024,21754,HOME BUILDING BLOCK WORD,3,5.95,16564.0,United Kingdom,2025-11-06
509025,22384,LUNCH BAG PINK RETROSPOT,1,1.65,,United Kingdom,2025-11-06
509026,15058A,BLUE WHITE SPOTS GARDEN PARASOL,10,3.95,16103.0,United Kingdom,2025-11-06
509026,17011F,ORIGAMI SANDLEWOOD INCENSE+FLOWER,6,2.1,16103.0,United Kingdom,2025-11-06
509026,21878,PACK OF 6 SANDCASTLE FLAGS ASSORTED,12,0.85,16103.0,United Kingdom,2025-11-06
509026,22189,CREAM HEART CARD HOLDER,16,3.95,16103.0,United Kingdom,2025-11-06
509026,85123A,WHITE HANGING HEART T-LIGHT HOLDER,32,2.55,16103.0,United Kingdom,2025-11-06
509026,21621,VINTAGE UNION JACK BUNTING,6,8.5,16103.0,United Kingdom,2025-11-06
509027,22443,GROW YOUR OWN HERBS SET OF 3,1,7.95,12837.0,United Kingdom,2025-11-06
509027,90122C,TURQUOISE CRYSTAL+GLASS BRACELET,1,4.95,12837.0,United Kingdom,2025-11-06
509027,90200C,BLUE SWEETHEART BRACELET,1,4.25,12837.0,United Kingdom,2025-11-06
509027,90200A,PURPLE SWEETHEART BRACELET,1,4.25,12837.0,United Kingdom,2025-11-06
509027,90200E,GREEN SWEETHEART BRACELET,1,4.25,12837.0,United Kingdom,2025-11-06
509027,90122B,JADE CRYSTAL+GLASS BRACELET,1,4.95,12837.0,United Kingdom,2025-11-06
509027,22158,3 HEARTS HANGING DECORATION RUSTIC,3,2.95,12837.0,United Kingdom,2025-11-06
509027,85131B,BEADED CRYSTAL HEART GREEN ON STICK,2,1.25,12837.0,United Kingdom,2025-11-06
509027,22442,GROW YOUR OWN FLOWERS SET OF 3,2,7.95,12837.0,United Kingdom,2025-11-06
509027,22441,GROW YOUR OWN BASIL IN ENAMEL MUG,2,2.1,12837.0,United Kingdom,2025-11-06
509027,22185,SLATE TILE NATURAL HANGING,5,1.65,12837.0,United Kingdom,2025-11-06
