Invoice,StockCode,Description,Quantity,Price,Customer ID,Country,InvoiceDate
501860,21900,"KEY FOB , SHED",6,0.65,15425.0,United Kingdom,2025-09-20
501860,22212,FOUR HOOK  WHITE LOVEBIRDS,4,2.1,15425.0,United Kingdom,2025-09-20
501860,21902,"KEY FOB , FRONT  DOOR ",4,0.65,15425.0,United Kingdom,2025-09-20
501860,37447,CERAMIC CAKE DESIGN SPOTTED PLATE,4,1.49,15425.0,United Kingdom,2025-09-20
501860,84405A,S/3 PINK COL METAL BASKET W HANDLE,1,12.75,15425.0,United Kingdom,2025-09-20
501860,21136,PAINTED METAL PEARS ASSORTED,8,1.69,15425.0,United Kingdom,2025-09-20
501860,22221,CAKE STAND LOVEBIRD 2 TIER PINK,1,9.95,15425.0,United Kingdom,2025-09-20
501860,22220,CAKE STAND LOVEBIRD 2 TIER WHITE,1,9.95,15425.0,United Kingdom,2025-09-20
501860,37502,TEA TIME MUG IN GIFT BOX,4,2.95,15425.0,United Kingdom,2025-09-20
501860,84880,WHITE WIRE EGG HOLDER,2,5.95,15425.0,United Kingdom,2025-09-20
501860,35809A,ENAMEL PINK TEA CONTAINER,6,2.1,15425.0,United Kingdom,2025-09-20
501860,35811A,ENAMEL PINK SUGAR CONTAINER,6,2.1,15425.0,United Kingdom,2025-09-20
501860,22198,LARGE POPCORN HOLDER ,5,1.65,15425.0,United Kingdom,2025-09-20
501860,84596L,BISCUITS SMALL BOWL LIGHT BLUE,8,1.25,15425.0,United Kingdom,2025-09-20
501860,21529,RETRO SPOT CERAMIC TOASTRACK,1,3.45,15425.0,United Kingdom,2025-09-20
501860,21389,IVORY HANGING DECORATION  BIRD,24,0.85,15425.0,United Kingdom,2025-09-20
501860,21386,IVORY HANGING DECORATION  EGG,24,0.85,15425.0,United Kingdom,2025-09-20
501860,21384,IVORY HANGING DECORATION  BUTTERFLY,24,0.85,15425.0,United Kingdom,2025-09-20
501860,47566B,TEA TIME PARTY BUNTING,4,4.65,15425.0,United Kingdom,2025-09-20
501860,21041,RED SPOTTY OVEN GLOVE DOUBLE,3,2.95,15425.0,United Kingdom,2025-09-20
501860,22219,LOVEBIRD HANGING DECORATION WHITE ,6,0.85,15425.0,United Kingdom,2025-09-20
501860,21456,2 PICTURE BOOK EGGS EASTER CHICKS,4,1.25,15425.0,United Kingdom,2025-09-20
501860,84406B,CREAM CUPID HEARTS COAT HANGER,3,3.25,15425.0,United Kingdom,2025-09-20
501860,22123,PING MICROWAVE APRON,2,5.95,15425.0,United Kingdom,2025-09-20
501860,71053,WHITE METAL LANTERN,2,3.75,15425.0,United Kingdom,2025-09-20
501860,22465,HANGING METAL STAR LANTERN,6,1.65,15425.0,United Kingdom,2025-09-20
501860,21218,RED SPOTTY BISCUIT TIN,3,3.75,15425.0,United Kingdom,2025-09-20
501860,47599A,PINK PARTY BAGS,6,2.1,15425.0,United Kingdom,2025-09-20
501860,22189,CREAM HEART CARD HOLDER,2,3.95,15425.0,United Kingdom,2025-09-20
501860,22188,BLACK HEART CARD HOLDER,2,3.95,15425.0,United Kingdom,2025-09-20
501860,85123A,WHITE HANGING HEART T-LIGHT HOLDER,4,2.95,15425.0,United Kingdom,2025-09-20
501860,21733,RED HANGING HEART T-LIGHT HOLDER,2,2.95,15425.0,United Kingdom,2025-09-20
501860,22223,CAKE PLATE LOVEBIRD PINK,2,4.95,15425.0,United Kingdom,2025-09-20
501860,22222,CAKE PLATE LOVEBIRD WHITE,2,4.95,15425.0,United Kingdom,2025-09-20
501860,22224,WHITE LOVEBIRD LANTERN,2,2.95,15425.0,United Kingdom,2025-09-20
501860,21902,"KEY FOB , FRONT  DOOR ",3,0.65,15425.0,United Kingdom,2025-09-20
C501861,20784,RED RETRO BAR STOOL,-1,39.95,14080.0,United Kingdom,2025-09-20
501862,90120A,PINK MURANO TWIST BRACELET,2,4.25,16326.0,United Kingdom,2025-09-20
501862,21781,MA CAMPAGNE CUTLERY BOX,1,14.95,16326.0,United Kingdom,2025-09-20
501862,21777,RECIPE BOX WITH METAL HEART,2,7.95,16326.0,United Kingdom,2025-09-20
501862,21755,LOVE BUILDING BLOCK WORD,1,5.95,16326.0,United Kingdom,2025-09-20
501862,84763,ZINC FINISH 15CM PLANTER POTS,10,1.25,16326.0,United Kingdom,2025-09-20
501862,22507,MEMO BOARD RETROSPOT  DESIGN,1,4.95,16326.0,United Kingdom,2025-09-20
501862,21294,ETCHED GLASS COASTER,10,1.25,16326.0,United Kingdom,2025-09-20
501862,22222,CAKE PLATE LOVEBIRD WHITE,1,4.95,16326.0,United Kingdom,2025-09-20
501862,21670,BLUE SPOT CERAMIC DRAWER KNOB,1,1.25,16326.0,United Kingdom,2025-09-20
501862,22508,DOORSTOP RETROSPOT HEART,1,3.75,16326.0,United Kingdom,2025-09-20
501862,48173C,DOOR MAT BLACK FLOCK ,2,7.49,16326.0,United Kingdom,2025-09-20
501862,21871,SAVE THE PLANET MUG,6,1.25,16326.0,United Kingdom,2025-09-20
501862,48194,DOOR MAT HEARTS,3,7.49,16326.0,United Kingdom,2025-09-20
501862,20685,DOOR MAT RED SPOT,3,7.49,16326.0,United Kingdom,2025-09-20
501862,48111,DOOR MAT 3 SMILEY CATS,3,7.49,16326.0,United Kingdom,2025-09-20
501862,48129,DOOR MAT TOPIARY,2,7.49,16326.0,United Kingdom,2025-09-20
501862,48188,DOOR MAT WELCOME PUPPIES,2,7.49,16326.0,United Kingdom,2025-09-20
501862,90184C,BLACK CHUNKY BEAD BRACELET W STRAP,1,8.95,16326.0,United Kingdom,2025-09-20
501862,90198A,VINTAGE ROSE BEAD BRACELET RASPBERR,2,4.25,16326.0,United Kingdom,2025-09-20
501862,90184A,AMBER CHUNKY BEAD BRACELET W STRAP,2,8.95,16326.0,United Kingdom,2025-09-20
501862,90198B,VINTAGE ROSE BEAD BRACELET BLACK,2,4.25,16326.0,United Kingdom,2025-09-20
501862,90197D,AMBER GLASS BRACELET HEART CHARMS,1,4.95,16326.0,United Kingdom,2025-09-20
501862,48189,DOOR MAT FRIENDSHIP ,2,7.49,16326.0,United Kingdom,2025-09-20
501863,22117,METAL SIGN HER DINNER IS SERVED ,6,2.95,15650.0,United Kingdom,2025-09-20
501863,21212,PACK OF 72 RETRO SPOT CAKE CASES,24,0.55,15650.0,United Kingdom,2025-09-20
501863,21527,RETRO SPOT TRADITIONAL TEAPOT ,2,7.95,15650.0,United Kingdom,2025-09-20
501863,21535,RETRO SPOT SMALL MILK JUG,6,2.55,15650.0,United Kingdom,2025-09-20
501863,21533,RETRO SPOT LARGE MILK JUG,3,4.95,15650.0,United Kingdom,2025-09-20
501863,37450,CERAMIC CAKE BOWL + HANGING CAKES,6,2.95,15650.0,United Kingdom,2025-09-20
501863,21216,"SET 3 RED SPOT TIN TEA,COFFEE,SUGAR",4,4.95,15650.0,United Kingdom,2025-09-20
501863,37449,CERAMIC CAKE STAND + HANGING CAKES,2,9.95,15650.0,United Kingdom,2025-09-20
501863,37447,CERAMIC CAKE DESIGN SPOTTED PLATE,12,1.49,15650.0,United Kingdom,2025-09-20
501863,21175,GIN + TONIC DIET METAL SIGN,6,2.1,15650.0,United Kingdom,2025-09-20
501863,21217,RED SPOTTY ROUND CAKE TINS,1,9.95,15650.0,United Kingdom,2025-09-20
501863,21181,PLEASE ONE PERSON METAL SIGN,6,2.1,15650.0,United Kingdom,2025-09-20
501863,22414,DOOR MAT NEIGHBOURHOOD WITCH ,2,7.49,15650.0,United Kingdom,2025-09-20
501863,20685,DOOR MAT RED SPOT,2,7.49,15650.0,United Kingdom,2025-09-20
501863,48116,DOOR MAT MULTICOLOUR STRIPE,2,7.49,15650.0,United Kingdom,2025-09-20
501863,48185,DOOR MAT FAIRY CAKE,2,7.49,15650.0,United Kingdom,2025-09-20
501863,48187,DOOR MAT NEW ENGLAND,2,7.49,15650.0,United Kingdom,2025-09-20
501863,22365,DOOR MAT RESPECTABLE HOUSE,2,7.49,15650.0,United Kingdom,2025-09-20
501863,85172,HYACINTH BULB T-LIGHT CANDLES,16,0.42,15650.0,United Kingdom,2025-09-20
501863,85175,CACTI T-LIGHT CANDLES,16,0.42,15650.0,United Kingdom,2025-09-20
501863,21078,SET/20 STRAWBERRY PAPER NAPKINS ,12,0.85,15650.0,United Kingdom,2025-09-20
501863,21080,SET/20 RED SPOTTY PAPER NAPKINS ,12,0.85,15650.0,United Kingdom,2025-09-20
501863,21260,FIRST AID TIN,6,3.25,15650.0,United Kingdom,2025-09-20
501863,21906,PHARMACIE FIRST AID TIN,2,6.75,15650.0,United Kingdom,2025-09-20
501863,48138,DOOR MAT UNION FLAG,2,7.49,15650.0,United Kingdom,2025-09-20
501864,21754,HOME BUILDING BLOCK WORD,12,5.95,17681.0,United Kingdom,2025-09-20
501864,21654,RIDGED GLASS FINGER BOWL,72,1.25,17681.0,United Kingdom,2025-09-20
501865,20711,JUMBO BAG TOYS ,5,1.95,,United Kingdom,2025-09-20
501865,22411,JUMBO SHOPPER VINTAGE RED PAISLEY,5,1.95,,United Kingdom,2025-09-20
501865,21931,JUMBO STORAGE BAG SUKI,4,1.95,,United Kingdom,2025-09-20
501865,21930,JUMBO STORAGE BAG SKULLS,5,1.95,,United Kingdom,2025-09-20
501866,84016,FLAG OF ST GEORGE CAR FLAG,300,0.35,13668.0,United Kingdom,2025-09-20
501866,22423,REGENCY CAKESTAND 3 TIER,16,10.95,13668.0,United Kingdom,2025-09-20
501867,22582,PACK OF 6 SWEETIE GIFT BOXES,6,2.55,18085.0,United Kingdom,2025-09-20
501867,22585,PACK OF 6 BIRDY GIFT TAGS,12,1.25,18085.0,United Kingdom,2025-09-20
501867,22139,RETRO SPOT TEA SET CERAMIC 11 PC ,9,4.95,18085.0,United Kingdom,2025-09-20
501867,22568,FELTCRAFT CUSHION OWL,8,3.75,18085.0,United Kingdom,2025-09-20
501867,22569,FELTCRAFT CUSHION BUTTERFLY,8,3.75,18085.0,United Kingdom,2025-09-20
501867,22570,FELTCRAFT CUSHION RABBIT,8,3.75,18085.0,United Kingdom,2025-09-20
501867,22584,PACK OF 6 PANNETONE GIFT BOXES,6,2.55,18085.0,United Kingdom,2025-09-20
501867,20967,GREY FLORAL FELTCRAFT SHOULDER BAG,4,3.75,18085.0,United Kingdom,2025-09-20
501867,22149,FELTCRAFT 6 FLOWER FRIENDS,6,2.1,18085.0,United Kingdom,2025-09-20
501867,22261,FELT EGG COSY WHITE RABBIT ,12,0.85,18085.0,United Kingdom,2025-09-20
501867,22262,FELT EGG COSY CHICKEN,12,0.85,18085.0,United Kingdom,2025-09-20
501867,21383,PACK OF 12 STICKY BUNNIES,24,0.65,18085.0,United Kingdom,2025-09-20
501867,20969,RED FLORAL FELTCRAFT SHOULDER BAG,4,3.75,18085.0,United Kingdom,2025-09-20
501868,47568,ENGLISH ROSE DESIGN PEG BAG,6,2.1,16746.0,United Kingdom,2025-09-20
501868,21155,RED SPOTTY PEG BAG,6,2.1,16746.0,United Kingdom,2025-09-20
501868,22382,LUNCH BAG SPACEBOY DESIGN ,10,1.65,16746.0,United Kingdom,2025-09-20
501868,22385,JUMBO BAG SPACEBOY DESIGN,10,1.95,16746.0,United Kingdom,2025-09-20
501868,21930,JUMBO STORAGE BAG SKULLS,10,1.95,16746.0,United Kingdom,2025-09-20
501868,84469,ROSE DES PADDED FLOOR CUSHION,13,2.95,16746.0,United Kingdom,2025-09-20
501868,20711,JUMBO BAG TOYS ,10,1.95,16746.0,United Kingdom,2025-09-20
501868,22383,LUNCH BAG SUKI  DESIGN ,100,1.45,16746.0,United Kingdom,2025-09-20
501868,21931,JUMBO STORAGE BAG SUKI,100,1.65,16746.0,United Kingdom,2025-09-20
501868,22467,GUMBALL COAT RACK,6,2.55,16746.0,United Kingdom,2025-09-20
501868,22468,BABUSHKA LIGHTS STRING OF 10,2,6.75,16746.0,United Kingdom,2025-09-20
501868,20712,JUMBO BAG WOODLAND ANIMALS,10,1.95,16746.0,United Kingdom,2025-09-20
501869,16014,SMALL CHINESE STYLE SCISSOR,1000,0.32,13848.0,United Kingdom,2025-09-20
501870,21935,SUKI  SHOULDER BAG,10,1.45,17448.0,United Kingdom,2025-09-20
501870,21879,HEARTS GIFT TAPE,12,0.55,17448.0,United Kingdom,2025-09-20
501870,22224,WHITE LOVEBIRD LANTERN,6,2.55,17448.0,United Kingdom,2025-09-20
501870,84884A,ANT WHITE WIRE HEART SPIRAL,5,3.39,17448.0,United Kingdom,2025-09-20
501870,21497,FANCY FONTS BIRTHDAY WRAP,25,0.34,17448.0,United Kingdom,2025-09-20
501870,84507B,STRIPES DESIGN MONKEY DOLL,6,2.1,17448.0,United Kingdom,2025-09-20
501870,22242,"HOOK, 5 HANGER , MAGIC TOADSTOOL",12,1.45,17448.0,United Kingdom,2025-09-20
501870,18097C,WHITE TALL PORCELAIN T-LIGHT HOLDER,6,1.95,17448.0,United Kingdom,2025-09-20
501870,22052,VINTAGE CARAVAN GIFT WRAP,25,0.34,17448.0,United Kingdom,2025-09-20
501870,22296,HEART IVORY TRELLIS LARGE,12,1.45,17448.0,United Kingdom,2025-09-20
501870,21883,STARS GIFT TAPE ,12,0.55,17448.0,United Kingdom,2025-09-20
501870,22188,BLACK HEART CARD HOLDER,4,3.39,17448.0,United Kingdom,2025-09-20
501870,18098C,PORCELAIN BUTTERFLY OIL BURNER,6,2.55,17448.0,United Kingdom,2025-09-20
501870,22219,LOVEBIRD HANGING DECORATION WHITE ,12,0.72,17448.0,United Kingdom,2025-09-20
501870,21884,CAKES AND BOWS GIFT  TAPE,12,0.55,17448.0,United Kingdom,2025-09-20
501870,22248,DECORATION  PINK CHICK MAGIC GARDEN,16,0.72,17448.0,United Kingdom,2025-09-20
501870,22247,BUNNY DECORATION MAGIC GARDEN,16,0.72,17448.0,United Kingdom,2025-09-20
501870,20692,FLORAL ELEPHANT SOFT TOY,3,3.75,17448.0,United Kingdom,2025-09-20
501870,22244,"HOOK, 3 HANGER ,MAGIC GARDEN",12,1.65,17448.0,United Kingdom,2025-09-20
501870,85123A,WHITE HANGING HEART T-LIGHT HOLDER,6,2.55,17448.0,United Kingdom,2025-09-20
501870,21323,HANGING MEDINA LANTERN LARGE,3,3.75,17448.0,United Kingdom,2025-09-20
501870,21385,IVORY HANGING DECORATION  HEART,17,0.85,17448.0,United Kingdom,2025-09-20
501870,22290,STANDING METAL RABBIT WITH EGG,6,1.85,17448.0,United Kingdom,2025-09-20
501870,48173C,DOOR MAT BLACK FLOCK ,2,6.35,17448.0,United Kingdom,2025-09-20
501870,22245,"HOOK, 1 HANGER ,MAGIC GARDEN",12,0.72,17448.0,United Kingdom,2025-09-20
501870,21557,SET OF 6 FUNKY BEAKERS,6,2.55,17448.0,United Kingdom,2025-09-20
501870,85175,CACTI T-LIGHT CANDLES,16,0.36,17448.0,United Kingdom,2025-09-20
501870,22250,DECORATION  BUTTERFLY  MAGIC GARDEN,16,0.72,17448.0,United Kingdom,2025-09-20
501870,21384,IVORY HANGING DECORATION  BUTTERFLY,24,0.72,17448.0,United Kingdom,2025-09-20
501870,85196,EASTER BUNNIES ON A STICK,12,0.42,17448.0,United Kingdom,2025-09-20
501870,22355,"CHARLOTTE BAG , SUKI DESIGN",10,0.72,17448.0,United Kingdom,2025-09-20
501870,22249,DECORATION WHITE CHICK MAGIC GARDEN,16,0.72,17448.0,United Kingdom,2025-09-20
501870,84971L,LARGE HEART FLOWERS HOOK   ,12,1.06,17448.0,United Kingdom,2025-09-20
501870,22295,HEART FILIGREE DOVE LARGE,12,1.45,17448.0,United Kingdom,2025-09-20
501871,85206A,CREAM FELT EASTER EGG BASKET,12,1.65,14970.0,United Kingdom,2025-09-20
501871,21777,RECIPE BOX WITH METAL HEART,4,7.95,14970.0,United Kingdom,2025-09-20
501871,21900,"KEY FOB , SHED",6,0.65,14970.0,United Kingdom,2025-09-20
501871,48194,DOOR MAT HEARTS,10,6.35,14970.0,United Kingdom,2025-09-20
501871,79323G,GOLD  CHERRY LIGHTS,24,5.45,14970.0,United Kingdom,2025-09-20
501871,79323W,WHITE CHERRY LIGHTS,24,5.45,14970.0,United Kingdom,2025-09-20
501871,21899,"KEY FOB , GARAGE DESIGN",6,0.65,14970.0,United Kingdom,2025-09-20
501871,21901,"KEY FOB , BACK DOOR ",6,0.65,14970.0,United Kingdom,2025-09-20
501871,21866,UNION JACK FLAG LUGGAGE TAG,6,1.25,14970.0,United Kingdom,2025-09-20
501871,84327A,PINK JUMPER LARRY THE LAMB,2,2.1,14970.0,United Kingdom,2025-09-20
501871,48138,DOOR MAT UNION FLAG,10,6.35,14970.0,United Kingdom,2025-09-20
501871,48187,DOOR MAT NEW ENGLAND,10,6.35,14970.0,United Kingdom,2025-09-20
501871,22366,DOOR MAT AIRMAIL ,10,6.35,14970.0,United Kingdom,2025-09-20
501871,21523,DOOR MAT FANCY FONT HOME SWEET HOME,10,6.35,14970.0,United Kingdom,2025-09-20
501871,21902,"KEY FOB , FRONT  DOOR ",6,0.65,14970.0,United Kingdom,2025-09-20
501872,17001,HEAVENS SCENT FRAGRANCE OILS ASSTD,36,0.29,17916.0,United Kingdom,2025-09-20
501872,72008,FROSTED BOX 9 WHITE T-LIGHT CANDLES,1,0.42,17916.0,United Kingdom,2025-09-20
501872,20730,STRAWBERRY CANDY BAG,1,1.25,17916.0,United Kingdom,2025-09-20
501872,17091A,LAVENDER INCENSE IN TIN,1,1.25,17916.0,United Kingdom,2025-09-20
501872,20871,OPULENT VELVET SET/3 CANDLES,1,2.1,17916.0,United Kingdom,2025-09-20
501872,85231L,LAVENDER SCENTED SET/9 T-LIGHTS,1,0.85,17916.0,United Kingdom,2025-09-20
501872,85231G,ORANGE SCENTED SET/9 T-LIGHTS,1,0.85,17916.0,United Kingdom,2025-09-20
501872,17091J,VANILLA INCENSE IN TIN,1,1.25,17916.0,United Kingdom,2025-09-20
C501873,79323LP,LIGHT PINK CHERRY LIGHTS,-3,6.75,14970.0,United Kingdom,2025-09-20
C501873,79323G,GOLD  CHERRY LIGHTS,-1,6.75,14970.0,United Kingdom,2025-09-20
C501873,79323P,PINK CHERRY LIGHTS,-2,6.75,14970.0,United Kingdom,2025-09-20
C501873,79323W,WHITE CHERRY LIGHTS,-1,6.75,14970.0,United Kingdom,2025-09-20
C501873,79323S,SILVER CHERRY LIGHTS,-1,6.75,14970.0,United Kingdom,2025-09-20
501874,84469,ROSE DES PADDED FLOOR CUSHION,65,2.95,17133.0,United Kingdom,2025-09-20
501874,84755,COLOUR GLASS T-LIGHT HOLDER HANGING,720,0.55,17133.0,United Kingdom,2025-09-20
501874,21869,POTTING SHED COFFEE MUG,72,1.06,17133.0,United Kingdom,2025-09-20
501874,21868,POTTING SHED TEA MUG,72,1.06,17133.0,United Kingdom,2025-09-20
501874,85123A,WHITE HANGING HEART T-LIGHT HOLDER,640,2.55,17133.0,United Kingdom,2025-09-20
501874,17091J,VANILLA INCENSE IN TIN,1,1.25,17133.0,United Kingdom,2025-09-20
501874,48138,DOOR MAT UNION FLAG,2,7.49,17133.0,United Kingdom,2025-09-20
501874,47566,PARTY BUNTING,60,3.75,17133.0,United Kingdom,2025-09-20
501875,22178,VICTORIAN GLASS HANGING T-LIGHT,12,1.25,16168.0,United Kingdom,2025-09-20
501875,84691,PACK 20 DOLLY PEGS,12,0.85,16168.0,United Kingdom,2025-09-20
501875,84755,COLOUR GLASS T-LIGHT HOLDER HANGING,32,0.65,16168.0,United Kingdom,2025-09-20
501875,40018F,CHERRY DESIGN PAPERLANTERNS,20,1.95,16168.0,United Kingdom,2025-09-20
501875,22488,NATURAL SLATE RECTANGLE CHALKBOARD,12,1.65,16168.0,United Kingdom,2025-09-20
501875,22087,PAPER BUNTING WHITE LACE,6,2.95,16168.0,United Kingdom,2025-09-20
501875,22457,NATURAL SLATE HEART CHALKBOARD ,12,2.95,16168.0,United Kingdom,2025-09-20
501875,22456,NATURAL SLATE CHALKBOARD LARGE ,6,4.95,16168.0,United Kingdom,2025-09-20
501875,40018E,TEA TIME PAPER LANTERNS,20,1.95,16168.0,United Kingdom,2025-09-20
501876,85121B,RETRO LAUNDRY TUB PINK,6,8.5,17236.0,United Kingdom,2025-09-20
501876,84879,ASSORTED COLOUR BIRD ORNAMENT,16,1.69,17236.0,United Kingdom,2025-09-20
501876,85014A,BLACK/BLUE DOTS RUFFLED UMBRELLA,10,5.95,17236.0,United Kingdom,2025-09-20
501876,82597,BOMBS AWAY METAL SIGN,1,2.1,17236.0,United Kingdom,2025-09-20
501876,22122,SET OF 2 FANCY FONT TEA TOWELS,2,2.95,17236.0,United Kingdom,2025-09-20
501876,22467,GUMBALL COAT RACK,2,2.55,17236.0,United Kingdom,2025-09-20
501877,21980,PACK OF 12 RED SPOTTY TISSUES ,12,0.29,17611.0,United Kingdom,2025-09-20
501877,79302M,"ART LIGHTS,FUNK MONKEY",4,2.95,17611.0,United Kingdom,2025-09-20
501877,21358,TOAST ITS - HAPPY BIRTHDAY,2,1.25,17611.0,United Kingdom,2025-09-20
501877,21357,TOAST ITS - DINOSAUR,2,1.25,17611.0,United Kingdom,2025-09-20
501877,22179,SET 10 LIGHTS NIGHT OWL,2,6.75,17611.0,United Kingdom,2025-09-20
501877,21912,VINTAGE SNAKES & LADDERS,2,3.75,17611.0,United Kingdom,2025-09-20
501877,21967,PACK OF 12 SKULL TISSUES,12,0.29,17611.0,United Kingdom,2025-09-20
501877,21675,BUTTERFLIES STICKERS,6,0.85,17611.0,United Kingdom,2025-09-20
501877,22334,DINOSAUR PARTY BAG + STICKER SET,2,1.65,17611.0,United Kingdom,2025-09-20
501877,22331,WOODLAND PARTY BAG + STICKER SET,2,1.65,17611.0,United Kingdom,2025-09-20
501877,22332,SKULLS PARTY BAG + STICKER SET,2,1.65,17611.0,United Kingdom,2025-09-20
501877,21987,PACK OF 6 SKULL PAPER CUPS,6,0.65,17611.0,United Kingdom,2025-09-20
501877,21544,SKULLS  WATER TRANSFER TATTOOS ,6,0.85,17611.0,United Kingdom,2025-09-20
501877,21679,SKULLS  STICKERS,6,0.85,17611.0,United Kingdom,2025-09-20
501877,21718,RED METAL BEACH SPADE ,6,1.25,17611.0,United Kingdom,2025-09-20
501877,21715,GIRLS VINTAGE TIN SEASIDE BUCKET,6,2.55,17611.0,United Kingdom,2025-09-20
501877,44091C,MULTICOLOUR CRUSOE CHECK LAMPSHADE,6,0.42,17611.0,United Kingdom,2025-09-20
501877,21989,PACK OF 20 SKULL PAPER NAPKINS,4,0.85,17611.0,United Kingdom,2025-09-20
501877,79030G,"TUMBLER, NEW ENGLAND",6,1.65,17611.0,United Kingdom,2025-09-20
501877,17165D,ASS COL LARGE SAND FROG P'WEIGHT,4,1.05,17611.0,United Kingdom,2025-09-20
501877,90167,BEADED LOVE HEART JEWELLERY SET,12,0.85,17611.0,United Kingdom,2025-09-20
501877,22323,PINK POLKADOT KIDS BAG,4,1.95,17611.0,United Kingdom,2025-09-20
501877,22382,LUNCH BAG SPACEBOY DESIGN ,3,1.65,17611.0,United Kingdom,2025-09-20
501877,17084R,ASSORTED INCENSE PACK,72,0.21,17611.0,United Kingdom,2025-09-20
501877,22068,BLACK PIRATE TREASURE CHEST,2,1.65,17611.0,United Kingdom,2025-09-20
501877,20726,LUNCH BAG WOODLAND,3,1.65,17611.0,United Kingdom,2025-09-20
501877,79323LP,LIGHT PINK CHERRY LIGHTS,2,6.75,17611.0,United Kingdom,2025-09-20
501877,20727,LUNCH BAG  BLACK SKULL.,10,1.65,17611.0,United Kingdom,2025-09-20
501877,21728,METAL MEDINA LANTERN ,1,12.75,17611.0,United Kingdom,2025-09-20
501877,85184C,S/4 VALENTINE DECOUPAGE HEART BOX,1,2.95,17611.0,United Kingdom,2025-09-20
501877,85184D,S/4 BLUE ROUND DECOUPAGE BOXES,1,2.95,17611.0,United Kingdom,2025-09-20
501877,20684,STRAWBERRY DREAM CHILDS UMBRELLA,1,3.25,17611.0,United Kingdom,2025-09-20
501877,20681,PINK SPOTTY CHILDS UMBRELLA,1,3.25,17611.0,United Kingdom,2025-09-20
501877,20682,RED SPOTTY CHILDS UMBRELLA,1,3.25,17611.0,United Kingdom,2025-09-20
501877,79191B,RETRO PLASTIC POLKA TRAY,2,0.85,17611.0,United Kingdom,2025-09-20
501877,21704,BAG 250g SWIRLY MARBLES,6,0.85,17611.0,United Kingdom,2025-09-20
501877,17165B,ASS COL LARGE SAND GECKO P'WEIGHT,7,1.05,17611.0,United Kingdom,2025-09-20
501877,22327,ROUND SNACK BOXES SET OF 4 SKULLS,3,2.95,17611.0,United Kingdom,2025-09-20
501877,85232D,SET/3 DECOUPAGE STACKING TINS,2,4.95,17611.0,United Kingdom,2025-09-20
501877,85042,ANTIQUE LILY FAIRY LIGHTS,5,4.95,17611.0,United Kingdom,2025-09-20
501877,22565,FELTCRAFT HAIRBANDS PINK AND WHITE ,12,0.85,17611.0,United Kingdom,2025-09-20
501877,84251G,"GREETING CARD, OVERCROWDED POOL.",12,0.19,17611.0,United Kingdom,2025-09-20
501877,84251F,"GREETING CARD, RITA",12,0.19,17611.0,United Kingdom,2025-09-20
501877,21507,"ELEPHANT, BIRTHDAY CARD, ",12,0.42,17611.0,United Kingdom,2025-09-20
501877,21504,SKULLS GREETING CARD,24,0.42,17611.0,United Kingdom,2025-09-20
501877,75149N,STRING CRYSTALS NATURAL,6,1.25,17611.0,United Kingdom,2025-09-20
501877,22357,KINGS CHOICE BISCUIT TIN,2,4.25,17611.0,United Kingdom,2025-09-20
501877,17091J,VANILLA INCENSE IN TIN,1,1.25,17611.0,United Kingdom,2025-09-20
501877,22358,KINGS CHOICE TEA CADDY ,3,2.95,17611.0,United Kingdom,2025-09-20
501877,84929,ASSTD FRUIT+FLOWERS FRIDGE MAGNETS,12,0.55,17611.0,United Kingdom,2025-09-20
501877,20669,RED HEART LUGGAGE TAG,4,1.25,17611.0,United Kingdom,2025-09-20
501877,20658,RED SPOTTY LUGGAGE TAG,3,1.25,17611.0,United Kingdom,2025-09-20
501877,37464,ROBOT MUG IN DISPLAY BOX,2,1.25,17611.0,United Kingdom,2025-09-20
501877,84380,SET OF 3 BUTTERFLY COOKIE CUTTERS,1,1.25,17611.0,United Kingdom,2025-09-20
501877,16235,RECYCLED PENCIL WITH RABBIT ERASER,10,0.21,17611.0,United Kingdom,2025-09-20
501877,79191D,RETRO PLASTIC DAISY TRAY,2,0.85,17611.0,United Kingdom,2025-09-20
501877,79191C,RETRO PLASTIC ELEPHANT TRAY,2,0.85,17611.0,United Kingdom,2025-09-20
501877,85227,SET OF 6 3D KIT CARDS FOR KIDS,6,0.85,17611.0,United Kingdom,2025-09-20
501877,84251C,"GREETING CARD, TWO SISTERS.",12,0.19,17611.0,United Kingdom,2025-09-20
501877,21509,COWBOYS AND INDIANS BIRTHDAY CARD ,12,0.42,17611.0,United Kingdom,2025-09-20
501877,20652,BLUE SPOTTY LUGGAGE TAG ,3,1.25,17611.0,United Kingdom,2025-09-20
501877,22024,RAINY LADIES BIRTHDAY CARD,12,0.42,17611.0,United Kingdom,2025-09-20
501877,21508,VINTAGE KID DOLLY CARD ,12,0.42,17611.0,United Kingdom,2025-09-20
501877,21731,RED TOADSTOOL LED NIGHT LIGHT,6,1.65,17611.0,United Kingdom,2025-09-20
501877,84507C,BLUE CIRCLES DESIGN MONKEY DOLL,2,2.55,17611.0,United Kingdom,2025-09-20
501877,22176,BLUE OWL SOFT TOY,2,2.95,17611.0,United Kingdom,2025-09-20
501877,22433,WATERING CAN GREEN DINOSAUR,2,1.95,17611.0,United Kingdom,2025-09-20
501877,22431,WATERING CAN BLUE ELEPHANT,2,1.95,17611.0,United Kingdom,2025-09-20
501877,M,Manual,50,1.0,17611.0,United Kingdom,2025-09-20
501877,22175,PINK OWL SOFT TOY,1,2.95,17611.0,United Kingdom,2025-09-20
501877,22175,PINK OWL SOFT TOY,1,2.95,17611.0,United Kingdom,2025-09-20
501877,21644,ASSORTED TUTTI FRUTTI HEART BOX,12,1.25,17611.0,United Kingdom,2025-09-20
501877,84247H,PACK/12 DECOUPAGE CARD,1,2.95,17611.0,United Kingdom,2025-09-20
501877,21213,PACK OF 72 SKULL CAKE CASES,24,0.55,17611.0,United Kingdom,2025-09-20
501877,21126,SET OF 6 GIRLS CELEBRATION CANDLES,12,1.25,17611.0,United Kingdom,2025-09-20
501877,22036,DINOSAUR BIRTHDAY CARD,12,0.42,17611.0,United Kingdom,2025-09-20
501877,22025,RING OF ROSES BIRTHDAY CARD,12,0.42,17611.0,United Kingdom,2025-09-20
501877,21975,PACK OF 60 DINOSAUR CAKE CASES,24,0.55,17611.0,United Kingdom,2025-09-20
501877,22029,SPACEBOY BIRTHDAY CARD,24,0.42,17611.0,United Kingdom,2025-09-20
C501878,M,Manual,-50,0.58,17611.0,United Kingdom,2025-09-20
501879,48138,DOOR MAT UNION FLAG,1,7.49,17472.0,United Kingdom,2025-09-20
501879,35965,FOLKART HEART NAPKIN RINGS,2,2.95,17472.0,United Kingdom,2025-09-20
501879,21907,I'M ON HOLIDAY METAL SIGN,1,2.1,17472.0,United Kingdom,2025-09-20
501879,22456,NATURAL SLATE CHALKBOARD LARGE ,1,4.95,17472.0,United Kingdom,2025-09-20
501879,21791,VINTAGE HEADS AND TAILS CARD GAME ,1,1.25,17472.0,United Kingdom,2025-09-20
501879,20674,GREEN SPOTTY BOWL,2,1.25,17472.0,United Kingdom,2025-09-20
501879,85214,TUB 24 PINK FLOWER PEGS,1,1.65,17472.0,United Kingdom,2025-09-20
501879,84510B,SET OF 4 FAIRY CAKES COASTERS ,1,1.25,17472.0,United Kingdom,2025-09-20
501879,22412,METAL SIGN NEIGHBOURHOOD WITCH ,1,2.1,17472.0,United Kingdom,2025-09-20
501879,22360,GLASS JAR ENGLISH CONFECTIONERY,1,2.95,17472.0,United Kingdom,2025-09-20
501879,21621,VINTAGE UNION JACK BUNTING,2,8.5,17472.0,United Kingdom,2025-09-20
501879,22488,NATURAL SLATE RECTANGLE CHALKBOARD,5,1.65,17472.0,United Kingdom,2025-09-20
501879,21868,POTTING SHED TEA MUG,2,1.25,17472.0,United Kingdom,2025-09-20
501879,21869,POTTING SHED COFFEE MUG,2,1.25,17472.0,United Kingdom,2025-09-20
501879,21873,IF YOU CAN'T STAND THE HEAT MUG,1,1.25,17472.0,United Kingdom,2025-09-20
501879,84985A,SET OF 72 GREEN PAPER DOILIES,1,1.45,17472.0,United Kingdom,2025-09-20
501879,84459B,YELLOW METAL CHICKEN HEART ,6,1.49,17472.0,United Kingdom,2025-09-20
501879,21985,PACK OF 12 HEARTS DESIGN TISSUES ,6,0.29,17472.0,United Kingdom,2025-09-20
501879,21718,RED METAL BEACH SPADE ,4,1.25,17472.0,United Kingdom,2025-09-20
501879,22507,MEMO BOARD RETROSPOT  DESIGN,2,4.95,17472.0,United Kingdom,2025-09-20
501879,21523,DOOR MAT FANCY FONT HOME SWEET HOME,1,7.49,17472.0,United Kingdom,2025-09-20
501879,84988,SET OF 72 PINK HEART PAPER DOILIES,1,1.45,17472.0,United Kingdom,2025-09-20
501879,21896,POTTING SHED TWINE,1,2.1,17472.0,United Kingdom,2025-09-20
501879,22365,DOOR MAT RESPECTABLE HOUSE,1,7.49,17472.0,United Kingdom,2025-09-20
501879,48173C,DOOR MAT BLACK FLOCK ,1,7.49,17472.0,United Kingdom,2025-09-20
501879,22366,DOOR MAT AIRMAIL ,1,7.49,17472.0,United Kingdom,2025-09-20
501879,48129,DOOR MAT TOPIARY,1,7.49,17472.0,United Kingdom,2025-09-20
501879,21717,EASTER TIN BUCKET,3,2.55,17472.0,United Kingdom,2025-09-20
501879,21715,GIRLS VINTAGE TIN SEASIDE BUCKET,2,2.55,17472.0,United Kingdom,2025-09-20
501879,21716,BOYS VINTAGE TIN SEASIDE BUCKET,2,2.55,17472.0,United Kingdom,2025-09-20
501879,22161,HEART DECORATION RUSTIC HANGING ,6,0.65,17472.0,United Kingdom,2025-09-20
501879,22196,SMALL HEART MEASURING SPOONS,3,0.85,17472.0,United Kingdom,2025-09-20
501879,21383,PACK OF 12 STICKY BUNNIES,2,0.65,17472.0,United Kingdom,2025-09-20
501879,22251,BIRDHOUSE DECORATION MAGIC GARDEN,2,1.25,17472.0,United Kingdom,2025-09-20
