Invoice,StockCode,Description,Quantity,Price,Customer ID,Country,InvoiceDate
511287,21533,RETRO SPOT LARGE MILK JUG,1,4.95,14514.0,United Kingdom,2025-11-21
511287,21348,PINK SPOTS CHOCOLATE NESTING BOXES ,1,2.95,14514.0,United Kingdom,2025-11-21
511287,22070,SMALL RED RETROSPOT MUG IN BOX ,2,3.75,14514.0,United Kingdom,2025-11-21
511287,21974,SET OF 36 PAISLEY FLOWER DOILIES,3,1.45,14514.0,United Kingdom,2025-11-21
511287,21867,PINK UNION JACK  LUGGAGE TAG,4,1.25,14514.0,United Kingdom,2025-11-21
511287,21866,UNION JACK FLAG LUGGAGE TAG,4,1.25,14514.0,United Kingdom,2025-11-21
511287,21864,UNION JACK FLAG PASSPORT COVER ,4,2.1,14514.0,United Kingdom,2025-11-21
511287,85049A,TRADITIONAL CHRISTMAS RIBBONS,5,1.25,14514.0,United Kingdom,2025-11-21
511287,21078,SET/20 STRAWBERRY PAPER NAPKINS ,1,0.85,14514.0,United Kingdom,2025-11-21
511287,85049C,ROMANTIC PINKS RIBBONS ,5,1.25,14514.0,United Kingdom,2025-11-21
511287,85049D,BRIGHT BLUES RIBBONS ,5,1.25,14514.0,United Kingdom,2025-11-21
511287,85049H,URBAN BLACK RIBBONS ,2,1.25,14514.0,United Kingdom,2025-11-21
511287,85152,HAND OVER THE CHOCOLATE   SIGN ,1,2.1,14514.0,United Kingdom,2025-11-21
511287,22464,HANGING METAL HEART LANTERN,12,1.65,14514.0,United Kingdom,2025-11-21
511287,85049F,BABY BOOM RIBBONS ,5,1.25,14514.0,United Kingdom,2025-11-21
511287,22178,VICTORIAN GLASS HANGING T-LIGHT,6,1.25,14514.0,United Kingdom,2025-11-21
511287,84950,ASSORTED COLOUR T-LIGHT HOLDER,12,0.85,14514.0,United Kingdom,2025-11-21
511287,22423,REGENCY CAKESTAND 3 TIER,2,12.75,14514.0,United Kingdom,2025-11-21
511287,85049E,SCANDINAVIAN REDS RIBBONS,5,1.25,14514.0,United Kingdom,2025-11-21
511289,21668,RED STRIPE CERAMIC DRAWER KNOB,6,1.25,17611.0,United Kingdom,2025-11-21
511289,21889,WOODEN BOX OF DOMINOES,4,1.25,17611.0,United Kingdom,2025-11-21
511289,21790,VINTAGE SNAP CARDS,4,0.85,17611.0,United Kingdom,2025-11-21
511289,84836,ZINC METAL HEART DECORATION,12,1.25,17611.0,United Kingdom,2025-11-21
511289,84978,HANGING HEART JAR T-LIGHT HOLDER,6,1.25,17611.0,United Kingdom,2025-11-21
511289,21545,CERAMIC BIRDHOUSE BUTTERFLY SMALL,2,2.95,17611.0,United Kingdom,2025-11-21
511289,22718,CARD CAT AND TREE ,12,0.42,17611.0,United Kingdom,2025-11-21
511289,20762,GREEN FERN SKETCHBOOK ,2,3.75,17611.0,United Kingdom,2025-11-21
511289,22567,20 DOLLY PEGS RETROSPOT,6,1.25,17611.0,United Kingdom,2025-11-21
511289,20886,BOX OF 9 PEBBLE CANDLES,4,1.95,17611.0,United Kingdom,2025-11-21
511289,22528,GARDENERS KNEELING PAD,2,1.25,17611.0,United Kingdom,2025-11-21
511289,18098C,PORCELAIN BUTTERFLY OIL BURNER,2,2.95,17611.0,United Kingdom,2025-11-21
511289,21669,BLUE STRIPE CERAMIC DRAWER KNOB,6,1.25,17611.0,United Kingdom,2025-11-21
511289,21548,CERAMIC BIRDHOUSE FINCH BLUE ROOF,2,2.95,17611.0,United Kingdom,2025-11-21
511289,22717,CARD DOG AND BALL ,12,0.42,17611.0,United Kingdom,2025-11-21
511289,22214,CANDLE PLATE LACE WHITE,4,2.55,17611.0,United Kingdom,2025-11-21
511289,20766,GARDEN PATH SKETCHBOOK,2,3.75,17611.0,United Kingdom,2025-11-21
511289,22716,CARD CIRCUS PARADE,12,0.42,17611.0,United Kingdom,2025-11-21
511289,48116,DOOR MAT MULTICOLOUR STRIPE,2,7.49,17611.0,United Kingdom,2025-11-21
511289,48187,DOOR MAT NEW ENGLAND,2,7.49,17611.0,United Kingdom,2025-11-21
511289,48197,DOOR MAT BIRD ON THE WIRE,2,7.49,17611.0,United Kingdom,2025-11-21
511289,48189,DOOR MAT FRIENDSHIP ,2,7.49,17611.0,United Kingdom,2025-11-21
511289,21795,SET OF 3 BLUE STRIPE BASKET,2,12.75,17611.0,United Kingdom,2025-11-21
511289,20685,DOOR MAT RED SPOT,2,7.49,17611.0,United Kingdom,2025-11-21
511289,22469,HEART OF WICKER SMALL,2,1.65,17611.0,United Kingdom,2025-11-21
511289,21333,CLASSIC WHITE FRAME,2,2.95,17611.0,United Kingdom,2025-11-21
511288,22423,REGENCY CAKESTAND 3 TIER,4,12.75,15260.0,United Kingdom,2025-11-21
511289,20761,BLUE PAISLEY SKETCHBOOK,2,3.75,17611.0,United Kingdom,2025-11-21
511289,20764,ABSTRACT CIRCLES SKETCHBOOK ,2,3.75,17611.0,United Kingdom,2025-11-21
511289,22470,HEART OF WICKER LARGE,2,2.95,17611.0,United Kingdom,2025-11-21
511290,21381,MINI WOODEN HAPPY BIRTHDAY GARLAND,24,1.69,12937.0,United Kingdom,2025-11-21
511290,85041,SET/4 PINK ORCHID CANDLES IN BOWL,4,1.65,12937.0,United Kingdom,2025-11-21
511290,84972L,GIANT PINK HEART MEMO HOLDER,4,3.95,12937.0,United Kingdom,2025-11-21
511290,22188,BLACK HEART CARD HOLDER,4,3.95,12937.0,United Kingdom,2025-11-21
511290,22583,PACK OF 6 HANDBAG GIFT BOXES,1,2.55,12937.0,United Kingdom,2025-11-21
511290,22584,PACK OF 6 PANNETONE GIFT BOXES,1,2.55,12937.0,United Kingdom,2025-11-21
511290,22423,REGENCY CAKESTAND 3 TIER,1,12.75,12937.0,United Kingdom,2025-11-21
511290,21380,WOODEN HAPPY BIRTHDAY GARLAND,12,2.95,12937.0,United Kingdom,2025-11-21
511290,21983,PACK OF 12 BLUE PAISLEY TISSUES ,12,0.29,12937.0,United Kingdom,2025-11-21
511290,21981,PACK OF 12 WOODLAND TISSUES ,12,0.29,12937.0,United Kingdom,2025-11-21
511290,21982,PACK OF 12 SUKI TISSUES ,12,0.29,12937.0,United Kingdom,2025-11-21
511290,21984,PACK OF 12 PINK PAISLEY TISSUES ,12,0.29,12937.0,United Kingdom,2025-11-21
511290,21986,PACK OF 12 PINK SPOT TISSUES ,12,0.29,12937.0,United Kingdom,2025-11-21
511290,21985,PACK OF 12 HEARTS DESIGN TISSUES ,12,0.29,12937.0,United Kingdom,2025-11-21
511290,85040B,SET/4 BLUE FLOWER CANDLES IN BOWL,4,1.65,12937.0,United Kingdom,2025-11-21
511290,85123A,WHITE HANGING HEART T-LIGHT HOLDER,32,2.55,12937.0,United Kingdom,2025-11-21
511290,21980,PACK OF 12 RED SPOTTY TISSUES ,12,0.29,12937.0,United Kingdom,2025-11-21
511290,85040A,S/4 PINK FLOWER CANDLES IN BOWL,4,1.65,12937.0,United Kingdom,2025-11-21
511290,22498,WOODEN REGATTA BUNTING,4,5.95,12937.0,United Kingdom,2025-11-21
511290,82613A,"METAL SIGN,CUPCAKE SINGLE HOOK",20,1.25,12937.0,United Kingdom,2025-11-21
511290,20717,STRAWBERRY SHOPPER BAG,10,1.25,12937.0,United Kingdom,2025-11-21
511290,72741,GRAND CHOCOLATECANDLE,18,1.45,12937.0,United Kingdom,2025-11-21
511290,20718,RED SPOTTY SHOPPER BAG,10,1.25,12937.0,United Kingdom,2025-11-21
511290,20716,PARTY FOOD SHOPPER BAG,10,1.25,12937.0,United Kingdom,2025-11-21
511290,20725,LUNCH BAG RED SPOTTY,10,1.65,12937.0,United Kingdom,2025-11-21
511290,37503,TEA TIME CAKE STAND IN GIFT BOX,2,10.75,12937.0,United Kingdom,2025-11-21
511290,20727,LUNCH BAG  BLACK SKULL.,10,1.65,12937.0,United Kingdom,2025-11-21
511290,20728,LUNCH BAG CARS BLUE,10,1.65,12937.0,United Kingdom,2025-11-21
511290,22382,LUNCH BAG SPACEBOY DESIGN ,10,1.65,12937.0,United Kingdom,2025-11-21
511290,22383,LUNCH BAG SUKI  DESIGN ,10,1.65,12937.0,United Kingdom,2025-11-21
511290,20726,LUNCH BAG WOODLAND,10,1.65,12937.0,United Kingdom,2025-11-21
511290,21621,VINTAGE UNION JACK BUNTING,2,8.5,12937.0,United Kingdom,2025-11-21
511290,21733,RED HANGING HEART T-LIGHT HOLDER,10,2.95,12937.0,United Kingdom,2025-11-21
511290,85061W,WHITE JEWELLED HEART DECORATION,24,0.85,12937.0,United Kingdom,2025-11-21
511290,84971S,SMALL HEART FLOWERS HOOK ,24,0.85,12937.0,United Kingdom,2025-11-21
511290,22384,LUNCH BAG PINK RETROSPOT,10,1.65,12937.0,United Kingdom,2025-11-21
511291,21906,PHARMACIE FIRST AID TIN,1,6.75,15872.0,United Kingdom,2025-11-21
511291,35471A,SET OF 3 BIRD L.BLUE FEATHER,3,1.25,15872.0,United Kingdom,2025-11-21
511291,72351A,SET/6 TURQUOISE BUTTERFLY T-LIGHTS,1,2.1,15872.0,United Kingdom,2025-11-21
511291,72351B,SET/6 PINK  BUTTERFLY T-LIGHTS,1,2.1,15872.0,United Kingdom,2025-11-21
511291,22358,KINGS CHOICE TEA CADDY ,1,2.95,15872.0,United Kingdom,2025-11-21
511291,22435,SET OF 9 HEART SHAPED BALLOONS,20,1.25,15872.0,United Kingdom,2025-11-21
511291,35471D,SET OF 3 BIRD LIGHT PINK FEATHER ,3,1.25,15872.0,United Kingdom,2025-11-21
511291,21445,12 PINK ROSE PEG PLACE SETTINGS,2,1.25,15872.0,United Kingdom,2025-11-21
511291,22030,SWALLOWS GREETING CARD,12,0.42,15872.0,United Kingdom,2025-11-21
511291,21200,MULTICOLOUR HONEYCOMB PAPER GARLAND,6,1.65,15872.0,United Kingdom,2025-11-21
511291,20828,GLITTER BUTTERFLY CLIPS,20,2.55,15872.0,United Kingdom,2025-11-21
511291,20615,BLUE SPOTTY PASSPORT COVER,2,2.1,15872.0,United Kingdom,2025-11-21
511291,21445,12 PINK ROSE PEG PLACE SETTINGS,2,1.25,15872.0,United Kingdom,2025-11-21
511292,21034,REX CASH+CARRY JUMBO SHOPPER,1,0.95,15164.0,United Kingdom,2025-11-21
511292,37482P,CUBIC MUG PINK POLKA DOT,3,2.55,15164.0,United Kingdom,2025-11-21
511292,22079,RIBBON REEL HEARTS DESIGN ,1,1.65,15164.0,United Kingdom,2025-11-21
511292,22078,RIBBON REEL LACE DESIGN ,1,2.1,15164.0,United Kingdom,2025-11-21
511292,16258A,SWIRLY CIRCULAR RUBBERS IN BAG,2,0.42,15164.0,United Kingdom,2025-11-21
511292,21002,ROSE DU SUD DRAWSTRING BAG,1,4.25,15164.0,United Kingdom,2025-11-21
511292,84905,PINK BUTTERFLY CUSHION COVER ,1,4.95,15164.0,United Kingdom,2025-11-21
511292,21745,GAOLERS KEYS DECORATIVE GARDEN ,2,3.75,15164.0,United Kingdom,2025-11-21
511292,22561,WOODEN SCHOOL COLOURING SET,2,1.65,15164.0,United Kingdom,2025-11-21
511292,21000,ROSE DU SUD COSMETICS BAG,1,4.25,15164.0,United Kingdom,2025-11-21
511292,21001,ROSE DU SUD WASHBAG ,1,5.95,15164.0,United Kingdom,2025-11-21
511292,22513,DOORSTOP FOOTBALL DESIGN,1,3.75,15164.0,United Kingdom,2025-11-21
511292,22528,GARDENERS KNEELING PAD,2,1.25,15164.0,United Kingdom,2025-11-21
511292,21891,TRADITIONAL WOODEN SKIPPING ROPE,2,1.25,15164.0,United Kingdom,2025-11-21
511292,20839,FRENCH PAISLEY CUSHION COVER ,1,2.95,15164.0,United Kingdom,2025-11-21
511292,37495,FAIRY CAKE BIRTHDAY CANDLE SET,1,3.75,15164.0,United Kingdom,2025-11-21
511292,85061W,WHITE JEWELLED HEART DECORATION,3,0.85,15164.0,United Kingdom,2025-11-21
511292,22637,PIGGY BANK RETROSPOT ,1,2.55,15164.0,United Kingdom,2025-11-21
511292,20992,JAZZ HEARTS PURSE NOTEBOOK,6,0.85,15164.0,United Kingdom,2025-11-21
511292,22112,CHOCOLATE HOT WATER BOTTLE,2,4.95,15164.0,United Kingdom,2025-11-21
511292,82494L,WOODEN FRAME ANTIQUE WHITE ,1,2.95,15164.0,United Kingdom,2025-11-21
511292,82482,WOODEN PICTURE FRAME WHITE FINISH,1,2.55,15164.0,United Kingdom,2025-11-21
511292,22488,NATURAL SLATE RECTANGLE CHALKBOARD,2,1.65,15164.0,United Kingdom,2025-11-21
511292,20855,PINK PATCH PURSE BLUE HEART,2,1.65,15164.0,United Kingdom,2025-11-21
511292,20856,DENIM PATCH PURSE PINK BUTTERFLY,2,1.65,15164.0,United Kingdom,2025-11-21
511292,20854,BLUE PATCH PURSE PINK HEART,2,1.65,15164.0,United Kingdom,2025-11-21
511292,21754,HOME BUILDING BLOCK WORD,3,5.95,15164.0,United Kingdom,2025-11-21
511292,16235,RECYCLED PENCIL WITH RABBIT ERASER,6,0.21,15164.0,United Kingdom,2025-11-21
511292,20973,12 PENCIL SMALL TUBE WOODLAND,1,0.65,15164.0,United Kingdom,2025-11-21
511292,20974,12 PENCILS SMALL TUBE SKULL,3,0.65,15164.0,United Kingdom,2025-11-21
511292,20976,12 PENCILS SMALL TUBE POSY,1,0.65,15164.0,United Kingdom,2025-11-21
511292,22505,MEMO BOARD COTTAGE DESIGN,2,4.95,15164.0,United Kingdom,2025-11-21
511292,21755,LOVE BUILDING BLOCK WORD,2,5.95,15164.0,United Kingdom,2025-11-21
511292,20975,12 PENCILS SMALL TUBE RED SPOTTY,1,0.65,15164.0,United Kingdom,2025-11-21
511294,20750,RED/WHITE DOT MINI CASES,2,7.95,12829.0,United Kingdom,2025-11-21
511294,35968,FOLK ART METAL HEART T-LIGHT HOLDER,12,0.38,12829.0,United Kingdom,2025-11-21
511294,35967,FOLK ART METAL STAR T-LIGHT HOLDER,12,0.38,12829.0,United Kingdom,2025-11-21
511294,35957,SMALLFOLKART BAUBLE CHRISTMAS DEC,96,0.19,12829.0,United Kingdom,2025-11-21
511294,35951,FOLKART BAUBLE CHRISTMAS DECORATION,48,0.38,12829.0,United Kingdom,2025-11-21
511294,21217,RED SPOTTY ROUND CAKE TINS,1,9.95,12829.0,United Kingdom,2025-11-21
511294,22312,OFFICE MUG WARMER POLKADOT,2,4.95,12829.0,United Kingdom,2025-11-21
C511293,71477,COLOUR GLASS. STAR T-LIGHT HOLDER,-5,2.75,17588.0,United Kingdom,2025-11-21
C511293,21463,MIRRORED DISCO BALL ,-1,5.95,17588.0,United Kingdom,2025-11-21
C511293,79323P,PINK CHERRY LIGHTS,-1,5.45,17588.0,United Kingdom,2025-11-21
511294,21843,RED RETROSPOT CAKE STAND,1,10.95,12829.0,United Kingdom,2025-11-21
511295,84970L,SINGLE HEART ZINC T-LIGHT HOLDER,12,0.95,15551.0,United Kingdom,2025-11-21
511295,21655,HANGING RIDGE GLASS T-LIGHT HOLDER,1,1.69,15551.0,United Kingdom,2025-11-21
511295,21714,CITRONELLA CANDLE GARDEN POT,6,1.25,15551.0,United Kingdom,2025-11-21
511295,21114,LAVENDER SCENTED FABRIC HEART,5,1.25,15551.0,United Kingdom,2025-11-21
511295,22341,LOVE GARLAND PAINTED ZINC ,12,1.65,15551.0,United Kingdom,2025-11-21
511295,17165B,ASS COL LARGE SAND GECKO P'WEIGHT,3,1.05,15551.0,United Kingdom,2025-11-21
511295,84879,ASSORTED COLOUR BIRD ORNAMENT,16,1.69,15551.0,United Kingdom,2025-11-21
511295,20985,HEART CALCULATOR,1,1.25,15551.0,United Kingdom,2025-11-21
511295,22624,IVORY KITCHEN SCALES,1,8.5,15551.0,United Kingdom,2025-11-21
511295,82484,WOOD BLACK BOARD ANT WHITE FINISH,2,6.45,15551.0,United Kingdom,2025-11-21
511295,22027,TEA PARTY BIRTHDAY CARD,12,0.42,15551.0,United Kingdom,2025-11-21
511295,71459,HANGING JAM JAR T-LIGHT HOLDER,12,0.85,15551.0,United Kingdom,2025-11-21
511295,22168,ORGANISER WOOD ANTIQUE WHITE ,1,8.5,15551.0,United Kingdom,2025-11-21
511295,22171,3 HOOK PHOTO SHELF ANTIQUE WHITE,2,8.5,15551.0,United Kingdom,2025-11-21
511295,85160A,WHITE BIRD GARDEN DESIGN MUG,6,1.25,15551.0,United Kingdom,2025-11-21
511295,22170,PICTURE FRAME WOOD TRIPLE PORTRAIT,4,6.75,15551.0,United Kingdom,2025-11-21
511295,21545,CERAMIC BIRDHOUSE BUTTERFLY SMALL,1,2.95,15551.0,United Kingdom,2025-11-21
511295,22036,DINOSAUR BIRTHDAY CARD,12,0.42,15551.0,United Kingdom,2025-11-21
511295,22030,SWALLOWS GREETING CARD,12,0.42,15551.0,United Kingdom,2025-11-21
511295,85160B,BLACK BIRD GARDEN DESIGN MUG,6,1.25,15551.0,United Kingdom,2025-11-21
511295,22424,ENAMEL BREAD BIN CREAM,1,12.75,15551.0,United Kingdom,2025-11-21
511295,21548,CERAMIC BIRDHOUSE FINCH BLUE ROOF,1,2.95,15551.0,United Kingdom,2025-11-21
511295,21755,LOVE BUILDING BLOCK WORD,2,5.95,15551.0,United Kingdom,2025-11-21
511295,21754,HOME BUILDING BLOCK WORD,3,5.95,15551.0,United Kingdom,2025-11-21
511295,22167,"WALL MIRROR , DIAMANTE OVAL SHAPE",2,9.95,15551.0,United Kingdom,2025-11-21
511295,21114,LAVENDER SCENTED FABRIC HEART,5,1.25,15551.0,United Kingdom,2025-11-21
511295,22265,EASTER DECORATION NATURAL CHICK,7,0.65,15551.0,United Kingdom,2025-11-21
511295,10002,INFLATABLE POLITICAL GLOBE ,3,0.85,15551.0,United Kingdom,2025-11-21
511295,21877,HOME SWEET HOME MUG,6,1.25,15551.0,United Kingdom,2025-11-21
511295,22037,ROBOT BIRTHDAY CARD,12,0.42,15551.0,United Kingdom,2025-11-21
511295,44234,ASSORTED CIRCULAR MOBILE,1,0.21,15551.0,United Kingdom,2025-11-21
511295,16235,RECYCLED PENCIL WITH RABBIT ERASER,2,0.21,15551.0,United Kingdom,2025-11-21
511296,84879,ASSORTED COLOUR BIRD ORNAMENT,8,1.69,17040.0,United Kingdom,2025-11-21
511297,22551,PLASTERS IN TIN SPACEBOY,12,1.65,17101.0,United Kingdom,2025-11-21
511297,21358,TOAST ITS - HAPPY BIRTHDAY,12,1.25,17101.0,United Kingdom,2025-11-21
511297,21354,TOAST ITS - BEST MUM,12,1.25,17101.0,United Kingdom,2025-11-21
511297,21355,TOAST ITS - I LOVE YOU ,12,1.25,17101.0,United Kingdom,2025-11-21
511297,22556,PLASTERS IN TIN CIRCUS PARADE ,12,1.65,17101.0,United Kingdom,2025-11-21
511297,22528,GARDENERS KNEELING PAD,12,1.25,17101.0,United Kingdom,2025-11-21
511297,22622,BOX OF VINTAGE ALPHABET BLOCKS,2,9.95,17101.0,United Kingdom,2025-11-21
511297,22496,SET OF 2 ROUND TINS DUTCH CHEESE,6,2.95,17101.0,United Kingdom,2025-11-21
511297,22495,SET OF 2 ROUND TINS CAMEMBERT ,6,2.95,17101.0,United Kingdom,2025-11-21
511297,21462,"NURSERY A,B,C PAINTED LETTERS",2,6.75,17101.0,United Kingdom,2025-11-21
511298,21791,VINTAGE HEADS AND TAILS CARD GAME ,12,1.25,15260.0,United Kingdom,2025-11-21
511298,85150,LADIES & GENTLEMEN METAL SIGN,6,2.55,15260.0,United Kingdom,2025-11-21
511298,22413,METAL SIGN TAKE IT OR LEAVE IT ,6,2.95,15260.0,United Kingdom,2025-11-21
511298,21755,LOVE BUILDING BLOCK WORD,3,5.95,15260.0,United Kingdom,2025-11-21
511298,20978,36 PENCILS TUBE SKULLS,16,1.25,15260.0,United Kingdom,2025-11-21
511298,22188,BLACK HEART CARD HOLDER,4,3.95,15260.0,United Kingdom,2025-11-21
511298,21889,WOODEN BOX OF DOMINOES,12,1.25,15260.0,United Kingdom,2025-11-21
511298,21790,VINTAGE SNAP CARDS,12,0.85,15260.0,United Kingdom,2025-11-21
511298,84050,PINK HEART SHAPE EGG FRYING PAN,6,1.65,15260.0,United Kingdom,2025-11-21
511298,22469,HEART OF WICKER SMALL,24,1.65,15260.0,United Kingdom,2025-11-21
511298,21907,I'M ON HOLIDAY METAL SIGN,24,2.1,15260.0,United Kingdom,2025-11-21
511298,48189,DOOR MAT FRIENDSHIP ,2,7.49,15260.0,United Kingdom,2025-11-21
511298,20718,RED SPOTTY SHOPPER BAG,10,1.25,15260.0,United Kingdom,2025-11-21
511298,20685,DOOR MAT RED SPOT,2,7.49,15260.0,United Kingdom,2025-11-21
511298,21754,HOME BUILDING BLOCK WORD,12,5.95,15260.0,United Kingdom,2025-11-21
511298,22149,FELTCRAFT 6 FLOWER FRIENDS,6,2.1,15260.0,United Kingdom,2025-11-21
511298,85071C,"CHARLIE+LOLA""EXTREMELY BUSY"" SIGN",6,2.55,15260.0,United Kingdom,2025-11-21
511299,15058A,BLUE WHITE SPOTS GARDEN PARASOL,1,7.95,18037.0,United Kingdom,2025-11-21
511300,21122,SET/10 PINK SPOTTY PARTY CANDLES,1,1.25,16788.0,United Kingdom,2025-11-21
511300,22427,ENAMEL FLOWER JUG CREAM,1,5.95,16788.0,United Kingdom,2025-11-21
511300,22425,ENAMEL COLANDER CREAM,1,4.95,16788.0,United Kingdom,2025-11-21
511300,22429,ENAMEL MEASURING JUG CREAM,1,4.25,16788.0,United Kingdom,2025-11-21
511300,84755,COLOUR GLASS T-LIGHT HOLDER HANGING,4,0.65,16788.0,United Kingdom,2025-11-21
511300,22217,T-LIGHT HOLDER HANGING LACE,2,1.25,16788.0,United Kingdom,2025-11-21
511300,22465,HANGING METAL STAR LANTERN,2,1.65,16788.0,United Kingdom,2025-11-21
511300,22464,HANGING METAL HEART LANTERN,2,1.65,16788.0,United Kingdom,2025-11-21
511300,21121,SET/10 RED SPOTTY PARTY CANDLES,1,1.25,16788.0,United Kingdom,2025-11-21
511300,84815,SET OF 3 DANISH ROSE PLANTERS,1,4.25,16788.0,United Kingdom,2025-11-21
511300,21124,SET/10 BLUE SPOTTY PARTY CANDLES,1,1.25,16788.0,United Kingdom,2025-11-21
511300,21983,PACK OF 12 BLUE PAISLEY TISSUES ,2,0.29,16788.0,United Kingdom,2025-11-21
511300,22521,CHILDS GARDEN TROWEL PINK,1,0.85,16788.0,United Kingdom,2025-11-21
511300,22523,CHILDS GARDEN FORK PINK,1,0.85,16788.0,United Kingdom,2025-11-21
511300,84405A,S/3 PINK COL METAL BASKET W HANDLE,1,12.75,16788.0,United Kingdom,2025-11-21
511300,22305,COFFEE MUG PINK PAISLEY DESIGN,1,2.55,16788.0,United Kingdom,2025-11-21
511300,84832,ZINC WILLIE WINKIE  CANDLE STICK,4,0.85,16788.0,United Kingdom,2025-11-21
511300,84856L,LARGE TAHITI BEACH BAG,1,5.95,16788.0,United Kingdom,2025-11-21
511300,84856S,SMALL TAHITI BEACH BAG,1,4.65,16788.0,United Kingdom,2025-11-21
511300,82494L,WOODEN FRAME ANTIQUE WHITE ,1,2.95,16788.0,United Kingdom,2025-11-21
511300,22444,GROW YOUR OWN PLANT IN A CAN ,4,1.25,16788.0,United Kingdom,2025-11-21
511300,85123A,WHITE HANGING HEART T-LIGHT HOLDER,10,2.95,16788.0,United Kingdom,2025-11-21
511300,21733,RED HANGING HEART T-LIGHT HOLDER,3,2.95,16788.0,United Kingdom,2025-11-21
511300,84673A,PINK FLY SWAT,4,0.65,16788.0,United Kingdom,2025-11-21
511300,22302,COFFEE MUG PEARS  DESIGN,1,2.55,16788.0,United Kingdom,2025-11-21
511300,22568,FELTCRAFT CUSHION OWL,2,3.75,16788.0,United Kingdom,2025-11-21
511300,22304,COFFEE MUG BLUE PAISLEY DESIGN,1,2.55,16788.0,United Kingdom,2025-11-21
511300,82482,WOODEN PICTURE FRAME WHITE FINISH,1,2.55,16788.0,United Kingdom,2025-11-21
511300,85099F,JUMBO BAG STRAWBERRY,1,1.95,16788.0,United Kingdom,2025-11-21
511300,47566,PARTY BUNTING,3,4.65,16788.0,United Kingdom,2025-11-21
511300,22271,FELTCRAFT DOLL ROSIE,1,2.95,16788.0,United Kingdom,2025-11-21
511300,22569,FELTCRAFT CUSHION BUTTERFLY,1,3.75,16788.0,United Kingdom,2025-11-21
511300,22470,HEART OF WICKER LARGE,1,2.95,16788.0,United Kingdom,2025-11-21
511300,22470,HEART OF WICKER LARGE,1,2.95,16788.0,United Kingdom,2025-11-21
511300,21166,COOK WITH WINE METAL SIGN ,1,1.95,16788.0,United Kingdom,2025-11-21
511300,21175,GIN + TONIC DIET METAL SIGN,1,2.1,16788.0,United Kingdom,2025-11-21
511300,22413,METAL SIGN TAKE IT OR LEAVE IT ,1,2.95,16788.0,United Kingdom,2025-11-21
511300,82551,LAUNDRY 15C METAL SIGN,2,1.25,16788.0,United Kingdom,2025-11-21
511300,82552,WASHROOM METAL SIGN,2,1.25,16788.0,United Kingdom,2025-11-21
511300,85152,HAND OVER THE CHOCOLATE   SIGN ,1,2.1,16788.0,United Kingdom,2025-11-21
511300,82582,AREA PATROLLED METAL SIGN,2,2.1,16788.0,United Kingdom,2025-11-21
511300,21469,POLKA DOT RAFFIA FOOD COVER,2,3.75,16788.0,United Kingdom,2025-11-21
511300,22185,SLATE TILE NATURAL HANGING,1,1.65,16788.0,United Kingdom,2025-11-21
511300,37509,NEW ENGLAND MUG W GIFT BOX,1,2.55,16788.0,United Kingdom,2025-11-21
511300,37502,TEA TIME MUG IN GIFT BOX,1,2.95,16788.0,United Kingdom,2025-11-21
511300,22115,METAL SIGN EMPIRE TEA,1,2.95,16788.0,United Kingdom,2025-11-21
511300,21872,GLAMOROUS  MUG,1,1.25,16788.0,United Kingdom,2025-11-21
511300,21876,POTTERING MUG,1,1.25,16788.0,United Kingdom,2025-11-21
511300,21877,HOME SWEET HOME MUG,1,1.25,16788.0,United Kingdom,2025-11-21
511300,37370,RETRO COFFEE MUGS ASSORTED,3,1.25,16788.0,United Kingdom,2025-11-21
511300,22303,COFFEE MUG APPLES DESIGN,1,2.55,16788.0,United Kingdom,2025-11-21
511300,22275,WEEKEND BAG VINTAGE ROSE PAISLEY,1,8.5,16788.0,United Kingdom,2025-11-21
511300,85062,PEARL CRYSTAL PUMPKIN T-LIGHT HLDR,2,1.65,16788.0,United Kingdom,2025-11-21
511300,22276,WASH BAG VINTAGE ROSE PAISLEY,1,2.55,16788.0,United Kingdom,2025-11-21
511300,82616C,MIDNIGHT GLAMOUR SCARF KNITTING KIT,1,2.95,16788.0,United Kingdom,2025-11-21
511300,82616B,FRAPPUCINO SCARF KNITTING KIT,1,2.95,16788.0,United Kingdom,2025-11-21
511300,21704,BAG 250g SWIRLY MARBLES,1,0.85,16788.0,United Kingdom,2025-11-21
511300,22150,3 STRIPEY MICE FELTCRAFT,1,1.95,16788.0,United Kingdom,2025-11-21
511300,40018F,CHERRY DESIGN PAPERLANTERNS,3,1.95,16788.0,United Kingdom,2025-11-21
511300,48138,DOOR MAT UNION FLAG,1,7.49,16788.0,United Kingdom,2025-11-21
511300,48187,DOOR MAT NEW ENGLAND,1,7.49,16788.0,United Kingdom,2025-11-21
511300,46776C,WOVEN FROST CUSHION COVER,1,4.95,16788.0,United Kingdom,2025-11-21
511300,22383,LUNCH BAG SUKI  DESIGN ,1,1.65,16788.0,United Kingdom,2025-11-21
511300,20725,LUNCH BAG RED SPOTTY,1,1.65,16788.0,United Kingdom,2025-11-21
511300,22517,CHILDS GARDEN RAKE PINK,1,2.1,16788.0,United Kingdom,2025-11-21
511300,22516,CHILDS GARDEN RAKE BLUE,1,2.1,16788.0,United Kingdom,2025-11-21
511300,82484,WOOD BLACK BOARD ANT WHITE FINISH,2,6.45,16788.0,United Kingdom,2025-11-21
511300,22514,CHILDS GARDEN SPADE BLUE,1,2.1,16788.0,United Kingdom,2025-11-21
511300,22515,CHILDS GARDEN SPADE PINK,1,2.1,16788.0,United Kingdom,2025-11-21
511300,22384,LUNCH BAG PINK RETROSPOT,1,1.65,16788.0,United Kingdom,2025-11-21
511300,22379,RECYCLING BAG RETROSPOT ,1,2.1,16788.0,United Kingdom,2025-11-21
511300,22381,TOY TIDY PINK RETROSPOT  ,1,2.1,16788.0,United Kingdom,2025-11-21
511300,22411,JUMBO SHOPPER VINTAGE RED PAISLEY,1,1.95,16788.0,United Kingdom,2025-11-21
511300,21931,JUMBO STORAGE BAG SUKI,1,1.95,16788.0,United Kingdom,2025-11-21
511300,85099B,JUMBO BAG RED RETROSPOT,1,1.95,16788.0,United Kingdom,2025-11-21
511300,21795,SET OF 3 BLUE STRIPE BASKET,1,12.75,16788.0,United Kingdom,2025-11-21
511300,21796,SET OF 3 RED STRIPE BASKETS,1,12.75,16788.0,United Kingdom,2025-11-21
511300,82615,PINK MARSHMALLOW SCARF KNITTING KIT,1,2.95,16788.0,United Kingdom,2025-11-21
511300,21519,GIN & TONIC DIET GREETING CARD ,12,0.42,16788.0,United Kingdom,2025-11-21
511300,21703,BAG 125g SWIRLY MARBLES,3,0.42,16788.0,United Kingdom,2025-11-21
511300,22149,FELTCRAFT 6 FLOWER FRIENDS,1,2.1,16788.0,United Kingdom,2025-11-21
511300,84997D,PINK 3 PIECE MINI DOTS CUTLERY SET,1,3.75,16788.0,United Kingdom,2025-11-21
511300,84997C,BLUE 3 PIECE MINI DOTS CUTLERY SET,1,3.75,16788.0,United Kingdom,2025-11-21
511300,79029,GLASS HONEYPOT WASP CATCHER,3,1.95,16788.0,United Kingdom,2025-11-21
511300,21985,PACK OF 12 HEARTS DESIGN TISSUES ,2,0.29,16788.0,United Kingdom,2025-11-21
511300,21984,PACK OF 12 PINK PAISLEY TISSUES ,2,0.29,16788.0,United Kingdom,2025-11-21
511300,22386,JUMBO BAG PINK WITH WHITE SPOTS,1,1.95,16788.0,United Kingdom,2025-11-21
511300,22149,FELTCRAFT 6 FLOWER FRIENDS,1,2.1,16788.0,United Kingdom,2025-11-21
511300,21926,RED/CREAM STRIPE CUSHION COVER ,1,1.25,16788.0,United Kingdom,2025-11-21
511300,21925,UNION STRIPE CUSHION COVER ,2,1.25,16788.0,United Kingdom,2025-11-21
511300,21626,VINTAGE UNION JACK PENNANT,3,1.95,16788.0,United Kingdom,2025-11-21
511300,22612,TEA COSY VINTAGE UNION JACK,1,3.75,16788.0,United Kingdom,2025-11-21
511300,22611,VINTAGE UNION JACK SHOPPING BAG,1,4.95,16788.0,United Kingdom,2025-11-21
511300,20726,LUNCH BAG WOODLAND,1,1.65,16788.0,United Kingdom,2025-11-21
511300,22645,CERAMIC HEART FAIRY CAKE MONEY BANK,1,1.45,16788.0,United Kingdom,2025-11-21
511300,22646,CERAMIC STRAWBERRY CAKE MONEY BANK,1,1.45,16788.0,United Kingdom,2025-11-21
511300,84949,SILVER HANGING T-LIGHT HOLDER,2,1.65,16788.0,United Kingdom,2025-11-21
511300,79532,MOSAIC GLASS BALL CANDLEHOLDER,2,1.25,16788.0,United Kingdom,2025-11-21
511300,22277,COSMETIC BAG VINTAGE ROSE PAISLEY,1,2.1,16788.0,United Kingdom,2025-11-21
511300,22520,CHILDS GARDEN TROWEL BLUE ,1,0.85,16788.0,United Kingdom,2025-11-21
511300,22522,CHILDS GARDEN FORK BLUE ,1,0.85,16788.0,United Kingdom,2025-11-21
511300,20971,PINK BLUE FELT CRAFT TRINKET BOX,2,1.25,16788.0,United Kingdom,2025-11-21
511300,22273,FELTCRAFT DOLL MOLLY,1,2.95,16788.0,United Kingdom,2025-11-21
511300,22274,FELTCRAFT DOLL EMILY,1,2.95,16788.0,United Kingdom,2025-11-21
511300,21624,VINTAGE UNION JACK DOORSTOP,1,5.95,16788.0,United Kingdom,2025-11-21
511301,22583,PACK OF 6 HANDBAG GIFT BOXES,1,2.55,14871.0,United Kingdom,2025-11-21
511301,22585,PACK OF 6 BIRDY GIFT TAGS,2,1.25,14871.0,United Kingdom,2025-11-21
511301,21889,WOODEN BOX OF DOMINOES,2,1.25,14871.0,United Kingdom,2025-11-21
511301,22131,FOOD CONTAINER SET 3 LOVE HEART ,1,1.95,14871.0,United Kingdom,2025-11-21
511301,22047,EMPIRE GIFT WRAP,25,0.42,14871.0,United Kingdom,2025-11-21
511301,22428,ENAMEL FIRE BUCKET CREAM,2,6.95,14871.0,United Kingdom,2025-11-21
511301,21314,SMALL GLASS HEART TRINKET POT,4,2.1,14871.0,United Kingdom,2025-11-21
