Invoice,StockCode,Description,Quantity,Price,Customer ID,Country,InvoiceDate
494870,20990,SPRING FLOWER CHOPSTICKS SET/5,1,1.95,15998.0,United Kingdom,2025-07-30
494870,21647,ASSORTED TUTTI FRUTTI LARGE PURSE,6,2.1,15998.0,United Kingdom,2025-07-30
494870,20864,DENIM PATCH PENCIL CASE BUTTERFLY,1,2.1,15998.0,United Kingdom,2025-07-30
494870,20862,PINK PATCH PENCIL CASE BLUE HEART,1,2.1,15998.0,United Kingdom,2025-07-30
494870,20856,DENIM PATCH PURSE PINK BUTTERFLY,1,1.65,15998.0,United Kingdom,2025-07-30
494870,20855,PINK PATCH PURSE BLUE HEART,1,1.65,15998.0,United Kingdom,2025-07-30
494870,20989,URBAN CHIC CHOPSTICKS SET/5,1,1.95,15998.0,United Kingdom,2025-07-30
494870,20857,BLUE ROSE PATCH PURSE PINK BUTTERFL,1,1.65,15998.0,United Kingdom,2025-07-30
494870,85024C,PINK SMALL JEWELLED PHOTOFRAME,2,1.65,15998.0,United Kingdom,2025-07-30
494870,20832,RED FLOCK LOVE HEART PHOTO FRAME,6,0.85,15998.0,United Kingdom,2025-07-30
494870,84559B,3D SHEET OF CAT STICKERS,2,0.85,15998.0,United Kingdom,2025-07-30
494870,22414,DOORMAT NEIGHBOURHOOD WITCH ,1,6.75,15998.0,United Kingdom,2025-07-30
494870,22365,DOORMAT RESPECTABLE HOUSE,1,6.75,15998.0,United Kingdom,2025-07-30
494870,48173C,DOOR MAT BLACK FLOCK ,1,6.75,15998.0,United Kingdom,2025-07-30
494870,48138,DOOR MAT UNION FLAG,2,6.75,15998.0,United Kingdom,2025-07-30
494870,21644,ASSORTED TUTTI FRUTTI HEART BOX,6,1.25,15998.0,United Kingdom,2025-07-30
494870,21833,CAMOUFLAGE LED TORCH,6,1.69,15998.0,United Kingdom,2025-07-30
494870,22290,STANDING METAL RABBIT WITH EGG,1,2.1,15998.0,United Kingdom,2025-07-30
494870,22209,WOOD STAMP SET HAPPY BIRTHDAY,2,1.65,15998.0,United Kingdom,2025-07-30
494870,22210,WOOD STAMP SET BEST WISHES,2,1.65,15998.0,United Kingdom,2025-07-30
494870,21380,WOODEN HAPPY BIRTHDAY GARLAND,1,2.95,15998.0,United Kingdom,2025-07-30
494870,21381,MINI WOODEN HAPPY BIRTHDAY GARLAND,2,1.69,15998.0,United Kingdom,2025-07-30
494870,16235,RECYCLED PENCIL WITH RABBIT ERASER,12,0.21,15998.0,United Kingdom,2025-07-30
494870,22270,HAPPY EASTER HANGING DECORATION,2,3.75,15998.0,United Kingdom,2025-07-30
494870,22269,EGG CUP NATURAL CHICKEN,1,1.25,15998.0,United Kingdom,2025-07-30
494870,47590A,BLUE HAPPY BIRTHDAY BUNTING,1,5.45,15998.0,United Kingdom,2025-07-30
494870,22366,DOORMAT AIRMAIL ,1,6.75,15998.0,United Kingdom,2025-07-30
494870,21638,ASSORTED TUTTI FRUTTI NOTEBOOK,6,2.1,15998.0,United Kingdom,2025-07-30
494870,20703,BLUE PADDED SOFT MOBILE,1,4.25,15998.0,United Kingdom,2025-07-30
494870,21438,TUB 24 HANGING EASTER EGGS SPOTTY,1,3.75,15998.0,United Kingdom,2025-07-30
494870,21437,24 HANGING EASTER EGGS FLORAL TUB,1,3.75,15998.0,United Kingdom,2025-07-30
494870,21380,WOODEN HAPPY BIRTHDAY GARLAND,1,2.95,15998.0,United Kingdom,2025-07-30
494870,37424,WHITE WITH BLACK CATS MUG,6,0.85,15998.0,United Kingdom,2025-07-30
494870,37503,TEA TIME CAKE STAND IN GIFT BOX,1,10.75,15998.0,United Kingdom,2025-07-30
494870,47590B,PINK HAPPY BIRTHDAY BUNTING,2,5.45,15998.0,United Kingdom,2025-07-30
494870,22300,COFFEE MUG DOG + BALL DESIGN,3,2.55,15998.0,United Kingdom,2025-07-30
494870,21458,2 PICTURE BOOK EGGS EASTER BUNNY,1,1.25,15998.0,United Kingdom,2025-07-30
494870,21457,2 PICTURE BOOK EGGS EASTER DUCKS,1,1.25,15998.0,United Kingdom,2025-07-30
494870,21355,TOAST ITS - I LOVE YOU ,3,1.25,15998.0,United Kingdom,2025-07-30
494870,22302,COFFEE MUG PEARS  DESIGN,2,2.55,15998.0,United Kingdom,2025-07-30
494870,22303,COFFEE MUG APPLES DESIGN,2,2.55,15998.0,United Kingdom,2025-07-30
494870,71143,SILVER BOOK MARK WITH BEADS,3,0.85,15998.0,United Kingdom,2025-07-30
494870,22301,COFFEE MUG CAT + BIRD DESIGN,3,2.55,15998.0,United Kingdom,2025-07-30
494870,21224,SET/4 SKULL BADGES,10,1.25,15998.0,United Kingdom,2025-07-30
494870,21876,POTTERING MUG,1,1.25,15998.0,United Kingdom,2025-07-30
494870,21541,DINOSAURS WATER TRANSFER TATTOOS ,6,0.85,15998.0,United Kingdom,2025-07-30
494870,85049B,LUSH GREENS RIBBONS,1,1.25,15998.0,United Kingdom,2025-07-30
494870,85049E,SCANDINAVIAN REDS RIBBONS,2,1.25,15998.0,United Kingdom,2025-07-30
494870,85049F,BABY BOOM RIBBONS ,1,1.25,15998.0,United Kingdom,2025-07-30
494870,21544,SKULLS  WATER TRANSFER TATTOOS ,8,0.85,15998.0,United Kingdom,2025-07-30
494870,85049H,URBAN BLACK RIBBONS ,1,1.25,15998.0,United Kingdom,2025-07-30
494870,85049D,BRIGHT BLUES RIBBONS ,1,1.25,15998.0,United Kingdom,2025-07-30
494870,22074,6 RIBBONS SHIMMERING PINKS ,1,1.65,15998.0,United Kingdom,2025-07-30
494870,85049G,CHOCOLATE BOX RIBBONS ,1,1.25,15998.0,United Kingdom,2025-07-30
494870,21830,ASSORTED CREEPY CRAWLIES,24,0.42,15998.0,United Kingdom,2025-07-30
494870,21827,EIGHT PIECE CREEPY CRAWLIE SET,4,1.25,15998.0,United Kingdom,2025-07-30
494870,21390,FILIGRIS HEART WITH BUTTERFLY,7,1.25,15998.0,United Kingdom,2025-07-30
494870,22334,DINOSAUR PARTY BAG + STICKER SET,2,1.65,15998.0,United Kingdom,2025-07-30
494870,22332,SKULLS PARTY BAG + STICKER SET,4,1.65,15998.0,United Kingdom,2025-07-30
494870,22333,RETRO SPORT PARTY BAG + STICKER SET,4,1.65,15998.0,United Kingdom,2025-07-30
494870,20865,PATCHWORK PENCIL CASE BUTTERFLY ,1,2.1,15998.0,United Kingdom,2025-07-30
494871,21832,CHOCOLATE CALCULATOR,12,1.65,17706.0,United Kingdom,2025-07-30
494871,84247G,"DECOUPAGE,GREETING CARD,",12,0.42,17706.0,United Kingdom,2025-07-30
494871,22277,COSMETIC BAG VINTAGE ROSE PAISLEY,12,2.1,17706.0,United Kingdom,2025-07-30
494871,22276,WASH BAG VINTAGE ROSE PAISLEY,6,2.55,17706.0,United Kingdom,2025-07-30
494871,22076,6 RIBBONS EMPIRE  ,12,1.65,17706.0,United Kingdom,2025-07-30
494871,22275,WEEKEND BAG VINTAGE ROSE PAISLEY,6,8.5,17706.0,United Kingdom,2025-07-30
494871,22358,KINGS CHOICE TEA CADDY ,6,2.95,17706.0,United Kingdom,2025-07-30
494871,21304,ARCHED GREY MIRROR,6,12.75,17706.0,United Kingdom,2025-07-30
494871,21875,KINGS CHOICE MUG,36,1.25,17706.0,United Kingdom,2025-07-30
494871,22278,OVERNIGHT BAG VINTAGE ROSE PAISLEY,6,4.95,17706.0,United Kingdom,2025-07-30
494871,21758,VINTAGE SHELLS PRINT,4,6.45,17706.0,United Kingdom,2025-07-30
494871,21674,RIDGED GLASS PENDANT LAMPSHADE,6,16.95,17706.0,United Kingdom,2025-07-30
494871,21159,MOODY BOY  DOOR HANGER ,12,1.45,17706.0,United Kingdom,2025-07-30
494871,21757,LIGHTHOUSE PRINTED METAL SIGN,4,4.95,17706.0,United Kingdom,2025-07-30
494871,72008,FROSTED BOX 9 WHITE T-LIGHT CANDLES,36,0.42,17706.0,United Kingdom,2025-07-30
494871,21276,TWO EMBOSSED HEART MINI DRAWERS,6,6.95,17706.0,United Kingdom,2025-07-30
494871,84791,GINGHAM HEART DECORATION,12,2.95,17706.0,United Kingdom,2025-07-30
494871,22212,FOUR HOOK  WHITE LOVEBIRDS,12,2.1,17706.0,United Kingdom,2025-07-30
494871,21644,ASSORTED TUTTI FRUTTI HEART BOX,36,1.25,17706.0,United Kingdom,2025-07-30
494871,21903,MAN FLU METAL SIGN,12,2.1,17706.0,United Kingdom,2025-07-30
494871,85152,HAND OVER THE CHOCOLATE   SIGN ,12,2.1,17706.0,United Kingdom,2025-07-30
494871,21495,SKULLS WRAP,50,0.42,17706.0,United Kingdom,2025-07-30
494871,21160,KEEP OUT GIRLS DOOR HANGER ,12,1.45,17706.0,United Kingdom,2025-07-30
494871,21910,WAY OUT METAL SIGN ,12,1.65,17706.0,United Kingdom,2025-07-30
494872,82001S,VINYL RECORD FRAME SILVER,2,3.75,14715.0,United Kingdom,2025-07-30
494872,21684,SMALL MEDINA STAMPED METAL BOWL ,24,0.85,14715.0,United Kingdom,2025-07-30
494872,21679,SKULLS  STICKERS,6,0.85,14715.0,United Kingdom,2025-07-30
494872,21681,GIANT MEDINA STAMPED METAL BOWL ,3,9.95,14715.0,United Kingdom,2025-07-30
494872,71053,WHITE METAL LANTERN,3,3.75,14715.0,United Kingdom,2025-07-30
494872,21876,POTTERING MUG,6,1.25,14715.0,United Kingdom,2025-07-30
494872,21137,BLACK RECORD COVER FRAME,2,3.75,14715.0,United Kingdom,2025-07-30
494872,22358,KINGS CHOICE TEA CADDY ,3,2.95,14715.0,United Kingdom,2025-07-30
494872,84976,RECTANGULAR SHAPED MIRROR,6,1.69,14715.0,United Kingdom,2025-07-30
494872,21559,STRAWBERRY LUNCHBOX WITH CUTLERY,2,2.55,14715.0,United Kingdom,2025-07-30
494872,22352,LUNCHBOX WITH CUTLERY RETROSPOT ,2,2.55,14715.0,United Kingdom,2025-07-30
494872,84975,HEART SHAPED MIRROR,6,1.69,14715.0,United Kingdom,2025-07-30
494872,22303,COFFEE MUG APPLES DESIGN,6,2.55,14715.0,United Kingdom,2025-07-30
494872,71053,WHITE METAL LANTERN,1,3.75,14715.0,United Kingdom,2025-07-30
494872,21683,MEDIUM MEDINA STAMPED METAL BOWL ,6,2.95,14715.0,United Kingdom,2025-07-30
494872,84966A,PINK KASHMIRI BOXED MIRROR,3,20.0,14715.0,United Kingdom,2025-07-30
494872,84966B,BLUE KASHMIRI BOXED MIRROR,3,20.0,14715.0,United Kingdom,2025-07-30
494872,21949,SET OF 6 STRAWBERRY CHOPSTICKS,1,1.25,14715.0,United Kingdom,2025-07-30
494873,21035,SET/2 RED SPOTTY TEA TOWELS ,6,2.95,12589.0,France,2025-07-30
494873,22138,BAKING SET 9 PIECE RETROSPOT ,3,4.95,12589.0,France,2025-07-30
494873,20754,RETRO RED SPOTTY WASHING UP GLOVES,6,2.1,12589.0,France,2025-07-30
494873,21156,RED SPOTTY CHILDS APRON,8,1.95,12589.0,France,2025-07-30
494873,22352,LUNCHBOX WITH CUTLERY RETROSPOT ,6,2.55,12589.0,France,2025-07-30
494873,21559,STRAWBERRY LUNCHBOX WITH CUTLERY,6,2.55,12589.0,France,2025-07-30
494873,21936,RED/WHITE SPOT PICNIC BAG,5,2.95,12589.0,France,2025-07-30
494873,21217,RED SPOTTY ROUND CAKE TINS,1,9.95,12589.0,France,2025-07-30
494873,20914,SET/5 RED SPOTTY LID GLASS BOWLS,6,2.95,12589.0,France,2025-07-30
494873,20977,36 PENCILS TUBE WOODLAND,16,1.25,12589.0,France,2025-07-30
494873,47570,ENGLISH ROSE TABLE CLOTH,2,10.65,12589.0,France,2025-07-30
494873,47503E,ASS FLORAL PRINT SCISSORS,12,1.25,12589.0,France,2025-07-30
494873,20979,36 PENCILS TUBE RED SPOTTY,16,1.25,12589.0,France,2025-07-30
494873,20978,36 PENCILS TUBE SKULLS,16,1.25,12589.0,France,2025-07-30
494873,21429,RED GINGHAM ROSE JEWELLERY BOX,8,1.65,12589.0,France,2025-07-30
494873,35645,VINTAGE BEAD PINK JEWEL BOX,4,4.25,12589.0,France,2025-07-30
494873,22139,RETRO SPOT TEA SET CERAMIC 11 PC ,3,4.95,12589.0,France,2025-07-30
494873,POST,POSTAGE,3,18.0,12589.0,France,2025-07-30
494873,21042,RED SPOTTY APRON ,3,5.95,12589.0,France,2025-07-30
494873,21153,RED SPOTTY TABLECLOTH ,2,10.65,12589.0,France,2025-07-30
494873,20963,APPLE BATH SPONGE,10,1.25,12589.0,France,2025-07-30
494873,20665,RED SPOTTY PURSE ,6,2.95,12589.0,France,2025-07-30
494873,20966,SANDWICH BATH SPONGE,10,1.25,12589.0,France,2025-07-30
494873,20716,PARTY FOOD SHOPPER BAG,10,1.25,12589.0,France,2025-07-30
494873,22356,"CHARLOTTE BAG , PINK/WHITE SPOTS",10,0.85,12589.0,France,2025-07-30
494873,20719,WOODLAND CHARLOTTE BAG,10,0.85,12589.0,France,2025-07-30
494873,20724,RED SPOTTY CHARLOTTE BAG,10,0.85,12589.0,France,2025-07-30
494873,16207B,PINK HEART RED HANDBAG,6,2.95,12589.0,France,2025-07-30
494873,21934,SKULL SHOULDER BAG,10,1.65,12589.0,France,2025-07-30
494873,21579,LOLITA  DESIGN  COTTON TOTE BAG,6,2.25,12589.0,France,2025-07-30
494873,21577,SAVE THE PLANET COTTON TOTE BAG,6,2.25,12589.0,France,2025-07-30
494873,21930,JUMBO STORAGE BAG SKULLS,10,1.95,12589.0,France,2025-07-30
494873,85099B,JUMBO BAG RED WHITE SPOTTY ,10,1.95,12589.0,France,2025-07-30
494873,20712,JUMBO BAG WOODLAND ANIMALS,10,1.95,12589.0,France,2025-07-30
494873,20750, RED/WHITE DOT MINI CASES,2,7.95,12589.0,France,2025-07-30
494873,21432,SET OF 3 CASES WOODLAND DESIGN,2,5.95,12589.0,France,2025-07-30
494873,20960,WATERMELON BATH SPONGE,10,1.25,12589.0,France,2025-07-30
494873,20661,BLUE SPOTTY PURSE ,6,2.95,12589.0,France,2025-07-30
494873,20682,RED SPOTTY CHILDS UMBRELLA,6,3.25,12589.0,France,2025-07-30
494873,20686,DOLLY MIXTURE CHILDREN'S UMBRELLA,6,3.25,12589.0,France,2025-07-30
494873,20681,PINK SPOTTY CHILDS UMBRELLA,6,3.25,12589.0,France,2025-07-30
494873,85014B,RED/WHITE DOTS RUFFLED UMBRELLA,3,5.95,12589.0,France,2025-07-30
494873,20718,RED SPOTTY SHOPPER BAG,10,1.25,12589.0,France,2025-07-30
494874,85183A,CHARLIE & LOLA WASTEPAPER BIN BLUE,48,1.25,16087.0,United Kingdom,2025-07-30
494874,21100,CHARLIE AND LOLA CHARLOTTE BAG,100,1.45,16087.0,United Kingdom,2025-07-30
494874,21137,BLACK RECORD COVER FRAME,24,3.39,16087.0,United Kingdom,2025-07-30
494874,85183B,CHARLIE & LOLA WASTEPAPER BIN FLORA,48,1.25,16087.0,United Kingdom,2025-07-30
494875,85123A,WHITE HANGING HEART T-LIGHT HOLDER,64,2.55,17511.0,United Kingdom,2025-07-30
494875,21165,BEWARE OF THE CAT METAL SIGN ,48,1.45,17511.0,United Kingdom,2025-07-30
494875,21624,VINTAGE UNION JACK DOORSTOP,20,4.95,17511.0,United Kingdom,2025-07-30
494875,85150,LADIES & GENTLEMEN METAL SIGN,48,2.1,17511.0,United Kingdom,2025-07-30
494875,82583,HOT BATHS METAL SIGN,72,1.69,17511.0,United Kingdom,2025-07-30
494875,21916,SET 12 RETRO WHITE CHALK STICKS,24,0.42,17511.0,United Kingdom,2025-07-30
494875,22053,EMPIRE DESIGN ROSETTE,10,1.25,17511.0,United Kingdom,2025-07-30
494875,21245,GREEN  SPOTTY PLATE ,96,1.45,17511.0,United Kingdom,2025-07-30
494875,37330,SPOTS MUG,48,1.65,17511.0,United Kingdom,2025-07-30
494875,21213,PACK OF 72 SKULL CAKE CASES,120,0.42,17511.0,United Kingdom,2025-07-30
494875,84991,60 TEATIME FAIRY CAKE CASES,120,0.42,17511.0,United Kingdom,2025-07-30
494875,22302,COFFEE MUG PEARS  DESIGN,36,2.1,17511.0,United Kingdom,2025-07-30
494875,84997D,PINK 3 PIECE MINI DOTS CUTLERY SET,72,3.39,17511.0,United Kingdom,2025-07-30
494875,84378,SET OF 3 HEART COOKIE CUTTERS,144,1.06,17511.0,United Kingdom,2025-07-30
494875,22309,TEA COSY RED  STRIPE,12,2.55,17511.0,United Kingdom,2025-07-30
494875,21535,RETRO SPOT SMALL MILK JUG,48,2.1,17511.0,United Kingdom,2025-07-30
494875,20750, RED/WHITE DOT MINI CASES,12,6.35,17511.0,United Kingdom,2025-07-30
494875,85099B,JUMBO BAG RED WHITE SPOTTY ,200,1.65,17511.0,United Kingdom,2025-07-30
494875,21154,RED SPOTTY OVEN GLOVE ,20,1.25,17511.0,United Kingdom,2025-07-30
494875,21592,RETRO SPOT  CIGAR BOX MATCHES ,144,1.06,17511.0,United Kingdom,2025-07-30
494875,46000S,POLYESTER FILLER PAD 40x40cm,25,1.45,17511.0,United Kingdom,2025-07-30
494875,22084,PAPER CHAIN KIT EMPIRE,40,2.55,17511.0,United Kingdom,2025-07-30
494875,84879,ASSORTED COLOUR BIRD ORNAMENT,160,1.45,17511.0,United Kingdom,2025-07-30
494875,84997C,BLUE 3 PIECE MINI DOTS CUTLERY SET,72,3.39,17511.0,United Kingdom,2025-07-30
494875,21754,HOME BUILDING BLOCK WORD,18,5.45,17511.0,United Kingdom,2025-07-30
494875,22136,LOVE HEART SOCK HANGER,96,1.45,17511.0,United Kingdom,2025-07-30
494875,21928,JUMBO BAG SCANDINAVIAN PAISLEY,100,1.65,17511.0,United Kingdom,2025-07-30
494875,21626,VINTAGE UNION JACK PENNANT,12,1.95,17511.0,United Kingdom,2025-07-30
494875,21899,"KEY FOB , GARAGE DESIGN",24,0.65,17511.0,United Kingdom,2025-07-30
494875,21428,SET3 BOOK BOX GREEN GINGHAM FLOWER ,16,3.75,17511.0,United Kingdom,2025-07-30
494875,20828,GLITTER BUTTERFLY CLIPS,48,2.1,17511.0,United Kingdom,2025-07-30
494875,22030,SWALLOWS GREETING CARD,72,0.36,17511.0,United Kingdom,2025-07-30
494875,21518,BANK ACCOUNT  GREETING  CARD ,72,0.36,17511.0,United Kingdom,2025-07-30
494875,21506,"FANCY FONT BIRTHDAY CARD, ",72,0.36,17511.0,United Kingdom,2025-07-30
494875,22026,BANQUET BIRTHDAY  CARD  ,72,0.36,17511.0,United Kingdom,2025-07-30
494875,84249D,FAIRY CAKE GREETINGS CARD,72,0.36,17511.0,United Kingdom,2025-07-30
494875,22027,TEA PARTY BIRTHDAY CARD,72,0.36,17511.0,United Kingdom,2025-07-30
494875,21504,SKULLS GREETING CARD,72,0.36,17511.0,United Kingdom,2025-07-30
494875,22035,VINTAGE CARAVAN GREETING CARD ,72,0.36,17511.0,United Kingdom,2025-07-30
494875,21507,"ELEPHANT, BIRTHDAY CARD, ",72,0.36,17511.0,United Kingdom,2025-07-30
494875,21930,JUMBO STORAGE BAG SKULLS,100,1.65,17511.0,United Kingdom,2025-07-30
494875,21509,COWBOYS AND INDIANS BIRTHDAY CARD ,72,0.36,17511.0,United Kingdom,2025-07-30
494875,85099F,JUMBO BAG STRAWBERRY,100,1.65,17511.0,United Kingdom,2025-07-30
494875,22270,HAPPY EASTER HANGING DECORATION,48,3.39,17511.0,United Kingdom,2025-07-30
494875,21124,SET/10 BLUE SPOTTY PARTY CANDLES,24,1.25,17511.0,United Kingdom,2025-07-30
494875,21931,JUMBO STORAGE BAG SUKI,100,1.65,17511.0,United Kingdom,2025-07-30
494875,21121,SET/10 RED SPOTTY PARTY CANDLES,24,1.25,17511.0,United Kingdom,2025-07-30
494875,22263,FELT EGG COSY LADYBIRD ,24,0.85,17511.0,United Kingdom,2025-07-30
494875,16235,RECYCLED PENCIL WITH RABBIT ERASER,120,0.21,17511.0,United Kingdom,2025-07-30
494875,22023,EMPIRE BIRTHDAY CARD,72,0.36,17511.0,United Kingdom,2025-07-30
494875,21122,SET/10 PINK SPOTTY PARTY CANDLES,24,1.25,17511.0,United Kingdom,2025-07-30
494875,22329,ROUND CONTAINER SET OF 5 RETROSPOT,48,1.45,17511.0,United Kingdom,2025-07-30
494876,21890,S/6 WOODEN SKITTLES IN COTTON BAG,30,2.95,15465.0,United Kingdom,2025-07-30
494876,85232D,SET/3 DECOUPAGE STACKING TINS,3,4.95,15465.0,United Kingdom,2025-07-30
494876,21756,BATH BUILDING BLOCK WORD,3,5.95,15465.0,United Kingdom,2025-07-30
494876,85232A,SET/3 POLKA DOT STACKING TINS,3,4.95,15465.0,United Kingdom,2025-07-30
494876,21260,FIRST AID TIN,6,3.25,15465.0,United Kingdom,2025-07-30
494878,21733,RED HANGING HEART T-LIGHT HOLDER,6,2.95,16596.0,United Kingdom,2025-07-30
494878,84580,MOUSE TOY WITH PINK T-SHIRT,4,3.75,16596.0,United Kingdom,2025-07-30
494878,85123A,WHITE HANGING HEART T-LIGHT HOLDER,6,2.95,16596.0,United Kingdom,2025-07-30
494878,21390,FILIGRIS HEART WITH BUTTERFLY,24,1.25,16596.0,United Kingdom,2025-07-30
494878,84029E,RED WOOLLY HOTTIE WHITE HEART.,4,3.75,16596.0,United Kingdom,2025-07-30
494878,37448,CERAMIC CAKE DESIGN SPOTTED MUG,12,1.49,16596.0,United Kingdom,2025-07-30
C494877,21238,RED SPOTTY CUP,-48,0.85,14113.0,United Kingdom,2025-07-30
494887,79341,WILLOW BRANCH LIGHTS.,9,6.75,14525.0,United Kingdom,2025-07-30
494887,21385,IVORY HANGING DECORATION  HEART,48,0.85,14525.0,United Kingdom,2025-07-30
494887,84839,SWEETHEART KEY CABINET,2,6.75,14525.0,United Kingdom,2025-07-30
494887,85123A,WHITE HANGING HEART T-LIGHT HOLDER,32,2.55,14525.0,United Kingdom,2025-07-30
494888,21656,RIDGED GLASS POSY VASE ,36,1.25,16027.0,United Kingdom,2025-07-30
494889,22358,KINGS CHOICE TEA CADDY ,1,2.95,14472.0,United Kingdom,2025-07-30
494889,84824,DANISH ROSE UMBRELLA STAND,1,15.95,14472.0,United Kingdom,2025-07-30
494889,84804A,CREAM DELPHINIUM ARTIFICIAL FLOWER,1,2.95,14472.0,United Kingdom,2025-07-30
494889,84800L,LARGE WHITE/PINK ROSE ART FLOWER,3,2.12,14472.0,United Kingdom,2025-07-30
494889,21728,METAL MEDINA LANTERN ,1,12.75,14472.0,United Kingdom,2025-07-30
494889,82483,WOOD 2 DRAWER CABINET WHITE FINISH,2,5.95,14472.0,United Kingdom,2025-07-30
494889,21324,HANGING MEDINA LANTERN SMALL,1,2.95,14472.0,United Kingdom,2025-07-30
494889,85123A,WHITE HANGING HEART T-LIGHT HOLDER,2,2.95,14472.0,United Kingdom,2025-07-30
494889,21755,LOVE BUILDING BLOCK WORD,2,5.95,14472.0,United Kingdom,2025-07-30
494889,21324,HANGING MEDINA LANTERN SMALL,1,2.95,14472.0,United Kingdom,2025-07-30
494889,82486,WOOD S/3 CABINET ANT WHITE FINISH,2,7.95,14472.0,United Kingdom,2025-07-30
494889,22156,HEART DECORATION WITH PEARLS ,4,0.85,14472.0,United Kingdom,2025-07-30
494889,21823,PAINTED METAL HEART WITH HOLLY BELL,4,1.45,14472.0,United Kingdom,2025-07-30
494889,22189,CREAM HEART CARD HOLDER,2,3.95,14472.0,United Kingdom,2025-07-30
494889,84884A,ANT WHITE WIRE HEART SPIRAL,2,3.95,14472.0,United Kingdom,2025-07-30
494889,85061W,WHITE JEWELLED HEART DECORATION,5,0.85,14472.0,United Kingdom,2025-07-30
494889,21174,POTTERING IN THE SHED METAL SIGN,3,1.95,14472.0,United Kingdom,2025-07-30
494889,35973,GERANIUM FOLKART HEART DECORATION,2,1.25,14472.0,United Kingdom,2025-07-30
494889,84459A,PINK METAL CHICKEN HEART ,1,1.49,14472.0,United Kingdom,2025-07-30
494889,84836,ZINC METAL HEART DECORATION,2,1.25,14472.0,United Kingdom,2025-07-30
494889,21179,NO JUNK MAIL METAL SIGN,1,1.25,14472.0,United Kingdom,2025-07-30
494889,21911,GARDEN METAL SIGN ,2,1.65,14472.0,United Kingdom,2025-07-30
494889,35973,GERANIUM FOLKART HEART DECORATION,2,1.25,14472.0,United Kingdom,2025-07-30
494889,22120,WELCOME  WOODEN BLOCK LETTERS,1,9.95,14472.0,United Kingdom,2025-07-30
494889,21823,PAINTED METAL HEART WITH HOLLY BELL,1,1.45,14472.0,United Kingdom,2025-07-30
494889,21728,METAL MEDINA LANTERN ,1,12.75,14472.0,United Kingdom,2025-07-30
494889,47469,ASSORTED SHAPES PHOTO CLIP SILVER ,24,0.65,14472.0,United Kingdom,2025-07-30
494889,21730,GLASS STAR FROSTED T-LIGHT HOLDER,1,4.95,14472.0,United Kingdom,2025-07-30
494889,21391,FRENCH EMROIDR LAVENDER SCENT HEART,3,2.1,14472.0,United Kingdom,2025-07-30
494889,22290,STANDING METAL RABBIT WITH EGG,4,2.1,14472.0,United Kingdom,2025-07-30
494889,22291,"SPRING DEC , HANGING CHICK CREAM",1,1.45,14472.0,United Kingdom,2025-07-30
494889,22293,"SPRING DEC , HANGING CHICK  GREEN",3,1.45,14472.0,United Kingdom,2025-07-30
494889,84459A,PINK METAL CHICKEN HEART ,1,1.49,14472.0,United Kingdom,2025-07-30
494889,35971,ROSE FOLKART HEART DECORATIONS,2,1.25,14472.0,United Kingdom,2025-07-30
494889,35973,GERANIUM FOLKART HEART DECORATION,1,1.25,14472.0,United Kingdom,2025-07-30
494889,21812,GARLAND WITH HEARTS AND BELLS,1,4.95,14472.0,United Kingdom,2025-07-30
494889,21823,PAINTED METAL HEART WITH HOLLY BELL,1,1.45,14472.0,United Kingdom,2025-07-30
494889,22288,"DECORATION , HANGING METAL RABBIT",3,1.25,14472.0,United Kingdom,2025-07-30
494889,22292,"SPRING DEC , HANGING CHICK  YELLOW",3,1.45,14472.0,United Kingdom,2025-07-30
494889,84459A,PINK METAL CHICKEN HEART ,1,1.49,14472.0,United Kingdom,2025-07-30
494889,21823,PAINTED METAL HEART WITH HOLLY BELL,1,1.45,14472.0,United Kingdom,2025-07-30
494889,22291,"SPRING DEC , HANGING CHICK CREAM",2,1.45,14472.0,United Kingdom,2025-07-30
494889,71477,COLOUR GLASS. STAR T-LIGHT HOLDER,1,3.25,14472.0,United Kingdom,2025-07-30
494889,21385,IVORY HANGING DECORATION  HEART,8,0.85,14472.0,United Kingdom,2025-07-30
494889,35471A,SET OF 3 BIRD L.BLUE FEATHER,2,1.25,14472.0,United Kingdom,2025-07-30
494889,35471D,SET OF 3 BIRD LIGHT PINK FEATHER ,2,1.25,14472.0,United Kingdom,2025-07-30
494889,21179,NO JUNK MAIL METAL SIGN,1,1.25,14472.0,United Kingdom,2025-07-30
494889,21905,MORE BUTTER METAL SIGN ,1,2.1,14472.0,United Kingdom,2025-07-30
494889,21175,GIN + TONIC DIET METAL SIGN,2,2.1,14472.0,United Kingdom,2025-07-30
494889,85130D,BEADED CRYSTAL HEART PINK LARGE,5,1.65,14472.0,United Kingdom,2025-07-30
494889,85130C,BEADED CRYSTAL HEART BLUE  LARGE,6,1.65,14472.0,United Kingdom,2025-07-30
494889,21114,LAVENDER SCENTED FABRIC HEART,15,1.25,14472.0,United Kingdom,2025-07-30
494890,20975,12 PENCILS SMALL TUBE RED SPOTTY,2,0.65,13555.0,United Kingdom,2025-07-30
494890,48189,DOOR MAT FRIENDSHIP ,1,6.75,13555.0,United Kingdom,2025-07-30
494890,21584,RETRO SPOT SMALL TUBE MATCHES,4,1.65,13555.0,United Kingdom,2025-07-30
494890,22131,FOOD CONTAINER SET 3 LOVE HEART ,1,1.95,13555.0,United Kingdom,2025-07-30
494890,85099B,JUMBO BAG RED WHITE SPOTTY ,2,1.95,13555.0,United Kingdom,2025-07-30
494890,21411,GINGHAM HEART  DOORSTOP RED,2,4.25,13555.0,United Kingdom,2025-07-30
494890,21114,LAVENDER SCENTED FABRIC HEART,10,1.25,13555.0,United Kingdom,2025-07-30
494890,21408,SPOTTY PINK DUCK DOORSTOP,1,4.25,13555.0,United Kingdom,2025-07-30
494890,21796,SET OF 3 RED STRIPE BASKETS,1,12.75,13555.0,United Kingdom,2025-07-30
494890,85099B,JUMBO BAG RED WHITE SPOTTY ,1,1.95,13555.0,United Kingdom,2025-07-30
494890,85049C,ROMANTIC PINKS RIBBONS ,2,1.25,13555.0,United Kingdom,2025-07-30
494890,20725,LUNCH BAG RED SPOTTY,1,1.65,13555.0,United Kingdom,2025-07-30
494890,21383,PACK OF 12 STICKY BUNNIES,1,0.65,13555.0,United Kingdom,2025-07-30
494890,21564,PINK  HEART SHAPE LOVE BUCKET ,1,2.95,13555.0,United Kingdom,2025-07-30
494890,21124,SET/10 BLUE SPOTTY PARTY CANDLES,1,1.25,13555.0,United Kingdom,2025-07-30
494890,20975,12 PENCILS SMALL TUBE RED SPOTTY,1,0.65,13555.0,United Kingdom,2025-07-30
494890,22083,PAPER CHAIN KIT RETRO SPOT,1,2.95,13555.0,United Kingdom,2025-07-30
494890,22097,SWALLOW SQUARE TISSUE BOX,2,1.25,13555.0,United Kingdom,2025-07-30
494890,20886,BOX OF 9 PEBBLE CANDLES,3,1.95,13555.0,United Kingdom,2025-07-30
494890,85049D,BRIGHT BLUES RIBBONS ,2,1.25,13555.0,United Kingdom,2025-07-30
494890,21122,SET/10 PINK SPOTTY PARTY CANDLES,1,1.25,13555.0,United Kingdom,2025-07-30
494890,22090,PAPER BUNTING RETRO SPOTS,1,2.95,13555.0,United Kingdom,2025-07-30
494890,47504G,ENGLISH ROSE TAPE MEASURE,1,1.25,13555.0,United Kingdom,2025-07-30
494890,84992,72 SWEETHEART FAIRY CAKE CASES,1,0.55,13555.0,United Kingdom,2025-07-30
494890,84992,72 SWEETHEART FAIRY CAKE CASES,1,0.55,13555.0,United Kingdom,2025-07-30
494890,21593,SWALLOW CIGAR BOX MATCHES ,1,1.25,13555.0,United Kingdom,2025-07-30
494890,20975,12 PENCILS SMALL TUBE RED SPOTTY,1,0.65,13555.0,United Kingdom,2025-07-30
494891,85099F,JUMBO BAG STRAWBERRY,3,1.95,12733.0,USA,2025-07-30
494891,84997D,PINK 3 PIECE MINI DOTS CUTLERY SET,24,3.75,12733.0,USA,2025-07-30
494891,84706B,FAIRY CAKES TABLE CLOCK,3,8.95,12733.0,USA,2025-07-30
494891,84706A,ENGLISH ROSE TABLE CLOCK,3,8.95,12733.0,USA,2025-07-30
494891,21396,RED SPOTTY EGG CUP ,12,1.25,12733.0,USA,2025-07-30
494891,22127,PARTY CONES CARNIVAL ASSORTED,18,1.25,12733.0,USA,2025-07-30
494891,22148,EASTER CRAFT 4 CHICKS ,5,1.95,12733.0,USA,2025-07-30
494891,22210,WOOD STAMP SET BEST WISHES,2,1.65,12733.0,USA,2025-07-30
494891,22236,CAKE STAND 3 TIER MAGIC GARDEN,3,12.75,12733.0,USA,2025-07-30
494891,22223,CAKE PLATE LOVEBIRD PINK,2,4.95,12733.0,USA,2025-07-30
494891,22147,FELTCRAFT BUTTERFLY HEARTS,5,1.45,12733.0,USA,2025-07-30
494891,21527,RETRO SPOT TRADITIONAL TEAPOT ,6,7.95,12733.0,USA,2025-07-30
494891,21621,VINTAGE UNION JACK BUNTING,4,8.5,12733.0,USA,2025-07-30
494891,22221,CAKE STAND LOVEBIRD 2 TIER PINK,1,9.95,12733.0,USA,2025-07-30
494891,40018E,TEA TIME PAPER LANTERNS,4,1.95,12733.0,USA,2025-07-30
494891,20971,PINK BLUE FELT CRAFT TRINKET BOX,12,1.25,12733.0,USA,2025-07-30
494891,47591D,PINK FAIRY CAKE CHILD'S APRON,8,1.95,12733.0,USA,2025-07-30
494891,22300,COFFEE MUG DOG + BALL DESIGN,6,2.55,12733.0,USA,2025-07-30
494891,21265,PINK GOOSE FEATHER TREE 60CM,1,9.95,12733.0,USA,2025-07-30
494891,84987,SET OF 36 TEATIME PAPER DOILIES,6,1.45,12733.0,USA,2025-07-30
494891,84520B,PACK 20 ENGLISH ROSE PAPER NAPKINS,6,0.85,12733.0,USA,2025-07-30
494891,84985A,SET OF 72 GREEN PAPER DOILIES,4,1.45,12733.0,USA,2025-07-30
494891,22326,ROUND SNACK BOXES SET OF4 WOODLAND ,1,2.95,12733.0,USA,2025-07-30
