Invoice,StockCode,Description,Quantity,Price,Customer ID,Country,InvoiceDate
516430,22623,BOX OF VINTAGE JIGSAW BLOCKS ,3,4.95,17511.0,United Kingdom,2025-12-28
516430,21888,BINGO SET,8,3.75,17511.0,United Kingdom,2025-12-28
516430,22139,RETRO SPOT TEA SET CERAMIC 11 PC ,24,4.25,17511.0,United Kingdom,2025-12-28
516430,22367,CHILDRENS APRON SPACEBOY DESIGN,8,1.95,17511.0,United Kingdom,2025-12-28
516430,22433,WATERING CAN GREEN DINOSAUR,12,1.95,17511.0,United Kingdom,2025-12-28
516430,22431,WATERING CAN BLUE ELEPHANT,12,1.95,17511.0,United Kingdom,2025-12-28
516430,22174,PHOTO CUBE,48,1.48,17511.0,United Kingdom,2025-12-28
516430,22383,LUNCH BAG SUKI  DESIGN ,100,1.45,17511.0,United Kingdom,2025-12-28
516430,85232B,SET/3 RUSSIAN DOLL STACKING TINS,24,4.25,17511.0,United Kingdom,2025-12-28
516430,22382,LUNCH BAG SPACEBOY DESIGN ,100,1.45,17511.0,United Kingdom,2025-12-28
516430,20728,LUNCH BAG CARS BLUE,100,1.45,17511.0,United Kingdom,2025-12-28
516430,22381,TOY TIDY PINK RETROSPOT  ,50,1.85,17511.0,United Kingdom,2025-12-28
516430,22386,JUMBO BAG PINK WITH WHITE SPOTS,200,1.65,17511.0,United Kingdom,2025-12-28
516430,85099F,JUMBO BAG STRAWBERRY,100,1.65,17511.0,United Kingdom,2025-12-28
516430,21928,JUMBO BAG SCANDINAVIAN PAISLEY,100,1.65,17511.0,United Kingdom,2025-12-28
516430,21929,JUMBO BAG PINK VINTAGE PAISLEY,100,1.65,17511.0,United Kingdom,2025-12-28
516430,85099B,JUMBO BAG RED RETROSPOT,200,1.65,17511.0,United Kingdom,2025-12-28
516430,21232,STRAWBERRY CERAMIC TRINKET BOX,72,1.06,17511.0,United Kingdom,2025-12-28
516430,20727,LUNCH BAG  BLACK SKULL.,100,1.45,17511.0,United Kingdom,2025-12-28
516430,21078,SET/20 STRAWBERRY PAPER NAPKINS ,96,0.64,17511.0,United Kingdom,2025-12-28
516430,22411,JUMBO SHOPPER VINTAGE RED PAISLEY,100,1.65,17511.0,United Kingdom,2025-12-28
516430,21154,RED SPOTTY OVEN GLOVE ,20,1.25,17511.0,United Kingdom,2025-12-28
516430,21156,RETROSPOT CHILDRENS APRON,16,1.95,17511.0,United Kingdom,2025-12-28
516430,22667,RECIPE BOX RETRO SPOT DESIGN,6,2.95,17511.0,United Kingdom,2025-12-28
516430,22665,RECIPE BOX BLUE SKETCHBOOK DESIGN,6,2.95,17511.0,United Kingdom,2025-12-28
516430,22654,DELUXE SEWING KIT ,4,5.95,17511.0,United Kingdom,2025-12-28
516430,21754,HOME BUILDING BLOCK WORD,18,5.45,17511.0,United Kingdom,2025-12-28
516430,21755,LOVE BUILDING BLOCK WORD,18,5.45,17511.0,United Kingdom,2025-12-28
516430,22170,PICTURE FRAME WOOD TRIPLE PORTRAIT,24,5.95,17511.0,United Kingdom,2025-12-28
516430,22169,FAMILY ALBUM WHITE PICTURE FRAME,16,7.65,17511.0,United Kingdom,2025-12-28
516430,85123A,WHITE HANGING HEART T-LIGHT HOLDER,32,2.55,17511.0,United Kingdom,2025-12-28
516430,21901,"KEY FOB , BACK DOOR ",24,0.65,17511.0,United Kingdom,2025-12-28
516430,20966,SANDWICH BATH SPONGE,10,1.25,17511.0,United Kingdom,2025-12-28
516430,20963,APPLE BATH SPONGE,10,1.25,17511.0,United Kingdom,2025-12-28
516430,20961,STRAWBERRY BATH SPONGE ,100,1.25,17511.0,United Kingdom,2025-12-28
516430,84520B,PACK 20 ENGLISH ROSE PAPER NAPKINS,96,0.64,17511.0,United Kingdom,2025-12-28
516430,21245,GREEN  SPOTTY PLATE ,96,1.45,17511.0,United Kingdom,2025-12-28
516430,21244,BLUE  SPOTTY PLATE ,96,1.45,17511.0,United Kingdom,2025-12-28
516430,21080,SET/20 RED SPOTTY PAPER NAPKINS ,96,0.64,17511.0,United Kingdom,2025-12-28
516430,22379,RECYCLING BAG RETROSPOT ,50,1.85,17511.0,United Kingdom,2025-12-28
516430,21217,RED SPOTTY ROUND CAKE TINS,12,8.95,17511.0,United Kingdom,2025-12-28
516430,20960,WATERMELON BATH SPONGE,10,1.25,17511.0,United Kingdom,2025-12-28
516431,79029,GLASS HONEYPOT WASP CATCHER,36,1.65,14905.0,United Kingdom,2025-12-28
516431,71038,WHITE HANGING BEADS CANDLE HOLDER,4,5.45,14905.0,United Kingdom,2025-12-28
516431,16015,MEDIUM CHINESE STYLE SCISSOR,20,0.5,14905.0,United Kingdom,2025-12-28
516431,21314,SMALL GLASS HEART TRINKET POT,8,2.1,14905.0,United Kingdom,2025-12-28
516431,22469,HEART OF WICKER SMALL,12,1.65,14905.0,United Kingdom,2025-12-28
516431,82600,NO SINGING METAL SIGN,12,2.1,14905.0,United Kingdom,2025-12-28
516431,85123A,WHITE HANGING HEART T-LIGHT HOLDER,32,2.55,14905.0,United Kingdom,2025-12-28
516431,22582,PACK OF 6 SWEETIE GIFT BOXES,6,2.55,14905.0,United Kingdom,2025-12-28
516431,21868,POTTING SHED TEA MUG,12,1.25,14905.0,United Kingdom,2025-12-28
516431,22528,GARDENERS KNEELING PAD,12,1.25,14905.0,United Kingdom,2025-12-28
516431,22173,METAL 4 HOOK HANGER FRENCH CHATEAU,8,2.95,14905.0,United Kingdom,2025-12-28
516432,22085,PAPER CHAIN KIT SKULLS ,24,2.95,12755.0,Japan,2025-12-28
516432,21202,DOLLY HONEYCOMB GARLAND,48,1.45,12755.0,Japan,2025-12-28
516432,21203,BUTTERFLIES  HONEYCOMB GARLAND,48,1.45,12755.0,Japan,2025-12-28
516432,21204,DAISIES  HONEYCOMB GARLAND ,48,1.45,12755.0,Japan,2025-12-28
516432,21207,SKULL AND CROSSBONES  GARLAND ,48,1.45,12755.0,Japan,2025-12-28
516432,22083,PAPER CHAIN KIT RETRO SPOT,24,2.95,12755.0,Japan,2025-12-28
516432,22079,RIBBON REEL HEARTS DESIGN ,30,1.65,12755.0,Japan,2025-12-28
516432,22081,RIBBON REEL FLORA + FAUNA ,30,1.65,12755.0,Japan,2025-12-28
516432,21291,SMALL SPOTTY CHOCOLATE GIFT BAG ,16,0.85,12755.0,Japan,2025-12-28
516432,21348,PINK SPOTS CHOCOLATE NESTING BOXES ,12,2.95,12755.0,Japan,2025-12-28
516432,22080,RIBBON REEL SPOTS DESIGN ,30,1.65,12755.0,Japan,2025-12-28
516433,20829,GLITTER HANGING BUTTERFLY STRING,1,2.1,12748.0,United Kingdom,2025-12-28
516433,21723,ALPHABET HEARTS STICKER SHEET,1,0.85,12748.0,United Kingdom,2025-12-28
516433,21725,SWEETIES  STICKERS,1,0.85,12748.0,United Kingdom,2025-12-28
516433,40018F,CHERRY DESIGN PAPERLANTERNS,2,1.95,12748.0,United Kingdom,2025-12-28
516433,85061W,WHITE JEWELLED HEART DECORATION,3,0.85,12748.0,United Kingdom,2025-12-28
516433,22669,RED BABY BUNTING ,5,2.95,12748.0,United Kingdom,2025-12-28
516433,22423,REGENCY CAKESTAND 3 TIER,1,12.75,12748.0,United Kingdom,2025-12-28
516433,21442,GREEN BIRDHOUSE DECORATION,1,0.85,12748.0,United Kingdom,2025-12-28
516433,22088,PAPER BUNTING COLOURED LACE,4,2.95,12748.0,United Kingdom,2025-12-28
516433,21257,VICTORIAN SEWING BOX MEDIUM,1,7.95,12748.0,United Kingdom,2025-12-28
516433,22569,FELTCRAFT CUSHION BUTTERFLY,1,3.75,12748.0,United Kingdom,2025-12-28
516433,22570,FELTCRAFT CUSHION RABBIT,1,3.75,12748.0,United Kingdom,2025-12-28
516433,79029,GLASS HONEYPOT WASP CATCHER,1,1.95,12748.0,United Kingdom,2025-12-28
516433,85061W,WHITE JEWELLED HEART DECORATION,3,0.85,12748.0,United Kingdom,2025-12-28
516433,22178,VICTORIAN GLASS HANGING T-LIGHT,6,1.25,12748.0,United Kingdom,2025-12-28
516433,85099B,JUMBO BAG RED RETROSPOT,2,1.95,12748.0,United Kingdom,2025-12-28
516433,21749,LARGE RED RETROSPOT WINDMILL,1,2.1,12748.0,United Kingdom,2025-12-28
516433,21746,SMALL RED RETROSPOT WINDMILL,2,1.25,12748.0,United Kingdom,2025-12-28
516433,84709B,PINK OVAL JEWELLED MIRROR,1,5.95,12748.0,United Kingdom,2025-12-28
516433,15039,SANDALWOOD FAN,1,0.85,12748.0,United Kingdom,2025-12-28
516433,75178,ASSTD COL BUTTERFLY/CRYSTAL W/CHIME,1,1.25,12748.0,United Kingdom,2025-12-28
516433,84526,GIANT BLACK SUNGLASSES,1,1.95,12748.0,United Kingdom,2025-12-28
516433,84559D,3D SHEET OF SEA WORLD STICKERS,1,0.85,12748.0,United Kingdom,2025-12-28
516433,75131,METAL TUBE CHIME ON BAMBOO,1,1.69,12748.0,United Kingdom,2025-12-28
516433,22705,WRAP GREEN PEARS ,25,0.42,12748.0,United Kingdom,2025-12-28
516433,21258,VICTORIAN SEWING BOX LARGE,1,12.75,12748.0,United Kingdom,2025-12-28
516433,21544,SKULLS  WATER TRANSFER TATTOOS ,1,0.85,12748.0,United Kingdom,2025-12-28
516433,71459,HANGING JAM JAR T-LIGHT HOLDER,12,0.85,12748.0,United Kingdom,2025-12-28
516433,22669,RED BABY BUNTING ,5,2.95,12748.0,United Kingdom,2025-12-28
516433,20829,GLITTER HANGING BUTTERFLY STRING,1,2.1,12748.0,United Kingdom,2025-12-28
516434,84879,ASSORTED COLOUR BIRD ORNAMENT,8,1.69,18096.0,United Kingdom,2025-12-28
516434,85169D,PINK LOVE BIRD CANDLE,2,1.25,18096.0,United Kingdom,2025-12-28
516434,82482,WOODEN PICTURE FRAME WHITE FINISH,1,2.55,18096.0,United Kingdom,2025-12-28
516434,22275,WEEKEND BAG VINTAGE ROSE PAISLEY,3,8.5,18096.0,United Kingdom,2025-12-28
516434,48187,DOORMAT NEW ENGLAND,1,7.49,18096.0,United Kingdom,2025-12-28
516434,21563,RED HEART SHAPE LOVE BUCKET ,1,2.95,18096.0,United Kingdom,2025-12-28
516434,85169C,EAU DE NIL LOVE BIRD CANDLE,1,1.25,18096.0,United Kingdom,2025-12-28
516434,21122,SET/10 PINK SPOTTY PARTY CANDLES,1,1.25,18096.0,United Kingdom,2025-12-28
516434,21713,CITRONELLA CANDLE FLOWERPOT,2,2.1,18096.0,United Kingdom,2025-12-28
516434,84946,ANTIQUE SILVER TEA GLASS ETCHED,6,1.25,18096.0,United Kingdom,2025-12-28
516434,84947,ANTIQUE SILVER TEA GLASS ENGRAVED,6,1.25,18096.0,United Kingdom,2025-12-28
516434,85169A,IVORY LOVE BIRD CANDLE,1,1.25,18096.0,United Kingdom,2025-12-28
516434,22374,AIRLINE BAG VINTAGE JET SET RED,1,6.35,18096.0,United Kingdom,2025-12-28
516434,84991,60 TEATIME FAIRY CAKE CASES,1,0.55,18096.0,United Kingdom,2025-12-28
516434,85099F,JUMBO BAG STRAWBERRY,1,1.95,18096.0,United Kingdom,2025-12-28
516434,22375,AIRLINE BAG VINTAGE JET SET BROWN,1,6.35,18096.0,United Kingdom,2025-12-28
516434,22178,VICTORIAN GLASS HANGING T-LIGHT,3,1.25,18096.0,United Kingdom,2025-12-28
516434,84949,SILVER HANGING T-LIGHT HOLDER,5,1.65,18096.0,United Kingdom,2025-12-28
516434,47559B,TEA TIME OVEN GLOVE,1,1.25,18096.0,United Kingdom,2025-12-28
516434,47556B,TEA TIME TEA TOWELS ,1,2.95,18096.0,United Kingdom,2025-12-28
516434,47568,ENGLISH ROSE DESIGN PEG BAG,1,2.1,18096.0,United Kingdom,2025-12-28
516434,21928,JUMBO BAG SCANDINAVIAN PAISLEY,1,1.95,18096.0,United Kingdom,2025-12-28
516434,85099B,JUMBO BAG RED RETROSPOT,1,1.95,18096.0,United Kingdom,2025-12-28
516434,85099C,JUMBO  BAG BAROQUE BLACK WHITE,1,1.95,18096.0,United Kingdom,2025-12-28
516434,21931,JUMBO STORAGE BAG SUKI,1,1.95,18096.0,United Kingdom,2025-12-28
516434,21465,PINK FLOWER CROCHET FOOD COVER,1,3.75,18096.0,United Kingdom,2025-12-28
516434,21203,BUTTERFLIES  HONEYCOMB GARLAND,1,1.65,18096.0,United Kingdom,2025-12-28
516434,21204,DAISIES  HONEYCOMB GARLAND ,1,1.65,18096.0,United Kingdom,2025-12-28
516434,22423,REGENCY CAKESTAND 3 TIER,1,12.75,18096.0,United Kingdom,2025-12-28
516434,72803A,ROSE SCENT CANDLE JEWELLED DRAWER,1,4.25,18096.0,United Kingdom,2025-12-28
516434,21931,JUMBO STORAGE BAG SUKI,1,1.95,18096.0,United Kingdom,2025-12-28
516435,72802C,VANILLA SCENT CANDLE JEWELLED BOX,2,4.25,,United Kingdom,2025-12-28
516435,72807C,SET/3 VANILLA SCENTED CANDLE IN BOX,3,4.25,,United Kingdom,2025-12-28
516436,20974,12 PENCILS SMALL TUBE SKULL,24,0.65,16422.0,United Kingdom,2025-12-28
516436,72351B,SET/6 PINK  BUTTERFLY T-LIGHTS,24,2.1,16422.0,United Kingdom,2025-12-28
516436,20975,12 PENCILS SMALL TUBE RED SPOTTY,24,0.65,16422.0,United Kingdom,2025-12-28
516436,47590B,PINK HAPPY BIRTHDAY BUNTING,50,4.65,16422.0,United Kingdom,2025-12-28
516437,48194,DOORMAT HEARTS,2,7.49,13481.0,United Kingdom,2025-12-28
516437,85099B,JUMBO BAG RED RETROSPOT,10,1.95,13481.0,United Kingdom,2025-12-28
516437,48185,DOORMAT FAIRY CAKE,2,7.49,13481.0,United Kingdom,2025-12-28
516437,22386,JUMBO BAG PINK WITH WHITE SPOTS,20,1.95,13481.0,United Kingdom,2025-12-28
516437,20702,PINK PADDED MOBILE,3,4.25,13481.0,United Kingdom,2025-12-28
516437,21931,JUMBO STORAGE BAG SUKI,20,1.95,13481.0,United Kingdom,2025-12-28
516437,20711,JUMBO BAG TOYS ,10,1.95,13481.0,United Kingdom,2025-12-28
516437,22501,PICNIC BASKET WICKER LARGE,2,9.95,13481.0,United Kingdom,2025-12-28
516437,21524,DOORMAT SPOTTY HOME SWEET HOME,2,7.49,13481.0,United Kingdom,2025-12-28
516437,85123A,WHITE HANGING HEART T-LIGHT HOLDER,6,2.95,13481.0,United Kingdom,2025-12-28
516437,84755,COLOUR GLASS T-LIGHT HOLDER HANGING,16,0.65,13481.0,United Kingdom,2025-12-28
516437,22385,JUMBO BAG SPACEBOY DESIGN,10,1.95,13481.0,United Kingdom,2025-12-28
516437,21430,SET/3 RED GINGHAM ROSE STORAGE BOX,4,3.75,13481.0,United Kingdom,2025-12-28
516438,22502,PICNIC BASKET WICKER SMALL,4,4.25,13481.0,United Kingdom,2025-12-28
516438,22625,RED KITCHEN SCALES,2,8.5,13481.0,United Kingdom,2025-12-28
516438,22637,PIGGY BANK RETROSPOT ,6,2.55,13481.0,United Kingdom,2025-12-28
516437,20972,PINK CREAM FELT CRAFT TRINKET BOX ,12,1.25,13481.0,United Kingdom,2025-12-28
516438,21770,OPEN CLOSED METAL SIGN,2,4.95,13481.0,United Kingdom,2025-12-28
516437,22519,CHILDS GARDEN BRUSH PINK,6,2.1,13481.0,United Kingdom,2025-12-28
516437,22518,CHILDS GARDEN BRUSH BLUE,6,2.1,13481.0,United Kingdom,2025-12-28
516437,22444,GROW YOUR OWN PLANT IN A CAN ,24,1.25,13481.0,United Kingdom,2025-12-28
516437,22273,FELTCRAFT DOLL MOLLY,6,2.95,13481.0,United Kingdom,2025-12-28
516437,84279P,CHERRY BLOSSOM  DECORATIVE FLASK,4,3.75,13481.0,United Kingdom,2025-12-28
516439,20676,RED SPOTTY BOWL,16,1.25,13509.0,United Kingdom,2025-12-28
516439,20677,PINK SPOTTY BOWL,16,1.25,13509.0,United Kingdom,2025-12-28
516439,20675,BLUE SPOTTY BOWL,8,1.25,13509.0,United Kingdom,2025-12-28
516439,22128,PARTY CONES CANDY ASSORTED,60,1.25,13509.0,United Kingdom,2025-12-28
516439,20674,GREEN SPOTTY BOWL,8,1.25,13509.0,United Kingdom,2025-12-28
516446,82607A,GLASS BONBON JAR PARFUME AUX FLEURE,6,1.25,13719.0,United Kingdom,2025-12-28
516446,21622,VINTAGE UNION JACK CUSHION COVER,8,4.95,13719.0,United Kingdom,2025-12-28
516446,21745,GAOLERS KEYS DECORATIVE GARDEN ,4,3.75,13719.0,United Kingdom,2025-12-28
516446,21765,HANGING METAL BIRD BATH,2,7.95,13719.0,United Kingdom,2025-12-28
516446,22488,NATURAL SLATE RECTANGLE CHALKBOARD,12,1.65,13719.0,United Kingdom,2025-12-28
516446,21418,STARFISH SOAP DISH,6,2.55,13719.0,United Kingdom,2025-12-28
516446,21415,CLAM SHELL SMALL ,6,2.1,13719.0,United Kingdom,2025-12-28
516446,21417,COCKLE SHELL DISH,6,2.1,13719.0,United Kingdom,2025-12-28
516447,21791,VINTAGE HEADS AND TAILS CARD GAME ,12,1.25,16129.0,United Kingdom,2025-12-28
516447,21892,TRADITIONAL WOODEN CATCH CUP GAME ,12,1.25,16129.0,United Kingdom,2025-12-28
516447,22549,PICTURE DOMINOES,12,1.45,16129.0,United Kingdom,2025-12-28
516447,22548,HEADS AND TAILS SPORTING FUN,12,1.25,16129.0,United Kingdom,2025-12-28
516447,20969,RED FLORAL FELTCRAFT SHOULDER BAG,4,3.75,16129.0,United Kingdom,2025-12-28
516447,22149,FELTCRAFT 6 FLOWER FRIENDS,6,2.1,16129.0,United Kingdom,2025-12-28
516447,84898F,YELLOW FLOWERS FELT HANDBAG KIT,6,2.1,16129.0,United Kingdom,2025-12-28
516447,22493,PAINT YOUR OWN CANVAS SET,12,1.65,16129.0,United Kingdom,2025-12-28
516447,22083,PAPER CHAIN KIT RETRO SPOT,6,2.95,16129.0,United Kingdom,2025-12-28
516447,22138,BAKING SET 9 PIECE RETROSPOT ,3,4.95,16129.0,United Kingdom,2025-12-28
516447,22617,BAKING SET SPACEBOY DESIGN,3,4.95,16129.0,United Kingdom,2025-12-28
516447,84077,WORLD WAR 2 GLIDERS ASSTD DESIGNS,48,0.21,16129.0,United Kingdom,2025-12-28
516447,84212,"ASSORTED FLOWER COLOUR ""LEIS""",24,0.65,16129.0,United Kingdom,2025-12-28
516447,17003,BROCADE RING PURSE ,36,0.21,16129.0,United Kingdom,2025-12-28
516447,85178,VICTORIAN SEWING KIT,12,1.25,16129.0,United Kingdom,2025-12-28
516447,85227,SET OF 6 3D KIT CARDS FOR KIDS,12,0.85,16129.0,United Kingdom,2025-12-28
516447,21541,DINOSAURS WATER TRANSFER TATTOOS ,12,0.85,16129.0,United Kingdom,2025-12-28
516447,21643,ASSORTED TUTTI FRUTTI MIRROR,12,1.25,16129.0,United Kingdom,2025-12-28
516447,21790,VINTAGE SNAP CARDS,12,0.85,16129.0,United Kingdom,2025-12-28
516447,21703,BAG 125g SWIRLY MARBLES,12,0.42,16129.0,United Kingdom,2025-12-28
516447,21542,WOODLAND WATER TRANSFER TATTOOS ,12,0.85,16129.0,United Kingdom,2025-12-28
516447,21544,SKULLS  WATER TRANSFER TATTOOS ,12,0.85,16129.0,United Kingdom,2025-12-28
516447,21888,BINGO SET,4,3.75,16129.0,United Kingdom,2025-12-28
516447,22367,CHILDRENS APRON SPACEBOY DESIGN,8,1.95,16129.0,United Kingdom,2025-12-28
516447,21327,SKULLS WRITING SET ,12,1.65,16129.0,United Kingdom,2025-12-28
516447,22090,PAPER BUNTING RETRO SPOTS,6,2.95,16129.0,United Kingdom,2025-12-28
516447,21891,TRADITIONAL WOODEN SKIPPING ROPE,12,1.25,16129.0,United Kingdom,2025-12-28
516447,22620,4 TRADITIONAL SPINNING TOPS,12,1.25,16129.0,United Kingdom,2025-12-28
516447,15034,PAPER POCKET TRAVELING FAN ,24,0.14,16129.0,United Kingdom,2025-12-28
516447,15036,ASSORTED COLOURS SILK FAN,12,0.75,16129.0,United Kingdom,2025-12-28
516447,20682,RED SPOTTY CHILDS UMBRELLA,6,3.25,16129.0,United Kingdom,2025-12-28
516447,22667,RECIPE BOX RETRO SPOT DESIGN,6,2.95,16129.0,United Kingdom,2025-12-28
516447,21679,SKULLS  STICKERS,12,0.85,16129.0,United Kingdom,2025-12-28
C516448,79000,MOROCCAN TEA GLASS,-7,0.85,13107.0,United Kingdom,2025-12-28
C516448,71459,HANGING JAM JAR T-LIGHT HOLDER,-1,0.85,13107.0,United Kingdom,2025-12-28
C516448,20754,RETRO RED SPOTTY WASHING UP GLOVES,-18,2.1,13107.0,United Kingdom,2025-12-28
C516448,22186,RED STAR CARD HOLDER,-12,2.95,13107.0,United Kingdom,2025-12-28
516449,22424,ENAMEL BREAD BIN CREAM,2,12.75,16359.0,United Kingdom,2025-12-28
516449,22427,ENAMEL FLOWER JUG CREAM,3,5.95,16359.0,United Kingdom,2025-12-28
516449,22425,ENAMEL COLANDER CREAM,3,4.95,16359.0,United Kingdom,2025-12-28
516449,84836,ZINC METAL HEART DECORATION,48,1.25,16359.0,United Kingdom,2025-12-28
516449,21770,OPEN CLOSED METAL SIGN,2,4.95,16359.0,United Kingdom,2025-12-28
516450,22555,PLASTERS IN TIN STRONGMAN,2,1.65,17091.0,United Kingdom,2025-12-28
516450,21983,PACK OF 12 BLUE PAISLEY TISSUES ,2,0.29,17091.0,United Kingdom,2025-12-28
516450,21982,PACK OF 12 SUKI TISSUES ,2,0.29,17091.0,United Kingdom,2025-12-28
516450,22380,TOY TIDY SPACEBOY  ,2,2.1,17091.0,United Kingdom,2025-12-28
516450,85099F,JUMBO BAG STRAWBERRY,2,1.95,17091.0,United Kingdom,2025-12-28
516450,21931,JUMBO STORAGE BAG SUKI,1,1.95,17091.0,United Kingdom,2025-12-28
516450,21928,JUMBO BAG SCANDINAVIAN PAISLEY,1,1.95,17091.0,United Kingdom,2025-12-28
516450,84270,ASSTD DESIGN BUBBLE GUM RING,30,0.21,17091.0,United Kingdom,2025-12-28
516450,15036,ASSORTED COLOURS SILK FAN,12,0.75,17091.0,United Kingdom,2025-12-28
516450,22149,FELTCRAFT 6 FLOWER FRIENDS,2,2.1,17091.0,United Kingdom,2025-12-28
516450,22147,FELTCRAFT BUTTERFLY HEARTS,2,1.45,17091.0,United Kingdom,2025-12-28
516450,22551,PLASTERS IN TIN SPACEBOY,2,1.65,17091.0,United Kingdom,2025-12-28
516450,21754,HOME BUILDING BLOCK WORD,2,5.95,17091.0,United Kingdom,2025-12-28
516450,72232,FENG SHUI PILLAR CANDLE,12,0.19,17091.0,United Kingdom,2025-12-28
516450,22487,WHITE WOOD GARDEN PLANT LADDER,1,9.95,17091.0,United Kingdom,2025-12-28
516450,22122,SET OF 2 FANCY FONT TEA TOWELS,5,2.95,17091.0,United Kingdom,2025-12-28
516450,84569B,PACK 3 FIRE ENGINE/CAR PATCHES,2,1.25,17091.0,United Kingdom,2025-12-28
516450,84569C,PACK 4 FLOWER/BUTTERFLY PATCHES,2,1.25,17091.0,United Kingdom,2025-12-28
516450,22621,TRADITIONAL KNITTING NANCY,3,1.45,17091.0,United Kingdom,2025-12-28
516450,22557,PLASTERS IN TIN VINTAGE PAISLEY ,3,1.65,17091.0,United Kingdom,2025-12-28
516450,22554,PLASTERS IN TIN WOODLAND ANIMALS,2,1.65,17091.0,United Kingdom,2025-12-28
516450,21523,DOORMAT FANCY FONT HOME SWEET HOME,1,7.49,17091.0,United Kingdom,2025-12-28
516450,22614,PACK OF 12 SPACEBOY TISSUES,2,0.29,17091.0,United Kingdom,2025-12-28
516450,37503,TEA TIME CAKE STAND IN GIFT BOX,2,10.75,17091.0,United Kingdom,2025-12-28
516450,48138,DOORMAT UNION FLAG,1,7.49,17091.0,United Kingdom,2025-12-28
516450,82615,PINK MARSHMALLOW SCARF KNITTING KIT,1,2.95,17091.0,United Kingdom,2025-12-28
516450,82616A,BUBBLE GUM SCARF KNITTING KIT,1,2.95,17091.0,United Kingdom,2025-12-28
516450,22501,PICNIC BASKET WICKER LARGE,1,9.95,17091.0,United Kingdom,2025-12-28
516450,22666,RECIPE BOX PANTRY YELLOW DESIGN,2,2.95,17091.0,United Kingdom,2025-12-28
516450,22411,JUMBO SHOPPER VINTAGE RED PAISLEY,2,1.95,17091.0,United Kingdom,2025-12-28
516450,85099F,JUMBO BAG STRAWBERRY,2,1.95,17091.0,United Kingdom,2025-12-28
516450,22380,TOY TIDY SPACEBOY  ,2,2.1,17091.0,United Kingdom,2025-12-28
516450,22188,BLACK HEART CARD HOLDER,1,3.95,17091.0,United Kingdom,2025-12-28
516450,22030,SWALLOWS GREETING CARD,24,0.42,17091.0,United Kingdom,2025-12-28
516450,22411,JUMBO SHOPPER VINTAGE RED PAISLEY,2,1.95,17091.0,United Kingdom,2025-12-28
516450,21948,SET OF 6 CAKE CHOPSTICKS,6,1.25,17091.0,United Kingdom,2025-12-28
516450,21947,SET OF 6 HEART CHOPSTICKS,6,1.25,17091.0,United Kingdom,2025-12-28
516450,22423,REGENCY CAKESTAND 3 TIER,2,12.75,17091.0,United Kingdom,2025-12-28
516450,22621,TRADITIONAL KNITTING NANCY,1,1.45,17091.0,United Kingdom,2025-12-28
516450,22555,PLASTERS IN TIN STRONGMAN,2,1.65,17091.0,United Kingdom,2025-12-28
516450,22652,TRAVEL SEWING KIT,1,1.65,17091.0,United Kingdom,2025-12-28
516450,22551,PLASTERS IN TIN SPACEBOY,2,1.65,17091.0,United Kingdom,2025-12-28
516450,22554,PLASTERS IN TIN WOODLAND ANIMALS,2,1.65,17091.0,United Kingdom,2025-12-28
516450,22652,TRAVEL SEWING KIT,3,1.65,17091.0,United Kingdom,2025-12-28
516450,22557,PLASTERS IN TIN VINTAGE PAISLEY ,1,1.65,17091.0,United Kingdom,2025-12-28
516451,21624,VINTAGE UNION JACK DOORSTOP,3,5.95,15617.0,United Kingdom,2025-12-28
516451,21164,HOME SWEET HOME METAL SIGN ,6,2.95,15617.0,United Kingdom,2025-12-28
516451,22227,"DECORATION, HANGING HEART+MIRROR ",24,0.65,15617.0,United Kingdom,2025-12-28
516451,22508,DOORSTOP RETROSPOT HEART,4,3.75,15617.0,United Kingdom,2025-12-28
516451,35400,WOODEN BOX ADVENT CALENDAR ,2,8.95,15617.0,United Kingdom,2025-12-28
516451,21411,GINGHAM HEART  DOORSTOP RED,3,4.25,15617.0,United Kingdom,2025-12-28
516451,21823,PAINTED METAL HEART WITH HOLLY BELL,12,1.45,15617.0,United Kingdom,2025-12-28
516451,35832,WOOLLY HAT SOCK GLOVE ADVENT STRING,12,2.95,15617.0,United Kingdom,2025-12-28
516451,21491,SET OF THREE VINTAGE GIFT WRAPS,12,1.95,15617.0,United Kingdom,2025-12-28
516451,22668,PINK BABY BUNTING,5,2.95,15617.0,United Kingdom,2025-12-28
516451,21824,PAINTED METAL STAR WITH HOLLY BELLS,12,1.45,15617.0,United Kingdom,2025-12-28
516452,22431,WATERING CAN BLUE ELEPHANT,6,1.95,13154.0,United Kingdom,2025-12-28
516452,22432,WATERING CAN PINK BUNNY,6,1.95,13154.0,United Kingdom,2025-12-28
516452,22516,CHILDS GARDEN RAKE BLUE,6,2.1,13154.0,United Kingdom,2025-12-28
516452,22517,CHILDS GARDEN RAKE PINK,12,2.1,13154.0,United Kingdom,2025-12-28
516452,22514,CHILDS GARDEN SPADE BLUE,6,2.1,13154.0,United Kingdom,2025-12-28
516452,22515,CHILDS GARDEN SPADE PINK,6,2.1,13154.0,United Kingdom,2025-12-28
516452,22522,CHILDS GARDEN FORK BLUE ,12,0.85,13154.0,United Kingdom,2025-12-28
516452,22523,CHILDS GARDEN FORK PINK,12,0.85,13154.0,United Kingdom,2025-12-28
516452,22526,WHEELBARROW FOR CHILDREN ,1,12.75,13154.0,United Kingdom,2025-12-28
516452,22227,"DECORATION, HANGING HEART+MIRROR ",24,0.65,13154.0,United Kingdom,2025-12-28
516452,72760B,VINTAGE CREAM 3 BASKET CAKE STAND,2,9.95,13154.0,United Kingdom,2025-12-28
516452,21899,"KEY FOB , GARAGE DESIGN",24,0.65,13154.0,United Kingdom,2025-12-28
516452,84884A,ANT WHITE WIRE HEART SPIRAL,5,3.95,13154.0,United Kingdom,2025-12-28
516452,21900,"KEY FOB , SHED",24,0.65,13154.0,United Kingdom,2025-12-28
516452,22487,WHITE WOOD GARDEN PLANT LADDER,1,9.95,13154.0,United Kingdom,2025-12-28
516452,85123A,WHITE HANGING HEART T-LIGHT HOLDER,6,2.95,13154.0,United Kingdom,2025-12-28
516452,71477,COLOUR GLASS. STAR T-LIGHT HOLDER,4,3.25,13154.0,United Kingdom,2025-12-28
516452,84970S,HANGING HEART ZINC T-LIGHT HOLDER,12,0.85,13154.0,United Kingdom,2025-12-28
516452,82580,BATHROOM METAL SIGN,12,0.55,13154.0,United Kingdom,2025-12-28
516452,82581,TOILET METAL SIGN,12,0.55,13154.0,United Kingdom,2025-12-28
516452,21179,NO JUNK MAIL METAL SIGN,12,1.25,13154.0,United Kingdom,2025-12-28
516452,10002,INFLATABLE POLITICAL GLOBE ,12,0.85,13154.0,United Kingdom,2025-12-28
516452,22323,PINK POLKADOT KIDS BAG,12,1.95,13154.0,United Kingdom,2025-12-28
516452,20703,BLUE PADDED SOFT MOBILE,3,4.25,13154.0,United Kingdom,2025-12-28
516452,22172,METAL SHELF WITH RAIL ,2,8.5,13154.0,United Kingdom,2025-12-28
516452,21790,VINTAGE SNAP CARDS,12,0.85,13154.0,United Kingdom,2025-12-28
516452,20702,PINK PADDED MOBILE,3,4.25,13154.0,United Kingdom,2025-12-28
516452,21380,WOODEN HAPPY BIRTHDAY GARLAND,6,2.95,13154.0,United Kingdom,2025-12-28
516452,22245,"HOOK, 1 HANGER ,MAGIC GARDEN",12,0.85,13154.0,United Kingdom,2025-12-28
516452,22251,BIRDHOUSE DECORATION MAGIC GARDEN,12,1.25,13154.0,United Kingdom,2025-12-28
516452,22248,DECORATION  PINK CHICK MAGIC GARDEN,16,0.85,13154.0,United Kingdom,2025-12-28
516452,22250,DECORATION  BUTTERFLY  MAGIC GARDEN,16,0.85,13154.0,United Kingdom,2025-12-28
516452,22231,JIGSAW TREE WITH BIRDHOUSE,12,1.45,13154.0,United Kingdom,2025-12-28
516452,22322,BIRD DECORATION GREEN  SPOT,12,0.85,13154.0,United Kingdom,2025-12-28
516452,22236,CAKE STAND 3 TIER MAGIC GARDEN,1,12.75,13154.0,United Kingdom,2025-12-28
516452,21765,HANGING METAL BIRD BATH,2,7.95,13154.0,United Kingdom,2025-12-28
516452,22525,CHILDRENS GARDEN GLOVES PINK,10,1.25,13154.0,United Kingdom,2025-12-28
516452,22230,JIGSAW TREE WITH WATERING CAN,12,0.85,13154.0,United Kingdom,2025-12-28
516452,22521,CHILDS GARDEN TROWEL PINK,12,0.85,13154.0,United Kingdom,2025-12-28
516452,22524,CHILDRENS GARDEN GLOVES BLUE,10,1.25,13154.0,United Kingdom,2025-12-28
516452,22549,PICTURE DOMINOES,12,1.45,13154.0,United Kingdom,2025-12-28
516452,21791,VINTAGE HEADS AND TAILS CARD GAME ,12,1.25,13154.0,United Kingdom,2025-12-28
516452,21888,BINGO SET,4,3.75,13154.0,United Kingdom,2025-12-28
516452,48111,DOORMAT 3 SMILEY CATS,2,7.49,13154.0,United Kingdom,2025-12-28
516452,84199,GLOW IN DARK DOLPHINS,24,0.21,13154.0,United Kingdom,2025-12-28
516452,21523,DOORMAT FANCY FONT HOME SWEET HOME,2,7.49,13154.0,United Kingdom,2025-12-28
516452,22519,CHILDS GARDEN BRUSH PINK,6,2.1,13154.0,United Kingdom,2025-12-28
516452,22518,CHILDS GARDEN BRUSH BLUE,6,2.1,13154.0,United Kingdom,2025-12-28
516452,22520,CHILDS GARDEN TROWEL BLUE ,12,0.85,13154.0,United Kingdom,2025-12-28
516452,48185,DOORMAT FAIRY CAKE,2,7.49,13154.0,United Kingdom,2025-12-28
516453,21976,PACK OF 60 MUSHROOM CAKE CASES,24,0.55,12480.0,Germany,2025-12-28
516453,79190D,RETRO PLASTIC DAISY TRAY,15,0.42,12480.0,Germany,2025-12-28
516453,22629,SPACEBOY LUNCH BOX ,12,1.95,12480.0,Germany,2025-12-28
516453,79190B,RETRO PLASTIC POLKA TRAY,15,0.42,12480.0,Germany,2025-12-28
