Invoice,StockCode,Description,Quantity,Price,Customer ID,Country,InvoiceDate
509027,84975,HEART SHAPED MIRROR,6,1.69,12837.0,United Kingdom,2025-11-06
509027,22335,HEART DECORATION PAINTED ZINC ,2,0.65,12837.0,United Kingdom,2025-11-06
509027,22341,LOVE GARLAND PAINTED ZINC ,5,1.65,12837.0,United Kingdom,2025-11-06
509027,90122A,PINK CRYSTAL+GLASS BRACELET,1,4.95,12837.0,United Kingdom,2025-11-06
509027,85131C,BEADED CRYSTAL HEART BLUE ON STICK,2,1.25,12837.0,United Kingdom,2025-11-06
509027,22443,GROW YOUR OWN HERBS SET OF 3,1,7.95,12837.0,United Kingdom,2025-11-06
509027,90010B,BLACK/WHITE GLASS/SILVER BRACELET,1,8.95,12837.0,United Kingdom,2025-11-06
509027,85131D,BEADED CRYSTAL HEART PINK\ON STICK,2,1.25,12837.0,United Kingdom,2025-11-06
509027,90175A,WHITE GLASS CHUNKY CHARM BRACELET,1,8.95,12837.0,United Kingdom,2025-11-06
509027,22208,WOOD STAMP SET THANK YOU,1,1.65,12837.0,United Kingdom,2025-11-06
509027,22209,WOOD STAMP SET HAPPY BIRTHDAY,1,1.65,12837.0,United Kingdom,2025-11-06
509027,22210,WOOD STAMP SET BEST WISHES,1,1.65,12837.0,United Kingdom,2025-11-06
509027,21124,SET/10 BLUE SPOTTY PARTY CANDLES,2,1.25,12837.0,United Kingdom,2025-11-06
509027,21121,SET/10 RED SPOTTY PARTY CANDLES,2,1.25,12837.0,United Kingdom,2025-11-06
509027,21122,SET/10 PINK SPOTTY PARTY CANDLES,2,1.25,12837.0,United Kingdom,2025-11-06
509027,21051,RIBBONS PURSE ,1,2.1,12837.0,United Kingdom,2025-11-06
509027,21126,SET OF 6 GIRLS CELEBRATION CANDLES,2,1.25,12837.0,United Kingdom,2025-11-06
509027,21125,SET 6 FOOTBALL CELEBRATION CANDLES,1,1.25,12837.0,United Kingdom,2025-11-06
509027,71459,HANGING JAM JAR T-LIGHT HOLDER,12,0.85,12837.0,United Kingdom,2025-11-06
509027,84757,ENCHANTED GARDEN WROUGHT IRON TABLE,2,14.95,12837.0,United Kingdom,2025-11-06
509027,21446,12 RED ROSE PEG PLACE SETTINGS,2,1.25,12837.0,United Kingdom,2025-11-06
509027,21447,12 IVORY ROSE PEG PLACE SETTINGS,2,1.25,12837.0,United Kingdom,2025-11-06
509027,21445,12 PINK ROSE PEG PLACE SETTINGS,2,1.25,12837.0,United Kingdom,2025-11-06
509027,47589,CONGRATULATIONS BUNTING,2,5.45,12837.0,United Kingdom,2025-11-06
509027,47566B,TEA TIME PARTY BUNTING,1,4.65,12837.0,United Kingdom,2025-11-06
509027,47590B,PINK HAPPY BIRTHDAY BUNTING,2,5.45,12837.0,United Kingdom,2025-11-06
509027,90175C,BLUE GLASS CHUNKY CHARM BRACELET,1,8.95,12837.0,United Kingdom,2025-11-06
509027,22156,HEART DECORATION WITH PEARLS ,8,0.85,12837.0,United Kingdom,2025-11-06
509027,21647,ASSORTED TUTTI FRUTTI LARGE PURSE,1,2.1,12837.0,United Kingdom,2025-11-06
509027,22087,PAPER BUNTING WHITE LACE,3,2.95,12837.0,United Kingdom,2025-11-06
509027,22119,PEACE WOODEN BLOCK LETTERS,2,6.95,12837.0,United Kingdom,2025-11-06
509027,71459,HANGING JAM JAR T-LIGHT HOLDER,12,0.85,12837.0,United Kingdom,2025-11-06
509027,22090,PAPER BUNTING RETRO SPOTS,1,2.95,12837.0,United Kingdom,2025-11-06
509027,35537,CANDLE RING W/CLEAR BEADS,6,0.42,12837.0,United Kingdom,2025-11-06
509027,21375,LARGE CAMPHOR WOOD FIELD MUSHROOM ,2,5.45,12837.0,United Kingdom,2025-11-06
509027,21474,SWEETHEART CREAM STEEL FOLDIN BENCH,2,19.95,12837.0,United Kingdom,2025-11-06
509027,21380,WOODEN HAPPY BIRTHDAY GARLAND,1,2.95,12837.0,United Kingdom,2025-11-06
509027,21381,MINI WOODEN HAPPY BIRTHDAY GARLAND,2,1.69,12837.0,United Kingdom,2025-11-06
509027,22118,JOY WOODEN BLOCK LETTERS,2,4.95,12837.0,United Kingdom,2025-11-06
509027,47566B,TEA TIME PARTY BUNTING,1,4.65,12837.0,United Kingdom,2025-11-06
509027,85123A,WHITE HANGING HEART T-LIGHT HOLDER,2,2.95,12837.0,United Kingdom,2025-11-06
509027,21380,WOODEN HAPPY BIRTHDAY GARLAND,1,2.95,12837.0,United Kingdom,2025-11-06
509027,22335,HEART DECORATION PAINTED ZINC ,1,0.65,12837.0,United Kingdom,2025-11-06
509027,48189,DOOR MAT FRIENDSHIP ,1,7.49,12837.0,United Kingdom,2025-11-06
509027,48187,DOOR MAT NEW ENGLAND,1,7.49,12837.0,United Kingdom,2025-11-06
509027,47590A,BLUE HAPPY BIRTHDAY BUNTING,2,5.45,12837.0,United Kingdom,2025-11-06
509027,22090,PAPER BUNTING RETRO SPOTS,2,2.95,12837.0,United Kingdom,2025-11-06
509027,21755,LOVE BUILDING BLOCK WORD,2,5.95,12837.0,United Kingdom,2025-11-06
509027,22294,HEART FILIGREE DOVE  SMALL,1,1.25,12837.0,United Kingdom,2025-11-06
509027,21376,LARGE  TALL CAMPHOR WOOD TOADSTOOL ,2,5.45,12837.0,United Kingdom,2025-11-06
509027,22488,NATURAL SLATE RECTANGLE CHALKBOARD,4,1.65,12837.0,United Kingdom,2025-11-06
509027,22084,PAPER CHAIN KIT EMPIRE,3,2.95,12837.0,United Kingdom,2025-11-06
509027,22139,RETRO SPOT TEA SET CERAMIC 11 PC ,2,4.95,12837.0,United Kingdom,2025-11-06
509027,21384,IVORY HANGING DECORATION  BUTTERFLY,2,0.85,12837.0,United Kingdom,2025-11-06
509027,22295,HEART FILIGREE DOVE LARGE,3,1.65,12837.0,United Kingdom,2025-11-06
509027,22470,HEART OF WICKER LARGE,3,2.95,12837.0,United Kingdom,2025-11-06
509027,21385,IVORY HANGING DECORATION  HEART,3,0.85,12837.0,United Kingdom,2025-11-06
509027,22297,HEART IVORY TRELLIS SMALL,3,1.25,12837.0,United Kingdom,2025-11-06
509027,21390,FILIGRIS HEART WITH BUTTERFLY,3,1.25,12837.0,United Kingdom,2025-11-06
509027,85213,MINI  ZINC GARDEN DECORATIONS ,1,0.85,12837.0,United Kingdom,2025-11-06
509027,22294,HEART FILIGREE DOVE  SMALL,2,1.25,12837.0,United Kingdom,2025-11-06
509027,22188,BLACK HEART CARD HOLDER,2,3.95,12837.0,United Kingdom,2025-11-06
509027,84972L,GIANT PINK HEART MEMO HOLDER,3,3.95,12837.0,United Kingdom,2025-11-06
509027,22189,CREAM HEART CARD HOLDER,4,3.95,12837.0,United Kingdom,2025-11-06
509027,22058,CERAMIC LOVE HEARTS DESIGN MUG,1,1.49,12837.0,United Kingdom,2025-11-06
509027,21231,SWEETHEART CERAMIC TRINKET BOX,1,1.25,12837.0,United Kingdom,2025-11-06
509027,22469,HEART OF WICKER SMALL,3,1.65,12837.0,United Kingdom,2025-11-06
509027,21361,LOVE LARGE WOOD LETTERS ,2,12.75,12837.0,United Kingdom,2025-11-06
509027,22487,WHITE WOOD GARDEN PLANT LADDER,2,9.95,12837.0,United Kingdom,2025-11-06
509028,84997A,GREEN 3 PIECE MINI DOTS CUTLERY SET,6,3.75,16717.0,United Kingdom,2025-11-06
509028,22513,DOORSTOP FOOTBALL DESIGN,4,3.75,16717.0,United Kingdom,2025-11-06
509028,71459,HANGING JAM JAR T-LIGHT HOLDER,12,0.85,16717.0,United Kingdom,2025-11-06
509028,85123A,WHITE HANGING HEART T-LIGHT HOLDER,12,2.95,16717.0,United Kingdom,2025-11-06
509028,85035A,GARDENIA 3 WICK MORRIS BOXED CANDLE,4,4.25,16717.0,United Kingdom,2025-11-06
509028,21688,SILVER PLATE CANDLE BOWL SMALL,6,2.95,16717.0,United Kingdom,2025-11-06
509028,22224,WHITE LOVEBIRD LANTERN,6,2.95,16717.0,United Kingdom,2025-11-06
509028,84406B,CREAM CUPID HEARTS COAT HANGER,8,3.25,16717.0,United Kingdom,2025-11-06
509028,21733,RED HANGING HEART T-LIGHT HOLDER,6,2.95,16717.0,United Kingdom,2025-11-06
509028,71053,WHITE METAL LANTERN,4,3.75,16717.0,United Kingdom,2025-11-06
509028,22275,WEEKEND BAG VINTAGE ROSE PAISLEY,2,8.5,16717.0,United Kingdom,2025-11-06
509028,85035B,CHOCOLATE 3 WICK MORRIS BOX CANDLE,4,4.25,16717.0,United Kingdom,2025-11-06
509028,22411,JUMBO SHOPPER VINTAGE RED PAISLEY,10,1.95,16717.0,United Kingdom,2025-11-06
509028,82482,WOODEN PICTURE FRAME WHITE FINISH,6,2.55,16717.0,United Kingdom,2025-11-06
509028,21137,BLACK RECORD COVER FRAME,4,3.75,16717.0,United Kingdom,2025-11-06
509028,21125,SET 6 FOOTBALL CELEBRATION CANDLES,12,1.25,16717.0,United Kingdom,2025-11-06
509028,20711,JUMBO BAG TOYS ,10,1.95,16717.0,United Kingdom,2025-11-06
509028,21932,SCANDINAVIAN PAISLEY PICNIC BAG,5,2.95,16717.0,United Kingdom,2025-11-06
509028,21251,DINOSAUR HEIGHT CHART STICKER SET,6,2.95,16717.0,United Kingdom,2025-11-06
509028,21249,WOODLAND  HEIGHT CHART STICKERS ,6,2.95,16717.0,United Kingdom,2025-11-06
509028,21519,GIN & TONIC DIET GREETING CARD ,12,0.42,16717.0,United Kingdom,2025-11-06
509028,22051,BLUE SCANDINAVIAN PAISLEY WRAP,25,0.42,16717.0,United Kingdom,2025-11-06
509028,21558,SKULL LUNCH BOX WITH CUTLERY ,6,2.55,16717.0,United Kingdom,2025-11-06
509029,15056BL,EDWARDIAN PARASOL BLACK,6,5.95,14031.0,United Kingdom,2025-11-06
509029,22424,ENAMEL BREAD BIN CREAM,2,12.75,14031.0,United Kingdom,2025-11-06
509029,22425,ENAMEL COLANDER CREAM,4,4.95,14031.0,United Kingdom,2025-11-06
509029,22426,ENAMEL WASH BOWL CREAM,4,3.75,14031.0,United Kingdom,2025-11-06
509029,22430,ENAMEL WATERING CAN CREAM,4,4.95,14031.0,United Kingdom,2025-11-06
509029,35004B,SET OF 3 BLACK FLYING DUCKS,6,5.45,14031.0,United Kingdom,2025-11-06
509029,22423,REGENCY CAKESTAND 3 TIER,5,12.75,14031.0,United Kingdom,2025-11-06
509029,79067,CORONA MEXICAN TRAY,5,3.75,14031.0,United Kingdom,2025-11-06
509029,15056N,EDWARDIAN PARASOL NATURAL,6,5.95,14031.0,United Kingdom,2025-11-06
509029,20679,EDWARDIAN PARASOL RED,6,5.95,14031.0,United Kingdom,2025-11-06
509029,15056P,EDWARDIAN PARASOL PINK,3,5.95,14031.0,United Kingdom,2025-11-06
509029,22429,ENAMEL MEASURING JUG CREAM,4,4.25,14031.0,United Kingdom,2025-11-06
509029,21662,VINTAGE GLASS COFFEE CADDY,2,5.95,14031.0,United Kingdom,2025-11-06
509029,21661,VINTAGE GLASS TEA CADDY,2,5.95,14031.0,United Kingdom,2025-11-06
509029,21524,DOOR MAT SPOTTY HOME SWEET HOME,10,6.35,14031.0,United Kingdom,2025-11-06
509029,22365,DOOR MAT RESPECTABLE HOUSE,10,6.35,14031.0,United Kingdom,2025-11-06
509029,21955,DOOR MAT UNION JACK GUNS AND ROSES,10,6.35,14031.0,United Kingdom,2025-11-06
509029,48138,DOOR MAT UNION FLAG,10,6.35,14031.0,United Kingdom,2025-11-06
509029,22606,WOODEN SKITTLES GARDEN SET,4,12.75,14031.0,United Kingdom,2025-11-06
509029,22605,WOODEN CROQUET GARDEN SET,4,10.95,14031.0,United Kingdom,2025-11-06
509029,22607,WOODEN ROUNDERS GARDEN SET ,12,7.65,14031.0,United Kingdom,2025-11-06
509029,85114B,IVORY ENCHANTED FOREST PLACEMAT,8,1.65,14031.0,United Kingdom,2025-11-06
509029,37370,RETRO COFFEE MUGS ASSORTED,72,1.06,14031.0,United Kingdom,2025-11-06
509030,21900,"KEY FOB , SHED",4,0.65,13764.0,United Kingdom,2025-11-06
509030,21911,GARDEN METAL SIGN ,2,1.65,13764.0,United Kingdom,2025-11-06
509030,21172,PARTY METAL SIGN ,1,1.45,13764.0,United Kingdom,2025-11-06
509030,21977,PACK OF 60 PINK PAISLEY CAKE CASES,6,0.55,13764.0,United Kingdom,2025-11-06
509030,21212,PACK OF 72 RETRO SPOT CAKE CASES,12,0.55,13764.0,United Kingdom,2025-11-06
509030,21901,"KEY FOB , BACK DOOR ",3,0.65,13764.0,United Kingdom,2025-11-06
509030,84801A,PINK HYDRANGEA ART FLOWER,6,2.1,13764.0,United Kingdom,2025-11-06
509030,22507,MEMO BOARD RETROSPOT  DESIGN,1,4.95,13764.0,United Kingdom,2025-11-06
509030,22505,MEMO BOARD COTTAGE DESIGN,3,4.95,13764.0,United Kingdom,2025-11-06
509030,84802A,WHITE ANEMONE ARTIFICIAL FLOWER,6,1.69,13764.0,United Kingdom,2025-11-06
509030,21910,WAY OUT METAL SIGN ,2,1.65,13764.0,United Kingdom,2025-11-06
509030,40018F,CHERRY DESIGN PAPERLANTERNS,4,1.95,13764.0,United Kingdom,2025-11-06
509030,21704,BAG 250g SWIRLY MARBLES,5,0.85,13764.0,United Kingdom,2025-11-06
509030,21472,LADYBIRD + BEE RAFFIA FOOD COVER,1,3.75,13764.0,United Kingdom,2025-11-06
509030,21975,PACK OF 60 DINOSAUR CAKE CASES,10,0.55,13764.0,United Kingdom,2025-11-06
509030,21791,VINTAGE HEADS AND TAILS CARD GAME ,2,1.25,13764.0,United Kingdom,2025-11-06
509030,15039,SANDALWOOD FAN,3,0.85,13764.0,United Kingdom,2025-11-06
509030,48187,DOOR MAT NEW ENGLAND,1,7.49,13764.0,United Kingdom,2025-11-06
509030,20717,STRAWBERRY SHOPPER BAG,2,1.25,13764.0,United Kingdom,2025-11-06
509030,21928,JUMBO BAG SCANDINAVIAN PAISLEY,1,1.95,13764.0,United Kingdom,2025-11-06
509030,21931,JUMBO STORAGE BAG SUKI,2,1.95,13764.0,United Kingdom,2025-11-06
509030,21892,TRADITIONAL WOODEN CATCH CUP GAME ,4,1.25,13764.0,United Kingdom,2025-11-06
509030,21891,TRADITIONAL WOODEN SKIPPING ROPE,4,1.25,13764.0,United Kingdom,2025-11-06
509030,84992,72 SWEETHEART FAIRY CAKE CASES,10,0.55,13764.0,United Kingdom,2025-11-06
509030,40046A,RED DAISY PAPER LAMPSHADE,3,1.25,13764.0,United Kingdom,2025-11-06
509030,21918,SET 12 KIDS COLOUR  CHALK STICKS,5,0.42,13764.0,United Kingdom,2025-11-06
509030,21917,SET 12 KIDS  WHITE CHALK STICKS,3,0.42,13764.0,United Kingdom,2025-11-06
509030,21790,VINTAGE SNAP CARDS,5,0.85,13764.0,United Kingdom,2025-11-06
509030,21795,SET OF 3 BLUE STRIPE BASKET,1,12.75,13764.0,United Kingdom,2025-11-06
509030,22384,LUNCH BAG PINK RETROSPOT,4,1.65,13764.0,United Kingdom,2025-11-06
509030,22383,LUNCH BAG SUKI  DESIGN ,4,1.65,13764.0,United Kingdom,2025-11-06
509030,85123A,WHITE HANGING HEART T-LIGHT HOLDER,6,2.95,13764.0,United Kingdom,2025-11-06
509030,48194,DOOR MAT HEARTS,1,7.49,13764.0,United Kingdom,2025-11-06
509030,84991,60 TEATIME FAIRY CAKE CASES,6,0.55,13764.0,United Kingdom,2025-11-06
509030,15058B,PINK WHITE SPOTS GARDEN PARASOL,1,7.95,13764.0,United Kingdom,2025-11-06
509030,21715,GIRLS VINTAGE TIN SEASIDE BUCKET,2,2.55,13764.0,United Kingdom,2025-11-06
509030,22536,MAGIC DRAWING SLATE PURDEY,10,0.42,13764.0,United Kingdom,2025-11-06
509030,22645,CERAMIC HEART FAIRY CAKE MONEY BANK,4,1.45,13764.0,United Kingdom,2025-11-06
509030,22607,WOODEN ROUNDERS GARDEN SET ,1,8.5,13764.0,United Kingdom,2025-11-06
509030,22083,PAPER CHAIN KIT RETRO SPOT,2,2.95,13764.0,United Kingdom,2025-11-06
509030,22090,PAPER BUNTING RETRO SPOTS,3,2.95,13764.0,United Kingdom,2025-11-06
509030,22607,WOODEN ROUNDERS GARDEN SET ,1,8.5,13764.0,United Kingdom,2025-11-06
509030,85099F,JUMBO BAG STRAWBERRY,2,1.95,13764.0,United Kingdom,2025-11-06
509030,21121,SET/10 RED SPOTTY PARTY CANDLES,17,1.25,13764.0,United Kingdom,2025-11-06
509030,21124,SET/10 BLUE SPOTTY PARTY CANDLES,11,1.25,13764.0,United Kingdom,2025-11-06
509030,21122,SET/10 PINK SPOTTY PARTY CANDLES,13,1.25,13764.0,United Kingdom,2025-11-06
509030,21126,SET OF 6 GIRLS CELEBRATION CANDLES,5,1.25,13764.0,United Kingdom,2025-11-06
509030,21927,BLUE/CREAM STRIPE CUSHION COVER ,2,1.25,13764.0,United Kingdom,2025-11-06
509030,20730,STRAWBERRY CANDY BAG,2,1.25,13764.0,United Kingdom,2025-11-06
509030,22098,BOUDOIR SQUARE TISSUE BOX,2,1.25,13764.0,United Kingdom,2025-11-06
509030,22439,6 ROCKET BALLOONS ,10,0.65,13764.0,United Kingdom,2025-11-06
509030,22537,MAGIC DRAWING SLATE DINOSAUR,10,0.42,13764.0,United Kingdom,2025-11-06
509030,21924,BLUE/CREAM STRIPE FRINGE HAMMOCK,1,7.95,13764.0,United Kingdom,2025-11-06
509030,22434,BALLOON PUMP WITH 10 BALLOONS,10,1.95,13764.0,United Kingdom,2025-11-06
509030,22440,BALLOON WATER BOMB PACK OF 35,20,0.42,13764.0,United Kingdom,2025-11-06
509030,22303,COFFEE MUG APPLES DESIGN,6,2.55,13764.0,United Kingdom,2025-11-06
509030,22410,MONEY BOX HOUSEKEEPING DESIGN,6,1.25,13764.0,United Kingdom,2025-11-06
509030,22489,PACK OF 12 TRADITIONAL CRAYONS,9,0.42,13764.0,United Kingdom,2025-11-06
509030,21357,TOAST ITS - DINOSAUR,3,1.25,13764.0,United Kingdom,2025-11-06
509030,21040,MODERN VINTAGE COTTON SHOPPING BAG,1,2.55,13764.0,United Kingdom,2025-11-06
509030,22302,COFFEE MUG PEARS  DESIGN,6,2.55,13764.0,United Kingdom,2025-11-06
509030,22556,PLASTERS IN TIN CIRCUS PARADE ,4,1.65,13764.0,United Kingdom,2025-11-06
509030,22645,CERAMIC HEART FAIRY CAKE MONEY BANK,4,1.45,13764.0,United Kingdom,2025-11-06
509030,21749,LARGE RED RETROSPOT WINDMILL,3,2.1,13764.0,United Kingdom,2025-11-06
509030,21746,SMALL RED RETROSPOT WINDMILL,10,1.25,13764.0,United Kingdom,2025-11-06
509030,15058A,BLUE WHITE SPOTS GARDEN PARASOL,3,7.95,13764.0,United Kingdom,2025-11-06
509030,22508,DOORSTOP RETROSPOT HEART,3,3.75,13764.0,United Kingdom,2025-11-06
509030,22559,SEASIDE FLYING DISC,4,1.25,13764.0,United Kingdom,2025-11-06
509031,22122,SET OF 2 FANCY FONT TEA TOWELS,1,2.95,17950.0,United Kingdom,2025-11-06
509031,84692,BOX OF 24 COCKTAIL PARASOLS,1,0.42,17950.0,United Kingdom,2025-11-06
509031,79051A,SMOKEY GREY COLOUR D.O.F. GLASS,4,0.65,17950.0,United Kingdom,2025-11-06
509031,46126A,ELVIS WALLHANGING / CURTAIN,6,1.25,17950.0,United Kingdom,2025-11-06
509031,84007,MAGIC GARDEN MOUNT FUJI,6,2.55,17950.0,United Kingdom,2025-11-06
509031,90214M,"LETTER ""M"" BLING KEY RING",1,1.25,17950.0,United Kingdom,2025-11-06
509031,21507,"ELEPHANT, BIRTHDAY CARD, ",12,0.42,17950.0,United Kingdom,2025-11-06
509031,22607,WOODEN ROUNDERS GARDEN SET ,2,8.5,17950.0,United Kingdom,2025-11-06
509031,90214D,"LETTER ""D"" BLING KEY RING",1,1.25,17950.0,United Kingdom,2025-11-06
509031,22174,PHOTO CUBE,6,1.65,17950.0,United Kingdom,2025-11-06
509031,75131,METAL TUBE CHIME ON BAMBOO,1,1.69,17950.0,United Kingdom,2025-11-06
509031,22606,WOODEN SKITTLES GARDEN SET,1,15.95,17950.0,United Kingdom,2025-11-06
509031,21912,VINTAGE SNAKES & LADDERS,4,3.75,17950.0,United Kingdom,2025-11-06
509031,21791,VINTAGE HEADS AND TAILS CARD GAME ,8,1.25,17950.0,United Kingdom,2025-11-06
509031,21889,WOODEN BOX OF DOMINOES,8,1.25,17950.0,United Kingdom,2025-11-06
509031,22605,WOODEN CROQUET GARDEN SET,2,12.75,17950.0,United Kingdom,2025-11-06
509031,21563,RED HEART SHAPE LOVE BUCKET ,2,2.95,17950.0,United Kingdom,2025-11-06
509031,21790,VINTAGE SNAP CARDS,8,0.85,17950.0,United Kingdom,2025-11-06
509031,79320,FLAMINGO LIGHTS,2,4.95,17950.0,United Kingdom,2025-11-06
509031,21508,VINTAGE KID DOLLY CARD ,12,0.42,17950.0,United Kingdom,2025-11-06
509031,21509,COWBOYS AND INDIANS BIRTHDAY CARD ,12,0.42,17950.0,United Kingdom,2025-11-06
509032,21755,LOVE BUILDING BLOCK WORD,3,5.95,16664.0,United Kingdom,2025-11-06
509032,21754,HOME BUILDING BLOCK WORD,3,5.95,16664.0,United Kingdom,2025-11-06
509032,22111,SCOTTIE DOG HOT WATER BOTTLE,2,4.95,16664.0,United Kingdom,2025-11-06
509032,85066,CREAM SWEETHEART MINI CHEST,2,12.75,16664.0,United Kingdom,2025-11-06
509032,21626,VINTAGE UNION JACK PENNANT,6,1.95,16664.0,United Kingdom,2025-11-06
509032,22328,ROUND SNACK BOXES SET OF 4 FRUITS ,3,2.95,16664.0,United Kingdom,2025-11-06
509032,22352,LUNCH BOX WITH CUTLERY RETROSPOT ,3,2.55,16664.0,United Kingdom,2025-11-06
509032,21485,RED SPOT HEART HOT WATER BOTTLE,2,4.95,16664.0,United Kingdom,2025-11-06
509033,84932C,SMALL ORIENTAL BLUE FOLDING STOOL,3,8.5,15879.0,United Kingdom,2025-11-06
509033,84288B,SET/2 BLUE  NOODLE BASKETS,1,1.95,15879.0,United Kingdom,2025-11-06
509033,84840,SWEETHEART CARRY-ALL BASKET,1,8.5,15879.0,United Kingdom,2025-11-06
509033,84932A,SMALL GREEN PEONY FOLDING STOOL,3,8.5,15879.0,United Kingdom,2025-11-06
509033,21629,SQUARE FLOOR CUSHION VINTAGE RED,6,7.95,15879.0,United Kingdom,2025-11-06
509033,21791,VINTAGE HEADS AND TAILS CARD GAME ,1,1.25,15879.0,United Kingdom,2025-11-06
509033,21626,VINTAGE UNION JACK PENNANT,1,1.95,15879.0,United Kingdom,2025-11-06
509033,20738,GREEN MINI TAPE MEASURE ,3,0.85,15879.0,United Kingdom,2025-11-06
509033,40016,CHINESE DRAGON PAPER LANTERNS,24,0.42,15879.0,United Kingdom,2025-11-06
509033,40018F,CHERRY DESIGN PAPERLANTERNS,1,1.95,15879.0,United Kingdom,2025-11-06
509033,21912,VINTAGE SNAKES & LADDERS,1,3.75,15879.0,United Kingdom,2025-11-06
509033,79321,CHILLI LIGHTS,2,4.95,15879.0,United Kingdom,2025-11-06
509033,21703,BAG 125g SWIRLY MARBLES,1,0.42,15879.0,United Kingdom,2025-11-06
509033,21790,VINTAGE SNAP CARDS,1,0.85,15879.0,United Kingdom,2025-11-06
509033,71459,HANGING JAM JAR T-LIGHT HOLDER,12,0.85,15879.0,United Kingdom,2025-11-06
509033,21621,VINTAGE UNION JACK BUNTING,1,8.5,15879.0,United Kingdom,2025-11-06
509033,21742,LARGE ROUND WICKER PLATTER ,1,5.95,15879.0,United Kingdom,2025-11-06
509033,85054,FRENCH ENAMEL POT W LID,1,2.95,15879.0,United Kingdom,2025-11-06
509033,22118,JOY WOODEN BLOCK LETTERS,1,4.95,15879.0,United Kingdom,2025-11-06
509033,84762A,WHITE PICNIC BARBECUE BUCKET,1,10.75,15879.0,United Kingdom,2025-11-06
509033,21915,RED  HARMONICA IN BOX ,1,1.25,15879.0,United Kingdom,2025-11-06
509033,21914,BLUE HARMONICA IN BOX ,2,1.25,15879.0,United Kingdom,2025-11-06
509033,84962,SET/3 COLOUR PAINTED KASHMIRI STOOL,1,59.95,15879.0,United Kingdom,2025-11-06
509033,22109,FULL ENGLISH BREAKFAST PLATE,1,3.75,15879.0,United Kingdom,2025-11-06
509033,22558,CLOTHES PEGS RETROSPOT PACK 24 ,1,1.25,15879.0,United Kingdom,2025-11-06
509033,21174,POTTERING IN THE SHED METAL SIGN,1,1.95,15879.0,United Kingdom,2025-11-06
509033,22605,WOODEN CROQUET GARDEN SET,1,12.75,15879.0,United Kingdom,2025-11-06
509033,21042,RED SPOTTY APRON ,1,5.95,15879.0,United Kingdom,2025-11-06
509033,82580,BATHROOM METAL SIGN,1,0.55,15879.0,United Kingdom,2025-11-06
509033,85121C,RETRO LAUNDRY TUB PISTACHIO,1,8.5,15879.0,United Kingdom,2025-11-06
509033,22549,PICTURE DOMINOES,2,1.45,15879.0,United Kingdom,2025-11-06
509033,82578,KITCHEN METAL SIGN,1,0.55,15879.0,United Kingdom,2025-11-06
509033,21755,LOVE BUILDING BLOCK WORD,1,5.95,15879.0,United Kingdom,2025-11-06
509033,21756,BATH BUILDING BLOCK WORD,1,5.95,15879.0,United Kingdom,2025-11-06
509033,21754,HOME BUILDING BLOCK WORD,1,5.95,15879.0,United Kingdom,2025-11-06
509033,82581,TOILET METAL SIGN,1,0.55,15879.0,United Kingdom,2025-11-06
509033,21662,VINTAGE GLASS COFFEE CADDY,1,5.95,15879.0,United Kingdom,2025-11-06
509033,21892,TRADITIONAL WOODEN CATCH CUP GAME ,1,1.25,15879.0,United Kingdom,2025-11-06
509033,22499,WOODEN UNION JACK BUNTING,1,5.95,15879.0,United Kingdom,2025-11-06
509033,48197,DOOR MAT BIRD ON THE WIRE,1,7.49,15879.0,United Kingdom,2025-11-06
509033,21524,DOOR MAT SPOTTY HOME SWEET HOME,1,7.49,15879.0,United Kingdom,2025-11-06
509033,21664,RIDGED GLASS STORAGE JAR CREAM LID,1,3.75,15879.0,United Kingdom,2025-11-06
509033,20681,PINK SPOTTY CHILDS UMBRELLA,1,3.25,15879.0,United Kingdom,2025-11-06
509033,21704,BAG 250g SWIRLY MARBLES,2,0.85,15879.0,United Kingdom,2025-11-06
509033,21469,POLKA DOT RAFFIA FOOD COVER,1,3.75,15879.0,United Kingdom,2025-11-06
509033,21472,LADYBIRD + BEE RAFFIA FOOD COVER,1,3.75,15879.0,United Kingdom,2025-11-06
509033,21468,BUTTERFLY CROCHET FOOD COVER,1,3.75,15879.0,United Kingdom,2025-11-06
509033,16011,ANIMAL STICKERS,24,0.21,15879.0,United Kingdom,2025-11-06
509033,84760S,SMALL HANGING GLASS+ZINC LANTERN,6,1.45,15879.0,United Kingdom,2025-11-06
509033,37491A,YELLOW/PINK CERAMIC CANDLE HOLDER,1,1.65,15879.0,United Kingdom,2025-11-06
509033,37491B,BLUE/YELLOW CERAMIC CANDLE HOLDER,1,1.65,15879.0,United Kingdom,2025-11-06
509033,37491C,GREEN/BLUE CERAMIC CANDLE HOLDER,1,1.65,15879.0,United Kingdom,2025-11-06
509033,37491D,PURPLE/BLUE CERAMIC CANDLE HOLDER,1,1.65,15879.0,United Kingdom,2025-11-06
509033,22119,PEACE WOODEN BLOCK LETTERS,1,6.95,15879.0,United Kingdom,2025-11-06
509033,22051,BLUE SCANDINAVIAN PAISLEY WRAP,25,0.42,15879.0,United Kingdom,2025-11-06
509033,21678,PAISLEY PATTERN  STICKERS,1,0.85,15879.0,United Kingdom,2025-11-06
509033,20682,RED SPOTTY CHILDS UMBRELLA,1,3.25,15879.0,United Kingdom,2025-11-06
509033,21653,GLASS ETCHED T-LIGHT HOLDER LARGE,3,2.1,15879.0,United Kingdom,2025-11-06
509033,22498,WOODEN REGATTA BUNTING,1,5.95,15879.0,United Kingdom,2025-11-06
509033,21070,VINTAGE BILLBOARD MUG ,6,1.25,15879.0,United Kingdom,2025-11-06
509033,21868,POTTING SHED TEA MUG,6,1.25,15879.0,United Kingdom,2025-11-06
509033,21917,SET 12 KIDS  WHITE CHALK STICKS,1,0.42,15879.0,United Kingdom,2025-11-06
509033,21253,SET OF PICTURE FRAME  STICKERS,1,2.95,15879.0,United Kingdom,2025-11-06
509033,21892,TRADITIONAL WOODEN CATCH CUP GAME ,1,1.25,15879.0,United Kingdom,2025-11-06
509033,22607,WOODEN ROUNDERS GARDEN SET ,1,8.5,15879.0,United Kingdom,2025-11-06
509033,21737,SET 3 WICKER LOG BASKETS,1,19.95,15879.0,United Kingdom,2025-11-06
509033,21918,SET 12 KIDS COLOUR  CHALK STICKS,2,0.42,15879.0,United Kingdom,2025-11-06
509033,22548,HEADS AND TAILS SPORTING FUN,1,1.25,15879.0,United Kingdom,2025-11-06
509033,22559,SEASIDE FLYING DISC,2,1.25,15879.0,United Kingdom,2025-11-06
509033,84279P,CHERRY BLOSSOM  DECORATIVE FLASK,1,3.75,15879.0,United Kingdom,2025-11-06
509033,84279B,CHERRY BLOSSOM DECORATIVE FLASK,1,3.75,15879.0,United Kingdom,2025-11-06
509033,21661,VINTAGE GLASS TEA CADDY,1,5.95,15879.0,United Kingdom,2025-11-06
509033,22498,WOODEN REGATTA BUNTING,1,5.95,15879.0,United Kingdom,2025-11-06
509033,22550,HOLIDAY FUN LUDO,1,3.75,15879.0,United Kingdom,2025-11-06
509033,21655,HANGING RIDGE GLASS T-LIGHT HOLDER,5,1.69,15879.0,United Kingdom,2025-11-06
