Invoice,StockCode,Description,Quantity,Price,Customer ID,Country,InvoiceDate
512903,21623,VINTAGE UNION JACK MEMOBOARD,4,9.95,16156.0,United Kingdom,2025-12-01
512903,47556B,TEA TIME TEA TOWELS ,12,2.95,16156.0,United Kingdom,2025-12-01
512903,21232,STRAWBERRY CERAMIC TRINKET BOX,12,1.25,16156.0,United Kingdom,2025-12-01
512903,21231,SWEETHEART CERAMIC TRINKET BOX,12,1.25,16156.0,United Kingdom,2025-12-01
512903,22718,CARD CAT AND TREE ,24,0.42,16156.0,United Kingdom,2025-12-01
512903,22714,CARD BIRTHDAY COWBOY,12,0.42,16156.0,United Kingdom,2025-12-01
512903,22706,WRAP COWBOYS  ,25,0.42,16156.0,United Kingdom,2025-12-01
512903,22561,WOODEN SCHOOL COLOURING SET,12,1.65,16156.0,United Kingdom,2025-12-01
512903,20726,LUNCH BAG WOODLAND,10,1.65,16156.0,United Kingdom,2025-12-01
512903,22528,GARDENERS KNEELING PAD,12,1.25,16156.0,United Kingdom,2025-12-01
512903,22717,CARD DOG AND BALL ,12,0.42,16156.0,United Kingdom,2025-12-01
512903,22549,PICTURE DOMINOES,12,1.45,16156.0,United Kingdom,2025-12-01
512903,22492,MINI PAINT SET VINTAGE ,36,0.65,16156.0,United Kingdom,2025-12-01
512903,22381,TOY TIDY PINK RETROSPOT  ,5,2.1,16156.0,United Kingdom,2025-12-01
512903,22379,RECYCLING BAG RETROSPOT ,5,2.1,16156.0,United Kingdom,2025-12-01
512903,21563,RED HEART SHAPE LOVE BUCKET ,6,2.95,16156.0,United Kingdom,2025-12-01
512903,22410,MONEY BOX HOUSEKEEPING DESIGN,12,1.25,16156.0,United Kingdom,2025-12-01
512903,22644,CERAMIC CHERRY CAKE MONEY BANK,12,1.45,16156.0,United Kingdom,2025-12-01
512904,85150,LADIES & GENTLEMEN METAL SIGN,6,2.55,12982.0,United Kingdom,2025-12-01
512904,22319,HAIRCLIPS FORTIES FABRIC ASSORTED,12,0.65,12982.0,United Kingdom,2025-12-01
512904,85175,CACTI T-LIGHT CANDLES,16,0.42,12982.0,United Kingdom,2025-12-01
512904,72586,"S/6 HALLOWEEN GHOST T LIGHTS, 5CM H",36,0.42,12982.0,United Kingdom,2025-12-01
512904,21174,POTTERING IN THE SHED METAL SIGN,12,1.95,12982.0,United Kingdom,2025-12-01
512904,84006,MAGIC TREE -PAPER FLOWERS,12,0.85,12982.0,United Kingdom,2025-12-01
512904,85212,MINI PAINTED GARDEN DECORATION ,12,0.85,12982.0,United Kingdom,2025-12-01
512904,22569,FELTCRAFT CUSHION BUTTERFLY,4,3.75,12982.0,United Kingdom,2025-12-01
512904,62096B,PURPLE/TURQ FLOWERS HANDBAG,6,1.25,12982.0,United Kingdom,2025-12-01
512904,21232,STRAWBERRY CERAMIC TRINKET BOX,12,1.25,12982.0,United Kingdom,2025-12-01
512904,40046A,RED DAISY PAPER LAMPSHADE,12,1.25,12982.0,United Kingdom,2025-12-01
512904,20914,SET/5 RED SPOTTY LID GLASS BOWLS,12,2.95,12982.0,United Kingdom,2025-12-01
512904,79029,GLASS HONEYPOT WASP CATCHER,6,1.95,12982.0,United Kingdom,2025-12-01
512904,22558,CLOTHES PEGS RETROSPOT PACK 24 ,12,1.25,12982.0,United Kingdom,2025-12-01
512904,21231,SWEETHEART CERAMIC TRINKET BOX,12,1.25,12982.0,United Kingdom,2025-12-01
512904,82607A,GLASS BONBON JAR PARFUME AUX FLEURE,6,1.25,12982.0,United Kingdom,2025-12-01
512904,22284,HEN HOUSE DECORATION,12,1.65,12982.0,United Kingdom,2025-12-01
512904,22178,VICTORIAN GLASS HANGING T-LIGHT,12,1.25,12982.0,United Kingdom,2025-12-01
512904,21155,RED SPOTTY PEG BAG,6,2.1,12982.0,United Kingdom,2025-12-01
512904,47568,ENGLISH ROSE DESIGN PEG BAG,6,2.1,12982.0,United Kingdom,2025-12-01
512904,71459,HANGING JAM JAR T-LIGHT HOLDER,24,0.85,12982.0,United Kingdom,2025-12-01
512905,22381,TOY TIDY PINK RETROSPOT  ,4,2.1,14825.0,United Kingdom,2025-12-01
512905,22627,MINT KITCHEN SCALES,2,8.5,14825.0,United Kingdom,2025-12-01
512905,21473,SWEETHEART CREAM STEEL TABLE RECT,1,19.95,14825.0,United Kingdom,2025-12-01
512905,79029,GLASS HONEYPOT WASP CATCHER,3,1.95,14825.0,United Kingdom,2025-12-01
512905,22384,LUNCH BAG PINK RETROSPOT,4,1.65,14825.0,United Kingdom,2025-12-01
512905,20727,LUNCH BAG  BLACK SKULL.,5,1.65,14825.0,United Kingdom,2025-12-01
512905,22084,PAPER CHAIN KIT EMPIRE,5,2.95,14825.0,United Kingdom,2025-12-01
512905,22379,RECYCLING BAG RETROSPOT ,4,2.1,14825.0,United Kingdom,2025-12-01
512905,21164,HOME SWEET HOME METAL SIGN ,3,2.95,14825.0,United Kingdom,2025-12-01
512905,22377,BOTTLE BAG RETROSPOT ,4,2.1,14825.0,United Kingdom,2025-12-01
512905,84789,ENCHANTED BIRD PLANT CAGE,1,3.75,14825.0,United Kingdom,2025-12-01
512905,21910,WAY OUT METAL SIGN ,3,1.65,14825.0,United Kingdom,2025-12-01
512905,21899,"KEY FOB , GARAGE DESIGN",3,0.65,14825.0,United Kingdom,2025-12-01
512905,21900,"KEY FOB , SHED",3,0.65,14825.0,United Kingdom,2025-12-01
512905,21901,"KEY FOB , BACK DOOR ",3,0.65,14825.0,United Kingdom,2025-12-01
512905,21902,"KEY FOB , FRONT  DOOR ",3,0.65,14825.0,United Kingdom,2025-12-01
512905,21936,RED RETROSPOT PICNIC BAG,5,2.95,14825.0,United Kingdom,2025-12-01
512906,22103,MIRROR MOSAIC T-LIGHT HOLDER ROUND,84,1.45,17349.0,United Kingdom,2025-12-01
512907,16169P,WRAP GREEN RUSSIAN FOLKART ,25,0.42,12932.0,United Kingdom,2025-12-01
512907,16169N,WRAP BLUE RUSSIAN FOLKART,25,0.42,12932.0,United Kingdom,2025-12-01
512907,16161M,WRAP  PINK FLOCK,25,0.42,12932.0,United Kingdom,2025-12-01
512907,22051,BLUE SCANDINAVIAN PAISLEY WRAP,25,0.42,12932.0,United Kingdom,2025-12-01
512907,21499,BLUE SPOTS  WRAP,50,0.42,12932.0,United Kingdom,2025-12-01
512907,21500,PINK SPOTS  WRAP ,50,0.42,12932.0,United Kingdom,2025-12-01
512907,21498,RED SPOTS  WRAP ,50,0.42,12932.0,United Kingdom,2025-12-01
512907,16161P,WRAP ENGLISH ROSE ,50,0.42,12932.0,United Kingdom,2025-12-01
512907,22050,PINK PAISLEY ROSE GIFT WRAP,25,0.42,12932.0,United Kingdom,2025-12-01
512908,21153,missing,-73,0.0,,United Kingdom,2025-12-01
512909,22564,ALPHABET STENCIL CRAFT,1,1.25,16883.0,United Kingdom,2025-12-01
512909,22493,PAINT YOUR OWN CANVAS SET,1,1.65,16883.0,United Kingdom,2025-12-01
512909,21725,SWEETIES  STICKERS,1,0.85,16883.0,United Kingdom,2025-12-01
512909,22273,FELTCRAFT DOLL MOLLY,1,2.95,16883.0,United Kingdom,2025-12-01
512909,22569,FELTCRAFT CUSHION BUTTERFLY,1,3.75,16883.0,United Kingdom,2025-12-01
512909,22561,WOODEN SCHOOL COLOURING SET,1,1.65,16883.0,United Kingdom,2025-12-01
512909,72008,FROSTED BOX 9 WHITE T-LIGHT CANDLES,3,0.42,16883.0,United Kingdom,2025-12-01
512909,21898,POTTING SHED ROSE CANDLE,2,2.95,16883.0,United Kingdom,2025-12-01
512909,85123A,WHITE HANGING HEART T-LIGHT HOLDER,2,2.95,16883.0,United Kingdom,2025-12-01
512909,22178,VICTORIAN GLASS HANGING T-LIGHT,24,1.25,16883.0,United Kingdom,2025-12-01
512909,21755,LOVE BUILDING BLOCK WORD,2,5.95,16883.0,United Kingdom,2025-12-01
512909,22059,CERAMIC STRWBERRY DESIGN MUG,1,1.49,16883.0,United Kingdom,2025-12-01
512909,37448,CERAMIC CAKE DESIGN SPOTTED MUG,1,1.49,16883.0,United Kingdom,2025-12-01
512909,22060,LARGE CAKE STAND HANGING HEARTS,2,9.95,16883.0,United Kingdom,2025-12-01
512909,21153,RED SPOTTY TABLECLOTH ,1,10.65,16883.0,United Kingdom,2025-12-01
512909,21725,SWEETIES  STICKERS,1,0.85,16883.0,United Kingdom,2025-12-01
512909,21471,STRAWBERRY RAFFIA FOOD COVER,2,3.75,16883.0,United Kingdom,2025-12-01
512909,21471,STRAWBERRY RAFFIA FOOD COVER,2,3.75,16883.0,United Kingdom,2025-12-01
512909,22562,MONSTERS STENCIL CRAFT,1,1.25,16883.0,United Kingdom,2025-12-01
512909,84755,COLOUR GLASS T-LIGHT HOLDER HANGING,8,0.65,16883.0,United Kingdom,2025-12-01
512909,22563,HAPPY STENCIL CRAFT,1,1.25,16883.0,United Kingdom,2025-12-01
512910,21172,PARTY METAL SIGN ,12,1.45,13705.0,United Kingdom,2025-12-01
512909,22621,TRADITIONAL KNITTING NANCY,1,1.45,16883.0,United Kingdom,2025-12-01
512909,22586,FELTCRAFT HAIRBAND PINK AND BLUE,1,0.85,16883.0,United Kingdom,2025-12-01
512910,21715,GIRLS VINTAGE TIN SEASIDE BUCKET,8,2.55,13705.0,United Kingdom,2025-12-01
512910,21923,RED/CREAM STRIPE FRINGE HAMMOCK,2,7.95,13705.0,United Kingdom,2025-12-01
512910,21911,GARDEN METAL SIGN ,12,1.65,13705.0,United Kingdom,2025-12-01
512910,22502,PICNIC BASKET WICKER SMALL,4,4.25,13705.0,United Kingdom,2025-12-01
512910,21915,RED  HARMONICA IN BOX ,12,1.25,13705.0,United Kingdom,2025-12-01
512910,22127,PARTY CONES CARNIVAL ASSORTED,12,1.25,13705.0,United Kingdom,2025-12-01
512910,22128,PARTY CONES CANDY ASSORTED,12,1.25,13705.0,United Kingdom,2025-12-01
512910,20699,MOUSEY LONG LEGS SOFT TOY,6,2.55,13705.0,United Kingdom,2025-12-01
512910,79029,GLASS HONEYPOT WASP CATCHER,6,1.95,13705.0,United Kingdom,2025-12-01
512910,21910,WAY OUT METAL SIGN ,12,1.65,13705.0,United Kingdom,2025-12-01
512910,22297,HEART IVORY TRELLIS SMALL,24,1.25,13705.0,United Kingdom,2025-12-01
512910,82580,BATHROOM METAL SIGN,12,0.55,13705.0,United Kingdom,2025-12-01
512910,21718,RED METAL BEACH SPADE ,12,1.25,13705.0,United Kingdom,2025-12-01
512910,22138,BAKING SET 9 PIECE RETROSPOT ,3,4.95,13705.0,United Kingdom,2025-12-01
512910,22498,WOODEN REGATTA BUNTING,3,5.95,13705.0,United Kingdom,2025-12-01
512909,22587,FELTCRAFT HAIRBAND RED AND BLUE,1,0.85,16883.0,United Kingdom,2025-12-01
512910,20695,FLORAL BLUE MONSTER,3,4.25,13705.0,United Kingdom,2025-12-01
512909,22566,FELTCRAFT HAIRBAND PINK AND PURPLE,1,0.85,16883.0,United Kingdom,2025-12-01
512911,21330,WOODLAND ANIMAL  WRITING SET ,1,3.36,,United Kingdom,2025-12-01
512911,21380,WOODEN HAPPY BIRTHDAY GARLAND,1,5.91,,United Kingdom,2025-12-01
512911,21447,12 IVORY ROSE PEG PLACE SETTINGS,1,2.51,,United Kingdom,2025-12-01
512911,21524,DOOR MAT SPOTTY HOME SWEET HOME,1,14.43,,United Kingdom,2025-12-01
512911,21542,WOODLAND WATER TRANSFER TATTOOS ,2,1.66,,United Kingdom,2025-12-01
512911,21641,ASSORTED TUTTI FRUTTI KEYRING BALL,1,1.66,,United Kingdom,2025-12-01
512911,90201B,BLACK ENAMEL FLOWER RING,1,2.96,,United Kingdom,2025-12-01
512911,90161D,ANT COPPER PINK BOUDICCA BRACELET,1,5.09,,United Kingdom,2025-12-01
512911,90166,PINK & WHITE ROSEBUD RING,1,4.24,,United Kingdom,2025-12-01
512911,90202C,GREEN ENAMEL FLOWER HAIR TIE,1,2.96,,United Kingdom,2025-12-01
512911,90214I,"LETTER ""I"" BLING KEY RING",1,2.51,,United Kingdom,2025-12-01
512911,21328,BALLOONS  WRITING SET ,1,3.36,,United Kingdom,2025-12-01
512911,DCGS0058,MISO PRETTY  GUM,1,0.81,,United Kingdom,2025-12-01
512911,90129A,PINK GLASS TASSLE BAG CHARM ,1,1.66,,United Kingdom,2025-12-01
512911,21240,BLUE  SPOTTY CUP,8,0.72,,United Kingdom,2025-12-01
512911,84520B,PACK 20 ENGLISH ROSE PAPER NAPKINS,2,1.66,,United Kingdom,2025-12-01
512911,20723,STRAWBERRY CHARLOTTE BAG,10,0.64,,United Kingdom,2025-12-01
512911,79030A,"TUMBLER, ENGLISH ROSE",1,12.72,,United Kingdom,2025-12-01
512911,79144C,PAINTED LIGHTBULB RAINBOW DESIGN,1,0.84,,United Kingdom,2025-12-01
512911,82484,WOOD BLACK BOARD ANT WHITE FINISH,1,13.57,,United Kingdom,2025-12-01
512911,82613D,METAL SIGN CUPCAKE SINGLE HOOK,1,2.51,,United Kingdom,2025-12-01
512911,84050,PINK HEART SHAPE EGG FRYING PAN,1,4.21,,United Kingdom,2025-12-01
512911,84270,ASSTD DESIGN BUBBLE GUM RING,15,0.43,,United Kingdom,2025-12-01
512911,22558,CLOTHES PEGS RETROSPOT PACK 24 ,5,1.06,,United Kingdom,2025-12-01
512911,84380,SET OF 3 BUTTERFLY COOKIE CUTTERS,1,2.51,,United Kingdom,2025-12-01
512911,84536A,ENGLISH ROSE NOTEBOOK A7 SIZE,3,0.81,,United Kingdom,2025-12-01
512911,84676,BATH DUCK WATERING CAN,1,5.91,,United Kingdom,2025-12-01
512911,84760S,SMALL HANGING GLASS+ZINC LANTERN,1,2.98,,United Kingdom,2025-12-01
512911,84818,DANISH ROSE PHOTO FRAME,1,2.51,,United Kingdom,2025-12-01
512911,84872A,TEATIME FUNKY FLOWER BACKPACK FOR 2,3,11.02,,United Kingdom,2025-12-01
512911,22356,CHARLOTTE BAG PINK WITH WHITE SPOTS,10,0.72,,United Kingdom,2025-12-01
512911,DOT,DOTCOM POSTAGE,1,50.68,,United Kingdom,2025-12-01
512911,85099F,JUMBO BAG STRAWBERRY,1,4.21,,United Kingdom,2025-12-01
512911,20685,DOOR MAT RED SPOT,1,14.43,,United Kingdom,2025-12-01
512911,85150,LADIES & GENTLEMEN METAL SIGN,1,5.06,,United Kingdom,2025-12-01
512911,21155,RED SPOTTY PEG BAG,1,4.21,,United Kingdom,2025-12-01
512911,21164,HOME SWEET HOME METAL SIGN ,1,5.91,,United Kingdom,2025-12-01
512911,21165,BEWARE OF THE CAT METAL SIGN ,1,4.21,,United Kingdom,2025-12-01
512911,21167,WHITE SAGE INCENSE,2,0.43,,United Kingdom,2025-12-01
512911,21217,RED SPOTTY ROUND CAKE TINS,1,21.23,,United Kingdom,2025-12-01
512911,21218,RED SPOTTY BISCUIT TIN,1,8.47,,United Kingdom,2025-12-01
512911,21154,RED SPOTTY OVEN GLOVE ,2,2.51,,United Kingdom,2025-12-01
512911,21232,STRAWBERRY CERAMIC TRINKET BOX,1,2.51,,United Kingdom,2025-12-01
512911,21284,RETRO SPOT CANDLE  SMALL,1,3.36,,United Kingdom,2025-12-01
512911,84882,GREEN WIRE STANDING CANDLE HOLDER,1,7.62,,United Kingdom,2025-12-01
512911,84912A,PINK ROSE WASHBAG,1,3.36,,United Kingdom,2025-12-01
512911,84997B,RED 3 PIECE MINI DOTS CUTLERY SET,1,7.62,,United Kingdom,2025-12-01
512911,85099B,JUMBO BAG RED RETROSPOT,1,4.21,,United Kingdom,2025-12-01
512911,72812,LARGE ZINC GLASS CANDLEHOLDER,1,4.21,,United Kingdom,2025-12-01
512911,21260,FIRST AID TIN,1,6.77,,United Kingdom,2025-12-01
512911,85124C,GREEN JUICY FRUIT PHOTO FRAME,1,5.06,,United Kingdom,2025-12-01
512911,21080,SET/20 RED SPOTTY PAPER NAPKINS ,1,1.66,,United Kingdom,2025-12-01
512911,21042,RED SPOTTY APRON ,1,12.72,,United Kingdom,2025-12-01
512911,85170B,SET/6 BLACK BIRD T-LIGHT CANDLES,1,4.21,,United Kingdom,2025-12-01
512911,85170D,SET/6 PINK BIRD T-LIGHT CANDLES,1,4.21,,United Kingdom,2025-12-01
512911,90005A,JADE GREEN ENAMEL HAIR COMB,1,2.11,,United Kingdom,2025-12-01
512911,15056P,EDWARDIAN PARASOL PINK,1,12.72,,United Kingdom,2025-12-01
512911,15060B,FAIRY CAKE DESIGN UMBRELLA,1,8.47,,United Kingdom,2025-12-01
512911,16207A,PINK STRAWBERRY HANDBAG ,1,3.36,,United Kingdom,2025-12-01
512911,21078,SET/20 STRAWBERRY PAPER NAPKINS ,5,1.66,,United Kingdom,2025-12-01
512911,20661,BLUE SPOTTY PURSE ,1,2.51,,United Kingdom,2025-12-01
512911,20718,RED SPOTTY SHOPPER BAG,2,2.51,,United Kingdom,2025-12-01
512911,20724,RED SPOTTY CHARLOTTE BAG,1,1.66,,United Kingdom,2025-12-01
512911,20725,LUNCH BAG RED SPOTTY,1,4.21,,United Kingdom,2025-12-01
512911,20972,PINK CREAM FELT CRAFT TRINKET BOX ,1,2.51,,United Kingdom,2025-12-01
512911,21035,SET/2 RED SPOTTY TEA TOWELS ,2,5.91,,United Kingdom,2025-12-01
512911,21039,RED SPOTTY SHOPPING BAG,1,5.91,,United Kingdom,2025-12-01
512911,20712,JUMBO BAG WOODLAND ANIMALS,1,4.21,,United Kingdom,2025-12-01
512911,71143,SILVER BOOK MARK WITH BEADS,1,2.51,,United Kingdom,2025-12-01
512911,22718,CARD CAT AND TREE ,1,0.85,,United Kingdom,2025-12-01
512911,47591B,SCOTTIES DES CHILD'S APRON,1,1.66,,United Kingdom,2025-12-01
512911,21916,SET 12 RETRO WHITE CHALK STICKS,2,0.81,,United Kingdom,2025-12-01
512911,21888,BINGO SET,1,7.62,,United Kingdom,2025-12-01
512911,62096A,PINK/YELLOW FLOWERS HANDBAG,1,3.36,,United Kingdom,2025-12-01
512911,21829,DINOSAUR KEYRINGS ASSORTED,15,0.43,,United Kingdom,2025-12-01
512911,21790,VINTAGE SNAP CARDS,3,1.66,,United Kingdom,2025-12-01
512911,21775,DECORATIVE FLORE BATHROOM BOTTLE,1,2.51,,United Kingdom,2025-12-01
512911,21774,DECORATIVE CATS BATHROOM BOTTLE,1,2.51,,United Kingdom,2025-12-01
512911,21754,HOME BUILDING BLOCK WORD,1,11.87,,United Kingdom,2025-12-01
512911,21669,BLUE STRIPE CERAMIC DRAWER KNOB,6,2.51,,United Kingdom,2025-12-01
512911,21668,RED STRIPE CERAMIC DRAWER KNOB,10,2.51,,United Kingdom,2025-12-01
512911,21324,HANGING MEDINA LANTERN SMALL,1,5.91,,United Kingdom,2025-12-01
512911,21323,HANGING MEDINA LANTERN LARGE,1,8.47,,United Kingdom,2025-12-01
512911,21313,GLASS HEART T-LIGHT HOLDER ,1,1.66,,United Kingdom,2025-12-01
512911,21621,VINTAGE UNION JACK BUNTING,5,7.45,,United Kingdom,2025-12-01
512911,21090,SET/6 COLLAGE PAPER PLATES,5,0.85,,United Kingdom,2025-12-01
512911,21094,SET/6 RED SPOTTY PAPER PLATES,6,0.64,,United Kingdom,2025-12-01
512911,84596B,SMALL DOLLY MIX DESIGN ORANGE BOWL,8,1.06,,United Kingdom,2025-12-01
512911,22381,TOY TIDY PINK RETROSPOT  ,1,4.21,,United Kingdom,2025-12-01
512911,22383,LUNCH BAG SUKI  DESIGN ,1,4.21,,United Kingdom,2025-12-01
512911,22384,LUNCH BAG PINK RETROSPOT,1,4.21,,United Kingdom,2025-12-01
512911,22419,LIPSTICK PEN RED,2,0.85,,United Kingdom,2025-12-01
512911,22424,ENAMEL BREAD BIN CREAM,1,25.49,,United Kingdom,2025-12-01
512911,22427,ENAMEL FLOWER JUG CREAM,1,11.87,,United Kingdom,2025-12-01
512911,21922,UNION STRIPE WITH FRINGE  HAMMOCK,1,16.98,,United Kingdom,2025-12-01
512911,22435,SET OF 9 HEART SHAPED BALLOONS,1,2.51,,United Kingdom,2025-12-01
512911,22502,PICNIC BASKET WICKER SMALL,1,8.47,,United Kingdom,2025-12-01
512911,22569,FELTCRAFT CUSHION BUTTERFLY,1,7.62,,United Kingdom,2025-12-01
512911,22570,FELTCRAFT CUSHION RABBIT,1,7.62,,United Kingdom,2025-12-01
512911,35471D,SET OF 3 BIRD LIGHT PINK FEATHER ,1,2.51,,United Kingdom,2025-12-01
512911,35810B,ENAMEL BLUE RIM COFFEE CONTAINER,1,4.21,,United Kingdom,2025-12-01
512911,37370,RETRO COFFEE MUGS ASSORTED,1,16.13,,United Kingdom,2025-12-01
512911,22488,NATURAL SLATE RECTANGLE CHALKBOARD,10,3.36,,United Kingdom,2025-12-01
512911,21928,JUMBO BAG SCANDINAVIAN PAISLEY,1,4.21,,United Kingdom,2025-12-01
512911,21864,UNION JACK FLAG PASSPORT COVER ,3,4.21,,United Kingdom,2025-12-01
512911,21981,PACK OF 12 WOODLAND TISSUES ,1,0.81,,United Kingdom,2025-12-01
512911,47591A,CAROUSEL DES CHILD'S APRON,1,1.66,,United Kingdom,2025-12-01
512911,47566,PARTY BUNTING,1,8.47,,United Kingdom,2025-12-01
512911,37449,CERAMIC CAKE STAND + HANGING CAKES,1,21.23,,United Kingdom,2025-12-01
512911,37446,MINI CAKE STAND WITH HANGING CAKES,4,3.36,,United Kingdom,2025-12-01
512911,22379,RECYCLING BAG RETROSPOT ,1,4.21,,United Kingdom,2025-12-01
512911,22352,LUNCH BOX WITH CUTLERY RETROSPOT ,1,5.06,,United Kingdom,2025-12-01
512911,22350,CAT BOWL ,3,5.06,,United Kingdom,2025-12-01
512911,22329,ROUND CONTAINER SET OF 5 RETROSPOT,1,3.36,,United Kingdom,2025-12-01
512911,22323,PINK POLKADOT KIDS BAG,1,4.21,,United Kingdom,2025-12-01
512911,22297,HEART IVORY TRELLIS SMALL,2,2.51,,United Kingdom,2025-12-01
512911,22283,6 EGG HOUSE PAINTED WOOD,1,16.13,,United Kingdom,2025-12-01
512911,21937,STRAWBERRY   PICNIC BAG,1,5.91,,United Kingdom,2025-12-01
512911,22242,"HOOK, 5 HANGER , MAGIC TOADSTOOL",1,3.36,,United Kingdom,2025-12-01
512911,22227,"DECORATION, HANGING HEART+MIRROR ",2,1.28,,United Kingdom,2025-12-01
512911,22215,CAKE STAND WHITE TWO TIER LACE,1,16.98,,United Kingdom,2025-12-01
512911,22219,LOVEBIRD HANGING DECORATION WHITE ,12,1.66,,United Kingdom,2025-12-01
512911,22197,SMALL POPCORN HOLDER,4,1.66,,United Kingdom,2025-12-01
512911,21983,PACK OF 12 BLUE PAISLEY TISSUES ,1,0.81,,United Kingdom,2025-12-01
512911,22055,MINI CAKE STAND  HANGING STRAWBERY,5,3.36,,United Kingdom,2025-12-01
512911,22067,CHOC TRUFFLE GOLD TRINKET POT ,1,3.36,,United Kingdom,2025-12-01
512911,22083,PAPER CHAIN KIT RETRO SPOT,2,5.91,,United Kingdom,2025-12-01
512911,22129,PARTY CONES CANDY TREE DECORATION,2,8.47,,United Kingdom,2025-12-01
512911,22132,RED LOVE HEART SHAPE CUP,1,1.66,,United Kingdom,2025-12-01
512911,22199,FRYING PAN RED POLKADOT ,1,8.47,,United Kingdom,2025-12-01
512911,22133,PINK LOVE HEART SHAPE CUP,1,1.66,,United Kingdom,2025-12-01
512911,22136,LOVE HEART SOCK HANGER,1,3.36,,United Kingdom,2025-12-01
512911,22149,FELTCRAFT 6 FLOWER FRIENDS,1,4.21,,United Kingdom,2025-12-01
512911,22161,HEART DECORATION RUSTIC HANGING ,1,1.66,,United Kingdom,2025-12-01
512911,22178,VICTORIAN GLASS HANGING T-LIGHT,1,2.51,,United Kingdom,2025-12-01
512911,22181,SNOWSTORM PHOTO FRAME FRIDGE MAGNET,1,1.66,,United Kingdom,2025-12-01
512911,22196,SMALL HEART MEASURING SPOONS,1,1.66,,United Kingdom,2025-12-01
512911,22134,LADLE LOVE HEART RED ,1,0.85,,United Kingdom,2025-12-01
512912,84945,MULTI COLOUR SILVER T-LIGHT HOLDER,24,0.85,16094.0,United Kingdom,2025-12-01
512912,21212,PACK OF 72 RETRO SPOT CAKE CASES,24,0.55,16094.0,United Kingdom,2025-12-01
512912,21624,VINTAGE UNION JACK DOORSTOP,3,5.95,16094.0,United Kingdom,2025-12-01
512912,84946,ANTIQUE SILVER TEA GLASS ETCHED,24,1.25,16094.0,United Kingdom,2025-12-01
512912,84987,SET OF 36 TEATIME PAPER DOILIES,12,1.45,16094.0,United Kingdom,2025-12-01
512912,22426,ENAMEL WASH BOWL CREAM,4,3.75,16094.0,United Kingdom,2025-12-01
512912,20749,ASSORTED COLOUR MINI CASES,2,7.95,16094.0,United Kingdom,2025-12-01
512912,21888,BINGO SET,4,3.75,16094.0,United Kingdom,2025-12-01
512912,22605,WOODEN CROQUET GARDEN SET,4,10.95,16094.0,United Kingdom,2025-12-01
512912,22423,REGENCY CAKESTAND 3 TIER,1,12.75,16094.0,United Kingdom,2025-12-01
512912,22622,BOX OF VINTAGE ALPHABET BLOCKS,2,9.95,16094.0,United Kingdom,2025-12-01
512912,21539,RED RETROSPOT BUTTER DISH,3,4.95,16094.0,United Kingdom,2025-12-01
512912,20750,RED/WHITE DOT MINI CASES,2,7.95,16094.0,United Kingdom,2025-12-01
512912,21217,RED SPOTTY ROUND CAKE TINS,2,9.95,16094.0,United Kingdom,2025-12-01
512912,21625,VINTAGE UNION JACK APRON,3,6.95,16094.0,United Kingdom,2025-12-01
512912,21621,VINTAGE UNION JACK BUNTING,2,8.5,16094.0,United Kingdom,2025-12-01
512912,22357,KINGS CHOICE BISCUIT TIN,4,4.25,16094.0,United Kingdom,2025-12-01
512912,37503,TEA TIME CAKE STAND IN GIFT BOX,2,10.75,16094.0,United Kingdom,2025-12-01
512912,21432,SET OF 3 CASES WOODLAND DESIGN,2,5.95,16094.0,United Kingdom,2025-12-01
512912,21533,RETRO SPOT LARGE MILK JUG,3,4.95,16094.0,United Kingdom,2025-12-01
C512913,79323B,BLACK CHERRY LIGHTS,-4,6.75,16838.0,United Kingdom,2025-12-01
512914,21210,SET OF 72 RETRO SPOT PAPER  DOILIES,60,1.45,15538.0,United Kingdom,2025-12-01
512914,20914,SET/5 RED SPOTTY LID GLASS BOWLS,30,2.95,15538.0,United Kingdom,2025-12-01
512915,22273,FELTCRAFT DOLL MOLLY,6,2.95,14840.0,United Kingdom,2025-12-01
512915,22274,FELTCRAFT DOLL EMILY,6,2.95,14840.0,United Kingdom,2025-12-01
512915,20971,PINK BLUE FELT CRAFT TRINKET BOX,12,1.25,14840.0,United Kingdom,2025-12-01
512915,20972,PINK CREAM FELT CRAFT TRINKET BOX ,12,1.25,14840.0,United Kingdom,2025-12-01
512915,22204,MILK PAN BLUE RETROSPOT,4,3.75,14840.0,United Kingdom,2025-12-01
512915,22202,MILK PAN PINK RETROSPOT,4,3.75,14840.0,United Kingdom,2025-12-01
512915,22201,FRYING PAN BLUE POLKADOT ,4,4.25,14840.0,United Kingdom,2025-12-01
512915,22200,FRYING PAN PINK POLKADOT ,4,4.25,14840.0,United Kingdom,2025-12-01
512915,85062,PEARL CRYSTAL PUMPKIN T-LIGHT HLDR,12,1.65,14840.0,United Kingdom,2025-12-01
512915,20692,FLORAL ELEPHANT SOFT TOY,6,4.25,14840.0,United Kingdom,2025-12-01
512915,22487,WHITE WOOD GARDEN PLANT LADDER,2,9.95,14840.0,United Kingdom,2025-12-01
512915,20699,MOUSEY LONG LEGS SOFT TOY,6,2.55,14840.0,United Kingdom,2025-12-01
512915,84459B,YELLOW METAL CHICKEN HEART ,12,1.49,14840.0,United Kingdom,2025-12-01
512915,84459A,PINK METAL CHICKEN HEART ,12,1.49,14840.0,United Kingdom,2025-12-01
512915,22149,FELTCRAFT 6 FLOWER FRIENDS,6,2.1,14840.0,United Kingdom,2025-12-01
512915,22263,FELT EGG COSY LADYBIRD ,12,0.85,14840.0,United Kingdom,2025-12-01
512915,20978,36 PENCILS TUBE SKULLS,16,1.25,14840.0,United Kingdom,2025-12-01
512915,84970L,SINGLE HEART ZINC T-LIGHT HOLDER,12,0.95,14840.0,United Kingdom,2025-12-01
512916,85042,ANTIQUE LILY FAIRY LIGHTS,4,4.95,13327.0,United Kingdom,2025-12-01
512916,84676,BATH DUCK WATERING CAN,6,2.95,13327.0,United Kingdom,2025-12-01
512916,22197,SMALL POPCORN HOLDER,12,0.85,13327.0,United Kingdom,2025-12-01
512916,22198,LARGE POPCORN HOLDER ,12,1.65,13327.0,United Kingdom,2025-12-01
512916,79320,FLAMINGO LIGHTS,4,4.95,13327.0,United Kingdom,2025-12-01
512916,21931,JUMBO STORAGE BAG SUKI,20,1.95,13327.0,United Kingdom,2025-12-01
512916,85099B,JUMBO BAG RED RETROSPOT,20,1.95,13327.0,United Kingdom,2025-12-01
512916,22379,RECYCLING BAG RETROSPOT ,15,2.1,13327.0,United Kingdom,2025-12-01
512916,20713,JUMBO BAG OWLS,10,1.95,13327.0,United Kingdom,2025-12-01
512916,79321,CHILLI LIGHTS,8,4.95,13327.0,United Kingdom,2025-12-01
512918,21244,,-37,0.0,,United Kingdom,2025-12-01
512917,20838,FRENCH LATTICE CUSHION COVER ,6,2.95,14962.0,United Kingdom,2025-12-01
512917,20839,FRENCH PAISLEY CUSHION COVER ,6,2.95,14962.0,United Kingdom,2025-12-01
512917,20840,FRENCH FLORAL CUSHION COVER ,6,2.95,14962.0,United Kingdom,2025-12-01
512919,22180,RETRO SPOT LAMP,2,9.95,18044.0,United Kingdom,2025-12-01
512919,22505,MEMO BOARD COTTAGE DESIGN,4,4.95,18044.0,United Kingdom,2025-12-01
512919,21623,VINTAGE UNION JACK MEMOBOARD,4,9.95,18044.0,United Kingdom,2025-12-01
512919,21955,DOOR MAT UNION JACK GUNS AND ROSES,2,7.49,18044.0,United Kingdom,2025-12-01
512919,22423,REGENCY CAKESTAND 3 TIER,16,10.95,18044.0,United Kingdom,2025-12-01
512919,21471,STRAWBERRY RAFFIA FOOD COVER,6,3.75,18044.0,United Kingdom,2025-12-01
512919,22394,PAPERWEIGHT KINGS CHOICE ,6,2.55,18044.0,United Kingdom,2025-12-01
512919,22626,BLACK KITCHEN SCALES,2,8.5,18044.0,United Kingdom,2025-12-01
512919,22389,PAPERWEIGHT SAVE THE PLANET,6,2.55,18044.0,United Kingdom,2025-12-01
512919,22485,SET OF 2 WOODEN MARKET CRATES,2,12.75,18044.0,United Kingdom,2025-12-01
512919,22528,GARDENERS KNEELING PAD,12,1.25,18044.0,United Kingdom,2025-12-01
512919,22427,ENAMEL FLOWER JUG CREAM,3,5.95,18044.0,United Kingdom,2025-12-01
512919,22624,IVORY KITCHEN SCALES,2,8.5,18044.0,United Kingdom,2025-12-01
512920,22423,REGENCY CAKESTAND 3 TIER,2,12.75,17883.0,United Kingdom,2025-12-01
512920,22480,RED TEA TOWEL CLASSIC DESIGN,1,1.25,17883.0,United Kingdom,2025-12-01
512920,21153,RED SPOTTY TABLECLOTH ,1,10.65,17883.0,United Kingdom,2025-12-01
512920,47570B,TEA TIME TABLE CLOTH,3,10.65,17883.0,United Kingdom,2025-12-01
512920,22472,TV DINNER TRAY DOLLY GIRL,1,4.95,17883.0,United Kingdom,2025-12-01
512920,22168,ORGANISER WOOD ANTIQUE WHITE ,1,8.5,17883.0,United Kingdom,2025-12-01
512920,21624,VINTAGE UNION JACK DOORSTOP,1,5.95,17883.0,United Kingdom,2025-12-01
512920,21621,VINTAGE UNION JACK BUNTING,1,8.5,17883.0,United Kingdom,2025-12-01
512920,47591D,PINK FAIRY CAKE CHILD'S APRON,10,1.95,17883.0,United Kingdom,2025-12-01
512920,47591C,BLUE FAIRY CAKE CHILD'S APRON,10,1.95,17883.0,United Kingdom,2025-12-01
512920,22627,MINT KITCHEN SCALES,1,8.5,17883.0,United Kingdom,2025-12-01
512921,21928,JUMBO BAG SCANDINAVIAN PAISLEY,3,1.95,17883.0,United Kingdom,2025-12-01
512921,20717,STRAWBERRY SHOPPER BAG,4,1.25,17883.0,United Kingdom,2025-12-01
512922,21695,SMALL SILVER FLOWER CANDLE POT,12,2.95,13676.0,United Kingdom,2025-12-01
512922,21319,GLASS CHALICE GREEN  SMALL ,6,1.65,13676.0,United Kingdom,2025-12-01
512922,79029,GLASS HONEYPOT WASP CATCHER,1,1.95,13676.0,United Kingdom,2025-12-01
