Invoice,StockCode,Description,Quantity,Price,Customer ID,Country,InvoiceDate
511267,90002C,FLOWER BURST SILVER RING MIDN'T BLU,2,3.75,13623.0,United Kingdom,2025-11-21
511267,22470,HEART OF WICKER LARGE,2,2.95,13623.0,United Kingdom,2025-11-21
511267,90145,SILVER HOOP EARRINGS WITH FLOWER,2,5.95,13623.0,United Kingdom,2025-11-21
511267,90162C,ANT SILVER FUSCHIA BOUDICCA RING,2,2.95,13623.0,United Kingdom,2025-11-21
511267,90170,DAISY HAIR BAND,2,1.65,13623.0,United Kingdom,2025-11-21
511267,90002A,FLOWER BURST SILVER RING OPAL,2,3.75,13623.0,United Kingdom,2025-11-21
511267,90203,SILVER CHARM NECKLACE 70CM,1,7.5,13623.0,United Kingdom,2025-11-21
511267,90148,LONG SILVER NECKLACE PASTEL FLOWER,1,12.75,13623.0,United Kingdom,2025-11-21
511267,90162D,ANT SILVER PURPLE BOUDICCA RING,1,2.95,13623.0,United Kingdom,2025-11-21
511268,21793,CLASSIC FRENCH STYLE BASKET BROWN,1,6.75,,United Kingdom,2025-11-21
511269,84947,ANTIQUE SILVER TEA GLASS ENGRAVED,12,1.25,16984.0,United Kingdom,2025-11-21
511269,84755,COLOUR GLASS T-LIGHT HOLDER HANGING,32,0.65,16984.0,United Kingdom,2025-11-21
511269,22178,VICTORIAN GLASS HANGING T-LIGHT,6,1.25,16984.0,United Kingdom,2025-11-21
511269,22393,PAPERWEIGHT VINTAGE COLLAGE,2,2.55,16984.0,United Kingdom,2025-11-21
511269,90122A,PINK CRYSTAL+GLASS BRACELET,1,4.95,16984.0,United Kingdom,2025-11-21
511269,22394,PAPERWEIGHT KINGS CHOICE ,2,2.55,16984.0,United Kingdom,2025-11-21
511269,22395,PAPERWEIGHT VINTAGE PAISLEY,2,2.55,16984.0,United Kingdom,2025-11-21
511269,90123B,TURQUOISE HEART OF GLASS BRACELET,1,5.95,16984.0,United Kingdom,2025-11-21
511269,90036B,"FLOWER GLASS GARLAND NECKL.36""GREEN",1,7.95,16984.0,United Kingdom,2025-11-21
511269,22389,PAPERWEIGHT SAVE THE PLANET,2,2.55,16984.0,United Kingdom,2025-11-21
511269,21651,HANGING GLASS ETCHED TEALIGHT,1,1.65,16984.0,United Kingdom,2025-11-21
511269,84978,HANGING HEART JAR T-LIGHT HOLDER,6,1.25,16984.0,United Kingdom,2025-11-21
511269,21652,GLASS ETCHED T-LIGHT HOLDER MEDIUM,1,1.95,16984.0,United Kingdom,2025-11-21
511269,21689,SILVER VANILLA  FLOWER CANDLE POT,3,3.75,16984.0,United Kingdom,2025-11-21
511269,21691,SILVER VANILLA FLOWER CANDLE POT,1,3.75,16984.0,United Kingdom,2025-11-21
511269,21692,SILVER LATTICE VANILLA CANDLE POT,4,3.75,16984.0,United Kingdom,2025-11-21
511269,21911,GARDEN METAL SIGN ,3,1.65,16984.0,United Kingdom,2025-11-21
511269,21910,WAY OUT METAL SIGN ,4,1.65,16984.0,United Kingdom,2025-11-21
511269,85150,LADIES & GENTLEMEN METAL SIGN,2,2.55,16984.0,United Kingdom,2025-11-21
511269,22412,METAL SIGN NEIGHBOURHOOD WITCH ,5,2.1,16984.0,United Kingdom,2025-11-21
511269,21689,SILVER VANILLA  FLOWER CANDLE POT,1,3.75,16984.0,United Kingdom,2025-11-21
511269,90036A,FLOWER GARLAND NECKLACE RED,1,7.95,16984.0,United Kingdom,2025-11-21
511269,21691,SILVER VANILLA FLOWER CANDLE POT,2,3.75,16984.0,United Kingdom,2025-11-21
511269,84949,SILVER HANGING T-LIGHT HOLDER,6,1.65,16984.0,United Kingdom,2025-11-21
511269,90198B,VINTAGE ROSE BEAD BRACELET BLACK,1,4.25,16984.0,United Kingdom,2025-11-21
511269,21464,DISCO BALL ROTATOR BATTERY OPERATED,1,4.25,16984.0,United Kingdom,2025-11-21
511269,90122C,TURQUOISE CRYSTAL+GLASS BRACELET,1,4.95,16984.0,United Kingdom,2025-11-21
511269,15034,PAPER POCKET TRAVELING FAN ,9,0.14,16984.0,United Kingdom,2025-11-21
511269,90200D,PINK SWEETHEART BRACELET,2,4.25,16984.0,United Kingdom,2025-11-21
511269,90036D,"FLOWER GLASS GARLAND NECKL.36""BLACK",1,7.95,16984.0,United Kingdom,2025-11-21
511269,90024A,NEW BAROQUE B'FLY NECKLACE BLACK,1,8.5,16984.0,United Kingdom,2025-11-21
511269,22391,PAPERWEIGHT HOME SWEET HOME,2,2.55,16984.0,United Kingdom,2025-11-21
511269,21687,SILVER PLATE CANDLE BOWL LARGE,3,3.75,16984.0,United Kingdom,2025-11-21
511269,21714,CITRONELLA CANDLE GARDEN POT,6,1.25,16984.0,United Kingdom,2025-11-21
511269,84949,SILVER HANGING T-LIGHT HOLDER,6,1.65,16984.0,United Kingdom,2025-11-21
511269,22460,EMBOSSED GLASS TEALIGHT HOLDER,48,1.25,16984.0,United Kingdom,2025-11-21
511269,21691,SILVER VANILLA FLOWER CANDLE POT,1,3.75,16984.0,United Kingdom,2025-11-21
511269,84970L,SINGLE HEART ZINC T-LIGHT HOLDER,12,0.95,16984.0,United Kingdom,2025-11-21
511269,90175C,BLUE GLASS CHUNKY CHARM BRACELET,1,8.95,16984.0,United Kingdom,2025-11-21
511269,21688,SILVER PLATE CANDLE BOWL SMALL,6,2.95,16984.0,United Kingdom,2025-11-21
511269,15036,ASSORTED COLOURS SILK FAN,12,0.75,16984.0,United Kingdom,2025-11-21
511269,21463,MIRRORED DISCO BALL ,1,5.95,16984.0,United Kingdom,2025-11-21
511269,15039,SANDALWOOD FAN,9,0.85,16984.0,United Kingdom,2025-11-21
511269,90065B,BLACK VINT ART DEC CRYSTAL BRACELET,1,6.75,16984.0,United Kingdom,2025-11-21
511269,90024E,NEW BAROQUE B'FLY NECKLACE MONTANA,1,8.5,16984.0,United Kingdom,2025-11-21
511269,90036F,"FLOWER GLASS GARLD NECKL36""TURQUOIS",1,7.95,16984.0,United Kingdom,2025-11-21
511269,90148,LONG SILVER NECKLACE PASTEL FLOWER,1,12.75,16984.0,United Kingdom,2025-11-21
511269,90123C,GREEN HEART OF GLASS BRACELET,1,5.95,16984.0,United Kingdom,2025-11-21
511269,90123D,WHITE HEART OF GLASS BRACELET,1,5.95,16984.0,United Kingdom,2025-11-21
511269,90131,PINK/AMETHYST/GOLD NECKLACE,1,6.95,16984.0,United Kingdom,2025-11-21
511269,90123A,PINK HEART OF GLASS BRACELET,1,5.95,16984.0,United Kingdom,2025-11-21
511269,84946,ANTIQUE SILVER TEA GLASS ETCHED,12,1.25,16984.0,United Kingdom,2025-11-21
511269,85060,WOOD FAN WITH FLOWER DESIGN,6,1.25,16984.0,United Kingdom,2025-11-21
511269,90065B,BLACK VINT ART DEC CRYSTAL BRACELET,1,6.75,16984.0,United Kingdom,2025-11-21
511269,21872,GLAMOROUS  MUG,1,1.25,16984.0,United Kingdom,2025-11-21
511269,84406B,CREAM CUPID HEARTS COAT HANGER,2,3.25,16984.0,United Kingdom,2025-11-21
511269,22167,"WALL MIRROR , DIAMANTE OVAL SHAPE",1,9.95,16984.0,United Kingdom,2025-11-21
511269,15030,FAN BLACK FRAME ,4,0.29,16984.0,United Kingdom,2025-11-21
511269,90147,CHUNKY SILVER NECKLACE PASTEL FLOWE,1,9.95,16984.0,United Kingdom,2025-11-21
511269,90026D,GLASS BEAD HOOP NECKLACE AMETHYST,1,8.5,16984.0,United Kingdom,2025-11-21
511269,90200E,GREEN SWEETHEART BRACELET,2,4.25,16984.0,United Kingdom,2025-11-21
511269,90200B,BLACK SWEETHEART BRACELET,3,4.25,16984.0,United Kingdom,2025-11-21
511269,90200C,BLUE SWEETHEART BRACELET,2,4.25,16984.0,United Kingdom,2025-11-21
511269,90024D,NEW BAROQUE B'FLY NECKLACE PINK,1,8.5,16984.0,United Kingdom,2025-11-21
511269,90026A,GLASS BEAD HOOP NECKLACE BLACK,1,8.5,16984.0,United Kingdom,2025-11-21
511269,90024F,NEW BAROQUE B'FLY NECKLACE CRYSTAL,1,8.5,16984.0,United Kingdom,2025-11-21
511269,90185D,CRYSTAL DIAMANTE EXPANDABLE RING,1,4.25,16984.0,United Kingdom,2025-11-21
511269,90185C,BLACK DIAMANTE EXPANDABLE RING,1,4.25,16984.0,United Kingdom,2025-11-21
511269,90026B,GLASS BEAD HOOP NECKLACE MONTANA,1,8.5,16984.0,United Kingdom,2025-11-21
511269,90203,SILVER CHARM NECKLACE 70CM,1,7.5,16984.0,United Kingdom,2025-11-21
511269,90199D,5 STRAND GLASS NECKLACE AMBER,1,6.35,16984.0,United Kingdom,2025-11-21
511269,90199A,5 STRAND GLASS NECKLACE BLACK,1,6.35,16984.0,United Kingdom,2025-11-21
511269,90014A,SILVER/MOP ORBIT NECKLACE,1,9.95,16984.0,United Kingdom,2025-11-21
511269,90070,RUBY GLASS CLUSTER BRACELET,1,5.95,16984.0,United Kingdom,2025-11-21
511269,90154,LAZER CUT NECKLACE W PASTEL BEADS,1,8.95,16984.0,United Kingdom,2025-11-21
511269,90147,CHUNKY SILVER NECKLACE PASTEL FLOWE,1,9.95,16984.0,United Kingdom,2025-11-21
511269,90036E,"FLOWER GLASS GARLD NECKL36""AMETHYST",1,7.95,16984.0,United Kingdom,2025-11-21
511269,21870,I CAN ONLY PLEASE ONE PERSON MUG,2,1.25,16984.0,United Kingdom,2025-11-21
511269,21836,GINGHAM OVEN GLOVE RED HEART ,2,3.75,16984.0,United Kingdom,2025-11-21
511269,22172,METAL SHELF WITH RAIL ,2,8.5,16984.0,United Kingdom,2025-11-21
511269,90199C,5 STRAND GLASS NECKLACE CRYSTAL,1,6.35,16984.0,United Kingdom,2025-11-21
511269,21955,DOOR MAT UNION JACK GUNS AND ROSES,1,7.49,16984.0,United Kingdom,2025-11-21
511269,37424,WHITE WITH BLACK CATS MUG,1,0.85,16984.0,United Kingdom,2025-11-21
511269,21524,DOOR MAT SPOTTY HOME SWEET HOME,1,7.49,16984.0,United Kingdom,2025-11-21
511269,22505,MEMO BOARD COTTAGE DESIGN,1,4.95,16984.0,United Kingdom,2025-11-21
511269,22507,MEMO BOARD RETROSPOT  DESIGN,2,4.95,16984.0,United Kingdom,2025-11-21
511269,22448,PIN CUSHION RUSSIAN DOLL RED,1,3.35,16984.0,United Kingdom,2025-11-21
511269,21714,CITRONELLA CANDLE GARDEN POT,6,1.25,16984.0,United Kingdom,2025-11-21
511269,21897,POTTING SHED CANDLE CITRONELLA,5,2.95,16984.0,United Kingdom,2025-11-21
511269,22178,VICTORIAN GLASS HANGING T-LIGHT,12,1.25,16984.0,United Kingdom,2025-11-21
511269,21389,IVORY HANGING DECORATION  BIRD,15,0.85,16984.0,United Kingdom,2025-11-21
511269,21693,SMALL HAMMERED SILVER CANDLEPOT ,6,2.95,16984.0,United Kingdom,2025-11-21
511269,22178,VICTORIAN GLASS HANGING T-LIGHT,6,1.25,16984.0,United Kingdom,2025-11-21
511269,21270,ANTIQUE CREAM CUTLERY CUPBOARD,1,12.75,16984.0,United Kingdom,2025-11-21
511269,85062,PEARL CRYSTAL PUMPKIN T-LIGHT HLDR,12,1.65,16984.0,United Kingdom,2025-11-21
511269,84984A,GREEN PEONY CUSHION COVER,1,4.65,16984.0,United Kingdom,2025-11-21
511269,84984B,RED PEONY CUSHION COVER ,1,4.65,16984.0,United Kingdom,2025-11-21
511269,21925,UNION STRIPE CUSHION COVER ,4,1.25,16984.0,United Kingdom,2025-11-21
511269,21926,RED/CREAM STRIPE CUSHION COVER ,4,1.25,16984.0,United Kingdom,2025-11-21
511269,84761,IVORY HANGING BIRD PLANTER ,3,2.55,16984.0,United Kingdom,2025-11-21
511269,22411,JUMBO SHOPPER VINTAGE RED PAISLEY,2,1.95,16984.0,United Kingdom,2025-11-21
511269,21928,JUMBO BAG SCANDINAVIAN PAISLEY,1,1.95,16984.0,United Kingdom,2025-11-21
511269,85099B,JUMBO BAG RED RETROSPOT,3,1.95,16984.0,United Kingdom,2025-11-21
511269,85099F,JUMBO BAG STRAWBERRY,3,1.95,16984.0,United Kingdom,2025-11-21
511269,22386,JUMBO BAG PINK WITH WHITE SPOTS,1,1.95,16984.0,United Kingdom,2025-11-21
511269,22502,PICNIC BASKET WICKER SMALL,2,4.25,16984.0,United Kingdom,2025-11-21
511271,21590,KINGS CHOICE CIGAR BOX MATCHES ,24,1.25,13699.0,United Kingdom,2025-11-21
511271,22115,METAL SIGN EMPIRE TEA,6,2.95,13699.0,United Kingdom,2025-11-21
511271,21875,KINGS CHOICE MUG,12,1.25,13699.0,United Kingdom,2025-11-21
511271,21870,I CAN ONLY PLEASE ONE PERSON MUG,12,1.25,13699.0,United Kingdom,2025-11-21
511271,21877,HOME SWEET HOME MUG,12,1.25,13699.0,United Kingdom,2025-11-21
511271,21733,RED HANGING HEART T-LIGHT HOLDER,6,2.95,13699.0,United Kingdom,2025-11-21
511271,22194,BLACK DINER WALL CLOCK,2,8.5,13699.0,United Kingdom,2025-11-21
511271,85150,LADIES & GENTLEMEN METAL SIGN,6,2.55,13699.0,United Kingdom,2025-11-21
511271,21524,DOOR MAT SPOTTY HOME SWEET HOME,2,7.49,13699.0,United Kingdom,2025-11-21
511271,22358,KINGS CHOICE TEA CADDY ,6,2.95,13699.0,United Kingdom,2025-11-21
511271,85123A,WHITE HANGING HEART T-LIGHT HOLDER,6,2.95,13699.0,United Kingdom,2025-11-21
511271,22423,REGENCY CAKESTAND 3 TIER,2,12.75,13699.0,United Kingdom,2025-11-21
511271,48185,DOOR MAT FAIRY CAKE,2,7.49,13699.0,United Kingdom,2025-11-21
511270,22379,RECYCLING BAG RETROSPOT ,8,2.1,14159.0,United Kingdom,2025-11-21
511271,82600,NO SINGING METAL SIGN,12,2.1,13699.0,United Kingdom,2025-11-21
511271,82597,BOMBS AWAY METAL SIGN,12,2.1,13699.0,United Kingdom,2025-11-21
511271,21166,COOK WITH WINE METAL SIGN ,12,1.95,13699.0,United Kingdom,2025-11-21
511271,21784,SHOE SHINE BOX ,2,9.95,13699.0,United Kingdom,2025-11-21
511271,21781,MA CAMPAGNE CUTLERY BOX,3,14.95,13699.0,United Kingdom,2025-11-21
511271,21777,RECIPE BOX WITH METAL HEART,2,7.95,13699.0,United Kingdom,2025-11-21
511271,22501,PICNIC BASKET WICKER LARGE,2,9.95,13699.0,United Kingdom,2025-11-21
511271,22365,DOOR MAT RESPECTABLE HOUSE,2,7.49,13699.0,United Kingdom,2025-11-21
511271,48138,DOOR MAT UNION FLAG,2,7.49,13699.0,United Kingdom,2025-11-21
511270,84510A,SET OF 4 ENGLISH ROSE COASTERS,1,1.25,14159.0,United Kingdom,2025-11-21
511270,84510C,SET OF 4 POLKADOTS COASTERS,1,1.25,14159.0,United Kingdom,2025-11-21
511270,85099F,JUMBO BAG STRAWBERRY,1,1.95,14159.0,United Kingdom,2025-11-21
511271,22117,METAL SIGN HER DINNER IS SERVED ,6,2.95,13699.0,United Kingdom,2025-11-21
511270,21931,JUMBO STORAGE BAG SUKI,2,1.95,14159.0,United Kingdom,2025-11-21
511270,85061W,WHITE JEWELLED HEART DECORATION,4,0.85,14159.0,United Kingdom,2025-11-21
511270,21241,GREEN SPOTTY CUP,2,0.85,14159.0,United Kingdom,2025-11-21
511270,84510F,SET OF 4 NEW ENGLAND COASTERS ,1,1.25,14159.0,United Kingdom,2025-11-21
511270,22197,SMALL POPCORN HOLDER,12,0.85,14159.0,United Kingdom,2025-11-21
511270,47566B,TEA TIME PARTY BUNTING,1,4.65,14159.0,United Kingdom,2025-11-21
511270,21245,GREEN  SPOTTY PLATE ,1,1.69,14159.0,United Kingdom,2025-11-21
511270,84691,PACK 20 DOLLY PEGS,2,0.85,14159.0,United Kingdom,2025-11-21
511270,47568,ENGLISH ROSE DESIGN PEG BAG,4,2.1,14159.0,United Kingdom,2025-11-21
511270,22508,DOORSTOP RETROSPOT HEART,1,3.75,14159.0,United Kingdom,2025-11-21
511270,22511,DOORSTOP RUSSIAN DOLL RETROSPOT,1,3.75,14159.0,United Kingdom,2025-11-21
511270,21624,VINTAGE UNION JACK DOORSTOP,1,5.95,14159.0,United Kingdom,2025-11-21
511270,47559B,TEA TIME OVEN GLOVE,1,1.25,14159.0,United Kingdom,2025-11-21
511270,22195,LARGE HEART MEASURING SPOONS,2,1.65,14159.0,United Kingdom,2025-11-21
511270,82578,KITCHEN METAL SIGN,2,0.55,14159.0,United Kingdom,2025-11-21
511270,82580,BATHROOM METAL SIGN,4,0.55,14159.0,United Kingdom,2025-11-21
511270,21937,STRAWBERRY   PICNIC BAG,6,2.95,14159.0,United Kingdom,2025-11-21
511270,20727,LUNCH BAG  BLACK SKULL.,210,1.45,14159.0,United Kingdom,2025-11-21
511270,22383,LUNCH BAG SUKI  DESIGN ,5,1.65,14159.0,United Kingdom,2025-11-21
511270,40018F,CHERRY DESIGN PAPERLANTERNS,4,1.95,14159.0,United Kingdom,2025-11-21
511270,22384,LUNCH BAG PINK RETROSPOT,4,1.65,14159.0,United Kingdom,2025-11-21
511270,20725,LUNCH BAG RED SPOTTY,10,1.65,14159.0,United Kingdom,2025-11-21
511270,85099C,JUMBO  BAG BAROQUE BLACK WHITE,3,1.95,14159.0,United Kingdom,2025-11-21
511270,22386,JUMBO BAG PINK WITH WHITE SPOTS,1,1.95,14159.0,United Kingdom,2025-11-21
511270,85099F,JUMBO BAG STRAWBERRY,4,1.95,14159.0,United Kingdom,2025-11-21
511270,22381,TOY TIDY PINK RETROSPOT  ,6,2.1,14159.0,United Kingdom,2025-11-21
511270,85099B,JUMBO BAG RED RETROSPOT,4,1.95,14159.0,United Kingdom,2025-11-21
511270,20684,STRAWBERRY DREAM CHILDS UMBRELLA,2,3.25,14159.0,United Kingdom,2025-11-21
511270,21240,BLUE  SPOTTY CUP,2,0.85,14159.0,United Kingdom,2025-11-21
511270,21239,PINK  SPOTTY CUP,2,0.85,14159.0,United Kingdom,2025-11-21
511270,22386,JUMBO BAG PINK WITH WHITE SPOTS,1,1.95,14159.0,United Kingdom,2025-11-21
511270,20914,SET/5 RED SPOTTY LID GLASS BOWLS,2,2.95,14159.0,United Kingdom,2025-11-21
511270,21839,MUMMY MOUSE RED GINGHAM RIBBON,1,5.45,14159.0,United Kingdom,2025-11-21
511270,84997D,PINK 3 PIECE MINI DOTS CUTLERY SET,1,3.75,14159.0,United Kingdom,2025-11-21
511270,22326,ROUND SNACK BOXES SET OF4 WOODLAND ,3,2.95,14159.0,United Kingdom,2025-11-21
511270,21474,SWEETHEART CREAM STEEL FOLDIN BENCH,1,19.95,14159.0,United Kingdom,2025-11-21
511270,21034,REX CASH+CARRY JUMBO SHOPPER,5,0.95,14159.0,United Kingdom,2025-11-21
511270,20723,STRAWBERRY CHARLOTTE BAG,2,0.85,14159.0,United Kingdom,2025-11-21
511270,47591C,BLUE FAIRY CAKE CHILD'S APRON,1,1.95,14159.0,United Kingdom,2025-11-21
511270,21156,RED SPOTTY CHILDS APRON,1,1.95,14159.0,United Kingdom,2025-11-21
511270,47591D,PINK FAIRY CAKE CHILD'S APRON,1,1.95,14159.0,United Kingdom,2025-11-21
511270,21936,RED RETROSPOT PICNIC BAG,5,2.95,14159.0,United Kingdom,2025-11-21
511270,21733,RED HANGING HEART T-LIGHT HOLDER,4,2.95,14159.0,United Kingdom,2025-11-21
511270,84901,BLACK FACE LAMB WITH PANTS,1,3.75,14159.0,United Kingdom,2025-11-21
511270,22347,PIZZA SLICE DISH,3,1.25,14159.0,United Kingdom,2025-11-21
511270,21381,MINI WOODEN HAPPY BIRTHDAY GARLAND,3,1.69,14159.0,United Kingdom,2025-11-21
511270,22219,LOVEBIRD HANGING DECORATION WHITE ,6,0.85,14159.0,United Kingdom,2025-11-21
511270,22198,LARGE POPCORN HOLDER ,4,1.65,14159.0,United Kingdom,2025-11-21
511270,22646,CERAMIC STRAWBERRY CAKE MONEY BANK,12,1.45,14159.0,United Kingdom,2025-11-21
511270,21901,"KEY FOB , BACK DOOR ",2,0.65,14159.0,United Kingdom,2025-11-21
511270,21901,"KEY FOB , BACK DOOR ",2,0.65,14159.0,United Kingdom,2025-11-21
511270,85123A,WHITE HANGING HEART T-LIGHT HOLDER,6,2.95,14159.0,United Kingdom,2025-11-21
511270,21899,"KEY FOB , GARAGE DESIGN",2,0.65,14159.0,United Kingdom,2025-11-21
511270,21900,"KEY FOB , SHED",2,0.65,14159.0,United Kingdom,2025-11-21
511270,22528,GARDENERS KNEELING PAD,3,1.25,14159.0,United Kingdom,2025-11-21
511270,22650,CERAMIC PIRATE CHEST MONEY BANK,4,1.45,14159.0,United Kingdom,2025-11-21
511270,22464,HANGING METAL HEART LANTERN,6,1.65,14159.0,United Kingdom,2025-11-21
511270,84755,COLOUR GLASS T-LIGHT HOLDER HANGING,16,0.65,14159.0,United Kingdom,2025-11-21
511270,84534B,FAIRY CAKE NOTEBOOK A5 SIZE,4,0.85,14159.0,United Kingdom,2025-11-21
511270,22328,ROUND SNACK BOXES SET OF 4 FRUITS ,3,2.95,14159.0,United Kingdom,2025-11-21
511270,21896,POTTING SHED TWINE,2,2.1,14159.0,United Kingdom,2025-11-21
511270,22524,CHILDRENS GARDEN GLOVES BLUE,1,1.25,14159.0,United Kingdom,2025-11-21
511270,22525,CHILDRENS GARDEN GLOVES PINK,1,1.25,14159.0,United Kingdom,2025-11-21
511270,84997A,GREEN 3 PIECE MINI DOTS CUTLERY SET,1,3.75,14159.0,United Kingdom,2025-11-21
511270,84997C,BLUE 3 PIECE MINI DOTS CUTLERY SET,2,3.75,14159.0,United Kingdom,2025-11-21
511270,84997D,PINK 3 PIECE MINI DOTS CUTLERY SET,1,3.75,14159.0,United Kingdom,2025-11-21
511270,84580,MOUSE TOY WITH PINK T-SHIRT,1,3.75,14159.0,United Kingdom,2025-11-21
511270,84580,MOUSE TOY WITH PINK T-SHIRT,2,3.75,14159.0,United Kingdom,2025-11-21
511270,20675,BLUE SPOTTY BOWL,2,1.25,14159.0,United Kingdom,2025-11-21
511270,20674,GREEN SPOTTY BOWL,2,1.25,14159.0,United Kingdom,2025-11-21
511270,84596G,SMALL CHOCOLATES PINK BOWL,1,1.25,14159.0,United Kingdom,2025-11-21
511270,20671,BLUE TEATIME PRINT BOWL ,2,1.25,14159.0,United Kingdom,2025-11-21
511270,84596F,SMALL MARSHMALLOWS PINK BOWL,2,1.25,14159.0,United Kingdom,2025-11-21
511270,84596B,SMALL DOLLY MIX DESIGN ORANGE BOWL,2,1.25,14159.0,United Kingdom,2025-11-21
511270,84596K,JELLY BABIES YELLOW SMALL BOWL,2,1.25,14159.0,United Kingdom,2025-11-21
511270,84536B,FAIRY CAKES NOTEBOOK A7 SIZE,4,0.42,14159.0,United Kingdom,2025-11-21
511270,84596J,MIXED NUTS LIGHT GREEN BOWL,2,1.25,14159.0,United Kingdom,2025-11-21
511270,84902,PINK KNITTED COW STUFFED TOY,1,3.75,14159.0,United Kingdom,2025-11-21
511270,21841,BABY MOUSE RED GINGHAM DRESS,1,4.25,14159.0,United Kingdom,2025-11-21
511270,82581,TOILET METAL SIGN,5,0.55,14159.0,United Kingdom,2025-11-21
511270,22327,ROUND SNACK BOXES SET OF 4 SKULLS,3,2.95,14159.0,United Kingdom,2025-11-21
511270,47566,PARTY BUNTING,2,4.65,14159.0,United Kingdom,2025-11-21
511270,22131,FOOD CONTAINER SET 3 LOVE HEART ,3,1.95,14159.0,United Kingdom,2025-11-21
511270,22131,FOOD CONTAINER SET 3 LOVE HEART ,1,1.95,14159.0,United Kingdom,2025-11-21
511270,22441,GROW YOUR OWN BASIL IN ENAMEL MUG,3,2.1,14159.0,United Kingdom,2025-11-21
511270,22523,CHILDS GARDEN FORK PINK,1,0.85,14159.0,United Kingdom,2025-11-21
511270,22521,CHILDS GARDEN TROWEL PINK,1,0.85,14159.0,United Kingdom,2025-11-21
511270,22522,CHILDS GARDEN FORK BLUE ,1,0.85,14159.0,United Kingdom,2025-11-21
511270,22520,CHILDS GARDEN TROWEL BLUE ,1,0.85,14159.0,United Kingdom,2025-11-21
511270,21243,PINK  SPOTTY PLATE ,2,1.69,14159.0,United Kingdom,2025-11-21
511270,84536A,ENGLISH ROSE NOTEBOOK A7 SIZE,4,0.42,14159.0,United Kingdom,2025-11-21
C511272,20727,LUNCH BAG  BLACK SKULL.,-210,1.45,14159.0,United Kingdom,2025-11-21
C511272,D,Discount,-1,43.17,14159.0,United Kingdom,2025-11-21
511273,20727,LUNCH BAG  BLACK SKULL.,10,1.65,14159.0,United Kingdom,2025-11-21
511273,21078,SET/20 STRAWBERRY PAPER NAPKINS ,1,0.85,14159.0,United Kingdom,2025-11-21
511273,21080,SET/20 RED SPOTTY PAPER NAPKINS ,1,0.85,14159.0,United Kingdom,2025-11-21
511273,84520B,PACK 20 ENGLISH ROSE PAPER NAPKINS,1,0.85,14159.0,United Kingdom,2025-11-21
511273,21982,PACK OF 12 SUKI TISSUES ,12,0.29,14159.0,United Kingdom,2025-11-21
511273,21985,PACK OF 12 HEARTS DESIGN TISSUES ,12,0.29,14159.0,United Kingdom,2025-11-21
511273,21967,PACK OF 12 SKULL TISSUES,12,0.29,14159.0,United Kingdom,2025-11-21
511274,37449,CERAMIC CAKE STAND + HANGING CAKES,2,9.95,13468.0,United Kingdom,2025-11-21
511274,20828,GLITTER BUTTERFLY CLIPS,6,2.55,13468.0,United Kingdom,2025-11-21
511274,21622,VINTAGE UNION JACK CUSHION COVER,4,4.95,13468.0,United Kingdom,2025-11-21
511274,22211,WOOD STAMP SET FLOWERS,12,1.65,13468.0,United Kingdom,2025-11-21
511274,20979,36 PENCILS TUBE RED SPOTTY,16,1.25,13468.0,United Kingdom,2025-11-21
511274,85042,ANTIQUE LILY FAIRY LIGHTS,4,4.95,13468.0,United Kingdom,2025-11-21
C511275,22467,GUMBALL COAT RACK,-1,2.55,12471.0,Germany,2025-11-21
511274,79320,FLAMINGO LIGHTS,4,4.95,13468.0,United Kingdom,2025-11-21
511274,37450,CERAMIC CAKE BOWL + HANGING CAKES,6,2.95,13468.0,United Kingdom,2025-11-21
511276,22428,ENAMEL FIRE BUCKET CREAM,2,6.95,17515.0,United Kingdom,2025-11-21
511276,22426,ENAMEL WASH BOWL CREAM,2,3.75,17515.0,United Kingdom,2025-11-21
511276,82486,WOOD S/3 CABINET ANT WHITE FINISH,2,7.95,17515.0,United Kingdom,2025-11-21
511276,21165,BEWARE OF THE CAT METAL SIGN ,3,1.69,17515.0,United Kingdom,2025-11-21
511276,22424,ENAMEL BREAD BIN CREAM,1,12.75,17515.0,United Kingdom,2025-11-21
511276,84789,ENCHANTED BIRD PLANT CAGE,2,3.75,17515.0,United Kingdom,2025-11-21
511276,21174,POTTERING IN THE SHED METAL SIGN,3,1.95,17515.0,United Kingdom,2025-11-21
511276,22528,GARDENERS KNEELING PAD,3,1.25,17515.0,United Kingdom,2025-11-21
511276,84405A,S/3 PINK COL METAL BASKET W HANDLE,1,12.75,17515.0,United Kingdom,2025-11-21
511276,84886,BLUE METAL WALL SHELF,2,9.95,17515.0,United Kingdom,2025-11-21
511276,84292,ROSE PINK METAL FOLDING CHAIR,2,7.95,17515.0,United Kingdom,2025-11-21
511276,21476,STEEL SWEETHEART ROUND TABLE CREAM,2,14.95,17515.0,United Kingdom,2025-11-21
511276,22526,WHEELBARROW FOR CHILDREN ,1,12.75,17515.0,United Kingdom,2025-11-21
511277,20728,LUNCH BAG CARS BLUE,730,1.45,14028.0,United Kingdom,2025-11-21
511277,20727,LUNCH BAG  BLACK SKULL.,730,1.45,14028.0,United Kingdom,2025-11-21
511277,20726,LUNCH BAG WOODLAND,730,1.45,14028.0,United Kingdom,2025-11-21
511278,21826,EIGHT PIECE DINOSAUR SET,12,1.25,14786.0,United Kingdom,2025-11-21
511278,22331,WOODLAND PARTY BAG + STICKER SET,8,1.65,14786.0,United Kingdom,2025-11-21
511278,15034,PAPER POCKET TRAVELING FAN ,24,0.14,14786.0,United Kingdom,2025-11-21
511278,22334,DINOSAUR PARTY BAG + STICKER SET,8,1.65,14786.0,United Kingdom,2025-11-21
511278,20973,12 PENCIL SMALL TUBE WOODLAND,24,0.65,14786.0,United Kingdom,2025-11-21
511278,21541,DINOSAURS WATER TRANSFER TATTOOS ,12,0.85,14786.0,United Kingdom,2025-11-21
511278,21542,WOODLAND WATER TRANSFER TATTOOS ,24,0.85,14786.0,United Kingdom,2025-11-21
511279,85099F,JUMBO BAG STRAWBERRY,4,1.95,17412.0,United Kingdom,2025-11-21
511279,20712,JUMBO BAG WOODLAND ANIMALS,4,1.95,17412.0,United Kingdom,2025-11-21
511279,20726,LUNCH BAG WOODLAND,10,1.65,17412.0,United Kingdom,2025-11-21
511279,21077,SET/20 WOODLAND PAPER NAPKINS ,6,0.85,17412.0,United Kingdom,2025-11-21
511279,47591B,SCOTTIES DES CHILD'S APRON,3,1.65,17412.0,United Kingdom,2025-11-21
511279,22507,MEMO BOARD RETROSPOT  DESIGN,2,4.95,17412.0,United Kingdom,2025-11-21
511279,22382,LUNCH BAG SPACEBOY DESIGN ,10,1.65,17412.0,United Kingdom,2025-11-21
511279,22367,CHILDS APRON SPACEBOY DESIGN,3,1.95,17412.0,United Kingdom,2025-11-21
511279,21082,SET/20 FRUIT SALAD PAPER NAPKINS ,6,0.85,17412.0,United Kingdom,2025-11-21
511279,10002,INFLATABLE POLITICAL GLOBE ,3,0.85,17412.0,United Kingdom,2025-11-21
511279,21844,RED RETROSPOT MUG,6,2.95,17412.0,United Kingdom,2025-11-21
511279,21533,RETRO SPOT LARGE MILK JUG,2,4.95,17412.0,United Kingdom,2025-11-21
511279,22704,WRAP RED APPLES ,25,0.42,17412.0,United Kingdom,2025-11-21
511279,22328,ROUND SNACK BOXES SET OF 4 FRUITS ,3,2.95,17412.0,United Kingdom,2025-11-21
511279,84676,BATH DUCK WATERING CAN,4,2.95,17412.0,United Kingdom,2025-11-21
511279,22502,PICNIC BASKET WICKER SMALL,2,4.25,17412.0,United Kingdom,2025-11-21
511279,79191D,RETRO PLASTIC DAISY TRAY,8,0.85,17412.0,United Kingdom,2025-11-21
511279,22710,WRAP I LOVE LONDON ,25,0.42,17412.0,United Kingdom,2025-11-21
511279,22411,JUMBO SHOPPER VINTAGE RED PAISLEY,4,1.95,17412.0,United Kingdom,2025-11-21
511279,84288B,SET/2 BLUE  NOODLE BASKETS,2,1.95,17412.0,United Kingdom,2025-11-21
511279,79066K,RETRO MOD TRAY,1,0.85,17412.0,United Kingdom,2025-11-21
511279,21787,RAIN PONCHO WITH RED SPOTS,8,0.85,17412.0,United Kingdom,2025-11-21
511279,79066K,RETRO MOD TRAY,3,0.85,17412.0,United Kingdom,2025-11-21
511279,21700,BIG DOUGHNUT FRIDGE MAGNETS,6,0.85,17412.0,United Kingdom,2025-11-21
511279,21078,SET/20 STRAWBERRY PAPER NAPKINS ,6,0.85,17412.0,United Kingdom,2025-11-21
511279,21746,SMALL RED RETROSPOT WINDMILL,6,1.25,17412.0,United Kingdom,2025-11-21
511279,21973,SET OF 36 MUSHROOM PAPER DOILIES,6,1.45,17412.0,United Kingdom,2025-11-21
511279,22398,MAGNETS PACK OF 4 SWALLOWS,6,1.25,17412.0,United Kingdom,2025-11-21
511279,22080,RIBBON REEL SPOTS DESIGN ,5,1.65,17412.0,United Kingdom,2025-11-21
511279,85049G,CHOCOLATE BOX RIBBONS ,1,1.25,17412.0,United Kingdom,2025-11-21
511279,22077,6 RIBBONS RUSTIC CHARM,2,1.65,17412.0,United Kingdom,2025-11-21
511279,21749,LARGE RED RETROSPOT WINDMILL,2,2.1,17412.0,United Kingdom,2025-11-21
511279,22088,PAPER BUNTING COLOURED LACE,4,2.95,17412.0,United Kingdom,2025-11-21
511279,22616,PACK OF 12 LONDON TISSUES ,12,0.29,17412.0,United Kingdom,2025-11-21
511279,22614,PACK OF 12 SPACEBOY TISSUES,12,0.29,17412.0,United Kingdom,2025-11-21
511279,21982,PACK OF 12 SUKI TISSUES ,24,0.29,17412.0,United Kingdom,2025-11-21
511279,21977,PACK OF 60 PINK PAISLEY CAKE CASES,16,0.55,17412.0,United Kingdom,2025-11-21
511279,21452,TOADSTOOL MONEY BOX,4,2.95,17412.0,United Kingdom,2025-11-21
511279,21472,LADYBIRD + BEE RAFFIA FOOD COVER,2,3.75,17412.0,United Kingdom,2025-11-21
