Invoice,StockCode,Description,Quantity,Price,Customer ID,Country,InvoiceDate
508899,22384,LUNCH BAG PINK RETROSPOT,10,1.65,16839.0,United Kingdom,2025-11-06
508899,20728,LUNCH BAG CARS BLUE,10,1.65,16839.0,United Kingdom,2025-11-06
508899,15056N,EDWARDIAN PARASOL NATURAL,60,4.95,16839.0,United Kingdom,2025-11-06
508899,22380,TOY TIDY SPACEBOY  ,10,2.1,16839.0,United Kingdom,2025-11-06
508899,84978,HANGING HEART JAR T-LIGHT HOLDER,72,1.06,16839.0,United Kingdom,2025-11-06
508899,71459,HANGING JAM JAR T-LIGHT HOLDER,96,0.72,16839.0,United Kingdom,2025-11-06
508899,85065,CREAM SWEETHEART TRAYS,10,9.95,16839.0,United Kingdom,2025-11-06
508900,22138,BAKING SET 9 PIECE RETROSPOT ,3,4.95,16835.0,United Kingdom,2025-11-06
508900,22139,RETRO SPOT TEA SET CERAMIC 11 PC ,3,4.95,16835.0,United Kingdom,2025-11-06
508900,37446,MINI CAKE STAND WITH HANGING CAKES,8,1.45,16835.0,United Kingdom,2025-11-06
508900,37444A,YELLOW BREAKFAST CUP AND SAUCER,4,2.95,16835.0,United Kingdom,2025-11-06
508900,21561,DINOSAUR LUNCH BOX WITH CUTLERY,6,2.55,16835.0,United Kingdom,2025-11-06
508900,21559,STRAWBERRY LUNCH BOX WITH CUTLERY,6,2.55,16835.0,United Kingdom,2025-11-06
508900,21472,LADYBIRD + BEE RAFFIA FOOD COVER,6,3.75,16835.0,United Kingdom,2025-11-06
508900,22212,FOUR HOOK  WHITE LOVEBIRDS,6,2.1,16835.0,United Kingdom,2025-11-06
508900,21955,DOOR MAT UNION JACK GUNS AND ROSES,2,7.49,16835.0,United Kingdom,2025-11-06
508900,85035C,ROSE 3 WICK MORRIS BOX CANDLE,4,4.25,16835.0,United Kingdom,2025-11-06
508900,22519,CHILDS GARDEN BRUSH PINK,6,2.1,16835.0,United Kingdom,2025-11-06
508900,84949,SILVER HANGING T-LIGHT HOLDER,6,1.65,16835.0,United Kingdom,2025-11-06
508900,85035B,CHOCOLATE 3 WICK MORRIS BOX CANDLE,4,4.25,16835.0,United Kingdom,2025-11-06
508900,22617,BAKING SET SPACEBOY DESIGN,3,4.95,16835.0,United Kingdom,2025-11-06
508900,21259,VICTORIAN SEWING BOX SMALL ,2,5.95,16835.0,United Kingdom,2025-11-06
508900,79029,GLASS HONEYPOT WASP CATCHER,6,1.95,16835.0,United Kingdom,2025-11-06
508900,84846A,SCENTED CANDLE IN DIGITALIS TIN,6,2.1,16835.0,United Kingdom,2025-11-06
508900,85129D,BEADED CRYSTAL HEART PINK SMALL,12,1.25,16835.0,United Kingdom,2025-11-06
508900,22585,PACK OF 6 BIRDY GIFT TAGS,12,1.25,16835.0,United Kingdom,2025-11-06
508900,21348,PINK SPOTS CHOCOLATE NESTING BOXES ,6,2.95,16835.0,United Kingdom,2025-11-06
508900,22518,CHILDS GARDEN BRUSH BLUE,6,2.1,16835.0,United Kingdom,2025-11-06
508901,22515,CHILDS GARDEN SPADE PINK,6,2.1,13999.0,United Kingdom,2025-11-06
508901,22517,CHILDS GARDEN RAKE PINK,6,2.1,13999.0,United Kingdom,2025-11-06
508901,22516,CHILDS GARDEN RAKE BLUE,6,2.1,13999.0,United Kingdom,2025-11-06
508901,22492,MINI PAINT SET VINTAGE ,36,0.65,13999.0,United Kingdom,2025-11-06
508901,22489,PACK OF 12 TRADITIONAL CRAYONS,24,0.42,13999.0,United Kingdom,2025-11-06
508901,22523,CHILDS GARDEN FORK PINK,12,0.85,13999.0,United Kingdom,2025-11-06
508901,22522,CHILDS GARDEN FORK BLUE ,12,0.85,13999.0,United Kingdom,2025-11-06
508901,21498,RED SPOTS  WRAP ,25,0.42,13999.0,United Kingdom,2025-11-06
508901,84279B,CHERRY BLOSSOM DECORATIVE FLASK,12,3.39,13999.0,United Kingdom,2025-11-06
508901,21080,SET/20 RED SPOTTY PAPER NAPKINS ,12,0.85,13999.0,United Kingdom,2025-11-06
508901,22514,CHILDS GARDEN SPADE BLUE,6,2.1,13999.0,United Kingdom,2025-11-06
508901,22498,WOODEN REGATTA BUNTING,3,5.95,13999.0,United Kingdom,2025-11-06
508901,85231G,ORANGE SCENTED SET/9 T-LIGHTS,12,0.85,13999.0,United Kingdom,2025-11-06
508901,21241,GREEN SPOTTY CUP,8,0.85,13999.0,United Kingdom,2025-11-06
508901,21240,BLUE  SPOTTY CUP,8,0.85,13999.0,United Kingdom,2025-11-06
508901,21239,PINK  SPOTTY CUP,8,0.85,13999.0,United Kingdom,2025-11-06
508901,21238,RED SPOTTY CUP,8,0.85,13999.0,United Kingdom,2025-11-06
508901,20677,PINK SPOTTY BOWL,8,1.25,13999.0,United Kingdom,2025-11-06
508901,20676,RED SPOTTY BOWL,8,1.25,13999.0,United Kingdom,2025-11-06
508901,20675,BLUE SPOTTY BOWL,8,1.25,13999.0,United Kingdom,2025-11-06
508901,20674,GREEN SPOTTY BOWL,8,1.25,13999.0,United Kingdom,2025-11-06
508901,22185,SLATE TILE NATURAL HANGING,36,1.45,13999.0,United Kingdom,2025-11-06
508901,85231B,CINAMMON SET OF 9 T-LIGHTS,12,0.85,13999.0,United Kingdom,2025-11-06
508902,84891B,,16,0.0,,United Kingdom,2025-11-06
508903,16162M,,144,0.0,,United Kingdom,2025-11-06
508904,21725,SWEETIES  STICKERS,12,0.85,14325.0,United Kingdom,2025-11-06
508904,21982,PACK OF 12 SUKI TISSUES ,48,0.29,14325.0,United Kingdom,2025-11-06
508904,85123A,WHITE HANGING HEART T-LIGHT HOLDER,6,2.95,14325.0,United Kingdom,2025-11-06
508904,22420,LIPSTICK PEN BABY PINK,12,0.42,14325.0,United Kingdom,2025-11-06
508904,22318,FIVE HEART HANGING DECORATION,6,2.95,14325.0,United Kingdom,2025-11-06
508904,21721,CANDY SHOP  STICKER SHEET,12,0.85,14325.0,United Kingdom,2025-11-06
508904,22129,PARTY CONES CANDY TREE DECORATION,12,0.85,14325.0,United Kingdom,2025-11-06
508904,16256B,FLOWER PENCIL/RUBBER+5 MINI PENCILS,24,0.42,14325.0,United Kingdom,2025-11-06
508904,22128,PARTY CONES CANDY ASSORTED,12,1.25,14325.0,United Kingdom,2025-11-06
508904,21891,TRADITIONAL WOODEN SKIPPING ROPE,12,1.25,14325.0,United Kingdom,2025-11-06
508904,84715,SET OF 6 ICE CREAM SKITTLES,8,2.95,14325.0,United Kingdom,2025-11-06
508904,21948,SET OF 6 CAKE CHOPSTICKS,12,1.25,14325.0,United Kingdom,2025-11-06
508904,85217,ASSORTED ICE CREAM FRIDGE MAGNETS,12,0.65,14325.0,United Kingdom,2025-11-06
508904,84077,WORLD WAR 2 GLIDERS ASSTD DESIGNS,48,0.21,14325.0,United Kingdom,2025-11-06
508904,22492,MINI PAINT SET VINTAGE ,36,0.65,14325.0,United Kingdom,2025-11-06
508904,22491,PACK OF 12 COLOURED PENCILS,12,0.85,14325.0,United Kingdom,2025-11-06
508904,22489,PACK OF 12 TRADITIONAL CRAYONS,24,0.42,14325.0,United Kingdom,2025-11-06
508904,21381,MINI WOODEN HAPPY BIRTHDAY GARLAND,12,1.69,14325.0,United Kingdom,2025-11-06
508905,84520B,PACK 20 ENGLISH ROSE PAPER NAPKINS,24,0.85,17560.0,United Kingdom,2025-11-06
508905,47566,PARTY BUNTING,20,4.65,17560.0,United Kingdom,2025-11-06
508905,84534B,FAIRY CAKE NOTEBOOK A5 SIZE,12,0.85,17560.0,United Kingdom,2025-11-06
508905,21977,PACK OF 60 PINK PAISLEY CAKE CASES,24,0.55,17560.0,United Kingdom,2025-11-06
508905,84991,60 TEATIME FAIRY CAKE CASES,24,0.55,17560.0,United Kingdom,2025-11-06
508905,84535B,FAIRY CAKES NOTEBOOK A6 SIZE,16,0.65,17560.0,United Kingdom,2025-11-06
508906,22374,AIRLINE BAG VINTAGE JET SET RED,2,6.35,13152.0,United Kingdom,2025-11-06
508906,22555,PLASTERS IN TIN STRONGMAN,12,1.65,13152.0,United Kingdom,2025-11-06
508906,22176,BLUE OWL SOFT TOY,6,2.95,13152.0,United Kingdom,2025-11-06
508906,21914,BLUE HARMONICA IN BOX ,12,1.25,13152.0,United Kingdom,2025-11-06
508906,21715,GIRLS VINTAGE TIN SEASIDE BUCKET,8,2.55,13152.0,United Kingdom,2025-11-06
508906,22052,VINTAGE CARAVAN GIFT WRAP,25,0.42,13152.0,United Kingdom,2025-11-06
508906,22073,RED RETROSPOT STORAGE JAR,4,3.75,13152.0,United Kingdom,2025-11-06
508906,22518,CHILDS GARDEN BRUSH BLUE,6,2.1,13152.0,United Kingdom,2025-11-06
508906,71459,HANGING JAM JAR T-LIGHT HOLDER,12,0.85,13152.0,United Kingdom,2025-11-06
508906,20685,DOOR MAT RED SPOT,2,7.49,13152.0,United Kingdom,2025-11-06
508906,48138,DOOR MAT UNION FLAG,2,7.49,13152.0,United Kingdom,2025-11-06
508906,84884A,ANT WHITE WIRE HEART SPIRAL,5,3.95,13152.0,United Kingdom,2025-11-06
508906,22526,WHEELBARROW FOR CHILDREN ,1,12.75,13152.0,United Kingdom,2025-11-06
508906,22514,CHILDS GARDEN SPADE BLUE,6,2.1,13152.0,United Kingdom,2025-11-06
508906,21115,ROSE CARAVAN DOORSTOP,2,6.75,13152.0,United Kingdom,2025-11-06
508907,22558,CLOTHES PEGS RETROSPOT PACK 24 ,48,1.06,16701.0,United Kingdom,2025-11-06
508907,84991,60 TEATIME FAIRY CAKE CASES,120,0.42,16701.0,United Kingdom,2025-11-06
508907,22417,PACK OF 60 SPACEBOY CAKE CASES,120,0.42,16701.0,United Kingdom,2025-11-06
508907,21539,RED RETROSPOT BUTTER DISH,18,4.25,16701.0,United Kingdom,2025-11-06
508907,21900,"KEY FOB , SHED",24,0.65,16701.0,United Kingdom,2025-11-06
508907,21504,SKULLS GREETING CARD,24,0.42,16701.0,United Kingdom,2025-11-06
508907,21934,SKULL SHOULDER BAG,10,1.65,16701.0,United Kingdom,2025-11-06
508907,35004C,SET OF 3 COLOURED  FLYING DUCKS,6,5.45,16701.0,United Kingdom,2025-11-06
508907,21829,DINOSAUR KEYRINGS ASSORTED,36,0.21,16701.0,United Kingdom,2025-11-06
508908,84839,SWEETHEART KEY CABINET,8,6.75,13831.0,United Kingdom,2025-11-06
508908,85066,CREAM SWEETHEART MINI CHEST,4,12.75,13831.0,United Kingdom,2025-11-06
508908,85123A,WHITE HANGING HEART T-LIGHT HOLDER,96,2.55,13831.0,United Kingdom,2025-11-06
508909,17091J,VANILLA INCENSE IN TIN,288,0.85,13783.0,United Kingdom,2025-11-06
508909,17039,INLAID WOOD INCENSE HOLDER,500,0.21,13783.0,United Kingdom,2025-11-06
508910,22524,CHILDRENS GARDEN GLOVES BLUE,12,1.25,13491.0,United Kingdom,2025-11-06
508910,22422,TOOTHPASTE TUBE PEN,12,0.65,13491.0,United Kingdom,2025-11-06
508910,84685,BEACH HUT KEY CABINET,16,1.25,13491.0,United Kingdom,2025-11-06
508910,37503,TEA TIME CAKE STAND IN GIFT BOX,6,10.75,13491.0,United Kingdom,2025-11-06
508910,22371,AIRLINE BAG VINTAGE TOKYO 78,2,6.35,13491.0,United Kingdom,2025-11-06
508910,22508,DOORSTOP RETROSPOT HEART,4,3.75,13491.0,United Kingdom,2025-11-06
508910,15060B,FAIRY CAKE DESIGN UMBRELLA,4,3.75,13491.0,United Kingdom,2025-11-06
508910,84762A,WHITE PICNIC BARBECUE BUCKET,6,5.95,13491.0,United Kingdom,2025-11-06
508910,79029,GLASS HONEYPOT WASP CATCHER,6,1.95,13491.0,United Kingdom,2025-11-06
508910,22525,CHILDRENS GARDEN GLOVES PINK,12,1.25,13491.0,United Kingdom,2025-11-06
508910,85232B,SET/3 RUSSIAN DOLL STACKING TINS,3,4.95,13491.0,United Kingdom,2025-11-06
C508911,22170,PICTURE FRAME WOOD TRIPLE PORTRAIT,-6,6.75,14911.0,EIRE,2025-11-06
C508911,85119,WATERING CAN SINGLE HOOK PISTACHIO,-8,1.69,14911.0,EIRE,2025-11-06
508912,72129,COLUMBIAN CANDLE ROUND ,4,0.65,17243.0,United Kingdom,2025-11-06
508912,22214,CANDLE PLATE LACE WHITE,24,2.55,17243.0,United Kingdom,2025-11-06
508912,21313,GLASS HEART T-LIGHT HOLDER ,12,0.85,17243.0,United Kingdom,2025-11-06
508912,82484,WOOD BLACK BOARD ANT WHITE FINISH,2,6.45,17243.0,United Kingdom,2025-11-06
508912,22465,HANGING METAL STAR LANTERN,36,1.65,17243.0,United Kingdom,2025-11-06
508914,22428,ENAMEL FIRE BUCKET CREAM,6,6.95,16570.0,United Kingdom,2025-11-06
508914,84978,HANGING HEART JAR T-LIGHT HOLDER,12,1.25,16570.0,United Kingdom,2025-11-06
508914,22460,EMBOSSED GLASS TEALIGHT HOLDER,24,1.25,16570.0,United Kingdom,2025-11-06
508914,22132,RED LOVE HEART SHAPE CUP,24,0.85,16570.0,United Kingdom,2025-11-06
508914,21977,PACK OF 60 PINK PAISLEY CAKE CASES,24,0.55,16570.0,United Kingdom,2025-11-06
508914,21212,PACK OF 72 RETRO SPOT CAKE CASES,24,0.55,16570.0,United Kingdom,2025-11-06
508914,20723,STRAWBERRY CHARLOTTE BAG,40,0.85,16570.0,United Kingdom,2025-11-06
508914,20724,RED SPOTTY CHARLOTTE BAG,24,0.85,16570.0,United Kingdom,2025-11-06
508914,22432,WATERING CAN PINK BUNNY,6,1.95,16570.0,United Kingdom,2025-11-06
508914,84879,ASSORTED COLOUR BIRD ORNAMENT,48,1.69,16570.0,United Kingdom,2025-11-06
508914,20728,LUNCH BAG CARS BLUE,10,1.65,16570.0,United Kingdom,2025-11-06
508914,22383,LUNCH BAG SUKI  DESIGN ,10,1.65,16570.0,United Kingdom,2025-11-06
508914,22605,WOODEN CROQUET GARDEN SET,1,12.75,16570.0,United Kingdom,2025-11-06
508914,22607,WOODEN ROUNDERS GARDEN SET ,2,8.5,16570.0,United Kingdom,2025-11-06
508914,22519,CHILDS GARDEN BRUSH PINK,6,2.1,16570.0,United Kingdom,2025-11-06
508915,21754,HOME BUILDING BLOCK WORD,3,5.95,16293.0,United Kingdom,2025-11-06
508915,21755,LOVE BUILDING BLOCK WORD,3,5.95,16293.0,United Kingdom,2025-11-06
508915,21588,RETRO SPOT GIANT  TUBE MATCHES,12,2.55,16293.0,United Kingdom,2025-11-06
508915,22621,TRADITIONAL KNITTING NANCY,12,1.45,16293.0,United Kingdom,2025-11-06
508915,22444,GROW YOUR OWN PLANT IN A CAN ,24,1.25,16293.0,United Kingdom,2025-11-06
508915,85047,WHITE BEADED GARLAND STRING 20LIGHT,4,6.35,16293.0,United Kingdom,2025-11-06
508915,85042,ANTIQUE LILY FAIRY LIGHTS,4,4.95,16293.0,United Kingdom,2025-11-06
508915,22169,FAMILY ALBUM WHITE PICTURE FRAME,2,8.5,16293.0,United Kingdom,2025-11-06
508915,84879,ASSORTED COLOUR BIRD ORNAMENT,8,1.69,16293.0,United Kingdom,2025-11-06
508915,22485,SET OF 2 WOODEN MARKET CRATES,2,12.75,16293.0,United Kingdom,2025-11-06
508915,84978,HANGING HEART JAR T-LIGHT HOLDER,12,1.25,16293.0,United Kingdom,2025-11-06
508915,22178,VICTORIAN GLASS HANGING T-LIGHT,12,1.25,16293.0,United Kingdom,2025-11-06
508915,21843,RED RETROSPOT CAKE STAND,2,10.95,16293.0,United Kingdom,2025-11-06
508915,21756,BATH BUILDING BLOCK WORD,3,5.95,16293.0,United Kingdom,2025-11-06
508917,82607E,GLASS BONBON JAR. D'AMANDES,6,1.25,16699.0,United Kingdom,2025-11-06
C508916,22138,BAKING SET 9 PIECE RETROSPOT ,-6,4.95,16699.0,United Kingdom,2025-11-06
508918,75013B,"STRING OF 8 BUTTERFLIES,PINK",88,1.65,17262.0,United Kingdom,2025-11-06
508919,22174,PHOTO CUBE,48,1.48,17930.0,United Kingdom,2025-11-06
508919,22041,"RECORD FRAME 7"" SINGLE SIZE ",48,2.1,17930.0,United Kingdom,2025-11-06
508919,21137,BLACK RECORD COVER FRAME,48,3.39,17930.0,United Kingdom,2025-11-06
508920,37446,MINI CAKE STAND WITH HANGING CAKES,32,1.25,18194.0,United Kingdom,2025-11-06
508921,22222,CAKE PLATE LOVEBIRD WHITE,1,4.95,15912.0,United Kingdom,2025-11-06
508921,22625,RED KITCHEN SCALES,1,8.5,15912.0,United Kingdom,2025-11-06
508921,85103,SILVER T-LIGHT SETTING,1,6.75,15912.0,United Kingdom,2025-11-06
508921,79000,MOROCCAN TEA GLASS,96,0.85,15912.0,United Kingdom,2025-11-06
508921,22215,CAKE STAND WHITE TWO TIER LACE,1,8.5,15912.0,United Kingdom,2025-11-06
C508922,79323P,PINK CHERRY LIGHTS,-10,6.75,14667.0,United Kingdom,2025-11-06
C508922,79323LP,LIGHT PINK CHERRY LIGHTS,-4,6.75,14667.0,United Kingdom,2025-11-06
C508922,79323B,BLACK CHERRY LIGHTS,-4,6.75,14667.0,United Kingdom,2025-11-06
508923,79000,MOROCCAN TEA GLASS,12,0.85,15912.0,United Kingdom,2025-11-06
508923,21726,MULTI HEARTS  STICKERS,1,0.85,15912.0,United Kingdom,2025-11-06
508923,21724,PANDA AND BUNNIES STICKER SHEET,1,0.85,15912.0,United Kingdom,2025-11-06
508923,22626,BLACK KITCHEN SCALES,1,8.5,15912.0,United Kingdom,2025-11-06
508923,21721,CANDY SHOP  STICKER SHEET,1,0.85,15912.0,United Kingdom,2025-11-06
508923,21722,SWEET PUDDING STICKER SHEET,1,0.85,15912.0,United Kingdom,2025-11-06
508923,16235,RECYCLED PENCIL WITH RABBIT ERASER,20,0.21,15912.0,United Kingdom,2025-11-06
508923,21719,LOVELY BONBON STICKER SHEET,1,0.85,15912.0,United Kingdom,2025-11-06
508924,21232,STRAWBERRY CERAMIC TRINKET BOX,6,1.25,14035.0,United Kingdom,2025-11-06
508924,22167,"WALL MIRROR , DIAMANTE OVAL SHAPE",1,9.95,14035.0,United Kingdom,2025-11-06
508924,22607,WOODEN ROUNDERS GARDEN SET ,1,8.5,14035.0,United Kingdom,2025-11-06
508924,22219,LOVEBIRD HANGING DECORATION WHITE ,4,0.85,14035.0,United Kingdom,2025-11-06
508924,85123A,WHITE HANGING HEART T-LIGHT HOLDER,6,2.95,14035.0,United Kingdom,2025-11-06
508924,22296,HEART IVORY TRELLIS LARGE,2,1.65,14035.0,United Kingdom,2025-11-06
508924,22295,HEART FILIGREE DOVE LARGE,2,1.65,14035.0,United Kingdom,2025-11-06
508924,21774,DECORATIVE CATS BATHROOM BOTTLE,3,1.25,14035.0,United Kingdom,2025-11-06
508924,21034,REX CASH+CARRY JUMBO SHOPPER,3,0.95,14035.0,United Kingdom,2025-11-06
508924,20831,GOLD PHOTO FRAME,6,2.1,14035.0,United Kingdom,2025-11-06
508924,82482,WOODEN PICTURE FRAME WHITE FINISH,6,2.55,14035.0,United Kingdom,2025-11-06
508924,82483,WOOD 2 DRAWER CABINET WHITE FINISH,2,5.95,14035.0,United Kingdom,2025-11-06
508924,82483,WOOD 2 DRAWER CABINET WHITE FINISH,4,5.95,14035.0,United Kingdom,2025-11-06
508924,82486,WOOD S/3 CABINET ANT WHITE FINISH,2,7.95,14035.0,United Kingdom,2025-11-06
508924,20829,GLITTER HANGING BUTTERFLY STRING,1,2.1,14035.0,United Kingdom,2025-11-06
508924,82494L,WOODEN FRAME ANTIQUE WHITE ,6,2.95,14035.0,United Kingdom,2025-11-06
508924,22094,RED POLKA DOT TISSUE BOX,1,1.25,14035.0,United Kingdom,2025-11-06
508924,20831,GOLD PHOTO FRAME,6,2.1,14035.0,United Kingdom,2025-11-06
508924,82486,WOOD S/3 CABINET ANT WHITE FINISH,2,7.95,14035.0,United Kingdom,2025-11-06
508924,82486,WOOD S/3 CABINET ANT WHITE FINISH,2,7.95,14035.0,United Kingdom,2025-11-06
508924,84879,ASSORTED COLOUR BIRD ORNAMENT,16,1.69,14035.0,United Kingdom,2025-11-06
508925,85123A,WHITE HANGING HEART T-LIGHT HOLDER,32,2.55,17413.0,United Kingdom,2025-11-06
508925,71459,HANGING JAM JAR T-LIGHT HOLDER,192,0.72,17413.0,United Kingdom,2025-11-06
C508926,79342B,BROWN FLOWER LIGHTS,-1,6.75,16167.0,United Kingdom,2025-11-06
C508926,79323GR,GREEN CHERRY LIGHTS,-4,6.75,16167.0,United Kingdom,2025-11-06
C508926,79323P,PINK CHERRY LIGHTS,-4,6.75,16167.0,United Kingdom,2025-11-06
C508926,79323LP,LIGHT PINK CHERRY LIGHTS,-5,6.75,16167.0,United Kingdom,2025-11-06
C508926,79323W,WHITE CHERRY LIGHTS,-13,6.75,16167.0,United Kingdom,2025-11-06
C508926,79323B,BLACK CHERRY LIGHTS,-1,6.75,16167.0,United Kingdom,2025-11-06
C508926,79323G,GOLD  CHERRY LIGHTS,-2,6.75,16167.0,United Kingdom,2025-11-06
C508926,79323S,SILVER CHERRY LIGHTS,-5,6.75,16167.0,United Kingdom,2025-11-06
C508927,22423,REGENCY CAKESTAND 3 TIER,-1,10.95,12471.0,Germany,2025-11-06
C508928,21627,ELEPHANT CARNIVAL POUFFE,-5,12.75,13164.0,United Kingdom,2025-11-06
C508928,POST,POSTAGE,-1,10.99,13164.0,United Kingdom,2025-11-06
C508935,21232,STRAWBERRY CERAMIC TRINKET BOX,-5,1.25,12494.0,France,2025-11-06
C508935,22363,GLASS JAR MARMALADE ,-3,2.95,12494.0,France,2025-11-06
508950,21867,PINK UNION JACK  LUGGAGE TAG,36,1.25,17382.0,United Kingdom,2025-11-06
508950,21865,PINK UNION JACK  PASSPORT COVER ,36,2.1,17382.0,United Kingdom,2025-11-06
508953,21680,WOODLAND  STICKERS,48,0.85,17382.0,United Kingdom,2025-11-06
508953,20977,36 PENCILS TUBE WOODLAND,48,1.25,17382.0,United Kingdom,2025-11-06
508958,48138,DOOR MAT UNION FLAG,50,6.35,12823.0,United Kingdom,2025-11-06
508962,22497,SET OF 2 TINS VINTAGE BATHROOM ,4,4.25,15636.0,United Kingdom,2025-11-06
508964,21243,PINK  SPOTTY PLATE ,40,1.69,15738.0,United Kingdom,2025-11-06
508964,20677,PINK SPOTTY BOWL,32,1.25,15738.0,United Kingdom,2025-11-06
508964,21239,PINK  SPOTTY CUP,32,0.85,15738.0,United Kingdom,2025-11-06
508964,21244,BLUE  SPOTTY PLATE ,8,1.69,15738.0,United Kingdom,2025-11-06
508964,20675,BLUE SPOTTY BOWL,16,1.25,15738.0,United Kingdom,2025-11-06
508964,21240,BLUE  SPOTTY CUP,16,0.85,15738.0,United Kingdom,2025-11-06
508964,20725,LUNCH BAG RED SPOTTY,10,1.65,15738.0,United Kingdom,2025-11-06
508964,21121,SET/10 RED SPOTTY PARTY CANDLES,24,1.25,15738.0,United Kingdom,2025-11-06
508964,22333,RETRO SPORT PARTY BAG + STICKER SET,16,1.65,15738.0,United Kingdom,2025-11-06
508964,21094,SET/6 RED SPOTTY PAPER PLATES,24,0.85,15738.0,United Kingdom,2025-11-06
508964,21080,SET/20 RED SPOTTY PAPER NAPKINS ,12,0.85,15738.0,United Kingdom,2025-11-06
508964,21086,SET/6 RED SPOTTY PAPER CUPS,24,0.65,15738.0,United Kingdom,2025-11-06
508964,21242,RED SPOTTY PLATE ,8,1.69,15738.0,United Kingdom,2025-11-06
508964,84375,SET OF 20 KIDS COOKIE CUTTERS,12,1.95,15738.0,United Kingdom,2025-11-06
508962,22494,EMERGENCY FIRST AID TIN ,12,1.25,15636.0,United Kingdom,2025-11-06
508964,20974,12 PENCILS SMALL TUBE SKULL,72,0.65,15738.0,United Kingdom,2025-11-06
508962,82483,WOOD 2 DRAWER CABINET WHITE FINISH,4,5.95,15636.0,United Kingdom,2025-11-06
508962,82494L,WOODEN FRAME ANTIQUE WHITE ,18,2.95,15636.0,United Kingdom,2025-11-06
508962,21259,VICTORIAN SEWING BOX SMALL ,2,5.95,15636.0,United Kingdom,2025-11-06
508962,84050,PINK HEART SHAPE EGG FRYING PAN,6,1.65,15636.0,United Kingdom,2025-11-06
508962,48187,DOOR MAT NEW ENGLAND,2,7.49,15636.0,United Kingdom,2025-11-06
508962,85068,CREAM SWEETHEART SHELF + HOOKS,2,7.95,15636.0,United Kingdom,2025-11-06
508962,84849D,HOT BATHS SOAP HOLDER,12,1.69,15636.0,United Kingdom,2025-11-06
508962,84849B,FAIRY SOAP SOAP HOLDER,12,1.69,15636.0,United Kingdom,2025-11-06
508962,22487,WHITE WOOD GARDEN PLANT LADDER,1,9.95,15636.0,United Kingdom,2025-11-06
508962,21175,GIN + TONIC DIET METAL SIGN,12,2.1,15636.0,United Kingdom,2025-11-06
508962,85150,LADIES & GENTLEMEN METAL SIGN,12,2.55,15636.0,United Kingdom,2025-11-06
508962,85123A,WHITE HANGING HEART T-LIGHT HOLDER,18,2.95,15636.0,United Kingdom,2025-11-06
508962,84946,ANTIQUE SILVER TEA GLASS ETCHED,12,1.25,15636.0,United Kingdom,2025-11-06
508962,22470,HEART OF WICKER LARGE,6,2.95,15636.0,United Kingdom,2025-11-06
508962,82486,WOOD S/3 CABINET ANT WHITE FINISH,2,7.95,15636.0,United Kingdom,2025-11-06
508962,82484,WOOD BLACK BOARD ANT WHITE FINISH,3,6.45,15636.0,United Kingdom,2025-11-06
508972,21214,SET OF 72 IVORY PAPER DOILIES,6,1.45,15727.0,United Kingdom,2025-11-06
508972,21175,GIN + TONIC DIET METAL SIGN,2,2.1,15727.0,United Kingdom,2025-11-06
508972,22204,MILK PAN BLUE RETROSPOT,1,3.75,15727.0,United Kingdom,2025-11-06
508972,22203,MILK PAN RED RETROSPOT,1,3.75,15727.0,United Kingdom,2025-11-06
508972,22352,LUNCH BOX WITH CUTLERY RETROSPOT ,4,2.55,15727.0,United Kingdom,2025-11-06
508972,21559,STRAWBERRY LUNCH BOX WITH CUTLERY,4,2.55,15727.0,United Kingdom,2025-11-06
508972,20914,SET/5 RED SPOTTY LID GLASS BOWLS,3,2.95,15727.0,United Kingdom,2025-11-06
508972,47590A,BLUE HAPPY BIRTHDAY BUNTING,2,5.45,15727.0,United Kingdom,2025-11-06
508972,20728,LUNCH BAG CARS BLUE,10,1.65,15727.0,United Kingdom,2025-11-06
508972,47566,PARTY BUNTING,2,4.65,15727.0,United Kingdom,2025-11-06
508972,84077,WORLD WAR 2 GLIDERS ASSTD DESIGNS,48,0.21,15727.0,United Kingdom,2025-11-06
508972,22383,LUNCH BAG SUKI  DESIGN ,10,1.65,15727.0,United Kingdom,2025-11-06
508972,85199L,LARGE HANGING IVORY & RED WOOD BIRD,48,0.65,15727.0,United Kingdom,2025-11-06
508972,84836,ZINC METAL HEART DECORATION,12,1.25,15727.0,United Kingdom,2025-11-06
508972,79026B,"S/4 ICON COASTER,ELVIS LIVES",2,1.25,15727.0,United Kingdom,2025-11-06
508972,22439,6 ROCKET BALLOONS ,10,0.65,15727.0,United Kingdom,2025-11-06
508972,22505,MEMO BOARD COTTAGE DESIGN,4,4.95,15727.0,United Kingdom,2025-11-06
508972,22507,MEMO BOARD RETROSPOT  DESIGN,4,4.95,15727.0,United Kingdom,2025-11-06
508972,47590B,PINK HAPPY BIRTHDAY BUNTING,2,5.45,15727.0,United Kingdom,2025-11-06
508972,47591C,BLUE FAIRY CAKE CHILD'S APRON,1,1.95,15727.0,United Kingdom,2025-11-06
508972,22645,CERAMIC HEART FAIRY CAKE MONEY BANK,4,1.45,15727.0,United Kingdom,2025-11-06
508972,22367,CHILDS APRON SPACEBOY DESIGN,2,1.95,15727.0,United Kingdom,2025-11-06
508972,22331,WOODLAND PARTY BAG + STICKER SET,6,1.65,15727.0,United Kingdom,2025-11-06
508972,48194,DOOR MAT HEARTS,1,7.49,15727.0,United Kingdom,2025-11-06
508972,48189,DOOR MAT FRIENDSHIP ,1,7.49,15727.0,United Kingdom,2025-11-06
508972,48138,DOOR MAT UNION FLAG,2,7.49,15727.0,United Kingdom,2025-11-06
508972,48187,DOOR MAT NEW ENGLAND,2,7.49,15727.0,United Kingdom,2025-11-06
508972,48116,DOOR MAT MULTICOLOUR STRIPE,1,7.49,15727.0,United Kingdom,2025-11-06
508972,22047,EMPIRE GIFT WRAP,25,0.42,15727.0,United Kingdom,2025-11-06
508972,21878,PACK OF 6 SANDCASTLE FLAGS ASSORTED,4,0.85,15727.0,United Kingdom,2025-11-06
508972,22498,WOODEN REGATTA BUNTING,3,5.95,15727.0,United Kingdom,2025-11-06
508972,22558,CLOTHES PEGS RETROSPOT PACK 24 ,13,1.25,15727.0,United Kingdom,2025-11-06
508972,22567,20 DOLLY PEGS RETROSPOT,4,1.25,15727.0,United Kingdom,2025-11-06
508972,22560,TRADITIONAL MODELLING CLAY,6,1.25,15727.0,United Kingdom,2025-11-06
508972,21231,SWEETHEART CERAMIC TRINKET BOX,3,1.25,15727.0,United Kingdom,2025-11-06
508972,21232,STRAWBERRY CERAMIC TRINKET BOX,3,1.25,15727.0,United Kingdom,2025-11-06
508972,22127,PARTY CONES CARNIVAL ASSORTED,6,1.25,15727.0,United Kingdom,2025-11-06
508972,84986B,SET OF 36 SILVER PAPER DOILIES,8,1.45,15727.0,United Kingdom,2025-11-06
508972,22416,36 DOILIES SPACEBOY DESIGN ,5,1.45,15727.0,United Kingdom,2025-11-06
508972,47591B,SCOTTIES DES CHILD'S APRON,2,1.65,15727.0,United Kingdom,2025-11-06
508972,47591A,CAROUSEL DES CHILD'S APRON,2,1.65,15727.0,United Kingdom,2025-11-06
508972,47591D,PINK FAIRY CAKE CHILD'S APRON,1,1.95,15727.0,United Kingdom,2025-11-06
508972,22128,PARTY CONES CANDY ASSORTED,6,1.25,15727.0,United Kingdom,2025-11-06
508972,21165,BEWARE OF THE CAT METAL SIGN ,2,1.69,15727.0,United Kingdom,2025-11-06
508972,20686,DOLLY MIXTURE CHILDREN'S UMBRELLA,2,3.25,15727.0,United Kingdom,2025-11-06
508972,15058B,PINK WHITE SPOTS GARDEN PARASOL,10,3.95,15727.0,United Kingdom,2025-11-06
508972,15058A,BLUE WHITE SPOTS GARDEN PARASOL,10,3.95,15727.0,United Kingdom,2025-11-06
508972,22405,MONEY BOX POCKET MONEY DESIGN,6,1.25,15727.0,United Kingdom,2025-11-06
508972,21975,PACK OF 60 DINOSAUR CAKE CASES,4,0.55,15727.0,United Kingdom,2025-11-06
508972,84989A,75 GREEN FAIRY CAKE CASES,4,0.55,15727.0,United Kingdom,2025-11-06
508972,84989B,75 BLACK FAIRY CAKE CASES,4,0.55,15727.0,United Kingdom,2025-11-06
508972,21212,PACK OF 72 RETRO SPOT CAKE CASES,12,0.55,15727.0,United Kingdom,2025-11-06
508972,22198,LARGE POPCORN HOLDER ,6,1.65,15727.0,United Kingdom,2025-11-06
508972,22528,GARDENERS KNEELING PAD,4,1.25,15727.0,United Kingdom,2025-11-06
508972,84991,60 TEATIME FAIRY CAKE CASES,6,0.55,15727.0,United Kingdom,2025-11-06
508972,21213,PACK OF 72 SKULL CAKE CASES,6,0.55,15727.0,United Kingdom,2025-11-06
508972,21975,PACK OF 60 DINOSAUR CAKE CASES,2,0.55,15727.0,United Kingdom,2025-11-06
508972,21976,PACK OF 60 MUSHROOM CAKE CASES,5,0.55,15727.0,United Kingdom,2025-11-06
508972,84989A,75 GREEN FAIRY CAKE CASES,1,0.55,15727.0,United Kingdom,2025-11-06
508972,21977,PACK OF 60 PINK PAISLEY CAKE CASES,10,0.55,15727.0,United Kingdom,2025-11-06
508972,22197,SMALL POPCORN HOLDER,5,0.85,15727.0,United Kingdom,2025-11-06
508972,22197,SMALL POPCORN HOLDER,15,0.85,15727.0,United Kingdom,2025-11-06
508972,44091A,BLUE CRUSOE CHECK LAMPSHADE,6,0.42,15727.0,United Kingdom,2025-11-06
508972,22417,PACK OF 60 SPACEBOY CAKE CASES,12,0.55,15727.0,United Kingdom,2025-11-06
508972,21211,SET OF 72 SKULL PAPER  DOILIES,2,1.45,15727.0,United Kingdom,2025-11-06
508972,84992,72 SWEETHEART FAIRY CAKE CASES,6,0.55,15727.0,United Kingdom,2025-11-06
508972,84986B,SET OF 36 SILVER PAPER DOILIES,9,1.45,15727.0,United Kingdom,2025-11-06
