Invoice,StockCode,Description,Quantity,Price,Customer ID,Country,InvoiceDate
498716,21181,PLEASE ONE PERSON METAL SIGN,6,2.1,15754.0,United Kingdom,2025-08-28
498716,21769,VINTAGE POST OFFICE CABINET,1,79.95,15754.0,United Kingdom,2025-08-28
498716,22083,PAPER CHAIN KIT RETRO SPOT,6,2.95,15754.0,United Kingdom,2025-08-28
498716,21174,POTTERING IN THE SHED METAL SIGN,12,1.95,15754.0,United Kingdom,2025-08-28
498717,85049D,BRIGHT BLUES RIBBONS ,2,1.25,17259.0,United Kingdom,2025-08-28
498717,22303,COFFEE MUG APPLES DESIGN,6,2.55,17259.0,United Kingdom,2025-08-28
498717,22302,COFFEE MUG PEARS  DESIGN,6,2.55,17259.0,United Kingdom,2025-08-28
498717,21506,"FANCY FONT BIRTHDAY CARD, ",12,0.42,17259.0,United Kingdom,2025-08-28
498717,22029,SPACEBOY BIRTHDAY CARD,12,0.42,17259.0,United Kingdom,2025-08-28
498717,47566,PARTY BUNTING,3,4.65,17259.0,United Kingdom,2025-08-28
498717,22374,AIRLINE BAG VINTAGE JET SET RED,1,6.35,17259.0,United Kingdom,2025-08-28
498717,21034,REX CASH+CARRY JUMBO SHOPPER,2,0.95,17259.0,United Kingdom,2025-08-28
498717,85049B,LUSH GREENS RIBBONS,2,1.25,17259.0,United Kingdom,2025-08-28
498717,22500,SET OF 2 TINS JARDIN DE PROVENCE,2,4.95,17259.0,United Kingdom,2025-08-28
498717,79323LP,LIGHT PINK CHERRY LIGHTS,2,6.75,17259.0,United Kingdom,2025-08-28
498717,48189,DOOR MAT FRIENDSHIP ,1,7.49,17259.0,United Kingdom,2025-08-28
498717,21592,RETRO SPOT  CIGAR BOX MATCHES ,1,1.25,17259.0,United Kingdom,2025-08-28
498717,71459,HANGING JAM JAR T-LIGHT HOLDER,12,0.85,17259.0,United Kingdom,2025-08-28
498717,79323P,PINK CHERRY LIGHTS,2,6.75,17259.0,United Kingdom,2025-08-28
498717,79323W, WHITE CHERRY LIGHTS,2,6.75,17259.0,United Kingdom,2025-08-28
498717,22328,ROUND SNACK BOXES SET OF 4 FRUITS ,1,2.95,17259.0,United Kingdom,2025-08-28
498717,21082,SET/20 FRUIT SALAD PAPER NAPKINS ,2,0.85,17259.0,United Kingdom,2025-08-28
498717,22495,SET OF 2 ROUND TINS CAMEMBERT ,2,2.95,17259.0,United Kingdom,2025-08-28
498717,22496,SET OF 2 ROUND TINS DUTCH CHEESE,2,2.95,17259.0,United Kingdom,2025-08-28
498717,21320,GLASS CHALICE GREEN  LARGE ,6,2.55,17259.0,United Kingdom,2025-08-28
498717,21321,GLASS CHALICE BLUE  LARGE ,6,2.55,17259.0,United Kingdom,2025-08-28
498717,84081,WHITE CERAMIC PARTY SET (5PCS),2,4.25,17259.0,United Kingdom,2025-08-28
498717,48138,DOOR MAT UNION FLAG,2,7.49,17259.0,United Kingdom,2025-08-28
498717,22315,200 RED + WHITE BENDY STRAWS,1,1.25,17259.0,United Kingdom,2025-08-28
498717,20803,SMALL PINK GLASS SUNDAE DISH,6,1.65,17259.0,United Kingdom,2025-08-28
498717,21827,EIGHT PIECE CREEPY CRAWLIE SET,4,1.25,17259.0,United Kingdom,2025-08-28
498717,10134,COLOURING PENCILS BROWN TUBE,1,1.25,17259.0,United Kingdom,2025-08-28
498717,20982,12 PENCILS TALL TUBE SKULLS,1,0.85,17259.0,United Kingdom,2025-08-28
498717,20981,12 PENCILS TALL TUBE WOODLAND,1,0.85,17259.0,United Kingdom,2025-08-28
498717,22208,WOOD STAMP SET THANK YOU,1,1.65,17259.0,United Kingdom,2025-08-28
498717,20749,ASSORTED COLOUR MINI CASES,1,7.95,17259.0,United Kingdom,2025-08-28
498717,21091,SET/6 WOODLAND PAPER PLATES,3,0.85,17259.0,United Kingdom,2025-08-28
498717,22331,WOODLAND PARTY BAG + STICKER SET,2,1.65,17259.0,United Kingdom,2025-08-28
498717,21675,BUTTERFLIES STICKERS,6,0.85,17259.0,United Kingdom,2025-08-28
498717,21060,PARTY INVITES BALLOON GIRL,2,0.85,17259.0,United Kingdom,2025-08-28
498717,21916,SET 12 RETRO WHITE CHALK STICKS,1,0.42,17259.0,United Kingdom,2025-08-28
498717,20971,PINK BLUE FELT CRAFT TRINKET BOX,10,1.25,17259.0,United Kingdom,2025-08-28
498717,20726,LUNCH BAG WOODLAND,1,1.65,17259.0,United Kingdom,2025-08-28
498717,21559,STRAWBERRY LUNCHBOX WITH CUTLERY,1,2.55,17259.0,United Kingdom,2025-08-28
498717,21679,SKULLS  STICKERS,6,0.85,17259.0,United Kingdom,2025-08-28
498717,21085,SET/6 WOODLAND PAPER CUPS,3,0.65,17259.0,United Kingdom,2025-08-28
498717,10134,COLOURING PENCILS BROWN TUBE,1,1.25,17259.0,United Kingdom,2025-08-28
498717,22118,JOY WOODEN BLOCK LETTERS,1,4.95,17259.0,United Kingdom,2025-08-28
498717,21755,LOVE BUILDING BLOCK WORD,3,5.95,17259.0,United Kingdom,2025-08-28
498717,21754,HOME BUILDING BLOCK WORD,1,5.95,17259.0,United Kingdom,2025-08-28
498717,22382,LUNCH BAG SPACEBOY DESIGN ,2,1.65,17259.0,United Kingdom,2025-08-28
498717,22384,LUNCH BAG PINK RETROSPOT,2,1.65,17259.0,United Kingdom,2025-08-28
498718,85199L,LARGE HANGING IVORY & RED WOOD BIRD,24,0.65,17675.0,United Kingdom,2025-08-28
498718,84967B,BLUE KASHMIRI OCCASIONAL TABLE,2,79.95,17675.0,United Kingdom,2025-08-28
498718,85199S,SMALL HANGING IVORY/RED WOOD BIRD,24,0.42,17675.0,United Kingdom,2025-08-28
498718,85174,S/4 CACTI CANDLES,16,4.25,17675.0,United Kingdom,2025-08-28
498718,84962,SET/3 COLOUR PAINTED KASHMIRI STOOL,2,59.95,17675.0,United Kingdom,2025-08-28
498719,21673,WHITE SPOT BLUE CERAMIC DRAWER KNOB,36,1.25,13854.0,United Kingdom,2025-08-28
498719,20749,ASSORTED COLOUR MINI CASES,12,6.35,13854.0,United Kingdom,2025-08-28
498719,21363,HOME SMALL WOOD LETTERS,12,4.95,13854.0,United Kingdom,2025-08-28
498719,21754,HOME BUILDING BLOCK WORD,18,5.45,13854.0,United Kingdom,2025-08-28
498720,21974,SET OF 36 PAISLEY FLOWER DOILIES,12,1.45,15673.0,United Kingdom,2025-08-28
498720,21210,SET OF 72 RETRO SPOT PAPER  DOILIES,12,1.45,15673.0,United Kingdom,2025-08-28
498720,22382,LUNCH BAG SPACEBOY DESIGN ,10,1.65,15673.0,United Kingdom,2025-08-28
498720,22383,LUNCH BAG SUKI  DESIGN ,10,1.65,15673.0,United Kingdom,2025-08-28
498720,22367,CHILDS APRON SPACEBOY DESIGN,8,1.95,15673.0,United Kingdom,2025-08-28
498720,20914,SET/5 RED SPOTTY LID GLASS BOWLS,12,2.95,15673.0,United Kingdom,2025-08-28
498720,21843,RETRO SPOT CAKE STAND,10,10.95,15673.0,United Kingdom,2025-08-28
498720,21621,VINTAGE UNION JACK BUNTING,10,8.5,15673.0,United Kingdom,2025-08-28
498720,22195,LARGE HEART MEASURING SPOONS,12,1.65,15673.0,United Kingdom,2025-08-28
498720,22385,JUMBO BAG SPACEBOY DESIGN,10,1.95,15673.0,United Kingdom,2025-08-28
498720,71459,HANGING JAM JAR T-LIGHT HOLDER,36,0.85,15673.0,United Kingdom,2025-08-28
498720,22327,ROUND SNACK BOXES SET OF 4 SKULLS,18,2.95,15673.0,United Kingdom,2025-08-28
498720,22272,FELTCRAFT DOLL MARIA,12,2.95,15673.0,United Kingdom,2025-08-28
498720,22138,BAKING SET 9 PIECE RETROSPOT ,6,4.95,15673.0,United Kingdom,2025-08-28
498720,22328,ROUND SNACK BOXES SET OF 4 FRUITS ,18,2.95,15673.0,United Kingdom,2025-08-28
498720,21917,SET 12 KIDS  WHITE CHALK STICKS,24,0.42,15673.0,United Kingdom,2025-08-28
498720,21918,SET 12 KIDS COLOUR  CHALK STICKS,24,0.42,15673.0,United Kingdom,2025-08-28
498720,22417,PACK OF 60 SPACEBOY CAKE CASES,24,0.55,15673.0,United Kingdom,2025-08-28
498720,21754,HOME BUILDING BLOCK WORD,6,5.95,15673.0,United Kingdom,2025-08-28
498720,21756,BATH BUILDING BLOCK WORD,6,5.95,15673.0,United Kingdom,2025-08-28
498720,22147,FELTCRAFT BUTTERFLY HEARTS,12,1.45,15673.0,United Kingdom,2025-08-28
498720,22149,FELTCRAFT 6 FLOWER FRIENDS,12,2.1,15673.0,United Kingdom,2025-08-28
498720,21755,LOVE BUILDING BLOCK WORD,6,5.95,15673.0,United Kingdom,2025-08-28
498721,22432,WATERING CAN PINK BUNNY,12,1.95,13178.0,United Kingdom,2025-08-28
498721,22433,WATERING CAN GREEN DINOSAUR,12,1.95,13178.0,United Kingdom,2025-08-28
498721,21559,STRAWBERRY LUNCHBOX WITH CUTLERY,6,2.55,13178.0,United Kingdom,2025-08-28
498721,22353,LUNCHBOX WITH CUTLERY FAIRY CAKES ,6,2.55,13178.0,United Kingdom,2025-08-28
498721,22090,PAPER BUNTING RETRO SPOTS,6,2.95,13178.0,United Kingdom,2025-08-28
498721,21116,OWL DOORSTOP,3,4.95,13178.0,United Kingdom,2025-08-28
498721,20727,LUNCH BAG  BLACK SKULL.,10,1.65,13178.0,United Kingdom,2025-08-28
498721,22326,ROUND SNACK BOXES SET OF4 WOODLAND ,12,2.95,13178.0,United Kingdom,2025-08-28
498721,22328,ROUND SNACK BOXES SET OF 4 FRUITS ,18,2.95,13178.0,United Kingdom,2025-08-28
498721,22367,CHILDS APRON SPACEBOY DESIGN,8,1.95,13178.0,United Kingdom,2025-08-28
498721,20726,LUNCH BAG WOODLAND,10,1.65,13178.0,United Kingdom,2025-08-28
498721,21930,JUMBO STORAGE BAG SKULLS,10,1.95,13178.0,United Kingdom,2025-08-28
498721,22089,PAPER BUNTING VINTAGE PAISLEY,6,2.95,13178.0,United Kingdom,2025-08-28
498721,21561,DINOSAUR LUNCHBOX WITH CUTLERY,6,2.55,13178.0,United Kingdom,2025-08-28
498721,47591B,SCOTTIES DES CHILD'S APRON,8,1.65,13178.0,United Kingdom,2025-08-28
498721,47591D,PINK FAIRY CAKE CHILD'S APRON,8,1.95,13178.0,United Kingdom,2025-08-28
498721,47505,MINATURE COLOURED GARDENING SET,3,4.95,13178.0,United Kingdom,2025-08-28
498721,22431,WATERING CAN BLUE ELEPHANT,12,1.95,13178.0,United Kingdom,2025-08-28
498721,20728,LUNCH BAG CARS BLUE,20,1.65,13178.0,United Kingdom,2025-08-28
498721,21431,GREEN GINGHAM FLOWER JEWELLERY BOX,8,1.65,13178.0,United Kingdom,2025-08-28
498721,20717,STRAWBERRY SHOPPER BAG,10,1.25,13178.0,United Kingdom,2025-08-28
498721,22319,HAIRCLIPS FORTIES FABRIC ASSORTED,12,0.65,13178.0,United Kingdom,2025-08-28
498721,21429,RED GINGHAM ROSE JEWELLERY BOX,8,1.65,13178.0,United Kingdom,2025-08-28
498721,22379,RECYCLING BAG RETROSPOT ,5,2.1,13178.0,United Kingdom,2025-08-28
498721,22380,TOY TIDY SPACEBOY  ,5,2.1,13178.0,United Kingdom,2025-08-28
498721,22381,TOY TIDY PINK RETROSPOT  ,5,2.1,13178.0,United Kingdom,2025-08-28
498721,22382,LUNCH BAG SPACEBOY DESIGN ,10,1.65,13178.0,United Kingdom,2025-08-28
498721,22383,LUNCH BAG SUKI  DESIGN ,10,1.65,13178.0,United Kingdom,2025-08-28
498721,22384,LUNCH BAG PINK RETROSPOT,10,1.65,13178.0,United Kingdom,2025-08-28
498721,22386,JUMBO BAG PINK WITH WHITE SPOTS,10,1.95,13178.0,United Kingdom,2025-08-28
498721,22355,"CHARLOTTE BAG , SUKI DESIGN",10,0.85,13178.0,United Kingdom,2025-08-28
498721,22411,JUMBO SHOPPER VINTAGE RED PAISLEY,10,1.95,13178.0,United Kingdom,2025-08-28
498721,22356,"CHARLOTTE BAG , PINK/WHITE SPOTS",10,0.85,13178.0,United Kingdom,2025-08-28
498721,20719,WOODLAND CHARLOTTE BAG,10,0.85,13178.0,United Kingdom,2025-08-28
498721,20724,RED SPOTTY CHARLOTTE BAG,10,0.85,13178.0,United Kingdom,2025-08-28
498721,21934,SKULL SHOULDER BAG,10,1.65,13178.0,United Kingdom,2025-08-28
498721,21935,SUKI  SHOULDER BAG,10,1.65,13178.0,United Kingdom,2025-08-28
498721,85099B,JUMBO BAG RED WHITE SPOTTY ,10,1.95,13178.0,United Kingdom,2025-08-28
498721,20718,RED SPOTTY SHOPPER BAG,10,1.25,13178.0,United Kingdom,2025-08-28
498721,22385,JUMBO BAG SPACEBOY DESIGN,10,1.95,13178.0,United Kingdom,2025-08-28
498722,16161U,"WRAP,SUKI AND FRIENDS",25,0.42,16071.0,United Kingdom,2025-08-28
498722,21080,SET/20 RED SPOTTY PAPER NAPKINS ,12,0.85,16071.0,United Kingdom,2025-08-28
498722,22138,BAKING SET 9 PIECE RETROSPOT ,3,4.95,16071.0,United Kingdom,2025-08-28
498722,16161P,WRAP ENGLISH ROSE ,25,0.42,16071.0,United Kingdom,2025-08-28
498722,85123A,WHITE HANGING HEART T-LIGHT HOLDER,6,2.95,16071.0,United Kingdom,2025-08-28
498722,21174,POTTERING IN THE SHED METAL SIGN,12,1.95,16071.0,United Kingdom,2025-08-28
498722,21864,UNION JACK FLAG PASSPORT COVER ,6,2.1,16071.0,United Kingdom,2025-08-28
498722,20975,12 PENCILS SMALL TUBE RED SPOTTY,24,0.65,16071.0,United Kingdom,2025-08-28
498722,22377,BOTTLE BAG RETROSPOT ,5,2.1,16071.0,United Kingdom,2025-08-28
498722,85099F,JUMBO BAG STRAWBERRY,10,1.95,16071.0,United Kingdom,2025-08-28
498722,85099B,JUMBO BAG RED WHITE SPOTTY ,10,1.95,16071.0,United Kingdom,2025-08-28
498722,21232,STRAWBERRY CERAMIC TRINKET BOX,12,1.25,16071.0,United Kingdom,2025-08-28
498722,21100,CHARLIE AND LOLA CHARLOTTE BAG,10,1.65,16071.0,United Kingdom,2025-08-28
498722,21499,BLUE SPOTS  WRAP,25,0.42,16071.0,United Kingdom,2025-08-28
498722,20724,RED SPOTTY CHARLOTTE BAG,10,0.85,16071.0,United Kingdom,2025-08-28
498722,21936,RED/WHITE SPOT PICNIC BAG,5,2.95,16071.0,United Kingdom,2025-08-28
498722,22383,LUNCH BAG SUKI  DESIGN ,10,1.65,16071.0,United Kingdom,2025-08-28
498722,84519A,TOMATO CHARLIE+LOLA COASTER SET,6,2.95,16071.0,United Kingdom,2025-08-28
498723,84964B,BLUE PAINTED KASHMIRI TABLE ,16,60.0,13340.0,United Kingdom,2025-08-28
498723,84964A,PINK PAINTED KASHMIRI TABLE,10,60.0,13340.0,United Kingdom,2025-08-28
498723,84965B,BLUE KASHMIRI COFFEE TABLE ,15,60.0,13340.0,United Kingdom,2025-08-28
498723,84965A,PINK KASHMIRI COFFEE TABLE ,15,60.0,13340.0,United Kingdom,2025-08-28
498724,48187,DOOR MAT NEW ENGLAND,20,6.35,13340.0,United Kingdom,2025-08-28
498724,22355,"CHARLOTTE BAG , SUKI DESIGN",30,0.85,13340.0,United Kingdom,2025-08-28
498724,20724,RED SPOTTY CHARLOTTE BAG,30,0.85,13340.0,United Kingdom,2025-08-28
498724,20728,LUNCH BAG CARS BLUE,20,1.65,13340.0,United Kingdom,2025-08-28
498724,22382,LUNCH BAG SPACEBOY DESIGN ,20,1.65,13340.0,United Kingdom,2025-08-28
498724,84946,ANTIQUE SILVER TEA GLASS ETCHED,72,1.06,13340.0,United Kingdom,2025-08-28
498724,84949,SILVER HANGING T-LIGHT HOLDER,96,1.45,13340.0,United Kingdom,2025-08-28
498724,21664,RIDGED GLASS STORAGE JAR CREAM LID,24,3.39,13340.0,United Kingdom,2025-08-28
498724,85123A,WHITE HANGING HEART T-LIGHT HOLDER,32,2.55,13340.0,United Kingdom,2025-08-28
498724,21659,GLASS CAKE STAND,12,12.75,13340.0,United Kingdom,2025-08-28
498724,82494L,WOODEN FRAME ANTIQUE WHITE ,24,2.55,13340.0,United Kingdom,2025-08-28
498724,21214,SET OF 72 IVORY PAPER DOILIES,96,1.25,13340.0,United Kingdom,2025-08-28
498724,21210,SET OF 72 RETRO SPOT PAPER  DOILIES,96,1.25,13340.0,United Kingdom,2025-08-28
498724,48188,DOOR MAT WELCOME PUPPIES,20,6.35,13340.0,United Kingdom,2025-08-28
498724,84975,HEART SHAPED MIRROR,18,1.69,13340.0,United Kingdom,2025-08-28
498724,21212,PACK OF 72 RETRO SPOT CAKE CASES,120,0.42,13340.0,United Kingdom,2025-08-28
498724,20685,DOOR MAT RED SPOT,30,6.35,13340.0,United Kingdom,2025-08-28
498724,21592,RETRO SPOT  CIGAR BOX MATCHES ,144,1.06,13340.0,United Kingdom,2025-08-28
498724,21974,SET OF 36 PAISLEY FLOWER DOILIES,144,1.25,13340.0,United Kingdom,2025-08-28
498724,21215, IVORY PAPER CUP CAKE CASES ,120,0.42,13340.0,United Kingdom,2025-08-28
498724,21977,PACK OF 60 PINK PAISLEY CAKE CASES,120,0.42,13340.0,United Kingdom,2025-08-28
498724,21975,PACK OF 60 DINOSAUR CAKE CASES,120,0.42,13340.0,United Kingdom,2025-08-28
498724,47591B,SCOTTIES DES CHILD'S APRON,32,1.65,13340.0,United Kingdom,2025-08-28
498724,21156,RED SPOTTY CHILDS APRON,50,1.65,13340.0,United Kingdom,2025-08-28
498724,21122,SET/10 PINK SPOTTY PARTY CANDLES,48,1.25,13340.0,United Kingdom,2025-08-28
498724,48189,DOOR MAT FRIENDSHIP ,20,6.35,13340.0,United Kingdom,2025-08-28
498724,21121,SET/10 RED SPOTTY PARTY CANDLES,48,1.25,13340.0,United Kingdom,2025-08-28
498724,22138,BAKING SET 9 PIECE RETROSPOT ,24,4.25,13340.0,United Kingdom,2025-08-28
498724,85213,MINI  ZINC GARDEN DECORATIONS ,96,0.64,13340.0,United Kingdom,2025-08-28
498724,84970S,HANGING HEART ZINC T-LIGHT HOLDER,36,0.85,13340.0,United Kingdom,2025-08-28
498724,84978,HANGING HEART JAR T-LIGHT HOLDER,36,1.06,13340.0,United Kingdom,2025-08-28
498724,22185,SLATE TILE NATURAL HANGING,36,1.45,13340.0,United Kingdom,2025-08-28
498724,21124,SET/10 BLUE SPOTTY PARTY CANDLES,48,1.25,13340.0,United Kingdom,2025-08-28
498725,21181,PLEASE ONE PERSON METAL SIGN,12,2.1,14667.0,United Kingdom,2025-08-28
498725,85152,HAND OVER THE CHOCOLATE   SIGN ,12,2.1,14667.0,United Kingdom,2025-08-28
498725,22294,HEART FILIGREE DOVE  SMALL,24,1.25,14667.0,United Kingdom,2025-08-28
498725,85040A,S/4 PINK FLOWER CANDLES IN BOWL,12,1.65,14667.0,United Kingdom,2025-08-28
498725,85040B,SET/4 BLUE FLOWER CANDLES IN BOWL,12,1.65,14667.0,United Kingdom,2025-08-28
498725,79323W, WHITE CHERRY LIGHTS,4,6.75,14667.0,United Kingdom,2025-08-28
498725,48189,DOOR MAT FRIENDSHIP ,1,7.49,14667.0,United Kingdom,2025-08-28
498725,16156N,"WRAP, FRIENDSHIP ON GREEN",25,0.42,14667.0,United Kingdom,2025-08-28
498725,16161U,"WRAP,SUKI AND FRIENDS",25,0.42,14667.0,United Kingdom,2025-08-28
498725,20685,DOOR MAT RED SPOT,2,7.49,14667.0,United Kingdom,2025-08-28
498725,84909A,PINK PAISLEY QUILT ,1,45.95,14667.0,United Kingdom,2025-08-28
498725,84657,GREEN ROSE CUSHION COVER,2,5.95,14667.0,United Kingdom,2025-08-28
498725,21868,POTTING SHED TEA MUG,6,1.25,14667.0,United Kingdom,2025-08-28
498725,46000P,POLYESTER FILLER PAD 65CMx65CM,4,4.25,14667.0,United Kingdom,2025-08-28
498725,21535,RETRO SPOT SMALL MILK JUG,2,2.55,14667.0,United Kingdom,2025-08-28
498725,48138,DOOR MAT UNION FLAG,3,7.49,14667.0,United Kingdom,2025-08-28
498725,84762A,WHITE PICNIC BARBECUE BUCKET,2,10.75,14667.0,United Kingdom,2025-08-28
498725,84910A,PINK PAISLEY CUSHION COVER ,2,5.95,14667.0,United Kingdom,2025-08-28
498725,22494,EMERGENCY FIRST AID TIN ,7,1.25,14667.0,United Kingdom,2025-08-28
498725,22082,RIBBON REEL STRIPES DESIGN ,5,1.65,14667.0,United Kingdom,2025-08-28
498725,21533,RETRO SPOT LARGE MILK JUG,2,4.95,14667.0,United Kingdom,2025-08-28
498725,22079,RIBBON REEL HEARTS DESIGN ,5,1.65,14667.0,United Kingdom,2025-08-28
498725,84578,ELEPHANT TOY WITH BLUE T-SHIRT,3,3.75,14667.0,United Kingdom,2025-08-28
498725,20931,BLUE POT PLANT CANDLE ,2,3.75,14667.0,United Kingdom,2025-08-28
498725,20934,SET/3 POT PLANT CANDLES,2,5.45,14667.0,United Kingdom,2025-08-28
498725,72741,GRAND CHOCOLATECANDLE,9,1.45,14667.0,United Kingdom,2025-08-28
498725,21756,BATH BUILDING BLOCK WORD,2,5.95,14667.0,United Kingdom,2025-08-28
498725,84997D,PINK 3 PIECE MINI DOTS CUTLERY SET,2,3.75,14667.0,United Kingdom,2025-08-28
498725,84997C,BLUE 3 PIECE MINI DOTS CUTLERY SET,2,3.75,14667.0,United Kingdom,2025-08-28
498725,84997B,RED 3 PIECE MINI DOTS CUTLERY SET,2,3.75,14667.0,United Kingdom,2025-08-28
498725,20932,PINK POT PLANT CANDLE,2,3.75,14667.0,United Kingdom,2025-08-28
498726,20828,GLITTER BUTTERFLY CLIPS,6,2.55,13576.0,United Kingdom,2025-08-28
498726,85099B,JUMBO BAG RED WHITE SPOTTY ,10,1.95,13576.0,United Kingdom,2025-08-28
498726,22377,BOTTLE BAG RETROSPOT ,5,2.1,13576.0,United Kingdom,2025-08-28
498726,22041,"RECORD FRAME 7"" SINGLE SIZE ",48,2.1,13576.0,United Kingdom,2025-08-28
498726,21137,BLACK RECORD COVER FRAME,48,3.39,13576.0,United Kingdom,2025-08-28
498726,22379,RECYCLING BAG RETROSPOT ,5,2.1,13576.0,United Kingdom,2025-08-28
498729,21907,I'M ON HOLIDAY METAL SIGN,12,2.1,17829.0,United Arab Emirates,2025-08-28
498729,82600,NO SINGING METAL SIGN,12,2.1,17829.0,United Arab Emirates,2025-08-28
498729,85152,HAND OVER THE CHOCOLATE   SIGN ,24,2.1,17829.0,United Arab Emirates,2025-08-28
498728,22079,RIBBON REEL HEARTS DESIGN ,48,1.65,13408.0,United Kingdom,2025-08-28
498728,22080,RIBBON REEL SPOTS DESIGN ,48,1.65,13408.0,United Kingdom,2025-08-28
498728,20751,FUNKY WASHING UP GLOVES ASSORTED,72,1.69,13408.0,United Kingdom,2025-08-28
498728,84997C,BLUE 3 PIECE MINI DOTS CUTLERY SET,72,3.75,13408.0,United Kingdom,2025-08-28
498728,22147,FELTCRAFT BUTTERFLY HEARTS,40,1.25,13408.0,United Kingdom,2025-08-28
498728,21397,BLUE  SPOTTY EGG CUP ,48,1.25,13408.0,United Kingdom,2025-08-28
498728,21403,BLUE EGG  SPOON,48,0.42,13408.0,United Kingdom,2025-08-28
498728,21911,GARDEN METAL SIGN ,24,1.65,13408.0,United Kingdom,2025-08-28
498728,22275,WEEKEND BAG VINTAGE ROSE PAISLEY,4,8.5,13408.0,United Kingdom,2025-08-28
498728,21495,SKULLS WRAP,25,0.42,13408.0,United Kingdom,2025-08-28
498728,21992,VINTAGE PAISLEY STATIONERY SET,48,2.55,13408.0,United Kingdom,2025-08-28
498728,84997D,PINK 3 PIECE MINI DOTS CUTLERY SET,17,3.75,13408.0,United Kingdom,2025-08-28
498729,21181,PLEASE ONE PERSON METAL SIGN,6,2.1,17829.0,United Arab Emirates,2025-08-28
498729,37448,CERAMIC CAKE DESIGN SPOTTED MUG,12,1.49,17829.0,United Arab Emirates,2025-08-28
498729,22115,METAL SIGN EMPIRE TEA,12,2.95,17829.0,United Arab Emirates,2025-08-28
498729,22071,SMALL RETRO SPOT MUG IN BOX  WHITE,6,3.75,17829.0,United Arab Emirates,2025-08-28
498729,85215,ASSORTED CHEESE FRIDGE MAGNETS,36,0.65,17829.0,United Arab Emirates,2025-08-28
498729,21700,BIG DOUGHNUT FRIDGE MAGNETS,60,0.85,17829.0,United Arab Emirates,2025-08-28
498729,22495,SET OF 2 ROUND TINS CAMEMBERT ,6,2.95,17829.0,United Arab Emirates,2025-08-28
498729,22496,SET OF 2 ROUND TINS DUTCH CHEESE,6,2.95,17829.0,United Arab Emirates,2025-08-28
498729,22202,MILK PAN PINK RETROSPOT,4,3.75,17829.0,United Arab Emirates,2025-08-28
498729,21908,CHOCOLATE THIS WAY METAL SIGN,6,2.1,17829.0,United Arab Emirates,2025-08-28
498729,22200,FRYING PAN PINK POLKADOT ,4,4.25,17829.0,United Arab Emirates,2025-08-28
498729,21844,RETRO SPOT MUG,6,2.95,17829.0,United Arab Emirates,2025-08-28
498729,22070,SMALL RETRO SPOT MUG IN BOX  RED,6,3.75,17829.0,United Arab Emirates,2025-08-28
498730,84997D,,-170,0.0,,United Kingdom,2025-08-28
498729,21166,COOK WITH WINE METAL SIGN ,12,1.95,17829.0,United Arab Emirates,2025-08-28
498729,22117,METAL SIGN HER DINNER IS SERVED ,12,2.95,17829.0,United Arab Emirates,2025-08-28
498729,82567,"AIRLINE LOUNGE,METAL SIGN",12,2.1,17829.0,United Arab Emirates,2025-08-28
498729,21232,STRAWBERRY CERAMIC TRINKET BOX,24,1.25,17829.0,United Arab Emirates,2025-08-28
498729,21532,DAIRY MAID SUGAR JAM BOWL,6,2.1,17829.0,United Arab Emirates,2025-08-28
498729,21888,BINGO SET,4,3.75,17829.0,United Arab Emirates,2025-08-28
498729,21534,DAIRY MAID LARGE MILK JUG,6,4.95,17829.0,United Arab Emirates,2025-08-28
498727,46000P,,5,0.0,,United Kingdom,2025-08-28
498729,21770,OPEN CLOSED METAL SIGN,12,4.95,17829.0,United Arab Emirates,2025-08-28
498729,22413,METAL SIGN TAKE IT OR LEAVE IT ,12,2.95,17829.0,United Arab Emirates,2025-08-28
498729,21980,PACK OF 12 RED SPOTTY TISSUES ,48,0.29,17829.0,United Arab Emirates,2025-08-28
498729,22138,BAKING SET 9 PIECE RETROSPOT ,24,4.25,17829.0,United Arab Emirates,2025-08-28
498729,20972,PINK CREAM FELT CRAFT TRINKET BOX ,12,1.25,17829.0,United Arab Emirates,2025-08-28
498729,20971,PINK BLUE FELT CRAFT TRINKET BOX,12,1.25,17829.0,United Arab Emirates,2025-08-28
498729,22149,FELTCRAFT 6 FLOWER FRIENDS,12,2.1,17829.0,United Arab Emirates,2025-08-28
498729,22241,GARLAND WOODEN HAPPY EASTER,12,1.25,17829.0,United Arab Emirates,2025-08-28
498729,21380,WOODEN HAPPY BIRTHDAY GARLAND,6,2.95,17829.0,United Arab Emirates,2025-08-28
498729,21458,2 PICTURE BOOK EGGS EASTER BUNNY,12,1.25,17829.0,United Arab Emirates,2025-08-28
498729,21536,DAIRY MAID  SMALL  MILK JUG,6,2.1,17829.0,United Arab Emirates,2025-08-28
498729,21906,PHARMACIE FIRST AID TIN,6,6.75,17829.0,United Arab Emirates,2025-08-28
498729,21260,FIRST AID TIN,6,3.25,17829.0,United Arab Emirates,2025-08-28
498729,22494,EMERGENCY FIRST AID TIN ,12,1.25,17829.0,United Arab Emirates,2025-08-28
498729,21912,VINTAGE SNAKES & LADDERS,4,3.75,17829.0,United Arab Emirates,2025-08-28
498729,22195,LARGE HEART MEASURING SPOONS,12,1.65,17829.0,United Arab Emirates,2025-08-28
498729,21845,DAIRY MAID STRIPE MUG,12,2.95,17829.0,United Arab Emirates,2025-08-28
498729,22065,CHRISTMAS PUDDING TRINKET POT ,48,1.25,17829.0,United Arab Emirates,2025-08-28
498729,22337,ANGEL DECORATION PAINTED ZINC ,24,0.65,17829.0,United Arab Emirates,2025-08-28
498729,21985,PACK OF 12 HEARTS DESIGN TISSUES ,48,0.29,17829.0,United Arab Emirates,2025-08-28
498729,22335,HEART DECORATION PAINTED ZINC ,24,0.65,17829.0,United Arab Emirates,2025-08-28
498729,22336,DOVE DECORATION PAINTED ZINC ,24,0.65,17829.0,United Arab Emirates,2025-08-28
498729,22339,CHRISTMAS TREE PAINTED ZINC ,24,0.65,17829.0,United Arab Emirates,2025-08-28
498729,22338,STAR DECORATION PAINTED ZINC ,24,0.65,17829.0,United Arab Emirates,2025-08-28
498729,22214,CANDLE PLATE LACE WHITE,6,2.55,17829.0,United Arab Emirates,2025-08-28
498729,22212,FOUR HOOK  WHITE LOVEBIRDS,12,2.1,17829.0,United Arab Emirates,2025-08-28
498729,22224,WHITE LOVEBIRD LANTERN,12,2.95,17829.0,United Arab Emirates,2025-08-28
498729,22207,FRYING PAN UNION FLAG,4,4.25,17829.0,United Arab Emirates,2025-08-28
498729,84975,HEART SHAPED MIRROR,12,1.69,17829.0,United Arab Emirates,2025-08-28
498729,20733,GOLD MINI TAPE MEASURE ,10,0.85,17829.0,United Arab Emirates,2025-08-28
498729,22196,SMALL HEART MEASURING SPOONS,12,0.85,17829.0,United Arab Emirates,2025-08-28
498731,46000M,Dotcom,-100,0.0,,United Kingdom,2025-08-28
498732,35001B,HAND OPEN SHAPE BLACK,1,3.49,,United Kingdom,2025-08-28
498733,21527,,-142,0.0,,United Kingdom,2025-08-28
498734,21930,JUMBO STORAGE BAG SKULLS,6,1.95,17610.0,United Kingdom,2025-08-28
498734,21989,PACK OF 20 SKULL PAPER NAPKINS,10,0.85,17610.0,United Kingdom,2025-08-28
498734,20727,LUNCH BAG  BLACK SKULL.,10,1.65,17610.0,United Kingdom,2025-08-28
498734,21495,SKULLS WRAP,25,0.42,17610.0,United Kingdom,2025-08-28
498734,21581,SKULLS  DESIGN  COTTON TOTE BAG,6,2.25,17610.0,United Kingdom,2025-08-28
498734,21213,PACK OF 72 SKULL CAKE CASES,25,0.55,17610.0,United Kingdom,2025-08-28
498734,21987,PACK OF 6 SKULL PAPER CUPS,20,0.65,17610.0,United Kingdom,2025-08-28
498734,21747,SMALL SKULL WINDMILL,12,1.25,17610.0,United Kingdom,2025-08-28
498734,22068,BLACK PIRATE TREASURE CHEST,6,1.65,17610.0,United Kingdom,2025-08-28
498734,21327,SKULLS WRITING SET ,6,1.65,17610.0,United Kingdom,2025-08-28
498734,21211,SET OF 72 SKULL PAPER  DOILIES,6,1.45,17610.0,United Kingdom,2025-08-28
498734,21504,SKULLS GREETING CARD,12,0.42,17610.0,United Kingdom,2025-08-28
498734,22327,ROUND SNACK BOXES SET OF 4 SKULLS,6,2.95,17610.0,United Kingdom,2025-08-28
498734,21988,PACK OF 6 SKULL PAPER PLATES,6,0.85,17610.0,United Kingdom,2025-08-28
C498735,21667,GLASS CAKE COVER AND PLATE,-6,14.95,16027.0,United Kingdom,2025-08-28
498736,22203,MILK PAN RED RETROSPOT,1,3.75,12748.0,United Kingdom,2025-08-28
498736,17165B,ASS COL LARGE SAND GECKO P'WEIGHT,6,1.05,12748.0,United Kingdom,2025-08-28
498736,22030,SWALLOWS GREETING CARD,12,0.42,12748.0,United Kingdom,2025-08-28
498736,22029,SPACEBOY BIRTHDAY CARD,12,0.42,12748.0,United Kingdom,2025-08-28
498736,22033,BOTANICAL ROSE GREETING CARD,11,0.42,12748.0,United Kingdom,2025-08-28
498736,22383,LUNCH BAG SUKI  DESIGN ,6,1.65,12748.0,United Kingdom,2025-08-28
498736,22382,LUNCH BAG SPACEBOY DESIGN ,6,1.65,12748.0,United Kingdom,2025-08-28
498736,21485,RED SPOT HEART HOT WATER BOTTLE,1,4.95,12748.0,United Kingdom,2025-08-28
498736,21329,DINOSAURS  WRITING SET ,6,1.65,12748.0,United Kingdom,2025-08-28
498736,21330,WOODLAND ANIMAL  WRITING SET ,6,1.65,12748.0,United Kingdom,2025-08-28
498736,22326,ROUND SNACK BOXES SET OF4 WOODLAND ,3,2.95,12748.0,United Kingdom,2025-08-28
