Invoice,StockCode,Description,Quantity,Price,Customer ID,Country,InvoiceDate
495310,21239,PINK  SPOTTY CUP,8,0.85,12531.0,Germany,2025-08-02
495310,21238,RED SPOTTY CUP,8,0.85,12531.0,Germany,2025-08-02
495310,21223,SET/4 BADGES WOODLAND ANIMAL,10,1.25,12531.0,Germany,2025-08-02
495310,21242,RED SPOTTY PLATE ,8,1.69,12531.0,Germany,2025-08-02
495310,21217,RED SPOTTY ROUND CAKE TINS,1,9.95,12531.0,Germany,2025-08-02
495310,21092,SET/6 STRAWBERRY PAPER PLATES,12,0.85,12531.0,Germany,2025-08-02
495310,21218,RED SPOTTY BISCUIT TIN,6,3.75,12531.0,Germany,2025-08-02
495310,21121,SET/10 RED SPOTTY PARTY CANDLES,24,1.25,12531.0,Germany,2025-08-02
495310,21122,SET/10 PINK SPOTTY PARTY CANDLES,24,1.25,12531.0,Germany,2025-08-02
495310,21124,SET/10 BLUE SPOTTY PARTY CANDLES,24,1.25,12531.0,Germany,2025-08-02
495310,21094,SET/6 RED SPOTTY PAPER PLATES,12,0.85,12531.0,Germany,2025-08-02
495310,21154,RED SPOTTY OVEN GLOVE ,10,1.25,12531.0,Germany,2025-08-02
495310,21155,RED SPOTTY PEG BAG,6,2.1,12531.0,Germany,2025-08-02
495310,21210,SET OF 72 RETRO SPOT PAPER  DOILIES,12,1.45,12531.0,Germany,2025-08-02
495310,21212,PACK OF 72 RETRO SPOT CAKE CASES,24,0.55,12531.0,Germany,2025-08-02
495310,21153,RED SPOTTY TABLECLOTH ,2,10.65,12531.0,Germany,2025-08-02
495311,84029E,RED WOOLLY HOTTIE WHITE HEART.,3,3.75,17243.0,United Kingdom,2025-08-02
495311,84029G,KNITTED UNION FLAG HOT WATER BOTTLE,1,3.75,17243.0,United Kingdom,2025-08-02
495311,21485,RED SPOT HEART HOT WATER BOTTLE,1,4.95,17243.0,United Kingdom,2025-08-02
495311,22112,CHOCOLATE HOT WATER BOTTLE,1,4.95,17243.0,United Kingdom,2025-08-02
495311,84836,ZINC METAL HEART DECORATION,12,1.25,17243.0,United Kingdom,2025-08-02
495311,22191,EAU DE NIL DINER WALL CLOCK,1,8.5,17243.0,United Kingdom,2025-08-02
495311,82494L,WOODEN FRAME ANTIQUE WHITE ,12,2.95,17243.0,United Kingdom,2025-08-02
495311,84836,ZINC METAL HEART DECORATION,12,1.25,17243.0,United Kingdom,2025-08-02
495311,84029G,KNITTED UNION FLAG HOT WATER BOTTLE,5,3.75,17243.0,United Kingdom,2025-08-02
495311,82486,WOOD S/3 CABINET ANT WHITE FINISH,6,7.95,17243.0,United Kingdom,2025-08-02
495311,22112,CHOCOLATE HOT WATER BOTTLE,1,4.95,17243.0,United Kingdom,2025-08-02
495311,84029D,LEOPARD PRINT HOT WATER BOTTLE,1,3.75,17243.0,United Kingdom,2025-08-02
495311,21486,PINK HEART DOTS HOT WATER BOTTLE,1,3.75,17243.0,United Kingdom,2025-08-02
495311,48173C,DOOR MAT BLACK FLOCK ,1,6.75,17243.0,United Kingdom,2025-08-02
495311,48195,DOOR MAT GREEN PAISLEY ,1,6.75,17243.0,United Kingdom,2025-08-02
495311,21485,RED SPOT HEART HOT WATER BOTTLE,1,4.95,17243.0,United Kingdom,2025-08-02
495311,22366,DOORMAT AIRMAIL ,1,6.75,17243.0,United Kingdom,2025-08-02
495311,20692,FLORAL ELEPHANT SOFT TOY,5,4.25,17243.0,United Kingdom,2025-08-02
495311,79323W, WHITE CHERRY LIGHTS,2,6.75,17243.0,United Kingdom,2025-08-02
495312,85123A,WHITE HANGING HEART T-LIGHT HOLDER,6,2.95,16822.0,United Kingdom,2025-08-02
495312,21911,GARDEN METAL SIGN ,12,1.65,16822.0,United Kingdom,2025-08-02
495312,22244,"HOOK, 3 HANGER ,MAGIC GARDEN",12,1.95,16822.0,United Kingdom,2025-08-02
495312,21407,BROWN CHECK CAT DOORSTOP ,3,4.25,16822.0,United Kingdom,2025-08-02
495312,22245,"HOOK, 1 HANGER ,MAGIC GARDEN",12,0.85,16822.0,United Kingdom,2025-08-02
495312,84665,SQUARE CHERRY BLOSSOM CABINET,4,5.95,16822.0,United Kingdom,2025-08-02
495312,84625D,WHITE NEWBAROQUE CANDLESTICK CANDLE,24,0.85,16822.0,United Kingdom,2025-08-02
495312,72739B,WHITE CHOCOLATE SCENT CANDLE,36,0.65,16822.0,United Kingdom,2025-08-02
495312,17136A,BLUE STONES ON WIRE FOR CANDLE,48,0.08,16822.0,United Kingdom,2025-08-02
495312,21442,GREEN BIRDHOUSE DECORATION,12,0.85,16822.0,United Kingdom,2025-08-02
495312,21765,HANGING METAL BIRD BATH,2,7.95,16822.0,United Kingdom,2025-08-02
495313,21385,IVORY HANGING DECORATION  HEART,24,0.85,13889.0,United Kingdom,2025-08-02
495313,20996,JAZZ HEARTS ADDRESS BOOK,24,0.42,13889.0,United Kingdom,2025-08-02
495313,84050,PINK HEART SHAPE EGG FRYING PAN,6,1.65,13889.0,United Kingdom,2025-08-02
495313,21390,FILIGRIS HEART WITH BUTTERFLY,24,1.25,13889.0,United Kingdom,2025-08-02
495313,85231L,LAVENDER SCENTED SET/9 T-LIGHTS,12,0.85,13889.0,United Kingdom,2025-08-02
495313,85231E,STRAWBERRY SCENTED SET/9 T-LIGHTS,12,0.85,13889.0,United Kingdom,2025-08-02
495313,84970L,SINGLE HEART ZINC T-LIGHT HOLDER,12,0.95,13889.0,United Kingdom,2025-08-02
495313,22224,WHITE LOVEBIRD LANTERN,6,2.95,13889.0,United Kingdom,2025-08-02
495313,21486,PINK HEART DOTS HOT WATER BOTTLE,4,3.75,13889.0,United Kingdom,2025-08-02
495313,22297,HEART IVORY TRELLIS SMALL,24,1.25,13889.0,United Kingdom,2025-08-02
495313,22276,WASH BAG VINTAGE ROSE PAISLEY,6,2.55,13889.0,United Kingdom,2025-08-02
495313,85129D,BEADED CRYSTAL HEART PINK SMALL,12,1.25,13889.0,United Kingdom,2025-08-02
495313,85123A,WHITE HANGING HEART T-LIGHT HOLDER,18,2.95,13889.0,United Kingdom,2025-08-02
495313,84970S,HANGING HEART ZINC T-LIGHT HOLDER,12,0.85,13889.0,United Kingdom,2025-08-02
495313,22227,"DECORATION, HANGING HEART+MIRROR ",24,0.65,13889.0,United Kingdom,2025-08-02
495313,21733,RED HANGING HEART T-LIGHT HOLDER,6,2.95,13889.0,United Kingdom,2025-08-02
495313,21411,GINGHAM HEART  DOORSTOP RED,3,4.25,13889.0,United Kingdom,2025-08-02
495313,21485,RED SPOT HEART HOT WATER BOTTLE,3,4.95,13889.0,United Kingdom,2025-08-02
495314,85175,CACTI T-LIGHT CANDLES,16,0.42,17888.0,United Kingdom,2025-08-02
495314,21733,RED HANGING HEART T-LIGHT HOLDER,3,2.95,17888.0,United Kingdom,2025-08-02
495314,22107,PIZZA PLATE IN BOX,2,3.75,17888.0,United Kingdom,2025-08-02
495314,20966,SANDWICH BATH SPONGE,1,1.25,17888.0,United Kingdom,2025-08-02
495314,21034,REX CASH+CARRY JUMBO SHOPPER,1,0.95,17888.0,United Kingdom,2025-08-02
495314,22223,CAKE PLATE LOVEBIRD PINK,1,4.95,17888.0,United Kingdom,2025-08-02
495314,22139,RETRO SPOT TEA SET CERAMIC 11 PC ,1,4.95,17888.0,United Kingdom,2025-08-02
495314,20934,SET/3 POT PLANT CANDLES,1,5.45,17888.0,United Kingdom,2025-08-02
495314,21082,SET/20 FRUIT SALAD PAPER NAPKINS ,2,0.85,17888.0,United Kingdom,2025-08-02
495314,17021,NAMASTE SWAGAT INCENSE,6,0.3,17888.0,United Kingdom,2025-08-02
495314,20774,GREEN FERN NOTEBOOK,1,1.65,17888.0,United Kingdom,2025-08-02
495314,20778,GARDEN PATH NOTEBOOK ,1,1.65,17888.0,United Kingdom,2025-08-02
495314,20773,BLUE PAISLEY NOTEBOOK,1,1.65,17888.0,United Kingdom,2025-08-02
495314,85042,ANTIQUE LILY FAIRY LIGHTS,6,4.95,17888.0,United Kingdom,2025-08-02
495314,22326,ROUND SNACK BOXES SET OF4 WOODLAND ,1,2.95,17888.0,United Kingdom,2025-08-02
495314,22328,ROUND SNACK BOXES SET OF 4 FRUITS ,1,2.95,17888.0,United Kingdom,2025-08-02
495314,22301,COFFEE MUG CAT + BIRD DESIGN,1,2.55,17888.0,United Kingdom,2025-08-02
495314,22244,"HOOK, 3 HANGER ,MAGIC GARDEN",2,1.95,17888.0,United Kingdom,2025-08-02
495314,22302,COFFEE MUG PEARS  DESIGN,1,2.55,17888.0,United Kingdom,2025-08-02
495314,22303,COFFEE MUG APPLES DESIGN,1,2.55,17888.0,United Kingdom,2025-08-02
495314,22300,COFFEE MUG DOG + BALL DESIGN,1,2.55,17888.0,United Kingdom,2025-08-02
495314,35980C,REDWHITE STRIPE SCANDINAVIAN HEART ,44,0.38,17888.0,United Kingdom,2025-08-02
495315,21348,,-45,0.0,,United Kingdom,2025-08-02
495316,21837,CROSS STITCH ALPHABET CUSHION COVER,2,5.95,15581.0,United Kingdom,2025-08-02
495316,21622,VINTAGE UNION JACK CUSHION COVER,2,4.95,15581.0,United Kingdom,2025-08-02
495316,21888,BINGO SET,1,3.75,15581.0,United Kingdom,2025-08-02
495316,48138,DOOR MAT UNION FLAG,1,6.75,15581.0,United Kingdom,2025-08-02
495316,85135A,YELLOW DRAGONFLY HELICOPTER,1,7.95,15581.0,United Kingdom,2025-08-02
495316,85135B,BLUE DRAGONFLY HELICOPTER,1,7.95,15581.0,United Kingdom,2025-08-02
495317,21934,SKULL SHOULDER BAG,10,1.65,16327.0,United Kingdom,2025-08-02
495317,85099C,JUMBO  BAG BAROQUE BLACK WHITE,10,1.95,16327.0,United Kingdom,2025-08-02
495317,21931,JUMBO STORAGE BAG SUKI,10,1.95,16327.0,United Kingdom,2025-08-02
495317,21755,LOVE BUILDING BLOCK WORD,3,5.95,16327.0,United Kingdom,2025-08-02
495317,84832,ZINC WILLIE WINKIE  CANDLE STICK,12,0.85,16327.0,United Kingdom,2025-08-02
495317,21669,BLUE STRIPE CERAMIC DRAWER KNOB,12,1.25,16327.0,United Kingdom,2025-08-02
495317,21671,RED SPOT CERAMIC DRAWER KNOB,12,1.25,16327.0,United Kingdom,2025-08-02
495317,21668,RED STRIPE CERAMIC DRAWER KNOB,12,1.25,16327.0,United Kingdom,2025-08-02
495317,21673,WHITE SPOT BLUE CERAMIC DRAWER KNOB,36,1.25,16327.0,United Kingdom,2025-08-02
495317,21672,WHITE SPOT RED CERAMIC DRAWER KNOB,12,1.25,16327.0,United Kingdom,2025-08-02
495317,22356,"CHARLOTTE BAG , PINK/WHITE SPOTS",10,0.85,16327.0,United Kingdom,2025-08-02
495317,84997D,PINK 3 PIECE MINI DOTS CUTLERY SET,6,3.75,16327.0,United Kingdom,2025-08-02
495317,84050,PINK HEART SHAPE EGG FRYING PAN,6,1.65,16327.0,United Kingdom,2025-08-02
495317,85061W,WHITE JEWELLED HEART DECORATION,24,0.85,16327.0,United Kingdom,2025-08-02
495317,84971S,SMALL HEART FLOWERS HOOK ,24,0.85,16327.0,United Kingdom,2025-08-02
495317,47591D,PINK FAIRY CAKE CHILD'S APRON,8,1.95,16327.0,United Kingdom,2025-08-02
495317,84997B,RED 3 PIECE MINI DOTS CUTLERY SET,6,3.75,16327.0,United Kingdom,2025-08-02
495317,84997C,BLUE 3 PIECE MINI DOTS CUTLERY SET,6,3.75,16327.0,United Kingdom,2025-08-02
495317,22355,"CHARLOTTE BAG , SUKI DESIGN",30,0.85,16327.0,United Kingdom,2025-08-02
495317,20725,LUNCH BAG RED SPOTTY,10,1.65,16327.0,United Kingdom,2025-08-02
495317,20727,LUNCH BAG  BLACK SKULL.,10,1.65,16327.0,United Kingdom,2025-08-02
495317,20726,LUNCH BAG WOODLAND,10,1.65,16327.0,United Kingdom,2025-08-02
495317,21260,FIRST AID TIN,6,3.25,16327.0,United Kingdom,2025-08-02
495317,20724,RED SPOTTY CHARLOTTE BAG,20,0.85,16327.0,United Kingdom,2025-08-02
495317,85060,WOOD FAN WITH FLOWER DESIGN,12,1.25,16327.0,United Kingdom,2025-08-02
495318,22223,CAKE PLATE LOVEBIRD PINK,3,4.95,15266.0,United Kingdom,2025-08-02
495317,22353,LUNCHBOX WITH CUTLERY FAIRY CAKES ,6,2.55,16327.0,United Kingdom,2025-08-02
495317,21559,STRAWBERRY LUNCHBOX WITH CUTLERY,6,2.55,16327.0,United Kingdom,2025-08-02
495317,82600,NO SINGING METAL SIGN,12,2.1,16327.0,United Kingdom,2025-08-02
495317,21041,RED SPOTTY OVEN GLOVE DOUBLE,6,2.95,16327.0,United Kingdom,2025-08-02
495317,21154,RED SPOTTY OVEN GLOVE ,10,1.25,16327.0,United Kingdom,2025-08-02
495317,47559B,TEA TIME OVEN GLOVE,10,1.25,16327.0,United Kingdom,2025-08-02
495317,21777,RECIPE BOX WITH METAL HEART,2,7.95,16327.0,United Kingdom,2025-08-02
495317,21257,VICTORIAN SEWING BOX MEDIUM,4,7.95,16327.0,United Kingdom,2025-08-02
495317,20991,JAZZ HEARTS MAGNETIC MEMO PAD,24,0.65,16327.0,United Kingdom,2025-08-02
495317,85232B,SET/3 RUSSIAN DOLL STACKING TINS,6,4.95,16327.0,United Kingdom,2025-08-02
495317,20738,GREEN MINI TAPE MEASURE ,10,0.85,16327.0,United Kingdom,2025-08-02
495317,47568,ENGLISH ROSE DESIGN PEG BAG,6,2.1,16327.0,United Kingdom,2025-08-02
495317,85123A,WHITE HANGING HEART T-LIGHT HOLDER,6,2.95,16327.0,United Kingdom,2025-08-02
495317,84946,ANTIQUE SILVER TEA GLASS ETCHED,12,1.25,16327.0,United Kingdom,2025-08-02
495318,48138,DOOR MAT UNION FLAG,2,6.75,15266.0,United Kingdom,2025-08-02
495318,48185,DOOR MAT FAIRY CAKE,2,6.75,15266.0,United Kingdom,2025-08-02
495318,21659,GLASS CAKE STAND,1,14.95,15266.0,United Kingdom,2025-08-02
495318,82081,PINK HEARTS PHOTO ALBUM,12,1.95,15266.0,United Kingdom,2025-08-02
495317,20719,WOODLAND CHARLOTTE BAG,10,0.85,16327.0,United Kingdom,2025-08-02
495317,20752,RETRO BLUE SPOTTY WASHING UP GLOVES,6,2.1,16327.0,United Kingdom,2025-08-02
495317,85014B,RED/WHITE DOTS RUFFLED UMBRELLA,3,5.95,16327.0,United Kingdom,2025-08-02
495317,85014A,BLACK/BLUE DOTS RUFFLED UMBRELLA,3,5.95,16327.0,United Kingdom,2025-08-02
495317,18096C,WHITE ROUND PORCELAIN TLIGHT HOLDER,6,2.55,16327.0,United Kingdom,2025-08-02
495317,20754,RETRO RED SPOTTY WASHING UP GLOVES,6,2.1,16327.0,United Kingdom,2025-08-02
C495319,20778,GARDEN PATH NOTEBOOK ,-1,1.65,17888.0,United Kingdom,2025-08-02
C495319,22300,COFFEE MUG DOG + BALL DESIGN,-1,2.55,17888.0,United Kingdom,2025-08-02
C495319,22303,COFFEE MUG APPLES DESIGN,-1,2.55,17888.0,United Kingdom,2025-08-02
C495319,22302,COFFEE MUG PEARS  DESIGN,-1,2.55,17888.0,United Kingdom,2025-08-02
C495319,22244,"HOOK, 3 HANGER ,MAGIC GARDEN",-2,1.95,17888.0,United Kingdom,2025-08-02
C495319,22301,COFFEE MUG CAT + BIRD DESIGN,-1,2.55,17888.0,United Kingdom,2025-08-02
C495319,22328,ROUND SNACK BOXES SET OF 4 FRUITS ,-1,2.95,17888.0,United Kingdom,2025-08-02
C495319,22326,ROUND SNACK BOXES SET OF4 WOODLAND ,-1,2.95,17888.0,United Kingdom,2025-08-02
C495319,85042,ANTIQUE LILY FAIRY LIGHTS,-6,4.95,17888.0,United Kingdom,2025-08-02
C495319,20773,BLUE PAISLEY NOTEBOOK,-1,1.65,17888.0,United Kingdom,2025-08-02
C495319,21082,SET/20 FRUIT SALAD PAPER NAPKINS ,-2,0.85,17888.0,United Kingdom,2025-08-02
C495319,20774,GREEN FERN NOTEBOOK,-1,1.65,17888.0,United Kingdom,2025-08-02
C495319,20934,SET/3 POT PLANT CANDLES,-1,5.45,17888.0,United Kingdom,2025-08-02
C495319,85175,CACTI T-LIGHT CANDLES,-16,0.42,17888.0,United Kingdom,2025-08-02
C495319,21733,RED HANGING HEART T-LIGHT HOLDER,-3,2.95,17888.0,United Kingdom,2025-08-02
C495319,22107,PIZZA PLATE IN BOX,-2,3.75,17888.0,United Kingdom,2025-08-02
C495319,20966,SANDWICH BATH SPONGE,-1,1.25,17888.0,United Kingdom,2025-08-02
C495319,22223,CAKE PLATE LOVEBIRD PINK,-1,4.95,17888.0,United Kingdom,2025-08-02
C495319,22139,RETRO SPOT TEA SET CERAMIC 11 PC ,-1,4.95,17888.0,United Kingdom,2025-08-02
C495319,21034,REX CASH+CARRY JUMBO SHOPPER,-1,0.95,17888.0,United Kingdom,2025-08-02
C495319,35980C,REDWHITE STRIPE SCANDINAVIAN HEART ,-44,0.38,17888.0,United Kingdom,2025-08-02
C495319,17021,NAMASTE SWAGAT INCENSE,-6,0.3,17888.0,United Kingdom,2025-08-02
495320,21493,,-6,0.0,,United Kingdom,2025-08-02
495321,21490,,-16,0.0,,United Kingdom,2025-08-02
495322,37379A,PINK CHERRY BLOSSOM CUP & SAUCER,6,1.25,14640.0,United Kingdom,2025-08-02
495322,21185, HOME SWEET HOME  BLACKBOARD,3,6.35,14640.0,United Kingdom,2025-08-02
495322,84984A,GREEN PEONY DES C/COVER,2,4.65,14640.0,United Kingdom,2025-08-02
495322,84984B,RED PEONY DES C/COVER ,2,4.65,14640.0,United Kingdom,2025-08-02
495322,84380,SET OF 3 BUTTERFLY COOKIE CUTTERS,12,1.25,14640.0,United Kingdom,2025-08-02
495322,21441,BLUE BIRDHOUSE DECORATION,12,0.85,14640.0,United Kingdom,2025-08-02
495322,21895,POTTING SHED SOW 'N' GROW SET,4,4.25,14640.0,United Kingdom,2025-08-02
495322,85213,MINI  ZINC GARDEN DECORATIONS ,12,0.85,14640.0,United Kingdom,2025-08-02
495322,22231,JIGSAW TREE WITH BIRDHOUSE,12,1.45,14640.0,United Kingdom,2025-08-02
495322,20932,PINK POT PLANT CANDLE,4,3.75,14640.0,United Kingdom,2025-08-02
495322,47566,PARTY BUNTING,5,4.65,14640.0,United Kingdom,2025-08-02
495322,21655,HANGING RIDGE GLASS T-LIGHT HOLDER,12,1.69,14640.0,United Kingdom,2025-08-02
495322,22326,ROUND SNACK BOXES SET OF4 WOODLAND ,6,2.95,14640.0,United Kingdom,2025-08-02
495322,84970L,SINGLE HEART ZINC T-LIGHT HOLDER,12,0.95,14640.0,United Kingdom,2025-08-02
495322,20931,BLUE POT PLANT CANDLE ,4,3.75,14640.0,United Kingdom,2025-08-02
495322,22244,"HOOK, 3 HANGER ,MAGIC GARDEN",12,1.95,14640.0,United Kingdom,2025-08-02
495322,22215,CAKE STAND WHITE TWO TIER LACE,2,8.5,14640.0,United Kingdom,2025-08-02
495322,22217,T-LIGHT HOLDER HANGING LACE,12,1.25,14640.0,United Kingdom,2025-08-02
495322,22232,JIGSAW TOADSTOOLS 3 PIECE,8,1.65,14640.0,United Kingdom,2025-08-02
495323,72768,,-6,0.0,,United Kingdom,2025-08-02
495324,44266F,,-2,0.0,,United Kingdom,2025-08-02
495325,47565,,-16,0.0,,United Kingdom,2025-08-02
495326,47581A,,-16,0.0,,United Kingdom,2025-08-02
495327,79065B,,-2,0.0,,United Kingdom,2025-08-02
495330,84494B,,18,0.0,,United Kingdom,2025-08-02
495328,84344,,-8,0.0,,United Kingdom,2025-08-02
495329,84494B,,-20,0.0,,United Kingdom,2025-08-02
495331,37503,TEA TIME CAKE STAND IN GIFT BOX,1,10.75,17799.0,United Kingdom,2025-08-02
495331,22060,LARGE CAKE STAND HANGING HEARTS,3,9.95,17799.0,United Kingdom,2025-08-02
495331,35965,FOLKART HEART NAPKIN RINGS,4,2.95,17799.0,United Kingdom,2025-08-02
495331,21080,SET/20 RED SPOTTY PAPER NAPKINS ,4,0.85,17799.0,United Kingdom,2025-08-02
495331,20914,SET/5 RED SPOTTY LID GLASS BOWLS,2,2.95,17799.0,United Kingdom,2025-08-02
495331,21975,PACK OF 60 DINOSAUR CAKE CASES,5,0.55,17799.0,United Kingdom,2025-08-02
495331,84991,60 TEATIME FAIRY CAKE CASES,4,0.55,17799.0,United Kingdom,2025-08-02
495331,84992,72 SWEETHEART FAIRY CAKE CASES,5,0.55,17799.0,United Kingdom,2025-08-02
495331,70006,LOVE HEART POCKET WARMER,2,1.65,17799.0,United Kingdom,2025-08-02
495331,22131,FOOD CONTAINER SET 3 LOVE HEART ,6,1.95,17799.0,United Kingdom,2025-08-02
495331,84029E,RED WOOLLY HOTTIE WHITE HEART.,2,3.75,17799.0,United Kingdom,2025-08-02
495331,22114,HOT WATER BOTTLE TEA AND SYMPATHY,2,3.95,17799.0,United Kingdom,2025-08-02
495331,21481,FAWN BLUE HOT WATER BOTTLE,1,2.95,17799.0,United Kingdom,2025-08-02
495331,22149,FELTCRAFT 6 FLOWER FRIENDS,4,2.1,17799.0,United Kingdom,2025-08-02
495331,17164D,ASS COL SMALL SAND FROG P'WEIGHT,3,0.42,17799.0,United Kingdom,2025-08-02
495331,72008,FROSTED BOX 9 WHITE T-LIGHT CANDLES,12,0.42,17799.0,United Kingdom,2025-08-02
495331,72789,BASKET/8 SCENTED LOVE TOKEN CANDLES,2,3.75,17799.0,United Kingdom,2025-08-02
495331,20886,BOX OF 9 PEBBLE CANDLES,4,1.95,17799.0,United Kingdom,2025-08-02
495331,85040A,S/4 PINK FLOWER CANDLES IN BOWL,4,1.65,17799.0,United Kingdom,2025-08-02
495331,21034,REX CASH+CARRY JUMBO SHOPPER,10,0.95,17799.0,United Kingdom,2025-08-02
495331,85206B,PINK FELT EASTER EGG BASKET,6,1.65,17799.0,United Kingdom,2025-08-02
495331,22138,BAKING SET 9 PIECE RETROSPOT ,2,4.95,17799.0,United Kingdom,2025-08-02
495331,20684,STRAWBERRY DREAM CHILDS UMBRELLA,2,3.25,17799.0,United Kingdom,2025-08-02
495331,20680,PINK FLOWERS CHILDS UMBRELLA,2,3.25,17799.0,United Kingdom,2025-08-02
495331,20682,RED SPOTTY CHILDS UMBRELLA,1,3.25,17799.0,United Kingdom,2025-08-02
495331,20686,DOLLY MIXTURE CHILDREN'S UMBRELLA,1,3.25,17799.0,United Kingdom,2025-08-02
495331,20681,PINK SPOTTY CHILDS UMBRELLA,2,3.25,17799.0,United Kingdom,2025-08-02
495331,20680,PINK FLOWERS CHILDS UMBRELLA,1,3.25,17799.0,United Kingdom,2025-08-02
495331,15056P,EDWARDIAN PARASOL PINK,1,5.95,17799.0,United Kingdom,2025-08-02
495331,15060B,FAIRY CAKE DESIGN UMBRELLA,2,3.75,17799.0,United Kingdom,2025-08-02
495331,15056BL,EDWARDIAN PARASOL BLACK,1,5.95,17799.0,United Kingdom,2025-08-02
495331,20679,EDWARDIAN PARASOL RED,3,5.95,17799.0,United Kingdom,2025-08-02
495331,22054,MINI CAKE STAND HANGING HEARTS,4,1.65,17799.0,United Kingdom,2025-08-02
495331,22055,MINI CAKE STAND  HANGING STRAWBERY,8,1.65,17799.0,United Kingdom,2025-08-02
495331,84081,WHITE CERAMIC PARTY SET (5PCS),2,4.25,17799.0,United Kingdom,2025-08-02
495331,21723,ALPHABET HEARTS STICKER SHEET,10,0.85,17799.0,United Kingdom,2025-08-02
495331,21726,MULTI HEARTS  STICKERS,10,0.85,17799.0,United Kingdom,2025-08-02
495331,84380,SET OF 3 BUTTERFLY COOKIE CUTTERS,3,1.25,17799.0,United Kingdom,2025-08-02
495331,84378,SET OF 3 HEART COOKIE CUTTERS,6,1.25,17799.0,United Kingdom,2025-08-02
495331,21700,BIG DOUGHNUT FRIDGE MAGNETS,6,0.85,17799.0,United Kingdom,2025-08-02
495331,21698,MOCK LOBSTER FRIDGE MAGNET,1,0.85,17799.0,United Kingdom,2025-08-02
495331,85206A,CREAM FELT EASTER EGG BASKET,4,1.65,17799.0,United Kingdom,2025-08-02
495331,17164D,ASS COL SMALL SAND FROG P'WEIGHT,5,0.42,17799.0,United Kingdom,2025-08-02
495331,20828,GLITTER BUTTERFLY CLIPS,4,2.55,17799.0,United Kingdom,2025-08-02
495331,22127,PARTY CONES CARNIVAL ASSORTED,24,1.25,17799.0,United Kingdom,2025-08-02
495331,22382,LUNCHBAG SPACEBOY DESIGN ,6,1.65,17799.0,United Kingdom,2025-08-02
495331,22383,LUNCHBAG SUKI  DESIGN ,4,1.65,17799.0,United Kingdom,2025-08-02
495331,22380,TOY TIDY SPACEBOY  ,4,2.1,17799.0,United Kingdom,2025-08-02
495331,21936,RED/WHITE SPOT PICNIC BAG,1,2.95,17799.0,United Kingdom,2025-08-02
495331,21034,REX CASH+CARRY JUMBO SHOPPER,2,0.95,17799.0,United Kingdom,2025-08-02
495331,85099B,JUMBO BAG RED WHITE SPOTTY ,4,1.95,17799.0,United Kingdom,2025-08-02
495331,21156,RED SPOTTY CHILDS APRON,4,1.95,17799.0,United Kingdom,2025-08-02
495331,47599B,BLUE PARTY BAGS ,1,2.1,17799.0,United Kingdom,2025-08-02
495331,21709,FOLDING UMBRELLA  CHOC/WHITE  SPOT,3,4.95,17799.0,United Kingdom,2025-08-02
495331,21706,"FOLDING UMBRELLA , RED/WHITE SPOT",3,4.95,17799.0,United Kingdom,2025-08-02
495331,20969,RED FLORAL FELTCRAFT SHOULDER BAG,1,3.75,17799.0,United Kingdom,2025-08-02
495331,20970,PINK FLORAL FELTCRAFT SHOULDER BAG,1,3.75,17799.0,United Kingdom,2025-08-02
495331,16161M,WRAP  PINK FLOCK,25,0.42,17799.0,United Kingdom,2025-08-02
495331,21500,PINK SPOTS  WRAP ,25,0.42,17799.0,United Kingdom,2025-08-02
495331,21499,BLUE SPOTS  WRAP,25,0.42,17799.0,United Kingdom,2025-08-02
495331,16156S,WRAP PINK FAIRY CAKES ,25,0.42,17799.0,United Kingdom,2025-08-02
495331,21381,MINI WOODEN HAPPY BIRTHDAY GARLAND,3,1.69,17799.0,United Kingdom,2025-08-02
495331,47599A,PINK PARTY BAGS,3,2.1,17799.0,United Kingdom,2025-08-02
495331,21440,12 MINI TOADSTOOL PEGS,2,1.25,17799.0,United Kingdom,2025-08-02
495331,20712,JUMBO BAG WOODLAND ANIMALS,4,1.95,17799.0,United Kingdom,2025-08-02
495331,85099F,JUMBO BAG STRAWBERRY,4,1.95,17799.0,United Kingdom,2025-08-02
495331,20725,LUNCH BAG RED SPOTTY,6,1.65,17799.0,United Kingdom,2025-08-02
495331,21936,RED/WHITE SPOT PICNIC BAG,2,2.95,17799.0,United Kingdom,2025-08-02
495331,21985,PACK OF 12 HEARTS DESIGN TISSUES ,12,0.29,17799.0,United Kingdom,2025-08-02
495331,21937,STRAWBERRY   PICNIC BAG,4,2.95,17799.0,United Kingdom,2025-08-02
495331,21830,ASSORTED CREEPY CRAWLIES,24,0.42,17799.0,United Kingdom,2025-08-02
495331,72739C,DARK CHOCOLATE SCENTCANDLE,2,1.25,17799.0,United Kingdom,2025-08-02
495331,72739B,WHITE CHOCOLATE SCENT CANDLE,2,1.25,17799.0,United Kingdom,2025-08-02
495331,85038,6 CHOCOLATE LOVE HEART T-LIGHTS,3,2.1,17799.0,United Kingdom,2025-08-02
495331,85038,6 CHOCOLATE LOVE HEART T-LIGHTS,1,2.1,17799.0,United Kingdom,2025-08-02
495331,85040B,SET/4 BLUE FLOWER CANDLES IN BOWL,3,1.65,17799.0,United Kingdom,2025-08-02
495331,21122,SET/10 PINK SPOTTY PARTY CANDLES,4,1.25,17799.0,United Kingdom,2025-08-02
495331,21677,HEARTS  STICKERS,6,0.85,17799.0,United Kingdom,2025-08-02
495331,21124,SET/10 BLUE SPOTTY PARTY CANDLES,2,1.25,17799.0,United Kingdom,2025-08-02
495331,18098C,PORCELAIN BUTTERFLY OIL BURNER,3,2.95,17799.0,United Kingdom,2025-08-02
495331,72801D,S/4 SKY BLUE DINNER CANDLES,2,1.25,17799.0,United Kingdom,2025-08-02
495331,21121,SET/10 RED SPOTTY PARTY CANDLES,2,1.25,17799.0,United Kingdom,2025-08-02
495331,21829,DINOSAUR KEYRINGS ASSORTED,36,0.21,17799.0,United Kingdom,2025-08-02
495331,22195,LARGE HEART MEASURING SPOONS,3,1.65,17799.0,United Kingdom,2025-08-02
495331,20726,LUNCH BAG WOODLAND,4,1.65,17799.0,United Kingdom,2025-08-02
495331,84992,72 SWEETHEART FAIRY CAKE CASES,1,0.55,17799.0,United Kingdom,2025-08-02
495331,84032B,CHARLIE + LOLA RED HOT WATER BOTTLE,2,2.95,17799.0,United Kingdom,2025-08-02
495333,85063,CREAM SWEETHEART MAGAZINE RACK,1,16.95,16158.0,United Kingdom,2025-08-02
495334,85070,,3,0.0,,United Kingdom,2025-08-02
495336,84681,,-36,0.0,,United Kingdom,2025-08-02
495335,84723,,7,0.0,,United Kingdom,2025-08-02
495337,84575A,,-14,0.0,,United Kingdom,2025-08-02
495338,84630,,-38,0.0,,United Kingdom,2025-08-02
495339,84555A,,-19,0.0,,United Kingdom,2025-08-02
495340,21866,UNION JACK FLAG LUGGAGE TAG,3,1.25,14031.0,United Kingdom,2025-08-02
495340,21935,SUKI  SHOULDER BAG,100,1.45,14031.0,United Kingdom,2025-08-02
495340,21524,SPOTTY  HOME SWEET HOME DOORMAT,10,5.95,14031.0,United Kingdom,2025-08-02
495340,48138,DOOR MAT UNION FLAG,30,5.95,14031.0,United Kingdom,2025-08-02
495340,37370,RETRO COFFEE MUGS ASSORTED,72,1.06,14031.0,United Kingdom,2025-08-02
495340,84029E,RED WOOLLY HOTTIE WHITE HEART.,24,2.95,14031.0,United Kingdom,2025-08-02
495340,84029G,KNITTED UNION FLAG HOT WATER BOTTLE,24,3.39,14031.0,United Kingdom,2025-08-02
495340,84678,CLASSICAL ROSE SMALL VASE,5,2.55,14031.0,United Kingdom,2025-08-02
495340,84682,CLASSICAL ROSE DISH,3,2.95,14031.0,United Kingdom,2025-08-02
495340,22220,CAKE STAND LOVEBIRD 2 TIER WHITE,2,9.95,14031.0,United Kingdom,2025-08-02
495340,85152,HAND OVER THE CHOCOLATE   SIGN ,5,2.1,14031.0,United Kingdom,2025-08-02
495340,35004G,SET OF 3 GOLD FLYING DUCKS,4,6.35,14031.0,United Kingdom,2025-08-02
495340,79067,CORONA MEXICAN TRAY,8,3.75,14031.0,United Kingdom,2025-08-02
495340,46000M,POLYESTER FILLER PAD 45x45cm,20,1.55,14031.0,United Kingdom,2025-08-02
495340,85014B,RED/WHITE DOTS RUFFLED UMBRELLA,3,5.95,14031.0,United Kingdom,2025-08-02
495340,85014D,PINK/BROWN DOTS RUFFLED UMBRELLA,2,5.95,14031.0,United Kingdom,2025-08-02
495340,85014A,BLACK/BLUE DOTS RUFFLED UMBRELLA,4,5.95,14031.0,United Kingdom,2025-08-02
495340,82552,WASHROOM METAL SIGN,6,1.25,14031.0,United Kingdom,2025-08-02
495340,21866,UNION JACK FLAG LUGGAGE TAG,3,1.25,14031.0,United Kingdom,2025-08-02
495340,85114B,IVORY ENCHANTED FOREST PLACEMAT,8,1.65,14031.0,United Kingdom,2025-08-02
495340,15056BL,EDWARDIAN PARASOL BLACK,12,5.95,14031.0,United Kingdom,2025-08-02
495340,22212,FOUR HOOK  WHITE LOVEBIRDS,4,2.1,14031.0,United Kingdom,2025-08-02
495340,20679,EDWARDIAN PARASOL RED,12,5.95,14031.0,United Kingdom,2025-08-02
C495341,82552,WASHROOM METAL SIGN,-4,1.25,14031.0,United Kingdom,2025-08-02
495342,22303,COFFEE MUG APPLES DESIGN,6,2.55,,United Kingdom,2025-08-02
495342,22302,COFFEE MUG PEARS  DESIGN,6,2.55,,United Kingdom,2025-08-02
495342,21527,RETRO SPOT TRADITIONAL TEAPOT ,1,7.95,,United Kingdom,2025-08-02
495343,10123C,HEARTS WRAPPING TAPE ,1,1.28,,United Kingdom,2025-08-02
495343,84836,ZINC METAL HEART DECORATION,1,2.51,,United Kingdom,2025-08-02
495343,84832,ZINC WILLIE WINKIE  CANDLE STICK,2,1.66,,United Kingdom,2025-08-02
495343,48184,DOOR MAT ENGLISH ROSE ,1,13.57,,United Kingdom,2025-08-02
495343,84755,COLOUR GLASS T-LIGHT HOLDER HANGING,1,5.06,,United Kingdom,2025-08-02
495343,84753A,PINK EAU DE COLOGNE BOTTLE,3,1.66,,United Kingdom,2025-08-02
495343,15036,ASSORTED COLOURS SILK FAN,1,1.28,,United Kingdom,2025-08-02
