Invoice,StockCode,Description,Quantity,Price,Customer ID,Country,InvoiceDate
496612,48116,DOOR MAT MULTICOLOUR STRIPE,20,5.95,15061.0,United Kingdom,2025-08-12
496612,21843,RETRO SPOT CAKE STAND,24,9.95,15061.0,United Kingdom,2025-08-12
496612,21673,WHITE SPOT BLUE CERAMIC DRAWER KNOB,48,1.06,15061.0,United Kingdom,2025-08-12
496612,20685,DOOR MAT RED SPOT,40,5.95,15061.0,United Kingdom,2025-08-12
496612,84946,ANTIQUE SILVER TEA GLASS ETCHED,72,1.06,15061.0,United Kingdom,2025-08-12
496612,79323B,BLACK CHERRY LIGHTS,12,5.45,15061.0,United Kingdom,2025-08-12
496612,48184,DOOR MAT ENGLISH ROSE ,20,5.95,15061.0,United Kingdom,2025-08-12
496613,79323LP,LIGHT PINK CHERRY LIGHTS,24,5.45,15270.0,United Kingdom,2025-08-12
496613,79323P,PINK CHERRY LIGHTS,24,5.45,15270.0,United Kingdom,2025-08-12
496613,79323GR,GREEN CHERRY LIGHTS,24,5.45,15270.0,United Kingdom,2025-08-12
496613,21733,RED HANGING HEART T-LIGHT HOLDER,24,2.95,15270.0,United Kingdom,2025-08-12
496613,79323W, WHITE CHERRY LIGHTS,24,5.45,15270.0,United Kingdom,2025-08-12
496613,85123A,WHITE HANGING HEART T-LIGHT HOLDER,24,2.95,15270.0,United Kingdom,2025-08-12
496614,22185,SLATE TILE NATURAL HANGING,36,1.45,15270.0,United Kingdom,2025-08-12
496614,71053,WHITE METAL LANTERN,24,3.39,15270.0,United Kingdom,2025-08-12
496614,79323W, WHITE CHERRY LIGHTS,24,5.45,15270.0,United Kingdom,2025-08-12
496614,75049L,LARGE CIRCULAR MIRROR MOBILE,96,0.85,15270.0,United Kingdom,2025-08-12
496614,79323LP,LIGHT PINK CHERRY LIGHTS,24,5.45,15270.0,United Kingdom,2025-08-12
496614,37441,ASSORTED WHITE EMBOSSED CHINA MUGS,12,2.1,15270.0,United Kingdom,2025-08-12
496615,84596L,BISCUITS SMALL BOWL LIGHT BLUE,1,2.51,,United Kingdom,2025-08-12
496615,84791,GINGHAM HEART DECORATION,1,5.91,,United Kingdom,2025-08-12
496615,84789,ENCHANTED BIRD PLANT CAGE,1,7.62,,United Kingdom,2025-08-12
496615,84689,S/2 BEACH HUT TREASURE CHESTS,1,11.87,,United Kingdom,2025-08-12
496615,84598,BOYS ALPHABET IRON ON PATCHES,8,0.43,,United Kingdom,2025-08-12
496615,84682,CLASSICAL ROSE DISH,1,5.91,,United Kingdom,2025-08-12
496615,84673B,BLUE FLY SWAT,1,1.28,,United Kingdom,2025-08-12
496615,84836,ZINC METAL HEART DECORATION,1,2.51,,United Kingdom,2025-08-12
496615,84683,CLASSICAL ROSE CANDLESTAND,1,2.51,,United Kingdom,2025-08-12
496615,84926F,PSYCHEDELIC TILE COASTER,1,2.51,,United Kingdom,2025-08-12
496615,84984C,ORIENTAL BLUE C/COVER ,1,11.87,,United Kingdom,2025-08-12
496615,84971S,SMALL HEART FLOWERS HOOK ,1,1.66,,United Kingdom,2025-08-12
496615,84975,HEART SHAPED MIRROR,1,3.36,,United Kingdom,2025-08-12
496615,84596K,JELLY BABIES YELLOW SMALL BOWL,1,2.51,,United Kingdom,2025-08-12
496615,85015,SET OF 12  VINTAGE POSTCARD SET,1,2.51,,United Kingdom,2025-08-12
496615,85017A,ENVELOPE 50 ROMANTIC IMAGES,2,0.81,,United Kingdom,2025-08-12
496615,85017B,ENVELOPE 50 BLOSSOM IMAGES,1,0.81,,United Kingdom,2025-08-12
496615,85017C,ENVELOPE 50 CURIOUS IMAGES,1,0.81,,United Kingdom,2025-08-12
496615,85020,ROUND PINK HEART MIRROR,1,4.21,,United Kingdom,2025-08-12
496615,85031A,ROMANTIC IMAGES SCRAP BOOK SET,2,3.36,,United Kingdom,2025-08-12
496615,84971L,LARGE HEART FLOWERS HOOK   ,1,2.51,,United Kingdom,2025-08-12
496615,84596J,MIXED NUTS LIGHT GREEN BOWL,2,2.51,,United Kingdom,2025-08-12
496615,82613D,METAL SIGN CUPCAKE SINGLE HOOK,1,2.51,,United Kingdom,2025-08-12
496615,84270,ASSTD DESIGN BUBBLE GUM RING,3,0.43,,United Kingdom,2025-08-12
496615,21303,FILIGREE WALL MIRROR  ANTIQUE WHITE,1,34.0,,United Kingdom,2025-08-12
496615,47566B,TEA TIME PARTY BUNTING,3,4.65,,United Kingdom,2025-08-12
496615,48194,DOOR MAT HEARTS,1,13.57,,United Kingdom,2025-08-12
496615,48197,DOOR MAT BIRD ON THE WIRE,1,13.57,,United Kingdom,2025-08-12
496615,72351A,SET/6 TURQUOISE BUTTERFLY T-LIGHTS,1,4.21,,United Kingdom,2025-08-12
496615,72351B,SET/6 PINK  BUTTERFLY T-LIGHTS,1,4.21,,United Kingdom,2025-08-12
496615,75049L,LARGE CIRCULAR MIRROR MOBILE,1,2.51,,United Kingdom,2025-08-12
496615,79029,GLASS HONEYPOT WASP CATCHER,1,4.21,,United Kingdom,2025-08-12
496615,79160,HEART SHAPE WIRELESS DOORBELL,1,3.36,,United Kingdom,2025-08-12
496615,79190A,RETRO PLASTIC 70'S TRAY,1,0.81,,United Kingdom,2025-08-12
496615,79190B,RETRO PLASTIC POLKA TRAY,1,0.81,,United Kingdom,2025-08-12
496615,79323S, SILVER CHERRY LIGHTS,1,13.57,,United Kingdom,2025-08-12
496615,82011A,"BATHROOM SCALES, TROPICAL BEACH",1,7.62,,United Kingdom,2025-08-12
496615,82011B,BATHROOM SCALES RUBBER DUCKS,1,7.62,,United Kingdom,2025-08-12
496615,82578,KITCHEN METAL SIGN,2,1.28,,United Kingdom,2025-08-12
496615,82580,BATHROOM METAL SIGN,2,1.28,,United Kingdom,2025-08-12
496615,82583,HOT BATHS METAL SIGN,1,4.21,,United Kingdom,2025-08-12
496615,82607A,GLASS BONBON JAR PARFUME AUX FLEURE,1,2.51,,United Kingdom,2025-08-12
496615,82613A,"METAL SIGN,CUPCAKE SINGLE HOOK",1,2.51,,United Kingdom,2025-08-12
496615,85031C,CURIOUS IMAGES SCRAP BOOK SET,1,3.36,,United Kingdom,2025-08-12
496615,84029G,KNITTED UNION FLAG HOT WATER BOTTLE,1,7.62,,United Kingdom,2025-08-12
496615,84580,MOUSE TOY WITH PINK T-SHIRT,1,4.21,,United Kingdom,2025-08-12
496615,85059,FRENCH ENAMEL WATER BASIN,1,7.62,,United Kingdom,2025-08-12
496615,21390,FILIGRIS HEART WITH BUTTERFLY,1,2.51,,United Kingdom,2025-08-12
496615,85066,CREAM SWEETHEART MINI CHEST,1,25.49,,United Kingdom,2025-08-12
496615,35810A,ENAMEL PINK COFFEE CONTAINER,1,4.21,,United Kingdom,2025-08-12
496615,35824B,"HANGING FLOWERS+MIRROR,BLUE",1,2.98,,United Kingdom,2025-08-12
496615,35972,DAISY FOLKART HEART DECORATION,1,2.51,,United Kingdom,2025-08-12
496615,37340,MULTICOLOUR SPRING FLOWER MUG,1,8.47,,United Kingdom,2025-08-12
496615,37482P,CUBIC MUG PINK POLKA DOT,1,16.98,,United Kingdom,2025-08-12
496615,40018F,CHERRY DESIGN PAPERLANTERNS,1,4.21,,United Kingdom,2025-08-12
496615,40046A,RED DAISY PAPER LAMPSHADE,1,2.51,,United Kingdom,2025-08-12
496615,46775E,CANDY POP CHUNKY KNITTED THROW ,1,11.02,,United Kingdom,2025-08-12
496615,46776A,WOVEN BUBBLE GUM CUSHION COVER,2,4.21,,United Kingdom,2025-08-12
496615,46776B,WOVEN BERRIES CUSHION COVER ,1,4.21,,United Kingdom,2025-08-12
496615,17129D,CLEAR COLOUR GLASS GEMS IN BAG,10,1.66,,United Kingdom,2025-08-12
496615,20682,RED SPOTTY CHILDS UMBRELLA,1,6.77,,United Kingdom,2025-08-12
496615,20685,DOOR MAT RED SPOT,1,13.57,,United Kingdom,2025-08-12
496615,20700,GREEN CAT FLORAL CUSHION COVER ,1,10.17,,United Kingdom,2025-08-12
496615,20712,JUMBO BAG WOODLAND ANIMALS,1,4.21,,United Kingdom,2025-08-12
496615,20718,RED SPOTTY SHOPPER BAG,1,2.51,,United Kingdom,2025-08-12
496615,20724,RED SPOTTY CHARLOTTE BAG,1,1.66,,United Kingdom,2025-08-12
496615,20725,LUNCH BAG RED SPOTTY,1,4.21,,United Kingdom,2025-08-12
496615,20829,GLITTER HANGING BUTTERFLY STRING,1,4.21,,United Kingdom,2025-08-12
496615,20748,KENSINGTON COFFEE SET,13,8.47,,United Kingdom,2025-08-12
496615,DOT,DOTCOM POSTAGE,1,180.37,,United Kingdom,2025-08-12
496615,35096A,BLUE VICTORIAN FABRIC HEART BOX,1,0.84,,United Kingdom,2025-08-12
496615,85061W,WHITE JEWELLED HEART DECORATION,4,1.66,,United Kingdom,2025-08-12
496615,48187,DOOR MAT NEW ENGLAND,1,13.57,,United Kingdom,2025-08-12
496615,48111,DOOR MAT 3 SMILEY CATS,1,13.57,,United Kingdom,2025-08-12
496615,85086A,CANDY SPOT HEART DECORATION,1,1.66,,United Kingdom,2025-08-12
496615,21330,WOODLAND ANIMAL  WRITING SET ,1,3.36,,United Kingdom,2025-08-12
496615,21408,SPOTTY PINK DUCK DOORSTOP,1,8.47,,United Kingdom,2025-08-12
496615,21414,SCALLOP SHELL SOAP DISH,1,4.21,,United Kingdom,2025-08-12
496615,21429,RED GINGHAM ROSE JEWELLERY BOX,1,3.36,,United Kingdom,2025-08-12
496615,21486,PINK HEART DOTS HOT WATER BOTTLE,1,4.21,,United Kingdom,2025-08-12
496615,21507,"ELEPHANT, BIRTHDAY CARD, ",1,0.85,,United Kingdom,2025-08-12
496615,20914,SET/5 RED SPOTTY LID GLASS BOWLS,1,5.91,,United Kingdom,2025-08-12
496615,20971,PINK BLUE FELT CRAFT TRINKET BOX,1,2.51,,United Kingdom,2025-08-12
496615,21035,SET/2 RED SPOTTY TEA TOWELS ,1,5.91,,United Kingdom,2025-08-12
496615,21154,RED SPOTTY OVEN GLOVE ,2,2.51,,United Kingdom,2025-08-12
496615,21157,RED SPOTTY WASHBAG,1,4.21,,United Kingdom,2025-08-12
496615,21174,POTTERING IN THE SHED METAL SIGN,2,4.21,,United Kingdom,2025-08-12
496615,21175,GIN + TONIC DIET METAL SIGN,1,4.21,,United Kingdom,2025-08-12
496615,21179,NO JUNK MAIL METAL SIGN,1,3.36,,United Kingdom,2025-08-12
496615,21216,"SET 3 RED SPOT TIN TEA,COFFEE,SUGAR",1,11.02,,United Kingdom,2025-08-12
496615,21232,STRAWBERRY CERAMIC TRINKET BOX,1,2.51,,United Kingdom,2025-08-12
496615,21247,SET OF RED SALAD SERVERS ,1,3.36,,United Kingdom,2025-08-12
496615,21255,"FRENCH BOTTLE , LAVENDER",1,3.36,,United Kingdom,2025-08-12
496615,46776D,WOVEN SUNSET CUSHION COVER ,1,4.21,,United Kingdom,2025-08-12
496615,46776F,WOVEN ROSE GARDEN CUSHION COVER ,1,4.21,,United Kingdom,2025-08-12
496615,48138,DOOR MAT UNION FLAG,1,13.57,,United Kingdom,2025-08-12
496615,90209B,GREEN ENAMEL+GLASS HAIR COMB,1,2.11,,United Kingdom,2025-08-12
496615,20730,STRAWBERRY CANDY BAG,1,0.85,,United Kingdom,2025-08-12
496615,90200D,PINK SWEETHEART BRACELET,1,4.24,,United Kingdom,2025-08-12
496615,22156,HEART DECORATION WITH PEARLS ,1,1.66,,United Kingdom,2025-08-12
496615,22173,METAL 4 HOOK HANGER FRENCH CHATEAU,1,5.91,,United Kingdom,2025-08-12
496615,22177,5 HOOK BLACKBOARD ORGANISER ,1,21.23,,United Kingdom,2025-08-12
496615,22185,SLATE TILE NATURAL HANGING,1,3.36,,United Kingdom,2025-08-12
496615,22195,LARGE HEART MEASURING SPOONS,1,3.36,,United Kingdom,2025-08-12
496615,22196,SMALL HEART MEASURING SPOONS,2,1.66,,United Kingdom,2025-08-12
496615,22197,"POPCORN HOLDER , SMALL ",3,1.66,,United Kingdom,2025-08-12
496615,22203,MILK PAN RED RETROSPOT,1,7.62,,United Kingdom,2025-08-12
496615,22219,LOVEBIRD HANGING DECORATION WHITE ,2,1.66,,United Kingdom,2025-08-12
496615,22227,"DECORATION, HANGING HEART+MIRROR ",1,1.28,,United Kingdom,2025-08-12
496615,22249,DECORATION WHITE CHICK MAGIC GARDEN,1,1.66,,United Kingdom,2025-08-12
496615,22250,DECORATION  BUTTERFLY  MAGIC GARDEN,1,1.66,,United Kingdom,2025-08-12
496615,22254,FELT TOADSTOOL LARGE,1,2.51,,United Kingdom,2025-08-12
496615,22255,FELT TOADSTOOL  SMALL,1,1.66,,United Kingdom,2025-08-12
496615,22258,FELT FARM ANIMAL RABBIT,1,2.51,,United Kingdom,2025-08-12
496615,22294,HEART FILIGREE DOVE  SMALL,1,2.51,,United Kingdom,2025-08-12
496615,22297,HEART IVORY TRELLIS SMALL,2,2.51,,United Kingdom,2025-08-12
496615,22328,ROUND SNACK BOXES SET OF 4 FRUITS ,2,5.91,,United Kingdom,2025-08-12
496615,22329,ROUND CONTAINER SET OF 5 RETROSPOT,1,3.36,,United Kingdom,2025-08-12
496615,22335,HEART DECORATION PAINTED ZINC ,1,1.28,,United Kingdom,2025-08-12
496615,22341,LOVE GARLAND PAINTED ZINC ,1,3.36,,United Kingdom,2025-08-12
496615,22149,FELTCRAFT 6 FLOWER FRIENDS,2,4.21,,United Kingdom,2025-08-12
496615,22342,HOME GARLAND PAINTED ZINC ,1,3.36,,United Kingdom,2025-08-12
496615,22134,LADLE LOVE HEART RED ,1,0.85,,United Kingdom,2025-08-12
496615,22122,SET OF 2 FANCY FONT TEA TOWELS,1,5.91,,United Kingdom,2025-08-12
496615,90201B,BLACK ENAMEL FLOWER RING,1,2.96,,United Kingdom,2025-08-12
496615,85098B,BLUE FLYING SINGING CANARY,1,7.62,,United Kingdom,2025-08-12
496615,85129A,"WHITE PEARL BEADED HEART, SMALL",1,2.51,,United Kingdom,2025-08-12
496615,85129D,BEADED CRYSTAL HEART PINK SMALL,1,2.51,,United Kingdom,2025-08-12
496615,85159B,"WHITE TEA,COFFEE,SUGAR JARS",1,12.72,,United Kingdom,2025-08-12
496615,85180B,PINK HEARTS LIGHT CHAIN ,1,9.32,,United Kingdom,2025-08-12
496615,21948,SET OF 6 CAKE CHOPSTICKS,1,2.51,,United Kingdom,2025-08-12
496615,21972,SET OF 36 DINOSAUR PAPER DOILIES,1,2.98,,United Kingdom,2025-08-12
496615,21975,PACK OF 60 DINOSAUR CAKE CASES,1,1.28,,United Kingdom,2025-08-12
496615,21977,PACK OF 60 PINK PAISLEY CAKE CASES,1,1.28,,United Kingdom,2025-08-12
496615,21980,PACK OF 12 RED SPOTTY TISSUES ,1,0.81,,United Kingdom,2025-08-12
496615,22024,RAINY LADIES BIRTHDAY CARD,1,0.85,,United Kingdom,2025-08-12
496615,22026,BANQUET BIRTHDAY  CARD  ,2,0.85,,United Kingdom,2025-08-12
496615,22030,SWALLOWS GREETING CARD,1,0.85,,United Kingdom,2025-08-12
496615,22032,BOTANICAL LILY GREETING CARD,1,0.85,,United Kingdom,2025-08-12
496615,22055,MINI CAKE STAND  HANGING STRAWBERY,1,3.36,,United Kingdom,2025-08-12
496615,22066,LOVE HEART TRINKET POT,1,3.36,,United Kingdom,2025-08-12
496615,22073,RETRO SPOT STORAGE JAR,1,7.62,,United Kingdom,2025-08-12
496615,22107,PIZZA PLATE IN BOX,1,7.62,,United Kingdom,2025-08-12
496615,22111,SCOTTIE DOG HOT WATER BOTTLE,1,11.02,,United Kingdom,2025-08-12
496615,22114,HOT WATER BOTTLE TEA AND SYMPATHY,2,8.47,,United Kingdom,2025-08-12
496615,22131,FOOD CONTAINER SET 3 LOVE HEART ,1,4.21,,United Kingdom,2025-08-12
496615,22350,CAT BOWL ,1,5.06,,United Kingdom,2025-08-12
496615,22053,EMPIRE DESIGN ROSETTE,1,2.51,,United Kingdom,2025-08-12
496615,22356,"CHARLOTTE BAG , PINK/WHITE SPOTS",1,1.66,,United Kingdom,2025-08-12
496615,21687,SILVER PLATE CANDLE BOWL LARGE,1,8.47,,United Kingdom,2025-08-12
496615,21773,DECORATIVE ROSE BATHROOM BOTTLE,1,2.51,,United Kingdom,2025-08-12
496615,21774,DECORATIVE CATS BATHROOM BOTTLE,1,2.51,,United Kingdom,2025-08-12
496615,21784,SHOE SHINE BOX ,2,21.23,,United Kingdom,2025-08-12
496615,21875,KINGS CHOICE MUG,1,3.36,,United Kingdom,2025-08-12
496615,21876,POTTERING MUG,1,3.36,,United Kingdom,2025-08-12
496615,21877,HOME SWEET HOME MUG,1,3.36,,United Kingdom,2025-08-12
496615,21900,"KEY FOB , SHED",3,1.66,,United Kingdom,2025-08-12
496615,21901,"KEY FOB , BACK DOOR ",1,1.66,,United Kingdom,2025-08-12
496615,21906,PHARMACIE FIRST AID TIN,1,13.57,,United Kingdom,2025-08-12
496615,21916,SET 12 RETRO WHITE CHALK STICKS,1,0.81,,United Kingdom,2025-08-12
496615,21934,SKULL SHOULDER BAG,1,3.36,,United Kingdom,2025-08-12
496615,21943,CAKES AND RABBITS DESIGN FLANNEL ,2,0.85,,United Kingdom,2025-08-12
496615,85199S,SMALL HANGING IVORY/RED WOOD BIRD,3,0.81,,United Kingdom,2025-08-12
496615,85213,MINI  ZINC GARDEN DECORATIONS ,1,1.66,,United Kingdom,2025-08-12
496615,85222,ASSORTED COLOUR SILK COSMETIC PURSE,1,4.21,,United Kingdom,2025-08-12
496615,90013A,MIDNIGHT BLUE VINTAGE EARRINGS,1,3.81,,United Kingdom,2025-08-12
496615,90019A,SILVER M.O.P ORBIT BRACELET,1,5.51,,United Kingdom,2025-08-12
496615,90019C,SILVER BLACK ORBIT BRACELET,1,5.51,,United Kingdom,2025-08-12
496615,90147,CHUNKY SILVER NECKLACE PASTEL FLOWE,1,10.62,,United Kingdom,2025-08-12
496615,22355,"CHARLOTTE BAG , SUKI DESIGN",2,1.66,,United Kingdom,2025-08-12
496615,21669,BLUE STRIPE CERAMIC DRAWER KNOB,3,2.51,,United Kingdom,2025-08-12
496615,21665,TRIANGULAR RIDGED GLASS POSY HOLDER,1,1.66,,United Kingdom,2025-08-12
496615,21829,DINOSAUR KEYRINGS ASSORTED,1,0.43,,United Kingdom,2025-08-12
496615,21564,PINK  HEART SHAPE LOVE BUCKET ,1,5.91,,United Kingdom,2025-08-12
496615,22358,KINGS CHOICE TEA CADDY ,2,5.91,,United Kingdom,2025-08-12
496615,22377,BOTTLE BAG RETROSPOT ,1,4.21,,United Kingdom,2025-08-12
496615,22378,WALL TIDY RETROSPOT ,2,4.21,,United Kingdom,2025-08-12
496615,22379,RECYCLING BAG RETROSPOT ,2,4.21,,United Kingdom,2025-08-12
496615,22380,TOY TIDY SPACEBOY  ,1,4.21,,United Kingdom,2025-08-12
496615,21647,ASSORTED TUTTI FRUTTI LARGE PURSE,1,4.21,,United Kingdom,2025-08-12
496615,22383,LUNCH BAG SUKI  DESIGN ,2,3.36,,United Kingdom,2025-08-12
496615,22386,JUMBO BAG PINK WITH WHITE SPOTS,1,4.21,,United Kingdom,2025-08-12
496615,22411,JUMBO SHOPPER VINTAGE RED PAISLEY,2,4.21,,United Kingdom,2025-08-12
496615,22414,DOOR MAT NEIGHBOURHOOD WITCH ,1,13.57,,United Kingdom,2025-08-12
496615,22416,36 DOILIES SPACEBOY DESIGN ,1,2.98,,United Kingdom,2025-08-12
496615,22382,LUNCH BAG SPACEBOY DESIGN ,1,3.36,,United Kingdom,2025-08-12
496615,22499,WOODEN UNION JACK BUNTING,1,12.72,,United Kingdom,2025-08-12
496615,22500,SET OF 2 TINS JARDIN DE PROVENCE,1,12.72,,United Kingdom,2025-08-12
496615,35004C,SET OF 3 COLOURED  FLYING DUCKS,1,12.72,,United Kingdom,2025-08-12
496615,21509,COWBOYS AND INDIANS BIRTHDAY CARD ,1,0.85,,United Kingdom,2025-08-12
496615,21519,GIN & TONIC DIET GREETING CARD ,2,0.85,,United Kingdom,2025-08-12
496615,21523,DOOR MAT FANCY FONT HOME SWEET HOME,1,13.57,,United Kingdom,2025-08-12
496615,21534,DAIRY MAID LARGE MILK JUG,1,10.17,,United Kingdom,2025-08-12
496615,21556,CERAMIC STRAWBERRY MONEY BOX,1,5.06,,United Kingdom,2025-08-12
496615,21563,RED HEART SHAPE LOVE BUCKET ,1,5.91,,United Kingdom,2025-08-12
496615,22417,PACK OF 60 SPACEBOY CAKE CASES,1,1.28,,United Kingdom,2025-08-12
496616,22353,LUNCHBOX WITH CUTLERY FAIRY CAKES ,6,2.55,12682.0,France,2025-08-12
496616,21559,STRAWBERRY LUNCHBOX WITH CUTLERY,6,2.55,12682.0,France,2025-08-12
496616,22326,ROUND SNACK BOXES SET OF4 WOODLAND ,12,2.95,12682.0,France,2025-08-12
496616,22328,ROUND SNACK BOXES SET OF 4 FRUITS ,12,2.95,12682.0,France,2025-08-12
496616,22262,FELT EGG COSY CHICKEN,12,0.85,12682.0,France,2025-08-12
496616,47566,PARTY BUNTING,5,4.65,12682.0,France,2025-08-12
496616,21746,SMALL RED SPOT  WINDMILL,12,1.25,12682.0,France,2025-08-12
496616,35095A,BLUE VICTORIAN FABRIC OVAL BOX,24,0.42,12682.0,France,2025-08-12
496616,35095B,RED VICTORIAN FABRIC OVAL BOX,24,0.42,12682.0,France,2025-08-12
496616,22254,FELT TOADSTOOL LARGE,12,1.25,12682.0,France,2025-08-12
496616,POST,POSTAGE,4,18.0,12682.0,France,2025-08-12
496616,10002,INFLATABLE POLITICAL GLOBE ,12,0.85,12682.0,France,2025-08-12
496616,21700,BIG DOUGHNUT FRIDGE MAGNETS,12,0.85,12682.0,France,2025-08-12
496616,21054,NURSE'S BAG SOFT TOY,6,8.95,12682.0,France,2025-08-12
496616,22352,LUNCHBOX WITH CUTLERY RETROSPOT ,6,2.55,12682.0,France,2025-08-12
496616,84691,PACK 20 DOLLY PEGS,12,0.85,12682.0,France,2025-08-12
496616,22090,PAPER BUNTING RETRO SPOTS,6,2.95,12682.0,France,2025-08-12
496616,20749,ASSORTED COLOUR MINI CASES,4,7.95,12682.0,France,2025-08-12
496616,15056BL,EDWARDIAN PARASOL BLACK,12,5.95,12682.0,France,2025-08-12
496616,15056N,EDWARDIAN PARASOL NATURAL,3,5.95,12682.0,France,2025-08-12
496616,20679,EDWARDIAN PARASOL RED,3,5.95,12682.0,France,2025-08-12
496616,20750, RED/WHITE DOT MINI CASES,6,7.95,12682.0,France,2025-08-12
496616,22322,BIRD DECORATION GREEN  SPOT,12,0.85,12682.0,France,2025-08-12
496616,22382,LUNCHBAG SPACEBOY DESIGN ,10,1.65,12682.0,France,2025-08-12
496616,21121,SET/10 RED SPOTTY PARTY CANDLES,24,1.25,12682.0,France,2025-08-12
496616,20725,LUNCH BAG RED SPOTTY,20,1.65,12682.0,France,2025-08-12
496616,22383,LUNCHBAG SUKI  DESIGN ,10,1.65,12682.0,France,2025-08-12
496616,22384,LUNCHBAG PINK RETROSPOT,10,1.65,12682.0,France,2025-08-12
496616,21039,RED SPOTTY SHOPPING BAG,12,2.55,12682.0,France,2025-08-12
496617,22242,"HOOK, 5 HANGER , MAGIC TOADSTOOL",24,1.65,12805.0,Netherlands,2025-08-12
496617,22243,"HOOK, 5 HANGER ,MAGIC TOADSTOOL RED",12,1.65,12805.0,Netherlands,2025-08-12
496617,20685,RED SPOTTY COIR DOORMAT,10,5.95,12805.0,Netherlands,2025-08-12
496617,85097B,BLUE ROCKING SINGING CANARY,12,3.75,12805.0,Netherlands,2025-08-12
496617,22326,ROUND SNACK BOXES SET OF4 WOODLAND ,6,2.95,12805.0,Netherlands,2025-08-12
496617,22366,DOORMAT AIRMAIL ,4,6.75,12805.0,Netherlands,2025-08-12
496617,21080,SET/20 RED SPOTTY PAPER NAPKINS ,12,0.85,12805.0,Netherlands,2025-08-12
496617,POST,POSTAGE,2,15.0,12805.0,Netherlands,2025-08-12
496617,21481,FAWN BLUE HOT WATER BOTTLE,6,2.95,12805.0,Netherlands,2025-08-12
496619,21479,,-1,0.0,,United Kingdom,2025-08-12
496618,22355,"CHARLOTTE BAG , SUKI DESIGN",20,0.85,12510.0,Spain,2025-08-12
496620,21479,,2,0.0,,United Kingdom,2025-08-12
496622,21551,,1,0.0,,United Kingdom,2025-08-12
C496621,21935,SUKI  SHOULDER BAG,-20,1.65,12510.0,Spain,2025-08-12
496623,22030,SWALLOWS GREETING CARD,24,0.42,15497.0,United Kingdom,2025-08-12
496623,22028,PENNY FARTHING BIRTHDAY CARD,24,0.42,15497.0,United Kingdom,2025-08-12
496623,22024,RAINY LADIES BIRTHDAY CARD,24,0.42,15497.0,United Kingdom,2025-08-12
496623,22026,BANQUET BIRTHDAY  CARD  ,24,0.42,15497.0,United Kingdom,2025-08-12
496623,85067,CREAM SWEETHEART WALL CABINET,3,16.95,15497.0,United Kingdom,2025-08-12
496623,85066,CREAM SWEETHEART MINI CHEST,16,10.95,15497.0,United Kingdom,2025-08-12
496623,22027,TEA PARTY BIRTHDAY CARD,24,0.42,15497.0,United Kingdom,2025-08-12
496623,84946,ANTIQUE SILVER TEA GLASS ETCHED,18,1.25,15497.0,United Kingdom,2025-08-12
496623,84879,ASSORTED COLOUR BIRD ORNAMENT,24,1.69,15497.0,United Kingdom,2025-08-12
496623,84837,WHITE SWEETHEARTS CABINET 4 DRAWERS,6,10.75,15497.0,United Kingdom,2025-08-12
496623,82494L,WOODEN FRAME ANTIQUE WHITE ,24,2.55,15497.0,United Kingdom,2025-08-12
496623,82486,WOOD S/3 CABINET ANT WHITE FINISH,16,6.95,15497.0,United Kingdom,2025-08-12
496623,84947,ANTIQUE SILVER TEA GLASS ENGRAVED,18,1.25,15497.0,United Kingdom,2025-08-12
496624,21561,DINOSAUR LUNCHBOX WITH CUTLERY,6,2.55,15321.0,United Kingdom,2025-08-12
496624,21828,EIGHT PIECE SNAKE  SET,12,1.25,15321.0,United Kingdom,2025-08-12
496624,21827,EIGHT PIECE CREEPY CRAWLIE SET,12,1.25,15321.0,United Kingdom,2025-08-12
496624,21826,EIGHT PIECE DINOSAUR SET,12,1.25,15321.0,United Kingdom,2025-08-12
496624,21213,PACK OF 72 SKULL CAKE CASES,24,0.55,15321.0,United Kingdom,2025-08-12
496624,21833,CAMOUFLAGE LED TORCH,12,1.69,15321.0,United Kingdom,2025-08-12
496624,20970,PINK FLORAL FELTCRAFT SHOULDER BAG,4,3.75,15321.0,United Kingdom,2025-08-12
496624,20727,LUNCH BAG  BLACK SKULL.,10,1.65,15321.0,United Kingdom,2025-08-12
496624,20725,LUNCH BAG RED SPOTTY,10,1.65,15321.0,United Kingdom,2025-08-12
496624,84077,WORLD WAR 2 GLIDERS ASSTD DESIGNS,48,0.21,15321.0,United Kingdom,2025-08-12
496624,20986,BLUE CALCULATOR RULER,12,1.25,15321.0,United Kingdom,2025-08-12
496624,21975,PACK OF 60 DINOSAUR CAKE CASES,24,0.55,15321.0,United Kingdom,2025-08-12
496624,22175,PINK OWL SOFT TOY,6,2.95,15321.0,United Kingdom,2025-08-12
496624,22149,FELTCRAFT 6 FLOWER FRIENDS,6,2.1,15321.0,United Kingdom,2025-08-12
496624,22417,PACK OF 60 SPACEBOY CAKE CASES,24,0.55,15321.0,United Kingdom,2025-08-12
496624,22382,LUNCHBAG SPACEBOY DESIGN ,10,1.65,15321.0,United Kingdom,2025-08-12
496624,22381,TOY TIDY PINK RETROSPOT  ,10,2.1,15321.0,United Kingdom,2025-08-12
496624,22380,TOY TIDY SPACEBOY  ,10,2.1,15321.0,United Kingdom,2025-08-12
496624,22367,CHILDS APRON SPACEBOY DESIGN,8,1.95,15321.0,United Kingdom,2025-08-12
496624,22138,BAKING SET 9 PIECE RETROSPOT ,6,4.95,15321.0,United Kingdom,2025-08-12
496624,22273,FELTCRAFT DOLL MOLLY,6,2.95,15321.0,United Kingdom,2025-08-12
496624,22272,FELTCRAFT DOLL MARIA,6,2.95,15321.0,United Kingdom,2025-08-12
496624,22179,SET 10 LIGHTS NIGHT OWL,2,6.75,15321.0,United Kingdom,2025-08-12
496624,22176,BLUE OWL SOFT TOY,6,2.95,15321.0,United Kingdom,2025-08-12
496624,22274,FELTCRAFT DOLL EMILY,6,2.95,15321.0,United Kingdom,2025-08-12
496625,22366,DOORMAT AIRMAIL ,20,5.95,14051.0,United Kingdom,2025-08-12
496625,48116,DOOR MAT MULTICOLOUR STRIPE,20,5.95,14051.0,United Kingdom,2025-08-12
496625,48138,DOOR MAT UNION FLAG,20,5.95,14051.0,United Kingdom,2025-08-12
496625,21355,TOAST ITS - I LOVE YOU ,18,1.25,14051.0,United Kingdom,2025-08-12
496625,21985,PACK OF 12 HEARTS DESIGN TISSUES ,48,0.29,14051.0,United Kingdom,2025-08-12
496625,20685,RED SPOTTY COIR DOORMAT,20,5.95,14051.0,United Kingdom,2025-08-12
496625,22048,BIRTHDAY BANQUET GIFT WRAP,50,0.42,14051.0,United Kingdom,2025-08-12
496625,22040,BOTANICAL ROSE GIFT WRAP,50,0.42,14051.0,United Kingdom,2025-08-12
496625,22030,SWALLOWS GREETING CARD,12,0.42,14051.0,United Kingdom,2025-08-12
496625,22026,BANQUET BIRTHDAY  CARD  ,24,0.42,14051.0,United Kingdom,2025-08-12
496625,22033,BOTANICAL ROSE GREETING CARD,12,0.42,14051.0,United Kingdom,2025-08-12
496625,21498,RED SPOTS  WRAP ,50,0.42,14051.0,United Kingdom,2025-08-12
496626,22411,JUMBO SHOPPER VINTAGE RED PAISLEY,20,1.95,13599.0,United Kingdom,2025-08-12
496626,21912,VINTAGE SNAKES & LADDERS,4,3.75,13599.0,United Kingdom,2025-08-12
496626,85099B,JUMBO BAG RED WHITE SPOTTY ,20,1.95,13599.0,United Kingdom,2025-08-12
496626,84946,ANTIQUE SILVER TEA GLASS ETCHED,72,1.06,13599.0,United Kingdom,2025-08-12
496626,84750A,PINK SMALL GLASS CAKE STAND,8,1.95,13599.0,United Kingdom,2025-08-12
496626,21314,SMALL GLASS HEART TRINKET POT,48,1.85,13599.0,United Kingdom,2025-08-12
496626,21875,KINGS CHOICE MUG,12,1.25,13599.0,United Kingdom,2025-08-12
496626,84406B,CREAM CUPID HEARTS COAT HANGER,8,3.25,13599.0,United Kingdom,2025-08-12
496626,21217,RED SPOTTY ROUND CAKE TINS,1,9.95,13599.0,United Kingdom,2025-08-12
496626,22382,LUNCHBAG SPACEBOY DESIGN ,20,1.65,13599.0,United Kingdom,2025-08-12
496626,84968A,S/16 VINTAGE ROSE CUTLERY,2,12.75,13599.0,United Kingdom,2025-08-12
496626,22386,JUMBO BAG PINK WITH WHITE SPOTS,100,1.65,13599.0,United Kingdom,2025-08-12
496626,84997D,PINK 3 PIECE MINI DOTS CUTLERY SET,6,3.75,13599.0,United Kingdom,2025-08-12
496626,21930,JUMBO STORAGE BAG SKULLS,10,1.95,13599.0,United Kingdom,2025-08-12
496626,85099F,JUMBO BAG STRAWBERRY,20,1.95,13599.0,United Kingdom,2025-08-12
496626,22379,RECYCLING BAG RETROSPOT ,50,1.85,13599.0,United Kingdom,2025-08-12
496626,22377,BOTTLE BAG RETROSPOT ,50,1.85,13599.0,United Kingdom,2025-08-12
496626,22348,TEA BAG PLATE RED SPOTTY ,12,0.85,13599.0,United Kingdom,2025-08-12
496626,21755,LOVE BUILDING BLOCK WORD,6,5.95,13599.0,United Kingdom,2025-08-12
496626,22169,FAMILY ALBUM WHITE PICTURE FRAME,2,7.65,13599.0,United Kingdom,2025-08-12
496626,21888,BINGO SET,4,3.75,13599.0,United Kingdom,2025-08-12
496626,22029,SPACE BOY BIRTHDAY CARD,12,0.42,13599.0,United Kingdom,2025-08-12
496626,22380,TOY TIDY SPACEBOY  ,20,2.1,13599.0,United Kingdom,2025-08-12
496626,22381,TOY TIDY PINK RETROSPOT  ,20,2.1,13599.0,United Kingdom,2025-08-12
496626,84879,ASSORTED COLOUR BIRD ORNAMENT,16,1.69,13599.0,United Kingdom,2025-08-12
496626,20712,JUMBO BAG WOODLAND ANIMALS,20,1.95,13599.0,United Kingdom,2025-08-12
496627,22224,WHITE LOVEBIRD LANTERN,6,2.95,14867.0,United Kingdom,2025-08-12
496627,22283,6 EGG HOUSE PAINTED WOOD,2,7.95,14867.0,United Kingdom,2025-08-12
496627,21474,SWEETHEART CREAM STEEL FOLDIN BENCH,2,19.95,14867.0,United Kingdom,2025-08-12
496627,84839,SWEETHEART KEY CABINET,2,6.75,14867.0,United Kingdom,2025-08-12
