Invoice,StockCode,Description,Quantity,Price,Customer ID,Country,InvoiceDate
516178,21242,RED SPOTTY PLATE ,8,1.69,14674.0,United Kingdom,2025-12-26
516178,71459,HANGING JAM JAR T-LIGHT HOLDER,12,0.85,14674.0,United Kingdom,2025-12-26
516178,20674,GREEN SPOTTY BOWL,8,1.25,14674.0,United Kingdom,2025-12-26
516178,20676,RED SPOTTY BOWL,8,1.25,14674.0,United Kingdom,2025-12-26
516178,21239,PINK  SPOTTY CUP,8,0.85,14674.0,United Kingdom,2025-12-26
516178,21240,BLUE  SPOTTY CUP,8,0.85,14674.0,United Kingdom,2025-12-26
516178,22379,RECYCLING BAG RETROSPOT ,5,2.1,14674.0,United Kingdom,2025-12-26
516178,22386,JUMBO BAG PINK WITH WHITE SPOTS,10,1.95,14674.0,United Kingdom,2025-12-26
516178,21243,PINK  SPOTTY PLATE ,8,1.69,14674.0,United Kingdom,2025-12-26
516178,21241,GREEN SPOTTY CUP,8,0.85,14674.0,United Kingdom,2025-12-26
516178,20675,BLUE SPOTTY BOWL,8,1.25,14674.0,United Kingdom,2025-12-26
516178,21621,VINTAGE UNION JACK BUNTING,2,8.5,14674.0,United Kingdom,2025-12-26
516178,47502,POLKADOT CUTLERY 24 PCS IN TRAY,2,12.75,14674.0,United Kingdom,2025-12-26
516178,21245,GREEN  SPOTTY PLATE ,8,1.69,14674.0,United Kingdom,2025-12-26
516179,22584,PACK OF 6 PANNETONE GIFT BOXES,12,2.55,17157.0,United Kingdom,2025-12-26
516179,22631,CIRCUS PARADE LUNCH BOX ,12,1.95,17157.0,United Kingdom,2025-12-26
516179,22659,LUNCH BOX I LOVE LONDON,12,1.95,17157.0,United Kingdom,2025-12-26
516179,82001S,VINYL RECORD FRAME SILVER,24,3.39,17157.0,United Kingdom,2025-12-26
516179,21137,BLACK RECORD COVER FRAME,48,3.39,17157.0,United Kingdom,2025-12-26
516179,22585,PACK OF 6 BIRDY GIFT TAGS,12,1.25,17157.0,United Kingdom,2025-12-26
C516180,22327,ROUND SNACK BOXES SET OF 4 SKULLS,-1,2.95,14546.0,United Kingdom,2025-12-26
C516180,21389,IVORY HANGING DECORATION  BIRD,-1,0.85,14546.0,United Kingdom,2025-12-26
516181,85064,CREAM SWEETHEART LETTER RACK,16,4.65,15291.0,United Kingdom,2025-12-26
516181,21624,VINTAGE UNION JACK DOORSTOP,3,5.95,15291.0,United Kingdom,2025-12-26
516181,85123A,WHITE HANGING HEART T-LIGHT HOLDER,32,2.55,15291.0,United Kingdom,2025-12-26
516181,15039,SANDALWOOD FAN,20,0.85,15291.0,United Kingdom,2025-12-26
516181,21672,WHITE SPOT RED CERAMIC DRAWER KNOB,24,1.25,15291.0,United Kingdom,2025-12-26
516181,21524,DOORMAT SPOTTY HOME SWEET HOME,10,6.35,15291.0,United Kingdom,2025-12-26
516181,84839,SWEETHEART KEY CABINET,10,5.55,15291.0,United Kingdom,2025-12-26
516182,22585,PACK OF 6 BIRDY GIFT TAGS,12,1.25,13078.0,United Kingdom,2025-12-26
516182,22430,ENAMEL WATERING CAN CREAM,4,4.95,13078.0,United Kingdom,2025-12-26
516182,21745,GAOLERS KEYS DECORATIVE GARDEN ,4,3.75,13078.0,United Kingdom,2025-12-26
516182,84763,ZINC FINISH 15CM PLANTER POTS,12,1.25,13078.0,United Kingdom,2025-12-26
516182,21714,CITRONELLA CANDLE GARDEN POT,12,1.25,13078.0,United Kingdom,2025-12-26
516182,84846A,SCENTED CANDLE IN DIGITALIS TIN,6,2.1,13078.0,United Kingdom,2025-12-26
516182,22487,WHITE WOOD GARDEN PLANT LADDER,4,8.5,13078.0,United Kingdom,2025-12-26
516182,84306,S/3 PINK SQUARE PLANTERS ROSES,2,10.95,13078.0,United Kingdom,2025-12-26
516182,22485,SET OF 2 WOODEN MARKET CRATES,2,12.75,13078.0,United Kingdom,2025-12-26
516182,82582,AREA PATROLLED METAL SIGN,12,2.1,13078.0,United Kingdom,2025-12-26
516182,46000M,POLYESTER FILLER PAD 45x45cm,4,1.55,13078.0,United Kingdom,2025-12-26
516182,22612,TEA COSY VINTAGE UNION JACK,4,3.75,13078.0,United Kingdom,2025-12-26
516182,84596L,BISCUITS SMALL BOWL LIGHT BLUE,8,1.25,13078.0,United Kingdom,2025-12-26
516182,84596F,SMALL MARSHMALLOWS PINK BOWL,8,1.25,13078.0,United Kingdom,2025-12-26
516182,84596J,MIXED NUTS LIGHT GREEN BOWL,8,1.25,13078.0,United Kingdom,2025-12-26
516182,85124A,PINK JUICY FRUIT PHOTO FRAME,6,2.55,13078.0,United Kingdom,2025-12-26
516182,21754,HOME BUILDING BLOCK WORD,3,5.95,13078.0,United Kingdom,2025-12-26
516182,21755,LOVE BUILDING BLOCK WORD,3,5.95,13078.0,United Kingdom,2025-12-26
516182,46000S,POLYESTER FILLER PAD 40x40cm,4,1.45,13078.0,United Kingdom,2025-12-26
516182,21622,VINTAGE UNION JACK CUSHION COVER,4,4.95,13078.0,United Kingdom,2025-12-26
516182,21621,VINTAGE UNION JACK BUNTING,12,8.5,13078.0,United Kingdom,2025-12-26
516183,15060B,FAIRY CAKE DESIGN UMBRELLA,4,3.75,15306.0,United Kingdom,2025-12-26
516183,22644,CERAMIC CHERRY CAKE MONEY BANK,12,1.45,15306.0,United Kingdom,2025-12-26
516183,21232,STRAWBERRY CERAMIC TRINKET BOX,12,1.25,15306.0,United Kingdom,2025-12-26
516183,21231,SWEETHEART CERAMIC TRINKET BOX,12,1.25,15306.0,United Kingdom,2025-12-26
516183,47556B,TEA TIME TEA TOWELS ,6,2.95,15306.0,United Kingdom,2025-12-26
516183,84987,SET OF 36 TEATIME PAPER DOILIES,12,1.45,15306.0,United Kingdom,2025-12-26
516183,22646,CERAMIC STRAWBERRY CAKE MONEY BANK,12,1.45,15306.0,United Kingdom,2025-12-26
516183,47590B,PINK HAPPY BIRTHDAY BUNTING,3,5.45,15306.0,United Kingdom,2025-12-26
516183,22492,MINI PAINT SET VINTAGE ,36,0.65,15306.0,United Kingdom,2025-12-26
516183,22251,BIRDHOUSE DECORATION MAGIC GARDEN,12,1.25,15306.0,United Kingdom,2025-12-26
516183,47591D,PINK FAIRY CAKE CHILDRENS APRON,8,1.95,15306.0,United Kingdom,2025-12-26
516183,15036,ASSORTED COLOURS SILK FAN,72,0.75,15306.0,United Kingdom,2025-12-26
516183,21188,3D HEARTS  HONEYCOMB PAPER GARLAND,12,2.95,15306.0,United Kingdom,2025-12-26
516183,85216,ASSORTED CAKES FRIDGE MAGNETS,12,0.65,15306.0,United Kingdom,2025-12-26
516183,37495,FAIRY CAKE BIRTHDAY CANDLE SET,4,3.75,15306.0,United Kingdom,2025-12-26
516183,84378,SET OF 3 HEART COOKIE CUTTERS,12,1.25,15306.0,United Kingdom,2025-12-26
516183,22139,RETRO SPOT TEA SET CERAMIC 11 PC ,3,4.95,15306.0,United Kingdom,2025-12-26
516183,22546,MINI JIGSAW PURDEY,48,0.42,15306.0,United Kingdom,2025-12-26
516183,22544,MINI JIGSAW SPACEBOY,48,0.42,15306.0,United Kingdom,2025-12-26
516183,22271,FELTCRAFT DOLL ROSIE,6,2.95,15306.0,United Kingdom,2025-12-26
516183,20970,PINK FLORAL FELTCRAFT SHOULDER BAG,4,3.75,15306.0,United Kingdom,2025-12-26
516183,85215,ASSORTED CHEESE FRIDGE MAGNETS,12,0.65,15306.0,United Kingdom,2025-12-26
516183,21106,CREAM SLICE FLANNEL CHOCOLATE SPOT ,6,2.95,15306.0,United Kingdom,2025-12-26
516183,21107,CREAM SLICE FLANNEL PINK SPOT ,6,2.95,15306.0,United Kingdom,2025-12-26
516183,21108,FAIRY CAKE FLANNEL ASSORTED COLOUR,9,2.55,15306.0,United Kingdom,2025-12-26
516183,22645,CERAMIC HEART FAIRY CAKE MONEY BANK,12,1.45,15306.0,United Kingdom,2025-12-26
516183,22061,LARGE CAKE STAND  HANGING STRAWBERY,2,9.95,15306.0,United Kingdom,2025-12-26
516183,21787,RAIN PONCHO WITH RED SPOTS,24,0.85,15306.0,United Kingdom,2025-12-26
516184,21792,CLASSIC FRENCH STYLE BASKET GREEN ,1,6.75,14343.0,United Kingdom,2025-12-26
516184,21114,LAVENDER SCENTED FABRIC HEART,15,1.25,14343.0,United Kingdom,2025-12-26
516184,85061W,WHITE JEWELLED HEART DECORATION,10,0.85,14343.0,United Kingdom,2025-12-26
516184,22575,METAL MERRY CHRISTMAS WREATH,6,1.95,14343.0,United Kingdom,2025-12-26
516184,22498,WOODEN REGATTA BUNTING,1,5.95,14343.0,United Kingdom,2025-12-26
516184,22156,HEART DECORATION WITH PEARLS ,15,0.85,14343.0,United Kingdom,2025-12-26
516184,22602,CHRISTMAS RETROSPOT HEART WOOD,10,0.85,14343.0,United Kingdom,2025-12-26
516184,22624,IVORY KITCHEN SCALES,1,8.5,14343.0,United Kingdom,2025-12-26
516184,82486,WOOD S/3 CABINET ANT WHITE FINISH,1,7.95,14343.0,United Kingdom,2025-12-26
516184,22219,LOVEBIRD HANGING DECORATION WHITE ,5,0.85,14343.0,United Kingdom,2025-12-26
516184,22469,HEART OF WICKER SMALL,2,1.65,14343.0,United Kingdom,2025-12-26
516184,21169,YOU'RE CONFUSING ME METAL SIGN ,1,1.69,14343.0,United Kingdom,2025-12-26
516184,21908,CHOCOLATE THIS WAY METAL SIGN,1,2.1,14343.0,United Kingdom,2025-12-26
516184,22188,BLACK HEART CARD HOLDER,1,3.95,14343.0,United Kingdom,2025-12-26
516184,84406B,CREAM CUPID HEARTS COAT HANGER,1,3.25,14343.0,United Kingdom,2025-12-26
516184,85123A,WHITE HANGING HEART T-LIGHT HOLDER,6,2.95,14343.0,United Kingdom,2025-12-26
516184,21232,STRAWBERRY CERAMIC TRINKET BOX,3,1.25,14343.0,United Kingdom,2025-12-26
516184,22591,CARDHOLDER GINGHAM CHRISTMAS TREE,2,2.55,14343.0,United Kingdom,2025-12-26
516184,82599,FANNY'S REST STOPMETAL SIGN,1,2.1,14343.0,United Kingdom,2025-12-26
516184,21904,HOUSE WRECKING METAL SIGN ,1,2.1,14343.0,United Kingdom,2025-12-26
516184,21907,I'M ON HOLIDAY METAL SIGN,1,2.1,14343.0,United Kingdom,2025-12-26
516184,82605,OLD DOC RUSSEL METAL SIGN,1,2.1,14343.0,United Kingdom,2025-12-26
516185,84990,60 GOLD AND SILVER FAIRY CAKE CASES,3,0.55,14546.0,United Kingdom,2025-12-26
516185,21212,PACK OF 72 RETRO SPOT CAKE CASES,5,0.55,14546.0,United Kingdom,2025-12-26
516185,21977,PACK OF 60 PINK PAISLEY CAKE CASES,5,0.55,14546.0,United Kingdom,2025-12-26
516185,84991,60 TEATIME FAIRY CAKE CASES,3,0.55,14546.0,United Kingdom,2025-12-26
516185,21975,PACK OF 60 DINOSAUR CAKE CASES,3,0.55,14546.0,United Kingdom,2025-12-26
516185,84978,HANGING HEART JAR T-LIGHT HOLDER,6,1.25,14546.0,United Kingdom,2025-12-26
516185,82494L,WOODEN FRAME ANTIQUE WHITE ,2,2.95,14546.0,United Kingdom,2025-12-26
516185,22152,PLACE SETTING WHITE STAR,10,0.42,14546.0,United Kingdom,2025-12-26
516185,22151,PLACE SETTING WHITE HEART,10,0.42,14546.0,United Kingdom,2025-12-26
516185,22212,FOUR HOOK  WHITE LOVEBIRDS,2,2.1,14546.0,United Kingdom,2025-12-26
516185,22173,METAL 4 HOOK HANGER FRENCH CHATEAU,1,2.95,14546.0,United Kingdom,2025-12-26
516185,22219,LOVEBIRD HANGING DECORATION WHITE ,5,0.85,14546.0,United Kingdom,2025-12-26
516185,21319,GLASS CHALICE GREEN  SMALL ,6,1.65,14546.0,United Kingdom,2025-12-26
516185,85214,TUB 24 PINK FLOWER PEGS,1,1.65,14546.0,United Kingdom,2025-12-26
516185,21121,SET/10 RED SPOTTY PARTY CANDLES,4,1.25,14546.0,United Kingdom,2025-12-26
516185,21455,PAINTED YELLOW WOODEN DAISY,2,0.85,14546.0,United Kingdom,2025-12-26
516185,21390,FILIGRIS HEART WITH BUTTERFLY,6,1.25,14546.0,United Kingdom,2025-12-26
516185,21454,PAINTED PINK RABBIT ,2,0.85,14546.0,United Kingdom,2025-12-26
516185,84836,ZINC METAL HEART DECORATION,2,1.25,14546.0,United Kingdom,2025-12-26
516185,21389,IVORY HANGING DECORATION  BIRD,6,0.85,14546.0,United Kingdom,2025-12-26
516185,21333,CLASSIC WHITE FRAME,4,2.95,14546.0,United Kingdom,2025-12-26
516185,21363,HOME SMALL WOOD LETTERS,2,4.95,14546.0,United Kingdom,2025-12-26
516185,22077,6 RIBBONS RUSTIC CHARM,2,1.65,14546.0,United Kingdom,2025-12-26
516185,85049H,URBAN BLACK RIBBONS ,2,1.25,14546.0,United Kingdom,2025-12-26
516185,85049G,CHOCOLATE BOX RIBBONS ,2,1.25,14546.0,United Kingdom,2025-12-26
516185,22074,6 RIBBONS SHIMMERING PINKS ,1,1.65,14546.0,United Kingdom,2025-12-26
516185,22078,RIBBON REEL LACE DESIGN ,2,2.1,14546.0,United Kingdom,2025-12-26
516185,21122,SET/10 PINK SPOTTY PARTY CANDLES,4,1.25,14546.0,United Kingdom,2025-12-26
516185,21124,SET/10 BLUE SPOTTY PARTY CANDLES,4,1.25,14546.0,United Kingdom,2025-12-26
516185,22228,BUNNY WOODEN PAINTED WITH BIRD ,2,0.85,14546.0,United Kingdom,2025-12-26
516185,82482,WOODEN PICTURE FRAME WHITE FINISH,2,2.55,14546.0,United Kingdom,2025-12-26
516185,35961,FOLKART ZINC HEART CHRISTMAS DEC,6,0.85,14546.0,United Kingdom,2025-12-26
516185,22457,NATURAL SLATE HEART CHALKBOARD ,2,2.95,14546.0,United Kingdom,2025-12-26
516185,22502,PICNIC BASKET WICKER SMALL,8,4.25,14546.0,United Kingdom,2025-12-26
516185,22557,PLASTERS IN TIN VINTAGE PAISLEY ,4,1.65,14546.0,United Kingdom,2025-12-26
516185,22185,SLATE TILE NATURAL HANGING,2,1.65,14546.0,United Kingdom,2025-12-26
516185,22555,PLASTERS IN TIN STRONGMAN,2,1.65,14546.0,United Kingdom,2025-12-26
516185,22556,PLASTERS IN TIN CIRCUS PARADE ,2,1.65,14546.0,United Kingdom,2025-12-26
516185,22553,PLASTERS IN TIN SKULLS,2,1.65,14546.0,United Kingdom,2025-12-26
516185,22501,PICNIC BASKET WICKER LARGE,2,9.95,14546.0,United Kingdom,2025-12-26
516185,21928,JUMBO BAG SCANDINAVIAN PAISLEY,1,1.95,14546.0,United Kingdom,2025-12-26
516185,22386,JUMBO BAG PINK WITH WHITE SPOTS,1,1.95,14546.0,United Kingdom,2025-12-26
516185,85099F,JUMBO BAG STRAWBERRY,1,1.95,14546.0,United Kingdom,2025-12-26
516185,21929,JUMBO BAG PINK VINTAGE PAISLEY,1,1.95,14546.0,United Kingdom,2025-12-26
516185,21932,SCANDINAVIAN PAISLEY PICNIC BAG,2,2.95,14546.0,United Kingdom,2025-12-26
516185,21933,PINK VINTAGE PAISLEY PICNIC BAG,2,2.95,14546.0,United Kingdom,2025-12-26
516185,21937,STRAWBERRY   PICNIC BAG,2,2.95,14546.0,United Kingdom,2025-12-26
516185,22554,PLASTERS IN TIN WOODLAND ANIMALS,2,1.65,14546.0,United Kingdom,2025-12-26
516185,22276,WASH BAG VINTAGE ROSE PAISLEY,2,2.55,14546.0,United Kingdom,2025-12-26
516185,21380,WOODEN HAPPY BIRTHDAY GARLAND,2,2.95,14546.0,United Kingdom,2025-12-26
516185,85123A,WHITE HANGING HEART T-LIGHT HOLDER,8,2.95,14546.0,United Kingdom,2025-12-26
516185,84946,ANTIQUE SILVER TEA GLASS ETCHED,6,1.25,14546.0,United Kingdom,2025-12-26
516185,21621,VINTAGE UNION JACK BUNTING,2,8.5,14546.0,United Kingdom,2025-12-26
516185,47590B,PINK HAPPY BIRTHDAY BUNTING,2,5.45,14546.0,United Kingdom,2025-12-26
516185,47589,CONGRATULATIONS BUNTING,2,5.45,14546.0,United Kingdom,2025-12-26
516185,22296,HEART IVORY TRELLIS LARGE,12,1.65,14546.0,United Kingdom,2025-12-26
516185,22382,LUNCH BAG SPACEBOY DESIGN ,1,1.65,14546.0,United Kingdom,2025-12-26
516185,20726,LUNCH BAG WOODLAND,1,1.65,14546.0,United Kingdom,2025-12-26
516185,20728,LUNCH BAG CARS BLUE,3,1.65,14546.0,United Kingdom,2025-12-26
516185,20725,LUNCH BAG RED SPOTTY,2,1.65,14546.0,United Kingdom,2025-12-26
516185,22383,LUNCH BAG SUKI  DESIGN ,1,1.65,14546.0,United Kingdom,2025-12-26
516185,20727,LUNCH BAG  BLACK SKULL.,2,1.65,14546.0,United Kingdom,2025-12-26
516185,22384,LUNCH BAG PINK RETROSPOT,3,1.65,14546.0,United Kingdom,2025-12-26
516186,20829,GLITTER HANGING BUTTERFLY STRING,16,2.1,18097.0,United Kingdom,2025-12-26
516186,21186,WHITE DOVE HONEYCOMB PAPER GARLAND,24,1.65,18097.0,United Kingdom,2025-12-26
516186,79029,GLASS HONEYPOT WASP CATCHER,18,1.95,18097.0,United Kingdom,2025-12-26
516186,22215,CAKE STAND WHITE TWO TIER LACE,6,8.5,18097.0,United Kingdom,2025-12-26
516186,22649,STRAWBERRY FAIRY CAKE TEAPOT,8,4.95,18097.0,United Kingdom,2025-12-26
516186,84520B,PACK 20 ENGLISH ROSE PAPER NAPKINS,12,0.85,18097.0,United Kingdom,2025-12-26
516186,84988,SET OF 72 PINK HEART PAPER DOILIES,24,1.45,18097.0,United Kingdom,2025-12-26
516186,22151,PLACE SETTING WHITE HEART,24,0.42,18097.0,United Kingdom,2025-12-26
516186,72351A,SET/6 TURQUOISE BUTTERFLY T-LIGHTS,12,2.1,18097.0,United Kingdom,2025-12-26
516186,21445,12 PINK ROSE PEG PLACE SETTINGS,12,1.25,18097.0,United Kingdom,2025-12-26
516186,21745,GAOLERS KEYS DECORATIVE GARDEN ,24,3.39,18097.0,United Kingdom,2025-12-26
516186,72351B,SET/6 PINK  BUTTERFLY T-LIGHTS,12,2.1,18097.0,United Kingdom,2025-12-26
516187,21207,SKULL AND CROSSBONES  GARLAND ,2,1.65,16089.0,United Kingdom,2025-12-26
516187,22606,WOODEN SKITTLES GARDEN SET,1,15.95,16089.0,United Kingdom,2025-12-26
516187,22249,DECORATION WHITE CHICK MAGIC GARDEN,3,0.85,16089.0,United Kingdom,2025-12-26
516187,21407,BROWN CHECK CAT DOORSTOP ,2,4.25,16089.0,United Kingdom,2025-12-26
516187,21590,KINGS CHOICE CIGAR BOX MATCHES ,2,1.25,16089.0,United Kingdom,2025-12-26
516187,79029,GLASS HONEYPOT WASP CATCHER,1,1.95,16089.0,United Kingdom,2025-12-26
516187,85198,ASSORTED FARMYARD ANIMALS IN BUCKET,12,0.85,16089.0,United Kingdom,2025-12-26
516187,21808,"CHRISTMAS GARLAND STARS,TREES",1,3.75,16089.0,United Kingdom,2025-12-26
516187,22501,PICNIC BASKET WICKER LARGE,1,9.95,16089.0,United Kingdom,2025-12-26
516187,21749,LARGE RED RETROSPOT WINDMILL,3,2.1,16089.0,United Kingdom,2025-12-26
516187,21746,SMALL RED RETROSPOT WINDMILL,3,1.25,16089.0,United Kingdom,2025-12-26
516187,21086,SET/6 RED SPOTTY PAPER CUPS,1,0.65,16089.0,United Kingdom,2025-12-26
516187,22158,3 HEARTS HANGING DECORATION RUSTIC,3,2.95,16089.0,United Kingdom,2025-12-26
516187,18097A,PINK TALL PORCELAIN T-LIGHT HOLDER ,3,2.55,16089.0,United Kingdom,2025-12-26
516187,18097C,WHITE TALL PORCELAIN T-LIGHT HOLDER,3,2.55,16089.0,United Kingdom,2025-12-26
516187,22464,HANGING METAL HEART LANTERN,2,1.65,16089.0,United Kingdom,2025-12-26
516187,22250,DECORATION  BUTTERFLY  MAGIC GARDEN,3,0.85,16089.0,United Kingdom,2025-12-26
516187,22320,BIRDS MOBILE VINTAGE DESIGN,1,5.95,16089.0,United Kingdom,2025-12-26
516187,22090,PAPER BUNTING RETRO SPOTS,1,2.95,16089.0,United Kingdom,2025-12-26
516187,21201,TROPICAL  HONEYCOMB PAPER GARLAND ,1,2.55,16089.0,United Kingdom,2025-12-26
516187,21808,"CHRISTMAS GARLAND STARS,TREES",3,3.75,16089.0,United Kingdom,2025-12-26
516187,22085,PAPER CHAIN KIT SKULLS ,1,2.95,16089.0,United Kingdom,2025-12-26
516187,21382,SET/4 SPRING FLOWER DECORATION,1,2.95,16089.0,United Kingdom,2025-12-26
516187,22595,CHRISTMAS GINGHAM HEART,12,0.85,16089.0,United Kingdom,2025-12-26
516187,22593,CHRISTMAS GINGHAM STAR,12,0.85,16089.0,United Kingdom,2025-12-26
516187,37495,FAIRY CAKE BIRTHDAY CANDLE SET,1,3.75,16089.0,United Kingdom,2025-12-26
516187,21205,MULTICOLOUR 3D BALLS GARLAND,1,2.55,16089.0,United Kingdom,2025-12-26
516188,21035,SET/2 RED SPOTTY TEA TOWELS ,6,2.95,14599.0,United Kingdom,2025-12-26
516188,22689,DOORMAT MERRY CHRISTMAS RED ,1,7.49,14599.0,United Kingdom,2025-12-26
516188,21811,CHRISTMAS HANGING HEART WITH BELL,12,1.25,14599.0,United Kingdom,2025-12-26
516188,21809,CHRISTMAS HANGING TREE WITH BELL,12,1.25,14599.0,United Kingdom,2025-12-26
516188,72586,"S/6 HALLOWEEN GHOST T LIGHTS, 5CM H",10,0.42,14599.0,United Kingdom,2025-12-26
516188,21210,SET OF 72 RETRO SPOT PAPER  DOILIES,12,1.45,14599.0,United Kingdom,2025-12-26
516188,85123A,WHITE HANGING HEART T-LIGHT HOLDER,6,2.95,14599.0,United Kingdom,2025-12-26
516188,22386,JUMBO BAG PINK WITH WHITE SPOTS,10,1.95,14599.0,United Kingdom,2025-12-26
516188,84839,SWEETHEART KEY CABINET,1,6.75,14599.0,United Kingdom,2025-12-26
516188,84839,SWEETHEART KEY CABINET,1,6.75,14599.0,United Kingdom,2025-12-26
516188,21669,BLUE STRIPE CERAMIC DRAWER KNOB,6,1.25,14599.0,United Kingdom,2025-12-26
516188,22179,SET 10 LIGHTS NIGHT OWL,2,6.75,14599.0,United Kingdom,2025-12-26
516188,22325,MOBILE VINTAGE HEARTS ,2,4.95,14599.0,United Kingdom,2025-12-26
516188,47590B,PINK HAPPY BIRTHDAY BUNTING,3,5.45,14599.0,United Kingdom,2025-12-26
516188,47589,CONGRATULATIONS BUNTING,2,5.45,14599.0,United Kingdom,2025-12-26
516189,21497,FANCY FONTS BIRTHDAY WRAP,25,0.42,12625.0,Germany,2025-12-26
516189,22030,SWALLOWS GREETING CARD,24,0.42,12625.0,Germany,2025-12-26
516189,21500,PINK SPOTS  WRAP ,25,0.42,12625.0,Germany,2025-12-26
516189,21499,BLUE SPOTS  WRAP,25,0.42,12625.0,Germany,2025-12-26
516189,21498,RED SPOTS  WRAP ,25,0.42,12625.0,Germany,2025-12-26
516189,85049C,ROMANTIC PINKS RIBBONS ,12,1.25,12625.0,Germany,2025-12-26
516189,85049F,BABY BOOM RIBBONS ,12,1.25,12625.0,Germany,2025-12-26
516189,85049D,BRIGHT BLUES RIBBONS ,12,1.25,12625.0,Germany,2025-12-26
516189,21506,"FANCY FONT BIRTHDAY CARD, ",24,0.42,12625.0,Germany,2025-12-26
516189,POST,POSTAGE,7,18.0,12625.0,Germany,2025-12-26
516189,85178,VICTORIAN SEWING KIT,12,1.25,12625.0,Germany,2025-12-26
516189,21937,STRAWBERRY   PICNIC BAG,10,2.95,12625.0,Germany,2025-12-26
516189,22045,SPACEBOY GIFT WRAP,25,0.42,12625.0,Germany,2025-12-26
516189,22242,"HOOK, 5 HANGER , MAGIC TOADSTOOL",12,1.65,12625.0,Germany,2025-12-26
516189,22037,ROBOT BIRTHDAY CARD,12,0.42,12625.0,Germany,2025-12-26
516189,22418,10 COLOUR SPACEBOY PEN,24,0.85,12625.0,Germany,2025-12-26
516189,21330,WOODLAND ANIMAL  WRITING SET ,12,1.65,12625.0,Germany,2025-12-26
516189,21249,WOODLAND  HEIGHT CHART STICKERS ,12,2.95,12625.0,Germany,2025-12-26
516189,22530,MAGIC DRAWING SLATE DOLLY GIRL ,48,0.42,12625.0,Germany,2025-12-26
516189,22534,MAGIC DRAWING SLATE SPACEBOY ,48,0.42,12625.0,Germany,2025-12-26
516189,22438,BALLOON ART MAKE YOUR OWN FLOWERS,10,1.95,12625.0,Germany,2025-12-26
516189,21559,STRAWBERRY LUNCH BOX WITH CUTLERY,24,2.55,12625.0,Germany,2025-12-26
516189,21561,DINOSAUR LUNCH BOX WITH CUTLERY,6,2.55,12625.0,Germany,2025-12-26
516189,22551,PLASTERS IN TIN SPACEBOY,24,1.65,12625.0,Germany,2025-12-26
516189,22554,PLASTERS IN TIN WOODLAND ANIMALS,24,1.65,12625.0,Germany,2025-12-26
516189,21431,GREEN GINGHAM FLOWER JEWELLERY BOX,8,1.65,12625.0,Germany,2025-12-26
516189,20726,LUNCH BAG WOODLAND,20,1.65,12625.0,Germany,2025-12-26
516189,22029,SPACEBOY BIRTHDAY CARD,24,0.42,12625.0,Germany,2025-12-26
516189,21429,RED GINGHAM ROSE JEWELLERY BOX,8,1.65,12625.0,Germany,2025-12-26
516189,85049B,LUSH GREENS RIBBONS,12,1.25,12625.0,Germany,2025-12-26
516189,22613,PACK OF 20 SPACEBOY NAPKINS,36,0.85,12625.0,Germany,2025-12-26
516189,21078,SET/20 STRAWBERRY PAPER NAPKINS ,12,0.85,12625.0,Germany,2025-12-26
516189,22382,LUNCH BAG SPACEBOY DESIGN ,20,1.65,12625.0,Germany,2025-12-26
516189,21380,WOODEN HAPPY BIRTHDAY GARLAND,18,2.95,12625.0,Germany,2025-12-26
516189,21122,SET/10 PINK SPOTTY PARTY CANDLES,24,1.25,12625.0,Germany,2025-12-26
516189,21124,SET/10 BLUE SPOTTY PARTY CANDLES,24,1.25,12625.0,Germany,2025-12-26
516189,22331,WOODLAND PARTY BAG + STICKER SET,16,1.65,12625.0,Germany,2025-12-26
516189,21188,3D HEARTS  HONEYCOMB PAPER GARLAND,12,2.95,12625.0,Germany,2025-12-26
516189,71459,HANGING JAM JAR T-LIGHT HOLDER,96,0.72,12625.0,Germany,2025-12-26
516189,84970S,HANGING HEART ZINC T-LIGHT HOLDER,24,0.85,12625.0,Germany,2025-12-26
516189,22326,ROUND SNACK BOXES SET OF4 WOODLAND ,12,2.95,12625.0,Germany,2025-12-26
516189,22328,ROUND SNACK BOXES SET OF 4 FRUITS ,12,2.95,12625.0,Germany,2025-12-26
516189,22352,LUNCH BOX WITH CUTLERY RETROSPOT ,12,2.55,12625.0,Germany,2025-12-26
516189,20751,FUNKY WASHING UP GLOVES ASSORTED,12,2.1,12625.0,Germany,2025-12-26
516189,84970L,SINGLE HEART ZINC T-LIGHT HOLDER,24,0.95,12625.0,Germany,2025-12-26
516189,21212,PACK OF 72 RETRO SPOT CAKE CASES,24,0.55,12625.0,Germany,2025-12-26
516189,22090,PAPER BUNTING RETRO SPOTS,12,2.95,12625.0,Germany,2025-12-26
516189,84992,72 SWEETHEART FAIRY CAKE CASES,24,0.55,12625.0,Germany,2025-12-26
516189,21080,SET/20 RED SPOTTY PAPER NAPKINS ,36,0.85,12625.0,Germany,2025-12-26
516189,21094,SET/6 RED SPOTTY PAPER PLATES,24,0.85,12625.0,Germany,2025-12-26
516189,21086,SET/6 RED SPOTTY PAPER CUPS,24,0.65,12625.0,Germany,2025-12-26
516189,85099B,JUMBO BAG RED RETROSPOT,10,1.95,12625.0,Germany,2025-12-26
516189,22333,RETRO SPORT PARTY BAG + STICKER SET,24,1.65,12625.0,Germany,2025-12-26
516189,21936,RED RETROSPOT PICNIC BAG,15,2.95,12625.0,Germany,2025-12-26
516189,20725,LUNCH BAG RED SPOTTY,20,1.65,12625.0,Germany,2025-12-26
516189,22416,36 DOILIES SPACEBOY DESIGN ,12,1.45,12625.0,Germany,2025-12-26
516189,22417,PACK OF 60 SPACEBOY CAKE CASES,24,0.55,12625.0,Germany,2025-12-26
516189,22635,CHILDS BREAKFAST SET DOLLY GIRL ,2,9.95,12625.0,Germany,2025-12-26
516189,22634,CHILDS BREAKFAST SET SPACEBOY ,2,9.95,12625.0,Germany,2025-12-26
