Invoice,StockCode,Description,Quantity,Price,Customer ID,Country,InvoiceDate
C501844,84770,ROUND GEORGIAN SILVER MIRROR,-6,2.95,17477.0,United Kingdom,2025-09-20
501845,21216,"SET 3 RED SPOT TIN TEA,COFFEE,SUGAR",4,4.95,17920.0,United Kingdom,2025-09-20
501845,22252,BIRDCAGE DECORATION TEALIGHT HOLDER,6,1.25,17920.0,United Kingdom,2025-09-20
501845,21218,RED SPOTTY BISCUIT TIN,6,3.75,17920.0,United Kingdom,2025-09-20
501845,84692,BOX OF 24 COCKTAIL PARASOLS,25,0.42,17920.0,United Kingdom,2025-09-20
501845,21366,MIRRORED WALL ART PHOTO FRAMES,1,4.25,17920.0,United Kingdom,2025-09-20
501845,22327,ROUND SNACK BOXES SET OF 4 SKULLS,2,2.95,17920.0,United Kingdom,2025-09-20
501845,47556B,TEA TIME TEA TOWELS ,2,2.95,17920.0,United Kingdom,2025-09-20
501845,47580,TEA TIME DES TEA COSY,1,2.55,17920.0,United Kingdom,2025-09-20
501845,21035,SET/2 RED SPOTTY TEA TOWELS ,20,2.95,17920.0,United Kingdom,2025-09-20
501845,22584,PACK OF 6 PANNETONE GIFT BOXES,6,2.55,17920.0,United Kingdom,2025-09-20
501845,22423,REGENCY CAKESTAND 3 TIER,4,12.75,17920.0,United Kingdom,2025-09-20
501845,22467,GUMBALL COAT RACK,36,2.1,17920.0,United Kingdom,2025-09-20
501845,20727,LUNCH BAG  BLACK SKULL.,100,1.45,17920.0,United Kingdom,2025-09-20
501845,22383,LUNCH BAG SUKI  DESIGN ,10,1.65,17920.0,United Kingdom,2025-09-20
501845,22417,PACK OF 60 SPACEBOY CAKE CASES,24,0.55,17920.0,United Kingdom,2025-09-20
501845,47566,PARTY BUNTING,4,4.65,17920.0,United Kingdom,2025-09-20
501845,47590A,BLUE HAPPY BIRTHDAY BUNTING,3,5.45,17920.0,United Kingdom,2025-09-20
501845,21733,RED HANGING HEART T-LIGHT HOLDER,32,2.55,17920.0,United Kingdom,2025-09-20
501845,47590B,PINK HAPPY BIRTHDAY BUNTING,3,5.45,17920.0,United Kingdom,2025-09-20
501845,22328,ROUND SNACK BOXES SET OF 4 FRUITS ,5,2.95,17920.0,United Kingdom,2025-09-20
501845,47559B,TEA TIME OVEN GLOVE,2,1.25,17920.0,United Kingdom,2025-09-20
501846,22259,FELT FARM ANIMAL HEN,2,1.25,17920.0,United Kingdom,2025-09-20
501846,22258,FELT FARM ANIMAL RABBIT,2,1.25,17920.0,United Kingdom,2025-09-20
501846,22254,FELT TOADSTOOL LARGE,4,1.25,17920.0,United Kingdom,2025-09-20
501846,22263,FELT EGG COSY LADYBIRD ,2,0.85,17920.0,United Kingdom,2025-09-20
501846,22256,FELT FARM ANIMAL CHICKEN,2,1.25,17920.0,United Kingdom,2025-09-20
501846,22264,FELT FARM ANIMAL WHITE BUNNY ,2,0.85,17920.0,United Kingdom,2025-09-20
501846,22260,FELT EGG COSY BLUE RABBIT ,2,0.85,17920.0,United Kingdom,2025-09-20
501847,21485,RED SPOT HEART HOT WATER BOTTLE,1,4.95,17243.0,United Kingdom,2025-09-20
501847,84836,ZINC METAL HEART DECORATION,12,1.25,17243.0,United Kingdom,2025-09-20
501847,18098C,PORCELAIN BUTTERFLY OIL BURNER,3,2.95,17243.0,United Kingdom,2025-09-20
501847,22250,DECORATION  BUTTERFLY  MAGIC GARDEN,15,0.85,17243.0,United Kingdom,2025-09-20
501847,75013B,"STRING OF 8 BUTTERFLIES,PINK",5,1.65,17243.0,United Kingdom,2025-09-20
501847,85206B,PINK FELT EASTER EGG BASKET,6,1.65,17243.0,United Kingdom,2025-09-20
501847,22021,BLUE FELT EASTER EGG BASKET,6,1.65,17243.0,United Kingdom,2025-09-20
501847,85205B,PINK FELT EASTER RABBIT GARLAND,14,2.55,17243.0,United Kingdom,2025-09-20
501847,18098C,PORCELAIN BUTTERFLY OIL BURNER,3,2.95,17243.0,United Kingdom,2025-09-20
501847,22423,REGENCY CAKESTAND 3 TIER,2,12.75,17243.0,United Kingdom,2025-09-20
501847,21484,CHICK GREY HOT WATER BOTTLE,1,3.45,17243.0,United Kingdom,2025-09-20
501847,22112,CHOCOLATE HOT WATER BOTTLE,1,4.95,17243.0,United Kingdom,2025-09-20
501847,21486,PINK HEART DOTS HOT WATER BOTTLE,1,3.75,17243.0,United Kingdom,2025-09-20
501847,22110,BIRD HOUSE HOT WATER BOTTLE,1,3.45,17243.0,United Kingdom,2025-09-20
501847,21034,REX CASH+CARRY JUMBO SHOPPER,1,0.95,17243.0,United Kingdom,2025-09-20
501847,85206A,CREAM FELT EASTER EGG BASKET,6,1.65,17243.0,United Kingdom,2025-09-20
501847,84219,BOX/12 MOTHER & CHICK IN BASKET/BOW,1,2.55,17243.0,United Kingdom,2025-09-20
501847,22657,HEN & 2 CHICKS IN BASKET,5,0.85,17243.0,United Kingdom,2025-09-20
501847,22423,REGENCY CAKESTAND 3 TIER,2,12.75,17243.0,United Kingdom,2025-09-20
501847,22269,EGG CUP NATURAL CHICKEN,16,1.25,17243.0,United Kingdom,2025-09-20
501847,17001,HEAVENS SCENT FRAGRANCE OILS ASSTD,36,0.29,17243.0,United Kingdom,2025-09-20
501847,85188B,PINK METAL SWINGING BUNNY,24,0.85,17243.0,United Kingdom,2025-09-20
501847,21383,PACK OF 12 STICKY BUNNIES,48,0.65,17243.0,United Kingdom,2025-09-20
501847,85200,BUNNY EGG BOX,12,1.25,17243.0,United Kingdom,2025-09-20
501847,22241,GARLAND WOODEN HAPPY EASTER,8,1.25,17243.0,United Kingdom,2025-09-20
501847,22251,BIRDHOUSE DECORATION MAGIC GARDEN,14,1.25,17243.0,United Kingdom,2025-09-20
501847,37502,TEA TIME MUG IN GIFT BOX,6,2.95,17243.0,United Kingdom,2025-09-20
501847,85188A,GREEN METAL SWINGING BUNNY,24,0.85,17243.0,United Kingdom,2025-09-20
501848,22220,CAKE STAND LOVEBIRD 2 TIER WHITE,2,9.95,13555.0,United Kingdom,2025-09-20
501848,21593,SWALLOW CIGAR BOX MATCHES ,24,1.25,13555.0,United Kingdom,2025-09-20
501848,21314,SMALL GLASS HEART TRINKET POT,48,1.85,13555.0,United Kingdom,2025-09-20
501848,22236,CAKE STAND 3 TIER MAGIC GARDEN,12,10.95,13555.0,United Kingdom,2025-09-20
501848,22138,BAKING SET 9 PIECE RETROSPOT ,6,4.95,13555.0,United Kingdom,2025-09-20
501848,20747,PICCADILLY TEA SET,2,14.95,13555.0,United Kingdom,2025-09-20
501848,21363,HOME SMALL WOOD LETTERS,3,4.95,13555.0,United Kingdom,2025-09-20
501848,84879,ASSORTED COLOUR BIRD ORNAMENT,8,1.69,13555.0,United Kingdom,2025-09-20
501848,85206A,CREAM FELT EASTER EGG BASKET,12,1.65,13555.0,United Kingdom,2025-09-20
501849,22329,ROUND CONTAINER SET OF 5 RETROSPOT,2,1.65,14451.0,United Kingdom,2025-09-20
501849,37508,NEW ENGLAND CERAMIC CAKE SERVER,2,2.55,14451.0,United Kingdom,2025-09-20
501849,21034,REX CASH+CARRY JUMBO SHOPPER,4,0.95,14451.0,United Kingdom,2025-09-20
501849,22090,PAPER BUNTING RETRO SPOTS,4,2.95,14451.0,United Kingdom,2025-09-20
501849,22176,BLUE OWL SOFT TOY,2,2.95,14451.0,United Kingdom,2025-09-20
501849,22473,TV DINNER TRAY VINTAGE PAISLEY,1,4.95,14451.0,United Kingdom,2025-09-20
501849,22475,SKULL DESIGN TV DINNER TRAY,1,4.95,14451.0,United Kingdom,2025-09-20
501849,21936,RED/WHITE SPOT PICNIC BAG,2,2.95,14451.0,United Kingdom,2025-09-20
501849,21932,SCANDINAVIAN PAISLEY PICNIC BAG,2,2.95,14451.0,United Kingdom,2025-09-20
501849,21937,STRAWBERRY   PICNIC BAG,2,2.95,14451.0,United Kingdom,2025-09-20
501849,85206A,CREAM FELT EASTER EGG BASKET,2,1.65,14451.0,United Kingdom,2025-09-20
501849,22021,BLUE FELT EASTER EGG BASKET,1,1.65,14451.0,United Kingdom,2025-09-20
501849,85206B,PINK FELT EASTER EGG BASKET,2,1.65,14451.0,United Kingdom,2025-09-20
501849,22175,PINK OWL SOFT TOY,2,2.95,14451.0,United Kingdom,2025-09-20
501849,20676,RED SPOTTY BOWL,4,1.25,14451.0,United Kingdom,2025-09-20
501849,20675,BLUE SPOTTY BOWL,3,1.25,14451.0,United Kingdom,2025-09-20
501849,20677,PINK SPOTTY BOWL,4,1.25,14451.0,United Kingdom,2025-09-20
501849,22476,EMPIRE UNION JACK TV DINNER TRAY,1,4.95,14451.0,United Kingdom,2025-09-20
501849,21358,TOAST ITS - HAPPY BIRTHDAY,2,1.25,14451.0,United Kingdom,2025-09-20
501849,21357,TOAST ITS - DINOSAUR,2,1.25,14451.0,United Kingdom,2025-09-20
501849,22507,MEMO BOARD RETROSPOT  DESIGN,3,4.95,14451.0,United Kingdom,2025-09-20
501849,20725,LUNCH BAG RED SPOTTY,4,1.65,14451.0,United Kingdom,2025-09-20
501849,20727,LUNCH BAG  BLACK SKULL.,4,1.65,14451.0,United Kingdom,2025-09-20
501849,22384,LUNCH BAG PINK RETROSPOT,4,1.65,14451.0,United Kingdom,2025-09-20
501849,22423,REGENCY CAKESTAND 3 TIER,3,12.75,14451.0,United Kingdom,2025-09-20
501849,21976,PACK OF 60 MUSHROOM CAKE CASES,2,0.55,14451.0,United Kingdom,2025-09-20
501849,22499,WOODEN UNION JACK BUNTING,2,5.95,14451.0,United Kingdom,2025-09-20
501849,84991,60 TEATIME FAIRY CAKE CASES,2,0.55,14451.0,United Kingdom,2025-09-20
501849,21213,PACK OF 72 SKULL CAKE CASES,2,0.55,14451.0,United Kingdom,2025-09-20
501849,21212,PACK OF 72 RETRO SPOT CAKE CASES,2,0.55,14451.0,United Kingdom,2025-09-20
501849,22327,ROUND SNACK BOXES SET OF 4 SKULLS,4,2.95,14451.0,United Kingdom,2025-09-20
501849,79029,GLASS HONEYPOT WASP CATCHER,5,1.95,14451.0,United Kingdom,2025-09-20
501849,22131,FOOD CONTAINER SET 3 LOVE HEART ,3,1.95,14451.0,United Kingdom,2025-09-20
501849,21356,TOAST ITS - FAIRY FLOWER,2,1.25,14451.0,United Kingdom,2025-09-20
501849,21975,PACK OF 60 DINOSAUR CAKE CASES,2,0.55,14451.0,United Kingdom,2025-09-20
501850,84292,ROSE PINK METAL FOLDING CHAIR,4,7.95,13214.0,United Kingdom,2025-09-20
501850,22361,GLASS JAR DAISY FRESH COTTON WOOL,6,2.95,13214.0,United Kingdom,2025-09-20
501850,22464,HANGING METAL HEART LANTERN,12,1.65,13214.0,United Kingdom,2025-09-20
501850,22457,NATURAL SLATE HEART CHALKBOARD ,6,2.95,13214.0,United Kingdom,2025-09-20
501850,22476,EMPIRE UNION JACK TV DINNER TRAY,3,4.95,13214.0,United Kingdom,2025-09-20
501850,22487,WHITE WOOD GARDEN PLANT LADDER,1,9.95,13214.0,United Kingdom,2025-09-20
501850,22483,RED GINGHAM TEDDY BEAR ,6,2.95,13214.0,United Kingdom,2025-09-20
501850,22473,TV DINNER TRAY VINTAGE PAISLEY,3,4.95,13214.0,United Kingdom,2025-09-20
501852,85049C,ROMANTIC PINKS RIBBONS ,12,1.25,17465.0,United Kingdom,2025-09-20
501852,37449,CERAMIC CAKE STAND + HANGING CAKES,4,9.95,17465.0,United Kingdom,2025-09-20
501852,21437,24 HANGING EASTER EGGS FLORAL TUB,8,3.75,17465.0,United Kingdom,2025-09-20
501852,22241,GARLAND WOODEN HAPPY EASTER,12,1.25,17465.0,United Kingdom,2025-09-20
501852,22281,EASTER TREE YELLOW BIRDS,16,5.25,17465.0,United Kingdom,2025-09-20
501852,22077,6 RIBBONS RUSTIC CHARM,12,1.65,17465.0,United Kingdom,2025-09-20
501852,22219,LOVEBIRD HANGING DECORATION WHITE ,12,0.85,17465.0,United Kingdom,2025-09-20
501852,47566B,TEA TIME PARTY BUNTING,5,4.65,17465.0,United Kingdom,2025-09-20
501852,84975,HEART SHAPED MIRROR,6,1.69,17465.0,United Kingdom,2025-09-20
501852,21590,KINGS CHOICE CIGAR BOX MATCHES ,24,1.25,17465.0,United Kingdom,2025-09-20
501852,21911,GARDEN METAL SIGN ,12,1.65,17465.0,United Kingdom,2025-09-20
501852,21380,WOODEN HAPPY BIRTHDAY GARLAND,6,2.95,17465.0,United Kingdom,2025-09-20
C501851,22270,HAPPY EASTER HANGING DECORATION,-3,3.75,14451.0,United Kingdom,2025-09-20
501852,84970S,HANGING HEART ZINC T-LIGHT HOLDER,12,0.85,17465.0,United Kingdom,2025-09-20
501853,22353,LUNCHBOX WITH CUTLERY FAIRY CAKES ,1,2.55,16782.0,United Kingdom,2025-09-20
501853,47505,MINATURE COLOURED GARDENING SET,2,4.95,16782.0,United Kingdom,2025-09-20
501853,22021,BLUE FELT EASTER EGG BASKET,1,1.65,16782.0,United Kingdom,2025-09-20
501853,85206B,PINK FELT EASTER EGG BASKET,1,1.65,16782.0,United Kingdom,2025-09-20
501853,21407,BROWN CHECK CAT DOORSTOP ,1,4.25,16782.0,United Kingdom,2025-09-20
501853,21557,SET OF 6 FUNKY BEAKERS,1,2.95,16782.0,United Kingdom,2025-09-20
501853,21223,SET/4 BADGES WOODLAND ANIMAL,1,1.25,16782.0,United Kingdom,2025-09-20
501853,21224,SET/4 SKULL BADGES,1,1.25,16782.0,United Kingdom,2025-09-20
501853,22383,LUNCH BAG SUKI  DESIGN ,1,1.65,16782.0,United Kingdom,2025-09-20
501853,21166,COOK WITH WINE METAL SIGN ,1,1.95,16782.0,United Kingdom,2025-09-20
501853,21590,KINGS CHOICE CIGAR BOX MATCHES ,1,1.25,16782.0,United Kingdom,2025-09-20
501853,21561,DINOSAUR LUNCHBOX WITH CUTLERY,1,2.55,16782.0,United Kingdom,2025-09-20
501853,21164,HOME SWEET HOME METAL SIGN ,1,2.95,16782.0,United Kingdom,2025-09-20
501853,21539,RETRO SPOTS BUTTER DISH,1,4.95,16782.0,United Kingdom,2025-09-20
501853,22348,TEA BAG PLATE RED SPOTTY ,1,0.85,16782.0,United Kingdom,2025-09-20
501853,20728,LUNCH BAG CARS BLUE,1,1.65,16782.0,United Kingdom,2025-09-20
501853,20727,LUNCH BAG  BLACK SKULL.,1,1.65,16782.0,United Kingdom,2025-09-20
501853,22382,LUNCH BAG SPACEBOY DESIGN ,2,1.65,16782.0,United Kingdom,2025-09-20
501853,22326,ROUND SNACK BOXES SET OF4 WOODLAND ,1,2.95,16782.0,United Kingdom,2025-09-20
501853,21448,12 DAISY PEGS IN WOOD BOX,1,1.65,16782.0,United Kingdom,2025-09-20
501853,35911A,MULTICOLOUR RABBIT EGG WARMER,2,2.1,16782.0,United Kingdom,2025-09-20
501853,22383,LUNCH BAG SUKI  DESIGN ,1,1.65,16782.0,United Kingdom,2025-09-20
501853,84997C,BLUE 3 PIECE MINI DOTS CUTLERY SET,1,3.75,16782.0,United Kingdom,2025-09-20
501853,22021,BLUE FELT EASTER EGG BASKET,2,1.65,16782.0,United Kingdom,2025-09-20
501853,21937,STRAWBERRY   PICNIC BAG,2,2.95,16782.0,United Kingdom,2025-09-20
501853,22411,JUMBO SHOPPER VINTAGE RED PAISLEY,1,1.95,16782.0,United Kingdom,2025-09-20
501853,47570,ENGLISH ROSE TABLE CLOTH,1,10.65,16782.0,United Kingdom,2025-09-20
501853,84520B,PACK 20 ENGLISH ROSE PAPER NAPKINS,2,0.85,16782.0,United Kingdom,2025-09-20
501853,47556B,TEA TIME TEA TOWELS ,1,2.95,16782.0,United Kingdom,2025-09-20
501853,21747,SMALL SKULL WINDMILL,1,1.25,16782.0,United Kingdom,2025-09-20
501853,85185B,PINK HORSE SOCK PUPPET,1,2.95,16782.0,United Kingdom,2025-09-20
501853,20728,LUNCH BAG CARS BLUE,1,1.65,16782.0,United Kingdom,2025-09-20
501853,20973,12 PENCIL SMALL TUBE WOODLAND,1,0.65,16782.0,United Kingdom,2025-09-20
501853,20727,LUNCH BAG  BLACK SKULL.,1,1.65,16782.0,United Kingdom,2025-09-20
501853,20982,12 PENCILS TALL TUBE SKULLS,1,0.85,16782.0,United Kingdom,2025-09-20
501853,84997B,RED 3 PIECE MINI DOTS CUTLERY SET,1,3.75,16782.0,United Kingdom,2025-09-20
501853,84691,PACK 20 DOLLY PEGS,1,0.85,16782.0,United Kingdom,2025-09-20
501853,22021,BLUE FELT EASTER EGG BASKET,1,1.65,16782.0,United Kingdom,2025-09-20
501853,85206B,PINK FELT EASTER EGG BASKET,1,1.65,16782.0,United Kingdom,2025-09-20
501853,21407,BROWN CHECK CAT DOORSTOP ,1,4.25,16782.0,United Kingdom,2025-09-20
501853,21100,CHARLIE AND LOLA CHARLOTTE BAG,1,1.65,16782.0,United Kingdom,2025-09-20
501853,21827,EIGHT PIECE CREEPY CRAWLIE SET,1,1.25,16782.0,United Kingdom,2025-09-20
501853,22210,WOOD STAMP SET BEST WISHES,1,1.65,16782.0,United Kingdom,2025-09-20
501853,20977,36 PENCILS TUBE WOODLAND,1,1.25,16782.0,United Kingdom,2025-09-20
501853,85206B,PINK FELT EASTER EGG BASKET,2,1.65,16782.0,United Kingdom,2025-09-20
501853,84691,PACK 20 DOLLY PEGS,1,0.85,16782.0,United Kingdom,2025-09-20
501853,21440,12 MINI TOADSTOOL PEGS,1,1.25,16782.0,United Kingdom,2025-09-20
501853,16237,SLEEPING CAT ERASERS,1,0.21,16782.0,United Kingdom,2025-09-20
501853,20981,12 PENCILS TALL TUBE WOODLAND,1,0.85,16782.0,United Kingdom,2025-09-20
501853,84569C,PACK 4 FLOWER/BUTTERFLY PATCHES,1,1.25,16782.0,United Kingdom,2025-09-20
501853,21590,KINGS CHOICE CIGAR BOX MATCHES ,1,1.25,16782.0,United Kingdom,2025-09-20
501853,21973,SET OF 36 MUSHROOM PAPER DOILIES,1,1.45,16782.0,United Kingdom,2025-09-20
501853,22416,36 DOILIES SPACEBOY DESIGN ,1,1.45,16782.0,United Kingdom,2025-09-20
501853,21972,SET OF 36 DINOSAUR PAPER DOILIES,1,1.45,16782.0,United Kingdom,2025-09-20
501853,21746,SMALL RED SPOT  WINDMILL,1,1.25,16782.0,United Kingdom,2025-09-20
501853,21058,PARTY INVITES WOODLAND,1,0.85,16782.0,United Kingdom,2025-09-20
501853,21059,PARTY INVITES DINOSAURS,1,0.85,16782.0,United Kingdom,2025-09-20
501853,22376,AIRLINE BAG VINTAGE JET SET WHITE,1,6.35,16782.0,United Kingdom,2025-09-20
501853,21327,SKULLS WRITING SET ,1,1.65,16782.0,United Kingdom,2025-09-20
501853,21330,WOODLAND ANIMAL  WRITING SET ,1,1.65,16782.0,United Kingdom,2025-09-20
501853,21329,DINOSAURS  WRITING SET ,1,1.65,16782.0,United Kingdom,2025-09-20
501853,47597,NEW ENGLAND TEATOWELS,1,2.55,16782.0,United Kingdom,2025-09-20
501853,22383,LUNCH BAG SUKI  DESIGN ,2,1.65,16782.0,United Kingdom,2025-09-20
501853,22273,FELTCRAFT DOLL MOLLY,1,2.95,16782.0,United Kingdom,2025-09-20
501853,21937,STRAWBERRY   PICNIC BAG,2,2.95,16782.0,United Kingdom,2025-09-20
501853,21213,PACK OF 72 SKULL CAKE CASES,1,0.55,16782.0,United Kingdom,2025-09-20
501853,20974,12 PENCILS SMALL TUBE SKULL,1,0.65,16782.0,United Kingdom,2025-09-20
501853,21975,PACK OF 60 DINOSAUR CAKE CASES,1,0.55,16782.0,United Kingdom,2025-09-20
501853,22376,AIRLINE BAG VINTAGE JET SET WHITE,1,6.35,16782.0,United Kingdom,2025-09-20
501853,22348,TEA BAG PLATE RED SPOTTY ,2,0.85,16782.0,United Kingdom,2025-09-20
501853,84375,SET OF 20 KIDS COOKIE CUTTERS,1,1.95,16782.0,United Kingdom,2025-09-20
501853,84569D,PACK 6 HEART/ICE-CREAM PATCHES,1,1.25,16782.0,United Kingdom,2025-09-20
501853,35914,PINK CHICK EGG WARMER + EGG CUP,2,2.1,16782.0,United Kingdom,2025-09-20
501853,21976,PACK OF 60 MUSHROOM CAKE CASES,1,0.55,16782.0,United Kingdom,2025-09-20
501853,22326,ROUND SNACK BOXES SET OF4 WOODLAND ,1,2.95,16782.0,United Kingdom,2025-09-20
501853,21977,PACK OF 60 PINK PAISLEY CAKE CASES,1,0.55,16782.0,United Kingdom,2025-09-20
501853,21524,DOOR MAT SPOTTY HOME SWEET HOME,1,7.49,16782.0,United Kingdom,2025-09-20
501853,16235,RECYCLED PENCIL WITH RABBIT ERASER,5,0.21,16782.0,United Kingdom,2025-09-20
501853,21100,CHARLIE AND LOLA CHARLOTTE BAG,1,1.65,16782.0,United Kingdom,2025-09-20
501853,21613,S/12 VANILLA  BOTANICAL T-LIGHTS,1,2.95,16782.0,United Kingdom,2025-09-20
501853,22327,ROUND SNACK BOXES SET OF 4 SKULLS,2,2.95,16782.0,United Kingdom,2025-09-20
501853,20981,12 PENCILS TALL TUBE WOODLAND,1,0.85,16782.0,United Kingdom,2025-09-20
501853,20727,LUNCH BAG  BLACK SKULL.,2,1.65,16782.0,United Kingdom,2025-09-20
501853,20978,36 PENCILS TUBE SKULLS,1,1.25,16782.0,United Kingdom,2025-09-20
501853,20726,LUNCH BAG WOODLAND,2,1.65,16782.0,United Kingdom,2025-09-20
501853,85071C,"CHARLIE+LOLA""EXTREMELY BUSY"" SIGN",1,2.55,16782.0,United Kingdom,2025-09-20
501853,85071D,CHARLIE+LOLA MY ROOM DOOR SIGN,1,2.55,16782.0,United Kingdom,2025-09-20
501853,22348,TEA BAG PLATE RED SPOTTY ,1,0.85,16782.0,United Kingdom,2025-09-20
501853,20725,LUNCH BAG RED SPOTTY,2,1.65,16782.0,United Kingdom,2025-09-20
501853,84991,60 TEATIME FAIRY CAKE CASES,1,0.55,16782.0,United Kingdom,2025-09-20
501853,21609,SET 12 LAVENDER  BOTANICAL T-LIGHTS,1,2.95,16782.0,United Kingdom,2025-09-20
501854,35001W,HAND OPEN SHAPE DECO.WHITE,1,3.49,15446.0,United Kingdom,2025-09-20
501854,35001G,HAND OPEN SHAPE GOLD,1,4.25,15446.0,United Kingdom,2025-09-20
501854,22190,LOCAL CAFE MUG,1,2.1,15446.0,United Kingdom,2025-09-20
501854,84555A,YELLOW VW BEETLE CERAMIC MONEY BOX,1,2.95,15446.0,United Kingdom,2025-09-20
501854,35160,BUDDHA INCENSE HOLDER ASSORTED,8,0.85,15446.0,United Kingdom,2025-09-20
501854,84437A,S/6 PINK EASTER DECS IN BOX,1,0.85,15446.0,United Kingdom,2025-09-20
501854,79534,MULTICOLOUR GLASS PLATE,12,0.55,15446.0,United Kingdom,2025-09-20
501854,22457,NATURAL SLATE HEART CHALKBOARD ,1,2.95,15446.0,United Kingdom,2025-09-20
501854,22488,NATURAL SLATE RECTANGLE CHALKBOARD,3,1.65,15446.0,United Kingdom,2025-09-20
501854,22464,HANGING METAL HEART LANTERN,1,1.65,15446.0,United Kingdom,2025-09-20
501854,72083A,STRAWBERY SWIRL FLARE CANDLE,2,2.1,15446.0,United Kingdom,2025-09-20
501854,21034,REX CASH+CARRY JUMBO SHOPPER,1,0.95,15446.0,United Kingdom,2025-09-20
501854,22290,STANDING METAL RABBIT WITH EGG,1,2.1,15446.0,United Kingdom,2025-09-20
501854,85123A,WHITE HANGING HEART T-LIGHT HOLDER,3,2.95,15446.0,United Kingdom,2025-09-20
501854,22266,EASTER DECORATION HANGING BUNNY,1,0.65,15446.0,United Kingdom,2025-09-20
501854,21621,VINTAGE UNION JACK BUNTING,1,8.5,15446.0,United Kingdom,2025-09-20
501854,22288,"DECORATION , HANGING METAL RABBIT",2,1.25,15446.0,United Kingdom,2025-09-20
501854,21389,IVORY HANGING DECORATION  BIRD,5,0.85,15446.0,United Kingdom,2025-09-20
501854,21411,GINGHAM HEART  DOORSTOP RED,1,4.25,15446.0,United Kingdom,2025-09-20
501854,22249,DECORATION WHITE CHICK MAGIC GARDEN,4,0.85,15446.0,United Kingdom,2025-09-20
501854,21407,BROWN CHECK CAT DOORSTOP ,1,4.25,15446.0,United Kingdom,2025-09-20
501854,22508,DOORSTOP RETROSPOT HEART,2,3.75,15446.0,United Kingdom,2025-09-20
501854,22228,BUNNY WOODEN PAINTED WITH BIRD ,2,0.85,15446.0,United Kingdom,2025-09-20
501854,22229,BUNNY WOODEN PAINTED WITH FLOWER ,2,0.85,15446.0,United Kingdom,2025-09-20
501854,22291,"SPRING DEC , HANGING CHICK CREAM",1,1.45,15446.0,United Kingdom,2025-09-20
501854,22292,"SPRING DEC , HANGING CHICK  YELLOW",2,1.45,15446.0,United Kingdom,2025-09-20
501854,22266,EASTER DECORATION HANGING BUNNY,3,0.65,15446.0,United Kingdom,2025-09-20
501854,22289,"DECORATION , HANGING METAL CHICKEN",2,1.25,15446.0,United Kingdom,2025-09-20
501854,M,Manual,3,1.0,15446.0,United Kingdom,2025-09-20
501854,22249,DECORATION WHITE CHICK MAGIC GARDEN,1,0.85,15446.0,United Kingdom,2025-09-20
501854,22284,HEN HOUSE DECORATION,2,1.65,15446.0,United Kingdom,2025-09-20
501855,22423,REGENCY CAKESTAND 3 TIER,6,12.75,17526.0,United Kingdom,2025-09-20
501855,72140E,BEST DAD CANDLE LETTERS,72,0.64,17526.0,United Kingdom,2025-09-20
501855,22417,PACK OF 60 SPACEBOY CAKE CASES,120,0.42,17526.0,United Kingdom,2025-09-20
501855,22236,CAKE STAND 3 TIER MAGIC GARDEN,12,10.95,17526.0,United Kingdom,2025-09-20
501855,20716,PARTY FOOD SHOPPER BAG,20,1.25,17526.0,United Kingdom,2025-09-20
501856,22169,FAMILY ALBUM WHITE PICTURE FRAME,2,8.5,17526.0,United Kingdom,2025-09-20
C501857,M,Manual,-3,0.45,15446.0,United Kingdom,2025-09-20
501858,85014B,RED/WHITE DOTS RUFFLED UMBRELLA,3,5.95,13593.0,United Kingdom,2025-09-20
501858,15056BL,EDWARDIAN PARASOL BLACK,2,5.95,13593.0,United Kingdom,2025-09-20
501858,22192,BLUE DINER WALL CLOCK,1,8.5,13593.0,United Kingdom,2025-09-20
501858,22191,EAU DE NIL DINER WALL CLOCK,1,8.5,13593.0,United Kingdom,2025-09-20
501858,21314,SMALL GLASS HEART TRINKET POT,7,2.1,13593.0,United Kingdom,2025-09-20
501858,21911,GARDEN METAL SIGN ,2,1.65,13593.0,United Kingdom,2025-09-20
501858,84925C,FAIRY CAKES  WALL THERMOMETER,8,2.55,13593.0,United Kingdom,2025-09-20
501858,72801D,S/4 SKY BLUE DINNER CANDLES,2,1.25,13593.0,United Kingdom,2025-09-20
501858,22461,SAVOY ART DECO CLOCK,1,12.75,13593.0,United Kingdom,2025-09-20
501858,85168A,WHITE BAROQUE CARRIAGE CLOCK,1,9.95,13593.0,United Kingdom,2025-09-20
501858,85163A,WHITE BAROQUE WALL CLOCK ,1,12.75,13593.0,United Kingdom,2025-09-20
501858,22111,SCOTTIE DOG HOT WATER BOTTLE,2,4.95,13593.0,United Kingdom,2025-09-20
501858,22112,CHOCOLATE HOT WATER BOTTLE,2,4.95,13593.0,United Kingdom,2025-09-20
501858,72801C,S/4 ROSE PINK DINNER CANDLES,2,1.25,13593.0,United Kingdom,2025-09-20
501858,21034,REX CASH+CARRY JUMBO SHOPPER,2,0.95,13593.0,United Kingdom,2025-09-20
501858,79071B,ENGLISH ROSE METAL WASTE BIN,3,2.95,13593.0,United Kingdom,2025-09-20
501858,47566B,TEA TIME PARTY BUNTING,6,4.65,13593.0,United Kingdom,2025-09-20
501858,79029,GLASS HONEYPOT WASP CATCHER,4,1.95,13593.0,United Kingdom,2025-09-20
501858,22189,CREAM HEART CARD HOLDER,6,3.95,13593.0,United Kingdom,2025-09-20
501858,22172,METAL SHELF WITH RAIL ,2,8.5,13593.0,United Kingdom,2025-09-20
501858,84755,COLOUR GLASS T-LIGHT HOLDER HANGING,16,0.65,13593.0,United Kingdom,2025-09-20
501858,84755,COLOUR GLASS T-LIGHT HOLDER HANGING,8,0.65,13593.0,United Kingdom,2025-09-20
501858,84755,COLOUR GLASS T-LIGHT HOLDER HANGING,8,0.65,13593.0,United Kingdom,2025-09-20
501858,84755,COLOUR GLASS T-LIGHT HOLDER HANGING,32,0.65,13593.0,United Kingdom,2025-09-20
501858,84856S,SMALL TAHITI BEACH BAG,3,4.65,13593.0,United Kingdom,2025-09-20
501858,84856L,LARGE TAHITI BEACH BAG,3,5.95,13593.0,United Kingdom,2025-09-20
501858,22505,MEMO BOARD COTTAGE DESIGN,4,4.95,13593.0,United Kingdom,2025-09-20
501858,84791,GINGHAM HEART DECORATION,6,2.95,13593.0,United Kingdom,2025-09-20
501858,21622,VINTAGE UNION JACK CUSHION COVER,6,4.95,13593.0,United Kingdom,2025-09-20
501858,21754,HOME BUILDING BLOCK WORD,6,5.95,13593.0,United Kingdom,2025-09-20
501858,37492D,PURPLE GREEN FLOWER PIGGY BANK,2,4.65,13593.0,United Kingdom,2025-09-20
501860,37503,TEA TIME CAKE STAND IN GIFT BOX,1,10.75,15425.0,United Kingdom,2025-09-20
501860,47570B,TEA TIME TABLE CLOTH,2,10.65,15425.0,United Kingdom,2025-09-20
501860,47567B,TEA TIME KITCHEN APRON,6,5.95,15425.0,United Kingdom,2025-09-20
501860,22197,SMALL POPCORN HOLDER,100,0.72,15425.0,United Kingdom,2025-09-20
501860,72741,GRAND CHOCOLATECANDLE,9,1.45,15425.0,United Kingdom,2025-09-20
501860,21537,RETRO SPOTS PUDDING BOWL,2,4.25,15425.0,United Kingdom,2025-09-20
501860,82578,KITCHEN METAL SIGN,6,0.55,15425.0,United Kingdom,2025-09-20
501860,22296,HEART IVORY TRELLIS LARGE,12,1.65,15425.0,United Kingdom,2025-09-20
501859,46775E,CANDY POP CHUNKY KNITTED THROW ,2,16.95,14080.0,United Kingdom,2025-09-20
501860,85130C,BEADED CRYSTAL HEART BLUE  LARGE,24,1.65,15425.0,United Kingdom,2025-09-20
501860,85130D,BEADED CRYSTAL HEART PINK LARGE,24,1.65,15425.0,United Kingdom,2025-09-20
501860,22252,BIRDCAGE DECORATION TEALIGHT HOLDER,6,1.25,15425.0,United Kingdom,2025-09-20
501860,47559B,TEA TIME OVEN GLOVE,4,1.25,15425.0,United Kingdom,2025-09-20
501860,82580,BATHROOM METAL SIGN,6,0.55,15425.0,United Kingdom,2025-09-20
501860,21529,RETRO SPOT CERAMIC TOASTRACK,1,3.45,15425.0,United Kingdom,2025-09-20
501860,47579,TEA TIME BREAKFAST BASKET,3,2.1,15425.0,United Kingdom,2025-09-20
501860,22384,LUNCH BAG PINK RETROSPOT,6,1.65,15425.0,United Kingdom,2025-09-20
501860,47591D,PINK FAIRY CAKE CHILD'S APRON,6,1.95,15425.0,United Kingdom,2025-09-20
501860,35971,ROSE FOLKART HEART DECORATIONS,6,1.25,15425.0,United Kingdom,2025-09-20
501859,46775D,SUNSET COLOUR CHUNKY KNITTED THROW,2,16.95,14080.0,United Kingdom,2025-09-20
501859,21770,OPEN CLOSED METAL SIGN,1,4.95,14080.0,United Kingdom,2025-09-20
501859,21670,BLUE SPOT CERAMIC DRAWER KNOB,6,1.25,14080.0,United Kingdom,2025-09-20
501859,20786,BLACK RETRO BAR STOOL,2,39.95,14080.0,United Kingdom,2025-09-20
501859,20787,BLUE RETRO BAR STOOL,1,39.95,14080.0,United Kingdom,2025-09-20
501860,20707,CRAZY DAISY HEART DECORATION,4,1.25,15425.0,United Kingdom,2025-09-20
501859,20785,FUSCHIA RETRO BAR STOOL,1,39.95,14080.0,United Kingdom,2025-09-20
501860,22461,SAVOY ART DECO CLOCK,1,12.75,15425.0,United Kingdom,2025-09-20
501860,84791,GINGHAM HEART DECORATION,3,2.95,15425.0,United Kingdom,2025-09-20
501860,22382,LUNCH BAG SPACEBOY DESIGN ,4,1.65,15425.0,United Kingdom,2025-09-20
501860,21156,RED SPOTTY CHILDS APRON,6,1.95,15425.0,United Kingdom,2025-09-20
501860,22367,CHILDS APRON SPACEBOY DESIGN,6,1.95,15425.0,United Kingdom,2025-09-20
501860,47591C,BLUE FAIRY CAKE CHILD'S APRON,6,1.95,15425.0,United Kingdom,2025-09-20
501859,20784,RED RETRO BAR STOOL,1,39.95,14080.0,United Kingdom,2025-09-20
