Invoice,StockCode,Description,Quantity,Price,Customer ID,Country,InvoiceDate
516480,21413,PERIWINKLE T-LIGHT HOLDER,12,1.25,16400.0,United Kingdom,2025-12-29
516480,85123A,WHITE HANGING HEART T-LIGHT HOLDER,32,2.55,16400.0,United Kingdom,2025-12-29
516480,84879,ASSORTED COLOUR BIRD ORNAMENT,40,1.69,16400.0,United Kingdom,2025-12-29
516480,21136,PAINTED METAL PEARS ASSORTED,40,1.69,16400.0,United Kingdom,2025-12-29
516481,22353,LUNCH BOX WITH CUTLERY FAIRY CAKES ,6,2.55,16945.0,United Kingdom,2025-12-29
516481,22149,FELTCRAFT 6 FLOWER FRIENDS,6,2.1,16945.0,United Kingdom,2025-12-29
516481,62096A,PINK/YELLOW FLOWERS HANDBAG,6,1.25,16945.0,United Kingdom,2025-12-29
516481,22150,3 STRIPEY MICE FELTCRAFT,6,1.95,16945.0,United Kingdom,2025-12-29
516481,22650,CERAMIC PIRATE CHEST MONEY BANK,12,1.45,16945.0,United Kingdom,2025-12-29
516481,21929,JUMBO BAG PINK VINTAGE PAISLEY,10,1.95,16945.0,United Kingdom,2025-12-29
516481,21559,STRAWBERRY LUNCH BOX WITH CUTLERY,6,2.55,16945.0,United Kingdom,2025-12-29
516481,21558,SKULL LUNCH BOX WITH CUTLERY ,6,2.55,16945.0,United Kingdom,2025-12-29
516481,21251,DINOSAUR HEIGHT CHART STICKER SET,6,2.95,16945.0,United Kingdom,2025-12-29
516481,21249,WOODLAND  HEIGHT CHART STICKERS ,6,2.95,16945.0,United Kingdom,2025-12-29
516481,22027,TEA PARTY BIRTHDAY CARD,12,0.42,16945.0,United Kingdom,2025-12-29
516481,22411,JUMBO SHOPPER VINTAGE RED PAISLEY,10,1.95,16945.0,United Kingdom,2025-12-29
516481,20724,RED SPOTTY CHARLOTTE BAG,10,0.85,16945.0,United Kingdom,2025-12-29
516481,21936,RED RETROSPOT PICNIC BAG,5,2.95,16945.0,United Kingdom,2025-12-29
516481,22663,JUMBO BAG DOLLY GIRL DESIGN,10,1.95,16945.0,United Kingdom,2025-12-29
516481,21928,JUMBO BAG SCANDINAVIAN PAISLEY,10,1.95,16945.0,United Kingdom,2025-12-29
516481,21930,JUMBO STORAGE BAG SKULLS,10,1.95,16945.0,United Kingdom,2025-12-29
516481,22661,CHARLOTTE BAG DOLLY GIRL DESIGN,10,0.85,16945.0,United Kingdom,2025-12-29
516481,22385,JUMBO BAG SPACEBOY DESIGN,10,1.95,16945.0,United Kingdom,2025-12-29
516481,22386,JUMBO BAG PINK WITH WHITE SPOTS,10,1.95,16945.0,United Kingdom,2025-12-29
516481,20711,JUMBO BAG TOYS ,10,1.95,16945.0,United Kingdom,2025-12-29
516481,22378,WALL TIDY RETROSPOT ,5,2.1,16945.0,United Kingdom,2025-12-29
516482,22692,DOORMAT WELCOME TO OUR HOME,4,7.49,13976.0,United Kingdom,2025-12-29
516482,21313,GLASS HEART T-LIGHT HOLDER ,12,0.85,13976.0,United Kingdom,2025-12-29
516482,22690,DOORMAT HOME SWEET HOME BLUE ,4,7.49,13976.0,United Kingdom,2025-12-29
516482,20685,DOORMAT RED SPOT,4,7.49,13976.0,United Kingdom,2025-12-29
516482,22172,METAL SHELF WITH RAIL ,2,8.5,13976.0,United Kingdom,2025-12-29
516482,84946,ANTIQUE SILVER TEA GLASS ETCHED,12,1.25,13976.0,United Kingdom,2025-12-29
516482,48173C,DOORMAT BLACK FLOCK ,2,7.49,13976.0,United Kingdom,2025-12-29
516482,21472,LADYBIRD + BEE RAFFIA FOOD COVER,6,3.75,13976.0,United Kingdom,2025-12-29
516482,22077,6 RIBBONS RUSTIC CHARM,12,1.65,13976.0,United Kingdom,2025-12-29
516482,21658,GLASS  BEURRE DISH,4,3.95,13976.0,United Kingdom,2025-12-29
516482,71459,HANGING JAM JAR T-LIGHT HOLDER,12,0.85,13976.0,United Kingdom,2025-12-29
516482,22188,BLACK HEART CARD HOLDER,4,3.95,13976.0,United Kingdom,2025-12-29
516482,21466,RED FLOWER CROCHET FOOD COVER,6,3.75,13976.0,United Kingdom,2025-12-29
516482,21186,WHITE DOVE HONEYCOMB PAPER GARLAND,12,1.65,13976.0,United Kingdom,2025-12-29
516482,22087,PAPER BUNTING WHITE LACE,6,2.95,13976.0,United Kingdom,2025-12-29
516482,84755,COLOUR GLASS T-LIGHT HOLDER HANGING,16,0.65,13976.0,United Kingdom,2025-12-29
516483,22593,CHRISTMAS GINGHAM STAR,24,0.85,17080.0,United Kingdom,2025-12-29
516483,22594,CHRISTMAS GINGHAM TREE,24,0.85,17080.0,United Kingdom,2025-12-29
516483,22130,PARTY CONE CHRISTMAS DECORATION ,24,0.85,17080.0,United Kingdom,2025-12-29
516484,72760B,VINTAGE CREAM 3 BASKET CAKE STAND,2,9.95,14422.0,United Kingdom,2025-12-29
516484,21671,RED SPOT CERAMIC DRAWER KNOB,12,1.25,14422.0,United Kingdom,2025-12-29
516484,21672,WHITE SPOT RED CERAMIC DRAWER KNOB,12,1.25,14422.0,United Kingdom,2025-12-29
516484,21519,GIN & TONIC DIET GREETING CARD ,12,0.42,14422.0,United Kingdom,2025-12-29
516484,21673,WHITE SPOT BLUE CERAMIC DRAWER KNOB,12,1.25,14422.0,United Kingdom,2025-12-29
516484,21670,BLUE SPOT CERAMIC DRAWER KNOB,12,1.25,14422.0,United Kingdom,2025-12-29
516484,21669,BLUE STRIPE CERAMIC DRAWER KNOB,12,1.25,14422.0,United Kingdom,2025-12-29
516484,21668,RED STRIPE CERAMIC DRAWER KNOB,12,1.25,14422.0,United Kingdom,2025-12-29
516484,84975,HEART SHAPED MIRROR,6,1.69,14422.0,United Kingdom,2025-12-29
516484,84880,WHITE WIRE EGG HOLDER,3,5.95,14422.0,United Kingdom,2025-12-29
516484,84978,HANGING HEART JAR T-LIGHT HOLDER,12,1.25,14422.0,United Kingdom,2025-12-29
516484,71459,HANGING JAM JAR T-LIGHT HOLDER,12,0.85,14422.0,United Kingdom,2025-12-29
516484,22224,WHITE LOVEBIRD LANTERN,6,2.95,14422.0,United Kingdom,2025-12-29
516484,22464,HANGING METAL HEART LANTERN,12,1.65,14422.0,United Kingdom,2025-12-29
516484,21755,LOVE BUILDING BLOCK WORD,3,5.95,14422.0,United Kingdom,2025-12-29
516484,85123A,WHITE HANGING HEART T-LIGHT HOLDER,6,2.95,14422.0,United Kingdom,2025-12-29
516484,22194,BLACK DINER WALL CLOCK,2,8.5,14422.0,United Kingdom,2025-12-29
516484,22461,SAVOY ART DECO CLOCK,6,10.95,14422.0,United Kingdom,2025-12-29
516484,84755,COLOUR GLASS T-LIGHT HOLDER HANGING,16,0.65,14422.0,United Kingdom,2025-12-29
516485,22621,TRADITIONAL KNITTING NANCY,12,1.45,12720.0,Germany,2025-12-29
516485,22271,FELTCRAFT DOLL ROSIE,6,2.95,12720.0,Germany,2025-12-29
516485,22273,FELTCRAFT DOLL MOLLY,6,2.95,12720.0,Germany,2025-12-29
516485,85099B,JUMBO BAG RED RETROSPOT,10,1.95,12720.0,Germany,2025-12-29
516485,22618,COOKING SET RETROSPOT,2,9.95,12720.0,Germany,2025-12-29
516485,22378,WALL TIDY RETROSPOT ,5,2.1,12720.0,Germany,2025-12-29
516485,22381,TOY TIDY PINK RETROSPOT  ,10,2.1,12720.0,Germany,2025-12-29
516485,22379,RECYCLING BAG RETROSPOT ,5,2.1,12720.0,Germany,2025-12-29
516485,22489,PACK OF 12 TRADITIONAL CRAYONS,24,0.42,12720.0,Germany,2025-12-29
516485,22356,CHARLOTTE BAG PINK WITH WHITE SPOTS,20,0.85,12720.0,Germany,2025-12-29
516485,22329,ROUND CONTAINER SET OF 5 RETROSPOT,12,1.65,12720.0,Germany,2025-12-29
516485,22386,JUMBO BAG PINK WITH WHITE SPOTS,10,1.95,12720.0,Germany,2025-12-29
516485,22665,RECIPE BOX BLUE SKETCHBOOK DESIGN,6,2.95,12720.0,Germany,2025-12-29
516485,22367,CHILDRENS APRON SPACEBOY DESIGN,8,1.95,12720.0,Germany,2025-12-29
516485,22494,EMERGENCY FIRST AID TIN ,12,1.25,12720.0,Germany,2025-12-29
516485,22617,BAKING SET SPACEBOY DESIGN,3,4.95,12720.0,Germany,2025-12-29
516485,22488,NATURAL SLATE RECTANGLE CHALKBOARD,12,1.65,12720.0,Germany,2025-12-29
516485,21498,RED SPOTS  WRAP ,25,0.42,12720.0,Germany,2025-12-29
516485,21500,PINK SPOTS  WRAP ,25,0.42,12720.0,Germany,2025-12-29
516485,20675,BLUE SPOTTY BOWL,16,1.25,12720.0,Germany,2025-12-29
516485,21244,BLUE  SPOTTY PLATE ,8,1.69,12720.0,Germany,2025-12-29
516485,21916,SET 12 RETRO WHITE CHALK STICKS,24,0.42,12720.0,Germany,2025-12-29
516485,21918,SET 12 KIDS COLOUR  CHALK STICKS,24,0.42,12720.0,Germany,2025-12-29
516485,21917,SET 12 KIDS  WHITE CHALK STICKS,24,0.42,12720.0,Germany,2025-12-29
516485,21535,RED RETROSPOT SMALL MILK JUG,6,2.55,12720.0,Germany,2025-12-29
516485,22138,BAKING SET 9 PIECE RETROSPOT ,3,4.95,12720.0,Germany,2025-12-29
516485,22666,RECIPE BOX PANTRY YELLOW DESIGN,6,2.95,12720.0,Germany,2025-12-29
516485,21986,PACK OF 12 PINK SPOT TISSUES ,48,0.29,12720.0,Germany,2025-12-29
516485,22083,PAPER CHAIN KIT RETRO SPOT,6,2.95,12720.0,Germany,2025-12-29
516485,21210,SET OF 72 RETRO SPOT PAPER  DOILIES,12,1.45,12720.0,Germany,2025-12-29
516485,21980,PACK OF 12 RED SPOTTY TISSUES ,48,0.29,12720.0,Germany,2025-12-29
516485,22667,RECIPE BOX RETRO SPOT DESIGN,6,2.95,12720.0,Germany,2025-12-29
516485,85006,SET 4 NURSERY DES ROUND BOXES,6,2.95,12720.0,Germany,2025-12-29
516485,22549,PICTURE DOMINOES,12,1.45,12720.0,Germany,2025-12-29
516485,21906,PHARMACIE FIRST AID TIN,2,6.75,12720.0,Germany,2025-12-29
516485,21156,RETROSPOT CHILDRENS APRON,8,1.95,12720.0,Germany,2025-12-29
516485,21212,PACK OF 72 RETRO SPOT CAKE CASES,24,0.55,12720.0,Germany,2025-12-29
516485,21238,RED SPOTTY CUP,8,0.85,12720.0,Germany,2025-12-29
516485,21239,PINK  SPOTTY CUP,8,0.85,12720.0,Germany,2025-12-29
516485,21241,GREEN SPOTTY CUP,8,0.85,12720.0,Germany,2025-12-29
516485,21242,RED SPOTTY PLATE ,8,1.69,12720.0,Germany,2025-12-29
516485,21243,PINK  SPOTTY PLATE ,8,1.69,12720.0,Germany,2025-12-29
516485,21531,RED RETROSPOT SUGAR JAM BOWL,6,2.55,12720.0,Germany,2025-12-29
516485,21245,GREEN  SPOTTY PLATE ,8,1.69,12720.0,Germany,2025-12-29
516485,20674,GREEN SPOTTY BOWL,8,1.25,12720.0,Germany,2025-12-29
516485,21035,SET/2 RED SPOTTY TEA TOWELS ,6,2.95,12720.0,Germany,2025-12-29
516485,21154,RED SPOTTY OVEN GLOVE ,10,1.25,12720.0,Germany,2025-12-29
516485,84997B,RED 3 PIECE MINI DOTS CUTLERY SET,6,3.75,12720.0,Germany,2025-12-29
516485,21080,SET/20 RED SPOTTY PAPER NAPKINS ,12,0.85,12720.0,Germany,2025-12-29
516485,20676,RED SPOTTY BOWL,8,1.25,12720.0,Germany,2025-12-29
516485,20677,PINK SPOTTY BOWL,8,1.25,12720.0,Germany,2025-12-29
516485,21880,RED AND WHITE SPOT TAPE,12,0.65,12720.0,Germany,2025-12-29
516485,21533,RETRO SPOT LARGE MILK JUG,3,4.95,12720.0,Germany,2025-12-29
516485,20718,RED SPOTTY SHOPPER BAG,10,1.25,12720.0,Germany,2025-12-29
516485,20724,RED SPOTTY CHARLOTTE BAG,10,0.85,12720.0,Germany,2025-12-29
516485,20975,12 PENCILS SMALL TUBE RED SPOTTY,24,0.65,12720.0,Germany,2025-12-29
516485,21843,RED RETROSPOT CAKE STAND,2,10.95,12720.0,Germany,2025-12-29
516486,POST,POSTAGE,6,18.0,12720.0,Germany,2025-12-29
516487,21158,MOODY GIRL DOOR HANGER ,12,1.45,17865.0,United Kingdom,2025-12-29
516487,82582,AREA PATROLLED METAL SIGN,72,1.69,17865.0,United Kingdom,2025-12-29
516487,21248,DOOR HANGER  MUM + DADS ROOM,12,1.45,17865.0,United Kingdom,2025-12-29
516487,21164,HOME SWEET HOME METAL SIGN ,12,2.95,17865.0,United Kingdom,2025-12-29
516487,21161,KEEP OUT BOYS DOOR HANGER ,12,1.45,17865.0,United Kingdom,2025-12-29
516487,82552,WASHROOM METAL SIGN,12,1.25,17865.0,United Kingdom,2025-12-29
516488,21212,PACK OF 72 RETRO SPOT CAKE CASES,24,0.55,17865.0,United Kingdom,2025-12-29
516488,84637,KITCHEN FLOWER POTS WALL PLAQUE,3,5.95,17865.0,United Kingdom,2025-12-29
516488,84638,SMALL KITCHEN FLOWER POTS PLAQUE,2,6.95,17865.0,United Kingdom,2025-12-29
516488,21171,BATHROOM METAL SIGN ,12,1.45,17865.0,United Kingdom,2025-12-29
516488,85150,LADIES & GENTLEMEN METAL SIGN,6,2.55,17865.0,United Kingdom,2025-12-29
516488,22612,TEA COSY VINTAGE UNION JACK,4,3.75,17865.0,United Kingdom,2025-12-29
516488,21527,RED RETROSPOT TRADITIONAL TEAPOT ,4,7.95,17865.0,United Kingdom,2025-12-29
516488,21042,RED SPOTTY APRON ,3,5.95,17865.0,United Kingdom,2025-12-29
516488,21625,VINTAGE UNION JACK APRON,3,6.95,17865.0,United Kingdom,2025-12-29
516488,21218,RED SPOTTY BISCUIT TIN,6,3.75,17865.0,United Kingdom,2025-12-29
516488,20998,ROSE DU SUD OVEN GLOVE,6,2.95,17865.0,United Kingdom,2025-12-29
516488,21281,VINTAGE KITCHEN PRINT SEAFOOD,6,2.55,17865.0,United Kingdom,2025-12-29
516488,21035,SET/2 RED SPOTTY TEA TOWELS ,6,2.95,17865.0,United Kingdom,2025-12-29
516488,47597,NEW ENGLAND TEATOWELS,6,2.55,17865.0,United Kingdom,2025-12-29
516488,21668,RED STRIPE CERAMIC DRAWER KNOB,24,1.25,17865.0,United Kingdom,2025-12-29
516488,21669,BLUE STRIPE CERAMIC DRAWER KNOB,24,1.25,17865.0,United Kingdom,2025-12-29
516488,21670,BLUE SPOT CERAMIC DRAWER KNOB,24,1.25,17865.0,United Kingdom,2025-12-29
516488,21671,RED SPOT CERAMIC DRAWER KNOB,24,1.25,17865.0,United Kingdom,2025-12-29
516488,21672,WHITE SPOT RED CERAMIC DRAWER KNOB,24,1.25,17865.0,United Kingdom,2025-12-29
516488,21673,WHITE SPOT BLUE CERAMIC DRAWER KNOB,24,1.25,17865.0,United Kingdom,2025-12-29
516488,21135,VICTORIAN  METAL POSTCARD SPRING,24,1.69,17865.0,United Kingdom,2025-12-29
516488,84971S,SMALL HEART FLOWERS HOOK ,24,0.85,17865.0,United Kingdom,2025-12-29
516488,84406B,CREAM CUPID HEARTS COAT HANGER,8,3.25,17865.0,United Kingdom,2025-12-29
516488,21154,RED SPOTTY OVEN GLOVE ,10,1.25,17865.0,United Kingdom,2025-12-29
516488,21280,VINTAGE KITCHEN PRINT VEGETABLES,6,2.55,17865.0,United Kingdom,2025-12-29
516488,84991,60 TEATIME FAIRY CAKE CASES,24,0.55,17865.0,United Kingdom,2025-12-29
516488,21278,VINTAGE KITCHEN PRINT PUDDINGS,6,2.55,17865.0,United Kingdom,2025-12-29
516488,85152,HAND OVER THE CHOCOLATE   SIGN ,12,2.1,17865.0,United Kingdom,2025-12-29
516488,21164,HOME SWEET HOME METAL SIGN ,12,2.95,17865.0,United Kingdom,2025-12-29
516488,21770,OPEN CLOSED METAL SIGN,8,4.95,17865.0,United Kingdom,2025-12-29
516488,21908,CHOCOLATE THIS WAY METAL SIGN,12,2.1,17865.0,United Kingdom,2025-12-29
516488,21910,WAY OUT METAL SIGN ,12,1.65,17865.0,United Kingdom,2025-12-29
516488,21911,GARDEN METAL SIGN ,12,1.65,17865.0,United Kingdom,2025-12-29
516488,21162,TOXIC AREA  DOOR HANGER ,12,1.45,17865.0,United Kingdom,2025-12-29
516488,21161,KEEP OUT BOYS DOOR HANGER ,12,1.45,17865.0,United Kingdom,2025-12-29
516488,21843,RED RETROSPOT CAKE STAND,3,10.95,17865.0,United Kingdom,2025-12-29
516488,22055,MINI CAKE STAND  HANGING STRAWBERY,8,1.65,17865.0,United Kingdom,2025-12-29
516488,22060,LARGE CAKE STAND HANGING HEARTS,2,9.95,17865.0,United Kingdom,2025-12-29
516488,22061,LARGE CAKE STAND  HANGING STRAWBERY,2,9.95,17865.0,United Kingdom,2025-12-29
516488,82600,NO SINGING METAL SIGN,12,2.1,17865.0,United Kingdom,2025-12-29
516488,22423,REGENCY CAKESTAND 3 TIER,2,12.75,17865.0,United Kingdom,2025-12-29
516488,21279,VINTAGE KITCHEN PRINT FRUITS,6,2.55,17865.0,United Kingdom,2025-12-29
516488,37448,CERAMIC CAKE DESIGN SPOTTED MUG,12,1.49,17865.0,United Kingdom,2025-12-29
516488,22059,CERAMIC STRWBERRY DESIGN MUG,12,1.49,17865.0,United Kingdom,2025-12-29
516488,84821,DANISH ROSE DELUXE COASTER,12,0.85,17865.0,United Kingdom,2025-12-29
516488,21231,SWEETHEART CERAMIC TRINKET BOX,24,1.25,17865.0,United Kingdom,2025-12-29
516488,21658,GLASS  BEURRE DISH,4,3.95,17865.0,United Kingdom,2025-12-29
516488,21531,RED RETROSPOT SUGAR JAM BOWL,6,2.55,17865.0,United Kingdom,2025-12-29
516488,21530,DAIRY MAID TOASTRACK,6,2.95,17865.0,United Kingdom,2025-12-29
516488,84782C,GREEN 3 TIER GLASS PLATE STAND,1,12.75,17865.0,United Kingdom,2025-12-29
516488,84782A,PINK 3 TIER GLASS PLATE STAND,1,12.75,17865.0,United Kingdom,2025-12-29
516488,21232,STRAWBERRY CERAMIC TRINKET BOX,72,1.06,17865.0,United Kingdom,2025-12-29
516489,22180,RETRO SPOT LAMP,4,9.95,13952.0,United Kingdom,2025-12-29
516489,20749,ASSORTED COLOUR MINI CASES,2,7.95,13952.0,United Kingdom,2025-12-29
516489,21535,RED RETROSPOT SMALL MILK JUG,6,2.55,13952.0,United Kingdom,2025-12-29
516489,21555,CERAMIC STRAWBERRY TRINKET TRAY,12,2.55,13952.0,United Kingdom,2025-12-29
516489,22625,RED KITCHEN SCALES,2,8.5,13952.0,United Kingdom,2025-12-29
516489,22668,PINK BABY BUNTING,15,2.95,13952.0,United Kingdom,2025-12-29
516489,82486,WOOD S/3 CABINET ANT WHITE FINISH,4,7.95,13952.0,United Kingdom,2025-12-29
516489,22669,RED BABY BUNTING ,15,2.95,13952.0,United Kingdom,2025-12-29
516489,35967,FOLK ART METAL STAR T-LIGHT HOLDER,12,0.38,13952.0,United Kingdom,2025-12-29
516489,35968,FOLK ART METAL HEART T-LIGHT HOLDER,12,0.38,13952.0,United Kingdom,2025-12-29
516489,82483,WOOD 2 DRAWER CABINET WHITE FINISH,4,5.95,13952.0,United Kingdom,2025-12-29
516489,20829,GLITTER HANGING BUTTERFLY STRING,16,2.1,13952.0,United Kingdom,2025-12-29
516489,22621,TRADITIONAL KNITTING NANCY,12,1.45,13952.0,United Kingdom,2025-12-29
516489,22090,PAPER BUNTING RETRO SPOTS,12,2.95,13952.0,United Kingdom,2025-12-29
516489,21533,RETRO SPOT LARGE MILK JUG,6,4.95,13952.0,United Kingdom,2025-12-29
516489,21486,PINK HEART DOTS HOT WATER BOTTLE,4,3.75,13952.0,United Kingdom,2025-12-29
516489,16207A,PINK STRAWBERRY HANDBAG ,6,2.95,13952.0,United Kingdom,2025-12-29
516489,21843,RED RETROSPOT CAKE STAND,4,10.95,13952.0,United Kingdom,2025-12-29
516489,84029E,RED WOOLLY HOTTIE WHITE HEART.,4,3.75,13952.0,United Kingdom,2025-12-29
516489,35957,SMALLFOLKART BAUBLE CHRISTMAS DEC,96,0.19,13952.0,United Kingdom,2025-12-29
516489,35951,FOLKART BAUBLE CHRISTMAS DECORATION,48,0.38,13952.0,United Kingdom,2025-12-29
516489,35819B,"ACRYLIC HANGING JEWEL,BLUE",72,0.38,13952.0,United Kingdom,2025-12-29
516489,35818P,"ACRYLIC JEWEL ICICLE, PINK",72,0.38,13952.0,United Kingdom,2025-12-29
516489,35817P,"ACRYLIC JEWEL SNOWFLAKE,PINK",36,0.38,13952.0,United Kingdom,2025-12-29
516489,35598D,PINK/WHITE CHRISTMAS TREE 60CM,24,0.65,13952.0,United Kingdom,2025-12-29
516489,35600D,PINK AND WHITE CHRISTMAS TREE 180CM,12,2.95,13952.0,United Kingdom,2025-12-29
516489,22667,RECIPE BOX RETRO SPOT DESIGN,6,2.95,13952.0,United Kingdom,2025-12-29
516489,84840,SWEETHEART CARRY-ALL BASKET,4,8.5,13952.0,United Kingdom,2025-12-29
516489,84839,SWEETHEART KEY CABINET,4,6.75,13952.0,United Kingdom,2025-12-29
516489,85066,CREAM SWEETHEART MINI CHEST,4,12.75,13952.0,United Kingdom,2025-12-29
516490,84879,ASSORTED COLOUR BIRD ORNAMENT,8,1.69,13913.0,United Kingdom,2025-12-29
516490,22423,REGENCY CAKESTAND 3 TIER,1,12.75,13913.0,United Kingdom,2025-12-29
516490,21359,RELAX LARGE WOOD LETTERS,1,15.95,13913.0,United Kingdom,2025-12-29
516491,21463,damaged,-27,0.0,,United Kingdom,2025-12-29
516493,84970S,HANGING HEART ZINC T-LIGHT HOLDER,48,0.85,18061.0,United Kingdom,2025-12-29
516493,84970L,SINGLE HEART ZINC T-LIGHT HOLDER,48,0.95,18061.0,United Kingdom,2025-12-29
516493,48138,DOORMAT UNION FLAG,6,7.49,18061.0,United Kingdom,2025-12-29
516493,21523,DOORMAT FANCY FONT HOME SWEET HOME,6,7.49,18061.0,United Kingdom,2025-12-29
516494,22356,CHARLOTTE BAG PINK WITH WHITE SPOTS,10,0.85,13048.0,United Kingdom,2025-12-29
516494,20723,STRAWBERRY CHARLOTTE BAG,10,0.85,13048.0,United Kingdom,2025-12-29
516494,22588,CARD HOLDER GINGHAM HEART,24,2.55,13048.0,United Kingdom,2025-12-29
516494,22589,CARDHOLDER GINGHAM STAR,24,2.55,13048.0,United Kingdom,2025-12-29
516494,22690,DOORMAT HOME SWEET HOME BLUE ,2,7.49,13048.0,United Kingdom,2025-12-29
516494,20685,DOORMAT RED SPOT,4,7.49,13048.0,United Kingdom,2025-12-29
516494,22355,CHARLOTTE BAG SUKI DESIGN,10,0.85,13048.0,United Kingdom,2025-12-29
516494,22275,WEEKEND BAG VINTAGE ROSE PAISLEY,3,8.5,13048.0,United Kingdom,2025-12-29
516494,47591B,SCOTTIES CHILDRENS APRON,2,1.65,13048.0,United Kingdom,2025-12-29
516494,22386,JUMBO BAG PINK WITH WHITE SPOTS,2,1.95,13048.0,United Kingdom,2025-12-29
516494,20724,RED SPOTTY CHARLOTTE BAG,10,0.85,13048.0,United Kingdom,2025-12-29
516494,47589,CONGRATULATIONS BUNTING,4,5.45,13048.0,United Kingdom,2025-12-29
516494,20716,PARTY FOOD SHOPPER BAG,10,1.25,13048.0,United Kingdom,2025-12-29
516494,20717,STRAWBERRY SHOPPER BAG,10,1.25,13048.0,United Kingdom,2025-12-29
516494,22669,RED BABY BUNTING ,5,2.95,13048.0,United Kingdom,2025-12-29
516494,21935,SUKI  SHOULDER BAG,10,1.65,13048.0,United Kingdom,2025-12-29
516494,21930,JUMBO STORAGE BAG SKULLS,10,1.95,13048.0,United Kingdom,2025-12-29
516494,21932,SCANDINAVIAN PAISLEY PICNIC BAG,10,2.95,13048.0,United Kingdom,2025-12-29
516494,85099F,JUMBO BAG STRAWBERRY,10,1.95,13048.0,United Kingdom,2025-12-29
516494,20711,JUMBO BAG TOYS ,10,1.95,13048.0,United Kingdom,2025-12-29
516494,21931,JUMBO STORAGE BAG SUKI,10,1.95,13048.0,United Kingdom,2025-12-29
516494,47590B,PINK HAPPY BIRTHDAY BUNTING,6,5.45,13048.0,United Kingdom,2025-12-29
516494,47592B,SCOTTIE DOGS CHILDRENS OVERALL,3,2.1,13048.0,United Kingdom,2025-12-29
516494,21928,JUMBO BAG SCANDINAVIAN PAISLEY,10,1.95,13048.0,United Kingdom,2025-12-29
516494,22668,PINK BABY BUNTING,5,2.95,13048.0,United Kingdom,2025-12-29
516494,22517,CHILDS GARDEN RAKE PINK,1,2.1,13048.0,United Kingdom,2025-12-29
516494,20726,LUNCH BAG WOODLAND,20,1.65,13048.0,United Kingdom,2025-12-29
516494,22602,CHRISTMAS RETROSPOT HEART WOOD,144,0.72,13048.0,United Kingdom,2025-12-29
516494,21531,RED RETROSPOT SUGAR JAM BOWL,3,2.55,13048.0,United Kingdom,2025-12-29
516494,21533,RETRO SPOT LARGE MILK JUG,4,4.95,13048.0,United Kingdom,2025-12-29
516494,84535B,FAIRY CAKES NOTEBOOK A6 SIZE,6,0.65,13048.0,United Kingdom,2025-12-29
516494,84536A,ENGLISH ROSE NOTEBOOK A7 SIZE,6,0.42,13048.0,United Kingdom,2025-12-29
516494,22188,BLACK HEART CARD HOLDER,6,3.95,13048.0,United Kingdom,2025-12-29
516494,22470,HEART OF WICKER LARGE,5,2.95,13048.0,United Kingdom,2025-12-29
516494,22515,CHILDS GARDEN SPADE PINK,1,2.1,13048.0,United Kingdom,2025-12-29
516494,22516,CHILDS GARDEN RAKE BLUE,1,2.1,13048.0,United Kingdom,2025-12-29
516494,22514,CHILDS GARDEN SPADE BLUE,1,2.1,13048.0,United Kingdom,2025-12-29
516494,22355,CHARLOTTE BAG SUKI DESIGN,10,0.85,13048.0,United Kingdom,2025-12-29
516494,21411,GINGHAM HEART  DOORSTOP RED,3,4.25,13048.0,United Kingdom,2025-12-29
516494,22469,HEART OF WICKER SMALL,10,1.65,13048.0,United Kingdom,2025-12-29
516494,17039,INLAID WOOD INCENSE HOLDER,6,0.29,13048.0,United Kingdom,2025-12-29
516494,22151,PLACE SETTING WHITE HEART,24,0.42,13048.0,United Kingdom,2025-12-29
516494,22152,PLACE SETTING WHITE STAR,24,0.42,13048.0,United Kingdom,2025-12-29
516494,84755,COLOUR GLASS T-LIGHT HOLDER HANGING,16,0.65,13048.0,United Kingdom,2025-12-29
516494,71459,HANGING JAM JAR T-LIGHT HOLDER,12,0.85,13048.0,United Kingdom,2025-12-29
516494,20728,LUNCH BAG CARS BLUE,20,1.65,13048.0,United Kingdom,2025-12-29
516494,20727,LUNCH BAG  BLACK SKULL.,10,1.65,13048.0,United Kingdom,2025-12-29
516494,22384,LUNCH BAG PINK RETROSPOT,20,1.65,13048.0,United Kingdom,2025-12-29
516494,22383,LUNCH BAG SUKI  DESIGN ,20,1.65,13048.0,United Kingdom,2025-12-29
516494,22158,3 HEARTS HANGING DECORATION RUSTIC,16,2.95,13048.0,United Kingdom,2025-12-29
516534,16207A,PINK STRAWBERRY HANDBAG ,2,2.95,,United Kingdom,2025-12-29
516534,21107,CREAM SLICE FLANNEL PINK SPOT ,2,2.95,,United Kingdom,2025-12-29
516534,84912A,PINK ROSE WASHBAG,2,3.75,,United Kingdom,2025-12-29
516534,84912B,GREEN ROSE WASHBAG,1,3.75,,United Kingdom,2025-12-29
516535,22222,CAKE PLATE LOVEBIRD WHITE,3,4.95,16883.0,United Kingdom,2025-12-29
516535,22570,FELTCRAFT CUSHION RABBIT,1,3.75,16883.0,United Kingdom,2025-12-29
516535,22273,FELTCRAFT DOLL MOLLY,1,2.95,16883.0,United Kingdom,2025-12-29
516535,22469,HEART OF WICKER SMALL,5,1.65,16883.0,United Kingdom,2025-12-29
516535,22470,HEART OF WICKER LARGE,5,2.95,16883.0,United Kingdom,2025-12-29
516535,71053,WHITE METAL LANTERN,2,3.75,16883.0,United Kingdom,2025-12-29
516535,79029,GLASS HONEYPOT WASP CATCHER,1,1.95,16883.0,United Kingdom,2025-12-29
516535,22220,CAKE STAND LOVEBIRD 2 TIER WHITE,4,9.95,16883.0,United Kingdom,2025-12-29
516535,22568,FELTCRAFT CUSHION OWL,1,3.75,16883.0,United Kingdom,2025-12-29
516535,22569,FELTCRAFT CUSHION BUTTERFLY,1,3.75,16883.0,United Kingdom,2025-12-29
516535,22271,FELTCRAFT DOLL ROSIE,1,2.95,16883.0,United Kingdom,2025-12-29
516535,22274,FELTCRAFT DOLL EMILY,1,2.95,16883.0,United Kingdom,2025-12-29
516535,22272,FELTCRAFT DOLL MARIA,1,2.95,16883.0,United Kingdom,2025-12-29
516535,22666,RECIPE BOX PANTRY YELLOW DESIGN,2,2.95,16883.0,United Kingdom,2025-12-29
516535,22667,RECIPE BOX RETRO SPOT DESIGN,2,2.95,16883.0,United Kingdom,2025-12-29
516535,22423,REGENCY CAKESTAND 3 TIER,1,12.75,16883.0,United Kingdom,2025-12-29
516536,21988,PACK OF 6 SKULL PAPER PLATES,216,0.64,16422.0,United Kingdom,2025-12-29
516536,21989,PACK OF 20 SKULL PAPER NAPKINS,192,0.64,16422.0,United Kingdom,2025-12-29
516536,21987,PACK OF 6 SKULL PAPER CUPS,192,0.65,16422.0,United Kingdom,2025-12-29
516536,20975,12 PENCILS SMALL TUBE RED SPOTTY,24,0.65,16422.0,United Kingdom,2025-12-29
516536,22090,PAPER BUNTING RETRO SPOTS,40,2.55,16422.0,United Kingdom,2025-12-29
516536,17003,BROCADE RING PURSE ,720,0.16,16422.0,United Kingdom,2025-12-29
516536,21212,PACK OF 72 RETRO SPOT CAKE CASES,120,0.42,16422.0,United Kingdom,2025-12-29
516537,47591B,SCOTTIES CHILDRENS APRON,16,1.65,13795.0,United Kingdom,2025-12-29
516537,21976,PACK OF 60 MUSHROOM CAKE CASES,24,0.55,13795.0,United Kingdom,2025-12-29
516537,84375,SET OF 20 KIDS COOKIE CUTTERS,12,1.95,13795.0,United Kingdom,2025-12-29
516537,84992,72 SWEETHEART FAIRY CAKE CASES,72,0.55,13795.0,United Kingdom,2025-12-29
516537,21213,PACK OF 72 SKULL CAKE CASES,24,0.55,13795.0,United Kingdom,2025-12-29
516537,21212,PACK OF 72 RETRO SPOT CAKE CASES,72,0.55,13795.0,United Kingdom,2025-12-29
516537,22138,BAKING SET 9 PIECE RETROSPOT ,3,4.95,13795.0,United Kingdom,2025-12-29
516537,84991,60 TEATIME FAIRY CAKE CASES,72,0.55,13795.0,United Kingdom,2025-12-29
516538,85099B,JUMBO BAG RED RETROSPOT,100,1.65,16180.0,United Kingdom,2025-12-29
516538,20725,LUNCH BAG RED SPOTTY,30,1.65,16180.0,United Kingdom,2025-12-29
516538,22356,CHARLOTTE BAG PINK WITH WHITE SPOTS,30,0.85,16180.0,United Kingdom,2025-12-29
516538,21232,STRAWBERRY CERAMIC TRINKET BOX,48,1.25,16180.0,United Kingdom,2025-12-29
516538,21231,SWEETHEART CERAMIC TRINKET BOX,48,1.25,16180.0,United Kingdom,2025-12-29
516538,20828,GLITTER BUTTERFLY CLIPS,12,2.55,16180.0,United Kingdom,2025-12-29
516538,85014A,BLACK/BLUE DOTS RUFFLED UMBRELLA,6,5.95,16180.0,United Kingdom,2025-12-29
516538,21933,PINK VINTAGE PAISLEY PICNIC BAG,50,2.55,16180.0,United Kingdom,2025-12-29
516538,21929,JUMBO BAG PINK VINTAGE PAISLEY,100,1.65,16180.0,United Kingdom,2025-12-29
516538,22385,JUMBO BAG SPACEBOY DESIGN,100,1.65,16180.0,United Kingdom,2025-12-29
516538,22444,GROW YOUR OWN PLANT IN A CAN ,24,1.25,16180.0,United Kingdom,2025-12-29
516538,20728,LUNCH BAG CARS BLUE,30,1.65,16180.0,United Kingdom,2025-12-29
516538,22318,FIVE HEART HANGING DECORATION,6,2.95,16180.0,United Kingdom,2025-12-29
516538,20727,LUNCH BAG  BLACK SKULL.,30,1.65,16180.0,United Kingdom,2025-12-29
516538,22423,REGENCY CAKESTAND 3 TIER,1,12.75,16180.0,United Kingdom,2025-12-29
516538,20665,RED SPOTTY PURSE ,6,2.95,16180.0,United Kingdom,2025-12-29
516538,20661,BLUE SPOTTY PURSE ,6,2.95,16180.0,United Kingdom,2025-12-29
516538,22066,LOVE HEART TRINKET POT,24,1.45,16180.0,United Kingdom,2025-12-29
516538,22051,BLUE SCANDINAVIAN PAISLEY WRAP,25,0.42,16180.0,United Kingdom,2025-12-29
