Invoice,StockCode,Description,Quantity,Price,Customer ID,Country,InvoiceDate
516583,84840,SWEETHEART CARRY-ALL BASKET,2,8.5,16416.0,United Kingdom,2025-12-29
516583,22500,SET OF 2 TINS JARDIN DE PROVENCE,4,4.95,16416.0,United Kingdom,2025-12-29
516583,84380,SET OF 3 BUTTERFLY COOKIE CUTTERS,12,1.25,16416.0,United Kingdom,2025-12-29
516583,22478,BIRDHOUSE GARDEN MARKER ,10,1.25,16416.0,United Kingdom,2025-12-29
516583,21313,GLASS HEART T-LIGHT HOLDER ,12,0.85,16416.0,United Kingdom,2025-12-29
516583,22521,CHILDS GARDEN TROWEL PINK,12,0.85,16416.0,United Kingdom,2025-12-29
516583,22523,CHILDS GARDEN FORK PINK,12,0.85,16416.0,United Kingdom,2025-12-29
516583,84378,SET OF 3 HEART COOKIE CUTTERS,12,1.25,16416.0,United Kingdom,2025-12-29
516583,22296,HEART IVORY TRELLIS LARGE,12,1.65,16416.0,United Kingdom,2025-12-29
516583,82607A,GLASS BONBON JAR PARFUME AUX FLEURE,6,1.25,16416.0,United Kingdom,2025-12-29
516583,82483,WOOD 2 DRAWER CABINET WHITE FINISH,2,5.95,16416.0,United Kingdom,2025-12-29
516583,21651,HANGING GLASS ETCHED TEALIGHT,2,1.65,16416.0,United Kingdom,2025-12-29
C516585,22138,BAKING SET 9 PIECE RETROSPOT ,-3,4.95,15732.0,United Kingdom,2025-12-29
C516585,22617,BAKING SET SPACEBOY DESIGN,-3,4.95,15732.0,United Kingdom,2025-12-29
C516584,21527,RED RETROSPOT TRADITIONAL TEAPOT ,-1,7.95,15079.0,United Kingdom,2025-12-29
516586,22430,ENAMEL WATERING CAN CREAM,8,4.95,13102.0,United Kingdom,2025-12-29
516586,22429,ENAMEL MEASURING JUG CREAM,4,4.25,13102.0,United Kingdom,2025-12-29
516586,22428,ENAMEL FIRE BUCKET CREAM,6,6.95,13102.0,United Kingdom,2025-12-29
516586,22380,TOY TIDY SPACEBOY  ,5,2.1,13102.0,United Kingdom,2025-12-29
516586,22424,ENAMEL BREAD BIN CREAM,2,12.75,13102.0,United Kingdom,2025-12-29
516586,22382,LUNCH BAG SPACEBOY DESIGN ,10,1.65,13102.0,United Kingdom,2025-12-29
516586,22630,DOLLY GIRL LUNCH BOX,24,1.95,13102.0,United Kingdom,2025-12-29
516586,22629,SPACEBOY LUNCH BOX ,24,1.95,13102.0,United Kingdom,2025-12-29
516586,22659,LUNCH BOX I LOVE LONDON,24,1.95,13102.0,United Kingdom,2025-12-29
516586,22666,RECIPE BOX PANTRY YELLOW DESIGN,12,2.95,13102.0,United Kingdom,2025-12-29
C516587,M,Manual,-1,12.8,,EIRE,2025-12-29
516588,85123A,WHITE HANGING HEART T-LIGHT HOLDER,6,2.95,17663.0,United Kingdom,2025-12-29
516588,21733,RED HANGING HEART T-LIGHT HOLDER,6,2.95,17663.0,United Kingdom,2025-12-29
516588,21754,HOME BUILDING BLOCK WORD,3,5.95,17663.0,United Kingdom,2025-12-29
516588,72760B,VINTAGE CREAM 3 BASKET CAKE STAND,2,9.95,17663.0,United Kingdom,2025-12-29
516588,21662,VINTAGE GLASS COFFEE CADDY,3,5.95,17663.0,United Kingdom,2025-12-29
516588,40018F,CHERRY DESIGN PAPERLANTERNS,5,1.95,17663.0,United Kingdom,2025-12-29
516588,21471,STRAWBERRY RAFFIA FOOD COVER,12,3.75,17663.0,United Kingdom,2025-12-29
516588,82552,WASHROOM METAL SIGN,12,1.25,17663.0,United Kingdom,2025-12-29
C516589,21239,PINK  SPOTTY CUP,-1,0.85,15005.0,United Kingdom,2025-12-29
C516589,21232,STRAWBERRY CERAMIC TRINKET BOX,-1,1.25,15005.0,United Kingdom,2025-12-29
C516589,37450,CERAMIC CAKE BOWL + HANGING CAKES,-2,2.95,15005.0,United Kingdom,2025-12-29
C516589,21843,RED RETROSPOT CAKE STAND,-1,10.95,15005.0,United Kingdom,2025-12-29
516590,22470,HEART OF WICKER LARGE,1,2.95,15005.0,United Kingdom,2025-12-29
516590,84508A,CAMOUFLAGE DESIGN TEDDY,2,2.55,15005.0,United Kingdom,2025-12-29
516590,84507B,STRIPES DESIGN MONKEY DOLL,2,2.55,15005.0,United Kingdom,2025-12-29
516590,84507C,BLUE CIRCLES DESIGN MONKEY DOLL,2,2.55,15005.0,United Kingdom,2025-12-29
516590,84898F,YELLOW FLOWERS FELT HANDBAG KIT,4,2.1,15005.0,United Kingdom,2025-12-29
516590,48185,DOORMAT FAIRY CAKE,1,7.49,15005.0,United Kingdom,2025-12-29
516590,82616A,BUBBLE GUM SCARF KNITTING KIT,2,2.95,15005.0,United Kingdom,2025-12-29
516590,22469,HEART OF WICKER SMALL,4,1.65,15005.0,United Kingdom,2025-12-29
516590,22325,MOBILE VINTAGE HEARTS ,2,4.95,15005.0,United Kingdom,2025-12-29
516590,21232,STRAWBERRY CERAMIC TRINKET BOX,7,1.25,15005.0,United Kingdom,2025-12-29
516590,84406B,CREAM CUPID HEARTS COAT HANGER,2,3.25,15005.0,United Kingdom,2025-12-29
516590,21470,FLOWER VINE RAFFIA FOOD COVER,1,3.75,15005.0,United Kingdom,2025-12-29
516590,21469,POLKA DOT RAFFIA FOOD COVER,1,3.75,15005.0,United Kingdom,2025-12-29
516590,22326,ROUND SNACK BOXES SET OF4 WOODLAND ,1,2.95,15005.0,United Kingdom,2025-12-29
516590,22659,LUNCH BOX I LOVE LONDON,2,1.95,15005.0,United Kingdom,2025-12-29
516590,22630,DOLLY GIRL LUNCH BOX,2,1.95,15005.0,United Kingdom,2025-12-29
516590,22629,SPACEBOY LUNCH BOX ,2,1.95,15005.0,United Kingdom,2025-12-29
516590,22063,CERAMIC BOWL WITH STRAWBERRY DESIGN,2,2.95,15005.0,United Kingdom,2025-12-29
516590,22059,CERAMIC STRWBERRY DESIGN MUG,4,1.49,15005.0,United Kingdom,2025-12-29
516590,37450,CERAMIC CAKE BOWL + HANGING CAKES,2,2.95,15005.0,United Kingdom,2025-12-29
516590,48194,DOORMAT HEARTS,1,7.49,15005.0,United Kingdom,2025-12-29
516590,21231,SWEETHEART CERAMIC TRINKET BOX,7,1.25,15005.0,United Kingdom,2025-12-29
516590,20719,WOODLAND CHARLOTTE BAG,10,0.85,15005.0,United Kingdom,2025-12-29
516590,22646,CERAMIC STRAWBERRY CAKE MONEY BANK,4,1.45,15005.0,United Kingdom,2025-12-29
516590,20724,RED SPOTTY CHARLOTTE BAG,10,0.85,15005.0,United Kingdom,2025-12-29
516590,22356,CHARLOTTE BAG PINK WITH WHITE SPOTS,10,0.85,15005.0,United Kingdom,2025-12-29
516590,22645,CERAMIC HEART FAIRY CAKE MONEY BANK,4,1.45,15005.0,United Kingdom,2025-12-29
516590,22644,CERAMIC CHERRY CAKE MONEY BANK,4,1.45,15005.0,United Kingdom,2025-12-29
516590,22139,RETRO SPOT TEA SET CERAMIC 11 PC ,1,4.95,15005.0,United Kingdom,2025-12-29
516590,22382,LUNCH BAG SPACEBOY DESIGN ,2,1.65,15005.0,United Kingdom,2025-12-29
516590,20725,LUNCH BAG RED SPOTTY,2,1.65,15005.0,United Kingdom,2025-12-29
516590,20723,STRAWBERRY CHARLOTTE BAG,10,0.85,15005.0,United Kingdom,2025-12-29
516590,22138,BAKING SET 9 PIECE RETROSPOT ,2,4.95,15005.0,United Kingdom,2025-12-29
516590,84997C,BLUE 3 PIECE MINI DOTS CUTLERY SET,2,3.75,15005.0,United Kingdom,2025-12-29
516590,85099F,JUMBO BAG STRAWBERRY,3,1.95,15005.0,United Kingdom,2025-12-29
516590,20726,LUNCH BAG WOODLAND,2,1.65,15005.0,United Kingdom,2025-12-29
516590,22386,JUMBO BAG PINK WITH WHITE SPOTS,2,1.95,15005.0,United Kingdom,2025-12-29
516590,21930,JUMBO STORAGE BAG SKULLS,2,1.95,15005.0,United Kingdom,2025-12-29
516590,21929,JUMBO BAG PINK VINTAGE PAISLEY,2,1.95,15005.0,United Kingdom,2025-12-29
516590,22663,JUMBO BAG DOLLY GIRL DESIGN,2,1.95,15005.0,United Kingdom,2025-12-29
516590,85099C,JUMBO  BAG BAROQUE BLACK WHITE,2,1.95,15005.0,United Kingdom,2025-12-29
516590,20727,LUNCH BAG  BLACK SKULL.,2,1.65,15005.0,United Kingdom,2025-12-29
516590,22661,CHARLOTTE BAG DOLLY GIRL DESIGN,20,0.85,15005.0,United Kingdom,2025-12-29
516590,22355,CHARLOTTE BAG SUKI DESIGN,10,0.85,15005.0,United Kingdom,2025-12-29
516590,22662,LUNCH BAG DOLLY GIRL DESIGN,3,1.65,15005.0,United Kingdom,2025-12-29
516590,22383,LUNCH BAG SUKI  DESIGN ,2,1.65,15005.0,United Kingdom,2025-12-29
516590,21928,JUMBO BAG SCANDINAVIAN PAISLEY,2,1.95,15005.0,United Kingdom,2025-12-29
516591,21508,VINTAGE KID DOLLY CARD ,24,0.42,12872.0,United Kingdom,2025-12-29
516591,21507,"ELEPHANT, BIRTHDAY CARD, ",24,0.42,12872.0,United Kingdom,2025-12-29
516591,21307,SET/4 BUTTERFLY MIRROR MAGNETS,4,2.1,12872.0,United Kingdom,2025-12-29
516591,21293,MIRRORED DOVE WALL DECORATION,5,2.1,12872.0,United Kingdom,2025-12-29
516591,21361,LOVE LARGE WOOD LETTERS ,1,12.75,12872.0,United Kingdom,2025-12-29
516591,47590B,PINK HAPPY BIRTHDAY BUNTING,3,5.45,12872.0,United Kingdom,2025-12-29
516591,21704,BAG 250g SWIRLY MARBLES,3,0.85,12872.0,United Kingdom,2025-12-29
516591,21755,LOVE BUILDING BLOCK WORD,2,5.95,12872.0,United Kingdom,2025-12-29
516591,21621,VINTAGE UNION JACK BUNTING,5,8.5,12872.0,United Kingdom,2025-12-29
516591,21509,COWBOYS AND INDIANS BIRTHDAY CARD ,24,0.42,12872.0,United Kingdom,2025-12-29
516591,21754,HOME BUILDING BLOCK WORD,2,5.95,12872.0,United Kingdom,2025-12-29
516591,21172,PARTY METAL SIGN ,12,1.45,12872.0,United Kingdom,2025-12-29
516591,84625A,PINK NEW BAROQUECANDLESTICK CANDLE,2,2.95,12872.0,United Kingdom,2025-12-29
516591,85152,HAND OVER THE CHOCOLATE   SIGN ,2,2.1,12872.0,United Kingdom,2025-12-29
516591,22197,SMALL POPCORN HOLDER,11,0.85,12872.0,United Kingdom,2025-12-29
516591,82600,NO SINGING METAL SIGN,3,2.1,12872.0,United Kingdom,2025-12-29
516591,21876,POTTERING MUG,4,1.25,12872.0,United Kingdom,2025-12-29
516591,84625C,BLUE NEW BAROQUE CANDLESTICK CANDLE,2,2.95,12872.0,United Kingdom,2025-12-29
516591,84625D,WHITE NEWBAROQUE CANDLESTICK CANDLE,2,2.95,12872.0,United Kingdom,2025-12-29
516591,21066,VINTAGE RED MUG,3,1.25,12872.0,United Kingdom,2025-12-29
516591,85123A,WHITE HANGING HEART T-LIGHT HOLDER,9,2.95,12872.0,United Kingdom,2025-12-29
516591,16043,POP ART PUSH DOWN RUBBER ,1,0.42,12872.0,United Kingdom,2025-12-29
516591,84975,HEART SHAPED MIRROR,12,1.69,12872.0,United Kingdom,2025-12-29
516591,21174,POTTERING IN THE SHED METAL SIGN,4,1.95,12872.0,United Kingdom,2025-12-29
516591,21907,I'M ON HOLIDAY METAL SIGN,5,2.1,12872.0,United Kingdom,2025-12-29
516592,84839,SWEETHEART KEY CABINET,1,6.75,17961.0,United Kingdom,2025-12-29
516592,21333,CLASSIC WHITE FRAME,3,2.95,17961.0,United Kingdom,2025-12-29
516592,85123A,WHITE HANGING HEART T-LIGHT HOLDER,1,2.95,17961.0,United Kingdom,2025-12-29
516593,85099C,JUMBO  BAG BAROQUE BLACK WHITE,10,1.95,17469.0,United Kingdom,2025-12-29
516593,85099F,JUMBO BAG STRAWBERRY,10,1.95,17469.0,United Kingdom,2025-12-29
516593,21931,JUMBO STORAGE BAG SUKI,10,1.95,17469.0,United Kingdom,2025-12-29
516593,21217,RED SPOTTY ROUND CAKE TINS,4,9.95,17469.0,United Kingdom,2025-12-29
516593,85123A,WHITE HANGING HEART T-LIGHT HOLDER,12,2.95,17469.0,United Kingdom,2025-12-29
516593,21164,HOME SWEET HOME METAL SIGN ,6,2.95,17469.0,United Kingdom,2025-12-29
516593,22558,CLOTHES PEGS RETROSPOT PACK 24 ,12,1.25,17469.0,United Kingdom,2025-12-29
516593,22383,LUNCH BAG SUKI  DESIGN ,10,1.65,17469.0,United Kingdom,2025-12-29
516593,21870,I CAN ONLY PLEASE ONE PERSON MUG,12,1.25,17469.0,United Kingdom,2025-12-29
516593,20914,SET/5 RED SPOTTY LID GLASS BOWLS,6,2.95,17469.0,United Kingdom,2025-12-29
516593,22628,PICNIC BOXES SET OF 3 RETROSPOT ,6,4.95,17469.0,United Kingdom,2025-12-29
516593,21936,RED RETROSPOT PICNIC BAG,5,2.95,17469.0,United Kingdom,2025-12-29
516593,21937,STRAWBERRY   PICNIC BAG,5,2.95,17469.0,United Kingdom,2025-12-29
516593,21466,RED FLOWER CROCHET FOOD COVER,6,3.75,17469.0,United Kingdom,2025-12-29
C516594,21395,BLUE SPOTTY BEAKER ,-10,1.95,15981.0,United Kingdom,2025-12-29
516595,22083,PAPER CHAIN KIT RETRO SPOT,1,2.95,17757.0,United Kingdom,2025-12-29
516595,21789,KIDS RAIN MAC PINK,5,0.85,17757.0,United Kingdom,2025-12-29
516595,21788,KIDS RAIN MAC BLUE,3,0.85,17757.0,United Kingdom,2025-12-29
516595,22659,LUNCH BOX I LOVE LONDON,3,1.95,17757.0,United Kingdom,2025-12-29
516595,22631,CIRCUS PARADE LUNCH BOX ,2,1.95,17757.0,United Kingdom,2025-12-29
516595,85054,FRENCH ENAMEL POT W LID,1,2.95,17757.0,United Kingdom,2025-12-29
516595,22367,CHILDRENS APRON SPACEBOY DESIGN,3,1.95,17757.0,United Kingdom,2025-12-29
516595,21156,RETROSPOT CHILDRENS APRON,2,1.95,17757.0,United Kingdom,2025-12-29
516595,22630,DOLLY GIRL LUNCH BOX,2,1.95,17757.0,United Kingdom,2025-12-29
516595,21218,RED SPOTTY BISCUIT TIN,1,3.75,17757.0,United Kingdom,2025-12-29
516595,22629,SPACEBOY LUNCH BOX ,2,1.95,17757.0,United Kingdom,2025-12-29
516595,21900,"KEY FOB , SHED",1,0.65,17757.0,United Kingdom,2025-12-29
516595,22197,SMALL POPCORN HOLDER,3,0.85,17757.0,United Kingdom,2025-12-29
516595,22198,LARGE POPCORN HOLDER ,3,1.65,17757.0,United Kingdom,2025-12-29
516595,22625,RED KITCHEN SCALES,1,8.5,17757.0,United Kingdom,2025-12-29
516595,22625,RED KITCHEN SCALES,1,8.5,17757.0,United Kingdom,2025-12-29
516595,22502,PICNIC BASKET WICKER SMALL,2,4.25,17757.0,United Kingdom,2025-12-29
516595,85014B,RED/WHITE DOTS RUFFLED UMBRELLA,2,5.95,17757.0,United Kingdom,2025-12-29
516595,22426,ENAMEL WASH BOWL CREAM,2,3.75,17757.0,United Kingdom,2025-12-29
516595,22430,ENAMEL WATERING CAN CREAM,2,4.95,17757.0,United Kingdom,2025-12-29
516595,22427,ENAMEL FLOWER JUG CREAM,1,5.95,17757.0,United Kingdom,2025-12-29
516595,22329,ROUND CONTAINER SET OF 5 RETROSPOT,1,1.65,17757.0,United Kingdom,2025-12-29
C516596,22487,WHITE WOOD GARDEN PLANT LADDER,-1,8.5,13078.0,United Kingdom,2025-12-29
C516596,85124A,PINK JUICY FRUIT PHOTO FRAME,-1,2.55,13078.0,United Kingdom,2025-12-29
C516597,21540,DAIRY MAID BUTTER DISH,-7,3.75,16701.0,United Kingdom,2025-12-29
C516598,21769,VINTAGE POST OFFICE CABINET,-1,79.95,13895.0,United Kingdom,2025-12-29
C516599,85059,FRENCH ENAMEL WATER BASIN,-1,3.75,16054.0,United Kingdom,2025-12-29
C516600,22341,LOVE GARLAND PAINTED ZINC ,-12,1.65,13012.0,United Kingdom,2025-12-29
C516600,21217,RED SPOTTY ROUND CAKE TINS,-1,9.95,13012.0,United Kingdom,2025-12-29
C516600,21918,SET 12 KIDS COLOUR  CHALK STICKS,-4,0.42,13012.0,United Kingdom,2025-12-29
516601,47502,POLKADOT CUTLERY 24 PCS IN TRAY,20,9.95,16029.0,United Kingdom,2025-12-29
516601,72760B,VINTAGE CREAM 3 BASKET CAKE STAND,32,8.49,16029.0,United Kingdom,2025-12-29
516601,21928,JUMBO BAG SCANDINAVIAN PAISLEY,100,1.65,16029.0,United Kingdom,2025-12-29
516601,85099C,JUMBO  BAG BAROQUE BLACK WHITE,100,1.65,16029.0,United Kingdom,2025-12-29
516601,85099B,JUMBO BAG RED RETROSPOT,100,1.65,16029.0,United Kingdom,2025-12-29
C516602,21784,SHOE SHINE BOX ,-1,9.95,14938.0,Channel Islands,2025-12-29
C516602,85170A,SET/6 IVORY BIRD T-LIGHT CANDLES,-4,2.1,14938.0,Channel Islands,2025-12-29
C516602,21145,ANTIQUE GLASS PLACE SETTING,-1,1.25,14938.0,Channel Islands,2025-12-29
C516602,21666,RIDGED GLASS T-LIGHT HOLDER,-1,0.65,14938.0,Channel Islands,2025-12-29
C516603,21877,HOME SWEET HOME MUG,-2,1.25,16556.0,United Kingdom,2025-12-29
C516604,84078A,SET/4 WHITE RETRO STORAGE CUBES ,-1,34.95,17680.0,United Kingdom,2025-12-29
C516605,22423,REGENCY CAKESTAND 3 TIER,-2,10.95,14299.0,United Kingdom,2025-12-29
C516606,84625D,WHITE NEWBAROQUE CANDLESTICK CANDLE,-3,2.95,14766.0,United Kingdom,2025-12-29
C516606,21320,GLASS CHALICE GREEN  LARGE ,-2,2.55,14766.0,United Kingdom,2025-12-29
C516606,79000,MOROCCAN TEA GLASS,-3,0.85,14766.0,United Kingdom,2025-12-29
C516606,84927D,LA PALMIERA TILE HOOK,-1,2.1,14766.0,United Kingdom,2025-12-29
C516606,21539,RED RETROSPOT BUTTER DISH,-1,4.95,14766.0,United Kingdom,2025-12-29
516607,22661,CHARLOTTE BAG DOLLY GIRL DESIGN,10,0.85,13444.0,United Kingdom,2025-12-29
516607,22411,JUMBO SHOPPER VINTAGE RED PAISLEY,10,1.95,13444.0,United Kingdom,2025-12-29
516607,22585,PACK OF 6 BIRDY GIFT TAGS,4,1.25,13444.0,United Kingdom,2025-12-29
516607,22584,PACK OF 6 PANNETONE GIFT BOXES,2,2.55,13444.0,United Kingdom,2025-12-29
516607,22582,PACK OF 6 SWEETIE GIFT BOXES,2,2.55,13444.0,United Kingdom,2025-12-29
516607,84670,JAPANESE CROCHETED ANIMAL,12,0.42,13444.0,United Kingdom,2025-12-29
516607,84270,ASSTD DESIGN BUBBLE GUM RING,30,0.21,13444.0,United Kingdom,2025-12-29
516607,85114A,BLACK ENCHANTED FOREST PLACEMAT,8,1.65,13444.0,United Kingdom,2025-12-29
516607,85114C,RED ENCHANTED FOREST PLACEMAT,8,1.65,13444.0,United Kingdom,2025-12-29
516607,85114B,IVORY ENCHANTED FOREST PLACEMAT,8,1.65,13444.0,United Kingdom,2025-12-29
516607,21612,SET 12 WILDFLOWER BOTANICAL T-LIGHT,3,2.95,13444.0,United Kingdom,2025-12-29
516607,22300,COFFEE MUG DOG + BALL DESIGN,6,2.55,13444.0,United Kingdom,2025-12-29
516607,21621,VINTAGE UNION JACK BUNTING,2,8.5,13444.0,United Kingdom,2025-12-29
516608,22641,SET OF 4 NAPKIN CHARMS INSTRUMENT,1,2.55,17961.0,United Kingdom,2025-12-29
516608,22033,BOTANICAL ROSE GREETING CARD,5,0.42,17961.0,United Kingdom,2025-12-29
516608,22030,SWALLOWS GREETING CARD,3,0.42,17961.0,United Kingdom,2025-12-29
516608,22419,LIPSTICK PEN RED,1,0.42,17961.0,United Kingdom,2025-12-29
516608,90128A,PINK LEAVES AND BEADS PHONE CHARM,1,1.25,17961.0,United Kingdom,2025-12-29
516608,90119,METALIC LEAVES BAG CHARMS,1,2.55,17961.0,United Kingdom,2025-12-29
516608,17012A,ORIGAMI VANILLA INCENSE/CANDLE SET ,1,2.55,17961.0,United Kingdom,2025-12-29
516608,17012B,ORIGAMI JASMINE INCENSE/CANDLE SET,1,2.55,17961.0,United Kingdom,2025-12-29
516608,17012C,ORIGAMI LAVENDER INCENSE/CANDL SET ,1,2.55,17961.0,United Kingdom,2025-12-29
516608,17012D,ORIGAMI ROSE INCENSE/CANDLE SET ,1,2.55,17961.0,United Kingdom,2025-12-29
516608,17012F,ORIGAMI SANDLEWOOD INCENSE/CAND SET,1,2.55,17961.0,United Kingdom,2025-12-29
516608,17003,BROCADE RING PURSE ,2,0.21,17961.0,United Kingdom,2025-12-29
516608,21289,LARGE STRIPES CHOCOLATE GIFT BAG,6,1.25,17961.0,United Kingdom,2025-12-29
516609,21746,SMALL RED RETROSPOT WINDMILL,6,1.25,17338.0,United Kingdom,2025-12-29
516609,22558,CLOTHES PEGS RETROSPOT PACK 24 ,1,1.25,17338.0,United Kingdom,2025-12-29
516609,22434,BALLOON PUMP WITH 10 BALLOONS,3,1.95,17338.0,United Kingdom,2025-12-29
516609,22436,12 COLOURED PARTY BALLOONS,10,0.65,17338.0,United Kingdom,2025-12-29
516609,22440,BALLOON WATER BOMB PACK OF 35,10,0.42,17338.0,United Kingdom,2025-12-29
516609,22212,FOUR HOOK  WHITE LOVEBIRDS,1,2.1,17338.0,United Kingdom,2025-12-29
516609,22520,CHILDS GARDEN TROWEL BLUE ,3,0.85,17338.0,United Kingdom,2025-12-29
516609,22521,CHILDS GARDEN TROWEL PINK,3,0.85,17338.0,United Kingdom,2025-12-29
516609,47591D,PINK FAIRY CAKE CHILDRENS APRON,1,1.95,17338.0,United Kingdom,2025-12-29
516609,22523,CHILDS GARDEN FORK PINK,3,0.85,17338.0,United Kingdom,2025-12-29
516609,21749,LARGE RED RETROSPOT WINDMILL,3,2.1,17338.0,United Kingdom,2025-12-29
516609,22501,PICNIC BASKET WICKER LARGE,2,9.95,17338.0,United Kingdom,2025-12-29
516609,21156,RETROSPOT CHILDRENS APRON,3,1.95,17338.0,United Kingdom,2025-12-29
516609,47593A,CAROUSEL PONIES BABY BIB,4,1.25,17338.0,United Kingdom,2025-12-29
516609,21324,HANGING MEDINA LANTERN SMALL,2,2.95,17338.0,United Kingdom,2025-12-29
516609,17091A,LAVENDER INCENSE IN TIN,6,1.25,17338.0,United Kingdom,2025-12-29
516609,79321,CHILLI LIGHTS,2,4.95,17338.0,United Kingdom,2025-12-29
516609,22522,CHILDS GARDEN FORK BLUE ,3,0.85,17338.0,United Kingdom,2025-12-29
516609,17091J,VANILLA INCENSE IN TIN,6,1.25,17338.0,United Kingdom,2025-12-29
516609,79067,CORONA MEXICAN TRAY,6,3.75,17338.0,United Kingdom,2025-12-29
516609,20762,GREEN FERN SKETCHBOOK ,2,3.75,17338.0,United Kingdom,2025-12-29
516609,20914,SET/5 RED SPOTTY LID GLASS BOWLS,3,2.95,17338.0,United Kingdom,2025-12-29
516609,22667,RECIPE BOX RETRO SPOT DESIGN,6,2.95,17338.0,United Kingdom,2025-12-29
516609,21154,RED SPOTTY OVEN GLOVE ,3,1.25,17338.0,United Kingdom,2025-12-29
516609,22558,CLOTHES PEGS RETROSPOT PACK 24 ,3,1.25,17338.0,United Kingdom,2025-12-29
516609,22465,HANGING METAL STAR LANTERN,12,1.65,17338.0,United Kingdom,2025-12-29
516609,21471,STRAWBERRY RAFFIA FOOD COVER,1,3.75,17338.0,United Kingdom,2025-12-29
516609,21467,CHERRY CROCHET FOOD COVER,1,3.75,17338.0,United Kingdom,2025-12-29
516609,21470,FLOWER VINE RAFFIA FOOD COVER,1,3.75,17338.0,United Kingdom,2025-12-29
516609,18098C,PORCELAIN BUTTERFLY OIL BURNER,3,2.95,17338.0,United Kingdom,2025-12-29
516609,21465,PINK FLOWER CROCHET FOOD COVER,1,3.75,17338.0,United Kingdom,2025-12-29
516609,84406B,CREAM CUPID HEARTS COAT HANGER,4,3.25,17338.0,United Kingdom,2025-12-29
516609,22212,FOUR HOOK  WHITE LOVEBIRDS,3,2.1,17338.0,United Kingdom,2025-12-29
516609,75131,METAL TUBE CHIME ON BAMBOO,3,1.69,17338.0,United Kingdom,2025-12-29
516609,35160,BUDDHA INCENSE HOLDER ASSORTED,8,0.85,17338.0,United Kingdom,2025-12-29
516609,20778,GARDEN PATH NOTEBOOK ,5,1.65,17338.0,United Kingdom,2025-12-29
516609,15036,ASSORTED COLOURS SILK FAN,24,0.75,17338.0,United Kingdom,2025-12-29
516609,85040A,S/4 PINK FLOWER CANDLES IN BOWL,4,1.65,17338.0,United Kingdom,2025-12-29
516609,20774,GREEN FERN NOTEBOOK,4,1.65,17338.0,United Kingdom,2025-12-29
516609,22348,TEA BAG PLATE RED SPOTTY ,3,0.85,17338.0,United Kingdom,2025-12-29
516609,71459,HANGING JAM JAR T-LIGHT HOLDER,12,0.85,17338.0,United Kingdom,2025-12-29
516609,85099B,JUMBO BAG RED RETROSPOT,3,1.95,17338.0,United Kingdom,2025-12-29
516609,85099C,JUMBO  BAG BAROQUE BLACK WHITE,4,1.95,17338.0,United Kingdom,2025-12-29
516609,21796,SET OF 3 RED STRIPE BASKETS,1,12.75,17338.0,United Kingdom,2025-12-29
516609,17165D,ASS COL LARGE SAND FROG P'WEIGHT,6,1.05,17338.0,United Kingdom,2025-12-29
516609,22637,PIGGY BANK RETROSPOT ,8,2.55,17338.0,United Kingdom,2025-12-29
516609,20970,PINK FLORAL FELTCRAFT SHOULDER BAG,1,3.75,17338.0,United Kingdom,2025-12-29
516609,20967,GREY FLORAL FELTCRAFT SHOULDER BAG,1,3.75,17338.0,United Kingdom,2025-12-29
516609,20969,RED FLORAL FELTCRAFT SHOULDER BAG,2,3.75,17338.0,United Kingdom,2025-12-29
516609,20967,GREY FLORAL FELTCRAFT SHOULDER BAG,1,3.75,17338.0,United Kingdom,2025-12-29
516609,21890,S/6 WOODEN SKITTLES IN COTTON BAG,4,2.95,17338.0,United Kingdom,2025-12-29
516609,79071B,ENGLISH ROSE METAL WASTE BIN,1,2.95,17338.0,United Kingdom,2025-12-29
516609,21918,SET 12 KIDS COLOUR  CHALK STICKS,6,0.42,17338.0,United Kingdom,2025-12-29
516609,15044D,RED PAPER PARASOL,1,2.95,17338.0,United Kingdom,2025-12-29
516609,15044B,BLUE PAPER PARASOL ,4,2.95,17338.0,United Kingdom,2025-12-29
516609,15039,SANDALWOOD FAN,12,0.85,17338.0,United Kingdom,2025-12-29
516609,47593A,CAROUSEL PONIES BABY BIB,1,1.25,17338.0,United Kingdom,2025-12-29
516609,47591D,PINK FAIRY CAKE CHILDRENS APRON,2,1.95,17338.0,United Kingdom,2025-12-29
516609,40001,WHITE BAMBOO RIBS LAMPSHADE,5,0.85,17338.0,United Kingdom,2025-12-29
516609,40003,WHITE BAMBOO RIBS LAMPSHADE,4,1.25,17338.0,United Kingdom,2025-12-29
516609,85040B,SET/4 BLUE FLOWER CANDLES IN BOWL,12,1.65,17338.0,United Kingdom,2025-12-29
516609,21916,SET 12 RETRO WHITE CHALK STICKS,6,0.42,17338.0,United Kingdom,2025-12-29
516609,22551,PLASTERS IN TIN SPACEBOY,3,1.65,17338.0,United Kingdom,2025-12-29
516609,21791,VINTAGE HEADS AND TAILS CARD GAME ,3,1.25,17338.0,United Kingdom,2025-12-29
516609,15044D,RED PAPER PARASOL,3,2.95,17338.0,United Kingdom,2025-12-29
516609,21324,HANGING MEDINA LANTERN SMALL,1,2.95,17338.0,United Kingdom,2025-12-29
516609,22557,PLASTERS IN TIN VINTAGE PAISLEY ,3,1.65,17338.0,United Kingdom,2025-12-29
516609,84673A,PINK FLY SWAT,3,0.65,17338.0,United Kingdom,2025-12-29
516609,84673B,BLUE FLY SWAT,3,0.65,17338.0,United Kingdom,2025-12-29
516609,85123A,WHITE HANGING HEART T-LIGHT HOLDER,6,2.95,17338.0,United Kingdom,2025-12-29
516609,22441,GROW YOUR OWN BASIL IN ENAMEL MUG,3,2.1,17338.0,United Kingdom,2025-12-29
516609,72351B,SET/6 PINK  BUTTERFLY T-LIGHTS,4,2.1,17338.0,United Kingdom,2025-12-29
516609,72349B,SET/6 PURPLE BUTTERFLY T-LIGHTS,3,2.1,17338.0,United Kingdom,2025-12-29
516609,72351A,SET/6 TURQUOISE BUTTERFLY T-LIGHTS,3,2.1,17338.0,United Kingdom,2025-12-29
516609,21414,SCALLOP SHELL SOAP DISH,2,2.1,17338.0,United Kingdom,2025-12-29
516609,22271,FELTCRAFT DOLL ROSIE,1,2.95,17338.0,United Kingdom,2025-12-29
516609,22272,FELTCRAFT DOLL MARIA,2,2.95,17338.0,United Kingdom,2025-12-29
516609,22570,FELTCRAFT CUSHION RABBIT,2,3.75,17338.0,United Kingdom,2025-12-29
516609,22271,FELTCRAFT DOLL ROSIE,1,2.95,17338.0,United Kingdom,2025-12-29
516609,22569,FELTCRAFT CUSHION BUTTERFLY,2,3.75,17338.0,United Kingdom,2025-12-29
516609,22274,FELTCRAFT DOLL EMILY,2,2.95,17338.0,United Kingdom,2025-12-29
516609,84859C,PINK DISCO HANDBAG,2,5.95,17338.0,United Kingdom,2025-12-29
516609,21414,SCALLOP SHELL SOAP DISH,1,2.1,17338.0,United Kingdom,2025-12-29
516609,17091B,JASMINE TEA INCENSE IN TIN,6,1.25,17338.0,United Kingdom,2025-12-29
516610,22492,MINI PAINT SET VINTAGE ,36,0.65,13615.0,United Kingdom,2025-12-29
516610,22301,COFFEE MUG CAT + BIRD DESIGN,6,2.55,13615.0,United Kingdom,2025-12-29
516610,22300,COFFEE MUG DOG + BALL DESIGN,6,2.55,13615.0,United Kingdom,2025-12-29
516610,20765,CHRYSANTHEMUM SKETCHBOOK ,4,3.75,13615.0,United Kingdom,2025-12-29
516610,22236,CAKE STAND 3 TIER MAGIC GARDEN,1,12.75,13615.0,United Kingdom,2025-12-29
516610,20772,GARDEN PATH JOURNAL,6,2.55,13615.0,United Kingdom,2025-12-29
516610,22567,20 DOLLY PEGS RETROSPOT,12,1.25,13615.0,United Kingdom,2025-12-29
516610,22303,COFFEE MUG APPLES DESIGN,6,2.55,13615.0,United Kingdom,2025-12-29
516610,22637,PIGGY BANK RETROSPOT ,6,2.55,13615.0,United Kingdom,2025-12-29
516610,21531,RED RETROSPOT SUGAR JAM BOWL,6,2.55,13615.0,United Kingdom,2025-12-29
516610,22139,RETRO SPOT TEA SET CERAMIC 11 PC ,3,4.95,13615.0,United Kingdom,2025-12-29
516610,22180,RETRO SPOT LAMP,1,9.95,13615.0,United Kingdom,2025-12-29
516610,22138,BAKING SET 9 PIECE RETROSPOT ,3,4.95,13615.0,United Kingdom,2025-12-29
516610,22073,RED RETROSPOT STORAGE JAR,4,3.75,13615.0,United Kingdom,2025-12-29
516610,21844,RED RETROSPOT MUG,6,2.95,13615.0,United Kingdom,2025-12-29
516610,21668,RED STRIPE CERAMIC DRAWER KNOB,12,1.25,13615.0,United Kingdom,2025-12-29
516610,21539,RED RETROSPOT BUTTER DISH,3,4.95,13615.0,United Kingdom,2025-12-29
516610,21535,RED RETROSPOT SMALL MILK JUG,6,2.55,13615.0,United Kingdom,2025-12-29
516610,20771,CHRYSANTHEMUM  JOURNAL,6,2.55,13615.0,United Kingdom,2025-12-29
516610,22348,TEA BAG PLATE RED SPOTTY ,12,0.85,13615.0,United Kingdom,2025-12-29
516610,15056N,EDWARDIAN PARASOL NATURAL,3,5.95,13615.0,United Kingdom,2025-12-29
516610,21212,PACK OF 72 RETRO SPOT CAKE CASES,24,0.55,13615.0,United Kingdom,2025-12-29
516610,22507,MEMO BOARD RETROSPOT  DESIGN,4,4.95,13615.0,United Kingdom,2025-12-29
516610,21533,RETRO SPOT LARGE MILK JUG,3,4.95,13615.0,United Kingdom,2025-12-29
516610,21217,RED SPOTTY ROUND CAKE TINS,1,9.95,13615.0,United Kingdom,2025-12-29
516610,21080,SET/20 RED SPOTTY PAPER NAPKINS ,12,0.85,13615.0,United Kingdom,2025-12-29
516610,20979,36 PENCILS TUBE RED SPOTTY,16,1.25,13615.0,United Kingdom,2025-12-29
516610,20685,DOORMAT RED SPOT,2,7.49,13615.0,United Kingdom,2025-12-29
516610,22636,CHILDS BREAKFAST SET CIRCUS PARADE,2,8.5,13615.0,United Kingdom,2025-12-29
516610,22635,CHILDS BREAKFAST SET DOLLY GIRL ,2,9.95,13615.0,United Kingdom,2025-12-29
516610,22655,VINTAGE RED KITCHEN CABINET,1,295.0,13615.0,United Kingdom,2025-12-29
