Invoice,StockCode,Description,Quantity,Price,Customer ID,Country,InvoiceDate
516470,40016,CHINESE DRAGON PAPER LANTERNS,2,8.47,,United Kingdom,2025-12-28
516470,46776F,WOVEN ROSE GARDEN CUSHION COVER ,2,4.21,,United Kingdom,2025-12-28
516470,22567,20 DOLLY PEGS RETROSPOT,2,2.51,,United Kingdom,2025-12-28
516470,22502,PICNIC BASKET WICKER SMALL,1,8.47,,United Kingdom,2025-12-28
516470,22508,DOORSTOP RETROSPOT HEART,1,7.62,,United Kingdom,2025-12-28
516470,22528,GARDENERS KNEELING PAD,1,2.51,,United Kingdom,2025-12-28
516470,22533,MAGIC DRAWING SLATE BAKE A CAKE ,1,0.85,,United Kingdom,2025-12-28
516470,20676,RED SPOTTY BOWL,1,2.51,,United Kingdom,2025-12-28
516470,22534,MAGIC DRAWING SLATE SPACEBOY ,1,0.85,,United Kingdom,2025-12-28
516470,37503,TEA TIME CAKE STAND IN GIFT BOX,1,21.23,,United Kingdom,2025-12-28
516470,22568,FELTCRAFT CUSHION OWL,1,7.62,,United Kingdom,2025-12-28
516470,22577,WOODEN HEART CHRISTMAS SCANDINAVIAN,20,1.66,,United Kingdom,2025-12-28
516470,22585,PACK OF 6 BIRDY GIFT TAGS,1,2.51,,United Kingdom,2025-12-28
516470,22587,FELTCRAFT HAIRBAND RED AND BLUE,1,1.66,,United Kingdom,2025-12-28
516470,22628,PICNIC BOXES SET OF 3 RETROSPOT ,1,10.17,,United Kingdom,2025-12-28
516470,22645,CERAMIC HEART FAIRY CAKE MONEY BANK,1,3.36,,United Kingdom,2025-12-28
516470,22646,CERAMIC STRAWBERRY CAKE MONEY BANK,1,3.36,,United Kingdom,2025-12-28
516470,22651,GENTLEMAN SHIRT REPAIR KIT ,1,1.66,,United Kingdom,2025-12-28
516470,22652,TRAVEL SEWING KIT,1,3.36,,United Kingdom,2025-12-28
516470,22659,LUNCH BOX I LOVE LONDON,1,4.21,,United Kingdom,2025-12-28
516470,22665,RECIPE BOX BLUE SKETCHBOOK DESIGN,2,5.91,,United Kingdom,2025-12-28
516470,35471D,SET OF 3 BIRD LIGHT PINK FEATHER ,1,2.51,,United Kingdom,2025-12-28
516470,37450,CERAMIC CAKE BOWL + HANGING CAKES,1,5.91,,United Kingdom,2025-12-28
516470,22605,WOODEN CROQUET GARDEN SET,1,25.49,,United Kingdom,2025-12-28
516471,82482,WOODEN PICTURE FRAME WHITE FINISH,6,2.55,16150.0,United Kingdom,2025-12-28
516471,22317,FIVE CATS HANGING DECORATION,6,2.95,16150.0,United Kingdom,2025-12-28
516471,22318,FIVE HEART HANGING DECORATION,6,2.95,16150.0,United Kingdom,2025-12-28
516471,82494L,WOODEN FRAME ANTIQUE WHITE ,6,2.95,16150.0,United Kingdom,2025-12-28
516471,85068,CREAM SWEETHEART SHELF + HOOKS,2,7.95,16150.0,United Kingdom,2025-12-28
516471,22173,METAL 4 HOOK HANGER FRENCH CHATEAU,8,2.95,16150.0,United Kingdom,2025-12-28
516471,84839,SWEETHEART KEY CABINET,2,6.75,16150.0,United Kingdom,2025-12-28
516471,85064,CREAM SWEETHEART LETTER RACK,2,5.45,16150.0,United Kingdom,2025-12-28
516471,85061W,WHITE JEWELLED HEART DECORATION,24,0.85,16150.0,United Kingdom,2025-12-28
516471,84818,DANISH ROSE PHOTO FRAME,6,2.55,16150.0,United Kingdom,2025-12-28
516471,22297,HEART IVORY TRELLIS SMALL,24,1.25,16150.0,United Kingdom,2025-12-28
516471,21428,SET3 BOOK BOX GREEN GINGHAM FLOWER ,4,4.25,16150.0,United Kingdom,2025-12-28
516471,84792,ENCHANTED BIRD COATHANGER 5 HOOK,4,4.65,16150.0,United Kingdom,2025-12-28
516471,84971S,SMALL HEART FLOWERS HOOK ,24,0.85,16150.0,United Kingdom,2025-12-28
516471,22469,HEART OF WICKER SMALL,12,1.65,16150.0,United Kingdom,2025-12-28
516471,21381,MINI WOODEN HAPPY BIRTHDAY GARLAND,12,1.69,16150.0,United Kingdom,2025-12-28
516471,22457,NATURAL SLATE HEART CHALKBOARD ,6,2.95,16150.0,United Kingdom,2025-12-28
516471,21430,SET/3 RED GINGHAM ROSE STORAGE BOX,4,3.75,16150.0,United Kingdom,2025-12-28
516471,84880,WHITE WIRE EGG HOLDER,3,5.95,16150.0,United Kingdom,2025-12-28
516471,21232,STRAWBERRY CERAMIC TRINKET BOX,12,1.25,16150.0,United Kingdom,2025-12-28
516471,22423,REGENCY CAKESTAND 3 TIER,2,12.75,16150.0,United Kingdom,2025-12-28
516471,21390,FILIGRIS HEART WITH BUTTERFLY,24,1.25,16150.0,United Kingdom,2025-12-28
516472,21323,damges,-34,0.0,,United Kingdom,2025-12-28
516473,21545,damages,-30,0.0,,United Kingdom,2025-12-28
516474,21440,,-21,0.0,,United Kingdom,2025-12-28
516475,21452,TOADSTOOL MONEY BOX,1,2.95,14040.0,United Kingdom,2025-12-28
516475,84978,HANGING HEART JAR T-LIGHT HOLDER,2,1.25,14040.0,United Kingdom,2025-12-28
516475,21452,TOADSTOOL MONEY BOX,2,2.95,14040.0,United Kingdom,2025-12-28
516475,22607,WOODEN ROUNDERS GARDEN SET ,1,8.5,14040.0,United Kingdom,2025-12-28
516475,22644,CERAMIC CHERRY CAKE MONEY BANK,4,1.45,14040.0,United Kingdom,2025-12-28
516475,21754,HOME BUILDING BLOCK WORD,3,5.95,14040.0,United Kingdom,2025-12-28
516475,72741,GRAND CHOCOLATECANDLE,9,1.45,14040.0,United Kingdom,2025-12-28
516475,22528,GARDENERS KNEELING PAD,18,1.25,14040.0,United Kingdom,2025-12-28
516475,21257,VICTORIAN SEWING BOX MEDIUM,2,7.95,14040.0,United Kingdom,2025-12-28
516475,20726,LUNCH BAG WOODLAND,1,1.65,14040.0,United Kingdom,2025-12-28
516475,22489,PACK OF 12 TRADITIONAL CRAYONS,6,0.42,14040.0,United Kingdom,2025-12-28
516475,22659,LUNCH BOX I LOVE LONDON,4,1.95,14040.0,United Kingdom,2025-12-28
516475,22064,PINK DOUGHNUT TRINKET POT ,4,1.65,14040.0,United Kingdom,2025-12-28
516475,22666,RECIPE BOX PANTRY YELLOW DESIGN,2,2.95,14040.0,United Kingdom,2025-12-28
516475,22197,SMALL POPCORN HOLDER,18,0.85,14040.0,United Kingdom,2025-12-28
516475,22491,PACK OF 12 COLOURED PENCILS,6,0.85,14040.0,United Kingdom,2025-12-28
516475,22422,TOOTHPASTE TUBE PEN,30,0.65,14040.0,United Kingdom,2025-12-28
516475,21231,SWEETHEART CERAMIC TRINKET BOX,9,1.25,14040.0,United Kingdom,2025-12-28
516475,21231,SWEETHEART CERAMIC TRINKET BOX,9,1.25,14040.0,United Kingdom,2025-12-28
516475,22423,REGENCY CAKESTAND 3 TIER,2,12.75,14040.0,United Kingdom,2025-12-28
516475,85123A,WHITE HANGING HEART T-LIGHT HOLDER,10,2.95,14040.0,United Kingdom,2025-12-28
516475,37495,FAIRY CAKE BIRTHDAY CANDLE SET,2,3.75,14040.0,United Kingdom,2025-12-28
516475,21733,RED HANGING HEART T-LIGHT HOLDER,6,2.95,14040.0,United Kingdom,2025-12-28
516475,72008,FROSTED BOX 9 WHITE T-LIGHT CANDLES,6,0.42,14040.0,United Kingdom,2025-12-28
516475,21407,BROWN CHECK CAT DOORSTOP ,2,4.25,14040.0,United Kingdom,2025-12-28
516475,21411,GINGHAM HEART  DOORSTOP RED,2,4.25,14040.0,United Kingdom,2025-12-28
516475,20967,GREY FLORAL FELTCRAFT SHOULDER BAG,2,3.75,14040.0,United Kingdom,2025-12-28
516475,22271,FELTCRAFT DOLL ROSIE,1,2.95,14040.0,United Kingdom,2025-12-28
516475,22568,FELTCRAFT CUSHION OWL,3,3.75,14040.0,United Kingdom,2025-12-28
516475,22570,FELTCRAFT CUSHION RABBIT,3,3.75,14040.0,United Kingdom,2025-12-28
516475,22569,FELTCRAFT CUSHION BUTTERFLY,3,3.75,14040.0,United Kingdom,2025-12-28
516475,20969,RED FLORAL FELTCRAFT SHOULDER BAG,1,3.75,14040.0,United Kingdom,2025-12-28
516475,22271,FELTCRAFT DOLL ROSIE,1,2.95,14040.0,United Kingdom,2025-12-28
516475,22272,FELTCRAFT DOLL MARIA,3,2.95,14040.0,United Kingdom,2025-12-28
516475,21891,TRADITIONAL WOODEN SKIPPING ROPE,4,1.25,14040.0,United Kingdom,2025-12-28
516475,21892,TRADITIONAL WOODEN CATCH CUP GAME ,4,1.25,14040.0,United Kingdom,2025-12-28
516475,22273,FELTCRAFT DOLL MOLLY,3,2.95,14040.0,United Kingdom,2025-12-28
516475,20685,DOORMAT RED SPOT,2,7.49,14040.0,United Kingdom,2025-12-28
516475,21410,COUNTRY COTTAGE  DOORSTOP GREEN,2,4.25,14040.0,United Kingdom,2025-12-28
516475,22660,DOORMAT I LOVE LONDON,3,7.49,14040.0,United Kingdom,2025-12-28
516475,22692,DOORMAT WELCOME TO OUR HOME,3,7.49,14040.0,United Kingdom,2025-12-28
516475,22691,DOORMAT WELCOME SUNRISE,2,7.49,14040.0,United Kingdom,2025-12-28
516475,21524,DOORMAT SPOTTY HOME SWEET HOME,2,7.49,14040.0,United Kingdom,2025-12-28
516475,21115,ROSE CARAVAN DOORSTOP,2,6.75,14040.0,United Kingdom,2025-12-28
516475,48187,DOORMAT NEW ENGLAND,2,7.49,14040.0,United Kingdom,2025-12-28
516475,48184,DOORMAT ENGLISH ROSE ,2,7.49,14040.0,United Kingdom,2025-12-28
516475,22690,DOORMAT HOME SWEET HOME BLUE ,2,7.49,14040.0,United Kingdom,2025-12-28
516475,48129,DOORMAT TOPIARY,2,7.49,14040.0,United Kingdom,2025-12-28
516476,79029,GLASS HONEYPOT WASP CATCHER,6,1.95,17584.0,United Kingdom,2025-12-28
516476,21007,ETCHED GLASS DROPLET DECORATION,48,0.38,17584.0,United Kingdom,2025-12-28
516476,22464,HANGING METAL HEART LANTERN,12,1.65,17584.0,United Kingdom,2025-12-28
516476,85145,JARDIN ETCHED GLASS LARGE BELL JAR,8,10.95,17584.0,United Kingdom,2025-12-28
516476,85146,JARDIN ETCHED GLASS SMALL BELL JAR,12,4.95,17584.0,United Kingdom,2025-12-28
516476,21324,HANGING MEDINA LANTERN SMALL,24,2.55,17584.0,United Kingdom,2025-12-28
516476,21012,ANTIQUE ALL GLASS CANDLESTICK,6,2.1,17584.0,United Kingdom,2025-12-28
516476,22457,NATURAL SLATE HEART CHALKBOARD ,12,2.95,17584.0,United Kingdom,2025-12-28
516476,21843,RED RETROSPOT CAKE STAND,24,9.95,17584.0,United Kingdom,2025-12-28
516476,85055,FRENCH ENAMEL UTENSIL HOLDER,4,3.75,17584.0,United Kingdom,2025-12-28
516476,21539,RED RETROSPOT BUTTER DISH,6,4.95,17584.0,United Kingdom,2025-12-28
516476,21658,GLASS  BEURRE DISH,4,3.95,17584.0,United Kingdom,2025-12-28
516476,85144,JARDIN ETCHED GLASS BUTTER DISH,12,6.35,17584.0,United Kingdom,2025-12-28
516476,21667,GLASS CAKE COVER AND PLATE,6,14.95,17584.0,United Kingdom,2025-12-28
516476,22423,REGENCY CAKESTAND 3 TIER,16,10.95,17584.0,United Kingdom,2025-12-28
516476,72760B,VINTAGE CREAM 3 BASKET CAKE STAND,4,9.95,17584.0,United Kingdom,2025-12-28
516476,82484,WOOD BLACK BOARD ANT WHITE FINISH,24,5.55,17584.0,United Kingdom,2025-12-28
516477,22120,WELCOME  WOODEN BLOCK LETTERS,2,9.95,14535.0,United Kingdom,2025-12-28
516477,21284,RETRO SPOT CANDLE  SMALL,12,1.69,14535.0,United Kingdom,2025-12-28
516477,21286,RETRO SPOT CANDLE  LARGE,12,2.55,14535.0,United Kingdom,2025-12-28
516477,20750,RED/WHITE DOT MINI CASES,1,7.95,14535.0,United Kingdom,2025-12-28
516477,21432,SET OF 3 CASES WOODLAND DESIGN,1,5.95,14535.0,United Kingdom,2025-12-28
516477,22669,RED BABY BUNTING ,5,2.95,14535.0,United Kingdom,2025-12-28
516477,22668,PINK BABY BUNTING,5,2.95,14535.0,United Kingdom,2025-12-28
516477,21166,COOK WITH WINE METAL SIGN ,1,1.95,14535.0,United Kingdom,2025-12-28
516477,20728,LUNCH BAG CARS BLUE,1,1.65,14535.0,United Kingdom,2025-12-28
516477,22383,LUNCH BAG SUKI  DESIGN ,1,1.65,14535.0,United Kingdom,2025-12-28
516477,22487,WHITE WOOD GARDEN PLANT LADDER,1,9.95,14535.0,United Kingdom,2025-12-28
516477,22382,LUNCH BAG SPACEBOY DESIGN ,2,1.65,14535.0,United Kingdom,2025-12-28
516477,22383,LUNCH BAG SUKI  DESIGN ,1,1.65,14535.0,United Kingdom,2025-12-28
516477,84832,ZINC WILLIE WINKIE  CANDLE STICK,5,0.85,14535.0,United Kingdom,2025-12-28
516477,21902,"KEY FOB , FRONT  DOOR ",2,0.65,14535.0,United Kingdom,2025-12-28
516477,21901,"KEY FOB , BACK DOOR ",2,0.65,14535.0,United Kingdom,2025-12-28
516477,22354,RETROSPOT PADDED SEAT CUSHION,4,3.75,14535.0,United Kingdom,2025-12-28
516477,21524,DOORMAT SPOTTY HOME SWEET HOME,1,7.49,14535.0,United Kingdom,2025-12-28
516477,48197,DOORMAT BIRD ON THE WIRE,1,7.49,14535.0,United Kingdom,2025-12-28
516477,48111,DOORMAT 3 SMILEY CATS,1,7.49,14535.0,United Kingdom,2025-12-28
516477,21900,"KEY FOB , SHED",2,0.65,14535.0,United Kingdom,2025-12-28
516477,22413,METAL SIGN TAKE IT OR LEAVE IT ,1,2.95,14535.0,United Kingdom,2025-12-28
516477,22117,METAL SIGN HER DINNER IS SERVED ,1,2.95,14535.0,United Kingdom,2025-12-28
516477,85152,HAND OVER THE CHOCOLATE   SIGN ,1,2.1,14535.0,United Kingdom,2025-12-28
516477,82597,BOMBS AWAY METAL SIGN,1,2.1,14535.0,United Kingdom,2025-12-28
516477,82567,"AIRLINE LOUNGE,METAL SIGN",2,2.1,14535.0,United Kingdom,2025-12-28
516477,82599,FANNY'S REST STOPMETAL SIGN,2,2.1,14535.0,United Kingdom,2025-12-28
516477,48138,DOORMAT UNION FLAG,2,7.49,14535.0,United Kingdom,2025-12-28
516477,85150,LADIES & GENTLEMEN METAL SIGN,1,2.55,14535.0,United Kingdom,2025-12-28
516477,21535,RED RETROSPOT SMALL MILK JUG,2,2.55,14535.0,United Kingdom,2025-12-28
516477,22628,PICNIC BOXES SET OF 3 RETROSPOT ,2,4.95,14535.0,United Kingdom,2025-12-28
516477,20914,SET/5 RED SPOTTY LID GLASS BOWLS,1,2.95,14535.0,United Kingdom,2025-12-28
516477,48188,DOORMAT WELCOME PUPPIES,1,7.49,14535.0,United Kingdom,2025-12-28
516477,21955,DOORMAT UNION JACK GUNS AND ROSES,1,7.49,14535.0,United Kingdom,2025-12-28
516477,22690,DOORMAT HOME SWEET HOME BLUE ,1,7.49,14535.0,United Kingdom,2025-12-28
516477,48187,DOORMAT NEW ENGLAND,1,7.49,14535.0,United Kingdom,2025-12-28
516477,21531,RED RETROSPOT SUGAR JAM BOWL,2,2.55,14535.0,United Kingdom,2025-12-28
516477,84832,ZINC WILLIE WINKIE  CANDLE STICK,1,0.85,14535.0,United Kingdom,2025-12-28
516477,21621,VINTAGE UNION JACK BUNTING,2,8.5,14535.0,United Kingdom,2025-12-28
516477,21174,POTTERING IN THE SHED METAL SIGN,1,1.95,14535.0,United Kingdom,2025-12-28
516477,85123A,WHITE HANGING HEART T-LIGHT HOLDER,4,2.95,14535.0,United Kingdom,2025-12-28
516477,22198,LARGE POPCORN HOLDER ,12,1.65,14535.0,United Kingdom,2025-12-28
516477,21903,MAN FLU METAL SIGN,1,2.1,14535.0,United Kingdom,2025-12-28
516477,84992,72 SWEETHEART FAIRY CAKE CASES,2,0.55,14535.0,United Kingdom,2025-12-28
516477,21976,PACK OF 60 MUSHROOM CAKE CASES,2,0.55,14535.0,United Kingdom,2025-12-28
516477,21977,PACK OF 60 PINK PAISLEY CAKE CASES,2,0.55,14535.0,United Kingdom,2025-12-28
516477,84989A,75 GREEN FAIRY CAKE CASES,2,0.55,14535.0,United Kingdom,2025-12-28
516477,21733,RED HANGING HEART T-LIGHT HOLDER,4,2.95,14535.0,United Kingdom,2025-12-28
516477,21215,IVORY PAPER CUP CAKE CASES ,1,0.55,14535.0,United Kingdom,2025-12-28
516477,84993A,75 GREEN PETIT FOUR CASES,4,0.42,14535.0,United Kingdom,2025-12-28
516477,22666,RECIPE BOX PANTRY YELLOW DESIGN,1,2.95,14535.0,United Kingdom,2025-12-28
516477,22470,HEART OF WICKER LARGE,2,2.95,14535.0,United Kingdom,2025-12-28
516477,21899,"KEY FOB , GARAGE DESIGN",2,0.65,14535.0,United Kingdom,2025-12-28
516477,22662,LUNCH BAG DOLLY GIRL DESIGN,2,1.65,14535.0,United Kingdom,2025-12-28
516477,22197,SMALL POPCORN HOLDER,12,0.85,14535.0,United Kingdom,2025-12-28
516477,21992,VINTAGE PAISLEY STATIONERY SET,2,2.95,14535.0,United Kingdom,2025-12-28
516477,22417,PACK OF 60 SPACEBOY CAKE CASES,2,0.55,14535.0,United Kingdom,2025-12-28
516477,21210,SET OF 72 RETRO SPOT PAPER  DOILIES,3,1.45,14535.0,United Kingdom,2025-12-28
516477,84991,60 TEATIME FAIRY CAKE CASES,2,0.55,14535.0,United Kingdom,2025-12-28
516477,84987,SET OF 36 TEATIME PAPER DOILIES,2,1.45,14535.0,United Kingdom,2025-12-28
516477,21908,CHOCOLATE THIS WAY METAL SIGN,1,2.1,14535.0,United Kingdom,2025-12-28
516477,85232B,SET/3 RUSSIAN DOLL STACKING TINS,2,4.95,14535.0,United Kingdom,2025-12-28
516477,22667,RECIPE BOX RETRO SPOT DESIGN,1,2.95,14535.0,United Kingdom,2025-12-28
516477,84985A,SET OF 72 GREEN PAPER DOILIES,3,1.45,14535.0,United Kingdom,2025-12-28
516477,22629,SPACEBOY LUNCH BOX ,2,1.95,14535.0,United Kingdom,2025-12-28
516477,21671,RED SPOT CERAMIC DRAWER KNOB,12,1.25,14535.0,United Kingdom,2025-12-28
516477,21668,RED STRIPE CERAMIC DRAWER KNOB,12,1.25,14535.0,United Kingdom,2025-12-28
516477,85231B,CINAMMON SET OF 9 T-LIGHTS,1,0.85,14535.0,United Kingdom,2025-12-28
516477,22630,DOLLY GIRL LUNCH BOX,2,1.95,14535.0,United Kingdom,2025-12-28
516477,22328,ROUND SNACK BOXES SET OF 4 FRUITS ,2,2.95,14535.0,United Kingdom,2025-12-28
516477,22329,ROUND CONTAINER SET OF 5 RETROSPOT,2,1.65,14535.0,United Kingdom,2025-12-28
516477,21669,BLUE STRIPE CERAMIC DRAWER KNOB,12,1.25,14535.0,United Kingdom,2025-12-28
516477,21672,WHITE SPOT RED CERAMIC DRAWER KNOB,12,1.25,14535.0,United Kingdom,2025-12-28
516477,21670,BLUE SPOT CERAMIC DRAWER KNOB,6,1.25,14535.0,United Kingdom,2025-12-28
516477,21673,WHITE SPOT BLUE CERAMIC DRAWER KNOB,6,1.25,14535.0,United Kingdom,2025-12-28
516477,21974,SET OF 36 PAISLEY FLOWER DOILIES,2,1.45,14535.0,United Kingdom,2025-12-28
516477,21993,FLORAL FOLK STATIONERY SET,2,2.95,14535.0,United Kingdom,2025-12-28
516478,22465,HANGING METAL STAR LANTERN,1,1.65,17576.0,United Kingdom,2025-12-28
516478,22224,WHITE LOVEBIRD LANTERN,2,2.95,17576.0,United Kingdom,2025-12-28
516478,22576,SWALLOW WOODEN CHRISTMAS DECORATION,1,0.85,17576.0,United Kingdom,2025-12-28
516478,85081,PADDED HOLLY CHRISTMAS DECORATION ,6,0.42,17576.0,United Kingdom,2025-12-28
516478,90188,DROP EARRINGS W FLOWER & LEAF,1,2.55,17576.0,United Kingdom,2025-12-28
516478,21781,MA CAMPAGNE CUTLERY BOX,1,14.95,17576.0,United Kingdom,2025-12-28
516478,35400,WOODEN BOX ADVENT CALENDAR ,2,8.95,17576.0,United Kingdom,2025-12-28
516478,90152C,BLUE/NAT SHELL NECKLACE W PENDANT,1,5.95,17576.0,United Kingdom,2025-12-28
516478,22170,PICTURE FRAME WOOD TRIPLE PORTRAIT,4,6.75,17576.0,United Kingdom,2025-12-28
516478,71053,WHITE METAL LANTERN,3,3.75,17576.0,United Kingdom,2025-12-28
516478,22465,HANGING METAL STAR LANTERN,1,1.65,17576.0,United Kingdom,2025-12-28
516478,22575,METAL MERRY CHRISTMAS WREATH,1,1.95,17576.0,United Kingdom,2025-12-28
516478,22464,HANGING METAL HEART LANTERN,6,1.65,17576.0,United Kingdom,2025-12-28
516478,22178,VICTORIAN GLASS HANGING T-LIGHT,6,1.25,17576.0,United Kingdom,2025-12-28
516478,22593,CHRISTMAS GINGHAM STAR,12,0.85,17576.0,United Kingdom,2025-12-28
516478,84978,HANGING HEART JAR T-LIGHT HOLDER,6,1.25,17576.0,United Kingdom,2025-12-28
516478,35400,WOODEN BOX ADVENT CALENDAR ,2,8.95,17576.0,United Kingdom,2025-12-28
516478,85062,PEARL CRYSTAL PUMPKIN T-LIGHT HLDR,6,1.65,17576.0,United Kingdom,2025-12-28
516478,21781,MA CAMPAGNE CUTLERY BOX,1,14.95,17576.0,United Kingdom,2025-12-28
516478,M,Manual,10,0.55,17576.0,United Kingdom,2025-12-28
516478,21324,HANGING MEDINA LANTERN SMALL,3,2.95,17576.0,United Kingdom,2025-12-28
516479,84358,FLOOR LAMP SHADE WOOD BASE,52,7.0,14061.0,United Kingdom,2025-12-28
