Invoice,StockCode,Description,Quantity,Price,Customer ID,Country,InvoiceDate
495278,82093,,-1,0.0,,United Kingdom,2025-08-02
495279,82494L,WOODEN FRAME ANTIQUE WHITE ,24,2.55,14440.0,United Kingdom,2025-08-02
495279,82486,WOOD S/3 CABINET ANT WHITE FINISH,16,6.95,14440.0,United Kingdom,2025-08-02
495279,82483,WOOD 2 DRAWER CABINET WHITE FINISH,16,4.95,14440.0,United Kingdom,2025-08-02
495279,85066,CREAM SWEETHEART MINI CHEST,4,12.75,14440.0,United Kingdom,2025-08-02
495279,84837,WHITE SWEETHEARTS CABINET 4 DRAWERS,6,10.75,14440.0,United Kingdom,2025-08-02
495279,21135,VICTORIAN  METAL POSTCARD SPRING,16,1.69,14440.0,United Kingdom,2025-08-02
495279,20662,FIRST CLASS HOLIDAY PURSE ,6,2.95,14440.0,United Kingdom,2025-08-02
495279,85123A,WHITE HANGING HEART T-LIGHT HOLDER,32,2.55,14440.0,United Kingdom,2025-08-02
495279,20670,VIP HOLIDAY PURSE,6,2.95,14440.0,United Kingdom,2025-08-02
495279,20622,VIPPASSPORT COVER ,6,2.1,14440.0,United Kingdom,2025-08-02
495279,20617,FIRST CLASS PASSPORT COVER ,6,2.1,14440.0,United Kingdom,2025-08-02
495279,21428,SET3 BOOK BOX GREEN GINGHAM FLOWER ,4,4.25,14440.0,United Kingdom,2025-08-02
495279,21429,RED GINGHAM ROSE JEWELLERY BOX,8,1.65,14440.0,United Kingdom,2025-08-02
495279,21431,GREEN GINGHAM FLOWER JEWELLERY BOX,8,1.65,14440.0,United Kingdom,2025-08-02
495279,20666,ECONOMY HOLIDAY PURSE,6,2.95,14440.0,United Kingdom,2025-08-02
495280,84997B,RED 3 PIECE MINI DOTS CUTLERY SET,6,3.75,12708.0,Germany,2025-08-02
495280,84270,ASSTD DESIGN BUBBLE GUM RING,30,0.21,12708.0,Germany,2025-08-02
495280,85093,CANDY SPOT EGG WARMER HARE,12,1.25,12708.0,Germany,2025-08-02
495280,84968D,S/16 VINTAGE RED CUTLERY,1,12.75,12708.0,Germany,2025-08-02
495280,84969,ASSORTED COLOUR SET 6 TEASPOONS,6,4.25,12708.0,Germany,2025-08-02
495280,84968F,S/16 VINTAGE SKY BLUE CUTLERY,1,12.75,12708.0,Germany,2025-08-02
495280,POST,POSTAGE,2,18.0,12708.0,Germany,2025-08-02
495280,21980,PACK OF 12 RED SPOTTY TISSUES ,48,0.29,12708.0,Germany,2025-08-02
495280,84968C,S/16 VINTAGE PISTACHIO CUTLERY,1,12.75,12708.0,Germany,2025-08-02
495280,21244,BLUE  SPOTTY PLATE ,8,1.69,12708.0,Germany,2025-08-02
495280,20677,PINK SPOTTY BOWL,8,1.25,12708.0,Germany,2025-08-02
495280,21243,PINK  SPOTTY PLATE ,8,1.69,12708.0,Germany,2025-08-02
495280,22326,ROUND SNACK BOXES SET OF4 WOODLAND ,6,2.95,12708.0,Germany,2025-08-02
495280,22358,KINGS CHOICE TEA CADDY ,6,2.95,12708.0,Germany,2025-08-02
495280,21245,GREEN  SPOTTY PLATE ,8,1.69,12708.0,Germany,2025-08-02
495280,21156,RED SPOTTY CHILDS APRON,8,1.95,12708.0,Germany,2025-08-02
495280,22328,ROUND SNACK BOXES SET OF 4 FRUITS ,6,2.95,12708.0,Germany,2025-08-02
495280,21240,BLUE  SPOTTY CUP,8,0.85,12708.0,Germany,2025-08-02
495280,21239,PINK  SPOTTY CUP,8,0.85,12708.0,Germany,2025-08-02
495280,21242,RED SPOTTY PLATE ,8,1.69,12708.0,Germany,2025-08-02
495280,21216,"SET 3 RED SPOT TIN TEA,COFFEE,SUGAR",4,4.95,12708.0,Germany,2025-08-02
C495281,79320, FLAMINGO LIGHTS,-1,4.95,16229.0,United Kingdom,2025-08-02
C495281,85044,RED REINDEER STRING OF 20 LIGHTS,-1,4.95,16229.0,United Kingdom,2025-08-02
C495281,85042,ANTIQUE LILY FAIRY LIGHTS,-2,4.95,16229.0,United Kingdom,2025-08-02
C495281,85047,WHITE BEADED GARLAND STRING 20LIGHT,-2,6.35,16229.0,United Kingdom,2025-08-02
495289,21437,24 HANGING EASTER EGGS FLORAL TUB,8,3.75,17519.0,United Kingdom,2025-08-02
495289,21121,SET/10 RED SPOTTY PARTY CANDLES,24,1.25,17519.0,United Kingdom,2025-08-02
495289,22333,RETRO SPORT PARTY BAG + STICKER SET,24,1.65,17519.0,United Kingdom,2025-08-02
495289,21094,SET/6 RED SPOTTY PAPER PLATES,48,0.85,17519.0,United Kingdom,2025-08-02
495289,22319,HAIRCLIPS FORTIES FABRIC ASSORTED,12,0.65,17519.0,United Kingdom,2025-08-02
495289,21380,WOODEN HAPPY BIRTHDAY GARLAND,12,2.95,17519.0,United Kingdom,2025-08-02
495289,21210,SET OF 72 RETRO SPOT PAPER  DOILIES,24,1.45,17519.0,United Kingdom,2025-08-02
495289,84991,60 TEATIME FAIRY CAKE CASES,24,0.55,17519.0,United Kingdom,2025-08-02
495289,22090,PAPER BUNTING RETRO SPOTS,24,2.95,17519.0,United Kingdom,2025-08-02
495290,20961,STRAWBERRY BATH SPONGE ,2,1.25,15867.0,United Kingdom,2025-08-02
495290,22195,LARGE HEART MEASURING SPOONS,3,1.65,15867.0,United Kingdom,2025-08-02
495290,85036B,CHOCOLATE 1 WICK MORRIS BOX CANDLE,2,4.25,15867.0,United Kingdom,2025-08-02
495290,22219,LOVEBIRD HANGING DECORATION WHITE ,3,0.85,15867.0,United Kingdom,2025-08-02
495290,84992,72 SWEETHEART FAIRY CAKE CASES,3,0.55,15867.0,United Kingdom,2025-08-02
495290,22196,SMALL HEART MEASURING SPOONS,3,0.85,15867.0,United Kingdom,2025-08-02
495290,70006,LOVE HEART POCKET WARMER,3,1.65,15867.0,United Kingdom,2025-08-02
495290,84050,PINK HEART SHAPE EGG FRYING PAN,1,1.65,15867.0,United Kingdom,2025-08-02
495290,21985,PACK OF 12 HEARTS DESIGN TISSUES ,12,0.29,15867.0,United Kingdom,2025-08-02
495290,21677,HEARTS  STICKERS,6,0.85,15867.0,United Kingdom,2025-08-02
495290,21947,SET OF 6 HEART CHOPSTICKS,3,1.25,15867.0,United Kingdom,2025-08-02
495290,84050,PINK HEART SHAPE EGG FRYING PAN,3,1.65,15867.0,United Kingdom,2025-08-02
495290,21122,SET/10 PINK SPOTTY PARTY CANDLES,2,1.25,15867.0,United Kingdom,2025-08-02
495290,35968,FOLK ART METAL HEART T-LIGHT HOLDER,7,0.38,15867.0,United Kingdom,2025-08-02
495290,84378,SET OF 3 HEART COOKIE CUTTERS,4,1.25,15867.0,United Kingdom,2025-08-02
495290,21396,RED SPOTTY EGG CUP ,12,1.25,15867.0,United Kingdom,2025-08-02
495290,22079,RIBBON REEL HEARTS DESIGN ,5,1.65,15867.0,United Kingdom,2025-08-02
495290,20966,SANDWICH BATH SPONGE,2,1.25,15867.0,United Kingdom,2025-08-02
495290,48138,DOOR MAT UNION FLAG,5,6.75,15867.0,United Kingdom,2025-08-02
495290,85231G,ORANGE SCENTED SET/9 T-LIGHTS,2,0.85,15867.0,United Kingdom,2025-08-02
495290,22415,WHITE TISSUE REAM,2,7.95,15867.0,United Kingdom,2025-08-02
495290,48184,DOOR MAT ENGLISH ROSE ,2,6.75,15867.0,United Kingdom,2025-08-02
495290,22414,DOORMAT NEIGHBOURHOOD WITCH ,1,6.75,15867.0,United Kingdom,2025-08-02
495290,22365,DOORMAT RESPECTABLE HOUSE,1,6.75,15867.0,United Kingdom,2025-08-02
495290,48173C,DOOR MAT BLACK FLOCK ,2,6.75,15867.0,United Kingdom,2025-08-02
495290,85231E,STRAWBERRY SCENTED SET/9 T-LIGHTS,2,0.85,15867.0,United Kingdom,2025-08-02
495290,21955,  DOORMAT UNION JACK GUNS AND ROSES,3,6.75,15867.0,United Kingdom,2025-08-02
495290,21523,FANCY FONT HOME SWEET HOME DOORMAT,2,6.75,15867.0,United Kingdom,2025-08-02
495290,20685,RED SPOTTY COIR DOORMAT,2,6.75,15867.0,United Kingdom,2025-08-02
495290,22107,PIZZA PLATE IN BOX,3,3.75,15867.0,United Kingdom,2025-08-02
495290,20679,EDWARDIAN PARASOL RED,2,5.95,15867.0,United Kingdom,2025-08-02
495290,85014B,RED/WHITE DOTS RUFFLED UMBRELLA,2,5.95,15867.0,United Kingdom,2025-08-02
495290,15056BL,EDWARDIAN PARASOL BLACK,2,5.95,15867.0,United Kingdom,2025-08-02
495290,22055,MINI CAKE STAND  HANGING STRAWBERY,3,1.65,15867.0,United Kingdom,2025-08-02
495290,85231L,LAVENDER SCENTED SET/9 T-LIGHTS,5,0.85,15867.0,United Kingdom,2025-08-02
495290,85231B,CINAMMON SET OF 9 T-LIGHTS,2,0.85,15867.0,United Kingdom,2025-08-02
495290,22109,FULL ENGLISH BREAKFAST PLATE,5,3.75,15867.0,United Kingdom,2025-08-02
495291,22082,RIBBON REEL STRIPES DESIGN ,10,1.65,14274.0,United Kingdom,2025-08-02
495291,16015,MEDIUM CHINESE STYLE SCISSOR,20,0.5,14274.0,United Kingdom,2025-08-02
495291,21428,SET3 BOOK BOX GREEN GINGHAM FLOWER ,4,4.25,14274.0,United Kingdom,2025-08-02
495291,21868,POTTING SHED TEA MUG,12,1.25,14274.0,United Kingdom,2025-08-02
495291,21746,SMALL RED SPOT  WINDMILL,12,1.25,14274.0,United Kingdom,2025-08-02
495291,21896,POTTING SHED TWINE,6,2.1,14274.0,United Kingdom,2025-08-02
495291,35915B,BLUE KNITTED HEN ,6,1.65,14274.0,United Kingdom,2025-08-02
495291,21584,RETRO SPOT SMALL TUBE MATCHES,20,1.65,14274.0,United Kingdom,2025-08-02
495291,22253,6 CROCHET STRAWBERRIES,12,1.25,14274.0,United Kingdom,2025-08-02
495291,20980,36 PENCILS TUBE POSY,12,1.25,14274.0,United Kingdom,2025-08-02
495291,22241,GARLAND WOODEN HAPPY EASTER,12,1.25,14274.0,United Kingdom,2025-08-02
495291,84755,COLOUR GLASS T-LIGHT HOLDER HANGING,16,0.65,14274.0,United Kingdom,2025-08-02
495291,22178,VICTORIAN GLASS HANGING T-LIGHT,12,1.25,14274.0,United Kingdom,2025-08-02
495291,21316,SMALL CHUNKY GLASS ROMAN  BOWL,8,2.95,14274.0,United Kingdom,2025-08-02
495291,21314,SMALL GLASS HEART TRINKET POT,16,2.1,14274.0,United Kingdom,2025-08-02
495292,22189,CREAM HEART CARD HOLDER,4,3.95,15465.0,United Kingdom,2025-08-02
495292,21217,RED SPOTTY ROUND CAKE TINS,2,9.95,15465.0,United Kingdom,2025-08-02
495292,22357,KINGS CHOICE BISCUIT TIN,2,4.25,15465.0,United Kingdom,2025-08-02
495292,72760B,VINTAGE CREAM 3 BASKET CAKE STAND,1,9.95,15465.0,United Kingdom,2025-08-02
495292,21428,SET3 BOOK BOX GREEN GINGHAM FLOWER ,2,4.25,15465.0,United Kingdom,2025-08-02
495292,21164,HOME SWEET HOME METAL SIGN ,3,2.95,15465.0,United Kingdom,2025-08-02
495292,22084,PAPER CHAIN KIT EMPIRE,40,2.55,15465.0,United Kingdom,2025-08-02
495292,82551,LAUNDRY 15C METAL SIGN,5,1.25,15465.0,United Kingdom,2025-08-02
495292,21715,GIRLS VINTAGE TIN SEASIDE BUCKET,4,2.55,15465.0,United Kingdom,2025-08-02
495292,21716,BOYS VINTAGE TIN SEASIDE BUCKET,4,2.55,15465.0,United Kingdom,2025-08-02
495292,21718,RED METAL BEACH SPADE ,8,1.25,15465.0,United Kingdom,2025-08-02
495292,22119, PEACE WOODEN BLOCK LETTERS,2,6.95,15465.0,United Kingdom,2025-08-02
495292,82552,WASHROOM METAL SIGN,6,1.25,15465.0,United Kingdom,2025-08-02
495293,21754,HOME BUILDING BLOCK WORD,3,5.95,16125.0,United Kingdom,2025-08-02
495293,22326,ROUND SNACK BOXES SET OF4 WOODLAND ,6,2.95,16125.0,United Kingdom,2025-08-02
495293,22215,CAKE STAND WHITE TWO TIER LACE,2,8.5,16125.0,United Kingdom,2025-08-02
495293,84839,SWEETHEART KEY CABINET,2,6.75,16125.0,United Kingdom,2025-08-02
495293,21929,JUMBO BAG PINK VINTAGE PAISLEY,10,1.95,16125.0,United Kingdom,2025-08-02
495293,85099B,JUMBO BAG RED WHITE SPOTTY ,10,1.95,16125.0,United Kingdom,2025-08-02
495293,79072,TEATIME CAKE TIN WITH HANDLE,2,9.95,16125.0,United Kingdom,2025-08-02
495293,20685,RED SPOTTY COIR DOORMAT,2,6.75,16125.0,United Kingdom,2025-08-02
495293,48187,DOOR MAT NEW ENGLAND,2,6.75,16125.0,United Kingdom,2025-08-02
495293,84879,ASSORTED COLOUR BIRD ORNAMENT,24,1.69,16125.0,United Kingdom,2025-08-02
495294,21407,BROWN CHECK CAT DOORSTOP ,3,4.25,17460.0,United Kingdom,2025-08-02
495294,84880,WHITE WIRE EGG HOLDER,3,5.95,17460.0,United Kingdom,2025-08-02
495294,82494L,WOODEN FRAME ANTIQUE WHITE ,12,2.95,17460.0,United Kingdom,2025-08-02
495294,22224,WHITE LOVEBIRD LANTERN,6,2.95,17460.0,United Kingdom,2025-08-02
495294,85123A,WHITE HANGING HEART T-LIGHT HOLDER,18,2.95,17460.0,United Kingdom,2025-08-02
495294,21212,PACK OF 72 RETRO SPOT CAKE CASES,24,0.55,17460.0,United Kingdom,2025-08-02
495294,22358,KINGS CHOICE TEA CADDY ,6,2.95,17460.0,United Kingdom,2025-08-02
495294,21154,RED SPOTTY OVEN GLOVE ,10,1.25,17460.0,United Kingdom,2025-08-02
495294,22073,RETRO SPOT STORAGE JAR,4,3.75,17460.0,United Kingdom,2025-08-02
495294,47559B,TEA TIME OVEN GLOVE,10,1.25,17460.0,United Kingdom,2025-08-02
495294,37448,CERAMIC CAKE DESIGN SPOTTED MUG,12,1.49,17460.0,United Kingdom,2025-08-02
495294,84991,60 TEATIME FAIRY CAKE CASES,24,0.55,17460.0,United Kingdom,2025-08-02
495295,TEST001,This is a test product.,5,4.5,12346.0,United Kingdom,2025-08-02
495296,37493C,,-36,0.0,,United Kingdom,2025-08-02
495297,37493B,,-37,0.0,,United Kingdom,2025-08-02
495298,37493D,,-44,0.0,,United Kingdom,2025-08-02
495299,84874A,,-1,0.0,,United Kingdom,2025-08-02
495300,84029E,RED WOOLLY HOTTIE WHITE HEART.,4,3.75,12510.0,Spain,2025-08-02
495300,79067,CORONA MEXICAN TRAY,12,3.75,12510.0,Spain,2025-08-02
495300,84937,KASHMIR FOLKART TUMBLERS,36,2.1,12510.0,Spain,2025-08-02
495300,POST,POSTAGE,8,28.0,12510.0,Spain,2025-08-02
495300,84279B,CHERRY BLOSSOM DECORATIVE FLASK,4,3.75,12510.0,Spain,2025-08-02
495300,20749,ASSORTED COLOUR MINI CASES,8,7.95,12510.0,Spain,2025-08-02
495300,20719,WOODLAND CHARLOTTE BAG,10,0.85,12510.0,Spain,2025-08-02
495300,21432,SET OF 3 CASES WOODLAND DESIGN,2,5.95,12510.0,Spain,2025-08-02
495300,20724,RED SPOTTY CHARLOTTE BAG,20,0.85,12510.0,Spain,2025-08-02
495300,22356,"CHARLOTTE BAG , PINK/WHITE SPOTS",20,0.85,12510.0,Spain,2025-08-02
495300,20764,ABSTRACT CIRCLES SKETCHBOOK ,8,3.75,12510.0,Spain,2025-08-02
495300,20770,ABSTRACT CIRCLE JOURNAL ,12,2.55,12510.0,Spain,2025-08-02
495300,21891,TRADITIONAL WOODEN SKIPPING ROPE,12,1.25,12510.0,Spain,2025-08-02
495300,20750, RED/WHITE DOT MINI CASES,4,7.95,12510.0,Spain,2025-08-02
495300,21892,TRADITIONAL WOODEN CATCH CUP GAME ,12,1.25,12510.0,Spain,2025-08-02
495300,84279P, CHERRY BLOSSOM  DECORATIVE FLASK,4,3.75,12510.0,Spain,2025-08-02
495300,22193,RED DINER WALL CLOCK,2,8.5,12510.0,Spain,2025-08-02
495300,22194,BLACK DINER WALL CLOCK,2,8.5,12510.0,Spain,2025-08-02
495301,84898E,,-7,0.0,,United Kingdom,2025-08-02
495300,84932D,SMALL ORIENTAL RED FOLDING STOOL,8,1.95,12510.0,Spain,2025-08-02
495300,84932C,SMALL ORIENTAL BLUE FOLDING STOOL,8,1.95,12510.0,Spain,2025-08-02
495300,79323P,PINK CHERRY LIGHTS,24,5.45,12510.0,Spain,2025-08-02
495300,79323W, WHITE CHERRY LIGHTS,24,5.45,12510.0,Spain,2025-08-02
495300,20776,ABSTRACT CIRCLES NOTEBOOK,6,1.65,12510.0,Spain,2025-08-02
495300,20969,RED FLORAL FELTCRAFT SHOULDER BAG,4,3.75,12510.0,Spain,2025-08-02
495300,20729,RED SPOTTY CANDY BAG,10,1.25,12510.0,Spain,2025-08-02
495300,21935,SUKI  SHOULDER BAG,20,1.65,12510.0,Spain,2025-08-02
495300,84077,WORLD WAR 2 GLIDERS ASSTD DESIGNS,96,0.21,12510.0,Spain,2025-08-02
495300,20967,GREY FLORAL FELTCRAFT SHOULDER BAG,8,3.75,12510.0,Spain,2025-08-02
495300,85227,SET/6 3D KIT CARDS FOR KIDS,36,0.85,12510.0,Spain,2025-08-02
495300,21222,SET/4 BADGES BEETLES,10,1.25,12510.0,Spain,2025-08-02
495302,84933C,LARGE BLUE ORIENTAL FOLDING STOOL,90,2.1,13694.0,United Kingdom,2025-08-02
495303,84933C,,4,0.0,,United Kingdom,2025-08-02
495304,47570B,TEA TIME TABLE CLOTH,2,10.65,14156.0,EIRE,2025-08-02
495304,47559B,TEA TIME OVEN GLOVE,10,1.25,14156.0,EIRE,2025-08-02
495304,47566B,TEA TIME PARTY BUNTING,5,4.65,14156.0,EIRE,2025-08-02
495304,47580,TEA TIME DES TEA COSY,6,2.55,14156.0,EIRE,2025-08-02
495304,84520D,PACK OF 20 FAIRY CAKE PAPER NAPKINS,12,0.85,14156.0,EIRE,2025-08-02
495304,84509G,FAIRY CAKE PLACEMATS ,4,3.75,14156.0,EIRE,2025-08-02
495304,84510B,SET OF 4 FAIRY CAKES COASTERS ,10,1.25,14156.0,EIRE,2025-08-02
495304,84991,60 TEATIME FAIRY CAKE CASES,24,0.55,14156.0,EIRE,2025-08-02
495304,C2,CARRIAGE,1,50.0,14156.0,EIRE,2025-08-02
495304,47570,ENGLISH ROSE TABLE CLOTH,2,10.65,14156.0,EIRE,2025-08-02
495304,84520B,PACK 20 ENGLISH ROSE PAPER NAPKINS,12,0.85,14156.0,EIRE,2025-08-02
495304,22244,"HOOK, 3 HANGER ,MAGIC GARDEN",12,1.95,14156.0,EIRE,2025-08-02
495304,22245,"HOOK, 1 HANGER ,MAGIC GARDEN",12,0.85,14156.0,EIRE,2025-08-02
495304,84380,SET OF 3 BUTTERFLY COOKIE CUTTERS,12,1.25,14156.0,EIRE,2025-08-02
495304,20751,FUNKY WASHING UP GLOVES ASSORTED,12,2.1,14156.0,EIRE,2025-08-02
495304,21977,PACK OF 60 PINK PAISLEY CAKE CASES,24,0.55,14156.0,EIRE,2025-08-02
495304,47556B,TEA TIME TEA TOWELS ,6,2.95,14156.0,EIRE,2025-08-02
495304,47568,ENGLISH ROSE DESIGN PEG BAG,6,2.1,14156.0,EIRE,2025-08-02
495304,37502,TEA TIME MUG IN GIFT BOX,6,2.95,14156.0,EIRE,2025-08-02
495304,22236,CAKE STAND 3 TIER MAGIC GARDEN,1,12.75,14156.0,EIRE,2025-08-02
495304,22215,CAKE STAND WHITE TWO TIER LACE,2,8.5,14156.0,EIRE,2025-08-02
495304,37503,TEA TIME CAKE STAND IN GIFT BOX,2,10.75,14156.0,EIRE,2025-08-02
495304,16202C,BEIGE PHOTO ALBUM,12,1.95,14156.0,EIRE,2025-08-02
495304,84396,6 HOOK JEWELLERY STAND BLACK DRESS,12,1.95,14156.0,EIRE,2025-08-02
495304,84595B,LARGE TRIFLE DESIGN L BLUE BOWL,24,1.65,14156.0,EIRE,2025-08-02
495304,37495,FAIRY CAKE BIRTHDAY CANDLE SET,4,3.75,14156.0,EIRE,2025-08-02
495304,84869,CANDY BUTTON PHOTO ALBUM,12,1.95,14156.0,EIRE,2025-08-02
495304,84933B,LARGE PINK PEONY FOLDING STOOL,1,2.1,14156.0,EIRE,2025-08-02
495304,20717,STRAWBERRY SHOPPER BAG,10,1.25,14156.0,EIRE,2025-08-02
495304,85099F,JUMBO BAG STRAWBERRY,10,1.95,14156.0,EIRE,2025-08-02
495304,84706A,ENGLISH ROSE TABLE CLOCK,24,1.95,14156.0,EIRE,2025-08-02
495304,16161P,WRAP ENGLISH ROSE ,25,0.42,14156.0,EIRE,2025-08-02
495304,16156L,"WRAP, CAROUSEL",25,0.42,14156.0,EIRE,2025-08-02
495304,84532B,FAIRY CAKES RECTANGLUAR BOXES,2,5.95,14156.0,EIRE,2025-08-02
495304,85184C,S/4 VALENTINE DECOUPAGE HEART BOX,6,2.95,14156.0,EIRE,2025-08-02
495304,21470,FLOWER VINE RAFFIA FOOD COVER,6,3.75,14156.0,EIRE,2025-08-02
495304,84692,BOX OF 24 COCKTAIL PARASOLS,25,0.42,14156.0,EIRE,2025-08-02
495304,22356,"CHARLOTTE BAG , PINK/WHITE SPOTS",10,0.85,14156.0,EIRE,2025-08-02
495304,22218,CAKE STAND LACE WHITE,3,4.25,14156.0,EIRE,2025-08-02
495305,79023B,,-57,0.0,,United Kingdom,2025-08-02
495306,84933B,,-8,0.0,,United Kingdom,2025-08-02
495307,20718,RED SPOTTY SHOPPER BAG,10,1.25,16779.0,United Kingdom,2025-08-02
495307,21035,SET/2 RED SPOTTY TEA TOWELS ,50,2.95,16779.0,United Kingdom,2025-08-02
495307,20914,SET/5 RED SPOTTY LID GLASS BOWLS,6,2.95,16779.0,United Kingdom,2025-08-02
495307,84692,BOX OF 24 COCKTAIL PARASOLS,25,0.42,16779.0,United Kingdom,2025-08-02
495307,20735,BLACK MINI TAPE MEASURE ,100,0.72,16779.0,United Kingdom,2025-08-02
495307,21556,CERAMIC STRAWBERRY MONEY BOX,7,2.55,16779.0,United Kingdom,2025-08-02
495307,20990,SPRING FLOWER CHOPSTICKS SET/5,19,1.95,16779.0,United Kingdom,2025-08-02
495307,20990,SPRING FLOWER CHOPSTICKS SET/5,1,1.95,16779.0,United Kingdom,2025-08-02
495307,21930,JUMBO STORAGE BAG SKULLS,20,1.95,16779.0,United Kingdom,2025-08-02
495307,20989,URBAN CHIC CHOPSTICKS SET/5,7,1.95,16779.0,United Kingdom,2025-08-02
495307,20711,JUMBO BAG TOYS ,20,1.95,16779.0,United Kingdom,2025-08-02
495307,85099B,JUMBO BAG RED WHITE SPOTTY ,20,1.95,16779.0,United Kingdom,2025-08-02
495307,20712,JUMBO BAG WOODLAND ANIMALS,20,1.95,16779.0,United Kingdom,2025-08-02
495307,20713,JUMBO BAG OWLS,20,1.95,16779.0,United Kingdom,2025-08-02
495307,21094,SET/6 RED SPOTTY PAPER PLATES,96,0.64,16779.0,United Kingdom,2025-08-02
495307,21218,RED SPOTTY BISCUIT TIN,24,3.25,16779.0,United Kingdom,2025-08-02
495307,20725,LUNCH BAG RED SPOTTY,100,1.45,16779.0,United Kingdom,2025-08-02
495307,47556B,TEA TIME TEA TOWELS ,20,2.95,16779.0,United Kingdom,2025-08-02
495307,85099C,JUMBO  BAG BAROQUE BLACK WHITE,20,1.95,16779.0,United Kingdom,2025-08-02
495308,21034,REX CASH+CARRY JUMBO SHOPPER,1,0.95,15863.0,United Kingdom,2025-08-02
495308,21484,CHICK GREY HOT WATER BOTTLE,1,3.45,15863.0,United Kingdom,2025-08-02
495308,21481,FAWN BLUE HOT WATER BOTTLE,1,2.95,15863.0,United Kingdom,2025-08-02
495308,21485,RED SPOT HEART HOT WATER BOTTLE,2,4.95,15863.0,United Kingdom,2025-08-02
495308,22315,200 RED + WHITE BENDY STRAWS,1,1.25,15863.0,United Kingdom,2025-08-02
495308,22367,CHILDS APRON SPACEBOY DESIGN,1,1.95,15863.0,United Kingdom,2025-08-02
C495309,79072,TEATIME CAKE TIN WITH HANDLE,-1,9.95,17243.0,United Kingdom,2025-08-02
C495309,21346,LARGE SILVER BALUSTRADE CANDLESTICK,-1,5.95,17243.0,United Kingdom,2025-08-02
495310,21937,STRAWBERRY   PICNIC BAG,5,2.95,12531.0,Germany,2025-08-02
495310,22082,RIBBON REEL STRIPES DESIGN ,10,1.65,12531.0,Germany,2025-08-02
495310,22079,RIBBON REEL HEARTS DESIGN ,10,1.65,12531.0,Germany,2025-08-02
495310,22078,RIBBON REEL LACE DESIGN ,10,2.1,12531.0,Germany,2025-08-02
495310,22073,RETRO SPOT STORAGE JAR,4,3.75,12531.0,Germany,2025-08-02
495310,22090,PAPER BUNTING RETRO SPOTS,6,2.95,12531.0,Germany,2025-08-02
495310,21976,PACK OF 60 MUSHROOM CAKE CASES,24,0.55,12531.0,Germany,2025-08-02
495310,21975,PACK OF 60 DINOSAUR CAKE CASES,24,0.55,12531.0,Germany,2025-08-02
495310,21973,SET OF 36 MUSHROOM PAPER DOILIES,12,1.45,12531.0,Germany,2025-08-02
495310,21972,SET OF 36 DINOSAUR PAPER DOILIES,12,1.45,12531.0,Germany,2025-08-02
495310,21936,RED/WHITE SPOT PICNIC BAG,5,2.95,12531.0,Germany,2025-08-02
495310,21671,RED SPOT CERAMIC DRAWER KNOB,12,1.25,12531.0,Germany,2025-08-02
495310,21894,POTTING SHED SEED ENVELOPES,12,1.25,12531.0,Germany,2025-08-02
495310,21880,RED AND WHITE SPOT TAPE,12,0.65,12531.0,Germany,2025-08-02
495310,21844,RETRO SPOT MUG,6,2.95,12531.0,Germany,2025-08-02
495310,21768,WALL MOUNTED VINTAGE ORGANISER,2,14.95,12531.0,Germany,2025-08-02
495310,21680,WOODLAND  STICKERS,12,0.85,12531.0,Germany,2025-08-02
495310,21672,WHITE SPOT RED CERAMIC DRAWER KNOB,12,1.25,12531.0,Germany,2025-08-02
495310,22138,BAKING SET 9 PIECE RETROSPOT ,3,4.95,12531.0,Germany,2025-08-02
495310,21668,RED STRIPE CERAMIC DRAWER KNOB,12,1.25,12531.0,Germany,2025-08-02
495310,21655,HANGING RIDGE GLASS T-LIGHT HOLDER,12,1.69,12531.0,Germany,2025-08-02
495310,21578,WOODLAND DESIGN  COTTON TOTE BAG,6,2.25,12531.0,Germany,2025-08-02
495310,21542,WOODLAND WATER TRANSFER TATTOOS ,24,0.85,12531.0,Germany,2025-08-02
495310,21541,DINOSAURS WATER TRANSFER TATTOOS ,12,0.85,12531.0,Germany,2025-08-02
495310,21896,POTTING SHED TWINE,6,2.1,12531.0,Germany,2025-08-02
495310,22139,RETRO SPOT TEA SET CERAMIC 11 PC ,3,4.95,12531.0,Germany,2025-08-02
495310,22329,ROUND CONTAINER SET OF 5 RETROSPOT,12,1.65,12531.0,Germany,2025-08-02
495310,22232,JIGSAW TOADSTOOLS 3 PIECE,8,1.65,12531.0,Germany,2025-08-02
495310,21537,RETRO SPOTS PUDDING BOWL,4,4.25,12531.0,Germany,2025-08-02
495310,POST,POSTAGE,9,18.0,12531.0,Germany,2025-08-02
495310,85059,FRENCH ENAMEL WATER BASIN,4,3.75,12531.0,Germany,2025-08-02
495310,85055,FRENCH ENAMEL UTENSIL HOLDER,4,3.75,12531.0,Germany,2025-08-02
495310,85032B,BLOSSOM IMAGES GIFT WRAP SET,6,2.1,12531.0,Germany,2025-08-02
495310,85032A,ROMANTIC IMAGES GIFT WRAP SET,6,2.1,12531.0,Germany,2025-08-02
495310,85016,SET OF 6 VINTAGE NOTELETS KIT,6,2.55,12531.0,Germany,2025-08-02
495310,85015,SET OF 12  VINTAGE POSTCARD SET,6,2.55,12531.0,Germany,2025-08-02
495310,84997D,PINK 3 PIECE MINI DOTS CUTLERY SET,6,3.75,12531.0,Germany,2025-08-02
495310,84997C,BLUE 3 PIECE MINI DOTS CUTLERY SET,6,3.75,12531.0,Germany,2025-08-02
495310,84997B,RED 3 PIECE MINI DOTS CUTLERY SET,6,3.75,12531.0,Germany,2025-08-02
495310,84970S,HANGING HEART ZINC T-LIGHT HOLDER,12,0.85,12531.0,Germany,2025-08-02
495310,84832,ZINC WILLIE WINKIE  CANDLE STICK,12,0.85,12531.0,Germany,2025-08-02
495310,84247L,FAWN AND MUSHROOM GREETING CARD,12,0.42,12531.0,Germany,2025-08-02
495310,22356,"CHARLOTTE BAG , PINK/WHITE SPOTS",10,0.85,12531.0,Germany,2025-08-02
495310,22354,RETRO SPOT PADDED SEAT CUSHION,10,3.75,12531.0,Germany,2025-08-02
495310,22334,DINOSAUR PARTY BAG + STICKER SET,8,1.65,12531.0,Germany,2025-08-02
495310,22333,RETRO SPORT PARTY BAG + STICKER SET,8,1.65,12531.0,Germany,2025-08-02
495310,22331,WOODLAND PARTY BAG + STICKER SET,8,1.65,12531.0,Germany,2025-08-02
495310,22326,ROUND SNACK BOXES SET OF4 WOODLAND ,6,2.95,12531.0,Germany,2025-08-02
495310,22255,FELT TOADSTOOL  SMALL,12,0.85,12531.0,Germany,2025-08-02
495310,22254,FELT TOADSTOOL LARGE,12,1.25,12531.0,Germany,2025-08-02
495310,22253,6 CROCHET STRAWBERRIES,12,1.25,12531.0,Germany,2025-08-02
495310,22243,"HOOK, 5 HANGER ,MAGIC TOADSTOOL RED",12,1.65,12531.0,Germany,2025-08-02
495310,22242,"HOOK, 5 HANGER , MAGIC TOADSTOOL",12,1.65,12531.0,Germany,2025-08-02
495310,22203,MILK PAN RED RETROSPOT,4,3.75,12531.0,Germany,2025-08-02
495310,21535,RETRO SPOT SMALL MILK JUG,6,2.55,12531.0,Germany,2025-08-02
495310,20677,PINK SPOTTY BOWL,8,1.25,12531.0,Germany,2025-08-02
495310,21531,RETRO SPOT SUGAR JAM BOWL,6,2.55,12531.0,Germany,2025-08-02
495310,21078,SET/20 STRAWBERRY PAPER NAPKINS ,12,0.85,12531.0,Germany,2025-08-02
495310,21077,SET/20 WOODLAND PAPER NAPKINS ,12,0.85,12531.0,Germany,2025-08-02
495310,21059,PARTY INVITES DINOSAURS,12,0.85,12531.0,Germany,2025-08-02
495310,21058,PARTY INVITES WOODLAND,12,0.85,12531.0,Germany,2025-08-02
495310,21041,RED SPOTTY OVEN GLOVE DOUBLE,6,2.95,12531.0,Germany,2025-08-02
495310,21039,RED SPOTTY SHOPPING BAG,6,2.55,12531.0,Germany,2025-08-02
495310,21035,SET/2 RED SPOTTY TEA TOWELS ,6,2.95,12531.0,Germany,2025-08-02
495310,20983,12 PENCILS TALL TUBE RED SPOTTY,12,0.85,12531.0,Germany,2025-08-02
495310,20981,12 PENCILS TALL TUBE WOODLAND,12,0.85,12531.0,Germany,2025-08-02
495310,20754,RETRO RED SPOTTY WASHING UP GLOVES,6,2.1,12531.0,Germany,2025-08-02
495310,20750, RED/WHITE DOT MINI CASES,4,7.95,12531.0,Germany,2025-08-02
495310,21080,SET/20 RED SPOTTY PAPER NAPKINS ,12,0.85,12531.0,Germany,2025-08-02
495310,20726,LUNCH BAG WOODLAND,10,1.65,12531.0,Germany,2025-08-02
495310,20724,RED SPOTTY CHARLOTTE BAG,20,0.85,12531.0,Germany,2025-08-02
495310,20723,STRAWBERRY CHARLOTTE BAG,10,0.85,12531.0,Germany,2025-08-02
495310,20719,WOODLAND CHARLOTTE BAG,10,0.85,12531.0,Germany,2025-08-02
495310,20718,RED SPOTTY SHOPPER BAG,10,1.25,12531.0,Germany,2025-08-02
495310,20717,STRAWBERRY SHOPPER BAG,10,1.25,12531.0,Germany,2025-08-02
495310,20685,RED SPOTTY COIR DOORMAT,2,6.75,12531.0,Germany,2025-08-02
495310,20682,RED SPOTTY CHILDS UMBRELLA,6,3.25,12531.0,Germany,2025-08-02
495310,20681,PINK SPOTTY CHILDS UMBRELLA,6,3.25,12531.0,Germany,2025-08-02
495310,20676,RED SPOTTY BOWL,8,1.25,12531.0,Germany,2025-08-02
495310,20675,BLUE SPOTTY BOWL,8,1.25,12531.0,Germany,2025-08-02
495310,20658,RED SPOTTY LUGGAGE TAG,12,1.25,12531.0,Germany,2025-08-02
495310,20725,LUNCH BAG RED SPOTTY,10,1.65,12531.0,Germany,2025-08-02
495310,21085,SET/6 WOODLAND PAPER CUPS,12,0.65,12531.0,Germany,2025-08-02
495310,21533,RETRO SPOT LARGE MILK JUG,3,4.95,12531.0,Germany,2025-08-02
495310,21091,SET/6 WOODLAND PAPER PLATES,12,0.85,12531.0,Germany,2025-08-02
495310,21498,RED SPOTS  WRAP ,25,0.42,12531.0,Germany,2025-08-02
495310,21439,BASKET OF TOADSTOOLS,12,1.25,12531.0,Germany,2025-08-02
495310,21432,SET OF 3 CASES WOODLAND DESIGN,4,5.95,12531.0,Germany,2025-08-02
495310,21086,SET/6 RED SPOTTY PAPER CUPS,12,0.65,12531.0,Germany,2025-08-02
495310,21330,WOODLAND ANIMAL  WRITING SET ,12,1.65,12531.0,Germany,2025-08-02
495310,21329,DINOSAURS  WRITING SET ,12,1.65,12531.0,Germany,2025-08-02
495310,21244,BLUE  SPOTTY PLATE ,8,1.69,12531.0,Germany,2025-08-02
495310,21243,PINK  SPOTTY PLATE ,8,1.69,12531.0,Germany,2025-08-02
495310,21240,BLUE  SPOTTY CUP,8,0.85,12531.0,Germany,2025-08-02
