Invoice,StockCode,Description,Quantity,Price,Customer ID,Country,InvoiceDate
495228,84755,COLOUR GLASS T-LIGHT HOLDER HANGING,144,0.55,14646.0,Netherlands,2025-08-02
495228,22147,FELTCRAFT BUTTERFLY HEARTS,80,1.25,14646.0,Netherlands,2025-08-02
495228,20914,SET/5 RED SPOTTY LID GLASS BOWLS,32,2.55,14646.0,Netherlands,2025-08-02
495228,21385,IVORY HANGING DECORATION  HEART,288,0.72,14646.0,Netherlands,2025-08-02
495228,21390,FILIGRIS HEART WITH BUTTERFLY,288,1.06,14646.0,Netherlands,2025-08-02
495228,21481,FAWN BLUE HOT WATER BOTTLE,36,2.55,14646.0,Netherlands,2025-08-02
495228,21485,RED SPOT HEART HOT WATER BOTTLE,24,4.25,14646.0,Netherlands,2025-08-02
495228,84879,ASSORTED COLOUR BIRD ORNAMENT,160,1.45,14646.0,Netherlands,2025-08-02
495228,84836,ZINC METAL HEART DECORATION,216,1.06,14646.0,Netherlands,2025-08-02
495228,84459B,YELLOW METAL CHICKEN HEART ,96,1.25,14646.0,Netherlands,2025-08-02
495228,22131,FOOD CONTAINER SET 3 LOVE HEART ,144,1.65,14646.0,Netherlands,2025-08-02
495228,22243,"HOOK, 5 HANGER ,MAGIC TOADSTOOL RED",384,1.45,14646.0,Netherlands,2025-08-02
495228,22244,"HOOK, 3 HANGER ,MAGIC GARDEN",96,1.65,14646.0,Netherlands,2025-08-02
495228,22253,6 CROCHET STRAWBERRIES,192,1.06,14646.0,Netherlands,2025-08-02
495228,22285,"DECORATION HEN ON NEST, HANGING",288,1.45,14646.0,Netherlands,2025-08-02
495228,22335,HEART DECORATION PAINTED ZINC ,288,0.55,14646.0,Netherlands,2025-08-02
495228,35961,FOLKART ZINC HEART CHRISTMAS DEC,288,0.72,14646.0,Netherlands,2025-08-02
495228,22146,EASTER CRAFT IVY WREATH WITH CHICK,80,1.65,14646.0,Netherlands,2025-08-02
495228,21843,RETRO SPOT CAKE STAND,24,9.95,14646.0,Netherlands,2025-08-02
495228,22148,EASTER CRAFT 4 CHICKS ,80,1.65,14646.0,Netherlands,2025-08-02
495228,21280,VINTAGE KITCHEN PRINT VEGETABLES,48,2.1,14646.0,Netherlands,2025-08-02
495228,22356,"CHARLOTTE BAG , PINK/WHITE SPOTS",100,0.72,14646.0,Netherlands,2025-08-02
495228,84970L,SINGLE HEART ZINC T-LIGHT HOLDER,288,0.79,14646.0,Netherlands,2025-08-02
495228,84970S,HANGING HEART ZINC T-LIGHT HOLDER,288,0.64,14646.0,Netherlands,2025-08-02
495228,84975,HEART SHAPED MIRROR,72,1.45,14646.0,Netherlands,2025-08-02
495228,21684,SMALL MEDINA STAMPED METAL BOWL ,360,0.64,14646.0,Netherlands,2025-08-02
495228,21683,MEDIUM MEDINA STAMPED METAL BOWL ,96,2.55,14646.0,Netherlands,2025-08-02
495228,21559,STRAWBERRY LUNCHBOX WITH CUTLERY,180,2.1,14646.0,Netherlands,2025-08-02
495228,22353,LUNCHBOX WITH CUTLERY FAIRY CAKES ,180,2.1,14646.0,Netherlands,2025-08-02
495228,20719,WOODLAND CHARLOTTE BAG,100,0.72,14646.0,Netherlands,2025-08-02
495228,84992,72 SWEETHEART FAIRY CAKE CASES,120,0.42,14646.0,Netherlands,2025-08-02
495228,21672,WHITE SPOT RED CERAMIC DRAWER KNOB,96,1.06,14646.0,Netherlands,2025-08-02
495228,22326,ROUND SNACK BOXES SET OF4 WOODLAND ,144,2.55,14646.0,Netherlands,2025-08-02
495228,22328,ROUND SNACK BOXES SET OF 4 FRUITS ,144,2.55,14646.0,Netherlands,2025-08-02
495228,22329,ROUND CONTAINER SET OF 5 RETROSPOT,144,1.45,14646.0,Netherlands,2025-08-02
495228,22136,LOVE HEART SOCK HANGER,96,1.45,14646.0,Netherlands,2025-08-02
495228,22294,HEART FILIGREE DOVE  SMALL,288,1.06,14646.0,Netherlands,2025-08-02
495228,85123A,WHITE HANGING HEART T-LIGHT HOLDER,480,2.55,14646.0,Netherlands,2025-08-02
495228,85194L,HANGING SPRING FLOWER EGG LARGE,144,0.72,14646.0,Netherlands,2025-08-02
495228,21281,VINTAGE KITCHEN PRINT SEAFOOD,48,2.1,14646.0,Netherlands,2025-08-02
495229,20712,JUMBO BAG WOODLAND ANIMALS,100,1.65,14646.0,Netherlands,2025-08-02
495229,20931,BLUE POT PLANT CANDLE ,48,2.95,14646.0,Netherlands,2025-08-02
495229,22199,FRYING PAN RED POLKADOT ,48,3.75,14646.0,Netherlands,2025-08-02
495229,20719,WOODLAND CHARLOTTE BAG,100,0.72,14646.0,Netherlands,2025-08-02
495229,85099B,JUMBO BAG RED WHITE SPOTTY ,100,1.65,14646.0,Netherlands,2025-08-02
495229,20728,LUNCH BAG CARS BLUE,100,1.45,14646.0,Netherlands,2025-08-02
495229,22366,DOORMAT AIRMAIL ,20,5.95,14646.0,Netherlands,2025-08-02
495229,22073,RETRO SPOT STORAGE JAR,48,3.39,14646.0,Netherlands,2025-08-02
495229,20724,RED SPOTTY CHARLOTTE BAG,100,0.72,14646.0,Netherlands,2025-08-02
495230,22179,SET 10 LIGHTS NIGHT OWL,2,6.75,13192.0,United Kingdom,2025-08-02
495230,21944,KITTENS DESIGN FLANNEL,12,0.85,13192.0,United Kingdom,2025-08-02
495230,21755,LOVE BUILDING BLOCK WORD,3,5.95,13192.0,United Kingdom,2025-08-02
495230,22139,RETRO SPOT TEA SET CERAMIC 11 PC ,3,4.95,13192.0,United Kingdom,2025-08-02
495230,22138,BAKING SET 9 PIECE RETROSPOT ,3,4.95,13192.0,United Kingdom,2025-08-02
495230,22149,FELTCRAFT 6 FLOWER FRIENDS,6,2.1,13192.0,United Kingdom,2025-08-02
495230,22146,EASTER CRAFT IVY WREATH WITH CHICK,6,1.95,13192.0,United Kingdom,2025-08-02
495230,22271,FELTCRAFT DOLL ROSIE,6,2.95,13192.0,United Kingdom,2025-08-02
495230,22299,PIG KEYRING WITH LIGHT & SOUND ,24,1.25,13192.0,United Kingdom,2025-08-02
495230,21889,WOODEN BOX OF DOMINOES,12,1.25,13192.0,United Kingdom,2025-08-02
495230,21891,TRADITIONAL WOODEN SKIPPING ROPE,12,1.25,13192.0,United Kingdom,2025-08-02
495230,21991,BOHEMIAN COLLAGE STATIONERY SET,6,2.95,13192.0,United Kingdom,2025-08-02
495230,22037,ROBOT BIRTHDAY CARD,12,0.42,13192.0,United Kingdom,2025-08-02
495230,17003,BROCADE RING PURSE ,50,0.21,13192.0,United Kingdom,2025-08-02
495230,22178,VICTORIAN GLASS HANGING T-LIGHT,12,1.25,13192.0,United Kingdom,2025-08-02
495230,21684,SMALL MEDINA STAMPED METAL BOWL ,12,0.85,13192.0,United Kingdom,2025-08-02
495230,22294,HEART FILIGREE DOVE  SMALL,24,1.25,13192.0,United Kingdom,2025-08-02
495230,22341,LOVE GARLAND PAINTED ZINC ,12,1.65,13192.0,United Kingdom,2025-08-02
495230,21737,SET 3 WICKER LOG BASKETS,1,19.95,13192.0,United Kingdom,2025-08-02
495230,21892,TRADITIONAL WOODEN CATCH CUP GAME ,12,1.25,13192.0,United Kingdom,2025-08-02
495230,22243,"HOOK, 5 HANGER ,MAGIC TOADSTOOL RED",12,1.65,13192.0,United Kingdom,2025-08-02
495230,21942,SKULLS DESIGN FLANNEL,12,0.85,13192.0,United Kingdom,2025-08-02
495230,22247,BUNNY DECORATION MAGIC GARDEN,16,0.85,13192.0,United Kingdom,2025-08-02
495230,22232,JIGSAW TOADSTOOLS 3 PIECE,8,1.65,13192.0,United Kingdom,2025-08-02
495230,70006,LOVE HEART POCKET WARMER,12,1.65,13192.0,United Kingdom,2025-08-02
495230,22289,"DECORATION , HANGING METAL CHICKEN",24,1.25,13192.0,United Kingdom,2025-08-02
495230,22292,"SPRING DEC , HANGING CHICK  YELLOW",24,1.45,13192.0,United Kingdom,2025-08-02
495230,22288,"DECORATION , HANGING METAL RABBIT",24,1.25,13192.0,United Kingdom,2025-08-02
495230,22286,"DECORATION , WOBBLY RABBIT , METAL ",12,1.65,13192.0,United Kingdom,2025-08-02
495230,22266,EASTER DECORATION HANGING BUNNY,24,0.65,13192.0,United Kingdom,2025-08-02
495230,22269,EGG CUP NATURAL CHICKEN,8,1.25,13192.0,United Kingdom,2025-08-02
495230,22268,EASTER DECORATION SITTING BUNNY,24,0.85,13192.0,United Kingdom,2025-08-02
495230,85196,EASTER BUNNIES ON A STICK,12,0.55,13192.0,United Kingdom,2025-08-02
495230,22270,HAPPY EASTER HANGING DECORATION,4,3.75,13192.0,United Kingdom,2025-08-02
495230,85093,CANDY SPOT EGG WARMER HARE,12,1.25,13192.0,United Kingdom,2025-08-02
495230,21383,PACK OF 12 STICKY BUNNIES,12,0.65,13192.0,United Kingdom,2025-08-02
495230,22248,DECORATION  PINK CHICK MAGIC GARDEN,16,0.85,13192.0,United Kingdom,2025-08-02
495230,22250,DECORATION  BUTTERFLY  MAGIC GARDEN,16,0.85,13192.0,United Kingdom,2025-08-02
495230,22355,"CHARLOTTE BAG , SUKI DESIGN",10,0.85,13192.0,United Kingdom,2025-08-02
495230,22249,DECORATION WHITE CHICK MAGIC GARDEN,16,0.85,13192.0,United Kingdom,2025-08-02
495230,21381,MINI WOODEN HAPPY BIRTHDAY GARLAND,12,1.69,13192.0,United Kingdom,2025-08-02
495230,21384,IVORY HANGING DECORATION  BUTTERFLY,24,0.85,13192.0,United Kingdom,2025-08-02
495230,21385,IVORY HANGING DECORATION  HEART,24,0.85,13192.0,United Kingdom,2025-08-02
495230,20726,LUNCH BAG WOODLAND,10,1.65,13192.0,United Kingdom,2025-08-02
C495231,M,Manual,-1,756.85,14911.0,EIRE,2025-08-02
495232,22212,FOUR HOOK  WHITE LOVEBIRDS,6,2.1,14156.0,EIRE,2025-08-02
495232,22173,METAL 4 HOOK HANGER FRENCH CHATEAU,8,2.95,14156.0,EIRE,2025-08-02
495232,48189,DOOR MAT FRIENDSHIP ,2,6.75,14156.0,EIRE,2025-08-02
495232,21524,SPOTTY  HOME SWEET HOME DOORMAT,2,6.75,14156.0,EIRE,2025-08-02
495232,48187,DOOR MAT NEW ENGLAND,4,6.75,14156.0,EIRE,2025-08-02
495232,21770,OPEN CLOSED METAL SIGN,4,4.95,14156.0,EIRE,2025-08-02
495232,21185, HOME SWEET HOME  BLACKBOARD,3,6.35,14156.0,EIRE,2025-08-02
495232,22199,FRYING PAN RED POLKADOT ,4,4.25,14156.0,EIRE,2025-08-02
495232,22184,CAKE STAND VICTORIAN FILIGREE LARGE,2,8.5,14156.0,EIRE,2025-08-02
495232,22203,MILK PAN RED RETROSPOT,4,3.75,14156.0,EIRE,2025-08-02
495232,20754,RETRO RED SPOTTY WASHING UP GLOVES,6,2.1,14156.0,EIRE,2025-08-02
495232,21437,24 HANGING EASTER EGGS FLORAL TUB,4,3.75,14156.0,EIRE,2025-08-02
495232,21429,RED GINGHAM ROSE JEWELLERY BOX,8,1.65,14156.0,EIRE,2025-08-02
495232,84406B,CREAM CUPID HEARTS COAT HANGER,8,3.25,14156.0,EIRE,2025-08-02
495232,22215,CAKE STAND WHITE TWO TIER LACE,2,8.5,14156.0,EIRE,2025-08-02
495232,21534,DAIRY MAID LARGE MILK JUG,3,4.95,14156.0,EIRE,2025-08-02
495232,22354,RETRO SPOT PADDED SEAT CUSHION,10,3.75,14156.0,EIRE,2025-08-02
495232,85178,VICTORIAN SEWING KIT,12,1.25,14156.0,EIRE,2025-08-02
495232,22319,HAIRCLIPS FORTIES FABRIC ASSORTED,12,0.65,14156.0,EIRE,2025-08-02
495232,21528,DAIRY MAID TRADITIONAL TEAPOT ,2,6.95,14156.0,EIRE,2025-08-02
495232,21396,RED SPOTTY EGG CUP ,12,1.25,14156.0,EIRE,2025-08-02
495232,21398,RED  SPOTTY COFFEE  MUG,6,2.1,14156.0,EIRE,2025-08-02
495232,22180,RETRO SPOT LAMP,2,9.95,14156.0,EIRE,2025-08-02
495232,22348,TEA BAG PLATE RED SPOTTY ,12,0.85,14156.0,EIRE,2025-08-02
495232,37449,CERAMIC CAKE STAND + HANGING CAKES,2,9.95,14156.0,EIRE,2025-08-02
495232,85049C,ROMANTIC PINKS RIBBONS ,12,1.25,14156.0,EIRE,2025-08-02
495232,85049F,BABY BOOM RIBBONS ,12,1.25,14156.0,EIRE,2025-08-02
495232,37447,CERAMIC CAKE DESIGN SPOTTED PLATE,12,1.49,14156.0,EIRE,2025-08-02
495232,37494A,FAIRY CAKE CERAMIC BUTTER DISH,6,2.95,14156.0,EIRE,2025-08-02
495232,22060,LARGE CAKE STAND HANGING HEARTS,2,9.95,14156.0,EIRE,2025-08-02
495232,22058,CERAMIC LOVE HEARTS DESIGN MUG,12,1.49,14156.0,EIRE,2025-08-02
495232,84509A,ENGLISH ROSE PLACEMATS,4,3.75,14156.0,EIRE,2025-08-02
495232,47568,ENGLISH ROSE DESIGN PEG BAG,6,2.1,14156.0,EIRE,2025-08-02
495232,22177,5 HOOK BLACKBOARD ORGANISER ,2,9.95,14156.0,EIRE,2025-08-02
495232,85090,CANDY SPOT APRON,3,4.65,14156.0,EIRE,2025-08-02
495232,21333,CLASSIC WHITE FRAME,6,2.95,14156.0,EIRE,2025-08-02
495232,22139,RETRO SPOT TEA SET CERAMIC 11 PC ,3,4.95,14156.0,EIRE,2025-08-02
495232,21214,SET OF 72 IVORY PAPER DOILIES,12,1.45,14156.0,EIRE,2025-08-02
495232,21877,HOME SWEET HOME MUG,12,1.25,14156.0,EIRE,2025-08-02
495232,21874,GIN AND TONIC MUG,12,1.25,14156.0,EIRE,2025-08-02
495232,21870,I CAN ONLY PLEASE ONE PERSON MUG,12,1.25,14156.0,EIRE,2025-08-02
495232,84375,SET OF 20 KIDS COOKIE CUTTERS,12,1.95,14156.0,EIRE,2025-08-02
495232,84050,PINK HEART SHAPE EGG FRYING PAN,6,1.65,14156.0,EIRE,2025-08-02
495232,84992,72 SWEETHEART FAIRY CAKE CASES,24,0.55,14156.0,EIRE,2025-08-02
495232,84828,JUNGLE POPSICLES ICE LOLLY HOLDERS,12,1.25,14156.0,EIRE,2025-08-02
495232,21539,RETRO SPOTS BUTTER DISH,3,4.95,14156.0,EIRE,2025-08-02
495232,21533,RETRO SPOT LARGE MILK JUG,3,4.95,14156.0,EIRE,2025-08-02
495232,20914,SET/5 RED SPOTTY LID GLASS BOWLS,6,2.95,14156.0,EIRE,2025-08-02
495232,22309,TEA COSY RED  STRIPE,6,2.55,14156.0,EIRE,2025-08-02
495232,21540,DAIRY MAID CERAMIC BUTTER DISH,3,4.25,14156.0,EIRE,2025-08-02
495232,85014B,RED/WHITE DOTS RUFFLED UMBRELLA,6,5.95,14156.0,EIRE,2025-08-02
495232,21527,RETRO SPOT TRADITIONAL TEAPOT ,2,7.95,14156.0,EIRE,2025-08-02
495232,21212,PACK OF 72 RETRO SPOT CAKE CASES,24,0.55,14156.0,EIRE,2025-08-02
495232,21210,SET OF 72 RETRO SPOT PAPER  DOILIES,12,1.45,14156.0,EIRE,2025-08-02
495232,22283,6 EGG HOUSE PAINTED WOOD,4,7.95,14156.0,EIRE,2025-08-02
495232,22244,"HOOK, 3 HANGER ,MAGIC GARDEN",12,1.95,14156.0,EIRE,2025-08-02
495232,21063,PARTY INVITES JAZZ HEARTS,12,0.85,14156.0,EIRE,2025-08-02
495232,21059,PARTY INVITES DINOSAURS,12,0.85,14156.0,EIRE,2025-08-02
495232,21121,SET/10 RED SPOTTY PARTY CANDLES,24,1.25,14156.0,EIRE,2025-08-02
495232,22269,EGG CUP NATURAL CHICKEN,8,1.25,14156.0,EIRE,2025-08-02
495232,22286,"DECORATION , WOBBLY RABBIT , METAL ",12,1.65,14156.0,EIRE,2025-08-02
495232,85093,CANDY SPOT EGG WARMER HARE,12,1.25,14156.0,EIRE,2025-08-02
495232,85200,BUNNY EGG BOX,12,1.25,14156.0,EIRE,2025-08-02
495232,21126,SET OF 6 GIRLS CELEBRATION CANDLES,12,1.25,14156.0,EIRE,2025-08-02
495232,21383,PACK OF 12 STICKY BUNNIES,12,0.65,14156.0,EIRE,2025-08-02
495232,85186C,BUNNY EGG GARLAND,24,0.42,14156.0,EIRE,2025-08-02
495232,85197,SET OF 12 MINI BUNNIES IN A BUCKET,6,2.1,14156.0,EIRE,2025-08-02
495232,22261,FELT EGG COSY WHITE RABBIT ,12,0.85,14156.0,EIRE,2025-08-02
495232,21466,RED FLOWER CROCHET FOOD COVER,6,3.75,14156.0,EIRE,2025-08-02
495232,21469,POLKA DOT RAFFIA FOOD COVER,6,3.75,14156.0,EIRE,2025-08-02
495232,85189,HANGING BUTTERFLY  EGG,24,0.85,14156.0,EIRE,2025-08-02
495233,21213,PACK OF 72 SKULL CAKE CASES,240,0.4,13027.0,United Kingdom,2025-08-02
C495234,M,Manual,-1,1193.89,14156.0,EIRE,2025-08-02
495235,M,Manual,1,1193.89,14156.0,EIRE,2025-08-02
495236,82551,LAUNDRY 15C METAL SIGN,96,1.06,17409.0,United Kingdom,2025-08-02
495236,84879,ASSORTED COLOUR BIRD ORNAMENT,160,1.45,17409.0,United Kingdom,2025-08-02
495236,21733,RED HANGING HEART T-LIGHT HOLDER,32,2.55,17409.0,United Kingdom,2025-08-02
495236,82583,HOT BATHS METAL SIGN,72,1.69,17409.0,United Kingdom,2025-08-02
495236,22180,RETRO SPOT LAMP,12,8.5,17409.0,United Kingdom,2025-08-02
495236,85123A,WHITE HANGING HEART T-LIGHT HOLDER,32,2.55,17409.0,United Kingdom,2025-08-02
495236,85014B,RED/WHITE DOTS RUFFLED UMBRELLA,3,5.95,17409.0,United Kingdom,2025-08-02
495236,85014A,BLACK/BLUE DOTS RUFFLED UMBRELLA,3,5.95,17409.0,United Kingdom,2025-08-02
495236,22348,TEA BAG PLATE RED SPOTTY ,24,0.85,17409.0,United Kingdom,2025-08-02
495236,85014D,PINK/BROWN DOTS RUFFLED UMBRELLA,3,5.95,17409.0,United Kingdom,2025-08-02
495236,85014C,BLUE/BROWN DOTS RUFFLED UMBRELLA,3,5.95,17409.0,United Kingdom,2025-08-02
495237,84050,PINK HEART SHAPE EGG FRYING PAN,12,1.65,17160.0,United Kingdom,2025-08-02
495237,84378,SET OF 3 HEART COOKIE CUTTERS,12,1.25,17160.0,United Kingdom,2025-08-02
495237,84836,ZINC METAL HEART DECORATION,12,1.25,17160.0,United Kingdom,2025-08-02
495237,84970S,HANGING HEART ZINC T-LIGHT HOLDER,24,0.85,17160.0,United Kingdom,2025-08-02
495237,84970L,SINGLE HEART ZINC T-LIGHT HOLDER,12,0.95,17160.0,United Kingdom,2025-08-02
495237,84992,72 SWEETHEART FAIRY CAKE CASES,24,0.55,17160.0,United Kingdom,2025-08-02
495237,22326,ROUND SNACK BOXES SET OF4 WOODLAND ,6,2.95,17160.0,United Kingdom,2025-08-02
495237,22367,CHILDS APRON SPACEBOY DESIGN,8,1.95,17160.0,United Kingdom,2025-08-02
495237,20914,SET/5 RED SPOTTY LID GLASS BOWLS,6,2.95,17160.0,United Kingdom,2025-08-02
495237,20718,RED SPOTTY SHOPPER BAG,10,1.25,17160.0,United Kingdom,2025-08-02
495237,22355,"CHARLOTTE BAG , SUKI DESIGN",10,0.85,17160.0,United Kingdom,2025-08-02
495237,22356,"CHARLOTTE BAG , PINK/WHITE SPOTS",10,0.85,17160.0,United Kingdom,2025-08-02
495237,20719,WOODLAND CHARLOTTE BAG,10,0.85,17160.0,United Kingdom,2025-08-02
495237,85099B,JUMBO BAG RED WHITE SPOTTY ,10,1.95,17160.0,United Kingdom,2025-08-02
495237,21931,JUMBO STORAGE BAG SUKI,10,1.95,17160.0,United Kingdom,2025-08-02
495237,22329,ROUND CONTAINER SET OF 5 RETROSPOT,12,1.65,17160.0,United Kingdom,2025-08-02
495237,84247L,FAWN AND MUSHROOM GREETING CARD,12,0.42,17160.0,United Kingdom,2025-08-02
495237,21485,RED SPOT HEART HOT WATER BOTTLE,6,4.95,17160.0,United Kingdom,2025-08-02
495237,85232B,SET/3 RUSSIAN DOLL STACKING TINS,3,4.95,17160.0,United Kingdom,2025-08-02
495237,21481,FAWN BLUE HOT WATER BOTTLE,6,2.95,17160.0,United Kingdom,2025-08-02
495237,21484,CHICK GREY HOT WATER BOTTLE,8,3.45,17160.0,United Kingdom,2025-08-02
495237,84077,WORLD WAR 2 GLIDERS ASSTD DESIGNS,48,0.21,17160.0,United Kingdom,2025-08-02
495237,21504,SKULLS GREETING CARD,12,0.42,17160.0,United Kingdom,2025-08-02
495237,84755,COLOUR GLASS T-LIGHT HOLDER HANGING,16,0.65,17160.0,United Kingdom,2025-08-02
495237,22149,FELTCRAFT 6 FLOWER FRIENDS,12,2.1,17160.0,United Kingdom,2025-08-02
495237,82580,BATHROOM METAL SIGN,12,0.55,17160.0,United Kingdom,2025-08-02
495237,22125,UNION JACK HOT WATER BOTTLE ,3,5.95,17160.0,United Kingdom,2025-08-02
495237,21975,PACK OF 60 DINOSAUR CAKE CASES,24,0.55,17160.0,United Kingdom,2025-08-02
495237,21212,PACK OF 72 RETRO SPOT CAKE CASES,24,0.55,17160.0,United Kingdom,2025-08-02
495237,84991,60 TEATIME FAIRY CAKE CASES,24,0.55,17160.0,United Kingdom,2025-08-02
495237,47559B,TEA TIME OVEN GLOVE,10,1.25,17160.0,United Kingdom,2025-08-02
495237,21239,PINK  SPOTTY CUP,8,0.85,17160.0,United Kingdom,2025-08-02
495237,21240,BLUE  SPOTTY CUP,8,0.85,17160.0,United Kingdom,2025-08-02
495237,21584,RETRO SPOT SMALL TUBE MATCHES,20,1.65,17160.0,United Kingdom,2025-08-02
495237,47591D,PINK FAIRY CAKE CHILD'S APRON,8,1.95,17160.0,United Kingdom,2025-08-02
495238,84016,FLAG OF ST GEORGE CAR FLAG,12,0.42,14854.0,United Kingdom,2025-08-02
495238,84755,COLOUR GLASS T-LIGHT HOLDER HANGING,16,0.65,14854.0,United Kingdom,2025-08-02
495238,35923,CANDY HEART HANGING DECORATION,12,1.25,14854.0,United Kingdom,2025-08-02
495238,47503E,ASS FLORAL PRINT SCISSORS,12,1.25,14854.0,United Kingdom,2025-08-02
495238,21383,PACK OF 12 STICKY BUNNIES,12,0.65,14854.0,United Kingdom,2025-08-02
495238,84836,ZINC METAL HEART DECORATION,12,1.25,14854.0,United Kingdom,2025-08-02
495238,21985,PACK OF 12 HEARTS DESIGN TISSUES ,48,0.29,14854.0,United Kingdom,2025-08-02
495238,22297,HEART IVORY TRELLIS SMALL,24,1.25,14854.0,United Kingdom,2025-08-02
495238,22083,PAPER CHAIN KIT RETRO SPOT,6,2.95,14854.0,United Kingdom,2025-08-02
495238,85214,TUB 24 PINK FLOWER PEGS,12,1.65,14854.0,United Kingdom,2025-08-02
495238,85194L,HANGING SPRING FLOWER EGG LARGE,12,0.85,14854.0,United Kingdom,2025-08-02
495238,35921,EASTER BUNNY HANGING GARLAND,12,1.25,14854.0,United Kingdom,2025-08-02
495238,85086A,CANDY SPOT HEART DECORATION,12,0.85,14854.0,United Kingdom,2025-08-02
495238,85217,ASSORTED ICE CREAM FRIDGE MAGNETS,12,0.65,14854.0,United Kingdom,2025-08-02
495238,35971,ROSE FOLKART HEART DECORATIONS,24,1.25,14854.0,United Kingdom,2025-08-02
495238,48194,DOORMAT HEARTS,2,6.75,14854.0,United Kingdom,2025-08-02
495238,21700,BIG DOUGHNUT FRIDGE MAGNETS,12,0.85,14854.0,United Kingdom,2025-08-02
495238,84050,PINK HEART SHAPE EGG FRYING PAN,6,1.65,14854.0,United Kingdom,2025-08-02
495238,21385,IVORY HANGING DECORATION  HEART,24,0.85,14854.0,United Kingdom,2025-08-02
495238,22241,GARLAND WOODEN HAPPY EASTER,12,1.25,14854.0,United Kingdom,2025-08-02
495238,84970S,HANGING HEART ZINC T-LIGHT HOLDER,12,0.85,14854.0,United Kingdom,2025-08-02
495239,22310,KNITTED MUG COSY IVORY COLOUR ,2,3.36,,United Kingdom,2025-08-02
495239,22132,RED LOVE HEART SHAPE CUP,1,1.66,,United Kingdom,2025-08-02
495239,22115,METAL SIGN EMPIRE TEA,1,5.91,,United Kingdom,2025-08-02
495239,22114,HOT WATER BOTTLE TEA AND SYMPATHY,1,8.47,,United Kingdom,2025-08-02
495239,22249,DECORATION WHITE CHICK MAGIC GARDEN,1,1.66,,United Kingdom,2025-08-02
495239,22247,BUNNY DECORATION MAGIC GARDEN,1,1.66,,United Kingdom,2025-08-02
495239,22245,"HOOK, 1 HANGER ,MAGIC GARDEN",6,1.66,,United Kingdom,2025-08-02
495239,35095A,BLUE VICTORIAN FABRIC OVAL BOX,1,0.84,,United Kingdom,2025-08-02
495239,21770,OPEN CLOSED METAL SIGN,2,10.17,,United Kingdom,2025-08-02
495239,35001W,HAND OPEN SHAPE DECO.WHITE,2,4.21,,United Kingdom,2025-08-02
495239,21775,DECORATIVE FLORE BATHROOM BOTTLE,2,2.51,,United Kingdom,2025-08-02
495239,35961,FOLKART ZINC HEART CHRISTMAS DEC,4,1.66,,United Kingdom,2025-08-02
495239,22134,LADLE LOVE HEART RED ,1,0.85,,United Kingdom,2025-08-02
495239,21768,WALL MOUNTED VINTAGE ORGANISER,3,29.74,,United Kingdom,2025-08-02
495239,21755,LOVE BUILDING BLOCK WORD,1,11.87,,United Kingdom,2025-08-02
495239,21754,HOME BUILDING BLOCK WORD,1,11.87,,United Kingdom,2025-08-02
495239,21734,SMALL MARAKESH LANTERN ON STICK,2,7.62,,United Kingdom,2025-08-02
495239,35004B,SET OF 3 BLACK FLYING DUCKS,2,5.91,,United Kingdom,2025-08-02
495239,84675,FROG KING WATERING CAN,1,5.91,,United Kingdom,2025-08-02
495239,84836,ZINC METAL HEART DECORATION,1,2.51,,United Kingdom,2025-08-02
495239,84715,SET OF 6 ICE CREAM SKITTLES,1,5.91,,United Kingdom,2025-08-02
495239,21881,CUTE CATS TAPE,1,1.66,,United Kingdom,2025-08-02
495239,21871,SAVE THE PLANET MUG,1,3.36,,United Kingdom,2025-08-02
495239,21849,SILVER DIAMANTE PEN IN GIFT BOX,1,2.51,,United Kingdom,2025-08-02
495239,21847,GREEN  DIAMANTE PEN IN GIFT BOX,1,2.51,,United Kingdom,2025-08-02
495239,21846,PINK DIAMANTE PEN IN GIFT BOX,3,2.51,,United Kingdom,2025-08-02
495239,21827,EIGHT PIECE CREEPY CRAWLIE SET,5,2.51,,United Kingdom,2025-08-02
495239,21826,EIGHT PIECE DINOSAUR SET,5,2.51,,United Kingdom,2025-08-02
495239,21820,GLITTER HEART GARLAND WITH BELLS ,1,7.62,,United Kingdom,2025-08-02
495239,84692,BOX OF 24 COCKTAIL PARASOLS,1,0.81,,United Kingdom,2025-08-02
495239,21809,CHRISTMAS HANGING TREE WITH BELL,1,2.51,,United Kingdom,2025-08-02
495239,84952C,MIRROR LOVE BIRD T-LIGHT HOLDER,2,2.51,,United Kingdom,2025-08-02
495239,84951B,S/4 BLACK LOVEBIRD COASTERS,1,1.66,,United Kingdom,2025-08-02
495239,84951A,S/4 PISTACHIO LOVEBIRD COASTERS,1,1.66,,United Kingdom,2025-08-02
495239,84946,ANTIQUE SILVER TEA GLASS ETCHED,2,2.51,,United Kingdom,2025-08-02
495239,84849B,FAIRY SOAP SOAP HOLDER,1,3.36,,United Kingdom,2025-08-02
495239,21726,MULTI HEARTS  STICKERS,2,1.66,,United Kingdom,2025-08-02
495239,84832,ZINC WILLIE WINKIE  CANDLE STICK,2,1.66,,United Kingdom,2025-08-02
495239,84813,SET OF 4 DIAMOND NAPKIN RINGS,2,11.02,,United Kingdom,2025-08-02
495239,21791,VINTAGE HEADS AND TAILS CARD GAME ,1,2.51,,United Kingdom,2025-08-02
495239,21706,"FOLDING UMBRELLA , RED/WHITE SPOT",1,10.17,,United Kingdom,2025-08-02
495239,21675,BUTTERFLIES STICKERS,7,0.81,,United Kingdom,2025-08-02
495239,21678,PAISLEY PATTERN  STICKERS,2,0.81,,United Kingdom,2025-08-02
495239,37448,CERAMIC CAKE DESIGN SPOTTED MUG,2,3.36,,United Kingdom,2025-08-02
495239,37422,WHITE WITH BLACK CATS BOWL,1,1.66,,United Kingdom,2025-08-02
495239,21622,VINTAGE UNION JACK CUSHION COVER,1,13.57,,United Kingdom,2025-08-02
495239,21581,SKULLS  DESIGN  COTTON TOTE BAG,2,2.51,,United Kingdom,2025-08-02
495239,21580,RABBIT  DESIGN  COTTON TOTE BAG,6,2.51,,United Kingdom,2025-08-02
495239,21578,WOODLAND DESIGN  COTTON TOTE BAG,6,2.51,,United Kingdom,2025-08-02
495239,21577,SAVE THE PLANET COTTON TOTE BAG,4,2.51,,United Kingdom,2025-08-02
495239,21576,LETS GO SHOPPING COTTON TOTE BAG,5,2.51,,United Kingdom,2025-08-02
495239,21559,STRAWBERRY LUNCHBOX WITH CUTLERY,1,5.06,,United Kingdom,2025-08-02
495239,21548,CERAMIC BIRDHOUSE FINCH BLUE ROOF,1,5.91,,United Kingdom,2025-08-02
495239,21544,SKULLS  WATER TRANSFER TATTOOS ,10,1.66,,United Kingdom,2025-08-02
495239,21535,RETRO SPOT SMALL MILK JUG,1,5.06,,United Kingdom,2025-08-02
495239,46775D,SUNSET COLOUR CHUNKY KNITTED THROW,3,11.02,,United Kingdom,2025-08-02
495239,46776F,WOVEN ROSE GARDEN CUSHION COVER ,2,4.21,,United Kingdom,2025-08-02
495239,46776E,WOVEN CANDY CUSHION COVER ,2,4.21,,United Kingdom,2025-08-02
495239,70006,LOVE HEART POCKET WARMER,5,1.66,,United Kingdom,2025-08-02
495239,82567,"AIRLINE LOUNGE,METAL SIGN",2,1.66,,United Kingdom,2025-08-02
495239,21637,ASSORTED SANSKRIT MINI NOTEBOOK,1,2.51,,United Kingdom,2025-08-02
495239,90059A,DIAMANTE HAIR GRIP PACK/2 CRYSTAL,2,1.69,,United Kingdom,2025-08-02
495239,90059C,DIAMANTE HAIR GRIP PACK/2 MONTANA,1,1.69,,United Kingdom,2025-08-02
495239,90071,RUBY GLASS CLUSTER EARRINGS,1,1.26,,United Kingdom,2025-08-02
495239,21677,HEARTS  STICKERS,2,0.81,,United Kingdom,2025-08-02
495239,21676,FLOWERS  STICKERS,4,0.81,,United Kingdom,2025-08-02
495239,84968A,S/16 VINTAGE ROSE CUTLERY,6,11.02,,United Kingdom,2025-08-02
495239,21669,BLUE STRIPE CERAMIC DRAWER KNOB,4,2.51,,United Kingdom,2025-08-02
495239,90187B,GREEN DROP EARRINGS W BEAD CLUSTER,1,3.39,,United Kingdom,2025-08-02
495239,90181B,AMETHYST GLASS/SHELL/PEARL NECKLACE,1,9.34,,United Kingdom,2025-08-02
495239,81952V,ROUND PURPLE CLOCK W/SUCKER,1,1.66,,United Kingdom,2025-08-02
495239,90171,DAISY RING,2,1.26,,United Kingdom,2025-08-02
495239,21680,WOODLAND  STICKERS,2,0.81,,United Kingdom,2025-08-02
495239,90129B,TURQUOISE GLASS TASSLE BAG CHARM ,1,1.66,,United Kingdom,2025-08-02
495239,90124B,BLUE MURANO TWIST NECKLACE,1,10.17,,United Kingdom,2025-08-02
495239,90122C,TURQUOISE CRYSTAL+GLASS BRACELET,1,5.09,,United Kingdom,2025-08-02
495239,90122B,JADE CRYSTAL+GLASS BRACELET,1,5.09,,United Kingdom,2025-08-02
495239,90122A,PINK CRYSTAL+GLASS BRACELET,1,5.09,,United Kingdom,2025-08-02
495239,90120A,PINK MURANO TWIST BRACELET,1,4.24,,United Kingdom,2025-08-02
495239,90098,NECKLACE+BRACELET PINK BUTTERFLY,7,1.66,,United Kingdom,2025-08-02
495239,90096,NECKLACE+BRACELET SET BLUE BLOSSOM,7,1.66,,United Kingdom,2025-08-02
495239,90082C,DIAMANTE BOW BROOCH WHITE COLOUR,1,6.79,,United Kingdom,2025-08-02
495239,90129A,PINK GLASS TASSLE BAG CHARM ,1,1.66,,United Kingdom,2025-08-02
495239,84968B,S/16 VINTAGE IVORY CUTLERY,5,11.02,,United Kingdom,2025-08-02
495239,35647,VINTAGE BEAD PINK SHADE ,1,2.51,,United Kingdom,2025-08-02
495239,84968D,S/16 VINTAGE RED CUTLERY,2,11.02,,United Kingdom,2025-08-02
495239,22325,MOBILE VINTAGE HEARTS ,11,3.36,,United Kingdom,2025-08-02
495239,20700,GREEN CAT FLORAL CUSHION COVER ,2,4.21,,United Kingdom,2025-08-02
495239,20695,FLORAL BLUE MONSTER,2,3.36,,United Kingdom,2025-08-02
495239,20694,FLORAL PINK MONSTER,3,2.51,,United Kingdom,2025-08-02
495239,20689,RETRO SISTERS EXPRESSO CUPS,2,5.06,,United Kingdom,2025-08-02
495239,20684,STRAWBERRY DREAM CHILDS UMBRELLA,1,6.77,,United Kingdom,2025-08-02
495239,20677,PINK SPOTTY BOWL,2,2.51,,United Kingdom,2025-08-02
495239,20676,RED SPOTTY BOWL,2,2.51,,United Kingdom,2025-08-02
