Invoice,StockCode,Description,Quantity,Price,Customer ID,Country,InvoiceDate
511779,85099F,JUMBO BAG STRAWBERRY,5,1.95,17068.0,United Kingdom,2025-11-24
511779,20711,JUMBO BAG TOYS ,5,1.95,17068.0,United Kingdom,2025-11-24
511779,21931,JUMBO STORAGE BAG SUKI,5,1.95,17068.0,United Kingdom,2025-11-24
511779,84991,60 TEATIME FAIRY CAKE CASES,1,0.55,17068.0,United Kingdom,2025-11-24
511779,22386,JUMBO BAG PINK WITH WHITE SPOTS,10,1.95,17068.0,United Kingdom,2025-11-24
511780,21238,RED SPOTTY CUP,8,0.85,12662.0,Germany,2025-11-24
511780,22326,ROUND SNACK BOXES SET OF4 WOODLAND ,6,2.95,12662.0,Germany,2025-11-24
511780,21432,SET OF 3 CASES WOODLAND DESIGN,4,5.95,12662.0,Germany,2025-11-24
511780,POST,POSTAGE,2,1.0,12662.0,Germany,2025-11-24
511780,22331,WOODLAND PARTY BAG + STICKER SET,8,1.65,12662.0,Germany,2025-11-24
511780,22549,PICTURE DOMINOES,12,1.45,12662.0,Germany,2025-11-24
511780,47421,ASSORTED COLOUR LIZARD SUCTION HOOK,24,0.42,12662.0,Germany,2025-11-24
511780,22242,"HOOK, 5 HANGER , MAGIC TOADSTOOL",12,1.65,12662.0,Germany,2025-11-24
511780,20977,36 PENCILS TUBE WOODLAND,16,1.25,12662.0,Germany,2025-11-24
511780,84546,CROCHET POODLE KEYRING,6,1.65,12662.0,Germany,2025-11-24
511780,22328,ROUND SNACK BOXES SET OF 4 FRUITS ,12,2.95,12662.0,Germany,2025-11-24
511780,20712,JUMBO BAG WOODLAND ANIMALS,10,1.95,12662.0,Germany,2025-11-24
511780,22556,PLASTERS IN TIN CIRCUS PARADE ,12,1.65,12662.0,Germany,2025-11-24
511780,22636,CHILDS BREAKFAST SET CIRCUS PARADE,2,8.5,12662.0,Germany,2025-11-24
511780,22621,TRADITIONAL KNITTING NANCY,12,1.45,12662.0,Germany,2025-11-24
511781,21495,SKULLS AND CROSSBONES WRAP,100,0.42,12891.0,United Kingdom,2025-11-24
511782,47599A,PINK PARTY BAGS,12,2.1,16862.0,United Kingdom,2025-11-24
511782,47599B,BLUE PARTY BAGS ,12,2.1,16862.0,United Kingdom,2025-11-24
511782,21080,SET/20 RED SPOTTY PAPER NAPKINS ,12,0.85,16862.0,United Kingdom,2025-11-24
511782,21086,SET/6 RED SPOTTY PAPER CUPS,12,0.65,16862.0,United Kingdom,2025-11-24
511782,21094,SET/6 RED SPOTTY PAPER PLATES,12,0.85,16862.0,United Kingdom,2025-11-24
511783,21431,GREEN GINGHAM FLOWER JEWELLERY BOX,4,1.65,16713.0,United Kingdom,2025-11-24
511783,21731,RED TOADSTOOL LED NIGHT LIGHT,3,1.65,16713.0,United Kingdom,2025-11-24
511783,21452,TOADSTOOL MONEY BOX,2,2.95,16713.0,United Kingdom,2025-11-24
511783,84828,JUNGLE POPSICLES ICE LOLLY HOLDERS,2,1.25,16713.0,United Kingdom,2025-11-24
511783,22382,LUNCH BAG SPACEBOY DESIGN ,3,1.65,16713.0,United Kingdom,2025-11-24
511783,22334,DINOSAUR PARTY BAG + STICKER SET,3,1.65,16713.0,United Kingdom,2025-11-24
511783,84997B,RED 3 PIECE MINI DOTS CUTLERY SET,2,3.75,16713.0,United Kingdom,2025-11-24
511783,22426,ENAMEL WASH BOWL CREAM,1,3.75,16713.0,United Kingdom,2025-11-24
511783,62018,SOMBRERO ,1,1.95,16713.0,United Kingdom,2025-11-24
511783,22524,CHILDRENS GARDEN GLOVES BLUE,3,1.25,16713.0,United Kingdom,2025-11-24
511783,22525,CHILDRENS GARDEN GLOVES PINK,3,1.25,16713.0,United Kingdom,2025-11-24
511783,84997C,BLUE 3 PIECE MINI DOTS CUTLERY SET,2,3.75,16713.0,United Kingdom,2025-11-24
511783,84997D,PINK 3 PIECE MINI DOTS CUTLERY SET,2,3.75,16713.0,United Kingdom,2025-11-24
511783,22333,RETRO SPORT PARTY BAG + STICKER SET,3,1.65,16713.0,United Kingdom,2025-11-24
511783,22439,6 ROCKET BALLOONS ,6,0.65,16713.0,United Kingdom,2025-11-24
511783,22514,CHILDS GARDEN SPADE BLUE,3,2.1,16713.0,United Kingdom,2025-11-24
511783,22523,CHILDS GARDEN FORK PINK,3,0.85,16713.0,United Kingdom,2025-11-24
511783,22521,CHILDS GARDEN TROWEL PINK,3,0.85,16713.0,United Kingdom,2025-11-24
511783,22522,CHILDS GARDEN FORK BLUE ,3,0.85,16713.0,United Kingdom,2025-11-24
511783,22520,CHILDS GARDEN TROWEL BLUE ,3,0.85,16713.0,United Kingdom,2025-11-24
511783,22634,CHILDS BREAKFAST SET SPACEBOY ,1,9.95,16713.0,United Kingdom,2025-11-24
511783,22635,CHILDS BREAKFAST SET DOLLY GIRL ,1,9.95,16713.0,United Kingdom,2025-11-24
511783,22515,CHILDS GARDEN SPADE PINK,3,2.1,16713.0,United Kingdom,2025-11-24
511783,22517,CHILDS GARDEN RAKE PINK,3,2.1,16713.0,United Kingdom,2025-11-24
511783,22518,CHILDS GARDEN BRUSH BLUE,4,2.1,16713.0,United Kingdom,2025-11-24
511783,22516,CHILDS GARDEN RAKE BLUE,3,2.1,16713.0,United Kingdom,2025-11-24
511783,22519,CHILDS GARDEN BRUSH PINK,4,2.1,16713.0,United Kingdom,2025-11-24
511783,22423,REGENCY CAKESTAND 3 TIER,1,12.75,16713.0,United Kingdom,2025-11-24
511783,21429,RED GINGHAM ROSE JEWELLERY BOX,4,1.65,16713.0,United Kingdom,2025-11-24
511783,84997A,GREEN 3 PIECE MINI DOTS CUTLERY SET,1,3.75,16713.0,United Kingdom,2025-11-24
511783,22478,BIRDHOUSE GARDEN MARKER ,4,1.25,16713.0,United Kingdom,2025-11-24
511783,79321,CHILLI LIGHTS,1,4.95,16713.0,United Kingdom,2025-11-24
511783,22636,CHILDS BREAKFAST SET CIRCUS PARADE,1,8.5,16713.0,United Kingdom,2025-11-24
511783,22482,BLUE TEA TOWEL CLASSIC DESIGN,3,1.25,16713.0,United Kingdom,2025-11-24
511783,21955,DOOR MAT UNION JACK GUNS AND ROSES,1,7.49,16713.0,United Kingdom,2025-11-24
511783,21524,DOOR MAT SPOTTY HOME SWEET HOME,1,7.49,16713.0,United Kingdom,2025-11-24
511783,48184,DOOR MAT ENGLISH ROSE ,1,7.49,16713.0,United Kingdom,2025-11-24
511783,20685,DOOR MAT RED SPOT,1,7.49,16713.0,United Kingdom,2025-11-24
511783,48187,DOOR MAT NEW ENGLAND,1,7.49,16713.0,United Kingdom,2025-11-24
511783,48185,DOOR MAT FAIRY CAKE,1,7.49,16713.0,United Kingdom,2025-11-24
511783,48138,DOOR MAT UNION FLAG,1,7.49,16713.0,United Kingdom,2025-11-24
511783,21523,DOOR MAT FANCY FONT HOME SWEET HOME,1,7.49,16713.0,United Kingdom,2025-11-24
511783,84406B,CREAM CUPID HEARTS COAT HANGER,2,3.25,16713.0,United Kingdom,2025-11-24
511783,82483,WOOD 2 DRAWER CABINET WHITE FINISH,2,5.95,16713.0,United Kingdom,2025-11-24
511783,82494L,WOODEN FRAME ANTIQUE WHITE ,2,2.95,16713.0,United Kingdom,2025-11-24
511783,82484,WOOD BLACK BOARD ANT WHITE FINISH,2,6.45,16713.0,United Kingdom,2025-11-24
511783,82486,WOOD S/3 CABINET ANT WHITE FINISH,1,7.95,16713.0,United Kingdom,2025-11-24
511783,22171,3 HOOK PHOTO SHELF ANTIQUE WHITE,2,8.5,16713.0,United Kingdom,2025-11-24
511783,22169,FAMILY ALBUM WHITE PICTURE FRAME,1,8.5,16713.0,United Kingdom,2025-11-24
511783,82482,WOODEN PICTURE FRAME WHITE FINISH,2,2.55,16713.0,United Kingdom,2025-11-24
511783,17003,BROCADE RING PURSE ,36,0.21,16713.0,United Kingdom,2025-11-24
511783,21124,SET/10 BLUE SPOTTY PARTY CANDLES,2,1.25,16713.0,United Kingdom,2025-11-24
511783,21121,SET/10 RED SPOTTY PARTY CANDLES,3,1.25,16713.0,United Kingdom,2025-11-24
511783,22170,PICTURE FRAME WOOD TRIPLE PORTRAIT,1,6.75,16713.0,United Kingdom,2025-11-24
511783,16207A,PINK STRAWBERRY HANDBAG ,3,2.95,16713.0,United Kingdom,2025-11-24
511783,21791,VINTAGE HEADS AND TAILS CARD GAME ,2,1.25,16713.0,United Kingdom,2025-11-24
511783,21556,CERAMIC STRAWBERRY MONEY BOX,2,2.55,16713.0,United Kingdom,2025-11-24
511783,21790,VINTAGE SNAP CARDS,2,0.85,16713.0,United Kingdom,2025-11-24
511783,21123,SET/10 IVORY SPOTTY PARTY CANDLES,2,1.25,16713.0,United Kingdom,2025-11-24
511783,22331,WOODLAND PARTY BAG + STICKER SET,3,1.65,16713.0,United Kingdom,2025-11-24
511783,21889,WOODEN BOX OF DOMINOES,2,1.25,16713.0,United Kingdom,2025-11-24
511783,21272,SALLE DE BAIN HOOK,1,1.25,16713.0,United Kingdom,2025-11-24
511783,22498,WOODEN REGATTA BUNTING,1,5.95,16713.0,United Kingdom,2025-11-24
511783,22505,MEMO BOARD COTTAGE DESIGN,2,4.95,16713.0,United Kingdom,2025-11-24
511783,22332,SKULLS PARTY BAG + STICKER SET,3,1.65,16713.0,United Kingdom,2025-11-24
511785,21523,DOOR MAT FANCY FONT HOME SWEET HOME,4,7.49,15601.0,United Kingdom,2025-11-24
511785,84675,FROG KING WATERING CAN,12,2.95,15601.0,United Kingdom,2025-11-24
511785,84674,FLYING PIG WATERING CAN,6,2.95,15601.0,United Kingdom,2025-11-24
511785,22431,WATERING CAN BLUE ELEPHANT,12,1.95,15601.0,United Kingdom,2025-11-24
511785,84676,BATH DUCK WATERING CAN,6,2.95,15601.0,United Kingdom,2025-11-24
511785,22433,WATERING CAN GREEN DINOSAUR,6,1.95,15601.0,United Kingdom,2025-11-24
511785,22432,WATERING CAN PINK BUNNY,6,1.95,15601.0,United Kingdom,2025-11-24
511785,85123A,WHITE HANGING HEART T-LIGHT HOLDER,32,2.55,15601.0,United Kingdom,2025-11-24
511785,48138,DOOR MAT UNION FLAG,4,7.49,15601.0,United Kingdom,2025-11-24
511785,48184,DOOR MAT ENGLISH ROSE ,4,7.49,15601.0,United Kingdom,2025-11-24
511785,21669,BLUE STRIPE CERAMIC DRAWER KNOB,12,1.25,15601.0,United Kingdom,2025-11-24
511785,21668,RED STRIPE CERAMIC DRAWER KNOB,24,1.25,15601.0,United Kingdom,2025-11-24
511785,21671,RED SPOT CERAMIC DRAWER KNOB,24,1.25,15601.0,United Kingdom,2025-11-24
511785,21670,BLUE SPOT CERAMIC DRAWER KNOB,12,1.25,15601.0,United Kingdom,2025-11-24
511785,84836,ZINC METAL HEART DECORATION,12,1.25,15601.0,United Kingdom,2025-11-24
511785,22219,LOVEBIRD HANGING DECORATION WHITE ,12,0.85,15601.0,United Kingdom,2025-11-24
511785,22029,SPACEBOY BIRTHDAY CARD,12,0.42,15601.0,United Kingdom,2025-11-24
511785,22037,ROBOT BIRTHDAY CARD,12,0.42,15601.0,United Kingdom,2025-11-24
C511784,21746,SMALL RED RETROSPOT WINDMILL,-1,1.25,17597.0,United Kingdom,2025-11-24
511785,48197,DOOR MAT BIRD ON THE WIRE,4,7.49,15601.0,United Kingdom,2025-11-24
511787,20770,ABSTRACT CIRCLE JOURNAL ,6,2.55,15757.0,United Kingdom,2025-11-24
511787,22037,ROBOT BIRTHDAY CARD,12,0.42,15757.0,United Kingdom,2025-11-24
511787,21506,"FANCY FONT BIRTHDAY CARD, ",12,0.42,15757.0,United Kingdom,2025-11-24
511787,22030,SWALLOWS GREETING CARD,12,0.42,15757.0,United Kingdom,2025-11-24
511787,21755,LOVE BUILDING BLOCK WORD,3,5.95,15757.0,United Kingdom,2025-11-24
511787,85232B,SET/3 RUSSIAN DOLL STACKING TINS,3,4.95,15757.0,United Kingdom,2025-11-24
511787,85065,CREAM SWEETHEART TRAYS,1,12.75,15757.0,United Kingdom,2025-11-24
511787,21892,TRADITIONAL WOODEN CATCH CUP GAME ,12,1.25,15757.0,United Kingdom,2025-11-24
511787,22430,ENAMEL WATERING CAN CREAM,4,4.95,15757.0,United Kingdom,2025-11-24
511787,22372,AIRLINE BAG VINTAGE WORLD CHAMPION ,2,6.35,15757.0,United Kingdom,2025-11-24
511787,21891,TRADITIONAL WOODEN SKIPPING ROPE,12,1.25,15757.0,United Kingdom,2025-11-24
511787,21577,SAVE THE PLANET COTTON TOTE BAG,6,2.25,15757.0,United Kingdom,2025-11-24
511787,22620,4 TRADITIONAL SPINNING TOPS,12,1.25,15757.0,United Kingdom,2025-11-24
511787,22636,CHILDS BREAKFAST SET CIRCUS PARADE,2,8.5,15757.0,United Kingdom,2025-11-24
511787,22138,BAKING SET 9 PIECE RETROSPOT ,3,4.95,15757.0,United Kingdom,2025-11-24
511787,21754,HOME BUILDING BLOCK WORD,3,5.95,15757.0,United Kingdom,2025-11-24
511787,21781,MA CAMPAGNE CUTLERY BOX,1,14.95,15757.0,United Kingdom,2025-11-24
511787,84836,ZINC METAL HEART DECORATION,12,1.25,15757.0,United Kingdom,2025-11-24
511787,21323,HANGING MEDINA LANTERN LARGE,3,4.25,15757.0,United Kingdom,2025-11-24
511787,22499,WOODEN UNION JACK BUNTING,3,5.95,15757.0,United Kingdom,2025-11-24
511787,21839,MUMMY MOUSE RED GINGHAM RIBBON,3,5.45,15757.0,United Kingdom,2025-11-24
511787,84968B,S/16 VINTAGE IVORY CUTLERY,1,12.75,15757.0,United Kingdom,2025-11-24
511787,21381,MINI WOODEN HAPPY BIRTHDAY GARLAND,12,1.69,15757.0,United Kingdom,2025-11-24
511787,21890,S/6 WOODEN SKITTLES IN COTTON BAG,6,2.95,15757.0,United Kingdom,2025-11-24
511787,21841,BABY MOUSE RED GINGHAM DRESS,3,4.25,15757.0,United Kingdom,2025-11-24
511787,22487,WHITE WOOD GARDEN PLANT LADDER,1,9.95,15757.0,United Kingdom,2025-11-24
511787,22624,IVORY KITCHEN SCALES,2,8.5,15757.0,United Kingdom,2025-11-24
511787,21114,LAVENDER SCENTED FABRIC HEART,10,1.25,15757.0,United Kingdom,2025-11-24
511786,21781,MA CAMPAGNE CUTLERY BOX,1,14.95,17869.0,United Kingdom,2025-11-24
511786,21153,RED SPOTTY TABLECLOTH ,2,10.65,17869.0,United Kingdom,2025-11-24
511786,21155,RED SPOTTY PEG BAG,1,2.1,17869.0,United Kingdom,2025-11-24
511786,22023,EMPIRE BIRTHDAY CARD,12,0.42,17869.0,United Kingdom,2025-11-24
511786,22122,SET OF 2 FANCY FONT TEA TOWELS,1,2.95,17869.0,United Kingdom,2025-11-24
511786,84467,ENGLISH ROSE DESIGN QUILTED THROW,1,39.95,17869.0,United Kingdom,2025-11-24
511786,22122,SET OF 2 FANCY FONT TEA TOWELS,2,2.95,17869.0,United Kingdom,2025-11-24
511786,21925,UNION STRIPE CUSHION COVER ,18,1.25,17869.0,United Kingdom,2025-11-24
511786,21470,FLOWER VINE RAFFIA FOOD COVER,1,3.75,17869.0,United Kingdom,2025-11-24
511786,21466,RED FLOWER CROCHET FOOD COVER,1,3.75,17869.0,United Kingdom,2025-11-24
511786,22429,ENAMEL MEASURING JUG CREAM,1,4.25,17869.0,United Kingdom,2025-11-24
511786,21471,STRAWBERRY RAFFIA FOOD COVER,1,3.75,17869.0,United Kingdom,2025-11-24
511787,85123A,WHITE HANGING HEART T-LIGHT HOLDER,6,2.95,15757.0,United Kingdom,2025-11-24
511787,22470,HEART OF WICKER LARGE,6,2.95,15757.0,United Kingdom,2025-11-24
511786,21465,PINK FLOWER CROCHET FOOD COVER,1,3.75,17869.0,United Kingdom,2025-11-24
511787,84879,ASSORTED COLOUR BIRD ORNAMENT,8,1.69,15757.0,United Kingdom,2025-11-24
511787,22169,FAMILY ALBUM WHITE PICTURE FRAME,2,8.5,15757.0,United Kingdom,2025-11-24
511787,21765,HANGING METAL BIRD BATH,2,7.95,15757.0,United Kingdom,2025-11-24
511787,82494L,WOODEN FRAME ANTIQUE WHITE ,6,2.95,15757.0,United Kingdom,2025-11-24
511787,22427,ENAMEL FLOWER JUG CREAM,3,5.95,15757.0,United Kingdom,2025-11-24
511786,22625,RED KITCHEN SCALES,1,8.5,17869.0,United Kingdom,2025-11-24
511786,85065,CREAM SWEETHEART TRAYS,1,12.75,17869.0,United Kingdom,2025-11-24
511787,82482,WOODEN PICTURE FRAME WHITE FINISH,6,2.55,15757.0,United Kingdom,2025-11-24
C511788,22064,PINK DOUGHNUT TRINKET POT ,-2,1.65,18168.0,United Kingdom,2025-11-24
C511788,21232,STRAWBERRY CERAMIC TRINKET BOX,-1,1.25,18168.0,United Kingdom,2025-11-24
C511788,22055,MINI CAKE STAND  HANGING STRAWBERY,-1,1.65,18168.0,United Kingdom,2025-11-24
C511788,21527,RED RETROSPOT TRADITIONAL TEAPOT ,-2,7.95,18168.0,United Kingdom,2025-11-24
511789,84795B,SUNSET CHECK HAMMOCK,1,7.95,14606.0,United Kingdom,2025-11-24
511789,85232D,SET/3 DECOUPAGE STACKING TINS,2,4.95,14606.0,United Kingdom,2025-11-24
511789,22218,CAKE STAND LACE WHITE,1,4.25,14606.0,United Kingdom,2025-11-24
511789,21246,RED SPOTTY BIG BOWL,1,4.95,14606.0,United Kingdom,2025-11-24
511789,21206,STRAWBERRY HONEYCOMB  GARLAND ,2,1.65,14606.0,United Kingdom,2025-11-24
511789,84880,WHITE WIRE EGG HOLDER,1,5.95,14606.0,United Kingdom,2025-11-24
511789,71053,WHITE METAL LANTERN,1,3.75,14606.0,United Kingdom,2025-11-24
511789,21666,RIDGED GLASS T-LIGHT HOLDER,6,0.65,14606.0,United Kingdom,2025-11-24
511789,22537,MAGIC DRAWING SLATE DINOSAUR,1,0.42,14606.0,United Kingdom,2025-11-24
511789,20702,PINK PADDED MOBILE,36,3.75,14606.0,United Kingdom,2025-11-24
511789,21673,WHITE SPOT BLUE CERAMIC DRAWER KNOB,96,1.06,14606.0,United Kingdom,2025-11-24
511789,21175,GIN + TONIC DIET METAL SIGN,1,2.1,14606.0,United Kingdom,2025-11-24
511789,21562,HAWAIIAN GRASS SKIRT ,1,2.1,14606.0,United Kingdom,2025-11-24
511789,21527,RED RETROSPOT TRADITIONAL TEAPOT ,1,7.95,14606.0,United Kingdom,2025-11-24
511789,22535,MAGIC DRAWING SLATE BUNNIES ,1,0.42,14606.0,United Kingdom,2025-11-24
511789,22529,MAGIC DRAWING SLATE GO TO THE FAIR ,1,0.42,14606.0,United Kingdom,2025-11-24
511789,21666,RIDGED GLASS T-LIGHT HOLDER,6,0.65,14606.0,United Kingdom,2025-11-24
511789,22536,MAGIC DRAWING SLATE PURDEY,1,0.42,14606.0,United Kingdom,2025-11-24
511789,85130A,BEADED PEARL HEART WHITE LARGE,24,1.65,14606.0,United Kingdom,2025-11-24
511789,22530,MAGIC DRAWING SLATE DOLLY GIRL ,2,0.42,14606.0,United Kingdom,2025-11-24
511789,20771,CHRYSANTHEMUM  JOURNAL,1,2.55,14606.0,United Kingdom,2025-11-24
511789,20767,BLUE PAISLEY JOURNAL ,3,2.55,14606.0,United Kingdom,2025-11-24
511789,21656,RIDGED GLASS POSY VASE ,5,1.45,14606.0,United Kingdom,2025-11-24
511789,85130A,BEADED PEARL HEART WHITE LARGE,24,1.65,14606.0,United Kingdom,2025-11-24
511789,37448,CERAMIC CAKE DESIGN SPOTTED MUG,1,1.49,14606.0,United Kingdom,2025-11-24
511789,22531,MAGIC DRAWING SLATE CIRCUS PARADE  ,2,0.42,14606.0,United Kingdom,2025-11-24
511789,22477,WATERING CAN GARDEN MARKER,5,1.25,14606.0,United Kingdom,2025-11-24
511789,20668,DISCO BALL CHRISTMAS DECORATION,24,0.12,14606.0,United Kingdom,2025-11-24
511789,21678,PAISLEY PATTERN  STICKERS,6,0.85,14606.0,United Kingdom,2025-11-24
511789,21726,MULTI HEARTS  STICKERS,5,0.85,14606.0,United Kingdom,2025-11-24
511789,84978,HANGING HEART JAR T-LIGHT HOLDER,5,1.25,14606.0,United Kingdom,2025-11-24
511789,21127,COLOURFUL FISHING GNOME,1,5.95,14606.0,United Kingdom,2025-11-24
511789,20717,STRAWBERRY SHOPPER BAG,1,1.25,14606.0,United Kingdom,2025-11-24
511789,22514,CHILDS GARDEN SPADE BLUE,1,2.1,14606.0,United Kingdom,2025-11-24
511789,22534,MAGIC DRAWING SLATE SPACEBOY ,2,0.42,14606.0,United Kingdom,2025-11-24
511789,21721,CANDY SHOP  STICKER SHEET,1,0.85,14606.0,United Kingdom,2025-11-24
511790,21700,BIG DOUGHNUT FRIDGE MAGNETS,6,0.85,18168.0,United Kingdom,2025-11-24
511790,22072,RED RETROSPOT TEA CUP AND SAUCER ,4,3.75,18168.0,United Kingdom,2025-11-24
511790,21527,RED RETROSPOT TRADITIONAL TEAPOT ,3,7.95,18168.0,United Kingdom,2025-11-24
511790,72756,FAIRY CAKE CANDLES,18,1.49,18168.0,United Kingdom,2025-11-24
511790,21529,RED RETROSPOT TOASTRACK,4,3.45,18168.0,United Kingdom,2025-11-24
511790,21218,RED SPOTTY BISCUIT TIN,2,3.75,18168.0,United Kingdom,2025-11-24
511790,22072,RED RETROSPOT TEA CUP AND SAUCER ,2,3.75,18168.0,United Kingdom,2025-11-24
511790,21745,GAOLERS KEYS DECORATIVE GARDEN ,1,3.75,18168.0,United Kingdom,2025-11-24
511790,22064,PINK DOUGHNUT TRINKET POT ,4,1.65,18168.0,United Kingdom,2025-11-24
511790,22180,RETRO SPOT LAMP,1,9.95,18168.0,United Kingdom,2025-11-24
511790,21844,RED RETROSPOT MUG,2,2.95,18168.0,United Kingdom,2025-11-24
511790,22646,CERAMIC STRAWBERRY CAKE MONEY BANK,8,1.45,18168.0,United Kingdom,2025-11-24
511790,21535,RED RETROSPOT SMALL MILK JUG,4,2.55,18168.0,United Kingdom,2025-11-24
511790,21231,SWEETHEART CERAMIC TRINKET BOX,12,1.25,18168.0,United Kingdom,2025-11-24
511790,22650,CERAMIC PIRATE CHEST MONEY BANK,4,1.45,18168.0,United Kingdom,2025-11-24
511790,22637,PIGGY BANK RETROSPOT ,8,2.55,18168.0,United Kingdom,2025-11-24
511790,22644,CERAMIC CHERRY CAKE MONEY BANK,12,1.45,18168.0,United Kingdom,2025-11-24
511790,22649,STRAWBERRY FAIRY CAKE TEAPOT,1,4.95,18168.0,United Kingdom,2025-11-24
511790,22055,MINI CAKE STAND  HANGING STRAWBERY,6,1.65,18168.0,United Kingdom,2025-11-24
511790,37446,MINI CAKE STAND WITH HANGING CAKES,6,1.45,18168.0,United Kingdom,2025-11-24
511790,21539,RED RETROSPOT BUTTER DISH,2,4.95,18168.0,United Kingdom,2025-11-24
511790,21531,RED RETROSPOT SUGAR JAM BOWL,4,2.55,18168.0,United Kingdom,2025-11-24
511790,22645,CERAMIC HEART FAIRY CAKE MONEY BANK,8,1.45,18168.0,United Kingdom,2025-11-24
511791,84970L,SINGLE HEART ZINC T-LIGHT HOLDER,48,0.95,14025.0,United Kingdom,2025-11-24
511791,47566,PARTY BUNTING,20,4.65,14025.0,United Kingdom,2025-11-24
511791,48138,DOOR MAT UNION FLAG,10,6.35,14025.0,United Kingdom,2025-11-24
511791,21621,VINTAGE UNION JACK BUNTING,20,8.5,14025.0,United Kingdom,2025-11-24
511791,85123A,WHITE HANGING HEART T-LIGHT HOLDER,32,2.55,14025.0,United Kingdom,2025-11-24
511791,84970S,HANGING HEART ZINC T-LIGHT HOLDER,48,0.85,14025.0,United Kingdom,2025-11-24
511791,71459,HANGING JAM JAR T-LIGHT HOLDER,24,0.85,14025.0,United Kingdom,2025-11-24
511791,21876,POTTERING MUG,48,1.25,14025.0,United Kingdom,2025-11-24
511791,22477,WATERING CAN GARDEN MARKER,30,1.25,14025.0,United Kingdom,2025-11-24
511791,22478,BIRDHOUSE GARDEN MARKER ,30,1.25,14025.0,United Kingdom,2025-11-24
511791,22528,GARDENERS KNEELING PAD,96,1.06,14025.0,United Kingdom,2025-11-24
511791,21868,POTTING SHED TEA MUG,48,1.25,14025.0,United Kingdom,2025-11-24
511791,22294,HEART FILIGREE DOVE  SMALL,24,1.25,14025.0,United Kingdom,2025-11-24
511791,22502,PICNIC BASKET WICKER SMALL,16,3.75,14025.0,United Kingdom,2025-11-24
511791,22488,NATURAL SLATE RECTANGLE CHALKBOARD,48,1.45,14025.0,United Kingdom,2025-11-24
511792,22606,WOODEN SKITTLES GARDEN SET,1,15.95,,United Kingdom,2025-11-24
C511793,M,Manual,-1,241.38,16943.0,United Kingdom,2025-11-24
511794,M,Manual,1,241.38,,United Kingdom,2025-11-24
C511795,85063,CREAM SWEETHEART MAGAZINE RACK,-1,16.95,13659.0,United Kingdom,2025-11-24
511796,22626,BLACK KITCHEN SCALES,4,8.5,15734.0,United Kingdom,2025-11-24
511796,22197,SMALL POPCORN HOLDER,12,0.85,15734.0,United Kingdom,2025-11-24
511796,20676,RED SPOTTY BOWL,8,1.25,15734.0,United Kingdom,2025-11-24
511796,22627,MINT KITCHEN SCALES,2,8.5,15734.0,United Kingdom,2025-11-24
511796,22624,IVORY KITCHEN SCALES,4,8.5,15734.0,United Kingdom,2025-11-24
511796,71403,"PINK/WHITE ""KEEP CLEAN"" BULLET BIN",12,2.95,15734.0,United Kingdom,2025-11-24
511796,21216,"SET 3 RED SPOT TIN TEA,COFFEE,SUGAR",4,4.95,15734.0,United Kingdom,2025-11-24
511796,22200,FRYING PAN PINK POLKADOT ,4,4.25,15734.0,United Kingdom,2025-11-24
511796,22207,FRYING PAN UNION FLAG,4,4.25,15734.0,United Kingdom,2025-11-24
511796,47566,PARTY BUNTING,25,4.65,15734.0,United Kingdom,2025-11-24
511797,48187,DOOR MAT NEW ENGLAND,10,6.35,14918.0,United Kingdom,2025-11-24
511797,48185,DOOR MAT FAIRY CAKE,10,6.35,14918.0,United Kingdom,2025-11-24
511797,48197,DOOR MAT BIRD ON THE WIRE,10,6.35,14918.0,United Kingdom,2025-11-24
511797,48111,DOOR MAT 3 SMILEY CATS,10,6.35,14918.0,United Kingdom,2025-11-24
511797,82583,HOT BATHS METAL SIGN,72,1.69,14918.0,United Kingdom,2025-11-24
511797,82582,AREA PATROLLED METAL SIGN,24,2.1,14918.0,United Kingdom,2025-11-24
511797,82600,NO SINGING METAL SIGN,48,1.69,14918.0,United Kingdom,2025-11-24
511797,85152,HAND OVER THE CHOCOLATE   SIGN ,48,1.69,14918.0,United Kingdom,2025-11-24
511797,82580,BATHROOM METAL SIGN,24,0.55,14918.0,United Kingdom,2025-11-24
511798,85066,CREAM SWEETHEART MINI CHEST,4,12.75,14918.0,United Kingdom,2025-11-24
511799,20975,12 PENCILS SMALL TUBE RED SPOTTY,24,0.65,15615.0,United Kingdom,2025-11-24
511799,20724,RED SPOTTY CHARLOTTE BAG,10,0.85,15615.0,United Kingdom,2025-11-24
511799,21977,PACK OF 60 PINK PAISLEY CAKE CASES,24,0.55,15615.0,United Kingdom,2025-11-24
511799,22417,PACK OF 60 SPACEBOY CAKE CASES,24,0.55,15615.0,United Kingdom,2025-11-24
511799,84991,60 TEATIME FAIRY CAKE CASES,24,0.55,15615.0,United Kingdom,2025-11-24
511799,22356,CHARLOTTE BAG PINK WITH WHITE SPOTS,10,0.85,15615.0,United Kingdom,2025-11-24
511799,21875,KINGS CHOICE MUG,24,1.25,15615.0,United Kingdom,2025-11-24
511799,21623,VINTAGE UNION JACK MEMOBOARD,4,9.95,15615.0,United Kingdom,2025-11-24
511799,22611,VINTAGE UNION JACK SHOPPING BAG,6,4.95,15615.0,United Kingdom,2025-11-24
511799,20979,36 PENCILS TUBE RED SPOTTY,24,1.25,15615.0,United Kingdom,2025-11-24
511799,84987,SET OF 36 TEATIME PAPER DOILIES,12,1.45,15615.0,United Kingdom,2025-11-24
511799,21080,SET/20 RED SPOTTY PAPER NAPKINS ,24,0.85,15615.0,United Kingdom,2025-11-24
511799,22528,GARDENERS KNEELING PAD,12,1.25,15615.0,United Kingdom,2025-11-24
511799,85099F,JUMBO BAG STRAWBERRY,20,1.95,15615.0,United Kingdom,2025-11-24
511799,21621,VINTAGE UNION JACK BUNTING,6,8.5,15615.0,United Kingdom,2025-11-24
511799,47566,PARTY BUNTING,5,4.65,15615.0,United Kingdom,2025-11-24
511799,82578,KITCHEN METAL SIGN,12,0.55,15615.0,United Kingdom,2025-11-24
511799,82551,LAUNDRY 15C METAL SIGN,12,1.25,15615.0,United Kingdom,2025-11-24
511799,22178,VICTORIAN GLASS HANGING T-LIGHT,12,1.25,15615.0,United Kingdom,2025-11-24
511799,82580,BATHROOM METAL SIGN,12,0.55,15615.0,United Kingdom,2025-11-24
511799,21381,MINI WOODEN HAPPY BIRTHDAY GARLAND,24,1.69,15615.0,United Kingdom,2025-11-24
511799,20719,WOODLAND CHARLOTTE BAG,10,0.85,15615.0,United Kingdom,2025-11-24
511799,22355,CHARLOTTE BAG SUKI DESIGN,10,0.85,15615.0,United Kingdom,2025-11-24
511799,20723,STRAWBERRY CHARLOTTE BAG,10,0.85,15615.0,United Kingdom,2025-11-24
511799,84978,HANGING HEART JAR T-LIGHT HOLDER,24,1.25,15615.0,United Kingdom,2025-11-24
C511800,22605,WOODEN CROQUET GARDEN SET,-1,10.95,13408.0,United Kingdom,2025-11-24
511801,72008,FROSTED BOX 9 WHITE T-LIGHT CANDLES,24,0.42,13999.0,United Kingdom,2025-11-24
511801,21932,SCANDINAVIAN PAISLEY PICNIC BAG,5,2.95,13999.0,United Kingdom,2025-11-24
511801,84755,COLOUR GLASS T-LIGHT HOLDER HANGING,16,0.65,13999.0,United Kingdom,2025-11-24
511801,22704,WRAP RED APPLES ,25,0.42,13999.0,United Kingdom,2025-11-24
511801,22498,WOODEN REGATTA BUNTING,3,5.95,13999.0,United Kingdom,2025-11-24
511801,22480,RED TEA TOWEL CLASSIC DESIGN,12,1.25,13999.0,United Kingdom,2025-11-24
511801,21936,RED RETROSPOT PICNIC BAG,5,2.95,13999.0,United Kingdom,2025-11-24
511801,22432,WATERING CAN PINK BUNNY,6,1.95,13999.0,United Kingdom,2025-11-24
511801,22482,BLUE TEA TOWEL CLASSIC DESIGN,12,1.25,13999.0,United Kingdom,2025-11-24
511801,22115,METAL SIGN EMPIRE TEA,6,2.95,13999.0,United Kingdom,2025-11-24
511801,21878,PACK OF 6 SANDCASTLE FLAGS ASSORTED,12,0.85,13999.0,United Kingdom,2025-11-24
511801,21912,VINTAGE SNAKES & LADDERS,4,3.75,13999.0,United Kingdom,2025-11-24
511801,22623,BOX OF VINTAGE JIGSAW BLOCKS ,3,4.95,13999.0,United Kingdom,2025-11-24
511801,21621,VINTAGE UNION JACK BUNTING,8,8.5,13999.0,United Kingdom,2025-11-24
511801,47566,PARTY BUNTING,5,4.65,13999.0,United Kingdom,2025-11-24
511801,22088,PAPER BUNTING COLOURED LACE,12,2.95,13999.0,United Kingdom,2025-11-24
511801,22431,WATERING CAN BLUE ELEPHANT,6,1.95,13999.0,United Kingdom,2025-11-24
511802,22427,ENAMEL FLOWER JUG CREAM,3,5.95,16359.0,United Kingdom,2025-11-24
511802,22430,ENAMEL WATERING CAN CREAM,4,4.95,16359.0,United Kingdom,2025-11-24
511802,22429,ENAMEL MEASURING JUG CREAM,4,4.25,16359.0,United Kingdom,2025-11-24
511802,84836,ZINC METAL HEART DECORATION,24,1.25,16359.0,United Kingdom,2025-11-24
511802,22428,ENAMEL FIRE BUCKET CREAM,6,6.95,16359.0,United Kingdom,2025-11-24
511803,84985A,SET OF 72 GREEN PAPER DOILIES,12,1.45,13658.0,United Kingdom,2025-11-24
511803,21629,SQUARE FLOOR CUSHION VINTAGE RED,2,7.95,13658.0,United Kingdom,2025-11-24
511803,21630,FLOOR CUSHION ELEPHANT CARNIVAL,2,8.95,13658.0,United Kingdom,2025-11-24
511803,22423,REGENCY CAKESTAND 3 TIER,6,12.75,13658.0,United Kingdom,2025-11-24
511803,21214,SET OF 72 IVORY PAPER DOILIES,12,1.45,13658.0,United Kingdom,2025-11-24
511803,84988,SET OF 72 PINK HEART PAPER DOILIES,12,1.45,13658.0,United Kingdom,2025-11-24
