Invoice,StockCode,Description,Quantity,Price,Customer ID,Country,InvoiceDate
503455,85047,WHITE BEADED GARLAND STRING 20LIGHT,24,5.55,15311.0,United Kingdom,2025-09-30
503452,85136B,BLUE SHARK HELICOPTER,1,7.95,16347.0,United Kingdom,2025-09-30
503455,22315,200 RED + WHITE BENDY STRAWS,3,1.25,15311.0,United Kingdom,2025-09-30
503455,21402,RED  EGG  SPOON,2,0.42,15311.0,United Kingdom,2025-09-30
503455,21403,BLUE EGG  SPOON,2,0.42,15311.0,United Kingdom,2025-09-30
503452,21910,WAY OUT METAL SIGN ,12,1.65,16347.0,United Kingdom,2025-09-30
503452,21713,CITRONELLA CANDLE FLOWERPOT,4,2.1,16347.0,United Kingdom,2025-09-30
503452,21911,GARDEN METAL SIGN ,12,1.65,16347.0,United Kingdom,2025-09-30
503452,72802C,VANILLA SCENT CANDLE JEWELLED BOX,3,4.25,16347.0,United Kingdom,2025-09-30
503452,84755,COLOUR GLASS T-LIGHT HOLDER HANGING,8,0.65,16347.0,United Kingdom,2025-09-30
503452,85123A,WHITE HANGING HEART T-LIGHT HOLDER,4,2.95,16347.0,United Kingdom,2025-09-30
503452,90058A,CRYSTAL STUD EARRINGS CLEAR DISPLAY,36,0.38,16347.0,United Kingdom,2025-09-30
503452,22524,CHILDRENS GARDEN GLOVES BLUE,10,1.25,16347.0,United Kingdom,2025-09-30
503452,84270,ASSTD DESIGN BUBBLE GUM RING,30,0.21,16347.0,United Kingdom,2025-09-30
503452,22030,SWALLOWS GREETING CARD,24,0.42,16347.0,United Kingdom,2025-09-30
503452,22525,CHILDRENS GARDEN GLOVES PINK,10,1.25,16347.0,United Kingdom,2025-09-30
503452,21829,DINOSAUR KEYRINGS ASSORTED,36,0.21,16347.0,United Kingdom,2025-09-30
503452,22122,SET OF 2 FANCY FONT TEA TOWELS,12,2.95,16347.0,United Kingdom,2025-09-30
503452,72802B,OCEAN SCENT CANDLE IN JEWELLED BOX,3,4.25,16347.0,United Kingdom,2025-09-30
503452,21136,PAINTED METAL PEARS ASSORTED,8,1.69,16347.0,United Kingdom,2025-09-30
503452,84879,ASSORTED COLOUR BIRD ORNAMENT,8,1.69,16347.0,United Kingdom,2025-09-30
503452,22457,NATURAL SLATE HEART CHALKBOARD ,2,2.95,16347.0,United Kingdom,2025-09-30
503461,22458,CAST IRON HOOK GARDEN FORK,8,2.55,17603.0,United Kingdom,2025-09-30
503461,22107,PIZZA PLATE IN BOX,4,3.75,17603.0,United Kingdom,2025-09-30
503461,22413,METAL SIGN TAKE IT OR LEAVE IT ,6,2.95,17603.0,United Kingdom,2025-09-30
503461,22412,METAL SIGN NEIGHBOURHOOD WITCH ,12,2.1,17603.0,United Kingdom,2025-09-30
503461,21164,HOME SWEET HOME METAL SIGN ,6,2.95,17603.0,United Kingdom,2025-09-30
503461,82597,BOMBS AWAY METAL SIGN,12,2.1,17603.0,United Kingdom,2025-09-30
503461,22477,WATERING CAN GARDEN MARKER,10,1.25,17603.0,United Kingdom,2025-09-30
503461,22459,CAST IRON HOOK GARDEN TROWEL,8,2.55,17603.0,United Kingdom,2025-09-30
503461,85121C,RETRO LAUNDRY TUB PISTACHIO,2,8.5,17603.0,United Kingdom,2025-09-30
503461,85150,LADIES & GENTLEMEN METAL SIGN,6,2.55,17603.0,United Kingdom,2025-09-30
503461,21613,S/12 VANILLA  BOTANICAL T-LIGHTS,6,2.95,17603.0,United Kingdom,2025-09-30
503461,21609,SET 12 LAVENDER  BOTANICAL T-LIGHTS,6,2.95,17603.0,United Kingdom,2025-09-30
503461,21391,FRENCH EMROIDR LAVENDER SCENT HEART,6,2.1,17603.0,United Kingdom,2025-09-30
503461,22510,DOORSTOP RUSSIAN DOLL GINGHAM,4,3.75,17603.0,United Kingdom,2025-09-30
503461,21117,BLOND DOLL DOORSTOP,2,6.75,17603.0,United Kingdom,2025-09-30
503461,21130,COLOURFUL STANDING GNOME,6,3.45,17603.0,United Kingdom,2025-09-30
503461,21127,COLOURFUL FISHING GNOME,3,5.95,17603.0,United Kingdom,2025-09-30
503461,84842,HELLO SAILOR BATHROOM SET,4,3.75,17603.0,United Kingdom,2025-09-30
503461,85231B,CINAMMON SET OF 9 T-LIGHTS,12,0.85,17603.0,United Kingdom,2025-09-30
503472,21232,STRAWBERRY CERAMIC TRINKET BOX,12,1.25,18241.0,United Kingdom,2025-09-30
503472,22069,BROWN  PIRATE TREASURE CHEST ,12,1.65,18241.0,United Kingdom,2025-09-30
503469,M,Manual,85,0.4,15311.0,United Kingdom,2025-09-30
503470,22500,SET OF 2 TINS JARDIN DE PROVENCE,12,4.95,13408.0,United Kingdom,2025-09-30
503470,22467,GUMBALL COAT RACK,36,2.1,13408.0,United Kingdom,2025-09-30
503470,85123A,WHITE HANGING HEART T-LIGHT HOLDER,32,2.55,13408.0,United Kingdom,2025-09-30
503472,21890,S/6 WOODEN SKITTLES IN COTTON BAG,6,2.95,18241.0,United Kingdom,2025-09-30
503470,22423,REGENCY CAKESTAND 3 TIER,16,10.95,13408.0,United Kingdom,2025-09-30
503472,20682,RED SPOTTY CHILDS UMBRELLA,6,3.25,18241.0,United Kingdom,2025-09-30
503472,20728,LUNCH BAG CARS BLUE,10,1.65,18241.0,United Kingdom,2025-09-30
503472,20725,LUNCH BAG RED SPOTTY,10,1.65,18241.0,United Kingdom,2025-09-30
503472,21704,BAG 250g SWIRLY MARBLES,12,0.85,18241.0,United Kingdom,2025-09-30
503472,21790,VINTAGE SNAP CARDS,12,0.85,18241.0,United Kingdom,2025-09-30
503472,21156,RED SPOTTY CHILDS APRON,8,1.95,18241.0,United Kingdom,2025-09-30
503472,22367,CHILDS APRON SPACEBOY DESIGN,8,1.95,18241.0,United Kingdom,2025-09-30
503472,22617,BAKING SET SPACEBOY DESIGN,3,4.95,18241.0,United Kingdom,2025-09-30
503472,22138,BAKING SET 9 PIECE RETROSPOT ,3,4.95,18241.0,United Kingdom,2025-09-30
503472,22560,TRADITIONAL MODELLING CLAY,24,1.25,18241.0,United Kingdom,2025-09-30
503476,21533,RETRO SPOT LARGE MILK JUG,1,4.95,,United Kingdom,2025-09-30
503476,20763,DAISY SKETCHBOOK ,1,3.75,,United Kingdom,2025-09-30
503476,47559B,TEA TIME OVEN GLOVE,1,1.25,,United Kingdom,2025-09-30
503476,10138,ASSORTED COLOUR JUMBO PEN,3,0.42,,United Kingdom,2025-09-30
503476,21846,PINK DIAMANTE PEN IN GIFT BOX,4,4.95,,United Kingdom,2025-09-30
503476,22076,6 RIBBONS EMPIRE  ,2,1.65,,United Kingdom,2025-09-30
503476,84748,FOLK FELT HANGING MULTICOL GARLAND,2,3.75,,United Kingdom,2025-09-30
503476,77079,DOLPHIN WINDMILL,2,2.12,,United Kingdom,2025-09-30
503476,22431,WATERING CAN BLUE ELEPHANT,1,1.95,,United Kingdom,2025-09-30
503479,21623,VINTAGE UNION JACK MEMOBOARD,12,9.95,13408.0,United Kingdom,2025-09-30
503497,BANK CHARGES,Bank Charges,1,15.0,17539.0,United Kingdom,2025-09-30
503496,85124C,GREEN JUICY FRUIT PHOTO FRAME,1,2.55,17841.0,United Kingdom,2025-09-30
503496,20729,RED SPOTTY CANDY BAG,1,1.25,17841.0,United Kingdom,2025-09-30
503496,22236,CAKE STAND 3 TIER MAGIC GARDEN,5,12.75,17841.0,United Kingdom,2025-09-30
503496,21668,RED STRIPE CERAMIC DRAWER KNOB,5,1.25,17841.0,United Kingdom,2025-09-30
503496,20747,PICCADILLY TEA SET,1,14.95,17841.0,United Kingdom,2025-09-30
503496,20990,SPRING FLOWER CHOPSTICKS SET/5,1,1.95,17841.0,United Kingdom,2025-09-30
503496,21186,WHITE DOVE HONEYCOMB PAPER GARLAND,10,1.65,17841.0,United Kingdom,2025-09-30
503496,21478,SILVER SKULL HOT WATER BOTTLE ,1,3.75,17841.0,United Kingdom,2025-09-30
503496,85098B,BLUE FLYING SINGING CANARY,1,3.75,17841.0,United Kingdom,2025-09-30
503496,21173,LOO ROLL  METAL SIGN ,8,1.65,17841.0,United Kingdom,2025-09-30
503496,84989B,75 BLACK FAIRY CAKE CASES,24,0.55,17841.0,United Kingdom,2025-09-30
503496,84990,60 GOLD AND SILVER FAIRY CAKE CASES,24,0.55,17841.0,United Kingdom,2025-09-30
503496,47590A,BLUE HAPPY BIRTHDAY BUNTING,1,5.45,17841.0,United Kingdom,2025-09-30
503496,21707,"FOLDING UMBRELLA , BLACK/BLUE  SPOT",1,4.95,17841.0,United Kingdom,2025-09-30
503496,21746,SMALL RED RETROSPOT WINDMILL,1,1.25,17841.0,United Kingdom,2025-09-30
503496,84535B,FAIRY CAKES NOTEBOOK A6 SIZE,1,0.65,17841.0,United Kingdom,2025-09-30
503496,79323W,WHITE CHERRY LIGHTS,4,6.75,17841.0,United Kingdom,2025-09-30
503496,79323LP,LIGHT PINK CHERRY LIGHTS,2,6.75,17841.0,United Kingdom,2025-09-30
503496,79323B,BLACK CHERRY LIGHTS,1,6.75,17841.0,United Kingdom,2025-09-30
503496,22021,BLUE FELT EASTER EGG BASKET,1,1.65,17841.0,United Kingdom,2025-09-30
503498,47567B,TEA TIME KITCHEN APRON,3,5.95,16551.0,United Kingdom,2025-09-30
503498,15034,PAPER POCKET TRAVELING FAN ,24,0.14,16551.0,United Kingdom,2025-09-30
503498,84535B,FAIRY CAKES NOTEBOOK A6 SIZE,16,0.65,16551.0,United Kingdom,2025-09-30
503498,84509G,SET OF 4 FAIRY CAKE PLACEMATS ,4,3.75,16551.0,United Kingdom,2025-09-30
503498,47579,TEA TIME BREAKFAST BASKET,6,2.1,16551.0,United Kingdom,2025-09-30
503498,84380,SET OF 3 BUTTERFLY COOKIE CUTTERS,12,1.25,16551.0,United Kingdom,2025-09-30
503498,47556B,TEA TIME TEA TOWELS ,6,2.95,16551.0,United Kingdom,2025-09-30
503498,47559B,TEA TIME OVEN GLOVE,10,1.25,16551.0,United Kingdom,2025-09-30
503498,37448,CERAMIC CAKE DESIGN SPOTTED MUG,12,1.49,16551.0,United Kingdom,2025-09-30
503498,22423,REGENCY CAKESTAND 3 TIER,2,12.75,16551.0,United Kingdom,2025-09-30
503498,84510B,SET OF 4 FAIRY CAKES COASTERS ,10,1.25,16551.0,United Kingdom,2025-09-30
503498,37503,TEA TIME CAKE STAND IN GIFT BOX,12,9.95,16551.0,United Kingdom,2025-09-30
503498,22236,CAKE STAND 3 TIER MAGIC GARDEN,3,12.75,16551.0,United Kingdom,2025-09-30
503498,37446,MINI CAKE STAND WITH HANGING CAKES,8,1.45,16551.0,United Kingdom,2025-09-30
503498,21667,GLASS CAKE COVER AND PLATE,1,16.95,16551.0,United Kingdom,2025-09-30
503498,48116,DOOR MAT MULTICOLOUR STRIPE,2,7.49,16551.0,United Kingdom,2025-09-30
503498,48185,DOOR MAT FAIRY CAKE,4,7.49,16551.0,United Kingdom,2025-09-30
503498,37447,CERAMIC CAKE DESIGN SPOTTED PLATE,12,1.49,16551.0,United Kingdom,2025-09-30
503499,20728,LUNCH BAG CARS BLUE,10,1.65,15173.0,United Kingdom,2025-09-30
503499,84715,SET OF 6 ICE CREAM SKITTLES,8,2.95,15173.0,United Kingdom,2025-09-30
503499,21429,RED GINGHAM ROSE JEWELLERY BOX,8,1.65,15173.0,United Kingdom,2025-09-30
503499,22180,RETRO SPOT LAMP,1,9.95,15173.0,United Kingdom,2025-09-30
503499,21524,DOOR MAT SPOTTY HOME SWEET HOME,2,7.49,15173.0,United Kingdom,2025-09-30
503499,22090,PAPER BUNTING RETRO SPOTS,6,2.95,15173.0,United Kingdom,2025-09-30
503499,22138,BAKING SET 9 PIECE RETROSPOT ,3,4.95,15173.0,United Kingdom,2025-09-30
503499,21431,GREEN GINGHAM FLOWER JEWELLERY BOX,8,1.65,15173.0,United Kingdom,2025-09-30
503499,22618,COOKING SET RETROSPOT,12,8.49,15173.0,United Kingdom,2025-09-30
503499,71038,WHITE HANGING BEADS CANDLE HOLDER,4,5.45,15173.0,United Kingdom,2025-09-30
503499,22356,"CHARLOTTE BAG , PINK/WHITE SPOTS",10,0.85,15173.0,United Kingdom,2025-09-30
503499,22139,RETRO SPOT TEA SET CERAMIC 11 PC ,3,4.95,15173.0,United Kingdom,2025-09-30
503499,20682,RED SPOTTY CHILDS UMBRELLA,6,3.25,15173.0,United Kingdom,2025-09-30
503499,20681,PINK SPOTTY CHILDS UMBRELLA,6,3.25,15173.0,United Kingdom,2025-09-30
503499,22617,BAKING SET SPACEBOY DESIGN,3,4.95,15173.0,United Kingdom,2025-09-30
503499,22323,PINK POLKADOT KIDS BAG,12,1.95,15173.0,United Kingdom,2025-09-30
503499,22324,BLUE POLKADOT KIDS BAG,12,1.95,15173.0,United Kingdom,2025-09-30
503499,20724,RED SPOTTY CHARLOTTE BAG,10,0.85,15173.0,United Kingdom,2025-09-30
503499,20750,RED/WHITE DOT MINI CASES,2,7.95,15173.0,United Kingdom,2025-09-30
503503,84997C,BLUE 3 PIECE MINI DOTS CUTLERY SET,6,3.75,12583.0,France,2025-09-30
503503,22333,RETRO SPORT PARTY BAG + STICKER SET,16,1.65,12583.0,France,2025-09-30
503503,21094,SET/6 RED SPOTTY PAPER PLATES,12,0.85,12583.0,France,2025-09-30
503503,21086,SET/6 RED SPOTTY PAPER CUPS,12,0.65,12583.0,France,2025-09-30
503503,21080,SET/20 RED SPOTTY PAPER NAPKINS ,12,0.85,12583.0,France,2025-09-30
503503,22561,WOODEN SCHOOL COLOURING SET,12,1.65,12583.0,France,2025-09-30
503503,21121,SET/10 RED SPOTTY PARTY CANDLES,24,1.25,12583.0,France,2025-09-30
503503,20983,12 PENCILS TALL TUBE RED SPOTTY,12,0.85,12583.0,France,2025-09-30
503503,22432,WATERING CAN PINK BUNNY,12,1.95,12583.0,France,2025-09-30
503503,22390,PAPERWEIGHT CHILDHOOD MEMORIES,18,2.55,12583.0,France,2025-09-30
503503,POST,POSTAGE,4,18.0,12583.0,France,2025-09-30
503503,20719,WOODLAND CHARLOTTE BAG,30,0.85,12583.0,France,2025-09-30
503503,22242,"HOOK, 5 HANGER , MAGIC TOADSTOOL",12,1.65,12583.0,France,2025-09-30
503503,20981,12 PENCILS TALL TUBE WOODLAND,24,0.85,12583.0,France,2025-09-30
503503,21715,GIRLS VINTAGE TIN SEASIDE BUCKET,16,2.55,12583.0,France,2025-09-30
503503,10002,INFLATABLE POLITICAL GLOBE ,24,0.85,12583.0,France,2025-09-30
503500,85196,,11,0.0,,United Kingdom,2025-09-30
503501,85206B,,20,0.0,,United Kingdom,2025-09-30
503503,22554,PLASTERS IN TIN WOODLAND ANIMALS,12,1.65,12583.0,France,2025-09-30
503503,22556,PLASTERS IN TIN CIRCUS PARADE ,24,1.65,12583.0,France,2025-09-30
503503,22555,PLASTERS IN TIN STRONGMAN,12,1.65,12583.0,France,2025-09-30
503503,22551,PLASTERS IN TIN SPACEBOY,12,1.65,12583.0,France,2025-09-30
503503,47592A,CAROUSEL DES CHILD'S OVERALL,12,2.1,12583.0,France,2025-09-30
503503,22326,ROUND SNACK BOXES SET OF4 WOODLAND ,24,2.95,12583.0,France,2025-09-30
503503,21716,BOYS VINTAGE TIN SEASIDE BUCKET,16,2.55,12583.0,France,2025-09-30
503503,22431,WATERING CAN BLUE ELEPHANT,12,1.95,12583.0,France,2025-09-30
503503,21791,VINTAGE HEADS AND TAILS CARD GAME ,24,1.25,12583.0,France,2025-09-30
503503,40018F,CHERRY DESIGN PAPERLANTERNS,10,1.95,12583.0,France,2025-09-30
503507,22417,PACK OF 60 SPACEBOY CAKE CASES,4,0.55,16713.0,United Kingdom,2025-09-30
503507,22521,CHILDS GARDEN TROWEL PINK,3,0.85,16713.0,United Kingdom,2025-09-30
503507,22423,REGENCY CAKESTAND 3 TIER,1,12.75,16713.0,United Kingdom,2025-09-30
503507,22514,CHILDS GARDEN SPADE BLUE,2,2.1,16713.0,United Kingdom,2025-09-30
503507,84992,72 SWEETHEART FAIRY CAKE CASES,4,0.55,16713.0,United Kingdom,2025-09-30
503507,21975,PACK OF 60 DINOSAUR CAKE CASES,4,0.55,16713.0,United Kingdom,2025-09-30
503507,84212,"ASSORTED FLOWER COLOUR ""LEIS""",6,0.65,16713.0,United Kingdom,2025-09-30
503507,21212,PACK OF 72 RETRO SPOT CAKE CASES,2,0.55,16713.0,United Kingdom,2025-09-30
503507,22402,MAGNETS PACK OF 4 VINTAGE COLLAGE,1,1.25,16713.0,United Kingdom,2025-09-30
503507,22563,HAPPY STENCIL CRAFT,2,1.25,16713.0,United Kingdom,2025-09-30
503507,22562,MONSTERS STENCIL CRAFT,2,1.25,16713.0,United Kingdom,2025-09-30
503507,22522,CHILDS GARDEN FORK BLUE ,3,0.85,16713.0,United Kingdom,2025-09-30
503507,84466,TOP SECRET PEN SET,3,1.25,16713.0,United Kingdom,2025-09-30
503507,84991,60 TEATIME FAIRY CAKE CASES,4,0.55,16713.0,United Kingdom,2025-09-30
503507,22523,CHILDS GARDEN FORK PINK,3,0.85,16713.0,United Kingdom,2025-09-30
503507,22507,MEMO BOARD RETROSPOT  DESIGN,2,4.95,16713.0,United Kingdom,2025-09-30
503507,22524,CHILDRENS GARDEN GLOVES BLUE,3,1.25,16713.0,United Kingdom,2025-09-30
503507,22525,CHILDRENS GARDEN GLOVES PINK,3,1.25,16713.0,United Kingdom,2025-09-30
503507,22475,SKULL DESIGN TV DINNER TRAY,1,4.95,16713.0,United Kingdom,2025-09-30
503507,22473,TV DINNER TRAY VINTAGE PAISLEY,1,4.95,16713.0,United Kingdom,2025-09-30
503507,22528,GARDENERS KNEELING PAD,6,1.25,16713.0,United Kingdom,2025-09-30
503507,22505,MEMO BOARD COTTAGE DESIGN,2,4.95,16713.0,United Kingdom,2025-09-30
503507,22617,BAKING SET SPACEBOY DESIGN,2,4.95,16713.0,United Kingdom,2025-09-30
503507,22474,SPACEBOY TV DINNER TRAY,2,4.95,16713.0,United Kingdom,2025-09-30
503507,22516,CHILDS GARDEN RAKE BLUE,2,2.1,16713.0,United Kingdom,2025-09-30
503507,22515,CHILDS GARDEN SPADE PINK,2,2.1,16713.0,United Kingdom,2025-09-30
503507,22519,CHILDS GARDEN BRUSH PINK,2,2.1,16713.0,United Kingdom,2025-09-30
503507,22518,CHILDS GARDEN BRUSH BLUE,2,2.1,16713.0,United Kingdom,2025-09-30
503507,22517,CHILDS GARDEN RAKE PINK,2,2.1,16713.0,United Kingdom,2025-09-30
503507,84969,ASSORTED COLOUR SET 6 TEASPOONS,1,4.25,16713.0,United Kingdom,2025-09-30
503507,22520,CHILDS GARDEN TROWEL BLUE ,3,0.85,16713.0,United Kingdom,2025-09-30
503507,84375,SET OF 20 KIDS COOKIE CUTTERS,3,1.95,16713.0,United Kingdom,2025-09-30
503507,21213,PACK OF 72 SKULL CAKE CASES,2,0.55,16713.0,United Kingdom,2025-09-30
503507,21121,SET/10 RED SPOTTY PARTY CANDLES,2,1.25,16713.0,United Kingdom,2025-09-30
503507,21122,SET/10 PINK SPOTTY PARTY CANDLES,3,1.25,16713.0,United Kingdom,2025-09-30
503507,48187,DOOR MAT NEW ENGLAND,1,7.49,16713.0,United Kingdom,2025-09-30
503507,48138,DOOR MAT UNION FLAG,1,7.49,16713.0,United Kingdom,2025-09-30
503507,48194,DOOR MAT HEARTS,1,7.49,16713.0,United Kingdom,2025-09-30
503507,22177,5 HOOK BLACKBOARD ORGANISER ,1,9.95,16713.0,United Kingdom,2025-09-30
503507,22171,3 HOOK PHOTO SHELF ANTIQUE WHITE,2,8.5,16713.0,United Kingdom,2025-09-30
503507,22334,DINOSAUR PARTY BAG + STICKER SET,2,1.65,16713.0,United Kingdom,2025-09-30
503507,22331,WOODLAND PARTY BAG + STICKER SET,2,1.65,16713.0,United Kingdom,2025-09-30
503507,22332,SKULLS PARTY BAG + STICKER SET,2,1.65,16713.0,United Kingdom,2025-09-30
503507,22333,RETRO SPORT PARTY BAG + STICKER SET,2,1.65,16713.0,United Kingdom,2025-09-30
503507,21181,PLEASE ONE PERSON METAL SIGN,1,2.1,16713.0,United Kingdom,2025-09-30
503507,22412,METAL SIGN NEIGHBOURHOOD WITCH ,1,2.1,16713.0,United Kingdom,2025-09-30
503507,21169,YOU'RE CONFUSING ME METAL SIGN ,1,1.69,16713.0,United Kingdom,2025-09-30
503507,21731,RED TOADSTOOL LED NIGHT LIGHT,3,1.65,16713.0,United Kingdom,2025-09-30
503507,22128,PARTY CONES CANDY ASSORTED,12,1.25,16713.0,United Kingdom,2025-09-30
503507,84792,ENCHANTED BIRD COATHANGER 5 HOOK,1,4.65,16713.0,United Kingdom,2025-09-30
503507,40046A,RED DAISY PAPER LAMPSHADE,2,1.25,16713.0,United Kingdom,2025-09-30
503507,84828,JUNGLE POPSICLES ICE LOLLY HOLDERS,2,1.25,16713.0,United Kingdom,2025-09-30
503507,84327A,PINK JUMPER LARRY THE LAMB,2,2.1,16713.0,United Kingdom,2025-09-30
503507,21259,VICTORIAN SEWING BOX SMALL ,1,5.95,16713.0,United Kingdom,2025-09-30
503507,22467,GUMBALL COAT RACK,3,2.55,16713.0,United Kingdom,2025-09-30
503507,22467,GUMBALL COAT RACK,2,2.55,16713.0,United Kingdom,2025-09-30
503507,22127,PARTY CONES CARNIVAL ASSORTED,12,1.25,16713.0,United Kingdom,2025-09-30
503507,82486,WOOD S/3 CABINET ANT WHITE FINISH,2,7.95,16713.0,United Kingdom,2025-09-30
503507,22169,FAMILY ALBUM WHITE PICTURE FRAME,2,8.5,16713.0,United Kingdom,2025-09-30
503507,21429,RED GINGHAM ROSE JEWELLERY BOX,4,1.65,16713.0,United Kingdom,2025-09-30
503507,79321,CHILLI LIGHTS,1,4.95,16713.0,United Kingdom,2025-09-30
503507,79323W,WHITE CHERRY LIGHTS,1,6.75,16713.0,United Kingdom,2025-09-30
503507,79323P,PINK CHERRY LIGHTS,1,6.75,16713.0,United Kingdom,2025-09-30
503507,40001,WHITE BAMBOO RIBS LAMPSHADE,3,0.85,16713.0,United Kingdom,2025-09-30
503507,40003,WHITE BAMBOO RIBS LAMPSHADE,3,1.25,16713.0,United Kingdom,2025-09-30
503507,21431,GREEN GINGHAM FLOWER JEWELLERY BOX,4,1.65,16713.0,United Kingdom,2025-09-30
503515,21474,SWEETHEART CREAM STEEL FOLDIN BENCH,2,19.95,13196.0,United Kingdom,2025-09-30
503515,85119,WATERING CAN SINGLE HOOK PISTACHIO,8,1.69,13196.0,United Kingdom,2025-09-30
503515,21410,COUNTRY COTTAGE  DOORSTOP GREEN,3,4.25,13196.0,United Kingdom,2025-09-30
503515,22478,BIRDHOUSE GARDEN MARKER ,10,1.25,13196.0,United Kingdom,2025-09-30
503515,22479,DAISY GARDEN MARKER,10,1.25,13196.0,United Kingdom,2025-09-30
503515,21429,RED GINGHAM ROSE JEWELLERY BOX,8,1.65,13196.0,United Kingdom,2025-09-30
503515,22487,WHITE WOOD GARDEN PLANT LADDER,1,9.95,13196.0,United Kingdom,2025-09-30
503515,15058B,PINK WHITE SPOTS GARDEN PARASOL,2,7.95,13196.0,United Kingdom,2025-09-30
503515,82607A,GLASS BONBON JAR PARFUME AUX FLEURE,6,1.25,13196.0,United Kingdom,2025-09-30
503515,84819,DANISH ROSE ROUND SEWING BOX,3,4.25,13196.0,United Kingdom,2025-09-30
503515,84292,ROSE PINK METAL FOLDING CHAIR,4,7.95,13196.0,United Kingdom,2025-09-30
503515,22483,RED GINGHAM TEDDY BEAR ,6,2.95,13196.0,United Kingdom,2025-09-30
503516,22423,REGENCY CAKESTAND 3 TIER,4,12.75,16434.0,United Kingdom,2025-09-30
503516,21623,VINTAGE UNION JACK MEMOBOARD,2,9.95,16434.0,United Kingdom,2025-09-30
503516,84880,WHITE WIRE EGG HOLDER,3,5.95,16434.0,United Kingdom,2025-09-30
503516,21537,RED RETROSPOT PUDDING BOWL,2,4.25,16434.0,United Kingdom,2025-09-30
503516,84946,ANTIQUE SILVER TEA GLASS ETCHED,12,1.25,16434.0,United Kingdom,2025-09-30
503516,21527,RED RETROSPOT TRADITIONAL TEAPOT ,3,7.95,16434.0,United Kingdom,2025-09-30
503516,21902,"KEY FOB , FRONT  DOOR ",2,0.65,16434.0,United Kingdom,2025-09-30
503516,21901,"KEY FOB , BACK DOOR ",2,0.65,16434.0,United Kingdom,2025-09-30
503516,21900,"KEY FOB , SHED",2,0.65,16434.0,United Kingdom,2025-09-30
503516,21899,"KEY FOB , GARAGE DESIGN",2,0.65,16434.0,United Kingdom,2025-09-30
503516,22507,MEMO BOARD RETROSPOT  DESIGN,2,4.95,16434.0,United Kingdom,2025-09-30
503516,21317,GLASS SPHERE CANDLE STAND MEDIUM,2,5.45,16434.0,United Kingdom,2025-09-30
503517,22215,CAKE STAND WHITE TWO TIER LACE,2,8.5,14200.0,United Kingdom,2025-09-30
503517,84884A,ANT WHITE WIRE HEART SPIRAL,5,3.95,14200.0,United Kingdom,2025-09-30
503517,84880,WHITE WIRE EGG HOLDER,3,5.95,14200.0,United Kingdom,2025-09-30
503517,22189,CREAM HEART CARD HOLDER,4,3.95,14200.0,United Kingdom,2025-09-30
503517,84406B,CREAM CUPID HEARTS COAT HANGER,8,3.25,14200.0,United Kingdom,2025-09-30
503517,21896,POTTING SHED TWINE,6,2.1,14200.0,United Kingdom,2025-09-30
503517,22457,NATURAL SLATE HEART CHALKBOARD ,6,2.95,14200.0,United Kingdom,2025-09-30
503517,84991,60 TEATIME FAIRY CAKE CASES,24,0.55,14200.0,United Kingdom,2025-09-30
503517,84987,SET OF 36 TEATIME PAPER DOILIES,12,1.45,14200.0,United Kingdom,2025-09-30
503517,84969,ASSORTED COLOUR SET 6 TEASPOONS,6,4.25,14200.0,United Kingdom,2025-09-30
503517,22172,METAL SHELF WITH RAIL ,2,8.5,14200.0,United Kingdom,2025-09-30
503517,84792,ENCHANTED BIRD COATHANGER 5 HOOK,4,4.65,14200.0,United Kingdom,2025-09-30
503517,22383,LUNCH BAG SUKI  DESIGN ,10,1.65,14200.0,United Kingdom,2025-09-30
503517,85099F,JUMBO BAG STRAWBERRY,10,1.95,14200.0,United Kingdom,2025-09-30
503517,21931,JUMBO STORAGE BAG SUKI,10,1.95,14200.0,United Kingdom,2025-09-30
503517,21380,WOODEN HAPPY BIRTHDAY GARLAND,6,2.95,14200.0,United Kingdom,2025-09-30
503517,21217,RED SPOTTY ROUND CAKE TINS,2,9.95,14200.0,United Kingdom,2025-09-30
503517,21218,RED SPOTTY BISCUIT TIN,6,3.75,14200.0,United Kingdom,2025-09-30
503517,21155,RED SPOTTY PEG BAG,6,2.1,14200.0,United Kingdom,2025-09-30
503517,21042,RED SPOTTY APRON ,3,5.95,14200.0,United Kingdom,2025-09-30
503517,21937,STRAWBERRY   PICNIC BAG,5,2.95,14200.0,United Kingdom,2025-09-30
C503518,20689,RETRO SISTERS EXPRESSO CUPS,-12,1.95,15997.0,United Kingdom,2025-09-30
503519,21384,,100,0.0,,United Kingdom,2025-09-30
503520,20934,,-112,0.0,,United Kingdom,2025-09-30
503522,21759,,-8,0.0,,United Kingdom,2025-09-30
503521,79338,,-37,0.0,,United Kingdom,2025-09-30
503523,84770,,-31,0.0,,United Kingdom,2025-09-30
503525,40018E,,-17,0.0,,United Kingdom,2025-09-30
503524,48195,,6,0.0,,United Kingdom,2025-09-30
503526,84791,,-11,0.0,,United Kingdom,2025-09-30
503528,20958,,-4,0.0,,United Kingdom,2025-09-30
C503527,10002,INFLATABLE POLITICAL GLOBE ,-200,0.72,16019.0,United Kingdom,2025-09-30
503530,35978,,48,0.0,,United Kingdom,2025-09-30
503529,21549,,-23,0.0,,United Kingdom,2025-09-30
503531,20676,RED SPOTTY BOWL,8,1.25,12708.0,Germany,2025-09-30
503531,POST,POSTAGE,1,18.0,12708.0,Germany,2025-09-30
503531,22389,PAPERWEIGHT SAVE THE PLANET,6,2.55,12708.0,Germany,2025-09-30
503531,21452,TOADSTOOL MONEY BOX,6,2.95,12708.0,Germany,2025-09-30
503531,22423,REGENCY CAKESTAND 3 TIER,1,12.75,12708.0,Germany,2025-09-30
503531,20674,GREEN SPOTTY BOWL,8,1.25,12708.0,Germany,2025-09-30
503531,20675,BLUE SPOTTY BOWL,8,1.25,12708.0,Germany,2025-09-30
503531,21242,RED SPOTTY PLATE ,8,1.69,12708.0,Germany,2025-09-30
503531,21245,GREEN  SPOTTY PLATE ,8,1.69,12708.0,Germany,2025-09-30
503531,21238,RED SPOTTY CUP,8,0.85,12708.0,Germany,2025-09-30
503531,22122,SET OF 2 FANCY FONT TEA TOWELS,12,2.95,12708.0,Germany,2025-09-30
503531,22328,ROUND SNACK BOXES SET OF 4 FRUITS ,6,2.95,12708.0,Germany,2025-09-30
503531,22326,ROUND SNACK BOXES SET OF4 WOODLAND ,6,2.95,12708.0,Germany,2025-09-30
503531,21077,SET/20 WOODLAND PAPER NAPKINS ,12,0.85,12708.0,Germany,2025-09-30
503531,21244,BLUE  SPOTTY PLATE ,8,1.69,12708.0,Germany,2025-09-30
503532,22518,CHILDS GARDEN BRUSH BLUE,6,2.1,12472.0,Germany,2025-09-30
503532,22519,CHILDS GARDEN BRUSH PINK,6,2.1,12472.0,Germany,2025-09-30
503532,22378,WALL TIDY RETROSPOT ,5,2.1,12472.0,Germany,2025-09-30
503532,22520,CHILDS GARDEN TROWEL BLUE ,12,0.85,12472.0,Germany,2025-09-30
503532,POST,POSTAGE,3,18.0,12472.0,Germany,2025-09-30
503532,21238,RED SPOTTY CUP,8,0.85,12472.0,Germany,2025-09-30
503532,22585,PACK OF 6 BIRDY GIFT TAGS,24,1.25,12472.0,Germany,2025-09-30
503532,22082,RIBBON REEL STRIPES DESIGN ,10,1.65,12472.0,Germany,2025-09-30
503532,85049B,LUSH GREENS RIBBONS,12,1.25,12472.0,Germany,2025-09-30
503532,20738,GREEN MINI TAPE MEASURE ,10,0.85,12472.0,Germany,2025-09-30
503532,22454,MEASURING TAPE RUSSIAN DOLL RED,6,2.95,12472.0,Germany,2025-09-30
503532,22453,MEASURING TAPE RUSSIAN DOLL BLUE,6,2.95,12472.0,Germany,2025-09-30
503532,22531,MAGIC DRAWING SLATE CIRCUS PARADE  ,48,0.42,12472.0,Germany,2025-09-30
503532,22534,MAGIC DRAWING SLATE SPACEBOY ,48,0.42,12472.0,Germany,2025-09-30
503532,21219,SET/4 BADGES BALLOON GIRL,10,1.25,12472.0,Germany,2025-09-30
503532,21914,BLUE HARMONICA IN BOX ,12,1.25,12472.0,Germany,2025-09-30
503532,21915,RED  HARMONICA IN BOX ,12,1.25,12472.0,Germany,2025-09-30
503532,22517,CHILDS GARDEN RAKE PINK,6,2.1,12472.0,Germany,2025-09-30
503532,85049G,CHOCOLATE BOX RIBBONS ,12,1.25,12472.0,Germany,2025-09-30
503532,22516,CHILDS GARDEN RAKE BLUE,6,2.1,12472.0,Germany,2025-09-30
503532,22523,CHILDS GARDEN FORK PINK,12,0.85,12472.0,Germany,2025-09-30
503532,22549,PICTURE DOMINOES,12,1.45,12472.0,Germany,2025-09-30
503532,22521,CHILDS GARDEN TROWEL PINK,12,0.85,12472.0,Germany,2025-09-30
503532,22522,CHILDS GARDEN FORK BLUE ,12,0.85,12472.0,Germany,2025-09-30
503532,22445,PENCIL CASE LIFE IS BEAUTIFUL,6,2.95,12472.0,Germany,2025-09-30
503532,22444,GROW YOUR OWN PLANT IN A CAN ,24,1.25,12472.0,Germany,2025-09-30
503532,22555,PLASTERS IN TIN STRONGMAN,12,1.65,12472.0,Germany,2025-09-30
503532,22556,PLASTERS IN TIN CIRCUS PARADE ,12,1.65,12472.0,Germany,2025-09-30
503532,22515,CHILDS GARDEN SPADE PINK,12,2.1,12472.0,Germany,2025-09-30
503532,22560,TRADITIONAL MODELLING CLAY,24,1.25,12472.0,Germany,2025-09-30
503532,22559,SEASIDE FRISBEE ,12,1.25,12472.0,Germany,2025-09-30
503532,21718,RED METAL BEACH SPADE ,12,1.25,12472.0,Germany,2025-09-30
503532,47505,MINATURE COLOURED GARDENING SET,3,4.95,12472.0,Germany,2025-09-30
503532,22077,6 RIBBONS RUSTIC CHARM,24,1.65,12472.0,Germany,2025-09-30
503532,20665,RED SPOTTY PURSE ,6,2.95,12472.0,Germany,2025-09-30
503532,22540,MINI JIGSAW CIRCUS PARADE ,48,0.42,12472.0,Germany,2025-09-30
503532,22544,MINI JIGSAW SPACEBOY,48,0.42,12472.0,Germany,2025-09-30
