Invoice,StockCode,Description,Quantity,Price,Customer ID,Country,InvoiceDate
492948,21108,FAIRY CAKE FLANNEL ASSORTED COLOUR,1,2.55,14606.0,United Kingdom,2025-07-14
492948,21484,CHICK GREY HOT WATER BOTTLE,1,3.45,14606.0,United Kingdom,2025-07-14
492948,84676,BATH DUCK WATERING CAN,1,2.95,14606.0,United Kingdom,2025-07-14
492948,21784,SHOE SHINE BOX ,1,9.95,14606.0,United Kingdom,2025-07-14
492948,15060B,FAIRY CAKE DESIGN UMBRELLA,1,3.75,14606.0,United Kingdom,2025-07-14
492948,M,Manual,1,68.96,14606.0,United Kingdom,2025-07-14
492948,21837,CROSS STITCH ALPHABET CUSHION COVER,1,5.95,14606.0,United Kingdom,2025-07-14
492948,21398,RED  SPOTTY COFFEE  MUG,1,2.1,14606.0,United Kingdom,2025-07-14
492948,72741,GRAND CHOCOLATECANDLE,9,1.45,14606.0,United Kingdom,2025-07-14
492948,21534,DAIRY MAID LARGE MILK JUG,1,4.95,14606.0,United Kingdom,2025-07-14
492950,22202,MILK PAN PINK RETROSPOT,12,3.75,12471.0,Germany,2025-07-14
492950,22301,COFFEE MUG CAT + BIRD DESIGN,6,2.55,12471.0,Germany,2025-07-14
492950,22314,OFFICE MUG WARMER CHOC+BLUE,10,4.95,12471.0,Germany,2025-07-14
492950,22150, 3 STRIPEY MICE FELTCRAFT,6,1.95,12471.0,Germany,2025-07-14
492950,22139,RETRO SPOT TEA SET CERAMIC 11 PC ,3,4.95,12471.0,Germany,2025-07-14
492950,22348,TEA BAG PLATE RED SPOTTY ,24,0.85,12471.0,Germany,2025-07-14
492950,22331,WOODLAND PARTY BAG + STICKER SET,16,1.65,12471.0,Germany,2025-07-14
492950,21027,NINJA RABBIT PINK,10,1.25,12471.0,Germany,2025-07-14
492950,22318,FIVE HEART HANGING DECORATION,6,2.95,12471.0,Germany,2025-07-14
492950,21918,SET 12 KIDS COLOUR  CHALK STICKS,24,0.42,12471.0,Germany,2025-07-14
492950,POST,POSTAGE,5,18.0,12471.0,Germany,2025-07-14
492950,22333,RETRO SPORT PARTY BAG + STICKER SET,8,1.65,12471.0,Germany,2025-07-14
492950,21527,RETRO SPOT TRADITIONAL TEAPOT ,8,7.95,12471.0,Germany,2025-07-14
492950,21980,PACK OF 12 RED SPOTTY TISSUES ,48,0.29,12471.0,Germany,2025-07-14
492950,21700,BIG DOUGHNUT FRIDGE MAGNETS,36,0.85,12471.0,Germany,2025-07-14
492950,22027,TEA PARTY BIRTHDAY CARD,24,0.42,12471.0,Germany,2025-07-14
492949,21673,WHITE SPOT BLUE CERAMIC DRAWER KNOB,12,1.25,14119.0,United Kingdom,2025-07-14
492949,21668,RED STRIPE CERAMIC DRAWER KNOB,12,1.25,14119.0,United Kingdom,2025-07-14
492950,20719,WOODLAND CHARLOTTE BAG,20,0.85,12471.0,Germany,2025-07-14
492950,21481,FAWN BLUE HOT WATER BOTTLE,18,2.95,12471.0,Germany,2025-07-14
492950,21485,RED SPOT HEART HOT WATER BOTTLE,18,4.95,12471.0,Germany,2025-07-14
492949,71028B,SILVER BLUE EGG T-LIGHT HOLDER,96,0.38,14119.0,United Kingdom,2025-07-14
492950,21576,LETS GO SHOPPING COTTON TOTE BAG,12,2.25,12471.0,Germany,2025-07-14
492950,21577,SAVE THE PLANET COTTON TOTE BAG,12,2.25,12471.0,Germany,2025-07-14
492950,21578,WOODLAND DESIGN  COTTON TOTE BAG,18,2.25,12471.0,Germany,2025-07-14
492950,21559,STRAWBERRY LUNCHBOX WITH CUTLERY,18,2.55,12471.0,Germany,2025-07-14
492950,22353,LUNCHBOX WITH CUTLERY FAIRY CAKES ,12,2.55,12471.0,Germany,2025-07-14
492950,21429,RED GINGHAM ROSE JEWELLERY BOX,16,1.65,12471.0,Germany,2025-07-14
492951,84884A,ANT WHITE WIRE HEART SPIRAL,30,3.39,16525.0,United Kingdom,2025-07-14
492951,21624,VINTAGE UNION JACK DOORSTOP,3,5.95,16525.0,United Kingdom,2025-07-14
492951,21626,VINTAGE UNION JACK PENNANT,12,1.95,16525.0,United Kingdom,2025-07-14
492951,21621,VINTAGE UNION JACK BUNTING,10,8.5,16525.0,United Kingdom,2025-07-14
492951,21175,GIN + TONIC DIET METAL SIGN,48,1.85,16525.0,United Kingdom,2025-07-14
492951,82483,WOOD 2 DRAWER CABINET WHITE FINISH,16,4.95,16525.0,United Kingdom,2025-07-14
492951,82580,BATHROOM METAL SIGN,36,0.55,16525.0,United Kingdom,2025-07-14
492951,72484,ROSES IN WHITE HEART CANDLE ,48,0.38,16525.0,United Kingdom,2025-07-14
492952,22095,LADS ONLY TISSUE BOX,2,1.25,,United Kingdom,2025-07-14
492952,22199,FRYING PAN RED POLKADOT ,2,4.25,,United Kingdom,2025-07-14
492952,22203,MILK PAN RED RETROSPOT,2,3.75,,United Kingdom,2025-07-14
492952,22207,FRYING PAN UNION FLAG,2,4.25,,United Kingdom,2025-07-14
492952,84968F,S/16 VINTAGE SKY BLUE CUTLERY,1,12.75,,United Kingdom,2025-07-14
492952,21414,SCALLOP SHELL SOAP DISH,3,2.1,,United Kingdom,2025-07-14
492952,84968D,S/16 VINTAGE RED CUTLERY,1,12.75,,United Kingdom,2025-07-14
492952,22124,SET OF 2 TEA TOWELS PING MICROWAVE,3,2.95,,United Kingdom,2025-07-14
492952,21154,RED SPOTTY OVEN GLOVE ,2,1.25,,United Kingdom,2025-07-14
492952,21042,RED SPOTTY APRON ,1,5.95,,United Kingdom,2025-07-14
492952,21844,RETRO SPOT MUG,6,2.95,,United Kingdom,2025-07-14
492952,22109,FULL ENGLISH BREAKFAST PLATE,3,3.75,,United Kingdom,2025-07-14
492952,22107,PIZZA PLATE IN BOX,2,3.75,,United Kingdom,2025-07-14
492952,22114,HOT WATER BOTTLE TEA AND SYMPATHY,1,3.95,,United Kingdom,2025-07-14
492953,20713,JUMBO BAG OWLS,10,1.95,14505.0,United Kingdom,2025-07-14
492953,85099C,JUMBO  BAG BAROQUE BLACK WHITE,10,1.95,14505.0,United Kingdom,2025-07-14
492953,21114,LAVENDER SCENTED FABRIC HEART,10,1.25,14505.0,United Kingdom,2025-07-14
492953,21391,FRENCH EMROIDR LAVENDER SCENT HEART,6,2.1,14505.0,United Kingdom,2025-07-14
492953,21429,RED GINGHAM ROSE JEWELLERY BOX,8,1.65,14505.0,United Kingdom,2025-07-14
492953,51012C,"FEATHER DUSTER, COAL BLACK",12,1.25,14505.0,United Kingdom,2025-07-14
492953,20754,RETRO RED SPOTTY WASHING UP GLOVES,6,2.1,14505.0,United Kingdom,2025-07-14
492953,21931,JUMBO STORAGE BAG SUKI,10,1.95,14505.0,United Kingdom,2025-07-14
492953,22193,RED DINER WALL CLOCK,2,8.5,14505.0,United Kingdom,2025-07-14
492953,21172,PARTY METAL SIGN ,12,1.45,14505.0,United Kingdom,2025-07-14
492953,84755,COLOUR GLASS T-LIGHT HOLDER HANGING,16,0.65,14505.0,United Kingdom,2025-07-14
492953,22125,UNION JACK HOT WATER BOTTLE ,3,5.95,14505.0,United Kingdom,2025-07-14
492953,21479,WHITE SKULL HOT WATER BOTTLE ,4,3.75,14505.0,United Kingdom,2025-07-14
492953,22084,PAPER CHAIN KIT EMPIRE,6,2.95,14505.0,United Kingdom,2025-07-14
492953,22112,CHOCOLATE HOT WATER BOTTLE,3,4.95,14505.0,United Kingdom,2025-07-14
492953,85123A,WHITE HANGING HEART T-LIGHT HOLDER,12,2.95,14505.0,United Kingdom,2025-07-14
492953,22217,T-LIGHT HOLDER HANGING LACE,12,1.25,14505.0,United Kingdom,2025-07-14
492953,21524,SPOTTY  HOME SWEET HOME DOORMAT,2,6.75,14505.0,United Kingdom,2025-07-14
492953,48195,DOOR MAT GREEN PAISLEY ,2,6.75,14505.0,United Kingdom,2025-07-14
492953,21647,ASSORTED TUTTI FRUTTI LARGE PURSE,12,2.1,14505.0,United Kingdom,2025-07-14
492953,48116,DOOR MAT MULTICOLOUR STRIPE,2,6.75,14505.0,United Kingdom,2025-07-14
492953,22224,WHITE LOVEBIRD LANTERN,6,2.95,14505.0,United Kingdom,2025-07-14
492953,22189,CREAM HEART CARD HOLDER,4,3.95,14505.0,United Kingdom,2025-07-14
492953,79321,CHILLI LIGHTS,8,4.95,14505.0,United Kingdom,2025-07-14
492953,22087,PAPER BUNTING WHITE LACE,6,2.95,14505.0,United Kingdom,2025-07-14
492953,84029G,KNITTED UNION FLAG HOT WATER BOTTLE,4,3.75,14505.0,United Kingdom,2025-07-14
492953,84836,ZINC METAL HEART DECORATION,12,1.25,14505.0,United Kingdom,2025-07-14
492953,22114,HOT WATER BOTTLE TEA AND SYMPATHY,4,3.95,14505.0,United Kingdom,2025-07-14
492954,15056BL,EDWARDIAN PARASOL BLACK,18,5.95,17182.0,United Kingdom,2025-07-14
492954,15056N,EDWARDIAN PARASOL NATURAL,12,5.95,17182.0,United Kingdom,2025-07-14
492963,22079,RIBBON REEL HEARTS DESIGN ,2,1.65,,United Kingdom,2025-07-14
492963,22107,PIZZA PLATE IN BOX,2,3.75,,United Kingdom,2025-07-14
492963,21843,RETRO SPOT CAKE STAND,1,10.95,,United Kingdom,2025-07-14
492963,21590,KINGS CHOICE CIGAR BOX MATCHES ,1,1.25,,United Kingdom,2025-07-14
492963,22190,LOCAL CAFE MUG,2,2.1,,United Kingdom,2025-07-14
492963,20914,SET/5 RED SPOTTY LID GLASS BOWLS,1,2.95,,United Kingdom,2025-07-14
492975,85014D,PINK/BROWN DOTS RUFFLED UMBRELLA,1,5.95,17961.0,United Kingdom,2025-07-14
492975,47591C,BLUE FAIRY CAKE CHILD'S APRON,3,1.95,17961.0,United Kingdom,2025-07-14
492975,84031A,CHARLIE+LOLA RED HOT WATER BOTTLE ,3,4.65,17961.0,United Kingdom,2025-07-14
492975,20978,36 PENCILS TUBE SKULLS,1,1.25,17961.0,United Kingdom,2025-07-14
492975,20686,DOLLY MIXTURE CHILDREN'S UMBRELLA,3,3.25,17961.0,United Kingdom,2025-07-14
492975,85035B,CHOCOLATE 3 WICK MORRIS BOX CANDLE,1,4.25,17961.0,United Kingdom,2025-07-14
492975,21225,POCKET MIRROR BUTTERFLY ,1,1.25,17961.0,United Kingdom,2025-07-14
492975,21479,WHITE SKULL HOT WATER BOTTLE ,1,3.75,17961.0,United Kingdom,2025-07-14
492975,85034B,3 WHITE CHOC MORRIS BOXED CANDLES,1,4.25,17961.0,United Kingdom,2025-07-14
492980,22091,EMPIRE TISSUE BOX,1,1.25,,United Kingdom,2025-07-14
492980,22115,METAL SIGN EMPIRE TEA,1,2.95,,United Kingdom,2025-07-14
492993,18010,ASSORTED FRAGRANCE BATH CONFETTI,2,0.42,14819.0,United Kingdom,2025-07-14
492993,16046,TEATIME PEN CASE & PENS,1,0.85,14819.0,United Kingdom,2025-07-14
492993,20960,WATERMELON BATH SPONGE,1,1.25,14819.0,United Kingdom,2025-07-14
492993,20961,STRAWBERRY BATH SPONGE ,1,1.25,14819.0,United Kingdom,2025-07-14
492993,16046,TEATIME PEN CASE & PENS,1,0.85,14819.0,United Kingdom,2025-07-14
492993,72801F,S/4 FESTIVE RED DINNER CANDLES,1,1.25,14819.0,United Kingdom,2025-07-14
492993,20682,RED SPOTTY CHILDS UMBRELLA,1,3.25,14819.0,United Kingdom,2025-07-14
492993,84931A,PINK SCOTTIE DOG W FLOWER PATTERN,1,2.55,14819.0,United Kingdom,2025-07-14
492993,21034,REX CASH+CARRY JUMBO SHOPPER,12,0.95,14819.0,United Kingdom,2025-07-14
492993,85099F,JUMBO BAG STRAWBERRY,1,1.95,14819.0,United Kingdom,2025-07-14
492993,21929,JUMBO BAG PINK VINTAGE PAISLEY,1,1.95,14819.0,United Kingdom,2025-07-14
492993,20681,PINK SPOTTY CHILDS UMBRELLA,1,3.25,14819.0,United Kingdom,2025-07-14
493050,20974,12 PENCILS SMALL TUBE SKULL,3,0.65,17377.0,United Kingdom,2025-07-14
493050,84970S,HANGING HEART ZINC T-LIGHT HOLDER,3,0.85,17377.0,United Kingdom,2025-07-14
493050,85036A,GARDENIA 1 WICK MORRIS BOXED CANDLE,1,4.25,17377.0,United Kingdom,2025-07-14
493050,20615,BLUE SPOTTY PASSPORT COVER,2,2.1,17377.0,United Kingdom,2025-07-14
493050,22112,CHOCOLATE HOT WATER BOTTLE,1,4.95,17377.0,United Kingdom,2025-07-14
493050,21533,RETRO SPOT LARGE MILK JUG,1,4.95,17377.0,United Kingdom,2025-07-14
493050,85123A,WHITE HANGING HEART T-LIGHT HOLDER,1,2.95,17377.0,United Kingdom,2025-07-14
493050,22207,FRYING PAN UNION FLAG,1,4.25,17377.0,United Kingdom,2025-07-14
493050,22200,FRYING PAN PINK POLKADOT ,1,4.25,17377.0,United Kingdom,2025-07-14
493050,21593,SWALLOW CIGAR BOX MATCHES ,2,1.25,17377.0,United Kingdom,2025-07-14
493050,21577,SAVE THE PLANET COTTON TOTE BAG,1,2.25,17377.0,United Kingdom,2025-07-14
493050,85007,SET OF 3 VINTAGE TEA TIME BOXES,1,4.65,17377.0,United Kingdom,2025-07-14
493050,21491,SET OF THREE VINTAGE GIFT WRAPS,4,1.95,17377.0,United Kingdom,2025-07-14
493050,21694,SMALL REGAL  SILVER CANDLEPOT ,4,2.95,17377.0,United Kingdom,2025-07-14
493050,22138,BAKING SET 9 PIECE RETROSPOT ,1,4.95,17377.0,United Kingdom,2025-07-14
493050,21479,WHITE SKULL HOT WATER BOTTLE ,1,3.75,17377.0,United Kingdom,2025-07-14
493050,85123A,WHITE HANGING HEART T-LIGHT HOLDER,1,2.95,17377.0,United Kingdom,2025-07-14
493050,85066,CREAM SWEETHEART MINI CHEST,1,12.75,17377.0,United Kingdom,2025-07-14
493050,85031A,ROMANTIC IMAGES SCRAP BOOK SET,1,4.95,17377.0,United Kingdom,2025-07-14
493050,20699,MOUSEY LONG LEGS SOFT TOY,1,2.55,17377.0,United Kingdom,2025-07-14
493050,82482,WOODEN PICTURE FRAME WHITE FINISH,1,2.55,17377.0,United Kingdom,2025-07-14
493050,21630,FLOOR CUSHION ELEPHANT CARNIVAL,2,8.95,17377.0,United Kingdom,2025-07-14
493050,21485,RED SPOT HEART HOT WATER BOTTLE,1,4.95,17377.0,United Kingdom,2025-07-14
493050,21544,SKULLS  WATER TRANSFER TATTOOS ,2,0.85,17377.0,United Kingdom,2025-07-14
493052,85099B,JUMBO BAG RED WHITE SPOTTY ,10,1.95,14480.0,United Kingdom,2025-07-14
493052,85038,6 CHOCOLATE LOVE HEART T-LIGHTS,6,2.1,14480.0,United Kingdom,2025-07-14
493052,21832,CHOCOLATE CALCULATOR,12,1.65,14480.0,United Kingdom,2025-07-14
493052,22125,UNION JACK HOT WATER BOTTLE ,3,5.95,14480.0,United Kingdom,2025-07-14
493052,22150, 3 STRIPEY MICE FELTCRAFT,6,1.95,14480.0,United Kingdom,2025-07-14
493052,90167,BEADED LOVE HEART JEWELLERY SET,24,0.85,14480.0,United Kingdom,2025-07-14
493052,22415,WHITE TISSUE REAM,1,7.95,14480.0,United Kingdom,2025-07-14
493052,85226C,BLUE PULL BACK RACING CAR,12,0.55,14480.0,United Kingdom,2025-07-14
493052,21359,RELAX LARGE WOOD LETTERS,1,15.95,14480.0,United Kingdom,2025-07-14
493052,84884A,ANT WHITE WIRE HEART SPIRAL,10,3.95,14480.0,United Kingdom,2025-07-14
493052,22112,CHOCOLATE HOT WATER BOTTLE,3,4.95,14480.0,United Kingdom,2025-07-14
493052,21638,ASSORTED TUTTI FRUTTI NOTEBOOK,12,2.1,14480.0,United Kingdom,2025-07-14
493052,85226A,WHITE/BLUE PULL BACK RACING CAR,12,0.55,14480.0,United Kingdom,2025-07-14
493052,21649,ASSORTED TUTTI FRUTTI PHOTO FRAME,12,2.95,14480.0,United Kingdom,2025-07-14
493052,22218,CAKE STAND LACE WHITE,3,4.25,14480.0,United Kingdom,2025-07-14
493052,22147,FELTCRAFT BUTTERFLY HEARTS,12,1.45,14480.0,United Kingdom,2025-07-14
493052,21645,ASSORTED TUTTI FRUTTI ROUND BOX,12,1.65,14480.0,United Kingdom,2025-07-14
493053,21130,COLOURFUL STANDING GNOME,4,3.45,17888.0,United Kingdom,2025-07-14
493053,21365,MIRRORED WALL ART STARS,2,2.95,17888.0,United Kingdom,2025-07-14
493053,21733,RED HANGING HEART T-LIGHT HOLDER,1,2.95,17888.0,United Kingdom,2025-07-14
493053,21731,RED TOADSTOOL LED NIGHT LIGHT,3,1.65,17888.0,United Kingdom,2025-07-14
493053,85169A,IVORY LOVE BIRD CANDLE,2,1.25,17888.0,United Kingdom,2025-07-14
493053,22122,SET OF 2 FANCY FONT TEA TOWELS,2,2.95,17888.0,United Kingdom,2025-07-14
493053,90214B,"LETTER ""B"" BLING KEY RING",2,1.25,17888.0,United Kingdom,2025-07-14
493053,85048,15CM CHRISTMAS GLASS BALL 20 LIGHTS,1,7.95,17888.0,United Kingdom,2025-07-14
493053,22090,PAPER BUNTING RETRO SPOTS,2,2.95,17888.0,United Kingdom,2025-07-14
493053,21056,DOCTOR'S BAG SOFT TOY,1,8.95,17888.0,United Kingdom,2025-07-14
493053,85099B,JUMBO BAG RED WHITE SPOTTY ,1,1.95,17888.0,United Kingdom,2025-07-14
493053,21733,RED HANGING HEART T-LIGHT HOLDER,1,2.95,17888.0,United Kingdom,2025-07-14
493054,75049L,LARGE CIRCULAR MIRROR MOBILE,12,1.25,,United Kingdom,2025-07-14
493054,21621,VINTAGE UNION JACK BUNTING,3,8.5,,United Kingdom,2025-07-14
493054,84676,BATH DUCK WATERING CAN,1,2.95,,United Kingdom,2025-07-14
493055,48194,DOORMAT HEARTS,1,6.75,,United Kingdom,2025-07-14
493055,21217,RED SPOTTY ROUND CAKE TINS,1,9.95,,United Kingdom,2025-07-14
493055,21067,VINTAGE RED TEATIME MUG,6,1.25,,United Kingdom,2025-07-14
493055,90214A,"LETTER ""A"" BLING KEY RING",1,1.25,,United Kingdom,2025-07-14
493055,90214K,"LETTER ""K"" BLING KEY RING",1,1.25,,United Kingdom,2025-07-14
493055,90214P,"LETTER ""P"" BLING KEY RING",1,1.25,,United Kingdom,2025-07-14
493064,21415,CLAM SHELL SMALL ,1,2.1,,United Kingdom,2025-07-14
493064,84499,BLACK FLOWER CANDLE PLATE,1,0.85,,United Kingdom,2025-07-14
C493065,79000,MOROCCAN TEA GLASS,-144,0.65,14293.0,United Kingdom,2025-07-14
493064,21416,CLAM SHELL LARGE,1,3.75,,United Kingdom,2025-07-14
493066,21877,HOME SWEET HOME MUG,1,1.25,,United Kingdom,2025-07-14
493066,84279B,CHERRY BLOSSOM DECORATIVE FLASK,1,3.75,,United Kingdom,2025-07-14
493066,21534,DAIRY MAID LARGE MILK JUG,1,4.95,,United Kingdom,2025-07-14
493066,21529,RETRO SPOT CERAMIC TOASTRACK,1,3.45,,United Kingdom,2025-07-14
493066,85232B,SET/3 RUSSIAN DOLL STACKING TINS,1,4.95,,United Kingdom,2025-07-14
493066,79163,BLACK CHAMPAGNE GLASS,4,1.65,,United Kingdom,2025-07-14
493066,21845,DAIRY MAID STRIPE MUG,1,2.95,,United Kingdom,2025-07-14
493066,21535,RETRO SPOT SMALL MILK JUG,1,2.55,,United Kingdom,2025-07-14
493066,21068,VINTAGE BILLBOARD LOVE/HATE MUG,1,1.25,,United Kingdom,2025-07-14
493066,21540,DAIRY MAID CERAMIC BUTTER DISH,1,4.25,,United Kingdom,2025-07-14
493066,22309,TEA COSY RED  STRIPE,1,2.55,,United Kingdom,2025-07-14
493066,22269,EGG CUP NATURAL CHICKEN,1,1.25,,United Kingdom,2025-07-14
493066,37506,NEW ENGLAND MILK JUG W GIFT BOX,1,5.95,,United Kingdom,2025-07-14
493066,85135B,BLUE DRAGONFLY HELICOPTER,1,7.95,,United Kingdom,2025-07-14
493066,22228,BUNNY WOODEN PAINTED WITH BIRD ,1,0.85,,United Kingdom,2025-07-14
493066,85078,SCANDINAVIAN 3 HEARTS NAPKIN RING,1,0.65,,United Kingdom,2025-07-14
493066,84937,KASHMIR FOLKART TUMBLERS,6,2.1,,United Kingdom,2025-07-14
493066,22348,TEA BAG PLATE RED SPOTTY ,1,0.85,,United Kingdom,2025-07-14
493066,22243,"HOOK, 5 HANGER ,MAGIC TOADSTOOL RED",1,1.65,,United Kingdom,2025-07-14
493066,22286,"DECORATION , WOBBLY RABBIT , METAL ",1,1.65,,United Kingdom,2025-07-14
493066,22287,"DECORATION , WOBBLY CHICKEN, METAL ",1,1.65,,United Kingdom,2025-07-14
493066,21350,GINGHAM HEART WREATH,1,2.95,,United Kingdom,2025-07-14
493066,21553,CERAMIC BIRDHOUSE FINCH BLUE  LARGE,1,5.95,,United Kingdom,2025-07-14
493066,21067,VINTAGE RED TEATIME MUG,1,1.25,,United Kingdom,2025-07-14
493066,21527,RETRO SPOT TRADITIONAL TEAPOT ,1,7.95,,United Kingdom,2025-07-14
493066,22072,TEA CUP AND SAUCER RETRO SPOT,1,3.75,,United Kingdom,2025-07-14
493066,22185,SLATE TILE NATURAL HANGING,3,1.65,,United Kingdom,2025-07-14
493066,22097,SWALLOW SQUARE TISSUE BOX,1,1.25,,United Kingdom,2025-07-14
493066,21738,COSY SLIPPER SHOES SMALL  RED ,1,2.95,,United Kingdom,2025-07-14
493066,21687,SILVER PLATE CANDLE BOWL LARGE,1,3.75,,United Kingdom,2025-07-14
493066,85178,VICTORIAN SEWING KIT,2,1.25,,United Kingdom,2025-07-14
493066,22028,PENNY FARTHING BIRTHDAY CARD,12,0.42,,United Kingdom,2025-07-14
493066,84247K,"FOLK ART GREETING CARD,pack/12",1,2.95,,United Kingdom,2025-07-14
493066,21506,"FANCY FONT BIRTHDAY CARD, ",12,0.42,,United Kingdom,2025-07-14
493066,21731,RED TOADSTOOL LED NIGHT LIGHT,3,1.65,,United Kingdom,2025-07-14
493066,84519B,CARROT CHARLIE+LOLA COASTER SET,1,2.95,,United Kingdom,2025-07-14
493066,84519A,TOMATO CHARLIE+LOLA COASTER SET,1,2.95,,United Kingdom,2025-07-14
493066,21533,RETRO SPOT LARGE MILK JUG,1,4.95,,United Kingdom,2025-07-14
493066,21544,SKULLS  WATER TRANSFER TATTOOS ,1,0.85,,United Kingdom,2025-07-14
493066,21164,HOME SWEET HOME METAL SIGN ,1,2.95,,United Kingdom,2025-07-14
493066,M,Manual,1,0.85,,United Kingdom,2025-07-14
493066,21411,GINGHAM HEART  DOORSTOP RED,1,4.25,,United Kingdom,2025-07-14
493066,21411,GINGHAM HEART  DOORSTOP RED,1,4.25,,United Kingdom,2025-07-14
493066,79067,CORONA MEXICAN TRAY,1,3.75,,United Kingdom,2025-07-14
493066,84520B,PACK 20 ENGLISH ROSE PAPER NAPKINS,1,0.85,,United Kingdom,2025-07-14
493066,21080,SET/20 RED SPOTTY PAPER NAPKINS ,2,0.85,,United Kingdom,2025-07-14
493066,22199,FRYING PAN RED POLKADOT ,1,4.25,,United Kingdom,2025-07-14
493066,21844,RETRO SPOT MUG,3,2.95,,United Kingdom,2025-07-14
493066,21843,RETRO SPOT CAKE STAND,1,10.95,,United Kingdom,2025-07-14
493066,21543,BUTTERFLY WATER TRANSFER TATTOOS ,1,0.85,,United Kingdom,2025-07-14
493066,22301,COFFEE MUG CAT + BIRD DESIGN,6,2.55,,United Kingdom,2025-07-14
493066,22229,BUNNY WOODEN PAINTED WITH FLOWER ,1,0.85,,United Kingdom,2025-07-14
493066,21556,CERAMIC STRAWBERRY MONEY BOX,1,2.55,,United Kingdom,2025-07-14
493066,21498,RED SPOTS  WRAP ,25,0.42,,United Kingdom,2025-07-14
493066,21027,NINJA RABBIT PINK,1,1.25,,United Kingdom,2025-07-14
493066,21841,BABY MOUSE RED GINGHAM DRESS,1,4.25,,United Kingdom,2025-07-14
493066,21027,NINJA RABBIT PINK,1,1.25,,United Kingdom,2025-07-14
493066,82581,TOILET METAL SIGN,1,0.55,,United Kingdom,2025-07-14
493066,22292,"SPRING DEC , HANGING CHICK  YELLOW",1,1.45,,United Kingdom,2025-07-14
493066,84832,ZINC WILLIE WINKIE  CANDLE STICK,2,0.85,,United Kingdom,2025-07-14
493066,22268,EASTER DECORATION SITTING BUNNY,1,0.85,,United Kingdom,2025-07-14
493066,22269,EGG CUP NATURAL CHICKEN,1,1.25,,United Kingdom,2025-07-14
493066,21027,NINJA RABBIT PINK,1,1.25,,United Kingdom,2025-07-14
493066,21026,SPACE OWL,2,1.25,,United Kingdom,2025-07-14
493066,84838,ANT WHITE HIGH RISE BIRD BOX,1,8.5,,United Kingdom,2025-07-14
493066,85089,CANDY SPOT BUNNY,1,2.95,,United Kingdom,2025-07-14
493066,21768,WALL MOUNTED VINTAGE ORGANISER,1,14.95,,United Kingdom,2025-07-14
493066,84816,DANISH ROSE BEDSIDE CABINET,1,39.95,,United Kingdom,2025-07-14
493066,21116,OWL DOORSTOP,1,4.95,,United Kingdom,2025-07-14
493066,84802A,WHITE ANEMONE ARTIFICIAL FLOWER,6,1.69,,United Kingdom,2025-07-14
493066,21671,RED SPOT CERAMIC DRAWER KNOB,6,1.25,,United Kingdom,2025-07-14
493066,21672,WHITE SPOT RED CERAMIC DRAWER KNOB,6,1.25,,United Kingdom,2025-07-14
493066,21218,RED SPOTTY BISCUIT TIN,1,3.75,,United Kingdom,2025-07-14
493066,21070,VINTAGE BILLBOARD MUG ,1,1.25,,United Kingdom,2025-07-14
493066,21440,12 MINI TOADSTOOL PEGS,1,1.25,,United Kingdom,2025-07-14
493066,21135,VICTORIAN  METAL POSTCARD SPRING,3,1.69,,United Kingdom,2025-07-14
493066,21407,BROWN CHECK CAT DOORSTOP ,1,4.25,,United Kingdom,2025-07-14
493066,21410,COUNTRY COTTAGE  DOORSTOP GREEN,1,4.25,,United Kingdom,2025-07-14
493066,84801B,WHITE HYDRANGEA ART FLOWER,6,2.1,,United Kingdom,2025-07-14
493066,85088,CANDY SPOT HAND BAG,1,2.1,,United Kingdom,2025-07-14
493066,21121,SET/10 RED SPOTTY PARTY CANDLES,1,1.25,,United Kingdom,2025-07-14
493066,21553,CERAMIC BIRDHOUSE FINCH BLUE  LARGE,1,5.95,,United Kingdom,2025-07-14
493066,75013B,"STRING OF 8 BUTTERFLIES,PINK",2,1.65,,United Kingdom,2025-07-14
493066,22125,UNION JACK HOT WATER BOTTLE ,1,5.95,,United Kingdom,2025-07-14
493066,22098,BOUDOIR SQUARE TISSUE BOX,1,1.25,,United Kingdom,2025-07-14
493066,22094,RED POLKA DOT TISSUE BOX,1,1.25,,United Kingdom,2025-07-14
493066,84773,RED ROSE AND LACE C/COVER,1,2.95,,United Kingdom,2025-07-14
493066,85123A,WHITE HANGING HEART T-LIGHT HOLDER,1,2.95,,United Kingdom,2025-07-14
493066,82585,SWEET VALENCIA CANDLE+CUP,1,1.25,,United Kingdom,2025-07-14
493066,51008,AFGHAN SLIPPER SOCK PAIR,1,3.45,,United Kingdom,2025-07-14
493066,21837,CROSS STITCH ALPHABET CUSHION COVER,1,5.95,,United Kingdom,2025-07-14
493066,21485,RED SPOT HEART HOT WATER BOTTLE,1,4.95,,United Kingdom,2025-07-14
493066,20718,RED SPOTTY SHOPPER BAG,1,1.25,,United Kingdom,2025-07-14
493066,21002,ROSE DU SUD DRAWSTRING BAG,1,4.25,,United Kingdom,2025-07-14
493066,21625,VINTAGE UNION JACK APRON,1,6.95,,United Kingdom,2025-07-14
493066,84984D,ORIENTAL RED C/COVER ,1,4.65,,United Kingdom,2025-07-14
493066,21756,BATH BUILDING BLOCK WORD,1,5.95,,United Kingdom,2025-07-14
493066,21754,HOME BUILDING BLOCK WORD,1,5.95,,United Kingdom,2025-07-14
493066,22120,WELCOME  WOODEN BLOCK LETTERS,1,9.95,,United Kingdom,2025-07-14
493066,82580,BATHROOM METAL SIGN,1,0.55,,United Kingdom,2025-07-14
493066,21622,VINTAGE UNION JACK CUSHION COVER,1,4.95,,United Kingdom,2025-07-14
493066,20717,STRAWBERRY SHOPPER BAG,1,1.25,,United Kingdom,2025-07-14
493066,46307,ROSES BLUE BASE CUSHION COVER ,1,1.65,,United Kingdom,2025-07-14
493066,84592,CROCHET ROSE PURSE WITH SUEDE BACK,1,2.95,,United Kingdom,2025-07-14
493067,85185F,LION SOCK PUPPET,1,2.95,,United Kingdom,2025-07-14
493067,21645,ASSORTED TUTTI FRUTTI ROUND BOX,1,1.65,,United Kingdom,2025-07-14
493067,84032A,CHARLIE+LOLA PINK HOT WATER BOTTLE,1,2.95,,United Kingdom,2025-07-14
493067,21645,ASSORTED TUTTI FRUTTI ROUND BOX,1,1.65,,United Kingdom,2025-07-14
493067,21741,COSY SLIPPER SHOES LARGE GREEN,1,2.95,,United Kingdom,2025-07-14
493067,85185B,PINK HORSE SOCK PUPPET,1,2.95,,United Kingdom,2025-07-14
493067,85129D,BEADED CRYSTAL HEART PINK SMALL,1,1.25,,United Kingdom,2025-07-14
493067,21826,EIGHT PIECE DINOSAUR SET,1,1.25,,United Kingdom,2025-07-14
493067,21357,TOAST ITS - DINOSAUR,1,1.25,,United Kingdom,2025-07-14
493067,21222,SET/4 BADGES BEETLES,1,1.25,,United Kingdom,2025-07-14
493067,85129A,"WHITE PEARL BEADED HEART, SMALL",1,1.25,,United Kingdom,2025-07-14
493067,84032A,CHARLIE+LOLA PINK HOT WATER BOTTLE,1,2.95,,United Kingdom,2025-07-14
493067,51008,AFGHAN SLIPPER SOCK PAIR,2,3.45,,United Kingdom,2025-07-14
493067,21356,TOAST ITS - FAIRY FLOWER,3,1.25,,United Kingdom,2025-07-14
493067,17013F,ORIGAMI SANDLEWOOD INCENSE IN TUBE,1,1.65,,United Kingdom,2025-07-14
493067,21357,TOAST ITS - DINOSAUR,1,1.25,,United Kingdom,2025-07-14
493067,84327A,PINK JUMPER LARRY THE LAMB,1,2.1,,United Kingdom,2025-07-14
493067,35096B,RED VICTORIAN FABRIC HEART BOX,1,0.42,,United Kingdom,2025-07-14
493067,85123A,WHITE HANGING HEART T-LIGHT HOLDER,1,2.95,,United Kingdom,2025-07-14
493067,85129D,BEADED CRYSTAL HEART PINK SMALL,1,1.25,,United Kingdom,2025-07-14
493067,22319,HAIRCLIPS FORTIES FABRIC ASSORTED,12,0.65,,United Kingdom,2025-07-14
493067,47566B,TEA TIME PARTY BUNTING,2,4.65,,United Kingdom,2025-07-14
493067,21447,12 IVORY ROSE PEG PLACE SETTINGS,1,1.25,,United Kingdom,2025-07-14
493067,20969,RED FLORAL FELTCRAFT SHOULDER BAG,1,3.75,,United Kingdom,2025-07-14
493067,37508,NEW ENGLAND CERAMIC CAKE SERVER,1,2.55,,United Kingdom,2025-07-14
493067,17014A,ORIGAMI VANILLA INCENSE CONES,1,1.65,,United Kingdom,2025-07-14
493067,21223,SET/4 BADGES WOODLAND ANIMAL,1,1.25,,United Kingdom,2025-07-14
493067,84029G,KNITTED UNION FLAG HOT WATER BOTTLE,1,3.75,,United Kingdom,2025-07-14
493067,21645,ASSORTED TUTTI FRUTTI ROUND BOX,1,1.65,,United Kingdom,2025-07-14
493067,85185B,PINK HORSE SOCK PUPPET,1,2.95,,United Kingdom,2025-07-14
493067,22321,BIRD DECORATION RED SPOT,12,0.85,,United Kingdom,2025-07-14
493067,84032B,CHARLIE + LOLA RED HOT WATER BOTTLE,1,2.95,,United Kingdom,2025-07-14
493067,84580,MOUSE TOY WITH PINK T-SHIRT,1,3.75,,United Kingdom,2025-07-14
493067,21413,PERIWINKLE T-LIGHT HOLDER,1,1.25,,United Kingdom,2025-07-14
493067,35096B,RED VICTORIAN FABRIC HEART BOX,1,0.42,,United Kingdom,2025-07-14
493067,35096B,RED VICTORIAN FABRIC HEART BOX,1,0.42,,United Kingdom,2025-07-14
C493068,84816,DANISH ROSE BEDSIDE CABINET,-1,21.0,,United Kingdom,2025-07-14
