Invoice,StockCode,Description,Quantity,Price,Customer ID,Country,InvoiceDate
512514,47591B,SCOTTIES DES CHILD'S APRON,1,1.65,14606.0,United Kingdom,2025-11-29
512514,21974,SET OF 36 PAISLEY FLOWER DOILIES,1,1.45,14606.0,United Kingdom,2025-11-29
512514,21581,SKULLS  DESIGN  COTTON TOTE BAG,1,2.25,14606.0,United Kingdom,2025-11-29
512514,22514,CHILDS GARDEN SPADE BLUE,1,2.1,14606.0,United Kingdom,2025-11-29
512514,22273,FELTCRAFT DOLL MOLLY,1,2.95,14606.0,United Kingdom,2025-11-29
512514,22150,3 STRIPEY MICE FELTCRAFT,1,1.95,14606.0,United Kingdom,2025-11-29
512514,21790,VINTAGE SNAP CARDS,1,0.85,14606.0,United Kingdom,2025-11-29
512514,85123A,WHITE HANGING HEART T-LIGHT HOLDER,1,2.95,14606.0,United Kingdom,2025-11-29
512514,82615,PINK MARSHMALLOW SCARF KNITTING KIT,1,2.95,14606.0,United Kingdom,2025-11-29
512514,85217,ASSORTED ICE CREAM FRIDGE MAGNETS,6,0.65,14606.0,United Kingdom,2025-11-29
512514,84212,"ASSORTED FLOWER COLOUR ""LEIS""",30,0.65,14606.0,United Kingdom,2025-11-29
512514,22333,RETRO SPORT PARTY BAG + STICKER SET,4,1.65,14606.0,United Kingdom,2025-11-29
512514,22533,MAGIC DRAWING SLATE BAKE A CAKE ,1,0.42,14606.0,United Kingdom,2025-11-29
512514,22398,MAGNETS PACK OF 4 SWALLOWS,1,1.25,14606.0,United Kingdom,2025-11-29
512514,22057,CERAMIC PLATE STRAWBERRY DESIGN,1,1.49,14606.0,United Kingdom,2025-11-29
512514,22399,MAGNETS PACK OF 4 CHILDHOOD MEMORY,1,1.25,14606.0,United Kingdom,2025-11-29
512514,22139,RETRO SPOT TEA SET CERAMIC 11 PC ,1,4.95,14606.0,United Kingdom,2025-11-29
512514,21527,RED RETROSPOT TRADITIONAL TEAPOT ,1,7.95,14606.0,United Kingdom,2025-11-29
512514,22260,FELT EGG COSY BLUE RABBIT ,2,0.85,14606.0,United Kingdom,2025-11-29
512514,21484,CHICK GREY HOT WATER BOTTLE,1,3.45,14606.0,United Kingdom,2025-11-29
512514,21844,RED RETROSPOT MUG,2,2.95,14606.0,United Kingdom,2025-11-29
512514,20985,HEART CALCULATOR,1,1.25,14606.0,United Kingdom,2025-11-29
512514,22320,BIRDS MOBILE VINTAGE DESIGN,1,5.95,14606.0,United Kingdom,2025-11-29
512514,20914,SET/5 RED SPOTTY LID GLASS BOWLS,1,2.95,14606.0,United Kingdom,2025-11-29
512514,20828,GLITTER BUTTERFLY CLIPS,1,2.55,14606.0,United Kingdom,2025-11-29
C512515,20914,SET/5 RED SPOTTY LID GLASS BOWLS,-1,2.95,16550.0,United Kingdom,2025-11-29
C512515,22617,BAKING SET SPACEBOY DESIGN,-1,4.95,16550.0,United Kingdom,2025-11-29
512516,48138,DOOR MAT UNION FLAG,6,7.49,14978.0,United Kingdom,2025-11-29
512516,22275,WEEKEND BAG VINTAGE ROSE PAISLEY,1,8.5,14978.0,United Kingdom,2025-11-29
512516,48185,DOOR MAT FAIRY CAKE,2,7.49,14978.0,United Kingdom,2025-11-29
512516,21796,SET OF 3 RED STRIPE BASKETS,1,12.75,14978.0,United Kingdom,2025-11-29
512516,21795,SET OF 3 BLUE STRIPE BASKET,1,12.75,14978.0,United Kingdom,2025-11-29
512516,21531,RED RETROSPOT SUGAR JAM BOWL,2,2.55,14978.0,United Kingdom,2025-11-29
512516,21529,RED RETROSPOT TOASTRACK,2,3.45,14978.0,United Kingdom,2025-11-29
512516,21535,RED RETROSPOT SMALL MILK JUG,2,2.55,14978.0,United Kingdom,2025-11-29
512516,21533,RETRO SPOT LARGE MILK JUG,1,4.95,14978.0,United Kingdom,2025-11-29
512516,21844,RED RETROSPOT MUG,6,2.95,14978.0,United Kingdom,2025-11-29
512516,21539,RED RETROSPOT BUTTER DISH,2,4.95,14978.0,United Kingdom,2025-11-29
512516,21291,SMALL SPOTTY CHOCOLATE GIFT BAG ,16,0.85,14978.0,United Kingdom,2025-11-29
512516,46000M,POLYESTER FILLER PAD 45x45cm,6,1.55,14978.0,United Kingdom,2025-11-29
512516,21527,RED RETROSPOT TRADITIONAL TEAPOT ,2,7.95,14978.0,United Kingdom,2025-11-29
512516,22501,PICNIC BASKET WICKER LARGE,2,9.95,14978.0,United Kingdom,2025-11-29
512516,22501,PICNIC BASKET WICKER LARGE,2,9.95,14978.0,United Kingdom,2025-11-29
512516,48194,DOOR MAT HEARTS,2,7.49,14978.0,United Kingdom,2025-11-29
512516,48116,DOOR MAT MULTICOLOUR STRIPE,2,7.49,14978.0,United Kingdom,2025-11-29
512516,48187,DOOR MAT NEW ENGLAND,2,7.49,14978.0,United Kingdom,2025-11-29
512516,20685,DOOR MAT RED SPOT,2,7.49,14978.0,United Kingdom,2025-11-29
512516,21622,VINTAGE UNION JACK CUSHION COVER,6,4.95,14978.0,United Kingdom,2025-11-29
512516,48173C,DOOR MAT BLACK FLOCK ,2,7.49,14978.0,United Kingdom,2025-11-29
512516,79067,CORONA MEXICAN TRAY,3,3.75,14978.0,United Kingdom,2025-11-29
512516,21621,VINTAGE UNION JACK BUNTING,1,8.5,14978.0,United Kingdom,2025-11-29
512516,22357,KINGS CHOICE BISCUIT TIN,2,4.25,14978.0,United Kingdom,2025-11-29
512516,22612,TEA COSY VINTAGE UNION JACK,2,3.75,14978.0,United Kingdom,2025-11-29
512516,21621,VINTAGE UNION JACK BUNTING,5,8.5,14978.0,United Kingdom,2025-11-29
512516,21115,ROSE CARAVAN DOORSTOP,2,6.75,14978.0,United Kingdom,2025-11-29
512517,22183,CAKE STAND VICTORIAN FILIGREE MED,4,6.75,13552.0,United Kingdom,2025-11-29
512517,22170,PICTURE FRAME WOOD TRIPLE PORTRAIT,4,6.75,13552.0,United Kingdom,2025-11-29
512517,22294,HEART FILIGREE DOVE  SMALL,24,1.25,13552.0,United Kingdom,2025-11-29
512517,84946,ANTIQUE SILVER TEA GLASS ETCHED,12,1.25,13552.0,United Kingdom,2025-11-29
512517,84947,ANTIQUE SILVER TEA GLASS ENGRAVED,12,1.25,13552.0,United Kingdom,2025-11-29
512517,22182,CAKE STAND VICTORIAN FILIGREE SMALL,4,4.95,13552.0,United Kingdom,2025-11-29
512517,20751,FUNKY WASHING UP GLOVES ASSORTED,12,2.1,13552.0,United Kingdom,2025-11-29
512517,22501,PICNIC BASKET WICKER LARGE,6,9.95,13552.0,United Kingdom,2025-11-29
512517,22055,MINI CAKE STAND  HANGING STRAWBERY,16,1.65,13552.0,United Kingdom,2025-11-29
512517,85178,VICTORIAN SEWING KIT,12,1.25,13552.0,United Kingdom,2025-11-29
512517,22246,"GARLAND, MAGIC GARDEN 1.8M",12,1.95,13552.0,United Kingdom,2025-11-29
512517,22423,REGENCY CAKESTAND 3 TIER,16,10.95,13552.0,United Kingdom,2025-11-29
512517,22558,CLOTHES PEGS RETROSPOT PACK 24 ,24,1.25,13552.0,United Kingdom,2025-11-29
512517,22348,TEA BAG PLATE RED SPOTTY ,12,0.85,13552.0,United Kingdom,2025-11-29
512518,84968A,S/16 VINTAGE ROSE CUTLERY,4,12.75,14543.0,United Kingdom,2025-11-29
512518,84968F,S/16 VINTAGE SKY BLUE CUTLERY,4,12.75,14543.0,United Kingdom,2025-11-29
512518,84968C,S/16 VINTAGE PISTACHIO CUTLERY,4,12.75,14543.0,United Kingdom,2025-11-29
512518,84968D,S/16 VINTAGE RED CUTLERY,4,12.75,14543.0,United Kingdom,2025-11-29
512518,22612,TEA COSY VINTAGE UNION JACK,12,3.75,14543.0,United Kingdom,2025-11-29
512518,84968B,S/16 VINTAGE IVORY CUTLERY,8,12.75,14543.0,United Kingdom,2025-11-29
512519,48173C,DOOR MAT BLACK FLOCK ,1,7.49,15040.0,United Kingdom,2025-11-29
512520,20749,ASSORTED COLOUR MINI CASES,12,6.35,13854.0,United Kingdom,2025-11-29
512520,84789,ENCHANTED BIRD PLANT CAGE,16,2.95,13854.0,United Kingdom,2025-11-29
512520,22621,TRADITIONAL KNITTING NANCY,12,1.45,13854.0,United Kingdom,2025-11-29
512521,78033,,-10,0.0,,United Kingdom,2025-11-29
512522,84879,ASSORTED COLOUR BIRD ORNAMENT,16,1.69,16550.0,United Kingdom,2025-11-29
512522,21911,GARDEN METAL SIGN ,3,1.65,16550.0,United Kingdom,2025-11-29
512522,21171,BATHROOM METAL SIGN ,3,1.45,16550.0,United Kingdom,2025-11-29
512522,21172,PARTY METAL SIGN ,3,1.45,16550.0,United Kingdom,2025-11-29
512522,22198,LARGE POPCORN HOLDER ,6,1.65,16550.0,United Kingdom,2025-11-29
512522,82580,BATHROOM METAL SIGN,5,0.55,16550.0,United Kingdom,2025-11-29
512522,82578,KITCHEN METAL SIGN,5,0.55,16550.0,United Kingdom,2025-11-29
512522,21063,PARTY INVITES JAZZ HEARTS,4,0.85,16550.0,United Kingdom,2025-11-29
512522,21240,BLUE  SPOTTY CUP,16,0.85,16550.0,United Kingdom,2025-11-29
512522,82581,TOILET METAL SIGN,5,0.55,16550.0,United Kingdom,2025-11-29
512522,22328,ROUND SNACK BOXES SET OF 4 FRUITS ,3,2.95,16550.0,United Kingdom,2025-11-29
512522,21974,SET OF 36 PAISLEY FLOWER DOILIES,10,1.45,16550.0,United Kingdom,2025-11-29
512522,84991,60 TEATIME FAIRY CAKE CASES,24,0.55,16550.0,United Kingdom,2025-11-29
512522,21977,PACK OF 60 PINK PAISLEY CAKE CASES,24,0.55,16550.0,United Kingdom,2025-11-29
512522,21975,PACK OF 60 DINOSAUR CAKE CASES,24,0.55,16550.0,United Kingdom,2025-11-29
512522,84988,SET OF 72 PINK HEART PAPER DOILIES,10,1.45,16550.0,United Kingdom,2025-11-29
512522,20751,FUNKY WASHING UP GLOVES ASSORTED,8,2.1,16550.0,United Kingdom,2025-11-29
512522,20754,RETRO RED SPOTTY WASHING UP GLOVES,4,2.1,16550.0,United Kingdom,2025-11-29
512522,22197,SMALL POPCORN HOLDER,15,0.85,16550.0,United Kingdom,2025-11-29
512522,21241,GREEN SPOTTY CUP,8,0.85,16550.0,United Kingdom,2025-11-29
512522,20668,DISCO BALL CHRISTMAS DECORATION,96,0.12,16550.0,United Kingdom,2025-11-29
512522,84692,BOX OF 24 COCKTAIL PARASOLS,25,0.42,16550.0,United Kingdom,2025-11-29
512522,21328,BALLOONS  WRITING SET ,1,1.65,16550.0,United Kingdom,2025-11-29
512522,79320,FLAMINGO LIGHTS,3,4.95,16550.0,United Kingdom,2025-11-29
512522,21239,PINK  SPOTTY CUP,16,0.85,16550.0,United Kingdom,2025-11-29
512522,44234,ASSORTED CIRCULAR MOBILE,20,0.21,16550.0,United Kingdom,2025-11-29
512522,22132,RED LOVE HEART SHAPE CUP,10,0.85,16550.0,United Kingdom,2025-11-29
512522,22624,IVORY KITCHEN SCALES,4,8.5,16550.0,United Kingdom,2025-11-29
512522,22627,MINT KITCHEN SCALES,4,8.5,16550.0,United Kingdom,2025-11-29
512522,20677,PINK SPOTTY BOWL,8,1.25,16550.0,United Kingdom,2025-11-29
512522,22617,BAKING SET SPACEBOY DESIGN,2,4.95,16550.0,United Kingdom,2025-11-29
512522,21212,PACK OF 72 RETRO SPOT CAKE CASES,24,0.55,16550.0,United Kingdom,2025-11-29
512522,21213,PACK OF 72 SKULL CAKE CASES,24,0.55,16550.0,United Kingdom,2025-11-29
512522,84992,72 SWEETHEART FAIRY CAKE CASES,24,0.55,16550.0,United Kingdom,2025-11-29
512522,21558,SKULL LUNCH BOX WITH CUTLERY ,6,2.55,16550.0,United Kingdom,2025-11-29
512522,22352,LUNCH BOX WITH CUTLERY RETROSPOT ,6,2.55,16550.0,United Kingdom,2025-11-29
512522,22353,LUNCH BOX WITH CUTLERY FAIRY CAKES ,6,2.55,16550.0,United Kingdom,2025-11-29
512522,21559,STRAWBERRY LUNCH BOX WITH CUTLERY,6,2.55,16550.0,United Kingdom,2025-11-29
512522,20677,PINK SPOTTY BOWL,8,1.25,16550.0,United Kingdom,2025-11-29
512522,21242,RED SPOTTY PLATE ,8,1.69,16550.0,United Kingdom,2025-11-29
512522,21245,GREEN  SPOTTY PLATE ,8,1.69,16550.0,United Kingdom,2025-11-29
512522,20675,BLUE SPOTTY BOWL,16,1.25,16550.0,United Kingdom,2025-11-29
512522,22149,FELTCRAFT 6 FLOWER FRIENDS,4,2.1,16550.0,United Kingdom,2025-11-29
512522,21682,LARGE MEDINA STAMPED METAL BOWL ,4,4.95,16550.0,United Kingdom,2025-11-29
512522,21243,PINK  SPOTTY PLATE ,16,1.69,16550.0,United Kingdom,2025-11-29
512522,79000,MOROCCAN TEA GLASS,12,0.85,16550.0,United Kingdom,2025-11-29
512522,21684,SMALL MEDINA STAMPED METAL BOWL ,12,0.85,16550.0,United Kingdom,2025-11-29
512522,20674,GREEN SPOTTY BOWL,8,1.25,16550.0,United Kingdom,2025-11-29
512522,21683,MEDIUM MEDINA STAMPED METAL BOWL ,6,2.95,16550.0,United Kingdom,2025-11-29
512523,22424,ENAMEL BREAD BIN CREAM,2,12.75,13769.0,United Kingdom,2025-11-29
512523,71477,COLOUR GLASS. STAR T-LIGHT HOLDER,24,2.75,13769.0,United Kingdom,2025-11-29
512523,71053,WHITE METAL LANTERN,4,3.75,13769.0,United Kingdom,2025-11-29
512523,84949,SILVER HANGING T-LIGHT HOLDER,6,1.65,13769.0,United Kingdom,2025-11-29
512523,84884A,ANT WHITE WIRE HEART SPIRAL,5,3.95,13769.0,United Kingdom,2025-11-29
512523,21907,I'M ON HOLIDAY METAL SIGN,12,2.1,13769.0,United Kingdom,2025-11-29
512523,85150,LADIES & GENTLEMEN METAL SIGN,6,2.55,13769.0,United Kingdom,2025-11-29
512523,22188,BLACK HEART CARD HOLDER,4,3.95,13769.0,United Kingdom,2025-11-29
512523,84945,MULTI COLOUR SILVER T-LIGHT HOLDER,12,0.85,13769.0,United Kingdom,2025-11-29
512523,84836,ZINC METAL HEART DECORATION,12,1.25,13769.0,United Kingdom,2025-11-29
512523,21324,HANGING MEDINA LANTERN SMALL,6,2.95,13769.0,United Kingdom,2025-11-29
512523,21323,HANGING MEDINA LANTERN LARGE,3,4.25,13769.0,United Kingdom,2025-11-29
512523,22470,HEART OF WICKER LARGE,12,2.95,13769.0,United Kingdom,2025-11-29
512523,22469,HEART OF WICKER SMALL,12,1.65,13769.0,United Kingdom,2025-11-29
512523,22112,CHOCOLATE HOT WATER BOTTLE,3,4.95,13769.0,United Kingdom,2025-11-29
C512524,22618,COOKING SET RETROSPOT,-1,9.95,16037.0,United Kingdom,2025-11-29
512525,22371,AIRLINE BAG VINTAGE TOKYO 78,2,5.45,17448.0,United Kingdom,2025-11-29
512525,20681,PINK SPOTTY CHILDS UMBRELLA,6,2.75,17448.0,United Kingdom,2025-11-29
512525,22355,"CHARLOTTE BAG , SUKI DESIGN",10,0.72,17448.0,United Kingdom,2025-11-29
512525,16161P,WRAP ENGLISH ROSE ,25,0.34,17448.0,United Kingdom,2025-11-29
C512526,21528,DAIRY MAID TRADITIONAL TEAPOT ,-1,6.95,14210.0,United Kingdom,2025-11-29
512525,82483,WOOD 2 DRAWER CABINET WHITE FINISH,3,4.95,17448.0,United Kingdom,2025-11-29
512525,22185,SLATE TILE NATURAL HANGING,12,1.45,17448.0,United Kingdom,2025-11-29
512525,21915,RED  HARMONICA IN BOX ,12,1.06,17448.0,United Kingdom,2025-11-29
512525,22078,RIBBON REEL LACE DESIGN ,10,1.85,17448.0,United Kingdom,2025-11-29
512525,85049B,LUSH GREENS RIBBONS,12,1.06,17448.0,United Kingdom,2025-11-29
512525,16161U,"WRAP,SUKI AND FRIENDS",25,0.34,17448.0,United Kingdom,2025-11-29
512525,21914,BLUE HARMONICA IN BOX ,12,1.06,17448.0,United Kingdom,2025-11-29
512525,21257,VICTORIAN SEWING BOX MEDIUM,2,6.95,17448.0,United Kingdom,2025-11-29
512525,22076,6 RIBBONS EMPIRE  ,12,1.45,17448.0,United Kingdom,2025-11-29
512525,21918,SET 12 KIDS COLOUR  CHALK STICKS,24,0.36,17448.0,United Kingdom,2025-11-29
512525,84670,JAPANESE CROCHETED ANIMAL,24,0.36,17448.0,United Kingdom,2025-11-29
512525,22047,EMPIRE GIFT WRAP,25,0.34,17448.0,United Kingdom,2025-11-29
512525,22622,BOX OF VINTAGE ALPHABET BLOCKS,2,8.5,17448.0,United Kingdom,2025-11-29
512525,20724,RED SPOTTY CHARLOTTE BAG,10,0.72,17448.0,United Kingdom,2025-11-29
512525,85049H,URBAN BLACK RIBBONS ,12,1.06,17448.0,United Kingdom,2025-11-29
512525,21892,TRADITIONAL WOODEN CATCH CUP GAME ,12,1.06,17448.0,United Kingdom,2025-11-29
512525,48173C,DOOR MAT BLACK FLOCK ,2,6.35,17448.0,United Kingdom,2025-11-29
512525,21891,TRADITIONAL WOODEN SKIPPING ROPE,12,1.06,17448.0,United Kingdom,2025-11-29
512525,21745,GAOLERS KEYS DECORATIVE GARDEN ,4,3.39,17448.0,United Kingdom,2025-11-29
512525,21063,PARTY INVITES JAZZ HEARTS,12,0.72,17448.0,United Kingdom,2025-11-29
512525,48138,DOOR MAT UNION FLAG,2,6.35,17448.0,United Kingdom,2025-11-29
512525,22414,DOOR MAT NEIGHBOURHOOD WITCH ,2,6.35,17448.0,United Kingdom,2025-11-29
512525,20685,DOOR MAT RED SPOT,2,6.35,17448.0,United Kingdom,2025-11-29
512525,21061,PARTY INVITES FOOTBALL,12,0.72,17448.0,United Kingdom,2025-11-29
512525,82484,WOOD BLACK BOARD ANT WHITE FINISH,6,5.55,17448.0,United Kingdom,2025-11-29
512525,22442,GROW YOUR OWN FLOWERS SET OF 3,2,6.75,17448.0,United Kingdom,2025-11-29
512525,22375,AIRLINE BAG VINTAGE JET SET BROWN,2,5.45,17448.0,United Kingdom,2025-11-29
512525,85065,CREAM SWEETHEART TRAYS,1,9.95,17448.0,United Kingdom,2025-11-29
512525,22038,BOTANICAL LAVENDER GIFT WRAP ,25,0.34,17448.0,United Kingdom,2025-11-29
512525,22208,WOOD STAMP SET THANK YOU,12,1.45,17448.0,United Kingdom,2025-11-29
512525,22365,DOOR MAT RESPECTABLE HOUSE,2,6.35,17448.0,United Kingdom,2025-11-29
512525,20682,RED SPOTTY CHILDS UMBRELLA,6,2.75,17448.0,United Kingdom,2025-11-29
512525,85049C,ROMANTIC PINKS RIBBONS ,12,1.06,17448.0,United Kingdom,2025-11-29
512525,22621,TRADITIONAL KNITTING NANCY,12,1.25,17448.0,United Kingdom,2025-11-29
512525,21464,DISCO BALL ROTATOR BATTERY OPERATED,2,3.75,17448.0,United Kingdom,2025-11-29
512525,22376,AIRLINE BAG VINTAGE JET SET WHITE,2,5.45,17448.0,United Kingdom,2025-11-29
512525,72741,GRAND CHOCOLATECANDLE,9,1.25,17448.0,United Kingdom,2025-11-29
512525,84755,COLOUR GLASS T-LIGHT HOLDER HANGING,16,0.55,17448.0,United Kingdom,2025-11-29
512525,71459,HANGING JAM JAR T-LIGHT HOLDER,12,0.72,17448.0,United Kingdom,2025-11-29
512525,22039,BOTANICAL LILY GIFT WRAP,25,0.34,17448.0,United Kingdom,2025-11-29
512525,85066,CREAM SWEETHEART MINI CHEST,2,10.95,17448.0,United Kingdom,2025-11-29
512525,22374,AIRLINE BAG VINTAGE JET SET RED,2,5.45,17448.0,United Kingdom,2025-11-29
512525,22209,WOOD STAMP SET HAPPY BIRTHDAY,12,1.45,17448.0,United Kingdom,2025-11-29
512525,22211,WOOD STAMP SET FLOWERS,12,1.45,17448.0,United Kingdom,2025-11-29
512525,48129,DOOR MAT TOPIARY,2,6.35,17448.0,United Kingdom,2025-11-29
512525,21755,LOVE BUILDING BLOCK WORD,3,5.45,17448.0,United Kingdom,2025-11-29
512525,22040,BOTANICAL ROSE GIFT WRAP,25,0.34,17448.0,United Kingdom,2025-11-29
512525,21890,S/6 WOODEN SKITTLES IN COTTON BAG,6,2.55,17448.0,United Kingdom,2025-11-29
512525,22366,DOOR MAT AIRMAIL ,2,6.35,17448.0,United Kingdom,2025-11-29
512527,71459,HANGING JAM JAR T-LIGHT HOLDER,12,0.85,17448.0,United Kingdom,2025-11-29
512527,22066,LOVE HEART TRINKET POT,12,1.45,17448.0,United Kingdom,2025-11-29
512527,22646,CERAMIC STRAWBERRY CAKE MONEY BANK,12,1.45,17448.0,United Kingdom,2025-11-29
512527,22500,SET OF 2 TINS JARDIN DE PROVENCE,4,4.95,17448.0,United Kingdom,2025-11-29
512527,22444,GROW YOUR OWN PLANT IN A CAN ,24,1.25,17448.0,United Kingdom,2025-11-29
512527,22582,PACK OF 6 SWEETIE GIFT BOXES,6,2.55,17448.0,United Kingdom,2025-11-29
512527,84839,SWEETHEART KEY CABINET,2,6.75,17448.0,United Kingdom,2025-11-29
512527,22040,BOTANICAL ROSE GIFT WRAP,25,0.42,17448.0,United Kingdom,2025-11-29
512527,22057,CERAMIC PLATE STRAWBERRY DESIGN,12,1.49,17448.0,United Kingdom,2025-11-29
512527,22421,LIPSTICK PEN FUSCHIA,12,0.42,17448.0,United Kingdom,2025-11-29
512527,22649,STRAWBERRY FAIRY CAKE TEAPOT,8,4.95,17448.0,United Kingdom,2025-11-29
512527,22442,GROW YOUR OWN FLOWERS SET OF 3,2,7.95,17448.0,United Kingdom,2025-11-29
512527,22420,LIPSTICK PEN BABY PINK,12,0.42,17448.0,United Kingdom,2025-11-29
512527,22063,CERAMIC BOWL WITH STRAWBERRY DESIGN,6,2.95,17448.0,United Kingdom,2025-11-29
512527,22537,MAGIC DRAWING SLATE DINOSAUR,48,0.42,17448.0,United Kingdom,2025-11-29
512527,84950,ASSORTED COLOUR T-LIGHT HOLDER,12,0.85,17448.0,United Kingdom,2025-11-29
512527,21382,SET/4 SPRING FLOWER DECORATION,6,2.95,17448.0,United Kingdom,2025-11-29
512527,82484,WOOD BLACK BOARD ANT WHITE FINISH,3,6.45,17448.0,United Kingdom,2025-11-29
512527,22067,CHOC TRUFFLE GOLD TRINKET POT ,12,1.65,17448.0,United Kingdom,2025-11-29
512527,22389,PAPERWEIGHT SAVE THE PLANET,6,2.55,17448.0,United Kingdom,2025-11-29
512527,37447,CERAMIC CAKE DESIGN SPOTTED PLATE,12,1.49,17448.0,United Kingdom,2025-11-29
512527,22605,WOODEN CROQUET GARDEN SET,1,12.75,17448.0,United Kingdom,2025-11-29
512527,22039,BOTANICAL LILY GIFT WRAP,25,0.42,17448.0,United Kingdom,2025-11-29
512527,22584,PACK OF 6 PANNETONE GIFT BOXES,6,2.55,17448.0,United Kingdom,2025-11-29
512527,22497,SET OF 2 TINS VINTAGE BATHROOM ,4,4.25,17448.0,United Kingdom,2025-11-29
512527,22419,LIPSTICK PEN RED,12,0.42,17448.0,United Kingdom,2025-11-29
512527,21232,STRAWBERRY CERAMIC TRINKET BOX,12,1.25,17448.0,United Kingdom,2025-11-29
512527,22394,PAPERWEIGHT KINGS CHOICE ,6,2.55,17448.0,United Kingdom,2025-11-29
512527,22212,FOUR HOOK  WHITE LOVEBIRDS,6,2.1,17448.0,United Kingdom,2025-11-29
512527,22055,MINI CAKE STAND  HANGING STRAWBERY,8,1.65,17448.0,United Kingdom,2025-11-29
512527,21700,BIG DOUGHNUT FRIDGE MAGNETS,12,0.85,17448.0,United Kingdom,2025-11-29
512527,22501,PICNIC BASKET WICKER LARGE,2,9.95,17448.0,United Kingdom,2025-11-29
512527,22062,CERAMIC BOWL WITH LOVE HEART DESIGN,6,2.95,17448.0,United Kingdom,2025-11-29
512527,22459,CAST IRON HOOK GARDEN TROWEL,8,2.55,17448.0,United Kingdom,2025-11-29
512527,21231,SWEETHEART CERAMIC TRINKET BOX,12,1.25,17448.0,United Kingdom,2025-11-29
512527,22458,CAST IRON HOOK GARDEN FORK,8,2.55,17448.0,United Kingdom,2025-11-29
512527,15056P,EDWARDIAN PARASOL PINK,3,5.95,17448.0,United Kingdom,2025-11-29
512527,15056N,EDWARDIAN PARASOL NATURAL,3,5.95,17448.0,United Kingdom,2025-11-29
512527,22607,WOODEN ROUNDERS GARDEN SET ,2,8.5,17448.0,United Kingdom,2025-11-29
512527,22531,MAGIC DRAWING SLATE CIRCUS PARADE  ,48,0.42,17448.0,United Kingdom,2025-11-29
512527,84755,COLOUR GLASS T-LIGHT HOLDER HANGING,16,0.65,17448.0,United Kingdom,2025-11-29
512527,21498,RED SPOTS  WRAP ,25,0.42,17448.0,United Kingdom,2025-11-29
512527,22645,CERAMIC HEART FAIRY CAKE MONEY BANK,12,1.45,17448.0,United Kingdom,2025-11-29
512527,22060,LARGE CAKE STAND HANGING HEARTS,2,9.95,17448.0,United Kingdom,2025-11-29
512527,21259,VICTORIAN SEWING BOX SMALL ,2,5.95,17448.0,United Kingdom,2025-11-29
512528,22399,MAGNETS PACK OF 4 CHILDHOOD MEMORY,2,1.25,17952.0,United Kingdom,2025-11-29
512528,22410,MONEY BOX HOUSEKEEPING DESIGN,6,1.25,17952.0,United Kingdom,2025-11-29
512528,22408,MONEY BOX CONFECTIONERY DESIGN,6,1.25,17952.0,United Kingdom,2025-11-29
512528,21912,VINTAGE SNAKES & LADDERS,3,3.75,17952.0,United Kingdom,2025-11-29
512528,21875,KINGS CHOICE MUG,6,1.25,17952.0,United Kingdom,2025-11-29
512528,21231,SWEETHEART CERAMIC TRINKET BOX,4,1.25,17952.0,United Kingdom,2025-11-29
512528,21891,TRADITIONAL WOODEN SKIPPING ROPE,3,1.25,17952.0,United Kingdom,2025-11-29
512528,22403,MAGNETS PACK OF 4 VINTAGE LABELS ,2,1.25,17952.0,United Kingdom,2025-11-29
512528,21877,HOME SWEET HOME MUG,6,1.25,17952.0,United Kingdom,2025-11-29
512528,22402,MAGNETS PACK OF 4 VINTAGE COLLAGE,2,1.25,17952.0,United Kingdom,2025-11-29
512528,22445,PENCIL CASE LIFE IS BEAUTIFUL,2,2.95,17952.0,United Kingdom,2025-11-29
512528,15036,ASSORTED COLOURS SILK FAN,12,0.75,17952.0,United Kingdom,2025-11-29
512528,47591C,BLUE FAIRY CAKE CHILD'S APRON,2,1.95,17952.0,United Kingdom,2025-11-29
512528,21892,TRADITIONAL WOODEN CATCH CUP GAME ,2,1.25,17952.0,United Kingdom,2025-11-29
512528,21889,WOODEN BOX OF DOMINOES,4,1.25,17952.0,United Kingdom,2025-11-29
512528,21790,VINTAGE SNAP CARDS,3,0.85,17952.0,United Kingdom,2025-11-29
512528,21791,VINTAGE HEADS AND TAILS CARD GAME ,1,1.25,17952.0,United Kingdom,2025-11-29
512528,21124,SET/10 BLUE SPOTTY PARTY CANDLES,2,1.25,17952.0,United Kingdom,2025-11-29
512528,21122,SET/10 PINK SPOTTY PARTY CANDLES,2,1.25,17952.0,United Kingdom,2025-11-29
512528,22558,CLOTHES PEGS RETROSPOT PACK 24 ,1,1.25,17952.0,United Kingdom,2025-11-29
512528,21888,BINGO SET,3,3.75,17952.0,United Kingdom,2025-11-29
512528,21121,SET/10 RED SPOTTY PARTY CANDLES,2,1.25,17952.0,United Kingdom,2025-11-29
512528,22399,MAGNETS PACK OF 4 CHILDHOOD MEMORY,2,1.25,17952.0,United Kingdom,2025-11-29
512528,21913,VINTAGE SEASIDE JIGSAW PUZZLES,2,3.75,17952.0,United Kingdom,2025-11-29
512528,22090,PAPER BUNTING RETRO SPOTS,1,2.95,17952.0,United Kingdom,2025-11-29
512528,22611,VINTAGE UNION JACK SHOPPING BAG,4,4.95,17952.0,United Kingdom,2025-11-29
512528,85099F,JUMBO BAG STRAWBERRY,1,1.95,17952.0,United Kingdom,2025-11-29
512528,22502,PICNIC BASKET WICKER SMALL,1,4.25,17952.0,United Kingdom,2025-11-29
512528,22358,KINGS CHOICE TEA CADDY ,1,2.95,17952.0,United Kingdom,2025-11-29
512528,22423,REGENCY CAKESTAND 3 TIER,1,12.75,17952.0,United Kingdom,2025-11-29
512528,22445,PENCIL CASE LIFE IS BEAUTIFUL,2,2.95,17952.0,United Kingdom,2025-11-29
512528,22558,CLOTHES PEGS RETROSPOT PACK 24 ,3,1.25,17952.0,United Kingdom,2025-11-29
512528,21791,VINTAGE HEADS AND TAILS CARD GAME ,4,1.25,17952.0,United Kingdom,2025-11-29
512528,21892,TRADITIONAL WOODEN CATCH CUP GAME ,2,1.25,17952.0,United Kingdom,2025-11-29
512528,20828,GLITTER BUTTERFLY CLIPS,2,2.55,17952.0,United Kingdom,2025-11-29
512528,85231G,ORANGE SCENTED SET/9 T-LIGHTS,1,0.85,17952.0,United Kingdom,2025-11-29
512528,85231B,CINAMMON SET OF 9 T-LIGHTS,1,0.85,17952.0,United Kingdom,2025-11-29
512528,21703,BAG 125g SWIRLY MARBLES,8,0.42,17952.0,United Kingdom,2025-11-29
512528,21877,HOME SWEET HOME MUG,6,1.25,17952.0,United Kingdom,2025-11-29
512528,22646,CERAMIC STRAWBERRY CAKE MONEY BANK,4,1.45,17952.0,United Kingdom,2025-11-29
512528,21876,POTTERING MUG,6,1.25,17952.0,United Kingdom,2025-11-29
512528,22089,PAPER BUNTING VINTAGE PAISLEY,1,2.95,17952.0,United Kingdom,2025-11-29
512528,20716,PARTY FOOD SHOPPER BAG,2,1.25,17952.0,United Kingdom,2025-11-29
512528,20718,RED SPOTTY SHOPPER BAG,2,1.25,17952.0,United Kingdom,2025-11-29
512528,21472,LADYBIRD + BEE RAFFIA FOOD COVER,1,3.75,17952.0,United Kingdom,2025-11-29
512528,21790,VINTAGE SNAP CARDS,3,0.85,17952.0,United Kingdom,2025-11-29
512528,47591D,PINK FAIRY CAKE CHILD'S APRON,2,1.95,17952.0,United Kingdom,2025-11-29
512528,47591A,CAROUSEL DES CHILD'S APRON,3,1.65,17952.0,United Kingdom,2025-11-29
512528,84856L,LARGE TAHITI BEACH BAG,4,5.95,17952.0,United Kingdom,2025-11-29
512528,22612,TEA COSY VINTAGE UNION JACK,3,3.75,17952.0,United Kingdom,2025-11-29
512528,20730,STRAWBERRY CANDY BAG,2,1.25,17952.0,United Kingdom,2025-11-29
C512529,22097,SWALLOW SQUARE TISSUE BOX,-5,1.25,15207.0,United Kingdom,2025-11-29
C512530,85124C,GREEN JUICY FRUIT PHOTO FRAME,-5,2.55,13078.0,United Kingdom,2025-11-29
C512531,71459,HANGING JAM JAR T-LIGHT HOLDER,-3,0.85,13745.0,United Kingdom,2025-11-29
C512531,22421,LIPSTICK PEN FUSCHIA,-12,0.42,13745.0,United Kingdom,2025-11-29
512532,21224,SET/4 SKULL BADGES,20,1.25,16253.0,United Kingdom,2025-11-29
512532,21311,SET/4 BIRD MIRROR MAGNETS ,12,2.1,16253.0,United Kingdom,2025-11-29
512532,84569D,PACK 6 HEART/ICE-CREAM PATCHES,12,1.25,16253.0,United Kingdom,2025-11-29
512532,21542,WOODLAND WATER TRANSFER TATTOOS ,24,0.85,16253.0,United Kingdom,2025-11-29
512532,21544,SKULLS  WATER TRANSFER TATTOOS ,24,0.85,16253.0,United Kingdom,2025-11-29
512532,21790,VINTAGE SNAP CARDS,24,0.85,16253.0,United Kingdom,2025-11-29
512532,21791,VINTAGE HEADS AND TAILS CARD GAME ,24,1.25,16253.0,United Kingdom,2025-11-29
512532,21888,BINGO SET,4,3.75,16253.0,United Kingdom,2025-11-29
512532,21914,BLUE HARMONICA IN BOX ,24,1.25,16253.0,United Kingdom,2025-11-29
512532,22549,PICTURE DOMINOES,36,1.45,16253.0,United Kingdom,2025-11-29
512532,20979,36 PENCILS TUBE RED SPOTTY,32,1.25,16253.0,United Kingdom,2025-11-29
512532,85226A,WHITE/BLUE PULL BACK RACING CAR,36,0.55,16253.0,United Kingdom,2025-11-29
512532,21507,"ELEPHANT, BIRTHDAY CARD, ",24,0.42,16253.0,United Kingdom,2025-11-29
512532,21506,"FANCY FONT BIRTHDAY CARD, ",24,0.42,16253.0,United Kingdom,2025-11-29
512532,22037,ROBOT BIRTHDAY CARD,24,0.42,16253.0,United Kingdom,2025-11-29
512532,22035,VINTAGE CARAVAN GREETING CARD ,24,0.42,16253.0,United Kingdom,2025-11-29
512532,22030,SWALLOWS GREETING CARD,24,0.42,16253.0,United Kingdom,2025-11-29
512532,16043,POP ART PUSH DOWN RUBBER ,24,0.42,16253.0,United Kingdom,2025-11-29
