Invoice,StockCode,Description,Quantity,Price,Customer ID,Country,InvoiceDate
503532,22551,PLASTERS IN TIN SPACEBOY,12,1.65,12472.0,Germany,2025-09-30
503532,22554,PLASTERS IN TIN WOODLAND ANIMALS,12,1.65,12472.0,Germany,2025-09-30
503532,22561,WOODEN SCHOOL COLOURING SET,12,1.65,12472.0,Germany,2025-09-30
503533,21216,"SET 3 RED SPOT TIN TEA,COFFEE,SUGAR",4,4.95,13397.0,United Kingdom,2025-09-30
503533,85099B,JUMBO BAG RED WHITE SPOTTY ,10,1.95,13397.0,United Kingdom,2025-09-30
503533,22386,JUMBO BAG PINK WITH WHITE SPOTS,10,1.95,13397.0,United Kingdom,2025-09-30
503533,84968E,S/16 VINTAGE BLACK CUTLERY,4,12.75,13397.0,United Kingdom,2025-09-30
503533,22191,EAU DE NIL DINER WALL CLOCK,4,8.5,13397.0,United Kingdom,2025-09-30
503533,22192,BLUE DINER WALL CLOCK,4,8.5,13397.0,United Kingdom,2025-09-30
503533,22194,BLACK DINER WALL CLOCK,4,8.5,13397.0,United Kingdom,2025-09-30
503533,47566B,TEA TIME PARTY BUNTING,20,4.65,13397.0,United Kingdom,2025-09-30
503534,21390,FILIGRIS HEART WITH BUTTERFLY,24,1.25,14239.0,United Kingdom,2025-09-30
503534,85123A,WHITE HANGING HEART T-LIGHT HOLDER,12,2.95,14239.0,United Kingdom,2025-09-30
503534,21733,RED HANGING HEART T-LIGHT HOLDER,6,2.95,14239.0,United Kingdom,2025-09-30
503534,21745,GAOLERS KEYS DECORATIVE GARDEN ,4,3.75,14239.0,United Kingdom,2025-09-30
503534,48194,DOOR MAT HEARTS,2,7.49,14239.0,United Kingdom,2025-09-30
503534,20685,DOOR MAT RED SPOT,2,7.49,14239.0,United Kingdom,2025-09-30
503534,21166,COOK WITH WINE METAL SIGN ,12,1.95,14239.0,United Kingdom,2025-09-30
503535,22039,BOTANICAL LILY GIFT WRAP,25,0.42,17700.0,United Kingdom,2025-09-30
503535,21983,PACK OF 12 BLUE PAISLEY TISSUES ,48,0.29,17700.0,United Kingdom,2025-09-30
503535,22089,PAPER BUNTING VINTAGE PAISLEY,6,2.95,17700.0,United Kingdom,2025-09-30
503535,85089,CANDY SPOT BUNNY,6,2.95,17700.0,United Kingdom,2025-09-30
503535,21916,SET 12 RETRO WHITE CHALK STICKS,24,0.42,17700.0,United Kingdom,2025-09-30
503535,22032,BOTANICAL LILY GREETING CARD,12,0.42,17700.0,United Kingdom,2025-09-30
503535,22051,BLUE SCANDINAVIAN PAISLEY WRAP,25,0.42,17700.0,United Kingdom,2025-09-30
503535,22045,SPACEBOY GIFT WRAP,25,0.42,17700.0,United Kingdom,2025-09-30
503535,16156S,WRAP PINK FAIRY CAKES ,25,0.42,17700.0,United Kingdom,2025-09-30
503535,22391,PAPERWEIGHT HOME SWEET HOME,6,2.55,17700.0,United Kingdom,2025-09-30
503535,22304,COFFEE MUG BLUE PAISLEY DESIGN,6,2.55,17700.0,United Kingdom,2025-09-30
503535,84520B,PACK 20 ENGLISH ROSE PAPER NAPKINS,12,0.85,17700.0,United Kingdom,2025-09-30
503535,47570B,TEA TIME TABLE CLOTH,2,10.65,17700.0,United Kingdom,2025-09-30
503535,47570,ENGLISH ROSE TABLE CLOTH,2,10.65,17700.0,United Kingdom,2025-09-30
503535,22456,NATURAL SLATE CHALKBOARD LARGE ,3,4.95,17700.0,United Kingdom,2025-09-30
503535,21756,BATH BUILDING BLOCK WORD,3,5.95,17700.0,United Kingdom,2025-09-30
503535,21754,HOME BUILDING BLOCK WORD,3,5.95,17700.0,United Kingdom,2025-09-30
503535,22083,PAPER CHAIN KIT RETRO SPOT,6,2.95,17700.0,United Kingdom,2025-09-30
503535,22560,TRADITIONAL MODELLING CLAY,24,1.25,17700.0,United Kingdom,2025-09-30
503535,22305,COFFEE MUG PINK PAISLEY DESIGN,6,2.55,17700.0,United Kingdom,2025-09-30
503536,37503,TEA TIME CAKE STAND IN GIFT BOX,3,10.75,15023.0,United Kingdom,2025-09-30
503536,10138,ASSORTED COLOUR JUMBO PEN,6,0.42,15023.0,United Kingdom,2025-09-30
503536,72741,GRAND CHOCOLATECANDLE,9,1.45,15023.0,United Kingdom,2025-09-30
503536,21531,RED RETROSPOT SUGAR JAM BOWL,2,2.55,15023.0,United Kingdom,2025-09-30
503536,21826,EIGHT PIECE DINOSAUR SET,1,1.25,15023.0,United Kingdom,2025-09-30
503536,16047,POP ART PEN CASE & PENS,2,0.85,15023.0,United Kingdom,2025-09-30
503536,16047,POP ART PEN CASE & PENS,2,0.85,15023.0,United Kingdom,2025-09-30
503536,21828,EIGHT PIECE SNAKE  SET,2,1.25,15023.0,United Kingdom,2025-09-30
503536,20914,SET/5 RED SPOTTY LID GLASS BOWLS,3,2.95,15023.0,United Kingdom,2025-09-30
503536,21826,EIGHT PIECE DINOSAUR SET,1,1.25,15023.0,United Kingdom,2025-09-30
503536,22423,REGENCY CAKESTAND 3 TIER,1,12.75,15023.0,United Kingdom,2025-09-30
503536,22131,FOOD CONTAINER SET 3 LOVE HEART ,4,1.95,15023.0,United Kingdom,2025-09-30
503536,21911,GARDEN METAL SIGN ,2,1.65,15023.0,United Kingdom,2025-09-30
503536,21907,I'M ON HOLIDAY METAL SIGN,2,2.1,15023.0,United Kingdom,2025-09-30
503536,85152,HAND OVER THE CHOCOLATE   SIGN ,1,2.1,15023.0,United Kingdom,2025-09-30
503536,21166,COOK WITH WINE METAL SIGN ,2,1.95,15023.0,United Kingdom,2025-09-30
503536,21843,RED RETROSPOT CAKE STAND,3,10.95,15023.0,United Kingdom,2025-09-30
503536,22563,HAPPY STENCIL CRAFT,1,1.25,15023.0,United Kingdom,2025-09-30
503536,22562,MONSTERS STENCIL CRAFT,1,1.25,15023.0,United Kingdom,2025-09-30
503536,22560,TRADITIONAL MODELLING CLAY,2,1.25,15023.0,United Kingdom,2025-09-30
503536,85123A,WHITE HANGING HEART T-LIGHT HOLDER,32,2.55,15023.0,United Kingdom,2025-09-30
503536,85136B,BLUE SHARK HELICOPTER,1,7.95,15023.0,United Kingdom,2025-09-30
503536,85136A,YELLOW SHARK HELICOPTER,1,7.95,15023.0,United Kingdom,2025-09-30
503536,84880,WHITE WIRE EGG HOLDER,1,5.95,15023.0,United Kingdom,2025-09-30
503536,22296,HEART IVORY TRELLIS LARGE,12,1.65,15023.0,United Kingdom,2025-09-30
503536,21535,RED RETROSPOT SMALL MILK JUG,2,2.55,15023.0,United Kingdom,2025-09-30
503536,22464,HANGING METAL HEART LANTERN,6,1.65,15023.0,United Kingdom,2025-09-30
503536,22383,LUNCH BAG SUKI  DESIGN ,2,1.65,15023.0,United Kingdom,2025-09-30
503536,20728,LUNCH BAG CARS BLUE,3,1.65,15023.0,United Kingdom,2025-09-30
503536,85136C,RED SHARK HELICOPTER,1,7.95,15023.0,United Kingdom,2025-09-30
503536,48188,DOOR MAT WELCOME PUPPIES,2,7.49,15023.0,United Kingdom,2025-09-30
503536,48129,DOOR MAT TOPIARY,2,7.49,15023.0,United Kingdom,2025-09-30
503536,48187,DOOR MAT NEW ENGLAND,1,7.49,15023.0,United Kingdom,2025-09-30
503536,48197,DOOR MAT BIRD ON THE WIRE,1,7.49,15023.0,United Kingdom,2025-09-30
503536,48111,DOOR MAT 3 SMILEY CATS,1,7.49,15023.0,United Kingdom,2025-09-30
503536,20685,DOOR MAT RED SPOT,1,7.49,15023.0,United Kingdom,2025-09-30
503536,48194,DOOR MAT HEARTS,2,7.49,15023.0,United Kingdom,2025-09-30
503536,21523,DOOR MAT FANCY FONT HOME SWEET HOME,2,7.49,15023.0,United Kingdom,2025-09-30
503536,48138,DOOR MAT UNION FLAG,2,7.49,15023.0,United Kingdom,2025-09-30
503536,20713,JUMBO BAG OWLS,3,1.95,15023.0,United Kingdom,2025-09-30
503536,48185,DOOR MAT FAIRY CAKE,2,7.49,15023.0,United Kingdom,2025-09-30
503536,20718,RED SPOTTY SHOPPER BAG,4,1.25,15023.0,United Kingdom,2025-09-30
503536,22384,LUNCH BAG PINK RETROSPOT,3,1.65,15023.0,United Kingdom,2025-09-30
503536,22147,FELTCRAFT BUTTERFLY HEARTS,2,1.45,15023.0,United Kingdom,2025-09-30
503536,22149,FELTCRAFT 6 FLOWER FRIENDS,2,2.1,15023.0,United Kingdom,2025-09-30
503536,21827,EIGHT PIECE CREEPY CRAWLIE SET,1,1.25,15023.0,United Kingdom,2025-09-30
503536,20711,JUMBO BAG TOYS ,6,1.95,15023.0,United Kingdom,2025-09-30
503536,21827,EIGHT PIECE CREEPY CRAWLIE SET,3,1.25,15023.0,United Kingdom,2025-09-30
503536,21826,EIGHT PIECE DINOSAUR SET,1,1.25,15023.0,United Kingdom,2025-09-30
503536,22523,CHILDS GARDEN FORK PINK,3,0.85,15023.0,United Kingdom,2025-09-30
503536,85099B,RED RETROSPOT JUMBO BAG ,6,1.95,15023.0,United Kingdom,2025-09-30
503536,85099C,JUMBO  BAG BAROQUE BLACK WHITE,3,1.95,15023.0,United Kingdom,2025-09-30
503536,20717,STRAWBERRY SHOPPER BAG,2,1.25,15023.0,United Kingdom,2025-09-30
503537,85067,CREAM SWEETHEART WALL CABINET,1,18.95,16130.0,United Kingdom,2025-09-30
503537,21164,HOME SWEET HOME METAL SIGN ,6,2.95,16130.0,United Kingdom,2025-09-30
503537,84837,WHITE SWEETHEARTS CABINET 4 DRAWERS,1,12.75,16130.0,United Kingdom,2025-09-30
503537,21775,DECORATIVE FLORE BATHROOM BOTTLE,12,1.25,16130.0,United Kingdom,2025-09-30
503537,20871,OPULENT VELVET SET/3 CANDLES,6,2.1,16130.0,United Kingdom,2025-09-30
503537,84843,WHITE SOAP RACK WITH 2 BOTTLES,2,5.95,16130.0,United Kingdom,2025-09-30
503537,82486,WOOD S/3 CABINET ANT WHITE FINISH,2,7.95,16130.0,United Kingdom,2025-09-30
503537,22360,GLASS JAR ENGLISH CONFECTIONERY,6,2.95,16130.0,United Kingdom,2025-09-30
503537,22487,WHITE WOOD GARDEN PLANT LADDER,2,9.95,16130.0,United Kingdom,2025-09-30
503537,84815,SET OF 3 DANISH ROSE PLANTERS,3,4.25,16130.0,United Kingdom,2025-09-30
503537,22364,GLASS JAR DIGESTIVE BISCUITS,6,2.95,16130.0,United Kingdom,2025-09-30
503537,46776A,WOVEN BUBBLE GUM CUSHION COVER,2,4.95,16130.0,United Kingdom,2025-09-30
503537,82607A,GLASS BONBON JAR PARFUME AUX FLEURE,6,1.25,16130.0,United Kingdom,2025-09-30
503537,20840,FRENCH FLORAL CUSHION COVER ,6,2.95,16130.0,United Kingdom,2025-09-30
503538,22273,FELTCRAFT DOLL MOLLY,2,2.95,14692.0,United Kingdom,2025-09-30
503538,22271,FELTCRAFT DOLL ROSIE,1,2.95,14692.0,United Kingdom,2025-09-30
503538,20971,PINK BLUE FELT CRAFT TRINKET BOX,2,1.25,14692.0,United Kingdom,2025-09-30
503538,22520,CHILDS GARDEN TROWEL BLUE ,6,0.85,14692.0,United Kingdom,2025-09-30
503538,20972,PINK CREAM FELT CRAFT TRINKET BOX ,2,1.25,14692.0,United Kingdom,2025-09-30
503538,20971,PINK BLUE FELT CRAFT TRINKET BOX,1,1.25,14692.0,United Kingdom,2025-09-30
503538,20970,PINK FLORAL FELTCRAFT SHOULDER BAG,2,3.75,14692.0,United Kingdom,2025-09-30
503538,47590B,PINK HAPPY BIRTHDAY BUNTING,2,5.45,14692.0,United Kingdom,2025-09-30
503538,22518,CHILDS GARDEN BRUSH BLUE,2,2.1,14692.0,United Kingdom,2025-09-30
503538,22519,CHILDS GARDEN BRUSH PINK,3,2.1,14692.0,United Kingdom,2025-09-30
503538,22521,CHILDS GARDEN TROWEL PINK,9,0.85,14692.0,United Kingdom,2025-09-30
503538,20971,PINK BLUE FELT CRAFT TRINKET BOX,1,1.25,14692.0,United Kingdom,2025-09-30
503538,22315,200 RED + WHITE BENDY STRAWS,1,1.25,14692.0,United Kingdom,2025-09-30
503538,22522,CHILDS GARDEN FORK BLUE ,2,0.85,14692.0,United Kingdom,2025-09-30
503538,21735,TWO DOOR CURIO CABINET,1,12.75,14692.0,United Kingdom,2025-09-30
503538,22523,CHILDS GARDEN FORK PINK,2,0.85,14692.0,United Kingdom,2025-09-30
503538,22112,CHOCOLATE HOT WATER BOTTLE,2,4.95,14692.0,United Kingdom,2025-09-30
503538,22526,WHEELBARROW FOR CHILDREN ,1,12.75,14692.0,United Kingdom,2025-09-30
503538,22524,CHILDRENS GARDEN GLOVES BLUE,3,1.25,14692.0,United Kingdom,2025-09-30
503538,22507,MEMO BOARD RETROSPOT  DESIGN,6,4.95,14692.0,United Kingdom,2025-09-30
503538,47420,ASSORTED COLOUR SUCTION CUP HOOK,8,0.19,14692.0,United Kingdom,2025-09-30
503538,22198,LARGE POPCORN HOLDER ,6,1.65,14692.0,United Kingdom,2025-09-30
503538,22197,SMALL POPCORN HOLDER,8,0.85,14692.0,United Kingdom,2025-09-30
503538,22189,CREAM HEART CARD HOLDER,2,3.95,14692.0,United Kingdom,2025-09-30
503538,22525,CHILDRENS GARDEN GLOVES PINK,10,1.25,14692.0,United Kingdom,2025-09-30
503539,21042,RED SPOTTY APRON ,3,5.95,17920.0,United Kingdom,2025-09-30
503539,21561,DINOSAUR LUNCH BOX WITH CUTLERY,4,2.55,17920.0,United Kingdom,2025-09-30
503539,21213,PACK OF 72 SKULL CAKE CASES,24,0.55,17920.0,United Kingdom,2025-09-30
503539,84380,SET OF 3 BUTTERFLY COOKIE CUTTERS,24,1.25,17920.0,United Kingdom,2025-09-30
503539,85099B,RED RETROSPOT JUMBO BAG ,10,1.95,17920.0,United Kingdom,2025-09-30
503539,47556B,TEA TIME TEA TOWELS ,2,2.95,17920.0,United Kingdom,2025-09-30
503539,21035,SET/2 RED SPOTTY TEA TOWELS ,1,2.95,17920.0,United Kingdom,2025-09-30
503539,21212,PACK OF 72 RETRO SPOT CAKE CASES,48,0.55,17920.0,United Kingdom,2025-09-30
503539,21721,CANDY SHOP  STICKER SHEET,5,0.85,17920.0,United Kingdom,2025-09-30
503539,21720,CAKE SHOP  STICKER SHEET,5,0.85,17920.0,United Kingdom,2025-09-30
503539,22136,LOVE HEART SOCK HANGER,3,1.65,17920.0,United Kingdom,2025-09-30
503539,47590B,PINK HAPPY BIRTHDAY BUNTING,8,5.45,17920.0,United Kingdom,2025-09-30
503539,22382,LUNCH BAG SPACEBOY DESIGN ,10,1.65,17920.0,United Kingdom,2025-09-30
503539,85014A,BLACK/BLUE DOTS RUFFLED UMBRELLA,5,5.95,17920.0,United Kingdom,2025-09-30
503539,82578,KITCHEN METAL SIGN,25,0.55,17920.0,United Kingdom,2025-09-30
503539,15056BL,EDWARDIAN PARASOL BLACK,4,5.95,17920.0,United Kingdom,2025-09-30
503540,84755,COLOUR GLASS T-LIGHT HOLDER HANGING,16,0.65,15198.0,United Kingdom,2025-09-30
503540,21115,ROSE CARAVAN DOORSTOP,2,6.75,15198.0,United Kingdom,2025-09-30
503540,22441,GROW YOUR OWN BASIL IN ENAMEL MUG,8,2.1,15198.0,United Kingdom,2025-09-30
503540,22026,BANQUET BIRTHDAY  CARD  ,12,0.42,15198.0,United Kingdom,2025-09-30
503540,22030,SWALLOWS GREETING CARD,12,0.42,15198.0,United Kingdom,2025-09-30
503540,22035,VINTAGE CARAVAN GREETING CARD ,12,0.42,15198.0,United Kingdom,2025-09-30
503540,84846A,SCENTED CANDLE IN DIGITALIS TIN,6,2.1,15198.0,United Kingdom,2025-09-30
503540,72728,ROSE SCENT CANDLES IN GLASS,9,0.85,15198.0,United Kingdom,2025-09-30
503540,22485,SET OF 2 WOODEN MARKET CRATES,2,12.75,15198.0,United Kingdom,2025-09-30
503540,22487,WHITE WOOD GARDEN PLANT LADDER,2,9.95,15198.0,United Kingdom,2025-09-30
503540,22023,EMPIRE BIRTHDAY CARD,12,0.42,15198.0,United Kingdom,2025-09-30
503541,20761,BLUE PAISLEY SKETCHBOOK,4,3.75,14748.0,United Kingdom,2025-09-30
503541,22608,PENS ASSORTED FUNKY JEWELED ,36,0.85,14748.0,United Kingdom,2025-09-30
503541,22609,PENS ASSORTED SPACEBALL,36,0.85,14748.0,United Kingdom,2025-09-30
503541,22610,PENS ASSORTED FUNNY FACE,36,0.85,14748.0,United Kingdom,2025-09-30
503541,20771,CHRYSANTHEMUM  JOURNAL,6,2.55,14748.0,United Kingdom,2025-09-30
503541,20770,ABSTRACT CIRCLE JOURNAL ,6,2.55,14748.0,United Kingdom,2025-09-30
503541,20767,BLUE PAISLEY JOURNAL ,6,2.55,14748.0,United Kingdom,2025-09-30
503541,20772,GARDEN PATH JOURNAL,6,2.55,14748.0,United Kingdom,2025-09-30
503541,16216,LETTER SHAPE PENCIL SHARPENER,80,0.16,14748.0,United Kingdom,2025-09-30
503541,20764,ABSTRACT CIRCLES SKETCHBOOK ,4,3.75,14748.0,United Kingdom,2025-09-30
503541,20762,GREEN FERN SKETCHBOOK ,4,3.75,14748.0,United Kingdom,2025-09-30
503541,20766,GARDEN PATH SKETCHBOOK,4,3.75,14748.0,United Kingdom,2025-09-30
503541,20763,DAISY SKETCHBOOK ,4,3.75,14748.0,United Kingdom,2025-09-30
503541,47480,HANGING PHOTO CLIP ROPE LADDER,12,1.65,14748.0,United Kingdom,2025-09-30
503541,10120,DOGGY RUBBER,30,0.21,14748.0,United Kingdom,2025-09-30
503541,16043,POP ART PUSH DOWN RUBBER ,24,0.42,14748.0,United Kingdom,2025-09-30
503541,16236,KITTY PENCIL ERASERS,28,0.21,14748.0,United Kingdom,2025-09-30
503541,16237,SLEEPING CAT ERASERS,30,0.21,14748.0,United Kingdom,2025-09-30
503541,22209,WOOD STAMP SET HAPPY BIRTHDAY,12,1.65,14748.0,United Kingdom,2025-09-30
503541,22210,WOOD STAMP SET BEST WISHES,12,1.65,14748.0,United Kingdom,2025-09-30
503541,22208,WOOD STAMP SET THANK YOU,12,1.65,14748.0,United Kingdom,2025-09-30
503541,20765,CHRYSANTHEMUM SKETCHBOOK ,4,3.75,14748.0,United Kingdom,2025-09-30
503542,21929,JUMBO BAG PINK VINTAGE PAISLEY,100,1.65,14646.0,Netherlands,2025-09-30
503542,20719,WOODLAND CHARLOTTE BAG,100,0.72,14646.0,Netherlands,2025-09-30
503542,22356,"CHARLOTTE BAG , PINK/WHITE SPOTS",100,0.72,14646.0,Netherlands,2025-09-30
503542,84997B,RED 3 PIECE MINI DOTS CUTLERY SET,72,3.39,14646.0,Netherlands,2025-09-30
503542,20725,LUNCH BAG RED SPOTTY,100,1.45,14646.0,Netherlands,2025-09-30
503542,22379,RECYCLING BAG RETROSPOT ,50,1.85,14646.0,Netherlands,2025-09-30
503542,22554,PLASTERS IN TIN WOODLAND ANIMALS,12,1.65,14646.0,Netherlands,2025-09-30
503542,20727,LUNCH BAG  BLACK SKULL.,50,1.65,14646.0,Netherlands,2025-09-30
503542,20724,RED SPOTTY CHARLOTTE BAG,100,0.72,14646.0,Netherlands,2025-09-30
503542,22551,PLASTERS IN TIN SPACEBOY,12,1.65,14646.0,Netherlands,2025-09-30
503542,22534,MAGIC DRAWING SLATE SPACEBOY ,48,0.42,14646.0,Netherlands,2025-09-30
503542,22530,MAGIC DRAWING SLATE DOLLY GIRL ,48,0.42,14646.0,Netherlands,2025-09-30
503542,85099C,JUMBO  BAG BAROQUE BLACK WHITE,20,1.95,14646.0,Netherlands,2025-09-30
503542,21122,SET/10 PINK SPOTTY PARTY CANDLES,144,1.25,14646.0,Netherlands,2025-09-30
503542,85099B,JUMBO BAG RED WHITE SPOTTY ,200,1.65,14646.0,Netherlands,2025-09-30
503542,21156,RED SPOTTY CHILDS APRON,100,1.65,14646.0,Netherlands,2025-09-30
503542,22416,36 DOILIES SPACEBOY DESIGN ,48,1.45,14646.0,Netherlands,2025-09-30
503542,20718,RED SPOTTY SHOPPER BAG,100,1.06,14646.0,Netherlands,2025-09-30
503542,21224,SET/4 SKULL BADGES,40,1.25,14646.0,Netherlands,2025-09-30
503542,21213,PACK OF 72 SKULL CAKE CASES,120,0.42,14646.0,Netherlands,2025-09-30
503542,21086,SET/6 RED SPOTTY PAPER CUPS,216,0.53,14646.0,Netherlands,2025-09-30
503542,21509,COWBOYS AND INDIANS BIRTHDAY CARD ,72,0.36,14646.0,Netherlands,2025-09-30
503542,22025,RING OF ROSES BIRTHDAY CARD,72,0.36,14646.0,Netherlands,2025-09-30
503542,22245,"HOOK, 1 HANGER ,MAGIC GARDEN",192,0.72,14646.0,Netherlands,2025-09-30
503542,21077,SET/20 WOODLAND PAPER NAPKINS ,96,0.64,14646.0,Netherlands,2025-09-30
503542,20723,STRAWBERRY CHARLOTTE BAG,100,0.72,14646.0,Netherlands,2025-09-30
503542,20750,RED/WHITE DOT MINI CASES,24,6.35,14646.0,Netherlands,2025-09-30
503542,21578,WOODLAND DESIGN  COTTON TOTE BAG,12,2.25,14646.0,Netherlands,2025-09-30
503542,21223,SET/4 BADGES WOODLAND ANIMAL,6,1.25,14646.0,Netherlands,2025-09-30
503542,21672,WHITE SPOT RED CERAMIC DRAWER KNOB,96,1.06,14646.0,Netherlands,2025-09-30
503542,20692,FLORAL ELEPHANT SOFT TOY,24,3.75,14646.0,Netherlands,2025-09-30
503543,21213,PACK OF 72 SKULL CAKE CASES,1,0.55,17993.0,United Kingdom,2025-09-30
503543,84901,BLACK FACE LAMB WITH PANTS,1,3.75,17993.0,United Kingdom,2025-09-30
503543,21122,SET/10 PINK SPOTTY PARTY CANDLES,1,1.25,17993.0,United Kingdom,2025-09-30
503543,85036A,GARDENIA 1 WICK MORRIS BOXED CANDLE,6,4.25,17993.0,United Kingdom,2025-09-30
503543,22461,SAVOY ART DECO CLOCK,1,12.75,17993.0,United Kingdom,2025-09-30
503543,84218,BOX/12 CHICK & EGG IN BASKET,1,1.95,17993.0,United Kingdom,2025-09-30
503543,21383,PACK OF 12 STICKY BUNNIES,2,0.65,17993.0,United Kingdom,2025-09-30
503543,85049G,CHOCOLATE BOX RIBBONS ,1,1.25,17993.0,United Kingdom,2025-09-30
503543,85187,S/12 MINI RABBIT EASTER,1,1.65,17993.0,United Kingdom,2025-09-30
503543,22241,GARLAND WOODEN HAPPY EASTER,1,1.25,17993.0,United Kingdom,2025-09-30
503543,22264,FELT FARM ANIMAL WHITE BUNNY ,5,0.85,17993.0,United Kingdom,2025-09-30
503543,84327A,PINK JUMPER LARRY THE LAMB,24,2.1,17993.0,United Kingdom,2025-09-30
503543,85049B,LUSH GREENS RIBBONS,1,1.25,17993.0,United Kingdom,2025-09-30
503543,21333,CLASSIC WHITE FRAME,1,2.95,17993.0,United Kingdom,2025-09-30
503543,22367,CHILDS APRON SPACEBOY DESIGN,1,1.95,17993.0,United Kingdom,2025-09-30
503543,21898,POTTING SHED ROSE CANDLE,1,2.95,17993.0,United Kingdom,2025-09-30
503543,84509A,SET OF 4 ENGLISH ROSE PLACEMATS,1,3.75,17993.0,United Kingdom,2025-09-30
503543,22107,PIZZA PLATE IN BOX,1,3.75,17993.0,United Kingdom,2025-09-30
503543,21977,PACK OF 60 PINK PAISLEY CAKE CASES,1,0.55,17993.0,United Kingdom,2025-09-30
503543,21126,SET OF 6 GIRLS CELEBRATION CANDLES,1,1.25,17993.0,United Kingdom,2025-09-30
503543,21125,SET 6 FOOTBALL CELEBRATION CANDLES,1,1.25,17993.0,United Kingdom,2025-09-30
503543,21122,SET/10 PINK SPOTTY PARTY CANDLES,1,1.25,17993.0,United Kingdom,2025-09-30
503543,21897,POTTING SHED CANDLE CITRONELLA,1,2.95,17993.0,United Kingdom,2025-09-30
503543,21124,SET/10 BLUE SPOTTY PARTY CANDLES,1,1.25,17993.0,United Kingdom,2025-09-30
503543,47591A,CAROUSEL DES CHILD'S APRON,1,1.65,17993.0,United Kingdom,2025-09-30
503543,84450B,PINK/YELLOW RABBIT SAT EASTER,3,0.42,17993.0,United Kingdom,2025-09-30
503543,84247N,PACK/12 BLUE FOLKART CARDS,1,2.95,17993.0,United Kingdom,2025-09-30
503543,21706,"FOLDING UMBRELLA , RED/WHITE SPOT",1,4.95,17993.0,United Kingdom,2025-09-30
503543,22080,RIBBON REEL SPOTS DESIGN ,1,1.65,17993.0,United Kingdom,2025-09-30
503543,85113,POLKA DOT PISTACHIO PAIL,1,2.1,17993.0,United Kingdom,2025-09-30
503543,21472,LADYBIRD + BEE RAFFIA FOOD COVER,1,3.75,17993.0,United Kingdom,2025-09-30
503543,85186C,BUNNY EGG GARLAND,4,0.42,17993.0,United Kingdom,2025-09-30
503543,22247,BUNNY DECORATION MAGIC GARDEN,8,0.85,17993.0,United Kingdom,2025-09-30
503543,22287,"DECORATION , WOBBLY CHICKEN, METAL ",1,1.65,17993.0,United Kingdom,2025-09-30
503543,84509F,SET OF 4 NEW ENGLAND PLACEMATS,1,3.75,17993.0,United Kingdom,2025-09-30
503543,84510A,SET OF 4 ENGLISH ROSE COASTERS,1,1.25,17993.0,United Kingdom,2025-09-30
503543,21992,VINTAGE PAISLEY STATIONERY SET,1,2.95,17993.0,United Kingdom,2025-09-30
503543,85031A,ROMANTIC IMAGES SCRAP BOOK SET,1,4.95,17993.0,United Kingdom,2025-09-30
503543,20616,CHERRY BLOSSOM PASSPORT COVER,1,2.1,17993.0,United Kingdom,2025-09-30
503543,84510A,SET OF 4 ENGLISH ROSE COASTERS,1,1.25,17993.0,United Kingdom,2025-09-30
503543,20865,PATCHWORK PENCIL CASE BUTTERFLY ,1,2.1,17993.0,United Kingdom,2025-09-30
503543,37464,ROBOT MUG IN DISPLAY BOX,1,1.25,17993.0,United Kingdom,2025-09-30
503543,22147,FELTCRAFT BUTTERFLY HEARTS,1,1.45,17993.0,United Kingdom,2025-09-30
503543,22122,SET OF 2 FANCY FONT TEA TOWELS,1,2.95,17993.0,United Kingdom,2025-09-30
503543,22286,"DECORATION , WOBBLY RABBIT , METAL ",1,1.65,17993.0,United Kingdom,2025-09-30
503543,20871,OPULENT VELVET SET/3 CANDLES,1,2.1,17993.0,United Kingdom,2025-09-30
503543,20886,BOX OF 9 PEBBLE CANDLES,1,1.95,17993.0,United Kingdom,2025-09-30
503543,72800F,4 IVORY DINNER CANDLES GOLD FLOCK,1,2.55,17993.0,United Kingdom,2025-09-30
503543,85160A,WHITE BIRD GARDEN DESIGN MUG,2,1.25,17993.0,United Kingdom,2025-09-30
503543,85035C,ROSE 3 WICK MORRIS BOX CANDLE,1,4.25,17993.0,United Kingdom,2025-09-30
503543,84457,SET/3 RABBITS FLOWER SKIPPPING ROPE,1,0.85,17993.0,United Kingdom,2025-09-30
503543,21897,POTTING SHED CANDLE CITRONELLA,1,2.95,17993.0,United Kingdom,2025-09-30
503543,21611,SET OF 12 LILY BOTANICAL T-LIGHTS,1,2.95,17993.0,United Kingdom,2025-09-30
503543,84509A,SET OF 4 ENGLISH ROSE PLACEMATS,1,3.75,17993.0,United Kingdom,2025-09-30
503543,85099B,RED RETROSPOT JUMBO BAG ,2,1.95,17993.0,United Kingdom,2025-09-30
503543,47597,NEW ENGLAND TEATOWELS,1,2.55,17993.0,United Kingdom,2025-09-30
503543,84992,72 SWEETHEART FAIRY CAKE CASES,1,0.55,17993.0,United Kingdom,2025-09-30
503543,21836,GINGHAM OVEN GLOVE RED HEART ,1,3.75,17993.0,United Kingdom,2025-09-30
503543,20772,GARDEN PATH JOURNAL,1,2.55,17993.0,United Kingdom,2025-09-30
503543,22557,PLASTERS IN TIN VINTAGE PAISLEY ,1,1.65,17993.0,United Kingdom,2025-09-30
503543,22372,AIRLINE BAG VINTAGE WORLD CHAMPION ,1,6.35,17993.0,United Kingdom,2025-09-30
503543,37370,RETRO COFFEE MUGS ASSORTED,2,1.25,17993.0,United Kingdom,2025-09-30
503543,22562,MONSTERS STENCIL CRAFT,1,1.25,17993.0,United Kingdom,2025-09-30
503543,84510F,SET OF 4 NEW ENGLAND COASTERS ,1,1.25,17993.0,United Kingdom,2025-09-30
503545,22138,BAKING SET 9 PIECE RETROSPOT ,3,4.95,13750.0,United Kingdom,2025-09-30
503545,20676,RED SPOTTY BOWL,8,1.25,13750.0,United Kingdom,2025-09-30
503545,85042,ANTIQUE LILY FAIRY LIGHTS,4,4.95,13750.0,United Kingdom,2025-09-30
503545,22179,SET 10 LIGHTS NIGHT OWL,2,6.75,13750.0,United Kingdom,2025-09-30
503545,20716,PARTY FOOD SHOPPER BAG,10,1.25,13750.0,United Kingdom,2025-09-30
503545,22352,LUNCHBOX WITH CUTLERY RETROSPOT ,6,2.55,13750.0,United Kingdom,2025-09-30
503545,22353,LUNCHBOX WITH CUTLERY FAIRY CAKES ,6,2.55,13750.0,United Kingdom,2025-09-30
503545,22200,FRYING PAN PINK POLKADOT ,4,4.25,13750.0,United Kingdom,2025-09-30
503545,22191,EAU DE NIL DINER WALL CLOCK,2,8.5,13750.0,United Kingdom,2025-09-30
503545,22222,CAKE PLATE LOVEBIRD WHITE,3,4.95,13750.0,United Kingdom,2025-09-30
503545,22215,CAKE STAND WHITE TWO TIER LACE,2,8.5,13750.0,United Kingdom,2025-09-30
503545,22218,CAKE STAND LACE WHITE,6,4.25,13750.0,United Kingdom,2025-09-30
503545,22194,BLACK DINER WALL CLOCK,2,8.5,13750.0,United Kingdom,2025-09-30
503545,22202,MILK PAN PINK RETROSPOT,4,3.75,13750.0,United Kingdom,2025-09-30
503545,82001S,VINYL RECORD FRAME SILVER,4,3.75,13750.0,United Kingdom,2025-09-30
503545,21137,BLACK RECORD COVER FRAME,16,3.75,13750.0,United Kingdom,2025-09-30
503545,22468,BABUSHKA LIGHTS STRING OF 10,2,6.75,13750.0,United Kingdom,2025-09-30
503546,21930,JUMBO STORAGE BAG SKULLS,10,1.95,16351.0,United Kingdom,2025-09-30
503546,22379,RECYCLING BAG RETROSPOT ,5,2.1,16351.0,United Kingdom,2025-09-30
503546,22381,TOY TIDY PINK RETROSPOT  ,5,2.1,16351.0,United Kingdom,2025-09-30
503546,22384,LUNCH BAG PINK RETROSPOT,10,1.65,16351.0,United Kingdom,2025-09-30
503546,22317,FIVE CATS HANGING DECORATION,6,2.95,16351.0,United Kingdom,2025-09-30
503546,22321,BIRD DECORATION RED SPOT,12,0.85,16351.0,United Kingdom,2025-09-30
503546,22554,PLASTERS IN TIN WOODLAND ANIMALS,12,1.65,16351.0,United Kingdom,2025-09-30
503546,22553,PLASTERS IN TIN SKULLS,12,1.65,16351.0,United Kingdom,2025-09-30
503546,20725,LUNCH BAG RED SPOTTY,10,1.65,16351.0,United Kingdom,2025-09-30
503546,21733,RED HANGING HEART T-LIGHT HOLDER,6,2.95,16351.0,United Kingdom,2025-09-30
503546,22189,CREAM HEART CARD HOLDER,8,3.95,16351.0,United Kingdom,2025-09-30
503546,20726,LUNCH BAG WOODLAND,10,1.65,16351.0,United Kingdom,2025-09-30
503546,20727,LUNCH BAG  BLACK SKULL.,10,1.65,16351.0,United Kingdom,2025-09-30
503546,21471,STRAWBERRY RAFFIA FOOD COVER,6,3.75,16351.0,United Kingdom,2025-09-30
503546,21472,LADYBIRD + BEE RAFFIA FOOD COVER,6,3.75,16351.0,United Kingdom,2025-09-30
503546,22507,MEMO BOARD RETROSPOT  DESIGN,4,4.95,16351.0,United Kingdom,2025-09-30
503546,22508,DOORSTOP RETROSPOT HEART,4,3.75,16351.0,United Kingdom,2025-09-30
503547,22487,WHITE WOOD GARDEN PLANT LADDER,1,9.95,14049.0,United Kingdom,2025-09-30
503547,84901,BLACK FACE LAMB WITH PANTS,2,3.75,14049.0,United Kingdom,2025-09-30
503547,84578,ELEPHANT TOY WITH BLUE T-SHIRT,2,3.75,14049.0,United Kingdom,2025-09-30
503547,84077,WORLD WAR 2 GLIDERS ASSTD DESIGNS,48,0.21,14049.0,United Kingdom,2025-09-30
503547,47593A,CAROUSEL DESIGN BABY BIB,3,1.25,14049.0,United Kingdom,2025-09-30
503547,47592A,CAROUSEL DES CHILD'S OVERALL,2,2.1,14049.0,United Kingdom,2025-09-30
503547,47593B,SCOTTIES DESIGN BABY BIB,4,1.25,14049.0,United Kingdom,2025-09-30
503547,22367,CHILDS APRON SPACEBOY DESIGN,3,1.95,14049.0,United Kingdom,2025-09-30
503547,21452,TOADSTOOL MONEY BOX,1,2.95,14049.0,United Kingdom,2025-09-30
503547,21788,KIDS RAIN MAC BLUE,3,0.85,14049.0,United Kingdom,2025-09-30
