Invoice,StockCode,Description,Quantity,Price,Customer ID,Country,InvoiceDate
512922,22427,ENAMEL FLOWER JUG CREAM,1,5.95,13676.0,United Kingdom,2025-12-01
512922,21688,SILVER PLATE CANDLE BOWL SMALL,12,2.95,13676.0,United Kingdom,2025-12-01
512922,84949,SILVER HANGING T-LIGHT HOLDER,6,1.65,13676.0,United Kingdom,2025-12-01
512922,90185B,AMETHYST DIAMANTE EXPANDABLE RING,1,4.25,13676.0,United Kingdom,2025-12-01
512922,90046,WHITE WITH METAL BAG CHARM,2,4.95,13676.0,United Kingdom,2025-12-01
512922,90210A,GREY ACRYLIC FACETED BANGLE,1,2.95,13676.0,United Kingdom,2025-12-01
