Invoice,StockCode,Description,Quantity,Price,Customer ID,Country,InvoiceDate
494912,85232B,SET/3 RUSSIAN DOLL STACKING TINS,6,4.95,16705.0,United Kingdom,2025-07-30
494912,22045,SPACE BOY GIFT WRAP,25,0.42,16705.0,United Kingdom,2025-07-30
494914,22046,TEA PARTY  WRAPPING PAPER ,25,0.42,16705.0,United Kingdom,2025-07-30
494914,PADS,PADS TO MATCH ALL CUSHIONS,1,0.001,16705.0,United Kingdom,2025-07-30
494914,22322,BIRD DECORATION GREEN  SPOT,24,0.85,16705.0,United Kingdom,2025-07-30
494914,22321,BIRD DECORATION RED SPOT,24,0.85,16705.0,United Kingdom,2025-07-30
494914,22029,SPACEBOY BIRTHDAY CARD,12,0.42,16705.0,United Kingdom,2025-07-30
494914,21717,EASTER TIN BUCKET,32,2.1,16705.0,United Kingdom,2025-07-30
494914,22146,EASTER CRAFT IVY WREATH WITH CHICK,40,1.65,16705.0,United Kingdom,2025-07-30
494914,22148,EASTER CRAFT 4 CHICKS ,40,1.65,16705.0,United Kingdom,2025-07-30
494914,22045,SPACEBOY GIFT WRAP,25,0.42,16705.0,United Kingdom,2025-07-30
494914,22052,VINTAGE CARAVAN GIFT WRAP,25,0.42,16705.0,United Kingdom,2025-07-30
494914,22305,COFFEE MUG PINK PAISLEY DESIGN,36,2.1,16705.0,United Kingdom,2025-07-30
494914,22366,DOORMAT AIRMAIL ,10,5.95,16705.0,United Kingdom,2025-07-30
494914,21519,GIN & TONIC DIET GREETING CARD ,12,0.42,16705.0,United Kingdom,2025-07-30
494914,22358,KINGS CHOICE TEA CADDY ,6,2.95,16705.0,United Kingdom,2025-07-30
494914,22352,LUNCHBOX WITH CUTLERY RETROSPOT ,6,2.55,16705.0,United Kingdom,2025-07-30
494914,21790,VINTAGE SNAP CARDS,72,0.72,16705.0,United Kingdom,2025-07-30
494914,22357,KINGS CHOICE BISCUIT TIN,12,3.75,16705.0,United Kingdom,2025-07-30
494914,21716,BOYS VINTAGE TIN SEASIDE BUCKET,32,2.1,16705.0,United Kingdom,2025-07-30
494914,20914,SET/5 RED SPOTTY LID GLASS BOWLS,32,2.55,16705.0,United Kingdom,2025-07-30
494914,21791,VINTAGE HEADS AND TAILS CARD GAME ,72,1.06,16705.0,United Kingdom,2025-07-30
494915,85049D,BRIGHT BLUES RIBBONS ,4,1.25,13564.0,United Kingdom,2025-07-30
494915,82587,TEXRIO TOMATOES CANDLE+CUP,2,1.25,13564.0,United Kingdom,2025-07-30
494915,85049H,URBAN BLACK RIBBONS ,4,1.25,13564.0,United Kingdom,2025-07-30
494915,21123,SET/10 IVORY SPOTTY PARTY CANDLES,2,1.25,13564.0,United Kingdom,2025-07-30
494915,21122,SET/10 PINK SPOTTY PARTY CANDLES,3,1.25,13564.0,United Kingdom,2025-07-30
494915,21326,AGED GLASS SILVER T-LIGHT HOLDER,12,0.65,13564.0,United Kingdom,2025-07-30
494915,22207,FRYING PAN UNION FLAG,3,4.25,13564.0,United Kingdom,2025-07-30
494915,82585,SWEET VALENCIA CANDLE+CUP,3,1.25,13564.0,United Kingdom,2025-07-30
494915,72728,ROSE SCENT CANDLES IN GLASS,9,0.85,13564.0,United Kingdom,2025-07-30
494915,84988,SET OF 72 PINK HEART PAPER DOILIES,6,1.45,13564.0,United Kingdom,2025-07-30
494915,85040A,S/4 PINK FLOWER CANDLES IN BOWL,12,1.65,13564.0,United Kingdom,2025-07-30
494915,85049C,ROMANTIC PINKS RIBBONS ,4,1.25,13564.0,United Kingdom,2025-07-30
494915,72741,GRAND CHOCOLATECANDLE,9,1.45,13564.0,United Kingdom,2025-07-30
494915,21550,CERAMIC BIRDHOUSE CRESTED TIT LARGE,1,5.95,13564.0,United Kingdom,2025-07-30
494915,82580,BATHROOM METAL SIGN,4,0.55,13564.0,United Kingdom,2025-07-30
494915,82578,KITCHEN METAL SIGN,5,0.55,13564.0,United Kingdom,2025-07-30
494915,82581,TOILET METAL SIGN,3,0.55,13564.0,United Kingdom,2025-07-30
494915,84987,SET OF 36 TEATIME PAPER DOILIES,7,1.45,13564.0,United Kingdom,2025-07-30
494915,22171,3 HOOK PHOTO SHELF ANTIQUE WHITE,2,8.5,13564.0,United Kingdom,2025-07-30
494915,84992,72 SWEETHEART FAIRY CAKE CASES,8,0.55,13564.0,United Kingdom,2025-07-30
494915,21256,"FRENCH BOTTLE, BRASSERIE DES ARTIST",4,1.65,13564.0,United Kingdom,2025-07-30
494915,82494L,WOODEN FRAME ANTIQUE WHITE ,4,2.95,13564.0,United Kingdom,2025-07-30
494915,48194,DOORMAT HEARTS,6,6.75,13564.0,United Kingdom,2025-07-30
494915,48138,DOOR MAT UNION FLAG,10,5.95,13564.0,United Kingdom,2025-07-30
494915,20713,JUMBO BAG OWLS,6,1.95,13564.0,United Kingdom,2025-07-30
494915,85099C,JUMBO  BAG BAROQUE BLACK WHITE,7,1.95,13564.0,United Kingdom,2025-07-30
494915,85099B,JUMBO BAG RED WHITE SPOTTY ,10,1.95,13564.0,United Kingdom,2025-07-30
494915,16161E,WRAP BOUDOIR ,50,0.1,13564.0,United Kingdom,2025-07-30
494915,16161G,WRAP BAD HAIR DAY,25,0.1,13564.0,United Kingdom,2025-07-30
494915,22172,METAL SHELF WITH RAIL ,2,8.5,13564.0,United Kingdom,2025-07-30
494915,20718,RED SPOTTY SHOPPER BAG,10,1.25,13564.0,United Kingdom,2025-07-30
494915,21756,BATH BUILDING BLOCK WORD,4,5.95,13564.0,United Kingdom,2025-07-30
494915,85038,6 CHOCOLATE LOVE HEART T-LIGHTS,10,2.1,13564.0,United Kingdom,2025-07-30
494915,37503,TEA TIME CAKE STAND IN GIFT BOX,2,10.75,13564.0,United Kingdom,2025-07-30
494915,37340,MULTICOLOUR SPRING FLOWER MUG,12,0.85,13564.0,United Kingdom,2025-07-30
494915,20798,CLEAR MILKSHAKE GLASS,4,2.1,13564.0,United Kingdom,2025-07-30
494915,21067,VINTAGE RED TEATIME MUG,6,1.25,13564.0,United Kingdom,2025-07-30
494915,84991,60 TEATIME FAIRY CAKE CASES,8,0.55,13564.0,United Kingdom,2025-07-30
494915,21255,"FRENCH BOTTLE , LAVENDER",5,1.65,13564.0,United Kingdom,2025-07-30
494915,21755,LOVE BUILDING BLOCK WORD,2,5.95,13564.0,United Kingdom,2025-07-30
494915,48173C,DOOR MAT BLACK FLOCK ,4,6.75,13564.0,United Kingdom,2025-07-30
494915,21548,CERAMIC BIRDHOUSE FINCH BLUE ROOF,2,2.95,13564.0,United Kingdom,2025-07-30
494915,21548,CERAMIC BIRDHOUSE FINCH BLUE ROOF,2,2.95,13564.0,United Kingdom,2025-07-30
494915,84050,PINK HEART SHAPE EGG FRYING PAN,1,1.65,13564.0,United Kingdom,2025-07-30
494915,84029E,RED WOOLLY HOTTIE WHITE HEART.,24,2.95,13564.0,United Kingdom,2025-07-30
494915,21554,CERAMIC BIRDHOUSE RED ROOF LARGE,1,5.95,13564.0,United Kingdom,2025-07-30
494915,20941,FROG CANDLE,6,1.25,13564.0,United Kingdom,2025-07-30
494915,21876,POTTERING MUG,6,1.25,13564.0,United Kingdom,2025-07-30
494915,35965,FOLKART HEART NAPKIN RINGS,6,2.95,13564.0,United Kingdom,2025-07-30
494915,82585,SWEET VALENCIA CANDLE+CUP,1,1.25,13564.0,United Kingdom,2025-07-30
494915,21137,BLACK RECORD COVER FRAME,10,3.75,13564.0,United Kingdom,2025-07-30
494915,72023F,RED ORGANIC CANDLE IN GLASS,12,1.25,13564.0,United Kingdom,2025-07-30
494915,21590,KINGS CHOICE CIGAR BOX MATCHES ,10,1.25,13564.0,United Kingdom,2025-07-30
494915,72739C,DARK CHOCOLATE SCENTCANDLE,12,1.25,13564.0,United Kingdom,2025-07-30
494915,22058,CERAMIC LOVE HEARTS DESIGN MUG,9,1.49,13564.0,United Kingdom,2025-07-30
494915,85175,CACTI T-LIGHT CANDLES,32,0.42,13564.0,United Kingdom,2025-07-30
494915,84978,HANGING HEART JAR T-LIGHT HOLDER,12,1.25,13564.0,United Kingdom,2025-07-30
494915,21879,HEARTS GIFT TAPE,12,0.65,13564.0,United Kingdom,2025-07-30
494915,21175,GIN + TONIC DIET METAL SIGN,12,2.1,13564.0,United Kingdom,2025-07-30
494915,21547,CERAMIC BIRDHOUSE CRESTED TIT SMALL,2,2.95,13564.0,United Kingdom,2025-07-30
494915,21181,PLEASE ONE PERSON  METAL SIGN,12,2.1,13564.0,United Kingdom,2025-07-30
494915,21068,VINTAGE BILLBOARD LOVE/HATE MUG,12,1.25,13564.0,United Kingdom,2025-07-30
494915,21908,CHOCOLATE THIS WAY METAL SIGN,12,2.1,13564.0,United Kingdom,2025-07-30
494915,21589,SWALLOW GIANT TUBE MATCHES,6,2.55,13564.0,United Kingdom,2025-07-30
494915,21985,PACK OF 12 HEARTS DESIGN TISSUES ,36,0.29,13564.0,United Kingdom,2025-07-30
494915,82587,TEXRIO TOMATOES CANDLE+CUP,2,1.25,13564.0,United Kingdom,2025-07-30
494915,82585,SWEET VALENCIA CANDLE+CUP,4,1.25,13564.0,United Kingdom,2025-07-30
494915,82587,TEXRIO TOMATOES CANDLE+CUP,1,1.25,13564.0,United Kingdom,2025-07-30
494915,82587,TEXRIO TOMATOES CANDLE+CUP,1,1.25,13564.0,United Kingdom,2025-07-30
494915,84970S,HANGING HEART ZINC T-LIGHT HOLDER,12,0.85,13564.0,United Kingdom,2025-07-30
494915,37352,BIRD IN TREE MUG ,6,1.25,13564.0,United Kingdom,2025-07-30
494915,20798,CLEAR MILKSHAKE GLASS,4,2.1,13564.0,United Kingdom,2025-07-30
494915,21550,CERAMIC BIRDHOUSE CRESTED TIT LARGE,1,5.95,13564.0,United Kingdom,2025-07-30
494915,22058,CERAMIC LOVE HEARTS DESIGN MUG,1,1.49,13564.0,United Kingdom,2025-07-30
494915,21664,RIDGED GLASS STORAGE JAR CREAM LID,3,3.75,13564.0,United Kingdom,2025-07-30
494915,21870,I CAN ONLY PLEASE ONE PERSON MUG,6,1.25,13564.0,United Kingdom,2025-07-30
494915,37461,FUNKY MONKEY MUG,6,1.25,13564.0,United Kingdom,2025-07-30
494915,84050,PINK HEART SHAPE EGG FRYING PAN,7,1.65,13564.0,United Kingdom,2025-07-30
494915,22189,CREAM HEART CARD HOLDER,6,3.95,13564.0,United Kingdom,2025-07-30
494915,21123,SET/10 IVORY SPOTTY PARTY CANDLES,1,1.25,13564.0,United Kingdom,2025-07-30
494915,35968,FOLK ART METAL HEART T-LIGHT HOLDER,12,0.38,13564.0,United Kingdom,2025-07-30
494916,75149N,STRING CRYSTALS NATURAL,6,1.25,17963.0,United Kingdom,2025-07-30
494916,85113,POLKA DOT PISTACHIO PAIL,4,2.1,17963.0,United Kingdom,2025-07-30
494916,85208,SET/12 FUNKY FELT FLOWER PEG IN BAG,1,2.1,17963.0,United Kingdom,2025-07-30
494916,22138,BAKING SET 9 PIECE RETROSPOT ,3,4.95,17963.0,United Kingdom,2025-07-30
494916,84050,PINK HEART SHAPE EGG FRYING PAN,2,1.65,17963.0,United Kingdom,2025-07-30
494916,84991,60 TEATIME FAIRY CAKE CASES,6,0.55,17963.0,United Kingdom,2025-07-30
494916,84992,72 SWEETHEART FAIRY CAKE CASES,6,0.55,17963.0,United Kingdom,2025-07-30
494916,21212,PACK OF 72 RETRO SPOT CAKE CASES,6,0.55,17963.0,United Kingdom,2025-07-30
494916,21213,PACK OF 72 SKULL CAKE CASES,6,0.55,17963.0,United Kingdom,2025-07-30
494916,21975,PACK OF 60 DINOSAUR CAKE CASES,6,0.55,17963.0,United Kingdom,2025-07-30
494916,22062,CERAMIC BOWL WITH LOVE HEART DESIGN,1,2.95,17963.0,United Kingdom,2025-07-30
494916,22054,MINI CAKE STAND HANGING HEARTS,3,1.65,17963.0,United Kingdom,2025-07-30
494916,22058,CERAMIC LOVE HEARTS DESIGN MUG,3,1.49,17963.0,United Kingdom,2025-07-30
494916,22062,CERAMIC BOWL WITH LOVE HEART DESIGN,2,2.95,17963.0,United Kingdom,2025-07-30
494916,35965,FOLKART HEART NAPKIN RINGS,3,2.95,17963.0,United Kingdom,2025-07-30
494916,84378,SET OF 3 HEART COOKIE CUTTERS,3,1.25,17963.0,United Kingdom,2025-07-30
494916,22195,LARGE HEART MEASURING SPOONS,2,1.65,17963.0,United Kingdom,2025-07-30
494916,47591C,BLUE FAIRY CAKE CHILD'S APRON,2,1.95,17963.0,United Kingdom,2025-07-30
494916,22021,BLUE FELT EASTER EGG BASKET,5,1.65,17963.0,United Kingdom,2025-07-30
494916,84750B,BLACK SMALL GLASS CAKE STAND,2,1.95,17963.0,United Kingdom,2025-07-30
494916,21448,12 DAISY PEGS IN WOOD BOX,1,1.65,17963.0,United Kingdom,2025-07-30
494916,85206A,CREAM FELT EASTER EGG BASKET,5,1.65,17963.0,United Kingdom,2025-07-30
494916,47591D,PINK FAIRY CAKE CHILD'S APRON,2,1.95,17963.0,United Kingdom,2025-07-30
494916,47591B,SCOTTIES DES CHILD'S APRON,2,1.65,17963.0,United Kingdom,2025-07-30
494916,22367,CHILDS APRON SPACEBOY DESIGN,4,1.95,17963.0,United Kingdom,2025-07-30
494916,21156,RED SPOTTY CHILDS APRON,2,1.95,17963.0,United Kingdom,2025-07-30
494916,85206B,PINK FELT EASTER EGG BASKET,5,1.65,17963.0,United Kingdom,2025-07-30
494916,22196,SMALL HEART MEASURING SPOONS,3,0.85,17963.0,United Kingdom,2025-07-30
494916,84380,SET OF 3 BUTTERFLY COOKIE CUTTERS,1,1.25,17963.0,United Kingdom,2025-07-30
494916,22062,CERAMIC BOWL WITH LOVE HEART DESIGN,1,2.95,17963.0,United Kingdom,2025-07-30
494916,22054,MINI CAKE STAND HANGING HEARTS,1,1.65,17963.0,United Kingdom,2025-07-30
494916,84988,SET OF 72 PINK HEART PAPER DOILIES,1,1.45,17963.0,United Kingdom,2025-07-30
494916,22060,LARGE CAKE STAND HANGING HEARTS,1,9.95,17963.0,United Kingdom,2025-07-30
494916,22236,CAKE STAND 3 TIER MAGIC GARDEN,1,12.75,17963.0,United Kingdom,2025-07-30
494916,22195,LARGE HEART MEASURING SPOONS,1,1.65,17963.0,United Kingdom,2025-07-30
494917,85024C,PINK SMALL JEWELLED PHOTOFRAME,1,1.65,14983.0,United Kingdom,2025-07-30
494917,85023B,EAU DE NILE JEWELLED PHOTOFRAME,1,2.55,14983.0,United Kingdom,2025-07-30
494917,85025B,EAU DE NILE HEART SHAPE PHOTO FRAME,1,1.65,14983.0,United Kingdom,2025-07-30
494917,85024B,EAU DE NILE JEWELLED PHOTOFRAME,1,1.65,14983.0,United Kingdom,2025-07-30
494917,85123A,WHITE HANGING HEART T-LIGHT HOLDER,3,2.95,14983.0,United Kingdom,2025-07-30
494917,22297,HEART IVORY TRELLIS SMALL,4,1.25,14983.0,United Kingdom,2025-07-30
494917,21899,"KEY FOB , GARAGE DESIGN",1,0.65,14983.0,United Kingdom,2025-07-30
494917,21385,IVORY HANGING DECORATION  HEART,3,0.85,14983.0,United Kingdom,2025-07-30
494917,85099C,JUMBO  BAG BAROQUE BLACK WHITE,2,1.95,14983.0,United Kingdom,2025-07-30
494917,21900,"KEY FOB , SHED",1,0.65,14983.0,United Kingdom,2025-07-30
494917,21901,"KEY FOB , BACK DOOR ",1,0.65,14983.0,United Kingdom,2025-07-30
494917,85025C,PINK HEART SHAPE PHOTO FRAME,1,1.65,14983.0,United Kingdom,2025-07-30
494917,22294,HEART FILIGREE DOVE  SMALL,3,1.25,14983.0,United Kingdom,2025-07-30
494917,85023C,PINK LARGE JEWELED PHOTOFRAME,1,2.55,14983.0,United Kingdom,2025-07-30
494917,21326,AGED GLASS SILVER T-LIGHT HOLDER,12,0.65,14983.0,United Kingdom,2025-07-30
494917,82494L,WOODEN FRAME ANTIQUE WHITE ,1,2.95,14983.0,United Kingdom,2025-07-30
494917,85023A,CRYSTAL LARGE JEWELLED PHOTO FRAME,4,2.55,14983.0,United Kingdom,2025-07-30
494917,21902,"KEY FOB , FRONT  DOOR ",1,0.65,14983.0,United Kingdom,2025-07-30
494917,84691,PACK 20 DOLLY PEGS,1,0.85,14983.0,United Kingdom,2025-07-30
494917,85049H,URBAN BLACK RIBBONS ,4,1.25,14983.0,United Kingdom,2025-07-30
494917,22103,MIRROR MOSAIC T-LIGHT HOLDER ROUND,6,1.65,14983.0,United Kingdom,2025-07-30
494917,72799E,IVORY PILLAR CANDLE SILVER FLOCK,1,2.95,14983.0,United Kingdom,2025-07-30
494917,22182,CAKE STAND VICTORIAN FILIGREE SMALL,1,4.95,14983.0,United Kingdom,2025-07-30
494917,21340,CLASSIC METAL BIRDCAGE PLANT HOLDER,1,12.75,14983.0,United Kingdom,2025-07-30
494917,21696,SMALL SILVER TRELLIS CANDLEPOT,6,2.95,14983.0,United Kingdom,2025-07-30
494917,21688,SILVER PLATE CANDLE BOWL SMALL,6,2.95,14983.0,United Kingdom,2025-07-30
494917,85062,PEARL CRYSTAL PUMPKIN T-LIGHT HLDR,18,1.65,14983.0,United Kingdom,2025-07-30
494917,22106,MIRROR MOSAIC HURRICANE LAMP ,1,6.75,14983.0,United Kingdom,2025-07-30
494917,82483,WOOD 2 DRAWER CABINET WHITE FINISH,2,5.95,14983.0,United Kingdom,2025-07-30
494917,71053,WHITE METAL LANTERN,1,3.75,14983.0,United Kingdom,2025-07-30
494918,21770,OPEN CLOSED METAL SIGN,1,10.17,,United Kingdom,2025-07-30
494918,21678,PAISLEY PATTERN  STICKERS,1,0.81,,United Kingdom,2025-07-30
494918,21768,WALL MOUNTED VINTAGE ORGANISER,1,29.74,,United Kingdom,2025-07-30
494918,21735,TWO DOOR CURIO CABINET,1,25.49,,United Kingdom,2025-07-30
494918,21723,ALPHABET HEARTS STICKER SHEET,1,1.66,,United Kingdom,2025-07-30
494918,21718,RED METAL BEACH SPADE ,4,2.51,,United Kingdom,2025-07-30
494918,21716,BOYS VINTAGE TIN SEASIDE BUCKET,1,5.06,,United Kingdom,2025-07-30
494918,21680,WOODLAND  STICKERS,2,0.81,,United Kingdom,2025-07-30
494918,21677,HEARTS  STICKERS,4,0.81,,United Kingdom,2025-07-30
494918,90161D,ANT COPPER PINK BOUDICCA BRACELET,1,5.09,,United Kingdom,2025-07-30
494918,21955,  DOORMAT UNION JACK GUNS AND ROSES,2,13.57,,United Kingdom,2025-07-30
494918,21895,POTTING SHED SOW 'N' GROW SET,1,8.47,,United Kingdom,2025-07-30
494918,21676,FLOWERS  STICKERS,1,0.81,,United Kingdom,2025-07-30
494918,20773,BLUE PAISLEY NOTEBOOK,1,1.66,,United Kingdom,2025-07-30
494918,90170,DAISY HAIR BAND,3,1.69,,United Kingdom,2025-07-30
494918,21775,DECORATIVE FLORE BATHROOM BOTTLE,1,2.51,,United Kingdom,2025-07-30
494918,90161B,ANT COPPER TURQ BOUDICCA BRACELET,1,5.09,,United Kingdom,2025-07-30
494918,90158,ST TROPEZ NECKLACE,1,5.09,,United Kingdom,2025-07-30
494918,90147,CHUNKY SILVER NECKLACE PASTEL FLOWE,1,10.62,,United Kingdom,2025-07-30
494918,22028,PENNY FARTHING BIRTHDAY CARD,1,0.84,,United Kingdom,2025-07-30
494918,21790,VINTAGE SNAP CARDS,1,1.66,,United Kingdom,2025-07-30
494918,35001W,HAND OPEN SHAPE DECO.WHITE,4,4.21,,United Kingdom,2025-07-30
494918,22090,PAPER BUNTING RETRO SPOTS,1,5.91,,United Kingdom,2025-07-30
494918,90204,PAIR OF ENAMEL BUTTERFLY HAIRCLIP,1,3.39,,United Kingdom,2025-07-30
494918,90202D,PINK ENAMEL FLOWER HAIR TIE,1,2.96,,United Kingdom,2025-07-30
494918,90195A,PURPLE GEMSTONE BRACELET,1,9.34,,United Kingdom,2025-07-30
494918,90192,JADE DROP EARRINGS W FILIGREE,1,5.09,,United Kingdom,2025-07-30
494918,90178A,AMBER CHUNKY GLASS+BEAD NECKLACE,1,11.9,,United Kingdom,2025-07-30
494918,85232B,SET/3 RUSSIAN DOLL STACKING TINS,1,10.17,,United Kingdom,2025-07-30
494918,85202,HANGING WOOD AND FELT HEART,2,0.84,,United Kingdom,2025-07-30
494918,85199S,SMALL HANGING IVORY/RED WOOD BIRD,2,0.81,,United Kingdom,2025-07-30
494918,85199L,LARGE HANGING IVORY & RED WOOD BIRD,1,1.28,,United Kingdom,2025-07-30
494918,84378,SET OF 3 HEART COOKIE CUTTERS,2,2.51,,United Kingdom,2025-07-30
494918,84251J,"GREETING CARD, THE BLACK CAT",1,0.84,,United Kingdom,2025-07-30
494918,84247G,"DECOUPAGE,GREETING CARD,",1,0.84,,United Kingdom,2025-07-30
494918,82613B,"METAL SIGN,CUPCAKE SINGLE HOOK",2,2.51,,United Kingdom,2025-07-30
494918,82483,WOOD 2 DRAWER CABINET WHITE FINISH,1,12.72,,United Kingdom,2025-07-30
494918,47559B,TEA TIME OVEN GLOVE,1,2.51,,United Kingdom,2025-07-30
494918,46775A,BUBBLE GUM CHUNKY KNITTED THROW ,7,11.02,,United Kingdom,2025-07-30
494918,90145,SILVER HOOP EARRINGS WITH FLOWER,2,6.37,,United Kingdom,2025-07-30
494918,22342,HOME GARLAND PAINTED ZINC ,1,3.36,,United Kingdom,2025-07-30
494918,22319,HAIRCLIPS FORTIES FABRIC ASSORTED,1,4.21,,United Kingdom,2025-07-30
494918,21847,GREEN  DIAMANTE PEN IN GIFT BOX,3,2.51,,United Kingdom,2025-07-30
494918,22180,RETRO SPOT LAMP,1,21.23,,United Kingdom,2025-07-30
494918,21846,PINK DIAMANTE PEN IN GIFT BOX,3,2.51,,United Kingdom,2025-07-30
494918,90141D,ROSE PENDANT TRIPLE SHELL NECKLACE,1,5.51,,United Kingdom,2025-07-30
494918,90129D,AMBER GLASS TASSLE BAG CHARM,1,1.66,,United Kingdom,2025-07-30
494918,90134,OLD ROSE COMBO BEAD NECKLACE,1,2.96,,United Kingdom,2025-07-30
494918,85121B,RETRO LAUNDRY TUB PINK,1,16.98,,United Kingdom,2025-07-30
494918,85117,NIGHTINGALE COATHOOK WHITE,1,3.36,,United Kingdom,2025-07-30
494918,85099C,JUMBO  BAG BAROQUE BLACK WHITE,1,4.21,,United Kingdom,2025-07-30
494918,85099B,JUMBO BAG RED WHITE SPOTTY ,8,4.21,,United Kingdom,2025-07-30
494918,85098B,BLUE FLYING SINGING CANARY,1,7.62,,United Kingdom,2025-07-30
494918,85097B,BLUE ROCKING SINGING CANARY,2,7.62,,United Kingdom,2025-07-30
494918,85086A,CANDY SPOT HEART DECORATION,1,1.66,,United Kingdom,2025-07-30
494918,85066,CREAM SWEETHEART MINI CHEST,1,25.49,,United Kingdom,2025-07-30
494918,85062,PEARL CRYSTAL PUMPKIN T-LIGHT HLDR,1,2.51,,United Kingdom,2025-07-30
494918,85123A,WHITE HANGING HEART T-LIGHT HOLDER,4,5.91,,United Kingdom,2025-07-30
494918,85053,FRENCH ENAMEL CANDLEHOLDER,3,4.21,,United Kingdom,2025-07-30
494918,85034C,3 ROSE MORRIS BOXED CANDLES,1,8.47,,United Kingdom,2025-07-30
494918,85034A,3 GARDENIA MORRIS BOXED CANDLES,1,8.47,,United Kingdom,2025-07-30
494918,85017C,ENVELOPE 50 CURIOUS IMAGES,1,0.81,,United Kingdom,2025-07-30
494918,85017A,ENVELOPE 50 ROMANTIC IMAGES,1,0.81,,United Kingdom,2025-07-30
494918,85016,SET OF 6 VINTAGE NOTELETS KIT,3,2.51,,United Kingdom,2025-07-30
494918,85015,SET OF 12  VINTAGE POSTCARD SET,1,2.51,,United Kingdom,2025-07-30
494918,84990,60 GOLD AND SILVER FAIRY CAKE CASES,2,1.28,,United Kingdom,2025-07-30
494918,84978,HANGING HEART JAR T-LIGHT HOLDER,1,2.51,,United Kingdom,2025-07-30
494918,90209B,GREEN ENAMEL+GLASS HAIR COMB,2,2.11,,United Kingdom,2025-07-30
494918,85038,6 CHOCOLATE LOVE HEART T-LIGHTS,3,2.51,,United Kingdom,2025-07-30
494918,90141A,GREEN PENDANT TRIPLE SHELL NECKLACE,1,5.51,,United Kingdom,2025-07-30
494918,85185B,PINK HORSE SOCK PUPPET,1,5.91,,United Kingdom,2025-07-30
494918,21579,LOLITA  DESIGN  COTTON TOTE BAG,2,2.51,,United Kingdom,2025-07-30
494918,90133,TEAL/FUSCHIA COL BEAD NECKLACE,1,5.09,,United Kingdom,2025-07-30
494918,84975,HEART SHAPED MIRROR,1,3.36,,United Kingdom,2025-07-30
494918,90130B,TURQ STONE/CRYSTAL EARRINGS,2,2.96,,United Kingdom,2025-07-30
494918,90129E,PURPLE GLASS TASSLE BAG CHARM,2,1.66,,United Kingdom,2025-07-30
494918,90129A,PINK GLASS TASSLE BAG CHARM ,2,1.66,,United Kingdom,2025-07-30
494918,90120B,BLUE MURANO TWIST BRACELET,1,4.24,,United Kingdom,2025-07-30
494918,90098,NECKLACE+BRACELET PINK BUTTERFLY,13,1.66,,United Kingdom,2025-07-30
494918,90096,NECKLACE+BRACELET SET BLUE BLOSSOM,10,1.66,,United Kingdom,2025-07-30
494918,90062,CARNIVAL BRACELET,3,12.75,,United Kingdom,2025-07-30
494918,85185D,FROG SOCK PUPPET,1,5.91,,United Kingdom,2025-07-30
494918,90059F,DIAMANTE HAIR GRIP PACK/2 LT ROSE,1,1.69,,United Kingdom,2025-07-30
494918,90056,CHUNKY CRACKED GLAZE NECKLACE IVORY,1,11.05,,United Kingdom,2025-07-30
494918,90042A,FRESHWATER PEARL BRACELET GOLD,1,2.54,,United Kingdom,2025-07-30
494918,21675,BUTTERFLIES STICKERS,3,0.81,,United Kingdom,2025-07-30
494918,21669,BLUE STRIPE CERAMIC DRAWER KNOB,1,2.51,,United Kingdom,2025-07-30
494918,21668,RED STRIPE CERAMIC DRAWER KNOB,10,2.51,,United Kingdom,2025-07-30
494918,21643,ASSORTED TUTTI FRUTTI MIRROR,1,2.51,,United Kingdom,2025-07-30
494918,21626,VINTAGE UNION JACK PENNANT,1,4.21,,United Kingdom,2025-07-30
494918,21581,SKULLS  DESIGN  COTTON TOTE BAG,3,2.51,,United Kingdom,2025-07-30
494918,21580,RABBIT  DESIGN  COTTON TOTE BAG,2,2.51,,United Kingdom,2025-07-30
494918,90059A,DIAMANTE HAIR GRIP PACK/2 CRYSTAL,2,1.69,,United Kingdom,2025-07-30
494918,DCGS0068,DOGS NIGHT COLLAR,1,8.47,,United Kingdom,2025-07-30
494918,20914,SET/5 RED SPOTTY LID GLASS BOWLS,1,5.91,,United Kingdom,2025-07-30
494918,21868,POTTING SHED TEA MUG,1,3.36,,United Kingdom,2025-07-30
494918,20970,PINK FLORAL FELTCRAFT SHOULDER BAG,1,7.62,,United Kingdom,2025-07-30
494918,20966,SANDWICH BATH SPONGE,1,2.51,,United Kingdom,2025-07-30
494918,20961,STRAWBERRY BATH SPONGE ,1,2.51,,United Kingdom,2025-07-30
494918,21866,UNION JACK FLAG LUGGAGE TAG,1,2.51,,United Kingdom,2025-07-30
494918,21851,LILAC DIAMANTE PEN IN GIFT BOX,2,2.51,,United Kingdom,2025-07-30
494918,21850,BLUE  DIAMANTE PEN IN GIFT BOX,4,2.51,,United Kingdom,2025-07-30
494918,21849,SILVER DIAMANTE PEN IN GIFT BOX,1,2.51,,United Kingdom,2025-07-30
494918,21905,MORE BUTTER METAL SIGN ,1,1.66,,United Kingdom,2025-07-30
494918,21904,HOUSE WRECKING METAL SIGN ,3,1.66,,United Kingdom,2025-07-30
494918,20972,PINK CREAM FELT CRAFT TRINKET BOX ,1,2.51,,United Kingdom,2025-07-30
494918,21977,PACK OF 60 PINK PAISLEY CAKE CASES,2,1.28,,United Kingdom,2025-07-30
494918,21974,SET OF 36 PAISLEY FLOWER DOILIES,2,2.98,,United Kingdom,2025-07-30
494918,21973,SET OF 36 MUSHROOM PAPER DOILIES,1,2.98,,United Kingdom,2025-07-30
494918,22029,SPACEBOY BIRTHDAY CARD,1,0.84,,United Kingdom,2025-07-30
494918,22098,BOUDOIR SQUARE TISSUE BOX,1,2.51,,United Kingdom,2025-07-30
494918,22185,SLATE TILE NATURAL HANGING,1,3.36,,United Kingdom,2025-07-30
494918,22184,CAKE STAND VICTORIAN FILIGREE LARGE,1,16.98,,United Kingdom,2025-07-30
494918,20956,PORCELAIN T-LIGHT HOLDERS ASSORTED,2,2.51,,United Kingdom,2025-07-30
494918,22324,BLUE POLKADOT KIDS BAG,8,3.36,,United Kingdom,2025-07-30
494918,20902,VINTAGE KEEPSAKE BOX PARIS DAYS,1,12.72,,United Kingdom,2025-07-30
494918,21975,PACK OF 60 DINOSAUR CAKE CASES,1,1.28,,United Kingdom,2025-07-30
494918,20901,VINTAGE KEEPSAKE BOX PINK FLOWER,1,12.72,,United Kingdom,2025-07-30
494918,21867,PINK UNION JACK  LUGGAGE TAG,1,2.51,,United Kingdom,2025-07-30
494918,21990,MODERN FLORAL STATIONERY SET,12,2.51,,United Kingdom,2025-07-30
494918,84971S,SMALL HEART FLOWERS HOOK ,1,1.66,,United Kingdom,2025-07-30
494918,90019C,SILVER BLACK ORBIT BRACELET,1,5.51,,United Kingdom,2025-07-30
494918,90018C,SILVER BLACK ORBIT DROP EARRINGS,1,4.24,,United Kingdom,2025-07-30
494918,90014C,SILVER/BLACK ORBIT NECKLACE,1,10.62,,United Kingdom,2025-07-30
494918,90013C,GREEN VINTAGE EARRINGS ,1,4.24,,United Kingdom,2025-07-30
494918,90013B,BLACK VINTAGE EARRINGS,1,4.24,,United Kingdom,2025-07-30
494918,90003B,ROSE COLOUR PAIR HEART HAIR SLIDES,1,3.81,,United Kingdom,2025-07-30
494918,90002D,FLOWER BURST SILVER RING CRYSTAL,1,3.81,,United Kingdom,2025-07-30
494918,72801G,S/4 BURGUNDY WINE DINNER CANDLES,3,2.51,,United Kingdom,2025-07-30
494918,21918,SET 12 KIDS COLOUR  CHALK STICKS,1,0.81,,United Kingdom,2025-07-30
494918,70007,HI TEC ALPINE HAND WARMER,10,1.66,,United Kingdom,2025-07-30
494918,48189,DOOR MAT FRIENDSHIP ,2,13.57,,United Kingdom,2025-07-30
494918,47579,TEA TIME BREAKFAST BASKET,1,4.21,,United Kingdom,2025-07-30
494918,46775D,SUNSET COLOUR CHUNKY KNITTED THROW,2,11.02,,United Kingdom,2025-07-30
494918,35811A,ENAMEL PINK SUGAR CONTAINER,1,4.21,,United Kingdom,2025-07-30
494918,22355,"CHARLOTTE BAG , SUKI DESIGN",1,1.66,,United Kingdom,2025-07-30
494918,22325,MOBILE VINTAGE HEARTS ,9,3.36,,United Kingdom,2025-07-30
494918,22200,FRYING PAN PINK POLKADOT ,1,8.47,,United Kingdom,2025-07-30
494918,22110,BIRD HOUSE HOT WATER BOTTLE,8,3.36,,United Kingdom,2025-07-30
494918,22030,SWALLOWS GREETING CARD,1,0.84,,United Kingdom,2025-07-30
494918,70006,LOVE HEART POCKET WARMER,1,1.66,,United Kingdom,2025-07-30
494918,20867,PINK ROSE FABRIC MIRROR,4,0.85,,United Kingdom,2025-07-30
494918,20829,GLITTER HANGING BUTTERFLY STRING,1,4.21,,United Kingdom,2025-07-30
494918,20782,CAMOUFLAGE EAR MUFF HEADPHONES,2,4.21,,United Kingdom,2025-07-30
494918,84250M,"GREETING CARD, BLACKPOOL ROCK",1,0.84,,United Kingdom,2025-07-30
494918,84031A,CHARLIE+LOLA RED HOT WATER BOTTLE ,1,4.21,,United Kingdom,2025-07-30
494918,82567,"AIRLINE LOUNGE,METAL SIGN",6,1.66,,United Kingdom,2025-07-30
494918,21112,"SWISS ROLL TOWEL, PINK  SPOTS",1,5.91,,United Kingdom,2025-07-30
494918,79144B,PAINTED LIGHTBULB STAR+ MOON,3,0.84,,United Kingdom,2025-07-30
494918,46775E,CANDY POP CHUNKY KNITTED THROW ,2,11.02,,United Kingdom,2025-07-30
494918,37370,RETRO COFFEE MUGS ASSORTED,1,16.13,,United Kingdom,2025-07-30
494918,22356,"CHARLOTTE BAG , PINK/WHITE SPOTS",1,1.66,,United Kingdom,2025-07-30
494918,22326,ROUND SNACK BOXES SET OF4 WOODLAND ,2,5.91,,United Kingdom,2025-07-30
494918,84249D,FAIRY CAKE GREETINGS CARD,1,0.84,,United Kingdom,2025-07-30
494918,22202,MILK PAN PINK RETROSPOT,1,7.62,,United Kingdom,2025-07-30
494918,22031,BOTANICAL LAVENDER BIRTHDAY CARD,1,0.84,,United Kingdom,2025-07-30
494918,21991,BOHEMIAN COLLAGE STATIONERY SET,9,2.51,,United Kingdom,2025-07-30
