Invoice,StockCode,Description,Quantity,Price,Customer ID,Country,InvoiceDate
511700,22605,WOODEN CROQUET GARDEN SET,2,12.75,13709.0,United Kingdom,2025-11-24
511700,22606,WOODEN SKITTLES GARDEN SET,2,15.95,13709.0,United Kingdom,2025-11-24
511700,48138,DOOR MAT UNION FLAG,4,7.49,13709.0,United Kingdom,2025-11-24
511700,20685,DOOR MAT RED SPOT,4,7.49,13709.0,United Kingdom,2025-11-24
511700,48187,DOOR MAT NEW ENGLAND,4,7.49,13709.0,United Kingdom,2025-11-24
511700,84970S,HANGING HEART ZINC T-LIGHT HOLDER,12,0.85,13709.0,United Kingdom,2025-11-24
511700,48194,DOOR MAT HEARTS,4,7.49,13709.0,United Kingdom,2025-11-24
511700,21411,GINGHAM HEART  DOORSTOP RED,3,4.25,13709.0,United Kingdom,2025-11-24
511700,84997B,RED 3 PIECE MINI DOTS CUTLERY SET,6,3.75,13709.0,United Kingdom,2025-11-24
511700,84997C,BLUE 3 PIECE MINI DOTS CUTLERY SET,6,3.75,13709.0,United Kingdom,2025-11-24
511700,21080,SET/20 RED SPOTTY PAPER NAPKINS ,12,0.85,13709.0,United Kingdom,2025-11-24
511700,21078,SET/20 STRAWBERRY PAPER NAPKINS ,12,0.85,13709.0,United Kingdom,2025-11-24
511700,21624,VINTAGE UNION JACK DOORSTOP,3,5.95,13709.0,United Kingdom,2025-11-24
511701,22508,DOORSTOP RETROSPOT HEART,4,3.75,16206.0,United Kingdom,2025-11-24
511701,47590B,PINK HAPPY BIRTHDAY BUNTING,3,5.45,16206.0,United Kingdom,2025-11-24
511701,47568,ENGLISH ROSE DESIGN PEG BAG,6,2.1,16206.0,United Kingdom,2025-11-24
511701,84755,COLOUR GLASS T-LIGHT HOLDER HANGING,16,0.65,16206.0,United Kingdom,2025-11-24
511701,84970L,SINGLE HEART ZINC T-LIGHT HOLDER,12,0.95,16206.0,United Kingdom,2025-11-24
511701,85064,CREAM SWEETHEART LETTER RACK,2,5.45,16206.0,United Kingdom,2025-11-24
511701,85068,CREAM SWEETHEART SHELF + HOOKS,2,7.95,16206.0,United Kingdom,2025-11-24
511701,47566,PARTY BUNTING,5,4.65,16206.0,United Kingdom,2025-11-24
511701,84970S,HANGING HEART ZINC T-LIGHT HOLDER,12,0.85,16206.0,United Kingdom,2025-11-24
511701,21755,LOVE BUILDING BLOCK WORD,3,5.95,16206.0,United Kingdom,2025-11-24
511701,22459,CAST IRON HOOK GARDEN TROWEL,8,2.55,16206.0,United Kingdom,2025-11-24
511701,22487,WHITE WOOD GARDEN PLANT LADDER,1,9.95,16206.0,United Kingdom,2025-11-24
511701,85123A,WHITE HANGING HEART T-LIGHT HOLDER,12,2.95,16206.0,United Kingdom,2025-11-24
511701,82484,WOOD BLACK BOARD ANT WHITE FINISH,3,6.45,16206.0,United Kingdom,2025-11-24
511701,48187,DOOR MAT NEW ENGLAND,2,7.49,16206.0,United Kingdom,2025-11-24
511701,15056P,EDWARDIAN PARASOL PINK,3,5.95,16206.0,United Kingdom,2025-11-24
511701,84839,SWEETHEART KEY CABINET,2,6.75,16206.0,United Kingdom,2025-11-24
511701,22458,CAST IRON HOOK GARDEN FORK,8,2.55,16206.0,United Kingdom,2025-11-24
511701,82494L,WOODEN FRAME ANTIQUE WHITE ,6,2.95,16206.0,United Kingdom,2025-11-24
511702,22222,CAKE PLATE LOVEBIRD WHITE,3,4.95,13446.0,United Kingdom,2025-11-24
511702,21174,POTTERING IN THE SHED METAL SIGN,12,1.95,13446.0,United Kingdom,2025-11-24
511702,47594B,SCOTTIES DESIGN WASHBAG,6,1.95,13446.0,United Kingdom,2025-11-24
511702,84670,JAPANESE CROCHETED ANIMAL,24,0.42,13446.0,United Kingdom,2025-11-24
511702,22139,RETRO SPOT TEA SET CERAMIC 11 PC ,3,4.95,13446.0,United Kingdom,2025-11-24
511702,47310M,"SMALL POP BOX,FUNKY MONKEY",6,1.25,13446.0,United Kingdom,2025-11-24
511702,22508,DOORSTOP RETROSPOT HEART,4,3.75,13446.0,United Kingdom,2025-11-24
511702,22505,MEMO BOARD COTTAGE DESIGN,4,4.95,13446.0,United Kingdom,2025-11-24
511702,21382,SET/4 SPRING FLOWER DECORATION,6,2.95,13446.0,United Kingdom,2025-11-24
511702,22410,MONEY BOX HOUSEKEEPING DESIGN,12,1.25,13446.0,United Kingdom,2025-11-24
511702,22250,DECORATION  BUTTERFLY  MAGIC GARDEN,16,0.85,13446.0,United Kingdom,2025-11-24
511702,21385,IVORY HANGING DECORATION  HEART,24,0.85,13446.0,United Kingdom,2025-11-24
511702,84792,ENCHANTED BIRD COATHANGER 5 HOOK,4,4.65,13446.0,United Kingdom,2025-11-24
511702,21272,SALLE DE BAIN HOOK,12,1.25,13446.0,United Kingdom,2025-11-24
511702,22170,PICTURE FRAME WOOD TRIPLE PORTRAIT,4,6.75,13446.0,United Kingdom,2025-11-24
511702,21948,SET OF 6 CAKE CHOPSTICKS,12,1.25,13446.0,United Kingdom,2025-11-24
511702,46000M,POLYESTER FILLER PAD 45x45cm,8,1.55,13446.0,United Kingdom,2025-11-24
511702,47570B,TEA TIME TABLE CLOTH,2,10.65,13446.0,United Kingdom,2025-11-24
511702,22321,BIRD DECORATION RED SPOT,12,0.85,13446.0,United Kingdom,2025-11-24
511703,84613A,PINK NEW BAROQUE FLOCK CANDLESTICK,3,4.65,12727.0,France,2025-11-24
511703,22224,WHITE LOVEBIRD LANTERN,6,2.95,12727.0,France,2025-11-24
511703,22151,PLACE SETTING WHITE HEART,24,0.42,12727.0,France,2025-11-24
511703,84987,SET OF 36 TEATIME PAPER DOILIES,12,1.45,12727.0,France,2025-11-24
511703,72799E,IVORY PILLAR CANDLE SILVER FLOCK,6,2.95,12727.0,France,2025-11-24
511703,22087,PAPER BUNTING WHITE LACE,12,2.95,12727.0,France,2025-11-24
511703,72799F,IVORY PILLAR CANDLE GOLD FLOCK,6,2.95,12727.0,France,2025-11-24
511703,POST,POSTAGE,4,18.0,12727.0,France,2025-11-24
511703,22215,CAKE STAND WHITE TWO TIER LACE,10,8.5,12727.0,France,2025-11-24
511703,22435,SET OF 9 HEART SHAPED BALLOONS,12,1.25,12727.0,France,2025-11-24
511703,20886,BOX OF 9 PEBBLE CANDLES,6,1.95,12727.0,France,2025-11-24
511703,72351A,SET/6 TURQUOISE BUTTERFLY T-LIGHTS,12,2.1,12727.0,France,2025-11-24
511703,72800D,S/4 BLUE DINNER CANDLE SILVER FLOCK,6,2.55,12727.0,France,2025-11-24
511703,72800C,S/4 PINK DINNER CANDLE SILVER FLOCK,6,2.55,12727.0,France,2025-11-24
511703,72800F,4 IVORY DINNER CANDLES GOLD FLOCK,6,2.55,12727.0,France,2025-11-24
511703,72800E,4 IVORY DINNER CANDLES SILVER FLOCK,6,2.55,12727.0,France,2025-11-24
511703,22090,PAPER BUNTING RETRO SPOTS,24,2.95,12727.0,France,2025-11-24
511703,21094,SET/6 RED SPOTTY PAPER PLATES,12,0.85,12727.0,France,2025-11-24
511703,21086,SET/6 RED SPOTTY PAPER CUPS,12,0.65,12727.0,France,2025-11-24
511703,22197,SMALL POPCORN HOLDER,24,0.85,12727.0,France,2025-11-24
511703,72351B,SET/6 PINK  BUTTERFLY T-LIGHTS,12,2.1,12727.0,France,2025-11-24
511704,21754,HOME BUILDING BLOCK WORD,3,5.95,18219.0,United Kingdom,2025-11-24
511704,84879,ASSORTED COLOUR BIRD ORNAMENT,8,1.69,18219.0,United Kingdom,2025-11-24
511704,22423,REGENCY CAKESTAND 3 TIER,2,12.75,18219.0,United Kingdom,2025-11-24
511704,22430,ENAMEL WATERING CAN CREAM,4,4.95,18219.0,United Kingdom,2025-11-24
511704,71053,WHITE METAL LANTERN,4,3.75,18219.0,United Kingdom,2025-11-24
511704,21755,LOVE BUILDING BLOCK WORD,3,5.95,18219.0,United Kingdom,2025-11-24
511704,21872,GLAMOROUS  MUG,12,1.25,18219.0,United Kingdom,2025-11-24
511704,84247L,FAWN AND MUSHROOM GREETING CARD,12,0.42,18219.0,United Kingdom,2025-11-24
511704,21519,GIN & TONIC DIET GREETING CARD ,12,0.42,18219.0,United Kingdom,2025-11-24
511704,21745,GAOLERS KEYS DECORATIVE GARDEN ,4,3.75,18219.0,United Kingdom,2025-11-24
511704,82482,WOODEN PICTURE FRAME WHITE FINISH,6,2.55,18219.0,United Kingdom,2025-11-24
511704,21212,PACK OF 72 RETRO SPOT CAKE CASES,24,0.55,18219.0,United Kingdom,2025-11-24
511704,22528,GARDENERS KNEELING PAD,12,1.25,18219.0,United Kingdom,2025-11-24
511705,22107,PIZZA PLATE IN BOX,4,3.75,13417.0,United Kingdom,2025-11-24
511705,46000S,POLYESTER FILLER PAD 40x40cm,12,1.45,13417.0,United Kingdom,2025-11-24
511705,22109,FULL ENGLISH BREAKFAST PLATE,12,3.75,13417.0,United Kingdom,2025-11-24
511705,22207,FRYING PAN UNION FLAG,12,4.25,13417.0,United Kingdom,2025-11-24
511705,48194,DOOR MAT HEARTS,2,7.49,13417.0,United Kingdom,2025-11-24
511705,48187,DOOR MAT NEW ENGLAND,4,7.49,13417.0,United Kingdom,2025-11-24
511705,48111,DOOR MAT 3 SMILEY CATS,4,7.49,13417.0,United Kingdom,2025-11-24
511705,22108,PING! MICROWAVE PLATE,8,3.75,13417.0,United Kingdom,2025-11-24
511705,22300,COFFEE MUG DOG + BALL DESIGN,6,2.55,13417.0,United Kingdom,2025-11-24
511705,22301,COFFEE MUG CAT + BIRD DESIGN,6,2.55,13417.0,United Kingdom,2025-11-24
511705,48188,DOOR MAT WELCOME PUPPIES,4,7.49,13417.0,United Kingdom,2025-11-24
511706,21787,RAIN PONCHO WITH RED SPOTS,24,0.85,13417.0,United Kingdom,2025-11-24
C511707,21232,STRAWBERRY CERAMIC TRINKET BOX,-8,1.25,16232.0,United Kingdom,2025-11-24
511708,84947,ANTIQUE SILVER TEA GLASS ENGRAVED,216,1.06,17388.0,United Kingdom,2025-11-24
511709,37495,FAIRY CAKE BIRTHDAY CANDLE SET,2,3.75,13878.0,United Kingdom,2025-11-24
511709,22371,AIRLINE BAG VINTAGE TOKYO 78,6,6.35,13878.0,United Kingdom,2025-11-24
511709,21868,POTTING SHED TEA MUG,18,1.25,13878.0,United Kingdom,2025-11-24
511709,22425,ENAMEL COLANDER CREAM,2,4.95,13878.0,United Kingdom,2025-11-24
511709,21787,RAIN PONCHO WITH RED SPOTS,24,0.85,13878.0,United Kingdom,2025-11-24
511709,21785,RAIN PONCHO ,48,0.85,13878.0,United Kingdom,2025-11-24
511709,21788,KIDS RAIN MAC BLUE,24,0.85,13878.0,United Kingdom,2025-11-24
511710,22203,MILK PAN RED RETROSPOT,1,3.75,17350.0,United Kingdom,2025-11-24
511710,22122,SET OF 2 FANCY FONT TEA TOWELS,2,2.95,17350.0,United Kingdom,2025-11-24
511710,21506,"FANCY FONT BIRTHDAY CARD, ",12,0.42,17350.0,United Kingdom,2025-11-24
511710,22030,SWALLOWS GREETING CARD,24,0.42,17350.0,United Kingdom,2025-11-24
511710,20780,BLACK EAR MUFF HEADPHONES,1,5.49,17350.0,United Kingdom,2025-11-24
511710,22379,RECYCLING BAG RETROSPOT ,1,2.1,17350.0,United Kingdom,2025-11-24
511710,79067,CORONA MEXICAN TRAY,1,3.75,17350.0,United Kingdom,2025-11-24
511710,22199,FRYING PAN RED POLKADOT ,1,4.25,17350.0,United Kingdom,2025-11-24
511710,21506,"FANCY FONT BIRTHDAY CARD, ",12,0.42,17350.0,United Kingdom,2025-11-24
511710,21796,SET OF 3 RED STRIPE BASKETS,1,12.75,17350.0,United Kingdom,2025-11-24
511710,21122,SET/10 PINK SPOTTY PARTY CANDLES,2,1.25,17350.0,United Kingdom,2025-11-24
511710,84033,FLAG OF ST GEORGE ,4,1.65,17350.0,United Kingdom,2025-11-24
511710,21094,SET/6 RED SPOTTY PAPER PLATES,1,0.85,17350.0,United Kingdom,2025-11-24
511710,84016,FLAG OF ST GEORGE CAR FLAG,4,0.42,17350.0,United Kingdom,2025-11-24
511710,22616,PACK OF 12 LONDON TISSUES ,12,0.29,17350.0,United Kingdom,2025-11-24
511710,62018,SOMBRERO ,1,1.95,17350.0,United Kingdom,2025-11-24
511710,21124,SET/10 BLUE SPOTTY PARTY CANDLES,2,1.25,17350.0,United Kingdom,2025-11-24
511710,22122,SET OF 2 FANCY FONT TEA TOWELS,3,2.95,17350.0,United Kingdom,2025-11-24
511710,21627,ELEPHANT CARNIVAL POUFFE,1,14.95,17350.0,United Kingdom,2025-11-24
511710,21795,SET OF 3 BLUE STRIPE BASKET,1,12.75,17350.0,United Kingdom,2025-11-24
511734,84950,ASSORTED COLOUR T-LIGHT HOLDER,12,0.85,17158.0,United Kingdom,2025-11-24
511734,21670,BLUE SPOT CERAMIC DRAWER KNOB,12,1.25,17158.0,United Kingdom,2025-11-24
511734,21673,WHITE SPOT BLUE CERAMIC DRAWER KNOB,12,1.25,17158.0,United Kingdom,2025-11-24
511734,21214,SET OF 72 IVORY PAPER DOILIES,12,1.45,17158.0,United Kingdom,2025-11-24
511734,21622,VINTAGE UNION JACK CUSHION COVER,4,4.95,17158.0,United Kingdom,2025-11-24
511734,21621,VINTAGE UNION JACK BUNTING,4,8.5,17158.0,United Kingdom,2025-11-24
511734,84970S,HANGING HEART ZINC T-LIGHT HOLDER,12,0.85,17158.0,United Kingdom,2025-11-24
511734,84945,MULTI COLOUR SILVER T-LIGHT HOLDER,24,0.85,17158.0,United Kingdom,2025-11-24
511734,22499,WOODEN UNION JACK BUNTING,3,5.95,17158.0,United Kingdom,2025-11-24
511734,21755,LOVE BUILDING BLOCK WORD,3,5.95,17158.0,United Kingdom,2025-11-24
511734,22077,6 RIBBONS RUSTIC CHARM,12,1.65,17158.0,United Kingdom,2025-11-24
511734,22585,PACK OF 6 BIRDY GIFT TAGS,12,1.25,17158.0,United Kingdom,2025-11-24
511734,71477,COLOUR GLASS. STAR T-LIGHT HOLDER,4,3.25,17158.0,United Kingdom,2025-11-24
511734,85217,ASSORTED ICE CREAM FRIDGE MAGNETS,12,0.65,17158.0,United Kingdom,2025-11-24
511734,21672,WHITE SPOT RED CERAMIC DRAWER KNOB,12,1.25,17158.0,United Kingdom,2025-11-24
511734,84837,WHITE SWEETHEARTS CABINET 4 DRAWERS,1,12.75,17158.0,United Kingdom,2025-11-24
511734,21361,LOVE LARGE WOOD LETTERS ,2,12.75,17158.0,United Kingdom,2025-11-24
511734,48138,DOOR MAT UNION FLAG,2,7.49,17158.0,United Kingdom,2025-11-24
511734,21955,DOOR MAT UNION JACK GUNS AND ROSES,2,7.49,17158.0,United Kingdom,2025-11-24
511734,48187,DOOR MAT NEW ENGLAND,2,7.49,17158.0,United Kingdom,2025-11-24
511734,21524,DOOR MAT SPOTTY HOME SWEET HOME,2,7.49,17158.0,United Kingdom,2025-11-24
511734,48194,DOOR MAT HEARTS,2,7.49,17158.0,United Kingdom,2025-11-24
511734,21523,DOOR MAT FANCY FONT HOME SWEET HOME,2,7.49,17158.0,United Kingdom,2025-11-24
511734,85216,ASSORTED CAKES FRIDGE MAGNETS,12,0.65,17158.0,United Kingdom,2025-11-24
511734,85215,ASSORTED CHEESE FRIDGE MAGNETS,12,0.65,17158.0,United Kingdom,2025-11-24
511734,21467,CHERRY CROCHET FOOD COVER,6,3.75,17158.0,United Kingdom,2025-11-24
C511739,22634,CHILDS BREAKFAST SET SPACEBOY ,-5,9.95,12682.0,France,2025-11-24
C511739,22635,CHILDS BREAKFAST SET DOLLY GIRL ,-3,9.95,12682.0,France,2025-11-24
C511739,22636,CHILDS BREAKFAST SET CIRCUS PARADE,-1,8.5,12682.0,France,2025-11-24
511745,84795B,SUNSET CHECK HAMMOCK,2,7.95,15183.0,United Kingdom,2025-11-24
511745,51014A,"FEATHER PEN,HOT PINK",12,0.85,15183.0,United Kingdom,2025-11-24
511745,84536A,ENGLISH ROSE NOTEBOOK A7 SIZE,16,0.42,15183.0,United Kingdom,2025-11-24
511745,84497,BUTTONS AND STRIPES NOTEBOOK ,6,3.75,15183.0,United Kingdom,2025-11-24
511745,22431,WATERING CAN BLUE ELEPHANT,6,1.95,15183.0,United Kingdom,2025-11-24
511745,84795C,OCEAN STRIPE HAMMOCK ,2,7.95,15183.0,United Kingdom,2025-11-24
511745,22139,RETRO SPOT TEA SET CERAMIC 11 PC ,3,4.95,15183.0,United Kingdom,2025-11-24
511745,21923,RED/CREAM STRIPE FRINGE HAMMOCK,2,7.95,15183.0,United Kingdom,2025-11-24
511745,84795A,PASTEL STRIPE HAMMOCK ,2,7.95,15183.0,United Kingdom,2025-11-24
511745,21922,UNION STRIPE WITH FRINGE  HAMMOCK,4,7.95,15183.0,United Kingdom,2025-11-24
511745,20935,ROUND CACTUS CANDLE,6,2.95,15183.0,United Kingdom,2025-11-24
511745,22149,FELTCRAFT 6 FLOWER FRIENDS,6,2.1,15183.0,United Kingdom,2025-11-24
511745,21924,BLUE/CREAM STRIPE FRINGE HAMMOCK,2,7.95,15183.0,United Kingdom,2025-11-24
511760,84467,ENGLISH ROSE DESIGN QUILTED THROW,1,39.95,,United Kingdom,2025-11-24
511761,85065,CREAM SWEETHEART TRAYS,2,12.75,17663.0,United Kingdom,2025-11-24
511761,84967C,GREEN KASHMIRI OCCASIONAL TABLE,1,79.95,17663.0,United Kingdom,2025-11-24
511761,21733,RED HANGING HEART T-LIGHT HOLDER,6,2.95,17663.0,United Kingdom,2025-11-24
511761,22424,ENAMEL BREAD BIN CREAM,2,12.75,17663.0,United Kingdom,2025-11-24
511761,21658,GLASS  BEURRE DISH,4,3.95,17663.0,United Kingdom,2025-11-24
511761,21870,I CAN ONLY PLEASE ONE PERSON MUG,12,1.25,17663.0,United Kingdom,2025-11-24
511761,21527,RED RETROSPOT TRADITIONAL TEAPOT ,2,7.95,17663.0,United Kingdom,2025-11-24
511761,82552,WASHROOM METAL SIGN,12,1.25,17663.0,United Kingdom,2025-11-24
511761,40018F,CHERRY DESIGN PAPERLANTERNS,5,1.95,17663.0,United Kingdom,2025-11-24
511761,79000,MOROCCAN TEA GLASS,12,0.85,17663.0,United Kingdom,2025-11-24
511761,22612,TEA COSY VINTAGE UNION JACK,4,3.75,17663.0,United Kingdom,2025-11-24
511761,22427,ENAMEL FLOWER JUG CREAM,3,5.95,17663.0,United Kingdom,2025-11-24
511761,21164,HOME SWEET HOME METAL SIGN ,12,2.95,17663.0,United Kingdom,2025-11-24
511762,84993A,75 GREEN PETIT FOUR CASES,24,0.42,17204.0,United Kingdom,2025-11-24
511762,84991,60 TEATIME FAIRY CAKE CASES,24,0.55,17204.0,United Kingdom,2025-11-24
511762,84992,72 SWEETHEART FAIRY CAKE CASES,24,0.55,17204.0,United Kingdom,2025-11-24
511762,21212,PACK OF 72 RETRO SPOT CAKE CASES,24,0.55,17204.0,United Kingdom,2025-11-24
511762,21217,RED SPOTTY ROUND CAKE TINS,6,9.95,17204.0,United Kingdom,2025-11-24
511762,21469,POLKA DOT RAFFIA FOOD COVER,6,3.75,17204.0,United Kingdom,2025-11-24
511762,21094,SET/6 RED SPOTTY PAPER PLATES,24,0.85,17204.0,United Kingdom,2025-11-24
511762,21086,SET/6 RED SPOTTY PAPER CUPS,24,0.65,17204.0,United Kingdom,2025-11-24
511762,20728,LUNCH BAG CARS BLUE,10,1.65,17204.0,United Kingdom,2025-11-24
511762,22383,LUNCH BAG SUKI  DESIGN ,10,1.65,17204.0,United Kingdom,2025-11-24
511762,20726,LUNCH BAG WOODLAND,10,1.65,17204.0,United Kingdom,2025-11-24
511762,22382,LUNCH BAG SPACEBOY DESIGN ,10,1.65,17204.0,United Kingdom,2025-11-24
511762,22384,LUNCH BAG PINK RETROSPOT,10,1.65,17204.0,United Kingdom,2025-11-24
511762,21936,RED RETROSPOT PICNIC BAG,5,2.95,17204.0,United Kingdom,2025-11-24
511762,20914,SET/5 RED SPOTTY LID GLASS BOWLS,6,2.95,17204.0,United Kingdom,2025-11-24
511762,20725,LUNCH BAG RED SPOTTY,10,1.65,17204.0,United Kingdom,2025-11-24
511763,22114,HOT WATER BOTTLE TEA AND SYMPATHY,4,3.95,13065.0,United Kingdom,2025-11-24
511763,84879,ASSORTED COLOUR BIRD ORNAMENT,8,1.69,13065.0,United Kingdom,2025-11-24
511763,21136,PAINTED METAL PEARS ASSORTED,8,1.69,13065.0,United Kingdom,2025-11-24
511763,84945,MULTI COLOUR SILVER T-LIGHT HOLDER,12,0.85,13065.0,United Kingdom,2025-11-24
511763,21908,CHOCOLATE THIS WAY METAL SIGN,12,2.1,13065.0,United Kingdom,2025-11-24
511763,21323,HANGING MEDINA LANTERN LARGE,3,4.25,13065.0,United Kingdom,2025-11-24
511763,21589,SWALLOW GIANT TUBE MATCHES,12,2.55,13065.0,United Kingdom,2025-11-24
511763,48189,DOOR MAT FRIENDSHIP ,2,7.49,13065.0,United Kingdom,2025-11-24
511763,22469,HEART OF WICKER SMALL,12,1.65,13065.0,United Kingdom,2025-11-24
511763,84839,SWEETHEART KEY CABINET,2,6.75,13065.0,United Kingdom,2025-11-24
511763,85123A,WHITE HANGING HEART T-LIGHT HOLDER,6,2.95,13065.0,United Kingdom,2025-11-24
C511764,20686,DOLLY MIXTURE CHILDREN'S UMBRELLA,-2,3.25,14329.0,United Kingdom,2025-11-24
511771,M,Manual,1,15.0,17032.0,United Kingdom,2025-11-24
511772,21670,BLUE SPOT CERAMIC DRAWER KNOB,12,1.25,17491.0,United Kingdom,2025-11-24
511772,21669,BLUE STRIPE CERAMIC DRAWER KNOB,12,1.25,17491.0,United Kingdom,2025-11-24
511772,21199,PINK  HEART CONFETTI IN TUBE,12,1.65,17491.0,United Kingdom,2025-11-24
511772,22556,PLASTERS IN TIN CIRCUS PARADE ,12,1.65,17491.0,United Kingdom,2025-11-24
511772,21713,CITRONELLA CANDLE FLOWERPOT,8,2.1,17491.0,United Kingdom,2025-11-24
511772,85068,CREAM SWEETHEART SHELF + HOOKS,2,7.95,17491.0,United Kingdom,2025-11-24
511772,72812,LARGE ZINC GLASS CANDLEHOLDER,6,2.1,17491.0,United Kingdom,2025-11-24
511772,21094,SET/6 RED SPOTTY PAPER PLATES,12,0.85,17491.0,United Kingdom,2025-11-24
511772,21080,SET/20 RED SPOTTY PAPER NAPKINS ,12,0.85,17491.0,United Kingdom,2025-11-24
511772,21086,SET/6 RED SPOTTY PAPER CUPS,12,0.65,17491.0,United Kingdom,2025-11-24
511772,22607,WOODEN ROUNDERS GARDEN SET ,4,8.5,17491.0,United Kingdom,2025-11-24
511772,22087,PAPER BUNTING WHITE LACE,24,2.95,17491.0,United Kingdom,2025-11-24
511772,84945,MULTI COLOUR SILVER T-LIGHT HOLDER,24,0.85,17491.0,United Kingdom,2025-11-24
511772,22172,METAL SHELF WITH RAIL ,4,8.5,17491.0,United Kingdom,2025-11-24
C511773,M,Manual,-1,15.0,17032.0,United Kingdom,2025-11-24
511774,BANK CHARGES,Bank Charges,1,15.0,17032.0,United Kingdom,2025-11-24
511775,85067,CREAM SWEETHEART WALL CABINET,1,18.95,13842.0,United Kingdom,2025-11-24
511775,84840,SWEETHEART CARRY-ALL BASKET,2,8.5,13842.0,United Kingdom,2025-11-24
511775,21274,EMBOSSED HEART 3 DRAWER SHELF,1,12.75,13842.0,United Kingdom,2025-11-24
511775,21777,RECIPE BOX WITH METAL HEART,2,7.95,13842.0,United Kingdom,2025-11-24
511775,22169,FAMILY ALBUM WHITE PICTURE FRAME,2,8.5,13842.0,United Kingdom,2025-11-24
511775,84946,ANTIQUE SILVER TEA GLASS ETCHED,12,1.25,13842.0,United Kingdom,2025-11-24
511775,22221,CAKE STAND LOVEBIRD 2 TIER PINK,2,9.95,13842.0,United Kingdom,2025-11-24
511775,85064,CREAM SWEETHEART LETTER RACK,2,5.45,13842.0,United Kingdom,2025-11-24
511775,84945,MULTI COLOUR SILVER T-LIGHT HOLDER,12,0.85,13842.0,United Kingdom,2025-11-24
511775,85066,CREAM SWEETHEART MINI CHEST,2,12.75,13842.0,United Kingdom,2025-11-24
C511776,79323W,WHITE CHERRY LIGHTS,-1,6.75,16713.0,United Kingdom,2025-11-24
C511776,79323P,PINK CHERRY LIGHTS,-1,6.75,16713.0,United Kingdom,2025-11-24
511777,37449,CERAMIC CAKE STAND + HANGING CAKES,32,8.5,12863.0,United Kingdom,2025-11-24
511777,37503,TEA TIME CAKE STAND IN GIFT BOX,12,9.95,12863.0,United Kingdom,2025-11-24
511777,22197,SMALL POPCORN HOLDER,12,0.85,12863.0,United Kingdom,2025-11-24
511777,22198,LARGE POPCORN HOLDER ,12,1.65,12863.0,United Kingdom,2025-11-24
511778,21864,UNION JACK FLAG PASSPORT COVER ,12,2.1,17716.0,United Kingdom,2025-11-24
511778,82486,WOOD S/3 CABINET ANT WHITE FINISH,2,7.95,17716.0,United Kingdom,2025-11-24
511778,85064,CREAM SWEETHEART LETTER RACK,2,5.45,17716.0,United Kingdom,2025-11-24
511778,84837,WHITE SWEETHEARTS CABINET 4 DRAWERS,4,12.75,17716.0,United Kingdom,2025-11-24
511778,84839,SWEETHEART KEY CABINET,6,6.75,17716.0,United Kingdom,2025-11-24
511778,85067,CREAM SWEETHEART WALL CABINET,3,16.95,17716.0,United Kingdom,2025-11-24
511778,82484,WOOD BLACK BOARD ANT WHITE FINISH,3,6.45,17716.0,United Kingdom,2025-11-24
511778,21755,LOVE BUILDING BLOCK WORD,6,5.95,17716.0,United Kingdom,2025-11-24
511778,82494L,WOODEN FRAME ANTIQUE WHITE ,6,2.95,17716.0,United Kingdom,2025-11-24
511778,20977,36 PENCILS TUBE WOODLAND,16,1.25,17716.0,United Kingdom,2025-11-24
511778,21624,VINTAGE UNION JACK DOORSTOP,3,5.95,17716.0,United Kingdom,2025-11-24
511778,21623,VINTAGE UNION JACK MEMOBOARD,2,9.95,17716.0,United Kingdom,2025-11-24
511778,21621,VINTAGE UNION JACK BUNTING,18,8.5,17716.0,United Kingdom,2025-11-24
511778,85066,CREAM SWEETHEART MINI CHEST,4,12.75,17716.0,United Kingdom,2025-11-24
511778,21188,3D HEARTS  HONEYCOMB PAPER GARLAND,12,2.95,17716.0,United Kingdom,2025-11-24
511778,21390,FILIGRIS HEART WITH BUTTERFLY,24,1.25,17716.0,United Kingdom,2025-11-24
511778,21385,IVORY HANGING DECORATION  HEART,24,0.85,17716.0,United Kingdom,2025-11-24
511778,22295,HEART FILIGREE DOVE LARGE,12,1.65,17716.0,United Kingdom,2025-11-24
511778,85123A,WHITE HANGING HEART T-LIGHT HOLDER,32,2.55,17716.0,United Kingdom,2025-11-24
511778,22626,BLACK KITCHEN SCALES,2,8.5,17716.0,United Kingdom,2025-11-24
511778,22502,PICNIC BASKET WICKER SMALL,4,4.25,17716.0,United Kingdom,2025-11-24
511778,21668,RED STRIPE CERAMIC DRAWER KNOB,96,1.06,17716.0,United Kingdom,2025-11-24
511778,21669,BLUE STRIPE CERAMIC DRAWER KNOB,96,1.06,17716.0,United Kingdom,2025-11-24
511778,21670,BLUE SPOT CERAMIC DRAWER KNOB,96,1.06,17716.0,United Kingdom,2025-11-24
511778,21671,RED SPOT CERAMIC DRAWER KNOB,96,1.06,17716.0,United Kingdom,2025-11-24
511778,22650,CERAMIC PIRATE CHEST MONEY BANK,12,1.45,17716.0,United Kingdom,2025-11-24
511778,21197,MULTICOLOUR  CONFETTI IN TUBE,12,1.65,17716.0,United Kingdom,2025-11-24
511778,22499,WOODEN UNION JACK BUNTING,12,5.95,17716.0,United Kingdom,2025-11-24
511778,22194,BLACK DINER WALL CLOCK,4,8.5,17716.0,United Kingdom,2025-11-24
511778,21198,WHITE HEART CONFETTI IN TUBE,12,1.65,17716.0,United Kingdom,2025-11-24
511778,22084,PAPER CHAIN KIT EMPIRE,12,2.95,17716.0,United Kingdom,2025-11-24
511778,21866,UNION JACK FLAG LUGGAGE TAG,12,1.25,17716.0,United Kingdom,2025-11-24
511778,22644,CERAMIC CHERRY CAKE MONEY BANK,12,1.45,17716.0,United Kingdom,2025-11-24
511778,20978,36 PENCILS TUBE SKULLS,16,1.25,17716.0,United Kingdom,2025-11-24
511778,22627,MINT KITCHEN SCALES,2,8.5,17716.0,United Kingdom,2025-11-24
511778,22469,HEART OF WICKER SMALL,12,1.65,17716.0,United Kingdom,2025-11-24
511778,22297,HEART IVORY TRELLIS SMALL,24,1.25,17716.0,United Kingdom,2025-11-24
511778,22296,HEART IVORY TRELLIS LARGE,12,1.65,17716.0,United Kingdom,2025-11-24
511778,22645,CERAMIC HEART FAIRY CAKE MONEY BANK,12,1.45,17716.0,United Kingdom,2025-11-24
511778,22624,IVORY KITCHEN SCALES,2,8.5,17716.0,United Kingdom,2025-11-24
511778,16156S,WRAP PINK FAIRY CAKES ,25,0.42,17716.0,United Kingdom,2025-11-24
511778,21231,SWEETHEART CERAMIC TRINKET BOX,12,1.25,17716.0,United Kingdom,2025-11-24
511778,21232,STRAWBERRY CERAMIC TRINKET BOX,12,1.25,17716.0,United Kingdom,2025-11-24
511778,22055,MINI CAKE STAND  HANGING STRAWBERY,32,1.45,17716.0,United Kingdom,2025-11-24
511778,22060,LARGE CAKE STAND HANGING HEARTS,12,8.5,17716.0,United Kingdom,2025-11-24
511778,37449,CERAMIC CAKE STAND + HANGING CAKES,8,8.5,17716.0,United Kingdom,2025-11-24
511778,47556B,TEA TIME TEA TOWELS ,18,2.95,17716.0,United Kingdom,2025-11-24
511778,37446,MINI CAKE STAND WITH HANGING CAKES,32,1.25,17716.0,United Kingdom,2025-11-24
511778,84509B,SET OF 4 FAIRY CAKE PLACEMATS,4,3.75,17716.0,United Kingdom,2025-11-24
511778,21211,SET OF 72 SKULL PAPER  DOILIES,12,1.45,17716.0,United Kingdom,2025-11-24
511778,21989,PACK OF 20 SKULL PAPER NAPKINS,12,0.85,17716.0,United Kingdom,2025-11-24
511778,22085,PAPER CHAIN KIT SKULLS ,12,2.95,17716.0,United Kingdom,2025-11-24
511778,22437,SET OF 9 BLACK SKULL BALLOONS,20,0.85,17716.0,United Kingdom,2025-11-24
511778,47559B,TEA TIME OVEN GLOVE,10,1.25,17716.0,United Kingdom,2025-11-24
511778,21870,I CAN ONLY PLEASE ONE PERSON MUG,12,1.25,17716.0,United Kingdom,2025-11-24
511778,20971,PINK BLUE FELT CRAFT TRINKET BOX,12,1.25,17716.0,United Kingdom,2025-11-24
511778,21210,SET OF 72 RETRO SPOT PAPER  DOILIES,12,1.45,17716.0,United Kingdom,2025-11-24
511778,21080,SET/20 RED SPOTTY PAPER NAPKINS ,12,0.85,17716.0,United Kingdom,2025-11-24
511778,20914,SET/5 RED SPOTTY LID GLASS BOWLS,32,2.55,17716.0,United Kingdom,2025-11-24
511778,84991,60 TEATIME FAIRY CAKE CASES,24,0.55,17716.0,United Kingdom,2025-11-24
511778,21213,PACK OF 72 SKULL CAKE CASES,24,0.55,17716.0,United Kingdom,2025-11-24
511778,84987,SET OF 36 TEATIME PAPER DOILIES,12,1.45,17716.0,United Kingdom,2025-11-24
511778,21535,RED RETROSPOT SMALL MILK JUG,12,2.55,17716.0,United Kingdom,2025-11-24
511779,22326,ROUND SNACK BOXES SET OF4 WOODLAND ,1,2.95,17068.0,United Kingdom,2025-11-24
511779,20726,LUNCH BAG WOODLAND,4,1.65,17068.0,United Kingdom,2025-11-24
511779,21155,RED SPOTTY PEG BAG,2,2.1,17068.0,United Kingdom,2025-11-24
511779,47568,ENGLISH ROSE DESIGN PEG BAG,2,2.1,17068.0,United Kingdom,2025-11-24
511779,22353,LUNCH BOX WITH CUTLERY FAIRY CAKES ,1,2.55,17068.0,United Kingdom,2025-11-24
511779,22382,LUNCH BAG SPACEBOY DESIGN ,5,1.65,17068.0,United Kingdom,2025-11-24
511779,85099B,JUMBO BAG RED RETROSPOT,10,1.95,17068.0,United Kingdom,2025-11-24
511779,22352,LUNCH BOX WITH CUTLERY RETROSPOT ,2,2.55,17068.0,United Kingdom,2025-11-24
511779,22198,LARGE POPCORN HOLDER ,1,1.65,17068.0,United Kingdom,2025-11-24
511779,22385,JUMBO BAG SPACEBOY DESIGN,4,1.95,17068.0,United Kingdom,2025-11-24
