Invoice,StockCode,Description,Quantity,Price,Customer ID,Country,InvoiceDate
512559,22197,SMALL POPCORN HOLDER,4,0.85,14031.0,United Kingdom,2025-11-29
512558,21547,CERAMIC BIRDHOUSE CRESTED TIT SMALL,6,2.95,14911.0,EIRE,2025-11-29
512559,22606,WOODEN SKITTLES GARDEN SET,4,12.75,14031.0,United Kingdom,2025-11-29
512559,22605,WOODEN CROQUET GARDEN SET,12,10.95,14031.0,United Kingdom,2025-11-29
512558,22487,WHITE WOOD GARDEN PLANT LADDER,3,9.95,14911.0,EIRE,2025-11-29
512558,21548,CERAMIC BIRDHOUSE FINCH BLUE ROOF,6,2.95,14911.0,EIRE,2025-11-29
512558,22106,MIRROR MOSAIC HURRICANE LAMP ,4,6.75,14911.0,EIRE,2025-11-29
512559,15056BL,EDWARDIAN PARASOL BLACK,2,5.95,14031.0,United Kingdom,2025-11-29
512558,22219,LOVEBIRD HANGING DECORATION WHITE ,12,0.85,14911.0,EIRE,2025-11-29
512558,C2,CARRIAGE,1,50.0,14911.0,EIRE,2025-11-29
512559,22423,REGENCY CAKESTAND 3 TIER,16,10.95,14031.0,United Kingdom,2025-11-29
512559,21922,UNION STRIPE WITH FRINGE  HAMMOCK,12,6.95,14031.0,United Kingdom,2025-11-29
512558,75011,BLUE DAISY MOBILE,4,3.75,14911.0,EIRE,2025-11-29
512560,84978,HANGING HEART JAR T-LIGHT HOLDER,6,1.25,17931.0,United Kingdom,2025-11-29
512560,22407,MONEY BOX FIRST ADE DESIGN,1,1.25,17931.0,United Kingdom,2025-11-29
512560,21312,LARGE CHUNKY GLASS ROMAN BOWL,1,6.75,17931.0,United Kingdom,2025-11-29
512560,21320,GLASS CHALICE GREEN  LARGE ,1,2.55,17931.0,United Kingdom,2025-11-29
512560,21318,GLASS CHALICE BLUE SMALL ,1,1.65,17931.0,United Kingdom,2025-11-29
512560,20802,SMALL GLASS SUNDAE DISH CLEAR,1,1.65,17931.0,United Kingdom,2025-11-29
512560,21260,FIRST AID TIN,1,3.25,17931.0,United Kingdom,2025-11-29
512560,22409,MONEY BOX BISCUITS DESIGN,1,1.25,17931.0,United Kingdom,2025-11-29
512560,22406,MONEY BOX KINGS CHOICE DESIGN,1,1.25,17931.0,United Kingdom,2025-11-29
512560,22408,MONEY BOX CONFECTIONERY DESIGN,1,1.25,17931.0,United Kingdom,2025-11-29
512560,22362,GLASS JAR PEACOCK BATH SALTS,1,2.95,17931.0,United Kingdom,2025-11-29
512560,22359,GLASS JAR KINGS CHOICE,1,2.95,17931.0,United Kingdom,2025-11-29
512560,22360,GLASS JAR ENGLISH CONFECTIONERY,1,2.95,17931.0,United Kingdom,2025-11-29
512560,22364,GLASS JAR DIGESTIVE BISCUITS,1,2.95,17931.0,United Kingdom,2025-11-29
512560,21977,PACK OF 60 PINK PAISLEY CAKE CASES,2,0.55,17931.0,United Kingdom,2025-11-29
512560,21364,PEACE SMALL WOOD LETTERS,1,6.75,17931.0,United Kingdom,2025-11-29
512560,21155,RED SPOTTY PEG BAG,1,2.1,17931.0,United Kingdom,2025-11-29
512560,20724,RED SPOTTY CHARLOTTE BAG,1,0.85,17931.0,United Kingdom,2025-11-29
512560,85088,CANDY SPOT HAND BAG,1,2.1,17931.0,United Kingdom,2025-11-29
512560,22356,CHARLOTTE BAG PINK WITH WHITE SPOTS,30,0.85,17931.0,United Kingdom,2025-11-29
512560,22405,MONEY BOX POCKET MONEY DESIGN,1,1.25,17931.0,United Kingdom,2025-11-29
512560,84989B,75 BLACK FAIRY CAKE CASES,1,0.55,17931.0,United Kingdom,2025-11-29
512560,22363,GLASS JAR MARMALADE ,1,2.95,17931.0,United Kingdom,2025-11-29
512560,21366,MIRRORED WALL ART PHOTO FRAMES,1,4.25,17931.0,United Kingdom,2025-11-29
512560,21373,MIRRORED WALL ART SNOWFLAKES,1,2.55,17931.0,United Kingdom,2025-11-29
512560,22624,IVORY KITCHEN SCALES,1,8.5,17931.0,United Kingdom,2025-11-29
512560,22429,ENAMEL MEASURING JUG CREAM,1,4.25,17931.0,United Kingdom,2025-11-29
512560,22556,PLASTERS IN TIN CIRCUS PARADE ,1,1.65,17931.0,United Kingdom,2025-11-29
512560,22557,PLASTERS IN TIN VINTAGE PAISLEY ,1,1.65,17931.0,United Kingdom,2025-11-29
512560,22555,PLASTERS IN TIN STRONGMAN,1,1.65,17931.0,United Kingdom,2025-11-29
512560,84849B,FAIRY SOAP SOAP HOLDER,1,1.69,17931.0,United Kingdom,2025-11-29
512560,21638,ASSORTED TUTTI FRUTTI NOTEBOOK,6,2.1,17931.0,United Kingdom,2025-11-29
512560,22295,HEART FILIGREE DOVE LARGE,24,1.65,17931.0,United Kingdom,2025-11-29
512560,22295,HEART FILIGREE DOVE LARGE,12,1.65,17931.0,United Kingdom,2025-11-29
512560,22198,LARGE POPCORN HOLDER ,1,1.65,17931.0,United Kingdom,2025-11-29
512560,22197,SMALL POPCORN HOLDER,1,0.85,17931.0,United Kingdom,2025-11-29
512560,21121,SET/10 RED SPOTTY PARTY CANDLES,2,1.25,17931.0,United Kingdom,2025-11-29
512560,22558,CLOTHES PEGS RETROSPOT PACK 24 ,2,1.25,17931.0,United Kingdom,2025-11-29
512560,21210,SET OF 72 RETRO SPOT PAPER  DOILIES,1,1.45,17931.0,United Kingdom,2025-11-29
512560,21974,SET OF 36 PAISLEY FLOWER DOILIES,1,1.45,17931.0,United Kingdom,2025-11-29
512560,84520B,PACK 20 ENGLISH ROSE PAPER NAPKINS,4,0.85,17931.0,United Kingdom,2025-11-29
512560,21082,SET/20 FRUIT SALAD PAPER NAPKINS ,2,0.85,17931.0,United Kingdom,2025-11-29
512560,21078,SET/20 STRAWBERRY PAPER NAPKINS ,4,0.85,17931.0,United Kingdom,2025-11-29
512560,21082,SET/20 FRUIT SALAD PAPER NAPKINS ,2,0.85,17931.0,United Kingdom,2025-11-29
512560,20803,SMALL PINK GLASS SUNDAE DISH,1,1.65,17931.0,United Kingdom,2025-11-29
512561,22382,LUNCH BAG SPACEBOY DESIGN ,3,1.65,,United Kingdom,2025-11-29
512561,22418,10 COLOUR SPACEBOY PEN,3,0.85,,United Kingdom,2025-11-29
512561,22037,ROBOT BIRTHDAY CARD,12,0.42,,United Kingdom,2025-11-29
512561,20974,12 PENCILS SMALL TUBE SKULL,3,0.65,,United Kingdom,2025-11-29
512562,84946,ANTIQUE SILVER TEA GLASS ETCHED,36,1.25,13346.0,United Kingdom,2025-11-29
512564,47597,NEW ENGLAND TEATOWELS,1,2.55,14375.0,United Kingdom,2025-11-29
512564,22212,FOUR HOOK  WHITE LOVEBIRDS,1,2.1,14375.0,United Kingdom,2025-11-29
512564,22558,CLOTHES PEGS RETROSPOT PACK 24 ,1,1.25,14375.0,United Kingdom,2025-11-29
512564,22243,"HOOK, 5 HANGER ,MAGIC TOADSTOOL RED",1,1.65,14375.0,United Kingdom,2025-11-29
512564,22079,RIBBON REEL HEARTS DESIGN ,1,1.65,14375.0,United Kingdom,2025-11-29
512564,20975,12 PENCILS SMALL TUBE RED SPOTTY,1,0.65,14375.0,United Kingdom,2025-11-29
512564,22080,RIBBON REEL SPOTS DESIGN ,1,1.65,14375.0,United Kingdom,2025-11-29
512564,22082,RIBBON REEL STRIPES DESIGN ,2,1.65,14375.0,United Kingdom,2025-11-29
512564,22245,"HOOK, 1 HANGER ,MAGIC GARDEN",2,0.85,14375.0,United Kingdom,2025-11-29
512564,21781,MA CAMPAGNE CUTLERY BOX,1,14.95,14375.0,United Kingdom,2025-11-29
512564,22083,PAPER CHAIN KIT RETRO SPOT,1,2.95,14375.0,United Kingdom,2025-11-29
512564,85099F,JUMBO BAG STRAWBERRY,1,1.95,14375.0,United Kingdom,2025-11-29
512564,21924,BLUE/CREAM STRIPE FRINGE HAMMOCK,1,7.95,14375.0,United Kingdom,2025-11-29
512564,22381,TOY TIDY PINK RETROSPOT  ,1,2.1,14375.0,United Kingdom,2025-11-29
512564,85099B,JUMBO BAG RED RETROSPOT,1,1.95,14375.0,United Kingdom,2025-11-29
512564,20712,JUMBO BAG WOODLAND ANIMALS,1,1.95,14375.0,United Kingdom,2025-11-29
512564,40018F,CHERRY DESIGN PAPERLANTERNS,1,1.95,14375.0,United Kingdom,2025-11-29
512564,84292,ROSE PINK METAL FOLDING CHAIR,2,7.95,14375.0,United Kingdom,2025-11-29
512564,22423,REGENCY CAKESTAND 3 TIER,1,12.75,14375.0,United Kingdom,2025-11-29
512564,21652,GLASS ETCHED T-LIGHT HOLDER MEDIUM,2,1.95,14375.0,United Kingdom,2025-11-29
512564,21754,HOME BUILDING BLOCK WORD,1,5.95,14375.0,United Kingdom,2025-11-29
512564,84077,WORLD WAR 2 GLIDERS ASSTD DESIGNS,10,0.21,14375.0,United Kingdom,2025-11-29
512564,22386,JUMBO BAG PINK WITH WHITE SPOTS,1,1.95,14375.0,United Kingdom,2025-11-29
512564,79071B,ENGLISH ROSE METAL WASTE BIN,1,2.95,14375.0,United Kingdom,2025-11-29
512564,21474,SWEETHEART CREAM STEEL FOLDIN BENCH,2,19.95,14375.0,United Kingdom,2025-11-29
512564,21476,STEEL SWEETHEART ROUND TABLE CREAM,1,14.95,14375.0,United Kingdom,2025-11-29
512564,21843,RED RETROSPOT CAKE STAND,1,10.95,14375.0,United Kingdom,2025-11-29
512564,21653,GLASS ETCHED T-LIGHT HOLDER LARGE,2,2.1,14375.0,United Kingdom,2025-11-29
512564,84884A,ANT WHITE WIRE HEART SPIRAL,1,3.95,14375.0,United Kingdom,2025-11-29
512564,21755,LOVE BUILDING BLOCK WORD,2,5.95,14375.0,United Kingdom,2025-11-29
512564,22303,COFFEE MUG APPLES DESIGN,1,2.55,14375.0,United Kingdom,2025-11-29
512564,22304,COFFEE MUG BLUE PAISLEY DESIGN,2,2.55,14375.0,United Kingdom,2025-11-29
512564,22305,COFFEE MUG PINK PAISLEY DESIGN,2,2.55,14375.0,United Kingdom,2025-11-29
512564,21381,MINI WOODEN HAPPY BIRTHDAY GARLAND,1,1.69,14375.0,United Kingdom,2025-11-29
512564,20773,BLUE PAISLEY NOTEBOOK,3,1.65,14375.0,United Kingdom,2025-11-29
512564,20976,12 PENCILS SMALL TUBE POSY,3,0.65,14375.0,United Kingdom,2025-11-29
512564,20975,12 PENCILS SMALL TUBE RED SPOTTY,2,0.65,14375.0,United Kingdom,2025-11-29
512564,20973,12 PENCIL SMALL TUBE WOODLAND,3,0.65,14375.0,United Kingdom,2025-11-29
512564,21381,MINI WOODEN HAPPY BIRTHDAY GARLAND,2,1.69,14375.0,United Kingdom,2025-11-29
512564,22302,COFFEE MUG PEARS  DESIGN,1,2.55,14375.0,United Kingdom,2025-11-29
512564,85099C,JUMBO  BAG BAROQUE BLACK WHITE,1,1.95,14375.0,United Kingdom,2025-11-29
512564,22242,"HOOK, 5 HANGER , MAGIC TOADSTOOL",1,1.65,14375.0,United Kingdom,2025-11-29
512564,22212,FOUR HOOK  WHITE LOVEBIRDS,1,2.1,14375.0,United Kingdom,2025-11-29
512565,84879,ASSORTED COLOUR BIRD ORNAMENT,8,1.69,15432.0,United Kingdom,2025-11-29
512565,21361,LOVE LARGE WOOD LETTERS ,3,12.75,15432.0,United Kingdom,2025-11-29
512565,21363,HOME SMALL WOOD LETTERS,3,4.95,15432.0,United Kingdom,2025-11-29
512565,21462,"NURSERY A,B,C PAINTED LETTERS",4,6.75,15432.0,United Kingdom,2025-11-29
512565,22318,FIVE HEART HANGING DECORATION,6,2.95,15432.0,United Kingdom,2025-11-29
512565,22423,REGENCY CAKESTAND 3 TIER,3,12.75,15432.0,United Kingdom,2025-11-29
512563,21737,SET 3 WICKER LOG BASKETS,2,19.95,13916.0,United Kingdom,2025-11-29
512563,22442,GROW YOUR OWN FLOWERS SET OF 3,2,7.95,13916.0,United Kingdom,2025-11-29
512563,20886,BOX OF 9 PEBBLE CANDLES,6,1.95,13916.0,United Kingdom,2025-11-29
512563,21611,SET OF 12 LILY BOTANICAL T-LIGHTS,6,2.95,13916.0,United Kingdom,2025-11-29
512563,22610,PENS ASSORTED FUNNY FACE,36,0.85,13916.0,United Kingdom,2025-11-29
512563,21258,VICTORIAN SEWING BOX LARGE,1,12.75,13916.0,United Kingdom,2025-11-29
512563,22050,PINK PAISLEY ROSE GIFT WRAP,25,0.42,13916.0,United Kingdom,2025-11-29
512563,22051,BLUE SCANDINAVIAN PAISLEY WRAP,25,0.42,13916.0,United Kingdom,2025-11-29
512563,22474,SPACEBOY TV DINNER TRAY,3,4.95,13916.0,United Kingdom,2025-11-29
512563,21760,FRENCH STYLE WALL DRESSER,1,125.0,13916.0,United Kingdom,2025-11-29
512564,22470,HEART OF WICKER LARGE,2,2.95,14375.0,United Kingdom,2025-11-29
512564,82613B,"METAL SIGN,CUPCAKE SINGLE HOOK",1,1.25,14375.0,United Kingdom,2025-11-29
512564,82613D,METAL SIGN CUPCAKE SINGLE HOOK,1,1.25,14375.0,United Kingdom,2025-11-29
512563,22443,GROW YOUR OWN HERBS SET OF 3,2,7.95,13916.0,United Kingdom,2025-11-29
512564,22244,"HOOK, 3 HANGER ,MAGIC GARDEN",3,1.95,14375.0,United Kingdom,2025-11-29
512564,22354,RETROSPOT PADDED SEAT CUSHION,4,3.75,14375.0,United Kingdom,2025-11-29
512564,21473,SWEETHEART CREAM STEEL TABLE RECT,1,19.95,14375.0,United Kingdom,2025-11-29
512564,20749,ASSORTED COLOUR MINI CASES,1,7.95,14375.0,United Kingdom,2025-11-29
512564,21918,SET 12 KIDS COLOUR  CHALK STICKS,9,0.42,14375.0,United Kingdom,2025-11-29
512564,22185,SLATE TILE NATURAL HANGING,11,1.65,14375.0,United Kingdom,2025-11-29
512564,21917,SET 12 KIDS  WHITE CHALK STICKS,1,0.42,14375.0,United Kingdom,2025-11-29
512564,22520,CHILDS GARDEN TROWEL BLUE ,1,0.85,14375.0,United Kingdom,2025-11-29
512564,22523,CHILDS GARDEN FORK PINK,1,0.85,14375.0,United Kingdom,2025-11-29
512564,22245,"HOOK, 1 HANGER ,MAGIC GARDEN",1,0.85,14375.0,United Kingdom,2025-11-29
512564,22521,CHILDS GARDEN TROWEL PINK,1,0.85,14375.0,United Kingdom,2025-11-29
512564,22522,CHILDS GARDEN FORK BLUE ,1,0.85,14375.0,United Kingdom,2025-11-29
512564,40018F,CHERRY DESIGN PAPERLANTERNS,1,1.95,14375.0,United Kingdom,2025-11-29
512564,82583,HOT BATHS METAL SIGN,1,2.1,14375.0,United Kingdom,2025-11-29
512564,84270,ASSTD DESIGN BUBBLE GUM RING,30,0.21,14375.0,United Kingdom,2025-11-29
512564,84659A,WHITE TRAVEL ALARM CLOCK,1,2.55,14375.0,United Kingdom,2025-11-29
512564,22151,PLACE SETTING WHITE HEART,24,0.42,14375.0,United Kingdom,2025-11-29
512564,84792,ENCHANTED BIRD COATHANGER 5 HOOK,1,4.65,14375.0,United Kingdom,2025-11-29
512564,21932,SCANDINAVIAN PAISLEY PICNIC BAG,3,2.95,14375.0,United Kingdom,2025-11-29
512564,22469,HEART OF WICKER SMALL,3,1.65,14375.0,United Kingdom,2025-11-29
512566,72349B,SET/6 PURPLE BUTTERFLY T-LIGHTS,24,2.1,13346.0,United Kingdom,2025-11-29
512567,82484,WOOD BLACK BOARD ANT WHITE FINISH,12,5.55,14619.0,United Kingdom,2025-11-29
512567,22619,SET OF 6 SOLDIER SKITTLES,8,3.75,14619.0,United Kingdom,2025-11-29
512567,22606,WOODEN SKITTLES GARDEN SET,1,15.95,14619.0,United Kingdom,2025-11-29
512567,22381,TOY TIDY PINK RETROSPOT  ,5,2.1,14619.0,United Kingdom,2025-11-29
512567,22379,RECYCLING BAG RETROSPOT ,5,2.1,14619.0,United Kingdom,2025-11-29
512567,21682,LARGE MEDINA STAMPED METAL BOWL ,4,4.95,14619.0,United Kingdom,2025-11-29
512567,22479,DAISY GARDEN MARKER,10,1.25,14619.0,United Kingdom,2025-11-29
512567,22478,BIRDHOUSE GARDEN MARKER ,10,1.25,14619.0,United Kingdom,2025-11-29
512567,22477,WATERING CAN GARDEN MARKER,10,1.25,14619.0,United Kingdom,2025-11-29
512567,22488,NATURAL SLATE RECTANGLE CHALKBOARD,12,1.65,14619.0,United Kingdom,2025-11-29
512567,21742,LARGE ROUND WICKER PLATTER ,4,5.95,14619.0,United Kingdom,2025-11-29
512567,22487,WHITE WOOD GARDEN PLANT LADDER,4,8.5,14619.0,United Kingdom,2025-11-29
512567,21902,"KEY FOB , FRONT  DOOR ",24,0.65,14619.0,United Kingdom,2025-11-29
512567,21901,"KEY FOB , BACK DOOR ",24,0.65,14619.0,United Kingdom,2025-11-29
512567,21900,"KEY FOB , SHED",24,0.65,14619.0,United Kingdom,2025-11-29
512567,21899,"KEY FOB , GARAGE DESIGN",24,0.65,14619.0,United Kingdom,2025-11-29
512567,22170,PICTURE FRAME WOOD TRIPLE PORTRAIT,12,5.95,14619.0,United Kingdom,2025-11-29
512567,84406B,CREAM CUPID HEARTS COAT HANGER,32,2.75,14619.0,United Kingdom,2025-11-29
512567,22621,TRADITIONAL KNITTING NANCY,12,1.45,14619.0,United Kingdom,2025-11-29
512567,22138,BAKING SET 9 PIECE RETROSPOT ,6,4.95,14619.0,United Kingdom,2025-11-29
512567,21694,SMALL REGAL  SILVER CANDLEPOT ,6,2.95,14619.0,United Kingdom,2025-11-29
512567,21683,MEDIUM MEDINA STAMPED METAL BOWL ,6,2.95,14619.0,United Kingdom,2025-11-29
512567,85216,ASSORTED CAKES FRIDGE MAGNETS,12,0.65,14619.0,United Kingdom,2025-11-29
512567,85217,ASSORTED ICE CREAM FRIDGE MAGNETS,12,0.65,14619.0,United Kingdom,2025-11-29
512567,85215,ASSORTED CHEESE FRIDGE MAGNETS,12,0.65,14619.0,United Kingdom,2025-11-29
512567,22218,CAKE STAND LACE WHITE,3,4.25,14619.0,United Kingdom,2025-11-29
512567,22215,CAKE STAND WHITE TWO TIER LACE,2,8.5,14619.0,United Kingdom,2025-11-29
512567,22423,REGENCY CAKESTAND 3 TIER,2,12.75,14619.0,United Kingdom,2025-11-29
512567,21977,PACK OF 60 PINK PAISLEY CAKE CASES,24,0.55,14619.0,United Kingdom,2025-11-29
512567,22107,PIZZA PLATE IN BOX,8,3.75,14619.0,United Kingdom,2025-11-29
512567,21974,SET OF 36 PAISLEY FLOWER DOILIES,12,1.45,14619.0,United Kingdom,2025-11-29
512567,21166,COOK WITH WINE METAL SIGN ,12,1.95,14619.0,United Kingdom,2025-11-29
512567,71459,HANGING JAM JAR T-LIGHT HOLDER,24,0.85,14619.0,United Kingdom,2025-11-29
512567,21614,SET OF 12 ROSE BOTANICAL T-LIGHTS,6,2.95,14619.0,United Kingdom,2025-11-29
512567,21612,SET 12 WILDFLOWER BOTANICAL T-LIGHT,6,2.95,14619.0,United Kingdom,2025-11-29
512567,21610,SET 12 PEAR BOTANICAL T-LIGHTS,6,2.95,14619.0,United Kingdom,2025-11-29
512567,21696,SMALL SILVER TRELLIS CANDLEPOT,6,2.95,14619.0,United Kingdom,2025-11-29
512567,21692,SILVER LATTICE VANILLA CANDLE POT,4,3.75,14619.0,United Kingdom,2025-11-29
512567,21175,GIN + TONIC DIET METAL SIGN,12,2.1,14619.0,United Kingdom,2025-11-29
512567,22444,GROW YOUR OWN PLANT IN A CAN ,24,1.25,14619.0,United Kingdom,2025-11-29
512569,21497,FANCY FONTS BIRTHDAY WRAP,25,0.42,17990.0,United Kingdom,2025-11-29
512568,22061,LARGE CAKE STAND  HANGING STRAWBERY,24,8.5,18194.0,United Kingdom,2025-11-29
512568,22063,CERAMIC BOWL WITH STRAWBERRY DESIGN,36,2.55,18194.0,United Kingdom,2025-11-29
512569,85123A,WHITE HANGING HEART T-LIGHT HOLDER,18,2.95,17990.0,United Kingdom,2025-11-29
512569,15036,ASSORTED COLOURS SILK FAN,12,0.75,17990.0,United Kingdom,2025-11-29
512569,20828,GLITTER BUTTERFLY CLIPS,12,2.55,17990.0,United Kingdom,2025-11-29
512569,21506,"FANCY FONT BIRTHDAY CARD, ",24,0.42,17990.0,United Kingdom,2025-11-29
512569,16161P,WRAP ENGLISH ROSE ,25,0.42,17990.0,United Kingdom,2025-11-29
512570,M,Manual,1,10.0,14075.0,United Kingdom,2025-11-29
512568,21232,STRAWBERRY CERAMIC TRINKET BOX,144,1.06,18194.0,United Kingdom,2025-11-29
512568,21231,SWEETHEART CERAMIC TRINKET BOX,144,1.06,18194.0,United Kingdom,2025-11-29
512568,37449,CERAMIC CAKE STAND + HANGING CAKES,16,8.5,18194.0,United Kingdom,2025-11-29
512568,37450,CERAMIC CAKE BOWL + HANGING CAKES,36,2.55,18194.0,United Kingdom,2025-11-29
512568,47590B,PINK HAPPY BIRTHDAY BUNTING,50,4.65,18194.0,United Kingdom,2025-11-29
512569,85042,ANTIQUE LILY FAIRY LIGHTS,16,4.95,17990.0,United Kingdom,2025-11-29
512571,46000M,POLYESTER FILLER PAD 45x45cm,6,1.55,12843.0,United Kingdom,2025-11-29
512571,21473,SWEETHEART CREAM STEEL TABLE RECT,2,19.95,12843.0,United Kingdom,2025-11-29
512571,21622,VINTAGE UNION JACK CUSHION COVER,6,4.95,12843.0,United Kingdom,2025-11-29
512571,22354,RETROSPOT PADDED SEAT CUSHION,7,3.75,12843.0,United Kingdom,2025-11-29
512572,20716,PARTY FOOD SHOPPER BAG,1,1.25,,United Kingdom,2025-11-29
512585,48184,DOOR MAT ENGLISH ROSE ,4,7.49,15867.0,United Kingdom,2025-11-29
512585,21955,DOOR MAT UNION JACK GUNS AND ROSES,4,7.49,15867.0,United Kingdom,2025-11-29
512585,48194,DOOR MAT HEARTS,2,7.49,15867.0,United Kingdom,2025-11-29
512585,21523,DOOR MAT FANCY FONT HOME SWEET HOME,2,7.49,15867.0,United Kingdom,2025-11-29
512585,48138,DOOR MAT UNION FLAG,5,7.49,15867.0,United Kingdom,2025-11-29
512585,48185,DOOR MAT FAIRY CAKE,2,7.49,15867.0,United Kingdom,2025-11-29
512585,21317,GLASS SPHERE CANDLE STAND MEDIUM,2,5.45,15867.0,United Kingdom,2025-11-29
512585,20970,PINK FLORAL FELTCRAFT SHOULDER BAG,1,3.75,15867.0,United Kingdom,2025-11-29
512585,21830,ASSORTED CREEPY CRAWLIES,24,0.42,15867.0,United Kingdom,2025-11-29
512585,84527,FLAMES SUNGLASSES PINK LENSES,1,1.95,15867.0,United Kingdom,2025-11-29
512585,84526,GIANT BLACK SUNGLASSES,3,1.95,15867.0,United Kingdom,2025-11-29
512585,48197,DOOR MAT BIRD ON THE WIRE,2,7.49,15867.0,United Kingdom,2025-11-29
512585,22444,GROW YOUR OWN PLANT IN A CAN ,24,1.25,15867.0,United Kingdom,2025-11-29
512585,48116,DOOR MAT MULTICOLOUR STRIPE,5,7.49,15867.0,United Kingdom,2025-11-29
512585,22487,WHITE WOOD GARDEN PLANT LADDER,1,9.95,15867.0,United Kingdom,2025-11-29
512585,22441,GROW YOUR OWN BASIL IN ENAMEL MUG,2,2.1,15867.0,United Kingdom,2025-11-29
512585,21878,PACK OF 6 SANDCASTLE FLAGS ASSORTED,3,0.85,15867.0,United Kingdom,2025-11-29
512585,22616,PACK OF 12 LONDON TISSUES ,3,0.29,15867.0,United Kingdom,2025-11-29
512585,22513,DOORSTOP FOOTBALL DESIGN,1,3.75,15867.0,United Kingdom,2025-11-29
512585,22442,GROW YOUR OWN FLOWERS SET OF 3,1,7.95,15867.0,United Kingdom,2025-11-29
512585,84522,PINK PARTY SUNGLASSES,1,1.95,15867.0,United Kingdom,2025-11-29
512585,78034B,BLUE NETTING STORAGE HANGER,3,1.95,15867.0,United Kingdom,2025-11-29
512585,22443,GROW YOUR OWN HERBS SET OF 3,2,7.95,15867.0,United Kingdom,2025-11-29
512585,21125,SET 6 FOOTBALL CELEBRATION CANDLES,2,1.25,15867.0,United Kingdom,2025-11-29
512585,85049G,CHOCOLATE BOX RIBBONS ,2,1.25,15867.0,United Kingdom,2025-11-29
512585,85049B,LUSH GREENS RIBBONS,2,1.25,15867.0,United Kingdom,2025-11-29
512585,85049C,ROMANTIC PINKS RIBBONS ,2,1.25,15867.0,United Kingdom,2025-11-29
512585,85049F,BABY BOOM RIBBONS ,2,1.25,15867.0,United Kingdom,2025-11-29
512585,22498,WOODEN REGATTA BUNTING,2,5.95,15867.0,United Kingdom,2025-11-29
512586,84601A,NEW BAROQUE IVORY CUSHION COVER ,5,2.95,14021.0,United Kingdom,2025-11-29
512586,21201,TROPICAL  HONEYCOMB PAPER GARLAND ,12,2.55,14021.0,United Kingdom,2025-11-29
512586,22271,FELTCRAFT DOLL ROSIE,6,2.95,14021.0,United Kingdom,2025-11-29
512586,20997,ROSE DU SUD CUSHION COVER ,3,4.95,14021.0,United Kingdom,2025-11-29
512586,22489,PACK OF 12 TRADITIONAL CRAYONS,24,0.42,14021.0,United Kingdom,2025-11-29
512586,84212,"ASSORTED FLOWER COLOUR ""LEIS""",24,0.65,14021.0,United Kingdom,2025-11-29
512586,22619,SET OF 6 SOLDIER SKITTLES,4,3.75,14021.0,United Kingdom,2025-11-29
512586,22560,TRADITIONAL MODELLING CLAY,24,1.25,14021.0,United Kingdom,2025-11-29
512586,22605,WOODEN CROQUET GARDEN SET,1,12.75,14021.0,United Kingdom,2025-11-29
512586,22621,TRADITIONAL KNITTING NANCY,12,1.45,14021.0,United Kingdom,2025-11-29
512587,21642,ASSORTED TUTTI FRUTTI PEN,24,0.85,14198.0,United Kingdom,2025-11-29
512587,48187,DOOR MAT NEW ENGLAND,2,7.49,14198.0,United Kingdom,2025-11-29
512587,48111,DOOR MAT 3 SMILEY CATS,2,7.49,14198.0,United Kingdom,2025-11-29
512587,46000P,POLYESTER FILLER PAD 65CMx65CM,3,4.25,14198.0,United Kingdom,2025-11-29
512587,84616,SILVER ROCCOCO CHANDELIER,1,29.95,14198.0,United Kingdom,2025-11-29
512587,82494L,WOODEN FRAME ANTIQUE WHITE ,6,2.95,14198.0,United Kingdom,2025-11-29
512587,84839,SWEETHEART KEY CABINET,2,6.75,14198.0,United Kingdom,2025-11-29
512587,82486,WOOD S/3 CABINET ANT WHITE FINISH,2,7.95,14198.0,United Kingdom,2025-11-29
512587,84945,MULTI COLOUR SILVER T-LIGHT HOLDER,12,0.85,14198.0,United Kingdom,2025-11-29
512587,84970S,HANGING HEART ZINC T-LIGHT HOLDER,12,0.85,14198.0,United Kingdom,2025-11-29
512587,22423,REGENCY CAKESTAND 3 TIER,2,12.75,14198.0,United Kingdom,2025-11-29
512588,85189,HANGING BUTTERFLY  EGG,24,0.85,15625.0,United Kingdom,2025-11-29
512589,15060B,FAIRY CAKE DESIGN UMBRELLA,1,8.47,,United Kingdom,2025-11-29
512589,17003,BROCADE RING PURSE ,1,0.43,,United Kingdom,2025-11-29
512589,20658,RED SPOTTY LUGGAGE TAG,4,2.51,,United Kingdom,2025-11-29
512589,20661,BLUE SPOTTY PURSE ,1,2.51,,United Kingdom,2025-11-29
512589,20670,VIP HOLIDAY PURSE,1,2.51,,United Kingdom,2025-11-29
512589,20713,JUMBO BAG OWLS,1,4.21,,United Kingdom,2025-11-29
512589,20718,RED SPOTTY SHOPPER BAG,2,2.51,,United Kingdom,2025-11-29
512589,21637,ASSORTED SANSKRIT MINI NOTEBOOK,2,2.51,,United Kingdom,2025-11-29
512589,21247,SET OF RED SALAD SERVERS ,1,3.36,,United Kingdom,2025-11-29
512589,21307,SET/4 BUTTERFLY MIRROR MAGNETS,1,3.36,,United Kingdom,2025-11-29
512589,21447,12 IVORY ROSE PEG PLACE SETTINGS,1,2.51,,United Kingdom,2025-11-29
512589,21363,HOME SMALL WOOD LETTERS,2,11.02,,United Kingdom,2025-11-29
512589,21410,COUNTRY COTTAGE  DOORSTOP GREEN,1,8.47,,United Kingdom,2025-11-29
512589,21506,"FANCY FONT BIRTHDAY CARD, ",2,0.85,,United Kingdom,2025-11-29
512589,21523,DOOR MAT FANCY FONT HOME SWEET HOME,1,14.43,,United Kingdom,2025-11-29
512589,21527,RED RETROSPOT TRADITIONAL TEAPOT ,1,16.98,,United Kingdom,2025-11-29
512589,21544,SKULLS  WATER TRANSFER TATTOOS ,1,1.66,,United Kingdom,2025-11-29
512589,21548,CERAMIC BIRDHOUSE FINCH BLUE ROOF,1,5.91,,United Kingdom,2025-11-29
512589,21561,DINOSAUR LUNCH BOX WITH CUTLERY,1,5.06,,United Kingdom,2025-11-29
512589,21621,VINTAGE UNION JACK BUNTING,1,16.98,,United Kingdom,2025-11-29
512589,21355,TOAST ITS - I LOVE YOU ,1,2.51,,United Kingdom,2025-11-29
512589,15056N,EDWARDIAN PARASOL NATURAL,3,12.72,,United Kingdom,2025-11-29
512589,90118,PINK DAISY BAG CHARM,1,5.06,,United Kingdom,2025-11-29
512589,15039,SANDALWOOD FAN,1,1.66,,United Kingdom,2025-11-29
512589,85203,HANGING WOOD AND FELT BUTTERFLY ,1,0.84,,United Kingdom,2025-11-29
512589,90010A,MIDNIGHT BLUE GLASS/SILVER BRACELET,1,9.77,,United Kingdom,2025-11-29
512589,90013A,MIDNIGHT BLUE VINTAGE EARRINGS,1,3.81,,United Kingdom,2025-11-29
512589,90018A,SILVER M.O.P ORBIT DROP EARRINGS,1,4.24,,United Kingdom,2025-11-29
512589,90024B,NEW BAROQUE B'FLY NECKLACE RED,1,8.49,,United Kingdom,2025-11-29
512589,90062,CARNIVAL BRACELET,1,12.75,,United Kingdom,2025-11-29
512589,21669,BLUE STRIPE CERAMIC DRAWER KNOB,2,2.51,,United Kingdom,2025-11-29
512589,90124B,BLUE MURANO TWIST NECKLACE,1,10.17,,United Kingdom,2025-11-29
512589,90134,OLD ROSE COMBO BEAD NECKLACE,1,2.96,,United Kingdom,2025-11-29
512589,90145,SILVER HOOP EARRINGS WITH FLOWER,2,6.37,,United Kingdom,2025-11-29
512589,90164B,WHITE  ROSEBUD PEARL BRACELET,1,7.64,,United Kingdom,2025-11-29
512589,90166,PINK & WHITE ROSEBUD RING,1,4.24,,United Kingdom,2025-11-29
512589,90169,DAISY HAIR COMB,1,2.54,,United Kingdom,2025-11-29
512589,90170,DAISY HAIR BAND,1,1.69,,United Kingdom,2025-11-29
512589,90177C,DROP DIAMANTE EARRINGS CRYSTAL,1,2.96,,United Kingdom,2025-11-29
512589,90214A,"LETTER ""A"" BLING KEY RING",1,2.51,,United Kingdom,2025-11-29
512589,90214B,"LETTER ""B"" BLING KEY RING",1,2.51,,United Kingdom,2025-11-29
512589,90214E,"LETTER ""E"" BLING KEY RING",1,2.51,,United Kingdom,2025-11-29
512589,90214M,"LETTER ""M"" BLING KEY RING",1,2.51,,United Kingdom,2025-11-29
512589,DOT,DOTCOM POSTAGE,1,124.97,,United Kingdom,2025-11-29
512589,15036,ASSORTED COLOURS SILK FAN,1,1.28,,United Kingdom,2025-11-29
512589,15044C,PURPLE PAPER PARASOL,1,5.91,,United Kingdom,2025-11-29
512589,21754,HOME BUILDING BLOCK WORD,2,11.87,,United Kingdom,2025-11-29
512589,22090,PAPER BUNTING RETRO SPOTS,4,5.91,,United Kingdom,2025-11-29
512589,21775,DECORATIVE FLORE BATHROOM BOTTLE,1,2.51,,United Kingdom,2025-11-29
512589,22509,SEWING BOX RETROSPOT DESIGN ,1,34.04,,United Kingdom,2025-11-29
512589,22528,GARDENERS KNEELING PAD,3,2.51,,United Kingdom,2025-11-29
512589,22544,MINI JIGSAW SPACEBOY,1,0.85,,United Kingdom,2025-11-29
512589,22545,MINI JIGSAW BUNNIES,1,0.85,,United Kingdom,2025-11-29
512589,22548,HEADS AND TAILS SPORTING FUN,1,2.51,,United Kingdom,2025-11-29
512589,22558,CLOTHES PEGS RETROSPOT PACK 24 ,4,2.51,,United Kingdom,2025-11-29
512589,22585,PACK OF 6 BIRDY GIFT TAGS,1,2.51,,United Kingdom,2025-11-29
512589,22621,TRADITIONAL KNITTING NANCY,1,2.98,,United Kingdom,2025-11-29
512589,22645,CERAMIC HEART FAIRY CAKE MONEY BANK,2,3.36,,United Kingdom,2025-11-29
512589,22646,CERAMIC STRAWBERRY CAKE MONEY BANK,2,3.36,,United Kingdom,2025-11-29
512589,22712,CARD DOLLY GIRL ,1,0.85,,United Kingdom,2025-11-29
512589,21080,SET/20 RED SPOTTY PAPER NAPKINS ,1,1.66,,United Kingdom,2025-11-29
512589,21086,SET/6 RED SPOTTY PAPER CUPS,6,1.66,,United Kingdom,2025-11-29
512589,21114,LAVENDER SCENTED FABRIC HEART,1,11.02,,United Kingdom,2025-11-29
