Invoice,StockCode,Description,Quantity,Price,Customer ID,Country,InvoiceDate
511851,84659A,WHITE TRAVEL ALARM CLOCK,2,2.55,13542.0,United Kingdom,2025-11-24
511851,85035C,ROSE 3 WICK MORRIS BOX CANDLE,1,4.25,13542.0,United Kingdom,2025-11-24
511851,85034C,3 ROSE MORRIS BOXED CANDLES,1,4.25,13542.0,United Kingdom,2025-11-24
511851,21326,AGED GLASS SILVER T-LIGHT HOLDER,12,0.65,13542.0,United Kingdom,2025-11-24
511851,85123A,WHITE HANGING HEART T-LIGHT HOLDER,2,2.95,13542.0,United Kingdom,2025-11-24
511851,15056BL,EDWARDIAN PARASOL BLACK,2,5.95,13542.0,United Kingdom,2025-11-24
511851,15056N,EDWARDIAN PARASOL NATURAL,2,5.95,13542.0,United Kingdom,2025-11-24
511851,85035A,GARDENIA 3 WICK MORRIS BOXED CANDLE,1,4.25,13542.0,United Kingdom,2025-11-24
511851,22063,CERAMIC BOWL WITH STRAWBERRY DESIGN,2,2.95,13542.0,United Kingdom,2025-11-24
511851,48187,DOOR MAT NEW ENGLAND,1,7.49,13542.0,United Kingdom,2025-11-24
511851,21232,STRAWBERRY CERAMIC TRINKET BOX,2,1.25,13542.0,United Kingdom,2025-11-24
511851,21713,CITRONELLA CANDLE FLOWERPOT,2,2.1,13542.0,United Kingdom,2025-11-24
511851,48173C,DOOR MAT BLACK FLOCK ,2,7.49,13542.0,United Kingdom,2025-11-24
511851,20685,DOOR MAT RED SPOT,2,7.49,13542.0,United Kingdom,2025-11-24
511851,48194,DOOR MAT HEARTS,2,7.49,13542.0,United Kingdom,2025-11-24
511851,21523,DOOR MAT FANCY FONT HOME SWEET HOME,2,7.49,13542.0,United Kingdom,2025-11-24
511851,21955,DOOR MAT UNION JACK GUNS AND ROSES,1,7.49,13542.0,United Kingdom,2025-11-24
511851,48184,DOOR MAT ENGLISH ROSE ,1,7.49,13542.0,United Kingdom,2025-11-24
511851,21524,DOOR MAT SPOTTY HOME SWEET HOME,4,7.49,13542.0,United Kingdom,2025-11-24
511851,48129,DOOR MAT TOPIARY,2,7.49,13542.0,United Kingdom,2025-11-24
511851,48116,DOOR MAT MULTICOLOUR STRIPE,1,7.49,13542.0,United Kingdom,2025-11-24
511851,85099B,JUMBO BAG RED RETROSPOT,4,1.95,13542.0,United Kingdom,2025-11-24
511851,22386,JUMBO BAG PINK WITH WHITE SPOTS,4,1.95,13542.0,United Kingdom,2025-11-24
511851,85099C,JUMBO  BAG BAROQUE BLACK WHITE,2,1.95,13542.0,United Kingdom,2025-11-24
511851,85099F,JUMBO BAG STRAWBERRY,2,1.95,13542.0,United Kingdom,2025-11-24
511851,48111,DOOR MAT 3 SMILEY CATS,2,7.49,13542.0,United Kingdom,2025-11-24
511851,72756,FAIRY CAKE CANDLES,9,1.49,13542.0,United Kingdom,2025-11-24
511852,21559,STRAWBERRY LUNCH BOX WITH CUTLERY,1,2.55,16549.0,United Kingdom,2025-11-24
511852,21066,VINTAGE RED MUG,1,1.25,16549.0,United Kingdom,2025-11-24
511852,21955,DOOR MAT UNION JACK GUNS AND ROSES,1,7.49,16549.0,United Kingdom,2025-11-24
511852,47556B,TEA TIME TEA TOWELS ,1,2.95,16549.0,United Kingdom,2025-11-24
511852,77101A,UNION FLAG WINDSOCK,1,1.25,16549.0,United Kingdom,2025-11-24
511852,84970S,HANGING HEART ZINC T-LIGHT HOLDER,2,0.85,16549.0,United Kingdom,2025-11-24
511852,22352,LUNCH BOX WITH CUTLERY RETROSPOT ,2,2.55,16549.0,United Kingdom,2025-11-24
511852,48116,DOOR MAT MULTICOLOUR STRIPE,1,7.49,16549.0,United Kingdom,2025-11-24
511852,21558,SKULL LUNCH BOX WITH CUTLERY ,1,2.55,16549.0,United Kingdom,2025-11-24
511852,21901,"KEY FOB , BACK DOOR ",1,0.65,16549.0,United Kingdom,2025-11-24
511852,84978,HANGING HEART JAR T-LIGHT HOLDER,1,1.25,16549.0,United Kingdom,2025-11-24
511852,21937,STRAWBERRY   PICNIC BAG,1,2.95,16549.0,United Kingdom,2025-11-24
511852,21586,KINGS CHOICE GIANT TUBE MATCHES,2,2.55,16549.0,United Kingdom,2025-11-24
511852,21584,RETRO SPOT SMALL TUBE MATCHES,1,1.65,16549.0,United Kingdom,2025-11-24
511852,20914,SET/5 RED SPOTTY LID GLASS BOWLS,1,2.95,16549.0,United Kingdom,2025-11-24
511852,21172,PARTY METAL SIGN ,1,1.45,16549.0,United Kingdom,2025-11-24
511852,84978,HANGING HEART JAR T-LIGHT HOLDER,1,1.25,16549.0,United Kingdom,2025-11-24
511852,84978,HANGING HEART JAR T-LIGHT HOLDER,4,1.25,16549.0,United Kingdom,2025-11-24
511852,84978,HANGING HEART JAR T-LIGHT HOLDER,4,1.25,16549.0,United Kingdom,2025-11-24
511852,21557,SET OF 6 FUNKY BEAKERS,5,2.95,16549.0,United Kingdom,2025-11-24
511852,84849B,FAIRY SOAP SOAP HOLDER,1,1.69,16549.0,United Kingdom,2025-11-24
511852,21754,HOME BUILDING BLOCK WORD,1,5.95,16549.0,United Kingdom,2025-11-24
511852,85123A,WHITE HANGING HEART T-LIGHT HOLDER,1,2.95,16549.0,United Kingdom,2025-11-24
511852,47590B,PINK HAPPY BIRTHDAY BUNTING,1,5.45,16549.0,United Kingdom,2025-11-24
511852,85150,LADIES & GENTLEMEN METAL SIGN,1,2.55,16549.0,United Kingdom,2025-11-24
511852,22097,SWALLOW SQUARE TISSUE BOX,1,1.25,16549.0,United Kingdom,2025-11-24
511852,21080,SET/20 RED SPOTTY PAPER NAPKINS ,2,0.85,16549.0,United Kingdom,2025-11-24
511852,21381,MINI WOODEN HAPPY BIRTHDAY GARLAND,2,1.69,16549.0,United Kingdom,2025-11-24
511852,22555,PLASTERS IN TIN STRONGMAN,2,1.65,16549.0,United Kingdom,2025-11-24
511852,22557,PLASTERS IN TIN VINTAGE PAISLEY ,1,1.65,16549.0,United Kingdom,2025-11-24
511852,22554,PLASTERS IN TIN WOODLAND ANIMALS,1,1.65,16549.0,United Kingdom,2025-11-24
511852,22469,HEART OF WICKER SMALL,1,1.65,16549.0,United Kingdom,2025-11-24
511852,47559B,TEA TIME OVEN GLOVE,1,1.25,16549.0,United Kingdom,2025-11-24
511852,22178,VICTORIAN GLASS HANGING T-LIGHT,1,1.25,16549.0,United Kingdom,2025-11-24
511852,22508,DOORSTOP RETROSPOT HEART,2,3.75,16549.0,United Kingdom,2025-11-24
511852,21363,HOME SMALL WOOD LETTERS,1,4.95,16549.0,United Kingdom,2025-11-24
511852,84970L,SINGLE HEART ZINC T-LIGHT HOLDER,2,0.95,16549.0,United Kingdom,2025-11-24
511852,21381,MINI WOODEN HAPPY BIRTHDAY GARLAND,1,1.69,16549.0,United Kingdom,2025-11-24
511852,84970S,HANGING HEART ZINC T-LIGHT HOLDER,2,0.85,16549.0,United Kingdom,2025-11-24
511852,21363,HOME SMALL WOOD LETTERS,1,4.95,16549.0,United Kingdom,2025-11-24
511852,22198,LARGE POPCORN HOLDER ,5,1.65,16549.0,United Kingdom,2025-11-24
511852,22138,BAKING SET 9 PIECE RETROSPOT ,1,4.95,16549.0,United Kingdom,2025-11-24
511852,22470,HEART OF WICKER LARGE,1,2.95,16549.0,United Kingdom,2025-11-24
511852,47589,CONGRATULATIONS BUNTING,1,5.45,16549.0,United Kingdom,2025-11-24
511852,21901,"KEY FOB , BACK DOOR ",3,0.65,16549.0,United Kingdom,2025-11-24
511852,21790,VINTAGE SNAP CARDS,1,0.85,16549.0,United Kingdom,2025-11-24
511852,21981,PACK OF 12 WOODLAND TISSUES ,1,0.29,16549.0,United Kingdom,2025-11-24
511852,21874,GIN AND TONIC MUG,1,1.25,16549.0,United Kingdom,2025-11-24
511852,22499,WOODEN UNION JACK BUNTING,1,5.95,16549.0,United Kingdom,2025-11-24
511852,21878,PACK OF 6 SANDCASTLE FLAGS ASSORTED,1,0.85,16549.0,United Kingdom,2025-11-24
511852,22616,PACK OF 12 LONDON TISSUES ,1,0.29,16549.0,United Kingdom,2025-11-24
511852,82581,TOILET METAL SIGN,1,0.55,16549.0,United Kingdom,2025-11-24
511852,21179,NO JUNK MAIL METAL SIGN,1,1.25,16549.0,United Kingdom,2025-11-24
511852,82581,TOILET METAL SIGN,2,0.55,16549.0,United Kingdom,2025-11-24
511852,20972,PINK CREAM FELT CRAFT TRINKET BOX ,1,1.25,16549.0,United Kingdom,2025-11-24
511852,21733,RED HANGING HEART T-LIGHT HOLDER,1,2.95,16549.0,United Kingdom,2025-11-24
511852,21228,"POCKET MIRROR ""GLAMOROUS""",2,1.25,16549.0,United Kingdom,2025-11-24
511852,20723,STRAWBERRY CHARLOTTE BAG,1,0.85,16549.0,United Kingdom,2025-11-24
511852,21174,POTTERING IN THE SHED METAL SIGN,1,1.95,16549.0,United Kingdom,2025-11-24
511852,22355,CHARLOTTE BAG SUKI DESIGN,1,0.85,16549.0,United Kingdom,2025-11-24
511852,21745,GAOLERS KEYS DECORATIVE GARDEN ,2,3.75,16549.0,United Kingdom,2025-11-24
511852,22215,CAKE STAND WHITE TWO TIER LACE,1,8.5,16549.0,United Kingdom,2025-11-24
511852,22508,DOORSTOP RETROSPOT HEART,1,3.75,16549.0,United Kingdom,2025-11-24
511852,21323,HANGING MEDINA LANTERN LARGE,2,4.25,16549.0,United Kingdom,2025-11-24
511852,85123A,WHITE HANGING HEART T-LIGHT HOLDER,3,2.95,16549.0,United Kingdom,2025-11-24
511852,21955,DOOR MAT UNION JACK GUNS AND ROSES,1,7.49,16549.0,United Kingdom,2025-11-24
511852,22470,HEART OF WICKER LARGE,1,2.95,16549.0,United Kingdom,2025-11-24
511852,20669,RED HEART LUGGAGE TAG,1,1.25,16549.0,United Kingdom,2025-11-24
511852,21900,"KEY FOB , SHED",1,0.65,16549.0,United Kingdom,2025-11-24
511852,22077,6 RIBBONS RUSTIC CHARM,1,1.65,16549.0,United Kingdom,2025-11-24
511852,22219,LOVEBIRD HANGING DECORATION WHITE ,1,0.85,16549.0,United Kingdom,2025-11-24
511852,21902,"KEY FOB , FRONT  DOOR ",1,0.65,16549.0,United Kingdom,2025-11-24
511852,21900,"KEY FOB , SHED",2,0.65,16549.0,United Kingdom,2025-11-24
511852,20981,12 PENCILS TALL TUBE WOODLAND,1,0.85,16549.0,United Kingdom,2025-11-24
511852,21875,KINGS CHOICE MUG,1,1.25,16549.0,United Kingdom,2025-11-24
511852,21872,GLAMOROUS  MUG,1,1.25,16549.0,United Kingdom,2025-11-24
511852,21876,POTTERING MUG,1,1.25,16549.0,United Kingdom,2025-11-24
511852,21899,"KEY FOB , GARAGE DESIGN",1,0.65,16549.0,United Kingdom,2025-11-24
511852,21584,RETRO SPOT SMALL TUBE MATCHES,1,1.65,16549.0,United Kingdom,2025-11-24
511852,21314,SMALL GLASS HEART TRINKET POT,2,2.1,16549.0,United Kingdom,2025-11-24
511852,21327,SKULLS WRITING SET ,1,1.65,16549.0,United Kingdom,2025-11-24
511852,22084,PAPER CHAIN KIT EMPIRE,1,2.95,16549.0,United Kingdom,2025-11-24
511852,40018F,CHERRY DESIGN PAPERLANTERNS,3,1.95,16549.0,United Kingdom,2025-11-24
511852,21929,JUMBO BAG PINK VINTAGE PAISLEY,2,1.95,16549.0,United Kingdom,2025-11-24
511852,21203,BUTTERFLIES  HONEYCOMB GARLAND,1,1.65,16549.0,United Kingdom,2025-11-24
511852,21866,UNION JACK FLAG LUGGAGE TAG,1,1.25,16549.0,United Kingdom,2025-11-24
511852,20659,ECONOMY LUGGAGE TAG,1,1.25,16549.0,United Kingdom,2025-11-24
511852,22178,VICTORIAN GLASS HANGING T-LIGHT,1,1.25,16549.0,United Kingdom,2025-11-24
