Invoice,StockCode,Description,Quantity,Price,Customer ID,Country,InvoiceDate
516538,22317,FIVE CATS HANGING DECORATION,6,2.95,16180.0,United Kingdom,2025-12-29
516538,22383,LUNCH BAG SUKI  DESIGN ,30,1.65,16180.0,United Kingdom,2025-12-29
516538,22131,FOOD CONTAINER SET 3 LOVE HEART ,6,1.95,16180.0,United Kingdom,2025-12-29
516538,22328,ROUND SNACK BOXES SET OF 4 FRUITS ,6,2.95,16180.0,United Kingdom,2025-12-29
516538,21700,BIG DOUGHNUT FRIDGE MAGNETS,12,0.85,16180.0,United Kingdom,2025-12-29
516541,22285,"DECORATION HEN ON NEST, HANGING",24,1.65,15290.0,United Kingdom,2025-12-29
516541,21977,PACK OF 60 PINK PAISLEY CAKE CASES,24,0.55,15290.0,United Kingdom,2025-12-29
C516543,20728,LUNCH BAG CARS BLUE,-1,1.65,13115.0,United Kingdom,2025-12-29
516541,22303,COFFEE MUG APPLES DESIGN,6,2.55,15290.0,United Kingdom,2025-12-29
516541,21868,POTTING SHED TEA MUG,36,1.25,15290.0,United Kingdom,2025-12-29
516541,21888,BINGO SET,8,3.75,15290.0,United Kingdom,2025-12-29
516541,22077,6 RIBBONS RUSTIC CHARM,24,1.65,15290.0,United Kingdom,2025-12-29
516541,21078,SET/20 STRAWBERRY PAPER NAPKINS ,24,0.85,15290.0,United Kingdom,2025-12-29
516541,84879,ASSORTED COLOUR BIRD ORNAMENT,24,1.69,15290.0,United Kingdom,2025-12-29
516541,21136,PAINTED METAL PEARS ASSORTED,16,1.69,15290.0,United Kingdom,2025-12-29
516541,21080,SET/20 RED SPOTTY PAPER NAPKINS ,24,0.85,15290.0,United Kingdom,2025-12-29
516548,40046A,RED DAISY PAPER LAMPSHADE,2,2.51,,United Kingdom,2025-12-29
516548,47566,PARTY BUNTING,16,4.65,,United Kingdom,2025-12-29
516548,47597,NEW ENGLAND TEATOWELS,1,1.66,,United Kingdom,2025-12-29
516548,48116,DOORMAT MULTICOLOUR STRIPE,1,14.43,,United Kingdom,2025-12-29
516548,48184,DOORMAT ENGLISH ROSE ,1,14.43,,United Kingdom,2025-12-29
516548,75178,ASSTD COL BUTTERFLY/CRYSTAL W/CHIME,2,2.51,,United Kingdom,2025-12-29
516548,79328,BLUE FLOCK GLASS CANDLEHOLDER,2,3.36,,United Kingdom,2025-12-29
516548,82011A,"BATHROOM SCALES, TROPICAL BEACH",10,4.21,,United Kingdom,2025-12-29
516548,82011C,BATHROOM SCALES FOOTPRINTS IN SAND,1,7.62,,United Kingdom,2025-12-29
516548,82484,WOOD BLACK BOARD ANT WHITE FINISH,1,13.57,,United Kingdom,2025-12-29
516548,82580,BATHROOM METAL SIGN,1,1.28,,United Kingdom,2025-12-29
516548,82600,NO SINGING METAL SIGN,1,4.21,,United Kingdom,2025-12-29
516548,84078A,SET/4 WHITE RETRO STORAGE CUBES ,1,76.55,,United Kingdom,2025-12-29
516548,84212,"ASSORTED FLOWER COLOUR ""LEIS""",2,5.06,,United Kingdom,2025-12-29
516548,84534B,FAIRY CAKE NOTEBOOK A5 SIZE,2,1.66,,United Kingdom,2025-12-29
516548,84536A,ENGLISH ROSE NOTEBOOK A7 SIZE,2,0.85,,United Kingdom,2025-12-29
516548,84598,BOYS ALPHABET IRON ON PATCHES,3,0.43,,United Kingdom,2025-12-29
516548,37449,CERAMIC CAKE STAND + HANGING CAKES,1,9.95,,United Kingdom,2025-12-29
516548,82483,WOOD 2 DRAWER CABINET WHITE FINISH,1,12.72,,United Kingdom,2025-12-29
516548,35961,FOLKART ZINC HEART CHRISTMAS DEC,1,1.66,,United Kingdom,2025-12-29
516548,82482,WOODEN PICTURE FRAME WHITE FINISH,9,2.55,,United Kingdom,2025-12-29
516548,22718,CARD CAT AND TREE ,1,0.85,,United Kingdom,2025-12-29
516548,85123A,WHITE HANGING HEART T-LIGHT HOLDER,7,2.95,,United Kingdom,2025-12-29
516548,82494L,WOODEN FRAME ANTIQUE WHITE ,8,2.95,,United Kingdom,2025-12-29
516548,84913B,MINT GREEN ROSE TOWEL,1,3.36,,United Kingdom,2025-12-29
516548,20617,FIRST CLASS PASSPORT COVER ,2,4.21,,United Kingdom,2025-12-29
516548,20618,QUEEN OF THE SKIES PASSPORT COVER ,6,4.21,,United Kingdom,2025-12-29
516548,20621,ECONOMY PASSPORT COVER ,4,4.21,,United Kingdom,2025-12-29
516548,20682,RED SPOTTY CHILDS UMBRELLA,1,6.77,,United Kingdom,2025-12-29
516548,20717,STRAWBERRY SHOPPER BAG,1,2.51,,United Kingdom,2025-12-29
516548,20961,STRAWBERRY BATH SPONGE ,1,2.51,,United Kingdom,2025-12-29
516548,20969,RED FLORAL FELTCRAFT SHOULDER BAG,1,7.62,,United Kingdom,2025-12-29
516548,71459,HANGING JAM JAR T-LIGHT HOLDER,4,1.69,,United Kingdom,2025-12-29
516548,72349B,SET/6 PURPLE BUTTERFLY T-LIGHTS,1,4.21,,United Kingdom,2025-12-29
516548,22498,WOODEN REGATTA BUNTING,1,12.72,,United Kingdom,2025-12-29
516548,22568,FELTCRAFT CUSHION OWL,1,7.62,,United Kingdom,2025-12-29
516548,22570,FELTCRAFT CUSHION RABBIT,1,7.62,,United Kingdom,2025-12-29
516548,22577,WOODEN HEART CHRISTMAS SCANDINAVIAN,1,1.66,,United Kingdom,2025-12-29
516548,22630,DOLLY GIRL LUNCH BOX,1,4.21,,United Kingdom,2025-12-29
516548,22643,SET OF 4 NAPKIN CHARMS LEAVES   ,1,5.06,,United Kingdom,2025-12-29
516548,22692,DOORMAT WELCOME TO OUR HOME,1,14.43,,United Kingdom,2025-12-29
516548,35471A,SET OF 3 BIRD L.BLUE FEATHER,1,2.51,,United Kingdom,2025-12-29
516548,84918,CREAM CUSHION COVER WITH FLOWERS,4,5.91,,United Kingdom,2025-12-29
516548,20941,FROG CANDLE,1,2.51,,United Kingdom,2025-12-29
516548,84978,HANGING HEART JAR T-LIGHT HOLDER,5,2.51,,United Kingdom,2025-12-29
516548,21731,RED TOADSTOOL LED NIGHT LIGHT,1,3.36,,United Kingdom,2025-12-29
516548,21755,LOVE BUILDING BLOCK WORD,1,11.87,,United Kingdom,2025-12-29
516548,21864,UNION JACK FLAG PASSPORT COVER ,1,4.21,,United Kingdom,2025-12-29
516548,21866,UNION JACK FLAG LUGGAGE TAG,1,2.51,,United Kingdom,2025-12-29
516548,21917,SET 12 KIDS  WHITE CHALK STICKS,1,0.85,,United Kingdom,2025-12-29
516548,21945,STRAWBERRIES  DESIGN FLANNEL ,1,1.66,,United Kingdom,2025-12-29
516548,21973,SET OF 36 MUSHROOM PAPER DOILIES,2,2.98,,United Kingdom,2025-12-29
516548,21976,PACK OF 60 MUSHROOM CAKE CASES,1,1.28,,United Kingdom,2025-12-29
516548,21977,PACK OF 60 PINK PAISLEY CAKE CASES,1,1.28,,United Kingdom,2025-12-29
516548,21981,PACK OF 12 WOODLAND TISSUES ,2,0.85,,United Kingdom,2025-12-29
516548,22025,RING OF ROSES BIRTHDAY CARD,1,0.85,,United Kingdom,2025-12-29
516548,22035,VINTAGE CARAVAN GREETING CARD ,1,0.85,,United Kingdom,2025-12-29
516548,22055,MINI CAKE STAND  HANGING STRAWBERY,1,3.36,,United Kingdom,2025-12-29
516548,22061,LARGE CAKE STAND  HANGING STRAWBERY,1,21.23,,United Kingdom,2025-12-29
516548,22088,PAPER BUNTING COLOURED LACE,2,5.91,,United Kingdom,2025-12-29
516548,22132,RED LOVE HEART SHAPE CUP,1,1.66,,United Kingdom,2025-12-29
516548,22133,PINK LOVE HEART SHAPE CUP,3,1.66,,United Kingdom,2025-12-29
516548,22135,LADLE LOVE HEART PINK,1,0.85,,United Kingdom,2025-12-29
516548,22139,RETRO SPOT TEA SET CERAMIC 11 PC ,1,11.02,,United Kingdom,2025-12-29
516548,21714,CITRONELLA CANDLE GARDEN POT,1,2.51,,United Kingdom,2025-12-29
516548,84970L,SINGLE HEART ZINC T-LIGHT HOLDER,2,2.13,,United Kingdom,2025-12-29
516548,21640,ASSORTED TUTTI FRUTTI  FOB NOTEBOOK,1,1.66,,United Kingdom,2025-12-29
516548,21622,VINTAGE UNION JACK CUSHION COVER,1,13.57,,United Kingdom,2025-12-29
516548,84988,SET OF 72 PINK HEART PAPER DOILIES,1,2.98,,United Kingdom,2025-12-29
516548,85014B,RED/WHITE DOTS RUFFLED UMBRELLA,1,12.72,,United Kingdom,2025-12-29
516548,85039A,SET/4 RED MINI ROSE CANDLE IN BOWL,1,3.36,,United Kingdom,2025-12-29
516548,85039B,S/4 IVORY MINI ROSE CANDLE IN BOWL,1,3.36,,United Kingdom,2025-12-29
516548,85039C,S/4 BLACK MINI ROSE CANDLE IN BOWL,1,3.36,,United Kingdom,2025-12-29
516548,85059,FRENCH ENAMEL WATER BASIN,1,7.62,,United Kingdom,2025-12-29
516548,85099B,JUMBO BAG RED RETROSPOT,1,4.21,,United Kingdom,2025-12-29
516548,20719,WOODLAND CHARLOTTE BAG,1,1.66,,United Kingdom,2025-12-29
516548,20726,LUNCH BAG WOODLAND,1,4.21,,United Kingdom,2025-12-29
516548,20828,GLITTER BUTTERFLY CLIPS,2,5.06,,United Kingdom,2025-12-29
516548,20832,RED FLOCK LOVE HEART PHOTO FRAME,1,1.66,,United Kingdom,2025-12-29
516548,20846,ZINC HEART LATTICE T-LIGHT HOLDER,34,2.51,,United Kingdom,2025-12-29
516548,20901,VINTAGE KEEPSAKE BOX PINK FLOWER,1,12.72,,United Kingdom,2025-12-29
516548,20914,SET/5 RED SPOTTY LID GLASS BOWLS,1,5.91,,United Kingdom,2025-12-29
516548,20932,PINK POT PLANT CANDLE,1,7.62,,United Kingdom,2025-12-29
516548,21204,DAISIES  HONEYCOMB GARLAND ,1,3.36,,United Kingdom,2025-12-29
516548,21452,TOADSTOOL MONEY BOX,1,5.91,,United Kingdom,2025-12-29
516548,21486,PINK HEART DOTS HOT WATER BOTTLE,2,4.21,,United Kingdom,2025-12-29
516548,21555,CERAMIC STRAWBERRY TRINKET TRAY,1,5.06,,United Kingdom,2025-12-29
516548,21637,ASSORTED SANSKRIT MINI NOTEBOOK,2,2.51,,United Kingdom,2025-12-29
516548,21174,POTTERING IN THE SHED METAL SIGN,2,4.21,,United Kingdom,2025-12-29
516548,21209,MULTICOLOUR HONEYCOMB FAN,1,3.36,,United Kingdom,2025-12-29
516548,21096,SET/6 FRUIT SALAD  PAPER PLATES,2,1.66,,United Kingdom,2025-12-29
516551,17011F,ORIGAMI SANDLEWOOD INCENSE+FLOWER,20,0.65,17696.0,United Kingdom,2025-12-29
516551,17091J,VANILLA INCENSE IN TIN,36,0.38,17696.0,United Kingdom,2025-12-29
516551,20941,FROG CANDLE,12,1.25,17696.0,United Kingdom,2025-12-29
516551,82600,NO SINGING METAL SIGN,48,1.69,17696.0,United Kingdom,2025-12-29
516551,82551,LAUNDRY 15C METAL SIGN,24,1.25,17696.0,United Kingdom,2025-12-29
516551,82580,BATHROOM METAL SIGN,12,0.55,17696.0,United Kingdom,2025-12-29
516551,21669,BLUE STRIPE CERAMIC DRAWER KNOB,36,1.25,17696.0,United Kingdom,2025-12-29
516551,21668,RED STRIPE CERAMIC DRAWER KNOB,12,1.25,17696.0,United Kingdom,2025-12-29
516548,21164,HOME SWEET HOME METAL SIGN ,1,5.91,,United Kingdom,2025-12-29
516551,21671,RED SPOT CERAMIC DRAWER KNOB,12,1.25,17696.0,United Kingdom,2025-12-29
516551,21670,BLUE SPOT CERAMIC DRAWER KNOB,12,1.25,17696.0,United Kingdom,2025-12-29
516551,17084R,ASSORTED INCENSE PACK,72,0.21,17696.0,United Kingdom,2025-12-29
516548,84913A,SOFT PINK ROSE TOWEL ,1,3.36,,United Kingdom,2025-12-29
516548,21218,RED SPOTTY BISCUIT TIN,1,8.47,,United Kingdom,2025-12-29
516548,22202,MILK PAN PINK RETROSPOT,1,7.62,,United Kingdom,2025-12-29
516548,22217,T-LIGHT HOLDER HANGING LACE,1,2.51,,United Kingdom,2025-12-29
516548,22224,WHITE LOVEBIRD LANTERN,1,5.91,,United Kingdom,2025-12-29
516548,22227,"DECORATION, HANGING HEART+MIRROR ",1,1.28,,United Kingdom,2025-12-29
516551,85175,CACTI T-LIGHT CANDLES,48,0.42,17696.0,United Kingdom,2025-12-29
516548,84912A,PINK ROSE WASHBAG,1,3.36,,United Kingdom,2025-12-29
516548,84908B,BLUE 5 PATCH FLOWER CUSHION COVER,2,5.91,,United Kingdom,2025-12-29
516548,84905,PINK BUTTERFLY CUSHION COVER ,2,5.06,,United Kingdom,2025-12-29
516548,21232,STRAWBERRY CERAMIC TRINKET BOX,1,2.51,,United Kingdom,2025-12-29
516548,21249,WOODLAND  HEIGHT CHART STICKERS ,1,5.91,,United Kingdom,2025-12-29
516548,21251,DINOSAUR HEIGHT CHART STICKER SET,1,5.91,,United Kingdom,2025-12-29
516548,21259,VICTORIAN SEWING BOX SMALL ,1,12.72,,United Kingdom,2025-12-29
516548,21312,LARGE CHUNKY GLASS ROMAN BOWL,1,13.57,,United Kingdom,2025-12-29
516548,21323,HANGING MEDINA LANTERN LARGE,1,8.47,,United Kingdom,2025-12-29
516548,21355,TOAST ITS - I LOVE YOU ,1,2.51,,United Kingdom,2025-12-29
516548,21377,SMALL CAMPHOR WOOD FIELD  MUSHROOM,1,3.36,,United Kingdom,2025-12-29
516548,21385,IVORY HANGING DECORATION  HEART,4,1.66,,United Kingdom,2025-12-29
516548,21390,FILIGRIS HEART WITH BUTTERFLY,1,2.51,,United Kingdom,2025-12-29
516548,21429,RED GINGHAM ROSE JEWELLERY BOX,1,3.36,,United Kingdom,2025-12-29
516548,22156,HEART DECORATION WITH PEARLS ,1,1.66,,United Kingdom,2025-12-29
516548,22161,HEART DECORATION RUSTIC HANGING ,1,1.66,,United Kingdom,2025-12-29
516548,22185,SLATE TILE NATURAL HANGING,1,3.36,,United Kingdom,2025-12-29
516548,22197,SMALL POPCORN HOLDER,10,1.66,,United Kingdom,2025-12-29
516548,22198,LARGE POPCORN HOLDER ,1,3.36,,United Kingdom,2025-12-29
516548,84686,BEACH HUT MIRROR,1,8.47,,United Kingdom,2025-12-29
516548,84692,BOX OF 24 COCKTAIL PARASOLS,1,0.85,,United Kingdom,2025-12-29
516548,84796B,BLUE SAVANNAH PICNIC HAMPER FOR 2,2,8.47,,United Kingdom,2025-12-29
516548,22250,DECORATION  BUTTERFLY  MAGIC GARDEN,1,1.66,,United Kingdom,2025-12-29
516548,22284,HEN HOUSE DECORATION,1,3.36,,United Kingdom,2025-12-29
516551,22461,SAVOY ART DECO CLOCK,1,12.75,17696.0,United Kingdom,2025-12-29
516548,22297,HEART IVORY TRELLIS SMALL,4,2.51,,United Kingdom,2025-12-29
516548,85213,MINI  ZINC GARDEN DECORATIONS ,3,1.66,,United Kingdom,2025-12-29
516548,85216,ASSORTED CAKES FRIDGE MAGNETS,1,7.62,,United Kingdom,2025-12-29
516548,85227,SET OF 6 3D KIT CARDS FOR KIDS,1,1.66,,United Kingdom,2025-12-29
516548,90012B,BLACK DROP CRYSTAL NECKLACE,1,10.2,,United Kingdom,2025-12-29
516548,90087,CRYSTAL SEA HORSE PHONE CHARM,1,1.66,,United Kingdom,2025-12-29
516548,90133,TEAL/FUSCHIA COL BEAD NECKLACE,1,5.09,,United Kingdom,2025-12-29
516548,90134,OLD ROSE COMBO BEAD NECKLACE,1,2.96,,United Kingdom,2025-12-29
516548,DOT,DOTCOM POSTAGE,1,278.71,,United Kingdom,2025-12-29
516548,15036,ASSORTED COLOURS SILK FAN,48,1.28,,United Kingdom,2025-12-29
516548,15039,SANDALWOOD FAN,1,1.66,,United Kingdom,2025-12-29
516548,15056N,EDWARDIAN PARASOL NATURAL,1,12.72,,United Kingdom,2025-12-29
516548,16236,KITTY PENCIL ERASERS,1,0.43,,United Kingdom,2025-12-29
516548,17003,BROCADE RING PURSE ,6,0.43,,United Kingdom,2025-12-29
516548,17091B,JASMINE TEA INCENSE IN TIN,3,2.51,,United Kingdom,2025-12-29
516548,17109D,FLOWER FAIRY INCENSE BOUQUET,3,3.36,,United Kingdom,2025-12-29
516548,17129F,BLUE GLASS GEMS IN BAG,3,1.66,,United Kingdom,2025-12-29
516548,20972,PINK CREAM FELT CRAFT TRINKET BOX ,1,2.51,,United Kingdom,2025-12-29
516548,21043,APRON MODERN VINTAGE COTTON,1,12.72,,United Kingdom,2025-12-29
516548,22296,HEART IVORY TRELLIS LARGE,3,3.36,,United Kingdom,2025-12-29
516548,85202,HANGING WOOD AND FELT HEART,1,0.84,,United Kingdom,2025-12-29
516548,85169A,IVORY LOVE BIRD CANDLE,1,2.51,,United Kingdom,2025-12-29
516548,17084N,FAIRY DREAMS INCENSE ,3,0.43,,United Kingdom,2025-12-29
516548,85123A,WHITE HANGING HEART T-LIGHT HOLDER,5,5.91,,United Kingdom,2025-12-29
516548,22301,COFFEE MUG CAT + BIRD DESIGN,2,5.06,,United Kingdom,2025-12-29
516548,22302,COFFEE MUG PEARS  DESIGN,2,5.06,,United Kingdom,2025-12-29
516548,22303,COFFEE MUG APPLES DESIGN,2,5.06,,United Kingdom,2025-12-29
516548,22326,ROUND SNACK BOXES SET OF4 WOODLAND ,1,5.91,,United Kingdom,2025-12-29
516548,22329,ROUND CONTAINER SET OF 5 RETROSPOT,1,3.36,,United Kingdom,2025-12-29
516548,22335,HEART DECORATION PAINTED ZINC ,1,1.28,,United Kingdom,2025-12-29
516548,22353,LUNCH BOX WITH CUTLERY FAIRY CAKES ,1,5.06,,United Kingdom,2025-12-29
516548,22366,DOORMAT AIRMAIL ,1,14.43,,United Kingdom,2025-12-29
516548,22410,MONEY BOX HOUSEKEEPING DESIGN,1,2.51,,United Kingdom,2025-12-29
516548,22355,CHARLOTTE BAG SUKI DESIGN,1,1.66,,United Kingdom,2025-12-29
516548,22412,METAL SIGN NEIGHBOURHOOD WITCH ,1,4.21,,United Kingdom,2025-12-29
516548,22421,LIPSTICK PEN FUSCHIA,2,0.85,,United Kingdom,2025-12-29
516548,22423,REGENCY CAKESTAND 3 TIER,2,25.49,,United Kingdom,2025-12-29
516548,22456,NATURAL SLATE CHALKBOARD LARGE ,1,10.17,,United Kingdom,2025-12-29
516548,22469,HEART OF WICKER SMALL,5,3.36,,United Kingdom,2025-12-29
516548,84685,BEACH HUT KEY CABINET,1,7.62,,United Kingdom,2025-12-29
516548,85103,SILVER T-LIGHT SETTING,1,13.57,,United Kingdom,2025-12-29
516548,85107,CUT GLASS T-LIGHT HOLDER OCTAGON,1,5.06,,United Kingdom,2025-12-29
516548,22411,JUMBO SHOPPER VINTAGE RED PAISLEY,1,4.21,,United Kingdom,2025-12-29
516548,85164B,BLACK BAROQUE CUCKOO CLOCK,1,25.49,,United Kingdom,2025-12-29
C516553,22221,CAKE STAND LOVEBIRD 2 TIER PINK,-1,9.95,14952.0,United Kingdom,2025-12-29
516561,72741,GRAND CHOCOLATECANDLE,288,1.25,12989.0,United Kingdom,2025-12-29
516564,22276,WASH BAG VINTAGE ROSE PAISLEY,3,2.55,14692.0,United Kingdom,2025-12-29
516564,22323,PINK POLKADOT KIDS BAG,4,1.95,14692.0,United Kingdom,2025-12-29
516564,84212,"ASSORTED FLOWER COLOUR ""LEIS""",6,0.65,14692.0,United Kingdom,2025-12-29
516564,22296,HEART IVORY TRELLIS LARGE,36,1.65,14692.0,United Kingdom,2025-12-29
516564,22275,WEEKEND BAG VINTAGE ROSE PAISLEY,4,8.5,14692.0,United Kingdom,2025-12-29
C516565,21527,RED RETROSPOT TRADITIONAL TEAPOT ,-1,7.95,12523.0,France,2025-12-29
C516565,21232,STRAWBERRY CERAMIC TRINKET BOX,-1,1.25,12523.0,France,2025-12-29
C516565,22269,EGG CUP NATURAL CHICKEN,-8,1.25,12523.0,France,2025-12-29
516566,22356,CHARLOTTE BAG PINK WITH WHITE SPOTS,20,0.85,12417.0,Belgium,2025-12-29
516566,21498,RED SPOTS  WRAP ,50,0.42,12417.0,Belgium,2025-12-29
516566,POST,POSTAGE,1,18.0,12417.0,Belgium,2025-12-29
516566,21042,RED SPOTTY APRON ,3,5.95,12417.0,Belgium,2025-12-29
516566,16161P,WRAP ENGLISH ROSE ,50,0.42,12417.0,Belgium,2025-12-29
516566,21452,TOADSTOOL MONEY BOX,6,2.95,12417.0,Belgium,2025-12-29
516566,22666,RECIPE BOX PANTRY YELLOW DESIGN,6,2.95,12417.0,Belgium,2025-12-29
516566,22577,WOODEN HEART CHRISTMAS SCANDINAVIAN,12,0.85,12417.0,Belgium,2025-12-29
516566,22600,CHRISTMAS RETROSPOT STAR WOOD,24,0.85,12417.0,Belgium,2025-12-29
516566,22593,CHRISTMAS GINGHAM STAR,12,0.85,12417.0,Belgium,2025-12-29
516566,21351,CINAMMON & ORANGE WREATH,2,6.75,12417.0,Belgium,2025-12-29
516568,21718,RED METAL BEACH SPADE ,12,1.25,12474.0,Germany,2025-12-29
516567,84970S,HANGING HEART ZINC T-LIGHT HOLDER,6,0.85,16529.0,United Kingdom,2025-12-29
516567,84970L,SINGLE HEART ZINC T-LIGHT HOLDER,6,0.95,16529.0,United Kingdom,2025-12-29
516567,84949,SILVER HANGING T-LIGHT HOLDER,6,1.65,16529.0,United Kingdom,2025-12-29
516567,21411,GINGHAM HEART  DOORSTOP RED,4,4.25,16529.0,United Kingdom,2025-12-29
516567,21410,COUNTRY COTTAGE  DOORSTOP GREEN,2,4.25,16529.0,United Kingdom,2025-12-29
516567,22644,CERAMIC CHERRY CAKE MONEY BANK,8,1.45,16529.0,United Kingdom,2025-12-29
516568,21715,GIRLS VINTAGE TIN SEASIDE BUCKET,8,2.55,12474.0,Germany,2025-12-29
516568,21716,BOYS VINTAGE TIN SEASIDE BUCKET,8,2.55,12474.0,Germany,2025-12-29
516568,21892,TRADITIONAL WOODEN CATCH CUP GAME ,12,1.25,12474.0,Germany,2025-12-29
516567,22507,MEMO BOARD RETROSPOT  DESIGN,4,4.95,16529.0,United Kingdom,2025-12-29
516568,22619,SET OF 6 SOLDIER SKITTLES,4,3.75,12474.0,Germany,2025-12-29
516568,22622,BOX OF VINTAGE ALPHABET BLOCKS,2,9.95,12474.0,Germany,2025-12-29
516568,22531,MAGIC DRAWING SLATE CIRCUS PARADE  ,48,0.42,12474.0,Germany,2025-12-29
516568,22534,MAGIC DRAWING SLATE SPACEBOY ,48,0.42,12474.0,Germany,2025-12-29
516568,22549,PICTURE DOMINOES,12,1.45,12474.0,Germany,2025-12-29
516568,22492,MINI PAINT SET VINTAGE ,36,0.65,12474.0,Germany,2025-12-29
516568,22634,CHILDS BREAKFAST SET SPACEBOY ,2,9.95,12474.0,Germany,2025-12-29
516568,22636,CHILDS BREAKFAST SET CIRCUS PARADE,2,8.5,12474.0,Germany,2025-12-29
516568,POST,POSTAGE,1,18.0,12474.0,Germany,2025-12-29
516568,21891,TRADITIONAL WOODEN SKIPPING ROPE,12,1.25,12474.0,Germany,2025-12-29
516567,22505,MEMO BOARD COTTAGE DESIGN,4,4.95,16529.0,United Kingdom,2025-12-29
516568,22621,TRADITIONAL KNITTING NANCY,12,1.45,12474.0,Germany,2025-12-29
516567,72802C,VANILLA SCENT CANDLE JEWELLED BOX,2,4.25,16529.0,United Kingdom,2025-12-29
516567,21232,STRAWBERRY CERAMIC TRINKET BOX,24,1.25,16529.0,United Kingdom,2025-12-29
516567,22645,CERAMIC HEART FAIRY CAKE MONEY BANK,8,1.45,16529.0,United Kingdom,2025-12-29
516567,48138,DOORMAT UNION FLAG,2,7.49,16529.0,United Kingdom,2025-12-29
516567,48184,DOORMAT ENGLISH ROSE ,3,7.49,16529.0,United Kingdom,2025-12-29
516567,21231,SWEETHEART CERAMIC TRINKET BOX,9,1.25,16529.0,United Kingdom,2025-12-29
516567,84509G,SET OF 4 FAIRY CAKE PLACEMATS ,2,3.75,16529.0,United Kingdom,2025-12-29
516567,47556B,TEA TIME TEA TOWELS ,2,2.95,16529.0,United Kingdom,2025-12-29
516567,72802B,OCEAN SCENT CANDLE IN JEWELLED BOX,2,4.25,16529.0,United Kingdom,2025-12-29
516567,47570B,TEA TIME TABLE CLOTH,2,10.65,16529.0,United Kingdom,2025-12-29
516567,37503,TEA TIME CAKE STAND IN GIFT BOX,1,10.75,16529.0,United Kingdom,2025-12-29
516567,48187,DOORMAT NEW ENGLAND,3,7.49,16529.0,United Kingdom,2025-12-29
516567,22470,HEART OF WICKER LARGE,10,2.95,16529.0,United Kingdom,2025-12-29
516567,22469,HEART OF WICKER SMALL,10,1.65,16529.0,United Kingdom,2025-12-29
516567,84836,ZINC METAL HEART DECORATION,2,1.25,16529.0,United Kingdom,2025-12-29
516567,22348,TEA BAG PLATE RED SPOTTY ,2,0.85,16529.0,United Kingdom,2025-12-29
516567,84763,ZINC FINISH 15CM PLANTER POTS,4,1.25,16529.0,United Kingdom,2025-12-29
516567,85152,HAND OVER THE CHOCOLATE   SIGN ,12,2.1,16529.0,United Kingdom,2025-12-29
516567,82600,NO SINGING METAL SIGN,12,2.1,16529.0,United Kingdom,2025-12-29
516567,82567,"AIRLINE LOUNGE,METAL SIGN",12,2.1,16529.0,United Kingdom,2025-12-29
516567,72802A,ROSE SCENT CANDLE IN JEWELLED BOX,2,4.25,16529.0,United Kingdom,2025-12-29
516567,22488,NATURAL SLATE RECTANGLE CHALKBOARD,12,1.65,16529.0,United Kingdom,2025-12-29
516569,22383,LUNCH BAG SUKI  DESIGN ,30,1.65,13093.0,United Kingdom,2025-12-29
516569,22382,LUNCH BAG SPACEBOY DESIGN ,10,1.65,13093.0,United Kingdom,2025-12-29
516569,20726,LUNCH BAG WOODLAND,30,1.65,13093.0,United Kingdom,2025-12-29
516569,20728,LUNCH BAG CARS BLUE,10,1.65,13093.0,United Kingdom,2025-12-29
516569,20725,LUNCH BAG RED SPOTTY,30,1.65,13093.0,United Kingdom,2025-12-29
516569,21210,SET OF 72 RETRO SPOT PAPER  DOILIES,12,1.45,13093.0,United Kingdom,2025-12-29
516569,22690,DOORMAT HOME SWEET HOME BLUE ,10,6.35,13093.0,United Kingdom,2025-12-29
516569,15036,ASSORTED COLOURS SILK FAN,24,0.75,13093.0,United Kingdom,2025-12-29
516569,84212,"ASSORTED FLOWER COLOUR ""LEIS""",48,0.65,13093.0,United Kingdom,2025-12-29
516569,84050,PINK HEART SHAPE EGG FRYING PAN,30,1.65,13093.0,United Kingdom,2025-12-29
516569,48111,DOORMAT 3 SMILEY CATS,10,6.35,13093.0,United Kingdom,2025-12-29
516569,20914,SET/5 RED SPOTTY LID GLASS BOWLS,32,2.55,13093.0,United Kingdom,2025-12-29
516569,71459,HANGING JAM JAR T-LIGHT HOLDER,60,0.85,13093.0,United Kingdom,2025-12-29
516569,84692,BOX OF 24 COCKTAIL PARASOLS,25,0.42,13093.0,United Kingdom,2025-12-29
516569,21949,SET OF 6 STRAWBERRY CHOPSTICKS,12,1.25,13093.0,United Kingdom,2025-12-29
516569,22629,SPACEBOY LUNCH BOX ,24,1.95,13093.0,United Kingdom,2025-12-29
516569,22036,DINOSAUR BIRTHDAY CARD,12,0.42,13093.0,United Kingdom,2025-12-29
516569,22037,ROBOT BIRTHDAY CARD,12,0.42,13093.0,United Kingdom,2025-12-29
516569,21508,VINTAGE KID DOLLY CARD ,12,0.42,13093.0,United Kingdom,2025-12-29
516569,22399,MAGNETS PACK OF 4 CHILDHOOD MEMORY,12,1.25,13093.0,United Kingdom,2025-12-29
516569,22400,MAGNETS PACK OF 4 HOME SWEET HOME,12,1.25,13093.0,United Kingdom,2025-12-29
516569,22402,MAGNETS PACK OF 4 VINTAGE COLLAGE,12,1.25,13093.0,United Kingdom,2025-12-29
516569,22136,LOVE HEART SOCK HANGER,24,1.65,13093.0,United Kingdom,2025-12-29
516569,22027,TEA PARTY BIRTHDAY CARD,12,0.42,13093.0,United Kingdom,2025-12-29
516569,22630,DOLLY GIRL LUNCH BOX,24,1.95,13093.0,United Kingdom,2025-12-29
516569,22423,REGENCY CAKESTAND 3 TIER,16,10.95,13093.0,United Kingdom,2025-12-29
516569,22502,PICNIC BASKET WICKER SMALL,16,3.75,13093.0,United Kingdom,2025-12-29
516569,48187,DOORMAT NEW ENGLAND,10,6.35,13093.0,United Kingdom,2025-12-29
516569,48194,DOORMAT HEARTS,10,6.35,13093.0,United Kingdom,2025-12-29
516570,21846,PINK DIAMANTE PEN IN GIFT BOX,1,4.95,,United Kingdom,2025-12-29
516570,20776,ABSTRACT CIRCLES NOTEBOOK,1,1.65,,United Kingdom,2025-12-29
516570,84946,ANTIQUE SILVER TEA GLASS ETCHED,2,1.25,,United Kingdom,2025-12-29
516570,21559,STRAWBERRY LUNCH BOX WITH CUTLERY,1,2.55,,United Kingdom,2025-12-29
516570,20757,RED DAISY POCKET BOOK ,3,0.85,,United Kingdom,2025-12-29
516570,20769,DAISY JOURNAL ,1,2.55,,United Kingdom,2025-12-29
516570,47566,PARTY BUNTING,1,4.65,,United Kingdom,2025-12-29
C516571,22533,MAGIC DRAWING SLATE BAKE A CAKE ,-48,0.42,17676.0,United Kingdom,2025-12-29
516572,22666,RECIPE BOX PANTRY YELLOW DESIGN,1,2.95,,United Kingdom,2025-12-29
516573,21035,SET/2 RED SPOTTY TEA TOWELS ,1,2.95,,United Kingdom,2025-12-29
516573,22070,SMALL RED RETROSPOT MUG IN BOX ,1,3.75,,United Kingdom,2025-12-29
516573,21232,STRAWBERRY CERAMIC TRINKET BOX,1,1.25,,United Kingdom,2025-12-29
516573,85025C,PINK HEART SHAPE PHOTO FRAME,1,1.65,,United Kingdom,2025-12-29
C516574,21754,HOME BUILDING BLOCK WORD,-1,5.95,13047.0,United Kingdom,2025-12-29
C516575,84978,HANGING HEART JAR T-LIGHT HOLDER,-1,1.25,17739.0,United Kingdom,2025-12-29
C516575,22666,RECIPE BOX PANTRY YELLOW DESIGN,-2,2.95,17739.0,United Kingdom,2025-12-29
C516576,20828,GLITTER BUTTERFLY CLIPS,-1,2.55,14621.0,United Kingdom,2025-12-29
C516576,20719,WOODLAND CHARLOTTE BAG,-2,0.85,14621.0,United Kingdom,2025-12-29
C516576,85170B,SET/6 BLACK BIRD T-LIGHT CANDLES,-3,2.1,14621.0,United Kingdom,2025-12-29
C516577,22064,PINK DOUGHNUT TRINKET POT ,-2,1.65,15791.0,United Kingdom,2025-12-29
C516577,21539,RED RETROSPOT BUTTER DISH,-1,4.95,15791.0,United Kingdom,2025-12-29
C516577,21232,STRAWBERRY CERAMIC TRINKET BOX,-1,1.25,15791.0,United Kingdom,2025-12-29
C516577,22073,RED RETROSPOT STORAGE JAR,-2,3.75,15791.0,United Kingdom,2025-12-29
C516577,71477,COLOUR GLASS. STAR T-LIGHT HOLDER,-3,3.25,15791.0,United Kingdom,2025-12-29
C516578,22138,BAKING SET 9 PIECE RETROSPOT ,-3,4.95,15827.0,United Kingdom,2025-12-29
C516578,21231,SWEETHEART CERAMIC TRINKET BOX,-1,1.25,15827.0,United Kingdom,2025-12-29
C516578,21843,RED RETROSPOT CAKE STAND,-1,10.95,15827.0,United Kingdom,2025-12-29
516579,22534,MAGIC DRAWING SLATE SPACEBOY ,96,0.42,16416.0,United Kingdom,2025-12-29
516579,21889,WOODEN BOX OF DOMINOES,24,1.25,16416.0,United Kingdom,2025-12-29
516579,71477,COLOUR GLASS. STAR T-LIGHT HOLDER,4,3.25,16416.0,United Kingdom,2025-12-29
516579,72760B,VINTAGE CREAM 3 BASKET CAKE STAND,1,9.95,16416.0,United Kingdom,2025-12-29
516579,22605,WOODEN CROQUET GARDEN SET,1,12.75,16416.0,United Kingdom,2025-12-29
C516580,21232,STRAWBERRY CERAMIC TRINKET BOX,-7,1.06,18223.0,United Kingdom,2025-12-29
C516580,22198,LARGE POPCORN HOLDER ,-2,1.65,18223.0,United Kingdom,2025-12-29
C516581,85099C,JUMBO  BAG BAROQUE BLACK WHITE,-2,1.95,16168.0,United Kingdom,2025-12-29
C516582,22061,LARGE CAKE STAND  HANGING STRAWBERY,-1,9.95,14915.0,United Kingdom,2025-12-29
516583,21314,SMALL GLASS HEART TRINKET POT,8,2.1,16416.0,United Kingdom,2025-12-29
516583,85123A,WHITE HANGING HEART T-LIGHT HOLDER,6,2.95,16416.0,United Kingdom,2025-12-29
516583,21977,PACK OF 60 PINK PAISLEY CAKE CASES,24,0.55,16416.0,United Kingdom,2025-12-29
516583,21258,VICTORIAN SEWING BOX LARGE,1,12.75,16416.0,United Kingdom,2025-12-29
516583,22469,HEART OF WICKER SMALL,6,1.65,16416.0,United Kingdom,2025-12-29
