Invoice,StockCode,Description,Quantity,Price,Customer ID,Country,InvoiceDate
508972,20684,STRAWBERRY DREAM CHILDS UMBRELLA,3,3.25,15727.0,United Kingdom,2025-11-06
508972,21214,SET OF 72 IVORY PAPER DOILIES,8,1.45,15727.0,United Kingdom,2025-11-06
508972,20682,RED SPOTTY CHILDS UMBRELLA,3,3.25,15727.0,United Kingdom,2025-11-06
508972,20681,PINK SPOTTY CHILDS UMBRELLA,3,3.25,15727.0,United Kingdom,2025-11-06
508972,22507,MEMO BOARD RETROSPOT  DESIGN,1,4.95,15727.0,United Kingdom,2025-11-06
508972,22607,WOODEN ROUNDERS GARDEN SET ,2,8.5,15727.0,United Kingdom,2025-11-06
508972,22333,RETRO SPORT PARTY BAG + STICKER SET,6,1.65,15727.0,United Kingdom,2025-11-06
508972,22334,DINOSAUR PARTY BAG + STICKER SET,6,1.65,15727.0,United Kingdom,2025-11-06
508972,22332,SKULLS PARTY BAG + STICKER SET,6,1.65,15727.0,United Kingdom,2025-11-06
508972,22605,WOODEN CROQUET GARDEN SET,2,12.75,15727.0,United Kingdom,2025-11-06
508972,22646,CERAMIC STRAWBERRY CAKE MONEY BANK,4,1.45,15727.0,United Kingdom,2025-11-06
508972,22398,MAGNETS PACK OF 4 SWALLOWS,12,1.25,15727.0,United Kingdom,2025-11-06
508972,22399,MAGNETS PACK OF 4 CHILDHOOD MEMORY,12,1.25,15727.0,United Kingdom,2025-11-06
508972,22400,MAGNETS PACK OF 4 HOME SWEET HOME,12,1.25,15727.0,United Kingdom,2025-11-06
508972,21972,SET OF 36 DINOSAUR PAPER DOILIES,4,1.45,15727.0,United Kingdom,2025-11-06
508972,84987,SET OF 36 TEATIME PAPER DOILIES,3,1.45,15727.0,United Kingdom,2025-11-06
508972,21973,SET OF 36 MUSHROOM PAPER DOILIES,2,1.45,15727.0,United Kingdom,2025-11-06
508972,22644,CERAMIC CHERRY CAKE MONEY BANK,4,1.45,15727.0,United Kingdom,2025-11-06
508972,84988,SET OF 72 PINK HEART PAPER DOILIES,2,1.45,15727.0,United Kingdom,2025-11-06
508972,21210,SET OF 72 RETRO SPOT PAPER  DOILIES,6,1.45,15727.0,United Kingdom,2025-11-06
508979,22301,COFFEE MUG CAT + BIRD DESIGN,2,5.06,,United Kingdom,2025-11-06
508979,22114,HOT WATER BOTTLE TEA AND SYMPATHY,1,8.47,,United Kingdom,2025-11-06
508979,22178,VICTORIAN GLASS HANGING T-LIGHT,10,2.51,,United Kingdom,2025-11-06
508979,22196,SMALL HEART MEASURING SPOONS,1,1.66,,United Kingdom,2025-11-06
508979,22198,LARGE POPCORN HOLDER ,1,3.36,,United Kingdom,2025-11-06
508979,22284,HEN HOUSE DECORATION,1,3.36,,United Kingdom,2025-11-06
508979,22219,LOVEBIRD HANGING DECORATION WHITE ,1,1.66,,United Kingdom,2025-11-06
508979,22300,COFFEE MUG DOG + BALL DESIGN,2,5.06,,United Kingdom,2025-11-06
508979,22111,SCOTTIE DOG HOT WATER BOTTLE,1,11.02,,United Kingdom,2025-11-06
508979,22218,CAKE STAND LACE WHITE,1,8.47,,United Kingdom,2025-11-06
508979,22109,FULL ENGLISH BREAKFAST PLATE,3,7.62,,United Kingdom,2025-11-06
508979,21916,SET 12 RETRO WHITE CHALK STICKS,1,0.81,,United Kingdom,2025-11-06
508979,22064,PINK DOUGHNUT TRINKET POT ,1,3.36,,United Kingdom,2025-11-06
508979,22030,SWALLOWS GREETING CARD,2,0.85,,United Kingdom,2025-11-06
508979,22026,BANQUET BIRTHDAY  CARD  ,1,0.85,,United Kingdom,2025-11-06
508979,21985,PACK OF 12 HEARTS DESIGN TISSUES ,1,0.81,,United Kingdom,2025-11-06
508979,21982,PACK OF 12 SUKI TISSUES ,1,0.81,,United Kingdom,2025-11-06
508979,21974,SET OF 36 PAISLEY FLOWER DOILIES,1,2.98,,United Kingdom,2025-11-06
508979,21973,SET OF 36 MUSHROOM PAPER DOILIES,1,2.98,,United Kingdom,2025-11-06
508979,21955,DOOR MAT UNION JACK GUNS AND ROSES,1,13.57,,United Kingdom,2025-11-06
508979,21908,CHOCOLATE THIS WAY METAL SIGN,1,4.21,,United Kingdom,2025-11-06
508979,21907,I'M ON HOLIDAY METAL SIGN,1,4.21,,United Kingdom,2025-11-06
508979,22322,BIRD DECORATION GREEN  SPOT,1,1.66,,United Kingdom,2025-11-06
508979,22090,PAPER BUNTING RETRO SPOTS,2,5.91,,United Kingdom,2025-11-06
508979,22353,LUNCH BOX WITH CUTLERY FAIRY CAKES ,1,5.06,,United Kingdom,2025-11-06
508979,84988,SET OF 72 PINK HEART PAPER DOILIES,1,2.98,,United Kingdom,2025-11-06
508979,22357,KINGS CHOICE BISCUIT TIN,1,4.25,,United Kingdom,2025-11-06
508979,21906,PHARMACIE FIRST AID TIN,1,13.57,,United Kingdom,2025-11-06
508979,85099C,JUMBO  BAG BAROQUE BLACK WHITE,3,4.21,,United Kingdom,2025-11-06
508979,85064,CREAM SWEETHEART LETTER RACK,1,11.02,,United Kingdom,2025-11-06
508979,85048,15CM CHRISTMAS GLASS BALL 20 LIGHTS,1,16.98,,United Kingdom,2025-11-06
508979,85040A,S/4 PINK FLOWER CANDLES IN BOWL,5,3.36,,United Kingdom,2025-11-06
508979,84913B,MINT GREEN ROSE TOWEL,3,3.36,,United Kingdom,2025-11-06
508979,84913A,SOFT PINK ROSE TOWEL ,1,3.36,,United Kingdom,2025-11-06
508979,84912A,PINK ROSE WASHBAG,1,3.36,,United Kingdom,2025-11-06
508979,84872A,TEATIME FUNKY FLOWER BACKPACK FOR 2,1,11.02,,United Kingdom,2025-11-06
508979,84836,ZINC METAL HEART DECORATION,1,2.51,,United Kingdom,2025-11-06
508979,84755,COLOUR GLASS T-LIGHT HOLDER HANGING,5,5.06,,United Kingdom,2025-11-06
508979,84692,BOX OF 24 COCKTAIL PARASOLS,1,0.81,,United Kingdom,2025-11-06
508979,84520B,PACK 20 ENGLISH ROSE PAPER NAPKINS,5,1.66,,United Kingdom,2025-11-06
508979,21445,12 PINK ROSE PEG PLACE SETTINGS,2,2.51,,United Kingdom,2025-11-06
508979,84509G,SET OF 4 FAIRY CAKE PLACEMATS ,1,7.62,,United Kingdom,2025-11-06
508979,84375,SET OF 20 KIDS COOKIE CUTTERS,1,4.21,,United Kingdom,2025-11-06
508979,84270,ASSTD DESIGN BUBBLE GUM RING,2,0.43,,United Kingdom,2025-11-06
508979,82605,OLD DOC RUSSEL METAL SIGN,1,4.21,,United Kingdom,2025-11-06
508979,82597,BOMBS AWAY METAL SIGN,1,4.21,,United Kingdom,2025-11-06
508979,82580,BATHROOM METAL SIGN,1,1.28,,United Kingdom,2025-11-06
508979,79164,BLACK WINE GLASS,2,21.23,,United Kingdom,2025-11-06
508979,22360,GLASS JAR ENGLISH CONFECTIONERY,1,5.91,,United Kingdom,2025-11-06
508979,22358,KINGS CHOICE TEA CADDY ,1,5.91,,United Kingdom,2025-11-06
508979,22354,RETROSPOT PADDED SEAT CUSHION,1,7.62,,United Kingdom,2025-11-06
508979,21790,VINTAGE SNAP CARDS,3,1.66,,United Kingdom,2025-11-06
508979,35241,ENAMEL BLUE RIM BISCUIT BIN,1,4.94,,United Kingdom,2025-11-06
508979,21716,BOYS VINTAGE TIN SEASIDE BUCKET,1,5.06,,United Kingdom,2025-11-06
508979,85170D,SET/6 PINK BIRD T-LIGHT CANDLES,1,4.21,,United Kingdom,2025-11-06
508979,85150,LADIES & GENTLEMEN METAL SIGN,3,5.06,,United Kingdom,2025-11-06
508979,79030G,"TUMBLER, NEW ENGLAND",1,12.72,,United Kingdom,2025-11-06
508979,72807A,SET/3 ROSE CANDLE IN JEWELLED BOX,1,8.47,,United Kingdom,2025-11-06
508979,72351B,SET/6 PINK  BUTTERFLY T-LIGHTS,1,4.21,,United Kingdom,2025-11-06
508979,48173C,DOOR MAT BLACK FLOCK ,2,13.57,,United Kingdom,2025-11-06
508979,47566,PARTY BUNTING,14,8.47,,United Kingdom,2025-11-06
508979,46776F,WOVEN ROSE GARDEN CUSHION COVER ,1,4.21,,United Kingdom,2025-11-06
508979,40018F,CHERRY DESIGN PAPERLANTERNS,1,4.21,,United Kingdom,2025-11-06
508979,35001W,HAND OPEN SHAPE DECO.WHITE,1,4.21,,United Kingdom,2025-11-06
508979,85214,TUB 24 PINK FLOWER PEGS,3,3.36,,United Kingdom,2025-11-06
508979,22625,RED KITCHEN SCALES,1,16.98,,United Kingdom,2025-11-06
508979,22544,MINI JIGSAW SPACEBOY,2,0.85,,United Kingdom,2025-11-06
508979,22540,MINI JIGSAW CIRCUS PARADE ,2,0.85,,United Kingdom,2025-11-06
508979,22537,MAGIC DRAWING SLATE DINOSAUR,2,0.85,,United Kingdom,2025-11-06
508979,22534,MAGIC DRAWING SLATE SPACEBOY ,2,0.85,,United Kingdom,2025-11-06
508979,22531,MAGIC DRAWING SLATE CIRCUS PARADE  ,2,0.85,,United Kingdom,2025-11-06
508979,22488,NATURAL SLATE RECTANGLE CHALKBOARD,1,3.36,,United Kingdom,2025-11-06
508979,22478,BIRDHOUSE GARDEN MARKER ,1,2.51,,United Kingdom,2025-11-06
508979,21731,RED TOADSTOOL LED NIGHT LIGHT,1,3.36,,United Kingdom,2025-11-06
508979,22427,ENAMEL FLOWER JUG CREAM,2,11.87,,United Kingdom,2025-11-06
508979,22372,AIRLINE BAG VINTAGE WORLD CHAMPION ,1,12.72,,United Kingdom,2025-11-06
508979,22605,WOODEN CROQUET GARDEN SET,1,25.49,,United Kingdom,2025-11-06
508979,90010B,BLACK/WHITE GLASS/SILVER BRACELET,1,9.77,,United Kingdom,2025-11-06
508979,22477,WATERING CAN GARDEN MARKER,1,2.51,,United Kingdom,2025-11-06
508979,90200E,GREEN SWEETHEART BRACELET,1,4.24,,United Kingdom,2025-11-06
508979,90018A,SILVER M.O.P ORBIT DROP EARRINGS,1,4.24,,United Kingdom,2025-11-06
508979,21715,GIRLS VINTAGE TIN SEASIDE BUCKET,1,5.06,,United Kingdom,2025-11-06
508979,21535,RED RETROSPOT SMALL MILK JUG,1,5.06,,United Kingdom,2025-11-06
508979,21356,TOAST ITS - FAIRY FLOWER,1,2.51,,United Kingdom,2025-11-06
508979,21260,FIRST AID TIN,1,6.77,,United Kingdom,2025-11-06
508979,21257,VICTORIAN SEWING BOX MEDIUM,1,16.13,,United Kingdom,2025-11-06
508979,21733,RED HANGING HEART T-LIGHT HOLDER,29,2.3,,United Kingdom,2025-11-06
508979,21231,SWEETHEART CERAMIC TRINKET BOX,2,2.51,,United Kingdom,2025-11-06
508979,21218,RED SPOTTY BISCUIT TIN,1,3.74,,United Kingdom,2025-11-06
508979,21215,IVORY PAPER CUP CAKE CASES ,4,1.28,,United Kingdom,2025-11-06
508979,21199,PINK  HEART CONFETTI IN TUBE,1,3.36,,United Kingdom,2025-11-06
508979,21232,STRAWBERRY CERAMIC TRINKET BOX,1,2.51,,United Kingdom,2025-11-06
508979,21108,FAIRY CAKE FLANNEL ASSORTED COLOUR,1,5.06,,United Kingdom,2025-11-06
508979,21116,OWL DOORSTOP,1,8.47,,United Kingdom,2025-11-06
508979,DOT,DOTCOM POSTAGE,1,150.08,,United Kingdom,2025-11-06
508979,15060B,FAIRY CAKE DESIGN UMBRELLA,2,8.47,,United Kingdom,2025-11-06
508979,17129F,DEEP BLUE GLASS GEMS IN BAG,1,1.66,,United Kingdom,2025-11-06
508979,20719,WOODLAND CHARLOTTE BAG,1,1.66,,United Kingdom,2025-11-06
508979,20713,JUMBO BAG OWLS,2,4.21,,United Kingdom,2025-11-06
508979,20750,RED/WHITE DOT MINI CASES,1,16.98,,United Kingdom,2025-11-06
508979,20801,LARGE PINK GLASS SUNDAE DISH,1,5.06,,United Kingdom,2025-11-06
508979,20936,FORKED CACTUS CANDLE,1,5.91,,United Kingdom,2025-11-06
508979,20973,12 PENCIL SMALL TUBE WOODLAND,24,1.28,,United Kingdom,2025-11-06
508979,20725,LUNCH BAG RED SPOTTY,1,4.21,,United Kingdom,2025-11-06
508986,20914,SET/5 RED SPOTTY LID GLASS BOWLS,6,2.95,14235.0,United Kingdom,2025-11-06
508986,21648,ASSORTED TUTTI FRUTTI SMALL PURSE,24,1.25,14235.0,United Kingdom,2025-11-06
508986,21115,ROSE CARAVAN DOORSTOP,2,6.75,14235.0,United Kingdom,2025-11-06
508986,22412,METAL SIGN NEIGHBOURHOOD WITCH ,12,2.1,14235.0,United Kingdom,2025-11-06
508986,21643,ASSORTED TUTTI FRUTTI MIRROR,24,1.25,14235.0,United Kingdom,2025-11-06
508986,21390,FILIGRIS HEART WITH BUTTERFLY,24,1.25,14235.0,United Kingdom,2025-11-06
508986,22528,GARDENERS KNEELING PAD,24,1.25,14235.0,United Kingdom,2025-11-06
508986,22342,HOME GARLAND PAINTED ZINC ,12,1.65,14235.0,United Kingdom,2025-11-06
508986,22341,LOVE GARLAND PAINTED ZINC ,12,1.65,14235.0,United Kingdom,2025-11-06
508986,22424,ENAMEL BREAD BIN CREAM,1,12.75,14235.0,United Kingdom,2025-11-06
508986,21429,RED GINGHAM ROSE JEWELLERY BOX,8,1.65,14235.0,United Kingdom,2025-11-06
508986,22469,HEART OF WICKER SMALL,12,1.65,14235.0,United Kingdom,2025-11-06
508986,21431,GREEN GINGHAM FLOWER JEWELLERY BOX,8,1.65,14235.0,United Kingdom,2025-11-06
508986,85099F,JUMBO BAG STRAWBERRY,30,1.95,14235.0,United Kingdom,2025-11-06
508986,85099B,RED RETROSPOT JUMBO BAG ,30,1.95,14235.0,United Kingdom,2025-11-06
508986,20828,GLITTER BUTTERFLY CLIPS,18,2.55,14235.0,United Kingdom,2025-11-06
508986,20727,LUNCH BAG  BLACK SKULL.,30,1.65,14235.0,United Kingdom,2025-11-06
508986,84670,JAPANESE CROCHETED ANIMAL,48,0.42,14235.0,United Kingdom,2025-11-06
508986,22139,RETRO SPOT TEA SET CERAMIC 11 PC ,3,4.95,14235.0,United Kingdom,2025-11-06
508986,21889,WOODEN BOX OF DOMINOES,12,1.25,14235.0,United Kingdom,2025-11-06
508986,20728,LUNCH BAG CARS BLUE,20,1.65,14235.0,United Kingdom,2025-11-06
508986,22420,LIPSTICK PEN BABY PINK,12,0.42,14235.0,United Kingdom,2025-11-06
508986,22419,LIPSTICK PEN RED,12,0.42,14235.0,United Kingdom,2025-11-06
508986,85099C,JUMBO  BAG BAROQUE BLACK WHITE,30,1.95,14235.0,United Kingdom,2025-11-06
508986,20725,LUNCH BAG RED SPOTTY,30,1.65,14235.0,United Kingdom,2025-11-06
508986,22421,LIPSTICK PEN FUSCHIA,12,0.42,14235.0,United Kingdom,2025-11-06
508992,90183A,AMBER DROP EARRINGS W LONG BEADS,1,2.95,,United Kingdom,2025-11-06
508993,21558,SKULL LUNCH BOX WITH CUTLERY ,6,2.55,14283.0,United Kingdom,2025-11-06
508993,22138,BAKING SET 9 PIECE RETROSPOT ,3,4.95,14283.0,United Kingdom,2025-11-06
508993,84685,BEACH HUT KEY CABINET,16,1.25,14283.0,United Kingdom,2025-11-06
508993,21128,GOLD FISHING GNOME,8,1.95,14283.0,United Kingdom,2025-11-06
508993,21129,SILVER FISHING GNOME ,8,1.95,14283.0,United Kingdom,2025-11-06
508993,22554,PLASTERS IN TIN WOODLAND ANIMALS,12,1.65,14283.0,United Kingdom,2025-11-06
508993,21975,PACK OF 60 DINOSAUR CAKE CASES,24,0.55,14283.0,United Kingdom,2025-11-06
508993,22417,PACK OF 60 SPACEBOY CAKE CASES,24,0.55,14283.0,United Kingdom,2025-11-06
508993,47566,PARTY BUNTING,5,4.65,14283.0,United Kingdom,2025-11-06
508993,22617,BAKING SET SPACEBOY DESIGN,3,4.95,14283.0,United Kingdom,2025-11-06
508993,22551,PLASTERS IN TIN SPACEBOY,12,1.65,14283.0,United Kingdom,2025-11-06
508993,22416,36 DOILIES SPACEBOY DESIGN ,12,1.45,14283.0,United Kingdom,2025-11-06
508993,21212,PACK OF 72 RETRO SPOT CAKE CASES,24,0.55,14283.0,United Kingdom,2025-11-06
508993,21621,VINTAGE UNION JACK BUNTING,2,8.5,14283.0,United Kingdom,2025-11-06
508994,20914,SET/5 RED SPOTTY LID GLASS BOWLS,6,2.95,17490.0,United Kingdom,2025-11-06
508994,20718,RED SPOTTY SHOPPER BAG,10,1.25,17490.0,United Kingdom,2025-11-06
508994,22558,CLOTHES PEGS RETROSPOT PACK 24 ,12,1.25,17490.0,United Kingdom,2025-11-06
508994,22035,VINTAGE CARAVAN GREETING CARD ,12,0.42,17490.0,United Kingdom,2025-11-06
508994,21112,"SWISS ROLL TOWEL, PINK  SPOTS",6,2.95,17490.0,United Kingdom,2025-11-06
508994,21107,CREAM SLICE FLANNEL PINK SPOT ,6,2.95,17490.0,United Kingdom,2025-11-06
508994,22052,VINTAGE CARAVAN GIFT WRAP,25,0.42,17490.0,United Kingdom,2025-11-06
508994,21210,SET OF 72 RETRO SPOT PAPER  DOILIES,12,1.45,17490.0,United Kingdom,2025-11-06
508994,21108,FAIRY CAKE FLANNEL ASSORTED COLOUR,9,2.55,17490.0,United Kingdom,2025-11-06
508994,21472,LADYBIRD + BEE RAFFIA FOOD COVER,6,3.75,17490.0,United Kingdom,2025-11-06
508994,20725,LUNCH BAG RED SPOTTY,10,1.65,17490.0,United Kingdom,2025-11-06
508994,22353,LUNCH BOX WITH CUTLERY FAIRY CAKES ,6,2.55,17490.0,United Kingdom,2025-11-06
508994,20754,RETRO RED SPOTTY WASHING UP GLOVES,6,2.1,17490.0,United Kingdom,2025-11-06
508994,21832,CHOCOLATE CALCULATOR,12,1.65,17490.0,United Kingdom,2025-11-06
508994,22299,PIG KEYRING WITH LIGHT & SOUND ,24,1.25,17490.0,United Kingdom,2025-11-06
508994,22382,LUNCH BAG SPACEBOY DESIGN ,10,1.65,17490.0,United Kingdom,2025-11-06
508994,16156S,WRAP PINK FAIRY CAKES ,25,0.42,17490.0,United Kingdom,2025-11-06
508994,35004C,SET OF 3 COLOURED  FLYING DUCKS,3,5.45,17490.0,United Kingdom,2025-11-06
508994,22624,IVORY KITCHEN SCALES,2,8.5,17490.0,United Kingdom,2025-11-06
508994,22329,ROUND CONTAINER SET OF 5 RETROSPOT,12,1.65,17490.0,United Kingdom,2025-11-06
508994,21206,STRAWBERRY HONEYCOMB  GARLAND ,12,1.65,17490.0,United Kingdom,2025-11-06
508995,22068,BLACK PIRATE TREASURE CHEST,12,1.65,15544.0,United Kingdom,2025-11-06
508995,21498,RED SPOTS  WRAP ,25,0.42,15544.0,United Kingdom,2025-11-06
508995,84997A,GREEN 3 PIECE MINI DOTS CUTLERY SET,12,3.75,15544.0,United Kingdom,2025-11-06
508995,21749,LARGE RED RETROSPOT WINDMILL,12,2.1,15544.0,United Kingdom,2025-11-06
508995,21746,SMALL RED RETROSPOT WINDMILL,24,1.25,15544.0,United Kingdom,2025-11-06
508995,21500,PINK SPOTS  WRAP ,25,0.42,15544.0,United Kingdom,2025-11-06
508995,20725,LUNCH BAG RED SPOTTY,10,1.65,15544.0,United Kingdom,2025-11-06
508995,20727,LUNCH BAG  BLACK SKULL.,20,1.65,15544.0,United Kingdom,2025-11-06
508995,21750,LARGE SKULL WINDMILL,12,2.1,15544.0,United Kingdom,2025-11-06
508995,21747,SMALL SKULL WINDMILL,24,1.25,15544.0,United Kingdom,2025-11-06
508995,22316,200 BENDY SKULL STRAWS,12,1.25,15544.0,United Kingdom,2025-11-06
508995,22332,SKULLS PARTY BAG + STICKER SET,8,1.65,15544.0,United Kingdom,2025-11-06
508995,21718,RED METAL BEACH SPADE ,24,1.25,15544.0,United Kingdom,2025-11-06
508995,21716,BOYS VINTAGE TIN SEASIDE BUCKET,16,2.55,15544.0,United Kingdom,2025-11-06
508995,21715,GIRLS VINTAGE TIN SEASIDE BUCKET,16,2.55,15544.0,United Kingdom,2025-11-06
508995,21504,SKULLS GREETING CARD,24,0.42,15544.0,United Kingdom,2025-11-06
508996,21363,HOME SMALL WOOD LETTERS,6,4.95,13982.0,United Kingdom,2025-11-06
508996,85123A,WHITE HANGING HEART T-LIGHT HOLDER,32,2.55,13982.0,United Kingdom,2025-11-06
508996,20724,RED SPOTTY CHARLOTTE BAG,20,0.85,13982.0,United Kingdom,2025-11-06
508996,22561,WOODEN SCHOOL COLOURING SET,12,1.65,13982.0,United Kingdom,2025-11-06
508996,22478,BIRDHOUSE GARDEN MARKER ,10,1.25,13982.0,United Kingdom,2025-11-06
508996,22458,CAST IRON HOOK GARDEN FORK,8,2.55,13982.0,United Kingdom,2025-11-06
508996,22405,MONEY BOX POCKET MONEY DESIGN,12,1.25,13982.0,United Kingdom,2025-11-06
508996,22410,MONEY BOX HOUSEKEEPING DESIGN,12,1.25,13982.0,United Kingdom,2025-11-06
508996,22318,FIVE HEART HANGING DECORATION,6,2.95,13982.0,United Kingdom,2025-11-06
508996,21533,RETRO SPOT LARGE MILK JUG,3,4.95,13982.0,United Kingdom,2025-11-06
508996,21765,HANGING METAL BIRD BATH,6,7.95,13982.0,United Kingdom,2025-11-06
508996,22459,CAST IRON HOOK GARDEN TROWEL,8,2.55,13982.0,United Kingdom,2025-11-06
508997,22348,TEA BAG PLATE RED SPOTTY ,2,0.85,16059.0,United Kingdom,2025-11-06
508997,22070,SMALL RED RETROSPOT MUG IN BOX ,1,3.75,16059.0,United Kingdom,2025-11-06
508997,20983,12 PENCILS TALL TUBE RED SPOTTY,2,0.85,16059.0,United Kingdom,2025-11-06
508997,84836,ZINC METAL HEART DECORATION,1,1.25,16059.0,United Kingdom,2025-11-06
508997,22077,6 RIBBONS RUSTIC CHARM,2,1.65,16059.0,United Kingdom,2025-11-06
508997,85049G,CHOCOLATE BOX RIBBONS ,1,1.25,16059.0,United Kingdom,2025-11-06
508997,85049B,LUSH GREENS RIBBONS,1,1.25,16059.0,United Kingdom,2025-11-06
508997,22558,CLOTHES PEGS RETROSPOT PACK 24 ,2,1.25,16059.0,United Kingdom,2025-11-06
508997,85049F,BABY BOOM RIBBONS ,1,1.25,16059.0,United Kingdom,2025-11-06
508997,22090,PAPER BUNTING RETRO SPOTS,3,2.95,16059.0,United Kingdom,2025-11-06
508997,22070,SMALL RED RETROSPOT MUG IN BOX ,1,3.75,16059.0,United Kingdom,2025-11-06
508997,85049A,TRADITIONAL CHRISTMAS RIBBONS,1,1.25,16059.0,United Kingdom,2025-11-06
508997,72796B,S/3 FRENCH VANILLA SQU CANDLE,2,1.65,16059.0,United Kingdom,2025-11-06
508997,35965,FOLKART HEART NAPKIN RINGS,1,2.95,16059.0,United Kingdom,2025-11-06
508997,85123A,WHITE HANGING HEART T-LIGHT HOLDER,1,2.95,16059.0,United Kingdom,2025-11-06
508997,37508,NEW ENGLAND CERAMIC CAKE SERVER,1,2.55,16059.0,United Kingdom,2025-11-06
508997,71459,HANGING JAM JAR T-LIGHT HOLDER,12,0.85,16059.0,United Kingdom,2025-11-06
508997,47581B,FAIRY CAKE WICKER PICNIC BASKET ,1,12.75,16059.0,United Kingdom,2025-11-06
508997,84773,RED ROSE AND LACE C/COVER,2,2.95,16059.0,United Kingdom,2025-11-06
508997,47566B,TEA TIME PARTY BUNTING,1,4.65,16059.0,United Kingdom,2025-11-06
508997,84970S,HANGING HEART ZINC T-LIGHT HOLDER,3,0.85,16059.0,United Kingdom,2025-11-06
508997,22083,PAPER CHAIN KIT RETRO SPOT,1,2.95,16059.0,United Kingdom,2025-11-06
508997,22084,PAPER CHAIN KIT EMPIRE,1,2.95,16059.0,United Kingdom,2025-11-06
508997,20669,RED HEART LUGGAGE TAG,2,1.25,16059.0,United Kingdom,2025-11-06
508997,21866,UNION JACK FLAG LUGGAGE TAG,2,1.25,16059.0,United Kingdom,2025-11-06
508997,84832,ZINC WILLIE WINKIE  CANDLE STICK,2,0.85,16059.0,United Kingdom,2025-11-06
508997,20975,12 PENCILS SMALL TUBE RED SPOTTY,2,0.65,16059.0,United Kingdom,2025-11-06
508997,37508,NEW ENGLAND CERAMIC CAKE SERVER,1,2.55,16059.0,United Kingdom,2025-11-06
508997,21212,PACK OF 72 RETRO SPOT CAKE CASES,6,0.55,16059.0,United Kingdom,2025-11-06
508997,22428,ENAMEL FIRE BUCKET CREAM,1,6.95,16059.0,United Kingdom,2025-11-06
508997,20914,SET/5 RED SPOTTY LID GLASS BOWLS,2,2.95,16059.0,United Kingdom,2025-11-06
508997,84992,72 SWEETHEART FAIRY CAKE CASES,4,0.55,16059.0,United Kingdom,2025-11-06
508997,85231B,CINAMMON SET OF 9 T-LIGHTS,2,0.85,16059.0,United Kingdom,2025-11-06
508997,22605,WOODEN CROQUET GARDEN SET,1,12.75,16059.0,United Kingdom,2025-11-06
508997,85231G,ORANGE SCENTED SET/9 T-LIGHTS,2,0.85,16059.0,United Kingdom,2025-11-06
508997,22488,NATURAL SLATE RECTANGLE CHALKBOARD,4,1.65,16059.0,United Kingdom,2025-11-06
508997,22508,DOORSTOP RETROSPOT HEART,2,3.75,16059.0,United Kingdom,2025-11-06
508997,22080,RIBBON REEL SPOTS DESIGN ,1,1.65,16059.0,United Kingdom,2025-11-06
508997,22441,GROW YOUR OWN BASIL IN ENAMEL MUG,2,2.1,16059.0,United Kingdom,2025-11-06
508997,22443,GROW YOUR OWN HERBS SET OF 3,1,7.95,16059.0,United Kingdom,2025-11-06
508997,20658,RED SPOTTY LUGGAGE TAG,2,1.25,16059.0,United Kingdom,2025-11-06
508997,21114,LAVENDER SCENTED FABRIC HEART,5,1.25,16059.0,United Kingdom,2025-11-06
508997,84836,ZINC METAL HEART DECORATION,2,1.25,16059.0,United Kingdom,2025-11-06
508997,21080,SET/20 RED SPOTTY PAPER NAPKINS ,2,0.85,16059.0,United Kingdom,2025-11-06
508997,22561,WOODEN SCHOOL COLOURING SET,3,1.65,16059.0,United Kingdom,2025-11-06
508997,22077,6 RIBBONS RUSTIC CHARM,1,1.65,16059.0,United Kingdom,2025-11-06
508997,22080,RIBBON REEL SPOTS DESIGN ,1,1.65,16059.0,United Kingdom,2025-11-06
508997,22428,ENAMEL FIRE BUCKET CREAM,1,6.95,16059.0,United Kingdom,2025-11-06
508997,22567,20 DOLLY PEGS RETROSPOT,2,1.25,16059.0,United Kingdom,2025-11-06
508997,20990,SPRING FLOWER CHOPSTICKS SET/5,1,1.95,16059.0,United Kingdom,2025-11-06
508997,85123A,WHITE HANGING HEART T-LIGHT HOLDER,1,2.95,16059.0,United Kingdom,2025-11-06
508997,21737,SET 3 WICKER LOG BASKETS,1,19.95,16059.0,United Kingdom,2025-11-06
508997,85231E,STRAWBERRY SCENTED SET/9 T-LIGHTS,2,0.85,16059.0,United Kingdom,2025-11-06
508997,84836,ZINC METAL HEART DECORATION,1,1.25,16059.0,United Kingdom,2025-11-06
508998,21726,MULTI HEARTS  STICKERS,2,0.85,14598.0,United Kingdom,2025-11-06
508998,22149,FELTCRAFT 6 FLOWER FRIENDS,4,2.1,14598.0,United Kingdom,2025-11-06
508998,22649,STRAWBERRY FAIRY CAKE TEAPOT,1,4.95,14598.0,United Kingdom,2025-11-06
508998,22560,TRADITIONAL MODELLING CLAY,6,1.25,14598.0,United Kingdom,2025-11-06
508998,84016,FLAG OF ST GEORGE CAR FLAG,12,0.42,14598.0,United Kingdom,2025-11-06
508998,16011,ANIMAL STICKERS,24,0.21,14598.0,United Kingdom,2025-11-06
508998,22332,SKULLS PARTY BAG + STICKER SET,2,1.65,14598.0,United Kingdom,2025-11-06
508998,21725,SWEETIES  STICKERS,2,0.85,14598.0,United Kingdom,2025-11-06
508998,21544,SKULLS  WATER TRANSFER TATTOOS ,2,0.85,14598.0,United Kingdom,2025-11-06
508998,21721,CANDY SHOP  STICKER SHEET,2,0.85,14598.0,United Kingdom,2025-11-06
508998,21722,SWEET PUDDING STICKER SHEET,2,0.85,14598.0,United Kingdom,2025-11-06
508998,20724,RED SPOTTY CHARLOTTE BAG,9,0.85,14598.0,United Kingdom,2025-11-06
508998,21542,WOODLAND WATER TRANSFER TATTOOS ,2,0.85,14598.0,United Kingdom,2025-11-06
508998,21937,STRAWBERRY   PICNIC BAG,3,2.95,14598.0,United Kingdom,2025-11-06
508998,21936,RED RETROSPOT PICNIC BAG,3,2.95,14598.0,United Kingdom,2025-11-06
508998,85099B,JUMBO BAG RED RETROSPOT,3,1.95,14598.0,United Kingdom,2025-11-06
508998,22528,GARDENERS KNEELING PAD,4,1.25,14598.0,United Kingdom,2025-11-06
508998,21724,PANDA AND BUNNIES STICKER SHEET,2,0.85,14598.0,United Kingdom,2025-11-06
508998,84755,COLOUR GLASS T-LIGHT HOLDER HANGING,16,0.65,14598.0,United Kingdom,2025-11-06
508998,21541,DINOSAURS WATER TRANSFER TATTOOS ,2,0.85,14598.0,United Kingdom,2025-11-06
508998,21790,VINTAGE SNAP CARDS,3,0.85,14598.0,United Kingdom,2025-11-06
508998,21918,SET 12 KIDS COLOUR  CHALK STICKS,3,0.42,14598.0,United Kingdom,2025-11-06
508998,22356,CHARLOTTE BAG PINK WITH WHITE SPOTS,4,0.85,14598.0,United Kingdom,2025-11-06
508998,22383,LUNCH BAG SUKI  DESIGN ,1,1.65,14598.0,United Kingdom,2025-11-06
508998,20728,LUNCH BAG CARS BLUE,1,1.65,14598.0,United Kingdom,2025-11-06
508998,20727,LUNCH BAG  BLACK SKULL.,1,1.65,14598.0,United Kingdom,2025-11-06
508998,79029,GLASS HONEYPOT WASP CATCHER,3,1.95,14598.0,United Kingdom,2025-11-06
508998,22489,PACK OF 12 TRADITIONAL CRAYONS,6,0.42,14598.0,United Kingdom,2025-11-06
508998,22231,JIGSAW TREE WITH BIRDHOUSE,1,1.45,14598.0,United Kingdom,2025-11-06
508998,22619,SET OF 6 SOLDIER SKITTLES,2,3.75,14598.0,United Kingdom,2025-11-06
508998,20723,STRAWBERRY CHARLOTTE BAG,6,0.85,14598.0,United Kingdom,2025-11-06
508998,21891,TRADITIONAL WOODEN SKIPPING ROPE,3,1.25,14598.0,United Kingdom,2025-11-06
508998,22559,SEASIDE FLYING DISC,4,1.25,14598.0,United Kingdom,2025-11-06
508998,22436,12 COLOURED PARTY BALLOONS,6,0.65,14598.0,United Kingdom,2025-11-06
508998,22437,SET OF 9 BLACK SKULL BALLOONS,6,0.85,14598.0,United Kingdom,2025-11-06
508998,85211,S/4 GROOVY CAT MAGNETS,2,1.65,14598.0,United Kingdom,2025-11-06
508998,22209,WOOD STAMP SET HAPPY BIRTHDAY,4,1.65,14598.0,United Kingdom,2025-11-06
508998,22233,JIGSAW RABBIT AND BIRDHOUSE,1,1.65,14598.0,United Kingdom,2025-11-06
508998,21917,SET 12 KIDS  WHITE CHALK STICKS,3,0.42,14598.0,United Kingdom,2025-11-06
508998,22620,4 TRADITIONAL SPINNING TOPS,2,1.25,14598.0,United Kingdom,2025-11-06
508999,20727,LUNCH BAG  BLACK SKULL.,1,1.65,17897.0,United Kingdom,2025-11-06
508999,22570,FELTCRAFT CUSHION RABBIT,1,3.75,17897.0,United Kingdom,2025-11-06
508999,21707,"FOLDING UMBRELLA , BLACK/BLUE  SPOT",1,4.95,17897.0,United Kingdom,2025-11-06
508999,21928,JUMBO BAG SCANDINAVIAN PAISLEY,1,1.95,17897.0,United Kingdom,2025-11-06
508999,21070,VINTAGE BILLBOARD MUG ,6,1.25,17897.0,United Kingdom,2025-11-06
508999,20914,SET/5 RED SPOTTY LID GLASS BOWLS,1,2.95,17897.0,United Kingdom,2025-11-06
508999,35004B,SET OF 3 BLACK FLYING DUCKS,1,5.45,17897.0,United Kingdom,2025-11-06
508999,22583,PACK OF 6 HANDBAG GIFT BOXES,1,2.55,17897.0,United Kingdom,2025-11-06
508999,85114B,IVORY ENCHANTED FOREST PLACEMAT,2,1.65,17897.0,United Kingdom,2025-11-06
508999,22299,PIG KEYRING WITH LIGHT & SOUND ,2,1.25,17897.0,United Kingdom,2025-11-06
508999,10124G,ARMY CAMO BOOKCOVER TAPE,1,0.42,17897.0,United Kingdom,2025-11-06
508999,22333,RETRO SPORT PARTY BAG + STICKER SET,1,1.65,17897.0,United Kingdom,2025-11-06
508999,85169A,IVORY LOVE BIRD CANDLE,2,1.25,17897.0,United Kingdom,2025-11-06
508999,22070,SMALL RED RETROSPOT MUG IN BOX ,1,3.75,17897.0,United Kingdom,2025-11-06
508999,21936,RED RETROSPOT PICNIC BAG,1,2.95,17897.0,United Kingdom,2025-11-06
