Invoice,StockCode,Description,Quantity,Price,Customer ID,Country,InvoiceDate
511132,22564,ALPHABET STENCIL CRAFT,1,1.25,17987.0,United Kingdom,2025-11-21
511132,20966,SANDWICH BATH SPONGE,4,1.25,17987.0,United Kingdom,2025-11-21
511132,22439,6 ROCKET BALLOONS ,3,0.65,17987.0,United Kingdom,2025-11-21
511132,21915,RED  HARMONICA IN BOX ,3,1.25,17987.0,United Kingdom,2025-11-21
511132,47568,ENGLISH ROSE DESIGN PEG BAG,1,2.1,17987.0,United Kingdom,2025-11-21
511132,22324,BLUE POLKADOT KIDS BAG,1,1.95,17987.0,United Kingdom,2025-11-21
511132,22323,PINK POLKADOT KIDS BAG,1,1.95,17987.0,United Kingdom,2025-11-21
511132,21703,BAG 125g SWIRLY MARBLES,10,0.42,17987.0,United Kingdom,2025-11-21
511132,21915,RED  HARMONICA IN BOX ,3,1.25,17987.0,United Kingdom,2025-11-21
511132,90214E,"LETTER ""E"" BLING KEY RING",1,1.25,17987.0,United Kingdom,2025-11-21
511132,90098,NECKLACE+BRACELET PINK BUTTERFLY,3,2.55,17987.0,United Kingdom,2025-11-21
511132,84559B,3D SHEET OF CAT STICKERS,5,0.85,17987.0,United Kingdom,2025-11-21
511132,84559A,3D SHEET OF DOG STICKERS,5,0.85,17987.0,United Kingdom,2025-11-21
511132,21642,ASSORTED TUTTI FRUTTI PEN,24,0.85,17987.0,United Kingdom,2025-11-21
511132,21677,HEARTS  STICKERS,6,0.85,17987.0,United Kingdom,2025-11-21
511132,21676,FLOWERS  STICKERS,6,0.85,17987.0,United Kingdom,2025-11-21
511132,21679,SKULLS  STICKERS,6,0.85,17987.0,United Kingdom,2025-11-21
511132,84006,MAGIC TREE -PAPER FLOWERS,10,0.85,17987.0,United Kingdom,2025-11-21
511132,84559B,3D SHEET OF CAT STICKERS,2,0.85,17987.0,United Kingdom,2025-11-21
511132,16258A,SWIRLY CIRCULAR RUBBERS IN BAG,12,0.42,17987.0,United Kingdom,2025-11-21
511132,21679,SKULLS  STICKERS,6,0.85,17987.0,United Kingdom,2025-11-21
511132,84559A,3D SHEET OF DOG STICKERS,2,0.85,17987.0,United Kingdom,2025-11-21
511132,20832,RED FLOCK LOVE HEART PHOTO FRAME,4,0.85,17987.0,United Kingdom,2025-11-21
511132,21644,ASSORTED TUTTI FRUTTI HEART BOX,1,1.25,17987.0,United Kingdom,2025-11-21
511132,20966,SANDWICH BATH SPONGE,1,1.25,17987.0,United Kingdom,2025-11-21
511132,90214G,"LETTER ""G"" BLING KEY RING",1,1.25,17987.0,United Kingdom,2025-11-21
511132,90214M,"LETTER ""M"" BLING KEY RING",1,1.25,17987.0,United Kingdom,2025-11-21
511132,90214M,"LETTER ""M"" BLING KEY RING",1,1.25,17987.0,United Kingdom,2025-11-21
511132,90214T,"LETTER ""T"" BLING KEY RING",1,1.25,17987.0,United Kingdom,2025-11-21
511132,21703,BAG 125g SWIRLY MARBLES,2,0.42,17987.0,United Kingdom,2025-11-21
511132,21648,ASSORTED TUTTI FRUTTI SMALL PURSE,3,1.25,17987.0,United Kingdom,2025-11-21
511132,21644,ASSORTED TUTTI FRUTTI HEART BOX,1,1.25,17987.0,United Kingdom,2025-11-21
511132,22323,PINK POLKADOT KIDS BAG,1,1.95,17987.0,United Kingdom,2025-11-21
511132,15039,SANDALWOOD FAN,6,0.85,17987.0,United Kingdom,2025-11-21
511132,21915,RED  HARMONICA IN BOX ,3,1.25,17987.0,United Kingdom,2025-11-21
511132,21914,BLUE HARMONICA IN BOX ,2,1.25,17987.0,United Kingdom,2025-11-21
511132,16218,CARTOON  PENCIL SHARPENERS,10,0.16,17987.0,United Kingdom,2025-11-21
511132,21747,SMALL SKULL WINDMILL,2,1.25,17987.0,United Kingdom,2025-11-21
511132,84016,FLAG OF ST GEORGE CAR FLAG,12,0.42,17987.0,United Kingdom,2025-11-21
511132,22564,ALPHABET STENCIL CRAFT,1,1.25,17987.0,United Kingdom,2025-11-21
511132,22563,HAPPY STENCIL CRAFT,1,1.25,17987.0,United Kingdom,2025-11-21
511132,21703,BAG 125g SWIRLY MARBLES,5,0.42,17987.0,United Kingdom,2025-11-21
511132,20996,JAZZ HEARTS ADDRESS BOOK,4,0.42,17987.0,United Kingdom,2025-11-21
511132,20985,HEART CALCULATOR,1,1.25,17987.0,United Kingdom,2025-11-21
511132,16258A,SWIRLY CIRCULAR RUBBERS IN BAG,12,0.42,17987.0,United Kingdom,2025-11-21
511132,16225,RATTLE SNAKE EGGS,4,1.25,17987.0,United Kingdom,2025-11-21
511132,35015,JACOBS LADDER SMALL,12,0.06,17987.0,United Kingdom,2025-11-21
511132,22139,RETRO SPOT TEA SET CERAMIC 11 PC ,1,4.95,17987.0,United Kingdom,2025-11-21
511132,90214L,"LETTER ""L"" BLING KEY RING",1,1.25,17987.0,United Kingdom,2025-11-21
511132,17003,BROCADE RING PURSE ,36,0.21,17987.0,United Kingdom,2025-11-21
511133,21080,SET/20 RED SPOTTY PAPER NAPKINS ,4,0.85,17227.0,United Kingdom,2025-11-21
511133,21082,SET/20 FRUIT SALAD PAPER NAPKINS ,1,0.85,17227.0,United Kingdom,2025-11-21
511133,21086,SET/6 RED SPOTTY PAPER CUPS,5,0.65,17227.0,United Kingdom,2025-11-21
511133,21089,SET/6 GREEN SPRING PAPER CUPS,6,0.65,17227.0,United Kingdom,2025-11-21
511133,22328,ROUND SNACK BOXES SET OF 4 FRUITS ,2,2.95,17227.0,United Kingdom,2025-11-21
511133,22333,RETRO SPORT PARTY BAG + STICKER SET,3,1.65,17227.0,United Kingdom,2025-11-21
511133,21097,SET/6 GREEN SPRING  PAPER PLATE,6,0.85,17227.0,United Kingdom,2025-11-21
511133,84375,SET OF 20 KIDS COOKIE CUTTERS,49,1.95,17227.0,United Kingdom,2025-11-21
511133,85114B,IVORY ENCHANTED FOREST PLACEMAT,6,1.65,17227.0,United Kingdom,2025-11-21
511133,21078,SET/20 STRAWBERRY PAPER NAPKINS ,1,0.85,17227.0,United Kingdom,2025-11-21
511133,22585,PACK OF 6 BIRDY GIFT TAGS,2,1.25,17227.0,United Kingdom,2025-11-21
511133,21094,SET/6 RED SPOTTY PAPER PLATES,4,0.85,17227.0,United Kingdom,2025-11-21
511134,21544,SKULLS  WATER TRANSFER TATTOOS ,12,0.85,17897.0,United Kingdom,2025-11-21
511134,21542,WOODLAND WATER TRANSFER TATTOOS ,12,0.85,17897.0,United Kingdom,2025-11-21
511134,21541,DINOSAURS WATER TRANSFER TATTOOS ,12,0.85,17897.0,United Kingdom,2025-11-21
511134,21897,POTTING SHED CANDLE CITRONELLA,2,2.95,17897.0,United Kingdom,2025-11-21
511134,22444,GROW YOUR OWN PLANT IN A CAN ,24,1.25,17897.0,United Kingdom,2025-11-21
511134,72800E,4 IVORY DINNER CANDLES SILVER FLOCK,1,2.55,17897.0,United Kingdom,2025-11-21
511134,84673B,BLUE FLY SWAT,2,0.65,17897.0,United Kingdom,2025-11-21
511134,21796,SET OF 3 RED STRIPE BASKETS,1,12.75,17897.0,United Kingdom,2025-11-21
511134,84270,ASSTD DESIGN BUBBLE GUM RING,30,0.21,17897.0,United Kingdom,2025-11-21
511134,71459,HANGING JAM JAR T-LIGHT HOLDER,12,0.85,17897.0,United Kingdom,2025-11-21
511134,22624,IVORY KITCHEN SCALES,1,8.5,17897.0,United Kingdom,2025-11-21
511134,84968B,S/16 VINTAGE IVORY CUTLERY,1,12.75,17897.0,United Kingdom,2025-11-21
511134,85099B,JUMBO BAG RED RETROSPOT,1,1.95,17897.0,United Kingdom,2025-11-21
511134,21212,PACK OF 72 RETRO SPOT CAKE CASES,3,0.55,17897.0,United Kingdom,2025-11-21
511134,22082,RIBBON REEL STRIPES DESIGN ,5,1.65,17897.0,United Kingdom,2025-11-21
511134,79029,GLASS HONEYPOT WASP CATCHER,1,1.95,17897.0,United Kingdom,2025-11-21
511134,85018A,S/6 PAPER BOXES ROMANTIC IMAGES,1,4.25,17897.0,United Kingdom,2025-11-21
511134,21034,REX CASH+CARRY JUMBO SHOPPER,3,0.95,17897.0,United Kingdom,2025-11-21
511134,22041,"RECORD FRAME 7"" SINGLE SIZE ",1,2.55,17897.0,United Kingdom,2025-11-21
511134,22488,NATURAL SLATE RECTANGLE CHALKBOARD,1,1.65,17897.0,United Kingdom,2025-11-21
511134,21034,REX CASH+CARRY JUMBO SHOPPER,2,0.95,17897.0,United Kingdom,2025-11-21
511134,84625A,PINK NEW BAROQUECANDLESTICK CANDLE,1,2.95,17897.0,United Kingdom,2025-11-21
511134,84625D,WHITE NEWBAROQUE CANDLESTICK CANDLE,1,2.95,17897.0,United Kingdom,2025-11-21
511134,21745,GAOLERS KEYS DECORATIVE GARDEN ,1,3.75,17897.0,United Kingdom,2025-11-21
511134,84673A,PINK FLY SWAT,2,0.65,17897.0,United Kingdom,2025-11-21
511134,79029,GLASS HONEYPOT WASP CATCHER,1,1.95,17897.0,United Kingdom,2025-11-21
511134,84625C,BLUE NEW BAROQUE CANDLESTICK CANDLE,1,2.95,17897.0,United Kingdom,2025-11-21
511135,21843,RED RETROSPOT CAKE STAND,4,10.95,12853.0,United Kingdom,2025-11-21
511135,84991,60 TEATIME FAIRY CAKE CASES,24,0.55,12853.0,United Kingdom,2025-11-21
511135,84992,72 SWEETHEART FAIRY CAKE CASES,24,0.55,12853.0,United Kingdom,2025-11-21
511135,21977,PACK OF 60 PINK PAISLEY CAKE CASES,24,0.55,12853.0,United Kingdom,2025-11-21
511135,21974,SET OF 36 PAISLEY FLOWER DOILIES,12,1.45,12853.0,United Kingdom,2025-11-21
511135,84987,SET OF 36 TEATIME PAPER DOILIES,12,1.45,12853.0,United Kingdom,2025-11-21
511135,21214,SET OF 72 IVORY PAPER DOILIES,12,1.45,12853.0,United Kingdom,2025-11-21
511135,22139,RETRO SPOT TEA SET CERAMIC 11 PC ,6,4.95,12853.0,United Kingdom,2025-11-21
511135,22423,REGENCY CAKESTAND 3 TIER,6,12.75,12853.0,United Kingdom,2025-11-21
511135,21975,PACK OF 60 DINOSAUR CAKE CASES,24,0.55,12853.0,United Kingdom,2025-11-21
511135,22470,HEART OF WICKER LARGE,12,2.95,12853.0,United Kingdom,2025-11-21
511135,22637,PIGGY BANK RETROSPOT ,12,2.55,12853.0,United Kingdom,2025-11-21
511135,21390,FILIGRIS HEART WITH BUTTERFLY,24,1.25,12853.0,United Kingdom,2025-11-21
511135,84971S,SMALL HEART FLOWERS HOOK ,24,0.85,12853.0,United Kingdom,2025-11-21
511135,48138,DOOR MAT UNION FLAG,4,7.49,12853.0,United Kingdom,2025-11-21
511135,48194,DOOR MAT HEARTS,4,7.49,12853.0,United Kingdom,2025-11-21
511135,22469,HEART OF WICKER SMALL,12,1.65,12853.0,United Kingdom,2025-11-21
511135,21523,DOOR MAT FANCY FONT HOME SWEET HOME,4,7.49,12853.0,United Kingdom,2025-11-21
511135,20685,DOOR MAT RED SPOT,4,7.49,12853.0,United Kingdom,2025-11-21
511136,22502,PICNIC BASKET WICKER SMALL,1,4.25,17897.0,United Kingdom,2025-11-21
511136,22088,PAPER BUNTING COLOURED LACE,2,2.95,17897.0,United Kingdom,2025-11-21
511136,22082,RIBBON REEL STRIPES DESIGN ,5,1.65,17897.0,United Kingdom,2025-11-21
511136,84836,ZINC METAL HEART DECORATION,12,1.25,17897.0,United Kingdom,2025-11-21
511136,21283,NATURAL BARK CANDLE SMALL,24,2.75,17897.0,United Kingdom,2025-11-21
511136,22479,DAISY GARDEN MARKER,10,1.25,17897.0,United Kingdom,2025-11-21
511136,84279B,CHERRY BLOSSOM DECORATIVE FLASK,1,3.75,17897.0,United Kingdom,2025-11-21
511136,21657,MILK BOTTLE WITH GLASS STOPPER ,1,6.95,17897.0,United Kingdom,2025-11-21
511136,21398,RED  SPOTTY COFFEE  MUG,1,2.1,17897.0,United Kingdom,2025-11-21
511136,22501,PICNIC BASKET WICKER LARGE,12,9.95,17897.0,United Kingdom,2025-11-21
511136,22479,DAISY GARDEN MARKER,10,1.25,17897.0,United Kingdom,2025-11-21
511137,72802C,VANILLA SCENT CANDLE JEWELLED BOX,1,4.25,14167.0,United Kingdom,2025-11-21
511137,22649,STRAWBERRY FAIRY CAKE TEAPOT,1,4.95,14167.0,United Kingdom,2025-11-21
511137,22645,CERAMIC HEART FAIRY CAKE MONEY BANK,4,1.45,14167.0,United Kingdom,2025-11-21
511137,37476,CONDIMENT TRAY 4 BOWLS AND 4 SPOONS,1,9.95,14167.0,United Kingdom,2025-11-21
511137,72802A,ROSE SCENT CANDLE IN JEWELLED BOX,3,4.25,14167.0,United Kingdom,2025-11-21
511137,72807A,SET/3 ROSE CANDLE IN JEWELLED BOX,1,4.25,14167.0,United Kingdom,2025-11-21
511137,72803A,ROSE SCENT CANDLE JEWELLED DRAWER,2,4.25,14167.0,United Kingdom,2025-11-21
511137,72807B,SET/3 OCEAN SCENT CANDLE JEWEL BOX,1,4.25,14167.0,United Kingdom,2025-11-21
511137,72807C,SET/3 VANILLA SCENTED CANDLE IN BOX,3,4.25,14167.0,United Kingdom,2025-11-21
511137,72807B,SET/3 OCEAN SCENT CANDLE JEWEL BOX,4,4.25,14167.0,United Kingdom,2025-11-21
511137,72803B,OCEAN SCENT CANDLE JEWELLED DRAWER,4,4.25,14167.0,United Kingdom,2025-11-21
511137,85041,SET/4 PINK ORCHID CANDLES IN BOWL,1,1.65,14167.0,United Kingdom,2025-11-21
511137,72803B,OCEAN SCENT CANDLE JEWELLED DRAWER,1,4.25,14167.0,United Kingdom,2025-11-21
511137,21232,STRAWBERRY CERAMIC TRINKET BOX,1,1.25,14167.0,United Kingdom,2025-11-21
511137,22645,CERAMIC HEART FAIRY CAKE MONEY BANK,4,1.45,14167.0,United Kingdom,2025-11-21
511137,21231,SWEETHEART CERAMIC TRINKET BOX,1,1.25,14167.0,United Kingdom,2025-11-21
511137,22067,CHOC TRUFFLE GOLD TRINKET POT ,2,1.65,14167.0,United Kingdom,2025-11-21
511137,21622,VINTAGE UNION JACK CUSHION COVER,1,4.95,14167.0,United Kingdom,2025-11-21
511137,85040B,SET/4 BLUE FLOWER CANDLES IN BOWL,1,1.65,14167.0,United Kingdom,2025-11-21
511137,85039B,S/4 IVORY MINI ROSE CANDLE IN BOWL,1,1.65,14167.0,United Kingdom,2025-11-21
511137,85041,SET/4 PINK ORCHID CANDLES IN BOWL,1,1.65,14167.0,United Kingdom,2025-11-21
511137,72351B,SET/6 PINK  BUTTERFLY T-LIGHTS,1,2.1,14167.0,United Kingdom,2025-11-21
511137,84564,6 SEGMENT COLOURED SNACK BOWL ,1,7.95,14167.0,United Kingdom,2025-11-21
511137,22063,CERAMIC BOWL WITH STRAWBERRY DESIGN,1,2.95,14167.0,United Kingdom,2025-11-21
511137,21231,SWEETHEART CERAMIC TRINKET BOX,1,1.25,14167.0,United Kingdom,2025-11-21
511137,21232,STRAWBERRY CERAMIC TRINKET BOX,1,1.25,14167.0,United Kingdom,2025-11-21
511137,72802B,OCEAN SCENT CANDLE IN JEWELLED BOX,6,4.25,14167.0,United Kingdom,2025-11-21
511137,84682,CLASSICAL ROSE DISH,2,2.95,14167.0,United Kingdom,2025-11-21
511137,22055,MINI CAKE STAND  HANGING STRAWBERY,2,1.65,14167.0,United Kingdom,2025-11-21
511137,37449,CERAMIC CAKE STAND + HANGING CAKES,2,9.95,14167.0,United Kingdom,2025-11-21
511160,82482,WOODEN PICTURE FRAME WHITE FINISH,2,2.55,15059.0,United Kingdom,2025-11-21
511160,82494L,WOODEN FRAME ANTIQUE WHITE ,2,2.95,15059.0,United Kingdom,2025-11-21
511161,22637,PIGGY BANK RETROSPOT ,6,2.55,15622.0,United Kingdom,2025-11-21
511160,85150,LADIES & GENTLEMEN METAL SIGN,2,2.55,15059.0,United Kingdom,2025-11-21
511160,21907,I'M ON HOLIDAY METAL SIGN,2,2.1,15059.0,United Kingdom,2025-11-21
511160,22413,METAL SIGN TAKE IT OR LEAVE IT ,4,2.95,15059.0,United Kingdom,2025-11-21
511160,21165,BEWARE OF THE CAT METAL SIGN ,2,1.69,15059.0,United Kingdom,2025-11-21
511160,22117,METAL SIGN HER DINNER IS SERVED ,2,2.95,15059.0,United Kingdom,2025-11-21
511160,22428,ENAMEL FIRE BUCKET CREAM,1,6.95,15059.0,United Kingdom,2025-11-21
511160,82551,LAUNDRY 15C METAL SIGN,2,1.25,15059.0,United Kingdom,2025-11-21
511160,85061W,WHITE JEWELLED HEART DECORATION,6,0.85,15059.0,United Kingdom,2025-11-21
511160,82552,WASHROOM METAL SIGN,2,1.25,15059.0,United Kingdom,2025-11-21
511160,21908,CHOCOLATE THIS WAY METAL SIGN,2,2.1,15059.0,United Kingdom,2025-11-21
511160,22174,PHOTO CUBE,1,1.65,15059.0,United Kingdom,2025-11-21
511160,82486,WOOD S/3 CABINET ANT WHITE FINISH,4,7.95,15059.0,United Kingdom,2025-11-21
511160,22178,VICTORIAN GLASS HANGING T-LIGHT,6,1.25,15059.0,United Kingdom,2025-11-21
511160,85142,JARDIN ETCHED GLASS GINGER JAR,1,7.95,15059.0,United Kingdom,2025-11-21
511160,82483,WOOD 2 DRAWER CABINET WHITE FINISH,4,5.95,15059.0,United Kingdom,2025-11-21
511160,84839,SWEETHEART KEY CABINET,1,6.75,15059.0,United Kingdom,2025-11-21
511160,85064,CREAM SWEETHEART LETTER RACK,2,5.45,15059.0,United Kingdom,2025-11-21
511160,90199B,5 STRAND GLASS NECKLACE AMETHYST,2,6.35,15059.0,United Kingdom,2025-11-21
511160,90200E,GREEN SWEETHEART BRACELET,2,4.25,15059.0,United Kingdom,2025-11-21
511160,82581,TOILET METAL SIGN,2,0.55,15059.0,United Kingdom,2025-11-21
511160,82580,BATHROOM METAL SIGN,2,0.55,15059.0,United Kingdom,2025-11-21
511160,22364,GLASS JAR DIGESTIVE BISCUITS,1,2.95,15059.0,United Kingdom,2025-11-21
511160,22361,GLASS JAR DAISY FRESH COTTON WOOL,2,2.95,15059.0,United Kingdom,2025-11-21
511160,22363,GLASS JAR MARMALADE ,1,2.95,15059.0,United Kingdom,2025-11-21
511160,21164,HOME SWEET HOME METAL SIGN ,2,2.95,15059.0,United Kingdom,2025-11-21
511160,84949,SILVER HANGING T-LIGHT HOLDER,6,1.65,15059.0,United Kingdom,2025-11-21
511160,82582,AREA PATROLLED METAL SIGN,2,2.1,15059.0,United Kingdom,2025-11-21
511160,90200C,BLUE SWEETHEART BRACELET,2,4.25,15059.0,United Kingdom,2025-11-21
511160,82567,"AIRLINE LOUNGE,METAL SIGN",2,2.1,15059.0,United Kingdom,2025-11-21
511159,84991,60 TEATIME FAIRY CAKE CASES,24,0.55,15622.0,United Kingdom,2025-11-21
511160,82583,HOT BATHS METAL SIGN,4,2.1,15059.0,United Kingdom,2025-11-21
511159,21843,RED RETROSPOT CAKE STAND,2,10.95,15622.0,United Kingdom,2025-11-21
511159,84828,JUNGLE POPSICLES ICE LOLLY HOLDERS,12,1.25,15622.0,United Kingdom,2025-11-21
511159,22423,REGENCY CAKESTAND 3 TIER,2,12.75,15622.0,United Kingdom,2025-11-21
511159,21212,PACK OF 72 RETRO SPOT CAKE CASES,24,0.55,15622.0,United Kingdom,2025-11-21
511159,22469,HEART OF WICKER SMALL,12,1.65,15622.0,United Kingdom,2025-11-21
511159,84212,"ASSORTED FLOWER COLOUR ""LEIS""",24,0.65,15622.0,United Kingdom,2025-11-21
511159,21562,HAWAIIAN GRASS SKIRT ,6,2.1,15622.0,United Kingdom,2025-11-21
511159,84016,FLAG OF ST GEORGE CAR FLAG,12,0.42,15622.0,United Kingdom,2025-11-21
511159,22083,PAPER CHAIN KIT RETRO SPOT,6,2.95,15622.0,United Kingdom,2025-11-21
511159,21704,BAG 250g SWIRLY MARBLES,12,0.85,15622.0,United Kingdom,2025-11-21
511159,22084,PAPER CHAIN KIT EMPIRE,6,2.95,15622.0,United Kingdom,2025-11-21
511159,20914,SET/5 RED SPOTTY LID GLASS BOWLS,6,2.95,15622.0,United Kingdom,2025-11-21
511159,21588,RETRO SPOT GIANT  TUBE MATCHES,12,2.55,15622.0,United Kingdom,2025-11-21
511159,84970S,HANGING HEART ZINC T-LIGHT HOLDER,12,0.85,15622.0,United Kingdom,2025-11-21
511160,22080,RIBBON REEL SPOTS DESIGN ,2,1.65,15059.0,United Kingdom,2025-11-21
511160,22429,ENAMEL MEASURING JUG CREAM,2,4.25,15059.0,United Kingdom,2025-11-21
511160,72008,FROSTED BOX 9 WHITE T-LIGHT CANDLES,1,0.42,15059.0,United Kingdom,2025-11-21
511160,22424,ENAMEL BREAD BIN CREAM,1,12.75,15059.0,United Kingdom,2025-11-21
511160,22528,GARDENERS KNEELING PAD,2,1.25,15059.0,United Kingdom,2025-11-21
511160,84849B,FAIRY SOAP SOAP HOLDER,2,1.69,15059.0,United Kingdom,2025-11-21
511160,22502,PICNIC BASKET WICKER SMALL,1,4.25,15059.0,United Kingdom,2025-11-21
511160,22501,PICNIC BASKET WICKER LARGE,1,9.95,15059.0,United Kingdom,2025-11-21
511160,90200A,PURPLE SWEETHEART BRACELET,2,4.25,15059.0,United Kingdom,2025-11-21
511159,21672,WHITE SPOT RED CERAMIC DRAWER KNOB,12,1.25,15622.0,United Kingdom,2025-11-21
511159,47566,PARTY BUNTING,5,4.65,15622.0,United Kingdom,2025-11-21
511160,22625,RED KITCHEN SCALES,1,8.5,15059.0,United Kingdom,2025-11-21
511159,22300,COFFEE MUG DOG + BALL DESIGN,6,2.55,15622.0,United Kingdom,2025-11-21
511164,20728,LUNCH BAG CARS BLUE,830,1.45,14028.0,United Kingdom,2025-11-21
511164,20727,LUNCH BAG  BLACK SKULL.,830,1.45,14028.0,United Kingdom,2025-11-21
511164,20726,LUNCH BAG WOODLAND,830,1.45,14028.0,United Kingdom,2025-11-21
511166,20832,RED FLOCK LOVE HEART PHOTO FRAME,24,0.85,14895.0,United Kingdom,2025-11-21
511166,71459,HANGING JAM JAR T-LIGHT HOLDER,24,0.85,14895.0,United Kingdom,2025-11-21
511166,22285,"DECORATION HEN ON NEST, HANGING",12,1.65,14895.0,United Kingdom,2025-11-21
511166,47480,HANGING PHOTO CLIP ROPE LADDER,12,1.65,14895.0,United Kingdom,2025-11-21
511166,84978,HANGING HEART JAR T-LIGHT HOLDER,24,1.25,14895.0,United Kingdom,2025-11-21
511166,84192,ASSORTED COLOUR METAL CAT ,18,1.25,14895.0,United Kingdom,2025-11-21
511166,84836,ZINC METAL HEART DECORATION,12,1.25,14895.0,United Kingdom,2025-11-21
C511172,20726,LUNCH BAG WOODLAND,-830,1.45,14028.0,United Kingdom,2025-11-21
C511172,20727,LUNCH BAG  BLACK SKULL.,-830,1.45,14028.0,United Kingdom,2025-11-21
C511172,20728,LUNCH BAG CARS BLUE,-830,1.45,14028.0,United Kingdom,2025-11-21
511174,84534B,FAIRY CAKE NOTEBOOK A5 SIZE,12,0.85,15249.0,United Kingdom,2025-11-21
511174,85123A,WHITE HANGING HEART T-LIGHT HOLDER,6,2.95,15249.0,United Kingdom,2025-11-21
511174,21868,POTTING SHED TEA MUG,12,1.25,15249.0,United Kingdom,2025-11-21
511174,20914,SET/5 RED SPOTTY LID GLASS BOWLS,6,2.95,15249.0,United Kingdom,2025-11-21
511174,22295,HEART FILIGREE DOVE LARGE,12,1.65,15249.0,United Kingdom,2025-11-21
511174,48116,DOOR MAT MULTICOLOUR STRIPE,2,7.49,15249.0,United Kingdom,2025-11-21
511174,84459B,YELLOW METAL CHICKEN HEART ,12,1.49,15249.0,United Kingdom,2025-11-21
511174,21642,ASSORTED TUTTI FRUTTI PEN,24,0.85,15249.0,United Kingdom,2025-11-21
511174,16052,TEATIME PUSH DOWN RUBBER,24,0.42,15249.0,United Kingdom,2025-11-21
511174,85049G,CHOCOLATE BOX RIBBONS ,12,1.25,15249.0,United Kingdom,2025-11-21
511174,84755,COLOUR GLASS T-LIGHT HOLDER HANGING,32,0.65,15249.0,United Kingdom,2025-11-21
511174,47570B,TEA TIME TABLE CLOTH,2,10.65,15249.0,United Kingdom,2025-11-21
511174,35653,VINTAGE BEAD NOTEBOOK,6,2.95,15249.0,United Kingdom,2025-11-21
511174,22470,HEART OF WICKER LARGE,6,2.95,15249.0,United Kingdom,2025-11-21
511174,22383,LUNCH BAG SUKI  DESIGN ,10,1.65,15249.0,United Kingdom,2025-11-21
511174,20775,DAISY NOTEBOOK ,6,1.65,15249.0,United Kingdom,2025-11-21
511174,22384,LUNCH BAG PINK RETROSPOT,10,1.65,15249.0,United Kingdom,2025-11-21
511174,22112,CHOCOLATE HOT WATER BOTTLE,3,4.95,15249.0,United Kingdom,2025-11-21
511174,22114,HOT WATER BOTTLE TEA AND SYMPATHY,4,3.95,15249.0,United Kingdom,2025-11-21
511174,37370,RETRO COFFEE MUGS ASSORTED,12,1.25,15249.0,United Kingdom,2025-11-21
511174,20728,LUNCH BAG CARS BLUE,10,1.65,15249.0,United Kingdom,2025-11-21
511174,22078,RIBBON REEL LACE DESIGN ,10,2.1,15249.0,United Kingdom,2025-11-21
511174,22080,RIBBON REEL SPOTS DESIGN ,10,1.65,15249.0,United Kingdom,2025-11-21
511174,48194,DOOR MAT HEARTS,4,7.49,15249.0,United Kingdom,2025-11-21
511174,22469,HEART OF WICKER SMALL,12,1.65,15249.0,United Kingdom,2025-11-21
511174,37343,SPOTS DESIGN MUG W PINK INSIDE,6,1.65,15249.0,United Kingdom,2025-11-21
511174,22077,6 RIBBONS RUSTIC CHARM,12,1.65,15249.0,United Kingdom,2025-11-21
511177,22623,BOX OF VINTAGE JIGSAW BLOCKS ,3,4.95,17505.0,United Kingdom,2025-11-21
511177,21791,VINTAGE HEADS AND TAILS CARD GAME ,12,1.25,17505.0,United Kingdom,2025-11-21
511177,21888,BINGO SET,4,3.75,17505.0,United Kingdom,2025-11-21
511177,21790,VINTAGE SNAP CARDS,12,0.85,17505.0,United Kingdom,2025-11-21
511176,20726,LUNCH BAG WOODLAND,830,1.45,14028.0,United Kingdom,2025-11-21
511176,20727,LUNCH BAG  BLACK SKULL.,830,1.45,14028.0,United Kingdom,2025-11-21
511177,22620,4 TRADITIONAL SPINNING TOPS,12,1.25,17505.0,United Kingdom,2025-11-21
511177,21912,VINTAGE SNAKES & LADDERS,4,3.75,17505.0,United Kingdom,2025-11-21
511177,22138,BAKING SET 9 PIECE RETROSPOT ,3,4.95,17505.0,United Kingdom,2025-11-21
511176,20728,LUNCH BAG CARS BLUE,830,1.45,14028.0,United Kingdom,2025-11-21
511177,22139,RETRO SPOT TEA SET CERAMIC 11 PC ,3,4.95,17505.0,United Kingdom,2025-11-21
511177,22619,SET OF 6 SOLDIER SKITTLES,4,3.75,17505.0,United Kingdom,2025-11-21
511177,21784,SHOE SHINE BOX ,2,9.95,17505.0,United Kingdom,2025-11-21
511177,22441,GROW YOUR OWN BASIL IN ENAMEL MUG,8,2.1,17505.0,United Kingdom,2025-11-21
511177,48111,DOOR MAT 3 SMILEY CATS,2,7.49,17505.0,United Kingdom,2025-11-21
511177,48188,DOOR MAT WELCOME PUPPIES,2,7.49,17505.0,United Kingdom,2025-11-21
511177,22365,DOOR MAT RESPECTABLE HOUSE,2,7.49,17505.0,United Kingdom,2025-11-21
511177,22464,HANGING METAL HEART LANTERN,12,1.65,17505.0,United Kingdom,2025-11-21
511177,48185,DOOR MAT FAIRY CAKE,2,7.49,17505.0,United Kingdom,2025-11-21
511177,21259,VICTORIAN SEWING BOX SMALL ,4,5.95,17505.0,United Kingdom,2025-11-21
511177,22561,WOODEN SCHOOL COLOURING SET,12,1.65,17505.0,United Kingdom,2025-11-21
511177,22550,HOLIDAY FUN LUDO,6,3.75,17505.0,United Kingdom,2025-11-21
511177,21777,RECIPE BOX WITH METAL HEART,2,7.95,17505.0,United Kingdom,2025-11-21
511179,22621,TRADITIONAL KNITTING NANCY,12,1.45,17505.0,United Kingdom,2025-11-21
511179,22622,BOX OF VINTAGE ALPHABET BLOCKS,2,9.95,17505.0,United Kingdom,2025-11-21
511185,85123A,WHITE HANGING HEART T-LIGHT HOLDER,1,2.95,16883.0,United Kingdom,2025-11-21
511185,22296,HEART IVORY TRELLIS LARGE,2,1.65,16883.0,United Kingdom,2025-11-21
511185,22499,WOODEN UNION JACK BUNTING,2,5.95,16883.0,United Kingdom,2025-11-21
511185,22168,ORGANISER WOOD ANTIQUE WHITE ,1,8.5,16883.0,United Kingdom,2025-11-21
511185,22513,DOORSTOP FOOTBALL DESIGN,4,3.75,16883.0,United Kingdom,2025-11-21
511185,21726,MULTI HEARTS  STICKERS,3,0.85,16883.0,United Kingdom,2025-11-21
511185,21725,SWEETIES  STICKERS,3,0.85,16883.0,United Kingdom,2025-11-21
511185,22650,CERAMIC PIRATE CHEST MONEY BANK,4,1.45,16883.0,United Kingdom,2025-11-21
511185,22219,LOVEBIRD HANGING DECORATION WHITE ,3,0.85,16883.0,United Kingdom,2025-11-21
511185,21544,SKULLS  WATER TRANSFER TATTOOS ,5,0.85,16883.0,United Kingdom,2025-11-21
511185,21914,BLUE HARMONICA IN BOX ,3,1.25,16883.0,United Kingdom,2025-11-21
511185,21915,RED  HARMONICA IN BOX ,3,1.25,16883.0,United Kingdom,2025-11-21
511185,20727,LUNCH BAG  BLACK SKULL.,1,1.65,16883.0,United Kingdom,2025-11-21
511185,22563,HAPPY STENCIL CRAFT,1,1.25,16883.0,United Kingdom,2025-11-21
511185,85062,PEARL CRYSTAL PUMPKIN T-LIGHT HLDR,4,1.65,16883.0,United Kingdom,2025-11-21
511185,22217,T-LIGHT HOLDER HANGING LACE,3,1.25,16883.0,United Kingdom,2025-11-21
511185,84755,COLOUR GLASS T-LIGHT HOLDER HANGING,8,0.65,16883.0,United Kingdom,2025-11-21
511185,22178,VICTORIAN GLASS HANGING T-LIGHT,6,1.25,16883.0,United Kingdom,2025-11-21
511185,84945,MULTI COLOUR SILVER T-LIGHT HOLDER,12,0.85,16883.0,United Kingdom,2025-11-21
511185,21313,GLASS HEART T-LIGHT HOLDER ,12,0.85,16883.0,United Kingdom,2025-11-21
511185,21679,SKULLS  STICKERS,6,0.85,16883.0,United Kingdom,2025-11-21
511204,22558,CLOTHES PEGS RETROSPOT PACK 24 ,2,1.25,15471.0,United Kingdom,2025-11-21
511204,22296,HEART IVORY TRELLIS LARGE,5,1.65,15471.0,United Kingdom,2025-11-21
511204,21615,4 LAVENDER BOTANICAL DINNER CANDLES,1,3.75,15471.0,United Kingdom,2025-11-21
511204,21619,4 VANILLA BOTANICAL CANDLES,1,3.75,15471.0,United Kingdom,2025-11-21
511204,72800F,4 IVORY DINNER CANDLES GOLD FLOCK,1,2.55,15471.0,United Kingdom,2025-11-21
511204,22296,HEART IVORY TRELLIS LARGE,1,1.65,15471.0,United Kingdom,2025-11-21
511204,21733,RED HANGING HEART T-LIGHT HOLDER,6,2.95,15471.0,United Kingdom,2025-11-21
511204,72741,GRAND CHOCOLATECANDLE,9,1.45,15471.0,United Kingdom,2025-11-21
511204,22465,HANGING METAL STAR LANTERN,3,1.65,15471.0,United Kingdom,2025-11-21
511204,46000M,POLYESTER FILLER PAD 45x45cm,6,1.55,15471.0,United Kingdom,2025-11-21
511204,21692,SILVER LATTICE VANILLA CANDLE POT,2,3.75,15471.0,United Kingdom,2025-11-21
511204,84859A,SILVER DISCO HANDBAG,1,5.95,15471.0,United Kingdom,2025-11-21
511204,20914,SET/5 RED SPOTTY LID GLASS BOWLS,1,2.95,15471.0,United Kingdom,2025-11-21
511204,22465,HANGING METAL STAR LANTERN,1,1.65,15471.0,United Kingdom,2025-11-21
511204,84806B,WHITE CANDYSTUFT ARTIFICIAL FLOWER,2,1.45,15471.0,United Kingdom,2025-11-21
511204,84800S,SMALL WHITE/PINK ROSE ART FLOWER,4,1.25,15471.0,United Kingdom,2025-11-21
511204,22329,ROUND CONTAINER SET OF 5 RETROSPOT,1,1.65,15471.0,United Kingdom,2025-11-21
511204,85123A,WHITE HANGING HEART T-LIGHT HOLDER,64,2.55,15471.0,United Kingdom,2025-11-21
511204,21620,S/4 ROSE    BOTANICAL  CANDLE,1,3.75,15471.0,United Kingdom,2025-11-21
