Invoice,StockCode,Description,Quantity,Price,Customer ID,Country,InvoiceDate
535322,85059,FRENCH ENAMEL WATER BASIN,1,7.62,,United Kingdom,2026-04-16
535322,20723,STRAWBERRY CHARLOTTE BAG,2,1.66,,United Kingdom,2026-04-16
535322,20725,LUNCH BAG RED RETROSPOT,1,4.21,,United Kingdom,2026-04-16
535322,21166,COOK WITH WINE METAL SIGN ,1,4.21,,United Kingdom,2026-04-16
535322,21165,BEWARE OF THE CAT METAL SIGN ,3,4.21,,United Kingdom,2026-04-16
535322,21163,DO NOT TOUCH MY STUFF DOOR HANGER ,1,3.36,,United Kingdom,2026-04-16
535322,21155,RED RETROSPOT PEG BAG,1,4.21,,United Kingdom,2026-04-16
535322,21110,LARGE CAKE TOWEL PINK SPOTS,1,13.57,,United Kingdom,2026-04-16
535322,21108,FAIRY CAKE FLANNEL ASSORTED COLOUR,2,5.06,,United Kingdom,2026-04-16
535322,21107,CREAM SLICE FLANNEL PINK SPOT ,3,5.91,,United Kingdom,2026-04-16
535322,21098,CHRISTMAS TOILET ROLL,9,2.51,,United Kingdom,2026-04-16
535322,21094,SET/6 RED SPOTTY PAPER PLATES,2,1.66,,United Kingdom,2026-04-16
535322,21071,VINTAGE BILLBOARD DRINK ME MUG,1,2.51,,United Kingdom,2026-04-16
535322,21068,VINTAGE BILLBOARD LOVE/HATE MUG,4,2.51,,United Kingdom,2026-04-16
535322,21054,NURSE'S BAG SOFT TOY,1,16.98,,United Kingdom,2026-04-16
535322,20724,RED RETROSPOT CHARLOTTE BAG,2,1.66,,United Kingdom,2026-04-16
535322,21015,DARK BIRD HOUSE TREE DECORATION,2,1.28,,United Kingdom,2026-04-16
535322,21012,ANTIQUE ALL GLASS CANDLESTICK,1,2.51,,United Kingdom,2026-04-16
535322,20998,ROSE DU SUD OVEN GLOVE,2,3.36,,United Kingdom,2026-04-16
535322,20985,HEART CALCULATOR,1,2.51,,United Kingdom,2026-04-16
535322,20975,12 PENCILS SMALL TUBE RED RETROSPOT,1,1.28,,United Kingdom,2026-04-16
535322,20974,12 PENCILS SMALL TUBE SKULL,1,1.28,,United Kingdom,2026-04-16
535322,20966,SANDWICH BATH SPONGE,2,2.51,,United Kingdom,2026-04-16
535322,20963,APPLE BATH SPONGE,4,2.51,,United Kingdom,2026-04-16
535322,20956,PORCELAIN T-LIGHT HOLDERS ASSORTED,3,2.51,,United Kingdom,2026-04-16
535322,20914,SET/5 RED RETROSPOT LID GLASS BOWLS,5,5.91,,United Kingdom,2026-04-16
535322,20903,VINTAGE KEEPSAKE BOX TRAVELOGUE,1,12.72,,United Kingdom,2026-04-16
535322,20830,SILVER PHOTO FRAME,1,4.21,,United Kingdom,2026-04-16
535322,20728,LUNCH BAG CARS BLUE,1,4.21,,United Kingdom,2026-04-16
535322,21014,SWISS CHALET TREE DECORATION ,1,1.28,,United Kingdom,2026-04-16
535322,22792,FLUTED ANTIQUE CANDLE HOLDER,10,1.66,,United Kingdom,2026-04-16
535322,84971S,SMALL HEART FLOWERS HOOK ,1,1.66,,United Kingdom,2026-04-16
535322,22772,PINK DRAWER KNOB ACRYLIC EDWARDIAN,4,2.51,,United Kingdom,2026-04-16
535322,22069,BROWN  PIRATE TREASURE CHEST ,2,3.36,,United Kingdom,2026-04-16
535322,22068,BLACK PIRATE TREASURE CHEST,1,3.36,,United Kingdom,2026-04-16
535322,22067,CHOC TRUFFLE GOLD TRINKET POT ,2,3.36,,United Kingdom,2026-04-16
535322,22066,LOVE HEART TRINKET POT,1,3.36,,United Kingdom,2026-04-16
535322,22064,PINK DOUGHNUT TRINKET POT ,4,3.36,,United Kingdom,2026-04-16
535322,22059,CERAMIC STRAWBERRY DESIGN MUG,2,3.36,,United Kingdom,2026-04-16
535322,22043,CHRISTMAS CARD SCREEN PRINT ,1,0.43,,United Kingdom,2026-04-16
535322,22042,CHRISTMAS CARD SINGING ANGEL,1,0.43,,United Kingdom,2026-04-16
535322,22030,SWALLOWS GREETING CARD,9,0.85,,United Kingdom,2026-04-16
535322,22029,SPACEBOY BIRTHDAY CARD,2,0.85,,United Kingdom,2026-04-16
535322,21993,FLORAL FOLK STATIONERY SET,2,2.51,,United Kingdom,2026-04-16
535322,21992,VINTAGE PAISLEY STATIONERY SET,5,2.51,,United Kingdom,2026-04-16
535322,21990,MODERN FLORAL STATIONERY SET,2,2.51,,United Kingdom,2026-04-16
535322,21986,PACK OF 12 PINK POLKADOT TISSUES,1,0.85,,United Kingdom,2026-04-16
535322,21983,PACK OF 12 BLUE PAISLEY TISSUES ,2,0.85,,United Kingdom,2026-04-16
535322,21982,PACK OF 12 SUKI TISSUES ,4,0.85,,United Kingdom,2026-04-16
535322,21981,PACK OF 12 WOODLAND TISSUES ,2,0.85,,United Kingdom,2026-04-16
535322,21977,PACK OF 60 PINK PAISLEY CAKE CASES,3,1.28,,United Kingdom,2026-04-16
535322,21975,PACK OF 60 DINOSAUR CAKE CASES,1,1.28,,United Kingdom,2026-04-16
535322,21974,SET OF 36 PAISLEY FLOWER DOILIES,1,2.98,,United Kingdom,2026-04-16
535322,21955,DOORMAT UNION JACK GUNS AND ROSES,2,14.43,,United Kingdom,2026-04-16
535322,21945,STRAWBERRIES  DESIGN FLANNEL ,1,1.66,,United Kingdom,2026-04-16
535322,21944,KITTENS DESIGN FLANNEL,1,1.66,,United Kingdom,2026-04-16
535322,21935,SUKI  SHOULDER BAG,4,3.36,,United Kingdom,2026-04-16
535322,21934,SKULL SHOULDER BAG,2,3.36,,United Kingdom,2026-04-16
535322,22077,6 RIBBONS RUSTIC CHARM,3,3.36,,United Kingdom,2026-04-16
535322,22079,RIBBON REEL HEARTS DESIGN ,2,3.36,,United Kingdom,2026-04-16
535322,22081,RIBBON REEL FLORA + FAUNA ,1,3.36,,United Kingdom,2026-04-16
535322,22082,RIBBON REEL STRIPES DESIGN ,1,3.36,,United Kingdom,2026-04-16
535322,22180,RETROSPOT LAMP,1,21.23,,United Kingdom,2026-04-16
535322,22179,SET 10 LIGHTS NIGHT OWL,1,13.57,,United Kingdom,2026-04-16
535322,22178,VICTORIAN GLASS HANGING T-LIGHT,13,2.51,,United Kingdom,2026-04-16
535322,22174,PHOTO CUBE,8,3.36,,United Kingdom,2026-04-16
535322,22162,HEART GARLAND RUSTIC PADDED,8,3.36,,United Kingdom,2026-04-16
535322,22161,HEART DECORATION RUSTIC HANGING ,5,0.81,,United Kingdom,2026-04-16
535322,22152,PLACE SETTING WHITE STAR,1,1.66,,United Kingdom,2026-04-16
535322,22149,FELTCRAFT 6 FLOWER FRIENDS,17,2.51,,United Kingdom,2026-04-16
535322,22147,FELTCRAFT BUTTERFLY HEARTS,1,3.36,,United Kingdom,2026-04-16
535322,22144,CHRISTMAS CRAFT LITTLE FRIENDS,4,4.21,,United Kingdom,2026-04-16
535322,22142,CHRISTMAS CRAFT WHITE FAIRY ,2,3.36,,United Kingdom,2026-04-16
535322,22141,CHRISTMAS CRAFT TREE TOP ANGEL,4,4.21,,United Kingdom,2026-04-16
535322,21931,JUMBO STORAGE BAG SUKI,1,4.21,,United Kingdom,2026-04-16
535322,22136,LOVE HEART SOCK HANGER,1,3.36,,United Kingdom,2026-04-16
535322,22134,LADLE LOVE HEART RED ,3,0.85,,United Kingdom,2026-04-16
535322,22133,PINK LOVE HEART SHAPE CUP,1,1.66,,United Kingdom,2026-04-16
535322,22131,FOOD CONTAINER SET 3 LOVE HEART ,2,4.21,,United Kingdom,2026-04-16
535322,22130,PARTY CONE CHRISTMAS DECORATION ,2,8.47,,United Kingdom,2026-04-16
535322,22124,SET OF 2 TEA TOWELS PING MICROWAVE,1,2.51,,United Kingdom,2026-04-16
535322,22121,NOEL WOODEN BLOCK LETTERS ,1,11.87,,United Kingdom,2026-04-16
535322,22109,FULL ENGLISH BREAKFAST PLATE,1,7.62,,United Kingdom,2026-04-16
535322,22107,PIZZA PLATE IN BOX,1,7.62,,United Kingdom,2026-04-16
535322,22095,LADS ONLY TISSUE BOX,1,2.51,,United Kingdom,2026-04-16
535322,22090,PAPER BUNTING RETROSPOT,5,5.91,,United Kingdom,2026-04-16
535322,22086,PAPER CHAIN KIT 50'S CHRISTMAS ,17,5.91,,United Kingdom,2026-04-16
535322,22083,PAPER CHAIN KIT RETROSPOT,3,5.91,,United Kingdom,2026-04-16
535322,22135,LADLE LOVE HEART PINK,4,0.85,,United Kingdom,2026-04-16
535322,21929,JUMBO BAG PINK VINTAGE PAISLEY,1,4.21,,United Kingdom,2026-04-16
535322,21928,JUMBO BAG SCANDINAVIAN PAISLEY,1,4.21,,United Kingdom,2026-04-16
535322,21915,RED  HARMONICA IN BOX ,1,2.51,,United Kingdom,2026-04-16
535322,21719,LOVELY BONBON STICKER SHEET,1,1.66,,United Kingdom,2026-04-16
535322,21705,BAG 500g SWIRLY MARBLES,1,3.36,,United Kingdom,2026-04-16
535322,21658,GLASS  BEURRE DISH,1,8.47,,United Kingdom,2026-04-16
535322,21656,RIDGED GLASS POSY VASE ,1,3.36,,United Kingdom,2026-04-16
535322,21643,ASSORTED TUTTI FRUTTI MIRROR,4,2.51,,United Kingdom,2026-04-16
535322,21642,ASSORTED TUTTI FRUTTI PEN,4,1.66,,United Kingdom,2026-04-16
535322,21640,ASSORTED TUTTI FRUTTI  FOB NOTEBOOK,1,1.66,,United Kingdom,2026-04-16
535322,21579,LOLITA  DESIGN  COTTON TOTE BAG,1,5.06,,United Kingdom,2026-04-16
535322,21576,LETS GO SHOPPING COTTON TOTE BAG,1,5.06,,United Kingdom,2026-04-16
535322,21559,STRAWBERRY LUNCH BOX WITH CUTLERY,1,5.06,,United Kingdom,2026-04-16
535322,21537,RED RETROSPOT PUDDING BOWL,1,8.47,,United Kingdom,2026-04-16
535322,21494,ROTATING LEAVES T-LIGHT HOLDER,3,5.06,,United Kingdom,2026-04-16
535322,21721,CANDY SHOP  STICKER SHEET,1,1.66,,United Kingdom,2026-04-16
535322,21486,PINK HEART DOTS HOT WATER BOTTLE,2,4.21,,United Kingdom,2026-04-16
535322,21481,FAWN BLUE HOT WATER BOTTLE,1,5.91,,United Kingdom,2026-04-16
535322,21479,WHITE SKULL HOT WATER BOTTLE ,3,7.62,,United Kingdom,2026-04-16
535322,21391,FRENCH EMROIDR LAVENDER SCENT HEART,1,4.21,,United Kingdom,2026-04-16
535322,21367,MIRRORED WALL ART GENTS,1,5.06,,United Kingdom,2026-04-16
535322,21363,HOME SMALL WOOD LETTERS,1,11.02,,United Kingdom,2026-04-16
535322,21356,TOAST ITS - FAIRY FLOWER,1,2.51,,United Kingdom,2026-04-16
535322,21355,TOAST ITS - I LOVE YOU ,1,2.51,,United Kingdom,2026-04-16
535322,21354,TOAST ITS - BEST MUM,1,2.51,,United Kingdom,2026-04-16
535322,21352,EUCALYPTUS & PINECONE  WREATH,2,5.91,,United Kingdom,2026-04-16
535322,21351,CINAMMON & ORANGE WREATH,1,5.91,,United Kingdom,2026-04-16
535322,21349,IVY HEART WREATH,1,13.57,,United Kingdom,2026-04-16
535322,21329,DINOSAURS  WRITING SET ,1,3.36,,United Kingdom,2026-04-16
535322,21484,CHICK GREY HOT WATER BOTTLE,3,7.62,,United Kingdom,2026-04-16
535322,22184,CAKE STAND VICTORIAN FILIGREE LARGE,1,8.47,,United Kingdom,2026-04-16
535322,21723,ALPHABET HEARTS STICKER SHEET,1,1.66,,United Kingdom,2026-04-16
535322,21781,MA CAMPAGNE CUTLERY BOX,1,29.74,,United Kingdom,2026-04-16
535322,21914,BLUE HARMONICA IN BOX ,3,2.51,,United Kingdom,2026-04-16
535322,21894,POTTING SHED SEED ENVELOPES,1,2.51,,United Kingdom,2026-04-16
535322,21892,TRADITIONAL WOODEN CATCH CUP GAME ,2,2.51,,United Kingdom,2026-04-16
535322,21891,TRADITIONAL WOODEN SKIPPING ROPE,1,2.51,,United Kingdom,2026-04-16
535322,21889,WOODEN BOX OF DOMINOES,3,2.51,,United Kingdom,2026-04-16
535322,21888,BINGO SET,1,7.62,,United Kingdom,2026-04-16
535322,21877,HOME SWEET HOME MUG,2,3.36,,United Kingdom,2026-04-16
535322,21876,POTTERING MUG,1,3.36,,United Kingdom,2026-04-16
535322,21874,GIN AND TONIC MUG,7,3.36,,United Kingdom,2026-04-16
535322,21872,GLAMOROUS  MUG,1,3.36,,United Kingdom,2026-04-16
535322,21871,SAVE THE PLANET MUG,3,3.36,,United Kingdom,2026-04-16
535322,21870,I CAN ONLY PLEASE ONE PERSON MUG,4,3.36,,United Kingdom,2026-04-16
535322,21731,RED TOADSTOOL LED NIGHT LIGHT,1,3.36,,United Kingdom,2026-04-16
535322,21868,POTTING SHED TEA MUG,1,3.36,,United Kingdom,2026-04-16
535322,21844,RED RETROSPOT MUG,6,5.91,,United Kingdom,2026-04-16
535322,21832,CHOCOLATE CALCULATOR,1,3.36,,United Kingdom,2026-04-16
535322,21829,DINOSAUR KEYRINGS ASSORTED,1,0.43,,United Kingdom,2026-04-16
535322,21821,GLITTER STAR GARLAND WITH BELLS ,2,7.62,,United Kingdom,2026-04-16
535322,21820,GLITTER HEART GARLAND WITH BELLS ,1,7.62,,United Kingdom,2026-04-16
535322,21813,GARLAND WITH STARS AND BELLS,2,10.17,,United Kingdom,2026-04-16
535322,21809,CHRISTMAS HANGING TREE WITH BELL,1,2.51,,United Kingdom,2026-04-16
535322,21803,CHRISTMAS TREE STAR DECORATION,2,0.43,,United Kingdom,2026-04-16
535322,21802,CHRISTMAS TREE HEART DECORATION,9,0.43,,United Kingdom,2026-04-16
535322,21801,CHRISTMAS TREE DECORATION WITH BELL,2,0.43,,United Kingdom,2026-04-16
535322,21791,VINTAGE HEADS AND TAILS CARD GAME ,3,2.51,,United Kingdom,2026-04-16
535322,21790,VINTAGE SNAP CARDS,12,1.66,,United Kingdom,2026-04-16
535322,21846,PINK DIAMANTE PEN IN GIFT BOX,1,4.21,,United Kingdom,2026-04-16
535322,22190,LOCAL CAFE MUG,2,2.51,,United Kingdom,2026-04-16
535322,22776,SWEETHEART CAKESTAND 3 TIER,1,20.38,,United Kingdom,2026-04-16
535322,22196,SMALL HEART MEASURING SPOONS,1,1.66,,United Kingdom,2026-04-16
535322,22646,CERAMIC STRAWBERRY CAKE MONEY BANK,1,3.36,,United Kingdom,2026-04-16
535322,22645,CERAMIC HEART FAIRY CAKE MONEY BANK,1,3.36,,United Kingdom,2026-04-16
535322,22644,CERAMIC CHERRY CAKE MONEY BANK,1,3.36,,United Kingdom,2026-04-16
535322,22639,SET OF 4 NAPKIN CHARMS HEARTS,2,5.06,,United Kingdom,2026-04-16
535322,22633,HAND WARMER UNION JACK,1,4.21,,United Kingdom,2026-04-16
535322,22631,CIRCUS PARADE LUNCH BOX ,1,4.21,,United Kingdom,2026-04-16
535322,22629,SPACEBOY LUNCH BOX ,1,4.21,,United Kingdom,2026-04-16
535322,22625,RED KITCHEN SCALES,1,16.98,,United Kingdom,2026-04-16
535322,22623,BOX OF VINTAGE JIGSAW BLOCKS ,2,11.02,,United Kingdom,2026-04-16
535322,22620,4 TRADITIONAL SPINNING TOPS,4,2.51,,United Kingdom,2026-04-16
535322,22614,PACK OF 12 SPACEBOY TISSUES,1,0.85,,United Kingdom,2026-04-16
535322,22611,VINTAGE UNION JACK SHOPPING BAG,1,10.17,,United Kingdom,2026-04-16
535322,22603,CHRISTMAS RETROSPOT TREE WOOD,1,1.66,,United Kingdom,2026-04-16
535322,22602,CHRISTMAS RETROSPOT HEART WOOD,1,1.66,,United Kingdom,2026-04-16
535322,22601,CHRISTMAS RETROSPOT ANGEL WOOD,1,1.66,,United Kingdom,2026-04-16
535322,22600,CHRISTMAS RETROSPOT STAR WOOD,1,1.66,,United Kingdom,2026-04-16
535322,22595,CHRISTMAS GINGHAM HEART,1,1.66,,United Kingdom,2026-04-16
535322,22594,CHRISTMAS GINGHAM TREE,2,1.66,,United Kingdom,2026-04-16
535322,22593,CHRISTMAS GINGHAM STAR,3,1.66,,United Kingdom,2026-04-16
535322,22585,PACK OF 6 BIRDY GIFT TAGS,1,2.51,,United Kingdom,2026-04-16
535322,22581,WOOD STOCKING CHRISTMAS SCANDISPOT,1,1.66,,United Kingdom,2026-04-16
535322,22580,ADVENT CALENDAR GINGHAM SACK,1,11.87,,United Kingdom,2026-04-16
535322,22579,WOODEN TREE CHRISTMAS SCANDINAVIAN,1,1.66,,United Kingdom,2026-04-16
535322,22577,WOODEN HEART CHRISTMAS SCANDINAVIAN,1,1.66,,United Kingdom,2026-04-16
535322,22575,METAL MERRY CHRISTMAS WREATH,1,4.21,,United Kingdom,2026-04-16
535322,22650,CERAMIC PIRATE CHEST MONEY BANK,1,3.36,,United Kingdom,2026-04-16
535322,22659,LUNCH BOX I LOVE LONDON,1,4.21,,United Kingdom,2026-04-16
535322,22661,CHARLOTTE BAG DOLLY GIRL DESIGN,1,1.66,,United Kingdom,2026-04-16
535322,22664,TOY TIDY DOLLY GIRL DESIGN,4,4.21,,United Kingdom,2026-04-16
535322,22195,LARGE HEART MEASURING SPOONS,1,3.36,,United Kingdom,2026-04-16
535322,22759,SET OF 3 NOTEBOOKS IN PARCEL,5,3.36,,United Kingdom,2026-04-16
535322,22755,SMALL PURPLE BABUSHKA NOTEBOOK ,1,1.66,,United Kingdom,2026-04-16
535322,22754,SMALL RED BABUSHKA NOTEBOOK ,2,1.66,,United Kingdom,2026-04-16
535322,22750,FELTCRAFT PRINCESS LOLA DOLL,3,7.62,,United Kingdom,2026-04-16
535322,22749,FELTCRAFT PRINCESS CHARLOTTE DOLL,3,7.62,,United Kingdom,2026-04-16
535322,22745,POPPY'S PLAYHOUSE BEDROOM ,1,4.21,,United Kingdom,2026-04-16
535322,22740,POLKADOT PEN,1,1.66,,United Kingdom,2026-04-16
535322,22739,RIBBON REEL CHRISTMAS SOCK BAUBLE,3,3.36,,United Kingdom,2026-04-16
535322,22738,RIBBON REEL SNOWY VILLAGE,3,3.36,,United Kingdom,2026-04-16
535322,22736,RIBBON REEL MAKING SNOWMEN ,1,3.36,,United Kingdom,2026-04-16
535322,22735,RIBBON REEL SOCKS AND MITTENS,1,3.36,,United Kingdom,2026-04-16
535322,22573,STAR WOODEN CHRISTMAS DECORATION,1,1.66,,United Kingdom,2026-04-16
535322,22733,3D TRADITIONAL CHRISTMAS STICKERS,1,2.51,,United Kingdom,2026-04-16
535322,22728,ALARM CLOCK BAKELIKE PINK,1,7.62,,United Kingdom,2026-04-16
535322,22714,CARD BIRTHDAY COWBOY,1,0.85,,United Kingdom,2026-04-16
535322,22713,CARD I LOVE LONDON ,1,0.85,,United Kingdom,2026-04-16
535322,22697,GREEN REGENCY TEACUP AND SAUCER,1,5.91,,United Kingdom,2026-04-16
535322,22696,WICKER WREATH LARGE,1,4.21,,United Kingdom,2026-04-16
535322,22695,WICKER WREATH SMALL,6,3.36,,United Kingdom,2026-04-16
535322,22694,WICKER STAR ,2,4.21,,United Kingdom,2026-04-16
535322,22692,DOORMAT WELCOME TO OUR HOME,1,7.95,,United Kingdom,2026-04-16
535322,22688,DOORMAT PEACE ON EARTH BLUE,1,14.43,,United Kingdom,2026-04-16
535322,22668,PINK BABY BUNTING,2,5.91,,United Kingdom,2026-04-16
535322,22666,RECIPE BOX PANTRY YELLOW DESIGN,5,5.91,,United Kingdom,2026-04-16
535322,22665,RECIPE BOX BLUE SKETCHBOOK DESIGN,2,5.91,,United Kingdom,2026-04-16
535322,22732,3D VINTAGE CHRISTMAS STICKERS ,1,2.51,,United Kingdom,2026-04-16
535322,22571,ROCKING HORSE RED CHRISTMAS ,2,1.66,,United Kingdom,2026-04-16
535322,22734,SET OF 6 RIBBONS VINTAGE CHRISTMAS,1,2.55,,United Kingdom,2026-04-16
535322,22560,TRADITIONAL MODELLING CLAY,1,2.51,,United Kingdom,2026-04-16
535322,22444,GROW YOUR OWN PLANT IN A CAN ,1,2.51,,United Kingdom,2026-04-16
535322,22435,SET OF 9 HEART SHAPED BALLOONS,2,2.51,,United Kingdom,2026-04-16
535322,22432,WATERING CAN PINK BUNNY,1,4.21,,United Kingdom,2026-04-16
535322,22423,REGENCY CAKESTAND 3 TIER,1,25.49,,United Kingdom,2026-04-16
535322,22422,TOOTHPASTE TUBE PEN,2,1.28,,United Kingdom,2026-04-16
535322,22421,LIPSTICK PEN FUSCHIA,1,0.85,,United Kingdom,2026-04-16
535322,22419,LIPSTICK PEN RED,2,0.85,,United Kingdom,2026-04-16
535322,22417,PACK OF 60 SPACEBOY CAKE CASES,2,1.28,,United Kingdom,2026-04-16
535322,22395,PAPERWEIGHT VINTAGE PAISLEY,1,5.06,,United Kingdom,2026-04-16
535322,22379,RECYCLING BAG RETROSPOT ,1,4.21,,United Kingdom,2026-04-16
535322,22361,GLASS JAR DAISY FRESH COTTON WOOL,1,5.91,,United Kingdom,2026-04-16
535322,22356,CHARLOTTE BAG PINK POLKADOT,8,1.66,,United Kingdom,2026-04-16
535322,22452,MEASURING TAPE BABUSHKA PINK,1,5.91,,United Kingdom,2026-04-16
535322,22355,CHARLOTTE BAG SUKI DESIGN,2,1.66,,United Kingdom,2026-04-16
535322,22336,DOVE DECORATION PAINTED ZINC ,6,1.28,,United Kingdom,2026-04-16
535322,22326,ROUND SNACK BOXES SET OF4 WOODLAND ,1,5.91,,United Kingdom,2026-04-16
535322,22324,BLUE POLKADOT KIDS BAG,1,4.21,,United Kingdom,2026-04-16
535322,22310,IVORY KNITTED MUG COSY ,2,3.36,,United Kingdom,2026-04-16
535322,22283,6 EGG HOUSE PAINTED WOOD,1,16.13,,United Kingdom,2026-04-16
535322,22278,OVERNIGHT BAG VINTAGE ROSE PAISLEY,1,11.02,,United Kingdom,2026-04-16
535322,22258,FELT FARM ANIMAL RABBIT,1,2.51,,United Kingdom,2026-04-16
535322,22212,FOUR HOOK  WHITE LOVEBIRDS,2,4.21,,United Kingdom,2026-04-16
535322,22211,WOOD STAMP SET FLOWERS,1,3.36,,United Kingdom,2026-04-16
535322,22198,LARGE POPCORN HOLDER ,7,3.36,,United Kingdom,2026-04-16
535322,22197,SMALL POPCORN HOLDER,16,1.66,,United Kingdom,2026-04-16
535322,22568,FELTCRAFT CUSHION OWL,1,7.62,,United Kingdom,2026-04-16
535322,22348,TEA BAG PLATE RED RETROSPOT,1,1.66,,United Kingdom,2026-04-16
535322,22457,NATURAL SLATE HEART CHALKBOARD ,2,5.91,,United Kingdom,2026-04-16
535322,22375,AIRLINE BAG VINTAGE JET SET BROWN,1,8.47,,United Kingdom,2026-04-16
535322,22469,HEART OF WICKER SMALL,17,3.36,,United Kingdom,2026-04-16
535322,22557,PLASTERS IN TIN VINTAGE PAISLEY ,1,3.36,,United Kingdom,2026-04-16
535322,22556,PLASTERS IN TIN CIRCUS PARADE ,1,3.36,,United Kingdom,2026-04-16
535322,22460,EMBOSSED GLASS TEALIGHT HOLDER,40,2.51,,United Kingdom,2026-04-16
535322,22554,PLASTERS IN TIN WOODLAND ANIMALS,1,3.36,,United Kingdom,2026-04-16
535322,22550,HOLIDAY FUN LUDO,1,7.62,,United Kingdom,2026-04-16
535322,22549,PICTURE DOMINOES,1,3.36,,United Kingdom,2026-04-16
535322,22547,MINI JIGSAW DINOSAUR ,1,0.85,,United Kingdom,2026-04-16
535322,22546,MINI JIGSAW PURDEY,2,0.85,,United Kingdom,2026-04-16
535322,22545,MINI JIGSAW BUNNIES,2,0.85,,United Kingdom,2026-04-16
535322,22544,MINI JIGSAW SPACEBOY,4,0.85,,United Kingdom,2026-04-16
535322,22539,MINI JIGSAW DOLLY GIRL,5,0.85,,United Kingdom,2026-04-16
535322,22537,MAGIC DRAWING SLATE DINOSAUR,1,0.85,,United Kingdom,2026-04-16
535322,22536,MAGIC DRAWING SLATE PURDEY,1,0.85,,United Kingdom,2026-04-16
535322,22555,PLASTERS IN TIN STRONGMAN,1,3.36,,United Kingdom,2026-04-16
535322,22478,BIRDHOUSE GARDEN MARKER ,1,2.51,,United Kingdom,2026-04-16
535322,22534,MAGIC DRAWING SLATE SPACEBOY ,3,0.85,,United Kingdom,2026-04-16
535322,22533,MAGIC DRAWING SLATE BAKE A CAKE ,1,0.85,,United Kingdom,2026-04-16
535322,22531,MAGIC DRAWING SLATE CIRCUS PARADE  ,3,0.85,,United Kingdom,2026-04-16
535322,22505,MEMO BOARD COTTAGE DESIGN,1,11.02,,United Kingdom,2026-04-16
535322,22502,PICNIC BASKET WICKER SMALL,1,8.47,,United Kingdom,2026-04-16
535322,22494,EMERGENCY FIRST AID TIN ,2,2.51,,United Kingdom,2026-04-16
535322,22493,PAINT YOUR OWN CANVAS SET,2,3.36,,United Kingdom,2026-04-16
535322,22489,PACK OF 12 TRADITIONAL CRAYONS,9,0.85,,United Kingdom,2026-04-16
535322,22488,NATURAL SLATE RECTANGLE CHALKBOARD,1,3.36,,United Kingdom,2026-04-16
535322,22477,WATERING CAN GARDEN MARKER,1,2.51,,United Kingdom,2026-04-16
535322,22470,HEART OF WICKER LARGE,1,5.91,,United Kingdom,2026-04-16
535322,22535,MAGIC DRAWING SLATE BUNNIES ,1,0.85,,United Kingdom,2026-04-16
535324,22501,PICNIC BASKET WICKER LARGE,1,9.95,14482.0,United Kingdom,2026-04-16
535324,22866,HAND WARMER SCOTTY DOG DESIGN,3,2.1,14482.0,United Kingdom,2026-04-16
535324,22633,HAND WARMER UNION JACK,1,2.1,14482.0,United Kingdom,2026-04-16
535324,22350,ILLUSTRATED CAT BOWL ,6,2.55,14482.0,United Kingdom,2026-04-16
535324,21866,UNION JACK FLAG LUGGAGE TAG,1,1.25,14482.0,United Kingdom,2026-04-16
535324,20652,BLUE POLKADOT LUGGAGE TAG ,1,1.25,14482.0,United Kingdom,2026-04-16
535324,20615,BLUE POLKADOT PASSPORT COVER,1,2.1,14482.0,United Kingdom,2026-04-16
535324,22379,RECYCLING BAG RETROSPOT ,50,1.85,14482.0,United Kingdom,2026-04-16
535324,20657,TROPICAL LUGGAGE TAG,1,1.25,14482.0,United Kingdom,2026-04-16
535324,21864,UNION JACK FLAG PASSPORT COVER ,1,2.1,14482.0,United Kingdom,2026-04-16
535324,22380,TOY TIDY SPACEBOY  ,20,2.1,14482.0,United Kingdom,2026-04-16
535324,22141,CHRISTMAS CRAFT TREE TOP ANGEL,3,2.1,14482.0,United Kingdom,2026-04-16
535324,22554,PLASTERS IN TIN WOODLAND ANIMALS,1,1.65,14482.0,United Kingdom,2026-04-16
535324,22114,HOT WATER BOTTLE TEA AND SYMPATHY,2,3.95,14482.0,United Kingdom,2026-04-16
535324,22112,CHOCOLATE HOT WATER BOTTLE,3,4.95,14482.0,United Kingdom,2026-04-16
535324,22111,SCOTTIE DOG HOT WATER BOTTLE,3,4.95,14482.0,United Kingdom,2026-04-16
535324,22835,HOT WATER BOTTLE I AM SO POORLY,2,4.65,14482.0,United Kingdom,2026-04-16
535324,22144,CHRISTMAS CRAFT LITTLE FRIENDS,7,2.1,14482.0,United Kingdom,2026-04-16
535324,22142,CHRISTMAS CRAFT WHITE FAIRY ,5,1.45,14482.0,United Kingdom,2026-04-16
535324,22862,LOVE HEART NAPKIN BOX ,4,4.25,14482.0,United Kingdom,2026-04-16
535324,22136,LOVE HEART SOCK HANGER,2,1.65,14482.0,United Kingdom,2026-04-16
535324,22428,ENAMEL FIRE BUCKET CREAM,1,6.95,14482.0,United Kingdom,2026-04-16
535324,20619,TROPICAL PASSPORT COVER ,1,2.1,14482.0,United Kingdom,2026-04-16
535324,16237,SLEEPING CAT ERASERS,1,0.21,14482.0,United Kingdom,2026-04-16
535324,21867,PINK UNION JACK  LUGGAGE TAG,1,1.25,14482.0,United Kingdom,2026-04-16
535324,22144,CHRISTMAS CRAFT LITTLE FRIENDS,1,2.1,14482.0,United Kingdom,2026-04-16
535324,22557,PLASTERS IN TIN VINTAGE PAISLEY ,1,1.65,14482.0,United Kingdom,2026-04-16
535324,21865,PINK UNION JACK  PASSPORT COVER ,1,2.1,14482.0,United Kingdom,2026-04-16
535324,20969,RED FLORAL FELTCRAFT SHOULDER BAG,1,3.75,14482.0,United Kingdom,2026-04-16
535324,22150,3 STRIPEY MICE FELTCRAFT,2,1.95,14482.0,United Kingdom,2026-04-16
535324,22147,FELTCRAFT BUTTERFLY HEARTS,2,1.45,14482.0,United Kingdom,2026-04-16
535324,21931,JUMBO STORAGE BAG SUKI,10,1.95,14482.0,United Kingdom,2026-04-16
535324,20713,JUMBO BAG OWLS,10,1.95,14482.0,United Kingdom,2026-04-16
535324,22147,FELTCRAFT BUTTERFLY HEARTS,1,1.45,14482.0,United Kingdom,2026-04-16
535324,22149,FELTCRAFT 6 FLOWER FRIENDS,1,2.1,14482.0,United Kingdom,2026-04-16
535324,22150,3 STRIPEY MICE FELTCRAFT,1,1.95,14482.0,United Kingdom,2026-04-16
535324,22188,BLACK HEART CARD HOLDER,2,3.95,14482.0,United Kingdom,2026-04-16
535324,22113,GREY HEART HOT WATER BOTTLE,2,3.75,14482.0,United Kingdom,2026-04-16
535324,20914,SET/5 RED RETROSPOT LID GLASS BOWLS,2,2.95,14482.0,United Kingdom,2026-04-16
535324,84625A,PINK NEW BAROQUECANDLESTICK CANDLE,1,2.95,14482.0,United Kingdom,2026-04-16
535324,21376,LARGE  TALL CAMPHOR WOOD TOADSTOOL ,2,5.45,14482.0,United Kingdom,2026-04-16
535324,22141,CHRISTMAS CRAFT TREE TOP ANGEL,1,2.1,14482.0,United Kingdom,2026-04-16
535324,22142,CHRISTMAS CRAFT WHITE FAIRY ,2,1.45,14482.0,United Kingdom,2026-04-16
535324,22400,MAGNETS PACK OF 4 HOME SWEET HOME,1,1.25,14482.0,United Kingdom,2026-04-16
535324,22139,RETROSPOT TEA SET CERAMIC 11 PC ,1,4.95,14482.0,United Kingdom,2026-04-16
535324,22084,PAPER CHAIN KIT EMPIRE,1,2.95,14482.0,United Kingdom,2026-04-16
535324,22911,PAPER CHAIN KIT LONDON,1,2.95,14482.0,United Kingdom,2026-04-16
535324,22643,SET OF 4 NAPKIN CHARMS LEAVES   ,1,2.55,14482.0,United Kingdom,2026-04-16
535324,22643,SET OF 4 NAPKIN CHARMS LEAVES   ,1,2.55,14482.0,United Kingdom,2026-04-16
535324,22638,SET OF 4 NAPKIN CHARMS CROWNS ,2,2.55,14482.0,United Kingdom,2026-04-16
535324,22580,ADVENT CALENDAR GINGHAM SACK,1,5.95,14482.0,United Kingdom,2026-04-16
535325,22969,HOMEMADE JAM SCENTED CANDLES,12,1.45,16558.0,United Kingdom,2026-04-16
535325,22712,CARD DOLLY GIRL ,12,0.42,16558.0,United Kingdom,2026-04-16
535325,21484,CHICK GREY HOT WATER BOTTLE,4,3.45,16558.0,United Kingdom,2026-04-16
535325,22444,GROW YOUR OWN PLANT IN A CAN ,24,1.25,16558.0,United Kingdom,2026-04-16
535325,22941,CHRISTMAS LIGHTS 10 REINDEER,4,8.5,16558.0,United Kingdom,2026-04-16
535325,22114,HOT WATER BOTTLE TEA AND SYMPATHY,8,3.95,16558.0,United Kingdom,2026-04-16
535325,22835,HOT WATER BOTTLE I AM SO POORLY,8,4.65,16558.0,United Kingdom,2026-04-16
535325,22112,CHOCOLATE HOT WATER BOTTLE,6,4.95,16558.0,United Kingdom,2026-04-16
535326,22952,60 CAKE CASES VINTAGE CHRISTMAS,48,0.55,16043.0,United Kingdom,2026-04-16
C535327,72760B,VINTAGE CREAM 3 BASKET CAKE STAND,-1,9.95,16292.0,United Kingdom,2026-04-16
535328,15039,SANDALWOOD FAN,2,0.85,17888.0,United Kingdom,2026-04-16
535328,15036,ASSORTED COLOURS SILK FAN,6,0.75,17888.0,United Kingdom,2026-04-16
535329,22207,FRYING PAN UNION FLAG,24,3.75,14608.0,United Kingdom,2026-04-16
535329,22112,CHOCOLATE HOT WATER BOTTLE,48,4.25,14608.0,United Kingdom,2026-04-16
535329,85099C,JUMBO  BAG BAROQUE BLACK WHITE,10,1.95,14608.0,United Kingdom,2026-04-16
535329,22379,RECYCLING BAG RETROSPOT ,5,2.1,14608.0,United Kingdom,2026-04-16
535329,22114,HOT WATER BOTTLE TEA AND SYMPATHY,24,3.45,14608.0,United Kingdom,2026-04-16
535330,48129,DOORMAT TOPIARY,2,7.95,13534.0,United Kingdom,2026-04-16
535330,21231,SWEETHEART CERAMIC TRINKET BOX,12,1.25,13534.0,United Kingdom,2026-04-16
535330,21232,STRAWBERRY CERAMIC TRINKET BOX,12,1.25,13534.0,United Kingdom,2026-04-16
535330,22645,CERAMIC HEART FAIRY CAKE MONEY BANK,12,1.45,13534.0,United Kingdom,2026-04-16
535330,22646,CERAMIC STRAWBERRY CAKE MONEY BANK,12,1.45,13534.0,United Kingdom,2026-04-16
