Invoice,StockCode,Description,Quantity,Price,Customer ID,Country,InvoiceDate
535078,22197,SMALL POPCORN HOLDER,200,0.72,16401.0,United Kingdom,2026-04-16
535078,22198,LARGE POPCORN HOLDER ,100,1.45,16401.0,United Kingdom,2026-04-16
535078,20728,LUNCH BAG CARS BLUE,10,1.65,16401.0,United Kingdom,2026-04-16
535078,22323,PINK POLKADOT KIDS BAG,15,1.95,16401.0,United Kingdom,2026-04-16
535079,22469,HEART OF WICKER SMALL,40,1.45,15661.0,United Kingdom,2026-04-16
535079,82578,KITCHEN METAL SIGN,24,0.55,15661.0,United Kingdom,2026-04-16
535079,82580,BATHROOM METAL SIGN,12,0.55,15661.0,United Kingdom,2026-04-16
535080,21523,DOORMAT FANCY FONT HOME SWEET HOME,6,7.95,13767.0,United Kingdom,2026-04-16
535080,21481,FAWN BLUE HOT WATER BOTTLE,12,2.95,13767.0,United Kingdom,2026-04-16
535080,21980,PACK OF 12 RED RETROSPOT TISSUES ,24,0.29,13767.0,United Kingdom,2026-04-16
535080,21986,PACK OF 12 PINK POLKADOT TISSUES,24,0.29,13767.0,United Kingdom,2026-04-16
535080,22866,HAND WARMER SCOTTY DOG DESIGN,96,1.85,13767.0,United Kingdom,2026-04-16
535080,22867,HAND WARMER BIRD DESIGN,96,1.85,13767.0,United Kingdom,2026-04-16
535080,22111,SCOTTIE DOG HOT WATER BOTTLE,6,4.95,13767.0,United Kingdom,2026-04-16
535080,22726,ALARM CLOCK BAKELIKE GREEN,8,3.75,13767.0,United Kingdom,2026-04-16
535080,22729,ALARM CLOCK BAKELIKE ORANGE,8,3.75,13767.0,United Kingdom,2026-04-16
535080,22727,ALARM CLOCK BAKELIKE RED ,8,3.75,13767.0,United Kingdom,2026-04-16
535080,22730,ALARM CLOCK BAKELIKE IVORY,8,3.75,13767.0,United Kingdom,2026-04-16
535080,84879,ASSORTED COLOUR BIRD ORNAMENT,32,1.69,13767.0,United Kingdom,2026-04-16
535080,72760B,VINTAGE CREAM 3 BASKET CAKE STAND,4,9.95,13767.0,United Kingdom,2026-04-16
535081,21258,VICTORIAN SEWING BOX LARGE,10,10.95,16233.0,United Kingdom,2026-04-16
535081,21257,VICTORIAN SEWING BOX MEDIUM,2,7.95,16233.0,United Kingdom,2026-04-16
535081,22586,FELTCRAFT HAIRBAND PINK AND BLUE,24,0.85,16233.0,United Kingdom,2026-04-16
535081,22150,3 STRIPEY MICE FELTCRAFT,40,1.65,16233.0,United Kingdom,2026-04-16
535082,22754,SMALL RED BABUSHKA NOTEBOOK ,12,0.85,16988.0,United Kingdom,2026-04-16
535082,22605,WOODEN CROQUET GARDEN SET,1,14.95,16988.0,United Kingdom,2026-04-16
535082,22607,WOODEN ROUNDERS GARDEN SET ,2,9.95,16988.0,United Kingdom,2026-04-16
535082,20727,LUNCH BAG  BLACK SKULL.,10,1.65,16988.0,United Kingdom,2026-04-16
535082,22693,GROW A FLYTRAP OR SUNFLOWER IN TIN,24,1.25,16988.0,United Kingdom,2026-04-16
535082,21735,TWO DOOR CURIO CABINET,2,12.75,16988.0,United Kingdom,2026-04-16
535082,22633,HAND WARMER UNION JACK,12,2.1,16988.0,United Kingdom,2026-04-16
535082,84978,HANGING HEART JAR T-LIGHT HOLDER,12,1.25,16988.0,United Kingdom,2026-04-16
535082,85099B,JUMBO BAG RED RETROSPOT,10,1.95,16988.0,United Kingdom,2026-04-16
535082,20725,LUNCH BAG RED RETROSPOT,10,1.65,16988.0,United Kingdom,2026-04-16
535082,22277,COSMETIC BAG VINTAGE ROSE PAISLEY,6,2.1,16988.0,United Kingdom,2026-04-16
535082,22632,HAND WARMER RED RETROSPOT,12,2.1,16988.0,United Kingdom,2026-04-16
535082,85066,CREAM SWEETHEART MINI CHEST,2,12.75,16988.0,United Kingdom,2026-04-16
535084,22244,3 HOOK HANGER MAGIC GARDEN,1,1.95,14796.0,United Kingdom,2026-04-16
535084,22212,FOUR HOOK  WHITE LOVEBIRDS,2,2.1,14796.0,United Kingdom,2026-04-16
535083,22839,"CAKE TIN, 3 TIER MINT/IVORY",3,14.95,14961.0,United Kingdom,2026-04-16
535083,22841,"CAKE TIN, ROUND, VINTAGE MINT,IVORY",2,7.95,14961.0,United Kingdom,2026-04-16
535083,22838,"CAKE TIN, 3 TIER RED/IVORY",3,14.95,14961.0,United Kingdom,2026-04-16
535084,84406B,CREAM CUPID HEARTS COAT HANGER,2,3.25,14796.0,United Kingdom,2026-04-16
535084,84792,ENCHANTED BIRD COATHANGER 5 HOOK,1,4.65,14796.0,United Kingdom,2026-04-16
535084,35933,PINK STOCKING CHRISTMAS DECORATION,12,0.38,14796.0,United Kingdom,2026-04-16
535084,21181,PLEASE ONE PERSON METAL SIGN,6,2.1,14796.0,United Kingdom,2026-04-16
535084,21174,POTTERING IN THE SHED METAL SIGN,2,1.95,14796.0,United Kingdom,2026-04-16
535084,21874,GIN AND TONIC MUG,2,1.25,14796.0,United Kingdom,2026-04-16
535083,22840,"CAKE TIN, ROUND, VINTAGE RED,CREAM",2,7.95,14961.0,United Kingdom,2026-04-16
535084,21870,I CAN ONLY PLEASE ONE PERSON MUG,4,1.25,14796.0,United Kingdom,2026-04-16
535084,47559B,TEA TIME OVEN GLOVE,3,1.25,14796.0,United Kingdom,2026-04-16
535084,37450,CERAMIC CAKE BOWL + HANGING CAKES,1,2.95,14796.0,United Kingdom,2026-04-16
535084,22659,LUNCH BOX I LOVE LONDON,2,1.95,14796.0,United Kingdom,2026-04-16
535084,22222,CAKE PLATE LOVEBIRD WHITE,1,4.95,14796.0,United Kingdom,2026-04-16
535084,22223,CAKE PLATE LOVEBIRD PINK,1,4.95,14796.0,United Kingdom,2026-04-16
535084,22752,SET 7 BABUSHKA NESTING BOXES,1,8.5,14796.0,United Kingdom,2026-04-16
535084,21169,YOU'RE CONFUSING ME METAL SIGN ,1,1.69,14796.0,United Kingdom,2026-04-16
535084,21231,SWEETHEART CERAMIC TRINKET BOX,12,1.25,14796.0,United Kingdom,2026-04-16
535084,22630,DOLLY GIRL LUNCH BOX,2,1.95,14796.0,United Kingdom,2026-04-16
535084,37446,MINI CAKE STAND WITH HANGING CAKES,7,1.45,14796.0,United Kingdom,2026-04-16
535084,22055,MINI CAKE STAND  HANGING STRAWBERY,2,1.65,14796.0,United Kingdom,2026-04-16
535084,22065,CHRISTMAS PUDDING TRINKET POT ,8,1.45,14796.0,United Kingdom,2026-04-16
535084,21232,STRAWBERRY CERAMIC TRINKET BOX,20,1.25,14796.0,United Kingdom,2026-04-16
535084,22063,CERAMIC BOWL WITH STRAWBERRY DESIGN,1,2.95,14796.0,United Kingdom,2026-04-16
535084,22412,METAL SIGN NEIGHBOURHOOD WITCH ,1,2.1,14796.0,United Kingdom,2026-04-16
535084,21212,PACK OF 72 RETROSPOT CAKE CASES,4,0.55,14796.0,United Kingdom,2026-04-16
535084,82567,"AIRLINE LOUNGE,METAL SIGN",1,2.1,14796.0,United Kingdom,2026-04-16
535084,22951,60 CAKE CASES DOLLY GIRL DESIGN,4,0.55,14796.0,United Kingdom,2026-04-16
535084,21976,PACK OF 60 MUSHROOM CAKE CASES,3,0.55,14796.0,United Kingdom,2026-04-16
535084,21213,PACK OF 72 SKULL CAKE CASES,2,0.55,14796.0,United Kingdom,2026-04-16
535084,21977,PACK OF 60 PINK PAISLEY CAKE CASES,6,0.55,14796.0,United Kingdom,2026-04-16
535084,84991,60 TEATIME FAIRY CAKE CASES,2,0.55,14796.0,United Kingdom,2026-04-16
535084,84992,72 SWEETHEART FAIRY CAKE CASES,4,0.55,14796.0,United Kingdom,2026-04-16
535084,21908,CHOCOLATE THIS WAY METAL SIGN,4,2.1,14796.0,United Kingdom,2026-04-16
535084,22294,HEART FILIGREE DOVE  SMALL,4,1.25,14796.0,United Kingdom,2026-04-16
535084,21809,CHRISTMAS HANGING TREE WITH BELL,5,1.25,14796.0,United Kingdom,2026-04-16
535084,21810,CHRISTMAS HANGING STAR WITH BELL,4,1.25,14796.0,United Kingdom,2026-04-16
535084,21823,PAINTED METAL HEART WITH HOLLY BELL,3,1.45,14796.0,United Kingdom,2026-04-16
535084,21824,PAINTED METAL STAR WITH HOLLY BELLS,3,1.45,14796.0,United Kingdom,2026-04-16
535084,22157,ANGEL DECORATION WITH LACE PADDED,4,0.85,14796.0,United Kingdom,2026-04-16
535084,22952,60 CAKE CASES VINTAGE CHRISTMAS,6,0.55,14796.0,United Kingdom,2026-04-16
535084,22576,SWALLOW WOODEN CHRISTMAS DECORATION,1,0.85,14796.0,United Kingdom,2026-04-16
535084,22155,STAR DECORATION RUSTIC,6,0.42,14796.0,United Kingdom,2026-04-16
535084,85152,HAND OVER THE CHOCOLATE   SIGN ,5,2.1,14796.0,United Kingdom,2026-04-16
535084,82582,AREA PATROLLED METAL SIGN,6,2.1,14796.0,United Kingdom,2026-04-16
535084,21165,BEWARE OF THE CAT METAL SIGN ,6,1.69,14796.0,United Kingdom,2026-04-16
535084,22603,CHRISTMAS RETROSPOT TREE WOOD,4,0.85,14796.0,United Kingdom,2026-04-16
535084,22601,CHRISTMAS RETROSPOT ANGEL WOOD,4,0.85,14796.0,United Kingdom,2026-04-16
535084,22573,STAR WOODEN CHRISTMAS DECORATION,2,0.85,14796.0,United Kingdom,2026-04-16
535084,22576,SWALLOW WOODEN CHRISTMAS DECORATION,4,0.85,14796.0,United Kingdom,2026-04-16
535084,22574,HEART WOODEN CHRISTMAS DECORATION,2,0.85,14796.0,United Kingdom,2026-04-16
535084,22572,ROCKING HORSE GREEN CHRISTMAS ,4,0.85,14796.0,United Kingdom,2026-04-16
535084,22571,ROCKING HORSE RED CHRISTMAS ,4,0.85,14796.0,United Kingdom,2026-04-16
535084,22579,WOODEN TREE CHRISTMAS SCANDINAVIAN,4,0.85,14796.0,United Kingdom,2026-04-16
535085,84006,MAGIC TREE -PAPER FLOWERS,12,0.85,12839.0,United Kingdom,2026-04-16
535085,21355,TOAST ITS - I LOVE YOU ,12,1.25,12839.0,United Kingdom,2026-04-16
535085,22189,CREAM HEART CARD HOLDER,20,3.95,12839.0,United Kingdom,2026-04-16
535085,22922,FRIDGE MAGNETS US DINER ASSORTED,24,0.85,12839.0,United Kingdom,2026-04-16
535085,21700,BIG DOUGHNUT FRIDGE MAGNETS,12,0.85,12839.0,United Kingdom,2026-04-16
535085,22220,CAKE STAND LOVEBIRD 2 TIER WHITE,2,9.95,12839.0,United Kingdom,2026-04-16
535085,21497,FANCY FONTS BIRTHDAY WRAP,25,0.42,12839.0,United Kingdom,2026-04-16
535085,21071,VINTAGE BILLBOARD DRINK ME MUG,12,1.25,12839.0,United Kingdom,2026-04-16
535085,22753,SMALL YELLOW BABUSHKA NOTEBOOK ,24,0.85,12839.0,United Kingdom,2026-04-16
535085,22755,SMALL PURPLE BABUSHKA NOTEBOOK ,24,0.85,12839.0,United Kingdom,2026-04-16
535085,84535B,FAIRY CAKES NOTEBOOK A6 SIZE,16,0.65,12839.0,United Kingdom,2026-04-16
535085,22398,MAGNETS PACK OF 4 SWALLOWS,12,1.25,12839.0,United Kingdom,2026-04-16
535085,22064,PINK DOUGHNUT TRINKET POT ,24,1.65,12839.0,United Kingdom,2026-04-16
535085,21481,FAWN BLUE HOT WATER BOTTLE,12,2.95,12839.0,United Kingdom,2026-04-16
535085,21231,SWEETHEART CERAMIC TRINKET BOX,12,1.25,12839.0,United Kingdom,2026-04-16
535085,21232,STRAWBERRY CERAMIC TRINKET BOX,24,1.25,12839.0,United Kingdom,2026-04-16
535085,20713,JUMBO BAG OWLS,10,1.95,12839.0,United Kingdom,2026-04-16
535085,21931,JUMBO STORAGE BAG SUKI,10,1.95,12839.0,United Kingdom,2026-04-16
535085,22111,SCOTTIE DOG HOT WATER BOTTLE,6,4.95,12839.0,United Kingdom,2026-04-16
535085,21069,VINTAGE BILLBOARD TEA MUG,12,1.25,12839.0,United Kingdom,2026-04-16
535085,85099C,JUMBO  BAG BAROQUE BLACK WHITE,10,1.95,12839.0,United Kingdom,2026-04-16
535085,22181,SNOWSTORM PHOTO FRAME FRIDGE MAGNET,12,0.85,12839.0,United Kingdom,2026-04-16
535085,82482,WOODEN PICTURE FRAME WHITE FINISH,12,2.55,12839.0,United Kingdom,2026-04-16
535085,21877,HOME SWEET HOME MUG,12,1.25,12839.0,United Kingdom,2026-04-16
535085,22059,CERAMIC STRAWBERRY DESIGN MUG,12,1.49,12839.0,United Kingdom,2026-04-16
535085,22969,HOMEMADE JAM SCENTED CANDLES,24,1.45,12839.0,United Kingdom,2026-04-16
535085,21871,SAVE THE PLANET MUG,12,1.25,12839.0,United Kingdom,2026-04-16
535086,21213,PACK OF 72 SKULL CAKE CASES,240,0.42,14560.0,United Kingdom,2026-04-16
C535087,22699,ROSES REGENCY TEACUP AND SAUCER ,-2,2.95,15730.0,United Kingdom,2026-04-16
535086,21217,RED RETROSPOT ROUND CAKE TINS,3,9.95,14560.0,United Kingdom,2026-04-16
535088,84836,ZINC METAL HEART DECORATION,12,1.25,17167.0,United Kingdom,2026-04-16
535088,22644,CERAMIC CHERRY CAKE MONEY BANK,12,1.45,17167.0,United Kingdom,2026-04-16
535088,48185,DOORMAT FAIRY CAKE,2,7.95,17167.0,United Kingdom,2026-04-16
535088,22646,CERAMIC STRAWBERRY CAKE MONEY BANK,12,1.45,17167.0,United Kingdom,2026-04-16
535088,22645,CERAMIC HEART FAIRY CAKE MONEY BANK,12,1.45,17167.0,United Kingdom,2026-04-16
535088,21232,STRAWBERRY CERAMIC TRINKET BOX,12,1.25,17167.0,United Kingdom,2026-04-16
535088,21231,SWEETHEART CERAMIC TRINKET BOX,12,1.25,17167.0,United Kingdom,2026-04-16
535088,22296,HEART IVORY TRELLIS LARGE,12,1.65,17167.0,United Kingdom,2026-04-16
535088,22851,SET 20 NAPKINS FAIRY CAKES DESIGN ,12,0.85,17167.0,United Kingdom,2026-04-16
535088,21361,LOVE LARGE WOOD LETTERS ,1,12.75,17167.0,United Kingdom,2026-04-16
535088,22497,SET OF 2 TINS VINTAGE BATHROOM ,4,4.25,17167.0,United Kingdom,2026-04-16
535088,21135,VICTORIAN  METAL POSTCARD SPRING,8,1.69,17167.0,United Kingdom,2026-04-16
535088,79321,CHILLI LIGHTS,4,4.95,17167.0,United Kingdom,2026-04-16
535088,22413,METAL SIGN TAKE IT OR LEAVE IT ,6,2.95,17167.0,United Kingdom,2026-04-16
535088,21174,POTTERING IN THE SHED METAL SIGN,12,1.95,17167.0,United Kingdom,2026-04-16
535088,22423,REGENCY CAKESTAND 3 TIER,3,12.75,17167.0,United Kingdom,2026-04-16
535088,21363,HOME SMALL WOOD LETTERS,3,4.95,17167.0,United Kingdom,2026-04-16
535089,22469,HEART OF WICKER SMALL,40,1.45,13089.0,United Kingdom,2026-04-16
535089,84029E,RED WOOLLY HOTTIE WHITE HEART.,12,3.75,13089.0,United Kingdom,2026-04-16
535089,35961,FOLKART ZINC HEART CHRISTMAS DEC,60,0.85,13089.0,United Kingdom,2026-04-16
535089,21683,MEDIUM MEDINA STAMPED METAL BOWL ,6,2.95,13089.0,United Kingdom,2026-04-16
535089,21681,GIANT MEDINA STAMPED METAL BOWL ,2,9.95,13089.0,United Kingdom,2026-04-16
535089,22837,HOT WATER BOTTLE BABUSHKA ,12,4.65,13089.0,United Kingdom,2026-04-16
535089,21485,RETROSPOT HEART HOT WATER BOTTLE,12,4.95,13089.0,United Kingdom,2026-04-16
535089,21484,CHICK GREY HOT WATER BOTTLE,12,3.45,13089.0,United Kingdom,2026-04-16
535089,22178,VICTORIAN GLASS HANGING T-LIGHT,24,1.25,13089.0,United Kingdom,2026-04-16
535089,84946,ANTIQUE SILVER TEA GLASS ETCHED,36,1.25,13089.0,United Kingdom,2026-04-16
535089,84947,ANTIQUE SILVER TEA GLASS ENGRAVED,24,1.25,13089.0,United Kingdom,2026-04-16
535089,22457,NATURAL SLATE HEART CHALKBOARD ,48,2.55,13089.0,United Kingdom,2026-04-16
535090,21116,OWL DOORSTOP,3,4.95,13958.0,United Kingdom,2026-04-16
535090,21527,RED RETROSPOT TRADITIONAL TEAPOT ,2,7.95,13958.0,United Kingdom,2026-04-16
535090,22423,REGENCY CAKESTAND 3 TIER,3,12.75,13958.0,United Kingdom,2026-04-16
535090,22283,6 EGG HOUSE PAINTED WOOD,2,7.95,13958.0,United Kingdom,2026-04-16
535090,22137,BATHROOM SET LOVE HEART DESIGN,6,2.95,13958.0,United Kingdom,2026-04-16
535090,22135,LADLE LOVE HEART PINK,12,0.42,13958.0,United Kingdom,2026-04-16
535090,22132,RED LOVE HEART SHAPE CUP,12,0.85,13958.0,United Kingdom,2026-04-16
535090,22133,PINK LOVE HEART SHAPE CUP,12,0.85,13958.0,United Kingdom,2026-04-16
535090,21777,RECIPE BOX WITH METAL HEART,2,7.95,13958.0,United Kingdom,2026-04-16
535090,22421,LIPSTICK PEN FUSCHIA,12,0.42,13958.0,United Kingdom,2026-04-16
535090,22169,FAMILY ALBUM WHITE PICTURE FRAME,2,8.5,13958.0,United Kingdom,2026-04-16
535090,82494L,WOODEN FRAME ANTIQUE WHITE ,6,2.95,13958.0,United Kingdom,2026-04-16
535090,82482,WOODEN PICTURE FRAME WHITE FINISH,6,2.55,13958.0,United Kingdom,2026-04-16
535090,22120,WELCOME  WOODEN BLOCK LETTERS,3,9.95,13958.0,United Kingdom,2026-04-16
535090,21755,LOVE BUILDING BLOCK WORD,6,5.95,13958.0,United Kingdom,2026-04-16
535090,21754,HOME BUILDING BLOCK WORD,3,5.95,13958.0,United Kingdom,2026-04-16
535090,85066,CREAM SWEETHEART MINI CHEST,2,12.75,13958.0,United Kingdom,2026-04-16
535090,22419,LIPSTICK PEN RED,12,0.42,13958.0,United Kingdom,2026-04-16
535090,22509,SEWING BOX RETROSPOT DESIGN ,2,16.95,13958.0,United Kingdom,2026-04-16
535090,21784,SHOE SHINE BOX ,2,9.95,13958.0,United Kingdom,2026-04-16
535090,21586,KINGS CHOICE GIANT TUBE MATCHES,12,2.55,13958.0,United Kingdom,2026-04-16
535090,21258,VICTORIAN SEWING BOX LARGE,1,12.75,13958.0,United Kingdom,2026-04-16
535090,22318,FIVE HEART HANGING DECORATION,6,2.95,13958.0,United Kingdom,2026-04-16
535090,37448,CERAMIC CAKE DESIGN SPOTTED MUG,12,1.49,13958.0,United Kingdom,2026-04-16
535090,22354,RETROSPOT PADDED SEAT CUSHION,5,3.75,13958.0,United Kingdom,2026-04-16
535090,72799E,IVORY PILLAR CANDLE SILVER FLOCK,6,2.95,13958.0,United Kingdom,2026-04-16
535090,21914,BLUE HARMONICA IN BOX ,24,1.25,13958.0,United Kingdom,2026-04-16
535090,21915,RED  HARMONICA IN BOX ,24,1.25,13958.0,United Kingdom,2026-04-16
535090,51014A,"FEATHER PEN,HOT PINK",12,0.85,13958.0,United Kingdom,2026-04-16
535090,16161U,WRAP SUKI AND FRIENDS,25,0.42,13958.0,United Kingdom,2026-04-16
535090,16156S,WRAP PINK FAIRY CAKES ,25,0.42,13958.0,United Kingdom,2026-04-16
535090,21981,PACK OF 12 WOODLAND TISSUES ,48,0.29,13958.0,United Kingdom,2026-04-16
535090,51014C,"FEATHER PEN,COAL BLACK",12,0.85,13958.0,United Kingdom,2026-04-16
535090,21257,VICTORIAN SEWING BOX MEDIUM,2,7.95,13958.0,United Kingdom,2026-04-16
535090,21259,VICTORIAN SEWING BOX SMALL ,2,5.95,13958.0,United Kingdom,2026-04-16
535090,20828,GLITTER BUTTERFLY CLIPS,12,2.55,13958.0,United Kingdom,2026-04-16
535090,15036,ASSORTED COLOURS SILK FAN,12,0.75,13958.0,United Kingdom,2026-04-16
535090,15039,SANDALWOOD FAN,10,0.85,13958.0,United Kingdom,2026-04-16
535090,22451,SILK PURSE BABUSHKA RED,6,3.35,13958.0,United Kingdom,2026-04-16
535090,22647,CERAMIC LOVE HEART MONEY BANK,12,1.45,13958.0,United Kingdom,2026-04-16
535090,22276,WASH BAG VINTAGE ROSE PAISLEY,6,2.55,13958.0,United Kingdom,2026-04-16
535090,22649,STRAWBERRY FAIRY CAKE TEAPOT,8,4.95,13958.0,United Kingdom,2026-04-16
535092,21578,WOODLAND DESIGN  COTTON TOTE BAG,6,2.25,13987.0,United Kingdom,2026-04-16
535092,84997B,RED 3 PIECE RETROSPOT CUTLERY SET,6,3.75,13987.0,United Kingdom,2026-04-16
535092,20665,RED RETROSPOT PURSE ,6,2.95,13987.0,United Kingdom,2026-04-16
535092,22276,WASH BAG VINTAGE ROSE PAISLEY,6,2.55,13987.0,United Kingdom,2026-04-16
535092,20866,BLUE ROSE FABRIC MIRROR,12,1.25,13987.0,United Kingdom,2026-04-16
535092,22356,CHARLOTTE BAG PINK POLKADOT,10,0.85,13987.0,United Kingdom,2026-04-16
535092,20718,RED RETROSPOT SHOPPER BAG,10,1.25,13987.0,United Kingdom,2026-04-16
535092,20724,RED RETROSPOT CHARLOTTE BAG,10,0.85,13987.0,United Kingdom,2026-04-16
535092,21533,RETROSPOT LARGE MILK JUG,3,4.95,13987.0,United Kingdom,2026-04-16
535092,85099B,JUMBO BAG RED RETROSPOT,10,1.95,13987.0,United Kingdom,2026-04-16
535092,21284,RETROSPOT CANDLE  SMALL,12,1.69,13987.0,United Kingdom,2026-04-16
535091,22151,PLACE SETTING WHITE HEART,24,0.42,14304.0,United Kingdom,2026-04-16
535092,84997C,BLUE 3 PIECE POLKADOT CUTLERY SET,6,3.75,13987.0,United Kingdom,2026-04-16
535092,22278,OVERNIGHT BAG VINTAGE ROSE PAISLEY,3,4.95,13987.0,United Kingdom,2026-04-16
535092,84946,ANTIQUE SILVER TEA GLASS ETCHED,12,1.25,13987.0,United Kingdom,2026-04-16
535092,84970S,HANGING HEART ZINC T-LIGHT HOLDER,12,0.85,13987.0,United Kingdom,2026-04-16
535092,22759,SET OF 3 NOTEBOOKS IN PARCEL,12,1.65,13987.0,United Kingdom,2026-04-16
535091,21591,COSY HOUR CIGAR BOX MATCHES ,24,1.25,14304.0,United Kingdom,2026-04-16
535091,85045,GREEN CHRISTMAS TREE STRING 20LIGHT,4,4.95,14304.0,United Kingdom,2026-04-16
535091,22600,CHRISTMAS RETROSPOT STAR WOOD,12,0.85,14304.0,United Kingdom,2026-04-16
535091,22155,STAR DECORATION RUSTIC,48,0.42,14304.0,United Kingdom,2026-04-16
535091,22158,3 HEARTS HANGING DECORATION RUSTIC,16,2.95,14304.0,United Kingdom,2026-04-16
535092,21577,SAVE THE PLANET COTTON TOTE BAG,6,2.25,13987.0,United Kingdom,2026-04-16
535092,21039,RED RETROSPOT SHOPPING BAG,6,2.55,13987.0,United Kingdom,2026-04-16
535092,22277,COSMETIC BAG VINTAGE ROSE PAISLEY,6,2.1,13987.0,United Kingdom,2026-04-16
535091,22603,CHRISTMAS RETROSPOT TREE WOOD,12,0.85,14304.0,United Kingdom,2026-04-16
535091,22077,6 RIBBONS RUSTIC CHARM,12,1.65,14304.0,United Kingdom,2026-04-16
535091,21744,SNOWFLAKE PORTABLE TABLE LIGHT ,6,2.95,14304.0,United Kingdom,2026-04-16
535091,21743,STAR PORTABLE TABLE LIGHT ,6,2.95,14304.0,United Kingdom,2026-04-16
535091,22311,OFFICE MUG WARMER BLACK+SILVER ,6,2.95,14304.0,United Kingdom,2026-04-16
535092,21429,RED GINGHAM ROSE JEWELLERY BOX,8,1.65,13987.0,United Kingdom,2026-04-16
535091,22087,PAPER BUNTING WHITE LACE,12,2.95,14304.0,United Kingdom,2026-04-16
535091,22211,WOOD STAMP SET FLOWERS,12,1.65,14304.0,United Kingdom,2026-04-16
535091,22617,BAKING SET SPACEBOY DESIGN,3,4.95,14304.0,United Kingdom,2026-04-16
535091,21883,STARS GIFT TAPE ,12,0.65,14304.0,United Kingdom,2026-04-16
535091,22570,FELTCRAFT CUSHION RABBIT,4,3.75,14304.0,United Kingdom,2026-04-16
535091,22585,PACK OF 6 BIRDY GIFT TAGS,12,1.25,14304.0,United Kingdom,2026-04-16
535091,22743,MAKE YOUR OWN FLOWERPOWER CARD KIT,6,2.95,14304.0,United Kingdom,2026-04-16
535091,22744,MAKE YOUR OWN MONSOON CARD KIT,6,2.95,14304.0,United Kingdom,2026-04-16
535091,22568,FELTCRAFT CUSHION OWL,4,3.75,14304.0,United Kingdom,2026-04-16
535091,85049G,CHOCOLATE BOX RIBBONS ,12,1.25,14304.0,United Kingdom,2026-04-16
535091,22335,HEART DECORATION PAINTED ZINC ,24,0.65,14304.0,United Kingdom,2026-04-16
535091,21915,RED  HARMONICA IN BOX ,12,1.25,14304.0,United Kingdom,2026-04-16
535091,84029E,RED WOOLLY HOTTIE WHITE HEART.,4,3.75,14304.0,United Kingdom,2026-04-16
535091,22189,CREAM HEART CARD HOLDER,4,3.95,14304.0,United Kingdom,2026-04-16
535091,22607,WOODEN ROUNDERS GARDEN SET ,2,9.95,14304.0,United Kingdom,2026-04-16
535091,22188,BLACK HEART CARD HOLDER,8,3.95,14304.0,United Kingdom,2026-04-16
535091,22366,DOORMAT AIRMAIL ,4,7.95,14304.0,United Kingdom,2026-04-16
535091,22690,DOORMAT HOME SWEET HOME BLUE ,4,7.95,14304.0,United Kingdom,2026-04-16
535091,22692,DOORMAT WELCOME TO OUR HOME,4,7.95,14304.0,United Kingdom,2026-04-16
535091,22195,LARGE HEART MEASURING SPOONS,12,1.65,14304.0,United Kingdom,2026-04-16
535091,20685,DOORMAT RED RETROSPOT,6,7.95,14304.0,United Kingdom,2026-04-16
C535093,82486,WOOD S/3 CABINET ANT WHITE FINISH,-1,6.95,15291.0,United Kingdom,2026-04-16
C535093,22797,CHEST OF DRAWERS GINGHAM HEART ,-2,16.95,15291.0,United Kingdom,2026-04-16
535094,20969,RED FLORAL FELTCRAFT SHOULDER BAG,4,3.75,16086.0,United Kingdom,2026-04-16
535094,22580,ADVENT CALENDAR GINGHAM SACK,3,5.95,16086.0,United Kingdom,2026-04-16
535094,21833,CAMOUFLAGE LED TORCH,12,1.69,16086.0,United Kingdom,2026-04-16
535094,11001,ASSTD DESIGN RACING CAR PEN,16,1.69,16086.0,United Kingdom,2026-04-16
535094,20972,PINK CREAM FELT CRAFT TRINKET BOX ,24,1.25,16086.0,United Kingdom,2026-04-16
535094,20967,GREY FLORAL FELTCRAFT SHOULDER BAG,4,3.75,16086.0,United Kingdom,2026-04-16
535094,20983,12 PENCILS TALL TUBE RED RETROSPOT,12,0.85,16086.0,United Kingdom,2026-04-16
535094,22385,JUMBO BAG SPACEBOY DESIGN,10,1.95,16086.0,United Kingdom,2026-04-16
535094,85099F,JUMBO BAG STRAWBERRY,20,1.95,16086.0,United Kingdom,2026-04-16
535094,85099B,JUMBO BAG RED RETROSPOT,20,1.95,16086.0,United Kingdom,2026-04-16
535094,21929,JUMBO BAG PINK VINTAGE PAISLEY,10,1.95,16086.0,United Kingdom,2026-04-16
535094,21930,JUMBO STORAGE BAG SKULLS,10,1.95,16086.0,United Kingdom,2026-04-16
535094,21638,ASSORTED TUTTI FRUTTI NOTEBOOK,12,2.1,16086.0,United Kingdom,2026-04-16
535095,21495,SKULLS AND CROSSBONES WRAP,200,0.34,15287.0,United Kingdom,2026-04-16
535095,22100,SKULLS SQUARE TISSUE BOX,12,1.25,15287.0,United Kingdom,2026-04-16
535095,22650,CERAMIC PIRATE CHEST MONEY BANK,12,1.45,15287.0,United Kingdom,2026-04-16
535095,84086C,PINK/PURPLE RETRO RADIO,6,2.95,15287.0,United Kingdom,2026-04-16
535095,21498,RED RETROSPOT WRAP ,200,0.34,15287.0,United Kingdom,2026-04-16
535096,84029G,KNITTED UNION FLAG HOT WATER BOTTLE,8,3.75,15728.0,United Kingdom,2026-04-16
535096,22112,CHOCOLATE HOT WATER BOTTLE,24,4.25,15728.0,United Kingdom,2026-04-16
535096,21479,WHITE SKULL HOT WATER BOTTLE ,4,3.75,15728.0,United Kingdom,2026-04-16
535096,22114,HOT WATER BOTTLE TEA AND SYMPATHY,24,3.45,15728.0,United Kingdom,2026-04-16
535096,22837,HOT WATER BOTTLE BABUSHKA ,8,4.65,15728.0,United Kingdom,2026-04-16
535096,21486,PINK HEART DOTS HOT WATER BOTTLE,8,3.75,15728.0,United Kingdom,2026-04-16
535097,22792,FLUTED ANTIQUE CANDLE HOLDER,12,0.85,16293.0,United Kingdom,2026-04-16
535097,22548,HEADS AND TAILS SPORTING FUN,12,1.25,16293.0,United Kingdom,2026-04-16
535097,84836,ZINC METAL HEART DECORATION,12,1.25,16293.0,United Kingdom,2026-04-16
535097,21326,AGED GLASS SILVER T-LIGHT HOLDER,12,0.65,16293.0,United Kingdom,2026-04-16
535097,84946,ANTIQUE SILVER TEA GLASS ETCHED,12,1.25,16293.0,United Kingdom,2026-04-16
535097,84945,MULTI COLOUR SILVER T-LIGHT HOLDER,12,0.85,16293.0,United Kingdom,2026-04-16
535097,21892,TRADITIONAL WOODEN CATCH CUP GAME ,12,1.25,16293.0,United Kingdom,2026-04-16
535097,21733,RED HANGING HEART T-LIGHT HOLDER,6,2.95,16293.0,United Kingdom,2026-04-16
535097,21098,CHRISTMAS TOILET ROLL,12,1.25,16293.0,United Kingdom,2026-04-16
535097,22867,HAND WARMER BIRD DESIGN,12,2.1,16293.0,United Kingdom,2026-04-16
535097,22633,HAND WARMER UNION JACK,12,2.1,16293.0,United Kingdom,2026-04-16
535097,22865,HAND WARMER OWL DESIGN,12,2.1,16293.0,United Kingdom,2026-04-16
535097,22632,HAND WARMER RED RETROSPOT,12,2.1,16293.0,United Kingdom,2026-04-16
535097,22791,T-LIGHT GLASS FLUTED ANTIQUE,12,1.25,16293.0,United Kingdom,2026-04-16
535097,22120,WELCOME  WOODEN BLOCK LETTERS,3,9.95,16293.0,United Kingdom,2026-04-16
535097,22866,HAND WARMER SCOTTY DOG DESIGN,12,2.1,16293.0,United Kingdom,2026-04-16
535097,21754,HOME BUILDING BLOCK WORD,3,5.95,16293.0,United Kingdom,2026-04-16
535097,21755,LOVE BUILDING BLOCK WORD,3,5.95,16293.0,United Kingdom,2026-04-16
535097,22486,PLASMATRONIC LAMP,1,12.75,16293.0,United Kingdom,2026-04-16
535097,22740,POLKADOT PEN,48,0.85,16293.0,United Kingdom,2026-04-16
535097,22418,10 COLOUR SPACEBOY PEN,24,0.85,16293.0,United Kingdom,2026-04-16
535097,21485,RETROSPOT HEART HOT WATER BOTTLE,3,4.95,16293.0,United Kingdom,2026-04-16
535097,21484,CHICK GREY HOT WATER BOTTLE,4,3.45,16293.0,United Kingdom,2026-04-16
535097,21479,WHITE SKULL HOT WATER BOTTLE ,4,3.75,16293.0,United Kingdom,2026-04-16
535097,21172,PARTY METAL SIGN ,12,1.45,16293.0,United Kingdom,2026-04-16
535097,22178,VICTORIAN GLASS HANGING T-LIGHT,12,1.25,16293.0,United Kingdom,2026-04-16
535097,85123A,WHITE HANGING HEART T-LIGHT HOLDER,6,2.95,16293.0,United Kingdom,2026-04-16
535097,22969,HOMEMADE JAM SCENTED CANDLES,12,1.45,16293.0,United Kingdom,2026-04-16
535097,22846,BREAD BIN DINER STYLE RED ,1,16.95,16293.0,United Kingdom,2026-04-16
535097,84879,ASSORTED COLOUR BIRD ORNAMENT,8,1.69,16293.0,United Kingdom,2026-04-16
535097,21481,FAWN BLUE HOT WATER BOTTLE,6,2.95,16293.0,United Kingdom,2026-04-16
C535098,22197,SMALL POPCORN HOLDER,-1,0.85,14655.0,United Kingdom,2026-04-16
535100,22113,GREY HEART HOT WATER BOTTLE,4,3.75,14540.0,United Kingdom,2026-04-16
535100,22862,LOVE HEART NAPKIN BOX ,4,4.25,14540.0,United Kingdom,2026-04-16
535100,21814,HEART T-LIGHT HOLDER ,12,1.45,14540.0,United Kingdom,2026-04-16
535100,84347,ROTATING SILVER ANGELS T-LIGHT HLDR,48,2.55,14540.0,United Kingdom,2026-04-16
535100,22423,REGENCY CAKESTAND 3 TIER,1,12.75,14540.0,United Kingdom,2026-04-16
535100,21756,BATH BUILDING BLOCK WORD,3,5.95,14540.0,United Kingdom,2026-04-16
535100,22791,T-LIGHT GLASS FLUTED ANTIQUE,12,1.25,14540.0,United Kingdom,2026-04-16
