Invoice,StockCode,Description,Quantity,Price,Customer ID,Country,InvoiceDate
518392,22188,BLACK HEART CARD HOLDER,36,3.39,14299.0,United Kingdom,2026-01-13
518392,21519,GIN & TONIC DIET GREETING CARD ,12,0.42,14299.0,United Kingdom,2026-01-13
518392,21843,RED RETROSPOT CAKE STAND,24,9.95,14299.0,United Kingdom,2026-01-13
518392,22423,REGENCY CAKESTAND 3 TIER,16,10.95,14299.0,United Kingdom,2026-01-13
518392,21172,PARTY METAL SIGN ,12,1.45,14299.0,United Kingdom,2026-01-13
518392,84782C,GREEN 3 TIER GLASS PLATE STAND,1,12.75,14299.0,United Kingdom,2026-01-13
518392,21355,TOAST ITS - I LOVE YOU ,12,1.25,14299.0,United Kingdom,2026-01-13
518392,84992,72 SWEETHEART FAIRY CAKE CASES,120,0.42,14299.0,United Kingdom,2026-01-13
518392,84991,60 TEATIME FAIRY CAKE CASES,120,0.42,14299.0,United Kingdom,2026-01-13
518392,22196,SMALL HEART MEASURING SPOONS,12,0.85,14299.0,United Kingdom,2026-01-13
518392,22189,CREAM HEART CARD HOLDER,36,3.39,14299.0,United Kingdom,2026-01-13
518392,21164,HOME SWEET HOME METAL SIGN ,12,2.95,14299.0,United Kingdom,2026-01-13
518393,37447,CERAMIC CAKE DESIGN SPOTTED PLATE,8,1.49,17085.0,United Kingdom,2026-01-13
518393,22057,CERAMIC PLATE STRAWBERRY DESIGN,4,1.49,17085.0,United Kingdom,2026-01-13
518393,22646,CERAMIC STRAWBERRY CAKE MONEY BANK,4,1.45,17085.0,United Kingdom,2026-01-13
518393,37450,CERAMIC CAKE BOWL + HANGING CAKES,4,2.95,17085.0,United Kingdom,2026-01-13
518393,22058,CERAMIC LOVE HEARTS DESIGN MUG,4,1.49,17085.0,United Kingdom,2026-01-13
518393,37448,CERAMIC CAKE DESIGN SPOTTED MUG,4,1.49,17085.0,United Kingdom,2026-01-13
518393,22064,PINK DOUGHNUT TRINKET POT ,4,1.65,17085.0,United Kingdom,2026-01-13
518393,22059,CERAMIC STRWBERRY DESIGN MUG,4,1.49,17085.0,United Kingdom,2026-01-13
518393,21733,RED HANGING HEART T-LIGHT HOLDER,2,2.95,17085.0,United Kingdom,2026-01-13
518393,21232,STRAWBERRY CERAMIC TRINKET BOX,10,1.25,17085.0,United Kingdom,2026-01-13
518393,22662,LUNCH BAG DOLLY GIRL DESIGN,2,1.65,17085.0,United Kingdom,2026-01-13
518393,22063,CERAMIC BOWL WITH STRAWBERRY DESIGN,3,2.95,17085.0,United Kingdom,2026-01-13
518393,22384,LUNCH BAG PINK RETROSPOT,2,1.65,17085.0,United Kingdom,2026-01-13
518393,22382,LUNCH BAG SPACEBOY DESIGN ,2,1.65,17085.0,United Kingdom,2026-01-13
518393,20728,LUNCH BAG CARS BLUE,2,1.65,17085.0,United Kingdom,2026-01-13
518393,20725,LUNCH BAG RED SPOTTY,4,1.65,17085.0,United Kingdom,2026-01-13
518393,22383,LUNCH BAG SUKI  DESIGN ,2,1.65,17085.0,United Kingdom,2026-01-13
518393,10002,INFLATABLE POLITICAL GLOBE ,6,0.85,17085.0,United Kingdom,2026-01-13
518393,72741,GRAND CHOCOLATECANDLE,9,1.45,17085.0,United Kingdom,2026-01-13
518393,22470,HEART OF WICKER LARGE,4,2.95,17085.0,United Kingdom,2026-01-13
518393,22109,FULL ENGLISH BREAKFAST PLATE,4,3.75,17085.0,United Kingdom,2026-01-13
518393,15044B,BLUE PAPER PARASOL ,1,2.95,17085.0,United Kingdom,2026-01-13
518393,20726,LUNCH BAG WOODLAND,2,1.65,17085.0,United Kingdom,2026-01-13
518394,22545,MINI JIGSAW BUNNIES,1,0.42,14606.0,United Kingdom,2026-01-13
518394,22212,FOUR HOOK  WHITE LOVEBIRDS,1,2.1,14606.0,United Kingdom,2026-01-13
518394,21651,HANGING GLASS ETCHED TEALIGHT,1,1.65,14606.0,United Kingdom,2026-01-13
518394,84971S,SMALL HEART FLOWERS HOOK ,1,0.85,14606.0,United Kingdom,2026-01-13
518394,21172,PARTY METAL SIGN ,1,1.45,14606.0,United Kingdom,2026-01-13
518394,21534,DAIRY MAID LARGE MILK JUG,1,4.95,14606.0,United Kingdom,2026-01-13
518394,21527,RED RETROSPOT TRADITIONAL TEAPOT ,1,7.95,14606.0,United Kingdom,2026-01-13
518394,21278,VINTAGE KITCHEN PRINT PUDDINGS,1,2.55,14606.0,United Kingdom,2026-01-13
518394,22546,MINI JIGSAW PURDEY,1,0.42,14606.0,United Kingdom,2026-01-13
518394,21931,JUMBO STORAGE BAG SUKI,2,1.95,14606.0,United Kingdom,2026-01-13
518394,22320,BIRDS MOBILE VINTAGE DESIGN,2,5.95,14606.0,United Kingdom,2026-01-13
518394,85014A,BLACK/BLUE DOTS RUFFLED UMBRELLA,1,5.95,14606.0,United Kingdom,2026-01-13
518394,84347,ROTATING SILVER ANGELS T-LIGHT HLDR,1,2.55,14606.0,United Kingdom,2026-01-13
518394,22227,"DECORATION, HANGING HEART+MIRROR ",4,0.65,14606.0,United Kingdom,2026-01-13
518394,37450,CERAMIC CAKE BOWL + HANGING CAKES,1,2.95,14606.0,United Kingdom,2026-01-13
518394,37448,CERAMIC CAKE DESIGN SPOTTED MUG,2,1.49,14606.0,United Kingdom,2026-01-13
518394,21563,RED HEART SHAPE LOVE BUCKET ,1,2.95,14606.0,United Kingdom,2026-01-13
518394,21564,PINK  HEART SHAPE LOVE BUCKET ,1,2.95,14606.0,United Kingdom,2026-01-13
518394,22207,FRYING PAN UNION FLAG,4,4.25,14606.0,United Kingdom,2026-01-13
518394,21875,KINGS CHOICE MUG,1,1.25,14606.0,United Kingdom,2026-01-13
518394,21656,RIDGED GLASS POSY VASE ,2,1.45,14606.0,United Kingdom,2026-01-13
518394,84050,PINK HEART SHAPE EGG FRYING PAN,1,1.65,14606.0,United Kingdom,2026-01-13
518394,22220,CAKE STAND LOVEBIRD 2 TIER WHITE,1,9.95,14606.0,United Kingdom,2026-01-13
518394,21700,BIG DOUGHNUT FRIDGE MAGNETS,6,0.85,14606.0,United Kingdom,2026-01-13
518394,22107,PIZZA PLATE IN BOX,4,3.75,14606.0,United Kingdom,2026-01-13
518394,22402,MAGNETS PACK OF 4 VINTAGE COLLAGE,1,1.25,14606.0,United Kingdom,2026-01-13
518394,85217,ASSORTED ICE CREAM FRIDGE MAGNETS,6,0.65,14606.0,United Kingdom,2026-01-13
518394,22478,BIRDHOUSE GARDEN MARKER ,2,1.25,14606.0,United Kingdom,2026-01-13
518394,35965,FOLKART HEART NAPKIN RINGS,1,2.95,14606.0,United Kingdom,2026-01-13
518394,21190,PINK HEARTS PAPER GARLAND,2,1.65,14606.0,United Kingdom,2026-01-13
518394,21870,I CAN ONLY PLEASE ONE PERSON MUG,1,1.25,14606.0,United Kingdom,2026-01-13
518394,37343,SPOTS DESIGN MUG W PINK INSIDE,2,1.65,14606.0,United Kingdom,2026-01-13
518394,22283,6 EGG HOUSE PAINTED WOOD,1,7.95,14606.0,United Kingdom,2026-01-13
518394,20718,RED SPOTTY SHOPPER BAG,1,1.25,14606.0,United Kingdom,2026-01-13
518394,22068,BLACK PIRATE TREASURE CHEST,1,1.65,14606.0,United Kingdom,2026-01-13
518394,22445,PENCIL CASE LIFE IS BEAUTIFUL,1,2.95,14606.0,United Kingdom,2026-01-13
518394,85039C,S/4 BLACK MINI ROSE CANDLE IN BOWL,1,1.65,14606.0,United Kingdom,2026-01-13
518394,22528,GARDENERS KNEELING PAD,1,1.25,14606.0,United Kingdom,2026-01-13
518394,22218,CAKE STAND LACE WHITE,1,4.25,14606.0,United Kingdom,2026-01-13
518394,85114C,RED ENCHANTED FOREST PLACEMAT,6,1.65,14606.0,United Kingdom,2026-01-13
518394,21080,SET/20 RED SPOTTY PAPER NAPKINS ,1,0.85,14606.0,United Kingdom,2026-01-13
518394,20961,STRAWBERRY BATH SPONGE ,1,1.25,14606.0,United Kingdom,2026-01-13
518394,22173,METAL 4 HOOK HANGER FRENCH CHATEAU,1,2.95,14606.0,United Kingdom,2026-01-13
518394,21114,LAVENDER SCENTED FABRIC HEART,5,1.25,14606.0,United Kingdom,2026-01-13
518394,20985,HEART CALCULATOR,1,1.25,14606.0,United Kingdom,2026-01-13
518394,21481,FAWN BLUE HOT WATER BOTTLE,1,2.95,14606.0,United Kingdom,2026-01-13
518394,22659,LUNCH BOX I LOVE LONDON,1,1.95,14606.0,United Kingdom,2026-01-13
518394,22114,HOT WATER BOTTLE TEA AND SYMPATHY,1,3.95,14606.0,United Kingdom,2026-01-13
518394,85039C,S/4 BLACK MINI ROSE CANDLE IN BOWL,1,1.65,14606.0,United Kingdom,2026-01-13
518394,22196,SMALL HEART MEASURING SPOONS,2,0.85,14606.0,United Kingdom,2026-01-13
518394,21247,SET OF RED SALAD SERVERS ,1,1.49,14606.0,United Kingdom,2026-01-13
518394,21562,HAWAIIAN GRASS SKIRT ,1,2.1,14606.0,United Kingdom,2026-01-13
518394,22475,SKULL DESIGN TV DINNER TRAY,1,4.95,14606.0,United Kingdom,2026-01-13
518394,21942,SKULLS DESIGN FLANNEL,2,0.85,14606.0,United Kingdom,2026-01-13
518395,22665,RECIPE BOX BLUE SKETCHBOOK DESIGN,6,2.95,14156.0,EIRE,2026-01-13
518395,84520B,PACK 20 ENGLISH ROSE PAPER NAPKINS,24,0.85,14156.0,EIRE,2026-01-13
518395,47568,ENGLISH ROSE DESIGN PEG BAG,12,2.1,14156.0,EIRE,2026-01-13
518395,22120,WELCOME  WOODEN BLOCK LETTERS,4,9.95,14156.0,EIRE,2026-01-13
518395,72760B,VINTAGE CREAM 3 BASKET CAKE STAND,8,9.95,14156.0,EIRE,2026-01-13
518395,22435,SET OF 9 HEART SHAPED BALLOONS,18,1.25,14156.0,EIRE,2026-01-13
518395,22647,CERAMIC LOVE HEART MONEY BANK,12,1.45,14156.0,EIRE,2026-01-13
518395,16236,KITTY PENCIL ERASERS,28,0.21,14156.0,EIRE,2026-01-13
518395,16237,SLEEPING CAT ERASERS,30,0.21,14156.0,EIRE,2026-01-13
518395,22667,RECIPE BOX RETRO SPOT DESIGN,6,2.95,14156.0,EIRE,2026-01-13
518395,22692,DOORMAT WELCOME TO OUR HOME,10,6.35,14156.0,EIRE,2026-01-13
518395,22652,TRAVEL SEWING KIT,12,1.65,14156.0,EIRE,2026-01-13
518395,22690,DOORMAT HOME SWEET HOME BLUE ,10,6.35,14156.0,EIRE,2026-01-13
518395,85049G,CHOCOLATE BOX RIBBONS ,24,1.25,14156.0,EIRE,2026-01-13
518395,85049F,BABY BOOM RIBBONS ,24,1.25,14156.0,EIRE,2026-01-13
518395,85049E,SCANDINAVIAN REDS RIBBONS,144,1.06,14156.0,EIRE,2026-01-13
518395,85049H,URBAN BLACK RIBBONS ,24,0.42,14156.0,EIRE,2026-01-13
518395,85049C,ROMANTIC PINKS RIBBONS ,24,1.25,14156.0,EIRE,2026-01-13
518395,85049B,LUSH GREENS RIBBONS,24,1.25,14156.0,EIRE,2026-01-13
518395,22077,6 RIBBONS RUSTIC CHARM,24,1.65,14156.0,EIRE,2026-01-13
518395,85049D,BRIGHT BLUES RIBBONS ,24,1.25,14156.0,EIRE,2026-01-13
518397,21891,TRADITIONAL WOODEN SKIPPING ROPE,1,1.25,16444.0,United Kingdom,2026-01-13
518396,20972,PINK CREAM FELT CRAFT TRINKET BOX ,144,1.06,13408.0,United Kingdom,2026-01-13
518397,85123A,WHITE HANGING HEART T-LIGHT HOLDER,3,2.95,16444.0,United Kingdom,2026-01-13
518397,21890,S/6 WOODEN SKITTLES IN COTTON BAG,3,2.95,16444.0,United Kingdom,2026-01-13
518397,22620,4 TRADITIONAL SPINNING TOPS,6,1.25,16444.0,United Kingdom,2026-01-13
518397,16212,FUNKY GIRLZ ASST MAGNETIC MEMO PAD,20,0.65,16444.0,United Kingdom,2026-01-13
518397,22621,TRADITIONAL KNITTING NANCY,6,1.45,16444.0,United Kingdom,2026-01-13
518396,21390,FILIGRIS HEART WITH BUTTERFLY,72,1.25,13408.0,United Kingdom,2026-01-13
518397,21892,TRADITIONAL WOODEN CATCH CUP GAME ,6,1.25,16444.0,United Kingdom,2026-01-13
518397,21891,TRADITIONAL WOODEN SKIPPING ROPE,5,1.25,16444.0,United Kingdom,2026-01-13
518397,22646,CERAMIC STRAWBERRY CAKE MONEY BANK,6,1.45,16444.0,United Kingdom,2026-01-13
518397,20861,GOLD COSMETIC BAG PINK STAR,6,2.1,16444.0,United Kingdom,2026-01-13
518397,20868,SILVER FABRIC MIRROR,6,1.25,16444.0,United Kingdom,2026-01-13
518397,22152,PLACE SETTING WHITE STAR,24,0.42,16444.0,United Kingdom,2026-01-13
518397,22650,CERAMIC PIRATE CHEST MONEY BANK,4,1.45,16444.0,United Kingdom,2026-01-13
518397,22313,OFFICE MUG WARMER PINK,3,4.95,16444.0,United Kingdom,2026-01-13
518397,22314,OFFICE MUG WARMER CHOC+BLUE,3,4.95,16444.0,United Kingdom,2026-01-13
518397,11001,ASSTD DESIGN RACING CAR PEN,16,1.69,16444.0,United Kingdom,2026-01-13
518397,84880,WHITE WIRE EGG HOLDER,3,5.95,16444.0,United Kingdom,2026-01-13
518397,72760B,VINTAGE CREAM 3 BASKET CAKE STAND,2,9.95,16444.0,United Kingdom,2026-01-13
518396,71053,WHITE METAL LANTERN,24,3.75,13408.0,United Kingdom,2026-01-13
518397,22759,SET OF 3 NOTEBOOKS IN PARCEL,4,1.65,16444.0,United Kingdom,2026-01-13
518396,84755,COLOUR GLASS T-LIGHT HOLDER HANGING,144,0.55,13408.0,United Kingdom,2026-01-13
518396,22147,FELTCRAFT BUTTERFLY HEARTS,40,1.25,13408.0,United Kingdom,2026-01-13
518396,21544,SKULLS  WATER TRANSFER TATTOOS ,24,0.85,13408.0,United Kingdom,2026-01-13
518397,47481,50CM METAL STRING WITH  7 CLIPS,4,0.85,16444.0,United Kingdom,2026-01-13
518397,20970,PINK FLORAL FELTCRAFT SHOULDER BAG,2,3.75,16444.0,United Kingdom,2026-01-13
518397,20967,GREY FLORAL FELTCRAFT SHOULDER BAG,2,3.75,16444.0,United Kingdom,2026-01-13
518397,21126,SET OF 6 GIRLS CELEBRATION CANDLES,2,1.25,16444.0,United Kingdom,2026-01-13
518397,22273,FELTCRAFT DOLL MOLLY,3,2.95,16444.0,United Kingdom,2026-01-13
518397,22271,FELTCRAFT DOLL ROSIE,3,2.95,16444.0,United Kingdom,2026-01-13
518397,20971,PINK BLUE FELT CRAFT TRINKET BOX,3,1.25,16444.0,United Kingdom,2026-01-13
518397,20972,PINK CREAM FELT CRAFT TRINKET BOX ,3,1.25,16444.0,United Kingdom,2026-01-13
518396,21700,BIG DOUGHNUT FRIDGE MAGNETS,24,0.85,13408.0,United Kingdom,2026-01-13
518397,21790,VINTAGE SNAP CARDS,4,0.85,16444.0,United Kingdom,2026-01-13
518397,21888,BINGO SET,3,3.75,16444.0,United Kingdom,2026-01-13
518397,21791,VINTAGE HEADS AND TAILS CARD GAME ,4,1.25,16444.0,United Kingdom,2026-01-13
518397,21094,SET/6 RED SPOTTY PAPER PLATES,2,0.85,16444.0,United Kingdom,2026-01-13
518397,21080,SET/20 RED SPOTTY PAPER NAPKINS ,1,0.85,16444.0,United Kingdom,2026-01-13
518397,21086,SET/6 RED SPOTTY PAPER CUPS,2,0.65,16444.0,United Kingdom,2026-01-13
518396,22215,CAKE STAND WHITE TWO TIER LACE,12,7.65,13408.0,United Kingdom,2026-01-13
518396,21622,VINTAGE UNION JACK CUSHION COVER,4,4.95,13408.0,United Kingdom,2026-01-13
518396,22411,JUMBO SHOPPER VINTAGE RED PAISLEY,100,1.65,13408.0,United Kingdom,2026-01-13
518396,21497,FANCY FONTS BIRTHDAY WRAP,25,0.42,13408.0,United Kingdom,2026-01-13
518396,21915,RED  HARMONICA IN BOX ,12,1.25,13408.0,United Kingdom,2026-01-13
518397,22548,HEADS AND TAILS SPORTING FUN,4,1.25,16444.0,United Kingdom,2026-01-13
518398,22158,3 HEARTS HANGING DECORATION RUSTIC,16,2.95,15046.0,United Kingdom,2026-01-13
518398,22759,SET OF 3 NOTEBOOKS IN PARCEL,1,1.65,15046.0,United Kingdom,2026-01-13
518398,82484,WOOD BLACK BOARD ANT WHITE FINISH,2,6.45,15046.0,United Kingdom,2026-01-13
518398,22575,METAL MERRY CHRISTMAS WREATH,8,1.95,15046.0,United Kingdom,2026-01-13
518398,48138,DOORMAT UNION FLAG,2,7.49,15046.0,United Kingdom,2026-01-13
518398,84879,ASSORTED COLOUR BIRD ORNAMENT,16,1.69,15046.0,United Kingdom,2026-01-13
518398,22079,RIBBON REEL HEARTS DESIGN ,5,1.65,15046.0,United Kingdom,2026-01-13
518398,22575,METAL MERRY CHRISTMAS WREATH,8,1.95,15046.0,United Kingdom,2026-01-13
518398,22078,RIBBON REEL LACE DESIGN ,5,2.1,15046.0,United Kingdom,2026-01-13
518399,84946,ANTIQUE SILVER TEA GLASS ETCHED,24,1.25,17491.0,United Kingdom,2026-01-13
518399,22087,PAPER BUNTING WHITE LACE,12,2.95,17491.0,United Kingdom,2026-01-13
518399,84879,ASSORTED COLOUR BIRD ORNAMENT,24,1.69,17491.0,United Kingdom,2026-01-13
518399,22585,PACK OF 6 BIRDY GIFT TAGS,24,1.25,17491.0,United Kingdom,2026-01-13
518400,22469,HEART OF WICKER SMALL,8,1.65,17050.0,United Kingdom,2026-01-13
518400,22470,HEART OF WICKER LARGE,4,2.95,17050.0,United Kingdom,2026-01-13
518400,21231,SWEETHEART CERAMIC TRINKET BOX,1,1.25,17050.0,United Kingdom,2026-01-13
518400,85123A,WHITE HANGING HEART T-LIGHT HOLDER,64,2.55,17050.0,United Kingdom,2026-01-13
518400,21733,RED HANGING HEART T-LIGHT HOLDER,32,2.55,17050.0,United Kingdom,2026-01-13
518400,20960,WATERMELON BATH SPONGE,10,1.25,17050.0,United Kingdom,2026-01-13
518400,85123A,WHITE HANGING HEART T-LIGHT HOLDER,1,2.95,17050.0,United Kingdom,2026-01-13
518400,21733,RED HANGING HEART T-LIGHT HOLDER,1,2.95,17050.0,United Kingdom,2026-01-13
518400,20966,SANDWICH BATH SPONGE,40,1.25,17050.0,United Kingdom,2026-01-13
518400,20961,STRAWBERRY BATH SPONGE ,10,1.25,17050.0,United Kingdom,2026-01-13
518401,85123A,WHITE HANGING HEART T-LIGHT HOLDER,6,2.95,13059.0,United Kingdom,2026-01-13
518401,22212,FOUR HOOK  WHITE LOVEBIRDS,12,2.1,13059.0,United Kingdom,2026-01-13
518401,85034A,3 GARDENIA MORRIS BOXED CANDLES,4,4.25,13059.0,United Kingdom,2026-01-13
518401,72807C,SET/3 VANILLA SCENTED CANDLE IN BOX,4,4.25,13059.0,United Kingdom,2026-01-13
518401,72807B,SET/3 OCEAN SCENT CANDLE JEWEL BOX,4,4.25,13059.0,United Kingdom,2026-01-13
518401,72807A,SET/3 ROSE CANDLE IN JEWELLED BOX,4,4.25,13059.0,United Kingdom,2026-01-13
518401,20871,OPULENT VELVET SET/3 CANDLES,6,2.1,13059.0,United Kingdom,2026-01-13
518401,22588,CARD HOLDER GINGHAM HEART,6,2.55,13059.0,United Kingdom,2026-01-13
518401,21621,VINTAGE UNION JACK BUNTING,2,8.5,13059.0,United Kingdom,2026-01-13
518401,21733,RED HANGING HEART T-LIGHT HOLDER,6,2.95,13059.0,United Kingdom,2026-01-13
518401,21524,DOORMAT SPOTTY HOME SWEET HOME,2,7.49,13059.0,United Kingdom,2026-01-13
518401,20910,VINTAGE PHOTO ALBUM PARIS DAYS,2,6.35,13059.0,United Kingdom,2026-01-13
518401,20765,CHRYSANTHEMUM SKETCHBOOK ,4,3.75,13059.0,United Kingdom,2026-01-13
518401,21625,VINTAGE UNION JACK APRON,3,6.95,13059.0,United Kingdom,2026-01-13
518401,21622,VINTAGE UNION JACK CUSHION COVER,4,4.95,13059.0,United Kingdom,2026-01-13
518401,21955,DOORMAT UNION JACK GUNS AND ROSES,2,7.49,13059.0,United Kingdom,2026-01-13
518401,21523,DOORMAT FANCY FONT HOME SWEET HOME,2,7.49,13059.0,United Kingdom,2026-01-13
518401,21755,LOVE BUILDING BLOCK WORD,3,5.95,13059.0,United Kingdom,2026-01-13
518401,22197,SMALL POPCORN HOLDER,24,0.85,13059.0,United Kingdom,2026-01-13
518401,84358,FLOOR LAMP SHADE WOOD BASE,1,9.95,13059.0,United Kingdom,2026-01-13
518401,22423,REGENCY CAKESTAND 3 TIER,1,12.75,13059.0,United Kingdom,2026-01-13
518401,22055,MINI CAKE STAND  HANGING STRAWBERY,8,1.65,13059.0,United Kingdom,2026-01-13
518401,22061,LARGE CAKE STAND  HANGING STRAWBERY,2,9.95,13059.0,United Kingdom,2026-01-13
518401,20766,GARDEN PATH SKETCHBOOK,4,3.75,13059.0,United Kingdom,2026-01-13
518402,22168,ORGANISER WOOD ANTIQUE WHITE ,2,8.5,14370.0,United Kingdom,2026-01-13
518402,85014A,BLACK/BLUE DOTS RUFFLED UMBRELLA,3,5.95,14370.0,United Kingdom,2026-01-13
518402,82484,WOOD BLACK BOARD ANT WHITE FINISH,3,6.45,14370.0,United Kingdom,2026-01-13
518402,22171,3 HOOK PHOTO SHELF ANTIQUE WHITE,4,8.5,14370.0,United Kingdom,2026-01-13
518402,22303,COFFEE MUG APPLES DESIGN,6,2.55,14370.0,United Kingdom,2026-01-13
518402,82494L,WOODEN FRAME ANTIQUE WHITE ,12,2.95,14370.0,United Kingdom,2026-01-13
518402,22170,PICTURE FRAME WOOD TRIPLE PORTRAIT,4,6.75,14370.0,United Kingdom,2026-01-13
518402,22692,DOORMAT WELCOME TO OUR HOME,2,7.49,14370.0,United Kingdom,2026-01-13
518402,84978,HANGING HEART JAR T-LIGHT HOLDER,12,1.25,14370.0,United Kingdom,2026-01-13
518403,22086,PAPER CHAIN KIT 50'S CHRISTMAS ,5,2.95,17132.0,United Kingdom,2026-01-13
518403,85232A,SET/3 POLKA DOT STACKING TINS,3,4.95,17132.0,United Kingdom,2026-01-13
518403,72760B,VINTAGE CREAM 3 BASKET CAKE STAND,1,9.95,17132.0,United Kingdom,2026-01-13
518403,22508,DOORSTOP RETROSPOT HEART,2,3.75,17132.0,United Kingdom,2026-01-13
518403,21755,LOVE BUILDING BLOCK WORD,4,5.95,17132.0,United Kingdom,2026-01-13
518403,22580,ADVENT CALENDAR GINGHAM SACK,3,5.95,17132.0,United Kingdom,2026-01-13
518403,22579,WOODEN TREE CHRISTMAS SCANDINAVIAN,1,0.85,17132.0,United Kingdom,2026-01-13
518403,22173,METAL 4 HOOK HANGER FRENCH CHATEAU,4,2.95,17132.0,United Kingdom,2026-01-13
518403,85123A,WHITE HANGING HEART T-LIGHT HOLDER,1,2.95,17132.0,United Kingdom,2026-01-13
518403,21744,SNOWFLAKE PORTABLE TABLE LIGHT ,1,2.95,17132.0,United Kingdom,2026-01-13
518403,72760B,VINTAGE CREAM 3 BASKET CAKE STAND,1,9.95,17132.0,United Kingdom,2026-01-13
518403,85123A,WHITE HANGING HEART T-LIGHT HOLDER,1,2.95,17132.0,United Kingdom,2026-01-13
518403,35981C,WHITE SNOW SCANDINAVIAN STOCKING ,20,0.38,17132.0,United Kingdom,2026-01-13
518403,85081,PADDED HOLLY CHRISTMAS DECORATION ,12,0.42,17132.0,United Kingdom,2026-01-13
518403,85123A,WHITE HANGING HEART T-LIGHT HOLDER,1,2.95,17132.0,United Kingdom,2026-01-13
518403,22130,PARTY CONE CHRISTMAS DECORATION ,24,0.85,17132.0,United Kingdom,2026-01-13
518403,22130,PARTY CONE CHRISTMAS DECORATION ,6,0.85,17132.0,United Kingdom,2026-01-13
518403,85123A,WHITE HANGING HEART T-LIGHT HOLDER,3,2.95,17132.0,United Kingdom,2026-01-13
518403,21272,SALLE DE BAIN HOOK,6,1.25,17132.0,United Kingdom,2026-01-13
518403,85066,CREAM SWEETHEART MINI CHEST,2,12.75,17132.0,United Kingdom,2026-01-13
518403,22581,WOOD STOCKING CHRISTMAS SCANDISPOT,47,0.85,17132.0,United Kingdom,2026-01-13
518403,21743,STAR PORTABLE TABLE LIGHT ,3,2.95,17132.0,United Kingdom,2026-01-13
518403,22576,SWALLOW WOODEN CHRISTMAS DECORATION,13,0.85,17132.0,United Kingdom,2026-01-13
518403,22579,WOODEN TREE CHRISTMAS SCANDINAVIAN,25,0.85,17132.0,United Kingdom,2026-01-13
518403,22573,STAR WOODEN CHRISTMAS DECORATION,19,0.85,17132.0,United Kingdom,2026-01-13
518403,21822,GLITTER CHRISTMAS TREE WITH BELLS,6,1.95,17132.0,United Kingdom,2026-01-13
518403,35970,ZINC FOLKART SLEIGH BELLS,6,1.69,17132.0,United Kingdom,2026-01-13
518403,22295,HEART FILIGREE DOVE LARGE,12,1.65,17132.0,United Kingdom,2026-01-13
518403,35961,FOLKART ZINC HEART CHRISTMAS DEC,12,0.85,17132.0,United Kingdom,2026-01-13
518403,22119,PEACE WOODEN BLOCK LETTERS,4,6.95,17132.0,United Kingdom,2026-01-13
518403,21822,GLITTER CHRISTMAS TREE WITH BELLS,6,1.95,17132.0,United Kingdom,2026-01-13
518403,35969,FOLKART CROWN TABLE DECORATIONS,12,1.65,17132.0,United Kingdom,2026-01-13
518403,22294,HEART FILIGREE DOVE  SMALL,24,1.25,17132.0,United Kingdom,2026-01-13
518403,35970,ZINC FOLKART SLEIGH BELLS,6,1.69,17132.0,United Kingdom,2026-01-13
518403,22593,CHRISTMAS GINGHAM STAR,36,0.85,17132.0,United Kingdom,2026-01-13
518403,35958,FOLKART ZINC STAR CHRISTMAS DEC,12,0.85,17132.0,United Kingdom,2026-01-13
518403,35962,12 ASS ZINC CHRISTMAS DECORATIONS,12,2.1,17132.0,United Kingdom,2026-01-13
518403,72760B,VINTAGE CREAM 3 BASKET CAKE STAND,1,9.95,17132.0,United Kingdom,2026-01-13
518403,82483,WOOD 2 DRAWER CABINET WHITE FINISH,2,5.95,17132.0,United Kingdom,2026-01-13
518403,84839,SWEETHEART KEY CABINET,2,6.75,17132.0,United Kingdom,2026-01-13
518403,22595,CHRISTMAS GINGHAM HEART,36,0.85,17132.0,United Kingdom,2026-01-13
518403,84970S,HANGING HEART ZINC T-LIGHT HOLDER,12,0.85,17132.0,United Kingdom,2026-01-13
518403,82482,WOODEN PICTURE FRAME WHITE FINISH,4,2.55,17132.0,United Kingdom,2026-01-13
518403,82494L,WOODEN FRAME ANTIQUE WHITE ,2,2.95,17132.0,United Kingdom,2026-01-13
518403,22578,WOODEN STAR CHRISTMAS SCANDINAVIAN,27,0.85,17132.0,United Kingdom,2026-01-13
518403,22574,HEART WOODEN CHRISTMAS DECORATION,15,0.85,17132.0,United Kingdom,2026-01-13
518403,22594,CHRISTMAS GINGHAM TREE,36,0.85,17132.0,United Kingdom,2026-01-13
518404,21080,SET/20 RED SPOTTY PAPER NAPKINS ,4,0.85,16115.0,United Kingdom,2026-01-13
518404,84987,SET OF 36 TEATIME PAPER DOILIES,6,1.45,16115.0,United Kingdom,2026-01-13
518404,47556B,TEA TIME TEA TOWELS ,4,2.95,16115.0,United Kingdom,2026-01-13
518404,21216,"SET 3 RED SPOT TIN TEA,COFFEE,SUGAR",2,4.95,16115.0,United Kingdom,2026-01-13
518404,22567,20 DOLLY PEGS RETROSPOT,2,1.25,16115.0,United Kingdom,2026-01-13
518404,22628,PICNIC BOXES SET OF 3 RETROSPOT ,2,4.95,16115.0,United Kingdom,2026-01-13
518404,21086,SET/6 RED SPOTTY PAPER CUPS,4,0.65,16115.0,United Kingdom,2026-01-13
518404,22352,LUNCH BOX WITH CUTLERY RETROSPOT ,3,2.55,16115.0,United Kingdom,2026-01-13
518404,21210,SET OF 72 RETRO SPOT PAPER  DOILIES,6,1.45,16115.0,United Kingdom,2026-01-13
518404,20725,LUNCH BAG RED SPOTTY,3,1.65,16115.0,United Kingdom,2026-01-13
518404,22197,SMALL POPCORN HOLDER,10,0.85,16115.0,United Kingdom,2026-01-13
518404,82578,KITCHEN METAL SIGN,3,0.55,16115.0,United Kingdom,2026-01-13
518404,82581,TOILET METAL SIGN,3,0.55,16115.0,United Kingdom,2026-01-13
518404,21911,GARDEN METAL SIGN ,2,1.65,16115.0,United Kingdom,2026-01-13
518404,40018F,CHERRY DESIGN PAPERLANTERNS,2,1.95,16115.0,United Kingdom,2026-01-13
518404,22759,SET OF 3 NOTEBOOKS IN PARCEL,3,1.65,16115.0,United Kingdom,2026-01-13
518404,22667,RECIPE BOX RETRO SPOT DESIGN,4,2.95,16115.0,United Kingdom,2026-01-13
518404,84991,60 TEATIME FAIRY CAKE CASES,12,0.55,16115.0,United Kingdom,2026-01-13
518404,84978,HANGING HEART JAR T-LIGHT HOLDER,12,1.25,16115.0,United Kingdom,2026-01-13
518404,21035,SET/2 RED SPOTTY TEA TOWELS ,5,2.95,16115.0,United Kingdom,2026-01-13
518404,22090,PAPER BUNTING RETRO SPOTS,2,2.95,16115.0,United Kingdom,2026-01-13
518404,21533,RETRO SPOT LARGE MILK JUG,2,4.95,16115.0,United Kingdom,2026-01-13
518404,82616A,BUBBLE GUM SCARF KNITTING KIT,1,2.95,16115.0,United Kingdom,2026-01-13
518404,22428,ENAMEL FIRE BUCKET CREAM,1,6.95,16115.0,United Kingdom,2026-01-13
518404,22565,FELTCRAFT HAIRBANDS PINK AND WHITE ,1,0.85,16115.0,United Kingdom,2026-01-13
518404,22130,PARTY CONE CHRISTMAS DECORATION ,6,0.85,16115.0,United Kingdom,2026-01-13
518404,22272,FELTCRAFT DOLL MARIA,1,2.95,16115.0,United Kingdom,2026-01-13
518404,20971,PINK BLUE FELT CRAFT TRINKET BOX,1,1.25,16115.0,United Kingdom,2026-01-13
518404,84627,CANDY STRIPE ROSE C/COVER ,1,5.95,16115.0,United Kingdom,2026-01-13
518404,22384,LUNCH BAG PINK RETROSPOT,1,1.65,16115.0,United Kingdom,2026-01-13
518404,16156S,WRAP PINK FAIRY CAKES ,25,0.42,16115.0,United Kingdom,2026-01-13
518404,20971,PINK BLUE FELT CRAFT TRINKET BOX,4,1.25,16115.0,United Kingdom,2026-01-13
518404,20972,PINK CREAM FELT CRAFT TRINKET BOX ,2,1.25,16115.0,United Kingdom,2026-01-13
518404,22565,FELTCRAFT HAIRBANDS PINK AND WHITE ,1,0.85,16115.0,United Kingdom,2026-01-13
518404,22653,BUTTON BOX ,4,1.95,16115.0,United Kingdom,2026-01-13
518404,22078,RIBBON REEL LACE DESIGN ,5,2.1,16115.0,United Kingdom,2026-01-13
518404,82615,PINK MARSHMALLOW SCARF KNITTING KIT,3,2.95,16115.0,United Kingdom,2026-01-13
518404,22566,FELTCRAFT HAIRBAND PINK AND PURPLE,2,0.85,16115.0,United Kingdom,2026-01-13
518404,85049E,SCANDINAVIAN REDS RIBBONS,3,1.25,16115.0,United Kingdom,2026-01-13
518404,85049A,TRADITIONAL CHRISTMAS RIBBONS,3,1.25,16115.0,United Kingdom,2026-01-13
518404,84627,CANDY STRIPE ROSE C/COVER ,1,5.95,16115.0,United Kingdom,2026-01-13
518404,84620,BLUE GINGHAM ROSE CUSHION COVER,1,5.95,16115.0,United Kingdom,2026-01-13
518404,22356,CHARLOTTE BAG PINK WITH WHITE SPOTS,1,0.85,16115.0,United Kingdom,2026-01-13
518404,20972,PINK CREAM FELT CRAFT TRINKET BOX ,1,1.25,16115.0,United Kingdom,2026-01-13
518404,20972,PINK CREAM FELT CRAFT TRINKET BOX ,2,1.25,16115.0,United Kingdom,2026-01-13
518405,20727,LUNCH BAG  BLACK SKULL.,20,1.65,17139.0,United Kingdom,2026-01-13
518405,20728,LUNCH BAG CARS BLUE,10,1.65,17139.0,United Kingdom,2026-01-13
518405,22382,LUNCH BAG SPACEBOY DESIGN ,20,1.65,17139.0,United Kingdom,2026-01-13
518405,22383,LUNCH BAG SUKI  DESIGN ,30,1.65,17139.0,United Kingdom,2026-01-13
518405,85123A,WHITE HANGING HEART T-LIGHT HOLDER,12,2.95,17139.0,United Kingdom,2026-01-13
518405,22662,LUNCH BAG DOLLY GIRL DESIGN,30,1.65,17139.0,United Kingdom,2026-01-13
518405,22690,DOORMAT HOME SWEET HOME BLUE ,10,6.35,17139.0,United Kingdom,2026-01-13
518405,22692,DOORMAT WELCOME TO OUR HOME,10,6.35,17139.0,United Kingdom,2026-01-13
518405,22384,LUNCH BAG PINK RETROSPOT,50,1.65,17139.0,United Kingdom,2026-01-13
518405,20725,LUNCH BAG RED SPOTTY,40,1.65,17139.0,United Kingdom,2026-01-13
