Invoice,StockCode,Description,Quantity,Price,Customer ID,Country,InvoiceDate
520693,21755,LOVE BUILDING BLOCK WORD,3,5.95,13995.0,United Kingdom,2026-01-31
520693,21871,SAVE THE PLANET MUG,12,1.25,13995.0,United Kingdom,2026-01-31
520693,21770,OPEN CLOSED METAL SIGN,2,4.95,13995.0,United Kingdom,2026-01-31
520693,22588,CARD HOLDER GINGHAM HEART,12,2.55,13995.0,United Kingdom,2026-01-31
520693,21519,GIN & TONIC DIET GREETING CARD ,12,0.42,13995.0,United Kingdom,2026-01-31
520693,22029,SPACEBOY BIRTHDAY CARD,12,0.42,13995.0,United Kingdom,2026-01-31
520693,20725,LUNCH BAG RED SPOTTY,10,1.65,13995.0,United Kingdom,2026-01-31
520693,22470,HEART OF WICKER LARGE,18,2.95,13995.0,United Kingdom,2026-01-31
520693,22469,HEART OF WICKER SMALL,24,1.65,13995.0,United Kingdom,2026-01-31
520693,22083,PAPER CHAIN KIT RETRO SPOT,6,2.95,13995.0,United Kingdom,2026-01-31
520693,22090,PAPER BUNTING RETRO SPOTS,12,2.95,13995.0,United Kingdom,2026-01-31
520693,22457,NATURAL SLATE HEART CHALKBOARD ,12,2.95,13995.0,United Kingdom,2026-01-31
520693,71459,HANGING JAM JAR T-LIGHT HOLDER,24,0.85,13995.0,United Kingdom,2026-01-31
520694,72760B,VINTAGE CREAM 3 BASKET CAKE STAND,2,9.95,15784.0,United Kingdom,2026-01-31
520694,22173,METAL 4 HOOK HANGER FRENCH CHATEAU,8,2.95,15784.0,United Kingdom,2026-01-31
520694,22297,HEART IVORY TRELLIS SMALL,24,1.25,15784.0,United Kingdom,2026-01-31
520694,22296,HEART IVORY TRELLIS LARGE,12,1.65,15784.0,United Kingdom,2026-01-31
520694,21531,RED RETROSPOT SUGAR JAM BOWL,6,2.55,15784.0,United Kingdom,2026-01-31
520694,21535,RED RETROSPOT SMALL MILK JUG,12,2.55,15784.0,United Kingdom,2026-01-31
520694,21843,RED RETROSPOT CAKE STAND,2,10.95,15784.0,United Kingdom,2026-01-31
520694,21527,RED RETROSPOT TRADITIONAL TEAPOT ,8,7.95,15784.0,United Kingdom,2026-01-31
520694,22072,RED RETROSPOT TEA CUP AND SAUCER ,16,3.75,15784.0,United Kingdom,2026-01-31
520694,22073,RED RETROSPOT STORAGE JAR,8,3.75,15784.0,United Kingdom,2026-01-31
520694,22180,RETRO SPOT LAMP,2,9.95,15784.0,United Kingdom,2026-01-31
520694,21402,RED  EGG  SPOON,12,0.42,15784.0,United Kingdom,2026-01-31
520694,21231,SWEETHEART CERAMIC TRINKET BOX,12,1.25,15784.0,United Kingdom,2026-01-31
520694,21232,STRAWBERRY CERAMIC TRINKET BOX,12,1.25,15784.0,United Kingdom,2026-01-31
520694,22478,BIRDHOUSE GARDEN MARKER ,10,1.25,15784.0,United Kingdom,2026-01-31
520695,21755,LOVE BUILDING BLOCK WORD,9,5.95,15430.0,United Kingdom,2026-01-31
520695,85064,CREAM SWEETHEART LETTER RACK,2,5.45,15430.0,United Kingdom,2026-01-31
520695,21754,HOME BUILDING BLOCK WORD,9,5.95,15430.0,United Kingdom,2026-01-31
520696,82482,WOODEN PICTURE FRAME WHITE FINISH,6,2.55,14770.0,United Kingdom,2026-01-31
520696,22498,WOODEN REGATTA BUNTING,3,5.95,14770.0,United Kingdom,2026-01-31
520696,22499,WOODEN UNION JACK BUNTING,3,5.95,14770.0,United Kingdom,2026-01-31
520696,21621,VINTAGE UNION JACK BUNTING,2,8.5,14770.0,United Kingdom,2026-01-31
520696,47590B,PINK HAPPY BIRTHDAY BUNTING,3,5.45,14770.0,United Kingdom,2026-01-31
520696,84879,ASSORTED COLOUR BIRD ORNAMENT,24,1.69,14770.0,United Kingdom,2026-01-31
520696,22295,HEART FILIGREE DOVE LARGE,12,1.65,14770.0,United Kingdom,2026-01-31
520696,22296,HEART IVORY TRELLIS LARGE,12,1.65,14770.0,United Kingdom,2026-01-31
520696,82494L,WOODEN FRAME ANTIQUE WHITE ,6,2.95,14770.0,United Kingdom,2026-01-31
520696,84945,MULTI COLOUR SILVER T-LIGHT HOLDER,12,0.85,14770.0,United Kingdom,2026-01-31
520696,21733,RED HANGING HEART T-LIGHT HOLDER,6,2.95,14770.0,United Kingdom,2026-01-31
520696,71477,COLOUR GLASS. STAR T-LIGHT HOLDER,4,3.25,14770.0,United Kingdom,2026-01-31
520696,85123A,WHITE HANGING HEART T-LIGHT HOLDER,6,2.95,14770.0,United Kingdom,2026-01-31
520696,21313,GLASS HEART T-LIGHT HOLDER ,12,0.85,14770.0,United Kingdom,2026-01-31
520696,21666,RIDGED GLASS T-LIGHT HOLDER,12,0.65,14770.0,United Kingdom,2026-01-31
520696,22426,ENAMEL WASH BOWL CREAM,4,3.75,14770.0,United Kingdom,2026-01-31
520696,85059,FRENCH ENAMEL WATER BASIN,4,3.75,14770.0,United Kingdom,2026-01-31
520696,21730,GLASS STAR FROSTED T-LIGHT HOLDER,3,4.95,14770.0,United Kingdom,2026-01-31
520697,20724,RED SPOTTY CHARLOTTE BAG,2,0.85,16923.0,United Kingdom,2026-01-31
520697,22384,LUNCH BAG PINK RETROSPOT,7,1.65,16923.0,United Kingdom,2026-01-31
520697,20727,LUNCH BAG  BLACK SKULL.,5,1.65,16923.0,United Kingdom,2026-01-31
520697,22661,CHARLOTTE BAG DOLLY GIRL DESIGN,1,0.85,16923.0,United Kingdom,2026-01-31
520697,22355,CHARLOTTE BAG SUKI DESIGN,10,0.85,16923.0,United Kingdom,2026-01-31
520697,47591B,SCOTTIES CHILDRENS APRON,2,1.65,16923.0,United Kingdom,2026-01-31
520697,47591D,PINK FAIRY CAKE CHILDRENS APRON,2,1.95,16923.0,United Kingdom,2026-01-31
520697,21156,RETROSPOT CHILDRENS APRON,2,1.95,16923.0,United Kingdom,2026-01-31
520697,84884A,ANT WHITE WIRE HEART SPIRAL,10,3.95,16923.0,United Kingdom,2026-01-31
520697,20728,LUNCH BAG CARS BLUE,3,1.65,16923.0,United Kingdom,2026-01-31
520697,84840,SWEETHEART CARRY-ALL BASKET,2,8.5,16923.0,United Kingdom,2026-01-31
520697,22356,CHARLOTTE BAG PINK WITH WHITE SPOTS,3,0.85,16923.0,United Kingdom,2026-01-31
520697,21732,RED HANGING METAL STAR TLIGHT HLDR,4,3.75,16923.0,United Kingdom,2026-01-31
520697,21257,VICTORIAN SEWING BOX MEDIUM,4,7.95,16923.0,United Kingdom,2026-01-31
520697,21259,VICTORIAN SEWING BOX SMALL ,4,5.95,16923.0,United Kingdom,2026-01-31
520697,21768,WALL MOUNTED VINTAGE ORGANISER,2,14.95,16923.0,United Kingdom,2026-01-31
520697,82583,HOT BATHS METAL SIGN,24,2.1,16923.0,United Kingdom,2026-01-31
520697,21181,PLEASE ONE PERSON METAL SIGN,24,2.1,16923.0,United Kingdom,2026-01-31
520697,82599,FANNY'S REST STOPMETAL SIGN,6,2.1,16923.0,United Kingdom,2026-01-31
520697,82605,OLD DOC RUSSEL METAL SIGN,3,2.1,16923.0,United Kingdom,2026-01-31
520697,82582,AREA PATROLLED METAL SIGN,3,2.1,16923.0,United Kingdom,2026-01-31
520697,21165,BEWARE OF THE CAT METAL SIGN ,1,1.69,16923.0,United Kingdom,2026-01-31
520697,21121,SET/10 RED SPOTTY PARTY CANDLES,3,1.25,16923.0,United Kingdom,2026-01-31
520697,85123A,WHITE HANGING HEART T-LIGHT HOLDER,20,2.95,16923.0,United Kingdom,2026-01-31
520697,84991,60 TEATIME FAIRY CAKE CASES,5,0.55,16923.0,United Kingdom,2026-01-31
520697,21732,RED HANGING METAL STAR TLIGHT HLDR,4,3.75,16923.0,United Kingdom,2026-01-31
520697,20718,RED SPOTTY SHOPPER BAG,5,1.25,16923.0,United Kingdom,2026-01-31
520697,22382,LUNCH BAG SPACEBOY DESIGN ,2,1.65,16923.0,United Kingdom,2026-01-31
520697,85150,LADIES & GENTLEMEN METAL SIGN,24,2.55,16923.0,United Kingdom,2026-01-31
520697,21154,RED SPOTTY OVEN GLOVE ,6,1.25,16923.0,United Kingdom,2026-01-31
520697,21039,RED SPOTTY SHOPPING BAG,2,2.55,16923.0,United Kingdom,2026-01-31
520697,21035,SET/2 RED SPOTTY TEA TOWELS ,5,2.95,16923.0,United Kingdom,2026-01-31
520697,22851,SET 20 NAPKINS FAIRY CAKES DESIGN ,5,0.85,16923.0,United Kingdom,2026-01-31
520697,21816,CHRISTMAS TREE T-LIGHT HOLDER,12,1.45,16923.0,United Kingdom,2026-01-31
520697,21080,SET/20 RED SPOTTY PAPER NAPKINS ,5,0.85,16923.0,United Kingdom,2026-01-31
520697,47556B,TEA TIME TEA TOWELS ,5,2.95,16923.0,United Kingdom,2026-01-31
520697,47559B,TEA TIME OVEN GLOVE,7,1.25,16923.0,United Kingdom,2026-01-31
520697,22112,CHOCOLATE HOT WATER BOTTLE,8,4.95,16923.0,United Kingdom,2026-01-31
520697,21902,"KEY FOB , FRONT  DOOR ",12,0.65,16923.0,United Kingdom,2026-01-31
520697,21901,"KEY FOB , BACK DOOR ",14,0.65,16923.0,United Kingdom,2026-01-31
520697,21900,"KEY FOB , SHED",12,0.65,16923.0,United Kingdom,2026-01-31
520697,84763,ZINC FINISH 15CM PLANTER POTS,1,1.25,16923.0,United Kingdom,2026-01-31
520697,21814,HEART T-LIGHT HOLDER ,12,1.45,16923.0,United Kingdom,2026-01-31
520697,21164,HOME SWEET HOME METAL SIGN ,12,2.95,16923.0,United Kingdom,2026-01-31
520697,22428,ENAMEL FIRE BUCKET CREAM,1,6.95,16923.0,United Kingdom,2026-01-31
520697,21260,FIRST AID TIN,6,3.25,16923.0,United Kingdom,2026-01-31
520697,21906,PHARMACIE FIRST AID TIN,2,6.75,16923.0,United Kingdom,2026-01-31
520697,82600,NO SINGING METAL SIGN,5,2.1,16923.0,United Kingdom,2026-01-31
520697,82494L,WOODEN FRAME ANTIQUE WHITE ,6,2.95,16923.0,United Kingdom,2026-01-31
520697,22494,EMERGENCY FIRST AID TIN ,3,1.25,16923.0,United Kingdom,2026-01-31
520697,21907,I'M ON HOLIDAY METAL SIGN,12,2.1,16923.0,United Kingdom,2026-01-31
520697,22630,DOLLY GIRL LUNCH BOX,1,1.95,16923.0,United Kingdom,2026-01-31
520697,16161P,WRAP ENGLISH ROSE ,25,0.42,16923.0,United Kingdom,2026-01-31
520697,22224,WHITE LOVEBIRD LANTERN,10,2.95,16923.0,United Kingdom,2026-01-31
520697,21870,I CAN ONLY PLEASE ONE PERSON MUG,12,1.25,16923.0,United Kingdom,2026-01-31
520697,21166,COOK WITH WINE METAL SIGN ,24,1.95,16923.0,United Kingdom,2026-01-31
520698,21754,HOME BUILDING BLOCK WORD,3,5.95,15465.0,United Kingdom,2026-01-31
520698,22186,RED STAR CARD HOLDER,3,2.95,15465.0,United Kingdom,2026-01-31
520698,21755,LOVE BUILDING BLOCK WORD,3,5.95,15465.0,United Kingdom,2026-01-31
520698,82484,WOOD BLACK BOARD ANT WHITE FINISH,2,6.45,15465.0,United Kingdom,2026-01-31
520698,21623,VINTAGE UNION JACK MEMOBOARD,2,9.95,15465.0,United Kingdom,2026-01-31
520698,21260,FIRST AID TIN,6,3.25,15465.0,United Kingdom,2026-01-31
520698,85152,HAND OVER THE CHOCOLATE   SIGN ,12,2.1,15465.0,United Kingdom,2026-01-31
520698,22612,TEA COSY VINTAGE UNION JACK,2,3.75,15465.0,United Kingdom,2026-01-31
520698,21431,GREEN GINGHAM FLOWER JEWELLERY BOX,8,1.65,15465.0,United Kingdom,2026-01-31
520698,22083,PAPER CHAIN KIT RETRO SPOT,6,2.95,15465.0,United Kingdom,2026-01-31
520698,21174,POTTERING IN THE SHED METAL SIGN,5,1.95,15465.0,United Kingdom,2026-01-31
520698,21430,SET/3 RED GINGHAM ROSE STORAGE BOX,2,3.75,15465.0,United Kingdom,2026-01-31
520698,21429,RED GINGHAM ROSE JEWELLERY BOX,10,1.65,15465.0,United Kingdom,2026-01-31
520698,21428,SET3 BOOK BOX GREEN GINGHAM FLOWER ,4,4.25,15465.0,United Kingdom,2026-01-31
520698,21843,RED RETROSPOT CAKE STAND,2,10.95,15465.0,United Kingdom,2026-01-31
520698,21955,DOORMAT UNION JACK GUNS AND ROSES,2,7.49,15465.0,United Kingdom,2026-01-31
520698,22121,NOEL WOODEN BLOCK LETTERS ,3,5.95,15465.0,United Kingdom,2026-01-31
520698,22690,DOORMAT HOME SWEET HOME BLUE ,2,7.49,15465.0,United Kingdom,2026-01-31
520698,22189,CREAM HEART CARD HOLDER,2,3.95,15465.0,United Kingdom,2026-01-31
520698,21524,DOORMAT SPOTTY HOME SWEET HOME,2,7.49,15465.0,United Kingdom,2026-01-31
520698,21166,COOK WITH WINE METAL SIGN ,12,1.95,15465.0,United Kingdom,2026-01-31
520698,21175,GIN + TONIC DIET METAL SIGN,12,2.1,15465.0,United Kingdom,2026-01-31
520698,21908,CHOCOLATE THIS WAY METAL SIGN,12,2.1,15465.0,United Kingdom,2026-01-31
520698,82552,WASHROOM METAL SIGN,10,1.25,15465.0,United Kingdom,2026-01-31
520698,21181,PLEASE ONE PERSON METAL SIGN,6,2.1,15465.0,United Kingdom,2026-01-31
520698,21260,FIRST AID TIN,6,3.25,15465.0,United Kingdom,2026-01-31
520698,21906,PHARMACIE FIRST AID TIN,2,6.75,15465.0,United Kingdom,2026-01-31
520698,79067,CORONA MEXICAN TRAY,6,3.75,15465.0,United Kingdom,2026-01-31
520698,72760B,VINTAGE CREAM 3 BASKET CAKE STAND,2,9.95,15465.0,United Kingdom,2026-01-31
520698,22429,ENAMEL MEASURING JUG CREAM,3,4.25,15465.0,United Kingdom,2026-01-31
520698,85123A,WHITE HANGING HEART T-LIGHT HOLDER,3,2.95,15465.0,United Kingdom,2026-01-31
520698,22423,REGENCY CAKESTAND 3 TIER,3,12.75,15465.0,United Kingdom,2026-01-31
520698,22687,DOORMAT CHRISTMAS VILLAGE,3,7.49,15465.0,United Kingdom,2026-01-31
520698,22689,DOORMAT MERRY CHRISTMAS RED ,3,7.49,15465.0,United Kingdom,2026-01-31
520698,22688,DOORMAT PEACE ON EARTH BLUE,3,7.49,15465.0,United Kingdom,2026-01-31
520698,48185,DOORMAT FAIRY CAKE,2,7.49,15465.0,United Kingdom,2026-01-31
520698,48138,DOORMAT UNION FLAG,2,7.49,15465.0,United Kingdom,2026-01-31
520698,21523,DOORMAT FANCY FONT HOME SWEET HOME,4,7.49,15465.0,United Kingdom,2026-01-31
520699,22386,JUMBO BAG PINK WITH WHITE SPOTS,10,1.95,13242.0,United Kingdom,2026-01-31
520699,21930,JUMBO STORAGE BAG SKULLS,10,1.95,13242.0,United Kingdom,2026-01-31
520699,21929,JUMBO BAG PINK VINTAGE PAISLEY,10,1.95,13242.0,United Kingdom,2026-01-31
520699,21931,JUMBO STORAGE BAG SUKI,10,1.95,13242.0,United Kingdom,2026-01-31
520699,85099F,JUMBO BAG STRAWBERRY,10,1.95,13242.0,United Kingdom,2026-01-31
520699,21928,JUMBO BAG SCANDINAVIAN PAISLEY,10,1.95,13242.0,United Kingdom,2026-01-31
520699,20711,JUMBO BAG TOYS ,10,1.95,13242.0,United Kingdom,2026-01-31
520699,22663,JUMBO BAG DOLLY GIRL DESIGN,10,1.95,13242.0,United Kingdom,2026-01-31
520699,22411,JUMBO SHOPPER VINTAGE RED PAISLEY,10,1.95,13242.0,United Kingdom,2026-01-31
520700,M,Manual,1,2.1,15976.0,United Kingdom,2026-01-31
520700,21532,DAIRY MAID SUGAR JAM BOWL,1,2.1,15976.0,United Kingdom,2026-01-31
520700,21531,RED RETROSPOT SUGAR JAM BOWL,1,2.55,15976.0,United Kingdom,2026-01-31
520700,21535,RED RETROSPOT SMALL MILK JUG,1,2.55,15976.0,United Kingdom,2026-01-31
520700,21080,SET/20 RED SPOTTY PAPER NAPKINS ,3,0.85,15976.0,United Kingdom,2026-01-31
520700,21154,RED SPOTTY OVEN GLOVE ,1,1.25,15976.0,United Kingdom,2026-01-31
520700,21530,DAIRY MAID TOASTRACK,1,2.95,15976.0,United Kingdom,2026-01-31
520700,21527,RED RETROSPOT TRADITIONAL TEAPOT ,2,7.95,15976.0,United Kingdom,2026-01-31
520700,21642,ASSORTED TUTTI FRUTTI PEN,48,0.85,15976.0,United Kingdom,2026-01-31
520700,21540,DAIRY MAID BUTTER DISH,1,4.25,15976.0,United Kingdom,2026-01-31
520700,22382,LUNCH BAG SPACEBOY DESIGN ,2,1.65,15976.0,United Kingdom,2026-01-31
520700,21531,RED RETROSPOT SUGAR JAM BOWL,1,2.55,15976.0,United Kingdom,2026-01-31
520700,21535,RED RETROSPOT SMALL MILK JUG,1,2.55,15976.0,United Kingdom,2026-01-31
520700,21985,PACK OF 12 HEARTS DESIGN TISSUES ,12,0.29,15976.0,United Kingdom,2026-01-31
520700,21986,PACK OF 12 PINK SPOT TISSUES ,12,0.29,15976.0,United Kingdom,2026-01-31
520700,21981,PACK OF 12 WOODLAND TISSUES ,12,0.29,15976.0,United Kingdom,2026-01-31
520700,21528,DAIRY MAID TRADITIONAL TEAPOT ,1,6.95,15976.0,United Kingdom,2026-01-31
520700,21534,DAIRY MAID LARGE MILK JUG,1,4.95,15976.0,United Kingdom,2026-01-31
520700,21741,COSY SLIPPER SHOES LARGE GREEN,1,2.95,15976.0,United Kingdom,2026-01-31
520700,84987,SET OF 36 TEATIME PAPER DOILIES,1,1.45,15976.0,United Kingdom,2026-01-31
520700,22673,FRENCH GARDEN SIGN BLUE METAL,1,1.25,15976.0,United Kingdom,2026-01-31
520700,22294,HEART FILIGREE DOVE  SMALL,1,1.25,15976.0,United Kingdom,2026-01-31
520700,84993A,75 GREEN PETIT FOUR CASES,2,0.42,15976.0,United Kingdom,2026-01-31
520700,22470,HEART OF WICKER LARGE,1,2.95,15976.0,United Kingdom,2026-01-31
520700,35971,ROSE FOLKART HEART DECORATIONS,1,1.25,15976.0,United Kingdom,2026-01-31
520700,22469,HEART OF WICKER SMALL,1,1.65,15976.0,United Kingdom,2026-01-31
520700,22280,POCKET BAG PINK PAISELY BROWN SPOT,1,2.1,15976.0,United Kingdom,2026-01-31
520700,21984,PACK OF 12 PINK PAISLEY TISSUES ,4,0.29,15976.0,United Kingdom,2026-01-31
520700,21986,PACK OF 12 PINK SPOT TISSUES ,2,0.29,15976.0,United Kingdom,2026-01-31
520700,85123A,WHITE HANGING HEART T-LIGHT HOLDER,1,2.95,15976.0,United Kingdom,2026-01-31
520700,84510A,SET OF 4 ENGLISH ROSE COASTERS,1,1.25,15976.0,United Kingdom,2026-01-31
520700,22429,ENAMEL MEASURING JUG CREAM,1,4.25,15976.0,United Kingdom,2026-01-31
520700,21985,PACK OF 12 HEARTS DESIGN TISSUES ,2,0.29,15976.0,United Kingdom,2026-01-31
520700,21980,PACK OF 12 RED SPOTTY TISSUES ,2,0.29,15976.0,United Kingdom,2026-01-31
520700,21929,JUMBO BAG PINK VINTAGE PAISLEY,1,1.95,15976.0,United Kingdom,2026-01-31
520700,85185B,PINK HORSE SOCK PUPPET,2,2.95,15976.0,United Kingdom,2026-01-31
520700,85185D,FROG SOCK PUPPET,1,2.95,15976.0,United Kingdom,2026-01-31
520700,84270,ASSTD DESIGN BUBBLE GUM RING,60,0.21,15976.0,United Kingdom,2026-01-31
520700,22672,FRENCH BATHROOM SIGN BLUE METAL,1,1.65,15976.0,United Kingdom,2026-01-31
520700,21986,PACK OF 12 PINK SPOT TISSUES ,2,0.29,15976.0,United Kingdom,2026-01-31
520700,21910,WAY OUT METAL SIGN ,1,1.65,15976.0,United Kingdom,2026-01-31
520700,20728,LUNCH BAG CARS BLUE,1,1.65,15976.0,United Kingdom,2026-01-31
520700,21056,DOCTOR'S BAG SOFT TOY,1,8.95,15976.0,United Kingdom,2026-01-31
520700,21055,TOOL BOX SOFT TOY ,1,8.95,15976.0,United Kingdom,2026-01-31
520700,21754,HOME BUILDING BLOCK WORD,2,5.95,15976.0,United Kingdom,2026-01-31
520700,22119,PEACE WOODEN BLOCK LETTERS,2,6.95,15976.0,United Kingdom,2026-01-31
520700,21115,ROSE CARAVAN DOORSTOP,2,6.75,15976.0,United Kingdom,2026-01-31
520700,21116,OWL DOORSTOP,1,4.95,15976.0,United Kingdom,2026-01-31
520700,21410,COUNTRY COTTAGE  DOORSTOP GREEN,2,4.25,15976.0,United Kingdom,2026-01-31
520700,22277,COSMETIC BAG VINTAGE ROSE PAISLEY,2,2.1,15976.0,United Kingdom,2026-01-31
520700,22276,WASH BAG VINTAGE ROSE PAISLEY,1,2.55,15976.0,United Kingdom,2026-01-31
520700,47594A,CAROUSEL DESIGN WASHBAG,1,1.95,15976.0,United Kingdom,2026-01-31
520700,22296,HEART IVORY TRELLIS LARGE,4,1.65,15976.0,United Kingdom,2026-01-31
520700,35958,FOLKART ZINC STAR CHRISTMAS DEC,2,0.85,15976.0,United Kingdom,2026-01-31
520700,21385,IVORY HANGING DECORATION  HEART,2,0.85,15976.0,United Kingdom,2026-01-31
520700,22297,HEART IVORY TRELLIS SMALL,4,1.25,15976.0,United Kingdom,2026-01-31
520700,22295,HEART FILIGREE DOVE LARGE,1,1.65,15976.0,United Kingdom,2026-01-31
520700,35961,FOLKART ZINC HEART CHRISTMAS DEC,2,0.85,15976.0,United Kingdom,2026-01-31
520700,21730,GLASS STAR FROSTED T-LIGHT HOLDER,1,4.95,15976.0,United Kingdom,2026-01-31
520700,85123A,WHITE HANGING HEART T-LIGHT HOLDER,2,2.95,15976.0,United Kingdom,2026-01-31
520700,21175,GIN + TONIC DIET METAL SIGN,1,2.1,15976.0,United Kingdom,2026-01-31
520700,22693,GROW A FLYTRAP OR SUNFLOWER IN TIN,24,1.25,15976.0,United Kingdom,2026-01-31
520700,21903,MAN FLU METAL SIGN,2,2.1,15976.0,United Kingdom,2026-01-31
520700,21908,CHOCOLATE THIS WAY METAL SIGN,1,2.1,15976.0,United Kingdom,2026-01-31
520700,22413,METAL SIGN TAKE IT OR LEAVE IT ,1,2.95,15976.0,United Kingdom,2026-01-31
520700,21733,RED HANGING HEART T-LIGHT HOLDER,1,2.95,15976.0,United Kingdom,2026-01-31
520700,82552,WASHROOM METAL SIGN,1,1.25,15976.0,United Kingdom,2026-01-31
520700,82578,KITCHEN METAL SIGN,1,0.55,15976.0,United Kingdom,2026-01-31
520700,21171,BATHROOM METAL SIGN ,1,1.45,15976.0,United Kingdom,2026-01-31
520700,21179,NO JUNK MAIL METAL SIGN,1,1.25,15976.0,United Kingdom,2026-01-31
520700,20725,LUNCH BAG RED SPOTTY,2,1.65,15976.0,United Kingdom,2026-01-31
520700,21166,COOK WITH WINE METAL SIGN ,1,1.95,15976.0,United Kingdom,2026-01-31
520700,22384,LUNCH BAG PINK RETROSPOT,3,1.65,15976.0,United Kingdom,2026-01-31
520700,85185D,FROG SOCK PUPPET,1,2.95,15976.0,United Kingdom,2026-01-31
520700,21210,SET OF 72 RETRO SPOT PAPER  DOILIES,1,1.45,15976.0,United Kingdom,2026-01-31
520700,84985A,SET OF 72 GREEN PAPER DOILIES,2,1.45,15976.0,United Kingdom,2026-01-31
520700,84988,SET OF 72 PINK HEART PAPER DOILIES,2,1.45,15976.0,United Kingdom,2026-01-31
520700,84987,SET OF 36 TEATIME PAPER DOILIES,1,1.45,15976.0,United Kingdom,2026-01-31
520700,21732,RED HANGING METAL STAR TLIGHT HLDR,1,3.75,15976.0,United Kingdom,2026-01-31
520700,20728,LUNCH BAG CARS BLUE,2,1.65,15976.0,United Kingdom,2026-01-31
520701,22278,OVERNIGHT BAG VINTAGE ROSE PAISLEY,1,4.95,15058.0,United Kingdom,2026-01-31
520701,22147,FELTCRAFT BUTTERFLY HEARTS,6,1.45,15058.0,United Kingdom,2026-01-31
520701,85049B,LUSH GREENS RIBBONS,4,1.25,15058.0,United Kingdom,2026-01-31
520701,85049E,SCANDINAVIAN REDS RIBBONS,4,1.25,15058.0,United Kingdom,2026-01-31
520701,85049A,TRADITIONAL CHRISTMAS RIBBONS,4,1.25,15058.0,United Kingdom,2026-01-31
520701,85049H,URBAN BLACK RIBBONS ,4,1.25,15058.0,United Kingdom,2026-01-31
520701,85214,TUB 24 PINK FLOWER PEGS,2,1.65,15058.0,United Kingdom,2026-01-31
520701,85049C,ROMANTIC PINKS RIBBONS ,4,1.25,15058.0,United Kingdom,2026-01-31
520701,85049D,BRIGHT BLUES RIBBONS ,4,1.25,15058.0,United Kingdom,2026-01-31
520701,22077,6 RIBBONS RUSTIC CHARM,4,1.65,15058.0,United Kingdom,2026-01-31
520701,21929,JUMBO BAG PINK VINTAGE PAISLEY,1,1.95,15058.0,United Kingdom,2026-01-31
520701,85049F,BABY BOOM RIBBONS ,4,1.25,15058.0,United Kingdom,2026-01-31
520701,85099F,JUMBO BAG STRAWBERRY,1,1.95,15058.0,United Kingdom,2026-01-31
520701,20972,PINK CREAM FELT CRAFT TRINKET BOX ,24,1.25,15058.0,United Kingdom,2026-01-31
520701,22275,WEEKEND BAG VINTAGE ROSE PAISLEY,1,8.5,15058.0,United Kingdom,2026-01-31
520701,22149,FELTCRAFT 6 FLOWER FRIENDS,6,2.1,15058.0,United Kingdom,2026-01-31
520701,21351,CINAMMON & ORANGE WREATH,1,6.75,15058.0,United Kingdom,2026-01-31
520701,85123A,WHITE HANGING HEART T-LIGHT HOLDER,2,2.95,15058.0,United Kingdom,2026-01-31
520701,20971,PINK BLUE FELT CRAFT TRINKET BOX,24,1.25,15058.0,United Kingdom,2026-01-31
520701,22143,CHRISTMAS CRAFT HEART DECORATIONS,6,2.1,15058.0,United Kingdom,2026-01-31
520701,84247N,PACK/12 BLUE FOLKART CARDS,12,2.95,15058.0,United Kingdom,2026-01-31
520701,22130,PARTY CONE CHRISTMAS DECORATION ,24,0.85,15058.0,United Kingdom,2026-01-31
520701,21349,IVY HEART WREATH,1,6.75,15058.0,United Kingdom,2026-01-31
520701,22271,FELTCRAFT DOLL ROSIE,2,2.95,15058.0,United Kingdom,2026-01-31
520701,22274,FELTCRAFT DOLL EMILY,2,2.95,15058.0,United Kingdom,2026-01-31
520701,22273,FELTCRAFT DOLL MOLLY,2,2.95,15058.0,United Kingdom,2026-01-31
520701,22145,CHRISTMAS CRAFT HEART STOCKING ,6,2.1,15058.0,United Kingdom,2026-01-31
520702,22423,REGENCY CAKESTAND 3 TIER,2,12.75,15936.0,United Kingdom,2026-01-31
520702,21314,SMALL GLASS HEART TRINKET POT,8,2.1,15936.0,United Kingdom,2026-01-31
520702,47590B,PINK HAPPY BIRTHDAY BUNTING,3,5.45,15936.0,United Kingdom,2026-01-31
520702,21156,RETROSPOT CHILDRENS APRON,8,1.95,15936.0,United Kingdom,2026-01-31
520702,22588,CARD HOLDER GINGHAM HEART,6,2.55,15936.0,United Kingdom,2026-01-31
520702,22460,EMBOSSED GLASS TEALIGHT HOLDER,12,1.25,15936.0,United Kingdom,2026-01-31
520702,21754,HOME BUILDING BLOCK WORD,3,5.95,15936.0,United Kingdom,2026-01-31
520702,84836,ZINC METAL HEART DECORATION,12,1.25,15936.0,United Kingdom,2026-01-31
520702,84879,ASSORTED COLOUR BIRD ORNAMENT,8,1.69,15936.0,United Kingdom,2026-01-31
520702,16161P,WRAP ENGLISH ROSE ,25,0.42,15936.0,United Kingdom,2026-01-31
520702,84520B,PACK 20 ENGLISH ROSE PAPER NAPKINS,12,0.85,15936.0,United Kingdom,2026-01-31
520703,20726,LUNCH BAG WOODLAND,10,1.65,15074.0,United Kingdom,2026-01-31
520703,22551,PLASTERS IN TIN SPACEBOY,12,1.65,15074.0,United Kingdom,2026-01-31
520703,22554,PLASTERS IN TIN WOODLAND ANIMALS,12,1.65,15074.0,United Kingdom,2026-01-31
520703,21980,PACK OF 12 RED SPOTTY TISSUES ,48,0.29,15074.0,United Kingdom,2026-01-31
520703,21983,PACK OF 12 BLUE PAISLEY TISSUES ,48,0.29,15074.0,United Kingdom,2026-01-31
520703,22614,PACK OF 12 SPACEBOY TISSUES,48,0.29,15074.0,United Kingdom,2026-01-31
520703,22355,CHARLOTTE BAG SUKI DESIGN,10,0.85,15074.0,United Kingdom,2026-01-31
520703,22303,COFFEE MUG APPLES DESIGN,6,2.55,15074.0,United Kingdom,2026-01-31
520703,20724,RED SPOTTY CHARLOTTE BAG,10,0.85,15074.0,United Kingdom,2026-01-31
520703,20728,LUNCH BAG CARS BLUE,10,1.65,15074.0,United Kingdom,2026-01-31
520703,20970,PINK FLORAL FELTCRAFT SHOULDER BAG,4,3.75,15074.0,United Kingdom,2026-01-31
520703,22147,FELTCRAFT BUTTERFLY HEARTS,12,1.45,15074.0,United Kingdom,2026-01-31
520703,22273,FELTCRAFT DOLL MOLLY,6,2.95,15074.0,United Kingdom,2026-01-31
520703,22271,FELTCRAFT DOLL ROSIE,6,2.95,15074.0,United Kingdom,2026-01-31
520703,22149,FELTCRAFT 6 FLOWER FRIENDS,6,2.1,15074.0,United Kingdom,2026-01-31
520703,20972,PINK CREAM FELT CRAFT TRINKET BOX ,24,1.25,15074.0,United Kingdom,2026-01-31
520703,20971,PINK BLUE FELT CRAFT TRINKET BOX,24,1.25,15074.0,United Kingdom,2026-01-31
520703,84991,60 TEATIME FAIRY CAKE CASES,24,0.55,15074.0,United Kingdom,2026-01-31
520703,22417,PACK OF 60 SPACEBOY CAKE CASES,24,0.55,15074.0,United Kingdom,2026-01-31
520703,47591D,PINK FAIRY CAKE CHILDRENS APRON,8,1.95,15074.0,United Kingdom,2026-01-31
520703,22367,CHILDRENS APRON SPACEBOY DESIGN,8,1.95,15074.0,United Kingdom,2026-01-31
520703,20967,GREY FLORAL FELTCRAFT SHOULDER BAG,4,3.75,15074.0,United Kingdom,2026-01-31
520704,22245,"HOOK, 1 HANGER ,MAGIC GARDEN",12,0.85,13102.0,United Kingdom,2026-01-31
520704,22328,ROUND SNACK BOXES SET OF 4 FRUITS ,6,2.95,13102.0,United Kingdom,2026-01-31
520704,22423,REGENCY CAKESTAND 3 TIER,2,12.75,13102.0,United Kingdom,2026-01-31
520704,22697,GREEN REGENCY TEACUP AND SAUCER,6,2.95,13102.0,United Kingdom,2026-01-31
520704,22698,PINK REGENCY TEACUP AND SAUCER,6,2.95,13102.0,United Kingdom,2026-01-31
520704,22417,PACK OF 60 SPACEBOY CAKE CASES,24,0.55,13102.0,United Kingdom,2026-01-31
520704,22382,LUNCH BAG SPACEBOY DESIGN ,10,1.65,13102.0,United Kingdom,2026-01-31
520704,22629,SPACEBOY LUNCH BOX ,36,1.95,13102.0,United Kingdom,2026-01-31
520704,22757,LARGE RED BABUSHKA NOTEBOOK ,12,1.25,13102.0,United Kingdom,2026-01-31
520704,22659,LUNCH BOX I LOVE LONDON,36,1.95,13102.0,United Kingdom,2026-01-31
520704,22662,LUNCH BAG DOLLY GIRL DESIGN,10,1.65,13102.0,United Kingdom,2026-01-31
520704,22046,TEA PARTY  WRAPPING PAPER ,25,0.42,13102.0,United Kingdom,2026-01-31
520704,22045,SPACEBOY GIFT WRAP,25,0.42,13102.0,United Kingdom,2026-01-31
520705,21981,PACK OF 12 WOODLAND TISSUES ,24,0.29,13203.0,United Kingdom,2026-01-31
520705,21985,PACK OF 12 HEARTS DESIGN TISSUES ,24,0.29,13203.0,United Kingdom,2026-01-31
520705,22410,MONEY BOX HOUSEKEEPING DESIGN,12,1.25,13203.0,United Kingdom,2026-01-31
520705,22616,PACK OF 12 LONDON TISSUES ,24,0.29,13203.0,United Kingdom,2026-01-31
520705,22035,VINTAGE CARAVAN GREETING CARD ,12,0.42,13203.0,United Kingdom,2026-01-31
520705,22718,CARD CAT AND TREE ,12,0.42,13203.0,United Kingdom,2026-01-31
520705,21980,PACK OF 12 RED SPOTTY TISSUES ,24,0.29,13203.0,United Kingdom,2026-01-31
520705,22030,SWALLOWS GREETING CARD,12,0.42,13203.0,United Kingdom,2026-01-31
520705,22418,10 COLOUR SPACEBOY PEN,24,0.85,13203.0,United Kingdom,2026-01-31
520705,21506,"FANCY FONT BIRTHDAY CARD, ",12,0.42,13203.0,United Kingdom,2026-01-31
520705,21967,PACK OF 12 SKULL TISSUES,24,0.29,13203.0,United Kingdom,2026-01-31
520705,22614,PACK OF 12 SPACEBOY TISSUES,24,0.29,13203.0,United Kingdom,2026-01-31
