Invoice,StockCode,Description,Quantity,Price,Customer ID,Country,InvoiceDate
520705,22555,PLASTERS IN TIN STRONGMAN,12,1.65,13203.0,United Kingdom,2026-01-31
520705,22556,PLASTERS IN TIN CIRCUS PARADE ,12,1.65,13203.0,United Kingdom,2026-01-31
520705,22652,TRAVEL SEWING KIT,10,1.65,13203.0,United Kingdom,2026-01-31
520705,22694,WICKER STAR ,6,2.1,13203.0,United Kingdom,2026-01-31
520705,21381,MINI WOODEN HAPPY BIRTHDAY GARLAND,12,1.69,13203.0,United Kingdom,2026-01-31
520705,22469,HEART OF WICKER SMALL,7,1.65,13203.0,United Kingdom,2026-01-31
520705,85123A,WHITE HANGING HEART T-LIGHT HOLDER,6,2.95,13203.0,United Kingdom,2026-01-31
520705,85023B,EAU DE NILE JEWELLED PHOTOFRAME,6,2.55,13203.0,United Kingdom,2026-01-31
520705,85025B,EAU DE NILE HEART SHAPE PHOTO FRAME,12,1.65,13203.0,United Kingdom,2026-01-31
520705,21911,GARDEN METAL SIGN ,12,1.65,13203.0,United Kingdom,2026-01-31
520705,22551,PLASTERS IN TIN SPACEBOY,12,1.65,13203.0,United Kingdom,2026-01-31
520705,22470,HEART OF WICKER LARGE,6,2.95,13203.0,United Kingdom,2026-01-31
520706,85232B,SET OF 3 BABUSHKA STACKING TINS,3,4.95,15166.0,United Kingdom,2026-01-31
520706,72130,COLUMBIAN CANDLE ROUND,24,0.19,15166.0,United Kingdom,2026-01-31
520706,22755,SMALL PURPLE BABUSHKA NOTEBOOK ,12,0.85,15166.0,United Kingdom,2026-01-31
520706,22411,JUMBO SHOPPER VINTAGE RED PAISLEY,10,1.95,15166.0,United Kingdom,2026-01-31
520706,20973,12 PENCIL SMALL TUBE WOODLAND,24,0.65,15166.0,United Kingdom,2026-01-31
520706,22754,SMALL RED BABUSHKA NOTEBOOK ,12,0.85,15166.0,United Kingdom,2026-01-31
520706,22551,PLASTERS IN TIN SPACEBOY,12,1.65,15166.0,United Kingdom,2026-01-31
520706,21258,VICTORIAN SEWING BOX LARGE,1,12.75,15166.0,United Kingdom,2026-01-31
520706,84946,ANTIQUE SILVER TEA GLASS ETCHED,12,1.25,15166.0,United Kingdom,2026-01-31
520706,84949,SILVER HANGING T-LIGHT HOLDER,6,1.65,15166.0,United Kingdom,2026-01-31
520706,21494,ROTATING LEAVES T-LIGHT HOLDER,12,1.25,15166.0,United Kingdom,2026-01-31
520706,22556,PLASTERS IN TIN CIRCUS PARADE ,12,1.65,15166.0,United Kingdom,2026-01-31
520707,22155,STAR DECORATION RUSTIC,48,0.42,17584.0,United Kingdom,2026-01-31
520707,21007,ETCHED GLASS DROPLET DECORATION,394,0.38,17584.0,United Kingdom,2026-01-31
520707,22423,REGENCY CAKESTAND 3 TIER,16,10.95,17584.0,United Kingdom,2026-01-31
520707,22675,FRENCH KITCHEN SIGN BLUE METAL,24,1.25,17584.0,United Kingdom,2026-01-31
520707,22674,FRENCH TOILET SIGN BLUE METAL,24,1.25,17584.0,United Kingdom,2026-01-31
520707,22673,FRENCH GARDEN SIGN BLUE METAL,24,1.25,17584.0,United Kingdom,2026-01-31
520707,22672,FRENCH BATHROOM SIGN BLUE METAL,24,1.65,17584.0,United Kingdom,2026-01-31
520707,22671,FRENCH LAUNDRY SIGN BLUE METAL,24,1.65,17584.0,United Kingdom,2026-01-31
520707,22679,"FRENCH BLUE METAL DOOR SIGN, 4",50,1.25,17584.0,United Kingdom,2026-01-31
520707,22676,"FRENCH BLUE METAL DOOR SIGN, 1",50,1.25,17584.0,United Kingdom,2026-01-31
520707,22677,"FRENCH BLUE METAL DOOR SIGN, 2",50,1.25,17584.0,United Kingdom,2026-01-31
520707,22686,"FRENCH BLUE METAL DOOR SIGN, No",36,1.25,17584.0,United Kingdom,2026-01-31
520707,22685,"FRENCH BLUE METAL DOOR SIGN, 0",50,1.25,17584.0,United Kingdom,2026-01-31
520707,22684,"FRENCH BLUE METAL DOOR SIGN, 9",50,1.25,17584.0,United Kingdom,2026-01-31
520707,22683,"FRENCH BLUE METAL DOOR SIGN, 8",50,1.25,17584.0,United Kingdom,2026-01-31
520707,22682,"FRENCH BLUE METAL DOOR SIGN, 7",50,1.25,17584.0,United Kingdom,2026-01-31
520707,22681,"FRENCH BLUE METAL DOOR SIGN, 6",50,1.25,17584.0,United Kingdom,2026-01-31
520707,22595,CHRISTMAS GINGHAM HEART,36,0.85,17584.0,United Kingdom,2026-01-31
520707,22678,"FRENCH BLUE METAL DOOR SIGN, 3",50,1.25,17584.0,United Kingdom,2026-01-31
520707,22602,CHRISTMAS RETROSPOT HEART WOOD,24,0.85,17584.0,United Kingdom,2026-01-31
520707,22457,NATURAL SLATE HEART CHALKBOARD ,12,2.95,17584.0,United Kingdom,2026-01-31
520707,22469,HEART OF WICKER SMALL,40,1.45,17584.0,United Kingdom,2026-01-31
520707,22680,"FRENCH BLUE METAL DOOR SIGN, 5",50,1.25,17584.0,United Kingdom,2026-01-31
520707,21770,OPEN CLOSED METAL SIGN,2,4.95,17584.0,United Kingdom,2026-01-31
520707,82578,KITCHEN METAL SIGN,24,0.55,17584.0,United Kingdom,2026-01-31
520707,82580,BATHROOM METAL SIGN,24,0.55,17584.0,United Kingdom,2026-01-31
520707,21658,GLASS  BEURRE DISH,8,3.95,17584.0,United Kingdom,2026-01-31
520707,85123A,WHITE HANGING HEART T-LIGHT HOLDER,12,2.95,17584.0,United Kingdom,2026-01-31
520707,22596,CHRISTMAS STAR WISH LIST CHALKBOARD,24,0.85,17584.0,United Kingdom,2026-01-31
520707,22173,METAL 4 HOOK HANGER FRENCH CHATEAU,32,2.55,17584.0,United Kingdom,2026-01-31
520707,84406B,CREAM CUPID HEARTS COAT HANGER,32,2.75,17584.0,United Kingdom,2026-01-31
520707,82581,TOILET METAL SIGN,24,0.55,17584.0,United Kingdom,2026-01-31
520707,84839,SWEETHEART KEY CABINET,10,5.55,17584.0,United Kingdom,2026-01-31
520707,85068,CREAM SWEETHEART SHELF + HOOKS,12,6.95,17584.0,United Kingdom,2026-01-31
520707,22589,CARDHOLDER GINGHAM STAR,12,2.55,17584.0,United Kingdom,2026-01-31
520707,22588,CARD HOLDER GINGHAM HEART,12,2.55,17584.0,United Kingdom,2026-01-31
520707,35400,WOODEN BOX ADVENT CALENDAR ,2,8.95,17584.0,United Kingdom,2026-01-31
520707,21730,GLASS STAR FROSTED T-LIGHT HOLDER,3,4.95,17584.0,United Kingdom,2026-01-31
520707,21364,PEACE SMALL WOOD LETTERS,8,6.75,17584.0,United Kingdom,2026-01-31
520707,22470,HEART OF WICKER LARGE,6,2.95,17584.0,United Kingdom,2026-01-31
520707,82483,WOOD 2 DRAWER CABINET WHITE FINISH,4,5.95,17584.0,United Kingdom,2026-01-31
520708,20971,PINK BLUE FELT CRAFT TRINKET BOX,12,1.25,18172.0,United Kingdom,2026-01-31
520708,20972,PINK CREAM FELT CRAFT TRINKET BOX ,24,1.25,18172.0,United Kingdom,2026-01-31
520708,22271,FELTCRAFT DOLL ROSIE,6,2.95,18172.0,United Kingdom,2026-01-31
520708,22272,FELTCRAFT DOLL MARIA,6,2.95,18172.0,United Kingdom,2026-01-31
520708,22149,FELTCRAFT 6 FLOWER FRIENDS,12,2.1,18172.0,United Kingdom,2026-01-31
520708,22147,FELTCRAFT BUTTERFLY HEARTS,12,1.45,18172.0,United Kingdom,2026-01-31
520708,22557,PLASTERS IN TIN VINTAGE PAISLEY ,12,1.65,18172.0,United Kingdom,2026-01-31
520708,21790,VINTAGE SNAP CARDS,24,0.85,18172.0,United Kingdom,2026-01-31
520708,22417,PACK OF 60 SPACEBOY CAKE CASES,24,0.55,18172.0,United Kingdom,2026-01-31
520708,22551,PLASTERS IN TIN SPACEBOY,12,1.65,18172.0,United Kingdom,2026-01-31
520708,22492,MINI PAINT SET VINTAGE ,36,0.65,18172.0,United Kingdom,2026-01-31
520709,84763,ZINC FINISH 15CM PLANTER POTS,5,1.25,14693.0,United Kingdom,2026-01-31
520708,22622,BOX OF VINTAGE ALPHABET BLOCKS,6,9.95,18172.0,United Kingdom,2026-01-31
520709,22406,MONEY BOX KINGS CHOICE DESIGN,1,1.25,14693.0,United Kingdom,2026-01-31
520709,21901,"KEY FOB , BACK DOOR ",4,0.65,14693.0,United Kingdom,2026-01-31
520709,22672,FRENCH BATHROOM SIGN BLUE METAL,1,1.65,14693.0,United Kingdom,2026-01-31
520709,72760B,VINTAGE CREAM 3 BASKET CAKE STAND,2,9.95,14693.0,United Kingdom,2026-01-31
520709,21172,PARTY METAL SIGN ,2,1.45,14693.0,United Kingdom,2026-01-31
520709,85141,JARDIN ETCHED GLASS FRUITBOWL,1,10.75,14693.0,United Kingdom,2026-01-31
520709,85104,SILVER GLASS T-LIGHT SET,1,2.95,14693.0,United Kingdom,2026-01-31
520709,22361,GLASS JAR DAISY FRESH COTTON WOOL,1,2.95,14693.0,United Kingdom,2026-01-31
520709,21902,"KEY FOB , FRONT  DOOR ",4,0.65,14693.0,United Kingdom,2026-01-31
520709,22423,REGENCY CAKESTAND 3 TIER,10,12.75,14693.0,United Kingdom,2026-01-31
520709,21900,"KEY FOB , SHED",2,0.65,14693.0,United Kingdom,2026-01-31
520709,82580,BATHROOM METAL SIGN,2,0.55,14693.0,United Kingdom,2026-01-31
520709,22670,FRENCH WC SIGN BLUE METAL,2,1.25,14693.0,United Kingdom,2026-01-31
520709,22674,FRENCH TOILET SIGN BLUE METAL,2,1.25,14693.0,United Kingdom,2026-01-31
520709,21899,"KEY FOB , GARAGE DESIGN",2,0.65,14693.0,United Kingdom,2026-01-31
520710,21843,RED RETROSPOT CAKE STAND,1,10.95,14388.0,United Kingdom,2026-01-31
520710,22355,CHARLOTTE BAG SUKI DESIGN,10,0.85,14388.0,United Kingdom,2026-01-31
520710,20724,RED SPOTTY CHARLOTTE BAG,10,0.85,14388.0,United Kingdom,2026-01-31
520710,22628,PICNIC BOXES SET OF 3 RETROSPOT ,2,4.95,14388.0,United Kingdom,2026-01-31
520710,20718,RED SPOTTY SHOPPER BAG,10,1.25,14388.0,United Kingdom,2026-01-31
520710,22328,ROUND SNACK BOXES SET OF 4 FRUITS ,6,2.95,14388.0,United Kingdom,2026-01-31
520710,21213,PACK OF 72 SKULL CAKE CASES,24,0.55,14388.0,United Kingdom,2026-01-31
520710,21217,RED SPOTTY ROUND CAKE TINS,1,9.95,14388.0,United Kingdom,2026-01-31
520710,22423,REGENCY CAKESTAND 3 TIER,1,12.75,14388.0,United Kingdom,2026-01-31
520710,22384,LUNCH BAG PINK RETROSPOT,10,1.65,14388.0,United Kingdom,2026-01-31
520710,22383,LUNCH BAG SUKI  DESIGN ,10,1.65,14388.0,United Kingdom,2026-01-31
520710,22675,FRENCH KITCHEN SIGN BLUE METAL,12,1.25,14388.0,United Kingdom,2026-01-31
520710,20711,JUMBO BAG TOYS ,10,1.95,14388.0,United Kingdom,2026-01-31
520710,22386,JUMBO BAG PINK WITH WHITE SPOTS,10,1.95,14388.0,United Kingdom,2026-01-31
520710,22411,JUMBO SHOPPER VINTAGE RED PAISLEY,10,1.95,14388.0,United Kingdom,2026-01-31
520710,22663,JUMBO BAG DOLLY GIRL DESIGN,10,1.95,14388.0,United Kingdom,2026-01-31
520710,85099C,JUMBO  BAG BAROQUE BLACK WHITE,10,1.95,14388.0,United Kingdom,2026-01-31
520710,85099F,JUMBO BAG STRAWBERRY,10,1.95,14388.0,United Kingdom,2026-01-31
520710,21931,JUMBO STORAGE BAG SUKI,10,1.95,14388.0,United Kingdom,2026-01-31
520710,20725,LUNCH BAG RED SPOTTY,10,1.65,14388.0,United Kingdom,2026-01-31
520711,85099C,JUMBO  BAG BAROQUE BLACK WHITE,100,1.65,14607.0,United Kingdom,2026-01-31
520712,21733,RED HANGING HEART T-LIGHT HOLDER,8,2.95,13059.0,United Kingdom,2026-01-31
520712,85123A,WHITE HANGING HEART T-LIGHT HOLDER,8,2.95,13059.0,United Kingdom,2026-01-31
520712,22111,SCOTTIE DOG HOT WATER BOTTLE,3,4.95,13059.0,United Kingdom,2026-01-31
520712,22061,LARGE CAKE STAND  HANGING STRAWBERY,2,9.95,13059.0,United Kingdom,2026-01-31
520712,22242,"HOOK, 5 HANGER , MAGIC TOADSTOOL",12,1.65,13059.0,United Kingdom,2026-01-31
520712,22060,LARGE CAKE STAND HANGING HEARTS,2,9.95,13059.0,United Kingdom,2026-01-31
520712,22114,HOT WATER BOTTLE TEA AND SYMPATHY,4,3.95,13059.0,United Kingdom,2026-01-31
520712,21696,SMALL SILVER TRELLIS CANDLEPOT,6,2.95,13059.0,United Kingdom,2026-01-31
520712,37495,FAIRY CAKE BIRTHDAY CANDLE SET,4,3.75,13059.0,United Kingdom,2026-01-31
520712,21741,COSY SLIPPER SHOES LARGE GREEN,6,2.95,13059.0,United Kingdom,2026-01-31
520712,21738,COSY SLIPPER SHOES SMALL  RED ,6,2.95,13059.0,United Kingdom,2026-01-31
520712,71053,WHITE METAL LANTERN,4,3.75,13059.0,United Kingdom,2026-01-31
520712,21621,VINTAGE UNION JACK BUNTING,4,8.5,13059.0,United Kingdom,2026-01-31
520712,22423,REGENCY CAKESTAND 3 TIER,3,12.75,13059.0,United Kingdom,2026-01-31
520712,22646,CERAMIC STRAWBERRY CAKE MONEY BANK,12,1.45,13059.0,United Kingdom,2026-01-31
520713,85150,LADIES & GENTLEMEN METAL SIGN,48,2.1,15722.0,United Kingdom,2026-01-31
520713,90209A,PURPLE ENAMEL+GLASS HAIR COMB,36,1.75,15722.0,United Kingdom,2026-01-31
520713,21181,PLEASE ONE PERSON METAL SIGN,48,1.85,15722.0,United Kingdom,2026-01-31
520713,85099F,JUMBO BAG STRAWBERRY,4,1.95,15722.0,United Kingdom,2026-01-31
520713,90209B,GREEN ENAMEL+GLASS HAIR COMB,72,1.75,15722.0,United Kingdom,2026-01-31
520713,90208,PAIR OF ENAMEL FLOWER CLUSTER SLIDE,36,2.1,15722.0,United Kingdom,2026-01-31
520713,72807A,SET/3 ROSE CANDLE IN JEWELLED BOX,3,4.25,15722.0,United Kingdom,2026-01-31
520713,21621,VINTAGE UNION JACK BUNTING,11,8.5,15722.0,United Kingdom,2026-01-31
520713,84029G,KNITTED UNION FLAG HOT WATER BOTTLE,2,3.75,15722.0,United Kingdom,2026-01-31
520713,84029E,RED WOOLLY HOTTIE WHITE HEART.,3,3.75,15722.0,United Kingdom,2026-01-31
520713,21488,RED WHITE SCARF  HOT WATER BOTTLE,2,3.95,15722.0,United Kingdom,2026-01-31
520714,22681,"FRENCH BLUE METAL DOOR SIGN, 6",10,1.25,14422.0,United Kingdom,2026-01-31
520713,21134,VICTORIAN METAL POSTCARD CHRISTMAS,9,1.65,15722.0,United Kingdom,2026-01-31
520713,90005A,JADE GREEN ENAMEL HAIR COMB,12,1.95,15722.0,United Kingdom,2026-01-31
520713,21175,GIN + TONIC DIET METAL SIGN,48,1.85,15722.0,United Kingdom,2026-01-31
520713,82483,WOOD 2 DRAWER CABINET WHITE FINISH,4,5.95,15722.0,United Kingdom,2026-01-31
520713,82599,FANNY'S REST STOPMETAL SIGN,12,2.1,15722.0,United Kingdom,2026-01-31
520713,21172,PARTY METAL SIGN ,10,1.45,15722.0,United Kingdom,2026-01-31
520713,82600,NO SINGING METAL SIGN,12,2.1,15722.0,United Kingdom,2026-01-31
520713,21908,CHOCOLATE THIS WAY METAL SIGN,12,2.1,15722.0,United Kingdom,2026-01-31
520713,22671,FRENCH LAUNDRY SIGN BLUE METAL,6,1.65,15722.0,United Kingdom,2026-01-31
520713,22674,FRENCH TOILET SIGN BLUE METAL,3,1.25,15722.0,United Kingdom,2026-01-31
520713,22675,FRENCH KITCHEN SIGN BLUE METAL,3,1.25,15722.0,United Kingdom,2026-01-31
520713,22670,FRENCH WC SIGN BLUE METAL,6,1.25,15722.0,United Kingdom,2026-01-31
520713,22121,NOEL WOODEN BLOCK LETTERS ,6,5.95,15722.0,United Kingdom,2026-01-31
520713,85152,HAND OVER THE CHOCOLATE   SIGN ,48,1.69,15722.0,United Kingdom,2026-01-31
520713,21174,POTTERING IN THE SHED METAL SIGN,48,1.65,15722.0,United Kingdom,2026-01-31
520714,22680,"FRENCH BLUE METAL DOOR SIGN, 5",10,1.25,14422.0,United Kingdom,2026-01-31
520713,82486,WOOD S/3 CABINET ANT WHITE FINISH,4,7.95,15722.0,United Kingdom,2026-01-31
520713,72807B,SET/3 OCEAN SCENT CANDLE JEWEL BOX,3,4.25,15722.0,United Kingdom,2026-01-31
520713,21623,VINTAGE UNION JACK MEMOBOARD,2,9.95,15722.0,United Kingdom,2026-01-31
520714,84836,ZINC METAL HEART DECORATION,12,1.25,14422.0,United Kingdom,2026-01-31
520714,21733,RED HANGING HEART T-LIGHT HOLDER,6,2.95,14422.0,United Kingdom,2026-01-31
520714,22682,"FRENCH BLUE METAL DOOR SIGN, 7",10,1.25,14422.0,United Kingdom,2026-01-31
520714,22683,"FRENCH BLUE METAL DOOR SIGN, 8",10,1.25,14422.0,United Kingdom,2026-01-31
520714,22684,"FRENCH BLUE METAL DOOR SIGN, 9",10,1.25,14422.0,United Kingdom,2026-01-31
520714,22685,"FRENCH BLUE METAL DOOR SIGN, 0",10,1.25,14422.0,United Kingdom,2026-01-31
520714,22686,"FRENCH BLUE METAL DOOR SIGN, No",12,1.25,14422.0,United Kingdom,2026-01-31
520714,22694,WICKER STAR ,12,2.1,14422.0,United Kingdom,2026-01-31
520714,22696,WICKER WREATH LARGE,6,1.95,14422.0,United Kingdom,2026-01-31
520714,22670,FRENCH WC SIGN BLUE METAL,12,1.25,14422.0,United Kingdom,2026-01-31
520714,22671,FRENCH LAUNDRY SIGN BLUE METAL,12,1.65,14422.0,United Kingdom,2026-01-31
520714,22672,FRENCH BATHROOM SIGN BLUE METAL,12,1.65,14422.0,United Kingdom,2026-01-31
520714,22674,FRENCH TOILET SIGN BLUE METAL,12,1.25,14422.0,United Kingdom,2026-01-31
520714,22675,FRENCH KITCHEN SIGN BLUE METAL,12,1.25,14422.0,United Kingdom,2026-01-31
520714,22676,"FRENCH BLUE METAL DOOR SIGN, 1",10,1.25,14422.0,United Kingdom,2026-01-31
520714,22695,WICKER WREATH SMALL,12,1.45,14422.0,United Kingdom,2026-01-31
520714,22678,"FRENCH BLUE METAL DOOR SIGN, 3",10,1.25,14422.0,United Kingdom,2026-01-31
520714,22677,"FRENCH BLUE METAL DOOR SIGN, 2",10,1.25,14422.0,United Kingdom,2026-01-31
520714,22577,WOODEN HEART CHRISTMAS SCANDINAVIAN,12,0.85,14422.0,United Kingdom,2026-01-31
520714,22082,RIBBON REEL STRIPES DESIGN ,10,1.65,14422.0,United Kingdom,2026-01-31
520714,22081,RIBBON REEL FLORA + FAUNA ,10,1.65,14422.0,United Kingdom,2026-01-31
520714,22574,HEART WOODEN CHRISTMAS DECORATION,12,0.85,14422.0,United Kingdom,2026-01-31
520714,22079,RIBBON REEL HEARTS DESIGN ,10,1.65,14422.0,United Kingdom,2026-01-31
520714,22078,RIBBON REEL LACE DESIGN ,10,2.1,14422.0,United Kingdom,2026-01-31
520714,22080,RIBBON REEL SPOTS DESIGN ,10,1.65,14422.0,United Kingdom,2026-01-31
520714,84352,SILVER CHRISTMAS TREE BAUBLE STAND ,2,16.95,14422.0,United Kingdom,2026-01-31
520714,35961,FOLKART ZINC HEART CHRISTMAS DEC,12,0.85,14422.0,United Kingdom,2026-01-31
520714,21143,ANTIQUE GLASS HEART DECORATION ,12,1.95,14422.0,United Kingdom,2026-01-31
520714,85123A,WHITE HANGING HEART T-LIGHT HOLDER,6,2.95,14422.0,United Kingdom,2026-01-31
520714,20943,SET/6 GINGERBREAD STAR T-LIGHTS,12,1.25,14422.0,United Kingdom,2026-01-31
520714,22679,"FRENCH BLUE METAL DOOR SIGN, 4",10,1.25,14422.0,United Kingdom,2026-01-31
520715,22604,SET OF 4 NAPKIN CHARMS CUTLERY,5,2.55,16510.0,United Kingdom,2026-01-31
520715,22457,NATURAL SLATE HEART CHALKBOARD ,12,2.95,16510.0,United Kingdom,2026-01-31
520715,22575,METAL MERRY CHRISTMAS WREATH,8,1.95,16510.0,United Kingdom,2026-01-31
520715,22082,RIBBON REEL STRIPES DESIGN ,5,1.65,16510.0,United Kingdom,2026-01-31
520715,22173,METAL 4 HOOK HANGER FRENCH CHATEAU,3,2.95,16510.0,United Kingdom,2026-01-31
520715,21695,SMALL SILVER FLOWER CANDLE POT,6,2.95,16510.0,United Kingdom,2026-01-31
520715,21359,RELAX LARGE WOOD LETTERS,1,15.95,16510.0,United Kingdom,2026-01-31
520715,21737,SET 3 WICKER LOG BASKETS,2,19.95,16510.0,United Kingdom,2026-01-31
520715,21755,LOVE BUILDING BLOCK WORD,1,5.95,16510.0,United Kingdom,2026-01-31
520715,21755,LOVE BUILDING BLOCK WORD,1,5.95,16510.0,United Kingdom,2026-01-31
520715,21260,FIRST AID TIN,3,3.25,16510.0,United Kingdom,2026-01-31
520715,22120,WELCOME  WOODEN BLOCK LETTERS,2,9.95,16510.0,United Kingdom,2026-01-31
520715,21742,LARGE ROUND WICKER PLATTER ,3,5.95,16510.0,United Kingdom,2026-01-31
520715,85061W,WHITE JEWELLED HEART DECORATION,24,0.85,16510.0,United Kingdom,2026-01-31
520715,21688,SILVER PLATE CANDLE BOWL SMALL,6,2.95,16510.0,United Kingdom,2026-01-31
520715,22296,HEART IVORY TRELLIS LARGE,12,1.65,16510.0,United Kingdom,2026-01-31
520715,22588,CARD HOLDER GINGHAM HEART,5,2.55,16510.0,United Kingdom,2026-01-31
520715,22601,CHRISTMAS RETROSPOT ANGEL WOOD,12,0.85,16510.0,United Kingdom,2026-01-31
520715,22080,RIBBON REEL SPOTS DESIGN ,5,1.65,16510.0,United Kingdom,2026-01-31
520715,35400,WOODEN BOX ADVENT CALENDAR ,1,8.95,16510.0,United Kingdom,2026-01-31
520715,21900,"KEY FOB , SHED",12,0.65,16510.0,United Kingdom,2026-01-31
520715,22139,RETRO SPOT TEA SET CERAMIC 11 PC ,1,4.95,16510.0,United Kingdom,2026-01-31
520715,21900,"KEY FOB , SHED",3,0.65,16510.0,United Kingdom,2026-01-31
520715,21902,"KEY FOB , FRONT  DOOR ",9,0.65,16510.0,United Kingdom,2026-01-31
520715,M,Manual,3,6.75,16510.0,United Kingdom,2026-01-31
520715,21361,LOVE LARGE WOOD LETTERS ,2,12.75,16510.0,United Kingdom,2026-01-31
520715,21364,PEACE SMALL WOOD LETTERS,2,6.75,16510.0,United Kingdom,2026-01-31
520715,22082,RIBBON REEL STRIPES DESIGN ,5,1.65,16510.0,United Kingdom,2026-01-31
520715,22219,LOVEBIRD HANGING DECORATION WHITE ,12,0.85,16510.0,United Kingdom,2026-01-31
520715,84879,ASSORTED COLOUR BIRD ORNAMENT,8,1.69,16510.0,United Kingdom,2026-01-31
520715,84754,S/15 SILVER GLASS BAUBLES IN BAG,12,1.25,16510.0,United Kingdom,2026-01-31
520715,22265,EASTER DECORATION NATURAL CHICK,13,0.65,16510.0,United Kingdom,2026-01-31
520715,22652,TRAVEL SEWING KIT,5,1.65,16510.0,United Kingdom,2026-01-31
520716,21737,SET 3 WICKER LOG BASKETS,1,19.95,15722.0,United Kingdom,2026-01-31
520717,16169N,WRAP BLUE RUSSIAN FOLKART,50,0.19,13093.0,United Kingdom,2026-01-31
520717,21066,VINTAGE RED MUG,36,0.38,13093.0,United Kingdom,2026-01-31
520717,21067,VINTAGE RED TEATIME MUG,60,0.38,13093.0,United Kingdom,2026-01-31
520717,21316,SMALL CHUNKY GLASS ROMAN  BOWL,32,0.85,13093.0,United Kingdom,2026-01-31
520717,22675,FRENCH KITCHEN SIGN BLUE METAL,96,1.06,13093.0,United Kingdom,2026-01-31
520717,35809A,ENAMEL PINK TEA CONTAINER,48,0.85,13093.0,United Kingdom,2026-01-31
520717,35810A,ENAMEL PINK COFFEE CONTAINER,36,0.85,13093.0,United Kingdom,2026-01-31
520717,72819,CUPID DESIGN SCENTED CANDLES,48,0.85,13093.0,United Kingdom,2026-01-31
520717,48188,DOORMAT WELCOME PUPPIES,10,6.35,13093.0,United Kingdom,2026-01-31
520717,22690,DOORMAT HOME SWEET HOME BLUE ,10,6.35,13093.0,United Kingdom,2026-01-31
520717,16169P,WRAP GREEN RUSSIAN FOLKART ,50,0.19,13093.0,United Kingdom,2026-01-31
520717,22672,FRENCH BATHROOM SIGN BLUE METAL,96,1.45,13093.0,United Kingdom,2026-01-31
520717,22697,GREEN REGENCY TEACUP AND SAUCER,24,2.55,13093.0,United Kingdom,2026-01-31
520717,72801C,4 ROSE PINK DINNER CANDLES,48,0.42,13093.0,United Kingdom,2026-01-31
520717,22699,ROSES REGENCY TEACUP AND SAUCER ,24,2.55,13093.0,United Kingdom,2026-01-31
520717,22423,REGENCY CAKESTAND 3 TIER,16,10.95,13093.0,United Kingdom,2026-01-31
520717,22698,PINK REGENCY TEACUP AND SAUCER,24,2.55,13093.0,United Kingdom,2026-01-31
520718,82486,WOOD S/3 CABINET ANT WHITE FINISH,2,7.95,13540.0,United Kingdom,2026-01-31
520718,22173,METAL 4 HOOK HANGER FRENCH CHATEAU,8,2.95,13540.0,United Kingdom,2026-01-31
520718,21745,GAOLERS KEYS DECORATIVE GARDEN ,4,3.75,13540.0,United Kingdom,2026-01-31
520718,21755,LOVE BUILDING BLOCK WORD,6,5.95,13540.0,United Kingdom,2026-01-31
520718,82494L,WOODEN FRAME ANTIQUE WHITE ,6,2.95,13540.0,United Kingdom,2026-01-31
520718,48194,DOORMAT HEARTS,2,7.49,13540.0,United Kingdom,2026-01-31
520718,48173C,DOORMAT BLACK FLOCK ,2,7.49,13540.0,United Kingdom,2026-01-31
520718,84840,SWEETHEART CARRY-ALL BASKET,4,8.5,13540.0,United Kingdom,2026-01-31
520718,21333,CLASSIC WHITE FRAME,8,2.95,13540.0,United Kingdom,2026-01-31
520718,22168,ORGANISER WOOD ANTIQUE WHITE ,2,8.5,13540.0,United Kingdom,2026-01-31
520718,21754,HOME BUILDING BLOCK WORD,6,5.95,13540.0,United Kingdom,2026-01-31
520718,20685,DOORMAT RED SPOT,2,7.49,13540.0,United Kingdom,2026-01-31
520719,21385,IVORY HANGING DECORATION  HEART,2,0.85,17792.0,United Kingdom,2026-01-31
520719,85062,PEARL CRYSTAL PUMPKIN T-LIGHT HLDR,2,1.65,17792.0,United Kingdom,2026-01-31
520719,22465,HANGING METAL STAR LANTERN,1,1.65,17792.0,United Kingdom,2026-01-31
520719,21054,NURSE'S BAG SOFT TOY,1,8.95,17792.0,United Kingdom,2026-01-31
520719,90214K,"LETTER ""K"" BLING KEY RING",1,1.25,17792.0,United Kingdom,2026-01-31
520719,22556,PLASTERS IN TIN CIRCUS PARADE ,1,1.65,17792.0,United Kingdom,2026-01-31
520719,21462,"NURSERY A,B,C PAINTED LETTERS",2,6.75,17792.0,United Kingdom,2026-01-31
520719,22296,HEART IVORY TRELLIS LARGE,2,1.65,17792.0,United Kingdom,2026-01-31
520719,22155,STAR DECORATION RUSTIC,1,0.42,17792.0,United Kingdom,2026-01-31
520719,20615,BLUE SPOTTY PASSPORT COVER,1,2.1,17792.0,United Kingdom,2026-01-31
520719,22158,3 HEARTS HANGING DECORATION RUSTIC,1,2.95,17792.0,United Kingdom,2026-01-31
520719,22596,CHRISTMAS STAR WISH LIST CHALKBOARD,2,0.85,17792.0,United Kingdom,2026-01-31
520719,22386,JUMBO BAG PINK WITH WHITE SPOTS,1,1.95,17792.0,United Kingdom,2026-01-31
520719,22551,PLASTERS IN TIN SPACEBOY,2,1.65,17792.0,United Kingdom,2026-01-31
520719,35400,WOODEN BOX ADVENT CALENDAR ,1,8.95,17792.0,United Kingdom,2026-01-31
520719,85129C,BEADED CRYSTAL HEART BLUE SMALL,1,1.25,17792.0,United Kingdom,2026-01-31
520719,22465,HANGING METAL STAR LANTERN,2,1.65,17792.0,United Kingdom,2026-01-31
520719,85066,CREAM SWEETHEART MINI CHEST,1,12.75,17792.0,United Kingdom,2026-01-31
520719,21317,GLASS SPHERE CANDLE STAND MEDIUM,1,5.45,17792.0,United Kingdom,2026-01-31
520719,22121,NOEL WOODEN BLOCK LETTERS ,2,5.95,17792.0,United Kingdom,2026-01-31
520719,82583,HOT BATHS METAL SIGN,2,2.1,17792.0,United Kingdom,2026-01-31
520719,21166,COOK WITH WINE METAL SIGN ,1,1.95,17792.0,United Kingdom,2026-01-31
520719,21754,HOME BUILDING BLOCK WORD,2,5.95,17792.0,United Kingdom,2026-01-31
520719,85129A,"WHITE PEARL BEADED HEART, SMALL",1,1.25,17792.0,United Kingdom,2026-01-31
520719,22156,HEART DECORATION WITH PEARLS ,3,0.85,17792.0,United Kingdom,2026-01-31
520719,22384,LUNCH BAG PINK RETROSPOT,1,1.65,17792.0,United Kingdom,2026-01-31
520719,20727,LUNCH BAG  BLACK SKULL.,1,1.65,17792.0,United Kingdom,2026-01-31
520719,22596,CHRISTMAS STAR WISH LIST CHALKBOARD,2,0.85,17792.0,United Kingdom,2026-01-31
520719,22155,STAR DECORATION RUSTIC,2,0.42,17792.0,United Kingdom,2026-01-31
520721,22600,CHRISTMAS RETROSPOT STAR WOOD,24,0.85,13922.0,United Kingdom,2026-01-31
520721,21349,IVY HEART WREATH,10,6.75,13922.0,United Kingdom,2026-01-31
520721,21889,WOODEN BOX OF DOMINOES,12,1.25,13922.0,United Kingdom,2026-01-31
520721,22158,3 HEARTS HANGING DECORATION RUSTIC,8,2.95,13922.0,United Kingdom,2026-01-31
520721,22161,HEART DECORATION RUSTIC HANGING ,24,0.65,13922.0,United Kingdom,2026-01-31
520721,22603,CHRISTMAS RETROSPOT TREE WOOD,24,0.85,13922.0,United Kingdom,2026-01-31
520721,22602,CHRISTMAS RETROSPOT HEART WOOD,24,0.85,13922.0,United Kingdom,2026-01-31
520721,22601,CHRISTMAS RETROSPOT ANGEL WOOD,24,0.85,13922.0,United Kingdom,2026-01-31
520720,20973,12 PENCIL SMALL TUBE WOODLAND,1,0.65,13069.0,United Kingdom,2026-01-31
520720,22487,WHITE WOOD GARDEN PLANT LADDER,1,9.95,13069.0,United Kingdom,2026-01-31
520720,82600,NO SINGING METAL SIGN,1,2.1,13069.0,United Kingdom,2026-01-31
520720,85152,HAND OVER THE CHOCOLATE   SIGN ,1,2.1,13069.0,United Kingdom,2026-01-31
520720,21181,PLEASE ONE PERSON METAL SIGN,1,2.1,13069.0,United Kingdom,2026-01-31
520720,84971S,SMALL HEART FLOWERS HOOK ,2,0.85,13069.0,United Kingdom,2026-01-31
520720,21232,STRAWBERRY CERAMIC TRINKET BOX,1,1.25,13069.0,United Kingdom,2026-01-31
520720,84405A,S/3 PINK COL METAL BASKET W HANDLE,6,4.95,13069.0,United Kingdom,2026-01-31
520720,21034,REX CASH+CARRY JUMBO SHOPPER,1,0.95,13069.0,United Kingdom,2026-01-31
520721,85048,15CM CHRISTMAS GLASS BALL 20 LIGHTS,12,6.95,13922.0,United Kingdom,2026-01-31
520720,84406B,CREAM CUPID HEARTS COAT HANGER,1,3.25,13069.0,United Kingdom,2026-01-31
520721,84832,ZINC WILLIE WINKIE  CANDLE STICK,12,0.85,13922.0,United Kingdom,2026-01-31
520720,84970L,SINGLE HEART ZINC T-LIGHT HOLDER,1,0.95,13069.0,United Kingdom,2026-01-31
520721,20727,LUNCH BAG  BLACK SKULL.,10,1.65,13922.0,United Kingdom,2026-01-31
520721,84347,ROTATING SILVER ANGELS T-LIGHT HLDR,6,2.55,13922.0,United Kingdom,2026-01-31
520720,22568,FELTCRAFT CUSHION OWL,1,3.75,13069.0,United Kingdom,2026-01-31
520720,20973,12 PENCIL SMALL TUBE WOODLAND,5,0.65,13069.0,United Kingdom,2026-01-31
520720,22596,CHRISTMAS STAR WISH LIST CHALKBOARD,24,0.85,13069.0,United Kingdom,2026-01-31
520720,22151,PLACE SETTING WHITE HEART,24,0.42,13069.0,United Kingdom,2026-01-31
520720,22215,CAKE STAND WHITE TWO TIER LACE,1,8.5,13069.0,United Kingdom,2026-01-31
