Invoice,StockCode,Description,Quantity,Price,Customer ID,Country,InvoiceDate
532034,77101A,UNION FLAG WINDSOCK,1,1.25,15001.0,United Kingdom,2026-04-03
532034,15039,SANDALWOOD FAN,2,0.85,15001.0,United Kingdom,2026-04-03
532034,84341B,SMALL PINK MAGIC CHRISTMAS TREE,2,0.85,15001.0,United Kingdom,2026-04-03
532034,20985,HEART CALCULATOR,1,1.25,15001.0,United Kingdom,2026-04-03
532034,85040A,S/4 PINK FLOWER CANDLES IN BOWL,2,1.65,15001.0,United Kingdom,2026-04-03
532034,21564,PINK  HEART SHAPE LOVE BUCKET ,1,2.95,15001.0,United Kingdom,2026-04-03
532034,21931,JUMBO STORAGE BAG SUKI,4,1.95,15001.0,United Kingdom,2026-04-03
532034,21865,PINK UNION JACK  PASSPORT COVER ,1,2.1,15001.0,United Kingdom,2026-04-03
532034,22605,WOODEN CROQUET GARDEN SET,1,14.95,15001.0,United Kingdom,2026-04-03
532036,84947,ANTIQUE SILVER TEA GLASS ENGRAVED,12,1.25,14615.0,United Kingdom,2026-04-03
532036,21755,LOVE BUILDING BLOCK WORD,3,5.95,14615.0,United Kingdom,2026-04-03
532036,21181,PLEASE ONE PERSON METAL SIGN,12,2.1,14615.0,United Kingdom,2026-04-03
532036,22423,REGENCY CAKESTAND 3 TIER,4,12.75,14615.0,United Kingdom,2026-04-03
532036,82583,HOT BATHS METAL SIGN,12,2.1,14615.0,United Kingdom,2026-04-03
532037,21533,RETROSPOT LARGE MILK JUG,3,4.95,16119.0,United Kingdom,2026-04-03
532037,22831,WHITE BROCANTE SOAP DISH,6,2.95,16119.0,United Kingdom,2026-04-03
532037,22457,NATURAL SLATE HEART CHALKBOARD ,6,2.95,16119.0,United Kingdom,2026-04-03
532037,22784,LANTERN CREAM GAZEBO ,6,4.95,16119.0,United Kingdom,2026-04-03
532037,21535,RED RETROSPOT SMALL MILK JUG,6,2.55,16119.0,United Kingdom,2026-04-03
532037,22465,HANGING METAL STAR LANTERN,12,1.65,16119.0,United Kingdom,2026-04-03
532037,82482,WOODEN PICTURE FRAME WHITE FINISH,6,2.55,16119.0,United Kingdom,2026-04-03
532037,22759,SET OF 3 NOTEBOOKS IN PARCEL,12,1.65,16119.0,United Kingdom,2026-04-03
532037,22801,ANTIQUE GLASS PEDESTAL BOWL,8,3.75,16119.0,United Kingdom,2026-04-03
532037,22460,EMBOSSED GLASS TEALIGHT HOLDER,24,1.25,16119.0,United Kingdom,2026-04-03
532038,22683,"FRENCH BLUE METAL DOOR SIGN, 8",6,1.25,17515.0,United Kingdom,2026-04-03
532038,21166,COOK WITH WINE METAL SIGN ,1,1.95,17515.0,United Kingdom,2026-04-03
532038,85008,SET OF 3 CONEY ISLAND OVAL BOXES,1,4.95,17515.0,United Kingdom,2026-04-03
532038,22672,FRENCH BATHROOM SIGN BLUE METAL,3,1.65,17515.0,United Kingdom,2026-04-03
532038,22675,FRENCH KITCHEN SIGN BLUE METAL,3,1.25,17515.0,United Kingdom,2026-04-03
532038,22685,"FRENCH BLUE METAL DOOR SIGN, 0",6,1.25,17515.0,United Kingdom,2026-04-03
532038,22677,FRENCH BLUE METAL DOOR SIGN 2,10,1.25,17515.0,United Kingdom,2026-04-03
532038,22680,FRENCH BLUE METAL DOOR SIGN 5,6,1.25,17515.0,United Kingdom,2026-04-03
532038,22681,"FRENCH BLUE METAL DOOR SIGN, 6",6,1.25,17515.0,United Kingdom,2026-04-03
532038,22679,FRENCH BLUE METAL DOOR SIGN 4,6,1.25,17515.0,United Kingdom,2026-04-03
532038,22678,FRENCH BLUE METAL DOOR SIGN 3,6,1.25,17515.0,United Kingdom,2026-04-03
532038,22676,FRENCH BLUE METAL DOOR SIGN 1,10,1.25,17515.0,United Kingdom,2026-04-03
532038,22682,"FRENCH BLUE METAL DOOR SIGN, 7",6,1.25,17515.0,United Kingdom,2026-04-03
532038,22413,METAL SIGN TAKE IT OR LEAVE IT ,1,2.95,17515.0,United Kingdom,2026-04-03
532038,21181,PLEASE ONE PERSON METAL SIGN,1,2.1,17515.0,United Kingdom,2026-04-03
532038,22079,RIBBON REEL HEARTS DESIGN ,5,1.65,17515.0,United Kingdom,2026-04-03
532038,21907,I'M ON HOLIDAY METAL SIGN,1,2.1,17515.0,United Kingdom,2026-04-03
532038,21735,TWO DOOR CURIO CABINET,1,12.75,17515.0,United Kingdom,2026-04-03
532038,22762,CUPBOARD 3 DRAWER MA CAMPAGNE,1,14.95,17515.0,United Kingdom,2026-04-03
532038,22764,"RUSTIC WOODEN CABINET, GLASS DOORS",2,24.95,17515.0,United Kingdom,2026-04-03
532038,22761,CHEST 7 DRAWER MA CAMPAGNE,1,24.95,17515.0,United Kingdom,2026-04-03
532038,22763,KEY CABINET MA CAMPAGNE,1,9.95,17515.0,United Kingdom,2026-04-03
532038,85067,CREAM SWEETHEART WALL CABINET,1,18.95,17515.0,United Kingdom,2026-04-03
532038,22830,UTILTY CABINET WITH HOOKS,1,26.95,17515.0,United Kingdom,2026-04-03
532038,22833,HALL CABINET WITH 3 DRAWERS,1,49.95,17515.0,United Kingdom,2026-04-03
532038,22077,6 RIBBONS RUSTIC CHARM,6,1.65,17515.0,United Kingdom,2026-04-03
532038,22737,RIBBON REEL CHRISTMAS PRESENT ,2,1.65,17515.0,United Kingdom,2026-04-03
532038,22765,NEWSPAPER STAND,1,14.95,17515.0,United Kingdom,2026-04-03
532039,21165,BEWARE OF THE CAT METAL SIGN ,24,1.69,13183.0,United Kingdom,2026-04-03
532039,21181,PLEASE ONE PERSON METAL SIGN,48,1.85,13183.0,United Kingdom,2026-04-03
532039,21166,COOK WITH WINE METAL SIGN ,48,1.69,13183.0,United Kingdom,2026-04-03
532039,21175,GIN + TONIC DIET METAL SIGN,48,1.85,13183.0,United Kingdom,2026-04-03
532039,82600,NO SINGING METAL SIGN,48,1.69,13183.0,United Kingdom,2026-04-03
532039,82583,HOT BATHS METAL SIGN,72,1.69,13183.0,United Kingdom,2026-04-03
532040,90180A,BLACK+WHITE NECKLACE W TASSEL,1,9.95,15001.0,United Kingdom,2026-04-03
532040,90184C,BLACK CHUNKY BEAD BRACELET W STRAP,1,8.95,15001.0,United Kingdom,2026-04-03
532040,90179C,BLACK FINE BEAD NECKLACE W TASSEL,1,5.95,15001.0,United Kingdom,2026-04-03
C532041,22631,CIRCUS PARADE LUNCH BOX ,-1,1.95,12474.0,Germany,2026-04-03
C532041,20682,RED RETROSPOT CHILDRENS UMBRELLA,-2,3.25,12474.0,Germany,2026-04-03
532042,21877,HOME SWEET HOME MUG,6,1.25,15551.0,United Kingdom,2026-04-03
532042,21868,POTTING SHED TEA MUG,6,1.25,15551.0,United Kingdom,2026-04-03
532042,22304,COFFEE MUG BLUE PAISLEY DESIGN,6,2.55,15551.0,United Kingdom,2026-04-03
532042,71477,COLOUR GLASS. STAR T-LIGHT HOLDER,1,3.25,15551.0,United Kingdom,2026-04-03
532042,22224,WHITE LOVEBIRD LANTERN,9,2.95,15551.0,United Kingdom,2026-04-03
532042,84879,ASSORTED COLOUR BIRD ORNAMENT,16,1.69,15551.0,United Kingdom,2026-04-03
532042,22698,PINK REGENCY TEACUP AND SAUCER,2,2.95,15551.0,United Kingdom,2026-04-03
532042,22697,GREEN REGENCY TEACUP AND SAUCER,2,2.95,15551.0,United Kingdom,2026-04-03
532042,71459,HANGING JAM JAR T-LIGHT HOLDER,10,0.85,15551.0,United Kingdom,2026-04-03
532042,22119,PEACE WOODEN BLOCK LETTERS,1,6.95,15551.0,United Kingdom,2026-04-03
532042,82494L,WOODEN FRAME ANTIQUE WHITE ,6,2.95,15551.0,United Kingdom,2026-04-03
532042,22863,SOAP DISH BROCANTE,4,2.95,15551.0,United Kingdom,2026-04-03
532042,22811,SET OF 6 T-LIGHTS CACTI ,6,2.95,15551.0,United Kingdom,2026-04-03
532042,71477,COLOUR GLASS. STAR T-LIGHT HOLDER,2,3.25,15551.0,United Kingdom,2026-04-03
532042,22575,METAL MERRY CHRISTMAS WREATH,16,1.95,15551.0,United Kingdom,2026-04-03
532042,22699,ROSES REGENCY TEACUP AND SAUCER ,2,2.95,15551.0,United Kingdom,2026-04-03
532042,22188,BLACK HEART CARD HOLDER,5,3.95,15551.0,United Kingdom,2026-04-03
532042,22398,MAGNETS PACK OF 4 SWALLOWS,2,1.25,15551.0,United Kingdom,2026-04-03
532042,90192,JADE DROP EARRINGS W FILIGREE,6,4.95,15551.0,United Kingdom,2026-04-03
532042,22219,LOVEBIRD HANGING DECORATION WHITE ,6,0.85,15551.0,United Kingdom,2026-04-03
532042,90013B,BLACK VINTAGE EARRINGS,4,3.75,15551.0,United Kingdom,2026-04-03
532042,90013C,GREEN VINTAGE EARRINGS ,4,3.75,15551.0,United Kingdom,2026-04-03
532042,90146,FINE SILVER NECKLACE W PASTEL FLOWE,4,7.5,15551.0,United Kingdom,2026-04-03
532042,90144,SILVER DROP EARRINGS WITH FLOWER,4,3.75,15551.0,United Kingdom,2026-04-03
532042,20803,SMALL PINK GLASS SUNDAE DISH,6,1.65,15551.0,United Kingdom,2026-04-03
532042,21135,VICTORIAN  METAL POSTCARD SPRING,8,1.69,15551.0,United Kingdom,2026-04-03
532042,90183A,AMBER DROP EARRINGS W LONG BEADS,6,2.95,15551.0,United Kingdom,2026-04-03
532042,22588,CARD HOLDER GINGHAM HEART,3,2.55,15551.0,United Kingdom,2026-04-03
532042,22589,CARDHOLDER GINGHAM STAR,3,2.55,15551.0,United Kingdom,2026-04-03
532042,84406B,CREAM CUPID HEARTS COAT HANGER,2,3.25,15551.0,United Kingdom,2026-04-03
532042,22336,DOVE DECORATION PAINTED ZINC ,6,0.65,15551.0,United Kingdom,2026-04-03
532042,22265,EASTER DECORATION NATURAL CHICK,5,0.65,15551.0,United Kingdom,2026-04-03
532042,22578,WOODEN STAR CHRISTMAS SCANDINAVIAN,7,0.85,15551.0,United Kingdom,2026-04-03
532042,22576,SWALLOW WOODEN CHRISTMAS DECORATION,6,0.85,15551.0,United Kingdom,2026-04-03
532042,22470,HEART OF WICKER LARGE,4,2.95,15551.0,United Kingdom,2026-04-03
532043,22767,TRIPLE PHOTO FRAME CORNICE ,2,9.95,15551.0,United Kingdom,2026-04-03
532043,82484,WOOD BLACK BOARD ANT WHITE FINISH,2,6.45,15551.0,United Kingdom,2026-04-03
532044,21094,SET/6 RED SPOTTY PAPER PLATES,2,0.85,14606.0,United Kingdom,2026-04-03
532044,90214S,"LETTER ""S"" BLING KEY RING",1,1.25,14606.0,United Kingdom,2026-04-03
532044,22196,SMALL HEART MEASURING SPOONS,1,0.85,14606.0,United Kingdom,2026-04-03
532044,21481,FAWN BLUE HOT WATER BOTTLE,1,2.95,14606.0,United Kingdom,2026-04-03
532045,71053,WHITE METAL LANTERN,4,3.75,16827.0,United Kingdom,2026-04-03
532044,20977,36 PENCILS TUBE WOODLAND,1,1.25,14606.0,United Kingdom,2026-04-03
532045,71053,WHITE METAL LANTERN,24,3.39,16827.0,United Kingdom,2026-04-03
532044,21212,PACK OF 72 RETROSPOT CAKE CASES,2,0.55,14606.0,United Kingdom,2026-04-03
532044,22358,KINGS CHOICE TEA CADDY ,1,2.95,14606.0,United Kingdom,2026-04-03
532044,22195,LARGE HEART MEASURING SPOONS,2,1.65,14606.0,United Kingdom,2026-04-03
532044,20966,SANDWICH BATH SPONGE,4,1.25,14606.0,United Kingdom,2026-04-03
532044,22474,SPACEBOY TV DINNER TRAY,1,4.95,14606.0,United Kingdom,2026-04-03
532044,21614,SET OF 12 ROSE BOTANICAL T-LIGHTS,1,2.95,14606.0,United Kingdom,2026-04-03
532044,85183B,CHARLIE & LOLA WASTEPAPER BIN FLORA,1,3.75,14606.0,United Kingdom,2026-04-03
532044,37370,RETRO COFFEE MUGS ASSORTED,6,1.25,14606.0,United Kingdom,2026-04-03
532044,21445,12 PINK ROSE PEG PLACE SETTINGS,24,1.25,14606.0,United Kingdom,2026-04-03
532044,20996,JAZZ HEARTS ADDRESS BOOK,4,0.42,14606.0,United Kingdom,2026-04-03
532044,22585,PACK OF 6 BIRDY GIFT TAGS,5,1.25,14606.0,United Kingdom,2026-04-03
532044,20977,36 PENCILS TUBE WOODLAND,1,1.25,14606.0,United Kingdom,2026-04-03
532044,22410,MONEY BOX HOUSEKEEPING DESIGN,2,1.25,14606.0,United Kingdom,2026-04-03
532044,22178,VICTORIAN GLASS HANGING T-LIGHT,12,1.25,14606.0,United Kingdom,2026-04-03
532044,22207,FRYING PAN UNION FLAG,1,4.25,14606.0,United Kingdom,2026-04-03
532044,47599A,PINK PARTY BAGS,1,2.1,14606.0,United Kingdom,2026-04-03
532044,21212,PACK OF 72 RETROSPOT CAKE CASES,1,0.55,14606.0,United Kingdom,2026-04-03
532044,22487,WHITE WOOD GARDEN PLANT LADDER,2,9.95,14606.0,United Kingdom,2026-04-03
532044,21720,CAKE SHOP  STICKER SHEET,1,0.85,14606.0,United Kingdom,2026-04-03
532044,22380,TOY TIDY SPACEBOY  ,2,2.1,14606.0,United Kingdom,2026-04-03
532044,48188,DOORMAT WELCOME PUPPIES,1,7.95,14606.0,United Kingdom,2026-04-03
532044,84520B,PACK 20 ENGLISH ROSE PAPER NAPKINS,3,0.85,14606.0,United Kingdom,2026-04-03
532044,22564,ALPHABET STENCIL CRAFT,3,1.25,14606.0,United Kingdom,2026-04-03
532044,22087,PAPER BUNTING WHITE LACE,1,2.95,14606.0,United Kingdom,2026-04-03
532044,20616,CHERRY BLOSSOM PASSPORT COVER,1,2.1,14606.0,United Kingdom,2026-04-03
532044,85170C,SET/6 EAU DE NIL BIRD T-LIGHTS,2,2.1,14606.0,United Kingdom,2026-04-03
532044,21188,3D HEARTS  HONEYCOMB PAPER GARLAND,1,2.95,14606.0,United Kingdom,2026-04-03
532044,21206,STRAWBERRY HONEYCOMB  GARLAND ,2,1.65,14606.0,United Kingdom,2026-04-03
532044,21724,PANDA AND BUNNIES STICKER SHEET,1,0.85,14606.0,United Kingdom,2026-04-03
532044,21908,CHOCOLATE THIS WAY METAL SIGN,1,2.1,14606.0,United Kingdom,2026-04-03
532044,21169,YOU'RE CONFUSING ME METAL SIGN ,2,1.69,14606.0,United Kingdom,2026-04-03
532044,22467,GUMBALL COAT RACK,4,2.55,14606.0,United Kingdom,2026-04-03
532044,22424,ENAMEL BREAD BIN CREAM,1,12.75,14606.0,United Kingdom,2026-04-03
532044,84032A,CHARLIE+LOLA PINK HOT WATER BOTTLE,1,2.95,14606.0,United Kingdom,2026-04-03
532044,20695,FLORAL BLUE MONSTER,1,4.25,14606.0,United Kingdom,2026-04-03
532044,21908,CHOCOLATE THIS WAY METAL SIGN,1,2.1,14606.0,United Kingdom,2026-04-03
532046,21112,"SWISS ROLL TOWEL, PINK  SPOTS",192,2.95,15971.0,United Kingdom,2026-04-03
532047,21769,VINTAGE POST OFFICE CABINET,6,69.95,13096.0,United Kingdom,2026-04-03
532048,21106,CREAM SLICE FLANNEL CHOCOLATE SPOT ,6,2.95,16422.0,United Kingdom,2026-04-03
532048,21872,GLAMOROUS  MUG,12,1.25,16422.0,United Kingdom,2026-04-03
532048,21889,WOODEN BOX OF DOMINOES,12,1.25,16422.0,United Kingdom,2026-04-03
532048,22620,4 TRADITIONAL SPINNING TOPS,12,1.25,16422.0,United Kingdom,2026-04-03
532048,22493,PAINT YOUR OWN CANVAS SET,12,1.65,16422.0,United Kingdom,2026-04-03
532048,22630,DOLLY GIRL LUNCH BOX,12,1.95,16422.0,United Kingdom,2026-04-03
532048,21648,ASSORTED TUTTI FRUTTI SMALL PURSE,24,1.25,16422.0,United Kingdom,2026-04-03
532048,21832,CHOCOLATE CALCULATOR,12,1.65,16422.0,United Kingdom,2026-04-03
532048,20659,ECONOMY LUGGAGE TAG,12,1.25,16422.0,United Kingdom,2026-04-03
532048,22629,SPACEBOY LUNCH BOX ,12,1.95,16422.0,United Kingdom,2026-04-03
532048,21107,CREAM SLICE FLANNEL PINK SPOT ,6,2.95,16422.0,United Kingdom,2026-04-03
532048,22147,FELTCRAFT BUTTERFLY HEARTS,24,1.45,16422.0,United Kingdom,2026-04-03
532048,22492,MINI PAINT SET VINTAGE ,36,0.65,16422.0,United Kingdom,2026-04-03
532048,21821,GLITTER STAR GARLAND WITH BELLS ,18,3.75,16422.0,United Kingdom,2026-04-03
532048,21791,VINTAGE HEADS AND TAILS CARD GAME ,10,1.25,16422.0,United Kingdom,2026-04-03
532048,35400,WOODEN BOX ADVENT CALENDAR ,10,8.95,16422.0,United Kingdom,2026-04-03
532048,20972,PINK CREAM FELT CRAFT TRINKET BOX ,48,1.25,16422.0,United Kingdom,2026-04-03
532048,21643,ASSORTED TUTTI FRUTTI MIRROR,24,1.25,16422.0,United Kingdom,2026-04-03
532048,21644,ASSORTED TUTTI FRUTTI HEART BOX,24,1.25,16422.0,United Kingdom,2026-04-03
532048,21833,CAMOUFLAGE LED TORCH,12,1.69,16422.0,United Kingdom,2026-04-03
532048,21326,AGED GLASS SILVER T-LIGHT HOLDER,12,0.65,16422.0,United Kingdom,2026-04-03
532048,22642,SET OF 4 NAPKIN CHARMS STARS   ,24,2.55,16422.0,United Kingdom,2026-04-03
532048,22152,PLACE SETTING WHITE STAR,72,0.42,16422.0,United Kingdom,2026-04-03
532048,22186,RED STAR CARD HOLDER,6,2.95,16422.0,United Kingdom,2026-04-03
532048,22582,PACK OF 6 SWEETIE GIFT BOXES,12,2.55,16422.0,United Kingdom,2026-04-03
532048,85045,GREEN CHRISTMAS TREE STRING 20LIGHT,24,4.25,16422.0,United Kingdom,2026-04-03
532048,21790,VINTAGE SNAP CARDS,24,0.85,16422.0,United Kingdom,2026-04-03
532049,35400,WOODEN BOX ADVENT CALENDAR ,16,7.95,16422.0,United Kingdom,2026-04-03
532049,22090,PAPER BUNTING RETROSPOT,40,2.55,16422.0,United Kingdom,2026-04-03
532049,47599A,PINK PARTY BAGS,12,2.1,16422.0,United Kingdom,2026-04-03
532049,20975,12 PENCILS SMALL TUBE RED RETROSPOT,24,0.65,16422.0,United Kingdom,2026-04-03
532049,21207,SKULL AND CROSSBONES  GARLAND ,48,1.45,16422.0,United Kingdom,2026-04-03
532049,20974,12 PENCILS SMALL TUBE SKULL,72,0.65,16422.0,United Kingdom,2026-04-03
532049,21086,SET/6 RED SPOTTY PAPER CUPS,216,0.53,16422.0,United Kingdom,2026-04-03
532049,21094,SET/6 RED SPOTTY PAPER PLATES,96,0.64,16422.0,United Kingdom,2026-04-03
532050,22603,CHRISTMAS RETROSPOT TREE WOOD,12,0.85,14911.0,EIRE,2026-04-03
532050,22600,CHRISTMAS RETROSPOT STAR WOOD,12,0.85,14911.0,EIRE,2026-04-03
532050,22576,SWALLOW WOODEN CHRISTMAS DECORATION,12,0.85,14911.0,EIRE,2026-04-03
532050,22571,ROCKING HORSE RED CHRISTMAS ,12,0.85,14911.0,EIRE,2026-04-03
532050,84992,72 SWEETHEART FAIRY CAKE CASES,24,0.55,14911.0,EIRE,2026-04-03
532050,22602,CHRISTMAS RETROSPOT HEART WOOD,24,0.85,14911.0,EIRE,2026-04-03
532050,22435,SET OF 9 HEART SHAPED BALLOONS,12,1.25,14911.0,EIRE,2026-04-03
532050,22480,RED TEA TOWEL CLASSIC DESIGN,12,1.25,14911.0,EIRE,2026-04-03
532050,22574,HEART WOODEN CHRISTMAS DECORATION,24,0.85,14911.0,EIRE,2026-04-03
532050,22904,CALENDAR PAPER CUT DESIGN,6,2.95,14911.0,EIRE,2026-04-03
532050,21879,HEARTS GIFT TAPE,12,0.65,14911.0,EIRE,2026-04-03
532050,22367,CHILDRENS APRON SPACEBOY DESIGN,8,1.95,14911.0,EIRE,2026-04-03
532050,47591D,PINK FAIRY CAKE CHILDRENS APRON,8,1.95,14911.0,EIRE,2026-04-03
532050,21098,CHRISTMAS TOILET ROLL,12,1.25,14911.0,EIRE,2026-04-03
532050,22381,TOY TIDY PINK POLKADOT,5,2.1,14911.0,EIRE,2026-04-03
532050,47570B,TEA TIME TABLE CLOTH,2,10.65,14911.0,EIRE,2026-04-03
532050,84378,SET OF 3 HEART COOKIE CUTTERS,12,1.25,14911.0,EIRE,2026-04-03
532051,20978,36 PENCILS TUBE SKULLS,16,1.25,14911.0,EIRE,2026-04-03
532051,47591D,PINK FAIRY CAKE CHILDRENS APRON,8,1.95,14911.0,EIRE,2026-04-03
532051,22909,SET OF 20 VINTAGE CHRISTMAS NAPKINS,12,0.85,14911.0,EIRE,2026-04-03
532051,20675,BLUE POLKADOT BOWL,8,1.25,14911.0,EIRE,2026-04-03
532051,22573,STAR WOODEN CHRISTMAS DECORATION,12,0.85,14911.0,EIRE,2026-04-03
532051,22577,WOODEN HEART CHRISTMAS SCANDINAVIAN,12,0.85,14911.0,EIRE,2026-04-03
532051,22553,PLASTERS IN TIN SKULLS,12,1.65,14911.0,EIRE,2026-04-03
532051,22603,CHRISTMAS RETROSPOT TREE WOOD,12,0.85,14911.0,EIRE,2026-04-03
532051,22556,PLASTERS IN TIN CIRCUS PARADE ,12,1.65,14911.0,EIRE,2026-04-03
532051,22380,TOY TIDY SPACEBOY  ,5,2.1,14911.0,EIRE,2026-04-03
532051,22419,LIPSTICK PEN RED,12,0.42,14911.0,EIRE,2026-04-03
532051,22492,MINI PAINT SET VINTAGE ,36,0.65,14911.0,EIRE,2026-04-03
532051,20686,DOLLY MIXTURE CHILDREN'S UMBRELLA,6,3.25,14911.0,EIRE,2026-04-03
532051,22601,CHRISTMAS RETROSPOT ANGEL WOOD,24,0.85,14911.0,EIRE,2026-04-03
532051,21253,SET OF PICTURE FRAME  STICKERS,12,2.95,14911.0,EIRE,2026-04-03
532051,84997C,BLUE 3 PIECE POLKADOT CUTLERY SET,12,3.75,14911.0,EIRE,2026-04-03
532051,22073,RED RETROSPOT STORAGE JAR,4,3.75,14911.0,EIRE,2026-04-03
532051,21333,CLASSIC WHITE FRAME,16,2.95,14911.0,EIRE,2026-04-03
532051,48194,DOORMAT HEARTS,4,7.95,14911.0,EIRE,2026-04-03
532051,84509G,SET OF 4 FAIRY CAKE PLACEMATS ,4,3.75,14911.0,EIRE,2026-04-03
532051,48129,DOORMAT TOPIARY,4,7.95,14911.0,EIRE,2026-04-03
532051,21243,PINK  POLKADOT PLATE ,8,1.69,14911.0,EIRE,2026-04-03
532051,20677,PINK POLKADOT BOWL,8,1.25,14911.0,EIRE,2026-04-03
532051,21239,PINK  POLKADOT CUP,8,0.85,14911.0,EIRE,2026-04-03
532051,20685,DOORMAT RED RETROSPOT,4,7.95,14911.0,EIRE,2026-04-03
532051,21240,BLUE POLKADOT CUP,8,0.85,14911.0,EIRE,2026-04-03
532051,22423,REGENCY CAKESTAND 3 TIER,2,12.75,14911.0,EIRE,2026-04-03
532051,84997D,PINK 3 PIECE POLKADOT CUTLERY SET,12,3.75,14911.0,EIRE,2026-04-03
532051,21531,RED RETROSPOT SUGAR JAM BOWL,6,2.55,14911.0,EIRE,2026-04-03
532051,21535,RED RETROSPOT SMALL MILK JUG,6,2.55,14911.0,EIRE,2026-04-03
532051,21244,BLUE POLKADOT PLATE ,8,1.69,14911.0,EIRE,2026-04-03
532052,21181,PLEASE ONE PERSON METAL SIGN,12,2.1,14422.0,United Kingdom,2026-04-03
532052,82600,NO SINGING METAL SIGN,12,2.1,14422.0,United Kingdom,2026-04-03
532052,21175,GIN + TONIC DIET METAL SIGN,12,2.1,14422.0,United Kingdom,2026-04-03
532052,21174,POTTERING IN THE SHED METAL SIGN,12,1.95,14422.0,United Kingdom,2026-04-03
532052,84947,ANTIQUE SILVER TEA GLASS ENGRAVED,12,1.25,14422.0,United Kingdom,2026-04-03
532052,84755,COLOUR GLASS T-LIGHT HOLDER HANGING,16,0.65,14422.0,United Kingdom,2026-04-03
532052,85123A,WHITE HANGING HEART T-LIGHT HOLDER,6,2.95,14422.0,United Kingdom,2026-04-03
532052,85118,HEART T-LIGHT HOLDER,48,0.38,14422.0,United Kingdom,2026-04-03
532052,37464,ROBOT MUG IN DISPLAY BOX,12,1.25,14422.0,United Kingdom,2026-04-03
532052,71477,COLOUR GLASS. STAR T-LIGHT HOLDER,8,3.25,14422.0,United Kingdom,2026-04-03
532052,22441,GROW YOUR OWN BASIL IN ENAMEL MUG,8,2.1,14422.0,United Kingdom,2026-04-03
532052,22804,CANDLEHOLDER PINK HANGING HEART,6,2.95,14422.0,United Kingdom,2026-04-03
532052,84029G,KNITTED UNION FLAG HOT WATER BOTTLE,4,3.75,14422.0,United Kingdom,2026-04-03
532052,22114,HOT WATER BOTTLE TEA AND SYMPATHY,4,3.95,14422.0,United Kingdom,2026-04-03
532052,22111,SCOTTIE DOG HOT WATER BOTTLE,3,4.95,14422.0,United Kingdom,2026-04-03
532052,84352,SILVER CHRISTMAS TREE BAUBLE STAND ,4,14.95,14422.0,United Kingdom,2026-04-03
532052,22112,CHOCOLATE HOT WATER BOTTLE,3,4.95,14422.0,United Kingdom,2026-04-03
532052,21868,POTTING SHED TEA MUG,12,1.25,14422.0,United Kingdom,2026-04-03
532052,84987,SET OF 36 TEATIME PAPER DOILIES,12,1.45,14422.0,United Kingdom,2026-04-03
532052,22851,SET 20 NAPKINS FAIRY CAKES DESIGN ,12,0.85,14422.0,United Kingdom,2026-04-03
532052,22414,DOORMAT NEIGHBOURHOOD WITCH ,2,7.95,14422.0,United Kingdom,2026-04-03
532052,22855,FINE WICKER HEART ,24,1.25,14422.0,United Kingdom,2026-04-03
532052,22835,HOT WATER BOTTLE I AM SO POORLY,8,4.65,14422.0,United Kingdom,2026-04-03
532053,21232,STRAWBERRY CERAMIC TRINKET BOX,72,1.06,18220.0,United Kingdom,2026-04-03
532053,21231,SWEETHEART CERAMIC TRINKET BOX,72,1.06,18220.0,United Kingdom,2026-04-03
532053,15060B,FAIRY CAKE DESIGN UMBRELLA,60,2.95,18220.0,United Kingdom,2026-04-03
532054,84879,ASSORTED COLOUR BIRD ORNAMENT,400,1.45,12931.0,United Kingdom,2026-04-03
532055,21192,WHITE BELL HONEYCOMB PAPER ,3,1.65,15529.0,United Kingdom,2026-04-03
532055,21058,PARTY INVITES WOODLAND,5,0.85,15529.0,United Kingdom,2026-04-03
532055,21062,PARTY INVITES SPACEMAN,5,0.85,15529.0,United Kingdom,2026-04-03
532055,21061,PARTY INVITES FOOTBALL,5,0.85,15529.0,United Kingdom,2026-04-03
532055,21063,PARTY INVITES JAZZ HEARTS,5,0.85,15529.0,United Kingdom,2026-04-03
532055,22908,PACK OF 20 NAPKINS RED APPLES,3,0.85,15529.0,United Kingdom,2026-04-03
532055,22613,PACK OF 20 SPACEBOY NAPKINS,3,0.85,15529.0,United Kingdom,2026-04-03
532055,22851,SET 20 NAPKINS FAIRY CAKES DESIGN ,3,0.85,15529.0,United Kingdom,2026-04-03
532055,79066K,RETRO MOD TRAY,2,0.85,15529.0,United Kingdom,2026-04-03
532055,79067,CORONA MEXICAN TRAY,2,3.75,15529.0,United Kingdom,2026-04-03
532055,21591,COSY HOUR CIGAR BOX MATCHES ,5,1.25,15529.0,United Kingdom,2026-04-03
532055,22952,60 CAKE CASES VINTAGE CHRISTMAS,3,0.55,15529.0,United Kingdom,2026-04-03
532055,21187,WHITE BELL HONEYCOMB PAPER GARLAND ,1,1.65,15529.0,United Kingdom,2026-04-03
532055,22070,SMALL RED RETROSPOT MUG IN BOX ,3,3.75,15529.0,United Kingdom,2026-04-03
532055,20973,12 PENCIL SMALL TUBE WOODLAND,6,0.65,15529.0,United Kingdom,2026-04-03
532055,21832,CHOCOLATE CALCULATOR,1,1.65,15529.0,United Kingdom,2026-04-03
532055,21124,SET/10 BLUE POLKADOT PARTY CANDLES,5,1.25,15529.0,United Kingdom,2026-04-03
532055,21122,SET/10 PINK POLKADOT PARTY CANDLES,5,1.25,15529.0,United Kingdom,2026-04-03
532055,46126A,ELVIS WALLHANGING / CURTAIN,3,1.25,15529.0,United Kingdom,2026-04-03
532055,22816,CARD MOTORBIKE SANTA,24,0.42,15529.0,United Kingdom,2026-04-03
532055,22071,SMALL WHITE RETROSPOT MUG IN BOX ,3,3.75,15529.0,United Kingdom,2026-04-03
532055,22629,SPACEBOY LUNCH BOX ,2,1.95,15529.0,United Kingdom,2026-04-03
532055,22906,12 MESSAGE CARDS WITH ENVELOPES,6,1.65,15529.0,United Kingdom,2026-04-03
532055,84535B,FAIRY CAKES NOTEBOOK A6 SIZE,4,0.65,15529.0,United Kingdom,2026-04-03
532055,22753,SMALL YELLOW BABUSHKA NOTEBOOK ,3,0.85,15529.0,United Kingdom,2026-04-03
532055,22755,SMALL PURPLE BABUSHKA NOTEBOOK ,3,0.85,15529.0,United Kingdom,2026-04-03
532055,22754,SMALL RED BABUSHKA NOTEBOOK ,3,0.85,15529.0,United Kingdom,2026-04-03
532055,20974,12 PENCILS SMALL TUBE SKULL,6,0.65,15529.0,United Kingdom,2026-04-03
532055,85232B,SET OF 3 BABUSHKA STACKING TINS,2,4.95,15529.0,United Kingdom,2026-04-03
532055,22243,5 HOOK HANGER RED MAGIC TOADSTOOL,3,1.65,15529.0,United Kingdom,2026-04-03
532055,35969,FOLKART CROWN TABLE DECORATIONS,4,1.65,15529.0,United Kingdom,2026-04-03
532055,84750B,BLACK SMALL GLASS CAKE STAND,3,1.95,15529.0,United Kingdom,2026-04-03
532055,22307,GOLD MUG BONE CHINA TREE OF LIFE,6,1.95,15529.0,United Kingdom,2026-04-03
532055,21989,PACK OF 20 SKULL PAPER NAPKINS,3,0.85,15529.0,United Kingdom,2026-04-03
532055,22139,RETROSPOT TEA SET CERAMIC 11 PC ,3,4.95,15529.0,United Kingdom,2026-04-03
532055,20749,ASSORTED COLOUR MINI CASES,1,7.95,15529.0,United Kingdom,2026-04-03
532055,22746,POPPY'S PLAYHOUSE LIVINGROOM ,3,2.1,15529.0,United Kingdom,2026-04-03
532055,22747,POPPY'S PLAYHOUSE BATHROOM,3,2.1,15529.0,United Kingdom,2026-04-03
532055,22748,POPPY'S PLAYHOUSE KITCHEN,3,2.1,15529.0,United Kingdom,2026-04-03
532055,22745,POPPY'S PLAYHOUSE BEDROOM ,3,2.1,15529.0,United Kingdom,2026-04-03
532055,84991,60 TEATIME FAIRY CAKE CASES,3,0.55,15529.0,United Kingdom,2026-04-03
532055,75131,METAL TUBE CHIME ON BAMBOO,1,1.69,15529.0,United Kingdom,2026-04-03
532055,84086B,YELLOW/BLUE RETRO RADIO,3,2.95,15529.0,United Kingdom,2026-04-03
532055,84086C,PINK/PURPLE RETRO RADIO,3,2.95,15529.0,United Kingdom,2026-04-03
532055,22818,CARD CHRISTMAS VILLAGE,24,0.42,15529.0,United Kingdom,2026-04-03
532055,22812,PACK 3 BOXES CHRISTMAS PANNETONE,5,1.95,15529.0,United Kingdom,2026-04-03
532055,84534B,FAIRY CAKE NOTEBOOK A5 SIZE,4,0.85,15529.0,United Kingdom,2026-04-03
532055,20754,RETROSPOT RED WASHING UP GLOVES,2,2.1,15529.0,United Kingdom,2026-04-03
532055,20752,BLUE POLKADOT WASHING UP GLOVES,2,2.1,15529.0,United Kingdom,2026-04-03
532055,22752,SET 7 BABUSHKA NESTING BOXES,1,8.5,15529.0,United Kingdom,2026-04-03
532055,22326,ROUND SNACK BOXES SET OF4 WOODLAND ,2,2.95,15529.0,United Kingdom,2026-04-03
532055,22726,ALARM CLOCK BAKELIKE GREEN,2,3.75,15529.0,United Kingdom,2026-04-03
532055,22727,ALARM CLOCK BAKELIKE RED ,2,3.75,15529.0,United Kingdom,2026-04-03
532055,22659,LUNCH BOX I LOVE LONDON,2,1.95,15529.0,United Kingdom,2026-04-03
532055,22467,GUMBALL COAT RACK,3,2.55,15529.0,United Kingdom,2026-04-03
532055,22630,DOLLY GIRL LUNCH BOX,2,1.95,15529.0,United Kingdom,2026-04-03
532055,22631,CIRCUS PARADE LUNCH BOX ,2,1.95,15529.0,United Kingdom,2026-04-03
532055,22328,ROUND SNACK BOXES SET OF 4 FRUITS ,2,2.95,15529.0,United Kingdom,2026-04-03
532055,22198,LARGE POPCORN HOLDER ,3,1.65,15529.0,United Kingdom,2026-04-03
532055,22560,TRADITIONAL MODELLING CLAY,10,1.25,15529.0,United Kingdom,2026-04-03
532055,22492,MINI PAINT SET VINTAGE ,36,0.65,15529.0,United Kingdom,2026-04-03
532055,84692,BOX OF 24 COCKTAIL PARASOLS,12,0.42,15529.0,United Kingdom,2026-04-03
532055,47591D,PINK FAIRY CAKE CHILDRENS APRON,3,1.95,15529.0,United Kingdom,2026-04-03
532055,20684,STRAWBERRY DREAM CHILDS UMBRELLA,3,3.25,15529.0,United Kingdom,2026-04-03
532055,22554,PLASTERS IN TIN WOODLAND ANIMALS,3,1.65,15529.0,United Kingdom,2026-04-03
