Invoice,StockCode,Description,Quantity,Price,Customer ID,Country,InvoiceDate
530070,22488,NATURAL SLATE RECTANGLE CHALKBOARD,1,1.65,16876.0,United Kingdom,2026-03-26
530070,22629,SPACEBOY LUNCH BOX ,1,1.95,16876.0,United Kingdom,2026-03-26
530070,22451,SILK PURSE BABUSHKA RED,1,3.35,16876.0,United Kingdom,2026-03-26
530070,22360,GLASS JAR ENGLISH CONFECTIONERY,1,2.95,16876.0,United Kingdom,2026-03-26
530070,22807,SET OF 6 T-LIGHTS TOADSTOOLS,1,2.95,16876.0,United Kingdom,2026-03-26
530070,82011C,BATHROOM SCALES FOOTPRINTS IN SAND,1,3.75,16876.0,United Kingdom,2026-03-26
530070,22551,PLASTERS IN TIN SPACEBOY,1,1.65,16876.0,United Kingdom,2026-03-26
530070,20974,12 PENCILS SMALL TUBE SKULL,15,0.65,16876.0,United Kingdom,2026-03-26
530070,22434,BALLOON PUMP WITH 10 BALLOONS,1,1.95,16876.0,United Kingdom,2026-03-26
530070,22534,MAGIC DRAWING SLATE SPACEBOY ,1,0.42,16876.0,United Kingdom,2026-03-26
530070,22669,RED BABY BUNTING ,2,2.95,16876.0,United Kingdom,2026-03-26
530070,21967,PACK OF 12 SKULL TISSUES,24,0.29,16876.0,United Kingdom,2026-03-26
530070,22045,SPACEBOY GIFT WRAP,25,0.42,16876.0,United Kingdom,2026-03-26
530070,22985,"WRAP, BILLBOARD FONTS DESIGN",25,0.42,16876.0,United Kingdom,2026-03-26
530070,22030,SWALLOWS GREETING CARD,12,0.42,16876.0,United Kingdom,2026-03-26
530070,22614,PACK OF 12 SPACEBOY TISSUES,12,0.29,16876.0,United Kingdom,2026-03-26
530070,85183A,CHARLIE & LOLA WASTEPAPER BIN BLUE,1,3.75,16876.0,United Kingdom,2026-03-26
530070,20975,12 PENCILS SMALL TUBE RED RETROSPOT,6,0.65,16876.0,United Kingdom,2026-03-26
530070,21987,PACK OF 6 SKULL PAPER CUPS,4,0.65,16876.0,United Kingdom,2026-03-26
530070,21989,PACK OF 20 SKULL PAPER NAPKINS,2,0.85,16876.0,United Kingdom,2026-03-26
530070,85175,CACTI T-LIGHT CANDLES,16,0.42,16876.0,United Kingdom,2026-03-26
530070,21213,PACK OF 72 SKULL CAKE CASES,1,0.55,16876.0,United Kingdom,2026-03-26
530070,22029,SPACEBOY BIRTHDAY CARD,12,0.42,16876.0,United Kingdom,2026-03-26
530071,22775,PURPLE DRAWERKNOB ACRYLIC EDWARDIAN,24,1.25,15039.0,United Kingdom,2026-03-26
530071,22376,AIRLINE BAG VINTAGE JET SET WHITE,2,4.25,15039.0,United Kingdom,2026-03-26
530071,20712,JUMBO BAG WOODLAND ANIMALS,10,1.95,15039.0,United Kingdom,2026-03-26
530071,21158,MOODY GIRL DOOR HANGER ,2,1.45,15039.0,United Kingdom,2026-03-26
530071,21159,MOODY BOY  DOOR HANGER ,2,1.45,15039.0,United Kingdom,2026-03-26
530071,35400,WOODEN BOX ADVENT CALENDAR ,2,8.95,15039.0,United Kingdom,2026-03-26
530071,21163,DO NOT TOUCH MY STUFF DOOR HANGER ,2,1.45,15039.0,United Kingdom,2026-03-26
530071,22771,CLEAR DRAWER KNOB ACRYLIC EDWARDIAN,12,1.25,15039.0,United Kingdom,2026-03-26
530071,22158,3 HEARTS HANGING DECORATION RUSTIC,8,2.95,15039.0,United Kingdom,2026-03-26
530071,22692,DOORMAT WELCOME TO OUR HOME,2,7.95,15039.0,United Kingdom,2026-03-26
530071,22456,NATURAL SLATE CHALKBOARD LARGE ,2,4.95,15039.0,United Kingdom,2026-03-26
530071,22198,LARGE POPCORN HOLDER ,4,1.65,15039.0,United Kingdom,2026-03-26
530071,22197,SMALL POPCORN HOLDER,100,0.72,15039.0,United Kingdom,2026-03-26
530071,21080,SET/20 RED RETROSPOT PAPER NAPKINS ,6,0.85,15039.0,United Kingdom,2026-03-26
530071,21523,DOORMAT FANCY FONT HOME SWEET HOME,2,7.95,15039.0,United Kingdom,2026-03-26
530071,22365,DOORMAT RESPECTABLE HOUSE,1,7.95,15039.0,United Kingdom,2026-03-26
530071,22371,AIRLINE BAG VINTAGE TOKYO 78,2,4.25,15039.0,United Kingdom,2026-03-26
530071,21777,RECIPE BOX WITH METAL HEART,2,7.95,15039.0,United Kingdom,2026-03-26
530071,22771,CLEAR DRAWER KNOB ACRYLIC EDWARDIAN,24,1.25,15039.0,United Kingdom,2026-03-26
530071,22890,NOVELTY BISCUITS CAKE STAND 3 TIER,1,9.95,15039.0,United Kingdom,2026-03-26
530071,22411,JUMBO SHOPPER VINTAGE RED PAISLEY,10,1.95,15039.0,United Kingdom,2026-03-26
530071,22776,SWEETHEART CAKESTAND 3 TIER,1,9.95,15039.0,United Kingdom,2026-03-26
530071,21162,TOXIC AREA  DOOR HANGER ,2,1.45,15039.0,United Kingdom,2026-03-26
530071,20668,DISCO BALL CHRISTMAS DECORATION,48,0.12,15039.0,United Kingdom,2026-03-26
530071,21539,RED RETROSPOT BUTTER DISH,1,4.95,15039.0,United Kingdom,2026-03-26
530071,22513,DOORSTOP FOOTBALL DESIGN,2,3.75,15039.0,United Kingdom,2026-03-26
530071,22644,CERAMIC CHERRY CAKE MONEY BANK,4,1.45,15039.0,United Kingdom,2026-03-26
530071,21428,SET3 BOOK BOX GREEN GINGHAM FLOWER ,3,4.25,15039.0,United Kingdom,2026-03-26
530071,22271,FELTCRAFT DOLL ROSIE,2,2.95,15039.0,United Kingdom,2026-03-26
530071,22273,FELTCRAFT DOLL MOLLY,2,2.95,15039.0,United Kingdom,2026-03-26
530071,21930,JUMBO STORAGE BAG SKULLS,10,1.95,15039.0,United Kingdom,2026-03-26
530071,84997D,PINK 3 PIECE POLKADOT CUTLERY SET,1,3.75,15039.0,United Kingdom,2026-03-26
530071,35832,WOOLLY HAT SOCK GLOVE ADVENT STRING,4,2.95,15039.0,United Kingdom,2026-03-26
530071,22274,FELTCRAFT DOLL EMILY,2,2.95,15039.0,United Kingdom,2026-03-26
530071,22580,ADVENT CALENDAR GINGHAM SACK,2,5.95,15039.0,United Kingdom,2026-03-26
530071,21240,BLUE POLKADOT CUP,8,0.85,15039.0,United Kingdom,2026-03-26
530071,21239,PINK  POLKADOT CUP,6,0.85,15039.0,United Kingdom,2026-03-26
530071,22173,METAL 4 HOOK HANGER FRENCH CHATEAU,1,2.95,15039.0,United Kingdom,2026-03-26
530071,22649,STRAWBERRY FAIRY CAKE TEAPOT,1,4.95,15039.0,United Kingdom,2026-03-26
530071,22242,5 HOOK HANGER MAGIC TOADSTOOL,2,1.65,15039.0,United Kingdom,2026-03-26
530071,22795,SWEETHEART RECIPE BOOK STAND,1,6.75,15039.0,United Kingdom,2026-03-26
530071,22086,PAPER CHAIN KIT 50'S CHRISTMAS ,6,2.95,15039.0,United Kingdom,2026-03-26
530071,22086,PAPER CHAIN KIT 50'S CHRISTMAS ,6,2.95,15039.0,United Kingdom,2026-03-26
530072,22943,CHRISTMAS LIGHTS 10 VINTAGE BAUBLES,3,4.95,16103.0,United Kingdom,2026-03-26
530072,22777,GLASS CLOCHE LARGE,2,8.5,16103.0,United Kingdom,2026-03-26
530072,21621,VINTAGE UNION JACK BUNTING,2,8.5,16103.0,United Kingdom,2026-03-26
530072,84806B,WHITE CANDYSTUFT ARTIFICIAL FLOWER,24,1.45,16103.0,United Kingdom,2026-03-26
530072,84801B,WHITE HYDRANGEA ART FLOWER,12,2.1,16103.0,United Kingdom,2026-03-26
530072,84970L,SINGLE HEART ZINC T-LIGHT HOLDER,24,0.95,16103.0,United Kingdom,2026-03-26
530072,22335,HEART DECORATION PAINTED ZINC ,24,0.65,16103.0,United Kingdom,2026-03-26
530072,35471D,SET OF 3 BIRD LIGHT PINK FEATHER ,12,1.25,16103.0,United Kingdom,2026-03-26
530072,85048,15CM CHRISTMAS GLASS BALL 20 LIGHTS,6,7.95,16103.0,United Kingdom,2026-03-26
530072,85123A,WHITE HANGING HEART T-LIGHT HOLDER,18,2.95,16103.0,United Kingdom,2026-03-26
530072,84949,SILVER HANGING T-LIGHT HOLDER,12,1.65,16103.0,United Kingdom,2026-03-26
530072,84946,ANTIQUE SILVER TEA GLASS ETCHED,24,1.25,16103.0,United Kingdom,2026-03-26
530072,22338,STAR DECORATION PAINTED ZINC ,24,0.65,16103.0,United Kingdom,2026-03-26
530072,22336,DOVE DECORATION PAINTED ZINC ,24,0.65,16103.0,United Kingdom,2026-03-26
530073,22092,BLUE PAISLEY TISSUE BOX,1,1.25,15958.0,United Kingdom,2026-03-26
530073,22311,OFFICE MUG WARMER BLACK+SILVER ,1,2.95,15958.0,United Kingdom,2026-03-26
530073,22810,SET OF 6 T-LIGHTS SNOWMEN,1,2.95,15958.0,United Kingdom,2026-03-26
530073,20878,SET/9 CHRISTMAS T-LIGHTS SCENTED ,1,1.25,15958.0,United Kingdom,2026-03-26
530073,35991,SET/6 BLACK SNOWFLAKE T-LIGHTS ,1,0.42,15958.0,United Kingdom,2026-03-26
530073,22277,COSMETIC BAG VINTAGE ROSE PAISLEY,1,2.1,15958.0,United Kingdom,2026-03-26
530073,21535,RED RETROSPOT SMALL MILK JUG,1,2.55,15958.0,United Kingdom,2026-03-26
530073,20871,OPULENT VELVET SET/3 CANDLES,4,2.1,15958.0,United Kingdom,2026-03-26
530073,22894,TABLECLOTH RED APPLES DESIGN ,1,8.5,15958.0,United Kingdom,2026-03-26
530073,22895,SET OF 2 TEA TOWELS APPLE AND PEARS,5,2.95,15958.0,United Kingdom,2026-03-26
530073,22096,PINK PAISLEY SQUARE TISSUE BOX ,1,1.25,15958.0,United Kingdom,2026-03-26
530073,22276,WASH BAG VINTAGE ROSE PAISLEY,2,2.55,15958.0,United Kingdom,2026-03-26
530073,20871,OPULENT VELVET SET/3 CANDLES,2,2.1,15958.0,United Kingdom,2026-03-26
530073,22752,SET 7 BABUSHKA NESTING BOXES,1,8.5,15958.0,United Kingdom,2026-03-26
530073,21530,DAIRY MAID TOASTRACK,1,2.95,15958.0,United Kingdom,2026-03-26
530073,22349,DOG BOWL CHASING BALL DESIGN,1,3.75,15958.0,United Kingdom,2026-03-26
530073,20752,BLUE POLKADOT WASHING UP GLOVES,2,2.1,15958.0,United Kingdom,2026-03-26
530073,22311,OFFICE MUG WARMER BLACK+SILVER ,1,2.95,15958.0,United Kingdom,2026-03-26
530073,22311,OFFICE MUG WARMER BLACK+SILVER ,1,2.95,15958.0,United Kingdom,2026-03-26
530073,21993,FLORAL FOLK STATIONERY SET,1,2.95,15958.0,United Kingdom,2026-03-26
530073,85152,HAND OVER THE CHOCOLATE   SIGN ,1,2.1,15958.0,United Kingdom,2026-03-26
530073,22111,SCOTTIE DOG HOT WATER BOTTLE,2,4.95,15958.0,United Kingdom,2026-03-26
530073,21530,DAIRY MAID TOASTRACK,1,2.95,15958.0,United Kingdom,2026-03-26
530073,22174,PHOTO CUBE,6,1.65,15958.0,United Kingdom,2026-03-26
530073,22895,SET OF 2 TEA TOWELS APPLE AND PEARS,4,2.95,15958.0,United Kingdom,2026-03-26
530073,21329,DINOSAURS  WRITING SET ,3,1.65,15958.0,United Kingdom,2026-03-26
530073,20754,RETROSPOT RED WASHING UP GLOVES,2,2.1,15958.0,United Kingdom,2026-03-26
530073,21328,BALLOONS  WRITING SET ,5,1.65,15958.0,United Kingdom,2026-03-26
530073,22636,CHILDS BREAKFAST SET CIRCUS PARADE,1,8.5,15958.0,United Kingdom,2026-03-26
530073,20752,BLUE POLKADOT WASHING UP GLOVES,2,2.1,15958.0,United Kingdom,2026-03-26
530073,35991,SET/6 BLACK SNOWFLAKE T-LIGHTS ,1,0.42,15958.0,United Kingdom,2026-03-26
530073,21990,MODERN FLORAL STATIONERY SET,1,2.95,15958.0,United Kingdom,2026-03-26
530073,21485,RETROSPOT HEART HOT WATER BOTTLE,2,4.95,15958.0,United Kingdom,2026-03-26
530073,22111,SCOTTIE DOG HOT WATER BOTTLE,1,4.95,15958.0,United Kingdom,2026-03-26
530073,21484,CHICK GREY HOT WATER BOTTLE,1,3.45,15958.0,United Kingdom,2026-03-26
530073,22107,PIZZA PLATE IN BOX,1,3.75,15958.0,United Kingdom,2026-03-26
530078,85099B,JUMBO BAG RED RETROSPOT,10,1.95,13293.0,United Kingdom,2026-03-26
530078,72741,GRAND CHOCOLATECANDLE,9,1.45,13293.0,United Kingdom,2026-03-26
530078,21790,VINTAGE SNAP CARDS,12,0.85,13293.0,United Kingdom,2026-03-26
530078,21890,S/6 WOODEN SKITTLES IN COTTON BAG,6,2.95,13293.0,United Kingdom,2026-03-26
530078,21703,BAG 125g SWIRLY MARBLES,12,0.42,13293.0,United Kingdom,2026-03-26
530078,84879,ASSORTED COLOUR BIRD ORNAMENT,16,1.69,13293.0,United Kingdom,2026-03-26
530078,21673,WHITE SPOT BLUE CERAMIC DRAWER KNOB,12,1.25,13293.0,United Kingdom,2026-03-26
530078,22139,RETROSPOT TEA SET CERAMIC 11 PC ,6,4.95,13293.0,United Kingdom,2026-03-26
530078,85132B,CHARLIE AND LOLA TABLE TINS,12,1.95,13293.0,United Kingdom,2026-03-26
530078,21259,VICTORIAN SEWING BOX SMALL ,4,5.95,13293.0,United Kingdom,2026-03-26
530078,21672,WHITE SPOT RED CERAMIC DRAWER KNOB,12,1.25,13293.0,United Kingdom,2026-03-26
530078,20685,DOORMAT RED RETROSPOT,4,7.95,13293.0,United Kingdom,2026-03-26
530079,21523,DOORMAT FANCY FONT HOME SWEET HOME,4,7.95,18061.0,United Kingdom,2026-03-26
530079,21116,OWL DOORSTOP,6,4.95,18061.0,United Kingdom,2026-03-26
530079,22622,BOX OF VINTAGE ALPHABET BLOCKS,4,9.95,18061.0,United Kingdom,2026-03-26
530079,84946,ANTIQUE SILVER TEA GLASS ETCHED,24,1.25,18061.0,United Kingdom,2026-03-26
530080,22666,RECIPE BOX PANTRY YELLOW DESIGN,6,2.95,14777.0,United Kingdom,2026-03-26
530080,21829,DINOSAUR KEYRINGS ASSORTED,36,0.21,14777.0,United Kingdom,2026-03-26
530080,22665,RECIPE BOX BLUE SKETCHBOOK DESIGN,6,2.95,14777.0,United Kingdom,2026-03-26
530080,21975,PACK OF 60 DINOSAUR CAKE CASES,24,0.55,14777.0,United Kingdom,2026-03-26
530080,85040A,S/4 PINK FLOWER CANDLES IN BOWL,12,1.65,14777.0,United Kingdom,2026-03-26
530080,20932,PINK POT PLANT CANDLE,4,3.75,14777.0,United Kingdom,2026-03-26
530080,72819,CUPID DESIGN SCENTED CANDLES,6,2.55,14777.0,United Kingdom,2026-03-26
530080,21213,PACK OF 72 SKULL CAKE CASES,24,0.55,14777.0,United Kingdom,2026-03-26
530080,22947,WOODEN ADVENT CALENDAR RED,2,16.95,14777.0,United Kingdom,2026-03-26
530080,22439,6 ROCKET BALLOONS ,24,0.65,14777.0,United Kingdom,2026-03-26
530080,85206A,CREAM FELT EASTER EGG BASKET,6,1.65,14777.0,United Kingdom,2026-03-26
530080,22444,GROW YOUR OWN PLANT IN A CAN ,24,1.25,14777.0,United Kingdom,2026-03-26
530080,22551,PLASTERS IN TIN SPACEBOY,12,1.65,14777.0,United Kingdom,2026-03-26
530080,22553,PLASTERS IN TIN SKULLS,12,1.65,14777.0,United Kingdom,2026-03-26
530080,22946,WOODEN ADVENT CALENDAR CREAM,2,16.95,14777.0,United Kingdom,2026-03-26
530080,21181,PLEASE ONE PERSON METAL SIGN,12,2.1,14777.0,United Kingdom,2026-03-26
530081,22185,SLATE TILE NATURAL HANGING,12,1.65,14229.0,United Kingdom,2026-03-26
530081,22488,NATURAL SLATE RECTANGLE CHALKBOARD,12,1.65,14229.0,United Kingdom,2026-03-26
530081,22083,PAPER CHAIN KIT RETROSPOT,12,2.95,14229.0,United Kingdom,2026-03-26
530081,48138,DOORMAT UNION FLAG,10,6.75,14229.0,United Kingdom,2026-03-26
530081,22456,NATURAL SLATE CHALKBOARD LARGE ,3,4.95,14229.0,United Kingdom,2026-03-26
530081,22457,NATURAL SLATE HEART CHALKBOARD ,48,2.55,14229.0,United Kingdom,2026-03-26
530081,22585,PACK OF 6 BIRDY GIFT TAGS,24,1.25,14229.0,United Kingdom,2026-03-26
530083,18098C,PORCELAIN BUTTERFLY OIL BURNER,6,2.95,13148.0,United Kingdom,2026-03-26
530083,22784,LANTERN CREAM GAZEBO ,3,4.95,13148.0,United Kingdom,2026-03-26
530083,21324,HANGING MEDINA LANTERN SMALL,6,2.95,13148.0,United Kingdom,2026-03-26
530083,82484,WOOD BLACK BOARD ANT WHITE FINISH,6,6.45,13148.0,United Kingdom,2026-03-26
530083,21547,CERAMIC BIRDHOUSE CRESTED TIT SMALL,6,2.95,13148.0,United Kingdom,2026-03-26
530083,21136,PAINTED METAL PEARS ASSORTED,8,1.69,13148.0,United Kingdom,2026-03-26
530083,22470,HEART OF WICKER LARGE,6,2.95,13148.0,United Kingdom,2026-03-26
530082,22427,ENAMEL FLOWER JUG CREAM,3,5.95,14229.0,United Kingdom,2026-03-26
530083,21262,WHITE GOOSE FEATHER CHRISTMAS TREE ,6,2.95,13148.0,United Kingdom,2026-03-26
530083,84625D,WHITE NEWBAROQUE CANDLESTICK CANDLE,24,0.85,13148.0,United Kingdom,2026-03-26
530083,22178,VICTORIAN GLASS HANGING T-LIGHT,12,1.25,13148.0,United Kingdom,2026-03-26
530083,85123A,WHITE HANGING HEART T-LIGHT HOLDER,6,2.95,13148.0,United Kingdom,2026-03-26
530083,22777,GLASS CLOCHE LARGE,2,8.5,13148.0,United Kingdom,2026-03-26
530083,85131A,BEADED PEARL HEART WHITE ON STICK,24,0.42,13148.0,United Kingdom,2026-03-26
530083,84879,ASSORTED COLOUR BIRD ORNAMENT,8,1.69,13148.0,United Kingdom,2026-03-26
530083,35964,FOLKART CLIP ON STARS,96,0.42,13148.0,United Kingdom,2026-03-26
530083,20733,GOLD MINI TAPE MEASURE ,10,0.85,13148.0,United Kingdom,2026-03-26
530083,21284,RETROSPOT CANDLE  SMALL,24,0.42,13148.0,United Kingdom,2026-03-26
530083,22795,SWEETHEART RECIPE BOOK STAND,2,6.75,13148.0,United Kingdom,2026-03-26
530083,22796,PHOTO FRAME 3 CLASSIC HANGING,2,9.95,13148.0,United Kingdom,2026-03-26
530083,22837,HOT WATER BOTTLE BABUSHKA ,4,4.65,13148.0,United Kingdom,2026-03-26
530083,21658,GLASS  BEURRE DISH,4,3.95,13148.0,United Kingdom,2026-03-26
530083,21352,EUCALYPTUS & PINECONE  WREATH,12,1.95,13148.0,United Kingdom,2026-03-26
530083,22113,GREY HEART HOT WATER BOTTLE,4,3.75,13148.0,United Kingdom,2026-03-26
530083,22111,SCOTTIE DOG HOT WATER BOTTLE,3,4.95,13148.0,United Kingdom,2026-03-26
530083,21533,RETROSPOT LARGE MILK JUG,3,4.95,13148.0,United Kingdom,2026-03-26
530083,20886,BOX OF 9 PEBBLE CANDLES,6,1.95,13148.0,United Kingdom,2026-03-26
530083,21351,CINAMMON & ORANGE WREATH,16,1.95,13148.0,United Kingdom,2026-03-26
530083,22049,WRAP CHRISTMAS SCREEN PRINT,25,0.19,13148.0,United Kingdom,2026-03-26
530083,22044,CHRISTMAS CARD STACK OF PRESENTS,24,0.19,13148.0,United Kingdom,2026-03-26
530083,22042,CHRISTMAS CARD SINGING ANGEL,24,0.19,13148.0,United Kingdom,2026-03-26
530083,21285,RETROSPOT CANDLE  MEDIUM,24,0.65,13148.0,United Kingdom,2026-03-26
530083,21421,PORCELAIN ROSE LARGE ,12,1.25,13148.0,United Kingdom,2026-03-26
530084,21544,SKULLS  WATER TRANSFER TATTOOS ,12,0.85,14075.0,United Kingdom,2026-03-26
530084,22418,10 COLOUR SPACEBOY PEN,24,0.85,14075.0,United Kingdom,2026-03-26
530084,22037,ROBOT BIRTHDAY CARD,12,0.42,14075.0,United Kingdom,2026-03-26
530084,21498,RED RETROSPOT WRAP ,25,0.42,14075.0,United Kingdom,2026-03-26
530084,22748,POPPY'S PLAYHOUSE KITCHEN,6,2.1,14075.0,United Kingdom,2026-03-26
530084,22746,POPPY'S PLAYHOUSE LIVINGROOM ,6,2.1,14075.0,United Kingdom,2026-03-26
530084,22334,DINOSAUR PARTY BAG + STICKER SET,8,1.65,14075.0,United Kingdom,2026-03-26
530084,22333,RETROSPOT PARTY BAG + STICKER SET,8,1.65,14075.0,United Kingdom,2026-03-26
530084,22745,POPPY'S PLAYHOUSE BEDROOM ,6,2.1,14075.0,United Kingdom,2026-03-26
530084,22331,WOODLAND PARTY BAG + STICKER SET,8,1.65,14075.0,United Kingdom,2026-03-26
530084,22492,MINI PAINT SET VINTAGE ,72,0.65,14075.0,United Kingdom,2026-03-26
530084,21791,VINTAGE HEADS AND TAILS CARD GAME ,12,1.25,14075.0,United Kingdom,2026-03-26
530084,22622,BOX OF VINTAGE ALPHABET BLOCKS,8,9.95,14075.0,United Kingdom,2026-03-26
530084,22332,SKULLS PARTY BAG + STICKER SET,8,1.65,14075.0,United Kingdom,2026-03-26
530084,22466,FAIRY TALE COTTAGE NIGHTLIGHT,12,1.95,14075.0,United Kingdom,2026-03-26
530084,21833,CAMOUFLAGE LED TORCH,12,1.69,14075.0,United Kingdom,2026-03-26
530084,21731,RED TOADSTOOL LED NIGHT LIGHT,36,1.65,14075.0,United Kingdom,2026-03-26
530084,16169C,WRAP BLUE REINDEER,100,0.42,14075.0,United Kingdom,2026-03-26
530085,22168,ORGANISER WOOD ANTIQUE WHITE ,1,8.5,17315.0,United Kingdom,2026-03-26
530085,21980,PACK OF 12 RED RETROSPOT TISSUES ,1,0.29,17315.0,United Kingdom,2026-03-26
530085,22456,NATURAL SLATE CHALKBOARD LARGE ,1,4.95,17315.0,United Kingdom,2026-03-26
530085,22209,WOOD STAMP SET HAPPY BIRTHDAY,1,1.65,17315.0,United Kingdom,2026-03-26
530085,46000S,POLYESTER FILLER PAD 40x40cm,5,1.45,17315.0,United Kingdom,2026-03-26
530085,21807,WHITE CHRISTMAS STAR DECORATION,1,0.42,17315.0,United Kingdom,2026-03-26
530085,21806,WHITE CHRISTMAS HEART DECORATION,1,0.42,17315.0,United Kingdom,2026-03-26
530085,21121,SET/10 RED POLKADOT PARTY CANDLES,1,1.25,17315.0,United Kingdom,2026-03-26
530085,84992,72 SWEETHEART FAIRY CAKE CASES,1,0.55,17315.0,United Kingdom,2026-03-26
530085,85123A,WHITE HANGING HEART T-LIGHT HOLDER,1,2.95,17315.0,United Kingdom,2026-03-26
530085,85035B,CHOCOLATE 3 WICK MORRIS BOX CANDLE,1,4.25,17315.0,United Kingdom,2026-03-26
530085,22178,VICTORIAN GLASS HANGING T-LIGHT,6,1.25,17315.0,United Kingdom,2026-03-26
530085,84755,COLOUR GLASS T-LIGHT HOLDER HANGING,8,0.65,17315.0,United Kingdom,2026-03-26
530085,84689,S/2 BEACH HUT TREASURE CHESTS,1,5.95,17315.0,United Kingdom,2026-03-26
530085,85232D,SET/3 DECOUPAGE STACKING TINS,1,4.95,17315.0,United Kingdom,2026-03-26
530085,21041,RED RETROSPOT OVEN GLOVE DOUBLE,1,2.95,17315.0,United Kingdom,2026-03-26
530085,21624,VINTAGE UNION JACK DOORSTOP,1,5.95,17315.0,United Kingdom,2026-03-26
530085,20702,PINK PADDED MOBILE,1,4.25,17315.0,United Kingdom,2026-03-26
530085,21411,GINGHAM HEART  DOORSTOP RED,1,4.25,17315.0,United Kingdom,2026-03-26
530085,22855,FINE WICKER HEART ,1,1.25,17315.0,United Kingdom,2026-03-26
530085,48184,DOORMAT ENGLISH ROSE ,1,7.95,17315.0,United Kingdom,2026-03-26
530085,22415,WHITE TISSUE REAM,1,7.95,17315.0,United Kingdom,2026-03-26
530085,84584,PINK GINGHAM CAT WITH SCARF,1,2.55,17315.0,United Kingdom,2026-03-26
530085,22853,CAT BOWL VINTAGE CREAM,2,3.25,17315.0,United Kingdom,2026-03-26
530085,85232A,SET/3 POLKADOT STACKING TINS,1,4.95,17315.0,United Kingdom,2026-03-26
530085,22470,HEART OF WICKER LARGE,2,2.95,17315.0,United Kingdom,2026-03-26
530085,22842,BISCUIT TIN VINTAGE RED,1,6.75,17315.0,United Kingdom,2026-03-26
530085,85099C,JUMBO  BAG BAROQUE BLACK WHITE,1,1.95,17315.0,United Kingdom,2026-03-26
530085,22411,JUMBO SHOPPER VINTAGE RED PAISLEY,1,1.95,17315.0,United Kingdom,2026-03-26
530085,21381,MINI WOODEN HAPPY BIRTHDAY GARLAND,1,1.69,17315.0,United Kingdom,2026-03-26
530085,21380,WOODEN HAPPY BIRTHDAY GARLAND,1,2.95,17315.0,United Kingdom,2026-03-26
530085,21035,SET/2 RED RETROSPOT TEA TOWELS ,1,2.95,17315.0,United Kingdom,2026-03-26
530085,35969,FOLKART CROWN TABLE DECORATIONS,1,1.65,17315.0,United Kingdom,2026-03-26
530085,22423,REGENCY CAKESTAND 3 TIER,1,12.75,17315.0,United Kingdom,2026-03-26
530085,20998,ROSE DU SUD OVEN GLOVE,1,2.95,17315.0,United Kingdom,2026-03-26
530085,22537,MAGIC DRAWING SLATE DINOSAUR,1,0.42,17315.0,United Kingdom,2026-03-26
530085,85055,FRENCH ENAMEL UTENSIL HOLDER,1,3.75,17315.0,United Kingdom,2026-03-26
530085,20773,BLUE PAISLEY NOTEBOOK,1,1.65,17315.0,United Kingdom,2026-03-26
530085,85059,FRENCH ENAMEL WATER BASIN,1,3.75,17315.0,United Kingdom,2026-03-26
530085,21390,FILIGRIS HEART WITH BUTTERFLY,2,1.25,17315.0,United Kingdom,2026-03-26
530085,22795,SWEETHEART RECIPE BOOK STAND,1,6.75,17315.0,United Kingdom,2026-03-26
530085,22896,PEG BAG APPLES DESIGN,1,2.55,17315.0,United Kingdom,2026-03-26
530085,22217,T-LIGHT HOLDER HANGING LACE,2,1.25,17315.0,United Kingdom,2026-03-26
530085,21694,SMALL REGAL  SILVER CANDLEPOT ,6,2.95,17315.0,United Kingdom,2026-03-26
530085,22377,BOTTLE BAG RETROSPOT ,1,2.1,17315.0,United Kingdom,2026-03-26
530085,22698,PINK REGENCY TEACUP AND SAUCER,1,2.95,17315.0,United Kingdom,2026-03-26
530085,22697,GREEN REGENCY TEACUP AND SAUCER,1,2.95,17315.0,United Kingdom,2026-03-26
530085,22699,ROSES REGENCY TEACUP AND SAUCER ,1,2.95,17315.0,United Kingdom,2026-03-26
530085,22469,HEART OF WICKER SMALL,1,1.65,17315.0,United Kingdom,2026-03-26
530085,21217,RED RETROSPOT ROUND CAKE TINS,2,9.95,17315.0,United Kingdom,2026-03-26
530085,22697,GREEN REGENCY TEACUP AND SAUCER,1,2.95,17315.0,United Kingdom,2026-03-26
530085,22480,RED TEA TOWEL CLASSIC DESIGN,1,1.25,17315.0,United Kingdom,2026-03-26
530085,21154,RED RETROSPOT OVEN GLOVE ,1,1.25,17315.0,United Kingdom,2026-03-26
530085,21894,POTTING SHED SEED ENVELOPES,1,1.25,17315.0,United Kingdom,2026-03-26
530085,22082,RIBBON REEL STRIPES DESIGN ,1,1.65,17315.0,United Kingdom,2026-03-26
530085,85049H,URBAN BLACK RIBBONS ,1,1.25,17315.0,United Kingdom,2026-03-26
530085,21324,HANGING MEDINA LANTERN SMALL,2,2.95,17315.0,United Kingdom,2026-03-26
530085,22855,FINE WICKER HEART ,1,1.25,17315.0,United Kingdom,2026-03-26
530085,22158,3 HEARTS HANGING DECORATION RUSTIC,1,2.95,17315.0,United Kingdom,2026-03-26
530085,72807C,SET/3 VANILLA SCENTED CANDLE IN BOX,1,4.25,17315.0,United Kingdom,2026-03-26
530085,35607B,BLACK FEATHER CHRISTMAS DECORATION,1,0.19,17315.0,United Kingdom,2026-03-26
530085,22695,WICKER WREATH SMALL,1,1.45,17315.0,United Kingdom,2026-03-26
530085,21430,SET/3 RED GINGHAM ROSE STORAGE BOX,1,3.75,17315.0,United Kingdom,2026-03-26
530085,22897,OVEN MITT APPLES DESIGN,1,1.45,17315.0,United Kingdom,2026-03-26
530085,22795,SWEETHEART RECIPE BOOK STAND,1,6.75,17315.0,United Kingdom,2026-03-26
530085,35095B,RED VICTORIAN FABRIC OVAL BOX,1,0.42,17315.0,United Kingdom,2026-03-26
530085,22904,CALENDAR PAPER CUT DESIGN,2,2.95,17315.0,United Kingdom,2026-03-26
530085,22667,RECIPE BOX RETROSPOT ,1,2.95,17315.0,United Kingdom,2026-03-26
530085,84613C,BLUE NEW BAROQUE FLOCK CANDLESTICK,2,4.65,17315.0,United Kingdom,2026-03-26
530085,72803B,OCEAN SCENT CANDLE JEWELLED DRAWER,1,4.25,17315.0,United Kingdom,2026-03-26
530085,72803A,ROSE SCENT CANDLE JEWELLED DRAWER,1,4.25,17315.0,United Kingdom,2026-03-26
530085,72801C,4 ROSE PINK DINNER CANDLES,1,1.25,17315.0,United Kingdom,2026-03-26
530085,72801D,4 SKY BLUE DINNER CANDLES,1,1.25,17315.0,United Kingdom,2026-03-26
530085,72800C,4 PINK DINNER CANDLE SILVER FLOCK,1,2.55,17315.0,United Kingdom,2026-03-26
530085,72800D,4 BLUE DINNER CANDLES SILVER FLOCK,1,2.55,17315.0,United Kingdom,2026-03-26
530085,72800B, 4 PURPLE FLOCK DINNER CANDLES,1,2.55,17315.0,United Kingdom,2026-03-26
530085,21690,SILVER  CANDLEPOT JARDIN ,1,3.75,17315.0,United Kingdom,2026-03-26
530085,21929,JUMBO BAG PINK VINTAGE PAISLEY,1,1.95,17315.0,United Kingdom,2026-03-26
530085,21618,4 WILDFLOWER BOTANICAL CANDLES,1,3.75,17315.0,United Kingdom,2026-03-26
530085,22579,WOODEN TREE CHRISTMAS SCANDINAVIAN,1,0.85,17315.0,United Kingdom,2026-03-26
530085,21843,RED RETROSPOT CAKE STAND,1,10.95,17315.0,United Kingdom,2026-03-26
530085,22906,12 MESSAGE CARDS WITH ENVELOPES,1,1.65,17315.0,United Kingdom,2026-03-26
530085,22667,RECIPE BOX RETROSPOT ,1,2.95,17315.0,United Kingdom,2026-03-26
530085,22469,HEART OF WICKER SMALL,1,1.65,17315.0,United Kingdom,2026-03-26
530085,20717,STRAWBERRY SHOPPER BAG,1,1.25,17315.0,United Kingdom,2026-03-26
530085,21288,STRIPEY CHOCOLATE NESTING BOXES,1,2.95,17315.0,United Kingdom,2026-03-26
530085,22242,5 HOOK HANGER MAGIC TOADSTOOL,1,1.65,17315.0,United Kingdom,2026-03-26
530085,21381,MINI WOODEN HAPPY BIRTHDAY GARLAND,1,1.69,17315.0,United Kingdom,2026-03-26
530085,22241,GARLAND WOODEN HAPPY EASTER,2,1.25,17315.0,United Kingdom,2026-03-26
530085,22577,WOODEN HEART CHRISTMAS SCANDINAVIAN,1,0.85,17315.0,United Kingdom,2026-03-26
530085,22488,NATURAL SLATE RECTANGLE CHALKBOARD,1,1.65,17315.0,United Kingdom,2026-03-26
530085,22759,SET OF 3 NOTEBOOKS IN PARCEL,1,1.65,17315.0,United Kingdom,2026-03-26
530085,21614,SET OF 12 ROSE BOTANICAL T-LIGHTS,1,2.95,17315.0,United Kingdom,2026-03-26
530085,22173,METAL 4 HOOK HANGER FRENCH CHATEAU,1,2.95,17315.0,United Kingdom,2026-03-26
530085,21348,PINK SPOTS CHOCOLATE NESTING BOXES ,1,2.95,17315.0,United Kingdom,2026-03-26
530085,21363,HOME SMALL WOOD LETTERS,1,4.95,17315.0,United Kingdom,2026-03-26
530085,22493,PAINT YOUR OWN CANVAS SET,3,1.65,17315.0,United Kingdom,2026-03-26
530085,72798C,SET/4 GARDEN ROSE DINNER CANDLE,1,1.65,17315.0,United Kingdom,2026-03-26
530085,71477,COLOUR GLASS. STAR T-LIGHT HOLDER,1,3.25,17315.0,United Kingdom,2026-03-26
530085,20723,STRAWBERRY CHARLOTTE BAG,1,0.85,17315.0,United Kingdom,2026-03-26
530085,84971S,SMALL HEART FLOWERS HOOK ,3,0.85,17315.0,United Kingdom,2026-03-26
530085,22895,SET OF 2 TEA TOWELS APPLE AND PEARS,1,2.95,17315.0,United Kingdom,2026-03-26
530085,22939,APRON APPLE DELIGHT,1,4.95,17315.0,United Kingdom,2026-03-26
530085,85018D,YULETIDE IMAGES S/6 PAPER BOXES,1,2.55,17315.0,United Kingdom,2026-03-26
530085,20724,RED RETROSPOT CHARLOTTE BAG,1,0.85,17315.0,United Kingdom,2026-03-26
530085,85099B,JUMBO BAG RED RETROSPOT,1,1.95,17315.0,United Kingdom,2026-03-26
