Invoice,StockCode,Description,Quantity,Price,Customer ID,Country,InvoiceDate
517074,22456,NATURAL SLATE CHALKBOARD LARGE ,1,4.95,,United Kingdom,2026-01-02
517074,22169,FAMILY ALBUM WHITE PICTURE FRAME,1,8.5,,United Kingdom,2026-01-02
517074,22170,PICTURE FRAME WOOD TRIPLE PORTRAIT,1,6.75,,United Kingdom,2026-01-02
517074,22378,WALL TIDY RETROSPOT ,1,2.1,,United Kingdom,2026-01-02
517074,22625,RED KITCHEN SCALES,1,8.5,,United Kingdom,2026-01-02
517074,22518,CHILDS GARDEN BRUSH BLUE,1,2.1,,United Kingdom,2026-01-02
517074,15044B,BLUE PAPER PARASOL ,1,2.95,,United Kingdom,2026-01-02
C517075,84466,TOP SECRET PEN SET,-15,0.95,16656.0,United Kingdom,2026-01-02
517076,85086A,CANDY SPOT HEART DECORATION,1,1.66,,United Kingdom,2026-01-02
517076,85014A,BLACK/BLUE DOTS RUFFLED UMBRELLA,1,12.72,,United Kingdom,2026-01-02
517076,85035B,CHOCOLATE 3 WICK MORRIS BOX CANDLE,1,8.47,,United Kingdom,2026-01-02
517076,85036A,GARDENIA 1 WICK MORRIS BOXED CANDLE,1,8.47,,United Kingdom,2026-01-02
517076,85068,CREAM SWEETHEART SHELF + HOOKS,1,16.13,,United Kingdom,2026-01-02
517076,85099B,JUMBO BAG RED RETROSPOT,2,4.21,,United Kingdom,2026-01-02
517076,90056,CHUNKY CRACKED GLAZE NECKLACE IVORY,1,11.05,,United Kingdom,2026-01-02
517076,85136C,RED SHARK HELICOPTER,2,8.47,,United Kingdom,2026-01-02
517076,85159A,"BLACK TEA,COFFEE,SUGAR JARS",1,12.72,,United Kingdom,2026-01-02
517076,85227,SET OF 6 3D KIT CARDS FOR KIDS,1,1.66,,United Kingdom,2026-01-02
517076,90002B,FLOWER BURST SILVER RING ROSE,1,3.81,,United Kingdom,2026-01-02
517076,84987,SET OF 36 TEATIME PAPER DOILIES,1,2.98,,United Kingdom,2026-01-02
517076,DOT,DOTCOM POSTAGE,1,208.3,,United Kingdom,2026-01-02
517076,85099F,JUMBO BAG STRAWBERRY,1,4.21,,United Kingdom,2026-01-02
517076,84978,HANGING HEART JAR T-LIGHT HOLDER,1,2.51,,United Kingdom,2026-01-02
517076,84796A,PINK HAWAIIAN PICNIC HAMPER FOR 2,2,8.47,,United Kingdom,2026-01-02
517076,84946,ANTIQUE SILVER TEA GLASS ETCHED,60,2.51,,United Kingdom,2026-01-02
517076,72801G,S/4 BURGUNDY WINE DINNER CANDLES,1,2.51,,United Kingdom,2026-01-02
517076,82482,WOODEN PICTURE FRAME WHITE FINISH,2,5.06,,United Kingdom,2026-01-02
517076,82484,WOOD BLACK BOARD ANT WHITE FINISH,1,5.91,,United Kingdom,2026-01-02
517076,82484,WOOD BLACK BOARD ANT WHITE FINISH,1,13.57,,United Kingdom,2026-01-02
517076,82494L,WOODEN FRAME ANTIQUE WHITE ,1,7.62,,United Kingdom,2026-01-02
517076,82581,TOILET METAL SIGN,2,1.28,,United Kingdom,2026-01-02
517076,84968F,S/16 VINTAGE SKY BLUE CUTLERY,1,25.49,,United Kingdom,2026-01-02
517076,82597,BOMBS AWAY METAL SIGN,1,4.21,,United Kingdom,2026-01-02
517076,84520B,PACK 20 ENGLISH ROSE PAPER NAPKINS,2,1.66,,United Kingdom,2026-01-02
517076,84568,GIRLS ALPHABET IRON ON PATCHES ,12,0.43,,United Kingdom,2026-01-02
517076,21928,JUMBO BAG SCANDINAVIAN PAISLEY,4,4.21,,United Kingdom,2026-01-02
517076,84843,WHITE SOAP RACK WITH 2 BOTTLES,1,11.87,,United Kingdom,2026-01-02
517076,84913A,SOFT PINK ROSE TOWEL ,2,3.36,,United Kingdom,2026-01-02
517076,84913B,MINT GREEN ROSE TOWEL,2,3.36,,United Kingdom,2026-01-02
517076,84509E,SET OF 4 CAROUSEL PLACEMATS ,1,7.62,,United Kingdom,2026-01-02
517076,21930,JUMBO STORAGE BAG SKULLS,1,4.21,,United Kingdom,2026-01-02
517076,22061,LARGE CAKE STAND  HANGING STRAWBERY,1,21.23,,United Kingdom,2026-01-02
517076,21933,PINK VINTAGE PAISLEY PICNIC BAG,1,5.91,,United Kingdom,2026-01-02
517076,21080,SET/20 RED SPOTTY PAPER NAPKINS ,2,1.66,,United Kingdom,2026-01-02
517076,21035,SET/2 RED SPOTTY TEA TOWELS ,1,5.91,,United Kingdom,2026-01-02
517076,21002,ROSE DU SUD DRAWSTRING BAG,2,3.36,,United Kingdom,2026-01-02
517076,84918,CREAM CUSHION COVER WITH FLOWERS,2,5.91,,United Kingdom,2026-01-02
517076,22411,JUMBO SHOPPER VINTAGE RED PAISLEY,1,4.21,,United Kingdom,2026-01-02
517076,22378,WALL TIDY RETROSPOT ,1,4.21,,United Kingdom,2026-01-02
517076,22366,DOORMAT AIRMAIL ,2,14.43,,United Kingdom,2026-01-02
517076,22355,CHARLOTTE BAG SUKI DESIGN,1,1.66,,United Kingdom,2026-01-02
517076,22353,LUNCH BOX WITH CUTLERY FAIRY CAKES ,1,5.06,,United Kingdom,2026-01-02
517076,22335,HEART DECORATION PAINTED ZINC ,1,1.28,,United Kingdom,2026-01-02
517076,22329,ROUND CONTAINER SET OF 5 RETROSPOT,4,3.36,,United Kingdom,2026-01-02
517076,22324,BLUE POLKADOT KIDS BAG,1,4.21,,United Kingdom,2026-01-02
517076,22300,COFFEE MUG DOG + BALL DESIGN,2,5.06,,United Kingdom,2026-01-02
517076,22200,FRYING PAN PINK POLKADOT ,2,8.47,,United Kingdom,2026-01-02
517076,22178,VICTORIAN GLASS HANGING T-LIGHT,10,2.51,,United Kingdom,2026-01-02
517076,22173,METAL 4 HOOK HANGER FRENCH CHATEAU,1,5.91,,United Kingdom,2026-01-02
517076,22172,METAL SHELF WITH RAIL ,1,16.98,,United Kingdom,2026-01-02
517076,21936,RED RETROSPOT PICNIC BAG,12,5.91,,United Kingdom,2026-01-02
517076,22059,CERAMIC STRWBERRY DESIGN MUG,2,3.36,,United Kingdom,2026-01-02
517076,72741,GRAND CHOCOLATECANDLE,9,2.82,,United Kingdom,2026-01-02
517076,22063,CERAMIC BOWL WITH STRAWBERRY DESIGN,2,5.91,,United Kingdom,2026-01-02
517076,22067,CHOC TRUFFLE GOLD TRINKET POT ,2,3.36,,United Kingdom,2026-01-02
517076,22073,RED RETROSPOT STORAGE JAR,3,7.62,,United Kingdom,2026-01-02
517076,21931,JUMBO STORAGE BAG SUKI,3,4.21,,United Kingdom,2026-01-02
517076,22083,PAPER CHAIN KIT RETRO SPOT,1,5.91,,United Kingdom,2026-01-02
517076,22090,PAPER BUNTING RETRO SPOTS,2,5.91,,United Kingdom,2026-01-02
517076,22094,RED POLKA DOT TISSUE BOX,2,2.51,,United Kingdom,2026-01-02
517076,22112,CHOCOLATE HOT WATER BOTTLE,2,11.02,,United Kingdom,2026-01-02
517076,22123,PING MICROWAVE APRON,1,5.06,,United Kingdom,2026-01-02
517076,22124,SET OF 2 TEA TOWELS PING MICROWAVE,1,2.51,,United Kingdom,2026-01-02
517076,22138,BAKING SET 9 PIECE RETROSPOT ,1,11.02,,United Kingdom,2026-01-02
517076,22087,PAPER BUNTING WHITE LACE,4,5.91,,United Kingdom,2026-01-02
517076,62096A,PINK/YELLOW FLOWERS HANDBAG,1,3.36,,United Kingdom,2026-01-02
517076,22323,PINK POLKADOT KIDS BAG,3,4.21,,United Kingdom,2026-01-02
517076,47593B,SCOTTIE DOGS BABY BIB,1,0.85,,United Kingdom,2026-01-02
517076,21491,SET OF THREE VINTAGE GIFT WRAPS,1,4.21,,United Kingdom,2026-01-02
517076,21486,PINK HEART DOTS HOT WATER BOTTLE,3,4.21,,United Kingdom,2026-01-02
517076,21415,CLAM SHELL SMALL ,1,4.21,,United Kingdom,2026-01-02
517076,21407,BROWN CHECK CAT DOORSTOP ,1,8.47,,United Kingdom,2026-01-02
517076,21385,IVORY HANGING DECORATION  HEART,1,1.66,,United Kingdom,2026-01-02
517076,21232,STRAWBERRY CERAMIC TRINKET BOX,4,2.51,,United Kingdom,2026-01-02
517076,21204,DAISIES  HONEYCOMB GARLAND ,2,3.36,,United Kingdom,2026-01-02
517076,21203,BUTTERFLIES  HONEYCOMB GARLAND,2,3.36,,United Kingdom,2026-01-02
517076,20982,12 PENCILS TALL TUBE SKULLS,1,1.66,,United Kingdom,2026-01-02
517076,20981,12 PENCILS TALL TUBE WOODLAND,4,1.66,,United Kingdom,2026-01-02
517076,20975,12 PENCILS SMALL TUBE RED SPOTTY,1,1.28,,United Kingdom,2026-01-02
517076,20914,SET/5 RED SPOTTY LID GLASS BOWLS,1,5.91,,United Kingdom,2026-01-02
517076,20866,BLUE ROSE FABRIC MIRROR,1,2.51,,United Kingdom,2026-01-02
517076,20724,RED SPOTTY CHARLOTTE BAG,4,1.66,,United Kingdom,2026-01-02
517076,20723,STRAWBERRY CHARLOTTE BAG,1,1.66,,United Kingdom,2026-01-02
517076,20718,RED SPOTTY SHOPPER BAG,2,2.51,,United Kingdom,2026-01-02
517076,20685,DOORMAT RED SPOT,1,14.43,,United Kingdom,2026-01-02
517076,21084,SET/6 COLLAGE PAPER CUPS,2,1.66,,United Kingdom,2026-01-02
517076,21090,SET/6 COLLAGE PAPER PLATES,2,1.66,,United Kingdom,2026-01-02
517076,21107,CREAM SLICE FLANNEL PINK SPOT ,2,5.91,,United Kingdom,2026-01-02
517076,21121,SET/10 RED SPOTTY PARTY CANDLES,1,2.51,,United Kingdom,2026-01-02
517076,21186,WHITE DOVE HONEYCOMB PAPER GARLAND,4,3.36,,United Kingdom,2026-01-02
517076,21188,3D HEARTS  HONEYCOMB PAPER GARLAND,1,5.91,,United Kingdom,2026-01-02
517076,21535,RED RETROSPOT SMALL MILK JUG,1,5.06,,United Kingdom,2026-01-02
517076,21201,TROPICAL  HONEYCOMB PAPER GARLAND ,2,5.06,,United Kingdom,2026-01-02
517076,15056BL,EDWARDIAN PARASOL BLACK,1,12.72,,United Kingdom,2026-01-02
517076,17129F,BLUE GLASS GEMS IN BAG,10,1.66,,United Kingdom,2026-01-02
517076,20665,RED SPOTTY PURSE ,1,5.91,,United Kingdom,2026-01-02
517076,20675,BLUE SPOTTY BOWL,1,2.51,,United Kingdom,2026-01-02
517076,48189,DOORMAT FRIENDSHIP ,1,14.43,,United Kingdom,2026-01-02
517076,20677,PINK SPOTTY BOWL,2,2.51,,United Kingdom,2026-01-02
517076,15039,SANDALWOOD FAN,8,1.66,,United Kingdom,2026-01-02
517076,21559,STRAWBERRY LUNCH BOX WITH CUTLERY,1,5.06,,United Kingdom,2026-01-02
517076,21218,RED SPOTTY BISCUIT TIN,2,8.47,,United Kingdom,2026-01-02
517076,21675,BUTTERFLIES STICKERS,1,1.66,,United Kingdom,2026-01-02
517076,22662,LUNCH BAG DOLLY GIRL DESIGN,1,4.21,,United Kingdom,2026-01-02
517076,22669,RED BABY BUNTING ,1,5.91,,United Kingdom,2026-01-02
517076,22692,DOORMAT WELCOME TO OUR HOME,1,14.43,,United Kingdom,2026-01-02
517076,22713,CARD I LOVE LONDON ,3,0.85,,United Kingdom,2026-01-02
517076,35004C,SET OF 3 COLOURED  FLYING DUCKS,1,12.72,,United Kingdom,2026-01-02
517076,21621,VINTAGE UNION JACK BUNTING,2,16.98,,United Kingdom,2026-01-02
517076,22659,LUNCH BOX I LOVE LONDON,2,4.21,,United Kingdom,2026-01-02
517076,37342,SPOTTY COFFEE CUP & SAUCER,4,5.91,,United Kingdom,2026-01-02
517076,37370,RETRO COFFEE MUGS ASSORTED,1,16.13,,United Kingdom,2026-01-02
517076,47566,PARTY BUNTING,6,8.47,,United Kingdom,2026-01-02
517076,47591A,CAROUSEL CHILDRENS APRON,1,1.66,,United Kingdom,2026-01-02
517076,47591B,SCOTTIES CHILDRENS APRON,1,1.66,,United Kingdom,2026-01-02
517076,47592A,CAROUSEL CHILDRENS OVERALL,1,1.66,,United Kingdom,2026-01-02
517076,47593A,CAROUSEL PONIES BABY BIB,1,0.85,,United Kingdom,2026-01-02
517076,37343,SPOTS DESIGN MUG W PINK INSIDE,6,3.36,,United Kingdom,2026-01-02
517076,22593,CHRISTMAS GINGHAM STAR,1,1.66,,United Kingdom,2026-01-02
517076,35241,ENAMEL BLUE RIM BISCUIT BIN,1,10.17,,United Kingdom,2026-01-02
517076,22502,PICNIC BASKET WICKER SMALL,7,8.47,,United Kingdom,2026-01-02
517076,22508,DOORSTOP RETROSPOT HEART,1,7.62,,United Kingdom,2026-01-02
517076,21676,FLOWERS  STICKERS,1,1.66,,United Kingdom,2026-01-02
517076,21678,PAISLEY PATTERN  STICKERS,1,1.66,,United Kingdom,2026-01-02
517076,21680,WOODLAND  STICKERS,1,1.66,,United Kingdom,2026-01-02
517076,21717,EASTER TIN BUCKET,1,5.06,,United Kingdom,2026-01-02
517076,21746,SMALL RED RETROSPOT WINDMILL,1,2.51,,United Kingdom,2026-01-02
517076,21755,LOVE BUILDING BLOCK WORD,1,11.87,,United Kingdom,2026-01-02
517076,21775,DECORATIVE FLORE BATHROOM BOTTLE,1,2.51,,United Kingdom,2026-01-02
517076,21914,BLUE HARMONICA IN BOX ,2,2.51,,United Kingdom,2026-01-02
517076,21918,SET 12 KIDS COLOUR  CHALK STICKS,1,0.85,,United Kingdom,2026-01-02
517076,21922,UNION STRIPE WITH FRINGE  HAMMOCK,3,8.47,,United Kingdom,2026-01-02
517076,22423,REGENCY CAKESTAND 3 TIER,2,25.49,,United Kingdom,2026-01-02
517076,22489,PACK OF 12 TRADITIONAL CRAYONS,1,0.85,,United Kingdom,2026-01-02
517076,21773,DECORATIVE ROSE BATHROOM BOTTLE,1,2.51,,United Kingdom,2026-01-02
517077,21621,VINTAGE UNION JACK BUNTING,8,8.5,16103.0,United Kingdom,2026-01-02
517077,21713,CITRONELLA CANDLE FLOWERPOT,16,2.1,16103.0,United Kingdom,2026-01-02
517077,85048,15CM CHRISTMAS GLASS BALL 20 LIGHTS,6,7.95,16103.0,United Kingdom,2026-01-02
517077,85123A,WHITE HANGING HEART T-LIGHT HOLDER,32,2.55,16103.0,United Kingdom,2026-01-02
517077,46000M,POLYESTER FILLER PAD 45x45cm,6,1.55,16103.0,United Kingdom,2026-01-02
517077,79029,GLASS HONEYPOT WASP CATCHER,12,1.95,16103.0,United Kingdom,2026-01-02
517077,20839,FRENCH PAISLEY CUSHION COVER ,6,2.95,16103.0,United Kingdom,2026-01-02
517077,22415,WHITE TISSUE REAM,4,7.95,16103.0,United Kingdom,2026-01-02
517078,22366,DOORMAT AIRMAIL ,2,7.49,16254.0,United Kingdom,2026-01-02
517078,21280,VINTAGE KITCHEN PRINT VEGETABLES,1,2.55,16254.0,United Kingdom,2026-01-02
517078,21279,VINTAGE KITCHEN PRINT FRUITS,1,2.55,16254.0,United Kingdom,2026-01-02
517078,21281,VINTAGE KITCHEN PRINT SEAFOOD,1,2.55,16254.0,United Kingdom,2026-01-02
517078,84799,SPRIG LAVENDER ARTIFICIAL FLOWER,24,1.25,16254.0,United Kingdom,2026-01-02
517078,85214,TUB 24 PINK FLOWER PEGS,1,1.65,16254.0,United Kingdom,2026-01-02
517078,21907,I'M ON HOLIDAY METAL SIGN,3,2.1,16254.0,United Kingdom,2026-01-02
517078,48129,DOORMAT TOPIARY,2,7.49,16254.0,United Kingdom,2026-01-02
517078,48184,DOORMAT ENGLISH ROSE ,2,7.49,16254.0,United Kingdom,2026-01-02
517078,22082,RIBBON REEL STRIPES DESIGN ,5,1.65,16254.0,United Kingdom,2026-01-02
517078,21795,SET OF 3 BLUE STRIPE BASKET,1,12.75,16254.0,United Kingdom,2026-01-02
517078,22474,SPACEBOY TV DINNER TRAY,1,4.95,16254.0,United Kingdom,2026-01-02
517078,85123A,WHITE HANGING HEART T-LIGHT HOLDER,6,2.95,16254.0,United Kingdom,2026-01-02
517078,21580,RABBIT  DESIGN  COTTON TOTE BAG,1,2.25,16254.0,United Kingdom,2026-01-02
517078,21758,VINTAGE SHELLS PRINT,2,6.45,16254.0,United Kingdom,2026-01-02
517078,21278,VINTAGE KITCHEN PRINT PUDDINGS,1,2.55,16254.0,United Kingdom,2026-01-02
517078,20685,DOORMAT RED SPOT,2,7.49,16254.0,United Kingdom,2026-01-02
517078,48173C,DOORMAT BLACK FLOCK ,2,7.49,16254.0,United Kingdom,2026-01-02
517078,21658,GLASS  BEURRE DISH,2,3.95,16254.0,United Kingdom,2026-01-02
517078,85099B,JUMBO BAG RED RETROSPOT,6,1.95,16254.0,United Kingdom,2026-01-02
517093,22156,HEART DECORATION WITH PEARLS ,12,0.85,16351.0,United Kingdom,2026-01-02
517093,22380,TOY TIDY SPACEBOY  ,10,2.1,16351.0,United Kingdom,2026-01-02
517093,21975,PACK OF 60 DINOSAUR CAKE CASES,24,0.55,16351.0,United Kingdom,2026-01-02
517093,21587,COSY HOUR GIANT TUBE MATCHES,24,2.55,16351.0,United Kingdom,2026-01-02
517093,22469,HEART OF WICKER SMALL,12,1.65,16351.0,United Kingdom,2026-01-02
517093,21213,PACK OF 72 SKULL CAKE CASES,24,0.55,16351.0,United Kingdom,2026-01-02
517093,85099B,JUMBO BAG RED RETROSPOT,10,1.95,16351.0,United Kingdom,2026-01-02
517093,22151,PLACE SETTING WHITE HEART,24,0.42,16351.0,United Kingdom,2026-01-02
517093,21825,PAINTED METAL TREE WITH HOLLY BELLS,12,1.45,16351.0,United Kingdom,2026-01-02
517093,21823,PAINTED METAL HEART WITH HOLLY BELL,12,1.45,16351.0,United Kingdom,2026-01-02
517093,21824,PAINTED METAL STAR WITH HOLLY BELLS,12,1.45,16351.0,United Kingdom,2026-01-02
517093,22667,RECIPE BOX RETRO SPOT DESIGN,6,2.95,16351.0,United Kingdom,2026-01-02
517093,22646,CERAMIC STRAWBERRY CAKE MONEY BANK,24,1.45,16351.0,United Kingdom,2026-01-02
517093,22593,CHRISTMAS GINGHAM STAR,12,0.85,16351.0,United Kingdom,2026-01-02
517093,22594,CHRISTMAS GINGHAM TREE,12,0.85,16351.0,United Kingdom,2026-01-02
517093,22595,CHRISTMAS GINGHAM HEART,12,0.85,16351.0,United Kingdom,2026-01-02
517093,22600,CHRISTMAS RETROSPOT STAR WOOD,12,0.85,16351.0,United Kingdom,2026-01-02
517093,22152,PLACE SETTING WHITE STAR,24,0.42,16351.0,United Kingdom,2026-01-02
517093,22645,CERAMIC HEART FAIRY CAKE MONEY BANK,24,1.45,16351.0,United Kingdom,2026-01-02
517093,20711,JUMBO BAG TOYS ,10,1.95,16351.0,United Kingdom,2026-01-02
517093,22664,TOY TIDY DOLLY GIRL DESIGN,10,2.1,16351.0,United Kingdom,2026-01-02
517093,22187,GREEN CHRISTMAS TREE CARD HOLDER,4,4.25,16351.0,United Kingdom,2026-01-02
517093,22601,CHRISTMAS RETROSPOT ANGEL WOOD,12,0.85,16351.0,United Kingdom,2026-01-02
517093,22602,CHRISTMAS RETROSPOT HEART WOOD,12,0.85,16351.0,United Kingdom,2026-01-02
517093,22603,CHRISTMAS RETROSPOT TREE WOOD,12,0.85,16351.0,United Kingdom,2026-01-02
517093,22578,WOODEN STAR CHRISTMAS SCANDINAVIAN,12,0.85,16351.0,United Kingdom,2026-01-02
517093,22579,WOODEN TREE CHRISTMAS SCANDINAVIAN,12,0.85,16351.0,United Kingdom,2026-01-02
517093,22581,WOOD STOCKING CHRISTMAS SCANDISPOT,12,0.85,16351.0,United Kingdom,2026-01-02
517093,22573,STAR WOODEN CHRISTMAS DECORATION,12,0.85,16351.0,United Kingdom,2026-01-02
517093,22574,HEART WOODEN CHRISTMAS DECORATION,12,0.85,16351.0,United Kingdom,2026-01-02
517093,22577,WOODEN HEART CHRISTMAS SCANDINAVIAN,12,0.85,16351.0,United Kingdom,2026-01-02
517093,22572,ROCKING HORSE GREEN CHRISTMAS ,12,0.85,16351.0,United Kingdom,2026-01-02
517093,22571,ROCKING HORSE RED CHRISTMAS ,12,0.85,16351.0,United Kingdom,2026-01-02
517093,22596,CHRISTMAS STAR WISH LIST CHALKBOARD,12,0.85,16351.0,United Kingdom,2026-01-02
517093,35970,ZINC FOLKART SLEIGH BELLS,12,1.69,16351.0,United Kingdom,2026-01-02
517093,22591,CARDHOLDER GINGHAM CHRISTMAS TREE,6,2.55,16351.0,United Kingdom,2026-01-02
517093,22662,LUNCH BAG DOLLY GIRL DESIGN,10,1.65,16351.0,United Kingdom,2026-01-02
517093,22576,SWALLOW WOODEN CHRISTMAS DECORATION,12,0.85,16351.0,United Kingdom,2026-01-02
517093,22663,JUMBO BAG DOLLY GIRL DESIGN,10,1.95,16351.0,United Kingdom,2026-01-02
517094,22028,PENNY FARTHING BIRTHDAY CARD,1,0.85,,United Kingdom,2026-01-02
517094,22033,BOTANICAL ROSE GREETING CARD,1,0.85,,United Kingdom,2026-01-02
517094,22037,ROBOT BIRTHDAY CARD,2,0.85,,United Kingdom,2026-01-02
517094,22063,CERAMIC BOWL WITH STRAWBERRY DESIGN,2,5.91,,United Kingdom,2026-01-02
517094,79030A,"TUMBLER, ENGLISH ROSE",1,12.72,,United Kingdom,2026-01-02
517094,22090,PAPER BUNTING RETRO SPOTS,5,5.91,,United Kingdom,2026-01-02
517094,22088,PAPER BUNTING COLOURED LACE,1,5.91,,United Kingdom,2026-01-02
517094,22092,BLUE PAISLEY TISSUE BOX,1,2.51,,United Kingdom,2026-01-02
517094,22024,RAINY LADIES BIRTHDAY CARD,1,0.85,,United Kingdom,2026-01-02
517094,22094,RED POLKA DOT TISSUE BOX,1,2.51,,United Kingdom,2026-01-02
517094,22073,RED RETROSPOT STORAGE JAR,3,7.62,,United Kingdom,2026-01-02
517094,21992,VINTAGE PAISLEY STATIONERY SET,1,5.91,,United Kingdom,2026-01-02
517094,21390,FILIGRIS HEART WITH BUTTERFLY,8,2.51,,United Kingdom,2026-01-02
517094,21922,UNION STRIPE WITH FRINGE  HAMMOCK,2,8.47,,United Kingdom,2026-01-02
517094,21901,"KEY FOB , BACK DOOR ",1,1.66,,United Kingdom,2026-01-02
517094,21900,"KEY FOB , SHED",1,1.66,,United Kingdom,2026-01-02
517094,21899,"KEY FOB , GARAGE DESIGN",1,1.66,,United Kingdom,2026-01-02
517094,21791,VINTAGE HEADS AND TAILS CARD GAME ,1,2.51,,United Kingdom,2026-01-02
517094,21790,VINTAGE SNAP CARDS,1,1.66,,United Kingdom,2026-01-02
517094,21642,ASSORTED TUTTI FRUTTI PEN,2,1.66,,United Kingdom,2026-01-02
517094,21641,ASSORTED TUTTI FRUTTI KEYRING BALL,1,1.66,,United Kingdom,2026-01-02
517094,21547,CERAMIC BIRDHOUSE CRESTED TIT SMALL,1,5.91,,United Kingdom,2026-01-02
517094,21544,SKULLS  WATER TRANSFER TATTOOS ,1,1.66,,United Kingdom,2026-01-02
517094,21509,COWBOYS AND INDIANS BIRTHDAY CARD ,1,0.85,,United Kingdom,2026-01-02
517094,22358,KINGS CHOICE TEA CADDY ,1,5.91,,United Kingdom,2026-01-02
517094,21931,JUMBO STORAGE BAG SUKI,1,4.21,,United Kingdom,2026-01-02
517094,22361,GLASS JAR DAISY FRESH COTTON WOOL,1,5.91,,United Kingdom,2026-01-02
517094,48187,DOORMAT NEW ENGLAND,1,14.43,,United Kingdom,2026-01-02
517094,22381,TOY TIDY PINK RETROSPOT  ,1,4.21,,United Kingdom,2026-01-02
517094,21357,TOAST ITS - DINOSAUR,1,2.51,,United Kingdom,2026-01-02
517094,79029,GLASS HONEYPOT WASP CATCHER,2,4.21,,United Kingdom,2026-01-02
517094,72819,CUPID DESIGN SCENTED CANDLES,1,5.06,,United Kingdom,2026-01-02
517094,72122,COFFEE SCENT PILLAR CANDLE,1,1.91,,United Kingdom,2026-01-02
517094,47597,NEW ENGLAND TEATOWELS,1,1.66,,United Kingdom,2026-01-02
517094,47568,ENGLISH ROSE DESIGN PEG BAG,1,4.21,,United Kingdom,2026-01-02
517094,46776B,WOVEN BERRIES CUSHION COVER ,1,4.21,,United Kingdom,2026-01-02
517094,35961,FOLKART ZINC HEART CHRISTMAS DEC,8,1.66,,United Kingdom,2026-01-02
517094,22718,CARD CAT AND TREE ,3,0.85,,United Kingdom,2026-01-02
517094,22716,CARD CIRCUS PARADE,1,0.85,,United Kingdom,2026-01-02
517094,22668,PINK BABY BUNTING,1,5.91,,United Kingdom,2026-01-02
517094,22666,RECIPE BOX PANTRY YELLOW DESIGN,2,5.91,,United Kingdom,2026-01-02
517094,22377,BOTTLE BAG RETROSPOT ,1,4.21,,United Kingdom,2026-01-02
517094,22663,JUMBO BAG DOLLY GIRL DESIGN,1,4.21,,United Kingdom,2026-01-02
517094,22653,BUTTON BOX ,1,4.21,,United Kingdom,2026-01-02
517094,22631,CIRCUS PARADE LUNCH BOX ,1,4.21,,United Kingdom,2026-01-02
517094,22630,DOLLY GIRL LUNCH BOX,1,4.21,,United Kingdom,2026-01-02
517094,22625,RED KITCHEN SCALES,1,16.98,,United Kingdom,2026-01-02
517094,22612,TEA COSY VINTAGE UNION JACK,1,7.62,,United Kingdom,2026-01-02
517094,22550,HOLIDAY FUN LUDO,1,7.62,,United Kingdom,2026-01-02
517094,22501,PICNIC BASKET WICKER LARGE,1,21.23,,United Kingdom,2026-01-02
517094,22469,HEART OF WICKER SMALL,4,3.36,,United Kingdom,2026-01-02
517094,22464,HANGING METAL HEART LANTERN,35,3.36,,United Kingdom,2026-01-02
517094,22418,10 COLOUR SPACEBOY PEN,1,1.66,,United Kingdom,2026-01-02
517094,22414,DOORMAT NEIGHBOURHOOD WITCH ,1,14.43,,United Kingdom,2026-01-02
517094,22411,JUMBO SHOPPER VINTAGE RED PAISLEY,3,4.21,,United Kingdom,2026-01-02
517094,22662,LUNCH BAG DOLLY GIRL DESIGN,1,4.21,,United Kingdom,2026-01-02
517094,21356,TOAST ITS - FAIRY FLOWER,1,2.51,,United Kingdom,2026-01-02
517094,90038C,GLASS AND BEADS BRACELET IVORY,1,3.81,,United Kingdom,2026-01-02
517094,21326,AGED GLASS SILVER T-LIGHT HOLDER,10,1.66,,United Kingdom,2026-01-02
517094,84918,CREAM CUSHION COVER WITH FLOWERS,1,5.91,,United Kingdom,2026-01-02
517094,84905,PINK BUTTERFLY CUSHION COVER ,1,5.06,,United Kingdom,2026-01-02
517094,84856L,LARGE TAHITI BEACH BAG,1,11.87,,United Kingdom,2026-01-02
517094,84849D,HOT BATHS SOAP HOLDER,1,3.36,,United Kingdom,2026-01-02
517094,84843,WHITE SOAP RACK WITH 2 BOTTLES,1,11.87,,United Kingdom,2026-01-02
517094,84836,ZINC METAL HEART DECORATION,8,2.51,,United Kingdom,2026-01-02
517094,84692,BOX OF 24 COCKTAIL PARASOLS,1,0.85,,United Kingdom,2026-01-02
517094,84682,CLASSICAL ROSE DISH,1,5.91,,United Kingdom,2026-01-02
517094,84596G,SMALL CHOCOLATES PINK BOWL,1,1.66,,United Kingdom,2026-01-02
517094,84520B,PACK 20 ENGLISH ROSE PAPER NAPKINS,2,1.66,,United Kingdom,2026-01-02
517094,82613D,METAL SIGN CUPCAKE SINGLE HOOK,1,2.51,,United Kingdom,2026-01-02
517094,79336,LIGHT PINK FLOCK GLASS CANDLEHOLDER,1,3.36,,United Kingdom,2026-01-02
517094,79328,BLUE FLOCK GLASS CANDLEHOLDER,1,3.36,,United Kingdom,2026-01-02
517094,79302M,"ART LIGHTS,FUNK MONKEY",1,5.91,,United Kingdom,2026-01-02
517094,79066K,RETRO MOD TRAY,4,1.66,,United Kingdom,2026-01-02
517094,79030G,"TUMBLER, NEW ENGLAND",1,12.72,,United Kingdom,2026-01-02
517094,22357,KINGS CHOICE BISCUIT TIN,1,8.47,,United Kingdom,2026-01-02
517094,22355,CHARLOTTE BAG SUKI DESIGN,1,1.66,,United Kingdom,2026-01-02
517094,22348,TEA BAG PLATE RED SPOTTY ,1,1.66,,United Kingdom,2026-01-02
517094,22335,HEART DECORATION PAINTED ZINC ,8,1.28,,United Kingdom,2026-01-02
517094,22297,HEART IVORY TRELLIS SMALL,8,2.51,,United Kingdom,2026-01-02
517094,22197,SMALL POPCORN HOLDER,1,1.66,,United Kingdom,2026-01-02
517094,22185,SLATE TILE NATURAL HANGING,1,3.36,,United Kingdom,2026-01-02
517094,22133,PINK LOVE HEART SHAPE CUP,1,1.66,,United Kingdom,2026-01-02
517094,21355,TOAST ITS - I LOVE YOU ,1,2.51,,United Kingdom,2026-01-02
517094,84946,ANTIQUE SILVER TEA GLASS ETCHED,20,2.51,,United Kingdom,2026-01-02
517094,84975,HEART SHAPED MIRROR,1,3.36,,United Kingdom,2026-01-02
517094,22134,LADLE LOVE HEART RED ,1,0.85,,United Kingdom,2026-01-02
517094,84997B,RED 3 PIECE MINI DOTS CUTLERY SET,1,7.62,,United Kingdom,2026-01-02
517094,84988,SET OF 72 PINK HEART PAPER DOILIES,1,2.98,,United Kingdom,2026-01-02
517094,21240,BLUE  SPOTTY CUP,1,1.66,,United Kingdom,2026-01-02
517094,21272,SALLE DE BAIN HOOK,2,2.51,,United Kingdom,2026-01-02
517094,21212,PACK OF 72 RETRO SPOT CAKE CASES,2,1.28,,United Kingdom,2026-01-02
517094,21110,LARGE CAKE TOWEL PINK SPOTS,1,13.57,,United Kingdom,2026-01-02
517094,21094,SET/6 RED SPOTTY PAPER PLATES,2,1.66,,United Kingdom,2026-01-02
517094,21086,SET/6 RED SPOTTY PAPER CUPS,2,1.66,,United Kingdom,2026-01-02
517094,21080,SET/20 RED SPOTTY PAPER NAPKINS ,2,1.66,,United Kingdom,2026-01-02
517094,21035,SET/2 RED SPOTTY TEA TOWELS ,1,5.91,,United Kingdom,2026-01-02
517094,20943,SET/6 GINGERBREAD STAR T-LIGHTS,1,2.51,,United Kingdom,2026-01-02
517094,20728,LUNCH BAG CARS BLUE,1,4.21,,United Kingdom,2026-01-02
517094,20726,LUNCH BAG WOODLAND,1,4.21,,United Kingdom,2026-01-02
517094,20723,STRAWBERRY CHARLOTTE BAG,1,1.66,,United Kingdom,2026-01-02
517094,21033,JUMBO BAG CHARLIE AND LOLA TOYS,1,5.91,,United Kingdom,2026-01-02
517094,20711,JUMBO BAG TOYS ,1,4.21,,United Kingdom,2026-01-02
517094,85062,PEARL CRYSTAL PUMPKIN T-LIGHT HLDR,10,2.51,,United Kingdom,2026-01-02
517094,85099B,JUMBO BAG RED RETROSPOT,2,4.21,,United Kingdom,2026-01-02
517094,20719,WOODLAND CHARLOTTE BAG,1,1.66,,United Kingdom,2026-01-02
517094,85135C,RED DRAGONFLY HELICOPTER,1,8.47,,United Kingdom,2026-01-02
517094,85159B,"WHITE TEA,COFFEE,SUGAR JARS",1,12.72,,United Kingdom,2026-01-02
517094,85203,HANGING WOOD AND FELT BUTTERFLY ,1,0.84,,United Kingdom,2026-01-02
517094,85099F,JUMBO BAG STRAWBERRY,2,4.21,,United Kingdom,2026-01-02
517094,DOT,DOTCOM POSTAGE,1,153.49,,United Kingdom,2026-01-02
517094,22131,FOOD CONTAINER SET 3 LOVE HEART ,1,4.21,,United Kingdom,2026-01-02
517094,16207A,PINK STRAWBERRY HANDBAG ,2,3.36,,United Kingdom,2026-01-02
517094,20662,FIRST CLASS HOLIDAY PURSE ,1,2.51,,United Kingdom,2026-01-02
517094,90062,CARNIVAL BRACELET,1,12.75,,United Kingdom,2026-01-02
517095,85123A,WHITE HANGING HEART T-LIGHT HOLDER,6,2.95,16208.0,United Kingdom,2026-01-02
517095,22668,PINK BABY BUNTING,5,2.95,16208.0,United Kingdom,2026-01-02
517095,22669,RED BABY BUNTING ,5,2.95,16208.0,United Kingdom,2026-01-02
517095,22588,CARD HOLDER GINGHAM HEART,6,2.55,16208.0,United Kingdom,2026-01-02
517095,22180,RETRO SPOT LAMP,2,9.95,16208.0,United Kingdom,2026-01-02
517095,22595,CHRISTMAS GINGHAM HEART,24,0.85,16208.0,United Kingdom,2026-01-02
517095,22577,WOODEN HEART CHRISTMAS SCANDINAVIAN,24,0.85,16208.0,United Kingdom,2026-01-02
517095,22469,HEART OF WICKER SMALL,12,1.65,16208.0,United Kingdom,2026-01-02
517095,21916,SET 12 RETRO WHITE CHALK STICKS,24,0.42,16208.0,United Kingdom,2026-01-02
517095,21755,LOVE BUILDING BLOCK WORD,3,5.95,16208.0,United Kingdom,2026-01-02
517095,21035,SET/2 RED SPOTTY TEA TOWELS ,6,2.95,16208.0,United Kingdom,2026-01-02
517095,21754,HOME BUILDING BLOCK WORD,3,5.95,16208.0,United Kingdom,2026-01-02
517095,22077,6 RIBBONS RUSTIC CHARM,12,1.65,16208.0,United Kingdom,2026-01-02
