Invoice,StockCode,Description,Quantity,Price,Customer ID,Country,InvoiceDate
535245,22896,PEG BAG APPLES DESIGN,2,2.55,14527.0,United Kingdom,2026-04-16
535245,22297,HEART IVORY TRELLIS SMALL,6,1.25,14527.0,United Kingdom,2026-04-16
535245,22296,HEART IVORY TRELLIS LARGE,6,1.65,14527.0,United Kingdom,2026-04-16
535245,22759,SET OF 3 NOTEBOOKS IN PARCEL,4,1.65,14527.0,United Kingdom,2026-04-16
535245,22577,WOODEN HEART CHRISTMAS SCANDINAVIAN,6,0.85,14527.0,United Kingdom,2026-04-16
535245,22602,CHRISTMAS RETROSPOT HEART WOOD,6,0.85,14527.0,United Kingdom,2026-04-16
535245,22595,CHRISTMAS GINGHAM HEART,1,0.85,14527.0,United Kingdom,2026-04-16
535245,22605,WOODEN CROQUET GARDEN SET,1,14.95,14527.0,United Kingdom,2026-04-16
535245,22430,ENAMEL WATERING CAN CREAM,2,4.95,14527.0,United Kingdom,2026-04-16
535245,22745,POPPY'S PLAYHOUSE BEDROOM ,2,2.1,14527.0,United Kingdom,2026-04-16
535245,22470,HEART OF WICKER LARGE,1,2.95,14527.0,United Kingdom,2026-04-16
535245,22594,CHRISTMAS GINGHAM TREE,1,0.85,14527.0,United Kingdom,2026-04-16
535245,79321,CHILLI LIGHTS,1,4.95,14527.0,United Kingdom,2026-04-16
535245,22866,HAND WARMER SCOTTY DOG DESIGN,2,2.1,14527.0,United Kingdom,2026-04-16
535245,22865,HAND WARMER OWL DESIGN,1,2.1,14527.0,United Kingdom,2026-04-16
535245,21042,RED RETROSPOT APRON ,2,5.95,14527.0,United Kingdom,2026-04-16
535245,22112,CHOCOLATE HOT WATER BOTTLE,2,4.95,14527.0,United Kingdom,2026-04-16
535245,22678,FRENCH BLUE METAL DOOR SIGN 3,1,1.25,14527.0,United Kingdom,2026-04-16
535245,47567B,TEA TIME KITCHEN APRON,1,5.95,14527.0,United Kingdom,2026-04-16
535245,22665,RECIPE BOX BLUE SKETCHBOOK DESIGN,1,2.95,14527.0,United Kingdom,2026-04-16
535245,21754,HOME BUILDING BLOCK WORD,1,5.95,14527.0,United Kingdom,2026-04-16
535245,22947,WOODEN ADVENT CALENDAR RED,1,16.95,14527.0,United Kingdom,2026-04-16
535245,21706,FOLDING UMBRELLA RED/WHITE POLKADOT,1,4.95,14527.0,United Kingdom,2026-04-16
535245,22192,BLUE DINER WALL CLOCK,1,8.5,14527.0,United Kingdom,2026-04-16
535245,22696,WICKER WREATH LARGE,1,1.95,14527.0,United Kingdom,2026-04-16
535247,22470,HEART OF WICKER LARGE,6,2.95,14824.0,United Kingdom,2026-04-16
535247,85099B,JUMBO BAG RED RETROSPOT,30,1.95,14824.0,United Kingdom,2026-04-16
535247,22112,CHOCOLATE HOT WATER BOTTLE,9,4.95,14824.0,United Kingdom,2026-04-16
535247,22111,SCOTTIE DOG HOT WATER BOTTLE,6,4.95,14824.0,United Kingdom,2026-04-16
535247,85099F,JUMBO BAG STRAWBERRY,10,1.95,14824.0,United Kingdom,2026-04-16
535247,85099C,JUMBO  BAG BAROQUE BLACK WHITE,20,1.95,14824.0,United Kingdom,2026-04-16
535247,22381,TOY TIDY PINK POLKADOT,20,2.1,14824.0,United Kingdom,2026-04-16
535247,22379,RECYCLING BAG RETROSPOT ,20,2.1,14824.0,United Kingdom,2026-04-16
535247,20713,JUMBO BAG OWLS,10,1.95,14824.0,United Kingdom,2026-04-16
535247,21930,JUMBO STORAGE BAG SKULLS,10,1.95,14824.0,United Kingdom,2026-04-16
535247,20711,JUMBO BAG TOYS ,20,1.95,14824.0,United Kingdom,2026-04-16
535247,84970S,HANGING HEART ZINC T-LIGHT HOLDER,12,0.85,14824.0,United Kingdom,2026-04-16
535247,22386,JUMBO BAG PINK POLKADOT,30,1.95,14824.0,United Kingdom,2026-04-16
535248,22726,ALARM CLOCK BAKELIKE GREEN,8,3.75,13319.0,United Kingdom,2026-04-16
535248,20725,LUNCH BAG RED RETROSPOT,10,1.65,13319.0,United Kingdom,2026-04-16
535248,22383,LUNCH BAG SUKI  DESIGN ,10,1.65,13319.0,United Kingdom,2026-04-16
535248,21670,BLUE SPOT CERAMIC DRAWER KNOB,12,1.25,13319.0,United Kingdom,2026-04-16
535248,22474,SPACEBOY TV DINNER TRAY,3,4.95,13319.0,United Kingdom,2026-04-16
535248,21212,PACK OF 72 RETROSPOT CAKE CASES,24,0.55,13319.0,United Kingdom,2026-04-16
535248,22952,60 CAKE CASES VINTAGE CHRISTMAS,24,0.55,13319.0,United Kingdom,2026-04-16
535248,22737,RIBBON REEL CHRISTMAS PRESENT ,10,1.65,13319.0,United Kingdom,2026-04-16
535248,85049A,TRADITIONAL CHRISTMAS RIBBONS,12,1.25,13319.0,United Kingdom,2026-04-16
535248,21533,RETROSPOT LARGE MILK JUG,3,4.95,13319.0,United Kingdom,2026-04-16
535248,21843,RED RETROSPOT CAKE STAND,3,10.95,13319.0,United Kingdom,2026-04-16
535248,22072,RED RETROSPOT TEA CUP AND SAUCER ,8,3.75,13319.0,United Kingdom,2026-04-16
535248,22781,GUMBALL MAGAZINE RACK,2,7.65,13319.0,United Kingdom,2026-04-16
535248,21672,WHITE SPOT RED CERAMIC DRAWER KNOB,12,1.25,13319.0,United Kingdom,2026-04-16
535248,21671,RED SPOT CERAMIC DRAWER KNOB,12,1.25,13319.0,United Kingdom,2026-04-16
535248,20914,SET/5 RED RETROSPOT LID GLASS BOWLS,12,2.95,13319.0,United Kingdom,2026-04-16
535248,21658,GLASS  BEURRE DISH,4,3.95,13319.0,United Kingdom,2026-04-16
535248,84754,S/15 SILVER GLASS BAUBLES IN BAG,24,1.25,13319.0,United Kingdom,2026-04-16
535248,22180,RETROSPOT LAMP,3,9.95,13319.0,United Kingdom,2026-04-16
535248,84347,ROTATING SILVER ANGELS T-LIGHT HLDR,24,2.55,13319.0,United Kingdom,2026-04-16
535248,84970S,HANGING HEART ZINC T-LIGHT HOLDER,24,0.85,13319.0,United Kingdom,2026-04-16
535248,22924,FRIDGE MAGNETS LA VIE EN ROSE,12,0.85,13319.0,United Kingdom,2026-04-16
535248,22837,HOT WATER BOTTLE BABUSHKA ,12,4.65,13319.0,United Kingdom,2026-04-16
535248,22791,T-LIGHT GLASS FLUTED ANTIQUE,12,1.25,13319.0,United Kingdom,2026-04-16
535248,21527,RED RETROSPOT TRADITIONAL TEAPOT ,4,7.95,13319.0,United Kingdom,2026-04-16
535249,22915,ASSORTED BOTTLE TOP  MAGNETS ,24,0.42,13319.0,United Kingdom,2026-04-16
535249,22965,3 TRADITIONAL COOKIE CUTTERS  SET,6,2.1,13319.0,United Kingdom,2026-04-16
535249,22969,HOMEMADE JAM SCENTED CANDLES,24,1.45,13319.0,United Kingdom,2026-04-16
535249,22913,RED COAT RACK PARIS FASHION,3,4.95,13319.0,United Kingdom,2026-04-16
535249,22912,YELLOW COAT RACK PARIS FASHION,3,4.95,13319.0,United Kingdom,2026-04-16
535249,22914,BLUE COAT RACK PARIS FASHION,3,4.95,13319.0,United Kingdom,2026-04-16
535250,90214M,"LETTER ""M"" BLING KEY RING",1,1.25,15987.0,United Kingdom,2026-04-16
535250,90214C,"LETTER ""C"" BLING KEY RING",1,1.25,15987.0,United Kingdom,2026-04-16
535250,90214K,"LETTER ""K"" BLING KEY RING",1,1.25,15987.0,United Kingdom,2026-04-16
535250,22132,RED LOVE HEART SHAPE CUP,1,0.85,15987.0,United Kingdom,2026-04-16
535250,22966,GINGERBREAD MAN COOKIE CUTTER,1,1.25,15987.0,United Kingdom,2026-04-16
535250,22328,ROUND SNACK BOXES SET OF 4 FRUITS ,1,2.95,15987.0,United Kingdom,2026-04-16
535250,22132,RED LOVE HEART SHAPE CUP,1,0.85,15987.0,United Kingdom,2026-04-16
535250,22097,SWALLOW SQUARE TISSUE BOX,1,1.25,15987.0,United Kingdom,2026-04-16
535250,22399,MAGNETS PACK OF 4 CHILDHOOD MEMORY,1,1.25,15987.0,United Kingdom,2026-04-16
535250,22147,FELTCRAFT BUTTERFLY HEARTS,4,1.45,15987.0,United Kingdom,2026-04-16
535250,22470,HEART OF WICKER LARGE,1,2.95,15987.0,United Kingdom,2026-04-16
535250,21902,"KEY FOB , FRONT  DOOR ",2,0.65,15987.0,United Kingdom,2026-04-16
535250,21899,"KEY FOB , GARAGE DESIGN",1,0.65,15987.0,United Kingdom,2026-04-16
535250,85135C,RED DRAGONFLY HELICOPTER,1,7.95,15987.0,United Kingdom,2026-04-16
535250,22505,MEMO BOARD COTTAGE DESIGN,1,4.95,15987.0,United Kingdom,2026-04-16
535250,20682,RED RETROSPOT CHILDRENS UMBRELLA,2,3.25,15987.0,United Kingdom,2026-04-16
535250,20681,PINK POLKADOT CHILDRENS UMBRELLA,1,3.25,15987.0,United Kingdom,2026-04-16
535250,21892,TRADITIONAL WOODEN CATCH CUP GAME ,2,1.25,15987.0,United Kingdom,2026-04-16
535250,22328,ROUND SNACK BOXES SET OF 4 FRUITS ,1,2.95,15987.0,United Kingdom,2026-04-16
535250,47590B,PINK HAPPY BIRTHDAY BUNTING,1,5.45,15987.0,United Kingdom,2026-04-16
535250,22865,HAND WARMER OWL DESIGN,2,2.1,15987.0,United Kingdom,2026-04-16
535250,21901,"KEY FOB , BACK DOOR ",2,0.65,15987.0,United Kingdom,2026-04-16
535250,22147,FELTCRAFT BUTTERFLY HEARTS,1,1.45,15987.0,United Kingdom,2026-04-16
535250,21900,"KEY FOB , SHED",1,0.65,15987.0,United Kingdom,2026-04-16
535250,20972,PINK CREAM FELT CRAFT TRINKET BOX ,1,1.25,15987.0,United Kingdom,2026-04-16
535250,22645,CERAMIC HEART FAIRY CAKE MONEY BANK,1,1.45,15987.0,United Kingdom,2026-04-16
535250,90162C,ANT SILVER FUSCHIA BOUDICCA RING,1,2.95,15987.0,United Kingdom,2026-04-16
535250,20972,PINK CREAM FELT CRAFT TRINKET BOX ,2,1.25,15987.0,United Kingdom,2026-04-16
535250,22147,FELTCRAFT BUTTERFLY HEARTS,1,1.45,15987.0,United Kingdom,2026-04-16
535250,22426,ENAMEL WASH BOWL CREAM,1,3.75,15987.0,United Kingdom,2026-04-16
535250,22909,SET OF 20 VINTAGE CHRISTMAS NAPKINS,1,0.85,15987.0,United Kingdom,2026-04-16
535250,22441,GROW YOUR OWN BASIL IN ENAMEL MUG,1,2.1,15987.0,United Kingdom,2026-04-16
535250,85053,FRENCH ENAMEL CANDLEHOLDER,1,2.1,15987.0,United Kingdom,2026-04-16
535250,22147,FELTCRAFT BUTTERFLY HEARTS,1,1.45,15987.0,United Kingdom,2026-04-16
535250,22952,60 CAKE CASES VINTAGE CHRISTMAS,1,0.55,15987.0,United Kingdom,2026-04-16
535250,22556,PLASTERS IN TIN CIRCUS PARADE ,1,1.65,15987.0,United Kingdom,2026-04-16
535250,22620,4 TRADITIONAL SPINNING TOPS,2,1.25,15987.0,United Kingdom,2026-04-16
535250,21705,BAG 500g SWIRLY MARBLES,1,1.65,15987.0,United Kingdom,2026-04-16
535250,21704,BAG 250g SWIRLY MARBLES,1,0.85,15987.0,United Kingdom,2026-04-16
535250,22188,BLACK HEART CARD HOLDER,2,3.95,15987.0,United Kingdom,2026-04-16
535250,21591,COSY HOUR CIGAR BOX MATCHES ,1,1.25,15987.0,United Kingdom,2026-04-16
535250,79144C,PAINTED LIGHTBULB RAINBOW DESIGN,2,0.42,15987.0,United Kingdom,2026-04-16
535250,21892,TRADITIONAL WOODEN CATCH CUP GAME ,2,1.25,15987.0,United Kingdom,2026-04-16
535250,22505,MEMO BOARD COTTAGE DESIGN,1,4.95,15987.0,United Kingdom,2026-04-16
535250,21981,PACK OF 12 WOODLAND TISSUES ,12,0.29,15987.0,United Kingdom,2026-04-16
535250,21892,TRADITIONAL WOODEN CATCH CUP GAME ,3,1.25,15987.0,United Kingdom,2026-04-16
535250,22488,NATURAL SLATE RECTANGLE CHALKBOARD,1,1.65,15987.0,United Kingdom,2026-04-16
535251,22112,CHOCOLATE HOT WATER BOTTLE,18,4.95,16570.0,United Kingdom,2026-04-16
535251,22941,CHRISTMAS LIGHTS 10 REINDEER,8,8.5,16570.0,United Kingdom,2026-04-16
535251,22729,ALARM CLOCK BAKELIKE ORANGE,12,3.75,16570.0,United Kingdom,2026-04-16
535251,22457,NATURAL SLATE HEART CHALKBOARD ,12,2.95,16570.0,United Kingdom,2026-04-16
535251,22383,LUNCH BAG SUKI  DESIGN ,24,1.65,16570.0,United Kingdom,2026-04-16
535251,20724,RED RETROSPOT CHARLOTTE BAG,100,0.72,16570.0,United Kingdom,2026-04-16
535251,22835,HOT WATER BOTTLE I AM SO POORLY,18,4.65,16570.0,United Kingdom,2026-04-16
535251,84978,HANGING HEART JAR T-LIGHT HOLDER,24,1.25,16570.0,United Kingdom,2026-04-16
535251,84879,ASSORTED COLOUR BIRD ORNAMENT,72,1.69,16570.0,United Kingdom,2026-04-16
535251,15056BL,EDWARDIAN PARASOL BLACK,4,5.95,16570.0,United Kingdom,2026-04-16
535251,22726,ALARM CLOCK BAKELIKE GREEN,4,3.75,16570.0,United Kingdom,2026-04-16
535251,22179,SET 10 LIGHTS NIGHT OWL,4,6.75,16570.0,United Kingdom,2026-04-16
535251,20723,STRAWBERRY CHARLOTTE BAG,100,0.72,16570.0,United Kingdom,2026-04-16
535252,21614,SET OF 12 ROSE BOTANICAL T-LIGHTS,48,2.55,17457.0,United Kingdom,2026-04-16
535252,85036A,GARDENIA 1 WICK MORRIS BOXED CANDLE,36,3.81,17457.0,United Kingdom,2026-04-16
535252,21488,RED WHITE SCARF  HOT WATER BOTTLE,144,3.45,17457.0,United Kingdom,2026-04-16
535254,22945,CHRISTMAS METAL TAGS ASSORTED ,12,0.85,14721.0,United Kingdom,2026-04-16
535254,21098,CHRISTMAS TOILET ROLL,1,1.25,14721.0,United Kingdom,2026-04-16
535254,84673A,PINK FLY SWAT,1,0.65,14721.0,United Kingdom,2026-04-16
535254,84946,ANTIQUE SILVER TEA GLASS ETCHED,6,1.25,14721.0,United Kingdom,2026-04-16
535254,22071,SMALL WHITE RETROSPOT MUG IN BOX ,1,3.75,14721.0,United Kingdom,2026-04-16
535254,22945,CHRISTMAS METAL TAGS ASSORTED ,6,0.85,14721.0,United Kingdom,2026-04-16
535254,82616B,FRAPPUCINO SCARF KNITTING KIT,1,2.95,14721.0,United Kingdom,2026-04-16
535254,22632,HAND WARMER RED RETROSPOT,1,2.1,14721.0,United Kingdom,2026-04-16
535254,21114,LAVENDER SCENTED FABRIC HEART,5,1.25,14721.0,United Kingdom,2026-04-16
535254,22627,MINT KITCHEN SCALES,1,8.5,14721.0,United Kingdom,2026-04-16
535253,22813,PACK 3 BOXES BIRD PANNETONE ,1,1.95,16874.0,United Kingdom,2026-04-16
535253,21703,BAG 125g SWIRLY MARBLES,2,0.42,16874.0,United Kingdom,2026-04-16
535254,22312,OFFICE MUG WARMER POLKADOT,1,2.95,14721.0,United Kingdom,2026-04-16
535254,21363,HOME SMALL WOOD LETTERS,1,4.95,14721.0,United Kingdom,2026-04-16
535254,21531,RED RETROSPOT SUGAR JAM BOWL,1,2.55,14721.0,United Kingdom,2026-04-16
535254,22862,LOVE HEART NAPKIN BOX ,2,4.25,14721.0,United Kingdom,2026-04-16
535254,22072,RED RETROSPOT TEA CUP AND SAUCER ,2,3.75,14721.0,United Kingdom,2026-04-16
535254,21744,SNOWFLAKE PORTABLE TABLE LIGHT ,1,2.95,14721.0,United Kingdom,2026-04-16
535254,21537,RED RETROSPOT PUDDING BOWL,2,4.25,14721.0,United Kingdom,2026-04-16
535254,22739,RIBBON REEL CHRISTMAS SOCK BAUBLE,5,1.65,14721.0,United Kingdom,2026-04-16
535254,22561,WOODEN SCHOOL COLOURING SET,1,1.65,14721.0,United Kingdom,2026-04-16
535254,22070,SMALL RED RETROSPOT MUG IN BOX ,1,3.75,14721.0,United Kingdom,2026-04-16
535254,22956,36 FOIL HEART CAKE CASES,1,2.1,14721.0,United Kingdom,2026-04-16
535254,84347,ROTATING SILVER ANGELS T-LIGHT HLDR,1,2.55,14721.0,United Kingdom,2026-04-16
535254,21914,BLUE HARMONICA IN BOX ,1,1.25,14721.0,United Kingdom,2026-04-16
535254,21916,SET 12 RETRO WHITE CHALK STICKS,1,0.42,14721.0,United Kingdom,2026-04-16
535254,21744,SNOWFLAKE PORTABLE TABLE LIGHT ,1,2.95,14721.0,United Kingdom,2026-04-16
535253,21704,BAG 250g SWIRLY MARBLES,1,0.85,16874.0,United Kingdom,2026-04-16
535254,22071,SMALL WHITE RETROSPOT MUG IN BOX ,1,3.75,14721.0,United Kingdom,2026-04-16
535253,22727,ALARM CLOCK BAKELIKE RED ,2,3.75,16874.0,United Kingdom,2026-04-16
535253,22173,METAL 4 HOOK HANGER FRENCH CHATEAU,1,2.95,16874.0,United Kingdom,2026-04-16
535253,21705,BAG 500g SWIRLY MARBLES,2,1.65,16874.0,United Kingdom,2026-04-16
535254,22910,PAPER CHAIN KIT VINTAGE CHRISTMAS,1,2.95,14721.0,United Kingdom,2026-04-16
535253,22641,SET OF 4 NAPKIN CHARMS INSTRUMENT,2,2.55,16874.0,United Kingdom,2026-04-16
535253,21744,SNOWFLAKE PORTABLE TABLE LIGHT ,12,2.95,16874.0,United Kingdom,2026-04-16
535253,21011,GLITTER SNOW PEAR TREE DECORATION,4,1.45,16874.0,United Kingdom,2026-04-16
535253,84947,ANTIQUE SILVER TEA GLASS ENGRAVED,1,1.25,16874.0,United Kingdom,2026-04-16
535253,21324,HANGING MEDINA LANTERN SMALL,1,2.95,16874.0,United Kingdom,2026-04-16
535253,22777,GLASS CLOCHE LARGE,1,8.5,16874.0,United Kingdom,2026-04-16
535253,21319,GLASS CHALICE GREEN  SMALL ,6,1.65,16874.0,United Kingdom,2026-04-16
535253,22801,ANTIQUE GLASS PEDESTAL BOWL,2,3.75,16874.0,United Kingdom,2026-04-16
535253,22800,ANTIQUE TALL SWIRLGLASS TRINKET POT,4,3.75,16874.0,United Kingdom,2026-04-16
535253,21324,HANGING MEDINA LANTERN SMALL,1,2.95,16874.0,United Kingdom,2026-04-16
535253,22778,GLASS CLOCHE SMALL,1,3.95,16874.0,United Kingdom,2026-04-16
535253,22697,GREEN REGENCY TEACUP AND SAUCER,3,2.95,16874.0,United Kingdom,2026-04-16
535253,84763,ZINC FINISH 15CM PLANTER POTS,3,1.25,16874.0,United Kingdom,2026-04-16
535253,85014A,BLACK/BLUE POLKADOT UMBRELLA,1,5.95,16874.0,United Kingdom,2026-04-16
535253,85008,SET OF 3 CONEY ISLAND OVAL BOXES,2,4.95,16874.0,United Kingdom,2026-04-16
535253,22726,ALARM CLOCK BAKELIKE GREEN,1,3.75,16874.0,United Kingdom,2026-04-16
535253,85178,VICTORIAN SEWING KIT,6,1.25,16874.0,United Kingdom,2026-04-16
535253,85176,SEWING SUSAN 21 NEEDLE SET,7,0.85,16874.0,United Kingdom,2026-04-16
535253,22813,PACK 3 BOXES BIRD PANNETONE ,1,1.95,16874.0,United Kingdom,2026-04-16
535253,72807B,SET/3 OCEAN SCENT CANDLE JEWEL BOX,1,4.25,16874.0,United Kingdom,2026-04-16
535253,22182,CAKE STAND VICTORIAN FILIGREE SMALL,2,4.95,16874.0,United Kingdom,2026-04-16
535253,22699,ROSES REGENCY TEACUP AND SAUCER ,4,2.95,16874.0,United Kingdom,2026-04-16
535253,22487,WHITE WOOD GARDEN PLANT LADDER,1,9.95,16874.0,United Kingdom,2026-04-16
535253,22362,GLASS JAR PEACOCK BATH SALTS,1,2.95,16874.0,United Kingdom,2026-04-16
535253,22364,GLASS JAR DIGESTIVE BISCUITS,1,2.95,16874.0,United Kingdom,2026-04-16
535253,22361,GLASS JAR DAISY FRESH COTTON WOOL,1,2.95,16874.0,United Kingdom,2026-04-16
535253,22362,GLASS JAR PEACOCK BATH SALTS,1,2.95,16874.0,United Kingdom,2026-04-16
535253,21794,CLASSIC FRENCH STYLE BASKET NATURAL,1,6.75,16874.0,United Kingdom,2026-04-16
535255,22086,PAPER CHAIN KIT 50'S CHRISTMAS ,6,2.95,17720.0,United Kingdom,2026-04-16
535255,22599,CHRISTMAS MUSICAL ZINC STAR,12,0.85,17720.0,United Kingdom,2026-04-16
535255,22969,HOMEMADE JAM SCENTED CANDLES,12,1.45,17720.0,United Kingdom,2026-04-16
535255,84879,ASSORTED COLOUR BIRD ORNAMENT,16,1.69,17720.0,United Kingdom,2026-04-16
535255,22488,NATURAL SLATE RECTANGLE CHALKBOARD,12,1.65,17720.0,United Kingdom,2026-04-16
535255,22602,CHRISTMAS RETROSPOT HEART WOOD,12,0.85,17720.0,United Kingdom,2026-04-16
535255,21056,DOCTOR'S BAG SOFT TOY,1,8.95,17720.0,United Kingdom,2026-04-16
535255,22077,6 RIBBONS RUSTIC CHARM,24,1.65,17720.0,United Kingdom,2026-04-16
535255,22797,CHEST OF DRAWERS GINGHAM HEART ,1,16.95,17720.0,United Kingdom,2026-04-16
535255,22577,WOODEN HEART CHRISTMAS SCANDINAVIAN,12,0.85,17720.0,United Kingdom,2026-04-16
535257,82494L,WOODEN FRAME ANTIQUE WHITE ,6,2.95,15044.0,United Kingdom,2026-04-16
535257,21755,LOVE BUILDING BLOCK WORD,2,5.95,15044.0,United Kingdom,2026-04-16
535257,21754,HOME BUILDING BLOCK WORD,6,5.95,15044.0,United Kingdom,2026-04-16
535257,22801,ANTIQUE GLASS PEDESTAL BOWL,7,3.75,15044.0,United Kingdom,2026-04-16
535257,82482,WOODEN PICTURE FRAME WHITE FINISH,6,2.55,15044.0,United Kingdom,2026-04-16
535257,82483,WOOD 2 DRAWER CABINET WHITE FINISH,4,5.95,15044.0,United Kingdom,2026-04-16
535257,85066,CREAM SWEETHEART MINI CHEST,2,12.75,15044.0,United Kingdom,2026-04-16
535257,72349B,SET/6 PURPLE BUTTERFLY T-LIGHTS,8,2.1,15044.0,United Kingdom,2026-04-16
535257,22969,HOMEMADE JAM SCENTED CANDLES,12,1.45,15044.0,United Kingdom,2026-04-16
C535256,21314,SMALL GLASS HEART TRINKET POT,-1,2.1,14415.0,United Kingdom,2026-04-16
C535256,22073,RED RETROSPOT STORAGE JAR,-1,3.75,14415.0,United Kingdom,2026-04-16
C535256,21259,VICTORIAN SEWING BOX SMALL ,-1,5.95,14415.0,United Kingdom,2026-04-16
C535256,21844,RED RETROSPOT MUG,-1,2.95,14415.0,United Kingdom,2026-04-16
C535256,84789,ENCHANTED BIRD PLANT CAGE,-1,3.75,14415.0,United Kingdom,2026-04-16
C535256,82582,AREA PATROLLED METAL SIGN,-1,2.1,14415.0,United Kingdom,2026-04-16
535257,22800,ANTIQUE TALL SWIRLGLASS TRINKET POT,8,3.75,15044.0,United Kingdom,2026-04-16
535257,22798,ANTIQUE GLASS DRESSING TABLE POT,8,2.95,15044.0,United Kingdom,2026-04-16
535257,21166,COOK WITH WINE METAL SIGN ,12,1.95,15044.0,United Kingdom,2026-04-16
535257,21181,PLEASE ONE PERSON METAL SIGN,12,2.1,15044.0,United Kingdom,2026-04-16
535257,82484,WOOD BLACK BOARD ANT WHITE FINISH,4,6.45,15044.0,United Kingdom,2026-04-16
535257,21349,IVY HEART WREATH,2,6.75,15044.0,United Kingdom,2026-04-16
535257,84406B,CREAM CUPID HEARTS COAT HANGER,8,3.25,15044.0,United Kingdom,2026-04-16
535257,22158,3 HEARTS HANGING DECORATION RUSTIC,16,2.95,15044.0,United Kingdom,2026-04-16
535257,85123A,WHITE HANGING HEART T-LIGHT HOLDER,8,2.95,15044.0,United Kingdom,2026-04-16
535257,22086,PAPER CHAIN KIT 50'S CHRISTMAS ,21,2.95,15044.0,United Kingdom,2026-04-16
535257,22866,HAND WARMER SCOTTY DOG DESIGN,8,2.1,15044.0,United Kingdom,2026-04-16
535257,22633,HAND WARMER UNION JACK,12,2.1,15044.0,United Kingdom,2026-04-16
535257,84029G,KNITTED UNION FLAG HOT WATER BOTTLE,4,3.75,15044.0,United Kingdom,2026-04-16
535257,22943,CHRISTMAS LIGHTS 10 VINTAGE BAUBLES,6,4.95,15044.0,United Kingdom,2026-04-16
535257,22835,HOT WATER BOTTLE I AM SO POORLY,2,4.65,15044.0,United Kingdom,2026-04-16
535257,22112,CHOCOLATE HOT WATER BOTTLE,3,4.95,15044.0,United Kingdom,2026-04-16
535257,22121,NOEL WOODEN BLOCK LETTERS ,3,5.95,15044.0,United Kingdom,2026-04-16
535257,21916,SET 12 RETRO WHITE CHALK STICKS,6,0.42,15044.0,United Kingdom,2026-04-16
535257,20711,JUMBO BAG TOYS ,8,1.95,15044.0,United Kingdom,2026-04-16
535257,82486,WOOD S/3 CABINET ANT WHITE FINISH,6,7.95,15044.0,United Kingdom,2026-04-16
535257,22114,HOT WATER BOTTLE TEA AND SYMPATHY,4,3.95,15044.0,United Kingdom,2026-04-16
535258,22379,RECYCLING BAG RETROSPOT ,5,2.1,16612.0,United Kingdom,2026-04-16
535258,22470,HEART OF WICKER LARGE,6,2.95,16612.0,United Kingdom,2026-04-16
535258,82484,WOOD BLACK BOARD ANT WHITE FINISH,6,6.45,16612.0,United Kingdom,2026-04-16
535258,82494L,WOODEN FRAME ANTIQUE WHITE ,12,2.95,16612.0,United Kingdom,2026-04-16
535258,22469,HEART OF WICKER SMALL,12,1.65,16612.0,United Kingdom,2026-04-16
535258,22670,FRENCH WC SIGN BLUE METAL,12,1.25,16612.0,United Kingdom,2026-04-16
535258,22781,GUMBALL MAGAZINE RACK,2,7.65,16612.0,United Kingdom,2026-04-16
535258,85099B,JUMBO BAG RED RETROSPOT,10,1.95,16612.0,United Kingdom,2026-04-16
535258,22754,SMALL RED BABUSHKA NOTEBOOK ,12,0.85,16612.0,United Kingdom,2026-04-16
535258,22757,LARGE RED BABUSHKA NOTEBOOK ,12,1.25,16612.0,United Kingdom,2026-04-16
535258,22467,GUMBALL COAT RACK,6,2.55,16612.0,United Kingdom,2026-04-16
535258,22468,BABUSHKA LIGHTS STRING OF 10,2,6.75,16612.0,United Kingdom,2026-04-16
535258,22179,SET 10 LIGHTS NIGHT OWL,2,6.75,16612.0,United Kingdom,2026-04-16
535258,22380,TOY TIDY SPACEBOY  ,5,2.1,16612.0,United Kingdom,2026-04-16
535258,21931,JUMBO STORAGE BAG SUKI,10,1.95,16612.0,United Kingdom,2026-04-16
535258,22837,HOT WATER BOTTLE BABUSHKA ,8,4.65,16612.0,United Kingdom,2026-04-16
535259,21620,SET OF 4 ROSE BOTANICAL CANDLES,2,3.75,17068.0,United Kingdom,2026-04-16
535259,22666,RECIPE BOX PANTRY YELLOW DESIGN,2,2.95,17068.0,United Kingdom,2026-04-16
535259,22665,RECIPE BOX BLUE SKETCHBOOK DESIGN,2,2.95,17068.0,United Kingdom,2026-04-16
535259,21328,BALLOONS  WRITING SET ,2,1.65,17068.0,United Kingdom,2026-04-16
535259,22141,CHRISTMAS CRAFT TREE TOP ANGEL,2,2.1,17068.0,United Kingdom,2026-04-16
535259,72801D,4 SKY BLUE DINNER CANDLES,1,1.25,17068.0,United Kingdom,2026-04-16
535259,21609,SET 12 LAVENDER  BOTANICAL T-LIGHTS,4,2.95,17068.0,United Kingdom,2026-04-16
535259,21329,DINOSAURS  WRITING SET ,2,1.65,17068.0,United Kingdom,2026-04-16
535259,22630,DOLLY GIRL LUNCH BOX,5,1.95,17068.0,United Kingdom,2026-04-16
535259,21614,SET OF 12 ROSE BOTANICAL T-LIGHTS,3,2.95,17068.0,United Kingdom,2026-04-16
535259,21620,SET OF 4 ROSE BOTANICAL CANDLES,1,3.75,17068.0,United Kingdom,2026-04-16
535259,22446,PIN CUSHION BABUSHKA PINK,1,3.35,17068.0,United Kingdom,2026-04-16
535259,85053,FRENCH ENAMEL CANDLEHOLDER,2,2.1,17068.0,United Kingdom,2026-04-16
535259,17091A,LAVENDER INCENSE IN TIN,1,1.25,17068.0,United Kingdom,2026-04-16
535259,17107D,"FLOWER FAIRY,5 SUMMER B'DRAW LINERS",2,2.55,17068.0,United Kingdom,2026-04-16
535259,21931,JUMBO STORAGE BAG SUKI,2,1.95,17068.0,United Kingdom,2026-04-16
535259,22385,JUMBO BAG SPACEBOY DESIGN,4,1.95,17068.0,United Kingdom,2026-04-16
535259,22386,JUMBO BAG PINK POLKADOT,2,1.95,17068.0,United Kingdom,2026-04-16
535259,21930,JUMBO STORAGE BAG SKULLS,3,1.95,17068.0,United Kingdom,2026-04-16
535259,22663,JUMBO BAG DOLLY GIRL DESIGN,4,1.95,17068.0,United Kingdom,2026-04-16
535259,21327,SKULLS WRITING SET ,2,1.65,17068.0,United Kingdom,2026-04-16
535259,21115,ROSE CARAVAN DOORSTOP,1,6.75,17068.0,United Kingdom,2026-04-16
535259,22086,PAPER CHAIN KIT 50'S CHRISTMAS ,2,2.95,17068.0,United Kingdom,2026-04-16
535259,72801D,4 SKY BLUE DINNER CANDLES,1,1.25,17068.0,United Kingdom,2026-04-16
535259,22367,CHILDRENS APRON SPACEBOY DESIGN,4,1.95,17068.0,United Kingdom,2026-04-16
535259,47591D,PINK FAIRY CAKE CHILDRENS APRON,2,1.95,17068.0,United Kingdom,2026-04-16
535259,20914,SET/5 RED RETROSPOT LID GLASS BOWLS,2,2.95,17068.0,United Kingdom,2026-04-16
535259,22470,HEART OF WICKER LARGE,3,2.95,17068.0,United Kingdom,2026-04-16
535259,22694,WICKER STAR ,2,2.1,17068.0,United Kingdom,2026-04-16
535259,22505,MEMO BOARD COTTAGE DESIGN,3,4.95,17068.0,United Kingdom,2026-04-16
535259,85099C,JUMBO  BAG BAROQUE BLACK WHITE,3,1.95,17068.0,United Kingdom,2026-04-16
535259,22662,LUNCH BAG DOLLY GIRL DESIGN,3,1.65,17068.0,United Kingdom,2026-04-16
535259,20725,LUNCH BAG RED RETROSPOT,3,1.65,17068.0,United Kingdom,2026-04-16
535259,22384,LUNCH BAG PINK POLKADOT,3,1.65,17068.0,United Kingdom,2026-04-16
535259,22383,LUNCH BAG SUKI  DESIGN ,3,1.65,17068.0,United Kingdom,2026-04-16
535259,22837,HOT WATER BOTTLE BABUSHKA ,2,4.65,17068.0,United Kingdom,2026-04-16
535259,20713,JUMBO BAG OWLS,5,1.95,17068.0,United Kingdom,2026-04-16
535259,20718,RED RETROSPOT SHOPPER BAG,6,1.25,17068.0,United Kingdom,2026-04-16
535259,21481,FAWN BLUE HOT WATER BOTTLE,2,2.95,17068.0,United Kingdom,2026-04-16
535259,22629,SPACEBOY LUNCH BOX ,5,1.95,17068.0,United Kingdom,2026-04-16
535259,85053,FRENCH ENAMEL CANDLEHOLDER,4,2.1,17068.0,United Kingdom,2026-04-16
535259,84536A,ENGLISH ROSE NOTEBOOK A7 SIZE,7,0.42,17068.0,United Kingdom,2026-04-16
535259,84536B,FAIRY CAKES NOTEBOOK A7 SIZE,9,0.42,17068.0,United Kingdom,2026-04-16
535259,22381,TOY TIDY PINK POLKADOT,3,2.1,17068.0,United Kingdom,2026-04-16
535259,20717,STRAWBERRY SHOPPER BAG,4,1.25,17068.0,United Kingdom,2026-04-16
535259,17107D,"FLOWER FAIRY,5 SUMMER B'DRAW LINERS",3,2.55,17068.0,United Kingdom,2026-04-16
535259,20716,PARTY FOOD SHOPPER BAG,6,1.25,17068.0,United Kingdom,2026-04-16
535259,22380,TOY TIDY SPACEBOY  ,5,2.1,17068.0,United Kingdom,2026-04-16
535260,22865,HAND WARMER OWL DESIGN,1,2.1,15021.0,United Kingdom,2026-04-16
535260,22350,ILLUSTRATED CAT BOWL ,2,2.55,15021.0,United Kingdom,2026-04-16
535260,22866,HAND WARMER SCOTTY DOG DESIGN,1,2.1,15021.0,United Kingdom,2026-04-16
535260,22867,HAND WARMER BIRD DESIGN,1,2.1,15021.0,United Kingdom,2026-04-16
535260,85123A,WHITE HANGING HEART T-LIGHT HOLDER,3,2.95,15021.0,United Kingdom,2026-04-16
535260,72807C,SET/3 VANILLA SCENTED CANDLE IN BOX,1,4.25,15021.0,United Kingdom,2026-04-16
535260,21481,FAWN BLUE HOT WATER BOTTLE,1,2.95,15021.0,United Kingdom,2026-04-16
535260,22866,HAND WARMER SCOTTY DOG DESIGN,1,2.1,15021.0,United Kingdom,2026-04-16
535260,22633,HAND WARMER UNION JACK,2,2.1,15021.0,United Kingdom,2026-04-16
535260,22113,GREY HEART HOT WATER BOTTLE,1,3.75,15021.0,United Kingdom,2026-04-16
535260,21733,RED HANGING HEART T-LIGHT HOLDER,1,2.95,15021.0,United Kingdom,2026-04-16
