Invoice,StockCode,Description,Quantity,Price,Customer ID,Country,InvoiceDate
516990,84796b,BLUE SAVANNAH PICNIC HAMPER FOR 2,1,8.47,,United Kingdom,2026-01-02
516990,48185,DOORMAT FAIRY CAKE,1,14.43,,United Kingdom,2026-01-02
516990,82599,FANNY'S REST STOPMETAL SIGN,1,4.21,,United Kingdom,2026-01-02
516990,84795b,SUNSET CHECK HAMMOCK,1,16.98,,United Kingdom,2026-01-02
516990,22055,MINI CAKE STAND  HANGING STRAWBERY,1,3.36,,United Kingdom,2026-01-02
516990,22607,WOODEN ROUNDERS GARDEN SET ,1,16.98,,United Kingdom,2026-01-02
516990,21985,PACK OF 12 HEARTS DESIGN TISSUES ,1,0.81,,United Kingdom,2026-01-02
516990,85152,HAND OVER THE CHOCOLATE   SIGN ,1,4.21,,United Kingdom,2026-01-02
516990,21929,JUMBO BAG PINK VINTAGE PAISLEY,3,5.06,,United Kingdom,2026-01-02
516990,21937,STRAWBERRY   PICNIC BAG,1,5.91,,United Kingdom,2026-01-02
516990,85099c,JUMBO  BAG BAROQUE BLACK WHITE,1,5.06,,United Kingdom,2026-01-02
516990,85099f,JUMBO BAG STRAWBERRY,1,5.06,,United Kingdom,2026-01-02
516990,DOT,DOTCOM POSTAGE,1,68.55,,United Kingdom,2026-01-02
516990,15056n,EDWARDIAN PARASOL NATURAL,1,12.72,,United Kingdom,2026-01-02
516990,17181,CIRCLE OF FRIENDS CANDLE HOLDER,1,5.06,,United Kingdom,2026-01-02
516990,84970s,HANGING HEART ZINC T-LIGHT HOLDER,18,2.13,,United Kingdom,2026-01-02
516990,20655,QUEEN OF SKIES LUGGAGE TAG,2,2.51,,United Kingdom,2026-01-02
516990,20658,RED SPOTTY LUGGAGE TAG,4,2.51,,United Kingdom,2026-01-02
516990,21558,SKULL LUNCH BOX WITH CUTLERY ,1,5.06,,United Kingdom,2026-01-02
516990,21713,CITRONELLA CANDLE FLOWERPOT,2,4.21,,United Kingdom,2026-01-02
516990,21714,CITRONELLA CANDLE GARDEN POT,3,2.51,,United Kingdom,2026-01-02
516990,21790,VINTAGE SNAP CARDS,4,1.66,,United Kingdom,2026-01-02
516990,18098c,PORCELAIN BUTTERFLY OIL BURNER,1,5.06,,United Kingdom,2026-01-02
516991,21033,JUMBO BAG CHARLIE AND LOLA TOYS,2,5.49,,United Kingdom,2026-01-02
516991,21257,VICTORIAN SEWING BOX MEDIUM,1,16.13,,United Kingdom,2026-01-02
516991,21258,VICTORIAN SEWING BOX LARGE,1,25.49,,United Kingdom,2026-01-02
516991,21928,JUMBO BAG SCANDINAVIAN PAISLEY,2,4.21,,United Kingdom,2026-01-02
516991,21929,JUMBO BAG PINK VINTAGE PAISLEY,2,5.06,,United Kingdom,2026-01-02
516991,22282,12 EGG HOUSE PAINTED WOOD,1,25.49,,United Kingdom,2026-01-02
516991,22072,RED RETROSPOT TEA CUP AND SAUCER ,2,7.62,,United Kingdom,2026-01-02
516991,22073,RED RETROSPOT STORAGE JAR,1,7.62,,United Kingdom,2026-01-02
516991,22360,GLASS JAR ENGLISH CONFECTIONERY,1,5.91,,United Kingdom,2026-01-02
516991,22502,PICNIC BASKET WICKER SMALL,1,8.47,,United Kingdom,2026-01-02
516991,20983,12 PENCILS TALL TUBE RED SPOTTY,1,1.66,,United Kingdom,2026-01-02
516991,22041,"RECORD FRAME 7"" SINGLE SIZE ",6,5.06,,United Kingdom,2026-01-02
516991,20960,WATERMELON BATH SPONGE,1,2.51,,United Kingdom,2026-01-02
516991,22202,MILK PAN PINK RETROSPOT,1,7.62,,United Kingdom,2026-01-02
516991,DOT,DOTCOM POSTAGE,1,58.55,,United Kingdom,2026-01-02
516991,85232b,SET/3 RUSSIAN DOLL STACKING TINS,1,10.17,,United Kingdom,2026-01-02
516991,85099c,JUMBO  BAG BAROQUE BLACK WHITE,1,5.06,,United Kingdom,2026-01-02
516991,84796a,PINK HAWAIIAN PICNIC HAMPER FOR 2,1,8.47,,United Kingdom,2026-01-02
516991,84536a,ENGLISH ROSE NOTEBOOK A7 SIZE,1,0.81,,United Kingdom,2026-01-02
516991,72351a,SET/6 TURQUOISE BUTTERFLY T-LIGHTS,1,4.21,,United Kingdom,2026-01-02
516991,71053,WHITE METAL LANTERN,1,8.47,,United Kingdom,2026-01-02
516991,48129,DOORMAT TOPIARY,1,14.43,,United Kingdom,2026-01-02
516991,22649,STRAWBERRY FAIRY CAKE TEAPOT,1,11.02,,United Kingdom,2026-01-02
516991,22612,TEA COSY VINTAGE UNION JACK,1,7.62,,United Kingdom,2026-01-02
516991,22607,WOODEN ROUNDERS GARDEN SET ,1,16.98,,United Kingdom,2026-01-02
516991,22507,MEMO BOARD RETROSPOT  DESIGN,2,11.02,,United Kingdom,2026-01-02
516991,15056n,EDWARDIAN PARASOL NATURAL,1,12.72,,United Kingdom,2026-01-02
516993,20685,DOORMAT RED SPOT,1,7.49,15493.0,United Kingdom,2026-01-02
516993,22511,DOORSTOP RUSSIAN DOLL RETROSPOT,1,3.75,15493.0,United Kingdom,2026-01-02
516993,21524,DOORMAT SPOTTY HOME SWEET HOME,1,7.49,15493.0,United Kingdom,2026-01-02
516993,48111,DOORMAT 3 SMILEY CATS,1,7.49,15493.0,United Kingdom,2026-01-02
516993,48138,DOORMAT UNION FLAG,1,7.49,15493.0,United Kingdom,2026-01-02
516993,22365,DOORMAT RESPECTABLE HOUSE,1,7.49,15493.0,United Kingdom,2026-01-02
516993,85124C,GREEN JUICY FRUIT PHOTO FRAME,1,2.55,15493.0,United Kingdom,2026-01-02
516993,48185,DOORMAT FAIRY CAKE,1,7.49,15493.0,United Kingdom,2026-01-02
516993,22660,DOORMAT I LOVE LONDON,1,7.49,15493.0,United Kingdom,2026-01-02
516993,48116,DOORMAT MULTICOLOUR STRIPE,1,7.49,15493.0,United Kingdom,2026-01-02
516993,22660,DOORMAT I LOVE LONDON,1,7.49,15493.0,United Kingdom,2026-01-02
516993,21411,GINGHAM HEART  DOORSTOP RED,1,4.25,15493.0,United Kingdom,2026-01-02
516993,17165B,ASS COL LARGE SAND GECKO P'WEIGHT,3,1.05,15493.0,United Kingdom,2026-01-02
516993,22055,MINI CAKE STAND  HANGING STRAWBERY,2,1.65,15493.0,United Kingdom,2026-01-02
516993,48187,DOORMAT NEW ENGLAND,1,7.49,15493.0,United Kingdom,2026-01-02
516993,21407,BROWN CHECK CAT DOORSTOP ,1,4.25,15493.0,United Kingdom,2026-01-02
516993,22117,METAL SIGN HER DINNER IS SERVED ,1,2.95,15493.0,United Kingdom,2026-01-02
516993,22510,DOORSTOP RUSSIAN DOLL GINGHAM,1,3.75,15493.0,United Kingdom,2026-01-02
516993,22359,GLASS JAR KINGS CHOICE,1,2.95,15493.0,United Kingdom,2026-01-02
516993,82486,WOOD S/3 CABINET ANT WHITE FINISH,1,7.95,15493.0,United Kingdom,2026-01-02
516993,21218,RED SPOTTY BISCUIT TIN,1,3.75,15493.0,United Kingdom,2026-01-02
516993,20750,RED/WHITE DOT MINI CASES,1,7.95,15493.0,United Kingdom,2026-01-02
516993,71038,WHITE HANGING BEADS CANDLE HOLDER,4,5.45,15493.0,United Kingdom,2026-01-02
516993,21622,VINTAGE UNION JACK CUSHION COVER,3,4.95,15493.0,United Kingdom,2026-01-02
516993,72750B,FLOWER FAIRY SET 3 CANDLES LAVENDER,2,5.95,15493.0,United Kingdom,2026-01-02
516993,22115,METAL SIGN EMPIRE TEA,1,2.95,15493.0,United Kingdom,2026-01-02
516993,82567,"AIRLINE LOUNGE,METAL SIGN",1,2.1,15493.0,United Kingdom,2026-01-02
516993,82600,NO SINGING METAL SIGN,1,2.1,15493.0,United Kingdom,2026-01-02
516993,82599,FANNY'S REST STOPMETAL SIGN,1,2.1,15493.0,United Kingdom,2026-01-02
516993,21907,I'M ON HOLIDAY METAL SIGN,1,2.1,15493.0,United Kingdom,2026-01-02
516993,21904,HOUSE WRECKING METAL SIGN ,1,2.1,15493.0,United Kingdom,2026-01-02
516993,21231,SWEETHEART CERAMIC TRINKET BOX,3,1.25,15493.0,United Kingdom,2026-01-02
516993,46000M,POLYESTER FILLER PAD 45x45cm,3,1.55,15493.0,United Kingdom,2026-01-02
516993,22508,DOORSTOP RETROSPOT HEART,1,3.75,15493.0,United Kingdom,2026-01-02
516993,22360,GLASS JAR ENGLISH CONFECTIONERY,2,2.95,15493.0,United Kingdom,2026-01-02
516993,37450,CERAMIC CAKE BOWL + HANGING CAKES,1,2.95,15493.0,United Kingdom,2026-01-02
516993,22362,GLASS JAR PEACOCK BATH SALTS,1,2.95,15493.0,United Kingdom,2026-01-02
516993,17165D,ASS COL LARGE SAND FROG P'WEIGHT,2,1.05,15493.0,United Kingdom,2026-01-02
516993,37450,CERAMIC CAKE BOWL + HANGING CAKES,2,2.95,15493.0,United Kingdom,2026-01-02
516993,22055,MINI CAKE STAND  HANGING STRAWBERY,2,1.65,15493.0,United Kingdom,2026-01-02
516993,22649,STRAWBERRY FAIRY CAKE TEAPOT,1,4.95,15493.0,United Kingdom,2026-01-02
516993,22423,REGENCY CAKESTAND 3 TIER,4,12.75,15493.0,United Kingdom,2026-01-02
516993,37449,CERAMIC CAKE STAND + HANGING CAKES,1,9.95,15493.0,United Kingdom,2026-01-02
516993,22059,CERAMIC STRWBERRY DESIGN MUG,1,1.49,15493.0,United Kingdom,2026-01-02
516993,22461,SAVOY ART DECO CLOCK,2,12.75,15493.0,United Kingdom,2026-01-02
516993,37448,CERAMIC CAKE DESIGN SPOTTED MUG,3,1.49,15493.0,United Kingdom,2026-01-02
516993,22066,LOVE HEART TRINKET POT,4,1.45,15493.0,United Kingdom,2026-01-02
516993,21218,RED SPOTTY BISCUIT TIN,1,3.75,15493.0,United Kingdom,2026-01-02
516993,71279,PINK GLASS CANDLEHOLDER,1,2.95,15493.0,United Kingdom,2026-01-02
516993,22646,CERAMIC STRAWBERRY CAKE MONEY BANK,2,1.45,15493.0,United Kingdom,2026-01-02
516993,22644,CERAMIC CHERRY CAKE MONEY BANK,2,1.45,15493.0,United Kingdom,2026-01-02
516993,84818,DANISH ROSE PHOTO FRAME,1,2.55,15493.0,United Kingdom,2026-01-02
516993,22361,GLASS JAR DAISY FRESH COTTON WOOL,1,2.95,15493.0,United Kingdom,2026-01-02
516993,22236,CAKE STAND 3 TIER MAGIC GARDEN,1,12.75,15493.0,United Kingdom,2026-01-02
516993,20830,SILVER PHOTO FRAME,2,2.1,15493.0,United Kingdom,2026-01-02
516993,22363,GLASS JAR MARMALADE ,1,2.95,15493.0,United Kingdom,2026-01-02
516993,22364,GLASS JAR DIGESTIVE BISCUITS,1,2.95,15493.0,United Kingdom,2026-01-02
516993,22649,STRAWBERRY FAIRY CAKE TEAPOT,1,4.95,15493.0,United Kingdom,2026-01-02
516993,22059,CERAMIC STRWBERRY DESIGN MUG,1,1.49,15493.0,United Kingdom,2026-01-02
516993,72802A,ROSE SCENT CANDLE IN JEWELLED BOX,1,4.25,15493.0,United Kingdom,2026-01-02
516993,37503,TEA TIME CAKE STAND IN GIFT BOX,1,10.75,15493.0,United Kingdom,2026-01-02
516993,85124B,BLUE JUICY FRUIT PHOTO FRAME,1,2.55,15493.0,United Kingdom,2026-01-02
516993,22061,LARGE CAKE STAND  HANGING STRAWBERY,1,9.95,15493.0,United Kingdom,2026-01-02
516993,72802A,ROSE SCENT CANDLE IN JEWELLED BOX,1,4.25,15493.0,United Kingdom,2026-01-02
516993,22222,CAKE PLATE LOVEBIRD WHITE,1,4.95,15493.0,United Kingdom,2026-01-02
516993,21527,RED RETROSPOT TRADITIONAL TEAPOT ,1,7.95,15493.0,United Kingdom,2026-01-02
516993,21232,STRAWBERRY CERAMIC TRINKET BOX,2,1.25,15493.0,United Kingdom,2026-01-02
516993,85124A,PINK JUICY FRUIT PHOTO FRAME,2,2.55,15493.0,United Kingdom,2026-01-02
516993,20820,SILVER LOOKING MIRROR,1,4.95,15493.0,United Kingdom,2026-01-02
516993,21535,RED RETROSPOT SMALL MILK JUG,2,2.55,15493.0,United Kingdom,2026-01-02
517001,21124,SET/10 BLUE SPOTTY PARTY CANDLES,288,1.06,16422.0,United Kingdom,2026-01-02
517001,21172,PARTY METAL SIGN ,60,1.45,16422.0,United Kingdom,2026-01-02
517001,84992,72 SWEETHEART FAIRY CAKE CASES,120,0.42,16422.0,United Kingdom,2026-01-02
517001,22090,PAPER BUNTING RETRO SPOTS,200,2.55,16422.0,United Kingdom,2026-01-02
517001,21213,PACK OF 72 SKULL CAKE CASES,120,0.42,16422.0,United Kingdom,2026-01-02
517009,M,Manual,1,626.35,,EIRE,2026-01-02
C517013,M,Manual,-1,626.35,,EIRE,2026-01-02
517017,21544,SKULLS  WATER TRANSFER TATTOOS ,12,0.85,13004.0,United Kingdom,2026-01-02
517017,22055,MINI CAKE STAND  HANGING STRAWBERY,8,1.65,13004.0,United Kingdom,2026-01-02
517017,37450,CERAMIC CAKE BOWL + HANGING CAKES,6,2.95,13004.0,United Kingdom,2026-01-02
517017,22621,TRADITIONAL KNITTING NANCY,12,1.45,13004.0,United Kingdom,2026-01-02
517017,20971,PINK BLUE FELT CRAFT TRINKET BOX,12,1.25,13004.0,United Kingdom,2026-01-02
517017,22355,CHARLOTTE BAG SUKI DESIGN,10,0.85,13004.0,United Kingdom,2026-01-02
517017,47591D,PINK FAIRY CAKE CHILDRENS APRON,8,1.95,13004.0,United Kingdom,2026-01-02
517017,48188,DOORMAT WELCOME PUPPIES,2,7.49,13004.0,United Kingdom,2026-01-02
517017,48138,DOORMAT UNION FLAG,2,7.49,13004.0,United Kingdom,2026-01-02
517017,21389,IVORY HANGING DECORATION  BIRD,12,0.85,13004.0,United Kingdom,2026-01-02
517017,21385,IVORY HANGING DECORATION  HEART,24,0.85,13004.0,United Kingdom,2026-01-02
517017,84580,MOUSE TOY WITH PINK T-SHIRT,4,3.75,13004.0,United Kingdom,2026-01-02
517017,21524,DOORMAT SPOTTY HOME SWEET HOME,2,7.49,13004.0,United Kingdom,2026-01-02
517017,21868,POTTING SHED TEA MUG,12,1.25,13004.0,United Kingdom,2026-01-02
517017,22548,HEADS AND TAILS SPORTING FUN,12,1.25,13004.0,United Kingdom,2026-01-02
517017,84978,HANGING HEART JAR T-LIGHT HOLDER,12,1.25,13004.0,United Kingdom,2026-01-02
517017,21509,COWBOYS AND INDIANS BIRTHDAY CARD ,12,0.42,13004.0,United Kingdom,2026-01-02
517017,22027,TEA PARTY BIRTHDAY CARD,12,0.42,13004.0,United Kingdom,2026-01-02
517017,22030,SWALLOWS GREETING CARD,12,0.42,13004.0,United Kingdom,2026-01-02
517017,22549,PICTURE DOMINOES,12,1.45,13004.0,United Kingdom,2026-01-02
517017,84251F,"GREETING CARD, RITA",12,0.19,13004.0,United Kingdom,2026-01-02
517017,82482,WOODEN PICTURE FRAME WHITE FINISH,6,2.55,13004.0,United Kingdom,2026-01-02
517017,82494L,WOODEN FRAME ANTIQUE WHITE ,6,2.95,13004.0,United Kingdom,2026-01-02
517017,21870,I CAN ONLY PLEASE ONE PERSON MUG,12,1.25,13004.0,United Kingdom,2026-01-02
517017,22715,CARD WEDDING DAY,12,0.42,13004.0,United Kingdom,2026-01-02
517033,22411,JUMBO SHOPPER VINTAGE RED PAISLEY,3,1.95,15550.0,United Kingdom,2026-01-02
517033,22662,LUNCH BAG DOLLY GIRL DESIGN,4,1.65,15550.0,United Kingdom,2026-01-02
517033,79000,MOROCCAN TEA GLASS,12,0.85,15550.0,United Kingdom,2026-01-02
517033,48173C,DOORMAT BLACK FLOCK ,1,7.49,15550.0,United Kingdom,2026-01-02
517033,84692,BOX OF 24 COCKTAIL PARASOLS,1,0.42,15550.0,United Kingdom,2026-01-02
517033,15039,SANDALWOOD FAN,12,0.85,15550.0,United Kingdom,2026-01-02
517033,85062,PEARL CRYSTAL PUMPKIN T-LIGHT HLDR,6,1.65,15550.0,United Kingdom,2026-01-02
517033,84755,COLOUR GLASS T-LIGHT HOLDER HANGING,8,0.65,15550.0,United Kingdom,2026-01-02
517033,84755,COLOUR GLASS T-LIGHT HOLDER HANGING,16,0.65,15550.0,United Kingdom,2026-01-02
517033,21194,PINK  HONEYCOMB PAPER FAN,2,2.1,15550.0,United Kingdom,2026-01-02
517033,71053,WHITE METAL LANTERN,1,3.75,15550.0,United Kingdom,2026-01-02
517033,21203,BUTTERFLIES  HONEYCOMB GARLAND,2,1.65,15550.0,United Kingdom,2026-01-02
517033,20828,GLITTER BUTTERFLY CLIPS,4,2.55,15550.0,United Kingdom,2026-01-02
517033,47590B,PINK HAPPY BIRTHDAY BUNTING,1,5.45,15550.0,United Kingdom,2026-01-02
517033,21195,PINK  HONEYCOMB PAPER BALL ,1,2.1,15550.0,United Kingdom,2026-01-02
517033,84879,ASSORTED COLOUR BIRD ORNAMENT,16,1.69,15550.0,United Kingdom,2026-01-02
517033,22382,LUNCH BAG SPACEBOY DESIGN ,10,1.65,15550.0,United Kingdom,2026-01-02
517033,20728,LUNCH BAG CARS BLUE,4,1.65,15550.0,United Kingdom,2026-01-02
517033,22383,LUNCH BAG SUKI  DESIGN ,10,1.65,15550.0,United Kingdom,2026-01-02
517033,21122,SET/10 PINK SPOTTY PARTY CANDLES,2,1.25,15550.0,United Kingdom,2026-01-02
517033,21200,MULTICOLOUR HONEYCOMB PAPER GARLAND,1,1.65,15550.0,United Kingdom,2026-01-02
517037,22628,PICNIC BOXES SET OF 3 RETROSPOT ,2,4.95,16746.0,United Kingdom,2026-01-02
517037,20727,LUNCH BAG  BLACK SKULL.,10,1.65,16746.0,United Kingdom,2026-01-02
517037,22382,LUNCH BAG SPACEBOY DESIGN ,10,1.65,16746.0,United Kingdom,2026-01-02
517037,84360,TABLE LAMP WHITE SHADE WOOD BASE,2,5.95,16746.0,United Kingdom,2026-01-02
517037,22719,GUMBALL MONOCHROME COAT RACK,12,1.25,16746.0,United Kingdom,2026-01-02
517037,22627,MINT KITCHEN SCALES,2,8.5,16746.0,United Kingdom,2026-01-02
517037,21558,SKULL LUNCH BOX WITH CUTLERY ,60,2.1,16746.0,United Kingdom,2026-01-02
517037,21042,RED SPOTTY APRON ,3,5.95,16746.0,United Kingdom,2026-01-02
517037,22624,IVORY KITCHEN SCALES,2,8.5,16746.0,United Kingdom,2026-01-02
517037,22661,CHARLOTTE BAG DOLLY GIRL DESIGN,10,0.85,16746.0,United Kingdom,2026-01-02
517037,22662,LUNCH BAG DOLLY GIRL DESIGN,10,1.65,16746.0,United Kingdom,2026-01-02
517037,22664,TOY TIDY DOLLY GIRL DESIGN,5,2.1,16746.0,United Kingdom,2026-01-02
517037,22621,TRADITIONAL KNITTING NANCY,12,1.45,16746.0,United Kingdom,2026-01-02
517037,22663,JUMBO BAG DOLLY GIRL DESIGN,10,1.95,16746.0,United Kingdom,2026-01-02
517042,84378,SET OF 3 HEART COOKIE CUTTERS,2,1.25,13069.0,United Kingdom,2026-01-02
517042,82600,NO SINGING METAL SIGN,1,2.1,13069.0,United Kingdom,2026-01-02
517042,21905,MORE BUTTER METAL SIGN ,1,2.1,13069.0,United Kingdom,2026-01-02
517042,21843,RED RETROSPOT CAKE STAND,1,10.95,13069.0,United Kingdom,2026-01-02
517042,22427,ENAMEL FLOWER JUG CREAM,1,5.95,13069.0,United Kingdom,2026-01-02
517042,21972,SET OF 36 DINOSAUR PAPER DOILIES,5,1.45,13069.0,United Kingdom,2026-01-02
517042,22416,SET OF 36 DOILIES SPACEBOY DESIGN ,5,1.45,13069.0,United Kingdom,2026-01-02
517042,21330,WOODLAND ANIMAL  WRITING SET ,2,1.65,13069.0,United Kingdom,2026-01-02
517042,84536A,ENGLISH ROSE NOTEBOOK A7 SIZE,5,0.42,13069.0,United Kingdom,2026-01-02
517042,84536B,FAIRY CAKES NOTEBOOK A7 SIZE,5,0.42,13069.0,United Kingdom,2026-01-02
517042,21900,"KEY FOB , SHED",10,0.65,13069.0,United Kingdom,2026-01-02
517042,21901,"KEY FOB , BACK DOOR ",10,0.65,13069.0,United Kingdom,2026-01-02
517042,21899,"KEY FOB , GARAGE DESIGN",10,0.65,13069.0,United Kingdom,2026-01-02
517042,20973,12 PENCIL SMALL TUBE WOODLAND,7,0.65,13069.0,United Kingdom,2026-01-02
517042,22428,ENAMEL FIRE BUCKET CREAM,1,6.95,13069.0,United Kingdom,2026-01-02
517042,20975,12 PENCILS SMALL TUBE RED SPOTTY,7,0.65,13069.0,United Kingdom,2026-01-02
517042,21907,I'M ON HOLIDAY METAL SIGN,1,2.1,13069.0,United Kingdom,2026-01-02
517042,20996,JAZZ HEARTS ADDRESS BOOK,5,0.42,13069.0,United Kingdom,2026-01-02
517042,21902,"KEY FOB , FRONT  DOOR ",10,0.65,13069.0,United Kingdom,2026-01-02
517042,21911,GARDEN METAL SIGN ,3,1.65,13069.0,United Kingdom,2026-01-02
517042,21910,WAY OUT METAL SIGN ,3,1.65,13069.0,United Kingdom,2026-01-02
517042,84380,SET OF 3 BUTTERFLY COOKIE CUTTERS,2,1.25,13069.0,United Kingdom,2026-01-02
517042,22384,LUNCH BAG PINK RETROSPOT,10,1.65,13069.0,United Kingdom,2026-01-02
517042,22382,LUNCH BAG SPACEBOY DESIGN ,10,1.65,13069.0,United Kingdom,2026-01-02
517042,20728,LUNCH BAG CARS BLUE,10,1.65,13069.0,United Kingdom,2026-01-02
517042,20726,LUNCH BAG WOODLAND,10,1.65,13069.0,United Kingdom,2026-01-02
517042,22568,FELTCRAFT CUSHION OWL,1,3.75,13069.0,United Kingdom,2026-01-02
517042,22380,TOY TIDY SPACEBOY  ,3,2.1,13069.0,United Kingdom,2026-01-02
517042,22381,TOY TIDY PINK RETROSPOT  ,3,2.1,13069.0,United Kingdom,2026-01-02
517042,22379,RECYCLING BAG RETROSPOT ,3,2.1,13069.0,United Kingdom,2026-01-02
517042,21933,PINK VINTAGE PAISLEY PICNIC BAG,1,2.95,13069.0,United Kingdom,2026-01-02
517042,21937,STRAWBERRY   PICNIC BAG,1,2.95,13069.0,United Kingdom,2026-01-02
517042,21212,PACK OF 72 RETRO SPOT CAKE CASES,120,0.42,13069.0,United Kingdom,2026-01-02
517042,21213,PACK OF 72 SKULL CAKE CASES,120,0.42,13069.0,United Kingdom,2026-01-02
517042,22417,PACK OF 60 SPACEBOY CAKE CASES,24,0.55,13069.0,United Kingdom,2026-01-02
517042,21980,PACK OF 12 RED SPOTTY TISSUES ,12,0.29,13069.0,United Kingdom,2026-01-02
517042,21171,BATHROOM METAL SIGN ,3,1.45,13069.0,United Kingdom,2026-01-02
517042,21172,PARTY METAL SIGN ,5,1.45,13069.0,United Kingdom,2026-01-02
517042,21179,NO JUNK MAIL METAL SIGN,2,1.25,13069.0,United Kingdom,2026-01-02
517042,21733,RED HANGING HEART T-LIGHT HOLDER,3,2.95,13069.0,United Kingdom,2026-01-02
517042,85152,HAND OVER THE CHOCOLATE   SIGN ,1,2.1,13069.0,United Kingdom,2026-01-02
517042,22469,HEART OF WICKER SMALL,2,1.65,13069.0,United Kingdom,2026-01-02
517042,21788,KIDS RAIN MAC BLUE,1,0.85,13069.0,United Kingdom,2026-01-02
517042,21789,KIDS RAIN MAC PINK,1,0.85,13069.0,United Kingdom,2026-01-02
517042,84789,ENCHANTED BIRD PLANT CAGE,1,3.75,13069.0,United Kingdom,2026-01-02
517042,21672,WHITE SPOT RED CERAMIC DRAWER KNOB,6,1.25,13069.0,United Kingdom,2026-01-02
517042,85031A,ROMANTIC IMAGES SCRAP BOOK SET,24,1.25,13069.0,United Kingdom,2026-01-02
517042,21671,RED SPOT CERAMIC DRAWER KNOB,6,1.25,13069.0,United Kingdom,2026-01-02
517042,21669,BLUE STRIPE CERAMIC DRAWER KNOB,6,1.25,13069.0,United Kingdom,2026-01-02
517042,21673,WHITE SPOT BLUE CERAMIC DRAWER KNOB,6,1.25,13069.0,United Kingdom,2026-01-02
517042,21668,RED STRIPE CERAMIC DRAWER KNOB,6,1.25,13069.0,United Kingdom,2026-01-02
517042,35957,SMALLFOLKART BAUBLE CHRISTMAS DEC,96,0.19,13069.0,United Kingdom,2026-01-02
517042,22668,PINK BABY BUNTING,5,2.95,13069.0,United Kingdom,2026-01-02
517042,22669,RED BABY BUNTING ,5,2.95,13069.0,United Kingdom,2026-01-02
517042,85065,CREAM SWEETHEART TRAYS,1,12.75,13069.0,United Kingdom,2026-01-02
517042,21967,PACK OF 12 SKULL TISSUES,12,0.29,13069.0,United Kingdom,2026-01-02
517042,21982,PACK OF 12 SUKI TISSUES ,12,0.29,13069.0,United Kingdom,2026-01-02
517042,22473,TV DINNER TRAY VINTAGE PAISLEY,1,4.95,13069.0,United Kingdom,2026-01-02
517042,22475,SKULL DESIGN TV DINNER TRAY,1,4.95,13069.0,United Kingdom,2026-01-02
517042,22168,ORGANISER WOOD ANTIQUE WHITE ,1,8.5,13069.0,United Kingdom,2026-01-02
517042,82494L,WOODEN FRAME ANTIQUE WHITE ,3,2.95,13069.0,United Kingdom,2026-01-02
517042,22614,PACK OF 12 SPACEBOY TISSUES,12,0.29,13069.0,United Kingdom,2026-01-02
517042,82482,WOODEN PICTURE FRAME WHITE FINISH,3,2.55,13069.0,United Kingdom,2026-01-02
517042,22627,MINT KITCHEN SCALES,1,8.5,13069.0,United Kingdom,2026-01-02
517042,22223,CAKE PLATE LOVEBIRD PINK,1,4.95,13069.0,United Kingdom,2026-01-02
517042,22470,HEART OF WICKER LARGE,2,2.95,13069.0,United Kingdom,2026-01-02
517042,22218,CAKE STAND LACE WHITE,1,4.25,13069.0,United Kingdom,2026-01-02
517042,37340,MULTICOLOUR SPRING FLOWER MUG,2,0.85,13069.0,United Kingdom,2026-01-02
517042,21071,VINTAGE BILLBOARD DRINK ME MUG,1,1.25,13069.0,United Kingdom,2026-01-02
517042,21069,VINTAGE BILLBOARD TEA MUG,1,1.25,13069.0,United Kingdom,2026-01-02
517042,21430,SET/3 RED GINGHAM ROSE STORAGE BOX,1,3.75,13069.0,United Kingdom,2026-01-02
517042,85123A,WHITE HANGING HEART T-LIGHT HOLDER,3,2.95,13069.0,United Kingdom,2026-01-02
517042,21116,OWL DOORSTOP,1,4.95,13069.0,United Kingdom,2026-01-02
517042,22508,DOORSTOP RETROSPOT HEART,1,3.75,13069.0,United Kingdom,2026-01-02
517042,22556,PLASTERS IN TIN CIRCUS PARADE ,2,1.65,13069.0,United Kingdom,2026-01-02
517042,22554,PLASTERS IN TIN WOODLAND ANIMALS,2,1.65,13069.0,United Kingdom,2026-01-02
517042,22383,LUNCH BAG SUKI  DESIGN ,10,1.65,13069.0,United Kingdom,2026-01-02
517042,22553,PLASTERS IN TIN SKULLS,2,1.65,13069.0,United Kingdom,2026-01-02
517042,22551,PLASTERS IN TIN SPACEBOY,2,1.65,13069.0,United Kingdom,2026-01-02
517042,21034,REX CASH+CARRY JUMBO SHOPPER,1,0.95,13069.0,United Kingdom,2026-01-02
517042,22120,WELCOME  WOODEN BLOCK LETTERS,1,9.95,13069.0,United Kingdom,2026-01-02
517043,22385,JUMBO BAG SPACEBOY DESIGN,10,1.95,15615.0,United Kingdom,2026-01-02
517043,20978,36 PENCILS TUBE SKULLS,16,1.25,15615.0,United Kingdom,2026-01-02
517043,22411,JUMBO SHOPPER VINTAGE RED PAISLEY,20,1.95,15615.0,United Kingdom,2026-01-02
517043,85099F,JUMBO BAG STRAWBERRY,20,1.95,15615.0,United Kingdom,2026-01-02
517043,20723,STRAWBERRY CHARLOTTE BAG,10,0.85,15615.0,United Kingdom,2026-01-02
517043,21086,SET/6 RED SPOTTY PAPER CUPS,12,0.65,15615.0,United Kingdom,2026-01-02
517043,22386,JUMBO BAG PINK WITH WHITE SPOTS,10,1.95,15615.0,United Kingdom,2026-01-02
517043,21078,SET/20 STRAWBERRY PAPER NAPKINS ,12,0.85,15615.0,United Kingdom,2026-01-02
517043,20725,LUNCH BAG RED SPOTTY,10,1.65,15615.0,United Kingdom,2026-01-02
517043,21080,SET/20 RED SPOTTY PAPER NAPKINS ,24,0.85,15615.0,United Kingdom,2026-01-02
517043,21972,SET OF 36 DINOSAUR PAPER DOILIES,12,1.45,15615.0,United Kingdom,2026-01-02
517043,21974,SET OF 36 PAISLEY FLOWER DOILIES,12,1.45,15615.0,United Kingdom,2026-01-02
517043,22384,LUNCH BAG PINK RETROSPOT,10,1.65,15615.0,United Kingdom,2026-01-02
517043,20728,LUNCH BAG CARS BLUE,10,1.65,15615.0,United Kingdom,2026-01-02
517043,85099B,JUMBO BAG RED RETROSPOT,30,1.95,15615.0,United Kingdom,2026-01-02
517043,21930,JUMBO STORAGE BAG SKULLS,10,1.95,15615.0,United Kingdom,2026-01-02
517043,22283,6 EGG HOUSE PAINTED WOOD,2,7.95,15615.0,United Kingdom,2026-01-02
517043,20751,FUNKY WASHING UP GLOVES ASSORTED,12,2.1,15615.0,United Kingdom,2026-01-02
517043,20754,RETRO RED SPOTTY WASHING UP GLOVES,6,2.1,15615.0,United Kingdom,2026-01-02
517043,21931,JUMBO STORAGE BAG SUKI,20,1.95,15615.0,United Kingdom,2026-01-02
517043,22185,SLATE TILE NATURAL HANGING,12,1.65,15615.0,United Kingdom,2026-01-02
517043,22178,VICTORIAN GLASS HANGING T-LIGHT,12,1.25,15615.0,United Kingdom,2026-01-02
517043,21742,LARGE ROUND WICKER PLATTER ,2,5.95,15615.0,United Kingdom,2026-01-02
517043,21381,MINI WOODEN HAPPY BIRTHDAY GARLAND,12,1.69,15615.0,United Kingdom,2026-01-02
517043,47590B,PINK HAPPY BIRTHDAY BUNTING,3,5.45,15615.0,United Kingdom,2026-01-02
517043,21936,RED RETROSPOT PICNIC BAG,5,2.95,15615.0,United Kingdom,2026-01-02
517043,22457,NATURAL SLATE HEART CHALKBOARD ,6,2.95,15615.0,United Kingdom,2026-01-02
517043,22342,HOME GARLAND PAINTED ZINC ,12,1.65,15615.0,United Kingdom,2026-01-02
517044,21936,RED RETROSPOT PICNIC BAG,5,2.95,14911.0,EIRE,2026-01-02
517044,85099C,JUMBO  BAG BAROQUE BLACK WHITE,10,1.95,14911.0,EIRE,2026-01-02
517044,22659,LUNCH BOX I LOVE LONDON,12,1.95,14911.0,EIRE,2026-01-02
517044,22630,DOLLY GIRL LUNCH BOX,12,1.95,14911.0,EIRE,2026-01-02
517044,22561,WOODEN SCHOOL COLOURING SET,12,1.65,14911.0,EIRE,2026-01-02
517044,21462,"NURSERY A,B,C PAINTED LETTERS",2,6.75,14911.0,EIRE,2026-01-02
517044,84580,MOUSE TOY WITH PINK T-SHIRT,4,3.75,14911.0,EIRE,2026-01-02
517044,47591D,PINK FAIRY CAKE CHILDRENS APRON,16,1.95,14911.0,EIRE,2026-01-02
517044,21519,GIN & TONIC DIET GREETING CARD ,24,0.42,14911.0,EIRE,2026-01-02
517046,84509A,SET OF 4 ENGLISH ROSE PLACEMATS,4,3.75,18245.0,United Kingdom,2026-01-02
517046,79030G,"TUMBLER, NEW ENGLAND",6,1.65,18245.0,United Kingdom,2026-01-02
517046,22423,REGENCY CAKESTAND 3 TIER,1,12.75,18245.0,United Kingdom,2026-01-02
517046,22709,WRAP WEDDING DAY,25,0.42,18245.0,United Kingdom,2026-01-02
517046,22080,RIBBON REEL SPOTS DESIGN ,10,1.65,18245.0,United Kingdom,2026-01-02
517046,22081,RIBBON REEL FLORA + FAUNA ,10,1.65,18245.0,United Kingdom,2026-01-02
517046,84270,ASSTD DESIGN BUBBLE GUM RING,30,0.21,18245.0,United Kingdom,2026-01-02
517046,84520B,PACK 20 ENGLISH ROSE PAPER NAPKINS,12,0.85,18245.0,United Kingdom,2026-01-02
517046,48138,DOORMAT UNION FLAG,2,7.49,18245.0,United Kingdom,2026-01-02
517046,21955,DOORMAT UNION JACK GUNS AND ROSES,2,7.49,18245.0,United Kingdom,2026-01-02
517046,21576,LETS GO SHOPPING COTTON TOTE BAG,6,2.25,18245.0,United Kingdom,2026-01-02
517046,21577,SAVE THE PLANET COTTON TOTE BAG,6,2.25,18245.0,United Kingdom,2026-01-02
517046,22079,RIBBON REEL HEARTS DESIGN ,10,1.65,18245.0,United Kingdom,2026-01-02
517046,47568,ENGLISH ROSE DESIGN PEG BAG,6,2.1,18245.0,United Kingdom,2026-01-02
517046,22668,PINK BABY BUNTING,5,2.95,18245.0,United Kingdom,2026-01-02
517046,84536A,ENGLISH ROSE NOTEBOOK A7 SIZE,16,0.42,18245.0,United Kingdom,2026-01-02
517046,84510A,SET OF 4 ENGLISH ROSE COASTERS,10,1.25,18245.0,United Kingdom,2026-01-02
