Invoice,StockCode,Description,Quantity,Price,Customer ID,Country,InvoiceDate
519614,85232B,SET/3 RUSSIAN DOLL STACKING TINS,3,4.95,14911.0,EIRE,2026-01-23
519614,22445,PENCIL CASE LIFE IS BEAUTIFUL,6,2.95,14911.0,EIRE,2026-01-23
519614,22383,LUNCH BAG SUKI  DESIGN ,10,1.65,14911.0,EIRE,2026-01-23
519614,21462,"NURSERY A,B,C PAINTED LETTERS",4,6.75,14911.0,EIRE,2026-01-23
519614,C2,CARRIAGE,1,50.0,14911.0,EIRE,2026-01-23
519614,21498,RED SPOTS  WRAP ,50,0.42,14911.0,EIRE,2026-01-23
519614,21519,GIN & TONIC DIET GREETING CARD ,12,0.42,14911.0,EIRE,2026-01-23
519614,20728,LUNCH BAG CARS BLUE,10,1.65,14911.0,EIRE,2026-01-23
519614,85099C,JUMBO  BAG BAROQUE BLACK WHITE,10,1.95,14911.0,EIRE,2026-01-23
519614,22629,SPACEBOY LUNCH BOX ,12,1.95,14911.0,EIRE,2026-01-23
519614,22556,PLASTERS IN TIN CIRCUS PARADE ,12,1.65,14911.0,EIRE,2026-01-23
519614,22605,WOODEN CROQUET GARDEN SET,1,12.75,14911.0,EIRE,2026-01-23
519614,84580,MOUSE TOY WITH PINK T-SHIRT,4,3.75,14911.0,EIRE,2026-01-23
519614,22561,WOODEN SCHOOL COLOURING SET,12,1.65,14911.0,EIRE,2026-01-23
519614,21166,COOK WITH WINE METAL SIGN ,24,1.95,14911.0,EIRE,2026-01-23
519614,22328,ROUND SNACK BOXES SET OF 4 FRUITS ,6,2.95,14911.0,EIRE,2026-01-23
519614,84970S,HANGING HEART ZINC T-LIGHT HOLDER,12,0.85,14911.0,EIRE,2026-01-23
519614,22482,BLUE TEA TOWEL CLASSIC DESIGN,12,1.25,14911.0,EIRE,2026-01-23
519614,22480,RED TEA TOWEL CLASSIC DESIGN,12,1.25,14911.0,EIRE,2026-01-23
519614,21922,UNION STRIPE WITH FRINGE  HAMMOCK,2,7.95,14911.0,EIRE,2026-01-23
519614,20977,36 PENCILS TUBE WOODLAND,16,1.25,14911.0,EIRE,2026-01-23
519614,21936,RED RETROSPOT PICNIC BAG,5,2.95,14911.0,EIRE,2026-01-23
519615,21213,PACK OF 72 SKULL CAKE CASES,120,0.42,16843.0,United Kingdom,2026-01-23
519615,22629,SPACEBOY LUNCH BOX ,24,1.95,16843.0,United Kingdom,2026-01-23
519615,22630,DOLLY GIRL LUNCH BOX,24,1.95,16843.0,United Kingdom,2026-01-23
519615,21981,PACK OF 12 WOODLAND TISSUES ,24,0.29,16843.0,United Kingdom,2026-01-23
519615,22613,PACK OF 20 SPACEBOY NAPKINS,24,0.85,16843.0,United Kingdom,2026-01-23
519615,21077,SET/20 WOODLAND PAPER NAPKINS ,24,0.85,16843.0,United Kingdom,2026-01-23
519615,21080,SET/20 RED SPOTTY PAPER NAPKINS ,24,0.85,16843.0,United Kingdom,2026-01-23
519615,84670,JAPANESE CROCHETED ANIMAL,24,0.42,16843.0,United Kingdom,2026-01-23
519615,22139,RETRO SPOT TEA SET CERAMIC 11 PC ,12,4.95,16843.0,United Kingdom,2026-01-23
519615,22242,"HOOK, 5 HANGER , MAGIC TOADSTOOL",36,1.65,16843.0,United Kingdom,2026-01-23
519615,22492,MINI PAINT SET VINTAGE ,288,0.65,16843.0,United Kingdom,2026-01-23
519615,21703,BAG 125g SWIRLY MARBLES,96,0.36,16843.0,United Kingdom,2026-01-23
519615,21430,SET/3 RED GINGHAM ROSE STORAGE BOX,8,3.75,16843.0,United Kingdom,2026-01-23
519615,20971,PINK BLUE FELT CRAFT TRINKET BOX,48,1.25,16843.0,United Kingdom,2026-01-23
519616,79337,BLUE FLOCK GLASS CANDLEHOLDER,288,0.38,13892.0,United Kingdom,2026-01-23
519617,21841,BABY MOUSE RED GINGHAM DRESS,3,4.25,14540.0,United Kingdom,2026-01-23
519617,22588,CARD HOLDER GINGHAM HEART,6,2.55,14540.0,United Kingdom,2026-01-23
519617,21671,RED SPOT CERAMIC DRAWER KNOB,12,1.25,14540.0,United Kingdom,2026-01-23
519617,21670,BLUE SPOT CERAMIC DRAWER KNOB,12,1.25,14540.0,United Kingdom,2026-01-23
519617,21669,BLUE STRIPE CERAMIC DRAWER KNOB,12,1.25,14540.0,United Kingdom,2026-01-23
519617,21668,RED STRIPE CERAMIC DRAWER KNOB,12,1.25,14540.0,United Kingdom,2026-01-23
519617,22498,WOODEN REGATTA BUNTING,3,5.95,14540.0,United Kingdom,2026-01-23
519617,21839,MUMMY MOUSE RED GINGHAM RIBBON,3,5.45,14540.0,United Kingdom,2026-01-23
519617,22692,DOORMAT WELCOME TO OUR HOME,2,7.49,14540.0,United Kingdom,2026-01-23
519617,35400,WOODEN BOX ADVENT CALENDAR ,2,8.95,14540.0,United Kingdom,2026-01-23
519617,35653,VINTAGE BEAD NOTEBOOK,6,2.95,14540.0,United Kingdom,2026-01-23
519617,21689,SILVER VANILLA  FLOWER CANDLE POT,24,3.75,14540.0,United Kingdom,2026-01-23
519617,21694,SMALL REGAL  SILVER CANDLEPOT ,6,2.95,14540.0,United Kingdom,2026-01-23
519617,21692,SILVER LATTICE VANILLA CANDLE POT,24,3.75,14540.0,United Kingdom,2026-01-23
519617,22361,GLASS JAR DAISY FRESH COTTON WOOL,6,2.95,14540.0,United Kingdom,2026-01-23
519617,20956,PORCELAIN T-LIGHT HOLDERS ASSORTED,24,1.25,14540.0,United Kingdom,2026-01-23
519617,21754,HOME BUILDING BLOCK WORD,3,5.95,14540.0,United Kingdom,2026-01-23
519618,22328,ROUND SNACK BOXES SET OF 4 FRUITS ,12,2.95,14852.0,United Kingdom,2026-01-23
519618,84945,MULTI COLOUR SILVER T-LIGHT HOLDER,12,0.85,14852.0,United Kingdom,2026-01-23
519618,84970S,HANGING HEART ZINC T-LIGHT HOLDER,24,0.85,14852.0,United Kingdom,2026-01-23
519618,85123A,WHITE HANGING HEART T-LIGHT HOLDER,32,2.55,14852.0,United Kingdom,2026-01-23
519618,84836,ZINC METAL HEART DECORATION,24,1.25,14852.0,United Kingdom,2026-01-23
519618,84879,ASSORTED COLOUR BIRD ORNAMENT,32,1.69,14852.0,United Kingdom,2026-01-23
519618,21390,FILIGRIS HEART WITH BUTTERFLY,48,1.25,14852.0,United Kingdom,2026-01-23
519618,22327,ROUND SNACK BOXES SET OF 4 SKULLS,12,2.95,14852.0,United Kingdom,2026-01-23
519618,21911,GARDEN METAL SIGN ,12,1.65,14852.0,United Kingdom,2026-01-23
519618,21977,PACK OF 60 PINK PAISLEY CAKE CASES,24,0.55,14852.0,United Kingdom,2026-01-23
519618,84755,COLOUR GLASS T-LIGHT HOLDER HANGING,48,0.65,14852.0,United Kingdom,2026-01-23
519618,84991,60 TEATIME FAIRY CAKE CASES,24,0.55,14852.0,United Kingdom,2026-01-23
519618,21212,PACK OF 72 RETRO SPOT CAKE CASES,24,0.55,14852.0,United Kingdom,2026-01-23
519618,21937,STRAWBERRY   PICNIC BAG,5,2.95,14852.0,United Kingdom,2026-01-23
519618,22684,"FRENCH BLUE METAL DOOR SIGN, 9",10,1.25,14852.0,United Kingdom,2026-01-23
519618,20725,LUNCH BAG RED SPOTTY,10,1.65,14852.0,United Kingdom,2026-01-23
519618,85099F,JUMBO BAG STRAWBERRY,10,1.95,14852.0,United Kingdom,2026-01-23
519618,85216,ASSORTED CAKES FRIDGE MAGNETS,12,0.65,14852.0,United Kingdom,2026-01-23
519618,20914,SET/5 RED SPOTTY LID GLASS BOWLS,12,2.95,14852.0,United Kingdom,2026-01-23
519618,85217,ASSORTED ICE CREAM FRIDGE MAGNETS,12,0.65,14852.0,United Kingdom,2026-01-23
519618,84992,72 SWEETHEART FAIRY CAKE CASES,24,0.55,14852.0,United Kingdom,2026-01-23
519618,21936,RED RETROSPOT PICNIC BAG,5,2.95,14852.0,United Kingdom,2026-01-23
519619,21912,VINTAGE SNAKES & LADDERS,1,7.62,,United Kingdom,2026-01-23
519619,21774,DECORATIVE CATS BATHROOM BOTTLE,1,2.51,,United Kingdom,2026-01-23
519619,21902,"KEY FOB , FRONT  DOOR ",1,1.66,,United Kingdom,2026-01-23
519619,21901,"KEY FOB , BACK DOOR ",1,1.66,,United Kingdom,2026-01-23
519619,21889,WOODEN BOX OF DOMINOES,1,2.51,,United Kingdom,2026-01-23
519619,21888,BINGO SET,1,7.62,,United Kingdom,2026-01-23
519619,21874,GIN AND TONIC MUG,1,3.36,,United Kingdom,2026-01-23
519619,21846,PINK DIAMANTE PEN IN GIFT BOX,1,4.21,,United Kingdom,2026-01-23
519619,21794,CLASSIC FRENCH STYLE BASKET NATURAL,1,13.57,,United Kingdom,2026-01-23
519619,21754,HOME BUILDING BLOCK WORD,1,11.87,,United Kingdom,2026-01-23
519619,21668,RED STRIPE CERAMIC DRAWER KNOB,1,2.51,,United Kingdom,2026-01-23
519619,21672,WHITE SPOT RED CERAMIC DRAWER KNOB,1,2.51,,United Kingdom,2026-01-23
519619,21671,RED SPOT CERAMIC DRAWER KNOB,1,2.51,,United Kingdom,2026-01-23
519619,21669,BLUE STRIPE CERAMIC DRAWER KNOB,1,2.51,,United Kingdom,2026-01-23
519619,DOT,DOTCOM POSTAGE,1,158.32,,United Kingdom,2026-01-23
519619,gift_0001_20,Dotcomgiftshop Gift Voucher £20.00,1,17.02,,United Kingdom,2026-01-23
519619,85123A,WHITE HANGING HEART T-LIGHT HOLDER,1,5.91,,United Kingdom,2026-01-23
519619,85098B,BLUE FLYING SINGING CANARY,2,7.62,,United Kingdom,2026-01-23
519619,85061W,WHITE JEWELLED HEART DECORATION,5,1.66,,United Kingdom,2026-01-23
519619,21913,VINTAGE SEASIDE JIGSAW PUZZLES,1,7.62,,United Kingdom,2026-01-23
519619,21731,RED TOADSTOOL LED NIGHT LIGHT,3,3.36,,United Kingdom,2026-01-23
519619,21914,BLUE HARMONICA IN BOX ,1,2.51,,United Kingdom,2026-01-23
519619,21537,RED RETROSPOT PUDDING BOWL,1,8.47,,United Kingdom,2026-01-23
519619,22697,GREEN REGENCY TEACUP AND SAUCER,4,5.91,,United Kingdom,2026-01-23
519619,21375,LARGE CAMPHOR WOOD FIELD MUSHROOM ,1,11.02,,United Kingdom,2026-01-23
519619,21213,PACK OF 72 SKULL CAKE CASES,1,1.28,,United Kingdom,2026-01-23
519619,21212,PACK OF 72 RETRO SPOT CAKE CASES,1,1.28,,United Kingdom,2026-01-23
519619,21210,SET OF 72 RETRO SPOT PAPER  DOILIES,1,2.98,,United Kingdom,2026-01-23
519619,21108,FAIRY CAKE FLANNEL ASSORTED COLOUR,2,5.06,,United Kingdom,2026-01-23
519619,21094,SET/6 RED SPOTTY PAPER PLATES,2,1.66,,United Kingdom,2026-01-23
519619,21658,GLASS  BEURRE DISH,1,8.47,,United Kingdom,2026-01-23
519619,21640,ASSORTED TUTTI FRUTTI  FOB NOTEBOOK,6,1.66,,United Kingdom,2026-01-23
519619,85014B,RED/WHITE DOTS RUFFLED UMBRELLA,1,12.72,,United Kingdom,2026-01-23
519619,21429,RED GINGHAM ROSE JEWELLERY BOX,2,3.36,,United Kingdom,2026-01-23
519619,21379,CAMPHOR WOOD PORTOBELLO MUSHROOM,1,2.51,,United Kingdom,2026-01-23
519619,47566,PARTY BUNTING,6,8.47,,United Kingdom,2026-01-23
519619,47556B,TEA TIME TEA TOWELS ,1,5.91,,United Kingdom,2026-01-23
519619,37424,WHITE WITH BLACK CATS MUG,2,1.66,,United Kingdom,2026-01-23
519619,37423,WHITE WITH BLACK CATS PLATE,2,1.66,,United Kingdom,2026-01-23
519619,35811A,ENAMEL PINK SUGAR CONTAINER,3,4.21,,United Kingdom,2026-01-23
519619,35810A,ENAMEL PINK COFFEE CONTAINER,3,4.21,,United Kingdom,2026-01-23
519619,35809A,ENAMEL PINK TEA CONTAINER,3,4.21,,United Kingdom,2026-01-23
519619,22755,SMALL PURPLE BABUSHKA NOTEBOOK ,1,1.66,,United Kingdom,2026-01-23
519619,22699,ROSES REGENCY TEACUP AND SAUCER ,2,5.91,,United Kingdom,2026-01-23
519619,22698,PINK REGENCY TEACUP AND SAUCER,3,5.91,,United Kingdom,2026-01-23
519619,22694,WICKER STAR ,2,4.21,,United Kingdom,2026-01-23
519619,84978,HANGING HEART JAR T-LIGHT HOLDER,1,2.51,,United Kingdom,2026-01-23
519619,21377,SMALL CAMPHOR WOOD FIELD  MUSHROOM,1,3.36,,United Kingdom,2026-01-23
519619,84692,BOX OF 24 COCKTAIL PARASOLS,1,0.85,,United Kingdom,2026-01-23
519619,22131,FOOD CONTAINER SET 3 LOVE HEART ,1,4.21,,United Kingdom,2026-01-23
519619,22120,WELCOME  WOODEN BLOCK LETTERS,1,20.38,,United Kingdom,2026-01-23
519619,22115,METAL SIGN EMPIRE TEA,1,5.91,,United Kingdom,2026-01-23
519619,22090,PAPER BUNTING RETRO SPOTS,3,5.91,,United Kingdom,2026-01-23
519619,22023,EMPIRE BIRTHDAY CARD,1,0.85,,United Kingdom,2026-01-23
519619,21947,SET OF 6 HEART CHOPSTICKS,1,2.51,,United Kingdom,2026-01-23
519619,21935,SUKI  SHOULDER BAG,1,3.36,,United Kingdom,2026-01-23
519619,21929,JUMBO BAG PINK VINTAGE PAISLEY,1,4.21,,United Kingdom,2026-01-23
519619,21918,SET 12 KIDS COLOUR  CHALK STICKS,11,0.85,,United Kingdom,2026-01-23
519619,22139,RETRO SPOT TEA SET CERAMIC 11 PC ,1,11.02,,United Kingdom,2026-01-23
519619,21915,RED  HARMONICA IN BOX ,1,2.51,,United Kingdom,2026-01-23
519619,21080,SET/20 RED SPOTTY PAPER NAPKINS ,3,1.66,,United Kingdom,2026-01-23
519619,20902,VINTAGE KEEPSAKE BOX PARIS DAYS,1,12.72,,United Kingdom,2026-01-23
519619,20725,LUNCH BAG RED SPOTTY,1,4.21,,United Kingdom,2026-01-23
519619,20724,RED SPOTTY CHARLOTTE BAG,1,1.66,,United Kingdom,2026-01-23
519619,20719,WOODLAND CHARLOTTE BAG,10,1.66,,United Kingdom,2026-01-23
519619,20682,RED SPOTTY CHILDS UMBRELLA,1,6.77,,United Kingdom,2026-01-23
519619,15060B,FAIRY CAKE DESIGN UMBRELLA,1,8.47,,United Kingdom,2026-01-23
519619,15039,SANDALWOOD FAN,1,1.66,,United Kingdom,2026-01-23
519619,84970S,HANGING HEART ZINC T-LIGHT HOLDER,2,2.13,,United Kingdom,2026-01-23
519619,21086,SET/6 RED SPOTTY PAPER CUPS,5,1.66,,United Kingdom,2026-01-23
519619,22179,SET 10 LIGHTS NIGHT OWL,1,13.57,,United Kingdom,2026-01-23
519619,20963,APPLE BATH SPONGE,1,2.51,,United Kingdom,2026-01-23
519619,22227,"DECORATION, HANGING HEART+MIRROR ",1,1.28,,United Kingdom,2026-01-23
519619,84568,GIRLS ALPHABET IRON ON PATCHES ,15,0.43,,United Kingdom,2026-01-23
519619,84050,PINK HEART SHAPE EGG FRYING PAN,1,4.21,,United Kingdom,2026-01-23
519619,82582,AREA PATROLLED METAL SIGN,1,4.21,,United Kingdom,2026-01-23
519619,79067,CORONA MEXICAN TRAY,3,8.47,,United Kingdom,2026-01-23
519619,48138,DOORMAT UNION FLAG,1,14.43,,United Kingdom,2026-01-23
519619,22676,"FRENCH BLUE METAL DOOR SIGN, 1",2,2.51,,United Kingdom,2026-01-23
519619,22662,LUNCH BAG DOLLY GIRL DESIGN,1,4.21,,United Kingdom,2026-01-23
519619,84569C,PACK 4 FLOWER/BUTTERFLY PATCHES,1,2.51,,United Kingdom,2026-01-23
519619,22619,SET OF 6 SOLDIER SKITTLES,1,7.62,,United Kingdom,2026-01-23
519619,22616,PACK OF 12 LONDON TISSUES ,1,0.85,,United Kingdom,2026-01-23
519619,22559,SEASIDE FLYING DISC,2,2.51,,United Kingdom,2026-01-23
519619,22550,HOLIDAY FUN LUDO,1,7.62,,United Kingdom,2026-01-23
519619,22494,EMERGENCY FIRST AID TIN ,1,2.51,,United Kingdom,2026-01-23
519619,22469,HEART OF WICKER SMALL,1,3.36,,United Kingdom,2026-01-23
519619,22461,SAVOY ART DECO CLOCK,1,25.49,,United Kingdom,2026-01-23
519619,22444,GROW YOUR OWN PLANT IN A CAN ,1,2.51,,United Kingdom,2026-01-23
519619,22414,DOORMAT NEIGHBOURHOOD WITCH ,1,14.43,,United Kingdom,2026-01-23
519619,22383,LUNCH BAG SUKI  DESIGN ,2,4.21,,United Kingdom,2026-01-23
519619,22379,RECYCLING BAG RETROSPOT ,3,4.21,,United Kingdom,2026-01-23
519619,22353,LUNCH BOX WITH CUTLERY FAIRY CAKES ,1,5.06,,United Kingdom,2026-01-23
519619,22296,HEART IVORY TRELLIS LARGE,5,3.36,,United Kingdom,2026-01-23
519619,22196,SMALL HEART MEASURING SPOONS,3,1.66,,United Kingdom,2026-01-23
519620,84997B,RED 3 PIECE MINI DOTS CUTLERY SET,30,3.75,14952.0,United Kingdom,2026-01-23
519620,84997A,GREEN 3 PIECE MINI DOTS CUTLERY SET,30,3.75,14952.0,United Kingdom,2026-01-23
519620,84997D,PINK 3 PIECE MINI DOTS CUTLERY SET,30,3.75,14952.0,United Kingdom,2026-01-23
519620,84997C,BLUE 3 PIECE MINI DOTS CUTLERY SET,30,3.75,14952.0,United Kingdom,2026-01-23
519621,21213,PACK OF 72 SKULL CAKE CASES,24,0.55,14852.0,United Kingdom,2026-01-23
519621,21679,SKULLS  STICKERS,12,0.85,14852.0,United Kingdom,2026-01-23
519621,21544,SKULLS  WATER TRANSFER TATTOOS ,12,0.85,14852.0,United Kingdom,2026-01-23
519621,22085,PAPER CHAIN KIT SKULLS ,6,2.95,14852.0,United Kingdom,2026-01-23
519621,22110,BIRD HOUSE HOT WATER BOTTLE,12,3.45,14852.0,United Kingdom,2026-01-23
519621,84792,ENCHANTED BIRD COATHANGER 5 HOOK,12,4.65,14852.0,United Kingdom,2026-01-23
519621,21988,PACK OF 6 SKULL PAPER PLATES,12,0.85,14852.0,United Kingdom,2026-01-23
519621,21987,PACK OF 6 SKULL PAPER CUPS,12,0.65,14852.0,United Kingdom,2026-01-23
519621,22553,PLASTERS IN TIN SKULLS,12,1.65,14852.0,United Kingdom,2026-01-23
519622,82600,NO SINGING METAL SIGN,12,2.1,12949.0,United Kingdom,2026-01-23
519622,10133,COLOURING PENCILS BROWN TUBE,10,0.85,12949.0,United Kingdom,2026-01-23
519622,10135,COLOURING PENCILS BROWN TUBE,10,1.25,12949.0,United Kingdom,2026-01-23
519622,85042,ANTIQUE LILY FAIRY LIGHTS,8,4.95,12949.0,United Kingdom,2026-01-23
519622,20972,PINK CREAM FELT CRAFT TRINKET BOX ,12,1.25,12949.0,United Kingdom,2026-01-23
519622,84988,SET OF 72 PINK HEART PAPER DOILIES,12,1.45,12949.0,United Kingdom,2026-01-23
519622,22149,FELTCRAFT 6 FLOWER FRIENDS,12,2.1,12949.0,United Kingdom,2026-01-23
519622,82583,HOT BATHS METAL SIGN,12,2.1,12949.0,United Kingdom,2026-01-23
519622,21447,12 IVORY ROSE PEG PLACE SETTINGS,12,1.25,12949.0,United Kingdom,2026-01-23
519622,72741,GRAND CHOCOLATECANDLE,9,1.45,12949.0,United Kingdom,2026-01-23
519622,22448,PIN CUSHION RUSSIAN DOLL RED,6,3.35,12949.0,United Kingdom,2026-01-23
519622,15056N,EDWARDIAN PARASOL NATURAL,3,5.95,12949.0,United Kingdom,2026-01-23
519622,21445,12 PINK ROSE PEG PLACE SETTINGS,12,1.25,12949.0,United Kingdom,2026-01-23
519622,20828,GLITTER BUTTERFLY CLIPS,12,2.55,12949.0,United Kingdom,2026-01-23
519622,21429,RED GINGHAM ROSE JEWELLERY BOX,8,1.65,12949.0,United Kingdom,2026-01-23
519622,21430,SET/3 RED GINGHAM ROSE STORAGE BOX,4,3.75,12949.0,United Kingdom,2026-01-23
519622,84755,COLOUR GLASS T-LIGHT HOLDER HANGING,32,0.65,12949.0,United Kingdom,2026-01-23
519622,22468,BABUSHKA LIGHTS STRING OF 10,4,6.75,12949.0,United Kingdom,2026-01-23
519622,21907,I'M ON HOLIDAY METAL SIGN,12,2.1,12949.0,United Kingdom,2026-01-23
519622,21260,FIRST AID TIN,6,3.25,12949.0,United Kingdom,2026-01-23
519622,21754,HOME BUILDING BLOCK WORD,6,5.95,12949.0,United Kingdom,2026-01-23
519622,84270,ASSTD DESIGN BUBBLE GUM RING,60,0.21,12949.0,United Kingdom,2026-01-23
519622,21922,UNION STRIPE WITH FRINGE  HAMMOCK,6,7.95,12949.0,United Kingdom,2026-01-23
519622,85232D,SET/3 DECOUPAGE STACKING TINS,3,4.95,12949.0,United Kingdom,2026-01-23
519622,22221,CAKE STAND LOVEBIRD 2 TIER PINK,2,9.95,12949.0,United Kingdom,2026-01-23
519622,22423,REGENCY CAKESTAND 3 TIER,3,12.75,12949.0,United Kingdom,2026-01-23
519622,48138,DOORMAT UNION FLAG,2,7.49,12949.0,United Kingdom,2026-01-23
519622,22469,HEART OF WICKER SMALL,12,1.65,12949.0,United Kingdom,2026-01-23
519622,21977,PACK OF 60 PINK PAISLEY CAKE CASES,24,0.55,12949.0,United Kingdom,2026-01-23
519622,22173,METAL 4 HOOK HANGER FRENCH CHATEAU,8,2.95,12949.0,United Kingdom,2026-01-23
519622,21272,SALLE DE BAIN HOOK,12,1.25,12949.0,United Kingdom,2026-01-23
519622,22295,HEART FILIGREE DOVE LARGE,12,1.65,12949.0,United Kingdom,2026-01-23
519622,21390,FILIGRIS HEART WITH BUTTERFLY,24,1.25,12949.0,United Kingdom,2026-01-23
519622,84836,ZINC METAL HEART DECORATION,24,1.25,12949.0,United Kingdom,2026-01-23
519622,82483,WOOD 2 DRAWER CABINET WHITE FINISH,4,5.95,12949.0,United Kingdom,2026-01-23
519622,82482,WOODEN PICTURE FRAME WHITE FINISH,6,2.55,12949.0,United Kingdom,2026-01-23
519622,21900,"KEY FOB , SHED",24,0.65,12949.0,United Kingdom,2026-01-23
519627,46000M,POLYESTER FILLER PAD 45x45cm,6,1.55,14198.0,United Kingdom,2026-01-23
519627,72760B,VINTAGE CREAM 3 BASKET CAKE STAND,2,9.95,14198.0,United Kingdom,2026-01-23
519627,84950,ASSORTED COLOUR T-LIGHT HOLDER,12,0.85,14198.0,United Kingdom,2026-01-23
519627,22178,VICTORIAN GLASS HANGING T-LIGHT,12,1.25,14198.0,United Kingdom,2026-01-23
519627,22423,REGENCY CAKESTAND 3 TIER,2,12.75,14198.0,United Kingdom,2026-01-23
519627,82486,WOOD S/3 CABINET ANT WHITE FINISH,2,7.95,14198.0,United Kingdom,2026-01-23
519627,82483,WOOD 2 DRAWER CABINET WHITE FINISH,4,5.95,14198.0,United Kingdom,2026-01-23
519627,72130,COLUMBIAN CANDLE ROUND,24,0.19,14198.0,United Kingdom,2026-01-23
519627,72128,COLUMBIAN CANDLE ROUND,24,0.38,14198.0,United Kingdom,2026-01-23
519627,85066,CREAM SWEETHEART MINI CHEST,2,12.75,14198.0,United Kingdom,2026-01-23
519640,21535,RED RETROSPOT SMALL MILK JUG,72,2.1,16684.0,United Kingdom,2026-01-23
519640,21929,JUMBO BAG PINK VINTAGE PAISLEY,200,1.65,16684.0,United Kingdom,2026-01-23
519640,21843,RED RETROSPOT CAKE STAND,24,9.95,16684.0,United Kingdom,2026-01-23
519640,21166,COOK WITH WINE METAL SIGN ,240,1.69,16684.0,United Kingdom,2026-01-23
519640,21314,SMALL GLASS HEART TRINKET POT,96,1.85,16684.0,United Kingdom,2026-01-23
519640,22361,GLASS JAR DAISY FRESH COTTON WOOL,72,2.55,16684.0,United Kingdom,2026-01-23
519640,20828,GLITTER BUTTERFLY CLIPS,96,2.1,16684.0,United Kingdom,2026-01-23
519640,82494L,WOODEN FRAME ANTIQUE WHITE ,120,2.55,16684.0,United Kingdom,2026-01-23
519640,82600,NO SINGING METAL SIGN,240,1.69,16684.0,United Kingdom,2026-01-23
519640,85178,VICTORIAN SEWING KIT,144,0.85,16684.0,United Kingdom,2026-01-23
519640,21977,PACK OF 60 PINK PAISLEY CAKE CASES,360,0.42,16684.0,United Kingdom,2026-01-23
519640,21212,PACK OF 72 RETRO SPOT CAKE CASES,360,0.42,16684.0,United Kingdom,2026-01-23
519640,22557,PLASTERS IN TIN VINTAGE PAISLEY ,192,1.45,16684.0,United Kingdom,2026-01-23
519640,82482,WOODEN PICTURE FRAME WHITE FINISH,144,2.1,16684.0,United Kingdom,2026-01-23
519640,22348,TEA BAG PLATE RED SPOTTY ,288,0.72,16684.0,United Kingdom,2026-01-23
519640,21531,RED RETROSPOT SUGAR JAM BOWL,48,2.1,16684.0,United Kingdom,2026-01-23
519640,22423,REGENCY CAKESTAND 3 TIER,32,10.95,16684.0,United Kingdom,2026-01-23
519640,21527,RED RETROSPOT TRADITIONAL TEAPOT ,36,6.95,16684.0,United Kingdom,2026-01-23
519640,85014A,BLACK/BLUE DOTS RUFFLED UMBRELLA,48,4.95,16684.0,United Kingdom,2026-01-23
519640,15056N,EDWARDIAN PARASOL NATURAL,120,4.95,16684.0,United Kingdom,2026-01-23
519640,15056BL,EDWARDIAN PARASOL BLACK,60,4.95,16684.0,United Kingdom,2026-01-23
519640,22710,WRAP I LOVE LONDON ,200,0.34,16684.0,United Kingdom,2026-01-23
519640,16156S,WRAP PINK FAIRY CAKES ,600,0.34,16684.0,United Kingdom,2026-01-23
519640,21497,FANCY FONTS BIRTHDAY WRAP,600,0.34,16684.0,United Kingdom,2026-01-23
519640,22029,SPACEBOY BIRTHDAY CARD,288,0.36,16684.0,United Kingdom,2026-01-23
519640,21506,"FANCY FONT BIRTHDAY CARD, ",432,0.36,16684.0,United Kingdom,2026-01-23
519640,22713,CARD I LOVE LONDON ,216,0.36,16684.0,United Kingdom,2026-01-23
519640,22030,SWALLOWS GREETING CARD,720,0.36,16684.0,United Kingdom,2026-01-23
519640,21844,RED RETROSPOT MUG,36,2.55,16684.0,United Kingdom,2026-01-23
519640,21877,HOME SWEET HOME MUG,72,1.06,16684.0,United Kingdom,2026-01-23
519640,16161U,WRAP SUKI AND FRIENDS,300,0.34,16684.0,United Kingdom,2026-01-23
519647,35400,WOODEN BOX ADVENT CALENDAR ,4,8.95,15247.0,United Kingdom,2026-01-23
519647,85123A,WHITE HANGING HEART T-LIGHT HOLDER,64,2.55,15247.0,United Kingdom,2026-01-23
519647,71477,COLOUR GLASS. STAR T-LIGHT HOLDER,24,2.75,15247.0,United Kingdom,2026-01-23
519647,46000S,POLYESTER FILLER PAD 40x40cm,30,1.45,15247.0,United Kingdom,2026-01-23
519656,22625,RED KITCHEN SCALES,2,8.5,12647.0,Germany,2026-01-23
519656,20685,DOORMAT RED SPOT,10,6.35,12647.0,Germany,2026-01-23
519656,POST,POSTAGE,7,18.0,12647.0,Germany,2026-01-23
519656,84859A,SILVER DISCO HANDBAG,12,1.25,12647.0,Germany,2026-01-23
519656,35811A,ENAMEL PINK SUGAR CONTAINER,24,0.85,12647.0,Germany,2026-01-23
519656,48187,DOORMAT NEW ENGLAND,10,6.35,12647.0,Germany,2026-01-23
519656,35810B,ENAMEL BLUE RIM COFFEE CONTAINER,24,0.85,12647.0,Germany,2026-01-23
519656,35810A,ENAMEL PINK COFFEE CONTAINER,24,0.85,12647.0,Germany,2026-01-23
519656,35809A,ENAMEL PINK TEA CONTAINER,24,0.85,12647.0,Germany,2026-01-23
519656,22202,MILK PAN PINK RETROSPOT,4,3.75,12647.0,Germany,2026-01-23
519656,22200,FRYING PAN PINK POLKADOT ,4,4.25,12647.0,Germany,2026-01-23
519656,84968A,SET OF 16 VINTAGE ROSE CUTLERY,3,12.75,12647.0,Germany,2026-01-23
519656,47568,ENGLISH ROSE DESIGN PEG BAG,6,2.1,12647.0,Germany,2026-01-23
519656,84997D,PINK 3 PIECE MINI DOTS CUTLERY SET,6,3.75,12647.0,Germany,2026-01-23
519656,85049E,SCANDINAVIAN REDS RIBBONS,24,1.25,12647.0,Germany,2026-01-23
519656,22077,6 RIBBONS RUSTIC CHARM,24,1.65,12647.0,Germany,2026-01-23
519656,81952B,ROUND BLUE CLOCK W/SUCKER,10,0.85,12647.0,Germany,2026-01-23
519656,21156,RETROSPOT CHILDRENS APRON,8,1.95,12647.0,Germany,2026-01-23
519656,47591D,PINK FAIRY CAKE CHILDRENS APRON,8,1.95,12647.0,Germany,2026-01-23
519656,22131,FOOD CONTAINER SET 3 LOVE HEART ,6,1.95,12647.0,Germany,2026-01-23
519656,22276,WASH BAG VINTAGE ROSE PAISLEY,6,2.55,12647.0,Germany,2026-01-23
519656,22378,WALL TIDY RETROSPOT ,10,2.1,12647.0,Germany,2026-01-23
519656,21930,JUMBO STORAGE BAG SKULLS,10,1.95,12647.0,Germany,2026-01-23
519656,84997C,BLUE 3 PIECE MINI DOTS CUTLERY SET,6,3.75,12647.0,Germany,2026-01-23
519657,21033,JUMBO BAG CHARLIE AND LOLA TOYS,10,2.95,14110.0,United Kingdom,2026-01-23
519657,22411,JUMBO SHOPPER VINTAGE RED PAISLEY,10,1.95,14110.0,United Kingdom,2026-01-23
519657,22385,JUMBO BAG SPACEBOY DESIGN,10,1.95,14110.0,United Kingdom,2026-01-23
519657,21931,JUMBO STORAGE BAG SUKI,10,1.95,14110.0,United Kingdom,2026-01-23
519657,20723,STRAWBERRY CHARLOTTE BAG,10,0.85,14110.0,United Kingdom,2026-01-23
519657,21137,BLACK RECORD COVER FRAME,24,3.39,14110.0,United Kingdom,2026-01-23
519657,85123A,WHITE HANGING HEART T-LIGHT HOLDER,32,2.55,14110.0,United Kingdom,2026-01-23
519657,21231,SWEETHEART CERAMIC TRINKET BOX,12,1.25,14110.0,United Kingdom,2026-01-23
519657,22382,LUNCH BAG SPACEBOY DESIGN ,10,1.65,14110.0,United Kingdom,2026-01-23
519657,22383,LUNCH BAG SUKI  DESIGN ,10,1.65,14110.0,United Kingdom,2026-01-23
519658,22188,BLACK HEART CARD HOLDER,4,3.95,16225.0,United Kingdom,2026-01-23
519658,22189,CREAM HEART CARD HOLDER,4,3.95,16225.0,United Kingdom,2026-01-23
519658,22469,HEART OF WICKER SMALL,8,1.65,16225.0,United Kingdom,2026-01-23
519658,22470,HEART OF WICKER LARGE,8,2.95,16225.0,United Kingdom,2026-01-23
519658,22178,VICTORIAN GLASS HANGING T-LIGHT,6,1.25,16225.0,United Kingdom,2026-01-23
519658,22456,NATURAL SLATE CHALKBOARD LARGE ,1,4.95,16225.0,United Kingdom,2026-01-23
519658,22086,PAPER CHAIN KIT 50'S CHRISTMAS ,1,2.95,16225.0,United Kingdom,2026-01-23
519658,21082,SET/20 FRUIT SALAD PAPER NAPKINS ,2,0.85,16225.0,United Kingdom,2026-01-23
519658,84880,WHITE WIRE EGG HOLDER,1,5.95,16225.0,United Kingdom,2026-01-23
519658,22386,JUMBO BAG PINK WITH WHITE SPOTS,3,1.95,16225.0,United Kingdom,2026-01-23
519658,21745,GAOLERS KEYS DECORATIVE GARDEN ,2,3.75,16225.0,United Kingdom,2026-01-23
519658,85099F,JUMBO BAG STRAWBERRY,3,1.95,16225.0,United Kingdom,2026-01-23
519658,82484,WOOD BLACK BOARD ANT WHITE FINISH,1,6.45,16225.0,United Kingdom,2026-01-23
519658,22170,PICTURE FRAME WOOD TRIPLE PORTRAIT,2,6.75,16225.0,United Kingdom,2026-01-23
519658,85123A,WHITE HANGING HEART T-LIGHT HOLDER,2,2.95,16225.0,United Kingdom,2026-01-23
519658,82482,WOODEN PICTURE FRAME WHITE FINISH,2,2.55,16225.0,United Kingdom,2026-01-23
519658,47591D,PINK FAIRY CAKE CHILDRENS APRON,2,1.95,16225.0,United Kingdom,2026-01-23
519658,21324,HANGING MEDINA LANTERN SMALL,4,2.95,16225.0,United Kingdom,2026-01-23
519658,21034,REX CASH+CARRY JUMBO SHOPPER,3,0.95,16225.0,United Kingdom,2026-01-23
519658,22528,GARDENERS KNEELING PAD,12,1.25,16225.0,United Kingdom,2026-01-23
519658,22649,STRAWBERRY FAIRY CAKE TEAPOT,1,4.95,16225.0,United Kingdom,2026-01-23
519658,21876,POTTERING MUG,6,1.25,16225.0,United Kingdom,2026-01-23
519658,82582,AREA PATROLLED METAL SIGN,2,2.1,16225.0,United Kingdom,2026-01-23
519658,84849D,HOT BATHS SOAP HOLDER,2,1.69,16225.0,United Kingdom,2026-01-23
519658,22625,RED KITCHEN SCALES,1,8.5,16225.0,United Kingdom,2026-01-23
519658,21232,STRAWBERRY CERAMIC TRINKET BOX,2,1.25,16225.0,United Kingdom,2026-01-23
