Invoice,StockCode,Description,Quantity,Price,Customer ID,Country,InvoiceDate
517046,22024,RAINY LADIES BIRTHDAY CARD,24,0.42,18245.0,United Kingdom,2026-01-02
517046,22027,TEA PARTY BIRTHDAY CARD,24,0.42,18245.0,United Kingdom,2026-01-02
517046,21508,VINTAGE KID DOLLY CARD ,24,0.42,18245.0,United Kingdom,2026-01-02
517046,22026,BANQUET BIRTHDAY  CARD  ,24,0.42,18245.0,United Kingdom,2026-01-02
517046,22712,CARD DOLLY GIRL ,24,0.42,18245.0,United Kingdom,2026-01-02
517046,21509,COWBOYS AND INDIANS BIRTHDAY CARD ,24,0.42,18245.0,United Kingdom,2026-01-02
517046,22714,CARD BIRTHDAY COWBOY,24,0.42,18245.0,United Kingdom,2026-01-02
517046,22030,SWALLOWS GREETING CARD,24,0.42,18245.0,United Kingdom,2026-01-02
517046,22033,BOTANICAL ROSE GREETING CARD,24,0.42,18245.0,United Kingdom,2026-01-02
517046,22715,CARD WEDDING DAY,24,0.42,18245.0,United Kingdom,2026-01-02
517046,85123A,WHITE HANGING HEART T-LIGHT HOLDER,12,2.95,18245.0,United Kingdom,2026-01-02
517046,22037,ROBOT BIRTHDAY CARD,24,0.42,18245.0,United Kingdom,2026-01-02
517047,20716,PARTY FOOD SHOPPER BAG,10,1.25,13715.0,United Kingdom,2026-01-02
517047,21135,VICTORIAN  METAL POSTCARD SPRING,16,1.69,13715.0,United Kingdom,2026-01-02
517047,82580,BATHROOM METAL SIGN,12,0.55,13715.0,United Kingdom,2026-01-02
517047,82581,TOILET METAL SIGN,12,0.55,13715.0,United Kingdom,2026-01-02
517047,85150,LADIES & GENTLEMEN METAL SIGN,6,2.55,13715.0,United Kingdom,2026-01-02
517047,22413,METAL SIGN TAKE IT OR LEAVE IT ,6,2.95,13715.0,United Kingdom,2026-01-02
517047,22295,HEART FILIGREE DOVE LARGE,24,1.65,13715.0,United Kingdom,2026-01-02
517047,22294,HEART FILIGREE DOVE  SMALL,24,1.25,13715.0,United Kingdom,2026-01-02
517047,85123A,WHITE HANGING HEART T-LIGHT HOLDER,12,2.95,13715.0,United Kingdom,2026-01-02
517047,21390,FILIGRIS HEART WITH BUTTERFLY,24,1.25,13715.0,United Kingdom,2026-01-02
517047,22219,LOVEBIRD HANGING DECORATION WHITE ,24,0.85,13715.0,United Kingdom,2026-01-02
517047,21231,SWEETHEART CERAMIC TRINKET BOX,72,1.06,13715.0,United Kingdom,2026-01-02
517047,21906,PHARMACIE FIRST AID TIN,2,6.75,13715.0,United Kingdom,2026-01-02
517047,21232,STRAWBERRY CERAMIC TRINKET BOX,72,1.06,13715.0,United Kingdom,2026-01-02
517047,71459,HANGING JAM JAR T-LIGHT HOLDER,12,0.85,13715.0,United Kingdom,2026-01-02
517047,22057,CERAMIC PLATE STRAWBERRY DESIGN,12,1.49,13715.0,United Kingdom,2026-01-02
517047,22064,PINK DOUGHNUT TRINKET POT ,24,1.65,13715.0,United Kingdom,2026-01-02
517047,84755,COLOUR GLASS T-LIGHT HOLDER HANGING,16,0.65,13715.0,United Kingdom,2026-01-02
517047,84970L,SINGLE HEART ZINC T-LIGHT HOLDER,12,0.95,13715.0,United Kingdom,2026-01-02
517047,84970S,HANGING HEART ZINC T-LIGHT HOLDER,12,0.85,13715.0,United Kingdom,2026-01-02
517047,22649,STRAWBERRY FAIRY CAKE TEAPOT,8,4.95,13715.0,United Kingdom,2026-01-02
517047,21733,RED HANGING HEART T-LIGHT HOLDER,6,2.95,13715.0,United Kingdom,2026-01-02
517047,21745,GAOLERS KEYS DECORATIVE GARDEN ,4,3.75,13715.0,United Kingdom,2026-01-02
517047,22215,CAKE STAND WHITE TWO TIER LACE,2,8.5,13715.0,United Kingdom,2026-01-02
517047,20718,RED SPOTTY SHOPPER BAG,10,1.25,13715.0,United Kingdom,2026-01-02
517047,20725,LUNCH BAG RED SPOTTY,10,1.65,13715.0,United Kingdom,2026-01-02
517047,37447,CERAMIC CAKE DESIGN SPOTTED PLATE,12,1.49,13715.0,United Kingdom,2026-01-02
517047,37448,CERAMIC CAKE DESIGN SPOTTED MUG,12,1.49,13715.0,United Kingdom,2026-01-02
517048,22130,PARTY CONE CHRISTMAS DECORATION ,180,0.72,12709.0,Germany,2026-01-02
517048,POST,POSTAGE,1,18.0,12709.0,Germany,2026-01-02
517049,21975,PACK OF 60 DINOSAUR CAKE CASES,48,0.55,14283.0,United Kingdom,2026-01-02
517049,21212,PACK OF 72 RETRO SPOT CAKE CASES,48,0.55,14283.0,United Kingdom,2026-01-02
517049,21213,PACK OF 72 SKULL CAKE CASES,24,0.55,14283.0,United Kingdom,2026-01-02
517049,22588,CARD HOLDER GINGHAM HEART,6,2.55,14283.0,United Kingdom,2026-01-02
517049,22589,CARDHOLDER GINGHAM STAR,6,2.55,14283.0,United Kingdom,2026-01-02
517050,22665,RECIPE BOX BLUE SKETCHBOOK DESIGN,3,2.95,18231.0,United Kingdom,2026-01-02
517050,22429,ENAMEL MEASURING JUG CREAM,3,4.25,18231.0,United Kingdom,2026-01-02
517050,22667,RECIPE BOX RETRO SPOT DESIGN,3,2.95,18231.0,United Kingdom,2026-01-02
517050,22430,ENAMEL WATERING CAN CREAM,4,4.95,18231.0,United Kingdom,2026-01-02
517050,22424,ENAMEL BREAD BIN CREAM,2,12.75,18231.0,United Kingdom,2026-01-02
517050,85123A,WHITE HANGING HEART T-LIGHT HOLDER,6,2.95,18231.0,United Kingdom,2026-01-02
517050,22666,RECIPE BOX PANTRY YELLOW DESIGN,3,2.95,18231.0,United Kingdom,2026-01-02
517051,21829,DINOSAUR KEYRINGS ASSORTED,108,0.21,14435.0,United Kingdom,2026-01-02
517051,21224,SET/4 SKULL BADGES,30,1.25,14435.0,United Kingdom,2026-01-02
517051,17003,BROCADE RING PURSE ,144,0.21,14435.0,United Kingdom,2026-01-02
517052,85060,WOOD FAN WITH FLOWER DESIGN,1,1.25,12977.0,United Kingdom,2026-01-02
517052,85070,ANT WHITE SWEETHEART TABLE W 3 DRAW,1,125.0,12977.0,United Kingdom,2026-01-02
517052,22167,"WALL MIRROR , DIAMANTE OVAL SHAPE",1,9.95,12977.0,United Kingdom,2026-01-02
517052,84824,DANISH ROSE UMBRELLA STAND,1,15.95,12977.0,United Kingdom,2026-01-02
517052,21258,VICTORIAN SEWING BOX LARGE,1,12.75,12977.0,United Kingdom,2026-01-02
517052,21765,HANGING METAL BIRD BATH,1,7.95,12977.0,United Kingdom,2026-01-02
517052,84840,SWEETHEART CARRY-ALL BASKET,1,8.5,12977.0,United Kingdom,2026-01-02
517052,85064,CREAM SWEETHEART LETTER RACK,1,5.45,12977.0,United Kingdom,2026-01-02
517052,22217,T-LIGHT HOLDER HANGING LACE,3,1.25,12977.0,United Kingdom,2026-01-02
517052,22217,T-LIGHT HOLDER HANGING LACE,3,1.25,12977.0,United Kingdom,2026-01-02
517052,22358,KINGS CHOICE TEA CADDY ,1,2.95,12977.0,United Kingdom,2026-01-02
517052,35811A,ENAMEL PINK SUGAR CONTAINER,3,2.1,12977.0,United Kingdom,2026-01-02
517052,85123A,WHITE HANGING HEART T-LIGHT HOLDER,3,2.95,12977.0,United Kingdom,2026-01-02
517052,22111,SCOTTIE DOG HOT WATER BOTTLE,1,4.95,12977.0,United Kingdom,2026-01-02
517052,85092,CANDY SPOT TEA COSY,2,3.35,12977.0,United Kingdom,2026-01-02
517052,21973,SET OF 36 MUSHROOM PAPER DOILIES,2,1.45,12977.0,United Kingdom,2026-01-02
517052,84988,SET OF 72 PINK HEART PAPER DOILIES,2,1.45,12977.0,United Kingdom,2026-01-02
517052,22262,FELT EGG COSY CHICKEN,1,0.85,12977.0,United Kingdom,2026-01-02
517052,22261,FELT EGG COSY WHITE RABBIT ,1,0.85,12977.0,United Kingdom,2026-01-02
517052,22262,FELT EGG COSY CHICKEN,2,0.85,12977.0,United Kingdom,2026-01-02
517052,22261,FELT EGG COSY WHITE RABBIT ,2,0.85,12977.0,United Kingdom,2026-01-02
517052,22030,SWALLOWS GREETING CARD,12,0.42,12977.0,United Kingdom,2026-01-02
517052,85034C,3 ROSE MORRIS BOXED CANDLES,2,4.25,12977.0,United Kingdom,2026-01-02
517052,85232D,SET/3 DECOUPAGE STACKING TINS,1,4.95,12977.0,United Kingdom,2026-01-02
517053,21244,BLUE  SPOTTY PLATE ,24,1.69,14115.0,United Kingdom,2026-01-02
517053,20674,GREEN SPOTTY BOWL,8,1.25,14115.0,United Kingdom,2026-01-02
517053,21243,PINK  SPOTTY PLATE ,24,1.69,14115.0,United Kingdom,2026-01-02
517053,21129,SILVER FISHING GNOME ,2,6.95,14115.0,United Kingdom,2026-01-02
517053,21238,RED SPOTTY CUP,8,0.85,14115.0,United Kingdom,2026-01-02
517053,84750B,BLACK SMALL GLASS CAKE STAND,16,1.95,14115.0,United Kingdom,2026-01-02
517053,21977,PACK OF 60 PINK PAISLEY CAKE CASES,48,0.55,14115.0,United Kingdom,2026-01-02
517053,20677,PINK SPOTTY BOWL,24,1.25,14115.0,United Kingdom,2026-01-02
517053,22139,RETRO SPOT TEA SET CERAMIC 11 PC ,3,4.95,14115.0,United Kingdom,2026-01-02
517053,20675,BLUE SPOTTY BOWL,24,1.25,14115.0,United Kingdom,2026-01-02
517053,84989A,75 GREEN FAIRY CAKE CASES,24,0.55,14115.0,United Kingdom,2026-01-02
517053,21241,GREEN SPOTTY CUP,8,0.85,14115.0,United Kingdom,2026-01-02
517053,21240,BLUE  SPOTTY CUP,24,0.85,14115.0,United Kingdom,2026-01-02
517053,21239,PINK  SPOTTY CUP,24,0.85,14115.0,United Kingdom,2026-01-02
517053,22423,REGENCY CAKESTAND 3 TIER,4,12.75,14115.0,United Kingdom,2026-01-02
517053,21974,SET OF 36 PAISLEY FLOWER DOILIES,48,1.45,14115.0,United Kingdom,2026-01-02
517053,21976,PACK OF 60 MUSHROOM CAKE CASES,24,0.55,14115.0,United Kingdom,2026-01-02
517053,84991,60 TEATIME FAIRY CAKE CASES,24,0.55,14115.0,United Kingdom,2026-01-02
517053,84992,72 SWEETHEART FAIRY CAKE CASES,48,0.55,14115.0,United Kingdom,2026-01-02
517053,21212,PACK OF 72 RETRO SPOT CAKE CASES,48,0.55,14115.0,United Kingdom,2026-01-02
C517054,22630,DOLLY GIRL LUNCH BOX,-1,1.95,14420.0,United Kingdom,2026-01-02
517055,22661,CHARLOTTE BAG DOLLY GIRL DESIGN,10,0.85,16558.0,United Kingdom,2026-01-02
517055,22663,JUMBO BAG DOLLY GIRL DESIGN,10,1.95,16558.0,United Kingdom,2026-01-02
517055,21448,12 DAISY PEGS IN WOOD BOX,12,1.65,16558.0,United Kingdom,2026-01-02
517055,85099B,JUMBO BAG RED RETROSPOT,10,1.95,16558.0,United Kingdom,2026-01-02
517055,22502,PICNIC BASKET WICKER SMALL,4,4.25,16558.0,United Kingdom,2026-01-02
517055,85124A,PINK JUICY FRUIT PHOTO FRAME,6,2.55,16558.0,United Kingdom,2026-01-02
517055,22169,FAMILY ALBUM WHITE PICTURE FRAME,2,8.5,16558.0,United Kingdom,2026-01-02
517055,22423,REGENCY CAKESTAND 3 TIER,2,12.75,16558.0,United Kingdom,2026-01-02
517055,85124C,GREEN JUICY FRUIT PHOTO FRAME,6,2.55,16558.0,United Kingdom,2026-01-02
C517056,22312,OFFICE MUG WARMER POLKADOT,-1,4.95,12590.0,Germany,2026-01-02
517057,22528,GARDENERS KNEELING PAD,48,1.06,14745.0,United Kingdom,2026-01-02
517057,22459,CAST IRON HOOK GARDEN TROWEL,8,2.55,14745.0,United Kingdom,2026-01-02
517057,22458,CAST IRON HOOK GARDEN FORK,8,2.55,14745.0,United Kingdom,2026-01-02
517057,85175,CACTI T-LIGHT CANDLES,16,0.42,14745.0,United Kingdom,2026-01-02
517057,22502,PICNIC BASKET WICKER SMALL,4,4.25,14745.0,United Kingdom,2026-01-02
517057,21714,CITRONELLA CANDLE GARDEN POT,12,1.25,14745.0,United Kingdom,2026-01-02
517057,84971S,SMALL HEART FLOWERS HOOK ,24,0.85,14745.0,United Kingdom,2026-01-02
517057,20728,LUNCH BAG CARS BLUE,10,1.65,14745.0,United Kingdom,2026-01-02
517057,20725,LUNCH BAG RED SPOTTY,10,1.65,14745.0,United Kingdom,2026-01-02
517057,22460,EMBOSSED GLASS TEALIGHT HOLDER,12,1.25,14745.0,United Kingdom,2026-01-02
C517058,22360,GLASS JAR ENGLISH CONFECTIONERY,-1,2.95,14236.0,United Kingdom,2026-01-02
517059,84751B,BLACK MEDIUM GLASS CAKE STAND,1,3.75,17224.0,United Kingdom,2026-01-02
517059,79172D,PURPLE TINT ACRYLIC FLOWER VASE,12,0.85,17224.0,United Kingdom,2026-01-02
517059,47503J,SET/3 FLORAL GARDEN TOOLS IN BAG,1,7.95,17224.0,United Kingdom,2026-01-02
517059,84467,ENGLISH ROSE DESIGN QUILTED THROW,1,39.95,17224.0,United Kingdom,2026-01-02
517059,84676,BATH DUCK WATERING CAN,1,2.95,17224.0,United Kingdom,2026-01-02
517059,72606A,BROWN ANTIQUE CUBE CANDLE,10,0.42,17224.0,United Kingdom,2026-01-02
517059,21684,SMALL MEDINA STAMPED METAL BOWL ,36,0.85,17224.0,United Kingdom,2026-01-02
517059,21916,SET 12 RETRO WHITE CHALK STICKS,3,0.42,17224.0,United Kingdom,2026-01-02
517060,22036,DINOSAUR BIRTHDAY CARD,48,0.42,16553.0,United Kingdom,2026-01-02
517060,22027,TEA PARTY BIRTHDAY CARD,24,0.42,16553.0,United Kingdom,2026-01-02
517060,22491,PACK OF 12 COLOURED PENCILS,24,0.85,16553.0,United Kingdom,2026-01-02
517060,21506,"FANCY FONT BIRTHDAY CARD, ",24,0.42,16553.0,United Kingdom,2026-01-02
517060,21212,PACK OF 72 RETRO SPOT CAKE CASES,72,0.55,16553.0,United Kingdom,2026-01-02
517060,84991,60 TEATIME FAIRY CAKE CASES,72,0.55,16553.0,United Kingdom,2026-01-02
517060,21357,TOAST ITS - DINOSAUR,48,1.25,16553.0,United Kingdom,2026-01-02
517060,84375,SET OF 20 KIDS COOKIE CUTTERS,24,1.95,16553.0,United Kingdom,2026-01-02
517060,21914,BLUE HARMONICA IN BOX ,48,1.25,16553.0,United Kingdom,2026-01-02
517060,21915,RED  HARMONICA IN BOX ,48,1.25,16553.0,United Kingdom,2026-01-02
517060,21915,RED  HARMONICA IN BOX ,48,1.25,16553.0,United Kingdom,2026-01-02
517060,20724,RED SPOTTY CHARLOTTE BAG,20,0.85,16553.0,United Kingdom,2026-01-02
517060,20723,STRAWBERRY CHARLOTTE BAG,20,0.85,16553.0,United Kingdom,2026-01-02
517060,22035,VINTAGE CARAVAN GREETING CARD ,48,0.42,16553.0,United Kingdom,2026-01-02
517060,22029,SPACEBOY BIRTHDAY CARD,48,0.42,16553.0,United Kingdom,2026-01-02
517060,37503,TEA TIME CAKE STAND IN GIFT BOX,2,10.75,16553.0,United Kingdom,2026-01-02
517061,22114,HOT WATER BOTTLE TEA AND SYMPATHY,48,3.45,16553.0,United Kingdom,2026-01-02
517061,21868,POTTING SHED TEA MUG,48,1.25,16553.0,United Kingdom,2026-01-02
517061,22528,GARDENERS KNEELING PAD,36,1.25,16553.0,United Kingdom,2026-01-02
517062,37501,TEA TIME TEA SET IN GIFT BOX,6,6.95,16553.0,United Kingdom,2026-01-02
517062,37500,TEA TIME TEAPOT IN GIFT BOX,4,9.95,16553.0,United Kingdom,2026-01-02
517062,84987,SET OF 36 TEATIME PAPER DOILIES,24,1.45,16553.0,United Kingdom,2026-01-02
517062,21661,VINTAGE GLASS TEA CADDY,3,5.95,16553.0,United Kingdom,2026-01-02
517062,37503,TEA TIME CAKE STAND IN GIFT BOX,2,10.75,16553.0,United Kingdom,2026-01-02
517062,22309,TEA COSY RED  STRIPE,24,2.55,16553.0,United Kingdom,2026-01-02
517062,22348,TEA BAG PLATE RED SPOTTY ,48,0.85,16553.0,United Kingdom,2026-01-02
517062,22358,KINGS CHOICE TEA CADDY ,18,2.95,16553.0,United Kingdom,2026-01-02
517062,22357,KINGS CHOICE BISCUIT TIN,12,3.75,16553.0,United Kingdom,2026-01-02
517062,22308,TEA COSY BLUE STRIPE,24,2.55,16553.0,United Kingdom,2026-01-02
C517063,22491,PACK OF 12 COLOURED PENCILS,-24,0.85,16555.0,United Kingdom,2026-01-02
C517063,22027,TEA PARTY BIRTHDAY CARD,-24,0.42,16555.0,United Kingdom,2026-01-02
C517063,22036,DINOSAUR BIRTHDAY CARD,-48,0.42,16555.0,United Kingdom,2026-01-02
C517063,22029,SPACEBOY BIRTHDAY CARD,-48,0.42,16555.0,United Kingdom,2026-01-02
C517063,20723,STRAWBERRY CHARLOTTE BAG,-20,0.85,16555.0,United Kingdom,2026-01-02
C517063,20724,RED SPOTTY CHARLOTTE BAG,-20,0.85,16555.0,United Kingdom,2026-01-02
C517063,21915,RED  HARMONICA IN BOX ,-48,1.25,16555.0,United Kingdom,2026-01-02
C517063,22035,VINTAGE CARAVAN GREETING CARD ,-48,0.42,16555.0,United Kingdom,2026-01-02
C517063,37503,TEA TIME CAKE STAND IN GIFT BOX,-2,10.75,16555.0,United Kingdom,2026-01-02
C517063,21357,TOAST ITS - DINOSAUR,-48,1.25,16555.0,United Kingdom,2026-01-02
C517063,84375,SET OF 20 KIDS COOKIE CUTTERS,-24,1.95,16555.0,United Kingdom,2026-01-02
C517063,84991,60 TEATIME FAIRY CAKE CASES,-72,0.55,16555.0,United Kingdom,2026-01-02
C517063,21212,PACK OF 72 RETRO SPOT CAKE CASES,-72,0.55,16555.0,United Kingdom,2026-01-02
C517063,21506,"FANCY FONT BIRTHDAY CARD, ",-24,0.42,16555.0,United Kingdom,2026-01-02
C517063,21914,BLUE HARMONICA IN BOX ,-48,1.25,16555.0,United Kingdom,2026-01-02
C517064,22114,HOT WATER BOTTLE TEA AND SYMPATHY,-48,3.45,16555.0,United Kingdom,2026-01-02
C517064,21868,POTTING SHED TEA MUG,-48,1.25,16555.0,United Kingdom,2026-01-02
C517064,22528,GARDENERS KNEELING PAD,-36,1.25,16555.0,United Kingdom,2026-01-02
517066,85217,ASSORTED ICE CREAM FRIDGE MAGNETS,24,0.65,16553.0,United Kingdom,2026-01-02
517066,22329,ROUND CONTAINER SET OF 5 RETROSPOT,12,1.65,16553.0,United Kingdom,2026-01-02
517066,22328,ROUND SNACK BOXES SET OF 4 FRUITS ,24,2.95,16553.0,United Kingdom,2026-01-02
517065,22637,PIGGY BANK RETROSPOT ,6,2.55,17692.0,United Kingdom,2026-01-02
517065,21876,POTTERING MUG,12,1.25,17692.0,United Kingdom,2026-01-02
517065,21358,TOAST ITS - HAPPY BIRTHDAY,12,1.25,17692.0,United Kingdom,2026-01-02
517065,21844,RED RETROSPOT MUG,6,2.95,17692.0,United Kingdom,2026-01-02
517065,22072,RED RETROSPOT TEA CUP AND SAUCER ,4,3.75,17692.0,United Kingdom,2026-01-02
517065,22073,RED RETROSPOT STORAGE JAR,8,3.75,17692.0,United Kingdom,2026-01-02
517065,21231,SWEETHEART CERAMIC TRINKET BOX,12,1.25,17692.0,United Kingdom,2026-01-02
517065,22066,LOVE HEART TRINKET POT,12,1.45,17692.0,United Kingdom,2026-01-02
517065,20972,PINK CREAM FELT CRAFT TRINKET BOX ,12,1.25,17692.0,United Kingdom,2026-01-02
517065,22492,MINI PAINT SET VINTAGE ,36,0.65,17692.0,United Kingdom,2026-01-02
517065,22068,BLACK PIRATE TREASURE CHEST,12,1.65,17692.0,United Kingdom,2026-01-02
517065,22317,FIVE CATS HANGING DECORATION,6,2.95,17692.0,United Kingdom,2026-01-02
517065,21731,RED TOADSTOOL LED NIGHT LIGHT,12,1.65,17692.0,United Kingdom,2026-01-02
517066,20724,RED SPOTTY CHARLOTTE BAG,30,0.85,16553.0,United Kingdom,2026-01-02
517065,22180,RETRO SPOT LAMP,1,9.95,17692.0,United Kingdom,2026-01-02
517066,84270,ASSTD DESIGN BUBBLE GUM RING,90,0.21,16553.0,United Kingdom,2026-01-02
517065,21218,RED SPOTTY BISCUIT TIN,12,3.75,17692.0,United Kingdom,2026-01-02
517066,22489,PACK OF 12 TRADITIONAL CRAYONS,24,0.42,16553.0,United Kingdom,2026-01-02
517065,21535,RED RETROSPOT SMALL MILK JUG,6,2.55,17692.0,United Kingdom,2026-01-02
517066,20723,STRAWBERRY CHARLOTTE BAG,30,0.85,16553.0,United Kingdom,2026-01-02
517066,84016,FLAG OF ST GEORGE CAR FLAG,36,0.42,16553.0,United Kingdom,2026-01-02
517066,22525,CHILDRENS GARDEN GLOVES PINK,12,1.25,16553.0,United Kingdom,2026-01-02
517066,22524,CHILDRENS GARDEN GLOVES BLUE,12,1.25,16553.0,United Kingdom,2026-01-02
517066,22444,GROW YOUR OWN PLANT IN A CAN ,24,1.25,16553.0,United Kingdom,2026-01-02
517066,21788,KIDS RAIN MAC BLUE,24,0.85,16553.0,United Kingdom,2026-01-02
517066,21789,KIDS RAIN MAC PINK,24,0.85,16553.0,United Kingdom,2026-01-02
517066,20914,SET/5 RED SPOTTY LID GLASS BOWLS,6,2.95,16553.0,United Kingdom,2026-01-02
517066,21829,DINOSAUR KEYRINGS ASSORTED,108,0.21,16553.0,United Kingdom,2026-01-02
517066,84077,WORLD WAR 2 GLIDERS ASSTD DESIGNS,192,0.21,16553.0,United Kingdom,2026-01-02
517066,21704,BAG 250g SWIRLY MARBLES,24,0.85,16553.0,United Kingdom,2026-01-02
517066,21790,VINTAGE SNAP CARDS,24,0.85,16553.0,United Kingdom,2026-01-02
517066,21889,WOODEN BOX OF DOMINOES,12,1.25,16553.0,United Kingdom,2026-01-02
517066,22492,MINI PAINT SET VINTAGE ,36,0.65,16553.0,United Kingdom,2026-01-02
517066,15044D,RED PAPER PARASOL,6,2.95,16553.0,United Kingdom,2026-01-02
C517067,22348,TEA BAG PLATE RED SPOTTY ,-48,0.85,16555.0,United Kingdom,2026-01-02
C517067,37500,TEA TIME TEAPOT IN GIFT BOX,-4,9.95,16555.0,United Kingdom,2026-01-02
C517067,22357,KINGS CHOICE BISCUIT TIN,-12,3.75,16555.0,United Kingdom,2026-01-02
C517067,22358,KINGS CHOICE TEA CADDY ,-18,2.95,16555.0,United Kingdom,2026-01-02
C517067,22309,TEA COSY RED  STRIPE,-24,2.55,16555.0,United Kingdom,2026-01-02
C517067,37501,TEA TIME TEA SET IN GIFT BOX,-6,6.95,16555.0,United Kingdom,2026-01-02
C517067,21661,VINTAGE GLASS TEA CADDY,-3,5.95,16555.0,United Kingdom,2026-01-02
C517067,37503,TEA TIME CAKE STAND IN GIFT BOX,-2,10.75,16555.0,United Kingdom,2026-01-02
C517067,84987,SET OF 36 TEATIME PAPER DOILIES,-24,1.45,16555.0,United Kingdom,2026-01-02
C517067,22308,TEA COSY BLUE STRIPE,-24,2.55,16555.0,United Kingdom,2026-01-02
C517068,21829,DINOSAUR KEYRINGS ASSORTED,-108,0.21,16555.0,United Kingdom,2026-01-02
C517068,84016,FLAG OF ST GEORGE CAR FLAG,-36,0.42,16555.0,United Kingdom,2026-01-02
C517068,22525,CHILDRENS GARDEN GLOVES PINK,-12,1.25,16555.0,United Kingdom,2026-01-02
C517068,22524,CHILDRENS GARDEN GLOVES BLUE,-12,1.25,16555.0,United Kingdom,2026-01-02
C517068,22444,GROW YOUR OWN PLANT IN A CAN ,-24,1.25,16555.0,United Kingdom,2026-01-02
C517068,21789,KIDS RAIN MAC PINK,-24,0.85,16555.0,United Kingdom,2026-01-02
C517068,21788,KIDS RAIN MAC BLUE,-24,0.85,16555.0,United Kingdom,2026-01-02
C517068,15044D,RED PAPER PARASOL,-6,2.95,16555.0,United Kingdom,2026-01-02
C517068,20914,SET/5 RED SPOTTY LID GLASS BOWLS,-6,2.95,16555.0,United Kingdom,2026-01-02
C517068,84077,WORLD WAR 2 GLIDERS ASSTD DESIGNS,-192,0.21,16555.0,United Kingdom,2026-01-02
C517068,20724,RED SPOTTY CHARLOTTE BAG,-30,0.85,16555.0,United Kingdom,2026-01-02
C517068,21790,VINTAGE SNAP CARDS,-24,0.85,16555.0,United Kingdom,2026-01-02
C517068,21889,WOODEN BOX OF DOMINOES,-12,1.25,16555.0,United Kingdom,2026-01-02
C517068,22492,MINI PAINT SET VINTAGE ,-36,0.65,16555.0,United Kingdom,2026-01-02
C517068,22489,PACK OF 12 TRADITIONAL CRAYONS,-24,0.42,16555.0,United Kingdom,2026-01-02
C517068,20723,STRAWBERRY CHARLOTTE BAG,-30,0.85,16555.0,United Kingdom,2026-01-02
C517068,84270,ASSTD DESIGN BUBBLE GUM RING,-90,0.21,16555.0,United Kingdom,2026-01-02
C517068,85217,ASSORTED ICE CREAM FRIDGE MAGNETS,-24,0.65,16555.0,United Kingdom,2026-01-02
C517068,22329,ROUND CONTAINER SET OF 5 RETROSPOT,-12,1.65,16555.0,United Kingdom,2026-01-02
C517068,22328,ROUND SNACK BOXES SET OF 4 FRUITS ,-24,2.95,16555.0,United Kingdom,2026-01-02
C517068,21704,BAG 250g SWIRLY MARBLES,-24,0.85,16555.0,United Kingdom,2026-01-02
517069,37503,TEA TIME CAKE STAND IN GIFT BOX,2,10.75,15015.0,United Kingdom,2026-01-02
517069,20726,LUNCH BAG WOODLAND,3,1.65,15015.0,United Kingdom,2026-01-02
517069,22662,LUNCH BAG DOLLY GIRL DESIGN,3,1.65,15015.0,United Kingdom,2026-01-02
517069,22423,REGENCY CAKESTAND 3 TIER,4,12.75,15015.0,United Kingdom,2026-01-02
517069,22382,LUNCH BAG SPACEBOY DESIGN ,3,1.65,15015.0,United Kingdom,2026-01-02
517069,22645,CERAMIC HEART FAIRY CAKE MONEY BANK,4,1.45,15015.0,United Kingdom,2026-01-02
517069,21034,REX CASH+CARRY JUMBO SHOPPER,1,0.95,15015.0,United Kingdom,2026-01-02
517069,21429,RED GINGHAM ROSE JEWELLERY BOX,2,1.65,15015.0,United Kingdom,2026-01-02
517069,22644,CERAMIC CHERRY CAKE MONEY BANK,4,1.45,15015.0,United Kingdom,2026-01-02
517069,22646,CERAMIC STRAWBERRY CAKE MONEY BANK,4,1.45,15015.0,United Kingdom,2026-01-02
517069,84755,COLOUR GLASS T-LIGHT HOLDER HANGING,8,0.65,15015.0,United Kingdom,2026-01-02
517069,21431,GREEN GINGHAM FLOWER JEWELLERY BOX,2,1.65,15015.0,United Kingdom,2026-01-02
517069,20727,LUNCH BAG  BLACK SKULL.,3,1.65,15015.0,United Kingdom,2026-01-02
517069,21724,PANDA AND BUNNIES STICKER SHEET,10,0.85,15015.0,United Kingdom,2026-01-02
517069,21726,MULTI HEARTS  STICKERS,10,0.85,15015.0,United Kingdom,2026-01-02
517069,22383,LUNCH BAG SUKI  DESIGN ,3,1.65,15015.0,United Kingdom,2026-01-02
517069,84992,72 SWEETHEART FAIRY CAKE CASES,3,0.55,15015.0,United Kingdom,2026-01-02
517069,21719,LOVELY BONBON STICKER SHEET,6,0.85,15015.0,United Kingdom,2026-01-02
517069,21542,WOODLAND WATER TRANSFER TATTOOS ,8,0.85,15015.0,United Kingdom,2026-01-02
517069,21725,SWEETIES  STICKERS,10,0.85,15015.0,United Kingdom,2026-01-02
517069,21675,BUTTERFLIES STICKERS,6,0.85,15015.0,United Kingdom,2026-01-02
517069,22417,PACK OF 60 SPACEBOY CAKE CASES,4,0.55,15015.0,United Kingdom,2026-01-02
517069,21975,PACK OF 60 DINOSAUR CAKE CASES,4,0.55,15015.0,United Kingdom,2026-01-02
517069,21976,PACK OF 60 MUSHROOM CAKE CASES,4,0.55,15015.0,United Kingdom,2026-01-02
517069,22563,HAPPY STENCIL CRAFT,4,1.25,15015.0,United Kingdom,2026-01-02
517069,22554,PLASTERS IN TIN WOODLAND ANIMALS,3,1.65,15015.0,United Kingdom,2026-01-02
517069,84378,SET OF 3 HEART COOKIE CUTTERS,3,1.25,15015.0,United Kingdom,2026-01-02
517070,22023,EMPIRE BIRTHDAY CARD,12,0.42,14257.0,United Kingdom,2026-01-02
517070,21448,12 DAISY PEGS IN WOOD BOX,12,1.65,14257.0,United Kingdom,2026-01-02
517070,22147,FELTCRAFT BUTTERFLY HEARTS,12,1.45,14257.0,United Kingdom,2026-01-02
517070,22027,TEA PARTY BIRTHDAY CARD,12,0.42,14257.0,United Kingdom,2026-01-02
517070,21507,"ELEPHANT, BIRTHDAY CARD, ",12,0.42,14257.0,United Kingdom,2026-01-02
517070,22149,FELTCRAFT 6 FLOWER FRIENDS,12,2.1,14257.0,United Kingdom,2026-01-02
517070,21506,"FANCY FONT BIRTHDAY CARD, ",12,0.42,14257.0,United Kingdom,2026-01-02
517070,22273,FELTCRAFT DOLL MOLLY,6,2.95,14257.0,United Kingdom,2026-01-02
517070,22271,FELTCRAFT DOLL ROSIE,6,2.95,14257.0,United Kingdom,2026-01-02
517070,22274,FELTCRAFT DOLL EMILY,6,2.95,14257.0,United Kingdom,2026-01-02
517070,21381,MINI WOODEN HAPPY BIRTHDAY GARLAND,12,1.69,14257.0,United Kingdom,2026-01-02
517070,22150,3 STRIPEY MICE FELTCRAFT,12,1.95,14257.0,United Kingdom,2026-01-02
517070,21509,COWBOYS AND INDIANS BIRTHDAY CARD ,12,0.42,14257.0,United Kingdom,2026-01-02
517070,21121,SET/10 RED SPOTTY PARTY CANDLES,24,1.25,14257.0,United Kingdom,2026-01-02
517070,20717,STRAWBERRY SHOPPER BAG,10,1.25,14257.0,United Kingdom,2026-01-02
517070,47591D,PINK FAIRY CAKE CHILDRENS APRON,8,1.95,14257.0,United Kingdom,2026-01-02
517070,21156,RETROSPOT CHILDRENS APRON,8,1.95,14257.0,United Kingdom,2026-01-02
517070,22087,PAPER BUNTING WHITE LACE,12,2.95,14257.0,United Kingdom,2026-01-02
517070,85042,ANTIQUE LILY FAIRY LIGHTS,16,4.95,14257.0,United Kingdom,2026-01-02
517070,20718,RED SPOTTY SHOPPER BAG,10,1.25,14257.0,United Kingdom,2026-01-02
517070,20723,STRAWBERRY CHARLOTTE BAG,10,0.85,14257.0,United Kingdom,2026-01-02
517070,20724,RED SPOTTY CHARLOTTE BAG,10,0.85,14257.0,United Kingdom,2026-01-02
517070,21527,RED RETROSPOT TRADITIONAL TEAPOT ,2,7.95,14257.0,United Kingdom,2026-01-02
517070,21528,DAIRY MAID TRADITIONAL TEAPOT ,2,6.95,14257.0,United Kingdom,2026-01-02
517070,85047,WHITE BEADED GARLAND STRING 20LIGHT,12,6.35,14257.0,United Kingdom,2026-01-02
517070,22379,RECYCLING BAG RETROSPOT ,10,2.1,14257.0,United Kingdom,2026-01-02
517070,21080,SET/20 RED SPOTTY PAPER NAPKINS ,12,0.85,14257.0,United Kingdom,2026-01-02
517070,20971,PINK BLUE FELT CRAFT TRINKET BOX,12,1.25,14257.0,United Kingdom,2026-01-02
517070,22083,PAPER CHAIN KIT RETRO SPOT,40,2.55,14257.0,United Kingdom,2026-01-02
517074,22605,WOODEN CROQUET GARDEN SET,1,12.75,,United Kingdom,2026-01-02
517074,21906,PHARMACIE FIRST AID TIN,1,6.75,,United Kingdom,2026-01-02
517074,22606,WOODEN SKITTLES GARDEN SET,1,15.95,,United Kingdom,2026-01-02
517074,21240,BLUE  SPOTTY CUP,1,0.85,,United Kingdom,2026-01-02
517074,21061,PARTY INVITES FOOTBALL,1,0.85,,United Kingdom,2026-01-02
517074,21242,RED SPOTTY PLATE ,3,1.69,,United Kingdom,2026-01-02
517074,21244,BLUE  SPOTTY PLATE ,3,1.69,,United Kingdom,2026-01-02
517074,84997C,BLUE 3 PIECE MINI DOTS CUTLERY SET,1,3.75,,United Kingdom,2026-01-02
517074,84997B,RED 3 PIECE MINI DOTS CUTLERY SET,1,3.75,,United Kingdom,2026-01-02
517074,21238,RED SPOTTY CUP,1,0.85,,United Kingdom,2026-01-02
517074,15044A,PINK PAPER PARASOL ,1,2.95,,United Kingdom,2026-01-02
517074,22637,PIGGY BANK RETROSPOT ,1,2.55,,United Kingdom,2026-01-02
517074,22353,LUNCH BOX WITH CUTLERY FAIRY CAKES ,1,2.55,,United Kingdom,2026-01-02
517074,35638B,PINK/BLUE STRING CURTAIN ,1,5.95,,United Kingdom,2026-01-02
517074,22456,NATURAL SLATE CHALKBOARD LARGE ,3,4.95,,United Kingdom,2026-01-02
