Invoice,StockCode,Description,Quantity,Price,Customer ID,Country,InvoiceDate
536226,21034,REX CASH+CARRY JUMBO SHOPPER,2,0.95,14605.0,United Kingdom,2026-04-20
536226,M,Manual,1,0.85,14605.0,United Kingdom,2026-04-20
536226,22649,STRAWBERRY FAIRY CAKE TEAPOT,2,4.95,14605.0,United Kingdom,2026-04-20
536226,21188,3D HEARTS  HONEYCOMB PAPER GARLAND,2,2.95,14605.0,United Kingdom,2026-04-20
536226,84992,72 SWEETHEART FAIRY CAKE CASES,1,0.55,14605.0,United Kingdom,2026-04-20
536226,84991,60 TEATIME FAIRY CAKE CASES,1,0.55,14605.0,United Kingdom,2026-04-20
536226,21246,RED RETROSPOT BIG BOWL,6,4.95,14605.0,United Kingdom,2026-04-20
536226,22278,OVERNIGHT BAG VINTAGE ROSE PAISLEY,2,4.95,14605.0,United Kingdom,2026-04-20
536226,47566,PARTY BUNTING,2,4.65,14605.0,United Kingdom,2026-04-20
536226,21955,DOORMAT UNION JACK GUNS AND ROSES,1,7.95,14605.0,United Kingdom,2026-04-20
536226,16161G,WRAP BAD HAIR DAY,25,0.1,14605.0,United Kingdom,2026-04-20
536226,79164,BLACK WINE GLASS,6,1.65,14605.0,United Kingdom,2026-04-20
536226,84817,DANISH ROSE DECORATIVE PLATE,12,2.1,14605.0,United Kingdom,2026-04-20
536226,21883,STARS GIFT TAPE ,12,0.65,14605.0,United Kingdom,2026-04-20
536226,37340,MULTICOLOUR SPRING FLOWER MUG,6,0.85,14605.0,United Kingdom,2026-04-20
536226,22697,GREEN REGENCY TEACUP AND SAUCER,3,2.95,14605.0,United Kingdom,2026-04-20
C536228,22169,FAMILY ALBUM WHITE PICTURE FRAME,-4,7.65,17342.0,United Kingdom,2026-04-20
C536229,22340,NOEL GARLAND PAINTED ZINC ,-1,1.65,13495.0,United Kingdom,2026-04-20
C536229,21730,GLASS STAR FROSTED T-LIGHT HOLDER,-2,4.95,13495.0,United Kingdom,2026-04-20
C536229,84949,SILVER HANGING T-LIGHT HOLDER,-3,1.65,13495.0,United Kingdom,2026-04-20
C536230,22797,CHEST OF DRAWERS GINGHAM HEART ,-1,16.95,17720.0,United Kingdom,2026-04-20
C536231,72760B,VINTAGE CREAM 3 BASKET CAKE STAND,-1,9.95,14849.0,United Kingdom,2026-04-20
C536232,21642,ASSORTED TUTTI FRUTTI PEN,-24,0.85,12935.0,United Kingdom,2026-04-20
536233,84006,MAGIC TREE -PAPER FLOWERS,5,0.85,15570.0,United Kingdom,2026-04-20
536233,22083,PAPER CHAIN KIT RETROSPOT,2,2.95,15570.0,United Kingdom,2026-04-20
536233,22086,PAPER CHAIN KIT 50'S CHRISTMAS ,2,2.95,15570.0,United Kingdom,2026-04-20
536233,21479,WHITE SKULL HOT WATER BOTTLE ,2,3.75,15570.0,United Kingdom,2026-04-20
536233,21485,RETROSPOT HEART HOT WATER BOTTLE,1,4.95,15570.0,United Kingdom,2026-04-20
536233,22111,SCOTTIE DOG HOT WATER BOTTLE,2,4.95,15570.0,United Kingdom,2026-04-20
536233,84029E,RED WOOLLY HOTTIE WHITE HEART.,1,3.75,15570.0,United Kingdom,2026-04-20
536233,35004C,SET OF 3 COLOURED  FLYING DUCKS,3,5.45,15570.0,United Kingdom,2026-04-20
536233,22867,HAND WARMER BIRD DESIGN,2,2.1,15570.0,United Kingdom,2026-04-20
536233,22349,DOG BOWL CHASING BALL DESIGN,2,3.75,15570.0,United Kingdom,2026-04-20
536233,71459,HANGING JAM JAR T-LIGHT HOLDER,12,0.85,15570.0,United Kingdom,2026-04-20
536233,82482,WOODEN PICTURE FRAME WHITE FINISH,6,2.55,15570.0,United Kingdom,2026-04-20
536233,22727,ALARM CLOCK BAKELIKE RED ,2,3.75,15570.0,United Kingdom,2026-04-20
536233,22726,ALARM CLOCK BAKELIKE GREEN,2,3.75,15570.0,United Kingdom,2026-04-20
536233,22730,ALARM CLOCK BAKELIKE IVORY,2,3.75,15570.0,United Kingdom,2026-04-20
536233,22110,BIRD HOUSE HOT WATER BOTTLE,2,2.55,15570.0,United Kingdom,2026-04-20
536233,22866,HAND WARMER SCOTTY DOG DESIGN,2,2.1,15570.0,United Kingdom,2026-04-20
536233,84347,ROTATING SILVER ANGELS T-LIGHT HLDR,8,2.55,15570.0,United Kingdom,2026-04-20
536233,22865,HAND WARMER OWL DESIGN,2,2.1,15570.0,United Kingdom,2026-04-20
536233,84007,MAGIC GARDEN MOUNT FUJI,1,2.55,15570.0,United Kingdom,2026-04-20
536233,22113,GREY HEART HOT WATER BOTTLE,4,3.75,15570.0,United Kingdom,2026-04-20
536233,22423,REGENCY CAKESTAND 3 TIER,2,12.75,15570.0,United Kingdom,2026-04-20
536233,22865,HAND WARMER OWL DESIGN,1,2.1,15570.0,United Kingdom,2026-04-20
536233,22699,ROSES REGENCY TEACUP AND SAUCER ,4,2.95,15570.0,United Kingdom,2026-04-20
536233,22941,CHRISTMAS LIGHTS 10 REINDEER,3,8.5,15570.0,United Kingdom,2026-04-20
536233,22702,BLACK AND WHITE CAT BOWL,1,2.1,15570.0,United Kingdom,2026-04-20
536233,22703,PINK CAT BOWL,2,2.1,15570.0,United Kingdom,2026-04-20
536233,22632,HAND WARMER RED RETROSPOT,2,2.1,15570.0,United Kingdom,2026-04-20
536233,21481,FAWN BLUE HOT WATER BOTTLE,2,2.95,15570.0,United Kingdom,2026-04-20
536233,21877,HOME SWEET HOME MUG,3,1.25,15570.0,United Kingdom,2026-04-20
536233,21876,POTTERING MUG,3,1.25,15570.0,United Kingdom,2026-04-20
536233,21326,AGED GLASS SILVER T-LIGHT HOLDER,12,0.65,15570.0,United Kingdom,2026-04-20
536233,22697,GREEN REGENCY TEACUP AND SAUCER,1,2.95,15570.0,United Kingdom,2026-04-20
536233,22699,ROSES REGENCY TEACUP AND SAUCER ,1,2.95,15570.0,United Kingdom,2026-04-20
536233,22139,RETROSPOT TEA SET CERAMIC 11 PC ,2,4.95,15570.0,United Kingdom,2026-04-20
536233,84347,ROTATING SILVER ANGELS T-LIGHT HLDR,2,2.55,15570.0,United Kingdom,2026-04-20
C536234,22760,"TRAY, BREAKFAST IN BED",-1,12.75,17422.0,United Kingdom,2026-04-20
C536234,21259,VICTORIAN SEWING BOX SMALL ,-1,5.95,17422.0,United Kingdom,2026-04-20
C536234,90201B,BLACK ENAMEL FLOWER RING,-6,2.95,17422.0,United Kingdom,2026-04-20
C536234,84665,SQUARE CHERRY BLOSSOM CABINET,-2,5.95,17422.0,United Kingdom,2026-04-20
C536234,22487,WHITE WOOD GARDEN PLANT LADDER,-1,9.95,17422.0,United Kingdom,2026-04-20
536235,20653,CHERRY BLOSSOM LUGGAGE TAG,2,1.25,18101.0,United Kingdom,2026-04-20
536235,21011,GLITTER SNOW PEAR TREE DECORATION,6,1.45,18101.0,United Kingdom,2026-04-20
536235,20617,FIRST CLASS PASSPORT COVER ,3,2.1,18101.0,United Kingdom,2026-04-20
536235,21866,UNION JACK FLAG LUGGAGE TAG,4,1.25,18101.0,United Kingdom,2026-04-20
536235,22867,HAND WARMER BIRD DESIGN,2,2.1,18101.0,United Kingdom,2026-04-20
536235,22633,HAND WARMER UNION JACK,2,2.1,18101.0,United Kingdom,2026-04-20
536235,20659,ECONOMY LUGGAGE TAG,3,1.25,18101.0,United Kingdom,2026-04-20
536235,21867,PINK UNION JACK  LUGGAGE TAG,2,1.25,18101.0,United Kingdom,2026-04-20
536235,20669,RED HEART LUGGAGE TAG,2,1.25,18101.0,United Kingdom,2026-04-20
536235,20618,QUEEN OF THE SKIES PASSPORT COVER ,2,2.1,18101.0,United Kingdom,2026-04-20
536235,20655,QUEEN OF SKIES LUGGAGE TAG,2,1.25,18101.0,United Kingdom,2026-04-20
536235,22158,3 HEARTS HANGING DECORATION RUSTIC,5,2.95,18101.0,United Kingdom,2026-04-20
536235,21890,S/6 WOODEN SKITTLES IN COTTON BAG,1,2.95,18101.0,United Kingdom,2026-04-20
536235,21744,SNOWFLAKE PORTABLE TABLE LIGHT ,1,2.95,18101.0,United Kingdom,2026-04-20
536235,21743,STAR PORTABLE TABLE LIGHT ,2,2.95,18101.0,United Kingdom,2026-04-20
536235,84875A,PINK SQUARE COMPACT MIRROR,2,3.75,18101.0,United Kingdom,2026-04-20
536235,84877A,PINK ROUND COMPACT MIRROR,2,3.75,18101.0,United Kingdom,2026-04-20
536235,84876D,BLUE HEART COMPACT MIRROR,2,3.75,18101.0,United Kingdom,2026-04-20
536235,21644,ASSORTED TUTTI FRUTTI HEART BOX,4,1.25,18101.0,United Kingdom,2026-04-20
536235,71270,PHOTO CLIP LINE,2,1.25,18101.0,United Kingdom,2026-04-20
536235,22151,PLACE SETTING WHITE HEART,8,0.42,18101.0,United Kingdom,2026-04-20
536235,22795,SWEETHEART RECIPE BOOK STAND,6,6.75,18101.0,United Kingdom,2026-04-20
536235,21078,SET/20 STRAWBERRY PAPER NAPKINS ,2,0.85,18101.0,United Kingdom,2026-04-20
536235,22575,METAL MERRY CHRISTMAS WREATH,3,1.95,18101.0,United Kingdom,2026-04-20
536235,22619,SET OF 6 SOLDIER SKITTLES,1,3.75,18101.0,United Kingdom,2026-04-20
C536236,22973,CHILDREN'S CIRCUS PARADE MUG,-2,1.45,17017.0,United Kingdom,2026-04-20
C536236,22630,DOLLY GIRL LUNCH BOX,-1,1.65,17017.0,United Kingdom,2026-04-20
C536236,22198,LARGE POPCORN HOLDER ,-1,1.45,17017.0,United Kingdom,2026-04-20
C536237,22791,T-LIGHT GLASS FLUTED ANTIQUE,-2,1.25,16293.0,United Kingdom,2026-04-20
C536237,84946,ANTIQUE SILVER TEA GLASS ETCHED,-2,1.25,16293.0,United Kingdom,2026-04-20
536238,22603,CHRISTMAS RETROSPOT TREE WOOD,6,0.85,14499.0,United Kingdom,2026-04-20
536238,22789,T-LIGHT HOLDER SWEETHEART HANGING,4,1.95,14499.0,United Kingdom,2026-04-20
536238,22576,SWALLOW WOODEN CHRISTMAS DECORATION,6,0.85,14499.0,United Kingdom,2026-04-20
536238,22571,ROCKING HORSE RED CHRISTMAS ,5,0.85,14499.0,United Kingdom,2026-04-20
536238,22910,PAPER CHAIN KIT VINTAGE CHRISTMAS,2,2.95,14499.0,United Kingdom,2026-04-20
536238,21098,CHRISTMAS TOILET ROLL,10,1.25,14499.0,United Kingdom,2026-04-20
536238,22296,HEART IVORY TRELLIS LARGE,3,1.65,14499.0,United Kingdom,2026-04-20
536238,21754,HOME BUILDING BLOCK WORD,1,5.95,14499.0,United Kingdom,2026-04-20
536238,21733,RED HANGING HEART T-LIGHT HOLDER,6,2.95,14499.0,United Kingdom,2026-04-20
536238,85123A,WHITE HANGING HEART T-LIGHT HOLDER,6,2.95,14499.0,United Kingdom,2026-04-20
536238,21731,RED TOADSTOOL LED NIGHT LIGHT,3,1.65,14499.0,United Kingdom,2026-04-20
536238,22694,WICKER STAR ,4,2.1,14499.0,United Kingdom,2026-04-20
536238,22469,HEART OF WICKER SMALL,1,1.65,14499.0,United Kingdom,2026-04-20
536238,20684,STRAWBERRY DREAM CHILDS UMBRELLA,1,3.25,14499.0,United Kingdom,2026-04-20
536238,22086,PAPER CHAIN KIT 50'S CHRISTMAS ,2,2.95,14499.0,United Kingdom,2026-04-20
536238,21802,CHRISTMAS TREE HEART DECORATION,6,0.42,14499.0,United Kingdom,2026-04-20
536238,22632,HAND WARMER RED RETROSPOT,2,2.1,14499.0,United Kingdom,2026-04-20
536238,21807,WHITE CHRISTMAS STAR DECORATION,6,0.42,14499.0,United Kingdom,2026-04-20
536238,22433,WATERING CAN GREEN DINOSAUR,1,1.95,14499.0,United Kingdom,2026-04-20
536238,22602,CHRISTMAS RETROSPOT HEART WOOD,2,0.85,14499.0,United Kingdom,2026-04-20
536238,22603,CHRISTMAS RETROSPOT TREE WOOD,2,0.85,14499.0,United Kingdom,2026-04-20
536238,22601,CHRISTMAS RETROSPOT ANGEL WOOD,2,0.85,14499.0,United Kingdom,2026-04-20
536238,22600,CHRISTMAS RETROSPOT STAR WOOD,2,0.85,14499.0,United Kingdom,2026-04-20
536238,22573,STAR WOODEN CHRISTMAS DECORATION,2,0.85,14499.0,United Kingdom,2026-04-20
536238,22576,SWALLOW WOODEN CHRISTMAS DECORATION,2,0.85,14499.0,United Kingdom,2026-04-20
536238,21801,CHRISTMAS TREE DECORATION WITH BELL,8,0.42,14499.0,United Kingdom,2026-04-20
536238,21821,GLITTER STAR GARLAND WITH BELLS ,1,3.75,14499.0,United Kingdom,2026-04-20
536238,82482,WOODEN PICTURE FRAME WHITE FINISH,6,2.55,14499.0,United Kingdom,2026-04-20
536238,21754,HOME BUILDING BLOCK WORD,1,5.95,14499.0,United Kingdom,2026-04-20
536238,21755,LOVE BUILDING BLOCK WORD,4,5.95,14499.0,United Kingdom,2026-04-20
536238,82582,AREA PATROLLED METAL SIGN,8,2.1,14499.0,United Kingdom,2026-04-20
536238,21809,CHRISTMAS HANGING TREE WITH BELL,6,1.25,14499.0,United Kingdom,2026-04-20
536238,22572,ROCKING HORSE GREEN CHRISTMAS ,2,0.85,14499.0,United Kingdom,2026-04-20
536239,22908,PACK OF 20 NAPKINS RED APPLES,12,0.85,12471.0,Germany,2026-04-20
536239,20719,WOODLAND CHARLOTTE BAG,10,0.85,12471.0,Germany,2026-04-20
536239,20914,SET/5 RED RETROSPOT LID GLASS BOWLS,18,2.95,12471.0,Germany,2026-04-20
536239,21210,SET OF 72 RETROSPOT PAPER  DOILIES,12,1.45,12471.0,Germany,2026-04-20
536239,21080,SET/20 RED RETROSPOT PAPER NAPKINS ,12,0.85,12471.0,Germany,2026-04-20
536239,21787,RAIN PONCHO RETROSPOT,24,0.85,12471.0,Germany,2026-04-20
536239,22812,PACK 3 BOXES CHRISTMAS PANNETONE,12,1.95,12471.0,Germany,2026-04-20
536239,22423,REGENCY CAKESTAND 3 TIER,16,10.95,12471.0,Germany,2026-04-20
536239,22585,PACK OF 6 BIRDY GIFT TAGS,12,1.25,12471.0,Germany,2026-04-20
536239,22820,GIFT BAG BIRTHDAY,12,0.65,12471.0,Germany,2026-04-20
536239,22467,GUMBALL COAT RACK,36,2.1,12471.0,Germany,2026-04-20
536239,POST,POSTAGE,14,18.0,12471.0,Germany,2026-04-20
536239,21231,SWEETHEART CERAMIC TRINKET BOX,12,1.25,12471.0,Germany,2026-04-20
536239,22472,TV DINNER TRAY DOLLY GIRL,6,4.95,12471.0,Germany,2026-04-20
536239,21232,STRAWBERRY CERAMIC TRINKET BOX,24,1.25,12471.0,Germany,2026-04-20
536239,22333,RETROSPOT PARTY BAG + STICKER SET,8,1.65,12471.0,Germany,2026-04-20
536239,22200,FRYING PAN PINK POLKADOT,4,4.25,12471.0,Germany,2026-04-20
536239,22077,6 RIBBONS RUSTIC CHARM,12,1.65,12471.0,Germany,2026-04-20
536239,21731,RED TOADSTOOL LED NIGHT LIGHT,12,1.65,12471.0,Germany,2026-04-20
536239,21700,BIG DOUGHNUT FRIDGE MAGNETS,36,0.85,12471.0,Germany,2026-04-20
536239,21578,WOODLAND DESIGN  COTTON TOTE BAG,12,2.25,12471.0,Germany,2026-04-20
536239,21577,SAVE THE PLANET COTTON TOTE BAG,12,2.25,12471.0,Germany,2026-04-20
536239,84988,SET OF 72 PINK HEART PAPER DOILIES,12,1.45,12471.0,Germany,2026-04-20
536239,22326,ROUND SNACK BOXES SET OF4 WOODLAND ,6,2.95,12471.0,Germany,2026-04-20
536239,22741,FUNKY DIVA PEN,48,0.85,12471.0,Germany,2026-04-20
536239,22728,ALARM CLOCK BAKELIKE PINK,8,3.75,12471.0,Germany,2026-04-20
536239,22419,LIPSTICK PEN RED,100,0.36,12471.0,Germany,2026-04-20
536239,22752,SET 7 BABUSHKA NESTING BOXES,6,8.5,12471.0,Germany,2026-04-20
536239,22759,SET OF 3 NOTEBOOKS IN PARCEL,12,1.65,12471.0,Germany,2026-04-20
536239,22813,PACK 3 BOXES BIRD PANNETONE ,12,1.95,12471.0,Germany,2026-04-20
536240,22966,GINGERBREAD MAN COOKIE CUTTER,12,1.25,12471.0,Germany,2026-04-20
536240,22964,3 PIECE SPACEBOY COOKIE CUTTER SET,6,2.1,12471.0,Germany,2026-04-20
536240,22962,JAM JAR WITH PINK LID,24,0.85,12471.0,Germany,2026-04-20
536240,22961,JAM MAKING SET PRINTED,24,1.45,12471.0,Germany,2026-04-20
536240,22923,FRIDGE MAGNETS LES ENFANTS ASSORTED,12,0.85,12471.0,Germany,2026-04-20
536240,22913,RED COAT RACK PARIS FASHION,9,4.95,12471.0,Germany,2026-04-20
536240,22969,HOMEMADE JAM SCENTED CANDLES,12,1.45,12471.0,Germany,2026-04-20
536241,22333,RETROSPOT PARTY BAG + STICKER SET,8,1.65,12471.0,Germany,2026-04-20
536241,22326,ROUND SNACK BOXES SET OF4 WOODLAND ,6,2.95,12471.0,Germany,2026-04-20
536241,22472,TV DINNER TRAY DOLLY GIRL,6,4.95,12471.0,Germany,2026-04-20
536241,22585,PACK OF 6 BIRDY GIFT TAGS,12,1.25,12471.0,Germany,2026-04-20
536241,22554,PLASTERS IN TIN WOODLAND ANIMALS,12,1.65,12471.0,Germany,2026-04-20
536241,22555,PLASTERS IN TIN STRONGMAN,12,1.65,12471.0,Germany,2026-04-20
536241,22556,PLASTERS IN TIN CIRCUS PARADE ,12,1.65,12471.0,Germany,2026-04-20
536241,22646,CERAMIC STRAWBERRY CAKE MONEY BANK,24,1.45,12471.0,Germany,2026-04-20
536241,22644,CERAMIC CHERRY CAKE MONEY BANK,12,1.45,12471.0,Germany,2026-04-20
536241,22549,PICTURE DOMINOES,12,1.45,12471.0,Germany,2026-04-20
536241,22812,PACK 3 BOXES CHRISTMAS PANNETONE,24,1.95,12471.0,Germany,2026-04-20
536241,22908,PACK OF 20 NAPKINS RED APPLES,12,0.85,12471.0,Germany,2026-04-20
536241,22907,PACK OF 20 NAPKINS PANTRY DESIGN,12,0.85,12471.0,Germany,2026-04-20
536241,22813,PACK 3 BOXES BIRD PANNETONE ,24,1.95,12471.0,Germany,2026-04-20
536241,22200,FRYING PAN PINK POLKADOT,4,4.25,12471.0,Germany,2026-04-20
536241,22625,RED KITCHEN SCALES,4,8.5,12471.0,Germany,2026-04-20
536241,22077,6 RIBBONS RUSTIC CHARM,12,1.65,12471.0,Germany,2026-04-20
536241,21212,PACK OF 72 RETROSPOT CAKE CASES,24,0.55,12471.0,Germany,2026-04-20
536241,21976,PACK OF 60 MUSHROOM CAKE CASES,24,0.55,12471.0,Germany,2026-04-20
536241,22759,SET OF 3 NOTEBOOKS IN PARCEL,12,1.65,12471.0,Germany,2026-04-20
536241,22752,SET 7 BABUSHKA NESTING BOXES,6,8.5,12471.0,Germany,2026-04-20
536241,22654,DELUXE SEWING KIT ,3,5.95,12471.0,Germany,2026-04-20
536241,22419,LIPSTICK PEN RED,100,0.36,12471.0,Germany,2026-04-20
536241,22728,ALARM CLOCK BAKELIKE PINK,12,3.75,12471.0,Germany,2026-04-20
536241,22741,FUNKY DIVA PEN,48,0.85,12471.0,Germany,2026-04-20
536241,22745,POPPY'S PLAYHOUSE BEDROOM ,12,2.1,12471.0,Germany,2026-04-20
536241,22747,POPPY'S PLAYHOUSE BATHROOM,6,2.1,12471.0,Germany,2026-04-20
536241,22748,POPPY'S PLAYHOUSE KITCHEN,12,2.1,12471.0,Germany,2026-04-20
536241,84988,SET OF 72 PINK HEART PAPER DOILIES,12,1.45,12471.0,Germany,2026-04-20
536241,21731,RED TOADSTOOL LED NIGHT LIGHT,12,1.65,12471.0,Germany,2026-04-20
536241,21577,SAVE THE PLANET COTTON TOTE BAG,18,2.25,12471.0,Germany,2026-04-20
536241,21578,WOODLAND DESIGN  COTTON TOTE BAG,12,2.25,12471.0,Germany,2026-04-20
536241,21700,BIG DOUGHNUT FRIDGE MAGNETS,36,0.85,12471.0,Germany,2026-04-20
536241,22746,POPPY'S PLAYHOUSE LIVINGROOM ,12,2.1,12471.0,Germany,2026-04-20
C536242,79191B,RETRO PLASTIC POLKA TRAY,-2,0.85,12705.0,Germany,2026-04-20
C536242,21653,GLASS ETCHED T-LIGHT HOLDER LARGE,-1,2.1,12705.0,Germany,2026-04-20
C536242,22202,MILK PAN PINK POLKADOT,-3,3.75,12705.0,Germany,2026-04-20
C536242,79191C,RETRO PLASTIC ELEPHANT TRAY,-12,0.85,12705.0,Germany,2026-04-20
C536242,85232B,SET OF 3 BABUSHKA STACKING TINS,-3,4.95,12705.0,Germany,2026-04-20
C536242,21875,KINGS CHOICE MUG,-2,1.25,12705.0,Germany,2026-04-20
C536242,22358,KINGS CHOICE TEA CADDY ,-2,2.95,12705.0,Germany,2026-04-20
C536242,22357,KINGS CHOICE BISCUIT TIN,-4,4.25,12705.0,Germany,2026-04-20
C536242,22556,PLASTERS IN TIN CIRCUS PARADE ,-12,1.65,12705.0,Germany,2026-04-20
536243,22585,PACK OF 6 BIRDY GIFT TAGS,12,1.25,15358.0,United Kingdom,2026-04-20
536243,22045,SPACEBOY GIFT WRAP,25,0.42,15358.0,United Kingdom,2026-04-20
536243,22024,RAINY LADIES BIRTHDAY CARD,12,0.42,15358.0,United Kingdom,2026-04-20
536243,21504,SKULLS GREETING CARD,12,0.42,15358.0,United Kingdom,2026-04-20
536243,22030,SWALLOWS GREETING CARD,12,0.42,15358.0,United Kingdom,2026-04-20
536243,21508,VINTAGE KID DOLLY CARD ,12,0.42,15358.0,United Kingdom,2026-04-20
536243,22584,PACK OF 6 PANNETONE GIFT BOXES,6,2.55,15358.0,United Kingdom,2026-04-20
536243,22743,MAKE YOUR OWN FLOWERPOWER CARD KIT,6,2.95,15358.0,United Kingdom,2026-04-20
536243,22812,PACK 3 BOXES CHRISTMAS PANNETONE,12,1.95,15358.0,United Kingdom,2026-04-20
536243,21975,PACK OF 60 DINOSAUR CAKE CASES,24,0.55,15358.0,United Kingdom,2026-04-20
536243,22745,POPPY'S PLAYHOUSE BEDROOM ,6,2.1,15358.0,United Kingdom,2026-04-20
536243,22077,6 RIBBONS RUSTIC CHARM,12,1.65,15358.0,United Kingdom,2026-04-20
536243,85176,SEWING SUSAN 21 NEEDLE SET,12,0.85,15358.0,United Kingdom,2026-04-20
536243,21544,SKULLS  WATER TRANSFER TATTOOS ,12,0.85,15358.0,United Kingdom,2026-04-20
536243,84375,SET OF 20 KIDS COOKIE CUTTERS,12,2.1,15358.0,United Kingdom,2026-04-20
536243,84536A,ENGLISH ROSE NOTEBOOK A7 SIZE,16,0.42,15358.0,United Kingdom,2026-04-20
536243,20970,PINK FLORAL FELTCRAFT SHOULDER BAG,8,3.75,15358.0,United Kingdom,2026-04-20
536243,20969,RED FLORAL FELTCRAFT SHOULDER BAG,8,3.75,15358.0,United Kingdom,2026-04-20
536243,22568,FELTCRAFT CUSHION OWL,8,3.75,15358.0,United Kingdom,2026-04-20
536243,22570,FELTCRAFT CUSHION RABBIT,4,3.75,15358.0,United Kingdom,2026-04-20
536243,22196,SMALL HEART MEASURING SPOONS,12,0.85,15358.0,United Kingdom,2026-04-20
C536244,22843,BISCUIT TIN VINTAGE GREEN,-1,6.75,13534.0,United Kingdom,2026-04-20
C536244,85099B,JUMBO BAG RED RETROSPOT,-1,1.95,13534.0,United Kingdom,2026-04-20
536245,22558,CLOTHES PEGS RETROSPOT PACK 24 ,12,1.49,15358.0,United Kingdom,2026-04-20
536246,22961,JAM MAKING SET PRINTED,12,1.45,15358.0,United Kingdom,2026-04-20
536246,22963,JAM JAR WITH GREEN LID,12,0.85,15358.0,United Kingdom,2026-04-20
536246,22962,JAM JAR WITH PINK LID,12,0.85,15358.0,United Kingdom,2026-04-20
536247,84946,ANTIQUE SILVER TEA GLASS ETCHED,36,1.25,13199.0,United Kingdom,2026-04-20
536247,84945,MULTI COLOUR SILVER T-LIGHT HOLDER,384,0.72,13199.0,United Kingdom,2026-04-20
536247,84947,ANTIQUE SILVER TEA GLASS ENGRAVED,48,1.25,13199.0,United Kingdom,2026-04-20
536247,79321,CHILLI LIGHTS,4,4.95,13199.0,United Kingdom,2026-04-20
536247,21463,MIRRORED DISCO BALL ,4,5.95,13199.0,United Kingdom,2026-04-20
536247,21464,DISCO BALL ROTATOR BATTERY OPERATED,4,4.25,13199.0,United Kingdom,2026-04-20
536248,22923,FRIDGE MAGNETS LES ENFANTS ASSORTED,12,0.85,12609.0,Germany,2026-04-20
536248,22922,FRIDGE MAGNETS US DINER ASSORTED,12,0.85,12609.0,Germany,2026-04-20
536248,21524,DOORMAT SPOTTY HOME SWEET HOME,2,7.95,12609.0,Germany,2026-04-20
536248,21260,FIRST AID TIN,6,3.25,12609.0,Germany,2026-04-20
536248,22328,ROUND SNACK BOXES SET OF 4 FRUITS ,6,2.95,12609.0,Germany,2026-04-20
536248,22892,SET OF SALT AND PEPPER TOADSTOOLS,12,1.25,12609.0,Germany,2026-04-20
536248,22924,FRIDGE MAGNETS LA VIE EN ROSE,12,0.85,12609.0,Germany,2026-04-20
536248,20728,LUNCH BAG CARS BLUE,10,1.65,12609.0,Germany,2026-04-20
536248,21756,BATH BUILDING BLOCK WORD,3,5.95,12609.0,Germany,2026-04-20
536248,22398,MAGNETS PACK OF 4 SWALLOWS,12,1.25,12609.0,Germany,2026-04-20
536248,22199,FRYING PAN RED RETROSPOT,4,4.25,12609.0,Germany,2026-04-20
536248,22427,ENAMEL FLOWER JUG CREAM,3,5.95,12609.0,Germany,2026-04-20
536248,22625,RED KITCHEN SCALES,2,8.5,12609.0,Germany,2026-04-20
536248,22968,ROSE COTTAGE KEEPSAKE BOX ,4,9.95,12609.0,Germany,2026-04-20
536248,22203,MILK PAN RED RETROSPOT,4,3.75,12609.0,Germany,2026-04-20
536248,21042,RED RETROSPOT APRON ,3,5.95,12609.0,Germany,2026-04-20
536248,20914,SET/5 RED RETROSPOT LID GLASS BOWLS,6,2.95,12609.0,Germany,2026-04-20
536248,22367,CHILDRENS APRON SPACEBOY DESIGN,8,1.95,12609.0,Germany,2026-04-20
536248,21576,LETS GO SHOPPING COTTON TOTE BAG,6,2.25,12609.0,Germany,2026-04-20
536248,21580,RABBIT  DESIGN  COTTON TOTE BAG,6,2.25,12609.0,Germany,2026-04-20
536248,POST,POSTAGE,3,18.0,12609.0,Germany,2026-04-20
536248,22399,MAGNETS PACK OF 4 CHILDHOOD MEMORY,12,1.25,12609.0,Germany,2026-04-20
536248,22080,RIBBON REEL POLKADOTS ,10,1.65,12609.0,Germany,2026-04-20
536248,22326,ROUND SNACK BOXES SET OF4 WOODLAND ,6,2.95,12609.0,Germany,2026-04-20
536249,22652,TRAVEL SEWING KIT,10,1.65,14092.0,United Kingdom,2026-04-20
536249,22988,SOLDIERS EGG CUP ,12,1.25,14092.0,United Kingdom,2026-04-20
536249,22960,JAM MAKING SET WITH JARS,6,4.25,14092.0,United Kingdom,2026-04-20
536249,22963,JAM JAR WITH GREEN LID,12,0.85,14092.0,United Kingdom,2026-04-20
536248,22079,RIBBON REEL HEARTS DESIGN ,10,1.65,12609.0,Germany,2026-04-20
536249,22891,TEA FOR ONE POLKADOT,3,4.25,14092.0,United Kingdom,2026-04-20
536249,22768,FAMILY PHOTO FRAME CORNICE,2,9.95,14092.0,United Kingdom,2026-04-20
536249,21706,FOLDING UMBRELLA RED/WHITE POLKADOT,6,4.95,14092.0,United Kingdom,2026-04-20
536249,21708,FOLDING UMBRELLA CREAM POLKADOT,6,4.95,14092.0,United Kingdom,2026-04-20
536249,21754,HOME BUILDING BLOCK WORD,4,5.95,14092.0,United Kingdom,2026-04-20
536249,84347,ROTATING SILVER ANGELS T-LIGHT HLDR,24,2.55,14092.0,United Kingdom,2026-04-20
536249,21723,ALPHABET HEARTS STICKER SHEET,12,0.85,14092.0,United Kingdom,2026-04-20
536249,22328,ROUND SNACK BOXES SET OF 4 FRUITS ,6,2.95,14092.0,United Kingdom,2026-04-20
536249,16237,SLEEPING CAT ERASERS,30,0.21,14092.0,United Kingdom,2026-04-20
536249,21720,CAKE SHOP  STICKER SHEET,12,0.85,14092.0,United Kingdom,2026-04-20
536249,21523,DOORMAT FANCY FONT HOME SWEET HOME,2,7.95,14092.0,United Kingdom,2026-04-20
536249,22726,ALARM CLOCK BAKELIKE GREEN,4,3.75,14092.0,United Kingdom,2026-04-20
536249,84375,SET OF 20 KIDS COOKIE CUTTERS,12,2.1,14092.0,United Kingdom,2026-04-20
536249,22131,FOOD CONTAINER SET 3 LOVE HEART ,6,1.95,14092.0,United Kingdom,2026-04-20
536249,22379,RECYCLING BAG RETROSPOT ,5,2.1,14092.0,United Kingdom,2026-04-20
536249,85014B,RED RETROSPOT UMBRELLA,3,5.95,14092.0,United Kingdom,2026-04-20
536249,22114,HOT WATER BOTTLE TEA AND SYMPATHY,4,3.95,14092.0,United Kingdom,2026-04-20
536249,22904,CALENDAR PAPER CUT DESIGN,12,2.95,14092.0,United Kingdom,2026-04-20
536249,20914,SET/5 RED RETROSPOT LID GLASS BOWLS,6,2.95,14092.0,United Kingdom,2026-04-20
536251,82583,HOT BATHS METAL SIGN,12,2.1,15856.0,United Kingdom,2026-04-20
536251,21181,PLEASE ONE PERSON METAL SIGN,12,2.1,15856.0,United Kingdom,2026-04-20
536251,85152,HAND OVER THE CHOCOLATE   SIGN ,12,2.1,15856.0,United Kingdom,2026-04-20
536251,22295,HEART FILIGREE DOVE LARGE,24,1.65,15856.0,United Kingdom,2026-04-20
536251,21166,COOK WITH WINE METAL SIGN ,12,1.95,15856.0,United Kingdom,2026-04-20
536251,21034,REX CASH+CARRY JUMBO SHOPPER,1,0.95,15856.0,United Kingdom,2026-04-20
536251,21908,CHOCOLATE THIS WAY METAL SIGN,12,2.1,15856.0,United Kingdom,2026-04-20
536251,21836,GINGHAM OVEN GLOVE RED HEART ,2,3.75,15856.0,United Kingdom,2026-04-20
536251,21156,RETROSPOT CHILDRENS APRON,1,1.95,15856.0,United Kingdom,2026-04-20
536251,22412,METAL SIGN NEIGHBOURHOOD WITCH ,8,2.1,15856.0,United Kingdom,2026-04-20
536251,22296,HEART IVORY TRELLIS LARGE,36,1.65,15856.0,United Kingdom,2026-04-20
536251,22157,ANGEL DECORATION WITH LACE PADDED,48,0.85,15856.0,United Kingdom,2026-04-20
536251,51014C,"FEATHER PEN,COAL BLACK",12,0.85,15856.0,United Kingdom,2026-04-20
536251,21165,BEWARE OF THE CAT METAL SIGN ,4,1.69,15856.0,United Kingdom,2026-04-20
536251,82600,NO SINGING METAL SIGN,12,2.1,15856.0,United Kingdom,2026-04-20
536251,21175,GIN + TONIC DIET METAL SIGN,12,2.1,15856.0,United Kingdom,2026-04-20
536251,37448,CERAMIC CAKE DESIGN SPOTTED MUG,1,1.49,15856.0,United Kingdom,2026-04-20
536251,85123A,WHITE HANGING HEART T-LIGHT HOLDER,128,2.55,15856.0,United Kingdom,2026-04-20
536251,21232,STRAWBERRY CERAMIC TRINKET BOX,4,1.25,15856.0,United Kingdom,2026-04-20
536251,22295,HEART FILIGREE DOVE LARGE,12,1.65,15856.0,United Kingdom,2026-04-20
536251,21733,RED HANGING HEART T-LIGHT HOLDER,32,2.55,15856.0,United Kingdom,2026-04-20
536251,22804,CANDLEHOLDER PINK HANGING HEART,32,2.55,15856.0,United Kingdom,2026-04-20
536251,22067,CHOC TRUFFLE GOLD TRINKET POT ,2,1.65,15856.0,United Kingdom,2026-04-20
536251,22645,CERAMIC HEART FAIRY CAKE MONEY BANK,4,1.45,15856.0,United Kingdom,2026-04-20
536251,22644,CERAMIC CHERRY CAKE MONEY BANK,4,1.45,15856.0,United Kingdom,2026-04-20
536251,21231,SWEETHEART CERAMIC TRINKET BOX,4,1.25,15856.0,United Kingdom,2026-04-20
C536250,71477,COLOUR GLASS. STAR T-LIGHT HOLDER,-1,2.75,14907.0,United Kingdom,2026-04-20
536251,22646,CERAMIC STRAWBERRY CAKE MONEY BANK,8,1.45,15856.0,United Kingdom,2026-04-20
536251,21232,STRAWBERRY CERAMIC TRINKET BOX,4,1.25,15856.0,United Kingdom,2026-04-20
536251,37448,CERAMIC CAKE DESIGN SPOTTED MUG,1,1.49,15856.0,United Kingdom,2026-04-20
536251,22064,PINK DOUGHNUT TRINKET POT ,8,1.65,15856.0,United Kingdom,2026-04-20
536251,22059,CERAMIC STRAWBERRY DESIGN MUG,2,1.49,15856.0,United Kingdom,2026-04-20
536251,21231,SWEETHEART CERAMIC TRINKET BOX,4,1.25,15856.0,United Kingdom,2026-04-20
536251,22645,CERAMIC HEART FAIRY CAKE MONEY BANK,4,1.45,15856.0,United Kingdom,2026-04-20
