Invoice,StockCode,Description,Quantity,Price,Customer ID,Country,InvoiceDate
519687,22326,ROUND SNACK BOXES SET OF4 WOODLAND ,6,2.95,14112.0,United Kingdom,2026-01-23
519687,22040,BOTANICAL ROSE GIFT WRAP,25,0.42,14112.0,United Kingdom,2026-01-23
519687,22328,ROUND SNACK BOXES SET OF 4 FRUITS ,6,2.95,14112.0,United Kingdom,2026-01-23
519687,21930,JUMBO STORAGE BAG SKULLS,20,1.95,14112.0,United Kingdom,2026-01-23
519686,22413,METAL SIGN TAKE IT OR LEAVE IT ,1,2.95,18283.0,United Kingdom,2026-01-23
519686,22646,CERAMIC STRAWBERRY CAKE MONEY BANK,1,1.45,18283.0,United Kingdom,2026-01-23
519686,22367,CHILDRENS APRON SPACEBOY DESIGN,1,1.95,18283.0,United Kingdom,2026-01-23
519687,22637,PIGGY BANK RETROSPOT ,6,2.55,14112.0,United Kingdom,2026-01-23
519686,71459,HANGING JAM JAR T-LIGHT HOLDER,6,0.85,18283.0,United Kingdom,2026-01-23
519686,22061,LARGE CAKE STAND  HANGING STRAWBERY,1,9.95,18283.0,United Kingdom,2026-01-23
519686,22617,BAKING SET SPACEBOY DESIGN,1,4.95,18283.0,United Kingdom,2026-01-23
519686,22618,COOKING SET RETROSPOT,1,9.95,18283.0,United Kingdom,2026-01-23
519686,21231,SWEETHEART CERAMIC TRINKET BOX,1,1.25,18283.0,United Kingdom,2026-01-23
519686,21232,STRAWBERRY CERAMIC TRINKET BOX,1,1.25,18283.0,United Kingdom,2026-01-23
519686,22645,CERAMIC HEART FAIRY CAKE MONEY BANK,1,1.45,18283.0,United Kingdom,2026-01-23
519686,22647,CERAMIC LOVE HEART MONEY BANK,1,1.45,18283.0,United Kingdom,2026-01-23
519686,21175,GIN + TONIC DIET METAL SIGN,1,2.1,18283.0,United Kingdom,2026-01-23
519686,21827,EIGHT PIECE CREEPY CRAWLIE SET,1,1.25,18283.0,United Kingdom,2026-01-23
519686,21828,EIGHT PIECE SNAKE  SET,1,1.25,18283.0,United Kingdom,2026-01-23
519686,22198,LARGE POPCORN HOLDER ,1,1.65,18283.0,United Kingdom,2026-01-23
519686,21559,STRAWBERRY LUNCH BOX WITH CUTLERY,1,2.55,18283.0,United Kingdom,2026-01-23
519686,22629,SPACEBOY LUNCH BOX ,1,1.95,18283.0,United Kingdom,2026-01-23
519686,22329,ROUND CONTAINER SET OF 5 RETROSPOT,1,1.65,18283.0,United Kingdom,2026-01-23
519686,20971,PINK BLUE FELT CRAFT TRINKET BOX,1,1.25,18283.0,United Kingdom,2026-01-23
519686,22742,MAKE YOUR OWN PLAYTIME CARD KIT,1,2.95,18283.0,United Kingdom,2026-01-23
519686,22743,MAKE YOUR OWN FLOWERPOWER CARD KIT,1,2.95,18283.0,United Kingdom,2026-01-23
519686,22744,MAKE YOUR OWN MONSOON CARD KIT,1,2.95,18283.0,United Kingdom,2026-01-23
519686,21826,EIGHT PIECE DINOSAUR SET,1,1.25,18283.0,United Kingdom,2026-01-23
519687,20727,LUNCH BAG  BLACK SKULL.,30,1.65,14112.0,United Kingdom,2026-01-23
519687,16237,SLEEPING CAT ERASERS,30,0.21,14112.0,United Kingdom,2026-01-23
519687,21934,SKULL SHOULDER BAG,10,1.65,14112.0,United Kingdom,2026-01-23
519686,22383,LUNCH BAG SUKI  DESIGN ,1,1.65,18283.0,United Kingdom,2026-01-23
519686,20728,LUNCH BAG CARS BLUE,1,1.65,18283.0,United Kingdom,2026-01-23
519686,22385,JUMBO BAG SPACEBOY DESIGN,1,1.95,18283.0,United Kingdom,2026-01-23
519686,22551,PLASTERS IN TIN SPACEBOY,1,1.65,18283.0,United Kingdom,2026-01-23
519686,22554,PLASTERS IN TIN WOODLAND ANIMALS,1,1.65,18283.0,United Kingdom,2026-01-23
519686,22553,PLASTERS IN TIN SKULLS,1,1.65,18283.0,United Kingdom,2026-01-23
519686,22417,PACK OF 60 SPACEBOY CAKE CASES,1,0.55,18283.0,United Kingdom,2026-01-23
519686,22759,SET OF 3 NOTEBOOKS IN PARCEL,1,1.65,18283.0,United Kingdom,2026-01-23
519687,20728,LUNCH BAG CARS BLUE,30,1.65,14112.0,United Kingdom,2026-01-23
519687,21238,RED SPOTTY CUP,8,0.85,14112.0,United Kingdom,2026-01-23
519687,21242,RED SPOTTY PLATE ,8,1.69,14112.0,United Kingdom,2026-01-23
519687,20676,RED SPOTTY BOWL,8,1.25,14112.0,United Kingdom,2026-01-23
519687,21241,GREEN SPOTTY CUP,8,0.85,14112.0,United Kingdom,2026-01-23
519687,22175,PINK OWL SOFT TOY,6,2.95,14112.0,United Kingdom,2026-01-23
519687,22176,BLUE OWL SOFT TOY,6,2.95,14112.0,United Kingdom,2026-01-23
519687,21429,RED GINGHAM ROSE JEWELLERY BOX,8,1.65,14112.0,United Kingdom,2026-01-23
519687,21430,SET/3 RED GINGHAM ROSE STORAGE BOX,4,3.75,14112.0,United Kingdom,2026-01-23
C519685,21714,CITRONELLA CANDLE GARDEN POT,-1,1.25,14521.0,United Kingdom,2026-01-23
519687,21452,TOADSTOOL MONEY BOX,6,2.95,14112.0,United Kingdom,2026-01-23
519686,20717,STRAWBERRY SHOPPER BAG,1,1.25,18283.0,United Kingdom,2026-01-23
519686,20723,STRAWBERRY CHARLOTTE BAG,1,0.85,18283.0,United Kingdom,2026-01-23
519687,22383,LUNCH BAG SUKI  DESIGN ,30,1.65,14112.0,United Kingdom,2026-01-23
519686,21033,JUMBO BAG CHARLIE AND LOLA TOYS,1,2.95,18283.0,United Kingdom,2026-01-23
519687,22505,MEMO BOARD COTTAGE DESIGN,4,4.95,14112.0,United Kingdom,2026-01-23
519686,20718,RED SPOTTY SHOPPER BAG,1,1.25,18283.0,United Kingdom,2026-01-23
519687,21935,SUKI  SHOULDER BAG,10,1.65,14112.0,United Kingdom,2026-01-23
519687,21581,SKULLS  DESIGN  COTTON TOTE BAG,6,2.25,14112.0,United Kingdom,2026-01-23
519687,21411,GINGHAM HEART  DOORSTOP RED,3,4.25,14112.0,United Kingdom,2026-01-23
519687,21116,OWL DOORSTOP,3,4.95,14112.0,United Kingdom,2026-01-23
519687,21407,BROWN CHECK CAT DOORSTOP ,3,4.25,14112.0,United Kingdom,2026-01-23
519687,21495,SKULLS AND CROSSBONES WRAP,25,0.42,14112.0,United Kingdom,2026-01-23
519687,22436,12 COLOURED PARTY BALLOONS,20,0.65,14112.0,United Kingdom,2026-01-23
519687,22437,SET OF 9 BLACK SKULL BALLOONS,20,0.85,14112.0,United Kingdom,2026-01-23
519687,22584,PACK OF 6 PANNETONE GIFT BOXES,6,2.55,14112.0,United Kingdom,2026-01-23
519686,20725,LUNCH BAG RED SPOTTY,2,1.65,18283.0,United Kingdom,2026-01-23
519687,22139,RETRO SPOT TEA SET CERAMIC 11 PC ,3,4.95,14112.0,United Kingdom,2026-01-23
519686,21100,CHARLIE AND LOLA CHARLOTTE BAG,1,1.65,18283.0,United Kingdom,2026-01-23
519687,22356,CHARLOTTE BAG PINK WITH WHITE SPOTS,20,0.85,14112.0,United Kingdom,2026-01-23
519687,22355,CHARLOTTE BAG SUKI DESIGN,20,0.85,14112.0,United Kingdom,2026-01-23
519687,20725,LUNCH BAG RED SPOTTY,30,1.65,14112.0,United Kingdom,2026-01-23
519687,22384,LUNCH BAG PINK RETROSPOT,30,1.65,14112.0,United Kingdom,2026-01-23
519686,22382,LUNCH BAG SPACEBOY DESIGN ,1,1.65,18283.0,United Kingdom,2026-01-23
519687,22439,6 ROCKET BALLOONS ,24,0.65,14112.0,United Kingdom,2026-01-23
519688,22383,LUNCH BAG SUKI  DESIGN ,5,1.65,17068.0,United Kingdom,2026-01-23
519688,22090,PAPER BUNTING RETRO SPOTS,2,2.95,17068.0,United Kingdom,2026-01-23
519688,22666,RECIPE BOX PANTRY YELLOW DESIGN,1,2.95,17068.0,United Kingdom,2026-01-23
519688,22662,LUNCH BAG DOLLY GIRL DESIGN,4,1.65,17068.0,United Kingdom,2026-01-23
519688,40046A,RED DAISY PAPER LAMPSHADE,6,1.25,17068.0,United Kingdom,2026-01-23
519688,20718,RED SPOTTY SHOPPER BAG,5,1.25,17068.0,United Kingdom,2026-01-23
519690,22635,CHILDS BREAKFAST SET DOLLY GIRL ,2,9.95,14112.0,United Kingdom,2026-01-23
519688,22665,RECIPE BOX BLUE SKETCHBOOK DESIGN,1,2.95,17068.0,United Kingdom,2026-01-23
519690,22634,CHILDS BREAKFAST SET SPACEBOY ,2,9.95,14112.0,United Kingdom,2026-01-23
519688,22329,ROUND CONTAINER SET OF 5 RETROSPOT,2,1.65,17068.0,United Kingdom,2026-01-23
519688,20725,LUNCH BAG RED SPOTTY,5,1.65,17068.0,United Kingdom,2026-01-23
519688,20728,LUNCH BAG CARS BLUE,3,1.65,17068.0,United Kingdom,2026-01-23
519688,22353,LUNCH BOX WITH CUTLERY FAIRY CAKES ,2,2.55,17068.0,United Kingdom,2026-01-23
519688,22352,LUNCH BOX WITH CUTLERY RETROSPOT ,1,2.55,17068.0,United Kingdom,2026-01-23
519688,21558,SKULL LUNCH BOX WITH CUTLERY ,1,2.55,17068.0,United Kingdom,2026-01-23
519688,21559,STRAWBERRY LUNCH BOX WITH CUTLERY,2,2.55,17068.0,United Kingdom,2026-01-23
519688,22326,ROUND SNACK BOXES SET OF4 WOODLAND ,2,2.95,17068.0,United Kingdom,2026-01-23
519688,22327,ROUND SNACK BOXES SET OF 4 SKULLS,2,2.95,17068.0,United Kingdom,2026-01-23
519688,20726,LUNCH BAG WOODLAND,5,1.65,17068.0,United Kingdom,2026-01-23
519690,22203,MILK PAN RED RETROSPOT,4,3.75,14112.0,United Kingdom,2026-01-23
519688,15060B,FAIRY CAKE DESIGN UMBRELLA,2,3.75,17068.0,United Kingdom,2026-01-23
519689,22027,TEA PARTY BIRTHDAY CARD,12,0.42,14283.0,United Kingdom,2026-01-23
519688,85014A,BLACK/BLUE DOTS RUFFLED UMBRELLA,2,5.95,17068.0,United Kingdom,2026-01-23
519688,85014B,RED/WHITE DOTS RUFFLED UMBRELLA,2,5.95,17068.0,United Kingdom,2026-01-23
519689,21213,PACK OF 72 SKULL CAKE CASES,24,0.55,14283.0,United Kingdom,2026-01-23
519689,22037,ROBOT BIRTHDAY CARD,12,0.42,14283.0,United Kingdom,2026-01-23
519689,46115B,GREEN POP ART MAO CUSHION COVER ,24,0.19,14283.0,United Kingdom,2026-01-23
519689,22469,HEART OF WICKER SMALL,12,1.65,14283.0,United Kingdom,2026-01-23
519689,35594,WOODEN CHRISTMAS TREE 3 HANGING,12,0.42,14283.0,United Kingdom,2026-01-23
519689,20768,GREEN FERN JOURNAL ,6,2.55,14283.0,United Kingdom,2026-01-23
519689,22659,LUNCH BOX I LOVE LONDON,12,1.95,14283.0,United Kingdom,2026-01-23
519689,22630,DOLLY GIRL LUNCH BOX,12,1.95,14283.0,United Kingdom,2026-01-23
519689,22694,WICKER STAR ,6,2.1,14283.0,United Kingdom,2026-01-23
519689,21507,"ELEPHANT, BIRTHDAY CARD, ",12,0.42,14283.0,United Kingdom,2026-01-23
519689,21509,COWBOYS AND INDIANS BIRTHDAY CARD ,12,0.42,14283.0,United Kingdom,2026-01-23
519689,22714,CARD BIRTHDAY COWBOY,12,0.42,14283.0,United Kingdom,2026-01-23
519688,21928,JUMBO BAG SCANDINAVIAN PAISLEY,5,1.95,17068.0,United Kingdom,2026-01-23
519688,85099C,JUMBO  BAG BAROQUE BLACK WHITE,5,1.95,17068.0,United Kingdom,2026-01-23
519688,21930,JUMBO STORAGE BAG SKULLS,3,1.95,17068.0,United Kingdom,2026-01-23
519688,22386,JUMBO BAG PINK WITH WHITE SPOTS,7,1.95,17068.0,United Kingdom,2026-01-23
519688,21212,PACK OF 72 RETRO SPOT CAKE CASES,3,0.55,17068.0,United Kingdom,2026-01-23
519689,21558,SKULL LUNCH BOX WITH CUTLERY ,6,2.55,14283.0,United Kingdom,2026-01-23
519688,22417,PACK OF 60 SPACEBOY CAKE CASES,2,0.55,17068.0,United Kingdom,2026-01-23
519691,85095,THREE CANVAS LUGGAGE TAGS,24,0.65,17841.0,United Kingdom,2026-01-23
519691,84989A,75 GREEN FAIRY CAKE CASES,2,0.55,17841.0,United Kingdom,2026-01-23
519691,21977,PACK OF 60 PINK PAISLEY CAKE CASES,5,0.55,17841.0,United Kingdom,2026-01-23
519691,84531B,BLUE KNITTED EGG COSY,2,1.95,17841.0,United Kingdom,2026-01-23
519691,84990,60 GOLD AND SILVER FAIRY CAKE CASES,12,0.55,17841.0,United Kingdom,2026-01-23
519691,21213,PACK OF 72 SKULL CAKE CASES,6,0.55,17841.0,United Kingdom,2026-01-23
519691,84989A,75 GREEN FAIRY CAKE CASES,3,0.55,17841.0,United Kingdom,2026-01-23
519691,16161U,WRAP SUKI AND FRIENDS,1,0.42,17841.0,United Kingdom,2026-01-23
519691,21747,SMALL SKULL WINDMILL,1,1.25,17841.0,United Kingdom,2026-01-23
519691,21212,PACK OF 72 RETRO SPOT CAKE CASES,2,0.55,17841.0,United Kingdom,2026-01-23
519691,21746,SMALL RED RETROSPOT WINDMILL,1,1.25,17841.0,United Kingdom,2026-01-23
519691,22365,DOORMAT RESPECTABLE HOUSE,1,7.49,17841.0,United Kingdom,2026-01-23
519691,84969,BOX OF 6 ASSORTED COLOUR TEASPOONS,1,4.25,17841.0,United Kingdom,2026-01-23
519691,21705,BAG 500g SWIRLY MARBLES,1,1.65,17841.0,United Kingdom,2026-01-23
519691,22652,TRAVEL SEWING KIT,2,1.65,17841.0,United Kingdom,2026-01-23
519691,21077,SET/20 WOODLAND PAPER NAPKINS ,4,0.85,17841.0,United Kingdom,2026-01-23
519691,21408,SPOTTY PINK DUCK DOORSTOP,1,4.25,17841.0,United Kingdom,2026-01-23
519691,21668,RED STRIPE CERAMIC DRAWER KNOB,6,1.25,17841.0,United Kingdom,2026-01-23
519691,72351B,SET/6 PINK  BUTTERFLY T-LIGHTS,4,2.1,17841.0,United Kingdom,2026-01-23
519691,15044D,RED PAPER PARASOL,1,2.95,17841.0,United Kingdom,2026-01-23
519691,21889,WOODEN BOX OF DOMINOES,1,1.25,17841.0,United Kingdom,2026-01-23
519691,84970S,HANGING HEART ZINC T-LIGHT HOLDER,3,0.85,17841.0,United Kingdom,2026-01-23
519691,84968E,SET OF 16 VINTAGE BLACK CUTLERY,1,12.75,17841.0,United Kingdom,2026-01-23
519691,79160,HEART SHAPE WIRELESS DOORBELL,4,2.1,17841.0,United Kingdom,2026-01-23
519691,20910,VINTAGE PHOTO ALBUM PARIS DAYS,1,6.35,17841.0,United Kingdom,2026-01-23
519691,21755,LOVE BUILDING BLOCK WORD,2,5.95,17841.0,United Kingdom,2026-01-23
519691,21591,COSY HOUR CIGAR BOX MATCHES ,1,1.25,17841.0,United Kingdom,2026-01-23
519691,21590,KINGS CHOICE CIGAR BOX MATCHES ,1,1.25,17841.0,United Kingdom,2026-01-23
519691,85098B,BLUE FLYING SINGING CANARY,1,3.75,17841.0,United Kingdom,2026-01-23
519691,21581,SKULLS  DESIGN  COTTON TOTE BAG,1,2.25,17841.0,United Kingdom,2026-01-23
519691,35633B,BLUE TINSEL GARLAND ,11,0.19,17841.0,United Kingdom,2026-01-23
519691,20618,QUEEN OF THE SKIES PASSPORT COVER ,1,2.1,17841.0,United Kingdom,2026-01-23
519691,21186,WHITE DOVE HONEYCOMB PAPER GARLAND,2,1.65,17841.0,United Kingdom,2026-01-23
519691,21186,WHITE DOVE HONEYCOMB PAPER GARLAND,10,1.65,17841.0,United Kingdom,2026-01-23
519691,21481,FAWN BLUE HOT WATER BOTTLE,1,2.95,17841.0,United Kingdom,2026-01-23
519691,21482,MUSHROOM BLUE HOT WATER BOTTLE,1,2.95,17841.0,United Kingdom,2026-01-23
519691,84032B,CHARLIE + LOLA RED HOT WATER BOTTLE,1,2.95,17841.0,United Kingdom,2026-01-23
519691,21484,CHICK GREY HOT WATER BOTTLE,1,3.45,17841.0,United Kingdom,2026-01-23
519691,20655,QUEEN OF SKIES LUGGAGE TAG,2,1.25,17841.0,United Kingdom,2026-01-23
519691,84819,DANISH ROSE ROUND SEWING BOX,1,4.25,17841.0,United Kingdom,2026-01-23
519691,84032A,CHARLIE+LOLA PINK HOT WATER BOTTLE,1,2.95,17841.0,United Kingdom,2026-01-23
519691,21592,RETRO SPOT  CIGAR BOX MATCHES ,1,1.25,17841.0,United Kingdom,2026-01-23
519691,20681,PINK SPOTTY CHILDS UMBRELLA,1,3.25,17841.0,United Kingdom,2026-01-23
519691,22596,CHRISTMAS STAR WISH LIST CHALKBOARD,1,0.85,17841.0,United Kingdom,2026-01-23
519691,22469,HEART OF WICKER SMALL,1,1.65,17841.0,United Kingdom,2026-01-23
519691,22470,HEART OF WICKER LARGE,1,2.95,17841.0,United Kingdom,2026-01-23
519691,21934,SKULL SHOULDER BAG,2,1.65,17841.0,United Kingdom,2026-01-23
519691,84997D,PINK 3 PIECE MINI DOTS CUTLERY SET,1,3.75,17841.0,United Kingdom,2026-01-23
519691,84997C,BLUE 3 PIECE MINI DOTS CUTLERY SET,1,3.75,17841.0,United Kingdom,2026-01-23
519691,84997B,RED 3 PIECE MINI DOTS CUTLERY SET,1,3.75,17841.0,United Kingdom,2026-01-23
519691,20748,KENSINGTON COFFEE SET,1,12.75,17841.0,United Kingdom,2026-01-23
519692,22457,NATURAL SLATE HEART CHALKBOARD ,12,2.95,17222.0,United Kingdom,2026-01-23
519692,84832,ZINC WILLIE WINKIE  CANDLE STICK,6,0.85,17222.0,United Kingdom,2026-01-23
519692,22575,METAL MERRY CHRISTMAS WREATH,24,1.95,17222.0,United Kingdom,2026-01-23
519692,21143,ANTIQUE GLASS HEART DECORATION ,12,1.95,17222.0,United Kingdom,2026-01-23
519692,21011,GLITTER SNOW PEAR TREE DECORATION,5,1.45,17222.0,United Kingdom,2026-01-23
519692,21474,SWEETHEART CREAM STEEL FOLDIN BENCH,1,19.95,17222.0,United Kingdom,2026-01-23
519692,22589,CARDHOLDER GINGHAM STAR,4,2.55,17222.0,United Kingdom,2026-01-23
519692,20851,ZINC HEART LATTICE TRAY OVAL ,4,5.95,17222.0,United Kingdom,2026-01-23
519692,20850,ZINC HEART LATTICE PLANTER BOWL,12,2.95,17222.0,United Kingdom,2026-01-23
519692,85113,POLKA DOT PISTACHIO PAIL,3,2.1,17222.0,United Kingdom,2026-01-23
519692,22588,CARD HOLDER GINGHAM HEART,5,2.55,17222.0,United Kingdom,2026-01-23
519692,22154,ANGEL DECORATION 3 BUTTONS ,48,0.42,17222.0,United Kingdom,2026-01-23
519692,22082,RIBBON REEL STRIPES DESIGN ,5,1.65,17222.0,United Kingdom,2026-01-23
519692,85135B,BLUE DRAGONFLY HELICOPTER,1,7.95,17222.0,United Kingdom,2026-01-23
519692,22599,CHRISTMAS MUSICAL ZINC STAR,10,0.85,17222.0,United Kingdom,2026-01-23
519692,22603,CHRISTMAS RETROSPOT TREE WOOD,8,0.85,17222.0,United Kingdom,2026-01-23
519692,22598,CHRISTMAS MUSICAL ZINC TREE,10,0.85,17222.0,United Kingdom,2026-01-23
519692,22595,CHRISTMAS GINGHAM HEART,36,0.85,17222.0,United Kingdom,2026-01-23
519692,35970,ZINC FOLKART SLEIGH BELLS,6,1.69,17222.0,United Kingdom,2026-01-23
519692,22597,CHRISTMAS MUSICAL ZINC HEART ,11,0.85,17222.0,United Kingdom,2026-01-23
519692,22576,SWALLOW WOODEN CHRISTMAS DECORATION,17,0.85,17222.0,United Kingdom,2026-01-23
519692,22601,CHRISTMAS RETROSPOT ANGEL WOOD,8,0.85,17222.0,United Kingdom,2026-01-23
519692,22602,CHRISTMAS RETROSPOT HEART WOOD,11,0.85,17222.0,United Kingdom,2026-01-23
519692,22577,WOODEN HEART CHRISTMAS SCANDINAVIAN,10,0.85,17222.0,United Kingdom,2026-01-23
519692,22130,PARTY CONE CHRISTMAS DECORATION ,24,0.85,17222.0,United Kingdom,2026-01-23
519692,M,Manual,2,7.95,17222.0,United Kingdom,2026-01-23
519692,21146,ANTIQUE GLASS RIDGED HANGING BALL,12,1.95,17222.0,United Kingdom,2026-01-23
519692,22580,ADVENT CALENDAR GINGHAM SACK,3,5.95,17222.0,United Kingdom,2026-01-23
519692,22158,3 HEARTS HANGING DECORATION RUSTIC,24,2.95,17222.0,United Kingdom,2026-01-23
519692,22593,CHRISTMAS GINGHAM STAR,36,0.85,17222.0,United Kingdom,2026-01-23
519692,22594,CHRISTMAS GINGHAM TREE,36,0.85,17222.0,United Kingdom,2026-01-23
519693,21841,BABY MOUSE RED GINGHAM DRESS,2,4.25,14667.0,United Kingdom,2026-01-23
519693,22030,SWALLOWS GREETING CARD,24,0.42,14667.0,United Kingdom,2026-01-23
519693,21868,POTTING SHED TEA MUG,6,1.25,14667.0,United Kingdom,2026-01-23
519693,22121,NOEL WOODEN BLOCK LETTERS ,8,5.95,14667.0,United Kingdom,2026-01-23
519693,22674,FRENCH TOILET SIGN BLUE METAL,6,1.25,14667.0,United Kingdom,2026-01-23
519693,22675,FRENCH KITCHEN SIGN BLUE METAL,5,1.25,14667.0,United Kingdom,2026-01-23
519693,22672,FRENCH BATHROOM SIGN BLUE METAL,5,1.65,14667.0,United Kingdom,2026-01-23
519693,21171,BATHROOM METAL SIGN ,4,1.45,14667.0,United Kingdom,2026-01-23
519693,21535,RED RETROSPOT SMALL MILK JUG,3,2.55,14667.0,United Kingdom,2026-01-23
519693,22600,CHRISTMAS RETROSPOT STAR WOOD,144,0.72,14667.0,United Kingdom,2026-01-23
519693,22301,COFFEE MUG CAT + BIRD DESIGN,6,2.55,14667.0,United Kingdom,2026-01-23
519693,22120,WELCOME  WOODEN BLOCK LETTERS,1,9.95,14667.0,United Kingdom,2026-01-23
519693,21839,MUMMY MOUSE RED GINGHAM RIBBON,2,5.45,14667.0,United Kingdom,2026-01-23
519693,21181,PLEASE ONE PERSON METAL SIGN,60,1.85,14667.0,United Kingdom,2026-01-23
519693,22465,HANGING METAL STAR LANTERN,6,1.65,14667.0,United Kingdom,2026-01-23
519693,22300,COFFEE MUG DOG + BALL DESIGN,6,2.55,14667.0,United Kingdom,2026-01-23
519693,22119,PEACE WOODEN BLOCK LETTERS,2,6.95,14667.0,United Kingdom,2026-01-23
519693,85040B,SET/4 BLUE FLOWER CANDLES IN BOWL,4,1.65,14667.0,United Kingdom,2026-01-23
519693,21034,REX CASH+CARRY JUMBO SHOPPER,1,0.95,14667.0,United Kingdom,2026-01-23
519693,21623,VINTAGE UNION JACK MEMOBOARD,1,9.95,14667.0,United Kingdom,2026-01-23
519693,85040A,S/4 PINK FLOWER CANDLES IN BOWL,4,1.65,14667.0,United Kingdom,2026-01-23
519694,21558,SKULL LUNCH BOX WITH CUTLERY ,10,2.55,13089.0,United Kingdom,2026-01-23
519694,21447,12 IVORY ROSE PEG PLACE SETTINGS,12,1.25,13089.0,United Kingdom,2026-01-23
519694,20724,RED SPOTTY CHARLOTTE BAG,10,0.85,13089.0,United Kingdom,2026-01-23
519694,21469,POLKA DOT RAFFIA FOOD COVER,6,3.75,13089.0,United Kingdom,2026-01-23
519694,22640,SET OF 4 NAPKIN CHARMS 3 KEYS ,8,2.55,13089.0,United Kingdom,2026-01-23
519694,72760B,VINTAGE CREAM 3 BASKET CAKE STAND,4,9.95,13089.0,United Kingdom,2026-01-23
519694,21621,VINTAGE UNION JACK BUNTING,4,8.5,13089.0,United Kingdom,2026-01-23
519694,21623,VINTAGE UNION JACK MEMOBOARD,4,9.95,13089.0,United Kingdom,2026-01-23
519694,85014B,RED/WHITE DOTS RUFFLED UMBRELLA,6,5.95,13089.0,United Kingdom,2026-01-23
519694,21559,STRAWBERRY LUNCH BOX WITH CUTLERY,10,2.55,13089.0,United Kingdom,2026-01-23
519694,21974,SET OF 36 PAISLEY FLOWER DOILIES,12,1.45,13089.0,United Kingdom,2026-01-23
519694,84988,SET OF 72 PINK HEART PAPER DOILIES,12,1.45,13089.0,United Kingdom,2026-01-23
519694,21312,LARGE CHUNKY GLASS ROMAN BOWL,16,1.95,13089.0,United Kingdom,2026-01-23
519694,22252,BIRDCAGE DECORATION TEALIGHT HOLDER,12,1.25,13089.0,United Kingdom,2026-01-23
519694,85170A,SET/6 IVORY BIRD T-LIGHT CANDLES,12,2.1,13089.0,United Kingdom,2026-01-23
519694,21874,GIN AND TONIC MUG,12,1.25,13089.0,United Kingdom,2026-01-23
519694,22023,EMPIRE BIRTHDAY CARD,12,0.42,13089.0,United Kingdom,2026-01-23
519694,84836,ZINC METAL HEART DECORATION,12,1.25,13089.0,United Kingdom,2026-01-23
519694,82600,NO SINGING METAL SIGN,12,2.1,13089.0,United Kingdom,2026-01-23
519694,21870,I CAN ONLY PLEASE ONE PERSON MUG,12,1.25,13089.0,United Kingdom,2026-01-23
519694,82486,WOOD S/3 CABINET ANT WHITE FINISH,6,7.95,13089.0,United Kingdom,2026-01-23
519694,82483,WOOD 2 DRAWER CABINET WHITE FINISH,8,5.95,13089.0,United Kingdom,2026-01-23
519694,82482,WOODEN PICTURE FRAME WHITE FINISH,12,2.55,13089.0,United Kingdom,2026-01-23
519694,82494L,WOODEN FRAME ANTIQUE WHITE ,8,2.95,13089.0,United Kingdom,2026-01-23
519694,22718,CARD CAT AND TREE ,12,0.42,13089.0,United Kingdom,2026-01-23
519694,22703,PINK CAT BOWL,6,2.1,13089.0,United Kingdom,2026-01-23
519694,22666,RECIPE BOX PANTRY YELLOW DESIGN,6,2.95,13089.0,United Kingdom,2026-01-23
519694,22457,NATURAL SLATE HEART CHALKBOARD ,8,2.95,13089.0,United Kingdom,2026-01-23
519694,22456,NATURAL SLATE CHALKBOARD LARGE ,6,4.95,13089.0,United Kingdom,2026-01-23
519694,22384,LUNCH BAG PINK RETROSPOT,10,1.65,13089.0,United Kingdom,2026-01-23
519694,71459,HANGING JAM JAR T-LIGHT HOLDER,12,0.85,13089.0,United Kingdom,2026-01-23
519695,21166,COOK WITH WINE METAL SIGN ,12,1.95,13089.0,United Kingdom,2026-01-23
519695,21165,BEWARE OF THE CAT METAL SIGN ,12,1.69,13089.0,United Kingdom,2026-01-23
519696,22684,"FRENCH BLUE METAL DOOR SIGN, 9",10,1.25,13089.0,United Kingdom,2026-01-23
519696,22673,FRENCH GARDEN SIGN BLUE METAL,12,1.25,13089.0,United Kingdom,2026-01-23
519696,22674,FRENCH TOILET SIGN BLUE METAL,12,1.25,13089.0,United Kingdom,2026-01-23
519696,22671,FRENCH LAUNDRY SIGN BLUE METAL,12,1.65,13089.0,United Kingdom,2026-01-23
519696,22672,FRENCH BATHROOM SIGN BLUE METAL,12,1.65,13089.0,United Kingdom,2026-01-23
519696,22685,"FRENCH BLUE METAL DOOR SIGN, 0",10,1.25,13089.0,United Kingdom,2026-01-23
519696,22683,"FRENCH BLUE METAL DOOR SIGN, 8",10,1.25,13089.0,United Kingdom,2026-01-23
519696,22675,FRENCH KITCHEN SIGN BLUE METAL,12,1.25,13089.0,United Kingdom,2026-01-23
519696,22677,"FRENCH BLUE METAL DOOR SIGN, 2",10,1.25,13089.0,United Kingdom,2026-01-23
519696,22678,"FRENCH BLUE METAL DOOR SIGN, 3",10,1.25,13089.0,United Kingdom,2026-01-23
519696,22679,"FRENCH BLUE METAL DOOR SIGN, 4",10,1.25,13089.0,United Kingdom,2026-01-23
519696,22680,"FRENCH BLUE METAL DOOR SIGN, 5",10,1.25,13089.0,United Kingdom,2026-01-23
519696,22682,"FRENCH BLUE METAL DOOR SIGN, 7",10,1.25,13089.0,United Kingdom,2026-01-23
519696,22686,"FRENCH BLUE METAL DOOR SIGN, No",12,1.25,13089.0,United Kingdom,2026-01-23
519696,22676,"FRENCH BLUE METAL DOOR SIGN, 1",10,1.25,13089.0,United Kingdom,2026-01-23
519696,22681,"FRENCH BLUE METAL DOOR SIGN, 6",10,1.25,13089.0,United Kingdom,2026-01-23
519697,21181,PLEASE ONE PERSON METAL SIGN,12,2.1,13089.0,United Kingdom,2026-01-23
519697,21175,GIN + TONIC DIET METAL SIGN,12,2.1,13089.0,United Kingdom,2026-01-23
519697,22596,CHRISTMAS STAR WISH LIST CHALKBOARD,24,0.85,13089.0,United Kingdom,2026-01-23
519698,22569,FELTCRAFT CUSHION BUTTERFLY,12,3.75,14911.0,EIRE,2026-01-23
519698,72802C,VANILLA SCENT CANDLE JEWELLED BOX,6,4.25,14911.0,EIRE,2026-01-23
519698,22211,WOOD STAMP SET FLOWERS,12,1.65,14911.0,EIRE,2026-01-23
519698,22570,FELTCRAFT CUSHION RABBIT,12,3.75,14911.0,EIRE,2026-01-23
519698,22568,FELTCRAFT CUSHION OWL,12,3.75,14911.0,EIRE,2026-01-23
519698,22668,PINK BABY BUNTING,5,2.95,14911.0,EIRE,2026-01-23
519698,C2,CARRIAGE,1,50.0,14911.0,EIRE,2026-01-23
519698,21333,CLASSIC WHITE FRAME,4,2.95,14911.0,EIRE,2026-01-23
519698,82482,WOODEN PICTURE FRAME WHITE FINISH,6,2.55,14911.0,EIRE,2026-01-23
519698,72807B,SET/3 OCEAN SCENT CANDLE JEWEL BOX,4,4.25,14911.0,EIRE,2026-01-23
519698,72802B,OCEAN SCENT CANDLE IN JEWELLED BOX,6,4.25,14911.0,EIRE,2026-01-23
519699,22189,CREAM HEART CARD HOLDER,4,3.95,14911.0,EIRE,2026-01-23
519700,22325,MOBILE VINTAGE HEARTS ,1,4.95,14722.0,United Kingdom,2026-01-23
519700,21431,GREEN GINGHAM FLOWER JEWELLERY BOX,2,1.65,14722.0,United Kingdom,2026-01-23
519700,21429,RED GINGHAM ROSE JEWELLERY BOX,2,1.65,14722.0,United Kingdom,2026-01-23
519700,22646,CERAMIC STRAWBERRY CAKE MONEY BANK,1,1.45,14722.0,United Kingdom,2026-01-23
519700,21638,ASSORTED TUTTI FRUTTI NOTEBOOK,6,2.1,14722.0,United Kingdom,2026-01-23
519700,22637,PIGGY BANK RETROSPOT ,1,2.55,14722.0,United Kingdom,2026-01-23
519700,21889,WOODEN BOX OF DOMINOES,3,1.25,14722.0,United Kingdom,2026-01-23
519700,22617,BAKING SET SPACEBOY DESIGN,3,4.95,14722.0,United Kingdom,2026-01-23
519700,22138,BAKING SET 9 PIECE RETROSPOT ,3,4.95,14722.0,United Kingdom,2026-01-23
519700,20703,BLUE PADDED SOFT MOBILE,1,4.25,14722.0,United Kingdom,2026-01-23
519700,47503A,ASS FLORAL PRINT MULTI SCREWDRIVER,1,1.25,14722.0,United Kingdom,2026-01-23
519700,22273,FELTCRAFT DOLL MOLLY,1,2.95,14722.0,United Kingdom,2026-01-23
519700,22111,SCOTTIE DOG HOT WATER BOTTLE,2,4.95,14722.0,United Kingdom,2026-01-23
519700,21231,SWEETHEART CERAMIC TRINKET BOX,1,1.25,14722.0,United Kingdom,2026-01-23
519700,21232,STRAWBERRY CERAMIC TRINKET BOX,3,1.25,14722.0,United Kingdom,2026-01-23
519700,85135B,BLUE DRAGONFLY HELICOPTER,1,7.95,14722.0,United Kingdom,2026-01-23
519700,85136C,RED SHARK HELICOPTER,1,7.95,14722.0,United Kingdom,2026-01-23
519700,85136B,BLUE SHARK HELICOPTER,1,7.95,14722.0,United Kingdom,2026-01-23
519700,22550,HOLIDAY FUN LUDO,1,3.75,14722.0,United Kingdom,2026-01-23
519700,21912,VINTAGE SNAKES & LADDERS,1,3.75,14722.0,United Kingdom,2026-01-23
519700,21791,VINTAGE HEADS AND TAILS CARD GAME ,3,1.25,14722.0,United Kingdom,2026-01-23
519706,21313,GLASS HEART T-LIGHT HOLDER ,24,0.85,15903.0,United Kingdom,2026-01-23
519706,21058,PARTY INVITES WOODLAND,24,0.85,15903.0,United Kingdom,2026-01-23
519706,21061,PARTY INVITES FOOTBALL,24,0.85,15903.0,United Kingdom,2026-01-23
519706,21314,SMALL GLASS HEART TRINKET POT,24,2.1,15903.0,United Kingdom,2026-01-23
519706,51014A,"FEATHER PEN,HOT PINK",96,0.85,15903.0,United Kingdom,2026-01-23
519706,21329,DINOSAURS  WRITING SET ,24,1.65,15903.0,United Kingdom,2026-01-23
519706,51014L,"FEATHER PEN,LIGHT PINK",96,0.85,15903.0,United Kingdom,2026-01-23
519707,21363,HOME SMALL WOOD LETTERS,3,4.95,16286.0,United Kingdom,2026-01-23
519707,22668,PINK BABY BUNTING,5,2.95,16286.0,United Kingdom,2026-01-23
519707,22661,CHARLOTTE BAG DOLLY GIRL DESIGN,10,0.85,16286.0,United Kingdom,2026-01-23
