Invoice,StockCode,Description,Quantity,Price,Customer ID,Country,InvoiceDate
517454,21975,PACK OF 60 DINOSAUR CAKE CASES,1,1.28,,United Kingdom,2026-01-05
517454,21977,PACK OF 60 PINK PAISLEY CAKE CASES,1,1.28,,United Kingdom,2026-01-05
517454,21982,PACK OF 12 SUKI TISSUES ,1,0.85,,United Kingdom,2026-01-05
517454,22025,RING OF ROSES BIRTHDAY CARD,2,0.85,,United Kingdom,2026-01-05
517454,22028,PENNY FARTHING BIRTHDAY CARD,2,0.85,,United Kingdom,2026-01-05
517454,22227,"DECORATION, HANGING HEART+MIRROR ",2,1.28,,United Kingdom,2026-01-05
517454,22037,ROBOT BIRTHDAY CARD,1,0.85,,United Kingdom,2026-01-05
517454,22055,MINI CAKE STAND  HANGING STRAWBERY,2,3.36,,United Kingdom,2026-01-05
517454,22077,6 RIBBONS RUSTIC CHARM,1,3.36,,United Kingdom,2026-01-05
517454,22083,PAPER CHAIN KIT RETRO SPOT,1,5.91,,United Kingdom,2026-01-05
517454,22086,PAPER CHAIN KIT 50'S CHRISTMAS ,1,5.91,,United Kingdom,2026-01-05
517454,21561,DINOSAUR LUNCH BOX WITH CUTLERY,1,5.06,,United Kingdom,2026-01-05
517454,22135,LADLE LOVE HEART PINK,1,0.85,,United Kingdom,2026-01-05
517454,22136,LOVE HEART SOCK HANGER,1,3.36,,United Kingdom,2026-01-05
517454,22138,BAKING SET 9 PIECE RETROSPOT ,1,11.02,,United Kingdom,2026-01-05
517454,22167,"WALL MIRROR , DIAMANTE OVAL SHAPE",1,20.38,,United Kingdom,2026-01-05
517454,21933,PINK VINTAGE PAISLEY PICNIC BAG,1,3.36,,United Kingdom,2026-01-05
517454,21931,JUMBO STORAGE BAG SUKI,1,4.21,,United Kingdom,2026-01-05
517454,22108,PING! MICROWAVE PLATE,1,3.36,,United Kingdom,2026-01-05
517454,21901,"KEY FOB , BACK DOOR ",1,1.66,,United Kingdom,2026-01-05
517454,21669,BLUE STRIPE CERAMIC DRAWER KNOB,3,2.51,,United Kingdom,2026-01-05
517454,21670,BLUE SPOT CERAMIC DRAWER KNOB,2,2.51,,United Kingdom,2026-01-05
517454,21671,RED SPOT CERAMIC DRAWER KNOB,2,2.51,,United Kingdom,2026-01-05
517454,21672,WHITE SPOT RED CERAMIC DRAWER KNOB,4,2.51,,United Kingdom,2026-01-05
517454,21673,WHITE SPOT BLUE CERAMIC DRAWER KNOB,3,2.51,,United Kingdom,2026-01-05
517454,21907,I'M ON HOLIDAY METAL SIGN,1,4.21,,United Kingdom,2026-01-05
517454,21731,RED TOADSTOOL LED NIGHT LIGHT,4,3.36,,United Kingdom,2026-01-05
517454,21741,COSY SLIPPER SHOES LARGE GREEN,2,5.91,,United Kingdom,2026-01-05
517454,21700,BIG DOUGHNUT FRIDGE MAGNETS,1,8.47,,United Kingdom,2026-01-05
517454,21765,HANGING METAL BIRD BATH,2,16.98,,United Kingdom,2026-01-05
517454,21791,VINTAGE HEADS AND TAILS CARD GAME ,1,2.51,,United Kingdom,2026-01-05
517454,21829,DINOSAUR KEYRINGS ASSORTED,6,0.43,,United Kingdom,2026-01-05
517454,21865,PINK UNION JACK  PASSPORT COVER ,1,4.21,,United Kingdom,2026-01-05
517454,21878,PACK OF 6 SANDCASTLE FLAGS ASSORTED,2,1.66,,United Kingdom,2026-01-05
517454,21891,TRADITIONAL WOODEN SKIPPING ROPE,1,2.51,,United Kingdom,2026-01-05
517454,21899,"KEY FOB , GARAGE DESIGN",1,1.66,,United Kingdom,2026-01-05
517454,21745,GAOLERS KEYS DECORATIVE GARDEN ,1,8.47,,United Kingdom,2026-01-05
517457,21936,RED RETROSPOT PICNIC BAG,1,2.95,16883.0,United Kingdom,2026-01-05
517457,21928,JUMBO BAG SCANDINAVIAN PAISLEY,1,1.95,16883.0,United Kingdom,2026-01-05
517457,22386,JUMBO BAG PINK WITH WHITE SPOTS,1,1.95,16883.0,United Kingdom,2026-01-05
517457,21333,CLASSIC WHITE FRAME,1,2.95,16883.0,United Kingdom,2026-01-05
517457,21232,STRAWBERRY CERAMIC TRINKET BOX,2,1.25,16883.0,United Kingdom,2026-01-05
517457,22646,CERAMIC STRAWBERRY CAKE MONEY BANK,4,1.45,16883.0,United Kingdom,2026-01-05
517457,82494L,WOODEN FRAME ANTIQUE WHITE ,1,2.95,16883.0,United Kingdom,2026-01-05
517457,20749,ASSORTED COLOUR MINI CASES,1,7.95,16883.0,United Kingdom,2026-01-05
517457,21742,LARGE ROUND WICKER PLATTER ,1,5.95,16883.0,United Kingdom,2026-01-05
517457,22215,CAKE STAND WHITE TWO TIER LACE,1,8.5,16883.0,United Kingdom,2026-01-05
517457,22625,RED KITCHEN SCALES,1,8.5,16883.0,United Kingdom,2026-01-05
517457,22423,REGENCY CAKESTAND 3 TIER,5,12.75,16883.0,United Kingdom,2026-01-05
517457,21897,POTTING SHED CANDLE CITRONELLA,1,2.95,16883.0,United Kingdom,2026-01-05
517457,22694,WICKER STAR ,1,2.1,16883.0,United Kingdom,2026-01-05
C517458,22646,CERAMIC STRAWBERRY CAKE MONEY BANK,-2,1.45,17188.0,United Kingdom,2026-01-05
C517458,22644,CERAMIC CHERRY CAKE MONEY BANK,-1,1.45,17188.0,United Kingdom,2026-01-05
C517458,22645,CERAMIC HEART FAIRY CAKE MONEY BANK,-1,1.45,17188.0,United Kingdom,2026-01-05
C517458,22423,REGENCY CAKESTAND 3 TIER,-1,12.75,17188.0,United Kingdom,2026-01-05
C517459,21232,STRAWBERRY CERAMIC TRINKET BOX,-1,1.25,17602.0,United Kingdom,2026-01-05
C517459,22055,MINI CAKE STAND  HANGING STRAWBERY,-1,1.65,17602.0,United Kingdom,2026-01-05
C517459,22068,BLACK PIRATE TREASURE CHEST,-1,1.65,17602.0,United Kingdom,2026-01-05
517460,82482,WOODEN PICTURE FRAME WHITE FINISH,6,2.55,14110.0,United Kingdom,2026-01-05
517460,22179,SET 10 LIGHTS NIGHT OWL,4,6.75,14110.0,United Kingdom,2026-01-05
517460,22468,BABUSHKA LIGHTS STRING OF 10,2,6.75,14110.0,United Kingdom,2026-01-05
517460,16161U,WRAP SUKI AND FRIENDS,25,0.42,14110.0,United Kingdom,2026-01-05
517460,22383,LUNCH BAG SUKI  DESIGN ,10,1.65,14110.0,United Kingdom,2026-01-05
517460,22355,CHARLOTTE BAG SUKI DESIGN,10,0.85,14110.0,United Kingdom,2026-01-05
517460,20723,STRAWBERRY CHARLOTTE BAG,10,0.85,14110.0,United Kingdom,2026-01-05
517460,82582,AREA PATROLLED METAL SIGN,12,2.1,14110.0,United Kingdom,2026-01-05
517460,82494L,WOODEN FRAME ANTIQUE WHITE ,6,2.95,14110.0,United Kingdom,2026-01-05
517460,79320,FLAMINGO LIGHTS,4,4.95,14110.0,United Kingdom,2026-01-05
517460,21154,RED SPOTTY OVEN GLOVE ,10,1.25,14110.0,United Kingdom,2026-01-05
517460,21972,SET OF 36 DINOSAUR PAPER DOILIES,12,1.45,14110.0,United Kingdom,2026-01-05
517460,21587,COSY HOUR GIANT TUBE MATCHES,12,2.55,14110.0,United Kingdom,2026-01-05
517460,22186,RED STAR CARD HOLDER,6,2.95,14110.0,United Kingdom,2026-01-05
517460,22689,DOORMAT MERRY CHRISTMAS RED ,10,6.35,14110.0,United Kingdom,2026-01-05
517460,22688,DOORMAT PEACE ON EARTH BLUE,2,7.49,14110.0,United Kingdom,2026-01-05
517460,20728,LUNCH BAG CARS BLUE,10,1.65,14110.0,United Kingdom,2026-01-05
517460,22687,DOORMAT CHRISTMAS VILLAGE,2,7.49,14110.0,United Kingdom,2026-01-05
517460,22049,WRAP CHRISTMAS SCREEN PRINT,25,0.42,14110.0,United Kingdom,2026-01-05
C517461,21763,VINTAGE WOODEN BAR STOOL,-1,29.95,14911.0,EIRE,2026-01-05
C517462,21380,WOODEN HAPPY BIRTHDAY GARLAND,-3,2.95,16975.0,United Kingdom,2026-01-05
C517463,22467,GUMBALL COAT RACK,-2,2.55,13102.0,United Kingdom,2026-01-05
C517463,21473,SWEETHEART CREAM STEEL TABLE RECT,-1,19.95,13102.0,United Kingdom,2026-01-05
C517463,22428,ENAMEL FIRE BUCKET CREAM,-2,6.95,13102.0,United Kingdom,2026-01-05
C517464,21033,JUMBO BAG CHARLIE AND LOLA TOYS,-10,2.95,16670.0,United Kingdom,2026-01-05
C517465,21527,RED RETROSPOT TRADITIONAL TEAPOT ,-2,7.95,17865.0,United Kingdom,2026-01-05
C517465,22061,LARGE CAKE STAND  HANGING STRAWBERY,-1,9.95,17865.0,United Kingdom,2026-01-05
C517465,21232,STRAWBERRY CERAMIC TRINKET BOX,-9,1.06,17865.0,United Kingdom,2026-01-05
C517465,21231,SWEETHEART CERAMIC TRINKET BOX,-3,1.25,17865.0,United Kingdom,2026-01-05
C517466,37449,CERAMIC CAKE STAND + HANGING CAKES,-1,9.95,13288.0,United Kingdom,2026-01-05
C517466,90062,CARNIVAL BRACELET,-2,12.75,13288.0,United Kingdom,2026-01-05
517467,21558,SKULL LUNCH BOX WITH CUTLERY ,6,2.55,18075.0,United Kingdom,2026-01-05
517467,20703,BLUE PADDED SOFT MOBILE,3,4.25,18075.0,United Kingdom,2026-01-05
517467,20702,PINK PADDED MOBILE,3,4.25,18075.0,United Kingdom,2026-01-05
517467,21916,SET 12 RETRO WHITE CHALK STICKS,24,0.42,18075.0,United Kingdom,2026-01-05
517467,84279P,CHERRY BLOSSOM  DECORATIVE FLASK,4,3.75,18075.0,United Kingdom,2026-01-05
517467,84970S,HANGING HEART ZINC T-LIGHT HOLDER,12,0.85,18075.0,United Kingdom,2026-01-05
517467,85064,CREAM SWEETHEART LETTER RACK,2,5.45,18075.0,United Kingdom,2026-01-05
517467,85068,CREAM SWEETHEART SHELF + HOOKS,2,7.95,18075.0,United Kingdom,2026-01-05
517467,85066,CREAM SWEETHEART MINI CHEST,2,12.75,18075.0,United Kingdom,2026-01-05
517467,22668,PINK BABY BUNTING,5,2.95,18075.0,United Kingdom,2026-01-05
517467,72598,SET/12 TAPER CANDLES,12,0.85,18075.0,United Kingdom,2026-01-05
517467,72008,FROSTED BOX 9 WHITE T-LIGHT CANDLES,12,0.42,18075.0,United Kingdom,2026-01-05
517467,22162,HEART GARLAND RUSTIC PADDED,8,2.95,18075.0,United Kingdom,2026-01-05
517467,35961,FOLKART ZINC HEART CHRISTMAS DEC,12,0.85,18075.0,United Kingdom,2026-01-05
517467,84763,ZINC FINISH 15CM PLANTER POTS,12,1.25,18075.0,United Kingdom,2026-01-05
517467,22690,DOORMAT HOME SWEET HOME BLUE ,2,7.49,18075.0,United Kingdom,2026-01-05
517467,22588,CARD HOLDER GINGHAM HEART,6,2.55,18075.0,United Kingdom,2026-01-05
517467,22470,HEART OF WICKER LARGE,6,2.95,18075.0,United Kingdom,2026-01-05
517467,22669,RED BABY BUNTING ,5,2.95,18075.0,United Kingdom,2026-01-05
517467,21559,STRAWBERRY LUNCH BOX WITH CUTLERY,6,2.55,18075.0,United Kingdom,2026-01-05
517467,20749,ASSORTED COLOUR MINI CASES,2,7.95,18075.0,United Kingdom,2026-01-05
517467,22617,BAKING SET SPACEBOY DESIGN,3,4.95,18075.0,United Kingdom,2026-01-05
517467,22138,BAKING SET 9 PIECE RETROSPOT ,3,4.95,18075.0,United Kingdom,2026-01-05
517467,85063,CREAM SWEETHEART MAGAZINE RACK,1,16.95,18075.0,United Kingdom,2026-01-05
517467,85065,CREAM SWEETHEART TRAYS,1,12.75,18075.0,United Kingdom,2026-01-05
517467,84840,SWEETHEART CARRY-ALL BASKET,2,8.5,18075.0,United Kingdom,2026-01-05
517467,82484,WOOD BLACK BOARD ANT WHITE FINISH,3,6.45,18075.0,United Kingdom,2026-01-05
517467,84836,ZINC METAL HEART DECORATION,12,1.25,18075.0,United Kingdom,2026-01-05
517467,84884A,ANT WHITE WIRE HEART SPIRAL,5,3.95,18075.0,United Kingdom,2026-01-05
517467,22172,METAL SHELF WITH RAIL ,2,8.5,18075.0,United Kingdom,2026-01-05
517467,84879,ASSORTED COLOUR BIRD ORNAMENT,8,1.69,18075.0,United Kingdom,2026-01-05
517467,22169,FAMILY ALBUM WHITE PICTURE FRAME,2,8.5,18075.0,United Kingdom,2026-01-05
517467,22485,SET OF 2 WOODEN MARKET CRATES,2,12.75,18075.0,United Kingdom,2026-01-05
517467,22469,HEART OF WICKER SMALL,12,1.65,18075.0,United Kingdom,2026-01-05
517467,84832,ZINC WILLIE WINKIE  CANDLE STICK,12,0.85,18075.0,United Kingdom,2026-01-05
517467,71459,HANGING JAM JAR T-LIGHT HOLDER,12,0.85,18075.0,United Kingdom,2026-01-05
517467,84978,HANGING HEART JAR T-LIGHT HOLDER,12,1.25,18075.0,United Kingdom,2026-01-05
517467,22276,WASH BAG VINTAGE ROSE PAISLEY,6,2.55,18075.0,United Kingdom,2026-01-05
517467,22457,NATURAL SLATE HEART CHALKBOARD ,6,2.95,18075.0,United Kingdom,2026-01-05
517467,21737,SET 3 WICKER LOG BASKETS,1,19.95,18075.0,United Kingdom,2026-01-05
517467,22456,NATURAL SLATE CHALKBOARD LARGE ,3,4.95,18075.0,United Kingdom,2026-01-05
C517468,22341,LOVE GARLAND PAINTED ZINC ,-12,1.65,16176.0,United Kingdom,2026-01-05
C517468,22342,HOME GARLAND PAINTED ZINC ,-12,1.65,16176.0,United Kingdom,2026-01-05
C517469,21930,JUMBO STORAGE BAG SKULLS,-1,1.65,14680.0,United Kingdom,2026-01-05
C517469,21937,STRAWBERRY   PICNIC BAG,-3,2.55,14680.0,United Kingdom,2026-01-05
C517469,20725,LUNCH BAG RED SPOTTY,-9,1.45,14680.0,United Kingdom,2026-01-05
C517469,85099B,JUMBO BAG RED RETROSPOT,-1,1.65,14680.0,United Kingdom,2026-01-05
C517469,20712,JUMBO BAG WOODLAND ANIMALS,-1,1.65,14680.0,United Kingdom,2026-01-05
C517469,22384,LUNCH BAG PINK RETROSPOT,-3,1.45,14680.0,United Kingdom,2026-01-05
C517469,22327,ROUND SNACK BOXES SET OF 4 SKULLS,-1,2.55,14680.0,United Kingdom,2026-01-05
C517469,20726,LUNCH BAG WOODLAND,-1,1.45,14680.0,United Kingdom,2026-01-05
C517469,20727,LUNCH BAG  BLACK SKULL.,-3,1.45,14680.0,United Kingdom,2026-01-05
C517469,20724,RED SPOTTY CHARLOTTE BAG,-1,0.72,14680.0,United Kingdom,2026-01-05
C517469,22356,CHARLOTTE BAG PINK WITH WHITE SPOTS,-1,0.72,14680.0,United Kingdom,2026-01-05
C517469,20728,LUNCH BAG CARS BLUE,-1,1.45,14680.0,United Kingdom,2026-01-05
C517470,21206,STRAWBERRY HONEYCOMB  GARLAND ,-3,1.65,12472.0,Germany,2026-01-05
C517470,22629,SPACEBOY LUNCH BOX ,-1,1.95,12472.0,Germany,2026-01-05
C517470,20719,WOODLAND CHARLOTTE BAG,-3,0.85,12472.0,Germany,2026-01-05
C517470,20724,RED SPOTTY CHARLOTTE BAG,-2,0.85,12472.0,Germany,2026-01-05
C517470,21241,GREEN SPOTTY CUP,-1,0.85,12472.0,Germany,2026-01-05
517471,21904,HOUSE WRECKING METAL SIGN ,12,2.1,16170.0,United Kingdom,2026-01-05
517471,22190,LOCAL CAFE MUG,6,2.1,16170.0,United Kingdom,2026-01-05
517471,22505,MEMO BOARD COTTAGE DESIGN,4,4.95,16170.0,United Kingdom,2026-01-05
517471,11001,ASSTD DESIGN RACING CAR PEN,16,1.69,16170.0,United Kingdom,2026-01-05
517471,22419,LIPSTICK PEN RED,12,0.42,16170.0,United Kingdom,2026-01-05
517471,10123G,ARMY CAMO WRAPPING TAPE,12,0.65,16170.0,United Kingdom,2026-01-05
517471,22609,PENS ASSORTED SPACEBALL,36,0.85,16170.0,United Kingdom,2026-01-05
517471,10125,MINI FUNKY DESIGN TAPES,20,0.85,16170.0,United Kingdom,2026-01-05
517471,22029,SPACEBOY BIRTHDAY CARD,12,0.42,16170.0,United Kingdom,2026-01-05
517471,22498,WOODEN REGATTA BUNTING,3,5.95,16170.0,United Kingdom,2026-01-05
517471,22608,PENS ASSORTED FUNKY JEWELED ,36,0.85,16170.0,United Kingdom,2026-01-05
517471,22355,CHARLOTTE BAG SUKI DESIGN,10,0.85,16170.0,United Kingdom,2026-01-05
517471,22653,BUTTON BOX ,12,1.95,16170.0,United Kingdom,2026-01-05
517471,22635,CHILDS BREAKFAST SET DOLLY GIRL ,2,9.95,16170.0,United Kingdom,2026-01-05
C517472,22421,LIPSTICK PEN FUSCHIA,-2,0.42,14861.0,United Kingdom,2026-01-05
C517472,22419,LIPSTICK PEN RED,-1,0.42,14861.0,United Kingdom,2026-01-05
C517472,84845C,CARNATION SQUARE HANDY TIN,-3,1.25,14861.0,United Kingdom,2026-01-05
C517472,85123A,WHITE HANGING HEART T-LIGHT HOLDER,-2,2.95,14861.0,United Kingdom,2026-01-05
517471,22630,DOLLY GIRL LUNCH BOX,12,1.95,16170.0,United Kingdom,2026-01-05
517471,21249,WOODLAND  HEIGHT CHART STICKERS ,6,2.95,16170.0,United Kingdom,2026-01-05
517471,21908,CHOCOLATE THIS WAY METAL SIGN,12,2.1,16170.0,United Kingdom,2026-01-05
517471,22492,MINI PAINT SET VINTAGE ,36,0.65,16170.0,United Kingdom,2026-01-05
517471,21577,SAVE THE PLANET COTTON TOTE BAG,6,2.25,16170.0,United Kingdom,2026-01-05
517471,20670,VIP HOLIDAY PURSE,6,2.95,16170.0,United Kingdom,2026-01-05
C517473,21042,RED SPOTTY APRON ,-6,5.95,16779.0,United Kingdom,2026-01-05
C517473,21155,RED SPOTTY PEG BAG,-1,2.1,16779.0,United Kingdom,2026-01-05
C517473,47568,ENGLISH ROSE DESIGN PEG BAG,-2,1.69,16779.0,United Kingdom,2026-01-05
C517473,21039,RED SPOTTY SHOPPING BAG,-2,2.55,16779.0,United Kingdom,2026-01-05
C517473,85099F,JUMBO BAG STRAWBERRY,-1,1.95,16779.0,United Kingdom,2026-01-05
C517473,20725,LUNCH BAG RED SPOTTY,-1,1.45,16779.0,United Kingdom,2026-01-05
C517473,20727,LUNCH BAG  BLACK SKULL.,-1,1.45,16779.0,United Kingdom,2026-01-05
C517473,21080,SET/20 RED SPOTTY PAPER NAPKINS ,-2,0.64,16779.0,United Kingdom,2026-01-05
517474,85232D,SET/3 DECOUPAGE STACKING TINS,3,4.95,12609.0,Germany,2026-01-05
517474,POST,POSTAGE,2,18.0,12609.0,Germany,2026-01-05
517474,22326,ROUND SNACK BOXES SET OF4 WOODLAND ,6,2.95,12609.0,Germany,2026-01-05
517474,22328,ROUND SNACK BOXES SET OF 4 FRUITS ,6,2.95,12609.0,Germany,2026-01-05
517474,21164,HOME SWEET HOME METAL SIGN ,6,2.95,12609.0,Germany,2026-01-05
517474,21524,DOORMAT SPOTTY HOME SWEET HOME,2,7.49,12609.0,Germany,2026-01-05
517474,22303,COFFEE MUG APPLES DESIGN,12,2.55,12609.0,Germany,2026-01-05
517474,21399,BLUE  SPOTTY  COFFEE MUG,6,2.1,12609.0,Germany,2026-01-05
517474,21398,RED  SPOTTY COFFEE  MUG,6,2.1,12609.0,Germany,2026-01-05
517474,21754,HOME BUILDING BLOCK WORD,3,5.95,12609.0,Germany,2026-01-05
517474,22497,SET OF 2 TINS VINTAGE BATHROOM ,4,4.25,12609.0,Germany,2026-01-05
517474,85232B,SET/3 RUSSIAN DOLL STACKING TINS,9,4.95,12609.0,Germany,2026-01-05
517474,22704,WRAP RED APPLES ,25,0.42,12609.0,Germany,2026-01-05
517474,22554,PLASTERS IN TIN WOODLAND ANIMALS,12,1.65,12609.0,Germany,2026-01-05
517474,84849B,FAIRY SOAP SOAP HOLDER,12,1.69,12609.0,Germany,2026-01-05
517474,22077,6 RIBBONS RUSTIC CHARM,12,1.65,12609.0,Germany,2026-01-05
517474,84836,ZINC METAL HEART DECORATION,12,1.25,12609.0,Germany,2026-01-05
517474,84847,FLORAL BATHROOM SET,6,3.75,12609.0,Germany,2026-01-05
517474,21669,BLUE STRIPE CERAMIC DRAWER KNOB,12,1.25,12609.0,Germany,2026-01-05
517474,21671,RED SPOT CERAMIC DRAWER KNOB,12,1.25,12609.0,Germany,2026-01-05
517474,21672,WHITE SPOT RED CERAMIC DRAWER KNOB,12,1.25,12609.0,Germany,2026-01-05
517474,22551,PLASTERS IN TIN SPACEBOY,12,1.65,12609.0,Germany,2026-01-05
517474,21668,RED STRIPE CERAMIC DRAWER KNOB,12,1.25,12609.0,Germany,2026-01-05
C517475,21527,RED RETROSPOT TRADITIONAL TEAPOT ,-1,7.95,13446.0,United Kingdom,2026-01-05
C517476,47503J,SET/3 FLORAL GARDEN TOOLS IN BAG,-10,7.95,14608.0,United Kingdom,2026-01-05
C517477,85123A,WHITE HANGING HEART T-LIGHT HOLDER,-1,2.55,16705.0,United Kingdom,2026-01-05
517478,22383,LUNCH BAG SUKI  DESIGN ,4,1.65,14451.0,United Kingdom,2026-01-05
517478,20725,LUNCH BAG RED SPOTTY,4,1.65,14451.0,United Kingdom,2026-01-05
517478,21936,RED RETROSPOT PICNIC BAG,2,2.95,14451.0,United Kingdom,2026-01-05
517478,22470,HEART OF WICKER LARGE,3,2.95,14451.0,United Kingdom,2026-01-05
517478,84839,SWEETHEART KEY CABINET,2,6.75,14451.0,United Kingdom,2026-01-05
517478,22662,LUNCH BAG DOLLY GIRL DESIGN,3,1.65,14451.0,United Kingdom,2026-01-05
517478,21244,BLUE  SPOTTY PLATE ,12,1.69,14451.0,United Kingdom,2026-01-05
517478,20727,LUNCH BAG  BLACK SKULL.,6,1.65,14451.0,United Kingdom,2026-01-05
517478,22469,HEART OF WICKER SMALL,3,1.65,14451.0,United Kingdom,2026-01-05
517478,22173,METAL 4 HOOK HANGER FRENCH CHATEAU,2,2.95,14451.0,United Kingdom,2026-01-05
517478,22326,ROUND SNACK BOXES SET OF4 WOODLAND ,5,2.95,14451.0,United Kingdom,2026-01-05
517478,22629,SPACEBOY LUNCH BOX ,4,1.95,14451.0,United Kingdom,2026-01-05
517478,21211,SET OF 72 SKULL PAPER  DOILIES,1,1.45,14451.0,United Kingdom,2026-01-05
517478,22630,DOLLY GIRL LUNCH BOX,3,1.95,14451.0,United Kingdom,2026-01-05
517478,85184D,S/4 BLUE ROUND DECOUPAGE BOXES,2,2.95,14451.0,United Kingdom,2026-01-05
517478,22382,LUNCH BAG SPACEBOY DESIGN ,4,1.65,14451.0,United Kingdom,2026-01-05
517478,21937,STRAWBERRY   PICNIC BAG,2,2.95,14451.0,United Kingdom,2026-01-05
517478,22327,ROUND SNACK BOXES SET OF 4 SKULLS,9,2.95,14451.0,United Kingdom,2026-01-05
517478,84992,72 SWEETHEART FAIRY CAKE CASES,2,0.55,14451.0,United Kingdom,2026-01-05
517478,21213,PACK OF 72 SKULL CAKE CASES,3,0.55,14451.0,United Kingdom,2026-01-05
517478,20727,LUNCH BAG  BLACK SKULL.,1,1.65,14451.0,United Kingdom,2026-01-05
517478,21238,RED SPOTTY CUP,3,0.85,14451.0,United Kingdom,2026-01-05
517478,20675,BLUE SPOTTY BOWL,1,1.25,14451.0,United Kingdom,2026-01-05
517478,20677,PINK SPOTTY BOWL,1,1.25,14451.0,United Kingdom,2026-01-05
517478,21243,PINK  SPOTTY PLATE ,1,1.69,14451.0,United Kingdom,2026-01-05
517478,22328,ROUND SNACK BOXES SET OF 4 FRUITS ,1,2.95,14451.0,United Kingdom,2026-01-05
517478,22417,PACK OF 60 SPACEBOY CAKE CASES,2,0.55,14451.0,United Kingdom,2026-01-05
517478,21240,BLUE  SPOTTY CUP,1,0.85,14451.0,United Kingdom,2026-01-05
517478,21241,GREEN SPOTTY CUP,4,0.85,14451.0,United Kingdom,2026-01-05
517478,47589,CONGRATULATIONS BUNTING,2,5.45,14451.0,United Kingdom,2026-01-05
517478,47590B,PINK HAPPY BIRTHDAY BUNTING,2,5.45,14451.0,United Kingdom,2026-01-05
517478,35936,CERISE+GOLD CHRISTMAS TREE DEC,3,0.38,14451.0,United Kingdom,2026-01-05
517478,35937,CERISE+GOLD CHRISTMAS STOCKING DEC,3,0.38,14451.0,United Kingdom,2026-01-05
517478,22437,SET OF 9 BLACK SKULL BALLOONS,2,0.85,14451.0,United Kingdom,2026-01-05
517478,21975,PACK OF 60 DINOSAUR CAKE CASES,3,0.55,14451.0,United Kingdom,2026-01-05
517478,21212,PACK OF 72 RETRO SPOT CAKE CASES,2,0.55,14451.0,United Kingdom,2026-01-05
517478,21239,PINK  SPOTTY CUP,4,0.85,14451.0,United Kingdom,2026-01-05
517479,21471,STRAWBERRY RAFFIA FOOD COVER,6,3.75,15981.0,United Kingdom,2026-01-05
517479,10134,COLOURING PENCILS BROWN TUBE,10,1.25,15981.0,United Kingdom,2026-01-05
517479,10135,COLOURING PENCILS BROWN TUBE,10,1.25,15981.0,United Kingdom,2026-01-05
517479,21136,PAINTED METAL PEARS ASSORTED,16,1.69,15981.0,United Kingdom,2026-01-05
517479,21466,RED FLOWER CROCHET FOOD COVER,6,3.75,15981.0,United Kingdom,2026-01-05
517479,21472,LADYBIRD + BEE RAFFIA FOOD COVER,6,3.75,15981.0,United Kingdom,2026-01-05
517479,21259,VICTORIAN SEWING BOX SMALL ,2,5.95,15981.0,United Kingdom,2026-01-05
517479,22088,PAPER BUNTING COLOURED LACE,6,2.95,15981.0,United Kingdom,2026-01-05
517479,22128,PARTY CONES CANDY ASSORTED,12,1.25,15981.0,United Kingdom,2026-01-05
517479,22138,BAKING SET 9 PIECE RETROSPOT ,3,4.95,15981.0,United Kingdom,2026-01-05
517479,22551,PLASTERS IN TIN SPACEBOY,12,1.65,15981.0,United Kingdom,2026-01-05
517479,22556,PLASTERS IN TIN CIRCUS PARADE ,12,1.65,15981.0,United Kingdom,2026-01-05
517479,22557,PLASTERS IN TIN VINTAGE PAISLEY ,12,1.65,15981.0,United Kingdom,2026-01-05
517479,21918,SET 12 KIDS COLOUR  CHALK STICKS,24,0.42,15981.0,United Kingdom,2026-01-05
C517480,M,Manual,-1,3610.5,14028.0,United Kingdom,2026-01-05
517481,C2,CARRIAGE,1,100.0,12737.0,France,2026-01-05
517482,22379,RECYCLING BAG RETROSPOT ,5,2.1,17651.0,United Kingdom,2026-01-05
517482,22423,REGENCY CAKESTAND 3 TIER,1,12.75,17651.0,United Kingdom,2026-01-05
517482,21975,PACK OF 60 DINOSAUR CAKE CASES,24,0.55,17651.0,United Kingdom,2026-01-05
517482,21843,RED RETROSPOT CAKE STAND,1,10.95,17651.0,United Kingdom,2026-01-05
517482,84817,DANISH ROSE DECORATIVE PLATE,6,2.1,17651.0,United Kingdom,2026-01-05
517482,20914,SET/5 RED SPOTTY LID GLASS BOWLS,6,2.95,17651.0,United Kingdom,2026-01-05
517482,20711,JUMBO BAG TOYS ,10,1.95,17651.0,United Kingdom,2026-01-05
517482,22138,BAKING SET 9 PIECE RETROSPOT ,3,4.95,17651.0,United Kingdom,2026-01-05
517482,22424,ENAMEL BREAD BIN CREAM,1,12.75,17651.0,United Kingdom,2026-01-05
517482,22617,BAKING SET SPACEBOY DESIGN,3,4.95,17651.0,United Kingdom,2026-01-05
517482,21217,RED SPOTTY ROUND CAKE TINS,1,9.95,17651.0,United Kingdom,2026-01-05
517482,22384,LUNCH BAG PINK RETROSPOT,10,1.65,17651.0,United Kingdom,2026-01-05
517482,22329,ROUND CONTAINER SET OF 5 RETROSPOT,12,1.65,17651.0,United Kingdom,2026-01-05
517482,22501,PICNIC BASKET WICKER LARGE,2,9.95,17651.0,United Kingdom,2026-01-05
517482,35968,FOLK ART METAL HEART T-LIGHT HOLDER,12,0.38,17651.0,United Kingdom,2026-01-05
517482,20754,RETRO RED SPOTTY WASHING UP GLOVES,6,2.1,17651.0,United Kingdom,2026-01-05
517482,21431,GREEN GINGHAM FLOWER JEWELLERY BOX,8,1.65,17651.0,United Kingdom,2026-01-05
517482,20728,LUNCH BAG CARS BLUE,20,1.65,17651.0,United Kingdom,2026-01-05
517482,21100,CHARLIE AND LOLA CHARLOTTE BAG,20,1.65,17651.0,United Kingdom,2026-01-05
517482,85059,FRENCH ENAMEL WATER BASIN,4,3.75,17651.0,United Kingdom,2026-01-05
517483,M,Manual,1,3610.5,12737.0,France,2026-01-05
C517484,21424,WOODLAND STORAGE BOX LARGE ,-3,2.95,17612.0,United Kingdom,2026-01-05
C517484,21425,SKULLS STORAGE BOX LARGE,-5,2.95,17612.0,United Kingdom,2026-01-05
517485,C2,CARRIAGE,1,110.0,12678.0,France,2026-01-05
517486,22477,WATERING CAN GARDEN MARKER,10,1.25,17168.0,United Kingdom,2026-01-05
517486,20886,BOX OF 9 PEBBLE CANDLES,6,1.95,17168.0,United Kingdom,2026-01-05
517486,22508,DOORSTOP RETROSPOT HEART,4,3.75,17168.0,United Kingdom,2026-01-05
517486,20963,APPLE BATH SPONGE,10,1.25,17168.0,United Kingdom,2026-01-05
517486,22423,REGENCY CAKESTAND 3 TIER,1,12.75,17168.0,United Kingdom,2026-01-05
517486,21700,BIG DOUGHNUT FRIDGE MAGNETS,12,0.85,17168.0,United Kingdom,2026-01-05
517486,85217,ASSORTED ICE CREAM FRIDGE MAGNETS,12,0.65,17168.0,United Kingdom,2026-01-05
517486,22061,LARGE CAKE STAND  HANGING STRAWBERY,2,9.95,17168.0,United Kingdom,2026-01-05
517486,21110,LARGE CAKE TOWEL PINK SPOTS,10,6.75,17168.0,United Kingdom,2026-01-05
517486,21109,"LARGE CAKE TOWEL, CHOCOLATE SPOTS",10,6.75,17168.0,United Kingdom,2026-01-05
517486,22478,BIRDHOUSE GARDEN MARKER ,10,1.25,17168.0,United Kingdom,2026-01-05
517486,84270,ASSTD DESIGN BUBBLE GUM RING,30,0.21,17168.0,United Kingdom,2026-01-05
517486,22139,RETRO SPOT TEA SET CERAMIC 11 PC ,3,4.95,17168.0,United Kingdom,2026-01-05
517486,21830,ASSORTED CREEPY CRAWLIES,24,0.42,17168.0,United Kingdom,2026-01-05
517486,85099F,JUMBO BAG STRAWBERRY,10,1.95,17168.0,United Kingdom,2026-01-05
517486,20717,STRAWBERRY SHOPPER BAG,10,1.25,17168.0,United Kingdom,2026-01-05
517486,21471,STRAWBERRY RAFFIA FOOD COVER,6,3.75,17168.0,United Kingdom,2026-01-05
517486,85174,S/4 CACTI CANDLES,4,4.95,17168.0,United Kingdom,2026-01-05
517486,85172,HYACINTH BULB T-LIGHT CANDLES,16,0.42,17168.0,United Kingdom,2026-01-05
517486,21640,ASSORTED TUTTI FRUTTI  FOB NOTEBOOK,24,0.85,17168.0,United Kingdom,2026-01-05
517486,21112,"SWISS ROLL TOWEL, PINK  SPOTS",6,2.95,17168.0,United Kingdom,2026-01-05
517487,82494L,WOODEN FRAME ANTIQUE WHITE ,6,2.95,16779.0,United Kingdom,2026-01-05
517487,17039,INLAID WOOD INCENSE HOLDER,50,0.29,16779.0,United Kingdom,2026-01-05
517487,22242,"HOOK, 5 HANGER , MAGIC TOADSTOOL",12,1.65,16779.0,United Kingdom,2026-01-05
517487,22528,GARDENERS KNEELING PAD,3,1.25,16779.0,United Kingdom,2026-01-05
517487,35811A,ENAMEL PINK SUGAR CONTAINER,6,2.1,16779.0,United Kingdom,2026-01-05
517487,72802A,ROSE SCENT CANDLE IN JEWELLED BOX,18,3.81,16779.0,United Kingdom,2026-01-05
517487,21086,SET/6 RED SPOTTY PAPER CUPS,6,0.65,16779.0,United Kingdom,2026-01-05
517487,35809A,ENAMEL PINK TEA CONTAINER,6,2.1,16779.0,United Kingdom,2026-01-05
517487,35810A,ENAMEL PINK COFFEE CONTAINER,6,2.1,16779.0,United Kingdom,2026-01-05
517487,84986B,SET OF 36 SILVER PAPER DOILIES,24,1.45,16779.0,United Kingdom,2026-01-05
517487,84986B,SET OF 36 SILVER PAPER DOILIES,24,1.45,16779.0,United Kingdom,2026-01-05
517487,21931,JUMBO STORAGE BAG SUKI,10,1.95,16779.0,United Kingdom,2026-01-05
517487,71477,COLOUR GLASS. STAR T-LIGHT HOLDER,24,2.75,16779.0,United Kingdom,2026-01-05
517487,22443,GROW YOUR OWN HERBS SET OF 3,1,7.95,16779.0,United Kingdom,2026-01-05
517487,82482,WOODEN PICTURE FRAME WHITE FINISH,6,2.55,16779.0,United Kingdom,2026-01-05
517487,22332,SKULLS PARTY BAG + STICKER SET,3,1.65,16779.0,United Kingdom,2026-01-05
517487,22333,RETRO SPORT PARTY BAG + STICKER SET,3,1.65,16779.0,United Kingdom,2026-01-05
