Invoice,StockCode,Description,Quantity,Price,Customer ID,Country,InvoiceDate
530060,22361,GLASS JAR DAISY FRESH COTTON WOOL,1,5.91,,United Kingdom,2026-03-26
530060,22356,CHARLOTTE BAG PINK POLKADOT,1,1.66,,United Kingdom,2026-03-26
530060,22501,PICNIC BASKET WICKER LARGE,1,21.23,,United Kingdom,2026-03-26
530060,22133,PINK LOVE HEART SHAPE CUP,1,1.66,,United Kingdom,2026-03-26
530060,22494,EMERGENCY FIRST AID TIN ,1,2.51,,United Kingdom,2026-03-26
530060,22492,MINI PAINT SET VINTAGE ,1,1.66,,United Kingdom,2026-03-26
530060,22485,SET OF 2 WOODEN MARKET CRATES,1,25.49,,United Kingdom,2026-03-26
530060,22479,DAISY GARDEN MARKER,2,2.51,,United Kingdom,2026-03-26
530060,22478,BIRDHOUSE GARDEN MARKER ,2,2.51,,United Kingdom,2026-03-26
530060,22477,WATERING CAN GARDEN MARKER,2,2.51,,United Kingdom,2026-03-26
530060,22457,NATURAL SLATE HEART CHALKBOARD ,3,5.91,,United Kingdom,2026-03-26
530060,22440,BALLOON WATER BOMB PACK OF 35,1,0.85,,United Kingdom,2026-03-26
530060,22426,ENAMEL WASH BOWL CREAM,1,7.62,,United Kingdom,2026-03-26
530060,22355,CHARLOTTE BAG SUKI DESIGN,6,1.66,,United Kingdom,2026-03-26
530060,22409,MONEY BOX BISCUITS DESIGN,1,2.51,,United Kingdom,2026-03-26
530060,22417,PACK OF 60 SPACEBOY CAKE CASES,3,1.28,,United Kingdom,2026-03-26
530060,22419,LIPSTICK PEN RED,3,0.85,,United Kingdom,2026-03-26
530060,22423,REGENCY CAKESTAND 3 TIER,2,25.49,,United Kingdom,2026-03-26
530060,22576,SWALLOW WOODEN CHRISTMAS DECORATION,1,1.66,,United Kingdom,2026-03-26
530060,22574,HEART WOODEN CHRISTMAS DECORATION,2,1.66,,United Kingdom,2026-03-26
530060,22573,STAR WOODEN CHRISTMAS DECORATION,2,1.66,,United Kingdom,2026-03-26
530060,22572,ROCKING HORSE GREEN CHRISTMAS ,2,1.66,,United Kingdom,2026-03-26
530060,22571,ROCKING HORSE RED CHRISTMAS ,2,1.66,,United Kingdom,2026-03-26
530060,22570,FELTCRAFT CUSHION RABBIT,1,7.62,,United Kingdom,2026-03-26
530060,22569,FELTCRAFT CUSHION BUTTERFLY,1,7.62,,United Kingdom,2026-03-26
530060,22568,FELTCRAFT CUSHION OWL,1,7.62,,United Kingdom,2026-03-26
530060,22352,LUNCH BOX WITH CUTLERY RETROSPOT ,1,5.06,,United Kingdom,2026-03-26
530060,22560,TRADITIONAL MODELLING CLAY,1,2.51,,United Kingdom,2026-03-26
530060,22555,PLASTERS IN TIN STRONGMAN,1,3.36,,United Kingdom,2026-03-26
530060,22553,PLASTERS IN TIN SKULLS,1,3.36,,United Kingdom,2026-03-26
530060,22549,PICTURE DOMINOES,1,3.36,,United Kingdom,2026-03-26
530060,22537,MAGIC DRAWING SLATE DINOSAUR,1,0.85,,United Kingdom,2026-03-26
530060,22535,MAGIC DRAWING SLATE BUNNIES ,2,0.85,,United Kingdom,2026-03-26
530060,22534,MAGIC DRAWING SLATE SPACEBOY ,1,0.85,,United Kingdom,2026-03-26
530060,22589,CARDHOLDER GINGHAM STAR,1,5.06,,United Kingdom,2026-03-26
530060,22424,ENAMEL BREAD BIN CREAM,1,25.49,,United Kingdom,2026-03-26
530060,22557,PLASTERS IN TIN VINTAGE PAISLEY ,2,3.36,,United Kingdom,2026-03-26
530060,22348,TEA BAG PLATE RED RETROSPOT,1,1.66,,United Kingdom,2026-03-26
530060,22497,SET OF 2 TINS VINTAGE BATHROOM ,2,8.47,,United Kingdom,2026-03-26
530060,22340,NOEL GARLAND PAINTED ZINC ,1,3.36,,United Kingdom,2026-03-26
530060,21820,GLITTER HEART GARLAND WITH BELLS ,1,7.62,,United Kingdom,2026-03-26
530060,21808,"CHRISTMAS GARLAND STARS,TREES",8,3.36,,United Kingdom,2026-03-26
530060,21803,CHRISTMAS TREE STAR DECORATION,11,0.43,,United Kingdom,2026-03-26
530060,21802,CHRISTMAS TREE HEART DECORATION,9,0.43,,United Kingdom,2026-03-26
530060,21801,CHRISTMAS TREE DECORATION WITH BELL,13,0.43,,United Kingdom,2026-03-26
530060,22203,MILK PAN RED RETROSPOT,1,7.62,,United Kingdom,2026-03-26
530060,22199,FRYING PAN RED RETROSPOT,1,8.47,,United Kingdom,2026-03-26
530060,22198,LARGE POPCORN HOLDER ,1,3.36,,United Kingdom,2026-03-26
530060,22197,SMALL POPCORN HOLDER,1,1.66,,United Kingdom,2026-03-26
530060,22195,LARGE HEART MEASURING SPOONS,1,3.36,,United Kingdom,2026-03-26
530060,22342,HOME GARLAND PAINTED ZINC ,1,3.36,,United Kingdom,2026-03-26
530060,22183,CAKE STAND VICTORIAN FILIGREE MED,7,5.91,,United Kingdom,2026-03-26
530060,22180,RETROSPOT LAMP,1,21.23,,United Kingdom,2026-03-26
530060,22178,VICTORIAN GLASS HANGING T-LIGHT,2,2.51,,United Kingdom,2026-03-26
530060,22176,BLUE OWL SOFT TOY,12,5.91,,United Kingdom,2026-03-26
530060,22162,HEART GARLAND RUSTIC PADDED,1,3.36,,United Kingdom,2026-03-26
530060,22145,CHRISTMAS CRAFT HEART STOCKING ,1,4.21,,United Kingdom,2026-03-26
530060,21821,GLITTER STAR GARLAND WITH BELLS ,1,7.62,,United Kingdom,2026-03-26
530060,21829,DINOSAUR KEYRINGS ASSORTED,1,0.43,,United Kingdom,2026-03-26
530060,22189,CREAM HEART CARD HOLDER,1,8.47,,United Kingdom,2026-03-26
530060,21873,IF YOU CAN'T STAND THE HEAT MUG,1,3.36,,United Kingdom,2026-03-26
530060,22322,BIRD DECORATION GREEN POLKADOT,1,1.66,,United Kingdom,2026-03-26
530060,21843,RED RETROSPOT CAKE STAND,2,21.23,,United Kingdom,2026-03-26
530060,22311,OFFICE MUG WARMER BLACK+SILVER ,1,5.91,,United Kingdom,2026-03-26
530060,22274,FELTCRAFT DOLL EMILY,1,5.91,,United Kingdom,2026-03-26
530060,22273,FELTCRAFT DOLL MOLLY,1,5.91,,United Kingdom,2026-03-26
530060,22212,FOUR HOOK  WHITE LOVEBIRDS,2,4.21,,United Kingdom,2026-03-26
530060,21929,JUMBO BAG PINK VINTAGE PAISLEY,1,4.21,,United Kingdom,2026-03-26
530060,21918,SET 12 KIDS COLOUR  CHALK STICKS,3,0.85,,United Kingdom,2026-03-26
530060,21914,BLUE HARMONICA IN BOX ,2,2.51,,United Kingdom,2026-03-26
530060,22260,FELT EGG COSY BLUE RABBIT ,1,1.66,,United Kingdom,2026-03-26
530060,21894,POTTING SHED SEED ENVELOPES,1,2.51,,United Kingdom,2026-03-26
530060,21892,TRADITIONAL WOODEN CATCH CUP GAME ,1,2.51,,United Kingdom,2026-03-26
530060,21891,TRADITIONAL WOODEN SKIPPING ROPE,1,2.51,,United Kingdom,2026-03-26
530060,21890,S/6 WOODEN SKITTLES IN COTTON BAG,1,5.91,,United Kingdom,2026-03-26
530060,21880,RED RETROSPOT TAPE,1,1.66,,United Kingdom,2026-03-26
530060,21878,PACK OF 6 SANDCASTLE FLAGS ASSORTED,1,1.66,,United Kingdom,2026-03-26
530060,21903,MAN FLU METAL SIGN,1,4.21,,United Kingdom,2026-03-26
530060,21875,KINGS CHOICE MUG,1,3.36,,United Kingdom,2026-03-26
530061,21704,BAG 250g SWIRLY MARBLES,12,0.85,13115.0,United Kingdom,2026-03-26
530061,22149,FELTCRAFT 6 FLOWER FRIENDS,12,2.1,13115.0,United Kingdom,2026-03-26
530061,21705,BAG 500g SWIRLY MARBLES,12,1.65,13115.0,United Kingdom,2026-03-26
530061,22299,PIG KEYRING WITH LIGHT & SOUND ,24,1.25,13115.0,United Kingdom,2026-03-26
530061,20702,PINK PADDED MOBILE,3,4.25,13115.0,United Kingdom,2026-03-26
530061,20969,RED FLORAL FELTCRAFT SHOULDER BAG,6,3.75,13115.0,United Kingdom,2026-03-26
530061,20967,GREY FLORAL FELTCRAFT SHOULDER BAG,4,3.75,13115.0,United Kingdom,2026-03-26
530061,22568,FELTCRAFT CUSHION OWL,12,3.75,13115.0,United Kingdom,2026-03-26
530061,22569,FELTCRAFT CUSHION BUTTERFLY,12,3.75,13115.0,United Kingdom,2026-03-26
530061,22940,FELTCRAFT CHRISTMAS FAIRY,4,4.25,13115.0,United Kingdom,2026-03-26
530061,22570,FELTCRAFT CUSHION RABBIT,12,3.75,13115.0,United Kingdom,2026-03-26
530061,21892,TRADITIONAL WOODEN CATCH CUP GAME ,12,1.25,13115.0,United Kingdom,2026-03-26
530061,22145,CHRISTMAS CRAFT HEART STOCKING ,6,2.1,13115.0,United Kingdom,2026-03-26
530061,22075,6 RIBBONS ELEGANT CHRISTMAS ,12,1.65,13115.0,United Kingdom,2026-03-26
530061,21062,PARTY INVITES SPACEMAN,12,0.85,13115.0,United Kingdom,2026-03-26
530061,21063,PARTY INVITES JAZZ HEARTS,12,0.85,13115.0,United Kingdom,2026-03-26
530061,21058,PARTY INVITES WOODLAND,12,0.85,13115.0,United Kingdom,2026-03-26
530061,21059,PARTY INVITES DINOSAURS,12,0.85,13115.0,United Kingdom,2026-03-26
530061,84078A,SET/4 WHITE RETRO STORAGE CUBES ,1,39.95,13115.0,United Kingdom,2026-03-26
530061,21739,COSY SLIPPER SHOES SMALL GREEN,6,2.95,13115.0,United Kingdom,2026-03-26
530061,22617,BAKING SET SPACEBOY DESIGN,3,4.95,13115.0,United Kingdom,2026-03-26
530061,22077,6 RIBBONS RUSTIC CHARM,12,1.65,13115.0,United Kingdom,2026-03-26
530061,21743,STAR PORTABLE TABLE LIGHT ,12,2.95,13115.0,United Kingdom,2026-03-26
530061,21744,SNOWFLAKE PORTABLE TABLE LIGHT ,6,2.95,13115.0,United Kingdom,2026-03-26
530061,22754,SMALL RED BABUSHKA NOTEBOOK ,12,0.85,13115.0,United Kingdom,2026-03-26
530061,16161U,WRAP SUKI AND FRIENDS,25,0.42,13115.0,United Kingdom,2026-03-26
530061,22755,SMALL PURPLE BABUSHKA NOTEBOOK ,12,0.85,13115.0,United Kingdom,2026-03-26
530061,84670,JAPANESE CROCHETED ANIMAL,24,0.42,13115.0,United Kingdom,2026-03-26
530061,21495,SKULLS AND CROSSBONES WRAP,25,0.42,13115.0,United Kingdom,2026-03-26
530061,21703,BAG 125g SWIRLY MARBLES,12,0.42,13115.0,United Kingdom,2026-03-26
530061,22759,SET OF 3 NOTEBOOKS IN PARCEL,12,1.65,13115.0,United Kingdom,2026-03-26
530061,21498,RED RETROSPOT WRAP ,25,0.42,13115.0,United Kingdom,2026-03-26
530061,20971,PINK BLUE FELT CRAFT TRINKET BOX,12,1.25,13115.0,United Kingdom,2026-03-26
530061,20972,PINK CREAM FELT CRAFT TRINKET BOX ,12,1.25,13115.0,United Kingdom,2026-03-26
530061,22150,3 STRIPEY MICE FELTCRAFT,6,1.95,13115.0,United Kingdom,2026-03-26
530061,21912,VINTAGE SNAKES & LADDERS,4,3.75,13115.0,United Kingdom,2026-03-26
530061,21730,GLASS STAR FROSTED T-LIGHT HOLDER,3,4.95,13115.0,United Kingdom,2026-03-26
530061,85048,15CM CHRISTMAS GLASS BALL 20 LIGHTS,4,7.95,13115.0,United Kingdom,2026-03-26
530061,22050,PINK PAISLEY ROSE GIFT WRAP,25,0.42,13115.0,United Kingdom,2026-03-26
530061,21098,CHRISTMAS TOILET ROLL,12,1.25,13115.0,United Kingdom,2026-03-26
530061,21500,PINK POLKADOT WRAP ,25,0.42,13115.0,United Kingdom,2026-03-26
530061,21499,BLUE POLKADOT WRAP,25,0.42,13115.0,United Kingdom,2026-03-26
530061,35832,WOOLLY HAT SOCK GLOVE ADVENT STRING,12,2.95,13115.0,United Kingdom,2026-03-26
530061,22750,FELTCRAFT PRINCESS LOLA DOLL,4,3.75,13115.0,United Kingdom,2026-03-26
530061,22749,FELTCRAFT PRINCESS CHARLOTTE DOLL,4,3.75,13115.0,United Kingdom,2026-03-26
530061,21349,IVY HEART WREATH,2,6.75,13115.0,United Kingdom,2026-03-26
530061,84559A,3D SHEET OF DOG STICKERS,12,0.85,13115.0,United Kingdom,2026-03-26
530061,21258,VICTORIAN SEWING BOX LARGE,2,12.75,13115.0,United Kingdom,2026-03-26
530061,21257,VICTORIAN SEWING BOX MEDIUM,2,7.95,13115.0,United Kingdom,2026-03-26
530061,21259,VICTORIAN SEWING BOX SMALL ,2,5.95,13115.0,United Kingdom,2026-03-26
530061,22653,BUTTON BOX ,10,1.95,13115.0,United Kingdom,2026-03-26
530061,22652,TRAVEL SEWING KIT,20,1.65,13115.0,United Kingdom,2026-03-26
530061,22654,DELUXE SEWING KIT ,12,5.95,13115.0,United Kingdom,2026-03-26
530061,22355,CHARLOTTE BAG SUKI DESIGN,10,0.85,13115.0,United Kingdom,2026-03-26
530061,20725,LUNCH BAG RED RETROSPOT,10,1.65,13115.0,United Kingdom,2026-03-26
530061,22319,HAIRCLIPS FORTIES FABRIC ASSORTED,12,0.65,13115.0,United Kingdom,2026-03-26
530061,22585,PACK OF 6 BIRDY GIFT TAGS,12,1.25,13115.0,United Kingdom,2026-03-26
530061,22565,FELTCRAFT HAIRBANDS PINK AND WHITE ,12,0.85,13115.0,United Kingdom,2026-03-26
530061,22587,FELTCRAFT HAIRBAND RED AND BLUE,12,0.85,13115.0,United Kingdom,2026-03-26
530061,84559B,3D SHEET OF CAT STICKERS,12,0.85,13115.0,United Kingdom,2026-03-26
530062,22944,CHRISTMAS METAL POSTCARD WITH BELLS,288,1.06,17306.0,United Kingdom,2026-03-26
530062,22616,PACK OF 12 LONDON TISSUES ,96,0.29,17306.0,United Kingdom,2026-03-26
530062,21811,CHRISTMAS HANGING HEART WITH BELL,144,1.06,17306.0,United Kingdom,2026-03-26
530062,21809,CHRISTMAS HANGING TREE WITH BELL,144,1.06,17306.0,United Kingdom,2026-03-26
530062,21810,CHRISTMAS HANGING STAR WITH BELL,144,1.06,17306.0,United Kingdom,2026-03-26
C530063,20975,12 PENCILS SMALL TUBE RED RETROSPOT,-56,0.55,12931.0,United Kingdom,2026-03-26
530064,22739,RIBBON REEL CHRISTMAS SOCK BAUBLE,10,1.65,14911.0,EIRE,2026-03-26
530064,21743,STAR PORTABLE TABLE LIGHT ,12,2.95,14911.0,EIRE,2026-03-26
530064,22423,REGENCY CAKESTAND 3 TIER,16,10.95,14911.0,EIRE,2026-03-26
530064,21392,RED POLKADOT PUDDING BOWL,6,2.1,14911.0,EIRE,2026-03-26
530064,21393,BLUE POLKADOT PUDDING BOWL,6,2.1,14911.0,EIRE,2026-03-26
530064,21537,RED RETROSPOT PUDDING BOWL,4,4.25,14911.0,EIRE,2026-03-26
530064,21364,PEACE SMALL WOOD LETTERS,2,6.75,14911.0,EIRE,2026-03-26
530064,22585,PACK OF 6 BIRDY GIFT TAGS,24,1.25,14911.0,EIRE,2026-03-26
530064,21843,RED RETROSPOT CAKE STAND,2,10.95,14911.0,EIRE,2026-03-26
530064,20685,DOORMAT RED RETROSPOT,2,7.95,14911.0,EIRE,2026-03-26
530064,22866,HAND WARMER SCOTTY DOG DESIGN,12,2.1,14911.0,EIRE,2026-03-26
530064,22778,GLASS CLOCHE SMALL,4,3.95,14911.0,EIRE,2026-03-26
530064,22197,SMALL POPCORN HOLDER,100,0.72,14911.0,EIRE,2026-03-26
530064,22735,RIBBON REEL SOCKS AND MITTENS,10,1.65,14911.0,EIRE,2026-03-26
530064,22952,60 CAKE CASES VINTAGE CHRISTMAS,24,0.55,14911.0,EIRE,2026-03-26
530064,22198,LARGE POPCORN HOLDER ,50,1.45,14911.0,EIRE,2026-03-26
530064,21870,I CAN ONLY PLEASE ONE PERSON MUG,12,1.25,14911.0,EIRE,2026-03-26
530064,21067,VINTAGE RED TEATIME MUG,12,1.25,14911.0,EIRE,2026-03-26
530064,21069,VINTAGE BILLBOARD TEA MUG,12,1.25,14911.0,EIRE,2026-03-26
530064,84692,BOX OF 24 COCKTAIL PARASOLS,25,0.42,14911.0,EIRE,2026-03-26
530064,22061,LARGE CAKE STAND  HANGING STRAWBERY,4,9.95,14911.0,EIRE,2026-03-26
530064,21874,GIN AND TONIC MUG,12,1.25,14911.0,EIRE,2026-03-26
530064,21790,VINTAGE SNAP CARDS,12,0.85,14911.0,EIRE,2026-03-26
530064,22938,CUPCAKE LACE PAPER SET 6,12,1.95,14911.0,EIRE,2026-03-26
530064,21212,PACK OF 72 RETROSPOT CAKE CASES,24,0.55,14911.0,EIRE,2026-03-26
530064,21485,RETROSPOT HEART HOT WATER BOTTLE,3,4.95,14911.0,EIRE,2026-03-26
530064,22393,PAPERWEIGHT VINTAGE COLLAGE,12,0.85,14911.0,EIRE,2026-03-26
530064,22434,BALLOON PUMP WITH 10 BALLOONS,8,1.95,14911.0,EIRE,2026-03-26
C530065,20750,RED RETROSPOT MINI CASES,-2,7.95,14934.0,Channel Islands,2026-03-26
C530065,20725,LUNCH BAG RED RETROSPOT,-10,1.65,14934.0,Channel Islands,2026-03-26
C530065,20718,RED RETROSPOT SHOPPER BAG,-10,1.25,14934.0,Channel Islands,2026-03-26
C530065,21871,SAVE THE PLANET MUG,-12,1.25,14934.0,Channel Islands,2026-03-26
C530065,21224,SET/4 SKULL BADGES,-10,1.25,14934.0,Channel Islands,2026-03-26
C530065,16235,RECYCLED PENCIL WITH RABBIT ERASER,-60,0.21,14934.0,Channel Islands,2026-03-26
C530065,21172,PARTY METAL SIGN ,-12,1.45,14934.0,Channel Islands,2026-03-26
C530065,21908,CHOCOLATE THIS WAY METAL SIGN,-6,2.1,14934.0,Channel Islands,2026-03-26
C530065,21212,PACK OF 72 RETROSPOT CAKE CASES,-24,0.55,14934.0,Channel Islands,2026-03-26
C530065,21935,SUKI  SHOULDER BAG,-10,1.65,14934.0,Channel Islands,2026-03-26
C530065,21577,SAVE THE PLANET COTTON TOTE BAG,-6,2.25,14934.0,Channel Islands,2026-03-26
C530065,85049C,ROMANTIC PINKS RIBBONS ,-12,1.25,14934.0,Channel Islands,2026-03-26
C530065,21870,I CAN ONLY PLEASE ONE PERSON MUG,-12,1.25,14934.0,Channel Islands,2026-03-26
C530065,84692,BOX OF 24 COCKTAIL PARASOLS,-25,0.42,14934.0,Channel Islands,2026-03-26
C530065,22378,WALL TIDY RETROSPOT ,-5,2.1,14934.0,Channel Islands,2026-03-26
C530065,21916,SET 12 RETRO WHITE CHALK STICKS,-24,0.42,14934.0,Channel Islands,2026-03-26
C530065,22398,MAGNETS PACK OF 4 SWALLOWS,-12,1.25,14934.0,Channel Islands,2026-03-26
C530065,22509,SEWING BOX RETROSPOT DESIGN ,-1,16.95,14934.0,Channel Islands,2026-03-26
C530065,84050,PINK HEART SHAPE EGG FRYING PAN,-6,1.65,14934.0,Channel Islands,2026-03-26
C530065,21754,HOME BUILDING BLOCK WORD,-4,5.95,14934.0,Channel Islands,2026-03-26
C530065,21755,LOVE BUILDING BLOCK WORD,-4,5.95,14934.0,Channel Islands,2026-03-26
C530065,22077,6 RIBBONS RUSTIC CHARM,-12,1.65,14934.0,Channel Islands,2026-03-26
C530065,22181,SNOWSTORM PHOTO FRAME FRIDGE MAGNET,-12,0.85,14934.0,Channel Islands,2026-03-26
C530065,21907,I'M ON HOLIDAY METAL SIGN,-6,2.1,14934.0,Channel Islands,2026-03-26
C530065,21166,COOK WITH WINE METAL SIGN ,-12,1.95,14934.0,Channel Islands,2026-03-26
C530065,22413,METAL SIGN TAKE IT OR LEAVE IT ,-6,2.95,14934.0,Channel Islands,2026-03-26
C530065,21877,HOME SWEET HOME MUG,-12,1.25,14934.0,Channel Islands,2026-03-26
C530065,22507,MEMO BOARD RETROSPOT  DESIGN,-4,4.95,14934.0,Channel Islands,2026-03-26
C530065,21181,PLEASE ONE PERSON METAL SIGN,-6,2.1,14934.0,Channel Islands,2026-03-26
530066,21484,CHICK GREY HOT WATER BOTTLE,1,3.45,17068.0,United Kingdom,2026-03-26
530066,22379,RECYCLING BAG RETROSPOT ,2,2.1,17068.0,United Kingdom,2026-03-26
530066,22380,TOY TIDY SPACEBOY  ,3,2.1,17068.0,United Kingdom,2026-03-26
530066,85099C,JUMBO  BAG BAROQUE BLACK WHITE,5,1.95,17068.0,United Kingdom,2026-03-26
530066,22890,NOVELTY BISCUITS CAKE STAND 3 TIER,1,9.95,17068.0,United Kingdom,2026-03-26
530066,22326,ROUND SNACK BOXES SET OF4 WOODLAND ,2,2.95,17068.0,United Kingdom,2026-03-26
530066,22910,PAPER CHAIN KIT VINTAGE CHRISTMAS,2,2.95,17068.0,United Kingdom,2026-03-26
530066,47566B,TEA TIME PARTY BUNTING,2,4.65,17068.0,United Kingdom,2026-03-26
530066,22113,GREY HEART HOT WATER BOTTLE,1,3.75,17068.0,United Kingdom,2026-03-26
530066,21485,RETROSPOT HEART HOT WATER BOTTLE,1,4.95,17068.0,United Kingdom,2026-03-26
530066,22968,ROSE COTTAGE KEEPSAKE BOX ,1,9.95,17068.0,United Kingdom,2026-03-26
530066,22374,AIRLINE BAG VINTAGE JET SET RED,2,4.25,17068.0,United Kingdom,2026-03-26
530066,22411,JUMBO SHOPPER VINTAGE RED PAISLEY,5,1.95,17068.0,United Kingdom,2026-03-26
530066,21928,JUMBO BAG SCANDINAVIAN PAISLEY,5,1.95,17068.0,United Kingdom,2026-03-26
530066,85099F,JUMBO BAG STRAWBERRY,5,1.95,17068.0,United Kingdom,2026-03-26
530066,85099B,JUMBO BAG RED RETROSPOT,6,1.95,17068.0,United Kingdom,2026-03-26
530066,22111,SCOTTIE DOG HOT WATER BOTTLE,1,4.95,17068.0,United Kingdom,2026-03-26
530066,35832,WOOLLY HAT SOCK GLOVE ADVENT STRING,7,2.95,17068.0,United Kingdom,2026-03-26
530066,21429,RED GINGHAM ROSE JEWELLERY BOX,3,1.65,17068.0,United Kingdom,2026-03-26
530066,22376,AIRLINE BAG VINTAGE JET SET WHITE,2,4.25,17068.0,United Kingdom,2026-03-26
530066,22375,AIRLINE BAG VINTAGE JET SET BROWN,1,4.25,17068.0,United Kingdom,2026-03-26
530066,22386,JUMBO BAG PINK POLKADOT,5,1.95,17068.0,United Kingdom,2026-03-26
530067,22466,FAIRY TALE COTTAGE NIGHTLIGHT,5,1.95,16960.0,United Kingdom,2026-03-26
530067,21481,FAWN BLUE HOT WATER BOTTLE,2,2.95,16960.0,United Kingdom,2026-03-26
530067,20971,PINK BLUE FELT CRAFT TRINKET BOX,2,1.25,16960.0,United Kingdom,2026-03-26
530067,20972,PINK CREAM FELT CRAFT TRINKET BOX ,2,1.25,16960.0,United Kingdom,2026-03-26
530067,21731,RED TOADSTOOL LED NIGHT LIGHT,2,1.65,16960.0,United Kingdom,2026-03-26
530067,84670,JAPANESE CROCHETED ANIMAL,24,0.42,16960.0,United Kingdom,2026-03-26
530067,21914,BLUE HARMONICA IN BOX ,3,1.25,16960.0,United Kingdom,2026-03-26
530067,21058,PARTY INVITES WOODLAND,1,0.85,16960.0,United Kingdom,2026-03-26
530067,22667,RECIPE BOX RETROSPOT ,3,2.95,16960.0,United Kingdom,2026-03-26
530067,22580,ADVENT CALENDAR GINGHAM SACK,1,5.95,16960.0,United Kingdom,2026-03-26
530067,85232B,SET OF 3 BABUSHKA STACKING TINS,2,4.95,16960.0,United Kingdom,2026-03-26
530067,21913,VINTAGE SEASIDE JIGSAW PUZZLES,1,3.75,16960.0,United Kingdom,2026-03-26
530067,22866,HAND WARMER SCOTTY DOG DESIGN,1,2.1,16960.0,United Kingdom,2026-03-26
530067,22617,BAKING SET SPACEBOY DESIGN,1,4.95,16960.0,United Kingdom,2026-03-26
530067,22521,CHILDS GARDEN TROWEL PINK,2,0.85,16960.0,United Kingdom,2026-03-26
530067,22907,PACK OF 20 NAPKINS PANTRY DESIGN,3,0.85,16960.0,United Kingdom,2026-03-26
530067,22941,CHRISTMAS LIGHTS 10 REINDEER,1,8.5,16960.0,United Kingdom,2026-03-26
530067,22520,CHILDS GARDEN TROWEL BLUE ,2,0.85,16960.0,United Kingdom,2026-03-26
530067,22131,FOOD CONTAINER SET 3 LOVE HEART ,1,1.95,16960.0,United Kingdom,2026-03-26
530067,20963,APPLE BATH SPONGE,1,1.25,16960.0,United Kingdom,2026-03-26
530067,22027,TEA PARTY BIRTHDAY CARD,12,0.42,16960.0,United Kingdom,2026-03-26
530067,21519,GIN & TONIC DIET GREETING CARD ,12,0.42,16960.0,United Kingdom,2026-03-26
530067,21509,COWBOYS AND INDIANS BIRTHDAY CARD ,12,0.42,16960.0,United Kingdom,2026-03-26
530067,22150,3 STRIPEY MICE FELTCRAFT,1,1.95,16960.0,United Kingdom,2026-03-26
530067,22150,3 STRIPEY MICE FELTCRAFT,1,1.95,16960.0,United Kingdom,2026-03-26
530067,22563,HAPPY STENCIL CRAFT,1,1.25,16960.0,United Kingdom,2026-03-26
530067,21058,PARTY INVITES WOODLAND,3,0.85,16960.0,United Kingdom,2026-03-26
530067,22331,WOODLAND PARTY BAG + STICKER SET,4,1.65,16960.0,United Kingdom,2026-03-26
530067,22910,PAPER CHAIN KIT VINTAGE CHRISTMAS,2,2.95,16960.0,United Kingdom,2026-03-26
530067,21832,CHOCOLATE CALCULATOR,1,1.65,16960.0,United Kingdom,2026-03-26
530067,22631,CIRCUS PARADE LUNCH BOX ,1,1.95,16960.0,United Kingdom,2026-03-26
530067,22865,HAND WARMER OWL DESIGN,1,2.1,16960.0,United Kingdom,2026-03-26
530067,22630,DOLLY GIRL LUNCH BOX,14,1.95,16960.0,United Kingdom,2026-03-26
530067,22629,SPACEBOY LUNCH BOX ,2,1.95,16960.0,United Kingdom,2026-03-26
530067,20963,APPLE BATH SPONGE,1,1.25,16960.0,United Kingdom,2026-03-26
530067,21210,SET OF 72 RETROSPOT PAPER  DOILIES,1,1.45,16960.0,United Kingdom,2026-03-26
530067,21973,SET OF 36 MUSHROOM PAPER DOILIES,1,1.45,16960.0,United Kingdom,2026-03-26
530067,22949,36 DOILIES DOLLY GIRL,1,1.45,16960.0,United Kingdom,2026-03-26
530067,21481,FAWN BLUE HOT WATER BOTTLE,2,2.95,16960.0,United Kingdom,2026-03-26
530067,84029E,RED WOOLLY HOTTIE WHITE HEART.,2,3.75,16960.0,United Kingdom,2026-03-26
530067,22662,LUNCH BAG DOLLY GIRL DESIGN,1,1.65,16960.0,United Kingdom,2026-03-26
530067,21491,SET OF THREE VINTAGE GIFT WRAPS,3,1.95,16960.0,United Kingdom,2026-03-26
530067,21703,BAG 125g SWIRLY MARBLES,5,0.42,16960.0,United Kingdom,2026-03-26
530067,21122,SET/10 PINK POLKADOT PARTY CANDLES,1,1.25,16960.0,United Kingdom,2026-03-26
530067,84378,SET OF 3 HEART COOKIE CUTTERS,2,1.25,16960.0,United Kingdom,2026-03-26
530067,22566,FELTCRAFT HAIRBAND PINK AND PURPLE,4,0.85,16960.0,United Kingdom,2026-03-26
530067,22086,PAPER CHAIN KIT 50'S CHRISTMAS ,1,2.95,16960.0,United Kingdom,2026-03-26
530067,22034,ROBIN CHRISTMAS CARD,12,0.42,16960.0,United Kingdom,2026-03-26
530067,22748,POPPY'S PLAYHOUSE KITCHEN,2,2.1,16960.0,United Kingdom,2026-03-26
530067,22329,ROUND CONTAINER SET OF 5 RETROSPOT,1,1.65,16960.0,United Kingdom,2026-03-26
530067,21448,12 DAISY PEGS IN WOOD BOX,1,1.65,16960.0,United Kingdom,2026-03-26
530067,22865,HAND WARMER OWL DESIGN,2,2.1,16960.0,United Kingdom,2026-03-26
530067,22496,SET OF 2 ROUND TINS DUTCH CHEESE,2,2.95,16960.0,United Kingdom,2026-03-26
530067,22495,SET OF 2 ROUND TINS CAMEMBERT ,1,2.95,16960.0,United Kingdom,2026-03-26
530067,21832,CHOCOLATE CALCULATOR,3,1.65,16960.0,United Kingdom,2026-03-26
530067,35970,ZINC FOLKART SLEIGH BELLS,6,1.69,16960.0,United Kingdom,2026-03-26
530067,21731,RED TOADSTOOL LED NIGHT LIGHT,5,1.65,16960.0,United Kingdom,2026-03-26
530067,47594B,SCOTTIES DESIGN WASHBAG,2,1.95,16960.0,United Kingdom,2026-03-26
530067,22662,LUNCH BAG DOLLY GIRL DESIGN,5,1.65,16960.0,United Kingdom,2026-03-26
530067,22745,POPPY'S PLAYHOUSE BEDROOM ,2,2.1,16960.0,United Kingdom,2026-03-26
530067,22746,POPPY'S PLAYHOUSE LIVINGROOM ,2,2.1,16960.0,United Kingdom,2026-03-26
530067,22747,POPPY'S PLAYHOUSE BATHROOM,1,2.1,16960.0,United Kingdom,2026-03-26
530067,84670,JAPANESE CROCHETED ANIMAL,12,0.42,16960.0,United Kingdom,2026-03-26
530068,20733,GOLD MINI TAPE MEASURE ,3,0.85,14606.0,United Kingdom,2026-03-26
530068,20738,GREEN MINI TAPE MEASURE ,4,0.85,14606.0,United Kingdom,2026-03-26
530068,21121,SET/10 RED POLKADOT PARTY CANDLES,1,1.25,14606.0,United Kingdom,2026-03-26
530068,22154,ANGEL DECORATION 3 BUTTONS ,1,0.42,14606.0,United Kingdom,2026-03-26
530068,22153,ANGEL DECORATION STARS ON DRESS,2,0.42,14606.0,United Kingdom,2026-03-26
530068,21892,TRADITIONAL WOODEN CATCH CUP GAME ,1,1.25,14606.0,United Kingdom,2026-03-26
530068,35957,SMALLFOLKART BAUBLE CHRISTMAS DEC,1,0.42,14606.0,United Kingdom,2026-03-26
530068,22207,FRYING PAN UNION FLAG,1,4.25,14606.0,United Kingdom,2026-03-26
530068,22314,OFFICE MUG WARMER CHOC+BLUE,1,2.95,14606.0,United Kingdom,2026-03-26
530068,22178,VICTORIAN GLASS HANGING T-LIGHT,24,1.25,14606.0,United Kingdom,2026-03-26
530068,20735,BLACK MINI TAPE MEASURE ,3,0.85,14606.0,United Kingdom,2026-03-26
530068,22427,ENAMEL FLOWER JUG CREAM,4,5.95,14606.0,United Kingdom,2026-03-26
530068,20734,SILVER MINI TAPE MEASURE ,8,0.85,14606.0,United Kingdom,2026-03-26
530068,22505,MEMO BOARD COTTAGE DESIGN,1,4.95,14606.0,United Kingdom,2026-03-26
530068,20985,HEART CALCULATOR,1,1.25,14606.0,United Kingdom,2026-03-26
530068,20996,JAZZ HEARTS ADDRESS BOOK,3,0.42,14606.0,United Kingdom,2026-03-26
530068,21463,MIRRORED DISCO BALL ,1,5.95,14606.0,United Kingdom,2026-03-26
530068,21464,DISCO BALL ROTATOR BATTERY OPERATED,1,4.25,14606.0,United Kingdom,2026-03-26
530068,35957,SMALLFOLKART BAUBLE CHRISTMAS DEC,1,0.42,14606.0,United Kingdom,2026-03-26
530068,22507,MEMO BOARD RETROSPOT  DESIGN,1,4.95,14606.0,United Kingdom,2026-03-26
530068,22650,CERAMIC PIRATE CHEST MONEY BANK,4,1.45,14606.0,United Kingdom,2026-03-26
530068,21892,TRADITIONAL WOODEN CATCH CUP GAME ,4,1.25,14606.0,United Kingdom,2026-03-26
530068,21035,SET/2 RED RETROSPOT TEA TOWELS ,2,2.95,14606.0,United Kingdom,2026-03-26
530068,22139,RETROSPOT TEA SET CERAMIC 11 PC ,2,4.95,14606.0,United Kingdom,2026-03-26
530068,22379,RECYCLING BAG RETROSPOT ,1,2.1,14606.0,United Kingdom,2026-03-26
530068,21169,YOU'RE CONFUSING ME METAL SIGN ,1,1.69,14606.0,United Kingdom,2026-03-26
530068,21623,VINTAGE UNION JACK MEMOBOARD,1,9.95,14606.0,United Kingdom,2026-03-26
C530069,22070,SMALL RED RETROSPOT MUG IN BOX ,-1,3.75,12494.0,France,2026-03-26
C530069,22071,SMALL WHITE RETROSPOT MUG IN BOX ,-1,3.75,12494.0,France,2026-03-26
530070,21988,PACK OF 6 SKULL PAPER PLATES,4,0.85,16876.0,United Kingdom,2026-03-26
530070,21033,JUMBO BAG CHARLIE AND LOLA TOYS,2,2.95,16876.0,United Kingdom,2026-03-26
530070,20728,LUNCH BAG CARS BLUE,1,1.65,16876.0,United Kingdom,2026-03-26
530070,22371,AIRLINE BAG VINTAGE TOKYO 78,1,4.25,16876.0,United Kingdom,2026-03-26
530070,22077,6 RIBBONS RUSTIC CHARM,1,1.65,16876.0,United Kingdom,2026-03-26
530070,22894,TABLECLOTH RED APPLES DESIGN ,1,8.5,16876.0,United Kingdom,2026-03-26
530070,22939,APRON APPLE DELIGHT,1,4.95,16876.0,United Kingdom,2026-03-26
530070,22332,SKULLS PARTY BAG + STICKER SET,3,1.65,16876.0,United Kingdom,2026-03-26
530070,20766,GARDEN PATH SKETCHBOOK,1,3.75,16876.0,United Kingdom,2026-03-26
