Invoice,StockCode,Description,Quantity,Price,Customer ID,Country,InvoiceDate
520571,84912A,PINK ROSE WASHBAG,1,3.36,,United Kingdom,2026-01-30
520571,84839,SWEETHEART KEY CABINET,1,12.72,,United Kingdom,2026-01-30
520571,84692,BOX OF 24 COCKTAIL PARASOLS,1,0.85,,United Kingdom,2026-01-30
520571,84534B,FAIRY CAKE NOTEBOOK A5 SIZE,1,1.66,,United Kingdom,2026-01-30
520571,84659A,WHITE TRAVEL ALARM CLOCK,1,2.51,,United Kingdom,2026-01-30
520571,84536B,FAIRY CAKES NOTEBOOK A7 SIZE,1,0.85,,United Kingdom,2026-01-30
520571,84913A,SOFT PINK ROSE TOWEL ,1,3.36,,United Kingdom,2026-01-30
520571,84683,CLASSICAL ROSE CANDLESTAND,3,2.51,,United Kingdom,2026-01-30
520571,84913B,MINT GREEN ROSE TOWEL,2,3.36,,United Kingdom,2026-01-30
520571,85232B,SET OF 3 BABUSHKA STACKING TINS,2,10.17,,United Kingdom,2026-01-30
520571,84991,60 TEATIME FAIRY CAKE CASES,1,1.28,,United Kingdom,2026-01-30
520571,85123A,WHITE HANGING HEART T-LIGHT HOLDER,2,5.91,,United Kingdom,2026-01-30
520571,85136C,RED SHARK HELICOPTER,1,8.47,,United Kingdom,2026-01-30
520571,85150,LADIES & GENTLEMEN METAL SIGN,1,5.06,,United Kingdom,2026-01-30
520571,85176,SEWING SUSAN 21 NEEDLE SET,2,1.66,,United Kingdom,2026-01-30
520571,85184C,S/4 VALENTINE DECOUPAGE HEART BOX,1,5.91,,United Kingdom,2026-01-30
520571,20963,APPLE BATH SPONGE,1,2.51,,United Kingdom,2026-01-30
520571,84520B,PACK 20 ENGLISH ROSE PAPER NAPKINS,13,1.66,,United Kingdom,2026-01-30
520571,84917,WHITE HAND TOWEL WITH BUTTERFLY,2,4.21,,United Kingdom,2026-01-30
520571,84378,SET OF 3 HEART COOKIE CUTTERS,1,2.51,,United Kingdom,2026-01-30
520571,22653,BUTTON BOX ,1,4.21,,United Kingdom,2026-01-30
520571,35916B,BLUE FELT HANGING HEART W FLOWER,1,1.66,,United Kingdom,2026-01-30
520571,20966,SANDWICH BATH SPONGE,1,2.51,,United Kingdom,2026-01-30
520571,22630,DOLLY GIRL LUNCH BOX,5,4.21,,United Kingdom,2026-01-30
520571,22635,CHILDS BREAKFAST SET DOLLY GIRL ,1,20.38,,United Kingdom,2026-01-30
520571,22654,DELUXE SEWING KIT ,1,11.87,,United Kingdom,2026-01-30
520571,22659,LUNCH BOX I LOVE LONDON,2,4.21,,United Kingdom,2026-01-30
520571,22662,LUNCH BAG DOLLY GIRL DESIGN,1,4.21,,United Kingdom,2026-01-30
520571,22665,RECIPE BOX BLUE SKETCHBOOK DESIGN,2,5.91,,United Kingdom,2026-01-30
520571,22666,RECIPE BOX PANTRY YELLOW DESIGN,1,5.91,,United Kingdom,2026-01-30
520571,22668,PINK BABY BUNTING,1,5.91,,United Kingdom,2026-01-30
520571,22676,"FRENCH BLUE METAL DOOR SIGN, 1",1,2.51,,United Kingdom,2026-01-30
520571,22677,"FRENCH BLUE METAL DOOR SIGN, 2",2,2.51,,United Kingdom,2026-01-30
520571,22680,"FRENCH BLUE METAL DOOR SIGN, 5",2,2.51,,United Kingdom,2026-01-30
520571,22681,"FRENCH BLUE METAL DOOR SIGN, 6",1,2.51,,United Kingdom,2026-01-30
520571,22684,"FRENCH BLUE METAL DOOR SIGN, 9",4,2.51,,United Kingdom,2026-01-30
520571,22686,"FRENCH BLUE METAL DOOR SIGN, No",1,2.51,,United Kingdom,2026-01-30
520571,22697,GREEN REGENCY TEACUP AND SAUCER,3,5.91,,United Kingdom,2026-01-30
520571,22698,PINK REGENCY TEACUP AND SAUCER,1,5.91,,United Kingdom,2026-01-30
520571,22699,ROSES REGENCY TEACUP AND SAUCER ,1,5.91,,United Kingdom,2026-01-30
520571,22758,LARGE PURPLE BABUSHKA NOTEBOOK  ,2,2.51,,United Kingdom,2026-01-30
520571,84077,WORLD WAR 2 GLIDERS ASSTD DESIGNS,6,0.43,,United Kingdom,2026-01-30
520571,20981,12 PENCILS TALL TUBE WOODLAND,1,1.66,,United Kingdom,2026-01-30
520571,22614,PACK OF 12 SPACEBOY TISSUES,1,0.85,,United Kingdom,2026-01-30
520571,21000,ROSE DU SUD COSMETICS BAG,1,3.36,,United Kingdom,2026-01-30
520571,21770,OPEN CLOSED METAL SIGN,1,10.17,,United Kingdom,2026-01-30
520571,21786,RAIN HAT WITH RED SPOTS,5,0.85,,United Kingdom,2026-01-30
520571,21788,KIDS RAIN MAC BLUE,1,1.66,,United Kingdom,2026-01-30
520571,21789,KIDS RAIN MAC PINK,1,1.66,,United Kingdom,2026-01-30
520571,21874,GIN AND TONIC MUG,1,3.36,,United Kingdom,2026-01-30
520571,21890,S/6 WOODEN SKITTLES IN COTTON BAG,1,5.91,,United Kingdom,2026-01-30
520571,21891,TRADITIONAL WOODEN SKIPPING ROPE,1,2.51,,United Kingdom,2026-01-30
520571,21915,RED  HARMONICA IN BOX ,2,2.51,,United Kingdom,2026-01-30
520571,21754,HOME BUILDING BLOCK WORD,3,5.91,,United Kingdom,2026-01-30
520571,21918,SET 12 KIDS COLOUR  CHALK STICKS,2,0.85,,United Kingdom,2026-01-30
520571,15036,ASSORTED COLOURS SILK FAN,2,1.28,,United Kingdom,2026-01-30
520571,15044C,PURPLE PAPER PARASOL,2,5.91,,United Kingdom,2026-01-30
520571,20717,STRAWBERRY SHOPPER BAG,1,2.51,,United Kingdom,2026-01-30
520571,20718,RED SPOTTY SHOPPER BAG,1,2.51,,United Kingdom,2026-01-30
520571,20726,LUNCH BAG WOODLAND,1,4.21,,United Kingdom,2026-01-30
520571,20829,GLITTER HANGING BUTTERFLY STRING,1,4.21,,United Kingdom,2026-01-30
520571,20903,VINTAGE KEEPSAKE BOX TRAVELOGUE,1,12.72,,United Kingdom,2026-01-30
520571,20960,WATERMELON BATH SPONGE,1,2.51,,United Kingdom,2026-01-30
520571,21935,SUKI  SHOULDER BAG,1,3.36,,United Kingdom,2026-01-30
520571,21733,RED HANGING HEART T-LIGHT HOLDER,2,5.91,,United Kingdom,2026-01-30
520571,21731,RED TOADSTOOL LED NIGHT LIGHT,1,3.36,,United Kingdom,2026-01-30
520571,21715,GIRLS VINTAGE TIN SEASIDE BUCKET,1,5.06,,United Kingdom,2026-01-30
520571,21001,ROSE DU SUD WASHBAG ,1,4.21,,United Kingdom,2026-01-30
520571,21063,PARTY INVITES JAZZ HEARTS,3,1.66,,United Kingdom,2026-01-30
520571,21071,VINTAGE BILLBOARD DRINK ME MUG,1,2.51,,United Kingdom,2026-01-30
520571,21080,SET/20 RED SPOTTY PAPER NAPKINS ,2,1.66,,United Kingdom,2026-01-30
520571,21212,PACK OF 72 RETRO SPOT CAKE CASES,1,1.28,,United Kingdom,2026-01-30
520571,21239,PINK  SPOTTY CUP,1,1.66,,United Kingdom,2026-01-30
520571,21240,BLUE  SPOTTY CUP,1,1.66,,United Kingdom,2026-01-30
520571,21242,RED SPOTTY PLATE ,8,3.36,,United Kingdom,2026-01-30
520571,21314,SMALL GLASS HEART TRINKET POT,2,4.21,,United Kingdom,2026-01-30
520571,21327,SKULLS WRITING SET ,1,3.36,,United Kingdom,2026-01-30
520571,21361,LOVE LARGE WOOD LETTERS ,1,25.49,,United Kingdom,2026-01-30
520571,21385,IVORY HANGING DECORATION  HEART,1,1.66,,United Kingdom,2026-01-30
520571,21399,BLUE  SPOTTY  COFFEE MUG,1,4.21,,United Kingdom,2026-01-30
520571,21408,SPOTTY PINK DUCK DOORSTOP,3,8.47,,United Kingdom,2026-01-30
520571,21481,FAWN BLUE HOT WATER BOTTLE,1,5.91,,United Kingdom,2026-01-30
520571,21488,RED WHITE SCARF  HOT WATER BOTTLE,1,8.47,,United Kingdom,2026-01-30
520571,21669,BLUE STRIPE CERAMIC DRAWER KNOB,1,2.51,,United Kingdom,2026-01-30
520571,21670,BLUE SPOT CERAMIC DRAWER KNOB,18,2.51,,United Kingdom,2026-01-30
520571,21673,WHITE SPOT BLUE CERAMIC DRAWER KNOB,1,2.51,,United Kingdom,2026-01-30
520571,20984,12 PENCILS TALL TUBE POSY,1,1.66,,United Kingdom,2026-01-30
520571,22560,TRADITIONAL MODELLING CLAY,1,2.51,,United Kingdom,2026-01-30
520571,84509A,SET OF 4 ENGLISH ROSE PLACEMATS,2,7.62,,United Kingdom,2026-01-30
520571,22551,PLASTERS IN TIN SPACEBOY,1,3.36,,United Kingdom,2026-01-30
520571,22630,DOLLY GIRL LUNCH BOX,4,1.95,,United Kingdom,2026-01-30
520571,22628,PICNIC BOXES SET OF 3 RETROSPOT ,2,4.95,,United Kingdom,2026-01-30
520571,22381,TOY TIDY PINK RETROSPOT  ,9,2.1,,United Kingdom,2026-01-30
520571,22627,MINT KITCHEN SCALES,1,8.5,,United Kingdom,2026-01-30
520571,21875,KINGS CHOICE MUG,6,1.25,,United Kingdom,2026-01-30
520571,22629,SPACEBOY LUNCH BOX ,4,1.95,,United Kingdom,2026-01-30
520571,22667,RECIPE BOX RETRO SPOT DESIGN,3,2.95,,United Kingdom,2026-01-30
520571,20961,STRAWBERRY BATH SPONGE ,1,2.51,,United Kingdom,2026-01-30
520571,20914,SET/5 RED SPOTTY LID GLASS BOWLS,2,2.95,,United Kingdom,2026-01-30
520571,21936,RED RETROSPOT PICNIC BAG,1,5.91,,United Kingdom,2026-01-30
520571,21976,PACK OF 60 MUSHROOM CAKE CASES,1,1.28,,United Kingdom,2026-01-30
520571,21980,PACK OF 12 RED SPOTTY TISSUES ,1,0.85,,United Kingdom,2026-01-30
520571,21981,PACK OF 12 WOODLAND TISSUES ,2,0.85,,United Kingdom,2026-01-30
520571,21982,PACK OF 12 SUKI TISSUES ,1,0.85,,United Kingdom,2026-01-30
520571,22073,RED RETROSPOT STORAGE JAR,1,7.62,,United Kingdom,2026-01-30
520571,22083,PAPER CHAIN KIT RETRO SPOT,1,5.91,,United Kingdom,2026-01-30
520571,22086,PAPER CHAIN KIT 50'S CHRISTMAS ,3,5.91,,United Kingdom,2026-01-30
520571,22087,PAPER BUNTING WHITE LACE,2,5.91,,United Kingdom,2026-01-30
520571,21944,KITTENS DESIGN FLANNEL,1,1.66,,United Kingdom,2026-01-30
520571,21425,SKULLS STORAGE BOX LARGE,1,2.95,,United Kingdom,2026-01-30
520571,DOT,DOTCOM POSTAGE,1,109.85,,United Kingdom,2026-01-30
520571,90167,BEADED LOVE HEART JEWELLERY SET,1,1.66,,United Kingdom,2026-01-30
520571,35962,12 ASS ZINC CHRISTMAS DECORATIONS,1,4.21,,United Kingdom,2026-01-30
520571,37343,SPOTS DESIGN MUG W PINK INSIDE,6,3.36,,United Kingdom,2026-01-30
520571,37370,RETRO COFFEE MUGS ASSORTED,1,16.13,,United Kingdom,2026-01-30
520571,40016,CHINESE DRAGON PAPER LANTERNS,1,8.47,,United Kingdom,2026-01-30
520571,47591B,SCOTTIES CHILDRENS APRON,1,1.66,,United Kingdom,2026-01-30
520571,47591D,PINK FAIRY CAKE CHILDRENS APRON,1,4.21,,United Kingdom,2026-01-30
520571,47592A,CAROUSEL CHILDRENS OVERALL,1,1.66,,United Kingdom,2026-01-30
520571,47597,NEW ENGLAND TEATOWELS,3,1.66,,United Kingdom,2026-01-30
520571,71403,"PINK/WHITE ""KEEP CLEAN"" BULLET BIN",1,5.91,,United Kingdom,2026-01-30
520571,71477,COLOUR GLASS. STAR T-LIGHT HOLDER,1,6.77,,United Kingdom,2026-01-30
520571,79067,CORONA MEXICAN TRAY,1,8.47,,United Kingdom,2026-01-30
520571,79403,FROSTED WHITE BASE ,1,1.66,,United Kingdom,2026-01-30
520571,79406,FROSTED WHITE BASE ,4,0.84,,United Kingdom,2026-01-30
520571,82494L,WOODEN FRAME ANTIQUE WHITE ,1,7.62,,United Kingdom,2026-01-30
520571,82583,HOT BATHS METAL SIGN,1,4.21,,United Kingdom,2026-01-30
520571,82600,NO SINGING METAL SIGN,1,4.21,,United Kingdom,2026-01-30
520571,84050,PINK HEART SHAPE EGG FRYING PAN,1,4.21,,United Kingdom,2026-01-30
520571,85232D,SET/3 DECOUPAGE STACKING TINS,1,10.17,,United Kingdom,2026-01-30
520571,90101,WHITE FRANGIPANI NECKLACE,1,2.54,,United Kingdom,2026-01-30
520571,22088,PAPER BUNTING COLOURED LACE,3,5.91,,United Kingdom,2026-01-30
520571,22090,PAPER BUNTING RETRO SPOTS,4,5.91,,United Kingdom,2026-01-30
520571,82597,BOMBS AWAY METAL SIGN,1,4.21,,United Kingdom,2026-01-30
520571,22131,FOOD CONTAINER SET 3 LOVE HEART ,1,4.21,,United Kingdom,2026-01-30
520571,22417,PACK OF 60 SPACEBOY CAKE CASES,1,1.28,,United Kingdom,2026-01-30
520571,22418,10 COLOUR SPACEBOY PEN,1,1.66,,United Kingdom,2026-01-30
520571,22423,REGENCY CAKESTAND 3 TIER,2,25.49,,United Kingdom,2026-01-30
520571,22431,WATERING CAN BLUE ELEPHANT,1,4.21,,United Kingdom,2026-01-30
520571,22444,GROW YOUR OWN PLANT IN A CAN ,4,2.51,,United Kingdom,2026-01-30
520571,22451,SILK PURSE BABUSHKA RED,1,6.77,,United Kingdom,2026-01-30
520571,22457,NATURAL SLATE HEART CHALKBOARD ,1,5.91,,United Kingdom,2026-01-30
520571,22469,HEART OF WICKER SMALL,2,3.36,,United Kingdom,2026-01-30
520571,22124,SET OF 2 TEA TOWELS PING MICROWAVE,1,2.51,,United Kingdom,2026-01-30
520571,22487,WHITE WOOD GARDEN PLANT LADDER,1,20.38,,United Kingdom,2026-01-30
520571,22498,WOODEN REGATTA BUNTING,2,12.72,,United Kingdom,2026-01-30
520571,22508,DOORSTOP RETROSPOT HEART,2,7.62,,United Kingdom,2026-01-30
520571,22525,CHILDRENS GARDEN GLOVES PINK,1,2.51,,United Kingdom,2026-01-30
520571,22528,GARDENERS KNEELING PAD,1,1.25,,United Kingdom,2026-01-30
520571,22530,MAGIC DRAWING SLATE DOLLY GIRL ,1,0.85,,United Kingdom,2026-01-30
520571,22534,MAGIC DRAWING SLATE SPACEBOY ,1,0.85,,United Kingdom,2026-01-30
520571,22545,MINI JIGSAW BUNNIES,1,0.85,,United Kingdom,2026-01-30
520571,22547,MINI JIGSAW DINOSAUR ,1,0.85,,United Kingdom,2026-01-30
520571,22492,MINI PAINT SET VINTAGE ,1,1.66,,United Kingdom,2026-01-30
520571,22382,LUNCH BAG SPACEBOY DESIGN ,1,4.21,,United Kingdom,2026-01-30
520571,22410,MONEY BOX HOUSEKEEPING DESIGN,1,2.51,,United Kingdom,2026-01-30
520571,22377,BOTTLE BAG RETROSPOT ,1,4.21,,United Kingdom,2026-01-30
520571,22151,PLACE SETTING WHITE HEART,5,1.66,,United Kingdom,2026-01-30
520571,22153,ANGEL DECORATION STARS ON DRESS,1,0.85,,United Kingdom,2026-01-30
520571,22154,ANGEL DECORATION 3 BUTTONS ,1,0.85,,United Kingdom,2026-01-30
520571,22157,ANGEL DECORATION WITH LACE PADDED,1,1.66,,United Kingdom,2026-01-30
520571,22162,HEART GARLAND RUSTIC PADDED,1,5.91,,United Kingdom,2026-01-30
520571,22180,RETRO SPOT LAMP,1,21.23,,United Kingdom,2026-01-30
520571,22201,FRYING PAN BLUE POLKADOT ,1,8.47,,United Kingdom,2026-01-30
520571,22203,MILK PAN RED RETROSPOT,1,7.62,,United Kingdom,2026-01-30
520571,22379,RECYCLING BAG RETROSPOT ,1,4.21,,United Kingdom,2026-01-30
520571,22248,DECORATION  PINK CHICK MAGIC GARDEN,1,1.66,,United Kingdom,2026-01-30
520571,22211,WOOD STAMP SET FLOWERS,1,3.36,,United Kingdom,2026-01-30
520571,22318,FIVE HEART HANGING DECORATION,1,5.91,,United Kingdom,2026-01-30
520571,22341,LOVE GARLAND PAINTED ZINC ,1,3.36,,United Kingdom,2026-01-30
520571,22353,LUNCH BOX WITH CUTLERY FAIRY CAKES ,2,5.06,,United Kingdom,2026-01-30
520571,22355,CHARLOTTE BAG SUKI DESIGN,1,1.66,,United Kingdom,2026-01-30
520571,22361,GLASS JAR DAISY FRESH COTTON WOOL,1,5.91,,United Kingdom,2026-01-30
520571,22366,DOORMAT AIRMAIL ,1,14.43,,United Kingdom,2026-01-30
520571,22367,CHILDRENS APRON SPACEBOY DESIGN,1,4.21,,United Kingdom,2026-01-30
520571,22554,PLASTERS IN TIN WOODLAND ANIMALS,3,3.36,,United Kingdom,2026-01-30
520571,22311,OFFICE MUG WARMER BLACK+SILVER ,2,8.47,,United Kingdom,2026-01-30
520572,85042,ANTIQUE LILY FAIRY LIGHTS,24,4.25,14001.0,United Kingdom,2026-01-30
520572,22088,PAPER BUNTING COLOURED LACE,12,2.95,14001.0,United Kingdom,2026-01-30
520572,22090,PAPER BUNTING RETRO SPOTS,12,2.95,14001.0,United Kingdom,2026-01-30
520572,21928,JUMBO BAG SCANDINAVIAN PAISLEY,10,1.95,14001.0,United Kingdom,2026-01-30
520572,20702,PINK PADDED MOBILE,6,4.25,14001.0,United Kingdom,2026-01-30
520572,21929,JUMBO BAG PINK VINTAGE PAISLEY,10,1.95,14001.0,United Kingdom,2026-01-30
520572,71038,WHITE HANGING BEADS CANDLE HOLDER,12,5.45,14001.0,United Kingdom,2026-01-30
520572,22173,METAL 4 HOOK HANGER FRENCH CHATEAU,16,2.95,14001.0,United Kingdom,2026-01-30
520572,22283,6 EGG HOUSE PAINTED WOOD,2,7.95,14001.0,United Kingdom,2026-01-30
520572,85099C,JUMBO  BAG BAROQUE BLACK WHITE,10,1.95,14001.0,United Kingdom,2026-01-30
520573,85070,for show,-1,0.0,,United Kingdom,2026-01-30
520574,85113,,3,0.0,,United Kingdom,2026-01-30
520575,84279P,CHERRY BLOSSOM  DECORATIVE FLASK,8,3.75,12963.0,United Kingdom,2026-01-30
520575,21588,RETRO SPOT GIANT  TUBE MATCHES,12,2.55,12963.0,United Kingdom,2026-01-30
C520576,22138,BAKING SET 9 PIECE RETROSPOT ,-3,4.95,17649.0,United Kingdom,2026-01-30
C520576,22139,RETRO SPOT TEA SET CERAMIC 11 PC ,-3,4.95,17649.0,United Kingdom,2026-01-30
520577,22138,BAKING SET 9 PIECE RETROSPOT ,3,4.95,17649.0,United Kingdom,2026-01-30
520578,20976,,4,0.0,,United Kingdom,2026-01-30
520580,90002C,,1,0.0,,United Kingdom,2026-01-30
520579,85129A,,3,0.0,,United Kingdom,2026-01-30
520581,90002E,,1,0.0,,United Kingdom,2026-01-30
520582,22382,LUNCH BAG SPACEBOY DESIGN ,10,1.65,17732.0,United Kingdom,2026-01-30
520582,20726,LUNCH BAG WOODLAND,10,1.65,17732.0,United Kingdom,2026-01-30
520582,21911,GARDEN METAL SIGN ,12,1.65,17732.0,United Kingdom,2026-01-30
520582,22059,CERAMIC STRWBERRY DESIGN MUG,12,1.49,17732.0,United Kingdom,2026-01-30
520582,20725,LUNCH BAG RED SPOTTY,10,1.65,17732.0,United Kingdom,2026-01-30
520582,21033,JUMBO BAG CHARLIE AND LOLA TOYS,10,2.95,17732.0,United Kingdom,2026-01-30
520582,85123A,WHITE HANGING HEART T-LIGHT HOLDER,12,2.95,17732.0,United Kingdom,2026-01-30
520582,21624,VINTAGE UNION JACK DOORSTOP,3,5.95,17732.0,United Kingdom,2026-01-30
520582,20711,JUMBO BAG TOYS ,10,1.95,17732.0,United Kingdom,2026-01-30
520582,20727,LUNCH BAG  BLACK SKULL.,10,1.65,17732.0,United Kingdom,2026-01-30
520582,21930,JUMBO STORAGE BAG SKULLS,10,1.95,17732.0,United Kingdom,2026-01-30
520582,22139,RETRO SPOT TEA SET CERAMIC 11 PC ,3,4.95,17732.0,United Kingdom,2026-01-30
520582,21277,FRENCH STYLE EMBOSSED HEART CABINET,1,21.95,17732.0,United Kingdom,2026-01-30
520582,22624,IVORY KITCHEN SCALES,2,8.5,17732.0,United Kingdom,2026-01-30
520582,21411,GINGHAM HEART  DOORSTOP RED,3,4.25,17732.0,United Kingdom,2026-01-30
520582,21754,HOME BUILDING BLOCK WORD,3,5.95,17732.0,United Kingdom,2026-01-30
520582,21890,S/6 WOODEN SKITTLES IN COTTON BAG,6,2.95,17732.0,United Kingdom,2026-01-30
520583,22621,?,-190,0.0,,United Kingdom,2026-01-30
520584,10123C,HEARTS WRAPPING TAPE ,12,0.65,12839.0,United Kingdom,2026-01-30
520584,16161U,WRAP SUKI AND FRIENDS,25,0.42,12839.0,United Kingdom,2026-01-30
520584,22440,BALLOON WATER BOMB PACK OF 35,20,0.42,12839.0,United Kingdom,2026-01-30
520584,21231,SWEETHEART CERAMIC TRINKET BOX,12,1.25,12839.0,United Kingdom,2026-01-30
520584,20985,HEART CALCULATOR,12,1.25,12839.0,United Kingdom,2026-01-30
520584,21232,STRAWBERRY CERAMIC TRINKET BOX,12,1.25,12839.0,United Kingdom,2026-01-30
520584,22197,SMALL POPCORN HOLDER,12,0.85,12839.0,United Kingdom,2026-01-30
520584,22198,LARGE POPCORN HOLDER ,12,1.65,12839.0,United Kingdom,2026-01-30
520584,22371,AIRLINE BAG VINTAGE TOKYO 78,2,6.35,12839.0,United Kingdom,2026-01-30
520584,22385,JUMBO BAG SPACEBOY DESIGN,10,1.95,12839.0,United Kingdom,2026-01-30
520584,85099C,JUMBO  BAG BAROQUE BLACK WHITE,10,1.95,12839.0,United Kingdom,2026-01-30
520584,22372,AIRLINE BAG VINTAGE WORLD CHAMPION ,2,6.35,12839.0,United Kingdom,2026-01-30
520584,22374,AIRLINE BAG VINTAGE JET SET RED,2,6.35,12839.0,United Kingdom,2026-01-30
520584,22375,AIRLINE BAG VINTAGE JET SET BROWN,2,6.35,12839.0,United Kingdom,2026-01-30
520584,22753,SMALL YELLOW BABUSHKA NOTEBOOK ,12,0.85,12839.0,United Kingdom,2026-01-30
520584,21509,COWBOYS AND INDIANS BIRTHDAY CARD ,12,0.42,12839.0,United Kingdom,2026-01-30
520584,21931,JUMBO STORAGE BAG SUKI,10,1.95,12839.0,United Kingdom,2026-01-30
520584,22037,ROBOT BIRTHDAY CARD,12,0.42,12839.0,United Kingdom,2026-01-30
520584,22756,LARGE YELLOW BABUSHKA NOTEBOOK ,12,1.25,12839.0,United Kingdom,2026-01-30
520584,22555,PLASTERS IN TIN STRONGMAN,12,1.65,12839.0,United Kingdom,2026-01-30
520584,22588,CARD HOLDER GINGHAM HEART,6,2.55,12839.0,United Kingdom,2026-01-30
520584,22029,SPACEBOY BIRTHDAY CARD,12,0.42,12839.0,United Kingdom,2026-01-30
520584,22355,CHARLOTTE BAG SUKI DESIGN,10,0.85,12839.0,United Kingdom,2026-01-30
520584,22661,CHARLOTTE BAG DOLLY GIRL DESIGN,10,0.85,12839.0,United Kingdom,2026-01-30
520584,20724,RED SPOTTY CHARLOTTE BAG,10,0.85,12839.0,United Kingdom,2026-01-30
520584,20719,WOODLAND CHARLOTTE BAG,10,0.85,12839.0,United Kingdom,2026-01-30
520584,82483,WOOD 2 DRAWER CABINET WHITE FINISH,4,5.95,12839.0,United Kingdom,2026-01-30
520584,21523,DOORMAT FANCY FONT HOME SWEET HOME,2,7.49,12839.0,United Kingdom,2026-01-30
520584,20723,STRAWBERRY CHARLOTTE BAG,10,0.85,12839.0,United Kingdom,2026-01-30
520584,20971,PINK BLUE FELT CRAFT TRINKET BOX,12,1.25,12839.0,United Kingdom,2026-01-30
520584,82482,WOODEN PICTURE FRAME WHITE FINISH,6,2.55,12839.0,United Kingdom,2026-01-30
520584,85025B,EAU DE NILE HEART SHAPE PHOTO FRAME,12,1.65,12839.0,United Kingdom,2026-01-30
520584,21172,PARTY METAL SIGN ,12,1.45,12839.0,United Kingdom,2026-01-30
520584,84378,SET OF 3 HEART COOKIE CUTTERS,12,1.25,12839.0,United Kingdom,2026-01-30
520584,84050,PINK HEART SHAPE EGG FRYING PAN,6,1.65,12839.0,United Kingdom,2026-01-30
520584,79320,FLAMINGO LIGHTS,4,4.95,12839.0,United Kingdom,2026-01-30
520584,22366,DOORMAT AIRMAIL ,2,7.49,12839.0,United Kingdom,2026-01-30
520585,79320,FLAMINGO LIGHTS,24,4.25,14110.0,United Kingdom,2026-01-30
520585,22468,BABUSHKA LIGHTS STRING OF 10,6,6.75,14110.0,United Kingdom,2026-01-30
520585,84032A,CHARLIE+LOLA PINK HOT WATER BOTTLE,6,2.95,14110.0,United Kingdom,2026-01-30
520585,22179,SET 10 LIGHTS NIGHT OWL,24,5.95,14110.0,United Kingdom,2026-01-30
520600,79534,MULTICOLOUR GLASS PLATE,12,0.55,17048.0,United Kingdom,2026-01-30
520600,21870,I CAN ONLY PLEASE ONE PERSON MUG,18,1.25,17048.0,United Kingdom,2026-01-30
520600,79532,MOSAIC GLASS BALL CANDLEHOLDER,6,1.25,17048.0,United Kingdom,2026-01-30
520600,84424A,FOUR PICTURE WHITE GLASS FRAME,6,3.75,17048.0,United Kingdom,2026-01-30
520600,85107,CUT GLASS T-LIGHT HOLDER OCTAGON,24,0.85,17048.0,United Kingdom,2026-01-30
520600,20893,HANGING BAUBLE T-LIGHT HOLDER SMALL,6,2.55,17048.0,United Kingdom,2026-01-30
520600,17091A,LAVENDER INCENSE IN TIN,6,1.25,17048.0,United Kingdom,2026-01-30
520600,71477,COLOUR GLASS. STAR T-LIGHT HOLDER,6,3.25,17048.0,United Kingdom,2026-01-30
520600,35443,RASTA IN BATH W SPLIFF ASHTRAY,4,0.85,17048.0,United Kingdom,2026-01-30
520600,72225C,LAVENDER SCENT CAKE CANDLE,48,0.29,17048.0,United Kingdom,2026-01-30
520600,21407,BROWN CHECK CAT DOORSTOP ,6,4.25,17048.0,United Kingdom,2026-01-30
520600,22510,GINGHAM BABUSHKA DOORSTOP,6,3.75,17048.0,United Kingdom,2026-01-30
520600,20894,HANGING BAUBLE T-LIGHT HOLDER LARGE,6,2.95,17048.0,United Kingdom,2026-01-30
520601,21877,HOME SWEET HOME MUG,12,1.25,17692.0,United Kingdom,2026-01-30
520601,21876,POTTERING MUG,12,1.25,17692.0,United Kingdom,2026-01-30
520601,21733,RED HANGING HEART T-LIGHT HOLDER,6,2.95,17692.0,United Kingdom,2026-01-30
520601,21181,PLEASE ONE PERSON METAL SIGN,12,2.1,17692.0,United Kingdom,2026-01-30
520601,21870,I CAN ONLY PLEASE ONE PERSON MUG,12,1.25,17692.0,United Kingdom,2026-01-30
520601,21871,SAVE THE PLANET MUG,12,1.25,17692.0,United Kingdom,2026-01-30
520601,21231,SWEETHEART CERAMIC TRINKET BOX,24,1.25,17692.0,United Kingdom,2026-01-30
520601,20972,PINK CREAM FELT CRAFT TRINKET BOX ,24,1.25,17692.0,United Kingdom,2026-01-30
520601,20971,PINK BLUE FELT CRAFT TRINKET BOX,24,1.25,17692.0,United Kingdom,2026-01-30
520601,22149,FELTCRAFT 6 FLOWER FRIENDS,6,2.1,17692.0,United Kingdom,2026-01-30
520601,22321,BIRD DECORATION RED SPOT,24,0.85,17692.0,United Kingdom,2026-01-30
520601,22335,HEART DECORATION PAINTED ZINC ,24,0.65,17692.0,United Kingdom,2026-01-30
520601,22227,"DECORATION, HANGING HEART+MIRROR ",24,0.65,17692.0,United Kingdom,2026-01-30
520601,22292,"SPRING DEC , HANGING CHICK  YELLOW",24,1.45,17692.0,United Kingdom,2026-01-30
520601,21232,STRAWBERRY CERAMIC TRINKET BOX,12,1.25,17692.0,United Kingdom,2026-01-30
520602,21410,COUNTRY COTTAGE  DOORSTOP GREEN,3,4.25,14499.0,United Kingdom,2026-01-30
520602,22692,DOORMAT WELCOME TO OUR HOME,2,7.49,14499.0,United Kingdom,2026-01-30
520602,21179,NO JUNK MAIL METAL SIGN,12,1.25,14499.0,United Kingdom,2026-01-30
520602,21911,GARDEN METAL SIGN ,12,1.65,14499.0,United Kingdom,2026-01-30
520602,82484,WOOD BLACK BOARD ANT WHITE FINISH,3,6.45,14499.0,United Kingdom,2026-01-30
520602,82483,WOOD 2 DRAWER CABINET WHITE FINISH,4,5.95,14499.0,United Kingdom,2026-01-30
520602,21314,SMALL GLASS HEART TRINKET POT,8,2.1,14499.0,United Kingdom,2026-01-30
520602,82482,WOODEN PICTURE FRAME WHITE FINISH,6,2.55,14499.0,United Kingdom,2026-01-30
520602,21693,SMALL HAMMERED SILVER CANDLEPOT ,6,2.95,14499.0,United Kingdom,2026-01-30
520602,22348,TEA BAG PLATE RED SPOTTY ,12,0.85,14499.0,United Kingdom,2026-01-30
520602,21755,LOVE BUILDING BLOCK WORD,3,5.95,14499.0,United Kingdom,2026-01-30
520602,22151,PLACE SETTING WHITE HEART,24,0.42,14499.0,United Kingdom,2026-01-30
520602,22470,HEART OF WICKER LARGE,6,2.95,14499.0,United Kingdom,2026-01-30
520602,22457,NATURAL SLATE HEART CHALKBOARD ,6,2.95,14499.0,United Kingdom,2026-01-30
520602,85123A,WHITE HANGING HEART T-LIGHT HOLDER,6,2.95,14499.0,United Kingdom,2026-01-30
520602,84970L,SINGLE HEART ZINC T-LIGHT HOLDER,12,0.95,14499.0,United Kingdom,2026-01-30
520602,84970S,HANGING HEART ZINC T-LIGHT HOLDER,12,0.85,14499.0,United Kingdom,2026-01-30
520602,21175,GIN + TONIC DIET METAL SIGN,12,2.1,14499.0,United Kingdom,2026-01-30
520602,21166,COOK WITH WINE METAL SIGN ,12,1.95,14499.0,United Kingdom,2026-01-30
520602,82582,AREA PATROLLED METAL SIGN,12,2.1,14499.0,United Kingdom,2026-01-30
520602,84978,HANGING HEART JAR T-LIGHT HOLDER,12,1.25,14499.0,United Kingdom,2026-01-30
520612,22636,CHILDS BREAKFAST SET CIRCUS PARADE,2,8.5,16421.0,United Kingdom,2026-01-30
520612,21623,VINTAGE UNION JACK MEMOBOARD,2,9.95,16421.0,United Kingdom,2026-01-30
520612,21258,VICTORIAN SEWING BOX LARGE,1,12.75,16421.0,United Kingdom,2026-01-30
520612,21693,SMALL HAMMERED SILVER CANDLEPOT ,6,2.95,16421.0,United Kingdom,2026-01-30
520612,22498,WOODEN REGATTA BUNTING,3,5.95,16421.0,United Kingdom,2026-01-30
520612,82494L,WOODEN FRAME ANTIQUE WHITE ,6,2.95,16421.0,United Kingdom,2026-01-30
520612,22635,CHILDS BREAKFAST SET DOLLY GIRL ,2,9.95,16421.0,United Kingdom,2026-01-30
520612,22372,AIRLINE BAG VINTAGE WORLD CHAMPION ,2,6.35,16421.0,United Kingdom,2026-01-30
520612,21115,ROSE CARAVAN DOORSTOP,2,6.75,16421.0,United Kingdom,2026-01-30
520612,21781,MA CAMPAGNE CUTLERY BOX,1,14.95,16421.0,United Kingdom,2026-01-30
520612,82484,WOOD BLACK BOARD ANT WHITE FINISH,3,6.45,16421.0,United Kingdom,2026-01-30
520612,85065,CREAM SWEETHEART TRAYS,1,12.75,16421.0,United Kingdom,2026-01-30
520612,21768,WALL MOUNTED VINTAGE ORGANISER,1,14.95,16421.0,United Kingdom,2026-01-30
520612,84840,SWEETHEART CARRY-ALL BASKET,2,8.5,16421.0,United Kingdom,2026-01-30
520612,84839,SWEETHEART KEY CABINET,2,6.75,16421.0,United Kingdom,2026-01-30
520612,85064,CREAM SWEETHEART LETTER RACK,2,5.45,16421.0,United Kingdom,2026-01-30
520612,21314,SMALL GLASS HEART TRINKET POT,8,2.1,16421.0,United Kingdom,2026-01-30
520612,22423,REGENCY CAKESTAND 3 TIER,2,12.75,16421.0,United Kingdom,2026-01-30
520612,21777,RECIPE BOX WITH METAL HEART,2,7.95,16421.0,United Kingdom,2026-01-30
520614,20829,GLITTER HANGING BUTTERFLY STRING,8,2.1,15623.0,United Kingdom,2026-01-30
520614,84755,COLOUR GLASS T-LIGHT HOLDER HANGING,16,0.65,15623.0,United Kingdom,2026-01-30
520614,21732,RED HANGING METAL STAR TLIGHT HLDR,4,3.75,15623.0,United Kingdom,2026-01-30
520614,84843,WHITE SOAP RACK WITH 2 BOTTLES,2,5.95,15623.0,United Kingdom,2026-01-30
520614,21733,RED HANGING HEART T-LIGHT HOLDER,6,2.95,15623.0,United Kingdom,2026-01-30
520614,22381,TOY TIDY PINK RETROSPOT  ,5,2.1,15623.0,United Kingdom,2026-01-30
520614,20702,PINK PADDED MOBILE,6,4.25,15623.0,United Kingdom,2026-01-30
520614,85068,CREAM SWEETHEART SHELF + HOOKS,2,7.95,15623.0,United Kingdom,2026-01-30
