Invoice,StockCode,Description,Quantity,Price,Customer ID,Country,InvoiceDate
520678,20973,12 PENCIL SMALL TUBE WOODLAND,1,0.65,15271.0,United Kingdom,2026-01-30
520678,22037,ROBOT BIRTHDAY CARD,12,0.42,15271.0,United Kingdom,2026-01-30
520678,20975,12 PENCILS SMALL TUBE RED SPOTTY,1,0.65,15271.0,United Kingdom,2026-01-30
520678,20974,12 PENCILS SMALL TUBE SKULL,1,0.65,15271.0,United Kingdom,2026-01-30
520678,84520B,PACK 20 ENGLISH ROSE PAPER NAPKINS,3,0.85,15271.0,United Kingdom,2026-01-30
520678,21034,REX CASH+CARRY JUMBO SHOPPER,1,0.95,15271.0,United Kingdom,2026-01-30
520678,21082,SET/20 FRUIT SALAD PAPER NAPKINS ,2,0.85,15271.0,United Kingdom,2026-01-30
520678,85063,CREAM SWEETHEART MAGAZINE RACK,1,16.95,15271.0,United Kingdom,2026-01-30
520678,22220,CAKE STAND LOVEBIRD 2 TIER WHITE,1,9.95,15271.0,United Kingdom,2026-01-30
520678,22435,SET OF 9 HEART SHAPED BALLOONS,10,1.25,15271.0,United Kingdom,2026-01-30
520678,21077,SET/20 WOODLAND PAPER NAPKINS ,2,0.85,15271.0,United Kingdom,2026-01-30
520678,84270,ASSTD DESIGN BUBBLE GUM RING,60,0.21,15271.0,United Kingdom,2026-01-30
520678,21080,SET/20 RED SPOTTY PAPER NAPKINS ,3,0.85,15271.0,United Kingdom,2026-01-30
520678,21839,MUMMY MOUSE RED GINGHAM RIBBON,1,5.45,15271.0,United Kingdom,2026-01-30
520678,85067,CREAM SWEETHEART WALL CABINET,1,18.95,15271.0,United Kingdom,2026-01-30
520678,85066,CREAM SWEETHEART MINI CHEST,2,12.75,15271.0,United Kingdom,2026-01-30
520678,22029,SPACEBOY BIRTHDAY CARD,12,0.42,15271.0,United Kingdom,2026-01-30
520678,22030,SWALLOWS GREETING CARD,12,0.42,15271.0,United Kingdom,2026-01-30
520678,85068,CREAM SWEETHEART SHELF + HOOKS,1,7.95,15271.0,United Kingdom,2026-01-30
520678,85066,CREAM SWEETHEART MINI CHEST,2,12.75,15271.0,United Kingdom,2026-01-30
520678,21841,BABY MOUSE RED GINGHAM DRESS,1,4.25,15271.0,United Kingdom,2026-01-30
520678,21274,EMBOSSED HEART 3 DRAWER SHELF,1,12.75,15271.0,United Kingdom,2026-01-30
520678,85065,CREAM SWEETHEART TRAYS,1,12.75,15271.0,United Kingdom,2026-01-30
520678,21777,RECIPE BOX WITH METAL HEART,1,7.95,15271.0,United Kingdom,2026-01-30
520678,82072,WHITE WOOD SINGLE P/FRAME,1,1.25,15271.0,United Kingdom,2026-01-30
520678,22099,CARAVAN SQUARE TISSUE BOX,2,1.25,15271.0,United Kingdom,2026-01-30
520678,22189,CREAM HEART CARD HOLDER,2,3.95,15271.0,United Kingdom,2026-01-30
520678,35240,ENAMEL BLUE RIM OVAL TRAY SET/2,1,8.49,15271.0,United Kingdom,2026-01-30
520678,22694,WICKER STAR ,3,2.1,15271.0,United Kingdom,2026-01-30
520678,22470,HEART OF WICKER LARGE,3,2.95,15271.0,United Kingdom,2026-01-30
520678,85064,CREAM SWEETHEART LETTER RACK,2,5.45,15271.0,United Kingdom,2026-01-30
520678,21768,WALL MOUNTED VINTAGE ORGANISER,1,14.95,15271.0,United Kingdom,2026-01-30
520679,21755,LOVE BUILDING BLOCK WORD,6,5.95,16539.0,United Kingdom,2026-01-30
520679,82580,BATHROOM METAL SIGN,12,0.55,16539.0,United Kingdom,2026-01-30
520679,21391,FRENCH EMROIDR LAVENDER SCENT HEART,6,2.1,16539.0,United Kingdom,2026-01-30
520679,21114,LAVENDER SCENTED FABRIC HEART,10,1.25,16539.0,United Kingdom,2026-01-30
520679,22296,HEART IVORY TRELLIS LARGE,12,1.65,16539.0,United Kingdom,2026-01-30
520679,22297,HEART IVORY TRELLIS SMALL,24,1.25,16539.0,United Kingdom,2026-01-30
520679,21754,HOME BUILDING BLOCK WORD,6,5.95,16539.0,United Kingdom,2026-01-30
520679,35637A,IVORY STRING CURTAIN WITH POLE ,12,1.95,16539.0,United Kingdom,2026-01-30
520679,21363,HOME SMALL WOOD LETTERS,3,4.95,16539.0,United Kingdom,2026-01-30
520679,21364,PEACE SMALL WOOD LETTERS,2,6.75,16539.0,United Kingdom,2026-01-30
520679,21361,LOVE LARGE WOOD LETTERS ,1,12.75,16539.0,United Kingdom,2026-01-30
520679,21955,DOORMAT UNION JACK GUNS AND ROSES,10,6.35,16539.0,United Kingdom,2026-01-30
520679,82552,WASHROOM METAL SIGN,12,1.25,16539.0,United Kingdom,2026-01-30
520679,21781,MA CAMPAGNE CUTLERY BOX,2,14.95,16539.0,United Kingdom,2026-01-30
520679,82581,TOILET METAL SIGN,12,0.55,16539.0,United Kingdom,2026-01-30
520680,22624,IVORY KITCHEN SCALES,2,8.5,15480.0,Malta,2026-01-30
520680,22625,RED KITCHEN SCALES,2,8.5,15480.0,Malta,2026-01-30
520680,22626,BLACK KITCHEN SCALES,2,8.5,15480.0,Malta,2026-01-30
520680,22635,CHILDS BREAKFAST SET DOLLY GIRL ,2,9.95,15480.0,Malta,2026-01-30
520680,22636,CHILDS BREAKFAST SET CIRCUS PARADE,2,8.5,15480.0,Malta,2026-01-30
520680,22692,DOORMAT WELCOME TO OUR HOME,2,7.49,15480.0,Malta,2026-01-30
520680,22660,DOORMAT I LOVE LONDON,2,7.49,15480.0,Malta,2026-01-30
520680,22603,CHRISTMAS RETROSPOT TREE WOOD,12,0.85,15480.0,Malta,2026-01-30
520680,22697,GREEN REGENCY TEACUP AND SAUCER,12,2.95,15480.0,Malta,2026-01-30
520680,22698,PINK REGENCY TEACUP AND SAUCER,12,2.95,15480.0,Malta,2026-01-30
520680,22699,ROSES REGENCY TEACUP AND SAUCER ,12,2.95,15480.0,Malta,2026-01-30
520680,22649,STRAWBERRY FAIRY CAKE TEAPOT,8,4.95,15480.0,Malta,2026-01-30
520680,22423,REGENCY CAKESTAND 3 TIER,5,12.75,15480.0,Malta,2026-01-30
520680,22595,CHRISTMAS GINGHAM HEART,12,0.85,15480.0,Malta,2026-01-30
520680,22601,CHRISTMAS RETROSPOT ANGEL WOOD,12,0.85,15480.0,Malta,2026-01-30
520680,22600,CHRISTMAS RETROSPOT STAR WOOD,12,0.85,15480.0,Malta,2026-01-30
520680,22594,CHRISTMAS GINGHAM TREE,12,0.85,15480.0,Malta,2026-01-30
520680,22593,CHRISTMAS GINGHAM STAR,12,0.85,15480.0,Malta,2026-01-30
520680,22576,SWALLOW WOODEN CHRISTMAS DECORATION,12,0.85,15480.0,Malta,2026-01-30
520680,22574,HEART WOODEN CHRISTMAS DECORATION,12,0.85,15480.0,Malta,2026-01-30
520680,22573,STAR WOODEN CHRISTMAS DECORATION,12,0.85,15480.0,Malta,2026-01-30
520680,22572,ROCKING HORSE GREEN CHRISTMAS ,12,0.85,15480.0,Malta,2026-01-30
520680,22571,ROCKING HORSE RED CHRISTMAS ,12,0.85,15480.0,Malta,2026-01-30
520680,22443,GROW YOUR OWN HERBS SET OF 3,2,7.95,15480.0,Malta,2026-01-30
520680,22441,GROW YOUR OWN BASIL IN ENAMEL MUG,8,2.1,15480.0,Malta,2026-01-30
520680,22430,ENAMEL WATERING CAN CREAM,4,4.95,15480.0,Malta,2026-01-30
520680,22712,CARD DOLLY GIRL ,12,0.42,15480.0,Malta,2026-01-30
520680,22602,CHRISTMAS RETROSPOT HEART WOOD,12,0.85,15480.0,Malta,2026-01-30
520680,22713,CARD I LOVE LONDON ,12,0.42,15480.0,Malta,2026-01-30
520680,37479P,CUBIC MUG FLOCK PINK ON BROWN,6,2.55,15480.0,Malta,2026-01-30
520680,22714,CARD BIRTHDAY COWBOY,12,0.42,15480.0,Malta,2026-01-30
520680,22366,DOORMAT AIRMAIL ,2,7.49,15480.0,Malta,2026-01-30
520680,21399,BLUE  SPOTTY  COFFEE MUG,6,2.1,15480.0,Malta,2026-01-30
520680,21398,RED  SPOTTY COFFEE  MUG,6,2.1,15480.0,Malta,2026-01-30
520680,21393,BLUE  SPOTTY PUDDING BOWL,6,2.1,15480.0,Malta,2026-01-30
520680,21392,RED SPOTTY PUDDING BOWL,6,2.1,15480.0,Malta,2026-01-30
520680,21245,GREEN  SPOTTY PLATE ,8,1.69,15480.0,Malta,2026-01-30
520680,21243,PINK  SPOTTY PLATE ,8,1.69,15480.0,Malta,2026-01-30
520680,21242,RED SPOTTY PLATE ,8,1.69,15480.0,Malta,2026-01-30
520680,21218,RED SPOTTY BISCUIT TIN,6,3.75,15480.0,Malta,2026-01-30
520680,21016,LIGHT BIRD HOUSE TREE DECORATION,12,0.85,15480.0,Malta,2026-01-30
520680,21014,SWISS CHALET TREE DECORATION ,12,0.85,15480.0,Malta,2026-01-30
520680,20943,SET/6 GINGERBREAD STAR T-LIGHTS,12,1.25,15480.0,Malta,2026-01-30
520680,20831,GOLD PHOTO FRAME,6,2.1,15480.0,Malta,2026-01-30
520680,21518,BANK ACCOUNT  GREETING  CARD ,12,0.42,15480.0,Malta,2026-01-30
520680,20830,SILVER PHOTO FRAME,6,2.1,15480.0,Malta,2026-01-30
520680,37479B,CUBIC MUG FLOCK BLUE ON BROWN,6,2.55,15480.0,Malta,2026-01-30
520680,37448,CERAMIC CAKE DESIGN SPOTTED MUG,12,1.49,15480.0,Malta,2026-01-30
520680,37447,CERAMIC CAKE DESIGN SPOTTED PLATE,12,1.49,15480.0,Malta,2026-01-30
520680,37370,RETRO COFFEE MUGS ASSORTED,12,1.25,15480.0,Malta,2026-01-30
520680,37342,SPOTTY COFFEE CUP & SAUCER,4,2.95,15480.0,Malta,2026-01-30
520680,35953,FOLKART STAR CHRISTMAS DECORATIONS,24,1.25,15480.0,Malta,2026-01-30
520680,35922,EASTER BUNNY WREATH,5,4.95,15480.0,Malta,2026-01-30
520680,35810B,ENAMEL BLUE RIM COFFEE CONTAINER,6,2.1,15480.0,Malta,2026-01-30
520680,35241,ENAMEL BLUE RIM BISCUIT BIN,3,4.95,15480.0,Malta,2026-01-30
520680,22718,CARD CAT AND TREE ,12,0.42,15480.0,Malta,2026-01-30
520680,22717,CARD DOG AND BALL ,12,0.42,15480.0,Malta,2026-01-30
520680,22716,CARD CIRCUS PARADE,12,0.42,15480.0,Malta,2026-01-30
520680,22715,CARD WEDDING DAY,12,0.42,15480.0,Malta,2026-01-30
520680,37482P,CUBIC MUG PINK POLKA DOT,6,2.55,15480.0,Malta,2026-01-30
520680,22307,GOLD MUG BONE CHINA TREE OF LIFE,6,1.95,15480.0,Malta,2026-01-30
520680,21506,"FANCY FONT BIRTHDAY CARD, ",12,0.42,15480.0,Malta,2026-01-30
520680,22301,COFFEE MUG CAT + BIRD DESIGN,12,2.55,15480.0,Malta,2026-01-30
520680,21456,2 PICTURE BOOK EGGS EASTER CHICKS,12,1.25,15480.0,Malta,2026-01-30
520680,20748,KENSINGTON COFFEE SET,2,12.75,15480.0,Malta,2026-01-30
520680,20677,PINK SPOTTY BOWL,8,1.25,15480.0,Malta,2026-01-30
520680,20676,RED SPOTTY BOWL,8,1.25,15480.0,Malta,2026-01-30
520680,20674,GREEN SPOTTY BOWL,8,1.25,15480.0,Malta,2026-01-30
520680,20671,BLUE TEATIME PRINT BOWL ,8,1.25,15480.0,Malta,2026-01-30
520680,15060B,FAIRY CAKE DESIGN UMBRELLA,4,3.75,15480.0,Malta,2026-01-30
520680,85159B,"WHITE TEA,COFFEE,SUGAR JARS",2,6.35,15480.0,Malta,2026-01-30
520680,85124C,GREEN JUICY FRUIT PHOTO FRAME,6,2.55,15480.0,Malta,2026-01-30
520680,85087,CANDY SPOT CUSHION COVER,6,2.95,15480.0,Malta,2026-01-30
520680,85035C,ROSE 3 WICK MORRIS BOX CANDLE,4,4.25,15480.0,Malta,2026-01-30
520680,85035B,CHOCOLATE 3 WICK MORRIS BOX CANDLE,4,4.25,15480.0,Malta,2026-01-30
520680,85035A,GARDENIA 3 WICK MORRIS BOXED CANDLE,4,4.25,15480.0,Malta,2026-01-30
520680,85014B,RED/WHITE DOTS RUFFLED UMBRELLA,3,5.95,15480.0,Malta,2026-01-30
520680,85014A,BLACK/BLUE DOTS RUFFLED UMBRELLA,3,5.95,15480.0,Malta,2026-01-30
520680,22306,SILVER MUG BONE CHINA TREE OF LIFE,6,1.95,15480.0,Malta,2026-01-30
520680,84509G,SET OF 4 FAIRY CAKE PLACEMATS ,4,3.75,15480.0,Malta,2026-01-30
520680,84509B,SET OF 4 FAIRY CAKE PLACEMATS,4,3.75,15480.0,Malta,2026-01-30
520680,84251G,"GREETING CARD, OVERCROWDED POOL.",12,0.19,15480.0,Malta,2026-01-30
520680,84247E,PACK/12 XMAS FUN CARD,6,2.95,15480.0,Malta,2026-01-30
520680,72816,SET/3 CHRISTMAS DECOUPAGE CANDLES,12,1.25,15480.0,Malta,2026-01-30
520680,72799F,IVORY PILLAR CANDLE GOLD FLOCK,6,2.95,15480.0,Malta,2026-01-30
520680,72799E,IVORY PILLAR CANDLE SILVER FLOCK,6,2.95,15480.0,Malta,2026-01-30
520680,48188,DOORMAT WELCOME PUPPIES,2,7.49,15480.0,Malta,2026-01-30
520680,47585A,PINK FAIRY CAKE CUSHION COVER,4,3.75,15480.0,Malta,2026-01-30
520680,37501,TEA TIME TEA SET IN GIFT BOX,3,6.95,15480.0,Malta,2026-01-30
520680,37495,FAIRY CAKE BIRTHDAY CANDLE SET,4,3.75,15480.0,Malta,2026-01-30
520680,21457,2 PICTURE BOOK EGGS EASTER DUCKS,12,1.25,15480.0,Malta,2026-01-30
520680,21458,2 PICTURE BOOK EGGS EASTER BUNNY,12,1.25,15480.0,Malta,2026-01-30
520680,84944,SET OF 6 KASHMIR FOLKART BAUBLES,4,4.25,15480.0,Malta,2026-01-30
520680,21509,COWBOYS AND INDIANS BIRTHDAY CARD ,12,0.42,15480.0,Malta,2026-01-30
520680,21507,"ELEPHANT, BIRTHDAY CARD, ",12,0.42,15480.0,Malta,2026-01-30
520680,22300,COFFEE MUG DOG + BALL DESIGN,12,2.55,15480.0,Malta,2026-01-30
520680,22283,6 EGG HOUSE PAINTED WOOD,2,7.95,15480.0,Malta,2026-01-30
520680,22139,RETRO SPOT TEA SET CERAMIC 11 PC ,3,4.95,15480.0,Malta,2026-01-30
520680,22114,HOT WATER BOTTLE TEA AND SYMPATHY,4,3.95,15480.0,Malta,2026-01-30
520680,22111,SCOTTIE DOG HOT WATER BOTTLE,3,4.95,15480.0,Malta,2026-01-30
520680,22071,SMALL WHITE RETROSPOT MUG IN BOX ,6,3.75,15480.0,Malta,2026-01-30
520680,22059,CERAMIC STRWBERRY DESIGN MUG,12,1.49,15480.0,Malta,2026-01-30
520680,22057,CERAMIC PLATE STRAWBERRY DESIGN,12,1.49,15480.0,Malta,2026-01-30
520680,22042,CHRISTMAS CARD SINGING ANGEL,12,0.42,15480.0,Malta,2026-01-30
520680,22035,VINTAGE CARAVAN GREETING CARD ,12,0.42,15480.0,Malta,2026-01-30
520680,22034,ROBIN CHRISTMAS CARD,12,0.42,15480.0,Malta,2026-01-30
520680,22030,SWALLOWS GREETING CARD,12,0.42,15480.0,Malta,2026-01-30
520680,22028,PENNY FARTHING BIRTHDAY CARD,12,0.42,15480.0,Malta,2026-01-30
520680,22061,LARGE CAKE STAND  HANGING STRAWBERY,2,9.95,15480.0,Malta,2026-01-30
520680,21873,IF YOU CAN'T STAND THE HEAT MUG,12,1.25,15480.0,Malta,2026-01-30
520680,21527,RED RETROSPOT TRADITIONAL TEAPOT ,2,7.95,15480.0,Malta,2026-01-30
520680,22024,RAINY LADIES BIRTHDAY CARD,12,0.42,15480.0,Malta,2026-01-30
520680,21531,RED RETROSPOT SUGAR JAM BOWL,6,2.55,15480.0,Malta,2026-01-30
520680,21535,RED RETROSPOT SMALL MILK JUG,6,2.55,15480.0,Malta,2026-01-30
520680,21548,CERAMIC BIRDHOUSE FINCH BLUE ROOF,6,2.95,15480.0,Malta,2026-01-30
520680,21622,VINTAGE UNION JACK CUSHION COVER,4,4.95,15480.0,Malta,2026-01-30
520680,21547,CERAMIC BIRDHOUSE CRESTED TIT SMALL,6,2.95,15480.0,Malta,2026-01-30
520680,21707,"FOLDING UMBRELLA , BLACK/BLUE  SPOT",4,4.95,15480.0,Malta,2026-01-30
520680,21708,FOLDING UMBRELLA  CREAM/MULTI  SPOT,4,4.95,15480.0,Malta,2026-01-30
520680,21710,FOLDING UMBRELLA  PINK/WHITE  SPOT,4,4.95,15480.0,Malta,2026-01-30
520680,21711,FOLDING UMBRELLA  WHITE/RED  SPOT,4,4.95,15480.0,Malta,2026-01-30
520680,21784,SHOE SHINE BOX ,2,9.95,15480.0,Malta,2026-01-30
520680,21706,"FOLDING UMBRELLA , RED/WHITE SPOT",4,4.95,15480.0,Malta,2026-01-30
520681,22502,PICNIC BASKET WICKER SMALL,2,0.0,,United Kingdom,2026-01-30
520681,22432,WATERING CAN PINK BUNNY,1,0.0,,United Kingdom,2026-01-30
520681,22501,PICNIC BASKET WICKER LARGE,9,0.0,,United Kingdom,2026-01-30
520681,22470,HEART OF WICKER LARGE,1,0.0,,United Kingdom,2026-01-30
520681,22469,HEART OF WICKER SMALL,3,0.0,,United Kingdom,2026-01-30
520681,22465,HANGING METAL STAR LANTERN,1,0.0,,United Kingdom,2026-01-30
520681,22431,WATERING CAN BLUE ELEPHANT,1,0.0,,United Kingdom,2026-01-30
520681,22372,AIRLINE BAG VINTAGE WORLD CHAMPION ,1,0.0,,United Kingdom,2026-01-30
520681,22428,ENAMEL FIRE BUCKET CREAM,3,0.0,,United Kingdom,2026-01-30
520681,22427,ENAMEL FLOWER JUG CREAM,2,0.0,,United Kingdom,2026-01-30
520681,22426,ENAMEL WASH BOWL CREAM,6,0.0,,United Kingdom,2026-01-30
520681,22424,ENAMEL BREAD BIN CREAM,1,0.0,,United Kingdom,2026-01-30
520681,22367,CHILDRENS APRON SPACEBOY DESIGN,1,0.0,,United Kingdom,2026-01-30
520681,22511,RETROSPOT BABUSHKA DOORSTOP,1,0.0,,United Kingdom,2026-01-30
520681,22429,ENAMEL MEASURING JUG CREAM,2,0.0,,United Kingdom,2026-01-30
520681,M,Manual,1,2197.45,,United Kingdom,2026-01-30
520681,22202,MILK PAN PINK RETROSPOT,2,0.0,,United Kingdom,2026-01-30
520681,20657,TROPICAL LUGGAGE TAG,1,0.0,,United Kingdom,2026-01-30
520681,22361,GLASS JAR DAISY FRESH COTTON WOOL,1,0.0,,United Kingdom,2026-01-30
520681,22326,ROUND SNACK BOXES SET OF4 WOODLAND ,1,0.0,,United Kingdom,2026-01-30
520681,22200,FRYING PAN PINK POLKADOT ,1,0.0,,United Kingdom,2026-01-30
520681,22197,SMALL POPCORN HOLDER,2,0.0,,United Kingdom,2026-01-30
520681,20619,TROPICAL PASSPORT COVER ,1,0.0,,United Kingdom,2026-01-30
520681,22066,LOVE HEART TRINKET POT,1,0.0,,United Kingdom,2026-01-30
520681,22073,RED RETROSPOT STORAGE JAR,1,0.0,,United Kingdom,2026-01-30
520681,21791,VINTAGE HEADS AND TAILS CARD GAME ,3,0.0,,United Kingdom,2026-01-30
520681,21116,OWL DOORSTOP,1,0.0,,United Kingdom,2026-01-30
520681,21890,S/6 WOODEN SKITTLES IN COTTON BAG,1,0.0,,United Kingdom,2026-01-30
520681,20685,DOORMAT RED SPOT,1,0.0,,United Kingdom,2026-01-30
520681,20676,RED SPOTTY BOWL,1,0.0,,United Kingdom,2026-01-30
520681,20677,PINK SPOTTY BOWL,1,0.0,,United Kingdom,2026-01-30
520681,21891,TRADITIONAL WOODEN SKIPPING ROPE,2,0.0,,United Kingdom,2026-01-30
520682,21181,PLEASE ONE PERSON METAL SIGN,12,2.1,14949.0,United Kingdom,2026-01-30
520682,21169,YOU'RE CONFUSING ME METAL SIGN ,12,1.69,14949.0,United Kingdom,2026-01-30
520682,72741,GRAND CHOCOLATECANDLE,9,1.45,14949.0,United Kingdom,2026-01-30
520682,22063,CERAMIC BOWL WITH STRAWBERRY DESIGN,6,2.95,14949.0,United Kingdom,2026-01-30
520682,22055,MINI CAKE STAND  HANGING STRAWBERY,8,1.65,14949.0,United Kingdom,2026-01-30
520682,21231,SWEETHEART CERAMIC TRINKET BOX,12,1.25,14949.0,United Kingdom,2026-01-30
520682,22649,STRAWBERRY FAIRY CAKE TEAPOT,8,4.95,14949.0,United Kingdom,2026-01-30
520682,82600,NO SINGING METAL SIGN,12,2.1,14949.0,United Kingdom,2026-01-30
520682,21232,STRAWBERRY CERAMIC TRINKET BOX,12,1.25,14949.0,United Kingdom,2026-01-30
520683,22198,LARGE POPCORN HOLDER ,4,1.65,17961.0,United Kingdom,2026-01-30
520683,22197,SMALL POPCORN HOLDER,6,0.85,17961.0,United Kingdom,2026-01-30
C520684,S,SAMPLES,-1,317.94,,United Kingdom,2026-01-30
520685,22629,SPACEBOY LUNCH BOX ,1,4.21,,United Kingdom,2026-01-30
520685,22631,CIRCUS PARADE LUNCH BOX ,1,4.21,,United Kingdom,2026-01-30
520685,22663,JUMBO BAG DOLLY GIRL DESIGN,1,4.21,,United Kingdom,2026-01-30
520685,22664,TOY TIDY DOLLY GIRL DESIGN,1,4.21,,United Kingdom,2026-01-30
520685,22671,FRENCH LAUNDRY SIGN BLUE METAL,1,3.36,,United Kingdom,2026-01-30
520685,22683,"FRENCH BLUE METAL DOOR SIGN, 8",1,2.51,,United Kingdom,2026-01-30
520685,22684,"FRENCH BLUE METAL DOOR SIGN, 9",1,2.51,,United Kingdom,2026-01-30
520685,22691,DOORMAT WELCOME SUNRISE,1,14.43,,United Kingdom,2026-01-30
520685,84534B,FAIRY CAKE NOTEBOOK A5 SIZE,1,1.66,,United Kingdom,2026-01-30
520685,84270,ASSTD DESIGN BUBBLE GUM RING,2,0.43,,United Kingdom,2026-01-30
520685,22628,PICNIC BOXES SET OF 3 RETROSPOT ,1,10.17,,United Kingdom,2026-01-30
520685,84536B,FAIRY CAKES NOTEBOOK A7 SIZE,1,0.85,,United Kingdom,2026-01-30
520685,84659A,WHITE TRAVEL ALARM CLOCK,2,2.51,,United Kingdom,2026-01-30
520685,84660B,BLACK STITCHED WALL CLOCK,1,7.62,,United Kingdom,2026-01-30
520685,84685,BEACH HUT KEY CABINET,1,7.62,,United Kingdom,2026-01-30
520685,84818,DANISH ROSE PHOTO FRAME,1,2.51,,United Kingdom,2026-01-30
520685,22697,GREEN REGENCY TEACUP AND SAUCER,5,5.91,,United Kingdom,2026-01-30
520685,22606,WOODEN SKITTLES GARDEN SET,1,34.0,,United Kingdom,2026-01-30
520685,22501,PICNIC BASKET WICKER LARGE,2,21.23,,United Kingdom,2026-01-30
520685,22604,SET OF 4 NAPKIN CHARMS CUTLERY,1,5.06,,United Kingdom,2026-01-30
520685,22355,CHARLOTTE BAG SUKI DESIGN,1,1.66,,United Kingdom,2026-01-30
520685,22360,GLASS JAR ENGLISH CONFECTIONERY,1,5.91,,United Kingdom,2026-01-30
520685,22361,GLASS JAR DAISY FRESH COTTON WOOL,2,5.91,,United Kingdom,2026-01-30
520685,22366,DOORMAT AIRMAIL ,1,14.43,,United Kingdom,2026-01-30
520685,22377,BOTTLE BAG RETROSPOT ,1,4.21,,United Kingdom,2026-01-30
520685,22378,WALL TIDY RETROSPOT ,1,4.21,,United Kingdom,2026-01-30
520685,22379,RECYCLING BAG RETROSPOT ,1,4.21,,United Kingdom,2026-01-30
520685,22380,TOY TIDY SPACEBOY  ,1,4.21,,United Kingdom,2026-01-30
520685,22605,WOODEN CROQUET GARDEN SET,1,25.49,,United Kingdom,2026-01-30
520685,22383,LUNCH BAG SUKI  DESIGN ,1,4.21,,United Kingdom,2026-01-30
520685,22411,JUMBO SHOPPER VINTAGE RED PAISLEY,2,4.21,,United Kingdom,2026-01-30
520685,22423,REGENCY CAKESTAND 3 TIER,1,25.49,,United Kingdom,2026-01-30
520685,22431,WATERING CAN BLUE ELEPHANT,1,4.21,,United Kingdom,2026-01-30
520685,22447,PIN CUSHION BABUSHKA BLUE,1,6.77,,United Kingdom,2026-01-30
520685,22450,SILK PURSE BABUSHKA BLUE,1,6.77,,United Kingdom,2026-01-30
520685,22457,NATURAL SLATE HEART CHALKBOARD ,1,5.91,,United Kingdom,2026-01-30
520685,22498,WOODEN REGATTA BUNTING,1,12.72,,United Kingdom,2026-01-30
520685,84849D,HOT BATHS SOAP HOLDER,1,3.36,,United Kingdom,2026-01-30
520685,22385,JUMBO BAG SPACEBOY DESIGN,1,4.21,,United Kingdom,2026-01-30
520685,84854,GIRLY PINK TOOL SET,1,8.47,,United Kingdom,2026-01-30
520685,84912A,PINK ROSE WASHBAG,1,3.36,,United Kingdom,2026-01-30
520685,84908A,PINK 5 PATCH FLOWER CUSHION COVER ,1,5.91,,United Kingdom,2026-01-30
520685,21524,DOORMAT SPOTTY HOME SWEET HOME,1,14.43,,United Kingdom,2026-01-30
520685,21558,SKULL LUNCH BOX WITH CUTLERY ,1,5.06,,United Kingdom,2026-01-30
520685,21657,MILK BOTTLE WITH GLASS STOPPER ,1,14.43,,United Kingdom,2026-01-30
520685,21658,GLASS  BEURRE DISH,1,8.47,,United Kingdom,2026-01-30
520685,21668,RED STRIPE CERAMIC DRAWER KNOB,3,2.51,,United Kingdom,2026-01-30
520685,21669,BLUE STRIPE CERAMIC DRAWER KNOB,2,2.51,,United Kingdom,2026-01-30
520685,15056N,EDWARDIAN PARASOL NATURAL,1,12.72,,United Kingdom,2026-01-30
520685,15058A,BLUE WHITE SPOTS GARDEN PARASOL,1,25.49,,United Kingdom,2026-01-30
520685,21507,"ELEPHANT, BIRTHDAY CARD, ",1,0.85,,United Kingdom,2026-01-30
520685,16207A,PINK STRAWBERRY HANDBAG ,1,3.36,,United Kingdom,2026-01-30
520685,16235,RECYCLED PENCIL WITH RABBIT ERASER,2,0.43,,United Kingdom,2026-01-30
520685,18097C,WHITE TALL PORCELAIN T-LIGHT HOLDER,1,5.06,,United Kingdom,2026-01-30
520685,20725,LUNCH BAG RED SPOTTY,1,4.21,,United Kingdom,2026-01-30
520685,20726,LUNCH BAG WOODLAND,1,4.21,,United Kingdom,2026-01-30
520685,22624,IVORY KITCHEN SCALES,1,8.5,,United Kingdom,2026-01-30
520685,21829,DINOSAUR KEYRINGS ASSORTED,72,0.21,,United Kingdom,2026-01-30
520685,22659,LUNCH BOX I LOVE LONDON,4,1.95,,United Kingdom,2026-01-30
520685,22666,RECIPE BOX PANTRY YELLOW DESIGN,3,2.95,,United Kingdom,2026-01-30
520685,16216,LETTER SHAPE PENCIL SHARPENER,1,1.28,,United Kingdom,2026-01-30
520685,84872A,TEATIME FUNKY FLOWER BACKPACK FOR 2,1,11.02,,United Kingdom,2026-01-30
520685,21486,PINK HEART DOTS HOT WATER BOTTLE,1,4.21,,United Kingdom,2026-01-30
520685,21403,BLUE EGG  SPOON,1,0.85,,United Kingdom,2026-01-30
520685,22348,TEA BAG PLATE RED SPOTTY ,2,1.66,,United Kingdom,2026-01-30
520685,84913A,SOFT PINK ROSE TOWEL ,2,3.36,,United Kingdom,2026-01-30
520685,84913B,MINT GREEN ROSE TOWEL,2,3.36,,United Kingdom,2026-01-30
520685,84917,WHITE HAND TOWEL WITH BUTTERFLY,1,4.21,,United Kingdom,2026-01-30
520685,84945,MULTI COLOUR SILVER T-LIGHT HOLDER,6,1.84,,United Kingdom,2026-01-30
520685,20727,LUNCH BAG  BLACK SKULL.,2,4.21,,United Kingdom,2026-01-30
520685,20784,RED RETRO BAR STOOL,4,34.0,,United Kingdom,2026-01-30
520685,20901,VINTAGE KEEPSAKE BOX PINK FLOWER,1,12.72,,United Kingdom,2026-01-30
520685,21410,COUNTRY COTTAGE  DOORSTOP GREEN,1,8.47,,United Kingdom,2026-01-30
520685,21165,BEWARE OF THE CAT METAL SIGN ,1,4.21,,United Kingdom,2026-01-30
520685,21199,PINK  HEART CONFETTI IN TUBE,2,3.36,,United Kingdom,2026-01-30
520685,21202,DOLLY HONEYCOMB GARLAND,1,3.36,,United Kingdom,2026-01-30
520685,21232,STRAWBERRY CERAMIC TRINKET BOX,1,2.51,,United Kingdom,2026-01-30
520685,21314,SMALL GLASS HEART TRINKET POT,4,4.21,,United Kingdom,2026-01-30
520685,21326,AGED GLASS SILVER T-LIGHT HOLDER,3,1.66,,United Kingdom,2026-01-30
520685,21366,MIRRORED WALL ART PHOTO FRAMES,3,8.47,,United Kingdom,2026-01-30
520685,21372,MIRRORED WALL ART TABLE LAMP,1,5.91,,United Kingdom,2026-01-30
520685,21380,WOODEN HAPPY BIRTHDAY GARLAND,1,5.91,,United Kingdom,2026-01-30
520685,21186,WHITE DOVE HONEYCOMB PAPER GARLAND,1,3.36,,United Kingdom,2026-01-30
520685,22341,LOVE GARLAND PAINTED ZINC ,1,3.36,,United Kingdom,2026-01-30
520685,84673B,BLUE FLY SWAT,1,1.28,,United Kingdom,2026-01-30
520685,22323,PINK POLKADOT KIDS BAG,1,4.21,,United Kingdom,2026-01-30
520685,84946,ANTIQUE SILVER TEA GLASS ETCHED,10,2.51,,United Kingdom,2026-01-30
520685,84947,ANTIQUE SILVER TEA GLASS ENGRAVED,3,2.51,,United Kingdom,2026-01-30
520685,84975,HEART SHAPED MIRROR,1,3.36,,United Kingdom,2026-01-30
520685,84978,HANGING HEART JAR T-LIGHT HOLDER,2,2.51,,United Kingdom,2026-01-30
520685,84988,SET OF 72 PINK HEART PAPER DOILIES,1,2.98,,United Kingdom,2026-01-30
520685,85031C,CURIOUS IMAGES SCRAP BOOK SET,1,3.36,,United Kingdom,2026-01-30
520685,85034A,3 GARDENIA MORRIS BOXED CANDLES,1,8.47,,United Kingdom,2026-01-30
520685,85099C,JUMBO  BAG BAROQUE BLACK WHITE,1,4.21,,United Kingdom,2026-01-30
520685,85099F,JUMBO BAG STRAWBERRY,2,4.21,,United Kingdom,2026-01-30
520685,85123A,WHITE HANGING HEART T-LIGHT HOLDER,1,5.91,,United Kingdom,2026-01-30
520685,85170A,SET/6 IVORY BIRD T-LIGHT CANDLES,2,4.21,,United Kingdom,2026-01-30
520685,90185A,AMBER DIAMANTE EXPANDABLE RING,1,4.24,,United Kingdom,2026-01-30
520685,DOT,DOTCOM POSTAGE,1,137.5,,United Kingdom,2026-01-30
520685,22659,LUNCH BOX I LOVE LONDON,2,1.95,,United Kingdom,2026-01-30
520685,82494L,WOODEN FRAME ANTIQUE WHITE ,6,2.95,,United Kingdom,2026-01-30
520685,22652,TRAVEL SEWING KIT,19,1.65,,United Kingdom,2026-01-30
520685,20724,RED SPOTTY CHARLOTTE BAG,10,0.85,,United Kingdom,2026-01-30
520685,82600,NO SINGING METAL SIGN,1,4.21,,United Kingdom,2026-01-30
520685,82599,FANNY'S REST STOPMETAL SIGN,1,4.21,,United Kingdom,2026-01-30
520685,82484,WOOD BLACK BOARD ANT WHITE FINISH,1,13.57,,United Kingdom,2026-01-30
520685,72800D,4 BLUE DINNER CANDLES SILVER FLOCK,2,5.06,,United Kingdom,2026-01-30
520685,22325,MOBILE VINTAGE HEARTS ,1,11.87,,United Kingdom,2026-01-30
520685,22698,PINK REGENCY TEACUP AND SAUCER,1,5.91,,United Kingdom,2026-01-30
520685,22744,MAKE YOUR OWN MONSOON CARD KIT,1,5.91,,United Kingdom,2026-01-30
520685,22754,SMALL RED BABUSHKA NOTEBOOK ,1,1.66,,United Kingdom,2026-01-30
520685,22755,SMALL PURPLE BABUSHKA NOTEBOOK ,1,1.66,,United Kingdom,2026-01-30
520685,22757,LARGE RED BABUSHKA NOTEBOOK ,1,2.51,,United Kingdom,2026-01-30
520685,22758,LARGE PURPLE BABUSHKA NOTEBOOK  ,1,2.51,,United Kingdom,2026-01-30
520685,22759,SET OF 3 NOTEBOOKS IN PARCEL,2,3.36,,United Kingdom,2026-01-30
520685,21217,RED SPOTTY ROUND CAKE TINS,2,9.95,,United Kingdom,2026-01-30
520685,35004C,SET OF 3 COLOURED  FLYING DUCKS,1,12.72,,United Kingdom,2026-01-30
520685,46776F,WOVEN ROSE GARDEN CUSHION COVER ,2,4.21,,United Kingdom,2026-01-30
520685,47503J,SET/3 FLORAL GARDEN TOOLS IN BAG,1,16.13,,United Kingdom,2026-01-30
520685,47593A,CAROUSEL PONIES BABY BIB,1,0.85,,United Kingdom,2026-01-30
520685,47597,NEW ENGLAND TEATOWELS,2,1.66,,United Kingdom,2026-01-30
520685,48129,DOORMAT TOPIARY,1,14.43,,United Kingdom,2026-01-30
520685,48138,DOORMAT UNION FLAG,1,14.43,,United Kingdom,2026-01-30
520685,48173C,DOORMAT BLACK FLOCK ,1,14.43,,United Kingdom,2026-01-30
520685,72351B,SET/6 PINK  BUTTERFLY T-LIGHTS,1,4.21,,United Kingdom,2026-01-30
520685,37448,CERAMIC CAKE DESIGN SPOTTED MUG,1,3.36,,United Kingdom,2026-01-30
520685,21670,BLUE SPOT CERAMIC DRAWER KNOB,2,2.51,,United Kingdom,2026-01-30
520685,35001G,HAND OPEN SHAPE GOLD,1,4.21,,United Kingdom,2026-01-30
520685,21673,WHITE SPOT BLUE CERAMIC DRAWER KNOB,2,2.51,,United Kingdom,2026-01-30
520685,21982,PACK OF 12 SUKI TISSUES ,3,0.85,,United Kingdom,2026-01-30
