Invoice,StockCode,Description,Quantity,Price,Customer ID,Country,InvoiceDate
536197,22865,HAND WARMER OWL DESIGN,4,2.1,13444.0,United Kingdom,2026-04-20
536197,22910,PAPER CHAIN KIT VINTAGE CHRISTMAS,9,2.95,13444.0,United Kingdom,2026-04-20
536197,22411,JUMBO SHOPPER VINTAGE RED PAISLEY,10,1.95,13444.0,United Kingdom,2026-04-20
536197,20718,RED RETROSPOT SHOPPER BAG,10,1.25,13444.0,United Kingdom,2026-04-20
536197,22739,RIBBON REEL CHRISTMAS SOCK BAUBLE,5,1.65,13444.0,United Kingdom,2026-04-20
536197,22738,RIBBON REEL SNOWY VILLAGE,5,1.65,13444.0,United Kingdom,2026-04-20
C536198,22761,CHEST 7 DRAWER MA CAMPAGNE,-1,24.95,,United Kingdom,2026-04-20
536199,22537,MAGIC DRAWING SLATE DINOSAUR,2,0.42,18039.0,United Kingdom,2026-04-20
536199,22531,MAGIC DRAWING SLATE CIRCUS PARADE  ,2,0.42,18039.0,United Kingdom,2026-04-20
536199,22534,MAGIC DRAWING SLATE SPACEBOY ,2,0.42,18039.0,United Kingdom,2026-04-20
536199,84347,ROTATING SILVER ANGELS T-LIGHT HLDR,2,2.55,18039.0,United Kingdom,2026-04-20
536199,16012,FOOD/DRINK SPONGE STICKERS,24,0.21,18039.0,United Kingdom,2026-04-20
536199,22587,FELTCRAFT HAIRBAND RED AND BLUE,3,0.85,18039.0,United Kingdom,2026-04-20
536199,22562,MONSTERS STENCIL CRAFT,2,1.25,18039.0,United Kingdom,2026-04-20
536199,22563,HAPPY STENCIL CRAFT,2,1.25,18039.0,United Kingdom,2026-04-20
536199,20972,PINK CREAM FELT CRAFT TRINKET BOX ,2,1.25,18039.0,United Kingdom,2026-04-20
536199,22195,LARGE HEART MEASURING SPOONS,2,1.65,18039.0,United Kingdom,2026-04-20
536199,22493,PAINT YOUR OWN CANVAS SET,2,1.65,18039.0,United Kingdom,2026-04-20
536199,21034,REX CASH+CARRY JUMBO SHOPPER,2,0.95,18039.0,United Kingdom,2026-04-20
536199,22810,SET OF 6 T-LIGHTS SNOWMEN,1,2.95,18039.0,United Kingdom,2026-04-20
536199,22809,SET OF 6 T-LIGHTS SANTA,1,2.95,18039.0,United Kingdom,2026-04-20
536199,22149,FELTCRAFT 6 FLOWER FRIENDS,2,2.1,18039.0,United Kingdom,2026-04-20
536199,22150,3 STRIPEY MICE FELTCRAFT,2,1.95,18039.0,United Kingdom,2026-04-20
536199,22147,FELTCRAFT BUTTERFLY HEARTS,2,1.45,18039.0,United Kingdom,2026-04-20
536199,22131,FOOD CONTAINER SET 3 LOVE HEART ,2,1.95,18039.0,United Kingdom,2026-04-20
536199,21327,SKULLS WRITING SET ,2,1.65,18039.0,United Kingdom,2026-04-20
536199,20992,JAZZ HEARTS PURSE NOTEBOOK,4,0.85,18039.0,United Kingdom,2026-04-20
536199,22629,SPACEBOY LUNCH BOX ,1,1.95,18039.0,United Kingdom,2026-04-20
536199,21107,CREAM SLICE FLANNEL PINK SPOT ,1,2.95,18039.0,United Kingdom,2026-04-20
536199,22532,MAGIC DRAWING SLATE LEAP FROG ,2,0.42,18039.0,United Kingdom,2026-04-20
536199,84077,WORLD WAR 2 GLIDERS ASSTD DESIGNS,48,0.29,18039.0,United Kingdom,2026-04-20
536199,22536,MAGIC DRAWING SLATE PURDEY,2,0.42,18039.0,United Kingdom,2026-04-20
536199,22561,WOODEN SCHOOL COLOURING SET,4,1.65,18039.0,United Kingdom,2026-04-20
536199,22635,CHILDS BREAKFAST SET DOLLY GIRL ,1,9.95,18039.0,United Kingdom,2026-04-20
536199,72807C,SET/3 VANILLA SCENTED CANDLE IN BOX,1,4.25,18039.0,United Kingdom,2026-04-20
536199,72803A,ROSE SCENT CANDLE JEWELLED DRAWER,1,4.25,18039.0,United Kingdom,2026-04-20
536199,20914,SET/5 RED RETROSPOT LID GLASS BOWLS,1,2.95,18039.0,United Kingdom,2026-04-20
536199,22956,36 FOIL HEART CAKE CASES,1,2.1,18039.0,United Kingdom,2026-04-20
536199,22743,MAKE YOUR OWN FLOWERPOWER CARD KIT,1,2.95,18039.0,United Kingdom,2026-04-20
536199,22493,PAINT YOUR OWN CANVAS SET,1,1.65,18039.0,United Kingdom,2026-04-20
536199,84347,ROTATING SILVER ANGELS T-LIGHT HLDR,2,2.55,18039.0,United Kingdom,2026-04-20
536199,22701,PINK DOG BOWL,1,2.95,18039.0,United Kingdom,2026-04-20
536199,21107,CREAM SLICE FLANNEL PINK SPOT ,1,2.95,18039.0,United Kingdom,2026-04-20
536199,22955,36 FOIL STAR CAKE CASES ,1,2.1,18039.0,United Kingdom,2026-04-20
536199,21587,COSY HOUR GIANT TUBE MATCHES,1,2.55,18039.0,United Kingdom,2026-04-20
536199,22844,VINTAGE CREAM DOG FOOD CONTAINER,1,8.5,18039.0,United Kingdom,2026-04-20
536199,22634,CHILDS BREAKFAST SET SPACEBOY ,1,9.95,18039.0,United Kingdom,2026-04-20
536199,21034,REX CASH+CARRY JUMBO SHOPPER,4,0.95,18039.0,United Kingdom,2026-04-20
536199,22810,SET OF 6 T-LIGHTS SNOWMEN,3,2.95,18039.0,United Kingdom,2026-04-20
536199,21034,REX CASH+CARRY JUMBO SHOPPER,4,0.95,18039.0,United Kingdom,2026-04-20
536199,85099C,JUMBO  BAG BAROQUE BLACK WHITE,3,1.95,18039.0,United Kingdom,2026-04-20
536199,22619,SET OF 6 SOLDIER SKITTLES,1,3.75,18039.0,United Kingdom,2026-04-20
536199,22493,PAINT YOUR OWN CANVAS SET,1,1.65,18039.0,United Kingdom,2026-04-20
536199,22626,BLACK KITCHEN SCALES,1,8.5,18039.0,United Kingdom,2026-04-20
536199,22955,36 FOIL STAR CAKE CASES ,1,2.1,18039.0,United Kingdom,2026-04-20
536199,22956,36 FOIL HEART CAKE CASES,1,2.1,18039.0,United Kingdom,2026-04-20
536199,72803A,ROSE SCENT CANDLE JEWELLED DRAWER,1,4.25,18039.0,United Kingdom,2026-04-20
536199,22629,SPACEBOY LUNCH BOX ,1,1.95,18039.0,United Kingdom,2026-04-20
536199,84347,ROTATING SILVER ANGELS T-LIGHT HLDR,2,2.55,18039.0,United Kingdom,2026-04-20
536200,22780,LIGHT GARLAND BUTTERFILES PINK,4,4.25,13050.0,United Kingdom,2026-04-20
536200,22728,ALARM CLOCK BAKELIKE PINK,4,3.75,13050.0,United Kingdom,2026-04-20
536200,22169,FAMILY ALBUM WHITE PICTURE FRAME,2,8.5,13050.0,United Kingdom,2026-04-20
536200,22427,ENAMEL FLOWER JUG CREAM,3,5.95,13050.0,United Kingdom,2026-04-20
536200,22086,PAPER CHAIN KIT 50'S CHRISTMAS ,6,2.95,13050.0,United Kingdom,2026-04-20
536200,16008,SMALL FOLDING SCISSOR(POINTED EDGE),24,0.25,13050.0,United Kingdom,2026-04-20
536200,22862,LOVE HEART NAPKIN BOX ,4,4.25,13050.0,United Kingdom,2026-04-20
536200,22555,PLASTERS IN TIN STRONGMAN,12,1.65,13050.0,United Kingdom,2026-04-20
536200,22592,CARDHOLDER HOLLY WREATH METAL,4,3.75,13050.0,United Kingdom,2026-04-20
536200,22178,VICTORIAN GLASS HANGING T-LIGHT,12,1.25,13050.0,United Kingdom,2026-04-20
536200,22652,TRAVEL SEWING KIT,10,1.65,13050.0,United Kingdom,2026-04-20
536200,21428,SET3 BOOK BOX GREEN GINGHAM FLOWER ,4,4.25,13050.0,United Kingdom,2026-04-20
536200,22960,JAM MAKING SET WITH JARS,6,4.25,13050.0,United Kingdom,2026-04-20
536200,22988,SOLDIERS EGG CUP ,12,1.25,13050.0,United Kingdom,2026-04-20
536200,22469,HEART OF WICKER SMALL,12,1.65,13050.0,United Kingdom,2026-04-20
536200,22969,HOMEMADE JAM SCENTED CANDLES,12,1.45,13050.0,United Kingdom,2026-04-20
536200,22977,DOLLY GIRL CHILDRENS EGG CUP,12,1.25,13050.0,United Kingdom,2026-04-20
536200,22666,RECIPE BOX PANTRY YELLOW DESIGN,6,2.95,13050.0,United Kingdom,2026-04-20
C536201,22197,SMALL POPCORN HOLDER,-3,0.72,15785.0,United Kingdom,2026-04-20
C536202,20725,LUNCH BAG RED RETROSPOT,-2,1.65,14233.0,United Kingdom,2026-04-20
C536203,37370,RETRO COFFEE MUGS ASSORTED,-4,1.25,17069.0,United Kingdom,2026-04-20
536204,22113,GREY HEART HOT WATER BOTTLE,4,3.75,15750.0,United Kingdom,2026-04-20
536204,20713,JUMBO BAG OWLS,10,1.95,15750.0,United Kingdom,2026-04-20
536204,21931,JUMBO STORAGE BAG SUKI,10,1.95,15750.0,United Kingdom,2026-04-20
536204,21928,JUMBO BAG SCANDINAVIAN PAISLEY,10,1.95,15750.0,United Kingdom,2026-04-20
536204,22112,CHOCOLATE HOT WATER BOTTLE,3,4.95,15750.0,United Kingdom,2026-04-20
536204,85099B,JUMBO BAG RED RETROSPOT,10,1.95,15750.0,United Kingdom,2026-04-20
536204,22111,SCOTTIE DOG HOT WATER BOTTLE,3,4.95,15750.0,United Kingdom,2026-04-20
536204,22866,HAND WARMER SCOTTY DOG DESIGN,24,2.1,15750.0,United Kingdom,2026-04-20
536204,22632,HAND WARMER RED RETROSPOT,12,2.1,15750.0,United Kingdom,2026-04-20
536204,22633,HAND WARMER UNION JACK,24,2.1,15750.0,United Kingdom,2026-04-20
536204,22558,CLOTHES PEGS RETROSPOT PACK 24 ,12,1.49,15750.0,United Kingdom,2026-04-20
536204,22865,HAND WARMER OWL DESIGN,24,2.1,15750.0,United Kingdom,2026-04-20
536205,22910,PAPER CHAIN KIT VINTAGE CHRISTMAS,40,2.55,13078.0,United Kingdom,2026-04-20
536205,22738,RIBBON REEL SNOWY VILLAGE,10,1.65,13078.0,United Kingdom,2026-04-20
536205,22624,IVORY KITCHEN SCALES,2,8.5,13078.0,United Kingdom,2026-04-20
536205,22625,RED KITCHEN SCALES,2,8.5,13078.0,United Kingdom,2026-04-20
536205,22627,MINT KITCHEN SCALES,2,8.5,13078.0,United Kingdom,2026-04-20
536205,84692,BOX OF 24 COCKTAIL PARASOLS,25,0.42,13078.0,United Kingdom,2026-04-20
536205,22041,"RECORD FRAME 7"" SINGLE SIZE ",12,2.55,13078.0,United Kingdom,2026-04-20
536205,22654,DELUXE SEWING KIT ,6,5.95,13078.0,United Kingdom,2026-04-20
536205,22569,FELTCRAFT CUSHION BUTTERFLY,4,3.75,13078.0,United Kingdom,2026-04-20
536205,21181,PLEASE ONE PERSON METAL SIGN,48,1.85,13078.0,United Kingdom,2026-04-20
536205,22028,PENNY FARTHING BIRTHDAY CARD,12,0.42,13078.0,United Kingdom,2026-04-20
536205,21523,DOORMAT FANCY FONT HOME SWEET HOME,10,6.75,13078.0,United Kingdom,2026-04-20
536205,48138,DOORMAT UNION FLAG,10,6.75,13078.0,United Kingdom,2026-04-20
536205,84050,PINK HEART SHAPE EGG FRYING PAN,72,1.25,13078.0,United Kingdom,2026-04-20
536205,21832,CHOCOLATE CALCULATOR,12,1.65,13078.0,United Kingdom,2026-04-20
536205,22194,BLACK DINER WALL CLOCK,2,8.5,13078.0,United Kingdom,2026-04-20
536205,22193,RED DINER WALL CLOCK,2,8.5,13078.0,United Kingdom,2026-04-20
536205,22192,BLUE DINER WALL CLOCK,2,8.5,13078.0,United Kingdom,2026-04-20
536205,22191,IVORY DINER WALL CLOCK,2,8.5,13078.0,United Kingdom,2026-04-20
536205,22109,FULL ENGLISH BREAKFAST PLATE,16,3.39,13078.0,United Kingdom,2026-04-20
536205,22107,PIZZA PLATE IN BOX,4,3.75,13078.0,United Kingdom,2026-04-20
536205,22111,SCOTTIE DOG HOT WATER BOTTLE,24,4.25,13078.0,United Kingdom,2026-04-20
536205,21745,GAOLERS KEYS DECORATIVE GARDEN ,4,3.75,13078.0,United Kingdom,2026-04-20
536205,21791,VINTAGE HEADS AND TAILS CARD GAME ,12,1.25,13078.0,United Kingdom,2026-04-20
536206,22620,4 TRADITIONAL SPINNING TOPS,12,1.25,13450.0,United Kingdom,2026-04-20
536206,21703,BAG 125g SWIRLY MARBLES,72,0.42,13450.0,United Kingdom,2026-04-20
536206,21892,TRADITIONAL WOODEN CATCH CUP GAME ,12,1.25,13450.0,United Kingdom,2026-04-20
536206,21915,RED  HARMONICA IN BOX ,72,1.25,13450.0,United Kingdom,2026-04-20
536206,21704,BAG 250g SWIRLY MARBLES,72,0.85,13450.0,United Kingdom,2026-04-20
536206,22569,FELTCRAFT CUSHION BUTTERFLY,4,3.75,13450.0,United Kingdom,2026-04-20
536206,22570,FELTCRAFT CUSHION RABBIT,4,3.75,13450.0,United Kingdom,2026-04-20
536206,22150,3 STRIPEY MICE FELTCRAFT,6,1.95,13450.0,United Kingdom,2026-04-20
536206,22147,FELTCRAFT BUTTERFLY HEARTS,12,1.45,13450.0,United Kingdom,2026-04-20
536206,22560,TRADITIONAL MODELLING CLAY,24,1.25,13450.0,United Kingdom,2026-04-20
536207,22197,SMALL POPCORN HOLDER,20,0.85,17826.0,United Kingdom,2026-04-20
536207,85135B,BLUE DRAGONFLY HELICOPTER,1,7.95,17826.0,United Kingdom,2026-04-20
536207,20832,RED FLOCK LOVE HEART PHOTO FRAME,2,0.85,17826.0,United Kingdom,2026-04-20
536207,22195,LARGE HEART MEASURING SPOONS,1,1.65,17826.0,United Kingdom,2026-04-20
536207,22107,PIZZA PLATE IN BOX,2,3.75,17826.0,United Kingdom,2026-04-20
536207,79067,CORONA MEXICAN TRAY,1,3.75,17826.0,United Kingdom,2026-04-20
536207,51020A,SUMMER FUN DESIGN SHOWER CAP,2,1.25,17826.0,United Kingdom,2026-04-20
536207,22646,CERAMIC STRAWBERRY CAKE MONEY BANK,4,1.45,17826.0,United Kingdom,2026-04-20
536207,21326,AGED GLASS SILVER T-LIGHT HOLDER,12,0.65,17826.0,United Kingdom,2026-04-20
536207,85123A,WHITE HANGING HEART T-LIGHT HOLDER,2,2.95,17826.0,United Kingdom,2026-04-20
536207,21933,PINK VINTAGE PAISLEY PICNIC BAG,1,2.95,17826.0,United Kingdom,2026-04-20
536207,21932,SCANDINAVIAN PAISLEY PICNIC BAG,1,2.95,17826.0,United Kingdom,2026-04-20
536207,47566,PARTY BUNTING,1,4.65,17826.0,United Kingdom,2026-04-20
536207,22988,SOLDIERS EGG CUP ,2,1.25,17826.0,United Kingdom,2026-04-20
536207,20878,SET/9 CHRISTMAS T-LIGHTS SCENTED ,1,1.25,17826.0,United Kingdom,2026-04-20
536207,84592,CROCHET ROSE PURSE WITH SUEDE BACK,2,2.95,17826.0,United Kingdom,2026-04-20
536207,21870,I CAN ONLY PLEASE ONE PERSON MUG,1,1.25,17826.0,United Kingdom,2026-04-20
536207,22584,PACK OF 6 PANNETONE GIFT BOXES,1,2.55,17826.0,United Kingdom,2026-04-20
536207,21929,JUMBO BAG PINK VINTAGE PAISLEY,1,1.95,17826.0,United Kingdom,2026-04-20
536207,21428,SET3 BOOK BOX GREEN GINGHAM FLOWER ,1,4.25,17826.0,United Kingdom,2026-04-20
536207,20867,PINK ROSE FABRIC MIRROR,1,1.25,17826.0,United Kingdom,2026-04-20
536207,22082,RIBBON REEL STRIPES DESIGN ,5,1.65,17826.0,United Kingdom,2026-04-20
536207,22759,SET OF 3 NOTEBOOKS IN PARCEL,1,1.65,17826.0,United Kingdom,2026-04-20
536207,22865,HAND WARMER OWL DESIGN,2,2.1,17826.0,United Kingdom,2026-04-20
536207,20867,PINK ROSE FABRIC MIRROR,1,1.25,17826.0,United Kingdom,2026-04-20
536207,22577,WOODEN HEART CHRISTMAS SCANDINAVIAN,2,0.85,17826.0,United Kingdom,2026-04-20
536207,22579,WOODEN TREE CHRISTMAS SCANDINAVIAN,2,0.85,17826.0,United Kingdom,2026-04-20
536207,22411,JUMBO SHOPPER VINTAGE RED PAISLEY,1,1.95,17826.0,United Kingdom,2026-04-20
536207,16238,PARTY TIME PENCIL ERASERS,4,0.21,17826.0,United Kingdom,2026-04-20
536207,22111,SCOTTIE DOG HOT WATER BOTTLE,1,4.95,17826.0,United Kingdom,2026-04-20
536207,22112,CHOCOLATE HOT WATER BOTTLE,1,4.95,17826.0,United Kingdom,2026-04-20
536207,22960,JAM MAKING SET WITH JARS,1,4.25,17826.0,United Kingdom,2026-04-20
536207,22866,HAND WARMER SCOTTY DOG DESIGN,2,2.1,17826.0,United Kingdom,2026-04-20
536207,22581,WOOD STOCKING CHRISTMAS SCANDISPOT,2,0.85,17826.0,United Kingdom,2026-04-20
536208,72232,FENG SHUI PILLAR CANDLE,48,0.19,14865.0,United Kingdom,2026-04-20
536209,22846,BREAD BIN DINER STYLE RED ,1,16.95,15906.0,United Kingdom,2026-04-20
536209,22441,GROW YOUR OWN BASIL IN ENAMEL MUG,8,2.1,15906.0,United Kingdom,2026-04-20
536209,37475,SET/4 COLOURFUL MIXING BOWLS,4,9.95,15906.0,United Kingdom,2026-04-20
536209,22960,JAM MAKING SET WITH JARS,12,3.75,15906.0,United Kingdom,2026-04-20
536209,22666,RECIPE BOX PANTRY YELLOW DESIGN,12,2.95,15906.0,United Kingdom,2026-04-20
536209,21870,I CAN ONLY PLEASE ONE PERSON MUG,1,1.25,15906.0,United Kingdom,2026-04-20
536209,22923,FRIDGE MAGNETS LES ENFANTS ASSORTED,6,0.85,15906.0,United Kingdom,2026-04-20
536209,22846,BREAD BIN DINER STYLE RED ,1,16.95,15906.0,United Kingdom,2026-04-20
536209,22867,HAND WARMER BIRD DESIGN,12,2.1,15906.0,United Kingdom,2026-04-20
536209,85048,15CM CHRISTMAS GLASS BALL 20 LIGHTS,5,7.95,15906.0,United Kingdom,2026-04-20
536209,22781,GUMBALL MAGAZINE RACK,6,7.65,15906.0,United Kingdom,2026-04-20
536209,21557,SET OF 6 FUNKY BEAKERS,1,2.95,15906.0,United Kingdom,2026-04-20
536209,22625,RED KITCHEN SCALES,1,8.5,15906.0,United Kingdom,2026-04-20
536209,22847,BREAD BIN DINER STYLE IVORY,1,16.95,15906.0,United Kingdom,2026-04-20
536209,22627,MINT KITCHEN SCALES,1,8.5,15906.0,United Kingdom,2026-04-20
536209,47567B,TEA TIME KITCHEN APRON,1,5.95,15906.0,United Kingdom,2026-04-20
536209,22961,JAM MAKING SET PRINTED,12,1.45,15906.0,United Kingdom,2026-04-20
536209,22840,ROUND CAKE TIN VINTAGE RED,3,7.95,15906.0,United Kingdom,2026-04-20
536209,22845,VINTAGE CREAM CAT FOOD CONTAINER,4,6.35,15906.0,United Kingdom,2026-04-20
536209,22844,VINTAGE CREAM DOG FOOD CONTAINER,4,8.5,15906.0,United Kingdom,2026-04-20
536209,22429,ENAMEL MEASURING JUG CREAM,3,4.25,15906.0,United Kingdom,2026-04-20
536209,22965,3 TRADITIONAl BISCUIT CUTTERS  SET,6,2.1,15906.0,United Kingdom,2026-04-20
536209,22442,GROW YOUR OWN FLOWERS SET OF 3,3,7.95,15906.0,United Kingdom,2026-04-20
536209,22443,GROW YOUR OWN HERBS SET OF 3,6,7.95,15906.0,United Kingdom,2026-04-20
536209,22626,BLACK KITCHEN SCALES,1,8.5,15906.0,United Kingdom,2026-04-20
536209,22487,WHITE WOOD GARDEN PLANT LADDER,1,9.95,15906.0,United Kingdom,2026-04-20
536209,84375,SET OF 20 KIDS COOKIE CUTTERS,12,2.1,15906.0,United Kingdom,2026-04-20
C536210,22838,3 TIER CAKE TIN RED AND CREAM,-1,14.95,17402.0,United Kingdom,2026-04-20
C536210,22838,3 TIER CAKE TIN RED AND CREAM,-1,14.95,17402.0,United Kingdom,2026-04-20
536211,22812,PACK 3 BOXES CHRISTMAS PANNETONE,12,1.95,13021.0,United Kingdom,2026-04-20
536211,22837,HOT WATER BOTTLE BABUSHKA ,8,4.65,13021.0,United Kingdom,2026-04-20
536211,21012,ANTIQUE ALL GLASS CANDLESTICK,6,2.1,13021.0,United Kingdom,2026-04-20
536211,21181,PLEASE ONE PERSON METAL SIGN,12,2.1,13021.0,United Kingdom,2026-04-20
536211,21982,PACK OF 12 SUKI TISSUES ,24,0.29,13021.0,United Kingdom,2026-04-20
536211,21498,RED RETROSPOT WRAP ,25,0.42,13021.0,United Kingdom,2026-04-20
536211,22752,SET 7 BABUSHKA NESTING BOXES,2,8.5,13021.0,United Kingdom,2026-04-20
536211,22049,WRAP CHRISTMAS SCREEN PRINT,25,0.42,13021.0,United Kingdom,2026-04-20
536211,85099C,JUMBO  BAG BAROQUE BLACK WHITE,10,1.95,13021.0,United Kingdom,2026-04-20
536211,22568,FELTCRAFT CUSHION OWL,4,3.75,13021.0,United Kingdom,2026-04-20
536211,22509,SEWING BOX RETROSPOT DESIGN ,1,16.95,13021.0,United Kingdom,2026-04-20
536211,21284,RETROSPOT CANDLE  SMALL,12,1.69,13021.0,United Kingdom,2026-04-20
536211,85099B,JUMBO BAG RED RETROSPOT,10,1.95,13021.0,United Kingdom,2026-04-20
536211,21929,JUMBO BAG PINK VINTAGE PAISLEY,10,1.95,13021.0,United Kingdom,2026-04-20
536211,21484,CHICK GREY HOT WATER BOTTLE,4,3.45,13021.0,United Kingdom,2026-04-20
536211,22835,HOT WATER BOTTLE I AM SO POORLY,4,4.65,13021.0,United Kingdom,2026-04-20
536211,22569,FELTCRAFT CUSHION BUTTERFLY,4,3.75,13021.0,United Kingdom,2026-04-20
C536212,35004C,SET OF 3 COLOURED  FLYING DUCKS,-12,4.65,15611.0,United Kingdom,2026-04-20
536213,22457,NATURAL SLATE HEART CHALKBOARD ,12,2.95,18170.0,United Kingdom,2026-04-20
536213,82494L,WOODEN FRAME ANTIQUE WHITE ,6,2.95,18170.0,United Kingdom,2026-04-20
536213,82482,WOODEN PICTURE FRAME WHITE FINISH,6,2.55,18170.0,United Kingdom,2026-04-20
536213,82486,WOOD S/3 CABINET ANT WHITE FINISH,2,7.95,18170.0,United Kingdom,2026-04-20
536213,22624,IVORY KITCHEN SCALES,1,8.5,18170.0,United Kingdom,2026-04-20
536213,85152,HAND OVER THE CHOCOLATE   SIGN ,5,2.1,18170.0,United Kingdom,2026-04-20
536213,22470,HEART OF WICKER LARGE,6,2.95,18170.0,United Kingdom,2026-04-20
536213,22676,FRENCH BLUE METAL DOOR SIGN 1,1,1.25,18170.0,United Kingdom,2026-04-20
536213,22119,PEACE WOODEN BLOCK LETTERS,2,6.95,18170.0,United Kingdom,2026-04-20
536213,22118,JOY WOODEN BLOCK LETTERS,2,4.95,18170.0,United Kingdom,2026-04-20
536213,85123A,WHITE HANGING HEART T-LIGHT HOLDER,15,2.95,18170.0,United Kingdom,2026-04-20
536213,22469,HEART OF WICKER SMALL,10,1.65,18170.0,United Kingdom,2026-04-20
536213,22121,NOEL WOODEN BLOCK LETTERS ,2,5.95,18170.0,United Kingdom,2026-04-20
536214,22644,CERAMIC CHERRY CAKE MONEY BANK,12,1.45,16600.0,United Kingdom,2026-04-20
536214,20727,LUNCH BAG  BLACK SKULL.,10,1.65,16600.0,United Kingdom,2026-04-20
536214,22383,LUNCH BAG SUKI  DESIGN ,10,1.65,16600.0,United Kingdom,2026-04-20
536214,21931,JUMBO STORAGE BAG SUKI,10,1.95,16600.0,United Kingdom,2026-04-20
536214,20713,JUMBO BAG OWLS,10,1.95,16600.0,United Kingdom,2026-04-20
536214,84879,ASSORTED COLOUR BIRD ORNAMENT,16,1.69,16600.0,United Kingdom,2026-04-20
536214,22149,FELTCRAFT 6 FLOWER FRIENDS,6,2.1,16600.0,United Kingdom,2026-04-20
C536215,21137,BLACK RECORD COVER FRAME,-7,3.39,13750.0,United Kingdom,2026-04-20
536216,22809,SET OF 6 T-LIGHTS SANTA,1,2.95,14390.0,United Kingdom,2026-04-20
536216,21694,SMALL REGAL  SILVER CANDLEPOT ,6,2.95,14390.0,United Kingdom,2026-04-20
536216,21693,SMALL HAMMERED SILVER CANDLEPOT ,18,2.95,14390.0,United Kingdom,2026-04-20
536216,18097C,WHITE TALL PORCELAIN T-LIGHT HOLDER,6,2.55,14390.0,United Kingdom,2026-04-20
536216,20749,ASSORTED COLOUR MINI CASES,1,7.95,14390.0,United Kingdom,2026-04-20
536216,22385,JUMBO BAG SPACEBOY DESIGN,6,1.95,14390.0,United Kingdom,2026-04-20
536216,22470,HEART OF WICKER LARGE,6,2.95,14390.0,United Kingdom,2026-04-20
536216,21930,JUMBO STORAGE BAG SKULLS,1,1.95,14390.0,United Kingdom,2026-04-20
536216,21351,CINAMMON & ORANGE WREATH,1,6.75,14390.0,United Kingdom,2026-04-20
536216,22810,SET OF 6 T-LIGHTS SNOWMEN,3,2.95,14390.0,United Kingdom,2026-04-20
536216,21833,CAMOUFLAGE LED TORCH,6,1.69,14390.0,United Kingdom,2026-04-20
536216,48138,DOORMAT UNION FLAG,3,7.95,14390.0,United Kingdom,2026-04-20
536216,22297,HEART IVORY TRELLIS SMALL,2,1.25,14390.0,United Kingdom,2026-04-20
536216,85099B,JUMBO BAG RED RETROSPOT,8,1.95,14390.0,United Kingdom,2026-04-20
536216,22571,ROCKING HORSE RED CHRISTMAS ,1,0.85,14390.0,United Kingdom,2026-04-20
536216,22578,WOODEN STAR CHRISTMAS SCANDINAVIAN,2,0.85,14390.0,United Kingdom,2026-04-20
536216,22579,WOODEN TREE CHRISTMAS SCANDINAVIAN,2,0.85,14390.0,United Kingdom,2026-04-20
536216,21681,GIANT MEDINA STAMPED METAL BOWL ,2,9.95,14390.0,United Kingdom,2026-04-20
536216,22634,CHILDS BREAKFAST SET SPACEBOY ,1,9.95,14390.0,United Kingdom,2026-04-20
536216,21479,WHITE SKULL HOT WATER BOTTLE ,2,3.75,14390.0,United Kingdom,2026-04-20
536216,22835,HOT WATER BOTTLE I AM SO POORLY,3,4.65,14390.0,United Kingdom,2026-04-20
536216,22372,AIRLINE BAG VINTAGE WORLD CHAMPION ,1,4.25,14390.0,United Kingdom,2026-04-20
536216,20970,PINK FLORAL FELTCRAFT SHOULDER BAG,2,3.75,14390.0,United Kingdom,2026-04-20
536216,20969,RED FLORAL FELTCRAFT SHOULDER BAG,1,3.75,14390.0,United Kingdom,2026-04-20
536216,21811,CHRISTMAS HANGING HEART WITH BELL,2,1.25,14390.0,United Kingdom,2026-04-20
536216,84997B,RED 3 PIECE RETROSPOT CUTLERY SET,2,3.75,14390.0,United Kingdom,2026-04-20
536216,84997A,GREEN 3 PIECE POLKADOT CUTLERY SET,2,3.75,14390.0,United Kingdom,2026-04-20
536216,22068,BLACK PIRATE TREASURE CHEST,1,1.65,14390.0,United Kingdom,2026-04-20
536216,22645,CERAMIC HEART FAIRY CAKE MONEY BANK,3,1.45,14390.0,United Kingdom,2026-04-20
536216,22086,PAPER CHAIN KIT 50'S CHRISTMAS ,4,2.95,14390.0,United Kingdom,2026-04-20
536216,22311,OFFICE MUG WARMER BLACK+SILVER ,3,2.95,14390.0,United Kingdom,2026-04-20
536217,47590A,BLUE HAPPY BIRTHDAY BUNTING,1,5.45,14390.0,United Kingdom,2026-04-20
536217,47590B,PINK HAPPY BIRTHDAY BUNTING,1,5.45,14390.0,United Kingdom,2026-04-20
536218,84032B,CHARLIE + LOLA RED HOT WATER BOTTLE,96,2.55,15769.0,United Kingdom,2026-04-20
536219,84032B,CHARLIE + LOLA RED HOT WATER BOTTLE,12,2.55,15769.0,United Kingdom,2026-04-20
536220,20749,ASSORTED COLOUR MINI CASES,1,7.95,,United Kingdom,2026-04-20
C536221,35004C,SET OF 3 COLOURED  FLYING DUCKS,-1,4.65,16228.0,United Kingdom,2026-04-20
536223,22423,REGENCY CAKESTAND 3 TIER,2,12.75,13650.0,United Kingdom,2026-04-20
536223,21115,ROSE CARAVAN DOORSTOP,2,6.75,13650.0,United Kingdom,2026-04-20
536223,22508,DOORSTOP RETROSPOT HEART,4,3.75,13650.0,United Kingdom,2026-04-20
536223,22772,PINK DRAWER KNOB ACRYLIC EDWARDIAN,12,1.25,13650.0,United Kingdom,2026-04-20
536223,21672,WHITE SPOT RED CERAMIC DRAWER KNOB,12,1.25,13650.0,United Kingdom,2026-04-20
536223,21843,RED RETROSPOT CAKE STAND,2,10.95,13650.0,United Kingdom,2026-04-20
536223,21901,"KEY FOB , BACK DOOR ",24,0.65,13650.0,United Kingdom,2026-04-20
536223,22189,CREAM HEART CARD HOLDER,8,3.95,13650.0,United Kingdom,2026-04-20
C536222,22646,CERAMIC STRAWBERRY CAKE MONEY BANK,-5,1.45,13534.0,United Kingdom,2026-04-20
C536222,85099B,JUMBO BAG RED RETROSPOT,-1,1.95,13534.0,United Kingdom,2026-04-20
536223,85123A,WHITE HANGING HEART T-LIGHT HOLDER,12,2.95,13650.0,United Kingdom,2026-04-20
536223,21899,"KEY FOB , GARAGE DESIGN",24,0.65,13650.0,United Kingdom,2026-04-20
536223,22379,RECYCLING BAG RETROSPOT ,5,2.1,13650.0,United Kingdom,2026-04-20
536223,21790,VINTAGE SNAP CARDS,12,0.85,13650.0,United Kingdom,2026-04-20
C536222,21231,SWEETHEART CERAMIC TRINKET BOX,-4,1.25,13534.0,United Kingdom,2026-04-20
536223,22377,BOTTLE BAG RETROSPOT ,5,2.1,13650.0,United Kingdom,2026-04-20
C536222,22645,CERAMIC HEART FAIRY CAKE MONEY BANK,-4,1.45,13534.0,United Kingdom,2026-04-20
536223,85172,HYACINTH BULB T-LIGHT CANDLES,16,0.42,13650.0,United Kingdom,2026-04-20
C536222,21232,STRAWBERRY CERAMIC TRINKET BOX,-4,1.25,13534.0,United Kingdom,2026-04-20
536223,20971,PINK BLUE FELT CRAFT TRINKET BOX,12,1.25,13650.0,United Kingdom,2026-04-20
536223,22147,FELTCRAFT BUTTERFLY HEARTS,12,1.45,13650.0,United Kingdom,2026-04-20
536223,22434,BALLOON PUMP WITH 10 BALLOONS,8,1.95,13650.0,United Kingdom,2026-04-20
536223,22489,PACK OF 12 TRADITIONAL CRAYONS,24,0.42,13650.0,United Kingdom,2026-04-20
536223,21497,FANCY FONTS BIRTHDAY WRAP,25,0.42,13650.0,United Kingdom,2026-04-20
C536224,22649,STRAWBERRY FAIRY CAKE TEAPOT,-1,4.95,13952.0,United Kingdom,2026-04-20
C536224,22236,CAKE STAND 3 TIER MAGIC GARDEN,-1,12.75,13952.0,United Kingdom,2026-04-20
C536225,72807C,SET/3 VANILLA SCENTED CANDLE IN BOX,-3,3.81,15497.0,United Kingdom,2026-04-20
536226,22966,GINGERBREAD MAN COOKIE CUTTER,1,1.25,14605.0,United Kingdom,2026-04-20
536226,22423,REGENCY CAKESTAND 3 TIER,4,12.75,14605.0,United Kingdom,2026-04-20
536226,22941,CHRISTMAS LIGHTS 10 REINDEER,1,8.5,14605.0,United Kingdom,2026-04-20
536226,47567B,TEA TIME KITCHEN APRON,3,5.95,14605.0,United Kingdom,2026-04-20
536226,84987,SET OF 36 TEATIME PAPER DOILIES,1,1.45,14605.0,United Kingdom,2026-04-20
536226,21877,HOME SWEET HOME MUG,2,1.25,14605.0,United Kingdom,2026-04-20
536226,22699,ROSES REGENCY TEACUP AND SAUCER ,2,2.95,14605.0,United Kingdom,2026-04-20
536226,21871,SAVE THE PLANET MUG,2,1.25,14605.0,United Kingdom,2026-04-20
536226,21874,GIN AND TONIC MUG,6,1.25,14605.0,United Kingdom,2026-04-20
C536227,85099B,JUMBO BAG RED RETROSPOT,-1,1.95,16612.0,United Kingdom,2026-04-20
536226,21067,VINTAGE RED TEATIME MUG,6,1.25,14605.0,United Kingdom,2026-04-20
536226,21071,VINTAGE BILLBOARD DRINK ME MUG,12,1.25,14605.0,United Kingdom,2026-04-20
536226,21069,VINTAGE BILLBOARD TEA MUG,12,1.25,14605.0,United Kingdom,2026-04-20
536226,21070,VINTAGE BILLBOARD MUG ,6,1.25,14605.0,United Kingdom,2026-04-20
536226,21870,I CAN ONLY PLEASE ONE PERSON MUG,6,1.25,14605.0,United Kingdom,2026-04-20
536226,21110,LARGE CAKE TOWEL PINK SPOTS,1,6.75,14605.0,United Kingdom,2026-04-20
536226,21872,GLAMOROUS  MUG,2,1.25,14605.0,United Kingdom,2026-04-20
536226,21109,"LARGE CAKE TOWEL, CHOCOLATE SPOTS",1,6.75,14605.0,United Kingdom,2026-04-20
536226,37330,BIG POLKADOT MUG,6,1.95,14605.0,United Kingdom,2026-04-20
536226,22699,ROSES REGENCY TEACUP AND SAUCER ,1,2.95,14605.0,United Kingdom,2026-04-20
536226,47567B,TEA TIME KITCHEN APRON,5,5.95,14605.0,United Kingdom,2026-04-20
