Invoice,StockCode,Description,Quantity,Price,Customer ID,Country,InvoiceDate
531836,22570,FELTCRAFT CUSHION RABBIT,4,3.75,12982.0,United Kingdom,2026-04-03
531836,71477,COLOUR GLASS. STAR T-LIGHT HOLDER,8,3.25,12982.0,United Kingdom,2026-04-03
531836,22526,WHEELBARROW FOR CHILDREN ,1,12.75,12982.0,United Kingdom,2026-04-03
531836,22890,NOVELTY BISCUITS CAKE STAND 3 TIER,2,9.95,12982.0,United Kingdom,2026-04-03
531836,22750,FELTCRAFT PRINCESS LOLA DOLL,4,3.75,12982.0,United Kingdom,2026-04-03
531836,22468,BABUSHKA LIGHTS STRING OF 10,2,6.75,12982.0,United Kingdom,2026-04-03
531836,22179,SET 10 LIGHTS NIGHT OWL,2,6.75,12982.0,United Kingdom,2026-04-03
531836,22176,BLUE OWL SOFT TOY,6,2.95,12982.0,United Kingdom,2026-04-03
531836,22441,GROW YOUR OWN BASIL IN ENAMEL MUG,8,2.1,12982.0,United Kingdom,2026-04-03
531836,22273,FELTCRAFT DOLL MOLLY,6,2.95,12982.0,United Kingdom,2026-04-03
531837,21354,TOAST ITS - BEST MUM,24,1.05,13777.0,United Kingdom,2026-04-03
531837,20971,PINK BLUE FELT CRAFT TRINKET BOX,144,1.06,13777.0,United Kingdom,2026-04-03
531837,85038,6 CHOCOLATE LOVE HEART T-LIGHTS,72,1.69,13777.0,United Kingdom,2026-04-03
531837,22095,LADS ONLY TISSUE BOX,108,1.25,13777.0,United Kingdom,2026-04-03
531837,85123A,WHITE HANGING HEART T-LIGHT HOLDER,168,2.55,13777.0,United Kingdom,2026-04-03
531837,85099B,JUMBO BAG RED RETROSPOT,40,1.65,13777.0,United Kingdom,2026-04-03
531837,35004C,SET OF 3 COLOURED  FLYING DUCKS,168,4.65,13777.0,United Kingdom,2026-04-03
531837,15056N,EDWARDIAN PARASOL NATURAL,60,4.25,13777.0,United Kingdom,2026-04-03
531837,21156,RETROSPOT CHILDRENS APRON,24,1.65,13777.0,United Kingdom,2026-04-03
531837,82615,PINK MARSHMALLOW SCARF KNITTING KIT,60,2.55,13777.0,United Kingdom,2026-04-03
531837,84029E,RED WOOLLY HOTTIE WHITE HEART.,120,2.95,13777.0,United Kingdom,2026-04-03
531837,84050,PINK HEART SHAPE EGG FRYING PAN,144,1.25,13777.0,United Kingdom,2026-04-03
531837,85174,S/4 CACTI CANDLES,24,4.25,13777.0,United Kingdom,2026-04-03
531837,22041,"RECORD FRAME 7"" SINGLE SIZE ",192,2.1,13777.0,United Kingdom,2026-04-03
531837,21107,CREAM SLICE FLANNEL PINK SPOT ,72,2.55,13777.0,United Kingdom,2026-04-03
531837,20727,LUNCH BAG  BLACK SKULL.,100,1.45,13777.0,United Kingdom,2026-04-03
531838,22147,FELTCRAFT BUTTERFLY HEARTS,40,1.25,13777.0,United Kingdom,2026-04-03
531838,20725,LUNCH BAG RED RETROSPOT,60,1.45,13777.0,United Kingdom,2026-04-03
531838,21232,STRAWBERRY CERAMIC TRINKET BOX,144,1.25,13777.0,United Kingdom,2026-04-03
531838,22646,CERAMIC STRAWBERRY CAKE MONEY BANK,144,1.25,13777.0,United Kingdom,2026-04-03
531839,84029E,RED WOOLLY HOTTIE WHITE HEART.,384,2.95,13777.0,United Kingdom,2026-04-03
531839,21232,STRAWBERRY CERAMIC TRINKET BOX,216,1.25,13777.0,United Kingdom,2026-04-03
531840,85174,S/4 CACTI CANDLES,16,4.25,13777.0,United Kingdom,2026-04-03
531840,84029E,RED WOOLLY HOTTIE WHITE HEART.,24,2.95,13777.0,United Kingdom,2026-04-03
531840,21137,BLACK RECORD COVER FRAME,312,3.39,13777.0,United Kingdom,2026-04-03
C531841,21844,RED RETROSPOT MUG,-5,2.95,13089.0,United Kingdom,2026-04-03
531842,22386,JUMBO BAG PINK POLKADOT,20,1.95,17082.0,United Kingdom,2026-04-03
531842,22411,JUMBO SHOPPER VINTAGE RED PAISLEY,20,1.95,17082.0,United Kingdom,2026-04-03
531842,22663,JUMBO BAG DOLLY GIRL DESIGN,20,1.95,17082.0,United Kingdom,2026-04-03
531842,85099B,JUMBO BAG RED RETROSPOT,20,1.95,17082.0,United Kingdom,2026-04-03
531842,85099F,JUMBO BAG STRAWBERRY,20,1.95,17082.0,United Kingdom,2026-04-03
531842,22178,VICTORIAN GLASS HANGING T-LIGHT,12,1.25,17082.0,United Kingdom,2026-04-03
531842,22460,EMBOSSED GLASS TEALIGHT HOLDER,12,1.25,17082.0,United Kingdom,2026-04-03
531842,22385,JUMBO BAG SPACEBOY DESIGN,20,1.95,17082.0,United Kingdom,2026-04-03
531842,84970L,SINGLE HEART ZINC T-LIGHT HOLDER,24,0.95,17082.0,United Kingdom,2026-04-03
531842,84970S,HANGING HEART ZINC T-LIGHT HOLDER,24,0.85,17082.0,United Kingdom,2026-04-03
531842,22959,WRAP CHRISTMAS VILLAGE,25,0.42,17082.0,United Kingdom,2026-04-03
531842,22738,RIBBON REEL SNOWY VILLAGE,10,1.65,17082.0,United Kingdom,2026-04-03
531842,22735,RIBBON REEL SOCKS AND MITTENS,10,1.65,17082.0,United Kingdom,2026-04-03
531842,22736,RIBBON REEL MAKING SNOWMEN ,10,1.65,17082.0,United Kingdom,2026-04-03
531842,84949,SILVER HANGING T-LIGHT HOLDER,12,1.65,17082.0,United Kingdom,2026-04-03
531842,21931,JUMBO STORAGE BAG SUKI,20,1.95,17082.0,United Kingdom,2026-04-03
531842,22457,NATURAL SLATE HEART CHALKBOARD ,12,2.95,17082.0,United Kingdom,2026-04-03
531842,21928,JUMBO BAG SCANDINAVIAN PAISLEY,20,1.95,17082.0,United Kingdom,2026-04-03
531842,47566,PARTY BUNTING,5,4.65,17082.0,United Kingdom,2026-04-03
531842,47566B,TEA TIME PARTY BUNTING,5,4.65,17082.0,United Kingdom,2026-04-03
531842,84406B,CREAM CUPID HEARTS COAT HANGER,8,3.25,17082.0,United Kingdom,2026-04-03
531842,21186,WHITE DOVE HONEYCOMB PAPER GARLAND,12,1.65,17082.0,United Kingdom,2026-04-03
531842,22423,REGENCY CAKESTAND 3 TIER,8,12.75,17082.0,United Kingdom,2026-04-03
531842,84988,SET OF 72 PINK HEART PAPER DOILIES,12,1.45,17082.0,United Kingdom,2026-04-03
531842,21929,JUMBO BAG PINK VINTAGE PAISLEY,20,1.95,17082.0,United Kingdom,2026-04-03
531842,21977,PACK OF 60 PINK PAISLEY CAKE CASES,24,0.55,17082.0,United Kingdom,2026-04-03
531842,22938,CUPCAKE LACE PAPER SET 6,12,1.95,17082.0,United Kingdom,2026-04-03
531842,84991,60 TEATIME FAIRY CAKE CASES,24,0.55,17082.0,United Kingdom,2026-04-03
531842,22951,60 CAKE CASES DOLLY GIRL DESIGN,24,0.55,17082.0,United Kingdom,2026-04-03
531842,21340,CLASSIC METAL BIRDCAGE PLANT HOLDER,6,12.75,17082.0,United Kingdom,2026-04-03
531842,20711,JUMBO BAG TOYS ,20,1.95,17082.0,United Kingdom,2026-04-03
531842,21212,PACK OF 72 RETROSPOT CAKE CASES,24,0.55,17082.0,United Kingdom,2026-04-03
531843,22812,PACK 3 BOXES CHRISTMAS PANNETONE,2,4.21,,United Kingdom,2026-04-03
531843,22816,CARD MOTORBIKE SANTA,1,0.85,,United Kingdom,2026-04-03
531843,22818,CARD CHRISTMAS VILLAGE,1,0.85,,United Kingdom,2026-04-03
531843,22819,"BIRTHDAY CARD, RETRO SPOT",2,0.85,,United Kingdom,2026-04-03
531843,22866,HAND WARMER SCOTTY DOG DESIGN,1,4.21,,United Kingdom,2026-04-03
531843,22865,HAND WARMER OWL DESIGN,1,4.21,,United Kingdom,2026-04-03
531843,22807,SET OF 6 T-LIGHTS TOADSTOOLS,5,5.91,,United Kingdom,2026-04-03
531843,22867,HAND WARMER BIRD DESIGN,1,4.21,,United Kingdom,2026-04-03
531843,22869,"NUMBER TILE COTTAGE GARDEN, 1",1,4.21,,United Kingdom,2026-04-03
531843,22855,FINE WICKER HEART ,1,2.51,,United Kingdom,2026-04-03
531843,22804,CANDLEHOLDER PINK HANGING HEART,1,5.91,,United Kingdom,2026-04-03
531843,22786,CUSHION COVER PINK UNION JACK,1,16.13,,United Kingdom,2026-04-03
531843,22800,ANTIQUE TALL SWIRLGLASS TRINKET POT,1,7.62,,United Kingdom,2026-04-03
531843,22798,ANTIQUE GLASS DRESSING TABLE POT,1,5.91,,United Kingdom,2026-04-03
531843,22774,RED DRAWER KNOB ACRYLIC EDWARDIAN,15,2.51,,United Kingdom,2026-04-03
531843,22760,"TRAY, BREAKFAST IN BED",1,25.49,,United Kingdom,2026-04-03
531843,22759,SET OF 3 NOTEBOOKS IN PARCEL,1,3.36,,United Kingdom,2026-04-03
531843,22870,"NUMBER TILE COTTAGE GARDEN, 2",1,4.21,,United Kingdom,2026-04-03
531843,22757,LARGE RED BABUSHKA NOTEBOOK ,1,2.51,,United Kingdom,2026-04-03
531843,22755,SMALL PURPLE BABUSHKA NOTEBOOK ,2,1.66,,United Kingdom,2026-04-03
531843,22754,SMALL RED BABUSHKA NOTEBOOK ,2,1.66,,United Kingdom,2026-04-03
531843,22746,POPPY'S PLAYHOUSE LIVINGROOM ,1,4.21,,United Kingdom,2026-04-03
531843,22745,POPPY'S PLAYHOUSE BEDROOM ,1,4.21,,United Kingdom,2026-04-03
531843,22801,ANTIQUE GLASS PEDESTAL BOWL,1,7.62,,United Kingdom,2026-04-03
531843,22877,"NUMBER TILE COTTAGE GARDEN, 9",1,4.21,,United Kingdom,2026-04-03
531843,22946,WOODEN ADVENT CALENDAR CREAM,1,34.0,,United Kingdom,2026-04-03
531843,22899,CHILDREN'S APRON DOLLY GIRL ,2,4.21,,United Kingdom,2026-04-03
531843,40016,CHINESE DRAGON PAPER LANTERNS,1,8.47,,United Kingdom,2026-04-03
531843,37467,PIG MUG IN TWO COLOUR DESIGNS,1,4.21,,United Kingdom,2026-04-03
531843,37464,ROBOT MUG IN DISPLAY BOX,1,2.51,,United Kingdom,2026-04-03
531843,37370,RETRO COFFEE MUGS ASSORTED,1,16.13,,United Kingdom,2026-04-03
531843,35969,FOLKART CROWN TABLE DECORATIONS,2,1.66,,United Kingdom,2026-04-03
531843,35965,FOLKART HEART NAPKIN RINGS,2,3.36,,United Kingdom,2026-04-03
531843,35961,FOLKART ZINC HEART CHRISTMAS DEC,1,1.66,,United Kingdom,2026-04-03
531843,35957,SMALLFOLKART BAUBLE CHRISTMAS DEC,5,1.66,,United Kingdom,2026-04-03
531843,35916A,YELLOW FELT HANGING HEART W FLOWER,1,1.66,,United Kingdom,2026-04-03
531843,35599D,PINK AND WHITE CHRISTMAS TREE 120CM,1,5.91,,United Kingdom,2026-04-03
531843,35095A,BLUE VICTORIAN FABRIC OVAL BOX,1,0.84,,United Kingdom,2026-04-03
531843,22892,SET OF SALT AND PEPPER TOADSTOOLS,3,2.51,,United Kingdom,2026-04-03
531843,35004C,SET OF 3 COLOURED  FLYING DUCKS,1,12.72,,United Kingdom,2026-04-03
531843,22968,ROSE COTTAGE KEEPSAKE BOX ,2,20.38,,United Kingdom,2026-04-03
531843,22952,60 CAKE CASES VINTAGE CHRISTMAS,5,1.28,,United Kingdom,2026-04-03
531843,22951,60 CAKE CASES DOLLY GIRL DESIGN,1,1.28,,United Kingdom,2026-04-03
531843,22950,36 DOILIES VINTAGE CHRISTMAS,5,2.98,,United Kingdom,2026-04-03
531843,22948,METAL DECORATION NAUGHTY CHILDREN ,2,6.77,,United Kingdom,2026-04-03
531843,22741,FUNKY DIVA PEN,3,1.66,,United Kingdom,2026-04-03
531843,22910,PAPER CHAIN KIT VINTAGE CHRISTMAS,4,5.91,,United Kingdom,2026-04-03
531843,22909,SET OF 20 VINTAGE CHRISTMAS NAPKINS,7,1.66,,United Kingdom,2026-04-03
531843,22906,12 MESSAGE CARDS WITH ENVELOPES,3,3.36,,United Kingdom,2026-04-03
531843,22905,CALENDAR IN SEASON DESIGN,2,5.91,,United Kingdom,2026-04-03
531843,22904,CALENDAR PAPER CUT DESIGN,3,5.91,,United Kingdom,2026-04-03
531843,35004B,SET OF 3 BLACK FLYING DUCKS,2,5.91,,United Kingdom,2026-04-03
531843,22740,POLKADOT PEN,8,1.66,,United Kingdom,2026-04-03
531843,22733,3D TRADITIONAL CHRISTMAS STICKERS,1,2.51,,United Kingdom,2026-04-03
531843,22738,RIBBON REEL SNOWY VILLAGE,1,3.36,,United Kingdom,2026-04-03
531843,22601,CHRISTMAS RETROSPOT ANGEL WOOD,2,1.66,,United Kingdom,2026-04-03
531843,22600,CHRISTMAS RETROSPOT STAR WOOD,1,1.66,,United Kingdom,2026-04-03
531843,22594,CHRISTMAS GINGHAM TREE,2,1.66,,United Kingdom,2026-04-03
531843,22588,CARD HOLDER GINGHAM HEART,1,5.06,,United Kingdom,2026-04-03
531843,22581,WOOD STOCKING CHRISTMAS SCANDISPOT,1,1.66,,United Kingdom,2026-04-03
531843,22580,ADVENT CALENDAR GINGHAM SACK,2,11.87,,United Kingdom,2026-04-03
531843,22573,STAR WOODEN CHRISTMAS DECORATION,1,1.66,,United Kingdom,2026-04-03
531843,22572,ROCKING HORSE GREEN CHRISTMAS ,1,1.66,,United Kingdom,2026-04-03
531843,22571,ROCKING HORSE RED CHRISTMAS ,1,1.66,,United Kingdom,2026-04-03
531843,22554,PLASTERS IN TIN WOODLAND ANIMALS,2,3.36,,United Kingdom,2026-04-03
531843,22553,PLASTERS IN TIN SKULLS,1,3.36,,United Kingdom,2026-04-03
531843,22549,PICTURE DOMINOES,1,3.36,,United Kingdom,2026-04-03
531843,22547,MINI JIGSAW DINOSAUR ,2,0.85,,United Kingdom,2026-04-03
531843,22544,MINI JIGSAW SPACEBOY,6,0.85,,United Kingdom,2026-04-03
531843,22543,MINI JIGSAW BAKE A CAKE ,1,0.85,,United Kingdom,2026-04-03
531843,22537,MAGIC DRAWING SLATE DINOSAUR,1,0.85,,United Kingdom,2026-04-03
531843,22534,MAGIC DRAWING SLATE SPACEBOY ,6,0.85,,United Kingdom,2026-04-03
531843,22532,MAGIC DRAWING SLATE LEAP FROG ,1,0.85,,United Kingdom,2026-04-03
531843,22530,MAGIC DRAWING SLATE DOLLY GIRL ,1,0.85,,United Kingdom,2026-04-03
531843,22525,CHILDRENS GARDEN GLOVES PINK,1,2.51,,United Kingdom,2026-04-03
531843,22524,CHILDRENS GARDEN GLOVES BLUE,1,2.51,,United Kingdom,2026-04-03
531843,22523,CHILDS GARDEN FORK PINK,1,1.66,,United Kingdom,2026-04-03
531843,22521,CHILDS GARDEN TROWEL PINK,1,1.66,,United Kingdom,2026-04-03
531843,22603,CHRISTMAS RETROSPOT TREE WOOD,2,1.66,,United Kingdom,2026-04-03
531843,22604,SET OF 4 NAPKIN CHARMS CUTLERY,1,5.06,,United Kingdom,2026-04-03
531843,22613,PACK OF 20 SPACEBOY NAPKINS,1,1.66,,United Kingdom,2026-04-03
531843,22616,PACK OF 12 LONDON TISSUES ,3,0.85,,United Kingdom,2026-04-03
531843,22737,RIBBON REEL CHRISTMAS PRESENT ,3,3.36,,United Kingdom,2026-04-03
531843,22736,RIBBON REEL MAKING SNOWMEN ,1,3.36,,United Kingdom,2026-04-03
531843,22735,RIBBON REEL SOCKS AND MITTENS,1,3.36,,United Kingdom,2026-04-03
531843,22734,SET OF 6 RIBBONS VINTAGE CHRISTMAS,4,2.55,,United Kingdom,2026-04-03
531843,46776C,WOVEN FROST CUSHION COVER,1,4.21,,United Kingdom,2026-04-03
531843,22731,3D CHRISTMAS STAMPS STICKERS ,2,2.51,,United Kingdom,2026-04-03
531843,22727,ALARM CLOCK BAKELIKE RED ,1,7.62,,United Kingdom,2026-04-03
531843,22717,CARD DOG AND BALL ,1,0.85,,United Kingdom,2026-04-03
531843,22714,CARD BIRTHDAY COWBOY,1,0.85,,United Kingdom,2026-04-03
531843,22713,CARD I LOVE LONDON ,1,0.85,,United Kingdom,2026-04-03
531843,22712,CARD DOLLY GIRL ,1,0.85,,United Kingdom,2026-04-03
531843,22739,RIBBON REEL CHRISTMAS SOCK BAUBLE,2,3.36,,United Kingdom,2026-04-03
531843,22687,DOORMAT CHRISTMAS VILLAGE,2,14.43,,United Kingdom,2026-04-03
531843,22676,FRENCH BLUE METAL DOOR SIGN 1,1,2.51,,United Kingdom,2026-04-03
531843,22669,RED BABY BUNTING ,5,5.91,,United Kingdom,2026-04-03
531843,22668,PINK BABY BUNTING,1,5.91,,United Kingdom,2026-04-03
531843,22666,RECIPE BOX PANTRY YELLOW DESIGN,2,5.91,,United Kingdom,2026-04-03
531843,22651,GENTLEMAN SHIRT REPAIR KIT ,3,1.66,,United Kingdom,2026-04-03
531843,22650,CERAMIC PIRATE CHEST MONEY BANK,1,3.36,,United Kingdom,2026-04-03
531843,22630,DOLLY GIRL LUNCH BOX,2,4.21,,United Kingdom,2026-04-03
531843,22629,SPACEBOY LUNCH BOX ,1,4.21,,United Kingdom,2026-04-03
531843,22624,IVORY KITCHEN SCALES,1,16.98,,United Kingdom,2026-04-03
531843,22621,TRADITIONAL KNITTING NANCY,2,1.45,,United Kingdom,2026-04-03
531843,22620,4 TRADITIONAL SPINNING TOPS,1,2.51,,United Kingdom,2026-04-03
531843,22678,FRENCH BLUE METAL DOOR SIGN 3,1,2.51,,United Kingdom,2026-04-03
531843,47566,PARTY BUNTING,1,8.47,,United Kingdom,2026-04-03
531843,72586,SET OF 6 HALLOWEEN GHOST T-LIGHTS,1,0.85,,United Kingdom,2026-04-03
531843,47593B,SCOTTIE DOGS BABY BIB,4,0.85,,United Kingdom,2026-04-03
531843,90014B,GOLD M PEARL  ORBIT NECKLACE,2,10.62,,United Kingdom,2026-04-03
531843,90014A,SILVER/MOP ORBIT NECKLACE,1,10.62,,United Kingdom,2026-04-03
531843,90011A,MIDNIGHT BLUE CRYSTAL DROP EARRINGS,1,2.96,,United Kingdom,2026-04-03
531843,85226A,WHITE/BLUE PULL BACK RACING CAR,4,1.66,,United Kingdom,2026-04-03
531843,85213,MINI  ZINC GARDEN DECORATIONS ,1,1.66,,United Kingdom,2026-04-03
531843,85199L,LARGE HANGING IVORY & RED WOOD BIRD,1,1.28,,United Kingdom,2026-04-03
531843,85177,BASKET OF FLOWERS SEWING KIT,2,1.66,,United Kingdom,2026-04-03
531843,85135C,RED DRAGONFLY HELICOPTER,2,8.47,,United Kingdom,2026-04-03
531843,85135B,BLUE DRAGONFLY HELICOPTER,2,8.47,,United Kingdom,2026-04-03
531843,85132A,CHARLIE + LOLA BISCUITS TINS,1,8.47,,United Kingdom,2026-04-03
531843,85131D,BEADED CRYSTAL HEART PINK ON STICK,6,0.85,,United Kingdom,2026-04-03
531843,90036C,"FLOWER GLASS GARLAND NECKL.36""BLUE",1,8.07,,United Kingdom,2026-04-03
531843,85131C,BEADED CRYSTAL HEART BLUE ON STICK,1,0.85,,United Kingdom,2026-04-03
531843,85131A,BEADED PEARL HEART WHITE ON STICK,3,0.85,,United Kingdom,2026-04-03
531843,85118,HEART T-LIGHT HOLDER,1,2.51,,United Kingdom,2026-04-03
531843,85114C,RED ENCHANTED FOREST PLACEMAT,1,3.36,,United Kingdom,2026-04-03
531843,85099B,JUMBO BAG RED RETROSPOT,34,2.51,,United Kingdom,2026-04-03
531843,85049H,URBAN BLACK RIBBONS ,1,2.51,,United Kingdom,2026-04-03
531843,85049E,SCANDINAVIAN REDS RIBBONS,2,2.51,,United Kingdom,2026-04-03
531843,85049A,TRADITIONAL CHRISTMAS RIBBONS,2,2.51,,United Kingdom,2026-04-03
531843,85039B,S/4 IVORY MINI ROSE CANDLE IN BOWL,1,1.66,,United Kingdom,2026-04-03
531843,85039A,SET/4 RED MINI ROSE CANDLE IN BOWL,2,1.66,,United Kingdom,2026-04-03
531843,85038,6 CHOCOLATE LOVE HEART T-LIGHTS,1,4.21,,United Kingdom,2026-04-03
531843,85032C,CURIOUS IMAGES GIFT WRAP SET,1,4.21,,United Kingdom,2026-04-03
531843,85131B,BEADED CRYSTAL HEART GREEN ON STICK,6,0.85,,United Kingdom,2026-04-03
531843,85018D,YULETIDE IMAGES S/6 PAPER BOXES,3,2.55,,United Kingdom,2026-04-03
531843,90042A,FRESHWATER PEARL BRACELET GOLD,1,2.54,,United Kingdom,2026-04-03
531843,90083,CRYSTAL CZECH CROSS PHONE CHARM,1,1.66,,United Kingdom,2026-04-03
531843,20713,JUMBO BAG OWLS,9,1.95,,United Kingdom,2026-04-03
531843,20711,JUMBO BAG TOYS ,11,1.95,,United Kingdom,2026-04-03
531843,21931,JUMBO STORAGE BAG SUKI,12,1.95,,United Kingdom,2026-04-03
531843,21928,JUMBO BAG SCANDINAVIAN PAISLEY,10,1.95,,United Kingdom,2026-04-03
531843,22379,RECYCLING BAG RETROSPOT ,6,2.1,,United Kingdom,2026-04-03
531843,22411,JUMBO SHOPPER VINTAGE RED PAISLEY,3,1.95,,United Kingdom,2026-04-03
531843,DOT,DOTCOM POSTAGE,1,282.89,,United Kingdom,2026-04-03
531843,90214W,"LETTER ""W"" BLING KEY RING",1,0.85,,United Kingdom,2026-04-03
531843,90214J,"LETTER ""J"" BLING KEY RING",3,0.85,,United Kingdom,2026-04-03
531843,90214E,"LETTER ""E"" BLING KEY RING",1,0.85,,United Kingdom,2026-04-03
531843,90214C,"LETTER ""C"" BLING KEY RING",1,0.85,,United Kingdom,2026-04-03
531843,90062,CARNIVAL BRACELET,1,12.75,,United Kingdom,2026-04-03
531843,90214A,"LETTER ""A"" BLING KEY RING",1,0.85,,United Kingdom,2026-04-03
531843,90200A,PURPLE SWEETHEART BRACELET,1,4.24,,United Kingdom,2026-04-03
531843,90198A,VINTAGE ROSE BEAD BRACELET RASPBERR,1,4.24,,United Kingdom,2026-04-03
531843,90192,JADE DROP EARRINGS W FILIGREE,1,5.09,,United Kingdom,2026-04-03
531843,90185D,CRYSTAL DIAMANTE EXPANDABLE RING,1,4.24,,United Kingdom,2026-04-03
531843,90184C,BLACK CHUNKY BEAD BRACELET W STRAP,1,9.34,,United Kingdom,2026-04-03
531843,90130B,TURQ STONE/CRYSTAL EARRINGS,1,2.96,,United Kingdom,2026-04-03
531843,90129C,GREEN GLASS TASSLE BAG CHARM,1,1.66,,United Kingdom,2026-04-03
531843,90115,SUMMER BUTTERFLIES BAG CHARM,1,2.51,,United Kingdom,2026-04-03
531843,90108,BLUE BLOSSOM HAIR CLIP,1,2.51,,United Kingdom,2026-04-03
531843,90099,NECKLACE+BRACELET SET BLUE HIBISCUS,1,5.06,,United Kingdom,2026-04-03
531843,90094,NECKLACE+BRACELET SET FRUIT SALAD ,4,2.51,,United Kingdom,2026-04-03
531843,90209C,PINK ENAMEL+GLASS HAIR COMB,1,2.11,,United Kingdom,2026-04-03
531843,47591B,SCOTTIES CHILDRENS APRON,4,1.66,,United Kingdom,2026-04-03
531843,85017B,ENVELOPE 50 BLOSSOM IMAGES,1,0.85,,United Kingdom,2026-04-03
531843,85015,SET OF 12  VINTAGE POSTCARD SET,2,2.51,,United Kingdom,2026-04-03
531843,84510A,SET OF 4 ENGLISH ROSE COASTERS,1,2.51,,United Kingdom,2026-04-03
531843,84499,BLACK FLOWER CANDLE PLATE,2,1.66,,United Kingdom,2026-04-03
531843,84378,SET OF 3 HEART COOKIE CUTTERS,1,2.51,,United Kingdom,2026-04-03
531843,84347,ROTATING SILVER ANGELS T-LIGHT HLDR,2,5.06,,United Kingdom,2026-04-03
531843,84077,WORLD WAR 2 GLIDERS ASSTD DESIGNS,2,0.43,,United Kingdom,2026-04-03
531843,84050,PINK HEART SHAPE EGG FRYING PAN,1,4.21,,United Kingdom,2026-04-03
531843,84032A,CHARLIE+LOLA PINK HOT WATER BOTTLE,3,3.36,,United Kingdom,2026-04-03
531843,84031A,CHARLIE+LOLA RED HOT WATER BOTTLE ,1,4.21,,United Kingdom,2026-04-03
531843,84006,MAGIC TREE -PAPER FLOWERS,1,1.66,,United Kingdom,2026-04-03
531843,82600,NO SINGING METAL SIGN,1,4.21,,United Kingdom,2026-04-03
531843,79321,CHILLI LIGHTS,1,10.17,,United Kingdom,2026-04-03
531843,84510E,SET OF 4 GREEN CAROUSEL COASTERS,1,2.51,,United Kingdom,2026-04-03
531843,79144C,PAINTED LIGHTBULB RAINBOW DESIGN,1,0.84,,United Kingdom,2026-04-03
531843,72817,SET OF 2 CHRISTMAS DECOUPAGE CANDLE,11,1.66,,United Kingdom,2026-04-03
531843,72816,SET/3 CHRISTMAS DECOUPAGE CANDLES,10,2.51,,United Kingdom,2026-04-03
531843,72815,3 WICK CHRISTMAS BRIAR CANDLE ,3,4.21,,United Kingdom,2026-04-03
531843,72799F,IVORY PILLAR CANDLE GOLD FLOCK,1,3.36,,United Kingdom,2026-04-03
531843,72741,GRAND CHOCOLATECANDLE,3,2.82,,United Kingdom,2026-04-03
531843,72598,SET/12 TAPER CANDLES,1,1.66,,United Kingdom,2026-04-03
531843,22507,MEMO BOARD RETROSPOT  DESIGN,1,11.02,,United Kingdom,2026-04-03
531843,72349B,SET/6 PURPLE BUTTERFLY T-LIGHTS,1,4.21,,United Kingdom,2026-04-03
531843,71495A,CD WALL TIDY BLUE OFFICE,1,0.84,,United Kingdom,2026-04-03
531843,70006,LOVE HEART POCKET WARMER,1,3.36,,United Kingdom,2026-04-03
531843,48185,DOORMAT FAIRY CAKE,1,14.43,,United Kingdom,2026-04-03
531843,72818,CHRISTMAS DECOUPAGE CANDLE,9,1.66,,United Kingdom,2026-04-03
531843,85017A,ENVELOPE 50 ROMANTIC IMAGES,1,0.85,,United Kingdom,2026-04-03
531843,84520B,PACK 20 ENGLISH ROSE PAPER NAPKINS,51,1.66,,United Kingdom,2026-04-03
531843,84536B,FAIRY CAKES NOTEBOOK A7 SIZE,1,0.85,,United Kingdom,2026-04-03
531843,84997D,PINK 3 PIECE POLKADOT CUTLERY SET,2,7.62,,United Kingdom,2026-04-03
531843,84992,72 SWEETHEART FAIRY CAKE CASES,3,1.28,,United Kingdom,2026-04-03
531843,84988,SET OF 72 PINK HEART PAPER DOILIES,2,2.98,,United Kingdom,2026-04-03
531843,84971S,SMALL HEART FLOWERS HOOK ,2,1.66,,United Kingdom,2026-04-03
531843,84950,ASSORTED COLOUR T-LIGHT HOLDER,6,0.99,,United Kingdom,2026-04-03
531843,84946,ANTIQUE SILVER TEA GLASS ETCHED,3,2.51,,United Kingdom,2026-04-03
531843,84927F,PSYCHEDELIC TILE HOOK,1,4.21,,United Kingdom,2026-04-03
531843,84927E,FLOWERS TILE HOOK,1,4.21,,United Kingdom,2026-04-03
531843,84927A,WAKE UP COCKEREL TILE HOOK,1,4.21,,United Kingdom,2026-04-03
531843,84917,WHITE HAND TOWEL WITH BUTTERFLY,1,4.21,,United Kingdom,2026-04-03
531843,84913B,MINT GREEN ROSE TOWEL,1,3.36,,United Kingdom,2026-04-03
531843,84536A,ENGLISH ROSE NOTEBOOK A7 SIZE,2,0.85,,United Kingdom,2026-04-03
531843,84912B,GREEN ROSE WASHBAG,2,3.36,,United Kingdom,2026-04-03
531843,84908B,BLUE 5 PATCH FLOWER CUSHION COVER,2,5.91,,United Kingdom,2026-04-03
531843,84908A,PINK 5 PATCH FLOWER CUSHION COVER ,1,5.91,,United Kingdom,2026-04-03
531843,84832,ZINC WILLIE WINKIE  CANDLE STICK,1,1.66,,United Kingdom,2026-04-03
531843,84828,JUNGLE POPSICLES ICE LOLLY HOLDERS,2,2.51,,United Kingdom,2026-04-03
531843,84750A,PINK SMALL GLASS CAKE STAND,1,4.21,,United Kingdom,2026-04-03
531843,84692,BOX OF 24 COCKTAIL PARASOLS,3,0.85,,United Kingdom,2026-04-03
531843,84688,BEACH HUT DESIGN BLACKBOARD,1,8.47,,United Kingdom,2026-04-03
531843,84663A,GRASS HOPPER WOODEN WALL CLOCK ,1,5.91,,United Kingdom,2026-04-03
531843,84568,GIRLS ALPHABET IRON ON PATCHES ,11,0.43,,United Kingdom,2026-04-03
531843,84559B,3D SHEET OF CAT STICKERS,1,1.69,,United Kingdom,2026-04-03
531843,84558A,3D DOG PICTURE PLAYING CARDS,1,5.91,,United Kingdom,2026-04-03
531843,84912A,PINK ROSE WASHBAG,2,3.36,,United Kingdom,2026-04-03
531843,22499,WOODEN UNION JACK BUNTING,1,12.72,,United Kingdom,2026-04-03
531843,22531,MAGIC DRAWING SLATE CIRCUS PARADE  ,2,0.85,,United Kingdom,2026-04-03
531843,22495,SET OF 2 ROUND TINS CAMEMBERT ,1,5.91,,United Kingdom,2026-04-03
531843,21509,COWBOYS AND INDIANS BIRTHDAY CARD ,2,0.85,,United Kingdom,2026-04-03
531843,21481,FAWN BLUE HOT WATER BOTTLE,1,5.91,,United Kingdom,2026-04-03
531843,21479,WHITE SKULL HOT WATER BOTTLE ,3,7.62,,United Kingdom,2026-04-03
531843,21439,BASKET OF TOADSTOOLS,1,2.51,,United Kingdom,2026-04-03
531843,21429,RED GINGHAM ROSE JEWELLERY BOX,2,3.36,,United Kingdom,2026-04-03
531843,21425,SKULLS STORAGE BOX LARGE,1,5.91,,United Kingdom,2026-04-03
531843,21399,BLUE POLKADOT COFFEE MUG,2,4.21,,United Kingdom,2026-04-03
531843,21398,RED POLKADOT COFFEE  MUG,1,4.21,,United Kingdom,2026-04-03
531843,21390,FILIGRIS HEART WITH BUTTERFLY,1,2.51,,United Kingdom,2026-04-03
531843,21379,CAMPHOR WOOD PORTOBELLO MUSHROOM,1,2.51,,United Kingdom,2026-04-03
531843,21371,MIRRORED WALL ART POPPIES,1,5.06,,United Kingdom,2026-04-03
531843,21351,CINAMMON & ORANGE WREATH,4,5.91,,United Kingdom,2026-04-03
531843,21349,IVY HEART WREATH,1,13.57,,United Kingdom,2026-04-03
531843,21327,SKULLS WRITING SET ,1,3.36,,United Kingdom,2026-04-03
531843,21324,HANGING MEDINA LANTERN SMALL,1,5.91,,United Kingdom,2026-04-03
531843,21314,SMALL GLASS HEART TRINKET POT,4,4.21,,United Kingdom,2026-04-03
531843,21260,FIRST AID TIN,2,6.77,,United Kingdom,2026-04-03
531843,21258,VICTORIAN SEWING BOX LARGE,1,25.49,,United Kingdom,2026-04-03
531843,21232,STRAWBERRY CERAMIC TRINKET BOX,6,2.51,,United Kingdom,2026-04-03
531843,21231,SWEETHEART CERAMIC TRINKET BOX,2,2.51,,United Kingdom,2026-04-03
531843,21224,SET/4 SKULL BADGES,2,2.51,,United Kingdom,2026-04-03
531843,21222,SET/4 BADGES BEETLES,1,2.51,,United Kingdom,2026-04-03
531843,21220,SET/4 BADGES DOGS,1,2.51,,United Kingdom,2026-04-03
531843,21544,SKULLS  WATER TRANSFER TATTOOS ,1,1.66,,United Kingdom,2026-04-03
531843,21558,SKULL LUNCH BOX WITH CUTLERY ,1,5.06,,United Kingdom,2026-04-03
531843,21562,HAWAIIAN GRASS SKIRT ,1,4.21,,United Kingdom,2026-04-03
531843,21581,SKULLS  DESIGN  COTTON TOTE BAG,1,5.06,,United Kingdom,2026-04-03
531843,21801,CHRISTMAS TREE DECORATION WITH BELL,25,0.43,,United Kingdom,2026-04-03
531843,21790,VINTAGE SNAP CARDS,6,1.66,,United Kingdom,2026-04-03
531843,21789,KIDS RAIN MAC PINK,1,1.66,,United Kingdom,2026-04-03
531843,21786,POLKADOT RAIN HAT ,5,0.85,,United Kingdom,2026-04-03
531843,21756,BATH BUILDING BLOCK WORD,1,11.87,,United Kingdom,2026-04-03
531843,21743,STAR PORTABLE TABLE LIGHT ,1,5.91,,United Kingdom,2026-04-03
531843,21731,RED TOADSTOOL LED NIGHT LIGHT,2,3.36,,United Kingdom,2026-04-03
531843,21725,SWEETIES  STICKERS,1,1.66,,United Kingdom,2026-04-03
531843,21724,PANDA AND BUNNIES STICKER SHEET,1,1.66,,United Kingdom,2026-04-03
531843,21722,SWEET PUDDING STICKER SHEET,1,1.66,,United Kingdom,2026-04-03
531843,21704,BAG 250g SWIRLY MARBLES,2,1.66,,United Kingdom,2026-04-03
531843,21217,RED RETROSPOT ROUND CAKE TINS,1,21.23,,United Kingdom,2026-04-03
531843,21703,BAG 125g SWIRLY MARBLES,2,0.85,,United Kingdom,2026-04-03
531843,21676,FLOWERS  STICKERS,1,1.66,,United Kingdom,2026-04-03
531843,21675,BUTTERFLIES STICKERS,1,1.66,,United Kingdom,2026-04-03
531843,21673,WHITE SPOT BLUE CERAMIC DRAWER KNOB,1,2.51,,United Kingdom,2026-04-03
531843,21671,RED SPOT CERAMIC DRAWER KNOB,2,2.51,,United Kingdom,2026-04-03
531843,21670,BLUE SPOT CERAMIC DRAWER KNOB,1,2.51,,United Kingdom,2026-04-03
531843,21669,BLUE STRIPE CERAMIC DRAWER KNOB,1,2.51,,United Kingdom,2026-04-03
