Invoice,StockCode,Description,Quantity,Price,Customer ID,Country,InvoiceDate
517386,22030,SWALLOWS GREETING CARD,12,0.42,16186.0,United Kingdom,2026-01-05
517386,22355,CHARLOTTE BAG SUKI DESIGN,10,0.85,16186.0,United Kingdom,2026-01-05
517386,20726,LUNCH BAG WOODLAND,10,1.65,16186.0,United Kingdom,2026-01-05
517386,20727,LUNCH BAG  BLACK SKULL.,10,1.65,16186.0,United Kingdom,2026-01-05
517386,22356,CHARLOTTE BAG PINK WITH WHITE SPOTS,10,0.85,16186.0,United Kingdom,2026-01-05
517386,21506,"FANCY FONT BIRTHDAY CARD, ",12,0.42,16186.0,United Kingdom,2026-01-05
517386,21069,VINTAGE BILLBOARD TEA MUG,24,1.25,16186.0,United Kingdom,2026-01-05
517386,85040B,SET/4 BLUE FLOWER CANDLES IN BOWL,12,1.65,16186.0,United Kingdom,2026-01-05
517386,22326,ROUND SNACK BOXES SET OF4 WOODLAND ,6,2.95,16186.0,United Kingdom,2026-01-05
517386,22327,ROUND SNACK BOXES SET OF 4 SKULLS,6,2.95,16186.0,United Kingdom,2026-01-05
517386,22328,ROUND SNACK BOXES SET OF 4 FRUITS ,6,2.95,16186.0,United Kingdom,2026-01-05
517386,22382,LUNCH BAG SPACEBOY DESIGN ,10,1.65,16186.0,United Kingdom,2026-01-05
517386,20975,12 PENCILS SMALL TUBE RED SPOTTY,24,0.65,16186.0,United Kingdom,2026-01-05
517386,22383,LUNCH BAG SUKI  DESIGN ,20,1.65,16186.0,United Kingdom,2026-01-05
517386,20974,12 PENCILS SMALL TUBE SKULL,24,0.65,16186.0,United Kingdom,2026-01-05
517386,21232,STRAWBERRY CERAMIC TRINKET BOX,12,1.25,16186.0,United Kingdom,2026-01-05
517386,21068,VINTAGE BILLBOARD LOVE/HATE MUG,12,1.25,16186.0,United Kingdom,2026-01-05
517386,21071,VINTAGE BILLBOARD DRINK ME MUG,24,1.25,16186.0,United Kingdom,2026-01-05
517386,20972,PINK CREAM FELT CRAFT TRINKET BOX ,12,1.25,16186.0,United Kingdom,2026-01-05
517386,20971,PINK BLUE FELT CRAFT TRINKET BOX,12,1.25,16186.0,United Kingdom,2026-01-05
517386,21231,SWEETHEART CERAMIC TRINKET BOX,12,1.25,16186.0,United Kingdom,2026-01-05
517386,20711,JUMBO BAG TOYS ,10,1.95,16186.0,United Kingdom,2026-01-05
517386,22628,PICNIC BOXES SET OF 3 RETROSPOT ,8,4.95,16186.0,United Kingdom,2026-01-05
517386,85042,ANTIQUE LILY FAIRY LIGHTS,4,4.95,16186.0,United Kingdom,2026-01-05
517386,84879,ASSORTED COLOUR BIRD ORNAMENT,8,1.69,16186.0,United Kingdom,2026-01-05
517386,16012,FOOD/DRINK SPUNGE STICKERS,24,0.21,16186.0,United Kingdom,2026-01-05
517386,16011,ANIMAL STICKERS,24,0.21,16186.0,United Kingdom,2026-01-05
517386,21213,PACK OF 72 SKULL CAKE CASES,24,0.55,16186.0,United Kingdom,2026-01-05
517386,22411,JUMBO SHOPPER VINTAGE RED PAISLEY,10,1.95,16186.0,United Kingdom,2026-01-05
517391,22423,REGENCY CAKESTAND 3 TIER,228,10.95,17949.0,United Kingdom,2026-01-05
517392,85061W,WHITE JEWELLED HEART DECORATION,24,0.85,16510.0,United Kingdom,2026-01-05
517392,21326,AGED GLASS SILVER T-LIGHT HOLDER,12,0.65,16510.0,United Kingdom,2026-01-05
517392,84978,HANGING HEART JAR T-LIGHT HOLDER,12,1.25,16510.0,United Kingdom,2026-01-05
517392,84970S,HANGING HEART ZINC T-LIGHT HOLDER,12,0.85,16510.0,United Kingdom,2026-01-05
517392,84947,ANTIQUE SILVER TEA GLASS ENGRAVED,24,1.25,16510.0,United Kingdom,2026-01-05
517392,84971S,SMALL HEART FLOWERS HOOK ,24,0.85,16510.0,United Kingdom,2026-01-05
517392,84946,ANTIQUE SILVER TEA GLASS ETCHED,24,1.25,16510.0,United Kingdom,2026-01-05
517392,22180,RETRO SPOT LAMP,2,9.95,16510.0,United Kingdom,2026-01-05
517392,84949,SILVER HANGING T-LIGHT HOLDER,12,1.65,16510.0,United Kingdom,2026-01-05
517393,22655,VINTAGE RED KITCHEN CABINET,2,295.0,13340.0,United Kingdom,2026-01-05
517393,21491,SET OF THREE VINTAGE GIFT WRAPS,96,1.65,13340.0,United Kingdom,2026-01-05
517393,22086,PAPER CHAIN KIT 50'S CHRISTMAS ,80,2.55,13340.0,United Kingdom,2026-01-05
517393,22692,DOORMAT WELCOME TO OUR HOME,30,6.35,13340.0,United Kingdom,2026-01-05
517393,84029E,RED WOOLLY HOTTIE WHITE HEART.,48,2.95,13340.0,United Kingdom,2026-01-05
517393,22114,HOT WATER BOTTLE TEA AND SYMPATHY,48,3.45,13340.0,United Kingdom,2026-01-05
517393,22112,CHOCOLATE HOT WATER BOTTLE,48,4.25,13340.0,United Kingdom,2026-01-05
517393,22382,LUNCH BAG SPACEBOY DESIGN ,30,1.65,13340.0,United Kingdom,2026-01-05
517393,20725,LUNCH BAG RED SPOTTY,30,1.65,13340.0,United Kingdom,2026-01-05
517393,22384,LUNCH BAG PINK RETROSPOT,30,1.65,13340.0,United Kingdom,2026-01-05
517393,22138,BAKING SET 9 PIECE RETROSPOT ,24,4.25,13340.0,United Kingdom,2026-01-05
517393,22629,SPACEBOY LUNCH BOX ,64,1.65,13340.0,United Kingdom,2026-01-05
517393,22666,RECIPE BOX PANTRY YELLOW DESIGN,24,2.55,13340.0,United Kingdom,2026-01-05
517393,21039,RED SPOTTY SHOPPING BAG,24,2.55,13340.0,United Kingdom,2026-01-05
517393,22690,DOORMAT HOME SWEET HOME BLUE ,20,6.35,13340.0,United Kingdom,2026-01-05
517393,20685,DOORMAT RED SPOT,30,6.35,13340.0,United Kingdom,2026-01-05
517393,85123A,WHITE HANGING HEART T-LIGHT HOLDER,64,2.55,13340.0,United Kingdom,2026-01-05
517393,85014B,RED/WHITE DOTS RUFFLED UMBRELLA,48,4.95,13340.0,United Kingdom,2026-01-05
517393,22631,CIRCUS PARADE LUNCH BOX ,64,1.65,13340.0,United Kingdom,2026-01-05
517393,22352,LUNCH BOX WITH CUTLERY RETROSPOT ,60,2.1,13340.0,United Kingdom,2026-01-05
517393,21733,RED HANGING HEART T-LIGHT HOLDER,64,2.55,13340.0,United Kingdom,2026-01-05
517393,85099B,JUMBO BAG RED RETROSPOT,40,1.95,13340.0,United Kingdom,2026-01-05
517393,22509,SEWING BOX RETROSPOT DESIGN ,4,14.95,13340.0,United Kingdom,2026-01-05
517393,22083,PAPER CHAIN KIT RETRO SPOT,40,2.55,13340.0,United Kingdom,2026-01-05
517394,21114,LAVENDER SCENTED FABRIC HEART,10,1.25,18264.0,United Kingdom,2026-01-05
517394,47591D,PINK FAIRY CAKE CHILDRENS APRON,8,1.95,18264.0,United Kingdom,2026-01-05
517394,21889,WOODEN BOX OF DOMINOES,12,1.25,18264.0,United Kingdom,2026-01-05
517394,22550,HOLIDAY FUN LUDO,4,3.75,18264.0,United Kingdom,2026-01-05
517394,21790,VINTAGE SNAP CARDS,12,0.85,18264.0,United Kingdom,2026-01-05
517394,22172,METAL SHELF WITH RAIL ,2,8.5,18264.0,United Kingdom,2026-01-05
517394,22224,WHITE LOVEBIRD LANTERN,6,2.95,18264.0,United Kingdom,2026-01-05
517394,21715,GIRLS VINTAGE TIN SEASIDE BUCKET,8,2.55,18264.0,United Kingdom,2026-01-05
517394,21718,RED METAL BEACH SPADE ,12,1.25,18264.0,United Kingdom,2026-01-05
517394,21912,VINTAGE SNAKES & LADDERS,4,3.75,18264.0,United Kingdom,2026-01-05
517394,22605,WOODEN CROQUET GARDEN SET,1,12.75,18264.0,United Kingdom,2026-01-05
517394,21891,TRADITIONAL WOODEN SKIPPING ROPE,12,1.25,18264.0,United Kingdom,2026-01-05
517394,22485,SET OF 2 WOODEN MARKET CRATES,2,12.75,18264.0,United Kingdom,2026-01-05
517394,21741,COSY SLIPPER SHOES LARGE GREEN,6,2.95,18264.0,United Kingdom,2026-01-05
517394,22501,PICNIC BASKET WICKER LARGE,4,9.95,18264.0,United Kingdom,2026-01-05
517394,22502,PICNIC BASKET WICKER SMALL,4,4.25,18264.0,United Kingdom,2026-01-05
517394,21716,BOYS VINTAGE TIN SEASIDE BUCKET,8,2.55,18264.0,United Kingdom,2026-01-05
517394,22526,WHEELBARROW FOR CHILDREN ,2,12.75,18264.0,United Kingdom,2026-01-05
517394,21787,RAIN PONCHO WITH RED SPOTS,24,0.85,18264.0,United Kingdom,2026-01-05
517394,20981,12 PENCILS TALL TUBE WOODLAND,12,0.85,18264.0,United Kingdom,2026-01-05
517394,21738,COSY SLIPPER SHOES SMALL  RED ,6,2.95,18264.0,United Kingdom,2026-01-05
517394,22099,CARAVAN SQUARE TISSUE BOX,12,1.25,18264.0,United Kingdom,2026-01-05
517394,22499,WOODEN UNION JACK BUNTING,3,5.95,18264.0,United Kingdom,2026-01-05
517394,21770,OPEN CLOSED METAL SIGN,2,4.95,18264.0,United Kingdom,2026-01-05
517394,21907,I'M ON HOLIDAY METAL SIGN,12,2.1,18264.0,United Kingdom,2026-01-05
517394,82552,WASHROOM METAL SIGN,12,1.25,18264.0,United Kingdom,2026-01-05
517394,22413,METAL SIGN TAKE IT OR LEAVE IT ,6,2.95,18264.0,United Kingdom,2026-01-05
517394,21432,SET OF 3 CASES WOODLAND DESIGN,2,5.95,18264.0,United Kingdom,2026-01-05
517394,21657,MILK BOTTLE WITH GLASS STOPPER ,3,6.95,18264.0,United Kingdom,2026-01-05
517394,22356,CHARLOTTE BAG PINK WITH WHITE SPOTS,10,0.85,18264.0,United Kingdom,2026-01-05
517394,21481,FAWN BLUE HOT WATER BOTTLE,6,2.95,18264.0,United Kingdom,2026-01-05
517394,22114,HOT WATER BOTTLE TEA AND SYMPATHY,4,3.95,18264.0,United Kingdom,2026-01-05
517394,21115,ROSE CARAVAN DOORSTOP,2,6.75,18264.0,United Kingdom,2026-01-05
517394,21361,LOVE LARGE WOOD LETTERS ,1,12.75,18264.0,United Kingdom,2026-01-05
517394,21578,WOODLAND DESIGN  COTTON TOTE BAG,6,2.25,18264.0,United Kingdom,2026-01-05
517394,22423,REGENCY CAKESTAND 3 TIER,1,12.75,18264.0,United Kingdom,2026-01-05
517395,17012D,ORIGAMI ROSE INCENSE/CANDLE SET ,6,2.55,14833.0,United Kingdom,2026-01-05
517395,22277,COSMETIC BAG VINTAGE ROSE PAISLEY,6,2.1,14833.0,United Kingdom,2026-01-05
517395,20931,BLUE POT PLANT CANDLE ,4,3.75,14833.0,United Kingdom,2026-01-05
517395,22276,WASH BAG VINTAGE ROSE PAISLEY,6,2.55,14833.0,United Kingdom,2026-01-05
517395,21413,PERIWINKLE T-LIGHT HOLDER,12,1.25,14833.0,United Kingdom,2026-01-05
517395,84946,ANTIQUE SILVER TEA GLASS ETCHED,12,1.25,14833.0,United Kingdom,2026-01-05
517395,82580,BATHROOM METAL SIGN,12,0.55,14833.0,United Kingdom,2026-01-05
517396,37503,,-104,0.0,,United Kingdom,2026-01-05
517397,85123A,WHITE HANGING HEART T-LIGHT HOLDER,32,2.55,15251.0,United Kingdom,2026-01-05
517397,22482,BLUE TEA TOWEL CLASSIC DESIGN,96,1.06,15251.0,United Kingdom,2026-01-05
517397,22501,PICNIC BASKET WICKER LARGE,16,8.5,15251.0,United Kingdom,2026-01-05
517397,22502,PICNIC BASKET WICKER SMALL,16,3.75,15251.0,United Kingdom,2026-01-05
517397,22526,WHEELBARROW FOR CHILDREN ,12,10.95,15251.0,United Kingdom,2026-01-05
517398,22083,PAPER CHAIN KIT RETRO SPOT,24,2.95,15122.0,United Kingdom,2026-01-05
517398,22411,JUMBO SHOPPER VINTAGE RED PAISLEY,20,1.95,15122.0,United Kingdom,2026-01-05
517398,85099F,JUMBO BAG STRAWBERRY,20,1.95,15122.0,United Kingdom,2026-01-05
517398,85099B,JUMBO BAG RED RETROSPOT,20,1.95,15122.0,United Kingdom,2026-01-05
517398,22084,PAPER CHAIN KIT EMPIRE,24,2.95,15122.0,United Kingdom,2026-01-05
517398,22624,IVORY KITCHEN SCALES,2,8.5,15122.0,United Kingdom,2026-01-05
517398,85150,LADIES & GENTLEMEN METAL SIGN,12,2.55,15122.0,United Kingdom,2026-01-05
517399,21989,PACK OF 20 SKULL PAPER NAPKINS,12,0.85,16153.0,United Kingdom,2026-01-05
517399,21078,SET/20 STRAWBERRY PAPER NAPKINS ,12,0.85,16153.0,United Kingdom,2026-01-05
517399,22613,PACK OF 20 SPACEBOY NAPKINS,12,0.85,16153.0,United Kingdom,2026-01-05
517399,22070,SMALL RED RETROSPOT MUG IN BOX ,6,3.75,16153.0,United Kingdom,2026-01-05
517399,20724,RED SPOTTY CHARLOTTE BAG,20,0.85,16153.0,United Kingdom,2026-01-05
517399,84380,SET OF 3 BUTTERFLY COOKIE CUTTERS,12,1.25,16153.0,United Kingdom,2026-01-05
517399,21843,RED RETROSPOT CAKE STAND,3,10.95,16153.0,United Kingdom,2026-01-05
517399,21539,RED RETROSPOT BUTTER DISH,6,4.95,16153.0,United Kingdom,2026-01-05
517399,22383,LUNCH BAG SUKI  DESIGN ,20,1.65,16153.0,United Kingdom,2026-01-05
517399,84378,SET OF 3 HEART COOKIE CUTTERS,12,1.25,16153.0,United Kingdom,2026-01-05
517399,20725,LUNCH BAG RED SPOTTY,20,1.65,16153.0,United Kingdom,2026-01-05
517399,22384,LUNCH BAG PINK RETROSPOT,20,1.65,16153.0,United Kingdom,2026-01-05
517399,22333,RETRO SPORT PARTY BAG + STICKER SET,8,1.65,16153.0,United Kingdom,2026-01-05
517399,22382,LUNCH BAG SPACEBOY DESIGN ,20,1.65,16153.0,United Kingdom,2026-01-05
517399,22437,SET OF 9 BLACK SKULL BALLOONS,20,0.85,16153.0,United Kingdom,2026-01-05
517399,22423,REGENCY CAKESTAND 3 TIER,1,12.75,16153.0,United Kingdom,2026-01-05
517399,21977,PACK OF 60 PINK PAISLEY CAKE CASES,24,0.55,16153.0,United Kingdom,2026-01-05
517399,21213,PACK OF 72 SKULL CAKE CASES,24,0.55,16153.0,United Kingdom,2026-01-05
517399,22417,PACK OF 60 SPACEBOY CAKE CASES,24,0.55,16153.0,United Kingdom,2026-01-05
517399,22416,SET OF 36 DOILIES SPACEBOY DESIGN ,12,1.45,16153.0,United Kingdom,2026-01-05
517399,21975,PACK OF 60 DINOSAUR CAKE CASES,24,0.55,16153.0,United Kingdom,2026-01-05
517399,22327,ROUND SNACK BOXES SET OF 4 SKULLS,6,2.95,16153.0,United Kingdom,2026-01-05
517399,47568,ENGLISH ROSE DESIGN PEG BAG,6,2.1,16153.0,United Kingdom,2026-01-05
517399,21121,SET/10 RED SPOTTY PARTY CANDLES,24,1.25,16153.0,United Kingdom,2026-01-05
517399,21122,SET/10 PINK SPOTTY PARTY CANDLES,24,1.25,16153.0,United Kingdom,2026-01-05
517399,20727,LUNCH BAG  BLACK SKULL.,20,1.65,16153.0,United Kingdom,2026-01-05
517400,22082,RIBBON REEL STRIPES DESIGN ,10,1.65,15358.0,United Kingdom,2026-01-05
517400,85176,SEWING SUSAN 21 NEEDLE SET,12,0.85,15358.0,United Kingdom,2026-01-05
517400,85178,VICTORIAN SEWING KIT,12,1.25,15358.0,United Kingdom,2026-01-05
517400,22564,ALPHABET STENCIL CRAFT,12,1.25,15358.0,United Kingdom,2026-01-05
517400,22562,MONSTERS STENCIL CRAFT,12,1.25,15358.0,United Kingdom,2026-01-05
517400,85049D,BRIGHT BLUES RIBBONS ,12,1.25,15358.0,United Kingdom,2026-01-05
517400,85049G,CHOCOLATE BOX RIBBONS ,12,1.25,15358.0,United Kingdom,2026-01-05
517400,22080,RIBBON REEL SPOTS DESIGN ,10,1.65,15358.0,United Kingdom,2026-01-05
517400,84077,WORLD WAR 2 GLIDERS ASSTD DESIGNS,192,0.21,15358.0,United Kingdom,2026-01-05
517400,22078,RIBBON REEL LACE DESIGN ,10,2.1,15358.0,United Kingdom,2026-01-05
517400,22272,FELTCRAFT DOLL MARIA,6,2.95,15358.0,United Kingdom,2026-01-05
517400,22147,FELTCRAFT BUTTERFLY HEARTS,12,1.45,15358.0,United Kingdom,2026-01-05
517400,22149,FELTCRAFT 6 FLOWER FRIENDS,6,2.1,15358.0,United Kingdom,2026-01-05
517400,20970,PINK FLORAL FELTCRAFT SHOULDER BAG,8,3.75,15358.0,United Kingdom,2026-01-05
517400,22271,FELTCRAFT DOLL ROSIE,6,2.95,15358.0,United Kingdom,2026-01-05
517400,22568,FELTCRAFT CUSHION OWL,4,3.75,15358.0,United Kingdom,2026-01-05
517400,22569,FELTCRAFT CUSHION BUTTERFLY,4,3.75,15358.0,United Kingdom,2026-01-05
517400,20831,GOLD PHOTO FRAME,6,2.1,15358.0,United Kingdom,2026-01-05
517400,85124A,PINK JUICY FRUIT PHOTO FRAME,6,2.55,15358.0,United Kingdom,2026-01-05
517400,21679,SKULLS  STICKERS,12,0.85,15358.0,United Kingdom,2026-01-05
517400,22150,3 STRIPEY MICE FELTCRAFT,6,1.95,15358.0,United Kingdom,2026-01-05
517400,21680,WOODLAND  STICKERS,12,0.85,15358.0,United Kingdom,2026-01-05
517400,84380,SET OF 3 BUTTERFLY COOKIE CUTTERS,24,1.25,15358.0,United Kingdom,2026-01-05
517400,21725,SWEETIES  STICKERS,12,0.85,15358.0,United Kingdom,2026-01-05
517400,21722,SWEET PUDDING STICKER SHEET,12,0.85,15358.0,United Kingdom,2026-01-05
517400,84536A,ENGLISH ROSE NOTEBOOK A7 SIZE,16,0.42,15358.0,United Kingdom,2026-01-05
517400,22087,PAPER BUNTING WHITE LACE,6,2.95,15358.0,United Kingdom,2026-01-05
517400,22088,PAPER BUNTING COLOURED LACE,6,2.95,15358.0,United Kingdom,2026-01-05
517400,21259,VICTORIAN SEWING BOX SMALL ,2,5.95,15358.0,United Kingdom,2026-01-05
517400,21257,VICTORIAN SEWING BOX MEDIUM,2,7.95,15358.0,United Kingdom,2026-01-05
517400,85017A,ENVELOPE 50 ROMANTIC IMAGES,24,0.85,15358.0,United Kingdom,2026-01-05
517400,22215,CAKE STAND WHITE TWO TIER LACE,2,8.5,15358.0,United Kingdom,2026-01-05
517400,21213,PACK OF 72 SKULL CAKE CASES,24,0.55,15358.0,United Kingdom,2026-01-05
517400,21212,PACK OF 72 RETRO SPOT CAKE CASES,24,0.55,15358.0,United Kingdom,2026-01-05
517400,84535B,FAIRY CAKES NOTEBOOK A6 SIZE,16,0.65,15358.0,United Kingdom,2026-01-05
517400,21508,VINTAGE KID DOLLY CARD ,12,0.42,15358.0,United Kingdom,2026-01-05
517400,21724,PANDA AND BUNNIES STICKER SHEET,12,0.85,15358.0,United Kingdom,2026-01-05
517400,21507,"ELEPHANT, BIRTHDAY CARD, ",12,0.42,15358.0,United Kingdom,2026-01-05
517400,21542,WOODLAND WATER TRANSFER TATTOOS ,12,0.85,15358.0,United Kingdom,2026-01-05
517400,85185B,PINK HORSE SOCK PUPPET,6,2.95,15358.0,United Kingdom,2026-01-05
517400,22025,RING OF ROSES BIRTHDAY CARD,12,0.42,15358.0,United Kingdom,2026-01-05
517400,21917,SET 12 KIDS  WHITE CHALK STICKS,24,0.42,15358.0,United Kingdom,2026-01-05
517400,22030,SWALLOWS GREETING CARD,12,0.42,15358.0,United Kingdom,2026-01-05
517400,22027,TEA PARTY BIRTHDAY CARD,12,0.42,15358.0,United Kingdom,2026-01-05
517400,22029,SPACEBOY BIRTHDAY CARD,12,0.42,15358.0,United Kingdom,2026-01-05
517401,85116,BLACK CANDELABRA T-LIGHT HOLDER,21,1.66,,United Kingdom,2026-01-05
517401,DOT,DOTCOM POSTAGE,1,203.32,,United Kingdom,2026-01-05
517401,90208,PAIR OF ENAMEL FLOWER CLUSTER SLIDE,1,2.54,,United Kingdom,2026-01-05
517401,90130C,GREEN STONE/CRYSTAL EARRINGS,1,2.96,,United Kingdom,2026-01-05
517401,90120C,GREEN MURANO TWIST BRACELET,1,4.24,,United Kingdom,2026-01-05
517401,85232D,SET/3 DECOUPAGE STACKING TINS,1,10.17,,United Kingdom,2026-01-05
517401,85150,LADIES & GENTLEMEN METAL SIGN,2,5.06,,United Kingdom,2026-01-05
517401,85123A,WHITE HANGING HEART T-LIGHT HOLDER,3,5.91,,United Kingdom,2026-01-05
517401,16237,SLEEPING CAT ERASERS,1,0.43,,United Kingdom,2026-01-05
517401,85099B,JUMBO BAG RED RETROSPOT,1,4.21,,United Kingdom,2026-01-05
517401,84670,JAPANESE CROCHETED ANIMAL,1,1.66,,United Kingdom,2026-01-05
517401,84946,ANTIQUE SILVER TEA GLASS ETCHED,4,2.51,,United Kingdom,2026-01-05
517401,84923,PINK BUTTERFLY HANDBAG W BOBBLES,1,4.21,,United Kingdom,2026-01-05
517401,84918,CREAM CUSHION COVER WITH FLOWERS,1,5.91,,United Kingdom,2026-01-05
517401,84872A,TEATIME FUNKY FLOWER BACKPACK FOR 2,5,11.02,,United Kingdom,2026-01-05
517401,84836,ZINC METAL HEART DECORATION,5,2.51,,United Kingdom,2026-01-05
517401,84820,DANISH ROSE TRINKET TRAYS,1,11.87,,United Kingdom,2026-01-05
517401,84818,DANISH ROSE PHOTO FRAME,1,2.51,,United Kingdom,2026-01-05
517401,84685,BEACH HUT KEY CABINET,1,7.62,,United Kingdom,2026-01-05
517401,17013D,ORIGAMI ROSE INCENSE IN TUBE,5,3.36,,United Kingdom,2026-01-05
517401,84568,GIRLS ALPHABET IRON ON PATCHES ,15,0.43,,United Kingdom,2026-01-05
517401,84978,HANGING HEART JAR T-LIGHT HOLDER,12,2.51,,United Kingdom,2026-01-05
517401,20674,GREEN SPOTTY BOWL,1,2.51,,United Kingdom,2026-01-05
517401,21232,STRAWBERRY CERAMIC TRINKET BOX,1,2.51,,United Kingdom,2026-01-05
517401,20677,PINK SPOTTY BOWL,1,2.51,,United Kingdom,2026-01-05
517401,84559A,3D SHEET OF DOG STICKERS,1,1.69,,United Kingdom,2026-01-05
517401,21843,RED RETROSPOT CAKE STAND,1,21.23,,United Kingdom,2026-01-05
517401,21755,LOVE BUILDING BLOCK WORD,1,11.87,,United Kingdom,2026-01-05
517401,21749,LARGE RED RETROSPOT WINDMILL,2,4.21,,United Kingdom,2026-01-05
517401,21731,RED TOADSTOOL LED NIGHT LIGHT,2,3.36,,United Kingdom,2026-01-05
517401,21539,RED RETROSPOT BUTTER DISH,1,10.17,,United Kingdom,2026-01-05
517401,21411,GINGHAM HEART  DOORSTOP RED,1,8.47,,United Kingdom,2026-01-05
517401,21407,BROWN CHECK CAT DOORSTOP ,1,8.47,,United Kingdom,2026-01-05
517401,21380,WOODEN HAPPY BIRTHDAY GARLAND,1,5.91,,United Kingdom,2026-01-05
517401,21246,RED SPOTTY BIG BOWL,1,11.02,,United Kingdom,2026-01-05
517401,20676,RED SPOTTY BOWL,2,2.51,,United Kingdom,2026-01-05
517401,21245,GREEN  SPOTTY PLATE ,1,3.36,,United Kingdom,2026-01-05
517401,21243,PINK  SPOTTY PLATE ,1,3.36,,United Kingdom,2026-01-05
517401,21242,RED SPOTTY PLATE ,1,3.36,,United Kingdom,2026-01-05
517401,21231,SWEETHEART CERAMIC TRINKET BOX,3,2.51,,United Kingdom,2026-01-05
517401,21220,SET/4 BADGES DOGS,1,2.51,,United Kingdom,2026-01-05
517401,21212,PACK OF 72 RETRO SPOT CAKE CASES,1,1.28,,United Kingdom,2026-01-05
517401,21172,PARTY METAL SIGN ,1,4.21,,United Kingdom,2026-01-05
517401,21002,ROSE DU SUD DRAWSTRING BAG,2,3.36,,United Kingdom,2026-01-05
517401,20914,SET/5 RED SPOTTY LID GLASS BOWLS,1,5.91,,United Kingdom,2026-01-05
517401,20829,GLITTER HANGING BUTTERFLY STRING,1,4.21,,United Kingdom,2026-01-05
517401,20719,WOODLAND CHARLOTTE BAG,1,1.66,,United Kingdom,2026-01-05
517401,21244,BLUE  SPOTTY PLATE ,1,3.36,,United Kingdom,2026-01-05
517401,84520B,PACK 20 ENGLISH ROSE PAPER NAPKINS,4,1.66,,United Kingdom,2026-01-05
517401,84598,BOYS ALPHABET IRON ON PATCHES,3,0.43,,United Kingdom,2026-01-05
517401,84077,WORLD WAR 2 GLIDERS ASSTD DESIGNS,5,0.43,,United Kingdom,2026-01-05
517401,22411,JUMBO SHOPPER VINTAGE RED PAISLEY,1,4.21,,United Kingdom,2026-01-05
517401,22364,GLASS JAR DIGESTIVE BISCUITS,1,5.91,,United Kingdom,2026-01-05
517401,22355,CHARLOTTE BAG SUKI DESIGN,1,1.66,,United Kingdom,2026-01-05
517401,22350,ILLUSTRATED CAT BOWL ,4,5.06,,United Kingdom,2026-01-05
517401,22325,MOBILE VINTAGE HEARTS ,1,11.87,,United Kingdom,2026-01-05
517401,22323,PINK POLKADOT KIDS BAG,1,4.21,,United Kingdom,2026-01-05
517401,22318,FIVE HEART HANGING DECORATION,1,5.91,,United Kingdom,2026-01-05
517401,22315,200 RED + WHITE BENDY STRAWS,1,2.51,,United Kingdom,2026-01-05
517401,22311,OFFICE MUG WARMER BLACK+SILVER ,1,8.47,,United Kingdom,2026-01-05
517401,22297,HEART IVORY TRELLIS SMALL,2,2.51,,United Kingdom,2026-01-05
517401,22469,HEART OF WICKER SMALL,2,3.36,,United Kingdom,2026-01-05
517401,22296,HEART IVORY TRELLIS LARGE,5,3.36,,United Kingdom,2026-01-05
517401,22090,PAPER BUNTING RETRO SPOTS,2,5.91,,United Kingdom,2026-01-05
517401,22083,PAPER CHAIN KIT RETRO SPOT,1,5.91,,United Kingdom,2026-01-05
517401,22072,RED RETROSPOT TEA CUP AND SAUCER ,2,7.62,,United Kingdom,2026-01-05
517401,21937,STRAWBERRY   PICNIC BAG,1,5.91,,United Kingdom,2026-01-05
517401,21935,SUKI  SHOULDER BAG,1,3.36,,United Kingdom,2026-01-05
517401,21922,UNION STRIPE WITH FRINGE  HAMMOCK,2,8.47,,United Kingdom,2026-01-05
517401,21911,GARDEN METAL SIGN ,1,3.36,,United Kingdom,2026-01-05
517401,21908,CHOCOLATE THIS WAY METAL SIGN,1,4.21,,United Kingdom,2026-01-05
517401,21875,KINGS CHOICE MUG,1,3.36,,United Kingdom,2026-01-05
517401,84279P,CHERRY BLOSSOM  DECORATIVE FLASK,1,8.47,,United Kingdom,2026-01-05
517401,22173,METAL 4 HOOK HANGER FRENCH CHATEAU,1,5.91,,United Kingdom,2026-01-05
517401,22489,PACK OF 12 TRADITIONAL CRAYONS,4,0.85,,United Kingdom,2026-01-05
517401,21915,RED  HARMONICA IN BOX ,1,2.51,,United Kingdom,2026-01-05
517401,22528,GARDENERS KNEELING PAD,1,2.51,,United Kingdom,2026-01-05
517401,22502,PICNIC BASKET WICKER SMALL,1,8.47,,United Kingdom,2026-01-05
517401,82597,BOMBS AWAY METAL SIGN,1,4.21,,United Kingdom,2026-01-05
517401,82482,WOODEN PICTURE FRAME WHITE FINISH,1,5.06,,United Kingdom,2026-01-05
517401,82069,BEECH WOOD P/FRAME,1,5.91,,United Kingdom,2026-01-05
517401,72807A,SET/3 ROSE CANDLE IN JEWELLED BOX,1,8.47,,United Kingdom,2026-01-05
517401,62096B,PURPLE/TURQ FLOWERS HANDBAG,1,3.36,,United Kingdom,2026-01-05
517401,48173C,DOORMAT BLACK FLOCK ,1,14.43,,United Kingdom,2026-01-05
517401,48111,DOORMAT 3 SMILEY CATS,1,14.43,,United Kingdom,2026-01-05
517401,47597,NEW ENGLAND TEATOWELS,3,1.66,,United Kingdom,2026-01-05
517401,47592A,CAROUSEL CHILDRENS OVERALL,7,1.66,,United Kingdom,2026-01-05
517401,82580,BATHROOM METAL SIGN,1,1.28,,United Kingdom,2026-01-05
517401,47566,PARTY BUNTING,13,8.47,,United Kingdom,2026-01-05
517401,47568,ENGLISH ROSE DESIGN PEG BAG,1,4.21,,United Kingdom,2026-01-05
517401,22621,TRADITIONAL KNITTING NANCY,1,2.98,,United Kingdom,2026-01-05
517401,22666,RECIPE BOX PANTRY YELLOW DESIGN,1,5.91,,United Kingdom,2026-01-05
517401,35961,FOLKART ZINC HEART CHRISTMAS DEC,4,1.66,,United Kingdom,2026-01-05
517401,22620,4 TRADITIONAL SPINNING TOPS,1,2.51,,United Kingdom,2026-01-05
517401,37444B,BLUE BREAKFAST CUP AND SAUCER ,1,5.91,,United Kingdom,2026-01-05
517401,37444C,PINK BREAKFAST CUP AND SAUCER ,1,5.91,,United Kingdom,2026-01-05
517401,46307,ROSES BLUE BASE CUSHION COVER ,1,5.91,,United Kingdom,2026-01-05
517401,37444A,YELLOW BREAKFAST CUP AND SAUCER,1,5.91,,United Kingdom,2026-01-05
517401,22537,MAGIC DRAWING SLATE DINOSAUR,1,0.85,,United Kingdom,2026-01-05
517402,22488,NATURAL SLATE RECTANGLE CHALKBOARD,2,3.36,,United Kingdom,2026-01-05
517402,22646,CERAMIC STRAWBERRY CAKE MONEY BANK,1,3.36,,United Kingdom,2026-01-05
517402,22498,WOODEN REGATTA BUNTING,1,12.72,,United Kingdom,2026-01-05
517402,22501,PICNIC BASKET WICKER LARGE,1,21.23,,United Kingdom,2026-01-05
517402,22567,20 DOLLY PEGS RETROSPOT,2,2.51,,United Kingdom,2026-01-05
517402,22620,4 TRADITIONAL SPINNING TOPS,1,2.51,,United Kingdom,2026-01-05
517402,22628,PICNIC BOXES SET OF 3 RETROSPOT ,1,10.17,,United Kingdom,2026-01-05
517402,22644,CERAMIC CHERRY CAKE MONEY BANK,1,3.36,,United Kingdom,2026-01-05
517402,22669,RED BABY BUNTING ,1,5.91,,United Kingdom,2026-01-05
517402,22659,LUNCH BOX I LOVE LONDON,1,4.21,,United Kingdom,2026-01-05
517402,22662,LUNCH BAG DOLLY GIRL DESIGN,1,4.21,,United Kingdom,2026-01-05
517402,22666,RECIPE BOX PANTRY YELLOW DESIGN,2,5.91,,United Kingdom,2026-01-05
517402,35001G,HAND OPEN SHAPE GOLD,1,4.21,,United Kingdom,2026-01-05
517402,35004C,SET OF 3 COLOURED  FLYING DUCKS,1,12.72,,United Kingdom,2026-01-05
517402,35961,FOLKART ZINC HEART CHRISTMAS DEC,2,1.66,,United Kingdom,2026-01-05
517402,37450,CERAMIC CAKE BOWL + HANGING CAKES,2,5.91,,United Kingdom,2026-01-05
517402,40018F,CHERRY DESIGN PAPERLANTERNS,1,4.21,,United Kingdom,2026-01-05
517402,47566,PARTY BUNTING,14,8.47,,United Kingdom,2026-01-05
517402,22650,CERAMIC PIRATE CHEST MONEY BANK,1,3.36,,United Kingdom,2026-01-05
517402,22469,HEART OF WICKER SMALL,1,3.36,,United Kingdom,2026-01-05
517402,22419,LIPSTICK PEN RED,4,0.85,,United Kingdom,2026-01-05
517402,22456,NATURAL SLATE CHALKBOARD LARGE ,3,10.17,,United Kingdom,2026-01-05
517402,47590B,PINK HAPPY BIRTHDAY BUNTING,1,11.02,,United Kingdom,2026-01-05
517402,22297,HEART IVORY TRELLIS SMALL,1,2.51,,United Kingdom,2026-01-05
517402,22323,PINK POLKADOT KIDS BAG,1,4.21,,United Kingdom,2026-01-05
517402,22324,BLUE POLKADOT KIDS BAG,1,4.21,,United Kingdom,2026-01-05
517402,22335,HEART DECORATION PAINTED ZINC ,1,1.28,,United Kingdom,2026-01-05
517402,22341,LOVE GARLAND PAINTED ZINC ,1,3.36,,United Kingdom,2026-01-05
517402,22352,LUNCH BOX WITH CUTLERY RETROSPOT ,2,5.06,,United Kingdom,2026-01-05
517402,22383,LUNCH BAG SUKI  DESIGN ,2,4.21,,United Kingdom,2026-01-05
517402,22457,NATURAL SLATE HEART CHALKBOARD ,6,5.91,,United Kingdom,2026-01-05
517402,22384,LUNCH BAG PINK RETROSPOT,3,4.21,,United Kingdom,2026-01-05
517402,22409,MONEY BOX BISCUITS DESIGN,1,2.51,,United Kingdom,2026-01-05
517402,22423,REGENCY CAKESTAND 3 TIER,4,25.49,,United Kingdom,2026-01-05
517402,22432,WATERING CAN PINK BUNNY,1,4.21,,United Kingdom,2026-01-05
517402,22435,SET OF 9 HEART SHAPED BALLOONS,1,2.51,,United Kingdom,2026-01-05
517402,22436,12 COLOURED PARTY BALLOONS,1,1.28,,United Kingdom,2026-01-05
517402,22445,PENCIL CASE LIFE IS BEAUTIFUL,1,5.91,,United Kingdom,2026-01-05
