Invoice,StockCode,Description,Quantity,Price,Customer ID,Country,InvoiceDate
519707,35400,WOODEN BOX ADVENT CALENDAR ,2,8.95,16286.0,United Kingdom,2026-01-23
519708,21507,"ELEPHANT, BIRTHDAY CARD, ",12,0.42,12870.0,United Kingdom,2026-01-23
519708,21508,VINTAGE KID DOLLY CARD ,12,0.42,12870.0,United Kingdom,2026-01-23
519708,21509,COWBOYS AND INDIANS BIRTHDAY CARD ,12,0.42,12870.0,United Kingdom,2026-01-23
519708,22027,TEA PARTY BIRTHDAY CARD,12,0.42,12870.0,United Kingdom,2026-01-23
519708,84946,ANTIQUE SILVER TEA GLASS ETCHED,36,1.25,12870.0,United Kingdom,2026-01-23
519708,85015,SET OF 12  VINTAGE POSTCARD SET,6,2.55,12870.0,United Kingdom,2026-01-23
519708,84782A,PINK 3 TIER GLASS PLATE STAND,8,3.95,12870.0,United Kingdom,2026-01-23
519708,84947,ANTIQUE SILVER TEA GLASS ENGRAVED,12,1.25,12870.0,United Kingdom,2026-01-23
519708,22178,VICTORIAN GLASS HANGING T-LIGHT,24,1.25,12870.0,United Kingdom,2026-01-23
519708,22029,SPACEBOY BIRTHDAY CARD,12,0.42,12870.0,United Kingdom,2026-01-23
519708,21068,VINTAGE BILLBOARD LOVE/HATE MUG,12,1.25,12870.0,United Kingdom,2026-01-23
519708,82578,KITCHEN METAL SIGN,12,0.55,12870.0,United Kingdom,2026-01-23
519708,82580,BATHROOM METAL SIGN,12,0.55,12870.0,United Kingdom,2026-01-23
519708,82581,TOILET METAL SIGN,12,0.55,12870.0,United Kingdom,2026-01-23
519708,21614,SET OF 12 ROSE BOTANICAL T-LIGHTS,6,2.95,12870.0,United Kingdom,2026-01-23
519708,21613,S/12 VANILLA  BOTANICAL T-LIGHTS,6,2.95,12870.0,United Kingdom,2026-01-23
519708,21611,SET OF 12 LILY BOTANICAL T-LIGHTS,6,2.95,12870.0,United Kingdom,2026-01-23
519708,21609,SET 12 LAVENDER  BOTANICAL T-LIGHTS,6,2.95,12870.0,United Kingdom,2026-01-23
519709,22699,TEACUP AND SAUCER REGENCY ROSES,72,2.55,16684.0,United Kingdom,2026-01-23
519709,22698,TEACUP AND SAUCER REGENCY PINK,72,2.55,16684.0,United Kingdom,2026-01-23
519709,22697,TEACUP AND SAUCER REGENCY GREEN,72,2.55,16684.0,United Kingdom,2026-01-23
519708,21071,VINTAGE BILLBOARD DRINK ME MUG,12,1.25,12870.0,United Kingdom,2026-01-23
519710,22667,RECIPE BOX RETRO SPOT DESIGN,240,2.55,16684.0,United Kingdom,2026-01-23
519711,21110,LARGE CAKE TOWEL PINK SPOTS,1,6.75,12851.0,United Kingdom,2026-01-23
519711,22493,PAINT YOUR OWN CANVAS SET,2,1.65,12851.0,United Kingdom,2026-01-23
519711,22663,JUMBO BAG DOLLY GIRL DESIGN,2,1.95,12851.0,United Kingdom,2026-01-23
519711,22426,ENAMEL WASH BOWL CREAM,1,3.75,12851.0,United Kingdom,2026-01-23
519711,22429,ENAMEL MEASURING JUG CREAM,1,4.25,12851.0,United Kingdom,2026-01-23
519711,20992,JAZZ HEARTS PURSE NOTEBOOK,5,0.85,12851.0,United Kingdom,2026-01-23
519711,22630,DOLLY GIRL LUNCH BOX,2,1.95,12851.0,United Kingdom,2026-01-23
519711,22554,PLASTERS IN TIN WOODLAND ANIMALS,1,1.65,12851.0,United Kingdom,2026-01-23
519711,84864A,PINK PAISLEY PHOTO ALBUM,1,6.75,12851.0,United Kingdom,2026-01-23
519711,22361,GLASS JAR DAISY FRESH COTTON WOOL,1,2.95,12851.0,United Kingdom,2026-01-23
519711,16254,TRANSPARENT ACRYLIC TAPE DISPENSER,2,0.85,12851.0,United Kingdom,2026-01-23
519711,20768,GREEN FERN JOURNAL ,1,2.55,12851.0,United Kingdom,2026-01-23
519711,47503A,ASS FLORAL PRINT MULTI SCREWDRIVER,1,1.25,12851.0,United Kingdom,2026-01-23
519711,21591,COSY HOUR CIGAR BOX MATCHES ,1,1.25,12851.0,United Kingdom,2026-01-23
519711,22623,BOX OF VINTAGE JIGSAW BLOCKS ,3,4.95,12851.0,United Kingdom,2026-01-23
519711,22697,GREEN REGENCY TEACUP AND SAUCER,1,2.95,12851.0,United Kingdom,2026-01-23
519711,16212,FUNKY GIRLZ ASST MAGNETIC MEMO PAD,1,0.65,12851.0,United Kingdom,2026-01-23
519711,22081,RIBBON REEL FLORA + FAUNA ,2,1.65,12851.0,United Kingdom,2026-01-23
519711,22079,RIBBON REEL HEARTS DESIGN ,2,1.65,12851.0,United Kingdom,2026-01-23
519711,22080,RIBBON REEL SPOTS DESIGN ,2,1.65,12851.0,United Kingdom,2026-01-23
519711,21888,BINGO SET,1,3.75,12851.0,United Kingdom,2026-01-23
519711,22423,REGENCY CAKESTAND 3 TIER,1,12.75,12851.0,United Kingdom,2026-01-23
519711,22082,RIBBON REEL STRIPES DESIGN ,3,1.65,12851.0,United Kingdom,2026-01-23
519711,21731,RED TOADSTOOL LED NIGHT LIGHT,2,1.65,12851.0,United Kingdom,2026-01-23
519711,17178,FLAT PALM T-LIGHT HOLDER,2,1.25,12851.0,United Kingdom,2026-01-23
519711,84968E,SET OF 16 VINTAGE BLACK CUTLERY,2,12.75,12851.0,United Kingdom,2026-01-23
519711,85099C,JUMBO  BAG BAROQUE BLACK WHITE,2,1.95,12851.0,United Kingdom,2026-01-23
519711,90160A,PURPLE BOUDICCA LARGE BRACELET,1,6.95,12851.0,United Kingdom,2026-01-23
519711,22466,FAIRY TALE COTTAGE NIGHTLIGHT,3,1.95,12851.0,United Kingdom,2026-01-23
519711,22667,RECIPE BOX RETRO SPOT DESIGN,1,2.95,12851.0,United Kingdom,2026-01-23
519712,22199,FRYING PAN RED POLKADOT ,2,4.25,16919.0,United Kingdom,2026-01-23
519712,22200,FRYING PAN PINK POLKADOT ,2,4.25,16919.0,United Kingdom,2026-01-23
519712,22383,LUNCH BAG SUKI  DESIGN ,2,1.65,16919.0,United Kingdom,2026-01-23
519712,22752,SET 7 BABUSHKA NESTING BOXES,3,8.5,16919.0,United Kingdom,2026-01-23
519712,20725,LUNCH BAG RED SPOTTY,2,1.65,16919.0,United Kingdom,2026-01-23
519712,85047,WHITE BEADED GARLAND STRING 20LIGHT,3,6.35,16919.0,United Kingdom,2026-01-23
519712,22637,PIGGY BANK RETROSPOT ,4,2.55,16919.0,United Kingdom,2026-01-23
519712,84992,72 SWEETHEART FAIRY CAKE CASES,3,0.55,16919.0,United Kingdom,2026-01-23
519712,22384,LUNCH BAG PINK RETROSPOT,2,1.65,16919.0,United Kingdom,2026-01-23
519712,21212,PACK OF 72 RETRO SPOT CAKE CASES,2,0.55,16919.0,United Kingdom,2026-01-23
519712,22756,LARGE YELLOW BABUSHKA NOTEBOOK ,2,1.25,16919.0,United Kingdom,2026-01-23
519712,20832,RED FLOCK LOVE HEART PHOTO FRAME,6,0.85,16919.0,United Kingdom,2026-01-23
519712,84535B,FAIRY CAKES NOTEBOOK A6 SIZE,2,0.65,16919.0,United Kingdom,2026-01-23
519712,22753,SMALL YELLOW BABUSHKA NOTEBOOK ,2,0.85,16919.0,United Kingdom,2026-01-23
519712,22755,SMALL PURPLE BABUSHKA NOTEBOOK ,1,0.85,16919.0,United Kingdom,2026-01-23
519712,22758,LARGE PURPLE BABUSHKA NOTEBOOK  ,1,1.25,16919.0,United Kingdom,2026-01-23
519712,84405A,S/3 PINK COL METAL BASKET W HANDLE,1,12.75,16919.0,United Kingdom,2026-01-23
519712,21488,RED WHITE SCARF  HOT WATER BOTTLE,2,3.95,16919.0,United Kingdom,2026-01-23
519712,84029E,RED WOOLLY HOTTIE WHITE HEART.,2,3.75,16919.0,United Kingdom,2026-01-23
519712,48194,DOORMAT HEARTS,3,7.49,16919.0,United Kingdom,2026-01-23
519712,84991,60 TEATIME FAIRY CAKE CASES,3,0.55,16919.0,United Kingdom,2026-01-23
519712,48185,DOORMAT FAIRY CAKE,1,7.49,16919.0,United Kingdom,2026-01-23
519713,22198,LARGE POPCORN HOLDER ,300,1.45,14156.0,EIRE,2026-01-23
519713,22197,SMALL POPCORN HOLDER,600,0.72,14156.0,EIRE,2026-01-23
519714,22601,CHRISTMAS RETROSPOT ANGEL WOOD,24,0.85,17829.0,United Arab Emirates,2026-01-23
519714,22576,SWALLOW WOODEN CHRISTMAS DECORATION,24,0.85,17829.0,United Arab Emirates,2026-01-23
519714,22596,CHRISTMAS STAR WISH LIST CHALKBOARD,24,0.85,17829.0,United Arab Emirates,2026-01-23
519714,22294,HEART FILIGREE DOVE  SMALL,24,1.25,17829.0,United Arab Emirates,2026-01-23
519714,22295,HEART FILIGREE DOVE LARGE,24,1.65,17829.0,United Arab Emirates,2026-01-23
519714,22065,CHRISTMAS PUDDING TRINKET POT ,48,1.25,17829.0,United Arab Emirates,2026-01-23
519714,21098,CHRISTMAS TOILET ROLL,72,1.06,17829.0,United Arab Emirates,2026-01-23
519714,22574,HEART WOODEN CHRISTMAS DECORATION,24,0.85,17829.0,United Arab Emirates,2026-01-23
519714,22688,DOORMAT PEACE ON EARTH BLUE,2,7.49,17829.0,United Arab Emirates,2026-01-23
519714,21491,SET OF THREE VINTAGE GIFT WRAPS,24,1.95,17829.0,United Arab Emirates,2026-01-23
519714,21906,PHARMACIE FIRST AID TIN,6,6.75,17829.0,United Arab Emirates,2026-01-23
519714,22494,EMERGENCY FIRST AID TIN ,12,1.25,17829.0,United Arab Emirates,2026-01-23
519714,22424,ENAMEL BREAD BIN CREAM,2,12.75,17829.0,United Arab Emirates,2026-01-23
519714,21910,WAY OUT METAL SIGN ,12,1.65,17829.0,United Arab Emirates,2026-01-23
519714,21911,GARDEN METAL SIGN ,12,1.65,17829.0,United Arab Emirates,2026-01-23
519714,22365,DOORMAT RESPECTABLE HOUSE,2,7.49,17829.0,United Arab Emirates,2026-01-23
519714,22689,DOORMAT MERRY CHRISTMAS RED ,2,7.49,17829.0,United Arab Emirates,2026-01-23
519714,22573,STAR WOODEN CHRISTMAS DECORATION,24,0.85,17829.0,United Arab Emirates,2026-01-23
519714,22581,WOOD STOCKING CHRISTMAS SCANDISPOT,24,0.85,17829.0,United Arab Emirates,2026-01-23
519714,22579,WOODEN TREE CHRISTMAS SCANDINAVIAN,24,0.85,17829.0,United Arab Emirates,2026-01-23
519714,22465,HANGING METAL STAR LANTERN,12,1.65,17829.0,United Arab Emirates,2026-01-23
519714,85150,LADIES & GENTLEMEN METAL SIGN,24,2.55,17829.0,United Arab Emirates,2026-01-23
519714,82552,WASHROOM METAL SIGN,12,1.25,17829.0,United Arab Emirates,2026-01-23
519714,82551,LAUNDRY 15C METAL SIGN,12,1.25,17829.0,United Arab Emirates,2026-01-23
519714,82599,FANNY'S REST STOPMETAL SIGN,12,2.1,17829.0,United Arab Emirates,2026-01-23
519714,21907,I'M ON HOLIDAY METAL SIGN,12,2.1,17829.0,United Arab Emirates,2026-01-23
519714,21181,PLEASE ONE PERSON METAL SIGN,12,2.1,17829.0,United Arab Emirates,2026-01-23
519714,82600,NO SINGING METAL SIGN,12,2.1,17829.0,United Arab Emirates,2026-01-23
519714,82583,HOT BATHS METAL SIGN,12,2.1,17829.0,United Arab Emirates,2026-01-23
519714,21164,HOME SWEET HOME METAL SIGN ,12,2.95,17829.0,United Arab Emirates,2026-01-23
519714,21174,POTTERING IN THE SHED METAL SIGN,12,1.95,17829.0,United Arab Emirates,2026-01-23
519714,22600,CHRISTMAS RETROSPOT STAR WOOD,24,0.85,17829.0,United Arab Emirates,2026-01-23
519714,22602,CHRISTMAS RETROSPOT HEART WOOD,24,0.85,17829.0,United Arab Emirates,2026-01-23
519714,22603,CHRISTMAS RETROSPOT TREE WOOD,24,0.85,17829.0,United Arab Emirates,2026-01-23
519714,22577,WOODEN HEART CHRISTMAS SCANDINAVIAN,24,0.85,17829.0,United Arab Emirates,2026-01-23
519714,22366,DOORMAT AIRMAIL ,2,7.49,17829.0,United Arab Emirates,2026-01-23
519714,48138,DOORMAT UNION FLAG,2,7.49,17829.0,United Arab Emirates,2026-01-23
519714,22578,WOODEN STAR CHRISTMAS SCANDINAVIAN,24,0.85,17829.0,United Arab Emirates,2026-01-23
519714,21166,COOK WITH WINE METAL SIGN ,12,1.95,17829.0,United Arab Emirates,2026-01-23
519714,21232,STRAWBERRY CERAMIC TRINKET BOX,12,1.25,17829.0,United Arab Emirates,2026-01-23
519714,21986,PACK OF 12 PINK SPOT TISSUES ,48,0.29,17829.0,United Arab Emirates,2026-01-23
519714,21985,PACK OF 12 HEARTS DESIGN TISSUES ,48,0.29,17829.0,United Arab Emirates,2026-01-23
519714,22114,HOT WATER BOTTLE TEA AND SYMPATHY,4,3.95,17829.0,United Arab Emirates,2026-01-23
519714,22112,CHOCOLATE HOT WATER BOTTLE,6,4.95,17829.0,United Arab Emirates,2026-01-23
519714,21485,RED SPOT HEART HOT WATER BOTTLE,6,4.95,17829.0,United Arab Emirates,2026-01-23
519714,22111,SCOTTIE DOG HOT WATER BOTTLE,6,4.95,17829.0,United Arab Emirates,2026-01-23
519714,21519,GIN & TONIC DIET GREETING CARD ,12,0.42,17829.0,United Arab Emirates,2026-01-23
519714,21832,CHOCOLATE CALCULATOR,12,1.65,17829.0,United Arab Emirates,2026-01-23
519714,20985,HEART CALCULATOR,12,1.25,17829.0,United Arab Emirates,2026-01-23
519714,22236,CAKE STAND 3 TIER MAGIC GARDEN,2,12.75,17829.0,United Arab Emirates,2026-01-23
519714,47590B,PINK HAPPY BIRTHDAY BUNTING,12,5.45,17829.0,United Arab Emirates,2026-01-23
519714,21122,SET/10 PINK SPOTTY PARTY CANDLES,48,1.25,17829.0,United Arab Emirates,2026-01-23
519714,21124,SET/10 BLUE SPOTTY PARTY CANDLES,48,1.25,17829.0,United Arab Emirates,2026-01-23
519714,22413,METAL SIGN TAKE IT OR LEAVE IT ,12,2.95,17829.0,United Arab Emirates,2026-01-23
519714,21231,SWEETHEART CERAMIC TRINKET BOX,12,1.25,17829.0,United Arab Emirates,2026-01-23
519714,21080,SET/20 RED SPOTTY PAPER NAPKINS ,12,0.85,17829.0,United Arab Emirates,2026-01-23
519714,21078,SET/20 STRAWBERRY PAPER NAPKINS ,12,0.85,17829.0,United Arab Emirates,2026-01-23
519714,84050,PINK HEART SHAPE EGG FRYING PAN,12,1.65,17829.0,United Arab Emirates,2026-01-23
519714,21175,GIN + TONIC DIET METAL SIGN,12,2.1,17829.0,United Arab Emirates,2026-01-23
519714,21903,MAN FLU METAL SIGN,12,2.1,17829.0,United Arab Emirates,2026-01-23
519714,85152,HAND OVER THE CHOCOLATE   SIGN ,12,2.1,17829.0,United Arab Emirates,2026-01-23
519714,21908,CHOCOLATE THIS WAY METAL SIGN,12,2.1,17829.0,United Arab Emirates,2026-01-23
519714,21165,BEWARE OF THE CAT METAL SIGN ,12,1.69,17829.0,United Arab Emirates,2026-01-23
519714,22115,METAL SIGN EMPIRE TEA,12,2.95,17829.0,United Arab Emirates,2026-01-23
519714,21770,OPEN CLOSED METAL SIGN,6,4.95,17829.0,United Arab Emirates,2026-01-23
519714,20681,PINK SPOTTY CHILDS UMBRELLA,12,3.25,17829.0,United Arab Emirates,2026-01-23
519714,20961,STRAWBERRY BATH SPONGE ,10,1.25,17829.0,United Arab Emirates,2026-01-23
519714,20960,WATERMELON BATH SPONGE,10,1.25,17829.0,United Arab Emirates,2026-01-23
519714,22200,FRYING PAN PINK POLKADOT ,12,4.25,17829.0,United Arab Emirates,2026-01-23
519714,22207,FRYING PAN UNION FLAG,12,4.25,17829.0,United Arab Emirates,2026-01-23
519714,84997D,PINK 3 PIECE MINI DOTS CUTLERY SET,12,3.75,17829.0,United Arab Emirates,2026-01-23
519714,85215,ASSORTED CHEESE FRIDGE MAGNETS,60,0.65,17829.0,United Arab Emirates,2026-01-23
519714,85217,ASSORTED ICE CREAM FRIDGE MAGNETS,60,0.65,17829.0,United Arab Emirates,2026-01-23
519714,21700,BIG DOUGHNUT FRIDGE MAGNETS,60,0.85,17829.0,United Arab Emirates,2026-01-23
519714,22195,LARGE HEART MEASURING SPOONS,12,1.65,17829.0,United Arab Emirates,2026-01-23
519715,20711,JUMBO BAG TOYS ,10,1.95,13971.0,United Kingdom,2026-01-23
519715,21472,LADYBIRD + BEE RAFFIA FOOD COVER,6,3.75,13971.0,United Kingdom,2026-01-23
519715,85066,CREAM SWEETHEART MINI CHEST,2,12.75,13971.0,United Kingdom,2026-01-23
519715,84992,72 SWEETHEART FAIRY CAKE CASES,24,0.55,13971.0,United Kingdom,2026-01-23
519715,21174,POTTERING IN THE SHED METAL SIGN,12,1.95,13971.0,United Kingdom,2026-01-23
519715,21928,JUMBO BAG SCANDINAVIAN PAISLEY,10,1.95,13971.0,United Kingdom,2026-01-23
519715,85099C,JUMBO  BAG BAROQUE BLACK WHITE,10,1.95,13971.0,United Kingdom,2026-01-23
519715,22386,JUMBO BAG PINK WITH WHITE SPOTS,20,1.95,13971.0,United Kingdom,2026-01-23
519715,21929,JUMBO BAG PINK VINTAGE PAISLEY,10,1.95,13971.0,United Kingdom,2026-01-23
519715,85099F,JUMBO BAG STRAWBERRY,20,1.95,13971.0,United Kingdom,2026-01-23
519715,22411,JUMBO SHOPPER VINTAGE RED PAISLEY,10,1.95,13971.0,United Kingdom,2026-01-23
519715,21432,SET OF 3 CASES WOODLAND DESIGN,4,5.95,13971.0,United Kingdom,2026-01-23
519715,20914,SET/5 RED SPOTTY LID GLASS BOWLS,6,2.95,13971.0,United Kingdom,2026-01-23
519716,84378,SET OF 3 HEART COOKIE CUTTERS,12,1.25,13360.0,United Kingdom,2026-01-23
519716,21356,TOAST ITS - FAIRY FLOWER,12,1.25,13360.0,United Kingdom,2026-01-23
519716,20914,SET/5 RED SPOTTY LID GLASS BOWLS,6,2.95,13360.0,United Kingdom,2026-01-23
519716,21843,RED RETROSPOT CAKE STAND,3,10.95,13360.0,United Kingdom,2026-01-23
519716,21035,SET/2 RED SPOTTY TEA TOWELS ,6,2.95,13360.0,United Kingdom,2026-01-23
519716,22077,6 RIBBONS RUSTIC CHARM,12,1.65,13360.0,United Kingdom,2026-01-23
519716,22583,PACK OF 6 HANDBAG GIFT BOXES,6,2.55,13360.0,United Kingdom,2026-01-23
519716,22584,PACK OF 6 PANNETONE GIFT BOXES,6,2.55,13360.0,United Kingdom,2026-01-23
519716,20971,PINK BLUE FELT CRAFT TRINKET BOX,12,1.25,13360.0,United Kingdom,2026-01-23
519716,22585,PACK OF 6 BIRDY GIFT TAGS,12,1.25,13360.0,United Kingdom,2026-01-23
519716,22536,MAGIC DRAWING SLATE PURDEY,48,0.42,13360.0,United Kingdom,2026-01-23
519716,22492,MINI PAINT SET VINTAGE ,36,0.65,13360.0,United Kingdom,2026-01-23
519716,21790,VINTAGE SNAP CARDS,12,0.85,13360.0,United Kingdom,2026-01-23
519716,22493,PAINT YOUR OWN CANVAS SET,12,1.65,13360.0,United Kingdom,2026-01-23
519716,C2,CARRIAGE,1,50.0,13360.0,United Kingdom,2026-01-23
519716,85065,CREAM SWEETHEART TRAYS,1,12.75,13360.0,United Kingdom,2026-01-23
519716,84991,60 TEATIME FAIRY CAKE CASES,24,0.55,13360.0,United Kingdom,2026-01-23
519716,21212,PACK OF 72 RETRO SPOT CAKE CASES,24,0.55,13360.0,United Kingdom,2026-01-23
519716,21977,PACK OF 60 PINK PAISLEY CAKE CASES,24,0.55,13360.0,United Kingdom,2026-01-23
519716,22149,FELTCRAFT 6 FLOWER FRIENDS,6,2.1,13360.0,United Kingdom,2026-01-23
519717,22456,NATURAL SLATE CHALKBOARD LARGE ,12,4.95,13089.0,United Kingdom,2026-01-23
519717,22423,REGENCY CAKESTAND 3 TIER,32,10.95,13089.0,United Kingdom,2026-01-23
519717,84949,SILVER HANGING T-LIGHT HOLDER,96,1.45,13089.0,United Kingdom,2026-01-23
519718,22579,WOODEN TREE CHRISTMAS SCANDINAVIAN,12,0.85,13479.0,United Kingdom,2026-01-23
519718,21349,IVY HEART WREATH,2,6.75,13479.0,United Kingdom,2026-01-23
519718,21802,CHRISTMAS TREE HEART DECORATION,36,0.42,13479.0,United Kingdom,2026-01-23
519718,21801,CHRISTMAS TREE DECORATION WITH BELL,36,0.42,13479.0,United Kingdom,2026-01-23
519718,21805,WHITE CHRISTMAS TREE DECORATION ,36,0.42,13479.0,United Kingdom,2026-01-23
519718,21803,CHRISTMAS TREE STAR DECORATION,36,0.42,13479.0,United Kingdom,2026-01-23
519718,21819,GLITTER CHRISTMAS STAR ,12,0.85,13479.0,United Kingdom,2026-01-23
519718,22417,PACK OF 60 SPACEBOY CAKE CASES,24,0.55,13479.0,United Kingdom,2026-01-23
519718,35958,FOLKART ZINC STAR CHRISTMAS DEC,12,0.85,13479.0,United Kingdom,2026-01-23
519718,35961,FOLKART ZINC HEART CHRISTMAS DEC,12,0.85,13479.0,United Kingdom,2026-01-23
519718,35970,ZINC FOLKART SLEIGH BELLS,12,1.69,13479.0,United Kingdom,2026-01-23
519718,22469,HEART OF WICKER SMALL,6,1.65,13479.0,United Kingdom,2026-01-23
519718,22470,HEART OF WICKER LARGE,6,2.95,13479.0,United Kingdom,2026-01-23
519718,21806,WHITE CHRISTMAS HEART DECORATION,36,0.42,13479.0,United Kingdom,2026-01-23
519718,21817,GLITTER CHRISTMAS TREE,12,0.85,13479.0,United Kingdom,2026-01-23
519718,21807,WHITE CHRISTMAS STAR DECORATION,36,0.42,13479.0,United Kingdom,2026-01-23
519718,72741,GRAND CHOCOLATECANDLE,9,1.45,13479.0,United Kingdom,2026-01-23
519718,37495,FAIRY CAKE BIRTHDAY CANDLE SET,4,3.75,13479.0,United Kingdom,2026-01-23
519718,84991,60 TEATIME FAIRY CAKE CASES,24,0.55,13479.0,United Kingdom,2026-01-23
519718,22591,CARDHOLDER GINGHAM CHRISTMAS TREE,6,2.55,13479.0,United Kingdom,2026-01-23
519718,84884A,ANT WHITE WIRE HEART SPIRAL,5,3.95,13479.0,United Kingdom,2026-01-23
519718,22158,3 HEARTS HANGING DECORATION RUSTIC,8,2.95,13479.0,United Kingdom,2026-01-23
519718,22151,PLACE SETTING WHITE HEART,24,0.42,13479.0,United Kingdom,2026-01-23
519718,22152,PLACE SETTING WHITE STAR,24,0.42,13479.0,United Kingdom,2026-01-23
519718,22593,CHRISTMAS GINGHAM STAR,12,0.85,13479.0,United Kingdom,2026-01-23
519718,22594,CHRISTMAS GINGHAM TREE,12,0.85,13479.0,United Kingdom,2026-01-23
519718,22595,CHRISTMAS GINGHAM HEART,12,0.85,13479.0,United Kingdom,2026-01-23
519718,22602,CHRISTMAS RETROSPOT HEART WOOD,12,0.85,13479.0,United Kingdom,2026-01-23
519718,22600,CHRISTMAS RETROSPOT STAR WOOD,12,0.85,13479.0,United Kingdom,2026-01-23
519719,21410,COUNTRY COTTAGE  DOORSTOP GREEN,1,4.25,,United Kingdom,2026-01-23
519719,21115,ROSE CARAVAN DOORSTOP,1,6.75,,United Kingdom,2026-01-23
519720,22276,WASH BAG VINTAGE ROSE PAISLEY,1,2.55,17961.0,United Kingdom,2026-01-23
519720,22372,AIRLINE BAG VINTAGE WORLD CHAMPION ,1,6.35,17961.0,United Kingdom,2026-01-23
519721,85170D,SET/6 PINK BIRD T-LIGHT CANDLES,1,2.1,14606.0,United Kingdom,2026-01-23
519721,21447,12 IVORY ROSE PEG PLACE SETTINGS,2,1.25,14606.0,United Kingdom,2026-01-23
519721,21714,CITRONELLA CANDLE GARDEN POT,2,1.25,14606.0,United Kingdom,2026-01-23
519721,72741,GRAND CHOCOLATECANDLE,9,1.45,14606.0,United Kingdom,2026-01-23
519721,22426,ENAMEL WASH BOWL CREAM,2,3.75,14606.0,United Kingdom,2026-01-23
519721,35965,FOLKART HEART NAPKIN RINGS,8,2.95,14606.0,United Kingdom,2026-01-23
519721,21687,SILVER PLATE CANDLE BOWL LARGE,1,3.75,14606.0,United Kingdom,2026-01-23
519721,21535,RED RETROSPOT SMALL MILK JUG,1,2.55,14606.0,United Kingdom,2026-01-23
519721,21294,ETCHED GLASS COASTER,4,1.25,14606.0,United Kingdom,2026-01-23
519721,82583,HOT BATHS METAL SIGN,3,2.1,14606.0,United Kingdom,2026-01-23
519721,21471,STRAWBERRY RAFFIA FOOD COVER,2,3.75,14606.0,United Kingdom,2026-01-23
519721,84880,WHITE WIRE EGG HOLDER,1,5.95,14606.0,United Kingdom,2026-01-23
519721,84692,BOX OF 24 COCKTAIL PARASOLS,1,0.42,14606.0,United Kingdom,2026-01-23
519721,21196,ROUND WHITE CONFETTI IN TUBE,1,1.65,14606.0,United Kingdom,2026-01-23
519721,21238,RED SPOTTY CUP,1,0.85,14606.0,United Kingdom,2026-01-23
519721,22329,ROUND CONTAINER SET OF 5 RETROSPOT,1,1.65,14606.0,United Kingdom,2026-01-23
519721,22335,HEART DECORATION PAINTED ZINC ,1,0.65,14606.0,United Kingdom,2026-01-23
519721,51014A,"FEATHER PEN,HOT PINK",12,0.85,14606.0,United Kingdom,2026-01-23
519721,22445,PENCIL CASE LIFE IS BEAUTIFUL,1,2.95,14606.0,United Kingdom,2026-01-23
519721,21564,PINK  HEART SHAPE LOVE BUCKET ,1,2.95,14606.0,United Kingdom,2026-01-23
519721,21563,RED HEART SHAPE LOVE BUCKET ,1,2.95,14606.0,United Kingdom,2026-01-23
519721,21827,EIGHT PIECE CREEPY CRAWLIE SET,1,1.25,14606.0,United Kingdom,2026-01-23
519721,21725,SWEETIES  STICKERS,5,0.85,14606.0,United Kingdom,2026-01-23
519721,22477,WATERING CAN GARDEN MARKER,1,1.25,14606.0,United Kingdom,2026-01-23
519721,21196,ROUND WHITE CONFETTI IN TUBE,1,1.65,14606.0,United Kingdom,2026-01-23
519721,22196,SMALL HEART MEASURING SPOONS,1,0.85,14606.0,United Kingdom,2026-01-23
519721,84828,JUNGLE POPSICLES ICE LOLLY HOLDERS,1,1.25,14606.0,United Kingdom,2026-01-23
519721,20828,GLITTER BUTTERFLY CLIPS,1,2.55,14606.0,United Kingdom,2026-01-23
519721,22430,ENAMEL WATERING CAN CREAM,2,4.95,14606.0,United Kingdom,2026-01-23
519721,20966,SANDWICH BATH SPONGE,1,1.25,14606.0,United Kingdom,2026-01-23
519721,20996,JAZZ HEARTS ADDRESS BOOK,1,0.42,14606.0,United Kingdom,2026-01-23
519722,85132C,CHARLIE AND LOLA FIGURES TINS,12,8.95,12435.0,Denmark,2026-01-23
519722,22194,BLACK DINER WALL CLOCK,36,7.65,12435.0,Denmark,2026-01-23
519722,85124A,PINK JUICY FRUIT PHOTO FRAME,9,2.1,12435.0,Denmark,2026-01-23
519722,20963,APPLE BATH SPONGE,30,1.25,12435.0,Denmark,2026-01-23
519722,85124C,GREEN JUICY FRUIT PHOTO FRAME,36,2.1,12435.0,Denmark,2026-01-23
519722,85132B,CHARLIE AND LOLA TABLE TINS,12,8.95,12435.0,Denmark,2026-01-23
519722,79067,CORONA MEXICAN TRAY,4,3.75,12435.0,Denmark,2026-01-23
519722,21915,RED  HARMONICA IN BOX ,36,1.25,12435.0,Denmark,2026-01-23
519722,21508,VINTAGE KID DOLLY CARD ,72,0.36,12435.0,Denmark,2026-01-23
519722,21509,COWBOYS AND INDIANS BIRTHDAY CARD ,72,0.36,12435.0,Denmark,2026-01-23
519722,22028,PENNY FARTHING BIRTHDAY CARD,72,0.36,12435.0,Denmark,2026-01-23
519722,21219,SET/4 BADGES BALLOON GIRL,20,1.25,12435.0,Denmark,2026-01-23
519722,21914,BLUE HARMONICA IN BOX ,36,1.25,12435.0,Denmark,2026-01-23
519722,22451,SILK PURSE RUSSIAN DOLL RED,6,3.35,12435.0,Denmark,2026-01-23
519722,21507,"ELEPHANT, BIRTHDAY CARD, ",72,0.36,12435.0,Denmark,2026-01-23
519722,22450,SILK PURSE RUSSIAN DOLL BLUE,6,3.35,12435.0,Denmark,2026-01-23
519722,22663,JUMBO BAG DOLLY GIRL DESIGN,10,1.95,12435.0,Denmark,2026-01-23
519722,20711,JUMBO BAG TOYS ,10,1.95,12435.0,Denmark,2026-01-23
519722,22449,SILK PURSE RUSSIAN DOLL PINK,6,3.35,12435.0,Denmark,2026-01-23
519722,22179,SET 10 LIGHTS NIGHT OWL,48,5.95,12435.0,Denmark,2026-01-23
519722,22454,MEASURING TAPE RUSSIAN DOLL RED,6,2.95,12435.0,Denmark,2026-01-23
519722,22453,MEASURING TAPE RUSSIAN DOLL BLUE,6,2.95,12435.0,Denmark,2026-01-23
519722,85178,VICTORIAN SEWING KIT,144,0.85,12435.0,Denmark,2026-01-23
519722,22551,PLASTERS IN TIN SPACEBOY,36,1.65,12435.0,Denmark,2026-01-23
519722,22452,MEASURING TAPE RUSSIAN DOLL PINK,6,2.95,12435.0,Denmark,2026-01-23
519722,22556,PLASTERS IN TIN CIRCUS PARADE ,36,1.65,12435.0,Denmark,2026-01-23
519722,21981,PACK OF 12 WOODLAND TISSUES ,48,0.29,12435.0,Denmark,2026-01-23
519722,21982,PACK OF 12 SUKI TISSUES ,48,0.29,12435.0,Denmark,2026-01-23
519722,22328,ROUND SNACK BOXES SET OF 4 FRUITS ,48,2.55,12435.0,Denmark,2026-01-23
519722,22630,DOLLY GIRL LUNCH BOX,24,1.95,12435.0,Denmark,2026-01-23
519722,22631,CIRCUS PARADE LUNCH BOX ,24,1.95,12435.0,Denmark,2026-01-23
519722,22554,PLASTERS IN TIN WOODLAND ANIMALS,36,1.65,12435.0,Denmark,2026-01-23
519723,21326,AGED GLASS SILVER T-LIGHT HOLDER,12,0.65,13842.0,United Kingdom,2026-01-23
519723,84581,DOG TOY WITH PINK CROCHET SKIRT,4,3.75,13842.0,United Kingdom,2026-01-23
519723,21333,CLASSIC WHITE FRAME,4,2.95,13842.0,United Kingdom,2026-01-23
519723,22173,METAL 4 HOOK HANGER FRENCH CHATEAU,8,2.95,13842.0,United Kingdom,2026-01-23
519723,21754,HOME BUILDING BLOCK WORD,3,5.95,13842.0,United Kingdom,2026-01-23
519723,84970S,HANGING HEART ZINC T-LIGHT HOLDER,12,0.85,13842.0,United Kingdom,2026-01-23
519723,22175,PINK OWL SOFT TOY,6,2.95,13842.0,United Kingdom,2026-01-23
519723,21506,"FANCY FONT BIRTHDAY CARD, ",12,0.42,13842.0,United Kingdom,2026-01-23
519723,22031,BOTANICAL LAVENDER BIRTHDAY CARD,12,0.42,13842.0,United Kingdom,2026-01-23
519723,22716,CARD CIRCUS PARADE,12,0.42,13842.0,United Kingdom,2026-01-23
519723,22150,3 STRIPEY MICE FELTCRAFT,6,1.95,13842.0,United Kingdom,2026-01-23
519723,20983,12 PENCILS TALL TUBE RED SPOTTY,12,0.85,13842.0,United Kingdom,2026-01-23
519723,22464,HANGING METAL HEART LANTERN,12,1.65,13842.0,United Kingdom,2026-01-23
519724,22646,CERAMIC STRAWBERRY CAKE MONEY BANK,12,1.45,17049.0,United Kingdom,2026-01-23
519724,21232,STRAWBERRY CERAMIC TRINKET BOX,12,1.25,17049.0,United Kingdom,2026-01-23
519724,21754,HOME BUILDING BLOCK WORD,3,5.95,17049.0,United Kingdom,2026-01-23
519724,22423,REGENCY CAKESTAND 3 TIER,1,12.75,17049.0,United Kingdom,2026-01-23
519724,22508,DOORSTOP RETROSPOT HEART,4,3.75,17049.0,United Kingdom,2026-01-23
519724,22649,STRAWBERRY FAIRY CAKE TEAPOT,8,4.95,17049.0,United Kingdom,2026-01-23
519724,22060,LARGE CAKE STAND HANGING HEARTS,2,9.95,17049.0,United Kingdom,2026-01-23
519724,22169,FAMILY ALBUM WHITE PICTURE FRAME,2,8.5,17049.0,United Kingdom,2026-01-23
519724,22694,WICKER STAR ,6,2.1,17049.0,United Kingdom,2026-01-23
519724,22221,CAKE STAND LOVEBIRD 2 TIER PINK,2,9.95,17049.0,United Kingdom,2026-01-23
519724,22220,CAKE STAND LOVEBIRD 2 TIER WHITE,2,9.95,17049.0,United Kingdom,2026-01-23
519724,47556B,TEA TIME TEA TOWELS ,6,2.95,17049.0,United Kingdom,2026-01-23
519724,37495,FAIRY CAKE BIRTHDAY CANDLE SET,4,3.75,17049.0,United Kingdom,2026-01-23
