Invoice,StockCode,Description,Quantity,Price,Customer ID,Country,InvoiceDate
516960,21430,SET/3 RED GINGHAM ROSE STORAGE BOX,4,3.75,12949.0,United Kingdom,2026-01-02
516960,84270,ASSTD DESIGN BUBBLE GUM RING,30,0.21,12949.0,United Kingdom,2026-01-02
516960,82494L,WOODEN FRAME ANTIQUE WHITE ,6,2.95,12949.0,United Kingdom,2026-01-02
516960,21232,STRAWBERRY CERAMIC TRINKET BOX,12,1.25,12949.0,United Kingdom,2026-01-02
516960,20828,GLITTER BUTTERFLY CLIPS,12,2.55,12949.0,United Kingdom,2026-01-02
516960,22468,BABUSHKA LIGHTS STRING OF 10,4,6.75,12949.0,United Kingdom,2026-01-02
516960,82482,WOODEN PICTURE FRAME WHITE FINISH,6,2.55,12949.0,United Kingdom,2026-01-02
516960,22077,6 RIBBONS RUSTIC CHARM,12,1.65,12949.0,United Kingdom,2026-01-02
516960,82486,WOOD S/3 CABINET ANT WHITE FINISH,4,7.95,12949.0,United Kingdom,2026-01-02
516960,82483,WOOD 2 DRAWER CABINET WHITE FINISH,4,5.95,12949.0,United Kingdom,2026-01-02
516960,85232B,SET/3 RUSSIAN DOLL STACKING TINS,6,4.95,12949.0,United Kingdom,2026-01-02
516960,21755,LOVE BUILDING BLOCK WORD,6,5.95,12949.0,United Kingdom,2026-01-02
516960,84050,PINK HEART SHAPE EGG FRYING PAN,18,1.65,12949.0,United Kingdom,2026-01-02
516960,22424,ENAMEL BREAD BIN CREAM,2,12.75,12949.0,United Kingdom,2026-01-02
516960,22327,ROUND SNACK BOXES SET OF 4 SKULLS,6,2.95,12949.0,United Kingdom,2026-01-02
516960,82581,TOILET METAL SIGN,12,0.55,12949.0,United Kingdom,2026-01-02
516960,82580,BATHROOM METAL SIGN,12,0.55,12949.0,United Kingdom,2026-01-02
516960,21135,VICTORIAN  METAL POSTCARD SPRING,16,1.69,12949.0,United Kingdom,2026-01-02
516960,82551,LAUNDRY 15C METAL SIGN,12,1.25,12949.0,United Kingdom,2026-01-02
516960,82552,WASHROOM METAL SIGN,12,1.25,12949.0,United Kingdom,2026-01-02
516960,22470,HEART OF WICKER LARGE,12,2.95,12949.0,United Kingdom,2026-01-02
516960,22469,HEART OF WICKER SMALL,12,1.65,12949.0,United Kingdom,2026-01-02
516960,22172,METAL SHELF WITH RAIL ,2,8.5,12949.0,United Kingdom,2026-01-02
516960,21136,PAINTED METAL PEARS ASSORTED,16,1.69,12949.0,United Kingdom,2026-01-02
516960,21745,GAOLERS KEYS DECORATIVE GARDEN ,4,3.75,12949.0,United Kingdom,2026-01-02
516960,72760B,VINTAGE CREAM 3 BASKET CAKE STAND,4,9.95,12949.0,United Kingdom,2026-01-02
516960,85064,CREAM SWEETHEART LETTER RACK,2,5.45,12949.0,United Kingdom,2026-01-02
516960,22423,REGENCY CAKESTAND 3 TIER,3,12.75,12949.0,United Kingdom,2026-01-02
516960,84946,ANTIQUE SILVER TEA GLASS ETCHED,36,1.25,12949.0,United Kingdom,2026-01-02
516960,71459,HANGING JAM JAR T-LIGHT HOLDER,36,0.85,12949.0,United Kingdom,2026-01-02
516960,22460,EMBOSSED GLASS TEALIGHT HOLDER,24,1.25,12949.0,United Kingdom,2026-01-02
516960,79000,MOROCCAN TEA GLASS,48,0.85,12949.0,United Kingdom,2026-01-02
516960,21172,PARTY METAL SIGN ,12,1.45,12949.0,United Kingdom,2026-01-02
516960,21171,BATHROOM METAL SIGN ,12,1.45,12949.0,United Kingdom,2026-01-02
516960,82600,NO SINGING METAL SIGN,12,2.1,12949.0,United Kingdom,2026-01-02
516960,84987,SET OF 36 TEATIME PAPER DOILIES,12,1.45,12949.0,United Kingdom,2026-01-02
516960,21380,WOODEN HAPPY BIRTHDAY GARLAND,18,2.95,12949.0,United Kingdom,2026-01-02
516960,20727,LUNCH BAG  BLACK SKULL.,10,1.65,12949.0,United Kingdom,2026-01-02
516960,15056N,EDWARDIAN PARASOL NATURAL,3,5.95,12949.0,United Kingdom,2026-01-02
516960,84992,72 SWEETHEART FAIRY CAKE CASES,24,0.55,12949.0,United Kingdom,2026-01-02
516960,84991,60 TEATIME FAIRY CAKE CASES,24,0.55,12949.0,United Kingdom,2026-01-02
516960,85152,HAND OVER THE CHOCOLATE   SIGN ,12,2.1,12949.0,United Kingdom,2026-01-02
516960,84832,ZINC WILLIE WINKIE  CANDLE STICK,12,0.85,12949.0,United Kingdom,2026-01-02
516960,84978,HANGING HEART JAR T-LIGHT HOLDER,24,1.25,12949.0,United Kingdom,2026-01-02
516960,84755,COLOUR GLASS T-LIGHT HOLDER HANGING,32,0.65,12949.0,United Kingdom,2026-01-02
516960,22212,FOUR HOOK  WHITE LOVEBIRDS,12,2.1,12949.0,United Kingdom,2026-01-02
516960,22219,LOVEBIRD HANGING DECORATION WHITE ,24,0.85,12949.0,United Kingdom,2026-01-02
516960,84792,ENCHANTED BIRD COATHANGER 5 HOOK,8,4.65,12949.0,United Kingdom,2026-01-02
516960,84406B,CREAM CUPID HEARTS COAT HANGER,8,3.25,12949.0,United Kingdom,2026-01-02
516960,84879,ASSORTED COLOUR BIRD ORNAMENT,16,1.69,12949.0,United Kingdom,2026-01-02
516960,84971S,SMALL HEART FLOWERS HOOK ,24,0.85,12949.0,United Kingdom,2026-01-02
516960,21390,FILIGRIS HEART WITH BUTTERFLY,24,1.25,12949.0,United Kingdom,2026-01-02
516960,22297,HEART IVORY TRELLIS SMALL,24,1.25,12949.0,United Kingdom,2026-01-02
516960,22294,HEART FILIGREE DOVE  SMALL,24,1.25,12949.0,United Kingdom,2026-01-02
516960,84947,ANTIQUE SILVER TEA GLASS ENGRAVED,36,1.25,12949.0,United Kingdom,2026-01-02
516960,84970S,HANGING HEART ZINC T-LIGHT HOLDER,24,0.85,12949.0,United Kingdom,2026-01-02
516960,84949,SILVER HANGING T-LIGHT HOLDER,12,1.65,12949.0,United Kingdom,2026-01-02
516960,22464,HANGING METAL HEART LANTERN,12,1.65,12949.0,United Kingdom,2026-01-02
516961,21930,JUMBO STORAGE BAG SKULLS,10,1.95,15378.0,United Kingdom,2026-01-02
516961,21928,JUMBO BAG SCANDINAVIAN PAISLEY,10,1.95,15378.0,United Kingdom,2026-01-02
516961,21931,JUMBO STORAGE BAG SUKI,10,1.95,15378.0,United Kingdom,2026-01-02
516961,85099C,JUMBO  BAG BAROQUE BLACK WHITE,10,1.95,15378.0,United Kingdom,2026-01-02
516961,22411,JUMBO SHOPPER VINTAGE RED PAISLEY,10,1.95,15378.0,United Kingdom,2026-01-02
516961,20717,STRAWBERRY SHOPPER BAG,10,1.25,15378.0,United Kingdom,2026-01-02
516962,21067,VINTAGE RED TEATIME MUG,12,1.25,12476.0,Germany,2026-01-02
516962,21843,RED RETROSPOT CAKE STAND,1,10.95,12476.0,Germany,2026-01-02
516962,20751,FUNKY WASHING UP GLOVES ASSORTED,12,2.1,12476.0,Germany,2026-01-02
516962,85123A,WHITE HANGING HEART T-LIGHT HOLDER,6,2.95,12476.0,Germany,2026-01-02
516962,21754,HOME BUILDING BLOCK WORD,3,5.95,12476.0,Germany,2026-01-02
516962,22424,ENAMEL BREAD BIN CREAM,1,12.75,12476.0,Germany,2026-01-02
516962,22425,ENAMEL COLANDER CREAM,3,4.95,12476.0,Germany,2026-01-02
516962,22427,ENAMEL FLOWER JUG CREAM,3,5.95,12476.0,Germany,2026-01-02
516962,21242,RED SPOTTY PLATE ,8,1.69,12476.0,Germany,2026-01-02
516962,20676,RED SPOTTY BOWL,8,1.25,12476.0,Germany,2026-01-02
516962,21238,RED SPOTTY CUP,8,0.85,12476.0,Germany,2026-01-02
516962,22624,IVORY KITCHEN SCALES,4,8.5,12476.0,Germany,2026-01-02
516962,22625,RED KITCHEN SCALES,2,8.5,12476.0,Germany,2026-01-02
516962,22423,REGENCY CAKESTAND 3 TIER,1,12.75,12476.0,Germany,2026-01-02
516962,84792,ENCHANTED BIRD COATHANGER 5 HOOK,4,4.65,12476.0,Germany,2026-01-02
516962,22328,ROUND SNACK BOXES SET OF 4 FRUITS ,6,2.95,12476.0,Germany,2026-01-02
516962,22040,BOTANICAL ROSE GIFT WRAP,25,0.42,12476.0,Germany,2026-01-02
516962,21498,RED SPOTS  WRAP ,25,0.42,12476.0,Germany,2026-01-02
516962,21658,GLASS  BEURRE DISH,4,3.95,12476.0,Germany,2026-01-02
516962,20914,SET/5 RED SPOTTY LID GLASS BOWLS,6,2.95,12476.0,Germany,2026-01-02
516962,22329,ROUND CONTAINER SET OF 5 RETROSPOT,12,1.65,12476.0,Germany,2026-01-02
516962,84997B,RED 3 PIECE MINI DOTS CUTLERY SET,6,3.75,12476.0,Germany,2026-01-02
516962,22411,JUMBO SHOPPER VINTAGE RED PAISLEY,10,1.95,12476.0,Germany,2026-01-02
516962,82484,WOOD BLACK BOARD ANT WHITE FINISH,3,6.45,12476.0,Germany,2026-01-02
516962,21500,PINK SPOTS  WRAP ,25,0.42,12476.0,Germany,2026-01-02
516962,21361,LOVE LARGE WOOD LETTERS ,1,12.75,12476.0,Germany,2026-01-02
516962,22634,CHILDS BREAKFAST SET SPACEBOY ,2,9.95,12476.0,Germany,2026-01-02
516962,20750,RED/WHITE DOT MINI CASES,2,7.95,12476.0,Germany,2026-01-02
516962,22635,CHILDS BREAKFAST SET DOLLY GIRL ,2,9.95,12476.0,Germany,2026-01-02
516962,22385,JUMBO BAG SPACEBOY DESIGN,10,1.95,12476.0,Germany,2026-01-02
516962,84946,ANTIQUE SILVER TEA GLASS ETCHED,12,1.25,12476.0,Germany,2026-01-02
516962,21980,PACK OF 12 RED SPOTTY TISSUES ,48,0.29,12476.0,Germany,2026-01-02
516962,82494L,WOODEN FRAME ANTIQUE WHITE ,6,2.95,12476.0,Germany,2026-01-02
516962,21661,VINTAGE GLASS TEA CADDY,3,5.95,12476.0,Germany,2026-01-02
516962,21324,HANGING MEDINA LANTERN SMALL,6,2.95,12476.0,Germany,2026-01-02
516962,21845,DAIRY MAID STRIPE MUG,12,2.95,12476.0,Germany,2026-01-02
516962,21662,VINTAGE GLASS COFFEE CADDY,3,5.95,12476.0,Germany,2026-01-02
516962,POST,POSTAGE,7,18.0,12476.0,Germany,2026-01-02
516962,22364,GLASS JAR DIGESTIVE BISCUITS,6,2.95,12476.0,Germany,2026-01-02
516962,20886,BOX OF 9 PEBBLE CANDLES,6,1.95,12476.0,Germany,2026-01-02
516962,21282,NATURAL BARK CANDLE LARGE,3,4.25,12476.0,Germany,2026-01-02
516962,21612,SET 12 WILDFLOWER BOTANICAL T-LIGHT,6,2.95,12476.0,Germany,2026-01-02
516962,21611,SET OF 12 LILY BOTANICAL T-LIGHTS,6,2.95,12476.0,Germany,2026-01-02
516962,79000,MOROCCAN TEA GLASS,12,0.85,12476.0,Germany,2026-01-02
516962,22485,SET OF 2 WOODEN MARKET CRATES,2,12.75,12476.0,Germany,2026-01-02
516962,22169,FAMILY ALBUM WHITE PICTURE FRAME,2,8.5,12476.0,Germany,2026-01-02
516962,22480,RED TEA TOWEL CLASSIC DESIGN,12,1.25,12476.0,Germany,2026-01-02
516962,22482,BLUE TEA TOWEL CLASSIC DESIGN,12,1.25,12476.0,Germany,2026-01-02
516962,22430,ENAMEL WATERING CAN CREAM,4,4.95,12476.0,Germany,2026-01-02
516962,22429,ENAMEL MEASURING JUG CREAM,4,4.25,12476.0,Germany,2026-01-02
516962,22088,PAPER BUNTING COLOURED LACE,6,2.95,12476.0,Germany,2026-01-02
516962,21609,SET 12 LAVENDER  BOTANICAL T-LIGHTS,6,2.95,12476.0,Germany,2026-01-02
516962,21891,TRADITIONAL WOODEN SKIPPING ROPE,12,1.25,12476.0,Germany,2026-01-02
516962,21827,EIGHT PIECE CREEPY CRAWLIE SET,12,1.25,12476.0,Germany,2026-01-02
516962,21528,DAIRY MAID TRADITIONAL TEAPOT ,2,6.95,12476.0,Germany,2026-01-02
516962,21534,DAIRY MAID LARGE MILK JUG,3,4.95,12476.0,Germany,2026-01-02
516962,21039,RED SPOTTY SHOPPING BAG,6,2.55,12476.0,Germany,2026-01-02
516962,85099B,JUMBO BAG RED RETROSPOT,10,1.95,12476.0,Germany,2026-01-02
516962,22090,PAPER BUNTING RETRO SPOTS,6,2.95,12476.0,Germany,2026-01-02
516962,21890,S/6 WOODEN SKITTLES IN COTTON BAG,6,2.95,12476.0,Germany,2026-01-02
516962,20658,RED SPOTTY LUGGAGE TAG,12,1.25,12476.0,Germany,2026-01-02
516962,22616,PACK OF 12 LONDON TISSUES ,48,0.29,12476.0,Germany,2026-01-02
516962,21497,FANCY FONTS BIRTHDAY WRAP,25,0.42,12476.0,Germany,2026-01-02
516962,22045,SPACEBOY GIFT WRAP,25,0.42,12476.0,Germany,2026-01-02
516962,22489,PACK OF 12 TRADITIONAL CRAYONS,24,0.42,12476.0,Germany,2026-01-02
516962,22561,WOODEN SCHOOL COLOURING SET,12,1.65,12476.0,Germany,2026-01-02
516962,20979,36 PENCILS TUBE RED SPOTTY,16,1.25,12476.0,Germany,2026-01-02
516962,21222,SET/4 BADGES BEETLES,10,1.25,12476.0,Germany,2026-01-02
516963,22087,PAPER BUNTING WHITE LACE,40,2.55,13001.0,United Kingdom,2026-01-02
516963,21086,SET/6 RED SPOTTY PAPER CUPS,12,0.65,13001.0,United Kingdom,2026-01-02
516963,21094,SET/6 RED SPOTTY PAPER PLATES,12,0.85,13001.0,United Kingdom,2026-01-02
516963,22383,LUNCH BAG SUKI  DESIGN ,10,1.65,13001.0,United Kingdom,2026-01-02
516963,22384,LUNCH BAG PINK RETROSPOT,10,1.65,13001.0,United Kingdom,2026-01-02
516963,22224,WHITE LOVEBIRD LANTERN,6,2.95,13001.0,United Kingdom,2026-01-02
516963,21042,RED SPOTTY APRON ,9,5.95,13001.0,United Kingdom,2026-01-02
516963,84992,72 SWEETHEART FAIRY CAKE CASES,24,0.55,13001.0,United Kingdom,2026-01-02
516963,21260,FIRST AID TIN,6,3.25,13001.0,United Kingdom,2026-01-02
516963,84879,ASSORTED COLOUR BIRD ORNAMENT,8,1.69,13001.0,United Kingdom,2026-01-02
516963,21429,RED GINGHAM ROSE JEWELLERY BOX,8,1.65,13001.0,United Kingdom,2026-01-02
516963,21731,RED TOADSTOOL LED NIGHT LIGHT,12,1.65,13001.0,United Kingdom,2026-01-02
516963,84520B,PACK 20 ENGLISH ROSE PAPER NAPKINS,36,0.85,13001.0,United Kingdom,2026-01-02
516963,15056N,EDWARDIAN PARASOL NATURAL,3,5.95,13001.0,United Kingdom,2026-01-02
516963,84988,SET OF 72 PINK HEART PAPER DOILIES,12,1.45,13001.0,United Kingdom,2026-01-02
516963,22646,CERAMIC STRAWBERRY CAKE MONEY BANK,12,1.45,13001.0,United Kingdom,2026-01-02
516963,20665,RED SPOTTY PURSE ,6,2.95,13001.0,United Kingdom,2026-01-02
516963,22284,HEN HOUSE DECORATION,12,1.65,13001.0,United Kingdom,2026-01-02
516963,20658,RED SPOTTY LUGGAGE TAG,12,1.25,13001.0,United Kingdom,2026-01-02
516963,21211,SET OF 72 SKULL PAPER  DOILIES,12,1.45,13001.0,United Kingdom,2026-01-02
516963,21207,SKULL AND CROSSBONES  GARLAND ,12,1.65,13001.0,United Kingdom,2026-01-02
516963,21326,AGED GLASS SILVER T-LIGHT HOLDER,144,0.55,13001.0,United Kingdom,2026-01-02
516963,84946,ANTIQUE SILVER TEA GLASS ETCHED,72,1.06,13001.0,United Kingdom,2026-01-02
516963,21272,SALLE DE BAIN HOOK,12,1.25,13001.0,United Kingdom,2026-01-02
516963,21864,UNION JACK FLAG PASSPORT COVER ,6,2.1,13001.0,United Kingdom,2026-01-02
516963,21867,PINK UNION JACK  LUGGAGE TAG,12,1.25,13001.0,United Kingdom,2026-01-02
516963,20727,LUNCH BAG  BLACK SKULL.,10,1.65,13001.0,United Kingdom,2026-01-02
516963,21911,GARDEN METAL SIGN ,12,1.65,13001.0,United Kingdom,2026-01-02
516963,21174,POTTERING IN THE SHED METAL SIGN,12,1.95,13001.0,United Kingdom,2026-01-02
516963,21903,MAN FLU METAL SIGN,12,2.1,13001.0,United Kingdom,2026-01-02
516963,48138,DOORMAT UNION FLAG,2,7.49,13001.0,United Kingdom,2026-01-02
516963,22411,JUMBO SHOPPER VINTAGE RED PAISLEY,10,1.95,13001.0,United Kingdom,2026-01-02
516963,20754,RETRO RED SPOTTY WASHING UP GLOVES,6,2.1,13001.0,United Kingdom,2026-01-02
516963,21987,PACK OF 6 SKULL PAPER CUPS,12,0.65,13001.0,United Kingdom,2026-01-02
516963,21988,PACK OF 6 SKULL PAPER PLATES,12,0.85,13001.0,United Kingdom,2026-01-02
516963,21558,SKULL LUNCH BOX WITH CUTLERY ,6,2.55,13001.0,United Kingdom,2026-01-02
516963,21213,PACK OF 72 SKULL CAKE CASES,24,0.55,13001.0,United Kingdom,2026-01-02
516963,21171,BATHROOM METAL SIGN ,12,1.45,13001.0,United Kingdom,2026-01-02
516964,21137,BLACK RECORD COVER FRAME,192,3.39,16210.0,United Kingdom,2026-01-02
516964,22411,JUMBO SHOPPER VINTAGE RED PAISLEY,10,1.95,16210.0,United Kingdom,2026-01-02
516964,22384,LUNCH BAG PINK RETROSPOT,10,1.65,16210.0,United Kingdom,2026-01-02
516964,20728,LUNCH BAG CARS BLUE,10,1.65,16210.0,United Kingdom,2026-01-02
516964,22423,REGENCY CAKESTAND 3 TIER,16,10.95,16210.0,United Kingdom,2026-01-02
516964,84946,ANTIQUE SILVER TEA GLASS ETCHED,72,1.06,16210.0,United Kingdom,2026-01-02
516964,84970L,SINGLE HEART ZINC T-LIGHT HOLDER,144,0.79,16210.0,United Kingdom,2026-01-02
516964,22666,RECIPE BOX PANTRY YELLOW DESIGN,48,2.55,16210.0,United Kingdom,2026-01-02
516964,20685,DOORMAT RED SPOT,2,7.49,16210.0,United Kingdom,2026-01-02
516964,22498,WOODEN REGATTA BUNTING,6,5.95,16210.0,United Kingdom,2026-01-02
516964,22041,"RECORD FRAME 7"" SINGLE SIZE ",48,2.1,16210.0,United Kingdom,2026-01-02
516964,84970S,HANGING HEART ZINC T-LIGHT HOLDER,144,0.64,16210.0,United Kingdom,2026-01-02
C516965,84676,BATH DUCK WATERING CAN,-3,2.95,12451.0,Switzerland,2026-01-02
C516965,21746,SMALL RED RETROSPOT WINDMILL,-10,1.25,12451.0,Switzerland,2026-01-02
516966,22376,AIRLINE BAG VINTAGE JET SET WHITE,1,6.35,,United Kingdom,2026-01-02
516966,22371,AIRLINE BAG VINTAGE TOKYO 78,1,6.35,,United Kingdom,2026-01-02
516967,84347,ROTATING SILVER ANGELS T-LIGHT HLDR,12,2.55,12813.0,Netherlands,2026-01-02
516967,21733,RED HANGING HEART T-LIGHT HOLDER,12,2.95,12813.0,Netherlands,2026-01-02
516967,35962,12 ASS ZINC CHRISTMAS DECORATIONS,12,2.1,12813.0,Netherlands,2026-01-02
516967,21732,RED HANGING METAL STAR TLIGHT HLDR,12,3.75,12813.0,Netherlands,2026-01-02
516967,22595,CHRISTMAS GINGHAM HEART,12,0.85,12813.0,Netherlands,2026-01-02
516967,22145,CHRISTMAS CRAFT HEART STOCKING ,6,2.1,12813.0,Netherlands,2026-01-02
516967,22593,CHRISTMAS GINGHAM STAR,12,0.85,12813.0,Netherlands,2026-01-02
516967,22594,CHRISTMAS GINGHAM TREE,12,0.85,12813.0,Netherlands,2026-01-02
516967,POST,POSTAGE,3,1.0,12813.0,Netherlands,2026-01-02
516967,21349,IVY HEART WREATH,4,6.75,12813.0,Netherlands,2026-01-02
516967,35958,FOLKART ZINC STAR CHRISTMAS DEC,36,0.85,12813.0,Netherlands,2026-01-02
516967,22297,HEART IVORY TRELLIS SMALL,24,1.25,12813.0,Netherlands,2026-01-02
516967,22596,CHRISTMAS STAR WISH LIST CHALKBOARD,24,0.85,12813.0,Netherlands,2026-01-02
516967,22574,HEART WOODEN CHRISTMAS DECORATION,24,0.85,12813.0,Netherlands,2026-01-02
516967,22162,HEART GARLAND RUSTIC PADDED,24,2.95,12813.0,Netherlands,2026-01-02
516967,22577,WOODEN HEART CHRISTMAS SCANDINAVIAN,24,0.85,12813.0,Netherlands,2026-01-02
516967,22602,CHRISTMAS RETROSPOT HEART WOOD,12,0.85,12813.0,Netherlands,2026-01-02
516967,22603,CHRISTMAS RETROSPOT TREE WOOD,12,0.85,12813.0,Netherlands,2026-01-02
516967,22158,3 HEARTS HANGING DECORATION RUSTIC,40,2.95,12813.0,Netherlands,2026-01-02
516967,22600,CHRISTMAS RETROSPOT STAR WOOD,12,0.85,12813.0,Netherlands,2026-01-02
516967,22597,CHRISTMAS MUSICAL ZINC HEART ,24,0.85,12813.0,Netherlands,2026-01-02
516967,22598,CHRISTMAS MUSICAL ZINC TREE,24,0.85,12813.0,Netherlands,2026-01-02
516967,22599,CHRISTMAS MUSICAL ZINC STAR,24,0.85,12813.0,Netherlands,2026-01-02
516967,22601,CHRISTMAS RETROSPOT ANGEL WOOD,12,0.85,12813.0,Netherlands,2026-01-02
516968,22549,PICTURE DOMINOES,12,1.45,15080.0,United Kingdom,2026-01-02
516968,22555,PLASTERS IN TIN STRONGMAN,12,1.65,15080.0,United Kingdom,2026-01-02
516968,22557,PLASTERS IN TIN VINTAGE PAISLEY ,12,1.65,15080.0,United Kingdom,2026-01-02
516968,22641,SET OF 4 NAPKIN CHARMS INSTUMENT   ,6,2.55,15080.0,United Kingdom,2026-01-02
516968,22639,SET OF 4 NAPKIN CHARMS HEARTS,6,2.55,15080.0,United Kingdom,2026-01-02
516968,22665,RECIPE BOX BLUE SKETCHBOOK DESIGN,6,2.95,15080.0,United Kingdom,2026-01-02
516968,22623,BOX OF VINTAGE JIGSAW BLOCKS ,6,4.95,15080.0,United Kingdom,2026-01-02
516968,21888,BINGO SET,4,3.75,15080.0,United Kingdom,2026-01-02
516968,21913,VINTAGE SEASIDE JIGSAW PUZZLES,4,3.75,15080.0,United Kingdom,2026-01-02
516968,22548,HEADS AND TAILS SPORTING FUN,12,1.25,15080.0,United Kingdom,2026-01-02
516968,21892,TRADITIONAL WOODEN CATCH CUP GAME ,12,1.25,15080.0,United Kingdom,2026-01-02
516968,21889,WOODEN BOX OF DOMINOES,12,1.25,15080.0,United Kingdom,2026-01-02
516968,21914,BLUE HARMONICA IN BOX ,12,1.25,15080.0,United Kingdom,2026-01-02
516968,21890,S/6 WOODEN SKITTLES IN COTTON BAG,12,2.95,15080.0,United Kingdom,2026-01-02
516968,22621,TRADITIONAL KNITTING NANCY,12,1.45,15080.0,United Kingdom,2026-01-02
516968,22493,PAINT YOUR OWN CANVAS SET,12,1.65,15080.0,United Kingdom,2026-01-02
516968,15056BL,EDWARDIAN PARASOL BLACK,3,5.95,15080.0,United Kingdom,2026-01-02
516968,15056N,EDWARDIAN PARASOL NATURAL,3,5.95,15080.0,United Kingdom,2026-01-02
516968,15056P,EDWARDIAN PARASOL PINK,3,5.95,15080.0,United Kingdom,2026-01-02
516968,21790,VINTAGE SNAP CARDS,12,0.85,15080.0,United Kingdom,2026-01-02
516969,37449,CERAMIC CAKE STAND + HANGING CAKES,2,9.95,17494.0,United Kingdom,2026-01-02
516969,22296,HEART IVORY TRELLIS LARGE,12,1.65,17494.0,United Kingdom,2026-01-02
516969,84836,ZINC METAL HEART DECORATION,12,1.25,17494.0,United Kingdom,2026-01-02
516970,84270,ASSTD DESIGN BUBBLE GUM RING,60,0.21,18231.0,United Kingdom,2026-01-02
516970,22480,RED TEA TOWEL CLASSIC DESIGN,12,1.25,18231.0,United Kingdom,2026-01-02
516970,22083,PAPER CHAIN KIT RETRO SPOT,12,2.95,18231.0,United Kingdom,2026-01-02
516970,20886,BOX OF 9 PEBBLE CANDLES,12,1.95,18231.0,United Kingdom,2026-01-02
516970,21326,AGED GLASS SILVER T-LIGHT HOLDER,12,0.65,18231.0,United Kingdom,2026-01-02
516970,84978,HANGING HEART JAR T-LIGHT HOLDER,12,1.25,18231.0,United Kingdom,2026-01-02
C516971,84880,WHITE WIRE EGG HOLDER,-1,5.95,14422.0,United Kingdom,2026-01-02
C516971,22461,SAVOY ART DECO CLOCK,-5,10.95,14422.0,United Kingdom,2026-01-02
C516972,22423,REGENCY CAKESTAND 3 TIER,-1,12.75,14205.0,United Kingdom,2026-01-02
C516972,21528,DAIRY MAID TRADITIONAL TEAPOT ,-1,6.95,14205.0,United Kingdom,2026-01-02
516973,48138,DOORMAT UNION FLAG,10,6.35,15093.0,United Kingdom,2026-01-02
516973,48184,DOORMAT ENGLISH ROSE ,10,6.35,15093.0,United Kingdom,2026-01-02
516973,21524,DOORMAT SPOTTY HOME SWEET HOME,10,6.35,15093.0,United Kingdom,2026-01-02
516973,84879,ASSORTED COLOUR BIRD ORNAMENT,144,1.69,15093.0,United Kingdom,2026-01-02
516973,21754,HOME BUILDING BLOCK WORD,12,5.95,15093.0,United Kingdom,2026-01-02
C516974,85123A,WHITE HANGING HEART T-LIGHT HOLDER,-1,2.95,17469.0,United Kingdom,2026-01-02
516975,16014,SMALL CHINESE STYLE SCISSOR,60,0.42,14000.0,United Kingdom,2026-01-02
516975,17003,BROCADE RING PURSE ,36,0.21,14000.0,United Kingdom,2026-01-02
516975,15039,SANDALWOOD FAN,10,0.85,14000.0,United Kingdom,2026-01-02
516975,15034,PAPER POCKET TRAVELING FAN ,24,0.14,14000.0,United Kingdom,2026-01-02
516975,15036,ASSORTED COLOURS SILK FAN,24,0.75,14000.0,United Kingdom,2026-01-02
516975,79000,MOROCCAN TEA GLASS,24,0.85,14000.0,United Kingdom,2026-01-02
516975,16016,LARGE CHINESE STYLE SCISSOR,30,0.85,14000.0,United Kingdom,2026-01-02
516975,16015,MEDIUM CHINESE STYLE SCISSOR,60,0.5,14000.0,United Kingdom,2026-01-02
516975,21922,UNION STRIPE WITH FRINGE  HAMMOCK,24,6.95,14000.0,United Kingdom,2026-01-02
516976,22139,RETRO SPOT TEA SET CERAMIC 11 PC ,24,4.25,16133.0,United Kingdom,2026-01-02
516976,21592,RETRO SPOT  CIGAR BOX MATCHES ,144,1.06,16133.0,United Kingdom,2026-01-02
516976,22561,WOODEN SCHOOL COLOURING SET,72,1.45,16133.0,United Kingdom,2026-01-02
516977,48194,DOORMAT HEARTS,2,14.43,,United Kingdom,2026-01-02
516977,79321,CHILLI LIGHTS,2,10.17,,United Kingdom,2026-01-02
516977,82482,WOODEN PICTURE FRAME WHITE FINISH,2,5.06,,United Kingdom,2026-01-02
516977,82552,WASHROOM METAL SIGN,1,2.51,,United Kingdom,2026-01-02
516977,84968e,S/16 VINTAGE BLACK CUTLERY,1,25.49,,United Kingdom,2026-01-02
516977,20655,QUEEN OF SKIES LUGGAGE TAG,1,2.51,,United Kingdom,2026-01-02
516977,DOT,DOTCOM POSTAGE,1,58.51,,United Kingdom,2026-01-02
516977,18098c,PORCELAIN BUTTERFLY OIL BURNER,1,5.06,,United Kingdom,2026-01-02
516977,20676,RED SPOTTY BOWL,1,2.51,,United Kingdom,2026-01-02
516977,21035,SET/2 RED SPOTTY TEA TOWELS ,2,5.91,,United Kingdom,2026-01-02
516977,84971s,SMALL HEART FLOWERS HOOK ,4,1.66,,United Kingdom,2026-01-02
516977,22622,BOX OF VINTAGE ALPHABET BLOCKS,1,21.23,,United Kingdom,2026-01-02
516977,21714,CITRONELLA CANDLE GARDEN POT,4,2.51,,United Kingdom,2026-01-02
516977,22501,PICNIC BASKET WICKER LARGE,1,21.23,,United Kingdom,2026-01-02
516977,22517,CHILDS GARDEN RAKE PINK,1,4.21,,United Kingdom,2026-01-02
516977,21116,OWL DOORSTOP,2,8.47,,United Kingdom,2026-01-02
516977,21430,SET/3 RED GINGHAM ROSE STORAGE BOX,1,7.62,,United Kingdom,2026-01-02
516977,21539,RED RETROSPOT BUTTER DISH,1,10.17,,United Kingdom,2026-01-02
516977,21558,SKULL LUNCH BOX WITH CUTLERY ,1,5.06,,United Kingdom,2026-01-02
516977,21086,SET/6 RED SPOTTY PAPER CUPS,1,1.66,,United Kingdom,2026-01-02
516977,21890,S/6 WOODEN SKITTLES IN COTTON BAG,1,5.91,,United Kingdom,2026-01-02
516977,22166,"WALL MIRROR , RECT DIAMANTE, PINK/",1,16.13,,United Kingdom,2026-01-02
516977,22196,SMALL HEART MEASURING SPOONS,1,1.66,,United Kingdom,2026-01-02
516977,22423,REGENCY CAKESTAND 3 TIER,2,25.49,,United Kingdom,2026-01-02
516978,18098c,PORCELAIN BUTTERFLY OIL BURNER,5,5.06,,United Kingdom,2026-01-02
516978,22424,ENAMEL BREAD BIN CREAM,1,25.49,,United Kingdom,2026-01-02
516978,22366,DOORMAT AIRMAIL ,1,14.43,,United Kingdom,2026-01-02
516978,22057,CERAMIC PLATE STRAWBERRY DESIGN,1,3.36,,United Kingdom,2026-01-02
516978,22055,MINI CAKE STAND  HANGING STRAWBERY,3,3.36,,United Kingdom,2026-01-02
516978,21947,SET OF 6 HEART CHOPSTICKS,1,2.51,,United Kingdom,2026-01-02
516978,21239,PINK  SPOTTY CUP,1,1.66,,United Kingdom,2026-01-02
516978,21186,WHITE DOVE HONEYCOMB PAPER GARLAND,1,3.36,,United Kingdom,2026-01-02
516978,21116,OWL DOORSTOP,1,8.47,,United Kingdom,2026-01-02
516978,22469,HEART OF WICKER SMALL,1,3.36,,United Kingdom,2026-01-02
516978,17181,CIRCLE OF FRIENDS CANDLE HOLDER,1,5.06,,United Kingdom,2026-01-02
516978,22196,SMALL HEART MEASURING SPOONS,1,1.66,,United Kingdom,2026-01-02
516978,85232b,SET/3 RUSSIAN DOLL STACKING TINS,1,10.17,,United Kingdom,2026-01-02
516978,85014a,BLACK/BLUE DOTS RUFFLED UMBRELLA,1,12.72,,United Kingdom,2026-01-02
516978,84796a,PINK HAWAIIAN PICNIC HAMPER FOR 2,1,8.47,,United Kingdom,2026-01-02
516978,82600,NO SINGING METAL SIGN,1,4.21,,United Kingdom,2026-01-02
516978,37333,"RETRO ""TEA FOR ONE"" ",1,11.02,,United Kingdom,2026-01-02
516978,35962,12 ASS ZINC CHRISTMAS DECORATIONS,4,4.21,,United Kingdom,2026-01-02
C516979,22457,NATURAL SLATE HEART CHALKBOARD ,-1,2.95,16150.0,United Kingdom,2026-01-02
C516979,22318,FIVE HEART HANGING DECORATION,-1,2.95,16150.0,United Kingdom,2026-01-02
C516979,84839,SWEETHEART KEY CABINET,-1,6.75,16150.0,United Kingdom,2026-01-02
C516979,84880,WHITE WIRE EGG HOLDER,-2,5.95,16150.0,United Kingdom,2026-01-02
516978,DOT,DOTCOM POSTAGE,1,41.7,,United Kingdom,2026-01-02
516985,DOT,DOTCOM POSTAGE,1,19.11,,United Kingdom,2026-01-02
516985,84986b,SET OF 36 SILVER PAPER DOILIES,2,2.98,,United Kingdom,2026-01-02
516985,37424,WHITE WITH BLACK CATS MUG,1,1.66,,United Kingdom,2026-01-02
516985,22094,RED POLKA DOT TISSUE BOX,2,2.51,,United Kingdom,2026-01-02
516985,21937,STRAWBERRY   PICNIC BAG,1,5.91,,United Kingdom,2026-01-02
516985,22055,MINI CAKE STAND  HANGING STRAWBERY,1,3.36,,United Kingdom,2026-01-02
516985,21924,BLUE/CREAM STRIPE FRINGE HAMMOCK,1,16.98,,United Kingdom,2026-01-02
516985,21714,CITRONELLA CANDLE GARDEN POT,1,2.51,,United Kingdom,2026-01-02
516985,21356,TOAST ITS - FAIRY FLOWER,1,2.51,,United Kingdom,2026-01-02
516985,21033,JUMBO BAG CHARLIE AND LOLA TOYS,1,5.49,,United Kingdom,2026-01-02
516985,20986,BLUE CALCULATOR RULER,1,2.51,,United Kingdom,2026-01-02
516985,21928,JUMBO BAG SCANDINAVIAN PAISLEY,1,5.06,,United Kingdom,2026-01-02
516990,22174,PHOTO CUBE,2,3.36,,United Kingdom,2026-01-02
516990,22182,CAKE STAND VICTORIAN FILIGREE SMALL,1,10.17,,United Kingdom,2026-01-02
516990,22195,LARGE HEART MEASURING SPOONS,1,3.36,,United Kingdom,2026-01-02
516990,22282,12 EGG HOUSE PAINTED WOOD,1,25.49,,United Kingdom,2026-01-02
516990,22352,LUNCH BOX WITH CUTLERY RETROSPOT ,1,5.06,,United Kingdom,2026-01-02
516990,22502,PICNIC BASKET WICKER SMALL,1,8.47,,United Kingdom,2026-01-02
516990,35004G,SET OF 3 GOLD FLYING DUCKS,1,12.72,,United Kingdom,2026-01-02
516990,22668,PINK BABY BUNTING,1,5.91,,United Kingdom,2026-01-02
