Invoice,StockCode,Description,Quantity,Price,Customer ID,Country,InvoiceDate
530086,22178,VICTORIAN GLASS HANGING T-LIGHT,576,0.9,16013.0,United Kingdom,2026-03-26
530087,22747,POPPY'S PLAYHOUSE BATHROOM,6,2.1,16732.0,United Kingdom,2026-03-26
530087,22364,GLASS JAR DIGESTIVE BISCUITS,6,2.95,16732.0,United Kingdom,2026-03-26
530087,22360,GLASS JAR ENGLISH CONFECTIONERY,6,2.95,16732.0,United Kingdom,2026-03-26
530087,21704,BAG 250g SWIRLY MARBLES,12,0.85,16732.0,United Kingdom,2026-03-26
530087,21791,VINTAGE HEADS AND TAILS CARD GAME ,12,1.25,16732.0,United Kingdom,2026-03-26
530087,21918,SET 12 KIDS COLOUR  CHALK STICKS,24,0.42,16732.0,United Kingdom,2026-03-26
530087,21790,VINTAGE SNAP CARDS,12,0.85,16732.0,United Kingdom,2026-03-26
530087,21889,WOODEN BOX OF DOMINOES,12,1.25,16732.0,United Kingdom,2026-03-26
530087,22434,BALLOON PUMP WITH 10 BALLOONS,8,1.95,16732.0,United Kingdom,2026-03-26
530087,22491,PACK OF 12 COLOURED PENCILS,12,0.85,16732.0,United Kingdom,2026-03-26
530087,22540,MINI JIGSAW CIRCUS PARADE ,24,0.42,16732.0,United Kingdom,2026-03-26
530087,22544,MINI JIGSAW SPACEBOY,24,0.42,16732.0,United Kingdom,2026-03-26
530087,22664,TOY TIDY DOLLY GIRL DESIGN,5,2.1,16732.0,United Kingdom,2026-03-26
530087,22380,TOY TIDY SPACEBOY  ,5,2.1,16732.0,United Kingdom,2026-03-26
530087,22555,PLASTERS IN TIN STRONGMAN,12,1.65,16732.0,United Kingdom,2026-03-26
530087,22615,PACK OF 12 CIRCUS PARADE TISSUES ,24,0.29,16732.0,United Kingdom,2026-03-26
530087,22616,PACK OF 12 LONDON TISSUES ,24,0.29,16732.0,United Kingdom,2026-03-26
530087,22631,CIRCUS PARADE LUNCH BOX ,12,1.95,16732.0,United Kingdom,2026-03-26
530087,22630,DOLLY GIRL LUNCH BOX,12,1.95,16732.0,United Kingdom,2026-03-26
530087,22636,CHILDS BREAKFAST SET CIRCUS PARADE,2,8.5,16732.0,United Kingdom,2026-03-26
530087,22623,BOX OF VINTAGE JIGSAW BLOCKS ,6,4.95,16732.0,United Kingdom,2026-03-26
530087,22622,BOX OF VINTAGE ALPHABET BLOCKS,4,9.95,16732.0,United Kingdom,2026-03-26
530087,22746,POPPY'S PLAYHOUSE LIVINGROOM ,6,2.1,16732.0,United Kingdom,2026-03-26
530087,22748,POPPY'S PLAYHOUSE KITCHEN,6,2.1,16732.0,United Kingdom,2026-03-26
530087,22745,POPPY'S PLAYHOUSE BEDROOM ,6,2.1,16732.0,United Kingdom,2026-03-26
530087,22362,GLASS JAR PEACOCK BATH SALTS,6,2.95,16732.0,United Kingdom,2026-03-26
530087,22655,VINTAGE RED KITCHEN CABINET,1,295.0,16732.0,United Kingdom,2026-03-26
530087,22393,PAPERWEIGHT VINTAGE COLLAGE,12,2.55,16732.0,United Kingdom,2026-03-26
530087,22539,MINI JIGSAW DOLLY GIRL,24,0.42,16732.0,United Kingdom,2026-03-26
530087,22713,CARD I LOVE LONDON ,12,0.42,16732.0,United Kingdom,2026-03-26
530087,22781,GUMBALL MAGAZINE RACK,2,7.65,16732.0,United Kingdom,2026-03-26
530087,21563,RED HEART SHAPE LOVE BUCKET ,6,2.95,16732.0,United Kingdom,2026-03-26
530087,22098,BOUDOIR SQUARE TISSUE BOX,12,1.25,16732.0,United Kingdom,2026-03-26
530087,22328,ROUND SNACK BOXES SET OF 4 FRUITS ,6,2.95,16732.0,United Kingdom,2026-03-26
530087,22417,PACK OF 60 SPACEBOY CAKE CASES,24,0.55,16732.0,United Kingdom,2026-03-26
530087,22951,72 CAKE CASES DOLLY GIRL DESIGN,24,0.55,16732.0,United Kingdom,2026-03-26
530087,22416,SET OF 36 DOILIES SPACEBOY DESIGN ,12,1.45,16732.0,United Kingdom,2026-03-26
530087,22949,36 DOILIES DOLLY GIRL,12,1.45,16732.0,United Kingdom,2026-03-26
530087,21210,SET OF 72 RETRO SPOT PAPER  DOILIES,12,1.45,16732.0,United Kingdom,2026-03-26
530087,22097,SWALLOW SQUARE TISSUE BOX,12,1.25,16732.0,United Kingdom,2026-03-26
530087,21587,COSY HOUR GIANT TUBE MATCHES,12,2.55,16732.0,United Kingdom,2026-03-26
530087,22942,CHRISTMAS LIGHTS 10 SANTAS ,4,8.5,16732.0,United Kingdom,2026-03-26
530087,22946,WOODEN ADVENT CALENDAR CREAM,2,16.95,16732.0,United Kingdom,2026-03-26
530087,22732,3D STICKERS VINTAGE CHRISTMAS,20,1.25,16732.0,United Kingdom,2026-03-26
530087,22734,SET OF 6 RIBBONS VINTAGE CHRISTMAS,12,2.55,16732.0,United Kingdom,2026-03-26
530087,22952,72 CAKE CASES VINTAGE CHRISTMAS,24,0.55,16732.0,United Kingdom,2026-03-26
530087,22945,CHRISTMAS METAL TAGS ASSORTED ,60,0.85,16732.0,United Kingdom,2026-03-26
530087,22910,PAPER CHAIN KIT VINTAGE CHRISTMAS,12,2.95,16732.0,United Kingdom,2026-03-26
530087,22943,CHRISTMAS LIGHTS 10 VINTAGE BAUBLES,12,4.95,16732.0,United Kingdom,2026-03-26
530087,22941,CHRISTMAS LIGHTS 10 REINDEER,6,8.5,16732.0,United Kingdom,2026-03-26
530087,22689,DOORMAT MERRY CHRISTMAS RED ,4,7.95,16732.0,United Kingdom,2026-03-26
530087,22374,AIRLINE BAG VINTAGE JET SET RED,4,4.25,16732.0,United Kingdom,2026-03-26
530087,22619,SET OF 6 SOLDIER SKITTLES,4,3.75,16732.0,United Kingdom,2026-03-26
530087,22405,MONEY BOX POCKET MONEY DESIGN,12,1.25,16732.0,United Kingdom,2026-03-26
530087,22029,SPACEBOY BIRTHDAY CARD,12,0.42,16732.0,United Kingdom,2026-03-26
530087,22361,GLASS JAR DAISY FRESH COTTON WOOL,6,2.95,16732.0,United Kingdom,2026-03-26
530087,21508,VINTAGE KID DOLLY CARD ,12,0.42,16732.0,United Kingdom,2026-03-26
530087,22624,IVORY KITCHEN SCALES,2,8.5,16732.0,United Kingdom,2026-03-26
530087,22191,IVORY DINER WALL CLOCK,2,8.5,16732.0,United Kingdom,2026-03-26
530087,22099,CARAVAN SQUARE TISSUE BOX,12,1.25,16732.0,United Kingdom,2026-03-26
530087,22659,LUNCH BOX I LOVE LONDON,12,1.95,16732.0,United Kingdom,2026-03-26
530087,22666,RECIPE BOX PANTRY YELLOW DESIGN,6,2.95,16732.0,United Kingdom,2026-03-26
530087,22725,ALARM CLOCK BAKELIKE CHOCOLATE,4,3.75,16732.0,United Kingdom,2026-03-26
530087,22730,ALARM CLOCK BAKELIKE IVORY,4,3.75,16732.0,United Kingdom,2026-03-26
530087,22728,ALARM CLOCK BAKELIKE PINK,4,3.75,16732.0,United Kingdom,2026-03-26
530087,22729,ALARM CLOCK BAKELIKE ORANGE,4,3.75,16732.0,United Kingdom,2026-03-26
530087,22727,ALARM CLOCK BAKELIKE RED ,8,3.75,16732.0,United Kingdom,2026-03-26
530087,22352,LUNCH BOX WITH CUTLERY RETROSPOT ,6,2.55,16732.0,United Kingdom,2026-03-26
530087,22472,TV DINNER TRAY DOLLY GIRL,3,4.95,16732.0,United Kingdom,2026-03-26
530087,22892,SALT AND PEPPER SHAKERS TOADSTOOLS,12,1.25,16732.0,United Kingdom,2026-03-26
530087,21786,RAIN HAT WITH RED SPOTS,24,0.42,16732.0,United Kingdom,2026-03-26
530087,21787,RAIN PONCHO WITH RED SPOTS,24,0.85,16732.0,United Kingdom,2026-03-26
530087,21212,PACK OF 72 RETRO SPOT CAKE CASES,24,0.55,16732.0,United Kingdom,2026-03-26
530087,22900, SET 2 TEA TOWELS I LOVE LONDON ,6,2.95,16732.0,United Kingdom,2026-03-26
530087,22726,ALARM CLOCK BAKELIKE GREEN,4,3.75,16732.0,United Kingdom,2026-03-26
530087,22692,DOORMAT WELCOME TO OUR HOME,4,7.95,16732.0,United Kingdom,2026-03-26
530087,22691,DOORMAT WELCOME SUNRISE,4,7.95,16732.0,United Kingdom,2026-03-26
530087,22660,DOORMAT I LOVE LONDON,2,7.95,16732.0,United Kingdom,2026-03-26
530087,22376,AIRLINE BAG VINTAGE JET SET WHITE,4,4.25,16732.0,United Kingdom,2026-03-26
530087,22371,AIRLINE BAG VINTAGE TOKYO 78,4,4.25,16732.0,United Kingdom,2026-03-26
530087,22027,TEA PARTY BIRTHDAY CARD,12,0.42,16732.0,United Kingdom,2026-03-26
530087,20914,SET/5 RED SPOTTY LID GLASS BOWLS,6,2.95,16732.0,United Kingdom,2026-03-26
530087,22635,CHILDS BREAKFAST SET DOLLY GIRL ,2,9.95,16732.0,United Kingdom,2026-03-26
530087,21592,RETRO SPOT  CIGAR BOX MATCHES ,24,1.25,16732.0,United Kingdom,2026-03-26
530087,22139,RETRO SPOT TEA SET CERAMIC 11 PC ,6,4.95,16732.0,United Kingdom,2026-03-26
530087,22618,COOKING SET RETROSPOT,4,9.95,16732.0,United Kingdom,2026-03-26
530087,21509,COWBOYS AND INDIANS BIRTHDAY CARD ,12,0.42,16732.0,United Kingdom,2026-03-26
530087,22712,CARD DOLLY GIRL ,12,0.42,16732.0,United Kingdom,2026-03-26
530087,22716,CARD CIRCUS PARADE,12,0.42,16732.0,United Kingdom,2026-03-26
530087,22711,WRAP CIRCUS PARADE,25,0.42,16732.0,United Kingdom,2026-03-26
530087,22045,SPACEBOY GIFT WRAP,25,0.42,16732.0,United Kingdom,2026-03-26
530087,22708,WRAP DOLLY GIRL,25,0.42,16732.0,United Kingdom,2026-03-26
530087,22046,TEA PARTY  WRAPPING PAPER ,25,0.42,16732.0,United Kingdom,2026-03-26
530087,20829,GLITTER HANGING BUTTERFLY STRING,8,2.1,16732.0,United Kingdom,2026-03-26
530087,22753,SMALL YELLOW BABUSHKA NOTEBOOK ,12,0.85,16732.0,United Kingdom,2026-03-26
530087,22454,MEASURING TAPE BABUSHKA RED,6,2.95,16732.0,United Kingdom,2026-03-26
530087,21507,"ELEPHANT, BIRTHDAY CARD, ",12,0.42,16732.0,United Kingdom,2026-03-26
530087,22452,MEASURING TAPE BABUSHKA PINK,6,2.95,16732.0,United Kingdom,2026-03-26
530087,22449,SILK PURSE BABUSHKA PINK,6,3.35,16732.0,United Kingdom,2026-03-26
530087,22940,FELTCRAFT CHRISTMAS FAIRY,12,4.25,16732.0,United Kingdom,2026-03-26
530087,22751,FELTCRAFT PRINCESS OLIVIA DOLL,4,3.75,16732.0,United Kingdom,2026-03-26
530087,22750,FELTCRAFT PRINCESS LOLA DOLL,4,3.75,16732.0,United Kingdom,2026-03-26
530087,22749,FELTCRAFT PRINCESS CHARLOTTE DOLL,4,3.75,16732.0,United Kingdom,2026-03-26
530087,22451,SILK PURSE BABUSHKA RED,6,3.35,16732.0,United Kingdom,2026-03-26
530087,22418,10 COLOUR SPACEBOY PEN,24,0.85,16732.0,United Kingdom,2026-03-26
530087,22474,SPACEBOY TV DINNER TRAY,3,4.95,16732.0,United Kingdom,2026-03-26
530087,22634,CHILDS BREAKFAST SET SPACEBOY ,2,9.95,16732.0,United Kingdom,2026-03-26
530087,22617,BAKING SET SPACEBOY DESIGN,3,4.95,16732.0,United Kingdom,2026-03-26
530087,84077,WORLD WAR 2 GLIDERS ASSTD DESIGNS,48,0.29,16732.0,United Kingdom,2026-03-26
530087,22752,SET 7 BABUSHKA NESTING BOXES,2,8.5,16732.0,United Kingdom,2026-03-26
530087,22629,SPACEBOY LUNCH BOX ,12,1.95,16732.0,United Kingdom,2026-03-26
530088,35400,WOODEN BOX ADVENT CALENDAR ,1,8.95,15311.0,United Kingdom,2026-03-26
530088,21033,JUMBO BAG CHARLIE AND LOLA TOYS,1,2.95,15311.0,United Kingdom,2026-03-26
530088,21669,BLUE STRIPE CERAMIC DRAWER KNOB,6,1.25,15311.0,United Kingdom,2026-03-26
530088,22775,PURPLE DRAWERKNOB ACRYLIC EDWARDIAN,12,1.25,15311.0,United Kingdom,2026-03-26
530088,21169,YOU'RE CONFUSING ME METAL SIGN ,2,1.69,15311.0,United Kingdom,2026-03-26
530088,84997B,RED 3 PIECE RETROSPOT CUTLERY SET,2,3.75,15311.0,United Kingdom,2026-03-26
530088,21668,RED STRIPE CERAMIC DRAWER KNOB,96,1.06,15311.0,United Kingdom,2026-03-26
530088,84946,ANTIQUE SILVER TEA GLASS ETCHED,4,1.25,15311.0,United Kingdom,2026-03-26
530089,72815,3 WICK CHRISTMAS BRIAR CANDLE ,1,3.75,16916.0,United Kingdom,2026-03-26
530089,35970,ZINC FOLKART SLEIGH BELLS,1,1.69,16916.0,United Kingdom,2026-03-26
530089,84997D,PINK 3 PIECE POLKADOT CUTLERY SET,1,3.75,16916.0,United Kingdom,2026-03-26
530089,22892,SET OF SALT AND PEPPER TOADSTOOLS,6,1.25,16916.0,United Kingdom,2026-03-26
530089,72814,SET OF 3 CHRISTMAS BRIAR CANDLES,2,3.75,16916.0,United Kingdom,2026-03-26
530089,84792,ENCHANTED BIRD COATHANGER 5 HOOK,1,4.65,16916.0,United Kingdom,2026-03-26
530089,84497,BUTTONS AND STRIPES NOTEBOOK ,1,3.75,16916.0,United Kingdom,2026-03-26
530089,21448,12 DAISY PEGS IN WOOD BOX,1,1.65,16916.0,United Kingdom,2026-03-26
530089,35653,VINTAGE BEAD NOTEBOOK,1,2.95,16916.0,United Kingdom,2026-03-26
530089,84832,ZINC WILLIE WINKIE  CANDLE STICK,1,0.85,16916.0,United Kingdom,2026-03-26
530089,22862,LOVE HEART NAPKIN BOX ,1,4.25,16916.0,United Kingdom,2026-03-26
530089,M,Manual,2,2.95,16916.0,United Kingdom,2026-03-26
530089,21469,POLKA DOT RAFFIA FOOD COVER,1,3.75,16916.0,United Kingdom,2026-03-26
530089,72800E,4 IVORY DINNER CANDLES SILVER FLOCK,1,2.55,16916.0,United Kingdom,2026-03-26
530089,84352,SILVER CHRISTMAS TREE BAUBLE STAND ,1,16.95,16916.0,United Kingdom,2026-03-26
530089,22480,RED TEA TOWEL CLASSIC DESIGN,1,1.25,16916.0,United Kingdom,2026-03-26
530089,22181,SNOWSTORM PHOTO FRAME FRIDGE MAGNET,2,0.85,16916.0,United Kingdom,2026-03-26
530089,22452,MEASURING TAPE BABUSHKA PINK,1,2.95,16916.0,United Kingdom,2026-03-26
530089,22448,PIN CUSHION BABUSHKA RED,1,3.35,16916.0,United Kingdom,2026-03-26
530089,21080,SET/20 RED RETROSPOT PAPER NAPKINS ,4,0.85,16916.0,United Kingdom,2026-03-26
530089,22553,PLASTERS IN TIN SKULLS,1,1.65,16916.0,United Kingdom,2026-03-26
530089,22557,PLASTERS IN TIN VINTAGE PAISLEY ,1,1.65,16916.0,United Kingdom,2026-03-26
530089,22788,BROCANTE COAT RACK,2,9.95,16916.0,United Kingdom,2026-03-26
530089,72814,SET OF 3 CHRISTMAS BRIAR CANDLES,2,3.75,16916.0,United Kingdom,2026-03-26
530089,21143,ANTIQUE GLASS HEART DECORATION ,1,1.95,16916.0,United Kingdom,2026-03-26
530089,22591,CARDHOLDER GINGHAM CHRISTMAS TREE,4,2.55,16916.0,United Kingdom,2026-03-26
530089,84978,HANGING HEART JAR T-LIGHT HOLDER,6,1.25,16916.0,United Kingdom,2026-03-26
530089,21212,PACK OF 72 RETROSPOT CAKE CASES,2,0.55,16916.0,United Kingdom,2026-03-26
530089,35961,FOLKART ZINC HEART CHRISTMAS DEC,12,0.85,16916.0,United Kingdom,2026-03-26
530089,35958,FOLKART ZINC STAR CHRISTMAS DEC,12,0.85,16916.0,United Kingdom,2026-03-26
530089,22862,LOVE HEART NAPKIN BOX ,2,4.25,16916.0,United Kingdom,2026-03-26
530089,20914,SET/5 RED RETROSPOT LID GLASS BOWLS,4,2.95,16916.0,United Kingdom,2026-03-26
530089,84270,ASSTD DESIGN BUBBLE GUM RING,60,0.21,16916.0,United Kingdom,2026-03-26
530089,84832,ZINC WILLIE WINKIE  CANDLE STICK,6,0.85,16916.0,United Kingdom,2026-03-26
530089,21891,TRADITIONAL WOODEN SKIPPING ROPE,6,1.25,16916.0,United Kingdom,2026-03-26
530089,35400,WOODEN BOX ADVENT CALENDAR ,1,8.95,16916.0,United Kingdom,2026-03-26
530089,21814,HEART T-LIGHT HOLDER ,1,1.45,16916.0,United Kingdom,2026-03-26
530089,35961,FOLKART ZINC HEART CHRISTMAS DEC,2,0.85,16916.0,United Kingdom,2026-03-26
530089,22592,CARDHOLDER HOLLY WREATH METAL,1,3.75,16916.0,United Kingdom,2026-03-26
530089,84559A,3D SHEET OF DOG STICKERS,1,0.85,16916.0,United Kingdom,2026-03-26
530089,22588,CARD HOLDER GINGHAM HEART,2,2.55,16916.0,United Kingdom,2026-03-26
530089,21814,HEART T-LIGHT HOLDER ,2,1.45,16916.0,United Kingdom,2026-03-26
530089,21143,ANTIQUE GLASS HEART DECORATION ,1,1.95,16916.0,United Kingdom,2026-03-26
530089,35970,ZINC FOLKART SLEIGH BELLS,2,1.69,16916.0,United Kingdom,2026-03-26
530090,82484,WOOD BLACK BOARD ANT WHITE FINISH,3,6.45,15729.0,United Kingdom,2026-03-26
530090,21755,LOVE BUILDING BLOCK WORD,3,5.95,15729.0,United Kingdom,2026-03-26
530090,22507,MEMO BOARD RETROSPOT  DESIGN,4,4.95,15729.0,United Kingdom,2026-03-26
530090,21754,HOME BUILDING BLOCK WORD,3,5.95,15729.0,United Kingdom,2026-03-26
530092,20798,CLEAR MILKSHAKE GLASS,6,2.1,15253.0,United Kingdom,2026-03-26
530092,18094C,WHITE AND BLUE CERAMIC OIL BURNER,12,1.25,15253.0,United Kingdom,2026-03-26
530092,21948,SET OF 6 CAKE CHOPSTICKS,12,1.25,15253.0,United Kingdom,2026-03-26
530092,84692,BOX OF 24 COCKTAIL PARASOLS,25,0.42,15253.0,United Kingdom,2026-03-26
530091,85099B,JUMBO BAG RED RETROSPOT,10,1.95,13975.0,United Kingdom,2026-03-26
530092,22465,HANGING METAL STAR LANTERN,12,1.65,15253.0,United Kingdom,2026-03-26
530091,22411,JUMBO SHOPPER VINTAGE RED PAISLEY,10,1.95,13975.0,United Kingdom,2026-03-26
530091,85099C,JUMBO  BAG BAROQUE BLACK WHITE,10,1.95,13975.0,United Kingdom,2026-03-26
530092,20685,DOORMAT RED RETROSPOT,2,7.95,15253.0,United Kingdom,2026-03-26
530091,20718,RED RETROSPOT SHOPPER BAG,10,1.25,13975.0,United Kingdom,2026-03-26
530092,85123A,WHITE HANGING HEART T-LIGHT HOLDER,18,2.95,15253.0,United Kingdom,2026-03-26
530091,20970,PINK FLORAL FELTCRAFT SHOULDER BAG,4,3.75,13975.0,United Kingdom,2026-03-26
530091,85099F,JUMBO BAG STRAWBERRY,10,1.95,13975.0,United Kingdom,2026-03-26
530091,20717,STRAWBERRY SHOPPER BAG,10,1.25,13975.0,United Kingdom,2026-03-26
530092,22557,PLASTERS IN TIN VINTAGE PAISLEY ,12,1.65,15253.0,United Kingdom,2026-03-26
530092,21479,WHITE SKULL HOT WATER BOTTLE ,4,3.75,15253.0,United Kingdom,2026-03-26
530092,21485,RETROSPOT HEART HOT WATER BOTTLE,6,4.95,15253.0,United Kingdom,2026-03-26
530092,21733,RED HANGING HEART T-LIGHT HOLDER,6,2.95,15253.0,United Kingdom,2026-03-26
530091,21928,JUMBO BAG SCANDINAVIAN PAISLEY,10,1.95,13975.0,United Kingdom,2026-03-26
530093,22697,GREEN REGENCY TEACUP AND SAUCER,6,2.95,16168.0,United Kingdom,2026-03-26
530094,85062,PEARL CRYSTAL PUMPKIN T-LIGHT HLDR,6,1.65,18127.0,United Kingdom,2026-03-26
530094,72815,3 WICK CHRISTMAS BRIAR CANDLE ,2,3.75,18127.0,United Kingdom,2026-03-26
530094,71477,COLOUR GLASS. STAR T-LIGHT HOLDER,1,3.25,18127.0,United Kingdom,2026-03-26
530094,72802C,VANILLA SCENT CANDLE JEWELLED BOX,1,4.25,18127.0,United Kingdom,2026-03-26
530094,72802A,ROSE SCENT CANDLE IN JEWELLED BOX,2,4.25,18127.0,United Kingdom,2026-03-26
530094,22219,LOVEBIRD HANGING DECORATION WHITE ,3,0.85,18127.0,United Kingdom,2026-03-26
530094,22457,NATURAL SLATE HEART CHALKBOARD ,4,2.95,18127.0,United Kingdom,2026-03-26
530094,22456,NATURAL SLATE CHALKBOARD LARGE ,1,4.95,18127.0,United Kingdom,2026-03-26
530094,22470,HEART OF WICKER LARGE,2,2.95,18127.0,United Kingdom,2026-03-26
530094,72814,SET OF 3 CHRISTMAS BRIAR CANDLES,1,3.75,18127.0,United Kingdom,2026-03-26
530094,21730,GLASS STAR FROSTED T-LIGHT HOLDER,1,4.95,18127.0,United Kingdom,2026-03-26
530094,72807C,SET/3 VANILLA SCENTED CANDLE IN BOX,1,4.25,18127.0,United Kingdom,2026-03-26
530094,85123A,WHITE HANGING HEART T-LIGHT HOLDER,6,2.95,18127.0,United Kingdom,2026-03-26
530094,72802B,OCEAN SCENT CANDLE IN JEWELLED BOX,1,4.25,18127.0,United Kingdom,2026-03-26
530094,72814,SET OF 3 CHRISTMAS BRIAR CANDLES,1,3.75,18127.0,United Kingdom,2026-03-26
530094,85103,SILVER T-LIGHT SETTING,1,6.75,18127.0,United Kingdom,2026-03-26
530094,22295,HEART FILIGREE DOVE LARGE,4,1.65,18127.0,United Kingdom,2026-03-26
530094,21812,GARLAND WITH HEARTS AND BELLS,3,4.95,18127.0,United Kingdom,2026-03-26
530094,22296,HEART IVORY TRELLIS LARGE,5,1.65,18127.0,United Kingdom,2026-03-26
530094,22167,"WALL MIRROR , DIAMANTE OVAL SHAPE",12,3.95,18127.0,United Kingdom,2026-03-26
530094,22796,PHOTO FRAME 3 CLASSIC HANGING,2,9.95,18127.0,United Kingdom,2026-03-26
530094,21733,RED HANGING HEART T-LIGHT HOLDER,4,2.95,18127.0,United Kingdom,2026-03-26
530103,21787,RAIN PONCHO RETROSPOT,1,0.85,17190.0,United Kingdom,2026-03-26
530103,22752,SET 7 BABUSHKA NESTING BOXES,1,8.5,17190.0,United Kingdom,2026-03-26
530103,10123C,HEARTS WRAPPING TAPE ,2,0.65,17190.0,United Kingdom,2026-03-26
530103,21786,POLKADOT RAIN HAT ,1,0.42,17190.0,United Kingdom,2026-03-26
530103,22906,12 MESSAGE CARDS WITH ENVELOPES,4,1.65,17190.0,United Kingdom,2026-03-26
530103,22727,ALARM CLOCK BAKELIKE RED ,1,3.75,17190.0,United Kingdom,2026-03-26
530103,85184C,S/4 VALENTINE DECOUPAGE HEART BOX,4,2.95,17190.0,United Kingdom,2026-03-26
530103,22904,CALENDAR PAPER CUT DESIGN,3,2.95,17190.0,United Kingdom,2026-03-26
530103,22696,WICKER WREATH LARGE,1,1.95,17190.0,United Kingdom,2026-03-26
530103,21786,POLKADOT RAIN HAT ,1,0.42,17190.0,United Kingdom,2026-03-26
530103,22910,PAPER CHAIN KIT VINTAGE CHRISTMAS,4,2.95,17190.0,United Kingdom,2026-03-26
530103,22628,PICNIC BOXES SET OF 3 RETROSPOT ,1,4.95,17190.0,United Kingdom,2026-03-26
530103,22909,SET OF 20 VINTAGE CHRISTMAS NAPKINS,1,0.85,17190.0,United Kingdom,2026-03-26
530103,22807,SET OF 6 T-LIGHTS TOADSTOOLS,2,2.95,17190.0,United Kingdom,2026-03-26
530103,22767,TRIPLE PHOTO FRAME CORNICE ,2,9.95,17190.0,United Kingdom,2026-03-26
530103,22768,FAMILY PHOTO FRAME CORNICE,1,9.95,17190.0,United Kingdom,2026-03-26
530103,22095,LADS ONLY TISSUE BOX,1,1.25,17190.0,United Kingdom,2026-03-26
530103,22501,PICNIC BASKET WICKER LARGE,1,9.95,17190.0,United Kingdom,2026-03-26
530103,22796,PHOTO FRAME 3 CLASSIC HANGING,1,9.95,17190.0,United Kingdom,2026-03-26
530103,22243,5 HOOK HANGER RED MAGIC TOADSTOOL,7,1.65,17190.0,United Kingdom,2026-03-26
530103,20718,RED RETROSPOT SHOPPER BAG,1,1.25,17190.0,United Kingdom,2026-03-26
530115,20712,JUMBO BAG WOODLAND ANIMALS,1,1.95,17190.0,United Kingdom,2026-03-26
530115,21033,JUMBO BAG CHARLIE AND LOLA TOYS,1,2.95,17190.0,United Kingdom,2026-03-26
530115,16169K,WRAP FOLK ART,25,0.42,17190.0,United Kingdom,2026-03-26
530115,22941,CHRISTMAS LIGHTS 10 REINDEER,1,8.5,17190.0,United Kingdom,2026-03-26
530115,22807,SET OF 6 T-LIGHTS TOADSTOOLS,2,2.95,17190.0,United Kingdom,2026-03-26
530115,22479,DAISY GARDEN MARKER,1,1.25,17190.0,United Kingdom,2026-03-26
530115,22909,SET OF 20 VINTAGE CHRISTMAS NAPKINS,1,0.85,17190.0,United Kingdom,2026-03-26
530115,22477,WATERING CAN GARDEN MARKER,1,1.25,17190.0,United Kingdom,2026-03-26
530115,22478,BIRDHOUSE GARDEN MARKER ,1,1.25,17190.0,United Kingdom,2026-03-26
530115,M,Manual,2,0.5,17190.0,United Kingdom,2026-03-26
530115,22910,PAPER CHAIN KIT VINTAGE CHRISTMAS,1,2.95,17190.0,United Kingdom,2026-03-26
530115,M,Manual,2,0.42,17190.0,United Kingdom,2026-03-26
530115,21329,DINOSAURS  WRITING SET ,1,1.65,17190.0,United Kingdom,2026-03-26
530115,85035C,ROSE 3 WICK MORRIS BOX CANDLE,1,4.25,17190.0,United Kingdom,2026-03-26
530115,22382,LUNCH BAG SPACEBOY DESIGN ,1,1.65,17190.0,United Kingdom,2026-03-26
530115,21328,BALLOONS  WRITING SET ,1,1.65,17190.0,United Kingdom,2026-03-26
530115,21894,POTTING SHED SEED ENVELOPES,2,1.25,17190.0,United Kingdom,2026-03-26
530115,22619,SET OF 6 SOLDIER SKITTLES,1,3.75,17190.0,United Kingdom,2026-03-26
530115,85036A,GARDENIA 1 WICK MORRIS BOXED CANDLE,1,4.25,17190.0,United Kingdom,2026-03-26
530115,22630,DOLLY GIRL LUNCH BOX,1,1.95,17190.0,United Kingdom,2026-03-26
530115,20971,PINK BLUE FELT CRAFT TRINKET BOX,1,1.25,17190.0,United Kingdom,2026-03-26
530115,21739,COSY SLIPPER SHOES SMALL GREEN,2,2.95,17190.0,United Kingdom,2026-03-26
530115,21992,VINTAGE PAISLEY STATIONERY SET,1,2.95,17190.0,United Kingdom,2026-03-26
530115,21993,FLORAL FOLK STATIONERY SET,1,2.95,17190.0,United Kingdom,2026-03-26
530115,85066,CREAM SWEETHEART MINI CHEST,1,12.75,17190.0,United Kingdom,2026-03-26
530115,84199,GLOW IN DARK DOLPHINS,1,0.21,17190.0,United Kingdom,2026-03-26
530115,21672,WHITE SPOT RED CERAMIC DRAWER KNOB,12,1.25,17190.0,United Kingdom,2026-03-26
530115,22243,5 HOOK HANGER RED MAGIC TOADSTOOL,4,1.65,17190.0,United Kingdom,2026-03-26
530115,21121,SET/10 RED POLKADOT PARTY CANDLES,1,1.25,17190.0,United Kingdom,2026-03-26
530115,21537,RED RETROSPOT PUDDING BOWL,1,4.25,17190.0,United Kingdom,2026-03-26
530115,22628,PICNIC BOXES SET OF 3 RETROSPOT ,1,4.95,17190.0,United Kingdom,2026-03-26
530115,22743,MAKE YOUR OWN FLOWERPOWER CARD KIT,1,2.95,17190.0,United Kingdom,2026-03-26
530115,22968,ROSE COTTAGE KEEPSAKE BOX ,1,9.95,17190.0,United Kingdom,2026-03-26
530115,22696,WICKER WREATH LARGE,1,1.95,17190.0,United Kingdom,2026-03-26
530115,85067,CREAM SWEETHEART WALL CABINET,1,18.95,17190.0,United Kingdom,2026-03-26
530115,22505,MEMO BOARD COTTAGE DESIGN,1,4.95,17190.0,United Kingdom,2026-03-26
530115,22379,RECYCLING BAG RETROSPOT ,1,2.1,17190.0,United Kingdom,2026-03-26
530115,21902,"KEY FOB , FRONT  DOOR ",2,0.65,17190.0,United Kingdom,2026-03-26
530115,22796,PHOTO FRAME 3 CLASSIC HANGING,1,9.95,17190.0,United Kingdom,2026-03-26
530115,21981,PACK OF 12 WOODLAND TISSUES ,1,0.29,17190.0,United Kingdom,2026-03-26
530115,21210,SET OF 72 RETROSPOT PAPER  DOILIES,1,1.45,17190.0,United Kingdom,2026-03-26
530115,84925F,PSYCHEDELIC WALL THERMOMETER,1,2.55,17190.0,United Kingdom,2026-03-26
530115,22242,5 HOOK HANGER MAGIC TOADSTOOL,5,1.65,17190.0,United Kingdom,2026-03-26
530115,21895,POTTING SHED SOW 'N' GROW SET,1,4.25,17190.0,United Kingdom,2026-03-26
530115,20754,RETROSPOT RED WASHING UP GLOVES,1,2.1,17190.0,United Kingdom,2026-03-26
530115,21626,VINTAGE UNION JACK PENNANT,1,1.95,17190.0,United Kingdom,2026-03-26
530115,21539,RED RETROSPOT BUTTER DISH,1,4.95,17190.0,United Kingdom,2026-03-26
530115,20914,SET/5 RED RETROSPOT LID GLASS BOWLS,2,2.95,17190.0,United Kingdom,2026-03-26
530115,22411,JUMBO SHOPPER VINTAGE RED PAISLEY,1,1.95,17190.0,United Kingdom,2026-03-26
530115,21787,RAIN PONCHO RETROSPOT,1,0.85,17190.0,United Kingdom,2026-03-26
530115,22629,SPACEBOY LUNCH BOX ,1,1.95,17190.0,United Kingdom,2026-03-26
530115,20711,JUMBO BAG TOYS ,1,1.95,17190.0,United Kingdom,2026-03-26
530115,21836,GINGHAM OVEN GLOVE RED HEART ,1,3.75,17190.0,United Kingdom,2026-03-26
530116,84247E,,141,0.0,,United Kingdom,2026-03-26
530117,72803B,,3,0.0,,United Kingdom,2026-03-26
530118,72801G,,-16,0.0,,United Kingdom,2026-03-26
530119,72780,,-20,0.0,,United Kingdom,2026-03-26
530120,22666,RECIPE BOX PANTRY YELLOW DESIGN,6,2.95,13883.0,United Kingdom,2026-03-26
530120,22776,SWEETHEART CAKESTAND 3 TIER,2,9.95,13883.0,United Kingdom,2026-03-26
530120,84380,SET OF 3 BUTTERFLY COOKIE CUTTERS,12,1.25,13883.0,United Kingdom,2026-03-26
530120,84378,SET OF 3 HEART COOKIE CUTTERS,12,1.25,13883.0,United Kingdom,2026-03-26
530120,22667,RECIPE BOX RETROSPOT ,6,2.95,13883.0,United Kingdom,2026-03-26
530120,22838,3 TIER CAKE TIN RED AND CREAM,2,14.95,13883.0,United Kingdom,2026-03-26
530120,22840,ROUND CAKE TIN VINTAGE RED,2,7.95,13883.0,United Kingdom,2026-03-26
530120,22842,BISCUIT TIN VINTAGE RED,2,6.75,13883.0,United Kingdom,2026-03-26
530120,22846,BREAD BIN DINER STYLE RED ,2,16.95,13883.0,United Kingdom,2026-03-26
530120,22907,PACK OF 20 NAPKINS PANTRY DESIGN,12,0.85,13883.0,United Kingdom,2026-03-26
530121,22950,,3,0.0,,United Kingdom,2026-03-26
530122,84997C,BLUE 3 PIECE POLKADOT CUTLERY SET,6,3.75,12492.0,Germany,2026-03-26
530122,85232B,SET OF 3 BABUSHKA STACKING TINS,3,4.95,12492.0,Germany,2026-03-26
530122,20973,12 PENCIL SMALL TUBE WOODLAND,24,0.65,12492.0,Germany,2026-03-26
530122,22551,PLASTERS IN TIN SPACEBOY,12,1.65,12492.0,Germany,2026-03-26
530122,22553,PLASTERS IN TIN SKULLS,12,1.65,12492.0,Germany,2026-03-26
530122,22556,PLASTERS IN TIN CIRCUS PARADE ,12,1.65,12492.0,Germany,2026-03-26
530122,22467,GUMBALL COAT RACK,12,2.55,12492.0,Germany,2026-03-26
530122,21668,RED STRIPE CERAMIC DRAWER KNOB,12,1.25,12492.0,Germany,2026-03-26
530122,21670,BLUE SPOT CERAMIC DRAWER KNOB,12,1.25,12492.0,Germany,2026-03-26
530122,21669,BLUE STRIPE CERAMIC DRAWER KNOB,12,1.25,12492.0,Germany,2026-03-26
530122,22242,5 HOOK HANGER MAGIC TOADSTOOL,12,1.65,12492.0,Germany,2026-03-26
530122,22326,ROUND SNACK BOXES SET OF4 WOODLAND ,6,2.95,12492.0,Germany,2026-03-26
530122,21671,RED SPOT CERAMIC DRAWER KNOB,12,1.25,12492.0,Germany,2026-03-26
530122,POST,POSTAGE,4,18.0,12492.0,Germany,2026-03-26
530122,84997B,RED 3 PIECE RETROSPOT CUTLERY SET,6,3.75,12492.0,Germany,2026-03-26
530122,21975,PACK OF 60 DINOSAUR CAKE CASES,24,0.55,12492.0,Germany,2026-03-26
530122,22180,RETROSPOT LAMP,3,9.95,12492.0,Germany,2026-03-26
