Invoice,StockCode,Description,Quantity,Price,Customer ID,Country,InvoiceDate
520685,21993,FLORAL FOLK STATIONERY SET,1,5.91,,United Kingdom,2026-01-30
520685,22059,CERAMIC STRWBERRY DESIGN MUG,1,3.36,,United Kingdom,2026-01-30
520685,22061,LARGE CAKE STAND  HANGING STRAWBERY,1,21.23,,United Kingdom,2026-01-30
520685,22087,PAPER BUNTING WHITE LACE,6,5.91,,United Kingdom,2026-01-30
520685,22090,PAPER BUNTING RETRO SPOTS,2,5.91,,United Kingdom,2026-01-30
520685,22114,HOT WATER BOTTLE TEA AND SYMPATHY,2,8.47,,United Kingdom,2026-01-30
520685,22135,LADLE LOVE HEART PINK,1,0.85,,United Kingdom,2026-01-30
520685,22184,CAKE STAND VICTORIAN FILIGREE LARGE,1,16.98,,United Kingdom,2026-01-30
520685,22188,BLACK HEART CARD HOLDER,2,8.47,,United Kingdom,2026-01-30
520685,22198,LARGE POPCORN HOLDER ,1,3.36,,United Kingdom,2026-01-30
520685,22218,CAKE STAND LACE WHITE,2,8.47,,United Kingdom,2026-01-30
520685,22219,LOVEBIRD HANGING DECORATION WHITE ,9,1.66,,United Kingdom,2026-01-30
520685,22221,CAKE STAND LOVEBIRD 2 TIER PINK,1,20.38,,United Kingdom,2026-01-30
520685,22227,"DECORATION, HANGING HEART+MIRROR ",2,1.28,,United Kingdom,2026-01-30
520685,22310,IVORY KNITTED MUG COSY ,7,3.36,,United Kingdom,2026-01-30
520685,22318,FIVE HEART HANGING DECORATION,1,5.91,,United Kingdom,2026-01-30
520685,21955,DOORMAT UNION JACK GUNS AND ROSES,1,14.43,,United Kingdom,2026-01-30
520685,21945,STRAWBERRIES  DESIGN FLANNEL ,1,1.66,,United Kingdom,2026-01-30
520685,22084,PAPER CHAIN KIT EMPIRE,1,5.91,,United Kingdom,2026-01-30
520685,21934,SKULL SHOULDER BAG,2,3.36,,United Kingdom,2026-01-30
520685,21715,GIRLS VINTAGE TIN SEASIDE BUCKET,1,5.06,,United Kingdom,2026-01-30
520685,21716,BOYS VINTAGE TIN SEASIDE BUCKET,2,5.06,,United Kingdom,2026-01-30
520685,21738,COSY SLIPPER SHOES SMALL  RED ,3,5.91,,United Kingdom,2026-01-30
520685,21935,SUKI  SHOULDER BAG,1,3.36,,United Kingdom,2026-01-30
520685,21773,DECORATIVE ROSE BATHROOM BOTTLE,1,2.51,,United Kingdom,2026-01-30
520685,21774,DECORATIVE CATS BATHROOM BOTTLE,1,2.51,,United Kingdom,2026-01-30
520685,21777,RECIPE BOX WITH METAL HEART,1,16.98,,United Kingdom,2026-01-30
520685,21846,PINK DIAMANTE PEN IN GIFT BOX,1,4.21,,United Kingdom,2026-01-30
520685,21847,GREEN  DIAMANTE PEN IN GIFT BOX,1,4.21,,United Kingdom,2026-01-30
520685,21754,HOME BUILDING BLOCK WORD,1,5.91,,United Kingdom,2026-01-30
520685,21850,BLUE  DIAMANTE PEN IN GIFT BOX,2,4.21,,United Kingdom,2026-01-30
520685,21849,SILVER DIAMANTE PEN IN GIFT BOX,4,4.21,,United Kingdom,2026-01-30
520685,21931,JUMBO STORAGE BAG SUKI,1,4.21,,United Kingdom,2026-01-30
520685,21930,JUMBO STORAGE BAG SKULLS,1,4.21,,United Kingdom,2026-01-30
520685,21929,JUMBO BAG PINK VINTAGE PAISLEY,3,4.21,,United Kingdom,2026-01-30
520685,21928,JUMBO BAG SCANDINAVIAN PAISLEY,1,4.21,,United Kingdom,2026-01-30
520685,21672,WHITE SPOT RED CERAMIC DRAWER KNOB,1,2.51,,United Kingdom,2026-01-30
520685,21878,PACK OF 6 SANDCASTLE FLAGS ASSORTED,1,1.66,,United Kingdom,2026-01-30
520685,21851,LILAC DIAMANTE PEN IN GIFT BOX,3,4.21,,United Kingdom,2026-01-30
520685,21890,S/6 WOODEN SKITTLES IN COTTON BAG,12,5.91,,United Kingdom,2026-01-30
520686,48189,DOORMAT FRIENDSHIP ,2,7.49,17351.0,United Kingdom,2026-01-30
520689,21078,SET/20 STRAWBERRY PAPER NAPKINS ,1,0.85,,United Kingdom,2026-01-30
520689,22443,GROW YOUR OWN HERBS SET OF 3,1,7.95,,United Kingdom,2026-01-30
520689,21082,SET/20 FRUIT SALAD PAPER NAPKINS ,1,0.85,,United Kingdom,2026-01-30
520689,22628,PICNIC BOXES SET OF 3 RETROSPOT ,1,4.95,,United Kingdom,2026-01-30
520689,22480,RED TEA TOWEL CLASSIC DESIGN,1,1.25,,United Kingdom,2026-01-30
520689,22482,BLUE TEA TOWEL CLASSIC DESIGN,1,1.25,,United Kingdom,2026-01-30
520689,22481,BLACK TEA TOWEL CLASSIC DESIGN,1,1.25,,United Kingdom,2026-01-30
