Invoice,StockCode,Description,Quantity,Price,Customer ID,Country,InvoiceDate
536044,22862,LOVE HEART NAPKIN BOX ,4,4.25,13655.0,United Kingdom,2026-04-20
536044,37449,CERAMIC CAKE STAND + HANGING CAKES,6,9.95,13655.0,United Kingdom,2026-04-20
536044,47570B,TEA TIME TABLE CLOTH,2,10.65,13655.0,United Kingdom,2026-04-20
536044,37450,CERAMIC CAKE BOWL + HANGING CAKES,6,2.95,13655.0,United Kingdom,2026-04-20
536044,22072,RED RETROSPOT TEA CUP AND SAUCER ,4,3.75,13655.0,United Kingdom,2026-04-20
536044,22301,COFFEE MUG CAT + BIRD DESIGN,6,2.55,13655.0,United Kingdom,2026-04-20
536044,21472,LADYBIRD + BEE RAFFIA FOOD COVER,6,3.75,13655.0,United Kingdom,2026-04-20
536044,37330,BIG POLKADOT MUG,12,1.95,13655.0,United Kingdom,2026-04-20
536044,21791,VINTAGE HEADS AND TAILS CARD GAME ,12,1.25,13655.0,United Kingdom,2026-04-20
536044,20996,JAZZ HEARTS ADDRESS BOOK,24,0.42,13655.0,United Kingdom,2026-04-20
536044,22968,ROSE COTTAGE KEEPSAKE BOX ,4,9.95,13655.0,United Kingdom,2026-04-20
536044,22456,NATURAL SLATE CHALKBOARD LARGE ,6,4.95,13655.0,United Kingdom,2026-04-20
536045,82494L,WOODEN FRAME ANTIQUE WHITE ,24,2.55,16525.0,United Kingdom,2026-04-20
536045,85049E,SCANDINAVIAN REDS RIBBONS,24,1.25,16525.0,United Kingdom,2026-04-20
536045,21260,FIRST AID TIN,48,2.75,16525.0,United Kingdom,2026-04-20
536045,21916,SET 12 RETRO WHITE CHALK STICKS,24,0.42,16525.0,United Kingdom,2026-04-20
536045,22169,FAMILY ALBUM WHITE PICTURE FRAME,16,7.65,16525.0,United Kingdom,2026-04-20
536045,22494,EMERGENCY FIRST AID TIN ,12,1.25,16525.0,United Kingdom,2026-04-20
536046,22131,FOOD CONTAINER SET 3 LOVE HEART ,6,1.95,13985.0,United Kingdom,2026-04-20
536046,22384,LUNCH BAG PINK POLKADOT,10,1.65,13985.0,United Kingdom,2026-04-20
536046,82494L,WOODEN FRAME ANTIQUE WHITE ,12,2.95,13985.0,United Kingdom,2026-04-20
536046,20728,LUNCH BAG CARS BLUE,10,1.65,13985.0,United Kingdom,2026-04-20
536046,21558,SKULL LUNCH BOX WITH CUTLERY ,12,2.55,13985.0,United Kingdom,2026-04-20
536046,20725,LUNCH BAG RED RETROSPOT,20,1.65,13985.0,United Kingdom,2026-04-20
536046,22663,JUMBO BAG DOLLY GIRL DESIGN,10,1.95,13985.0,United Kingdom,2026-04-20
536046,22381,TOY TIDY PINK POLKADOT,5,2.1,13985.0,United Kingdom,2026-04-20
536046,22380,TOY TIDY SPACEBOY  ,10,2.1,13985.0,United Kingdom,2026-04-20
536046,22382,LUNCH BAG SPACEBOY DESIGN ,20,1.65,13985.0,United Kingdom,2026-04-20
536046,22327,ROUND SNACK BOXES SET OF 4 SKULLS,12,2.95,13985.0,United Kingdom,2026-04-20
536046,21559,STRAWBERRY LUNCH BOX WITH CUTLERY,12,2.55,13985.0,United Kingdom,2026-04-20
536046,22379,RECYCLING BAG RETROSPOT ,5,2.1,13985.0,United Kingdom,2026-04-20
536047,22504,CABIN BAG VINTAGE RETROSPOT,12,24.95,13029.0,United Kingdom,2026-04-20
536047,21481,FAWN BLUE HOT WATER BOTTLE,6,2.95,13029.0,United Kingdom,2026-04-20
536047,21479,WHITE SKULL HOT WATER BOTTLE ,4,3.75,13029.0,United Kingdom,2026-04-20
536048,22943,CHRISTMAS LIGHTS 10 VINTAGE BAUBLES,1,4.95,,United Kingdom,2026-04-20
536049,22090,PAPER BUNTING RETROSPOT,12,2.95,15382.0,United Kingdom,2026-04-20
536049,22174,PHOTO CUBE,24,1.65,15382.0,United Kingdom,2026-04-20
536049,22629,SPACEBOY LUNCH BOX ,24,1.95,15382.0,United Kingdom,2026-04-20
536049,22631,CIRCUS PARADE LUNCH BOX ,12,1.95,15382.0,United Kingdom,2026-04-20
536049,20914,SET/5 RED RETROSPOT LID GLASS BOWLS,12,2.95,15382.0,United Kingdom,2026-04-20
536049,22952,60 CAKE CASES VINTAGE CHRISTMAS,24,0.55,15382.0,United Kingdom,2026-04-20
536049,22752,SET 7 BABUSHKA NESTING BOXES,10,8.5,15382.0,United Kingdom,2026-04-20
536049,84559A,3D SHEET OF DOG STICKERS,12,0.85,15382.0,United Kingdom,2026-04-20
536049,22087,PAPER BUNTING WHITE LACE,12,2.95,15382.0,United Kingdom,2026-04-20
536049,79321,CHILLI LIGHTS,16,4.95,15382.0,United Kingdom,2026-04-20
536049,21488,RED WHITE SCARF  HOT WATER BOTTLE,8,3.95,15382.0,United Kingdom,2026-04-20
536049,84559B,3D SHEET OF CAT STICKERS,24,0.85,15382.0,United Kingdom,2026-04-20
536049,22431,WATERING CAN BLUE ELEPHANT,6,1.95,15382.0,United Kingdom,2026-04-20
536049,79067,CORONA MEXICAN TRAY,4,3.75,15382.0,United Kingdom,2026-04-20
536049,84347,ROTATING SILVER ANGELS T-LIGHT HLDR,12,2.55,15382.0,United Kingdom,2026-04-20
536049,22328,ROUND SNACK BOXES SET OF 4 FRUITS ,12,2.95,15382.0,United Kingdom,2026-04-20
536049,22327,ROUND SNACK BOXES SET OF 4 SKULLS,6,2.95,15382.0,United Kingdom,2026-04-20
536049,22326,ROUND SNACK BOXES SET OF4 WOODLAND ,18,2.95,15382.0,United Kingdom,2026-04-20
536049,22199,FRYING PAN RED RETROSPOT,4,4.25,15382.0,United Kingdom,2026-04-20
536049,21977,PACK OF 60 PINK PAISLEY CAKE CASES,24,0.55,15382.0,United Kingdom,2026-04-20
536049,21528,DAIRY MAID TRADITIONAL TEAPOT ,6,6.95,15382.0,United Kingdom,2026-04-20
536049,21527,RED RETROSPOT TRADITIONAL TEAPOT ,6,7.95,15382.0,United Kingdom,2026-04-20
536049,21213,PACK OF 72 SKULL CAKE CASES,24,0.55,15382.0,United Kingdom,2026-04-20
536049,22321,BIRD DECORATION RED RETROSPOT,24,0.85,15382.0,United Kingdom,2026-04-20
536049,21731,RED TOADSTOOL LED NIGHT LIGHT,12,1.65,15382.0,United Kingdom,2026-04-20
536049,22492,MINI PAINT SET VINTAGE ,36,0.65,15382.0,United Kingdom,2026-04-20
536049,22467,GUMBALL COAT RACK,6,2.55,15382.0,United Kingdom,2026-04-20
536049,22745,POPPY'S PLAYHOUSE BEDROOM ,6,2.1,15382.0,United Kingdom,2026-04-20
536049,22748,POPPY'S PLAYHOUSE KITCHEN,12,2.1,15382.0,United Kingdom,2026-04-20
536049,22751,FELTCRAFT PRINCESS OLIVIA DOLL,8,3.75,15382.0,United Kingdom,2026-04-20
536049,22652,TRAVEL SEWING KIT,10,1.65,15382.0,United Kingdom,2026-04-20
536049,20972,PINK CREAM FELT CRAFT TRINKET BOX ,12,1.25,15382.0,United Kingdom,2026-04-20
536049,10002,INFLATABLE POLITICAL GLOBE ,12,0.85,15382.0,United Kingdom,2026-04-20
536049,22616,PACK OF 12 LONDON TISSUES ,24,0.29,15382.0,United Kingdom,2026-04-20
536049,21982,PACK OF 12 SUKI TISSUES ,24,0.29,15382.0,United Kingdom,2026-04-20
536049,85014A,BLACK/BLUE POLKADOT UMBRELLA,6,5.95,15382.0,United Kingdom,2026-04-20
536049,15056BL,EDWARDIAN PARASOL BLACK,6,5.95,15382.0,United Kingdom,2026-04-20
536049,21929,JUMBO BAG PINK VINTAGE PAISLEY,10,1.95,15382.0,United Kingdom,2026-04-20
536049,22355,CHARLOTTE BAG SUKI DESIGN,20,0.85,15382.0,United Kingdom,2026-04-20
536049,22466,FAIRY TALE COTTAGE NIGHTLIGHT,12,1.95,15382.0,United Kingdom,2026-04-20
536049,20724,RED RETROSPOT CHARLOTTE BAG,10,0.85,15382.0,United Kingdom,2026-04-20
536049,21931,JUMBO STORAGE BAG SUKI,20,1.95,15382.0,United Kingdom,2026-04-20
536049,22530,MAGIC DRAWING SLATE DOLLY GIRL ,24,0.42,15382.0,United Kingdom,2026-04-20
536049,22834,HAND WARMER BABUSHKA DESIGN,24,2.1,15382.0,United Kingdom,2026-04-20
536049,22865,HAND WARMER OWL DESIGN,24,2.1,15382.0,United Kingdom,2026-04-20
536049,22866,HAND WARMER SCOTTY DOG DESIGN,24,2.1,15382.0,United Kingdom,2026-04-20
536049,22534,MAGIC DRAWING SLATE SPACEBOY ,24,0.42,15382.0,United Kingdom,2026-04-20
536049,85099B,JUMBO BAG RED RETROSPOT,10,1.95,15382.0,United Kingdom,2026-04-20
536049,85099F,JUMBO BAG STRAWBERRY,10,1.95,15382.0,United Kingdom,2026-04-20
536049,20712,JUMBO BAG WOODLAND ANIMALS,10,1.95,15382.0,United Kingdom,2026-04-20
536049,20723,STRAWBERRY CHARLOTTE BAG,10,0.85,15382.0,United Kingdom,2026-04-20
536049,84077,WORLD WAR 2 GLIDERS ASSTD DESIGNS,48,0.29,15382.0,United Kingdom,2026-04-20
536050,84946,ANTIQUE SILVER TEA GLASS ETCHED,12,1.25,16500.0,United Kingdom,2026-04-20
536051,22975,SPACEBOY CHILDRENS EGG CUP,12,1.25,15382.0,United Kingdom,2026-04-20
536051,22974,CHILDRENS DOLLY GIRL MUG,12,1.65,15382.0,United Kingdom,2026-04-20
536051,22973,CHILDRENS CIRCUS PARADE MUG,12,1.65,15382.0,United Kingdom,2026-04-20
536050,22791,T-LIGHT GLASS FLUTED ANTIQUE,12,1.25,16500.0,United Kingdom,2026-04-20
536050,22086,PAPER CHAIN KIT 50'S CHRISTMAS ,30,2.95,16500.0,United Kingdom,2026-04-20
536050,22792,FLUTED ANTIQUE CANDLE HOLDER,12,0.85,16500.0,United Kingdom,2026-04-20
536050,22952,60 CAKE CASES VINTAGE CHRISTMAS,24,0.55,16500.0,United Kingdom,2026-04-20
536052,21481,FAWN BLUE HOT WATER BOTTLE,12,2.95,13999.0,United Kingdom,2026-04-20
536052,22375,AIRLINE BAG VINTAGE JET SET BROWN,4,4.25,13999.0,United Kingdom,2026-04-20
536052,22623,BOX OF VINTAGE JIGSAW BLOCKS ,3,4.95,13999.0,United Kingdom,2026-04-20
536052,85099B,JUMBO BAG RED RETROSPOT,10,1.95,13999.0,United Kingdom,2026-04-20
536052,84755,COLOUR GLASS T-LIGHT HOLDER HANGING,16,0.65,13999.0,United Kingdom,2026-04-20
536051,22977,DOLLY GIRL CHILDRENS EGG CUP,12,1.25,15382.0,United Kingdom,2026-04-20
536052,21485,RETROSPOT HEART HOT WATER BOTTLE,3,4.95,13999.0,United Kingdom,2026-04-20
536052,22910,PAPER CHAIN KIT VINTAGE CHRISTMAS,6,2.95,13999.0,United Kingdom,2026-04-20
536052,22086,PAPER CHAIN KIT 50'S CHRISTMAS ,6,2.95,13999.0,United Kingdom,2026-04-20
536052,21791,VINTAGE HEADS AND TAILS CARD GAME ,24,1.25,13999.0,United Kingdom,2026-04-20
536050,84978,HANGING HEART JAR T-LIGHT HOLDER,24,1.25,16500.0,United Kingdom,2026-04-20
536051,22976,CIRCUS PARADE CHILDRENS EGG CUP ,12,1.25,15382.0,United Kingdom,2026-04-20
536051,22972,CHILDRENS SPACEBOY MUG,12,1.65,15382.0,United Kingdom,2026-04-20
536051,22558,CLOTHES PEGS RETROSPOT PACK 24 ,12,1.49,15382.0,United Kingdom,2026-04-20
536051,22988,SOLDIERS EGG CUP ,12,1.25,15382.0,United Kingdom,2026-04-20
536052,21790,VINTAGE SNAP CARDS,12,0.85,13999.0,United Kingdom,2026-04-20
536052,22560,TRADITIONAL MODELLING CLAY,24,1.25,13999.0,United Kingdom,2026-04-20
536052,22943,CHRISTMAS LIGHTS 10 VINTAGE BAUBLES,3,4.95,13999.0,United Kingdom,2026-04-20
536052,22840,ROUND CAKE TIN VINTAGE RED,2,7.95,13999.0,United Kingdom,2026-04-20
536052,22841,ROUND CAKE TIN VINTAGE GREEN,2,7.95,13999.0,United Kingdom,2026-04-20
536052,22111,SCOTTIE DOG HOT WATER BOTTLE,6,4.95,13999.0,United Kingdom,2026-04-20
536051,15036,ASSORTED COLOURS SILK FAN,12,0.75,15382.0,United Kingdom,2026-04-20
536051,22690,DOORMAT HOME SWEET HOME BLUE ,2,7.95,15382.0,United Kingdom,2026-04-20
536052,22652,TRAVEL SEWING KIT,10,1.65,13999.0,United Kingdom,2026-04-20
536051,22942,CHRISTMAS LIGHTS 10 SANTAS ,4,8.5,15382.0,United Kingdom,2026-04-20
536051,22943,CHRISTMAS LIGHTS 10 VINTAGE BAUBLES,6,4.95,15382.0,United Kingdom,2026-04-20
536051,22953,BIRTHDAY PARTY CORDON BARRIER TAPE,12,1.25,15382.0,United Kingdom,2026-04-20
536051,22954,HEN PARTY CORDON BARRIER TAPE,12,1.25,15382.0,United Kingdom,2026-04-20
536051,22837,HOT WATER BOTTLE BABUSHKA LARGE,8,4.65,15382.0,United Kingdom,2026-04-20
536051,22633,HAND WARMER UNION JACK,12,2.1,15382.0,United Kingdom,2026-04-20
536051,22966,GINGERBREAD MAN COOKIE CUTTER,12,1.25,15382.0,United Kingdom,2026-04-20
536051,22965,3 TRADITIONAL COOKIE CUTTERS  SET,6,2.1,15382.0,United Kingdom,2026-04-20
536051,22941,CHRISTMAS LIGHTS 10 REINDEER,4,8.5,15382.0,United Kingdom,2026-04-20
536053,22750,FELTCRAFT PRINCESS LOLA DOLL,4,3.75,15392.0,United Kingdom,2026-04-20
536053,22585,PACK OF 6 BIRDY GIFT TAGS,12,1.25,15392.0,United Kingdom,2026-04-20
536053,22035,VINTAGE CARAVAN GREETING CARD ,12,0.42,15392.0,United Kingdom,2026-04-20
536053,22984,CARD GINGHAM ROSE ,12,0.42,15392.0,United Kingdom,2026-04-20
536053,85232B,SET OF 3 BABUSHKA STACKING TINS,3,4.95,15392.0,United Kingdom,2026-04-20
536053,22569,FELTCRAFT CUSHION BUTTERFLY,24,3.39,15392.0,United Kingdom,2026-04-20
536053,22837,HOT WATER BOTTLE BABUSHKA ,4,4.65,15392.0,United Kingdom,2026-04-20
536053,22568,FELTCRAFT CUSHION OWL,24,3.39,15392.0,United Kingdom,2026-04-20
536053,20971,PINK BLUE FELT CRAFT TRINKET BOX,144,1.06,15392.0,United Kingdom,2026-04-20
536053,22454,MEASURING TAPE BABUSHKA RED,6,2.95,15392.0,United Kingdom,2026-04-20
536053,22968,ROSE COTTAGE KEEPSAKE BOX ,2,9.95,15392.0,United Kingdom,2026-04-20
536053,22570,FELTCRAFT CUSHION RABBIT,24,3.39,15392.0,United Kingdom,2026-04-20
536054,84029G,KNITTED UNION FLAG HOT WATER BOTTLE,24,3.39,17739.0,United Kingdom,2026-04-20
536054,84029E,RED WOOLLY HOTTIE WHITE HEART.,24,3.39,17739.0,United Kingdom,2026-04-20
536054,22366,DOORMAT AIRMAIL ,10,6.75,17739.0,United Kingdom,2026-04-20
536054,21870,I CAN ONLY PLEASE ONE PERSON MUG,12,1.25,17739.0,United Kingdom,2026-04-20
536054,21363,HOME SMALL WOOD LETTERS,12,4.95,17739.0,United Kingdom,2026-04-20
536054,21166,COOK WITH WINE METAL SIGN ,12,1.95,17739.0,United Kingdom,2026-04-20
536054,22114,HOT WATER BOTTLE TEA AND SYMPATHY,24,3.45,17739.0,United Kingdom,2026-04-20
536055,22380,TOY TIDY SPACEBOY  ,5,2.1,17631.0,United Kingdom,2026-04-20
536055,22726,ALARM CLOCK BAKELIKE GREEN,4,3.75,17631.0,United Kingdom,2026-04-20
536055,48194,DOORMAT HEARTS,2,7.95,17631.0,United Kingdom,2026-04-20
536055,22961,JAM MAKING SET PRINTED,12,1.45,17631.0,United Kingdom,2026-04-20
536055,22865,HAND WARMER OWL DESIGN,12,2.1,17631.0,United Kingdom,2026-04-20
536055,22835,HOT WATER BOTTLE I AM SO POORLY,4,4.65,17631.0,United Kingdom,2026-04-20
536055,22384,LUNCH BAG PINK POLKADOT,10,1.65,17631.0,United Kingdom,2026-04-20
536055,22781,GUMBALL MAGAZINE RACK,2,7.65,17631.0,United Kingdom,2026-04-20
536056,22514,CHILDS GARDEN SPADE BLUE,1,2.1,,United Kingdom,2026-04-20
536056,22515,CHILDS GARDEN SPADE PINK,1,2.1,,United Kingdom,2026-04-20
536057,22086,PAPER CHAIN KIT 50'S CHRISTMAS ,6,2.95,16817.0,United Kingdom,2026-04-20
536057,22130,PARTY CONE CHRISTMAS DECORATION ,12,0.85,16817.0,United Kingdom,2026-04-20
536057,22083,PAPER CHAIN KIT RETROSPOT,6,2.95,16817.0,United Kingdom,2026-04-20
536057,22251,BIRDHOUSE DECORATION MAGIC GARDEN,12,1.25,16817.0,United Kingdom,2026-04-20
536057,22269,EGG CUP NATURAL CHICKEN,8,1.25,16817.0,United Kingdom,2026-04-20
536057,22233,JIGSAW RABBIT AND BIRDHOUSE,12,1.65,16817.0,United Kingdom,2026-04-20
536057,22147,FELTCRAFT BUTTERFLY HEARTS,12,1.45,16817.0,United Kingdom,2026-04-20
536057,22149,FELTCRAFT 6 FLOWER FRIENDS,6,2.1,16817.0,United Kingdom,2026-04-20
536057,22835,HOT WATER BOTTLE I AM SO POORLY,4,4.65,16817.0,United Kingdom,2026-04-20
536057,22114,HOT WATER BOTTLE TEA AND SYMPATHY,4,3.95,16817.0,United Kingdom,2026-04-20
536057,22178,VICTORIAN GLASS HANGING T-LIGHT,12,1.25,16817.0,United Kingdom,2026-04-20
536057,22230,JIGSAW TREE WITH WATERING CAN,12,0.85,16817.0,United Kingdom,2026-04-20
536058,22312,OFFICE MUG WARMER POLKADOT,12,2.95,14414.0,United Kingdom,2026-04-20
536058,22311,OFFICE MUG WARMER BLACK+SILVER ,12,2.95,14414.0,United Kingdom,2026-04-20
536058,22802,FAUX FUR CHOCOLATE THROW,4,19.95,14414.0,United Kingdom,2026-04-20
536058,46775D,SUNSET COLOUR CHUNKY KNITTED THROW,4,16.95,14414.0,United Kingdom,2026-04-20
536058,84078A,SET/4 WHITE RETRO STORAGE CUBES ,1,39.95,14414.0,United Kingdom,2026-04-20
536058,21137,BLACK RECORD COVER FRAME,4,3.75,14414.0,United Kingdom,2026-04-20
536058,85048,15CM CHRISTMAS GLASS BALL 20 LIGHTS,4,7.95,14414.0,United Kingdom,2026-04-20
536058,22637,PIGGY BANK RETROSPOT ,12,2.55,14414.0,United Kingdom,2026-04-20
536058,21114,LAVENDER SCENTED FABRIC HEART,40,1.25,14414.0,United Kingdom,2026-04-20
536058,22633,HAND WARMER UNION JACK,24,2.1,14414.0,United Kingdom,2026-04-20
536058,22961,JAM MAKING SET PRINTED,24,1.45,14414.0,United Kingdom,2026-04-20
536058,21411,GINGHAM HEART  DOORSTOP RED,16,3.75,14414.0,United Kingdom,2026-04-20
536058,84876B,GREEN HEART COMPACT MIRROR,24,1.25,14414.0,United Kingdom,2026-04-20
536058,84877B,GREEN ROUND COMPACT MIRROR,24,1.25,14414.0,United Kingdom,2026-04-20
536058,84876D,BLUE HEART COMPACT MIRROR,24,1.25,14414.0,United Kingdom,2026-04-20
536058,71459,HANGING JAM JAR T-LIGHT HOLDER,24,0.85,14414.0,United Kingdom,2026-04-20
536058,22969,HOMEMADE JAM SCENTED CANDLES,48,1.45,14414.0,United Kingdom,2026-04-20
536058,22809,SET OF 6 T-LIGHTS SANTA,18,2.95,14414.0,United Kingdom,2026-04-20
536058,22810,SET OF 6 T-LIGHTS SNOWMEN,18,2.95,14414.0,United Kingdom,2026-04-20
536058,85038,6 CHOCOLATE LOVE HEART T-LIGHTS,12,2.1,14414.0,United Kingdom,2026-04-20
536058,21407,BROWN CHECK CAT DOORSTOP ,16,3.75,14414.0,United Kingdom,2026-04-20
536059,22730,ALARM CLOCK BAKELIKE IVORY,8,3.75,13767.0,United Kingdom,2026-04-20
536059,84879,ASSORTED COLOUR BIRD ORNAMENT,40,1.69,13767.0,United Kingdom,2026-04-20
536059,21135,VICTORIAN  METAL POSTCARD SPRING,40,1.69,13767.0,United Kingdom,2026-04-20
536059,22727,ALARM CLOCK BAKELIKE RED ,16,3.75,13767.0,United Kingdom,2026-04-20
536059,22729,ALARM CLOCK BAKELIKE ORANGE,8,3.75,13767.0,United Kingdom,2026-04-20
536059,21212,PACK OF 72 RETROSPOT CAKE CASES,24,0.55,13767.0,United Kingdom,2026-04-20
536059,22866,HAND WARMER SCOTTY DOG DESIGN,96,1.85,13767.0,United Kingdom,2026-04-20
536059,22726,ALARM CLOCK BAKELIKE GREEN,16,3.75,13767.0,United Kingdom,2026-04-20
536059,22867,HAND WARMER BIRD DESIGN,96,1.85,13767.0,United Kingdom,2026-04-20
536060,21829,DINOSAUR KEYRINGS ASSORTED,36,0.21,16122.0,United Kingdom,2026-04-20
536060,20972,PINK CREAM FELT CRAFT TRINKET BOX ,12,1.25,16122.0,United Kingdom,2026-04-20
536060,22149,FELTCRAFT 6 FLOWER FRIENDS,6,2.1,16122.0,United Kingdom,2026-04-20
536060,22150,3 STRIPEY MICE FELTCRAFT,6,1.95,16122.0,United Kingdom,2026-04-20
536060,22568,FELTCRAFT CUSHION OWL,4,3.75,16122.0,United Kingdom,2026-04-20
536060,22569,FELTCRAFT CUSHION BUTTERFLY,4,3.75,16122.0,United Kingdom,2026-04-20
536060,21703,BAG 125g SWIRLY MARBLES,12,0.42,16122.0,United Kingdom,2026-04-20
536060,21791,VINTAGE HEADS AND TAILS CARD GAME ,12,1.25,16122.0,United Kingdom,2026-04-20
536061,22768,FAMILY PHOTO FRAME CORNICE,2,9.95,13481.0,United Kingdom,2026-04-20
536061,22960,JAM MAKING SET WITH JARS,6,4.25,13481.0,United Kingdom,2026-04-20
536061,22966,GINGERBREAD MAN COOKIE CUTTER,12,1.25,13481.0,United Kingdom,2026-04-20
536061,22969,HOMEMADE JAM SCENTED CANDLES,12,1.45,13481.0,United Kingdom,2026-04-20
536061,22594,CHRISTMAS GINGHAM TREE,12,0.85,13481.0,United Kingdom,2026-04-20
536061,21481,FAWN BLUE HOT WATER BOTTLE,6,2.95,13481.0,United Kingdom,2026-04-20
536061,21484,CHICK GREY HOT WATER BOTTLE,8,3.45,13481.0,United Kingdom,2026-04-20
536061,21486,PINK HEART DOTS HOT WATER BOTTLE,4,3.75,13481.0,United Kingdom,2026-04-20
536061,21929,JUMBO BAG PINK VINTAGE PAISLEY,10,1.95,13481.0,United Kingdom,2026-04-20
536061,20972,PINK CREAM FELT CRAFT TRINKET BOX ,12,1.25,13481.0,United Kingdom,2026-04-20
536061,22595,CHRISTMAS GINGHAM HEART,12,0.85,13481.0,United Kingdom,2026-04-20
536061,22568,FELTCRAFT CUSHION OWL,8,3.75,13481.0,United Kingdom,2026-04-20
536061,22940,FELTCRAFT CHRISTMAS FAIRY,8,4.25,13481.0,United Kingdom,2026-04-20
536061,22750,FELTCRAFT PRINCESS LOLA DOLL,8,3.75,13481.0,United Kingdom,2026-04-20
536061,22749,FELTCRAFT PRINCESS CHARLOTTE DOLL,8,3.75,13481.0,United Kingdom,2026-04-20
536061,20702,PINK PADDED MOBILE,3,4.25,13481.0,United Kingdom,2026-04-20
536061,48185,DOORMAT FAIRY CAKE,2,7.95,13481.0,United Kingdom,2026-04-20
536061,22692,DOORMAT WELCOME TO OUR HOME,2,7.95,13481.0,United Kingdom,2026-04-20
536061,21523,DOORMAT FANCY FONT HOME SWEET HOME,2,7.95,13481.0,United Kingdom,2026-04-20
536061,22663,JUMBO BAG DOLLY GIRL DESIGN,10,1.95,13481.0,United Kingdom,2026-04-20
536061,21931,JUMBO STORAGE BAG SUKI,10,1.95,13481.0,United Kingdom,2026-04-20
536061,20711,JUMBO BAG TOYS ,10,1.95,13481.0,United Kingdom,2026-04-20
536061,21430,SET/3 RED GINGHAM ROSE STORAGE BOX,4,3.75,13481.0,United Kingdom,2026-04-20
C536062,22941,CHRISTMAS LIGHTS 10 REINDEER,-17,7.65,13102.0,United Kingdom,2026-04-20
536063,22113,GREY HEART HOT WATER BOTTLE,4,3.75,15796.0,United Kingdom,2026-04-20
536063,21485,RETROSPOT HEART HOT WATER BOTTLE,3,4.95,15796.0,United Kingdom,2026-04-20
536063,22111,SCOTTIE DOG HOT WATER BOTTLE,3,4.95,15796.0,United Kingdom,2026-04-20
536063,22114,HOT WATER BOTTLE TEA AND SYMPATHY,4,3.95,15796.0,United Kingdom,2026-04-20
536063,22112,CHOCOLATE HOT WATER BOTTLE,3,4.95,15796.0,United Kingdom,2026-04-20
536063,85064,CREAM SWEETHEART LETTER RACK,6,5.45,15796.0,United Kingdom,2026-04-20
536064,22567,20 DOLLY PEGS RETROSPOT,12,1.25,14422.0,United Kingdom,2026-04-20
536064,79321,CHILLI LIGHTS,4,4.95,14422.0,United Kingdom,2026-04-20
536064,22809,SET OF 6 T-LIGHTS SANTA,6,2.95,14422.0,United Kingdom,2026-04-20
536064,22810,SET OF 6 T-LIGHTS SNOWMEN,6,2.95,14422.0,United Kingdom,2026-04-20
536064,21870,I CAN ONLY PLEASE ONE PERSON MUG,12,1.25,14422.0,United Kingdom,2026-04-20
536064,85150,LADIES & GENTLEMEN METAL SIGN,12,2.55,14422.0,United Kingdom,2026-04-20
536064,22091,EMPIRE TISSUE BOX,12,1.25,14422.0,United Kingdom,2026-04-20
536064,47591D,PINK FAIRY CAKE CHILDRENS APRON,8,1.95,14422.0,United Kingdom,2026-04-20
536064,22807,SET OF 6 T-LIGHTS TOADSTOOLS,6,2.95,14422.0,United Kingdom,2026-04-20
536064,85173,SET/6 FROG PRINCE T-LIGHT CANDLES,6,2.55,14422.0,United Kingdom,2026-04-20
536064,72598,SET/12 TAPER CANDLES,12,0.85,14422.0,United Kingdom,2026-04-20
536064,21874,GIN AND TONIC MUG,12,1.25,14422.0,United Kingdom,2026-04-20
536064,21166,COOK WITH WINE METAL SIGN ,12,1.95,14422.0,United Kingdom,2026-04-20
536064,85175,CACTI T-LIGHT CANDLES,16,0.42,14422.0,United Kingdom,2026-04-20
536064,22464,HANGING METAL HEART LANTERN,12,1.65,14422.0,United Kingdom,2026-04-20
536064,21754,HOME BUILDING BLOCK WORD,6,5.95,14422.0,United Kingdom,2026-04-20
536064,21755,LOVE BUILDING BLOCK WORD,6,5.95,14422.0,United Kingdom,2026-04-20
536064,22694,WICKER STAR ,12,2.1,14422.0,United Kingdom,2026-04-20
536064,22696,WICKER WREATH LARGE,6,1.95,14422.0,United Kingdom,2026-04-20
536064,22695,WICKER WREATH SMALL,12,1.45,14422.0,United Kingdom,2026-04-20
536064,22776,SWEETHEART CAKESTAND 3 TIER,2,9.95,14422.0,United Kingdom,2026-04-20
536064,22470,HEART OF WICKER LARGE,12,2.95,14422.0,United Kingdom,2026-04-20
536064,22457,NATURAL SLATE HEART CHALKBOARD ,6,2.95,14422.0,United Kingdom,2026-04-20
536064,84755,COLOUR GLASS T-LIGHT HOLDER HANGING,16,0.65,14422.0,United Kingdom,2026-04-20
536064,21181,PLEASE ONE PERSON METAL SIGN,12,2.1,14422.0,United Kingdom,2026-04-20
536064,84947,ANTIQUE SILVER TEA GLASS ENGRAVED,12,1.25,14422.0,United Kingdom,2026-04-20
536064,22469,HEART OF WICKER SMALL,24,1.65,14422.0,United Kingdom,2026-04-20
C536065,22943,CHRISTMAS LIGHTS 10 VINTAGE BAUBLES,-1,4.95,17420.0,United Kingdom,2026-04-20
536066,22767,TRIPLE PHOTO FRAME CORNICE ,2,9.95,12586.0,Italy,2026-04-20
536066,22840,ROUND CAKE TIN VINTAGE RED,2,7.95,12586.0,Italy,2026-04-20
536066,22624,IVORY KITCHEN SCALES,4,8.5,12586.0,Italy,2026-04-20
536066,22847,BREAD BIN DINER STYLE IVORY,8,14.95,12586.0,Italy,2026-04-20
536066,37370,RETRO COFFEE MUGS ASSORTED,12,1.25,12586.0,Italy,2026-04-20
536066,22796,PHOTO FRAME 3 CLASSIC HANGING,2,9.95,12586.0,Italy,2026-04-20
536066,22577,WOODEN HEART CHRISTMAS SCANDINAVIAN,12,0.85,12586.0,Italy,2026-04-20
536066,84840,SWEETHEART CARRY-ALL BASKET,2,8.5,12586.0,Italy,2026-04-20
536066,22151,PLACE SETTING WHITE HEART,24,0.42,12586.0,Italy,2026-04-20
536066,22606,WOODEN SKITTLES GARDEN SET,1,15.95,12586.0,Italy,2026-04-20
536066,84819,DANISH ROSE ROUND SEWING BOX,3,4.25,12586.0,Italy,2026-04-20
536066,22765,NEWSPAPER STAND,1,14.95,12586.0,Italy,2026-04-20
536066,21288,STRIPEY CHOCOLATE NESTING BOXES,6,2.95,12586.0,Italy,2026-04-20
536066,84913B,MINT GREEN ROSE TOWEL,4,4.65,12586.0,Italy,2026-04-20
536066,22595,CHRISTMAS GINGHAM HEART,12,0.85,12586.0,Italy,2026-04-20
536066,22379,RECYCLING BAG RETROSPOT ,5,2.1,12586.0,Italy,2026-04-20
536066,22654,DELUXE SEWING KIT ,3,5.95,12586.0,Italy,2026-04-20
536066,21428,SET3 BOOK BOX GREEN GINGHAM FLOWER ,8,4.25,12586.0,Italy,2026-04-20
536066,22844,VINTAGE CREAM DOG FOOD CONTAINER,4,8.5,12586.0,Italy,2026-04-20
536066,22845,VINTAGE CREAM CAT FOOD CONTAINER,2,6.35,12586.0,Italy,2026-04-20
536066,85123A,WHITE HANGING HEART T-LIGHT HOLDER,12,2.95,12586.0,Italy,2026-04-20
536066,21733,RED HANGING HEART T-LIGHT HOLDER,6,2.95,12586.0,Italy,2026-04-20
536066,22727,ALARM CLOCK BAKELIKE RED ,4,3.75,12586.0,Italy,2026-04-20
536066,22508,DOORSTOP RETROSPOT HEART,8,3.75,12586.0,Italy,2026-04-20
536066,22630,DOLLY GIRL LUNCH BOX,12,1.95,12586.0,Italy,2026-04-20
536066,22501,PICNIC BASKET WICKER LARGE,2,9.95,12586.0,Italy,2026-04-20
536066,22634,CHILDS BREAKFAST SET SPACEBOY ,2,9.95,12586.0,Italy,2026-04-20
536066,22423,REGENCY CAKESTAND 3 TIER,1,12.75,12586.0,Italy,2026-04-20
536066,84997B,RED 3 PIECE RETROSPOT CUTLERY SET,6,3.75,12586.0,Italy,2026-04-20
536066,21537,RED RETROSPOT PUDDING BOWL,4,4.25,12586.0,Italy,2026-04-20
536066,47567B,TEA TIME KITCHEN APRON,18,5.95,12586.0,Italy,2026-04-20
536066,21430,SET/3 RED GINGHAM ROSE STORAGE BOX,4,3.75,12586.0,Italy,2026-04-20
536066,22635,CHILDS BREAKFAST SET DOLLY GIRL ,2,9.95,12586.0,Italy,2026-04-20
536067,22114,HOT WATER BOTTLE TEA AND SYMPATHY,24,3.45,17044.0,United Kingdom,2026-04-20
536067,84029E,RED WOOLLY HOTTIE WHITE HEART.,24,3.39,17044.0,United Kingdom,2026-04-20
536067,22112,CHOCOLATE HOT WATER BOTTLE,24,4.25,17044.0,United Kingdom,2026-04-20
536067,22835,HOT WATER BOTTLE I AM SO POORLY,24,4.25,17044.0,United Kingdom,2026-04-20
536067,22632,HAND WARMER RED RETROSPOT,96,1.85,17044.0,United Kingdom,2026-04-20
536067,22865,HAND WARMER OWL DESIGN,96,1.85,17044.0,United Kingdom,2026-04-20
536067,84946,ANTIQUE SILVER TEA GLASS ETCHED,72,1.06,17044.0,United Kingdom,2026-04-20
536067,21743,STAR PORTABLE TABLE LIGHT ,48,2.55,17044.0,United Kingdom,2026-04-20
536067,22791,T-LIGHT GLASS FLUTED ANTIQUE,72,1.06,17044.0,United Kingdom,2026-04-20
536067,84949,SILVER HANGING T-LIGHT HOLDER,72,1.65,17044.0,United Kingdom,2026-04-20
536067,84352,SILVER CHRISTMAS TREE BAUBLE STAND ,4,14.95,17044.0,United Kingdom,2026-04-20
536067,22922,FRIDGE MAGNETS US DINER ASSORTED,120,0.72,17044.0,United Kingdom,2026-04-20
536067,22866,HAND WARMER SCOTTY DOG DESIGN,96,1.85,17044.0,United Kingdom,2026-04-20
536068,22491,PACK OF 12 COLOURED PENCILS,36,0.85,17090.0,United Kingdom,2026-04-20
C536069,85123A,WHITE HANGING HEART T-LIGHT HOLDER,-1,2.95,16782.0,United Kingdom,2026-04-20
536068,22560,TRADITIONAL MODELLING CLAY,36,1.25,17090.0,United Kingdom,2026-04-20
C536069,21468,BUTTERFLY CROCHET FOOD COVER,-1,3.75,16782.0,United Kingdom,2026-04-20
C536069,21658,GLASS  BEURRE DISH,-1,3.95,16782.0,United Kingdom,2026-04-20
C536070,21845,DAIRY MAID STRIPE MUG,-6,2.95,17688.0,United Kingdom,2026-04-20
C536071,21136,PAINTED METAL PEARS ASSORTED,-212,1.45,18084.0,United Kingdom,2026-04-20
