Invoice,StockCode,Description,Quantity,Price,Customer ID,Country,InvoiceDate
520720,37495,FAIRY CAKE BIRTHDAY CANDLE SET,1,3.75,13069.0,United Kingdom,2026-01-31
520720,47591D,PINK FAIRY CAKE CHILDRENS APRON,1,1.95,13069.0,United Kingdom,2026-01-31
520720,85150,LADIES & GENTLEMEN METAL SIGN,1,2.55,13069.0,United Kingdom,2026-01-31
520720,82482,WOODEN PICTURE FRAME WHITE FINISH,3,2.55,13069.0,United Kingdom,2026-01-31
520720,22470,HEART OF WICKER LARGE,1,2.95,13069.0,United Kingdom,2026-01-31
520720,22223,CAKE PLATE LOVEBIRD PINK,1,4.95,13069.0,United Kingdom,2026-01-31
520720,21231,SWEETHEART CERAMIC TRINKET BOX,1,1.25,13069.0,United Kingdom,2026-01-31
520720,84832,ZINC WILLIE WINKIE  CANDLE STICK,1,0.85,13069.0,United Kingdom,2026-01-31
520720,85080,PADDED RED HEART DECORATION,6,0.42,13069.0,United Kingdom,2026-01-31
520720,35970,ZINC FOLKART SLEIGH BELLS,2,1.69,13069.0,United Kingdom,2026-01-31
520720,20702,PINK PADDED MOBILE,1,4.25,13069.0,United Kingdom,2026-01-31
520721,21108,FAIRY CAKE FLANNEL ASSORTED COLOUR,45,2.1,13922.0,United Kingdom,2026-01-31
520720,22469,HEART OF WICKER SMALL,1,1.65,13069.0,United Kingdom,2026-01-31
520722,22296,HEART IVORY TRELLIS LARGE,24,1.65,18149.0,United Kingdom,2026-01-31
520722,85123A,WHITE HANGING HEART T-LIGHT HOLDER,10,2.95,18149.0,United Kingdom,2026-01-31
520722,22295,HEART FILIGREE DOVE LARGE,24,1.65,18149.0,United Kingdom,2026-01-31
520722,35961,FOLKART ZINC HEART CHRISTMAS DEC,48,0.85,18149.0,United Kingdom,2026-01-31
520722,84879,ASSORTED COLOUR BIRD ORNAMENT,16,1.69,18149.0,United Kingdom,2026-01-31
520722,84949,SILVER HANGING T-LIGHT HOLDER,12,1.65,18149.0,United Kingdom,2026-01-31
520723,35004C,SET OF 3 COLOURED  FLYING DUCKS,3,5.45,12889.0,United Kingdom,2026-01-31
520723,22138,BAKING SET 9 PIECE RETROSPOT ,3,4.95,12889.0,United Kingdom,2026-01-31
520723,22626,BLACK KITCHEN SCALES,2,8.5,12889.0,United Kingdom,2026-01-31
520723,21491,SET OF THREE VINTAGE GIFT WRAPS,12,1.95,12889.0,United Kingdom,2026-01-31
520724,21080,SET/20 RED SPOTTY PAPER NAPKINS ,6,0.85,17841.0,United Kingdom,2026-01-31
520724,22475,SKULL DESIGN TV DINNER TRAY,1,4.95,17841.0,United Kingdom,2026-01-31
520724,21935,SUKI  SHOULDER BAG,1,1.65,17841.0,United Kingdom,2026-01-31
520724,21931,JUMBO STORAGE BAG SUKI,1,1.95,17841.0,United Kingdom,2026-01-31
520724,20718,RED SPOTTY SHOPPER BAG,2,1.25,17841.0,United Kingdom,2026-01-31
520724,22356,CHARLOTTE BAG PINK WITH WHITE SPOTS,1,0.85,17841.0,United Kingdom,2026-01-31
520724,22379,RECYCLING BAG RETROSPOT ,1,2.1,17841.0,United Kingdom,2026-01-31
520724,22378,WALL TIDY RETROSPOT ,1,2.1,17841.0,United Kingdom,2026-01-31
520724,20726,LUNCH BAG WOODLAND,1,1.65,17841.0,United Kingdom,2026-01-31
520724,20728,LUNCH BAG CARS BLUE,1,1.65,17841.0,United Kingdom,2026-01-31
520724,22383,LUNCH BAG SUKI  DESIGN ,1,1.65,17841.0,United Kingdom,2026-01-31
520724,84926A,WAKE UP COCKEREL TILE COASTER,1,1.25,17841.0,United Kingdom,2026-01-31
520724,21874,GIN AND TONIC MUG,1,1.25,17841.0,United Kingdom,2026-01-31
520724,84899F,YELLOW PURPLE DAISY FELT PURSE KIT,2,1.25,17841.0,United Kingdom,2026-01-31
520724,84692,BOX OF 24 COCKTAIL PARASOLS,6,0.42,17841.0,United Kingdom,2026-01-31
520724,85123A,WHITE HANGING HEART T-LIGHT HOLDER,1,2.95,17841.0,United Kingdom,2026-01-31
520724,22367,CHILDRENS APRON SPACEBOY DESIGN,6,1.95,17841.0,United Kingdom,2026-01-31
520724,21478,SILVER SKULL HOT WATER BOTTLE ,1,3.75,17841.0,United Kingdom,2026-01-31
520724,20663,QUEEN OF THE SKIES HOLIDAY PURSE ,1,2.95,17841.0,United Kingdom,2026-01-31
520724,20664,TROPICAL HOLIDAY PURSE ,1,2.95,17841.0,United Kingdom,2026-01-31
520724,20828,GLITTER BUTTERFLY CLIPS,1,2.55,17841.0,United Kingdom,2026-01-31
520724,20829,GLITTER HANGING BUTTERFLY STRING,1,2.1,17841.0,United Kingdom,2026-01-31
520724,21523,DOORMAT FANCY FONT HOME SWEET HOME,1,7.49,17841.0,United Kingdom,2026-01-31
520724,22366,DOORMAT AIRMAIL ,1,7.49,17841.0,United Kingdom,2026-01-31
520724,84378,SET OF 3 HEART COOKIE CUTTERS,1,1.25,17841.0,United Kingdom,2026-01-31
520724,84997A,GREEN 3 PIECE MINI DOTS CUTLERY SET,1,3.75,17841.0,United Kingdom,2026-01-31
520724,22083,PAPER CHAIN KIT RETRO SPOT,1,2.95,17841.0,United Kingdom,2026-01-31
520724,22502,PICNIC BASKET WICKER SMALL,2,4.25,17841.0,United Kingdom,2026-01-31
520724,21668,RED STRIPE CERAMIC DRAWER KNOB,1,1.25,17841.0,United Kingdom,2026-01-31
520724,22088,PAPER BUNTING COLOURED LACE,2,2.95,17841.0,United Kingdom,2026-01-31
520724,21172,PARTY METAL SIGN ,1,1.45,17841.0,United Kingdom,2026-01-31
520724,21532,DAIRY MAID SUGAR JAM BOWL,1,2.1,17841.0,United Kingdom,2026-01-31
520724,85185B,PINK HORSE SOCK PUPPET,1,2.95,17841.0,United Kingdom,2026-01-31
520724,21977,PACK OF 60 PINK PAISLEY CAKE CASES,1,0.55,17841.0,United Kingdom,2026-01-31
520724,21213,PACK OF 72 SKULL CAKE CASES,1,0.55,17841.0,United Kingdom,2026-01-31
520724,22417,PACK OF 60 SPACEBOY CAKE CASES,1,0.55,17841.0,United Kingdom,2026-01-31
520724,82494L,WOODEN FRAME ANTIQUE WHITE ,1,2.95,17841.0,United Kingdom,2026-01-31
520724,82482,WOODEN PICTURE FRAME WHITE FINISH,1,2.55,17841.0,United Kingdom,2026-01-31
520724,22173,METAL 4 HOOK HANGER FRENCH CHATEAU,2,2.95,17841.0,United Kingdom,2026-01-31
520724,22200,FRYING PAN PINK POLKADOT ,1,4.25,17841.0,United Kingdom,2026-01-31
520724,22197,SMALL POPCORN HOLDER,4,0.85,17841.0,United Kingdom,2026-01-31
520724,22212,FOUR HOOK  WHITE LOVEBIRDS,1,2.1,17841.0,United Kingdom,2026-01-31
520724,20970,PINK FLORAL FELTCRAFT SHOULDER BAG,1,3.75,17841.0,United Kingdom,2026-01-31
520724,22087,PAPER BUNTING WHITE LACE,6,2.95,17841.0,United Kingdom,2026-01-31
520724,85232B,SET OF 3 BABUSHKA STACKING TINS,2,4.95,17841.0,United Kingdom,2026-01-31
520724,22119,PEACE WOODEN BLOCK LETTERS,1,6.95,17841.0,United Kingdom,2026-01-31
520724,20967,GREY FLORAL FELTCRAFT SHOULDER BAG,1,3.75,17841.0,United Kingdom,2026-01-31
520724,22588,CARD HOLDER GINGHAM HEART,1,2.55,17841.0,United Kingdom,2026-01-31
520724,79160,HEART SHAPE WIRELESS DOORBELL,1,2.1,17841.0,United Kingdom,2026-01-31
520724,22589,CARDHOLDER GINGHAM STAR,1,2.55,17841.0,United Kingdom,2026-01-31
520724,21992,VINTAGE PAISLEY STATIONERY SET,1,2.95,17841.0,United Kingdom,2026-01-31
520724,21181,PLEASE ONE PERSON METAL SIGN,4,2.1,17841.0,United Kingdom,2026-01-31
520724,22318,FIVE HEART HANGING DECORATION,1,2.95,17841.0,United Kingdom,2026-01-31
520724,20969,RED FLORAL FELTCRAFT SHOULDER BAG,1,3.75,17841.0,United Kingdom,2026-01-31
520724,84898F,YELLOW FLOWERS FELT HANDBAG KIT,1,2.1,17841.0,United Kingdom,2026-01-31
C520725,22371,AIRLINE BAG VINTAGE TOKYO 78,-1,6.35,16755.0,United Kingdom,2026-01-31
520726,21871,SAVE THE PLANET MUG,12,1.25,17442.0,United Kingdom,2026-01-31
520726,21918,SET 12 KIDS COLOUR  CHALK STICKS,24,0.42,17442.0,United Kingdom,2026-01-31
520726,22411,JUMBO SHOPPER VINTAGE RED PAISLEY,10,1.95,17442.0,United Kingdom,2026-01-31
520726,22559,SEASIDE FLYING DISC,12,1.25,17442.0,United Kingdom,2026-01-31
520726,85227,SET OF 6 3D KIT CARDS FOR KIDS,12,0.85,17442.0,United Kingdom,2026-01-31
520726,22711,WRAP CIRCUS PARADE,25,0.42,17442.0,United Kingdom,2026-01-31
520726,21658,GLASS  BEURRE DISH,8,3.95,17442.0,United Kingdom,2026-01-31
520726,20761,BLUE PAISLEY SKETCHBOOK,4,3.75,17442.0,United Kingdom,2026-01-31
520726,22674,FRENCH TOILET SIGN BLUE METAL,12,1.25,17442.0,United Kingdom,2026-01-31
520726,22672,FRENCH BATHROOM SIGN BLUE METAL,12,1.65,17442.0,United Kingdom,2026-01-31
520726,22636,CHILDS BREAKFAST SET CIRCUS PARADE,2,8.5,17442.0,United Kingdom,2026-01-31
520726,85055,FRENCH ENAMEL UTENSIL HOLDER,8,3.75,17442.0,United Kingdom,2026-01-31
520726,22047,EMPIRE GIFT WRAP,25,0.42,17442.0,United Kingdom,2026-01-31
520727,17090D,VANILLA INCENSE 40 CONES IN TIN,1,1.25,16755.0,United Kingdom,2026-01-31
520727,17091J,VANILLA INCENSE IN TIN,6,1.25,16755.0,United Kingdom,2026-01-31
520727,84597B,RETRO BROWN BALL ASHTRAY ,6,1.25,16755.0,United Kingdom,2026-01-31
520727,84597C,RETRO PINK BALL ASHTRAY ,4,1.25,16755.0,United Kingdom,2026-01-31
520727,22431,WATERING CAN BLUE ELEPHANT,2,1.95,16755.0,United Kingdom,2026-01-31
520727,17038,PORCELAIN BUDAH INCENSE HOLDER,10,0.1,16755.0,United Kingdom,2026-01-31
520727,22131,FOOD CONTAINER SET 3 LOVE HEART ,10,1.95,16755.0,United Kingdom,2026-01-31
520727,84212,"ASSORTED FLOWER COLOUR ""LEIS""",36,0.65,16755.0,United Kingdom,2026-01-31
520727,21432,SET OF 3 CASES WOODLAND DESIGN,2,5.95,16755.0,United Kingdom,2026-01-31
520727,21985,PACK OF 12 HEARTS DESIGN TISSUES ,12,0.29,16755.0,United Kingdom,2026-01-31
520727,21981,PACK OF 12 WOODLAND TISSUES ,12,0.29,16755.0,United Kingdom,2026-01-31
520727,22327,ROUND SNACK BOXES SET OF 4 SKULLS,6,2.95,16755.0,United Kingdom,2026-01-31
520727,22189,CREAM HEART CARD HOLDER,2,3.95,16755.0,United Kingdom,2026-01-31
520727,22329,ROUND CONTAINER SET OF 5 RETROSPOT,4,1.65,16755.0,United Kingdom,2026-01-31
520727,16020C,CLEAR STATIONERY BOX SET ,4,0.85,16755.0,United Kingdom,2026-01-31
520727,81950B,FLOWER BLUE CLOCK W/SUCKER,6,0.85,16755.0,United Kingdom,2026-01-31
520727,22328,ROUND SNACK BOXES SET OF 4 FRUITS ,2,2.95,16755.0,United Kingdom,2026-01-31
520727,21967,PACK OF 12 SKULL TISSUES,12,0.29,16755.0,United Kingdom,2026-01-31
520727,22151,PLACE SETTING WHITE HEART,24,0.42,16755.0,United Kingdom,2026-01-31
520727,17096,ASSORTED LAQUERED INCENSE HOLDERS,6,0.21,16755.0,United Kingdom,2026-01-31
520727,22646,CERAMIC STRAWBERRY CAKE MONEY BANK,4,1.45,16755.0,United Kingdom,2026-01-31
520727,72129,COLUMBIAN CANDLE ROUND ,6,0.65,16755.0,United Kingdom,2026-01-31
520727,21563,RED HEART SHAPE LOVE BUCKET ,1,2.95,16755.0,United Kingdom,2026-01-31
520727,22197,SMALL POPCORN HOLDER,10,0.85,16755.0,United Kingdom,2026-01-31
520727,84741C,CITRUS GARLAND FELT FLOWERS ,4,1.95,16755.0,United Kingdom,2026-01-31
520727,22136,LOVE HEART SOCK HANGER,4,1.65,16755.0,United Kingdom,2026-01-31
520727,22132,RED LOVE HEART SHAPE CUP,24,0.85,16755.0,United Kingdom,2026-01-31
520727,22374,AIRLINE BAG VINTAGE JET SET RED,1,6.35,16755.0,United Kingdom,2026-01-31
520727,22663,JUMBO BAG DOLLY GIRL DESIGN,2,1.95,16755.0,United Kingdom,2026-01-31
520727,22386,JUMBO BAG PINK WITH WHITE SPOTS,6,1.95,16755.0,United Kingdom,2026-01-31
520727,20718,RED SPOTTY SHOPPER BAG,4,1.25,16755.0,United Kingdom,2026-01-31
520727,22719,GUMBALL MONOCHROME COAT RACK,4,1.25,16755.0,United Kingdom,2026-01-31
520727,47420,ASSORTED COLOUR SUCTION CUP HOOK,24,0.19,16755.0,United Kingdom,2026-01-31
520727,85123A,WHITE HANGING HEART T-LIGHT HOLDER,8,2.95,16755.0,United Kingdom,2026-01-31
520727,72741,GRAND CHOCOLATECANDLE,9,1.45,16755.0,United Kingdom,2026-01-31
520727,21380,WOODEN HAPPY BIRTHDAY GARLAND,12,2.95,16755.0,United Kingdom,2026-01-31
520727,20750,RED/WHITE DOT MINI CASES,2,7.95,16755.0,United Kingdom,2026-01-31
520727,22637,PIGGY BANK RETROSPOT ,4,2.55,16755.0,United Kingdom,2026-01-31
520727,22753,SMALL YELLOW BABUSHKA NOTEBOOK ,12,0.85,16755.0,United Kingdom,2026-01-31
520727,21930,JUMBO STORAGE BAG SKULLS,6,1.95,16755.0,United Kingdom,2026-01-31
520728,48138,DOORMAT UNION FLAG,2,7.49,18226.0,United Kingdom,2026-01-31
520728,21928,JUMBO BAG SCANDINAVIAN PAISLEY,10,1.95,18226.0,United Kingdom,2026-01-31
520728,22386,JUMBO BAG PINK WITH WHITE SPOTS,10,1.95,18226.0,United Kingdom,2026-01-31
520728,84755,COLOUR GLASS T-LIGHT HOLDER HANGING,48,0.65,18226.0,United Kingdom,2026-01-31
520728,20971,PINK BLUE FELT CRAFT TRINKET BOX,12,1.25,18226.0,United Kingdom,2026-01-31
520728,84507B,STRIPES DESIGN MONKEY DOLL,384,0.85,18226.0,United Kingdom,2026-01-31
520728,22227,"DECORATION, HANGING HEART+MIRROR ",48,0.65,18226.0,United Kingdom,2026-01-31
520728,22690,DOORMAT HOME SWEET HOME BLUE ,2,7.49,18226.0,United Kingdom,2026-01-31
520728,21868,POTTING SHED TEA MUG,12,1.25,18226.0,United Kingdom,2026-01-31
520728,22528,GARDENERS KNEELING PAD,48,1.06,18226.0,United Kingdom,2026-01-31
520728,22411,JUMBO SHOPPER VINTAGE RED PAISLEY,20,1.95,18226.0,United Kingdom,2026-01-31
520729,21875,KINGS CHOICE MUG,2,1.25,15555.0,United Kingdom,2026-01-31
520729,22662,LUNCH BAG DOLLY GIRL DESIGN,5,1.65,15555.0,United Kingdom,2026-01-31
520729,20726,LUNCH BAG WOODLAND,4,1.65,15555.0,United Kingdom,2026-01-31
520729,20725,LUNCH BAG RED SPOTTY,4,1.65,15555.0,United Kingdom,2026-01-31
520729,20727,LUNCH BAG  BLACK SKULL.,5,1.65,15555.0,United Kingdom,2026-01-31
520729,22384,LUNCH BAG PINK RETROSPOT,4,1.65,15555.0,United Kingdom,2026-01-31
520729,22382,LUNCH BAG SPACEBOY DESIGN ,5,1.65,15555.0,United Kingdom,2026-01-31
520729,22383,LUNCH BAG SUKI  DESIGN ,8,1.65,15555.0,United Kingdom,2026-01-31
520729,21868,POTTING SHED TEA MUG,2,1.25,15555.0,United Kingdom,2026-01-31
520729,37461,FUNKY MONKEY MUG,1,1.25,15555.0,United Kingdom,2026-01-31
520729,35001W,HAND OPEN SHAPE DECO.WHITE,2,3.49,15555.0,United Kingdom,2026-01-31
520729,21918,SET 12 KIDS COLOUR  CHALK STICKS,2,0.42,15555.0,United Kingdom,2026-01-31
520729,47597,NEW ENGLAND TEATOWELS,2,2.55,15555.0,United Kingdom,2026-01-31
520729,21580,RABBIT  DESIGN  COTTON TOTE BAG,1,2.25,15555.0,United Kingdom,2026-01-31
520729,22489,PACK OF 12 TRADITIONAL CRAYONS,2,0.42,15555.0,United Kingdom,2026-01-31
520729,22385,JUMBO BAG SPACEBOY DESIGN,2,1.95,15555.0,United Kingdom,2026-01-31
520729,85099F,JUMBO BAG STRAWBERRY,2,1.95,15555.0,United Kingdom,2026-01-31
520729,22386,JUMBO BAG PINK WITH WHITE SPOTS,2,1.95,15555.0,United Kingdom,2026-01-31
520729,85099C,JUMBO  BAG BAROQUE BLACK WHITE,1,1.95,15555.0,United Kingdom,2026-01-31
520729,21931,JUMBO STORAGE BAG SUKI,2,1.95,15555.0,United Kingdom,2026-01-31
520729,22551,PLASTERS IN TIN SPACEBOY,4,1.65,15555.0,United Kingdom,2026-01-31
520730,22423,REGENCY CAKESTAND 3 TIER,16,10.95,13093.0,United Kingdom,2026-01-31
520730,85123A,WHITE HANGING HEART T-LIGHT HOLDER,32,2.55,13093.0,United Kingdom,2026-01-31
520730,22699,ROSES REGENCY TEACUP AND SAUCER ,24,2.55,13093.0,United Kingdom,2026-01-31
520730,22698,PINK REGENCY TEACUP AND SAUCER,24,2.55,13093.0,United Kingdom,2026-01-31
520730,22697,GREEN REGENCY TEACUP AND SAUCER,24,2.55,13093.0,United Kingdom,2026-01-31
520730,72819,CUPID DESIGN SCENTED CANDLES,48,0.85,13093.0,United Kingdom,2026-01-31
520730,21066,VINTAGE RED MUG,36,0.38,13093.0,United Kingdom,2026-01-31
520730,35810A,ENAMEL PINK COFFEE CONTAINER,36,0.85,13093.0,United Kingdom,2026-01-31
520730,35809A,ENAMEL PINK TEA CONTAINER,48,0.85,13093.0,United Kingdom,2026-01-31
520730,72801C,4 ROSE PINK DINNER CANDLES,48,0.42,13093.0,United Kingdom,2026-01-31
520730,21067,VINTAGE RED TEATIME MUG,60,0.38,13093.0,United Kingdom,2026-01-31
520731,84689,S/2 BEACH HUT TREASURE CHESTS,2,5.95,15555.0,United Kingdom,2026-01-31
520731,82484,WOOD BLACK BOARD ANT WHITE FINISH,1,6.45,15555.0,United Kingdom,2026-01-31
520731,21918,SET 12 KIDS COLOUR  CHALK STICKS,2,0.42,15555.0,United Kingdom,2026-01-31
520731,84688,BEACH HUT DESIGN BLACKBOARD,2,4.25,15555.0,United Kingdom,2026-01-31
520732,46000M,POLYESTER FILLER PAD 45x45cm,3,1.55,17384.0,United Kingdom,2026-01-31
520732,22385,JUMBO BAG SPACEBOY DESIGN,1,1.95,17384.0,United Kingdom,2026-01-31
520732,21931,JUMBO STORAGE BAG SUKI,1,1.95,17384.0,United Kingdom,2026-01-31
520732,22611,VINTAGE UNION JACK SHOPPING BAG,4,4.95,17384.0,United Kingdom,2026-01-31
520732,15056N,EDWARDIAN PARASOL NATURAL,24,5.95,17384.0,United Kingdom,2026-01-31
